B1: Relatório de Aviso de Crédito
A2: 1138 | B2: Empresa: ELETROSUL (TSBE) | D2: Número AVC: | E2: 33940
D4: Receita Anual Permitida | E4: 89438455.099999994
D5: Recebimento Mensal (receita Anual/12) | E5: 7453204.5899999999
D6: Receita Permitida | E6: 7453204.5899999999
D7: PIS/PASEP e COFINS * | E7: 762666.64000000199
D8: Antecipação | E8: -305700.69
D9: Parcela de Ajuste do Ciclo Anterior | E9: -206769.92999999999
D10: Receita de novas obras RBNI | E10: 59197.790000000001
D11: Rede de Fronteira | E11: 235096.20000000001
D12: Total s/ PIS/PASEP e COFINS | E12: 7235027.96
D13: Total c/ PIS/PASEP e COFINS | E13: 7997694.6000000024
D15: * Alíquota PIS/PASEP e COFINS = 9,25% (com RGR = 2,60%)
B17: Usuárias | C17: CNPJ | D17: Rede Básica | E17: Total de Fronteira | F17: Quota Proinfa | G17: Quota CCC Sist. Interligado | H17: Quota CCC Sist. Isolado | I17: Quota CDE | J17: 1a. Parcela dia 15/11/2023 | K17: 2a. Parcela dia 25/11/2023 | L17: 3a. Parcela dia 05/12/2023 | M17: Total s/ PIS/PASEP e COFINS | N17: PIS/PASEP e COFINS | O17: Total c/ PIS/PASEP e COFINS
A18: 2001 | B18: RGE SUL (AES-SUL) | C18: 02.016.440/0001-62 | D18: 189948.67999999999 | E18: 0 | F18: 0 | G18: 0 | H18: 0 | I18: 0 | J18: 0 | K18: 209971.76000000001 | L18: 0 | M18: =SUM(J18:L18)-20023.08 -> 189948.67999999999 | N18: 20023.080000000002 | O18: =SUM(M18:N18) -> 209971.76000000001
A19: 2002 | B19: EDP SAO PAULO (BANDEIRANTE) | C19: 02.302.100/0001-06 | D19: 128732.56 | E19: 0 | F19: 0 | G19: 0 | H19: 0 | I19: 0 | J19: 47434.220000000001 | K19: 47434.220000000001 | L19: 47434.220000000001 | M19: =SUM(J19:L19)-13570.1 -> 128732.56 | N19: 13570.1 | O19: =SUM(M19:N19) -> 142302.66
A20: 2004 | B20: ENERGISA SUL-SUDESTE | C20: 07.282.377/0001-20 | D20: 32819.860000000001 | E20: 0 | F20: 0 | G20: 0 | H20: 0 | I20: 0 | J20: 0 | K20: 36279.5 | L20: 0 | M20: =SUM(J20:L20)-3459.64 -> 32819.860000000001 | N20: 3459.6399999999999 | O20: =SUM(M20:N20) -> 36279.5
A21: 2006 | B21: CBA | C21: 61.409.892/0003-35 | D21: 2185.25 | E21: 0 | F21: 0 | G21: 0 | H21: 0 | I21: 0 | J21: 0 | K21: 2415.5999999999999 | L21: 0 | M21: =SUM(J21:L21)-230.35 -> 2185.25 | N21: 230.34999999999999 | O21: =SUM(M21:N21) -> 2415.5999999999999
A22: 2007 | B22: EQUATORIAL ALAGOAS (CEAL) | C22: 12.272.084/0001-00 | D22: 45047.489999999998 | E22: 0 | F22: 0 | G22: 0 | H22: 0 | I22: 0 | J22: 0 | K22: 49796.089999999997 | L22: 0 | M22: =SUM(J22:L22)-4748.6 -> 45047.489999999998 | N22: 4748.6000000000004 | O22: =SUM(M22:N22) -> 49796.089999999997
A23: 2008 | B23: CEB | C23: 07.522.669/0001-92 | D23: 56951.849999999999 | E23: 0 | F23: 0 | G23: 0 | H23: 0 | I23: 0 | J23: 0 | K23: 62955.32 | L23: 0 | M23: =SUM(J23:L23)-6003.47 -> 56951.849999999999 | N23: 6003.4700000000003 | O23: =SUM(M23:N23) -> 62955.32
A24: 2009 | B24: CEEE-D | C24: 08.467.115/0001-00 | D24: 123083.53 | E24: 235096.20000000001 | F24: 0 | G24: 0 | H24: 0 | I24: 0 | J24: 0 | K24: 395936.57000000001 | L24: 0 | M24: =SUM(J24:L24)-37756.84 -> 358179.72999999998 | N24: 37756.839999999997 | O24: =SUM(M24:N24) -> 395936.56999999995
A25: 2011 | B25: CELESC | C25: 08.336.783/0001-90 | D25: 267199.81 | E25: 0 | F25: 0 | G25: 0 | H25: 0 | I25: 0 | J25: 0 | K25: 295366.16999999998 | L25: 0 | M25: =SUM(J25:L25)-28166.36 -> 267199.81 | N25: 28166.360000000001 | O25: =SUM(M25:N25) -> 295366.16999999998
A26: 2012 | B26: CELG-D | C26: 01.543.032/0001-04 | D26: 111888.89999999999 | E26: 0 | F26: 0 | G26: 0 | H26: 0 | I26: 0 | J26: 41227.82 | K26: 41227.82 | L26: 41227.82 | M26: =SUM(J26:L26)-11794.56 -> 111888.89999999999 | N26: 11794.559999999999 | O26: =SUM(M26:N26) -> 123683.45999999999
A27: 2013 | B27: EQUATORIAL PARA (CELPA) | C27: 04.895.728/0001-80 | D27: 107940.39 | E27: 0 | F27: 0 | G27: 0 | H27: 0 | I27: 0 | J27: 39772.910000000003 | K27: 39772.910000000003 | L27: 39772.900000000001 | M27: =SUM(J27:L27)-11378.33 -> 107940.39 | N27: 11378.33 | O27: =SUM(M27:N27) -> 119318.72
A28: 2014 | B28: CELPE | C28: 10.835.932/0001-08 | D28: 107512.56 | E28: 0 | F28: 0 | G28: 0 | H28: 0 | I28: 0 | J28: 0 | K28: 118845.78999999999 | L28: 0 | M28: =SUM(J28:L28)-11333.23 -> 107512.56 | N28: 11333.23 | O28: =SUM(M28:N28) -> 118845.78999999999
A29: 2016 | B29: ENERGISA TO (CELTINS) | C29: 25.086.034/0001-71 | D29: 18623.759999999998 | E29: 0 | F29: 0 | G29: 0 | H29: 0 | I29: 0 | J29: 0 | K29: 20586.950000000001 | L29: 0 | M29: =SUM(J29:L29)-1963.19 -> 18623.760000000002 | N29: 1963.1900000000001 | O29: =SUM(M29:N29) -> 20586.950000000001
A30: 2017 | B30: EQUATORIAL MARANHÃO (CEMAR) | C30: 06.272.793/0001-84 | D30: 59372.470000000001 | E30: 0 | F30: 0 | G30: 0 | H30: 0 | I30: 0 | J30: 21877.040000000001 | K30: 21877.040000000001 | L30: 21877.029999999999 | M30: =SUM(J30:L30)-6258.64 -> 59372.470000000001 | N30: 6258.6400000000003 | O30: =SUM(M30:N30) -> 65631.110000000001
A31: 2018 | B31: ENERGISA MT (CEMAT) | C31: 03.467.321/0001-99 | D31: 70266.460000000006 | E31: 0 | F31: 0 | G31: 0 | H31: 0 | I31: 0 | J31: 0 | K31: 77673.470000000001 | L31: 0 | M31: =SUM(J31:L31)-7407.01 -> 70266.460000000006 | N31: 7407.0100000000002 | O31: =SUM(M31:N31) -> 77673.470000000001
A32: 2019 | B32: CEMIG-D | C32: 06.981.180/0001-16 | D32: 374945.73999999999 | E32: 0 | F32: 0 | G32: 0 | H32: 0 | I32: 0 | J32: 0 | K32: 414469.92999999999 | L32: 0 | M32: =SUM(J32:L32)-39524.19 -> 374945.73999999999 | N32: 39524.190000000002 | O32: =SUM(M32:N32) -> 414469.92999999999
A33: 2020 | B33: EQUATORIAL PIAUI (CEPISA) | C33: 06.840.748/0001-89 | D33: 38385.580000000002 | E33: 0 | F33: 0 | G33: 0 | H33: 0 | I33: 0 | J33: 0 | K33: 42431.919999999998 | L33: 0 | M33: =SUM(J33:L33)-4046.34 -> 38385.580000000002 | N33: 4046.3400000000001 | O33: =SUM(M33:N33) -> 42431.919999999998
A34: 2021 | B34: AMPLA | C34: 33.050.071/0001-58 | D34: 114739.78999999999 | E34: 0 | F34: 0 | G34: 0 | H34: 0 | I34: 0 | J34: 42278.290000000001 | K34: 42278.290000000001 | L34: 42278.290000000001 | M34: =SUM(J34:L34)-12095.08 -> 114739.78999999999 | N34: 12095.08 | O34: =SUM(M34:N34) -> 126834.87
A35: 2024 | B35: JAGUARI | C35: 53.859.112/0001-69 | D35: 28100.09 | E35: 0 | F35: 0 | G35: 0 | H35: 0 | I35: 0 | J35: 0 | K35: 31062.209999999999 | L35: 0 | M35: =SUM(J35:L35)-2962.12 -> 28100.09 | N35: 2962.1199999999999 | O35: =SUM(M35:N35) -> 31062.209999999999
A36: 2025 | B36: COELBA-D | C36: 15.139.629/0001-94 | D36: 196027.54000000001 | E36: 0 | F36: 0 | G36: 0 | H36: 0 | I36: 0 | J36: 0 | K36: 216691.41 | L36: 0 | M36: =SUM(J36:L36)-20663.87 -> 196027.54000000001 | N36: 20663.869999999999 | O36: =SUM(M36:N36) -> 216691.41
A37: 2026 | B37: COELCE | C37: 07.047.251/0001-70 | D37: 78786.039999999994 | E37: 0 | F37: 0 | G37: 0 | H37: 0 | I37: 0 | J37: 29030.369999999999 | K37: 29030.369999999999 | L37: 29030.380000000001 | M37: =SUM(J37:L37)-8305.08 -> 78786.039999999994 | N37: 8305.0799999999999 | O37: =SUM(M37:N37) -> 87091.119999999995
A38: 2027 | B38: COPEL-D | C38: 04.368.898/0001-06 | D38: 350582.41999999998 | E38: 0 | F38: 0 | G38: 0 | H38: 0 | I38: 0 | J38: 0 | K38: 387538.40000000002 | L38: 0 | M38: =SUM(J38:L38)-36955.98 -> 350582.42000000004 | N38: 36955.980000000003 | O38: =SUM(M38:N38) -> 387538.40000000002
A39: 2028 | B39: COSERN | C39: 08.324.196/0001-81 | D39: 38016.110000000001 | E39: 0 | F39: 0 | G39: 0 | H39: 0 | I39: 0 | J39: 0 | K39: 42023.510000000002 | L39: 0 | M39: =SUM(J39:L39)-4007.4 -> 38016.110000000001 | N39: 4007.4000000000001 | O39: =SUM(M39:N39) -> 42023.510000000002
A40: 2030 | B40: CPFL-D | C40: 33.050.196/0001-88 | D40: 246163.31 | E40: 0 | F40: 0 | G40: 0 | H40: 0 | I40: 0 | J40: 0 | K40: 272112.15000000002 | L40: 0 | M40: =SUM(J40:L40)-25948.84 -> 246163.31000000003 | N40: 25948.84 | O40: =SUM(M40:N40) -> 272112.15000000002
A41: 2032 | B41: DME | C41: 23.664.303/0001-04 | D41: 3208.4400000000001 | E41: 0 | F41: 0 | G41: 0 | H41: 0 | I41: 0 | J41: 0 | K41: 3546.6500000000001 | L41: 0 | M41: =SUM(J41:L41)-338.21 -> 3208.4400000000001 | N41: 338.20999999999998 | O41: =SUM(M41:N41) -> 3546.6500000000001
A42: 2033 | B42: ELEKTRO | C42: 02.328.280/0001-97 | D42: 150659.59 | E42: 0 | F42: 0 | G42: 0 | H42: 0 | I42: 0 | J42: 0 | K42: 166541.09 | L42: 0 | M42: =SUM(J42:L42)-15881.5 -> 150659.59 | N42: 15881.5 | O42: =SUM(M42:N42) -> 166541.09
A43: 2035 | B43: ELETROPAULO | C43: 61.695.227/0001-93 | D43: 328125.82000000001 | E43: 0 | F43: 0 | G43: 0 | H43: 0 | I43: 0 | J43: 0 | K43: 362714.58000000002 | L43: 0 | M43: =SUM(J43:L43)-34588.76 -> 328125.82000000001 | N43: 34588.760000000002 | O43: =SUM(M43:N43) -> 362714.58000000002
A44: 2036 | B44: ENERGISA SE (ENERGIPE) | C44: 13.017.462/0001-63 | D44: 18219.720000000001 | E44: 0 | F44: 0 | G44: 0 | H44: 0 | I44: 0 | J44: 0 | K44: 20140.32 | L44: 0 | M44: =SUM(J44:L44)-1920.6 -> 18219.720000000001 | N44: 1920.5999999999999 | O44: =SUM(M44:N44) -> 20140.32
A45: 2037 | B45: ENERGISA MS (ENERSUL) | C45: 15.413.826/0001-50 | D45: 47817.339999999997 | E45: 0 | F45: 0 | G45: 0 | H45: 0 | I45: 0 | J45: 0 | K45: 52857.910000000003 | L45: 0 | M45: =SUM(J45:L45)-5040.57 -> 47817.340000000004 | N45: 5040.5699999999997 | O45: =SUM(M45:N45) -> 52857.910000000003
A46: 2038 | B46: EDP ES | C46: 28.152.650/0001-71 | D46: 70644.470000000001 | E46: 0 | F46: 0 | G46: 0 | H46: 0 | I46: 0 | J46: 26030.439999999999 | K46: 26030.439999999999 | L46: 26030.439999999999 | M46: =SUM(J46:L46)-7446.85 -> 70644.469999999987 | N46: 7446.8500000000004 | O46: =SUM(M46:N46) -> 78091.319999999992
A47: 2040 | B47: LIGHT-D | C47: 60.444.437/0001-46 | D47: 216456.60000000001 | E47: 0 | F47: 0 | G47: 0 | H47: 0 | I47: 0 | J47: 0 | K47: 239273.95999999999 | L47: 0 | M47: =SUM(J47:L47)-22817.36 -> 216456.59999999998 | N47: 22817.360000000001 | O47: =SUM(M47:N47) -> 239273.95999999996
A48: 2042 | B48: PIRATININGA | C48: 04.172.213/0001-51 | D48: 106802.25 | E48: 0 | F48: 0 | G48: 0 | H48: 0 | I48: 0 | J48: 0 | K48: 118060.61 | L48: 0 | M48: =SUM(J48:L48)-11258.36 -> 106802.25 | N48: 11258.360000000001 | O48: =SUM(M48:N48) -> 118060.61
A49: 2044 | B49: ENERGISA PB (SAELPA) | C49: 09.095.183/0001-40 | D49: 37412.809999999998 | E49: 0 | F49: 0 | G49: 0 | H49: 0 | I49: 0 | J49: 0 | K49: 41356.610000000001 | L49: 0 | M49: =SUM(J49:L49)-3943.8 -> 37412.809999999998 | N49: 3943.8000000000002 | O49: =SUM(M49:N49) -> 41356.610000000001
A50: 2048 | B50: SULGIPE | C50: 13.255.658/0001-96 | D50: 2992.46 | E50: 0 | F50: 0 | G50: 0 | H50: 0 | I50: 0 | J50: 0 | K50: 3307.9000000000001 | L50: 0 | M50: =SUM(J50:L50)-315.44 -> 2992.46 | N50: 315.44 | O50: =SUM(M50:N50) -> 3307.9000000000001
A51: 2050 | B51: ELFSM | C51: 27.485.069/0001-09 | D51: 3147.8800000000001 | E51: 0 | F51: 0 | G51: 0 | H51: 0 | I51: 0 | J51: 0 | K51: 3479.71 | L51: 0 | M51: =SUM(J51:L51)-331.83 -> 3147.8800000000001 | N51: 331.82999999999998 | O51: =SUM(M51:N51) -> 3479.71
A52: 2051 | B52: ENERGISA MG (CFLCL) | C52: 19.527.639/0001-58 | D52: 5532.29 | E52: 0 | F52: 0 | G52: 0 | H52: 0 | I52: 0 | J52: 0 | K52: 6115.4700000000003 | L52: 0 | M52: =SUM(J52:L52)-583.18 -> 5532.29 | N52: 583.17999999999995 | O52: =SUM(M52:N52) -> 6115.4700000000003
A53: 2052 | B53: DCELT (IGUAÇÚ) | C53: 83.855.973/0001-30 | D53: 141.47 | E53: 0 | F53: 0 | G53: 0 | H53: 0 | I53: 0 | J53: 0 | K53: 156.38 | L53: 0 | M53: =SUM(J53:L53)-14.91 -> 141.47 | N53: 14.91 | O53: =SUM(M53:N53) -> 156.38
A54: 2053 | B54: ENERGISA AC (ELETROACRE) | C54: 04.065.033/0001-70 | D54: 4178.4399999999996 | E54: 0 | F54: 0 | G54: 0 | H54: 0 | I54: 0 | J54: 0 | K54: 4618.8999999999996 | L54: 0 | M54: =SUM(J54:L54)-440.46 -> 4178.4399999999996 | N54: 440.45999999999998 | O54: =SUM(M54:N54) -> 4618.8999999999996
A55: 2054 | B55: ENERGISA RONDONIA (CERON) | C55: 05.914.650/0001-66 | D55: 18706 | E55: 0 | F55: 0 | G55: 0 | H55: 0 | I55: 0 | J55: 0 | K55: 20677.860000000001 | L55: 0 | M55: =SUM(J55:L55)-1971.86 -> 18706 | N55: 1971.8599999999999 | O55: =SUM(M55:N55) -> 20677.860000000001
A56: 2055 | B56: COPREL | C56: 90.660.754/0001-60 | D56: 2210.1500000000001 | E56: 0 | F56: 0 | G56: 0 | H56: 0 | I56: 0 | J56: 0 | K56: 2443.1300000000001 | L56: 0 | M56: =SUM(J56:L56)-232.98 -> 2210.1500000000001 | N56: 232.97999999999999 | O56: =SUM(M56:N56) -> 2443.1300000000001
A57: 2057 | B57: HIDROPAN | C57: 91.982.348/0001-87 | D57: 1090.21 | E57: 0 | F57: 0 | G57: 0 | H57: 0 | I57: 0 | J57: 0 | K57: 1205.1300000000001 | L57: 0 | M57: =SUM(J57:L57)-114.92 -> 1090.21 | N57: 114.92 | O57: =SUM(M57:N57) -> 1205.1300000000001
A58: 2058 | B58: ELETROCAR | C58: 88.446.034/0001-55 | D58: 1973.1900000000001 | E58: 0 | F58: 0 | G58: 0 | H58: 0 | I58: 0 | J58: 0 | K58: 2181.1900000000001 | L58: 0 | M58: =SUM(J58:L58)-208 -> 1973.1900000000001 | N58: 208 | O58: =SUM(M58:N58) -> 2181.1900000000001
A59: 2059 | B59: CERTAJA | C59: 97.839.922/0001-29 | D59: 1157.4200000000001 | E59: 0 | F59: 0 | G59: 0 | H59: 0 | I59: 0 | J59: 0 | K59: 1279.4300000000001 | L59: 0 | M59: =SUM(J59:L59)-122.01 -> 1157.4200000000001 | N59: 122.01000000000001 | O59: =SUM(M59:N59) -> 1279.4300000000001
A60: 2060 | B60: DEMEI | C60: 95.289.500/0001-00 | D60: 2778.7399999999998 | E60: 0 | F60: 0 | G60: 0 | H60: 0 | I60: 0 | J60: 0 | K60: 3071.6599999999999 | L60: 0 | M60: =SUM(J60:L60)-292.92 -> 2778.7399999999998 | N60: 292.92000000000002 | O60: =SUM(M60:N60) -> 3071.6599999999999
A61: 2061 | B61: CERILUZ | C61: 87.656.989/0001-74 | D61: 803.91999999999996 | E61: 0 | F61: 0 | G61: 0 | H61: 0 | I61: 0 | J61: 0 | K61: 888.65999999999997 | L61: 0 | M61: =SUM(J61:L61)-84.74 -> 803.91999999999996 | N61: 84.739999999999995 | O61: =SUM(M61:N61) -> 888.65999999999997
A62: 2063 | B62: COOPERA | C62: 83.646.653/0001-70 | D62: 2270.5 | E62: 0 | F62: 0 | G62: 0 | H62: 0 | I62: 0 | J62: 0 | K62: 2509.8400000000001 | L62: 0 | M62: =SUM(J62:L62)-239.34 -> 2270.5 | N62: 239.34 | O62: =SUM(M62:N62) -> 2509.8400000000001
A63: 2064 | B63: CEA-D | C63: 05.965.546/0001-09 | D63: 8442.3500000000004 | E63: 0 | F63: 0 | G63: 0 | H63: 0 | I63: 0 | J63: 0 | K63: 9332.2800000000007 | L63: 0 | M63: =SUM(J63:L63)-889.93 -> 8442.3500000000004 | N63: 889.92999999999995 | O63: =SUM(M63:N63) -> 9332.2800000000007
A64: 2065 | B64: AMAZONAS-D | C64: 02.341.467/0001-20 | D64: 54739.779999999999 | E64: 0 | F64: 0 | G64: 0 | H64: 0 | I64: 0 | J64: 0 | K64: 60510.07 | L64: 0 | M64: =SUM(J64:L64)-5770.29 -> 54739.779999999999 | N64: 5770.29 | O64: =SUM(M64:N64) -> 60510.07
A65: 2066 | B65: COOPERLUZ | C65: 95.824.322/0001-61 | D65: 740.82000000000005 | E65: 0 | F65: 0 | G65: 0 | H65: 0 | I65: 0 | J65: 0 | K65: 818.90999999999997 | L65: 0 | M65: =SUM(J65:L65)-78.09 -> 740.81999999999994 | N65: 78.090000000000003 | O65: =SUM(M65:N65) -> 818.90999999999997
A66: 2067 | B66: NOVA PALMA | C66: 89.889.604/0001-44 | D66: 52.630000000000003 | E66: 0 | F66: 0 | G66: 0 | H66: 0 | I66: 0 | J66: 0 | K66: 58.18 | L66: 0 | M66: =SUM(J66:L66)-5.55 -> 52.630000000000003 | N66: 5.5499999999999998 | O66: =SUM(M66:N66) -> 58.18
A67: 2068 | B67: CHESP(SÃO PATRÍCIO) | C67: 01.377.555/0001-10 | D67: 1087.8699999999999 | E67: 0 | F67: 0 | G67: 0 | H67: 0 | I67: 0 | J67: 0 | K67: 1202.55 | L67: 0 | M67: =SUM(J67:L67)-114.68 -> 1087.8699999999999 | N67: 114.68000000000001 | O67: =SUM(M67:N67) -> 1202.55
A68: 2069 | B68: FORCEL | C68: 79.850.574/0001-09 | D68: 30.789999999999999 | E68: 0 | F68: 0 | G68: 0 | H68: 0 | I68: 0 | J68: 0 | K68: 34.039999999999999 | L68: 0 | M68: =SUM(J68:L68)-3.25 -> 30.789999999999999 | N68: 3.25 | O68: =SUM(M68:N68) -> 34.039999999999999
A69: 2070 | B69: MUXENERGIA | C69: 97.578.090/0001-34 | D69: 46.469999999999999 | E69: 0 | F69: 0 | G69: 0 | H69: 0 | I69: 0 | J69: 0 | K69: 51.369999999999997 | L69: 0 | M69: =SUM(J69:L69)-4.9 -> 46.469999999999999 | N69: 4.9000000000000004 | O69: =SUM(M69:N69) -> 51.369999999999997
A70: 2071 | B70: CERMISSÕES | C70: 97.081.434/0001-03 | D70: 857.25999999999999 | E70: 0 | F70: 0 | G70: 0 | H70: 0 | I70: 0 | J70: 0 | K70: 947.63 | L70: 0 | M70: =SUM(J70:L70)-90.37 -> 857.25999999999999 | N70: 90.370000000000005 | O70: =SUM(M70:N70) -> 947.63
A71: 2072 | B71: COCEL | C71: 75.805.895/0001-30 | D71: 173.74000000000001 | E71: 0 | F71: 0 | G71: 0 | H71: 0 | I71: 0 | J71: 0 | K71: 192.05000000000001 | L71: 0 | M71: =SUM(J71:L71)-18.31 -> 173.74000000000001 | N71: 18.309999999999999 | O71: =SUM(M71:N71) -> 192.05000000000001
A72: 2073 | B72: CEMIRIM | C72: 52.777.034/0001-90 | D72: 861.77999999999997 | E72: 0 | F72: 0 | G72: 0 | H72: 0 | I72: 0 | J72: 0 | K72: 952.62 | L72: 0 | M72: =SUM(J72:L72)-90.84 -> 861.77999999999997 | N72: 90.840000000000003 | O72: =SUM(M72:N72) -> 952.62
A73: 2074 | B73: CERTEL ENERGIA | C73: 09.257.558/0001-21 | D73: 4207.3999999999996 | E73: 0 | F73: 0 | G73: 0 | H73: 0 | I73: 0 | J73: 0 | K73: 4650.9200000000001 | L73: 0 | M73: =SUM(J73:L73)-443.52 -> 4207.3999999999996 | N73: 443.51999999999998 | O73: =SUM(M73:N73) -> 4650.9200000000001
A74: 2075 | B74: CERTHIL | C74: 98.042.963/0001-52 | D74: 600.99000000000001 | E74: 0 | F74: 0 | G74: 0 | H74: 0 | I74: 0 | J74: 0 | K74: 664.34000000000003 | L74: 0 | M74: =SUM(J74:L74)-63.35 -> 600.99000000000001 | N74: 63.350000000000001 | O74: =SUM(M74:N74) -> 664.34000000000003
A75: 2076 | B75: COOPERALIANÇA | C75: 83.647.990/0001-81 | D75: 154.94 | E75: 0 | F75: 0 | G75: 0 | H75: 0 | I75: 0 | J75: 0 | K75: 171.27000000000001 | L75: 0 | M75: =SUM(J75:L75)-16.33 -> 154.94 | N75: 16.329999999999998 | O75: =SUM(M75:N75) -> 171.26999999999998
A76: 2077 | B76: CERSUL | C76: 86.512.670/0001-02 | D76: 1104.6800000000001 | E76: 0 | F76: 0 | G76: 0 | H76: 0 | I76: 0 | J76: 0 | K76: 1221.1300000000001 | L76: 0 | M76: =SUM(J76:L76)-116.45 -> 1104.6800000000001 | N76: 116.45 | O76: =SUM(M76:N76) -> 1221.1300000000001
A77: 2078 | B77: COOPERCOCAL | C77: 86.532.348/0001-45 | D77: 729.79999999999995 | E77: 0 | F77: 0 | G77: 0 | H77: 0 | I77: 0 | J77: 0 | K77: 806.73000000000002 | L77: 0 | M77: =SUM(J77:L77)-76.93 -> 729.79999999999995 | N77: 76.930000000000007 | O77: =SUM(M77:N77) -> 806.73000000000002
A78: 3001 | B78: AES TIETÊ | C78: 00.194.724/0001-13 | D78: 28552.990000000002 | E78: 0 | F78: 0 | G78: 0 | H78: 0 | I78: 0 | J78: 0 | K78: 31562.849999999999 | L78: 0 | M78: =SUM(J78:L78)-3009.86 -> 28552.989999999998 | N78: 3009.8600000000001 | O78: =SUM(M78:N78) -> 31562.849999999999
A79: 3003 | B79: ALCOA (CONS. MACHADINHO) | C79: 23.637.697/0001-01 | D79: 5111.1999999999998 | E79: 0 | F79: 0 | G79: 0 | H79: 0 | I79: 0 | J79: 0 | K79: 5649.9899999999998 | L79: 0 | M79: =SUM(J79:L79)-538.79 -> 5111.1999999999998 | N79: 538.78999999999996 | O79: =SUM(M79:N79) -> 5649.9899999999998
A80: 3004 | B80: ARCELORMITTAL (CONS. GUILMAN AMORIM | C80: 17.469.701/0066-12 | D80: 860.97000000000003 | E80: 0 | F80: 0 | G80: 0 | H80: 0 | I80: 0 | J80: 0 | K80: 951.73000000000002 | L80: 0 | M80: =SUM(J80:L80)-90.76 -> 860.97000000000003 | N80: 90.760000000000005 | O80: =SUM(M80:N80) -> 951.73000000000002
A81: 3005 | B81: MACHADINHO PART (CONS. MACHADINHO) | C81: 22.686.342/0001-40 | D81: 1047.5699999999999 | E81: 0 | F81: 0 | G81: 0 | H81: 0 | I81: 0 | J81: 0 | K81: 1158 | L81: 0 | M81: =SUM(J81:L81)-110.43 -> 1047.5699999999999 | N81: 110.43000000000001 | O81: =SUM(M81:N81) -> 1158
A82: 3007 | B82: CBA (CONS. MACHADINHO) | C82: 24.241.083/0001-79 | D82: 5464.6300000000001 | E82: 0 | F82: 0 | G82: 0 | H82: 0 | I82: 0 | J82: 0 | K82: 6040.6700000000001 | L82: 0 | M82: =SUM(J82:L82)-576.04 -> 5464.6300000000001 | N82: 576.03999999999996 | O82: =SUM(M82:N82) -> 6040.6700000000001
A83: 3008 | B83: CBA (UHE PIRAJÚ) | C83: 61.409.892/0001-73 | D83: 1270.0999999999999 | E83: 0 | F83: 0 | G83: 0 | H83: 0 | I83: 0 | J83: 0 | K83: 1403.99 | L83: 0 | M83: =SUM(J83:L83)-133.89 -> 1270.0999999999999 | N83: 133.88999999999999 | O83: =SUM(M83:N83) -> 1403.9899999999998
A84: 3009 | B84: CEB LAJEADO (CONS. LAJEADO) | C84: 03.677.638/0001-50 | D84: 3616.6700000000001 | E84: 0 | F84: 0 | G84: 0 | H84: 0 | I84: 0 | J84: 0 | K84: 3997.9099999999999 | L84: 0 | M84: =SUM(J84:L84)-381.24 -> 3616.6700000000001 | N84: 381.24000000000001 | O84: =SUM(M84:N84) -> 3997.9099999999999
A85: 3011 | B85: CEEE(CONS. DONA FRANCISCA) | C85: 39.881.421/0001-04 | D85: 323.00999999999999 | E85: 0 | F85: 0 | G85: 0 | H85: 0 | I85: 0 | J85: 0 | K85: 357.06 | L85: 0 | M85: =SUM(J85:L85)-34.05 -> 323.00999999999999 | N85: 34.049999999999997 | O85: =SUM(M85:N85) -> 357.06
A86: 3012 | B86: CEEE(CONS. MACHADINHO) | C86: 39.881.421/0001-04 | D86: 1097.98 | E86: 0 | F86: 0 | G86: 0 | H86: 0 | I86: 0 | J86: 0 | K86: 1213.72 | L86: 0 | M86: =SUM(J86:L86)-115.74 -> 1097.98 | N86: 115.73999999999999 | O86: =SUM(M86:N86) -> 1213.72
A87: 3015 | B87: CEMIG-G | C87: 06.981.176/0001-58 | D87: 31726.709999999999 | E87: 0 | F87: 0 | G87: 0 | H87: 0 | I87: 0 | J87: 0 | K87: 35071.120000000003 | L87: 0 | M87: =SUM(J87:L87)-3344.41 -> 31726.710000000003 | N87: 3344.4099999999999 | O87: =SUM(M87:N87) -> 35071.120000000003
A88: 3021 | B88: CGTEE | C88: 02.016.507/0001-69 | D88: 6042.8299999999999 | E88: 0 | F88: 0 | G88: 0 | H88: 0 | I88: 0 | J88: 0 | K88: 6679.8199999999997 | L88: 0 | M88: =SUM(J88:L88)-636.99 -> 6042.8299999999999 | N88: 636.99000000000001 | O88: =SUM(M88:N88) -> 6679.8199999999997
A89: 3022 | B89: CHESF-G | C89: 33.541.368/0001-16 | D89: 215640.48999999999 | E89: 0 | F89: 0 | G89: 0 | H89: 0 | I89: 0 | J89: 0 | K89: 238371.82000000001 | L89: 0 | M89: =SUM(J89:L89)-22731.33 -> 215640.48999999999 | N89: 22731.330000000002 | O89: =SUM(M89:N89) -> 238371.82000000001
A90: 3025 | B90: COPEL-G | C90: 04.370.282/0001-70 | D90: 47685.730000000003 | E90: 0 | F90: 0 | G90: 0 | H90: 0 | I90: 0 | J90: 0 | K90: 52712.43 | L90: 0 | M90: =SUM(J90:L90)-5026.7 -> 47685.730000000003 | N90: 5026.6999999999998 | O90: =SUM(M90:N90) -> 52712.43
A91: 3026 | B91: UEG ARAUCÁRIA | C91: 02.743.574/0001-85 | D91: 6753.8199999999997 | E91: 0 | F91: 0 | G91: 0 | H91: 0 | I91: 0 | J91: 0 | K91: 7465.7600000000002 | L91: 0 | M91: =SUM(J91:L91)-711.94 -> 6753.8199999999997 | N91: 711.94000000000005 | O91: =SUM(M91:N91) -> 7465.7600000000002
A92: 3027 | B92: COTEMINAS(CONS. PORTO ESTRELA) | C92: 07.663.140/0001-99 | D92: 461.31999999999999 | E92: 0 | F92: 0 | G92: 0 | H92: 0 | I92: 0 | J92: 0 | K92: 509.94999999999999 | L92: 0 | M92: =SUM(J92:L92)-48.63 -> 461.31999999999999 | N92: 48.630000000000003 | O92: =SUM(M92:N92) -> 509.94999999999999
A93: 3033 | B93: DFESA(CONS. DONA FRANCISCA) | C93: 02.832.860/0003-89 | D93: 1830.3900000000001 | E93: 0 | F93: 0 | G93: 0 | H93: 0 | I93: 0 | J93: 0 | K93: 2023.3399999999999 | L93: 0 | M93: =SUM(J93:L93)-192.95 -> 1830.3899999999999 | N93: 192.94999999999999 | O93: =SUM(M93:N93) -> 2023.3399999999999
A94: 3034 | B94: DME(CONS. MACHADINHO) | C94: 23.664.303/0001-04 | D94: 542.54999999999995 | E94: 0 | F94: 0 | G94: 0 | H94: 0 | I94: 0 | J94: 0 | K94: 599.74000000000001 | L94: 0 | M94: =SUM(J94:L94)-57.19 -> 542.54999999999995 | N94: 57.189999999999998 | O94: =SUM(M94:N94) -> 599.74000000000001
A95: 3035 | B95: RIO PARANAPANEMA(DUKE ENERGY) | C95: 02.998.301/0001-81 | D95: 31862.209999999999 | E95: 0 | F95: 0 | G95: 0 | H95: 0 | I95: 0 | J95: 0 | K95: 35220.900000000001 | L95: 0 | M95: =SUM(J95:L95)-3358.69 -> 31862.210000000003 | N95: 3358.6900000000001 | O95: =SUM(M95:N95) -> 35220.900000000001
A96: 3038 | B96: PETROBRAS (UTE MARIO LAGO) | C96: 33.000.167/0087-81 | D96: 13822.08 | E96: 0 | F96: 0 | G96: 0 | H96: 0 | I96: 0 | J96: 0 | K96: 15279.110000000001 | L96: 0 | M96: =SUM(J96:L96)-1457.03 -> 13822.08 | N96: 1457.03 | O96: =SUM(M96:N96) -> 15279.110000000001
A97: 3039 | B97: ELETRONORTE-G | C97: 00.357.038/0001-16 | D97: 7170.79 | E97: 0 | F97: 0 | G97: 0 | H97: 0 | I97: 0 | J97: 0 | K97: 7926.6899999999996 | L97: 0 | M97: =SUM(J97:L97)-755.9 -> 7170.79 | N97: 755.89999999999998 | O97: =SUM(M97:N97) -> 7926.6899999999996
A98: 3040 | B98: ELETRONUCLEAR | C98: 42.540.211/0001-67 | D98: 37295.839999999997 | E98: 0 | F98: 0 | G98: 0 | H98: 0 | I98: 0 | J98: 0 | K98: 41227.309999999998 | L98: 0 | M98: =SUM(J98:L98)-3931.47 -> 37295.839999999997 | N98: 3931.4699999999998 | O98: =SUM(M98:N98) -> 41227.309999999998
A99: 3044 | B99: FURNAS(APM MANSO) | C99: 23.274.194/0001-19 | D99: 5110.4099999999999 | E99: 0 | F99: 0 | G99: 0 | H99: 0 | I99: 0 | J99: 0 | K99: 5649.1099999999997 | L99: 0 | M99: =SUM(J99:L99)-538.7 -> 5110.4099999999999 | N99: 538.70000000000005 | O99: =SUM(M99:N99) -> 5649.1099999999997
A100: 3045 | B100: INVESTCO(CONS. LAJEADO) | C100: 00.644.907/0001-93 | D100: 182.66 | E100: 0 | F100: 0 | G100: 0 | H100: 0 | I100: 0 | J100: 0 | K100: 201.91 | L100: 0 | M100: =SUM(J100:L100)-19.25 -> 182.66 | N100: 19.25 | O100: =SUM(M100:N100) -> 201.91
A101: 3046 | B101: ITAPEBI(UHE ITAPEBI) | C101: 02.397.080/0002-77 | D101: 4763.54 | E101: 0 | F101: 0 | G101: 0 | H101: 0 | I101: 0 | J101: 0 | K101: 5265.6800000000003 | L101: 0 | M101: =SUM(J101:L101)-502.14 -> 4763.54 | N101: 502.13999999999999 | O101: =SUM(M101:N101) -> 5265.6800000000003
A102: 3047 | B102: ITASA (CONS. ITÁ) | C102: 01.355.994/0002-02 | D102: 14721.549999999999 | E102: 0 | F102: 0 | G102: 0 | H102: 0 | I102: 0 | J102: 0 | K102: 16273.389999999999 | L102: 0 | M102: =SUM(J102:L102)-1551.84 -> 14721.549999999999 | N102: 1551.8399999999999 | O102: =SUM(M102:N102) -> 16273.389999999999
A103: 3048 | B103: ITIQUIRA(UHE ITIQUIRA) | C103: 02.808.298/0017-53 | D103: 3671.1500000000001 | E103: 0 | F103: 0 | G103: 0 | H103: 0 | I103: 0 | J103: 0 | K103: 4058.1399999999999 | L103: 0 | M103: =SUM(J103:L103)-386.99 -> 3671.1499999999996 | N103: 386.99000000000001 | O103: =SUM(M103:N103) -> 4058.1399999999994
A104: 3052 | B104: PETROBRAS(UTE TERMOCEARÁ) | C104: 33.000.167/0104-17 | D104: 3803.3000000000002 | E104: 0 | F104: 0 | G104: 0 | H104: 0 | I104: 0 | J104: 0 | K104: 4204.2200000000003 | L104: 0 | M104: =SUM(J104:L104)-400.92 -> 3803.3000000000002 | N104: 400.92000000000002 | O104: =SUM(M104:N104) -> 4204.2200000000003
A105: 3054 | B105: PAULISTA LAJEADO(CONS. LAJEADO) | C105: 03.491.603/0001-21 | D105: 1265.8399999999999 | E105: 0 | F105: 0 | G105: 0 | H105: 0 | I105: 0 | J105: 0 | K105: 1399.28 | L105: 0 | M105: =SUM(J105:L105)-133.44 -> 1265.8399999999999 | N105: 133.44 | O105: =SUM(M105:N105) -> 1399.28
A106: 3055 | B106: PETROBRAS (UTE SEPÉ-TIARAJU) | C106: 33.000.167/0071-14 | D106: 3669.6100000000001 | E106: 0 | F106: 0 | G106: 0 | H106: 0 | I106: 0 | J106: 0 | K106: 4056.4299999999998 | L106: 0 | M106: =SUM(J106:L106)-386.82 -> 3669.6099999999997 | N106: 386.81999999999999 | O106: =SUM(M106:N106) -> 4056.4299999999998
A107: 3057 | B107: PETROBRAS(UTE FERNAN GASPARIAN) | C107: 33.000.167/0026-60 | D107: 2689.3600000000001 | E107: 0 | F107: 0 | G107: 0 | H107: 0 | I107: 0 | J107: 0 | K107: 2972.8499999999999 | L107: 0 | M107: =SUM(J107:L107)-283.49 -> 2689.3599999999997 | N107: 283.49000000000001 | O107: =SUM(M107:N107) -> 2972.8499999999995
A108: 3058 | B108: PETROBRAS (UTE CELSO FURTADO) | C108: 33.000.167/0024-06 | D108: 2701.1900000000001 | E108: 0 | F108: 0 | G108: 0 | H108: 0 | I108: 0 | J108: 0 | K108: 2985.9299999999998 | L108: 0 | M108: =SUM(J108:L108)-284.74 -> 2701.1899999999996 | N108: 284.74000000000001 | O108: =SUM(M108:N108) -> 2985.9299999999994
A109: 3061 | B109: LAJEADO ENERGIA(CONS. LAJEADO) | C109: 03.460.864/0002-65 | D109: 13200.860000000001 | E109: 0 | F109: 0 | G109: 0 | H109: 0 | I109: 0 | J109: 0 | K109: 14592.4 | L109: 0 | M109: =SUM(J109:L109)-1391.54 -> 13200.860000000001 | N109: 1391.54 | O109: =SUM(M109:N109) -> 14592.400000000001
A110: 3062 | B110: VCB(CONS. MACHADINHO) | C110: 28.323.127/0001-60 | D110: 1115.3499999999999 | E110: 0 | F110: 0 | G110: 0 | H110: 0 | I110: 0 | J110: 0 | K110: 1232.9200000000001 | L110: 0 | M110: =SUM(J110:L110)-117.57 -> 1115.3500000000001 | N110: 117.56999999999999 | O110: =SUM(M110:N110) -> 1232.9200000000001
A111: 3064 | B111: SAMARCO(CONS.GUILMAN AMORIM) | C111: 16.628.281/0003-23 | D111: 827.20000000000005 | E111: 0 | F111: 0 | G111: 0 | H111: 0 | I111: 0 | J111: 0 | K111: 914.39999999999998 | L111: 0 | M111: =SUM(J111:L111)-87.2 -> 827.19999999999993 | N111: 87.200000000000003 | O111: =SUM(M111:N111) -> 914.39999999999998
A112: 3068 | B112: TERMOPERNAMBUCO(UTE TERMOPERN.) | C112: 03.795.050/0002-81 | D112: 9054.3299999999999 | E112: 0 | F112: 0 | G112: 0 | H112: 0 | I112: 0 | J112: 0 | K112: 10008.780000000001 | L112: 0 | M112: =SUM(J112:L112)-954.45 -> 9054.3299999999999 | N112: 954.45000000000005 | O112: =SUM(M112:N112) -> 10008.780000000001
A113: 3069 | B113: ENGIE | C113: 02.474.103/0001-19 | D113: 68504.179999999993 | E113: 0 | F113: 0 | G113: 0 | H113: 0 | I113: 0 | J113: 0 | K113: 75725.419999999998 | L113: 0 | M113: =SUM(J113:L113)-7221.24 -> 68504.179999999993 | N113: 7221.2399999999998 | O113: =SUM(M113:N113) -> 75725.419999999998
A114: 3070 | B114: ENGIE (CONS. ITÁ) | C114: 02.474.103/0001-19 | D114: 10912.360000000001 | E114: 0 | F114: 0 | G114: 0 | H114: 0 | I114: 0 | J114: 0 | K114: 12062.67 | L114: 0 | M114: =SUM(J114:L114)-1150.31 -> 10912.360000000001 | N114: 1150.3099999999999 | O114: =SUM(M114:N114) -> 12062.67
A115: 3071 | B115: ENGIE (CONS. MACHADINHO) | C115: 02.474.103/0001-19 | D115: 3828.8699999999999 | E115: 0 | F115: 0 | G115: 0 | H115: 0 | I115: 0 | J115: 0 | K115: 4232.4799999999996 | L115: 0 | M115: =SUM(J115:L115)-403.61 -> 3828.8699999999994 | N115: 403.61000000000001 | O115: =SUM(M115:N115) -> 4232.4799999999996
A116: 3072 | B116: VALE (VALESUL-CONS. MACHADINHO) | C116: 33.592.510/0005-88 | D116: 1646.49 | E116: 0 | F116: 0 | G116: 0 | H116: 0 | I116: 0 | J116: 0 | K116: 1820.05 | L116: 0 | M116: =SUM(J116:L116)-173.56 -> 1646.49 | N116: 173.56 | O116: =SUM(M116:N116) -> 1820.05
A117: 3073 | B117: EMAE | C117: 02.302.101/0001-42 | D117: 869.26999999999998 | E117: 0 | F117: 0 | G117: 0 | H117: 0 | I117: 0 | J117: 0 | K117: 960.89999999999998 | L117: 0 | M117: =SUM(J117:L117)-91.63 -> 869.26999999999998 | N117: 91.629999999999995 | O117: =SUM(M117:N117) -> 960.89999999999998
A118: 3074 | B118: CGTF(UTE FORTALEZA) | C118: 04.423.567/0016-08 | D118: 5615.1400000000003 | E118: 0 | F118: 0 | G118: 0 | H118: 0 | I118: 0 | J118: 0 | K118: 6207.0500000000002 | L118: 0 | M118: =SUM(J118:L118)-591.91 -> 5615.1400000000003 | N118: 591.90999999999997 | O118: =SUM(M118:N118) -> 6207.0500000000002
A119: 3078 | B119: NORTE FLUMINENSE(UTE NORTE FLUM.) | C119: 03.258.983/0002-30 | D119: 12995.68 | E119: 0 | F119: 0 | G119: 0 | H119: 0 | I119: 0 | J119: 0 | K119: 14365.59 | L119: 0 | M119: =SUM(J119:L119)-1369.91 -> 12995.68 | N119: 1369.9100000000001 | O119: =SUM(M119:N119) -> 14365.59
A120: 3079 | B120: CDSA | C120: 01.672.223/0001-68 | D120: 12366.83 | E120: 0 | F120: 0 | G120: 0 | H120: 0 | I120: 0 | J120: 0 | K120: 13670.459999999999 | L120: 0 | M120: =SUM(J120:L120)-1303.63 -> 12366.829999999998 | N120: 1303.6300000000001 | O120: =SUM(M120:N120) -> 13670.459999999999
A121: 3083 | B121: VOTORANTIM(UHE PEDRA DO CAVALO) | C121: 10.656.452/0066-25 | D121: 2250.1199999999999 | E121: 0 | F121: 0 | G121: 0 | H121: 0 | I121: 0 | J121: 0 | K121: 2487.3099999999999 | L121: 0 | M121: =SUM(J121:L121)-237.19 -> 2250.1199999999999 | N121: 237.19 | O121: =SUM(M121:N121) -> 2487.3099999999999
A122: 3084 | B122: CERAN | C122: 04.237.975/0001-99 | D122: 5593.4899999999998 | E122: 0 | F122: 0 | G122: 0 | H122: 0 | I122: 0 | J122: 0 | K122: 6183.1199999999999 | L122: 0 | M122: =SUM(J122:L122)-589.63 -> 5593.4899999999998 | N122: 589.63 | O122: =SUM(M122:N122) -> 6183.1199999999999
A123: 3090 | B123: BAESA (UHE BARRA GRANDE) | C123: 04.781.143/0001-39 | D123: 12550.09 | E123: 0 | F123: 0 | G123: 0 | H123: 0 | I123: 0 | J123: 0 | K123: 13873.030000000001 | L123: 0 | M123: =SUM(J123:L123)-1322.94 -> 12550.09 | N123: 1322.9400000000001 | O123: =SUM(M123:N123) -> 13873.030000000001
A124: 3095 | B124: PETROBRAS(UTE JESUS S. PEREIRA) | C124: 33.000.167/0148-38 | D124: 6585.8299999999999 | E124: 0 | F124: 0 | G124: 0 | H124: 0 | I124: 0 | J124: 0 | K124: 7280.0600000000004 | L124: 0 | M124: =SUM(J124:L124)-694.23 -> 6585.8299999999999 | N124: 694.23000000000002 | O124: =SUM(M124:N124) -> 7280.0599999999995
A125: 3097 | B125: CEMIG(UHE IRAPÉ) | C125: 06.981.176/0001-58 | D125: 6050.8800000000001 | E125: 0 | F125: 0 | G125: 0 | H125: 0 | I125: 0 | J125: 0 | K125: 6688.7200000000003 | L125: 0 | M125: =SUM(J125:L125)-637.84 -> 6050.8800000000001 | N125: 637.84000000000003 | O125: =SUM(M125:N125) -> 6688.7200000000003
A126: 3098 | B126: VERACEL(UTE VERACEL) | C126: 40.551.996/0001-48 | D126: 142.78999999999999 | E126: 0 | F126: 0 | G126: 0 | H126: 0 | I126: 0 | J126: 0 | K126: 157.84 | L126: 0 | M126: =SUM(J126:L126)-15.05 -> 142.78999999999999 | N126: 15.050000000000001 | O126: =SUM(M126:N126) -> 157.84
A127: 3102 | B127: ENERPEIXE(UHE PEIXE ANGICAL) | C127: 04.426.411/0003-66 | D127: 9714.5100000000002 | E127: 0 | F127: 0 | G127: 0 | H127: 0 | I127: 0 | J127: 0 | K127: 10738.549999999999 | L127: 0 | M127: =SUM(J127:L127)-1024.04 -> 9714.5099999999984 | N127: 1024.04 | O127: =SUM(M127:N127) -> 10738.549999999999
A128: 3103 | B128: ENERCAN (UHE CAMPOS NOVOS) | C128: 03.356.967/0001-07 | D128: 15679.58 | E128: 0 | F128: 0 | G128: 0 | H128: 0 | I128: 0 | J128: 0 | K128: 17332.41 | L128: 0 | M128: =SUM(J128:L128)-1652.83 -> 15679.58 | N128: 1652.8299999999999 | O128: =SUM(M128:N128) -> 17332.41
A129: 3108 | B129: VENTOS DO SUL | C129: 06.016.348/0002-34 | D129: 2335.6300000000001 | E129: 0 | F129: 0 | G129: 0 | H129: 0 | I129: 0 | J129: 0 | K129: 2581.8400000000001 | L129: 0 | M129: =SUM(J129:L129)-246.21 -> 2335.6300000000001 | N129: 246.21000000000001 | O129: =SUM(M129:N129) -> 2581.8400000000001
A130: 3119 | B130: BSE-G | C130: 03.059.729/0001-21 | D130: 2883.9000000000001 | E130: 0 | F130: 0 | G130: 0 | H130: 0 | I130: 0 | J130: 0 | K130: 3187.9000000000001 | L130: 0 | M130: =SUM(J130:L130)-304 -> 2883.9000000000001 | N130: 304 | O130: =SUM(M130:N130) -> 3187.9000000000001
A131: 3120 | B131: BRENTECH(UTE GOIANIA 2) | C131: 07.921.085/0001-90 | D131: 2556.0799999999999 | E131: 0 | F131: 0 | G131: 0 | H131: 0 | I131: 0 | J131: 0 | K131: 2825.52 | L131: 0 | M131: =SUM(J131:L131)-269.44 -> 2556.0799999999999 | N131: 269.44 | O131: =SUM(M131:N131) -> 2825.52
A132: 3121 | B132: UTE GUARANI (UTE AREMBEPE) | C132: 23.865.997/0001-48 | D132: 2219.3899999999999 | E132: 0 | F132: 0 | G132: 0 | H132: 0 | I132: 0 | J132: 0 | K132: 2453.3400000000001 | L132: 0 | M132: =SUM(J132:L132)-233.95 -> 2219.3900000000003 | N132: 233.94999999999999 | O132: =SUM(M132:N132) -> 2453.3400000000001
A133: 3122 | B133: EPESA | C133: 06.212.748/0001-34 | D133: 4007.3000000000002 | E133: 0 | F133: 0 | G133: 0 | H133: 0 | I133: 0 | J133: 0 | K133: 4429.7200000000003 | L133: 0 | M133: =SUM(J133:L133)-422.42 -> 4007.3000000000002 | N133: 422.42000000000002 | O133: =SUM(M133:N133) -> 4429.7200000000003
A134: 3123 | B134: UTE APOENA (UTE MURICY) | C134: 23.865.997/0001-48 | D134: 2175.4499999999998 | E134: 0 | F134: 0 | G134: 0 | H134: 0 | I134: 0 | J134: 0 | K134: 2404.77 | L134: 0 | M134: =SUM(J134:L134)-229.32 -> 2175.4499999999998 | N134: 229.31999999999999 | O134: =SUM(M134:N134) -> 2404.77
A135: 3126 | B135: PETROBRAS(UTE EUZEBIO ROCHA) | C135: 33.000.167/0116-50 | D135: 2450.9299999999998 | E135: 0 | F135: 0 | G135: 0 | H135: 0 | I135: 0 | J135: 0 | K135: 2709.29 | L135: 0 | M135: =SUM(J135:L135)-258.36 -> 2450.9299999999998 | N135: 258.36000000000001 | O135: =SUM(M135:N135) -> 2709.29
A136: 3127 | B136: PRAIA FORMOSA | C136: 08.439.659/0008-27 | D136: 1977 | E136: 0 | F136: 0 | G136: 0 | H136: 0 | I136: 0 | J136: 0 | K136: 2185.4000000000001 | L136: 0 | M136: =SUM(J136:L136)-208.4 -> 1977 | N136: 208.40000000000001 | O136: =SUM(M136:N136) -> 2185.4000000000001
A137: 3130 | B137: ICARAIZINHO | C137: 08.439.659/0009-08 | D137: 1106.4000000000001 | E137: 0 | F137: 0 | G137: 0 | H137: 0 | I137: 0 | J137: 0 | K137: 1223.03 | L137: 0 | M137: =SUM(J137:L137)-116.63 -> 1106.4000000000001 | N137: 116.63 | O137: =SUM(M137:N137) -> 1223.0300000000002
A138: 3133 | B138: BAGUARI(CONS. BAGUARI) | C138: 07.799.995/0001-41 | D138: 952.39999999999998 | E138: 0 | F138: 0 | G138: 0 | H138: 0 | I138: 0 | J138: 0 | K138: 1052.8 | L138: 0 | M138: =SUM(J138:L138)-100.4 -> 952.39999999999998 | N138: 100.40000000000001 | O138: =SUM(M138:N138) -> 1052.8
A139: 3134 | B139: GERA MARANHÃO (GERANORTE) | C139: 09.110.880/0001-23 | D139: 5831.9099999999999 | E139: 0 | F139: 0 | G139: 0 | H139: 0 | I139: 0 | J139: 0 | K139: 6446.6700000000001 | L139: 0 | M139: =SUM(J139:L139)-614.76 -> 5831.9099999999999 | N139: 614.75999999999999 | O139: =SUM(M139:N139) -> 6446.6700000000001
A140: 3135 | B140: BONS VENTOS | C140: 08.439.659/0001-50 | D140: 2687.5700000000002 | E140: 0 | F140: 0 | G140: 0 | H140: 0 | I140: 0 | J140: 0 | K140: 2970.8800000000001 | L140: 0 | M140: =SUM(J140:L140)-283.31 -> 2687.5700000000002 | N140: 283.31 | O140: =SUM(M140:N140) -> 2970.8800000000001
A141: 3136 | B141: VIANA | C141: 09.043.782/0002-00 | D141: 3206.6799999999998 | E141: 0 | F141: 0 | G141: 0 | H141: 0 | I141: 0 | J141: 0 | K141: 3544.71 | L141: 0 | M141: =SUM(J141:L141)-338.03 -> 3206.6800000000003 | N141: 338.02999999999997 | O141: =SUM(M141:N141) -> 3544.71
A142: 3137 | B142: BORBOREMA(UTE CAMP. GRANDE) | C142: 09.036.424/0001-80 | D142: 3895.4299999999998 | E142: 0 | F142: 0 | G142: 0 | H142: 0 | I142: 0 | J142: 0 | K142: 4306.0600000000004 | L142: 0 | M142: =SUM(J142:L142)-410.63 -> 3895.4300000000003 | N142: 410.63 | O142: =SUM(M142:N142) -> 4306.0600000000004
A143: 3138 | B143: ENERGIMP (VOLTA DO RIO) | C143: 07.063.713/0002-24 | D143: 859.97000000000003 | E143: 0 | F143: 0 | G143: 0 | H143: 0 | I143: 0 | J143: 0 | K143: 950.62 | L143: 0 | M143: =SUM(J143:L143)-90.65 -> 859.97000000000003 | N143: 90.650000000000006 | O143: =SUM(M143:N143) -> 950.62
A144: 3139 | B144: ENERGIMP (PRAIA DO MORGADO) | C144: 07.063.963/0001-83 | D144: 561.86000000000001 | E144: 0 | F144: 0 | G144: 0 | H144: 0 | I144: 0 | J144: 0 | K144: 621.09000000000003 | L144: 0 | M144: =SUM(J144:L144)-59.23 -> 561.86000000000001 | N144: 59.229999999999997 | O144: =SUM(M144:N144) -> 621.09000000000003
A145: 3140 | B145: RIO VERDE(UHE SALTO) | C145: 05.252.008/0001-69 | D145: 2802.8800000000001 | E145: 0 | F145: 0 | G145: 0 | H145: 0 | I145: 0 | J145: 0 | K145: 3098.3400000000001 | L145: 0 | M145: =SUM(J145:L145)-295.46 -> 2802.8800000000001 | N145: 295.45999999999998 | O145: =SUM(M145:N145) -> 3098.3400000000001
A146: 3141 | B146: FOZ DO RIO CLARO | C146: 07.823.262/0001-03 | D146: 1599.0899999999999 | E146: 0 | F146: 0 | G146: 0 | H146: 0 | I146: 0 | J146: 0 | K146: 1767.6600000000001 | L146: 0 | M146: =SUM(J146:L146)-168.57 -> 1599.0900000000001 | N146: 168.56999999999999 | O146: =SUM(M146:N146) -> 1767.6600000000001
A147: 3142 | B147: UTE CAÇU I | C147: 08.598.391/0001-08 | D147: 2199.75 | E147: 0 | F147: 0 | G147: 0 | H147: 0 | I147: 0 | J147: 0 | K147: 2431.6300000000001 | L147: 0 | M147: =SUM(J147:L147)-231.88 -> 2199.75 | N147: 231.88 | O147: =SUM(M147:N147) -> 2431.6300000000001
A148: 3143 | B148: KINROSS (CAÇU B.-COQUEIROS) | C148: 20.346.524/0005-70 | D148: 3750.5900000000001 | E148: 0 | F148: 0 | G148: 0 | H148: 0 | I148: 0 | J148: 0 | K148: 4145.9499999999998 | L148: 0 | M148: =SUM(J148:L148)-395.36 -> 3750.5899999999997 | N148: 395.36000000000001 | O148: =SUM(M148:N148) -> 4145.9499999999998
A149: 3144 | B149: CANDEIAS-G | C149: 10.508.162/0001-99 | D149: 4295.9700000000003 | E149: 0 | F149: 0 | G149: 0 | H149: 0 | I149: 0 | J149: 0 | K149: 4748.8199999999997 | L149: 0 | M149: =SUM(J149:L149)-452.85 -> 4295.9699999999993 | N149: 452.85000000000002 | O149: =SUM(M149:N149) -> 4748.8199999999997
A150: 3145 | B150: CBA(RIO VERDINHO) | C150: 61.409.892/0210-90 | D150: 2205.9499999999998 | E150: 0 | F150: 0 | G150: 0 | H150: 0 | I150: 0 | J150: 0 | K150: 2438.4899999999998 | L150: 0 | M150: =SUM(J150:L150)-232.54 -> 2205.9499999999998 | N150: 232.53999999999999 | O150: =SUM(M150:N150) -> 2438.4899999999998
A151: 3151 | B151: FOZ DO CHAPECÓ | C151: 04.591.168/0001-70 | D151: 21767.669999999998 | E151: 0 | F151: 0 | G151: 0 | H151: 0 | I151: 0 | J151: 0 | K151: 24062.27 | L151: 0 | M151: =SUM(J151:L151)-2294.6 -> 21767.670000000002 | N151: 2294.5999999999999 | O151: =SUM(M151:N151) -> 24062.27
A152: 3152 | B152: EPASA | C152: 10.366.780/0001-41 | D152: 4596.0699999999997 | E152: 0 | F152: 0 | G152: 0 | H152: 0 | I152: 0 | J152: 0 | K152: 5080.5600000000004 | L152: 0 | M152: =SUM(J152:L152)-484.49 -> 4596.0700000000006 | N152: 484.49000000000001 | O152: =SUM(M152:N152) -> 5080.5600000000004
A153: 3153 | B153: UTE SANTA LUZIA I | C153: 08.906.558/0001-42 | D153: 1750.1400000000001 | E153: 0 | F153: 0 | G153: 0 | H153: 0 | I153: 0 | J153: 0 | K153: 1934.6300000000001 | L153: 0 | M153: =SUM(J153:L153)-184.49 -> 1750.1400000000001 | N153: 184.49000000000001 | O153: =SUM(M153:N153) -> 1934.6300000000001
A154: 3155 | B154: UTE BOA VISTA | C154: 24.222.394/0001-90 | D154: 868.55999999999995 | E154: 0 | F154: 0 | G154: 0 | H154: 0 | I154: 0 | J154: 0 | K154: 960.12 | L154: 0 | M154: =SUM(J154:L154)-91.56 -> 868.55999999999995 | N154: 91.560000000000002 | O154: =SUM(M154:N154) -> 960.11999999999989
A155: 3156 | B155: TERNIUM(UTE ATLÂNTICO) | C155: 07.005.330/0001-19 | D155: 4260.6199999999999 | E155: 0 | F155: 0 | G155: 0 | H155: 0 | I155: 0 | J155: 0 | K155: 4709.75 | L155: 0 | M155: =SUM(J155:L155)-449.13 -> 4260.6199999999999 | N155: 449.13 | O155: =SUM(M155:N155) -> 4709.75
A156: 3158 | B156: CEE(CONS. ESTREITO) | C156: 08.976.022/0002-84 | D156: 9558.4099999999999 | E156: 0 | F156: 0 | G156: 0 | H156: 0 | I156: 0 | J156: 0 | K156: 10565.99 | L156: 0 | M156: =SUM(J156:L156)-1007.58 -> 9558.4099999999999 | N156: 1007.58 | O156: =SUM(M156:N156) -> 10565.99
A157: 3159 | B157: ESTREITO PART(CONS. ESTREITO) | C157: 22.686.355/0001-19 | D157: 1059.1300000000001 | E157: 0 | F157: 0 | G157: 0 | H157: 0 | I157: 0 | J157: 0 | K157: 1170.78 | L157: 0 | M157: =SUM(J157:L157)-111.65 -> 1059.1299999999999 | N157: 111.65000000000001 | O157: =SUM(M157:N157) -> 1170.78
A158: 3160 | B158: ESTREITO(CONS. ESTREITO) | C158: 07.089.298/0002-88 | D158: 6080.4499999999998 | E158: 0 | F158: 0 | G158: 0 | H158: 0 | I158: 0 | J158: 0 | K158: 6721.4099999999999 | L158: 0 | M158: =SUM(J158:L158)-640.96 -> 6080.4499999999998 | N158: 640.96000000000004 | O158: =SUM(M158:N158) -> 6721.4099999999999
A159: 3161 | B159: VALE(CONS. ESTREITO) | C159: 33.592.510/0091-00 | D159: 7156.2799999999997 | E159: 0 | F159: 0 | G159: 0 | H159: 0 | I159: 0 | J159: 0 | K159: 7910.6499999999996 | L159: 0 | M159: =SUM(J159:L159)-754.37 -> 7156.2799999999997 | N159: 754.37 | O159: =SUM(M159:N159) -> 7910.6499999999996
A160: 3166 | B160: SJC (UTE QUIRINÓPOLIS) | C160: 10.249.419/0002-16 | D160: 773.55999999999995 | E160: 0 | F160: 0 | G160: 0 | H160: 0 | I160: 0 | J160: 0 | K160: 855.10000000000002 | L160: 0 | M160: =SUM(J160:L160)-81.54 -> 773.56000000000006 | N160: 81.540000000000006 | O160: =SUM(M160:N160) -> 855.10000000000002
A161: 3167 | B161: EOL CERRO CHATO I | C161: 02.016.507/0001-69 | D161: 240.5 | E161: 0 | F161: 0 | G161: 0 | H161: 0 | I161: 0 | J161: 0 | K161: 265.85000000000002 | L161: 0 | M161: =SUM(J161:L161)-25.35 -> 240.50000000000003 | N161: 25.350000000000001 | O161: =SUM(M161:N161) -> 265.85000000000002
A162: 3168 | B162: EOL CERRO CHATO II | C162: 02.016.507/0001-69 | D162: 240.38999999999999 | E162: 0 | F162: 0 | G162: 0 | H162: 0 | I162: 0 | J162: 0 | K162: 265.73000000000002 | L162: 0 | M162: =SUM(J162:L162)-25.34 -> 240.39000000000001 | N162: 25.34 | O162: =SUM(M162:N162) -> 265.73000000000002
A163: 3169 | B163: EOL CERRO CHATO III | C163: 02.016.507/0001-69 | D163: 240.87 | E163: 0 | F163: 0 | G163: 0 | H163: 0 | I163: 0 | J163: 0 | K163: 266.25999999999999 | L163: 0 | M163: =SUM(J163:L163)-25.39 -> 240.87 | N163: 25.390000000000001 | O163: =SUM(M163:N163) -> 266.25999999999999
A164: 3170 | B164: UTE ELDORADO | C164: 05.620.523/0002-35 | D164: 1791.21 | E164: 0 | F164: 0 | G164: 0 | H164: 0 | I164: 0 | J164: 0 | K164: 1980.03 | L164: 0 | M164: =SUM(J164:L164)-188.82 -> 1791.21 | N164: 188.81999999999999 | O164: =SUM(M164:N164) -> 1980.03
A165: 3172 | B165: BAGUARI ENERGIA(CONS. BAGUARI) | C165: 09.568.947/0001-78 | D165: 915.03999999999996 | E165: 0 | F165: 0 | G165: 0 | H165: 0 | I165: 0 | J165: 0 | K165: 1011.5 | L165: 0 | M165: =SUM(J165:L165)-96.46 -> 915.03999999999996 | N165: 96.459999999999994 | O165: =SUM(M165:N165) -> 1011.5
A166: 3173 | B166: UTE PORTO DO PECÉM | C166: 08.976.495/0001-09 | D166: 14345.549999999999 | E166: 0 | F166: 0 | G166: 0 | H166: 0 | I166: 0 | J166: 0 | K166: 15857.76 | L166: 0 | M166: =SUM(J166:L166)-1512.21 -> 14345.549999999999 | N166: 1512.21 | O166: =SUM(M166:N166) -> 15857.759999999998
A167: 3174 | B167: AGUAS DA PEDRA(UHE DARNANELOS) | C167: 08.768.414/0001-77 | D167: 7341.4200000000001 | E167: 0 | F167: 0 | G167: 0 | H167: 0 | I167: 0 | J167: 0 | K167: 8115.3000000000002 | L167: 0 | M167: =SUM(J167:L167)-773.88 -> 7341.4200000000001 | N167: 773.88 | O167: =SUM(M167:N167) -> 8115.3000000000002
A168: 3175 | B168: UTE BERNECK | C168: 81.905.176/0001-94 | D168: 130.59 | E168: 0 | F168: 0 | G168: 0 | H168: 0 | I168: 0 | J168: 0 | K168: 144.36000000000001 | L168: 0 | M168: =SUM(J168:L168)-13.77 -> 130.59 | N168: 13.77 | O168: =SUM(M168:N168) -> 144.36000000000001
A169: 3176 | B169: PORTO DO ITAQUI | C169: 08.219.477/0001-74 | D169: 6835.21 | E169: 0 | F169: 0 | G169: 0 | H169: 0 | I169: 0 | J169: 0 | K169: 7555.7299999999996 | L169: 0 | M169: =SUM(J169:L169)-720.52 -> 6835.2099999999991 | N169: 720.51999999999998 | O169: =SUM(M169:N169) -> 7555.7299999999996
A170: 3177 | B170: CERRADINHO(UTE PORTO DAS AGUAS) | C170: 08.322.396/0001-03 | D170: 4103.8500000000004 | E170: 0 | F170: 0 | G170: 0 | H170: 0 | I170: 0 | J170: 0 | K170: 4536.4499999999998 | L170: 0 | M170: =SUM(J170:L170)-432.6 -> 4103.8499999999995 | N170: 432.60000000000002 | O170: =SUM(M170:N170) -> 4536.4499999999998
A171: 3178 | B171: UTE COSTA RICA | C171: 08.070.566/0016-88 | D171: 909.25999999999999 | E171: 0 | F171: 0 | G171: 0 | H171: 0 | I171: 0 | J171: 0 | K171: 1005.11 | L171: 0 | M171: =SUM(J171:L171)-95.85 -> 909.25999999999999 | N171: 95.849999999999994 | O171: =SUM(M171:N171) -> 1005.11
A172: 3179 | B172: UTE NARDINI | C172: 48.708.267/0015-60 | D172: 598.94000000000005 | E172: 0 | F172: 0 | G172: 0 | H172: 0 | I172: 0 | J172: 0 | K172: 662.08000000000004 | L172: 0 | M172: =SUM(J172:L172)-63.14 -> 598.94000000000005 | N172: 63.140000000000001 | O172: =SUM(M172:N172) -> 662.08000000000004
A173: 3181 | B173: CEPASA(UTE PALMEIRAS DE GOIÁS) | C173: 13.348.048/0001-37 | D173: 3541.8699999999999 | E173: 0 | F173: 0 | G173: 0 | H173: 0 | I173: 0 | J173: 0 | K173: 3915.23 | L173: 0 | M173: =SUM(J173:L173)-373.36 -> 3541.8699999999999 | N173: 373.36000000000001 | O173: =SUM(M173:N173) -> 3915.23
A174: 3182 | B174: NEW ENERGY(EOL ALEGRIA I) | C174: 04.245.220/0002-17 | D174: 1023.78 | E174: 0 | F174: 0 | G174: 0 | H174: 0 | I174: 0 | J174: 0 | K174: 1131.7 | L174: 0 | M174: =SUM(J174:L174)-107.92 -> 1023.7800000000001 | N174: 107.92 | O174: =SUM(M174:N174) -> 1131.7
A175: 3183 | B175: SAESA(UHE SANTO ANTÔNIO) | C175: 09.391.823/0002-40 | D175: 149666.04000000001 | E175: 0 | F175: 0 | G175: 0 | H175: 0 | I175: 0 | J175: 0 | K175: 165442.79999999999 | L175: 0 | M175: =SUM(J175:L175)-15776.76 -> 149666.03999999998 | N175: 15776.76 | O175: =SUM(M175:N175) -> 165442.79999999999
A176: 3184 | B176: EMPA(PCH INDAIAZINHO) | C176: 11.254.582/0002-30 | D176: 142.03 | E176: 0 | F176: 0 | G176: 0 | H176: 0 | I176: 0 | J176: 0 | K176: 157 | L176: 0 | M176: =SUM(J176:L176)-14.97 -> 142.03 | N176: 14.970000000000001 | O176: =SUM(M176:N176) -> 157
A177: 3185 | B177: EMPA(PCH INDAIÁ GRANDE) | C177: 10.400.065/0002-69 | D177: 227.31999999999999 | E177: 0 | F177: 0 | G177: 0 | H177: 0 | I177: 0 | J177: 0 | K177: 251.28 | L177: 0 | M177: =SUM(J177:L177)-23.96 -> 227.31999999999999 | N177: 23.960000000000001 | O177: =SUM(M177:N177) -> 251.28
A178: 3186 | B178: NEW ENERGY(EOL ALEGRIA II) | C178: 04.245.220/0002-17 | D178: 2011.1500000000001 | E178: 0 | F178: 0 | G178: 0 | H178: 0 | I178: 0 | J178: 0 | K178: 2223.1500000000001 | L178: 0 | M178: =SUM(J178:L178)-212 -> 2011.1500000000001 | N178: 212 | O178: =SUM(M178:N178) -> 2223.1500000000001
A179: 3187 | B179: VENTOS DA LAGOA(EOL SANGR.2-3) | C179: 11.603.076/0002-09 | D179: 412.91000000000003 | E179: 0 | F179: 0 | G179: 0 | H179: 0 | I179: 0 | J179: 0 | K179: 456.44 | L179: 0 | M179: =SUM(J179:L179)-43.53 -> 412.90999999999997 | N179: 43.530000000000001 | O179: =SUM(M179:N179) -> 456.43999999999994
A180: 3192 | B180: EOL MACAUBAS | C180: 09.194.393/0002-77 | D180: 348 | E180: 0 | F180: 0 | G180: 0 | H180: 0 | I180: 0 | J180: 0 | K180: 384.68000000000001 | L180: 0 | M180: =SUM(J180:L180)-36.68 -> 348 | N180: 36.68 | O180: =SUM(M180:N180) -> 384.68000000000001
A181: 3193 | B181: EOL N. HORIZONTE | C181: 09.214.349/0002-81 | D181: 348 | E181: 0 | F181: 0 | G181: 0 | H181: 0 | I181: 0 | J181: 0 | K181: 384.68000000000001 | L181: 0 | M181: =SUM(J181:L181)-36.68 -> 348 | N181: 36.68 | O181: =SUM(M181:N181) -> 384.68000000000001
A182: 3194 | B182: EOL SEABRA | C182: 09.196.341/0002-30 | D182: 348 | E182: 0 | F182: 0 | G182: 0 | H182: 0 | I182: 0 | J182: 0 | K182: 384.68000000000001 | L182: 0 | M182: =SUM(J182:L182)-36.68 -> 348 | N182: 36.68 | O182: =SUM(M182:N182) -> 384.68000000000001
A183: 3195 | B183: PCH PEZZI | C183: 09.199.579/0002-19 | D183: 140.36000000000001 | E183: 0 | F183: 0 | G183: 0 | H183: 0 | I183: 0 | J183: 0 | K183: 155.16 | L183: 0 | M183: =SUM(J183:L183)-14.8 -> 140.35999999999999 | N183: 14.800000000000001 | O183: =SUM(M183:N183) -> 155.16
A184: 3196 | B184: CPFL (EOL SANTA CLARA I) | C184: 10.797.899/0002-50 | D184: 328.43000000000001 | E184: 0 | F184: 0 | G184: 0 | H184: 0 | I184: 0 | J184: 0 | K184: 363.05000000000001 | L184: 0 | M184: =SUM(J184:L184)-34.62 -> 328.43000000000001 | N184: 34.619999999999997 | O184: =SUM(M184:N184) -> 363.05000000000001
A185: 3197 | B185: CPFL (EOL SANTA CLARA II) | C185: 10.797.908/0002-02 | D185: 328.43000000000001 | E185: 0 | F185: 0 | G185: 0 | H185: 0 | I185: 0 | J185: 0 | K185: 363.05000000000001 | L185: 0 | M185: =SUM(J185:L185)-34.62 -> 328.43000000000001 | N185: 34.619999999999997 | O185: =SUM(M185:N185) -> 363.05000000000001
A186: 3198 | B186: CPFL (EOL SANTA CLARA III) | C186: 10.797.910/0002-81 | D186: 329.45999999999998 | E186: 0 | F186: 0 | G186: 0 | H186: 0 | I186: 0 | J186: 0 | K186: 364.19 | L186: 0 | M186: =SUM(J186:L186)-34.73 -> 329.45999999999998 | N186: 34.729999999999997 | O186: =SUM(M186:N186) -> 364.19
A187: 3199 | B187: CPFL (EOL SANTA CLARA IV) | C187: 10.797.907/0002-68 | D187: 328.43000000000001 | E187: 0 | F187: 0 | G187: 0 | H187: 0 | I187: 0 | J187: 0 | K187: 363.05000000000001 | L187: 0 | M187: =SUM(J187:L187)-34.62 -> 328.43000000000001 | N187: 34.619999999999997 | O187: =SUM(M187:N187) -> 363.05000000000001
A188: 3200 | B188: CPFL (EOL SANTA CLARA V) | C188: 10.797.909/0002-57 | D188: 328.43000000000001 | E188: 0 | F188: 0 | G188: 0 | H188: 0 | I188: 0 | J188: 0 | K188: 363.05000000000001 | L188: 0 | M188: =SUM(J188:L188)-34.62 -> 328.43000000000001 | N188: 34.619999999999997 | O188: =SUM(M188:N188) -> 363.05000000000001
A189: 3201 | B189: CPFL (EOL SANTA CLARA VI) | C189: 10.797.906/0002-13 | D189: 328.43000000000001 | E189: 0 | F189: 0 | G189: 0 | H189: 0 | I189: 0 | J189: 0 | K189: 363.05000000000001 | L189: 0 | M189: =SUM(J189:L189)-34.62 -> 328.43000000000001 | N189: 34.619999999999997 | O189: =SUM(M189:N189) -> 363.05000000000001
A190: 3202 | B190: CPFL (EOL EURUS VI) | C190: 10.797.905/0002-79 | D190: 87.590000000000003 | E190: 0 | F190: 0 | G190: 0 | H190: 0 | I190: 0 | J190: 0 | K190: 96.819999999999993 | L190: 0 | M190: =SUM(J190:L190)-9.23 -> 87.589999999999989 | N190: 9.2300000000000004 | O190: =SUM(M190:N190) -> 96.819999999999993
A191: 3203 | B191: EOL ALVORADA | C191: 11.349.807/0001-50 | D191: 90.269999999999996 | E191: 0 | F191: 0 | G191: 0 | H191: 0 | I191: 0 | J191: 0 | K191: 99.790000000000006 | L191: 0 | M191: =SUM(J191:L191)-9.52 -> 90.27000000000001 | N191: 9.5199999999999996 | O191: =SUM(M191:N191) -> 99.790000000000006
A192: 3204 | B192: EOL CANDIBA | C192: 11.349.756/0001-67 | D192: 113.73999999999999 | E192: 0 | F192: 0 | G192: 0 | H192: 0 | I192: 0 | J192: 0 | K192: 125.73 | L192: 0 | M192: =SUM(J192:L192)-11.99 -> 113.74000000000001 | N192: 11.99 | O192: =SUM(M192:N192) -> 125.73
A193: 3205 | B193: EOL GUANAMBI | C193: 11.350.499/0001-83 | D193: 246.43000000000001 | E193: 0 | F193: 0 | G193: 0 | H193: 0 | I193: 0 | J193: 0 | K193: 272.41000000000003 | L193: 0 | M193: =SUM(J193:L193)-25.98 -> 246.43000000000004 | N193: 25.98 | O193: =SUM(M193:N193) -> 272.41000000000003
A194: 3206 | B194: EOL GUIRAPÁ | C194: 11.345.796/0001-30 | D194: 338.5 | E194: 0 | F194: 0 | G194: 0 | H194: 0 | I194: 0 | J194: 0 | K194: 374.18000000000001 | L194: 0 | M194: =SUM(J194:L194)-35.68 -> 338.5 | N194: 35.68 | O194: =SUM(M194:N194) -> 374.18000000000001
A195: 3207 | B195: EOL IGAPORÃ | C195: 11.366.011/0001-06 | D195: 338.5 | E195: 0 | F195: 0 | G195: 0 | H195: 0 | I195: 0 | J195: 0 | K195: 374.18000000000001 | L195: 0 | M195: =SUM(J195:L195)-35.68 -> 338.5 | N195: 35.68 | O195: =SUM(M195:N195) -> 374.18000000000001
A196: 3208 | B196: EOL ILHEUS | C196: 11.366.468/0001-10 | D196: 132.69 | E196: 0 | F196: 0 | G196: 0 | H196: 0 | I196: 0 | J196: 0 | K196: 146.68000000000001 | L196: 0 | M196: =SUM(J196:L196)-13.99 -> 132.69 | N196: 13.99 | O196: =SUM(M196:N196) -> 146.68000000000001
A197: 3209 | B197: EOL PAJEÚ DO VENTO | C197: 11.365.985/0001-75 | D197: 303.30000000000001 | E197: 0 | F197: 0 | G197: 0 | H197: 0 | I197: 0 | J197: 0 | K197: 335.26999999999998 | L197: 0 | M197: =SUM(J197:L197)-31.97 -> 303.29999999999995 | N197: 31.969999999999999 | O197: =SUM(M197:N197) -> 335.26999999999998
A198: 3210 | B198: EOL PINDAÍ | C198: 11.350.542/0001-00 | D198: 284.33999999999997 | E198: 0 | F198: 0 | G198: 0 | H198: 0 | I198: 0 | J198: 0 | K198: 314.31 | L198: 0 | M198: =SUM(J198:L198)-29.97 -> 284.34000000000003 | N198: 29.969999999999999 | O198: =SUM(M198:N198) -> 314.31000000000006
A199: 3211 | B199: EOL PORTO SEGURO | C199: 11.366.056/0001-80 | D199: 75.819999999999993 | E199: 0 | F199: 0 | G199: 0 | H199: 0 | I199: 0 | J199: 0 | K199: 83.810000000000002 | L199: 0 | M199: =SUM(J199:L199)-7.99 -> 75.820000000000007 | N199: 7.9900000000000002 | O199: =SUM(M199:N199) -> 83.810000000000002
A200: 3212 | B200: EOL RIO VERDE | C200: 11.350.476/0001-79 | D200: 338.5 | E200: 0 | F200: 0 | G200: 0 | H200: 0 | I200: 0 | J200: 0 | K200: 374.18000000000001 | L200: 0 | M200: =SUM(J200:L200)-35.68 -> 338.5 | N200: 35.68 | O200: =SUM(M200:N200) -> 374.18000000000001
A201: 3213 | B201: EOL SERRA DO SALTO | C201: 11.349.836/0001-12 | D201: 227.47 | E201: 0 | F201: 0 | G201: 0 | H201: 0 | I201: 0 | J201: 0 | K201: 251.44999999999999 | L201: 0 | M201: =SUM(J201:L201)-23.98 -> 227.47 | N201: 23.98 | O201: =SUM(M201:N201) -> 251.44999999999999
A202: 3215 | B202: EOL PLANALTINA | C202: 11.363.327/0001-44 | D202: 322.25999999999999 | E202: 0 | F202: 0 | G202: 0 | H202: 0 | I202: 0 | J202: 0 | K202: 356.23000000000002 | L202: 0 | M202: =SUM(J202:L202)-33.97 -> 322.25999999999999 | N202: 33.969999999999999 | O202: =SUM(M202:N202) -> 356.23000000000002
A203: 3216 | B203: EOL LICÍNIO DE ALMEIDA | C203: 11.349.904/0001-43 | D203: 284.33999999999997 | E203: 0 | F203: 0 | G203: 0 | H203: 0 | I203: 0 | J203: 0 | K203: 314.31 | L203: 0 | M203: =SUM(J203:L203)-29.97 -> 284.34000000000003 | N203: 29.969999999999999 | O203: =SUM(M203:N203) -> 314.31000000000006
A204: 3217 | B204: EOL N.S. DA CONCEIÇÃO | C204: 11.371.340/0001-45 | D204: 338.5 | E204: 0 | F204: 0 | G204: 0 | H204: 0 | I204: 0 | J204: 0 | K204: 374.18000000000001 | L204: 0 | M204: =SUM(J204:L204)-35.68 -> 338.5 | N204: 35.68 | O204: =SUM(M204:N204) -> 374.18000000000001
A205: 3219 | B205: DESA (EOL MORRO DOS VENTOS I) | C205: 11.686.050/0001-90 | D205: 313.38 | E205: 0 | F205: 0 | G205: 0 | H205: 0 | I205: 0 | J205: 0 | K205: 346.41000000000003 | L205: 0 | M205: =SUM(J205:L205)-33.03 -> 313.38 | N205: 33.030000000000001 | O205: =SUM(M205:N205) -> 346.40999999999997
A206: 3220 | B206: DESA (EOL MORRO DOS VENTOS III) | C206: 11.686.100/0001-30 | D206: 316.75 | E206: 0 | F206: 0 | G206: 0 | H206: 0 | I206: 0 | J206: 0 | K206: 350.13999999999999 | L206: 0 | M206: =SUM(J206:L206)-33.39 -> 316.75 | N206: 33.390000000000001 | O206: =SUM(M206:N206) -> 350.13999999999999
A207: 3221 | B207: DESA (EOL MORRO DOS VENTOS IV) | C207: 11.686.202/0001-55 | D207: 316.75 | E207: 0 | F207: 0 | G207: 0 | H207: 0 | I207: 0 | J207: 0 | K207: 350.13999999999999 | L207: 0 | M207: =SUM(J207:L207)-33.39 -> 316.75 | N207: 33.390000000000001 | O207: =SUM(M207:N207) -> 350.13999999999999
A208: 3222 | B208: DESA (EOL MORRO DOS VENTOS IX) | C208: 11.686.103/0001-73 | D208: 322.36000000000001 | E208: 0 | F208: 0 | G208: 0 | H208: 0 | I208: 0 | J208: 0 | K208: 356.33999999999997 | L208: 0 | M208: =SUM(J208:L208)-33.98 -> 322.35999999999996 | N208: 33.979999999999997 | O208: =SUM(M208:N208) -> 356.33999999999997
A209: 3223 | B209: DESA (EOL MORRO DOS VENTOS VI) | C209: 11.686.150/0001-17 | D209: 307.75999999999999 | E209: 0 | F209: 0 | G209: 0 | H209: 0 | I209: 0 | J209: 0 | K209: 340.19999999999999 | L209: 0 | M209: =SUM(J209:L209)-32.44 -> 307.75999999999999 | N209: 32.439999999999998 | O209: =SUM(M209:N209) -> 340.19999999999999
A210: 3224 | B210: COPEL (GJC) | C210: 04.370.282/0001-70 | D210: 2891.8699999999999 | E210: 0 | F210: 0 | G210: 0 | H210: 0 | I210: 0 | J210: 0 | K210: 3196.71 | L210: 0 | M210: =SUM(J210:L210)-304.84 -> 2891.8699999999999 | N210: 304.83999999999997 | O210: =SUM(M210:N210) -> 3196.71
A211: 3225 | B211: CGT ELETROSUL (GJC) | C211: 02.016.507/0001-69 | D211: 2778.46 | E211: 0 | F211: 0 | G211: 0 | H211: 0 | I211: 0 | J211: 0 | K211: 3071.3499999999999 | L211: 0 | M211: =SUM(J211:L211)-292.89 -> 2778.46 | N211: 292.88999999999999 | O211: =SUM(M211:N211) -> 3071.3499999999999
A212: 3226 | B212: PCH SERRA DOS CAVALINHOS II | C212: 09.199.572/0002-05 | D212: 214.27000000000001 | E212: 0 | F212: 0 | G212: 0 | H212: 0 | I212: 0 | J212: 0 | K212: 236.86000000000001 | L212: 0 | M212: =SUM(J212:L212)-22.59 -> 214.27000000000001 | N212: 22.59 | O212: =SUM(M212:N212) -> 236.86000000000001
A213: 3227 | B213: VENTOS DO LITORAL(OSORIO 2-3) | C213: 11.627.075/0002-02 | D213: 408.66000000000003 | E213: 0 | F213: 0 | G213: 0 | H213: 0 | I213: 0 | J213: 0 | K213: 451.74000000000001 | L213: 0 | M213: =SUM(J213:L213)-43.08 -> 408.66000000000003 | N213: 43.079999999999998 | O213: =SUM(M213:N213) -> 451.74000000000001
A214: 3228 | B214: PECEM II | C214: 10.471.487/0001-44 | D214: 6950.6899999999996 | E214: 0 | F214: 0 | G214: 0 | H214: 0 | I214: 0 | J214: 0 | K214: 7683.3800000000001 | L214: 0 | M214: =SUM(J214:L214)-732.69 -> 6950.6900000000005 | N214: 732.69000000000005 | O214: =SUM(M214:N214) -> 7683.380000000001
A215: 3229 | B215: UTE SUAPE II | C215: 09.373.678/0003-56 | D215: 6691.9300000000003 | E215: 0 | F215: 0 | G215: 0 | H215: 0 | I215: 0 | J215: 0 | K215: 7397.3500000000004 | L215: 0 | M215: =SUM(J215:L215)-705.42 -> 6691.9300000000003 | N215: 705.41999999999996 | O215: =SUM(M215:N215) -> 7397.3500000000004
A216: 3230 | B216: UTE AGUA EMENDADA | C216: 08.070.566/0011-73 | D216: 830.75 | E216: 0 | F216: 0 | G216: 0 | H216: 0 | I216: 0 | J216: 0 | K216: 918.32000000000005 | L216: 0 | M216: =SUM(J216:L216)-87.57 -> 830.75 | N216: 87.569999999999993 | O216: =SUM(M216:N216) -> 918.31999999999994
A217: 3231 | B217: UTE MORRO VERMELHO | C217: 08.070.566/0012-54 | D217: 921.12 | E217: 0 | F217: 0 | G217: 0 | H217: 0 | I217: 0 | J217: 0 | K217: 1018.22 | L217: 0 | M217: =SUM(J217:L217)-97.1 -> 921.12 | N217: 97.099999999999994 | O217: =SUM(M217:N217) -> 1018.22
A218: 3232 | B218: PARNAÍBA(UTE MARANHÃO IV e V) | C218: 15.743.303/0001-71 | D218: 13033.49 | E218: 0 | F218: 0 | G218: 0 | H218: 0 | I218: 0 | J218: 0 | K218: 14407.389999999999 | L218: 0 | M218: =SUM(J218:L218)-1373.9 -> 13033.49 | N218: 1373.9000000000001 | O218: =SUM(M218:N218) -> 14407.389999999999
A219: 3234 | B219: EOL SETE GAMELEIRAS | C219: 12.710.327/0002-17 | D219: 337.44 | E219: 0 | F219: 0 | G219: 0 | H219: 0 | I219: 0 | J219: 0 | K219: 373.00999999999999 | L219: 0 | M219: =SUM(J219:L219)-35.57 -> 337.44 | N219: 35.57 | O219: =SUM(M219:N219) -> 373.00999999999999
A220: 3235 | B220: EOL SÃO PEDRO DO LAGO | C220: 12.709.813/0002-15 | D220: 346.08999999999997 | E220: 0 | F220: 0 | G220: 0 | H220: 0 | I220: 0 | J220: 0 | K220: 382.56999999999999 | L220: 0 | M220: =SUM(J220:L220)-36.48 -> 346.08999999999997 | N220: 36.479999999999997 | O220: =SUM(M220:N220) -> 382.56999999999999
A221: 3236 | B221: EOL PEDRA BRANCA | C221: 12.709.996/0002-79 | D221: 337.44 | E221: 0 | F221: 0 | G221: 0 | H221: 0 | I221: 0 | J221: 0 | K221: 373.00999999999999 | L221: 0 | M221: =SUM(J221:L221)-35.57 -> 337.44 | N221: 35.57 | O221: =SUM(M221:N221) -> 373.00999999999999
A222: 3237 | B222: COSAN (UTE JATAI) | C222: 18.686.104/0001-67 | D222: 3615.9000000000001 | E222: 0 | F222: 0 | G222: 0 | H222: 0 | I222: 0 | J222: 0 | K222: 3997.0599999999999 | L222: 0 | M222: =SUM(J222:L222)-381.16 -> 3615.9000000000001 | N222: 381.16000000000003 | O222: =SUM(M222:N222) -> 3997.0599999999999
A223: 3239 | B223: ENERGIMP (EOL BURITI) | C223: 11.646.785/0001-90 | D223: 294.82999999999998 | E223: 0 | F223: 0 | G223: 0 | H223: 0 | I223: 0 | J223: 0 | K223: 325.91000000000003 | L223: 0 | M223: =SUM(J223:L223)-31.08 -> 294.83000000000004 | N223: 31.079999999999998 | O223: =SUM(M223:N223) -> 325.91000000000003
A224: 3240 | B224: ENERGIMP (EOL CAJUCOCO) | C224: 11.646.760/0001-97 | D224: 295.52999999999997 | E224: 0 | F224: 0 | G224: 0 | H224: 0 | I224: 0 | J224: 0 | K224: 326.68000000000001 | L224: 0 | M224: =SUM(J224:L224)-31.15 -> 295.53000000000003 | N224: 31.149999999999999 | O224: =SUM(M224:N224) -> 326.68000000000001
A225: 3242 | B225: EOL ICARAÍ I | C225: 11.476.987/0001-31 | D225: 255.53999999999999 | E225: 0 | F225: 0 | G225: 0 | H225: 0 | I225: 0 | J225: 0 | K225: 282.48000000000002 | L225: 0 | M225: =SUM(J225:L225)-26.94 -> 255.54000000000002 | N225: 26.940000000000001 | O225: =SUM(M225:N225) -> 282.48000000000002
A226: 3243 | B226: EOL ICARAÍ II | C226: 11.477.001/0001-48 | D226: 708.47000000000003 | E226: 0 | F226: 0 | G226: 0 | H226: 0 | I226: 0 | J226: 0 | K226: 783.14999999999998 | L226: 0 | M226: =SUM(J226:L226)-74.68 -> 708.47000000000003 | N226: 74.680000000000007 | O226: =SUM(M226:N226) -> 783.15000000000009
A227: 3244 | B227: UTE PERNAMBUCO III | C227: 10.502.676/0001-37 | D227: 3469.1999999999998 | E227: 0 | F227: 0 | G227: 0 | H227: 0 | I227: 0 | J227: 0 | K227: 3834.9000000000001 | L227: 0 | M227: =SUM(J227:L227)-365.7 -> 3469.2000000000003 | N227: 365.69999999999999 | O227: =SUM(M227:N227) -> 3834.9000000000001
A228: 3245 | B228: ENERGIMP (EOL COQUEIRO) | C228: 11.646.832/0001-04 | D228: 265.47000000000003 | E228: 0 | F228: 0 | G228: 0 | H228: 0 | I228: 0 | J228: 0 | K228: 293.44999999999999 | L228: 0 | M228: =SUM(J228:L228)-27.98 -> 265.46999999999997 | N228: 27.98 | O228: =SUM(M228:N228) -> 293.44999999999999
A229: 3249 | B229: ADECOAGRO(UTE AMANDINA) | C229: 07.903.169/0017-68 | D229: 686.25999999999999 | E229: 0 | F229: 0 | G229: 0 | H229: 0 | I229: 0 | J229: 0 | K229: 758.60000000000002 | L229: 0 | M229: =SUM(J229:L229)-72.34 -> 686.25999999999999 | N229: 72.340000000000003 | O229: =SUM(M229:N229) -> 758.60000000000002
A230: 3250 | B230: UTE ALTO TAQUARI | C230: 08.070.566/0017-69 | D230: 789.52999999999997 | E230: 0 | F230: 0 | G230: 0 | H230: 0 | I230: 0 | J230: 0 | K230: 872.75999999999999 | L230: 0 | M230: =SUM(J230:L230)-83.23 -> 789.52999999999997 | N230: 83.230000000000004 | O230: =SUM(M230:N230) -> 872.75999999999999
A231: 3251 | B231: EOL CAETITE 2 | C231: 12.106.989/0002-82 | D231: 332.41000000000003 | E231: 0 | F231: 0 | G231: 0 | H231: 0 | I231: 0 | J231: 0 | K231: 367.44999999999999 | L231: 0 | M231: =SUM(J231:L231)-35.04 -> 332.40999999999997 | N231: 35.039999999999999 | O231: =SUM(M231:N231) -> 367.44999999999999
A232: 3252 | B232: EOL CAETITE 3 | C232: 12.106.879/0002-10 | D232: 330.07999999999998 | E232: 0 | F232: 0 | G232: 0 | H232: 0 | I232: 0 | J232: 0 | K232: 364.87 | L232: 0 | M232: =SUM(J232:L232)-34.79 -> 330.07999999999998 | N232: 34.789999999999999 | O232: =SUM(M232:N232) -> 364.87
A233: 3258 | B233: EOL ATLANTICA I | C233: 12.773.558/0002-70 | D233: 212.63999999999999 | E233: 0 | F233: 0 | G233: 0 | H233: 0 | I233: 0 | J233: 0 | K233: 235.06 | L233: 0 | M233: =SUM(J233:L233)-22.42 -> 212.63999999999999 | N233: 22.420000000000002 | O233: =SUM(M233:N233) -> 235.06
A234: 3259 | B234: EOL ATLANTICA II | C234: 12.963.869/0002-00 | D234: 212.63999999999999 | E234: 0 | F234: 0 | G234: 0 | H234: 0 | I234: 0 | J234: 0 | K234: 235.06 | L234: 0 | M234: =SUM(J234:L234)-22.42 -> 212.63999999999999 | N234: 22.420000000000002 | O234: =SUM(M234:N234) -> 235.06
A235: 3260 | B235: EOL ATLANTICA IV | C235: 12.981.225/0002-36 | D235: 212.63999999999999 | E235: 0 | F235: 0 | G235: 0 | H235: 0 | I235: 0 | J235: 0 | K235: 235.06 | L235: 0 | M235: =SUM(J235:L235)-22.42 -> 212.63999999999999 | N235: 22.420000000000002 | O235: =SUM(M235:N235) -> 235.06
A236: 3261 | B236: EOL ATLANTICA V | C236: 12.864.421/0002-20 | D236: 215.55000000000001 | E236: 0 | F236: 0 | G236: 0 | H236: 0 | I236: 0 | J236: 0 | K236: 238.27000000000001 | L236: 0 | M236: =SUM(J236:L236)-22.72 -> 215.55000000000001 | N236: 22.719999999999999 | O236: =SUM(M236:N236) -> 238.27000000000001
A237: 3262 | B237: BRASVENTOS (EOL MIASSABA III) | C237: 11.839.616/0001-77 | D237: 1516.8099999999999 | E237: 0 | F237: 0 | G237: 0 | H237: 0 | I237: 0 | J237: 0 | K237: 1676.7 | L237: 0 | M237: =SUM(J237:L237)-159.89 -> 1516.8099999999999 | N237: 159.88999999999999 | O237: =SUM(M237:N237) -> 1676.6999999999998
A238: 3263 | B238: ESBR (UHE JIRAU) | C238: 09.029.666/0004-90 | D238: 161377.75 | E238: 0 | F238: 0 | G238: 0 | H238: 0 | I238: 0 | J238: 0 | K238: 178389.07999999999 | L238: 0 | M238: =SUM(J238:L238)-17011.33 -> 161377.75 | N238: 17011.330000000002 | O238: =SUM(M238:N238) -> 178389.08000000002
A239: 3264 | B239: UTE SUZANO | C239: 16.404.287/0222-05 | D239: 1721.8299999999999 | E239: 0 | F239: 0 | G239: 0 | H239: 0 | I239: 0 | J239: 0 | K239: 1903.3299999999999 | L239: 0 | M239: =SUM(J239:L239)-181.5 -> 1721.8299999999999 | N239: 181.5 | O239: =SUM(M239:N239) -> 1903.3299999999999
A240: 3265 | B240: EOL REI DOS VENTOS 3 | C240: 11.637.104/0001-28 | D240: 1331.8299999999999 | E240: 0 | F240: 0 | G240: 0 | H240: 0 | I240: 0 | J240: 0 | K240: 1472.22 | L240: 0 | M240: =SUM(J240:L240)-140.39 -> 1331.8299999999999 | N240: 140.38999999999999 | O240: =SUM(M240:N240) -> 1472.2199999999998
A241: 3266 | B241: RIO CANOAS (UHE GARIBALDI) | C241: 11.316.814/0001-56 | D241: 2602.6599999999999 | E241: 0 | F241: 0 | G241: 0 | H241: 0 | I241: 0 | J241: 0 | K241: 2877.0100000000002 | L241: 0 | M241: =SUM(J241:L241)-274.35 -> 2602.6600000000003 | N241: 274.35000000000002 | O241: =SUM(M241:N241) -> 2877.0100000000002
A242: 3267 | B242: EOL REI DOS VENTOS 1 | C242: 11.637.090/0001-42 | D242: 1294.8399999999999 | E242: 0 | F242: 0 | G242: 0 | H242: 0 | I242: 0 | J242: 0 | K242: 1431.3299999999999 | L242: 0 | M242: =SUM(J242:L242)-136.49 -> 1294.8399999999999 | N242: 136.49000000000001 | O242: =SUM(M242:N242) -> 1431.3299999999999
A243: 3268 | B243: EOL DREEN OLHO DAGUA | C243: 12.723.444/0001-34 | D243: 332.08999999999997 | E243: 0 | F243: 0 | G243: 0 | H243: 0 | I243: 0 | J243: 0 | K243: 367.10000000000002 | L243: 0 | M243: =SUM(J243:L243)-35.01 -> 332.09000000000003 | N243: 35.009999999999998 | O243: =SUM(M243:N243) -> 367.10000000000002
A244: 3269 | B244: EOL DREEN BOA VISTA | C244: 12.723.413/0001-83 | D244: 155.47999999999999 | E244: 0 | F244: 0 | G244: 0 | H244: 0 | I244: 0 | J244: 0 | K244: 171.87 | L244: 0 | M244: =SUM(J244:L244)-16.39 -> 155.48000000000002 | N244: 16.390000000000001 | O244: =SUM(M244:N244) -> 171.87
A245: 3270 | B245: EOL ASA BRANCA IV | C245: 11.681.456/0002-61 | D245: 334.63 | E245: 0 | F245: 0 | G245: 0 | H245: 0 | I245: 0 | J245: 0 | K245: 369.89999999999998 | L245: 0 | M245: =SUM(J245:L245)-35.27 -> 334.63 | N245: 35.270000000000003 | O245: =SUM(M245:N245) -> 369.89999999999998
A246: 3271 | B246: EOL ASA BRANCA VI | C246: 11.694.617/0002-51 | D246: 334.63 | E246: 0 | F246: 0 | G246: 0 | H246: 0 | I246: 0 | J246: 0 | K246: 369.89999999999998 | L246: 0 | M246: =SUM(J246:L246)-35.27 -> 334.63 | N246: 35.270000000000003 | O246: =SUM(M246:N246) -> 369.89999999999998
A247: 3272 | B247: EOL ASA BRANCA VIII | C247: 11.694.621/0002-10 | D247: 334.63 | E247: 0 | F247: 0 | G247: 0 | H247: 0 | I247: 0 | J247: 0 | K247: 369.89999999999998 | L247: 0 | M247: =SUM(J247:L247)-35.27 -> 334.63 | N247: 35.270000000000003 | O247: =SUM(M247:N247) -> 369.89999999999998
A248: 3273 | B248: EOL CALANGO 1 | C248: 12.106.898/0002-47 | D248: 298.60000000000002 | E248: 0 | F248: 0 | G248: 0 | H248: 0 | I248: 0 | J248: 0 | K248: 330.07999999999998 | L248: 0 | M248: =SUM(J248:L248)-31.48 -> 298.59999999999997 | N248: 31.48 | O248: =SUM(M248:N248) -> 330.07999999999998
A249: 3274 | B249: EOL CALANGO 2 | C249: 12.107.047/0002-19 | D249: 298.91000000000003 | E249: 0 | F249: 0 | G249: 0 | H249: 0 | I249: 0 | J249: 0 | K249: 330.42000000000002 | L249: 0 | M249: =SUM(J249:L249)-31.51 -> 298.91000000000003 | N249: 31.510000000000002 | O249: =SUM(M249:N249) -> 330.42000000000002
A250: 3275 | B250: EOL CALANGO 3 | C250: 12.106.962/0002-90 | D250: 299.50999999999999 | E250: 0 | F250: 0 | G250: 0 | H250: 0 | I250: 0 | J250: 0 | K250: 331.07999999999998 | L250: 0 | M250: =SUM(J250:L250)-31.57 -> 299.50999999999999 | N250: 31.57 | O250: =SUM(M250:N250) -> 331.07999999999998
A251: 3276 | B251: EOL CALANGO 4 | C251: 12.106.862/0002-63 | D251: 297.27999999999997 | E251: 0 | F251: 0 | G251: 0 | H251: 0 | I251: 0 | J251: 0 | K251: 328.62 | L251: 0 | M251: =SUM(J251:L251)-31.34 -> 297.28000000000003 | N251: 31.34 | O251: =SUM(M251:N251) -> 328.62
A252: 3277 | B252: EOL CALANGO 5 | C252: 12.159.338/0002-50 | D252: 296.77999999999997 | E252: 0 | F252: 0 | G252: 0 | H252: 0 | I252: 0 | J252: 0 | K252: 328.06 | L252: 0 | M252: =SUM(J252:L252)-31.28 -> 296.77999999999997 | N252: 31.280000000000001 | O252: =SUM(M252:N252) -> 328.05999999999995
A253: 3278 | B253: EOL RENASCENÇA I | C253: 12.831.777/0002-68 | D253: 331.27999999999997 | E253: 0 | F253: 0 | G253: 0 | H253: 0 | I253: 0 | J253: 0 | K253: 366.19999999999999 | L253: 0 | M253: =SUM(J253:L253)-34.92 -> 331.27999999999997 | N253: 34.920000000000002 | O253: =SUM(M253:N253) -> 366.19999999999999
A254: 3279 | B254: EOL RENASCENÇA II | C254: 12.831.668/0002-40 | D254: 331.27999999999997 | E254: 0 | F254: 0 | G254: 0 | H254: 0 | I254: 0 | J254: 0 | K254: 366.19999999999999 | L254: 0 | M254: =SUM(J254:L254)-34.92 -> 331.27999999999997 | N254: 34.920000000000002 | O254: =SUM(M254:N254) -> 366.19999999999999
A255: 3280 | B255: EOL RENASCENÇA III | C255: 12.833.445/0002-12 | D255: 331.27999999999997 | E255: 0 | F255: 0 | G255: 0 | H255: 0 | I255: 0 | J255: 0 | K255: 366.19999999999999 | L255: 0 | M255: =SUM(J255:L255)-34.92 -> 331.27999999999997 | N255: 34.920000000000002 | O255: =SUM(M255:N255) -> 366.19999999999999
A256: 3281 | B256: EOL RENASCENÇA IV | C256: 12.833.899/0002-93 | D256: 331.27999999999997 | E256: 0 | F256: 0 | G256: 0 | H256: 0 | I256: 0 | J256: 0 | K256: 366.19999999999999 | L256: 0 | M256: =SUM(J256:L256)-34.92 -> 331.27999999999997 | N256: 34.920000000000002 | O256: =SUM(M256:N256) -> 366.19999999999999
A257: 3282 | B257: EOL VENTOS DE SÃO MIGUEL | C257: 12.833.419/0002-94 | D257: 331.27999999999997 | E257: 0 | F257: 0 | G257: 0 | H257: 0 | I257: 0 | J257: 0 | K257: 366.19999999999999 | L257: 0 | M257: =SUM(J257:L257)-34.92 -> 331.27999999999997 | N257: 34.920000000000002 | O257: =SUM(M257:N257) -> 366.19999999999999
A258: 3283 | B258: EOL FLEIXEIRAS I | C258: 09.096.120/0002-90 | D258: 279.85000000000002 | E258: 0 | F258: 0 | G258: 0 | H258: 0 | I258: 0 | J258: 0 | K258: 309.35000000000002 | L258: 0 | M258: =SUM(J258:L258)-29.5 -> 279.85000000000002 | N258: 29.5 | O258: =SUM(M258:N258) -> 309.35000000000002
A259: 3284 | B259: EOL GUAJIRÚ | C259: 08.701.973/0002-40 | D259: 279.85000000000002 | E259: 0 | F259: 0 | G259: 0 | H259: 0 | I259: 0 | J259: 0 | K259: 309.35000000000002 | L259: 0 | M259: =SUM(J259:L259)-29.5 -> 279.85000000000002 | N259: 29.5 | O259: =SUM(M259:N259) -> 309.35000000000002
A260: 3285 | B260: EOL MUNDAÚ | C260: 08.629.553/0002-09 | D260: 212.96000000000001 | E260: 0 | F260: 0 | G260: 0 | H260: 0 | I260: 0 | J260: 0 | K260: 235.41 | L260: 0 | M260: =SUM(J260:L260)-22.45 -> 212.96000000000001 | N260: 22.449999999999999 | O260: =SUM(M260:N260) -> 235.41
A261: 3286 | B261: EOL TRAIRÍ | C261: 09.252.423/0002-54 | D261: 243.38999999999999 | E261: 0 | F261: 0 | G261: 0 | H261: 0 | I261: 0 | J261: 0 | K261: 269.05000000000001 | L261: 0 | M261: =SUM(J261:L261)-25.66 -> 243.39000000000001 | N261: 25.66 | O261: =SUM(M261:N261) -> 269.05000000000001
A262: 3287 | B262: EOL FAISA I | C262: 11.619.268/0001-22 | D262: 293.57999999999998 | E262: 0 | F262: 0 | G262: 0 | H262: 0 | I262: 0 | J262: 0 | K262: 324.52999999999997 | L262: 0 | M262: =SUM(J262:L262)-30.95 -> 293.57999999999998 | N262: 30.949999999999999 | O262: =SUM(M262:N262) -> 324.52999999999997
A263: 3288 | B263: EOL FAISA II | C263: 11.619.388/0001-20 | D263: 271.94999999999999 | E263: 0 | F263: 0 | G263: 0 | H263: 0 | I263: 0 | J263: 0 | K263: 300.62 | L263: 0 | M263: =SUM(J263:L263)-28.67 -> 271.94999999999999 | N263: 28.670000000000002 | O263: =SUM(M263:N263) -> 300.62
A264: 3289 | B264: EOL FAISA III | C264: 11.619.413/0001-75 | D264: 250.33000000000001 | E264: 0 | F264: 0 | G264: 0 | H264: 0 | I264: 0 | J264: 0 | K264: 276.72000000000003 | L264: 0 | M264: =SUM(J264:L264)-26.39 -> 250.33000000000004 | N264: 26.390000000000001 | O264: =SUM(M264:N264) -> 276.72000000000003
A265: 3290 | B265: EOL FAISA IV | C265: 11.619.342/0001-00 | D265: 250.33000000000001 | E265: 0 | F265: 0 | G265: 0 | H265: 0 | I265: 0 | J265: 0 | K265: 276.72000000000003 | L265: 0 | M265: =SUM(J265:L265)-26.39 -> 250.33000000000004 | N265: 26.390000000000001 | O265: =SUM(M265:N265) -> 276.72000000000003
A266: 3291 | B266: EOL FAISA V | C266: 11.652.254/0001-00 | D266: 293.57999999999998 | E266: 0 | F266: 0 | G266: 0 | H266: 0 | I266: 0 | J266: 0 | K266: 324.52999999999997 | L266: 0 | M266: =SUM(J266:L266)-30.95 -> 293.57999999999998 | N266: 30.949999999999999 | O266: =SUM(M266:N266) -> 324.52999999999997
A267: 3292 | B267: EOL TAÍBA ÁGUIA | C267: 11.477.009/0001-04 | D267: 232.31 | E267: 0 | F267: 0 | G267: 0 | H267: 0 | I267: 0 | J267: 0 | K267: 256.80000000000001 | L267: 0 | M267: =SUM(J267:L267)-24.49 -> 232.31 | N267: 24.489999999999998 | O267: =SUM(M267:N267) -> 256.80000000000001
A268: 3293 | B268: EOL TAÍBA ANDORINHA | C268: 11.477.020/0001-74 | D268: 147.46000000000001 | E268: 0 | F268: 0 | G268: 0 | H268: 0 | I268: 0 | J268: 0 | K268: 163 | L268: 0 | M268: =SUM(J268:L268)-15.54 -> 147.46000000000001 | N268: 15.539999999999999 | O268: =SUM(M268:N268) -> 163
A269: 3294 | B269: EOL COLÔNIA | C269: 11.476.958/0001-70 | D269: 189.99000000000001 | E269: 0 | F269: 0 | G269: 0 | H269: 0 | I269: 0 | J269: 0 | K269: 210.02000000000001 | L269: 0 | M269: =SUM(J269:L269)-20.03 -> 189.99000000000001 | N269: 20.030000000000001 | O269: =SUM(M269:N269) -> 210.02000000000001
A270: 3295 | B270: EOL EMBUACA | C270: 10.288.461/0001-65 | D270: 256.69 | E270: 0 | F270: 0 | G270: 0 | H270: 0 | I270: 0 | J270: 0 | K270: 283.75 | L270: 0 | M270: =SUM(J270:L270)-27.06 -> 256.69 | N270: 27.059999999999999 | O270: =SUM(M270:N270) -> 283.75
A271: 3296 | B271: CPFL (EOL CAMPO DOS VENTOS II) | C271: 10.797.889/0002-14 | D271: 340.52999999999997 | E271: 0 | F271: 0 | G271: 0 | H271: 0 | I271: 0 | J271: 0 | K271: 376.43000000000001 | L271: 0 | M271: =SUM(J271:L271)-35.9 -> 340.53000000000003 | N271: 35.899999999999999 | O271: =SUM(M271:N271) -> 376.43000000000001
A272: 3297 | B272: EOL SÃO BENTO DO NORTE | C272: 12.723.384/0001-50 | D272: 310.38 | E272: 0 | F272: 0 | G272: 0 | H272: 0 | I272: 0 | J272: 0 | K272: 343.10000000000002 | L272: 0 | M272: =SUM(J272:L272)-32.72 -> 310.38 | N272: 32.719999999999999 | O272: =SUM(M272:N272) -> 343.10000000000002
A273: 3298 | B273: EOL ASA BRANCA V | C273: 11.681.458/0002-50 | D273: 307.51999999999998 | E273: 0 | F273: 0 | G273: 0 | H273: 0 | I273: 0 | J273: 0 | K273: 339.94 | L273: 0 | M273: =SUM(J273:L273)-32.42 -> 307.51999999999998 | N273: 32.420000000000002 | O273: =SUM(M273:N273) -> 339.94
A274: 3299 | B274: EOL ASA BRANCA VII | C274: 11.694.618/0002-04 | D274: 307.51999999999998 | E274: 0 | F274: 0 | G274: 0 | H274: 0 | I274: 0 | J274: 0 | K274: 339.94 | L274: 0 | M274: =SUM(J274:L274)-32.42 -> 307.51999999999998 | N274: 32.420000000000002 | O274: =SUM(M274:N274) -> 339.94
A275: 3300 | B275: PETROBRAS (UTE B. FLUMINENSE) | C275: 33.000.167/0238-29 | D275: 9558.3500000000004 | E275: 0 | F275: 0 | G275: 0 | H275: 0 | I275: 0 | J275: 0 | K275: 10565.93 | L275: 0 | M275: =SUM(J275:L275)-1007.58 -> 9558.3500000000004 | N275: 1007.58 | O275: =SUM(M275:N275) -> 10565.93
A276: 3301 | B276: EOL MAR E TERRA | C276: 10.288.438/0001-70 | D276: 254.78999999999999 | E276: 0 | F276: 0 | G276: 0 | H276: 0 | I276: 0 | J276: 0 | K276: 281.64999999999998 | L276: 0 | M276: =SUM(J276:L276)-26.86 -> 254.78999999999996 | N276: 26.859999999999999 | O276: =SUM(M276:N276) -> 281.64999999999998
A277: 3302 | B277: EOL BELA VISTA | C277: 10.288.502/0001-13 | D277: 303.42000000000002 | E277: 0 | F277: 0 | G277: 0 | H277: 0 | I277: 0 | J277: 0 | K277: 335.39999999999998 | L277: 0 | M277: =SUM(J277:L277)-31.98 -> 303.41999999999996 | N277: 31.98 | O277: =SUM(M277:N277) -> 335.39999999999998
A278: 3303 | B278: EOL PAU FERRO | C278: 14.422.424/0002-30 | D278: 342.35000000000002 | E278: 0 | F278: 0 | G278: 0 | H278: 0 | I278: 0 | J278: 0 | K278: 378.44 | L278: 0 | M278: =SUM(J278:L278)-36.09 -> 342.35000000000002 | N278: 36.090000000000003 | O278: =SUM(M278:N278) -> 378.44000000000005
A279: 3304 | B279: EOL PEDRA DO GERONIMO | C279: 14.422.483/0002-08 | D279: 342.35000000000002 | E279: 0 | F279: 0 | G279: 0 | H279: 0 | I279: 0 | J279: 0 | K279: 378.44 | L279: 0 | M279: =SUM(J279:L279)-36.09 -> 342.35000000000002 | N279: 36.090000000000003 | O279: =SUM(M279:N279) -> 378.44000000000005
A280: 3305 | B280: EOL TACAICÓ | C280: 14.411.251/0002-54 | D280: 210.28999999999999 | E280: 0 | F280: 0 | G280: 0 | H280: 0 | I280: 0 | J280: 0 | K280: 232.46000000000001 | L280: 0 | M280: =SUM(J280:L280)-22.17 -> 210.29000000000002 | N280: 22.170000000000002 | O280: =SUM(M280:N280) -> 232.46000000000004
A281: 3306 | B281: UTE TROPICAL BIOENERGIA | C281: 08.195.806/0001-94 | D281: 909.73000000000002 | E281: 0 | F281: 0 | G281: 0 | H281: 0 | I281: 0 | J281: 0 | K281: 1005.63 | L281: 0 | M281: =SUM(J281:L281)-95.9 -> 909.73000000000002 | N281: 95.900000000000006 | O281: =SUM(M281:N281) -> 1005.63
A282: 3307 | B282: EOL PALMAS | C282: 10.656.525/0001-33 | D282: 185.61000000000001 | E282: 0 | F282: 0 | G282: 0 | H282: 0 | I282: 0 | J282: 0 | K282: 205.18000000000001 | L282: 0 | M282: =SUM(J282:L282)-19.57 -> 185.61000000000001 | N282: 19.57 | O282: =SUM(M282:N282) -> 205.18000000000001
A283: 3308 | B283: EOL ILHA GRANDE | C283: 08.624.273/0001-19 | D283: 294.33999999999997 | E283: 0 | F283: 0 | G283: 0 | H283: 0 | I283: 0 | J283: 0 | K283: 325.37 | L283: 0 | M283: =SUM(J283:L283)-31.03 -> 294.34000000000003 | N283: 31.030000000000001 | O283: =SUM(M283:N283) -> 325.37
A284: 3309 | B284: EOL RIBEIRÃO | C284: 10.656.583/0001-67 | D284: 213.97 | E284: 0 | F284: 0 | G284: 0 | H284: 0 | I284: 0 | J284: 0 | K284: 236.53 | L284: 0 | M284: =SUM(J284:L284)-22.56 -> 213.97 | N284: 22.559999999999999 | O284: =SUM(M284:N284) -> 236.53
A285: 3310 | B285: UTE IACO | C285: 07.895.728/0006-82 | D285: 887.26999999999998 | E285: 0 | F285: 0 | G285: 0 | H285: 0 | I285: 0 | J285: 0 | K285: 980.79999999999995 | L285: 0 | M285: =SUM(J285:L285)-93.53 -> 887.26999999999998 | N285: 93.530000000000001 | O285: =SUM(M285:N285) -> 980.79999999999995
A286: 3312 | B286: EOL IBIRAPUITÃ I | C286: 14.608.116/0001-12 | D286: 199.65000000000001 | E286: 0 | F286: 0 | G286: 0 | H286: 0 | I286: 0 | J286: 0 | K286: 220.69999999999999 | L286: 0 | M286: =SUM(J286:L286)-21.05 -> 199.64999999999998 | N286: 21.050000000000001 | O286: =SUM(M286:N286) -> 220.69999999999999
A287: 3313 | B287: PARNAÍBA II | C287: 14.578.002/0001-77 | D287: 13696.809999999999 | E287: 0 | F287: 0 | G287: 0 | H287: 0 | I287: 0 | J287: 0 | K287: 15140.629999999999 | L287: 0 | M287: =SUM(J287:L287)-1443.82 -> 13696.809999999999 | N287: 1443.8199999999999 | O287: =SUM(M287:N287) -> 15140.629999999999
A288: 3314 | B288: UTE ERB CANDEIAS | C288: 12.901.925/0001-92 | D288: 88.810000000000002 | E288: 0 | F288: 0 | G288: 0 | H288: 0 | I288: 0 | J288: 0 | K288: 98.170000000000002 | L288: 0 | M288: =SUM(J288:L288)-9.36 -> 88.810000000000002 | N288: 9.3599999999999994 | O288: =SUM(M288:N288) -> 98.170000000000002
A289: 3315 | B289: EOL UNIÃO DOS VENTOS 1 | C289: 13.336.223/0001-76 | D289: 232.40000000000001 | E289: 0 | F289: 0 | G289: 0 | H289: 0 | I289: 0 | J289: 0 | K289: 256.89999999999998 | L289: 0 | M289: =SUM(J289:L289)-24.5 -> 232.39999999999998 | N289: 24.5 | O289: =SUM(M289:N289) -> 256.89999999999998
A290: 3316 | B290: EOL UNIÃO DOS VENTOS 2 | C290: 13.336.463/0001-70 | D290: 233.47 | E290: 0 | F290: 0 | G290: 0 | H290: 0 | I290: 0 | J290: 0 | K290: 258.07999999999998 | L290: 0 | M290: =SUM(J290:L290)-24.61 -> 233.46999999999997 | N290: 24.609999999999999 | O290: =SUM(M290:N290) -> 258.07999999999998
A291: 3317 | B291: EOL UNIÃO DOS VENTOS 3 | C291: 13.336.480/0001-08 | D291: 231.11000000000001 | E291: 0 | F291: 0 | G291: 0 | H291: 0 | I291: 0 | J291: 0 | K291: 255.47 | L291: 0 | M291: =SUM(J291:L291)-24.36 -> 231.11000000000001 | N291: 24.359999999999999 | O291: =SUM(M291:N291) -> 255.47000000000003
A292: 3318 | B292: EOL UNIÃO DOS VENTOS 4 | C292: 13.336.491/0001-98 | D292: 116.23 | E292: 0 | F292: 0 | G292: 0 | H292: 0 | I292: 0 | J292: 0 | K292: 128.47999999999999 | L292: 0 | M292: =SUM(J292:L292)-12.25 -> 116.22999999999999 | N292: 12.25 | O292: =SUM(M292:N292) -> 128.47999999999999
A293: 3319 | B293: EOL UNIÃO DOS VENTOS 5 | C293: 13.336.386/0001-59 | D293: 246.31999999999999 | E293: 0 | F293: 0 | G293: 0 | H293: 0 | I293: 0 | J293: 0 | K293: 272.29000000000002 | L293: 0 | M293: =SUM(J293:L293)-25.97 -> 246.32000000000002 | N293: 25.969999999999999 | O293: =SUM(M293:N293) -> 272.29000000000002
A294: 3320 | B294: EOL UNIÃO DOS VENTOS 6 | C294: 13.336.397/0001-39 | D294: 132.47999999999999 | E294: 0 | F294: 0 | G294: 0 | H294: 0 | I294: 0 | J294: 0 | K294: 146.44999999999999 | L294: 0 | M294: =SUM(J294:L294)-13.97 -> 132.47999999999999 | N294: 13.970000000000001 | O294: =SUM(M294:N294) -> 146.44999999999999
A295: 3321 | B295: EOL UNIÃO DOS VENTOS 7 | C295: 13.341.988/0001-02 | D295: 149.93000000000001 | E295: 0 | F295: 0 | G295: 0 | H295: 0 | I295: 0 | J295: 0 | K295: 165.72999999999999 | L295: 0 | M295: =SUM(J295:L295)-15.8 -> 149.92999999999998 | N295: 15.800000000000001 | O295: =SUM(M295:N295) -> 165.72999999999999
A296: 3322 | B296: EOL UNIÃO DOS VENTOS 8 | C296: 13.336.404/0001-00 | D296: 159.31999999999999 | E296: 0 | F296: 0 | G296: 0 | H296: 0 | I296: 0 | J296: 0 | K296: 176.11000000000001 | L296: 0 | M296: =SUM(J296:L296)-16.79 -> 159.32000000000002 | N296: 16.789999999999999 | O296: =SUM(M296:N296) -> 176.11000000000001
A297: 3323 | B297: EOL UNIÃO DOS VENTOS 9 | C297: 13.336.428/0001-51 | D297: 118.44 | E297: 0 | F297: 0 | G297: 0 | H297: 0 | I297: 0 | J297: 0 | K297: 130.93000000000001 | L297: 0 | M297: =SUM(J297:L297)-12.49 -> 118.44000000000001 | N297: 12.49 | O297: =SUM(M297:N297) -> 130.93000000000001
A298: 3324 | B298: EOL UNIÃO DOS VENTOS 10 | C298: 13.336.415/0001-82 | D298: 151.53999999999999 | E298: 0 | F298: 0 | G298: 0 | H298: 0 | I298: 0 | J298: 0 | K298: 167.50999999999999 | L298: 0 | M298: =SUM(J298:L298)-15.97 -> 151.53999999999999 | N298: 15.970000000000001 | O298: =SUM(M298:N298) -> 167.50999999999999
A299: 3325 | B299: UTE PARNAÍBA IV | C299: 14.578.002/0001-77 | D299: 1018.11 | E299: 0 | F299: 0 | G299: 0 | H299: 0 | I299: 0 | J299: 0 | K299: 1125.4300000000001 | L299: 0 | M299: =SUM(J299:L299)-107.32 -> 1018.1100000000001 | N299: 107.31999999999999 | O299: =SUM(M299:N299) -> 1125.4300000000001
A300: 3326 | B300: EOL PRIMAVERA | C300: 12.851.871/0004-40 | D300: 330.42000000000002 | E300: 0 | F300: 0 | G300: 0 | H300: 0 | I300: 0 | J300: 0 | K300: 365.25 | L300: 0 | M300: =SUM(J300:L300)-34.83 -> 330.42000000000002 | N300: 34.829999999999998 | O300: =SUM(M300:N300) -> 365.25
A301: 3327 | B301: EOL MODELO I | C301: 14.512.809/0002-98 | D301: 333.69 | E301: 0 | F301: 0 | G301: 0 | H301: 0 | I301: 0 | J301: 0 | K301: 368.87 | L301: 0 | M301: =SUM(J301:L301)-35.18 -> 333.69 | N301: 35.18 | O301: =SUM(M301:N301) -> 368.87
A302: 3328 | B302: EOL MODELO II | C302: 14.504.489/0002-24 | D302: 290.35000000000002 | E302: 0 | F302: 0 | G302: 0 | H302: 0 | I302: 0 | J302: 0 | K302: 320.95999999999998 | L302: 0 | M302: =SUM(J302:L302)-30.61 -> 290.34999999999997 | N302: 30.609999999999999 | O302: =SUM(M302:N302) -> 320.95999999999998
A303: 3329 | B303: EOL SÃO JUDAS | C303: 12.851.951/0003-15 | D303: 327.38 | E303: 0 | F303: 0 | G303: 0 | H303: 0 | I303: 0 | J303: 0 | K303: 361.88999999999999 | L303: 0 | M303: =SUM(J303:L303)-34.51 -> 327.38 | N303: 34.509999999999998 | O303: =SUM(M303:N303) -> 361.88999999999999
A304: 3330 | B304: EOL CRISTAL | C304: 12.851.920/0003-64 | D304: 328.83999999999997 | E304: 0 | F304: 0 | G304: 0 | H304: 0 | I304: 0 | J304: 0 | K304: 363.5 | L304: 0 | M304: =SUM(J304:L304)-34.66 -> 328.84000000000003 | N304: 34.659999999999997 | O304: =SUM(M304:N304) -> 363.5
A305: 3331 | B305: EOL PEDRA PRETA | C305: 09.665.342/0002-86 | D305: 226.19999999999999 | E305: 0 | F305: 0 | G305: 0 | H305: 0 | I305: 0 | J305: 0 | K305: 250.03999999999999 | L305: 0 | M305: =SUM(J305:L305)-23.84 -> 226.19999999999999 | N305: 23.84 | O305: =SUM(M305:N305) -> 250.03999999999999
A306: 3332 | B306: EOL COSTA BRANCA | C306: 09.665.392/0002-63 | D306: 226.37 | E306: 0 | F306: 0 | G306: 0 | H306: 0 | I306: 0 | J306: 0 | K306: 250.22999999999999 | L306: 0 | M306: =SUM(J306:L306)-23.86 -> 226.37 | N306: 23.859999999999999 | O306: =SUM(M306:N306) -> 250.23000000000002
A307: 3333 | B307: EOL JUREMAS | C307: 09.665.446/0002-90 | D307: 177.75999999999999 | E307: 0 | F307: 0 | G307: 0 | H307: 0 | I307: 0 | J307: 0 | K307: 196.5 | L307: 0 | M307: =SUM(J307:L307)-18.74 -> 177.75999999999999 | N307: 18.739999999999998 | O307: =SUM(M307:N307) -> 196.5
A308: 3334 | B308: EOL MACACOS | C308: 07.091.059/0002-62 | D308: 226.16 | E308: 0 | F308: 0 | G308: 0 | H308: 0 | I308: 0 | J308: 0 | K308: 250 | L308: 0 | M308: =SUM(J308:L308)-23.84 -> 226.16 | N308: 23.84 | O308: =SUM(M308:N308) -> 250
A309: 3335 | B309: EOL EMILIANA | C309: 14.422.996/0002-19 | D309: 308.60000000000002 | E309: 0 | F309: 0 | G309: 0 | H309: 0 | I309: 0 | J309: 0 | K309: 341.13 | L309: 0 | M309: =SUM(J309:L309)-32.53 -> 308.60000000000002 | N309: 32.530000000000001 | O309: =SUM(M309:N309) -> 341.13
A310: 3336 | B310: EOL JOANA | C310: 14.423.010/0002-25 | D310: 308.60000000000002 | E310: 0 | F310: 0 | G310: 0 | H310: 0 | I310: 0 | J310: 0 | K310: 341.13 | L310: 0 | M310: =SUM(J310:L310)-32.53 -> 308.60000000000002 | N310: 32.530000000000001 | O310: =SUM(M310:N310) -> 341.13
A311: 3337 | B311: UHE SANTO ANTONIO JARI | C311: 03.581.989/0003-24 | D311: 5873.8900000000003 | E311: 0 | F311: 0 | G311: 0 | H311: 0 | I311: 0 | J311: 0 | K311: 6493.0699999999997 | L311: 0 | M311: =SUM(J311:L311)-619.18 -> 5873.8899999999994 | N311: 619.17999999999995 | O311: =SUM(M311:N311) -> 6493.0699999999997
A312: 3338 | B312: EOL CARCARÁ I | C312: 14.535.594/0001-40 | D312: 333.79000000000002 | E312: 0 | F312: 0 | G312: 0 | H312: 0 | I312: 0 | J312: 0 | K312: 368.98000000000002 | L312: 0 | M312: =SUM(J312:L312)-35.19 -> 333.79000000000002 | N312: 35.189999999999998 | O312: =SUM(M312:N312) -> 368.98000000000002
A313: 3339 | B313: DESA (EOL EURUS I) | C313: 12.652.614/0001-37 | D313: 336.19999999999999 | E313: 0 | F313: 0 | G313: 0 | H313: 0 | I313: 0 | J313: 0 | K313: 371.63999999999999 | L313: 0 | M313: =SUM(J313:L313)-35.44 -> 336.19999999999999 | N313: 35.439999999999998 | O313: =SUM(M313:N313) -> 371.63999999999999
A314: 3340 | B314: DESA (EOL EURUS III) | C314: 12.652.634/0001-08 | D314: 329.82999999999998 | E314: 0 | F314: 0 | G314: 0 | H314: 0 | I314: 0 | J314: 0 | K314: 364.60000000000002 | L314: 0 | M314: =SUM(J314:L314)-34.77 -> 329.83000000000004 | N314: 34.770000000000003 | O314: =SUM(M314:N314) -> 364.60000000000002
A315: 3341 | B315: EOL CARCARÁ II | C315: 15.394.399/0001-00 | D315: 262.58999999999997 | E315: 0 | F315: 0 | G315: 0 | H315: 0 | I315: 0 | J315: 0 | K315: 290.26999999999998 | L315: 0 | M315: =SUM(J315:L315)-27.68 -> 262.58999999999997 | N315: 27.68 | O315: =SUM(M315:N315) -> 290.26999999999998
A316: 3342 | B316: EOL RENASCENÇA V | C316: 10.797.904/0001-43 | D316: 331.81999999999999 | E316: 0 | F316: 0 | G316: 0 | H316: 0 | I316: 0 | J316: 0 | K316: 366.80000000000001 | L316: 0 | M316: =SUM(J316:L316)-34.98 -> 331.81999999999999 | N316: 34.979999999999997 | O316: =SUM(M316:N316) -> 366.80000000000001
A317: 3343 | B317: ATLANTIC (EOL EURUS II) | C317: 10.797.897/0001-80 | D317: 331.81999999999999 | E317: 0 | F317: 0 | G317: 0 | H317: 0 | I317: 0 | J317: 0 | K317: 366.80000000000001 | L317: 0 | M317: =SUM(J317:L317)-34.98 -> 331.81999999999999 | N317: 34.979999999999997 | O317: =SUM(M317:N317) -> 366.80000000000001
A318: 3344 | B318: EOL SANTO ANTÔNIO DE PÁDUA | C318: 09.601.233/0001-14 | D318: 146.16999999999999 | E318: 0 | F318: 0 | G318: 0 | H318: 0 | I318: 0 | J318: 0 | K318: 161.58000000000001 | L318: 0 | M318: =SUM(J318:L318)-15.41 -> 146.17000000000002 | N318: 15.41 | O318: =SUM(M318:N318) -> 161.58000000000001
A319: 3345 | B319: EOL SÃO CRISTOVÃO | C319: 10.272.500/0001-36 | D319: 263.76999999999998 | E319: 0 | F319: 0 | G319: 0 | H319: 0 | I319: 0 | J319: 0 | K319: 291.56999999999999 | L319: 0 | M319: =SUM(J319:L319)-27.8 -> 263.76999999999998 | N319: 27.800000000000001 | O319: =SUM(M319:N319) -> 291.56999999999999
A320: 3346 | B320: EOL SÃO JORGE | C320: 09.571.485/0001-48 | D320: 249.11000000000001 | E320: 0 | F320: 0 | G320: 0 | H320: 0 | I320: 0 | J320: 0 | K320: 275.37 | L320: 0 | M320: =SUM(J320:L320)-26.26 -> 249.11000000000001 | N320: 26.260000000000002 | O320: =SUM(M320:N320) -> 275.37
A321: 3347 | B321: EOL V. DO NORDESTE | C321: 11.204.086/0001-90 | D321: 265.38999999999999 | E321: 0 | F321: 0 | G321: 0 | H321: 0 | I321: 0 | J321: 0 | K321: 293.37 | L321: 0 | M321: =SUM(J321:L321)-27.98 -> 265.38999999999999 | N321: 27.98 | O321: =SUM(M321:N321) -> 293.37
A322: 3348 | B322: EOL TANQUE | C322: 12.048.059/0001-39 | D322: 338.5 | E322: 0 | F322: 0 | G322: 0 | H322: 0 | I322: 0 | J322: 0 | K322: 374.18000000000001 | L322: 0 | M322: =SUM(J322:L322)-35.68 -> 338.5 | N322: 35.68 | O322: =SUM(M322:N322) -> 374.18000000000001
A323: 3349 | B323: EOL SERAÍMA | C323: 12.047.526/0001-06 | D323: 338.5 | E323: 0 | F323: 0 | G323: 0 | H323: 0 | I323: 0 | J323: 0 | K323: 374.18000000000001 | L323: 0 | M323: =SUM(J323:L323)-35.68 -> 338.5 | N323: 35.68 | O323: =SUM(M323:N323) -> 374.18000000000001
A324: 3350 | B324: EOL DOS ARAÇAS | C324: 11.201.833/0001-37 | D324: 338.5 | E324: 0 | F324: 0 | G324: 0 | H324: 0 | I324: 0 | J324: 0 | K324: 374.18000000000001 | L324: 0 | M324: =SUM(J324:L324)-35.68 -> 338.5 | N324: 35.68 | O324: =SUM(M324:N324) -> 374.18000000000001
A325: 3351 | B325: EOL DA PRATA | C325: 11.366.231/0001-30 | D325: 246.43000000000001 | E325: 0 | F325: 0 | G325: 0 | H325: 0 | I325: 0 | J325: 0 | K325: 272.41000000000003 | L325: 0 | M325: =SUM(J325:L325)-25.98 -> 246.43000000000004 | N325: 25.98 | O325: =SUM(M325:N325) -> 272.41000000000003
A326: 3352 | B326: EOL CAETITÉ 1 | C326: 12.158.428/0002-27 | D326: 283.07999999999998 | E326: 0 | F326: 0 | G326: 0 | H326: 0 | I326: 0 | J326: 0 | K326: 312.92000000000002 | L326: 0 | M326: =SUM(J326:L326)-29.84 -> 283.08000000000004 | N326: 29.84 | O326: =SUM(M326:N326) -> 312.92000000000002
A327: 3353 | B327: EOL TERRAL | C327: 15.394.357/0001-79 | D327: 262.58999999999997 | E327: 0 | F327: 0 | G327: 0 | H327: 0 | I327: 0 | J327: 0 | K327: 290.26999999999998 | L327: 0 | M327: =SUM(J327:L327)-27.68 -> 262.58999999999997 | N327: 27.68 | O327: =SUM(M327:N327) -> 290.26999999999998
A328: 3354 | B328: TIJOA (UHE TRES IRMÃOS) | C328: 14.522.198/0001-88 | D328: 19254.099999999999 | E328: 0 | F328: 0 | G328: 0 | H328: 0 | I328: 0 | J328: 0 | K328: 21283.73 | L328: 0 | M328: =SUM(J328:L328)-2029.63 -> 19254.099999999999 | N328: 2029.6300000000001 | O328: =SUM(M328:N328) -> 21283.73
A329: 3355 | B329: EOL FAROL | C329: 12.723.335/0001-17 | D329: 200.47999999999999 | E329: 0 | F329: 0 | G329: 0 | H329: 0 | I329: 0 | J329: 0 | K329: 221.61000000000001 | L329: 0 | M329: =SUM(J329:L329)-21.13 -> 200.48000000000002 | N329: 21.129999999999999 | O329: =SUM(M329:N329) -> 221.61000000000001
A330: 3356 | B330: UTE TROPICAL BIOENERGIA II | C330: 08.195.806/0001-94 | D330: 404.98000000000002 | E330: 0 | F330: 0 | G330: 0 | H330: 0 | I330: 0 | J330: 0 | K330: 447.67000000000002 | L330: 0 | M330: =SUM(J330:L330)-42.69 -> 404.98000000000002 | N330: 42.689999999999998 | O330: =SUM(M330:N330) -> 447.67000000000002
A331: 3357 | B331: UHE FERREIRA GOMES | C331: 12.489.315/0001-23 | D331: 4987.3199999999997 | E331: 0 | F331: 0 | G331: 0 | H331: 0 | I331: 0 | J331: 0 | K331: 5513.0500000000002 | L331: 0 | M331: =SUM(J331:L331)-525.73 -> 4987.3199999999997 | N331: 525.73000000000002 | O331: =SUM(M331:N331) -> 5513.0499999999993
A332: 3358 | B332: VENTOS DOS INDIOS (INDIOS 2-3) | C332: 11.622.264/0002-84 | D332: 426.89999999999998 | E332: 0 | F332: 0 | G332: 0 | H332: 0 | I332: 0 | J332: 0 | K332: 471.89999999999998 | L332: 0 | M332: =SUM(J332:L332)-45 -> 426.89999999999998 | N332: 45 | O332: =SUM(M332:N332) -> 471.89999999999998
A333: 3359 | B333: NORTE ENERGIA (BELO MONTE) | C333: 12.300.288/0001-07 | D333: 266679.98999999999 | E333: 0 | F333: 0 | G333: 0 | H333: 0 | I333: 0 | J333: 0 | K333: 294791.56 | L333: 0 | M333: =SUM(J333:L333)-28111.57 -> 266679.98999999999 | N333: 28111.57 | O333: =SUM(M333:N333) -> 294791.56
A334: 3360 | B334: EOL MORRÃO | C334: 12.049.829/0001-68 | D334: 303.69999999999999 | E334: 0 | F334: 0 | G334: 0 | H334: 0 | I334: 0 | J334: 0 | K334: 335.70999999999998 | L334: 0 | M334: =SUM(J334:L334)-32.01 -> 303.69999999999999 | N334: 32.009999999999998 | O334: =SUM(M334:N334) -> 335.70999999999998
A335: 3361 | B335: ACARI (EOL RIACHÃO I) | C335: 12.959.291/0001-29 | D335: 301.69 | E335: 0 | F335: 0 | G335: 0 | H335: 0 | I335: 0 | J335: 0 | K335: 333.49000000000001 | L335: 0 | M335: =SUM(J335:L335)-31.8 -> 301.69 | N335: 31.800000000000001 | O335: =SUM(M335:N335) -> 333.49000000000001
A336: 3362 | B336: ALBUQUERQUE (EOL RIACHÃO II) | C336: 12.960.216/0001-88 | D336: 277.74000000000001 | E336: 0 | F336: 0 | G336: 0 | H336: 0 | I336: 0 | J336: 0 | K336: 307.01999999999998 | L336: 0 | M336: =SUM(J336:L336)-29.28 -> 277.74000000000001 | N336: 29.280000000000001 | O336: =SUM(M336:N336) -> 307.01999999999998
A337: 3363 | B337: ANEMOI (EOL RIACHÃO IV) | C337: 12.959.327/0001-74 | D337: 304.20999999999998 | E337: 0 | F337: 0 | G337: 0 | H337: 0 | I337: 0 | J337: 0 | K337: 336.27999999999997 | L337: 0 | M337: =SUM(J337:L337)-32.07 -> 304.20999999999998 | N337: 32.07 | O337: =SUM(M337:N337) -> 336.27999999999997
A338: 3364 | B338: APELIOTES (EOL RIACHÃO VI) | C338: 12.959.413/0001-87 | D338: 304.94999999999999 | E338: 0 | F338: 0 | G338: 0 | H338: 0 | I338: 0 | J338: 0 | K338: 337.10000000000002 | L338: 0 | M338: =SUM(J338:L338)-32.15 -> 304.95000000000005 | N338: 32.149999999999999 | O338: =SUM(M338:N338) -> 337.10000000000002
A339: 3365 | B339: ARENA (EOL RIACHÃO VII) | C339: 11.781.913/0001-09 | D339: 305.47000000000003 | E339: 0 | F339: 0 | G339: 0 | H339: 0 | I339: 0 | J339: 0 | K339: 337.67000000000002 | L339: 0 | M339: =SUM(J339:L339)-32.2 -> 305.47000000000003 | N339: 32.200000000000003 | O339: =SUM(M339:N339) -> 337.67000000000002
A340: 3366 | B340: EOL SANTA HELENA | C340: 12.053.929/0002-49 | D340: 361.82999999999998 | E340: 0 | F340: 0 | G340: 0 | H340: 0 | I340: 0 | J340: 0 | K340: 399.97000000000003 | L340: 0 | M340: =SUM(J340:L340)-38.14 -> 361.83000000000004 | N340: 38.140000000000001 | O340: =SUM(M340:N340) -> 399.97000000000003
A341: 3367 | B341: EOL SM | C341: 12.053.787/0002-10 | D341: 357.62 | E341: 0 | F341: 0 | G341: 0 | H341: 0 | I341: 0 | J341: 0 | K341: 395.31999999999999 | L341: 0 | M341: =SUM(J341:L341)-37.7 -> 357.62 | N341: 37.700000000000003 | O341: =SUM(M341:N341) -> 395.31999999999999
A342: 3368 | B342: EOL VERACE I | C342: 42.873.310/0003-22 | D342: 161.69 | E342: 0 | F342: 0 | G342: 0 | H342: 0 | I342: 0 | J342: 0 | K342: 178.72999999999999 | L342: 0 | M342: =SUM(J342:L342)-17.04 -> 161.69 | N342: 17.039999999999999 | O342: =SUM(M342:N342) -> 178.72999999999999
A343: 3369 | B343: EOL VERACE II | C343: 42.873.310/0003-22 | D343: 161.59 | E343: 0 | F343: 0 | G343: 0 | H343: 0 | I343: 0 | J343: 0 | K343: 178.62 | L343: 0 | M343: =SUM(J343:L343)-17.03 -> 161.59 | N343: 17.030000000000001 | O343: =SUM(M343:N343) -> 178.62
A344: 3370 | B344: EOL VERACE III | C344: 42.873.310/0003-22 | D344: 211.34999999999999 | E344: 0 | F344: 0 | G344: 0 | H344: 0 | I344: 0 | J344: 0 | K344: 233.63 | L344: 0 | M344: =SUM(J344:L344)-22.28 -> 211.34999999999999 | N344: 22.280000000000001 | O344: =SUM(M344:N344) -> 233.63
A345: 3371 | B345: EOL VERACE IV | C345: 42.873.310/0003-22 | D345: 243.93000000000001 | E345: 0 | F345: 0 | G345: 0 | H345: 0 | I345: 0 | J345: 0 | K345: 269.63999999999999 | L345: 0 | M345: =SUM(J345:L345)-25.71 -> 243.92999999999998 | N345: 25.710000000000001 | O345: =SUM(M345:N345) -> 269.63999999999999
A346: 3372 | B346: EOL VERACE V | C346: 42.873.310/0003-22 | D346: 242.5 | E346: 0 | F346: 0 | G346: 0 | H346: 0 | I346: 0 | J346: 0 | K346: 268.06 | L346: 0 | M346: =SUM(J346:L346)-25.56 -> 242.5 | N346: 25.559999999999999 | O346: =SUM(M346:N346) -> 268.06
A347: 3373 | B347: EOL VERACE VI | C347: 42.873.310/0003-22 | D347: 147.16 | E347: 0 | F347: 0 | G347: 0 | H347: 0 | I347: 0 | J347: 0 | K347: 162.66999999999999 | L347: 0 | M347: =SUM(J347:L347)-15.51 -> 147.16 | N347: 15.51 | O347: =SUM(M347:N347) -> 162.66999999999999
A348: 3374 | B348: EOL VERACE VII | C348: 42.873.310/0003-22 | D348: 243.83000000000001 | E348: 0 | F348: 0 | G348: 0 | H348: 0 | I348: 0 | J348: 0 | K348: 269.52999999999997 | L348: 0 | M348: =SUM(J348:L348)-25.7 -> 243.82999999999998 | N348: 25.699999999999999 | O348: =SUM(M348:N348) -> 269.52999999999997
A349: 3375 | B349: EOL VERACE VIII | C349: 42.873.310/0003-22 | D349: 211.11000000000001 | E349: 0 | F349: 0 | G349: 0 | H349: 0 | I349: 0 | J349: 0 | K349: 233.36000000000001 | L349: 0 | M349: =SUM(J349:L349)-22.25 -> 211.11000000000001 | N349: 22.25 | O349: =SUM(M349:N349) -> 233.36000000000001
A350: 3376 | B350: EOL VERACE IX | C350: 42.873.310/0003-22 | D350: 243.21000000000001 | E350: 0 | F350: 0 | G350: 0 | H350: 0 | I350: 0 | J350: 0 | K350: 268.85000000000002 | L350: 0 | M350: =SUM(J350:L350)-25.64 -> 243.21000000000004 | N350: 25.640000000000001 | O350: =SUM(M350:N350) -> 268.85000000000002
A351: 3377 | B351: EOL VERACE X | C351: 42.873.310/0003-22 | D351: 227.75 | E351: 0 | F351: 0 | G351: 0 | H351: 0 | I351: 0 | J351: 0 | K351: 251.75999999999999 | L351: 0 | M351: =SUM(J351:L351)-24.01 -> 227.75 | N351: 24.010000000000002 | O351: =SUM(M351:N351) -> 251.75999999999999
A352: 3378 | B352: EOL AMETISTA | C352: 11.201.885/0001-03 | D352: 316.61000000000001 | E352: 0 | F352: 0 | G352: 0 | H352: 0 | I352: 0 | J352: 0 | K352: 349.98000000000002 | L352: 0 | M352: =SUM(J352:L352)-33.37 -> 316.61000000000001 | N352: 33.369999999999997 | O352: =SUM(M352:N352) -> 349.98000000000002
A353: 3379 | B353: EOL DOURADOS | C353: 12.041.319/0001-44 | D353: 316.83999999999997 | E353: 0 | F353: 0 | G353: 0 | H353: 0 | I353: 0 | J353: 0 | K353: 350.24000000000001 | L353: 0 | M353: =SUM(J353:L353)-33.4 -> 316.84000000000003 | N353: 33.399999999999999 | O353: =SUM(M353:N353) -> 350.24000000000001
A354: 3380 | B354: EOL MARON | C354: 12.041.214/0001-95 | D354: 336.69999999999999 | E354: 0 | F354: 0 | G354: 0 | H354: 0 | I354: 0 | J354: 0 | K354: 372.19 | L354: 0 | M354: =SUM(J354:L354)-35.49 -> 336.69999999999999 | N354: 35.490000000000002 | O354: =SUM(M354:N354) -> 372.19
A355: 3381 | B355: EOL PILÕES | C355: 11.201.797/0001-01 | D355: 336.69999999999999 | E355: 0 | F355: 0 | G355: 0 | H355: 0 | I355: 0 | J355: 0 | K355: 372.19 | L355: 0 | M355: =SUM(J355:L355)-35.49 -> 336.69999999999999 | N355: 35.490000000000002 | O355: =SUM(M355:N355) -> 372.19
A356: 3382 | B356: EOL MALHADINHA I | C356: 14.080.223/0002-00 | D356: 207.84999999999999 | E356: 0 | F356: 0 | G356: 0 | H356: 0 | I356: 0 | J356: 0 | K356: 229.75999999999999 | L356: 0 | M356: =SUM(J356:L356)-21.91 -> 207.84999999999999 | N356: 21.91 | O356: =SUM(M356:N356) -> 229.75999999999999
A357: 3383 | B357: UTE CMPC | C357: 11.234.954/0001-85 | D357: 247.84 | E357: 0 | F357: 0 | G357: 0 | H357: 0 | I357: 0 | J357: 0 | K357: 273.97000000000003 | L357: 0 | M357: =SUM(J357:L357)-26.13 -> 247.84000000000003 | N357: 26.129999999999999 | O357: =SUM(M357:N357) -> 273.97000000000003
A358: 3384 | B358: EOL ASA BRANCA I | C358: 12.802.855/0001-15 | D358: 300.93000000000001 | E358: 0 | F358: 0 | G358: 0 | H358: 0 | I358: 0 | J358: 0 | K358: 332.64999999999998 | L358: 0 | M358: =SUM(J358:L358)-31.72 -> 300.92999999999995 | N358: 31.719999999999999 | O358: =SUM(M358:N358) -> 332.64999999999998
A359: 3385 | B359: EOL ASA BRANCA II | C359: 12.802.844/0001-35 | D359: 342.26999999999998 | E359: 0 | F359: 0 | G359: 0 | H359: 0 | I359: 0 | J359: 0 | K359: 378.35000000000002 | L359: 0 | M359: =SUM(J359:L359)-36.08 -> 342.27000000000004 | N359: 36.079999999999998 | O359: =SUM(M359:N359) -> 378.35000000000002
A360: 3386 | B360: EOL ASA BRANCA III | C360: 12.802.835/0001-44 | D360: 295.58999999999997 | E360: 0 | F360: 0 | G360: 0 | H360: 0 | I360: 0 | J360: 0 | K360: 326.75 | L360: 0 | M360: =SUM(J360:L360)-31.16 -> 295.58999999999997 | N360: 31.16 | O360: =SUM(M360:N360) -> 326.75
A361: 3387 | B361: EOL EURUS IV | C361: 12.802.866/0001-03 | D361: 358.87 | E361: 0 | F361: 0 | G361: 0 | H361: 0 | I361: 0 | J361: 0 | K361: 396.69999999999999 | L361: 0 | M361: =SUM(J361:L361)-37.83 -> 358.87 | N361: 37.829999999999998 | O361: =SUM(M361:N361) -> 396.69999999999999
A362: 3388 | B362: ALIANÇA (CONS. PORTO ESTRELA) | C362: 12.009.135/0001-05 | D362: 922.63999999999999 | E362: 0 | F362: 0 | G362: 0 | H362: 0 | I362: 0 | J362: 0 | K362: 1019.9 | L362: 0 | M362: =SUM(J362:L362)-97.26 -> 922.63999999999999 | N362: 97.260000000000005 | O362: =SUM(M362:N362) -> 1019.9
A363: 3389 | B363: ALIANÇA (UHE AIMORÉS) | C363: 12.009.135/0001-05 | D363: 4369.2600000000002 | E363: 0 | F363: 0 | G363: 0 | H363: 0 | I363: 0 | J363: 0 | K363: 4829.8400000000001 | L363: 0 | M363: =SUM(J363:L363)-460.58 -> 4369.2600000000002 | N363: 460.57999999999998 | O363: =SUM(M363:N363) -> 4829.8400000000001
A364: 3390 | B364: EOL LANCHINHA | C364: 14.603.978/0001-52 | D364: 314.16000000000003 | E364: 0 | F364: 0 | G364: 0 | H364: 0 | I364: 0 | J364: 0 | K364: 347.27999999999997 | L364: 0 | M364: =SUM(J364:L364)-33.12 -> 314.15999999999997 | N364: 33.119999999999997 | O364: =SUM(M364:N364) -> 347.27999999999997
A365: 3391 | B365: EOL PELADO | C365: 14.604.100/0001-31 | D365: 222.77000000000001 | E365: 0 | F365: 0 | G365: 0 | H365: 0 | I365: 0 | J365: 0 | K365: 246.25 | L365: 0 | M365: =SUM(J365:L365)-23.48 -> 222.77000000000001 | N365: 23.48 | O365: =SUM(M365:N365) -> 246.25
A366: 3392 | B366: EOL CHUÍ I | C366: 42.873.310/0002-41 | D366: 197.05000000000001 | E366: 0 | F366: 0 | G366: 0 | H366: 0 | I366: 0 | J366: 0 | K366: 217.81999999999999 | L366: 0 | M366: =SUM(J366:L366)-20.77 -> 197.04999999999998 | N366: 20.77 | O366: =SUM(M366:N366) -> 217.81999999999999
A367: 3393 | B367: EOL CHUÍ II | C367: 42.873.310/0002-41 | D367: 179 | E367: 0 | F367: 0 | G367: 0 | H367: 0 | I367: 0 | J367: 0 | K367: 197.87 | L367: 0 | M367: =SUM(J367:L367)-18.87 -> 179 | N367: 18.870000000000001 | O367: =SUM(M367:N367) -> 197.87
A368: 3394 | B368: EOL CHUÍ IV | C368: 42.873.310/0002-41 | D368: 178.83000000000001 | E368: 0 | F368: 0 | G368: 0 | H368: 0 | I368: 0 | J368: 0 | K368: 197.68000000000001 | L368: 0 | M368: =SUM(J368:L368)-18.85 -> 178.83000000000001 | N368: 18.850000000000001 | O368: =SUM(M368:N368) -> 197.68000000000001
A369: 3395 | B369: EOL CHUÍ V | C369: 42.873.310/0002-41 | D369: 243.33000000000001 | E369: 0 | F369: 0 | G369: 0 | H369: 0 | I369: 0 | J369: 0 | K369: 268.98000000000002 | L369: 0 | M369: =SUM(J369:L369)-25.65 -> 243.33000000000001 | N369: 25.649999999999999 | O369: =SUM(M369:N369) -> 268.98000000000002
A370: 3396 | B370: EOL MINUANO I | C370: 42.873.310/0002-41 | D370: 176.34999999999999 | E370: 0 | F370: 0 | G370: 0 | H370: 0 | I370: 0 | J370: 0 | K370: 194.94 | L370: 0 | M370: =SUM(J370:L370)-18.59 -> 176.34999999999999 | N370: 18.59 | O370: =SUM(M370:N370) -> 194.94
A371: 3397 | B371: EOL MINUANO II | C371: 42.873.310/0002-41 | D371: 192.94999999999999 | E371: 0 | F371: 0 | G371: 0 | H371: 0 | I371: 0 | J371: 0 | K371: 213.28999999999999 | L371: 0 | M371: =SUM(J371:L371)-20.34 -> 192.94999999999999 | N371: 20.34 | O371: =SUM(M371:N371) -> 213.28999999999999
A372: 3398 | B372: PETROBRAS (UTE U-50) | C372: 33.000.167/1111-08 | D372: 428.00999999999999 | E372: 0 | F372: 0 | G372: 0 | H372: 0 | I372: 0 | J372: 0 | K372: 473.13 | L372: 0 | M372: =SUM(J372:L372)-45.12 -> 428.00999999999999 | N372: 45.119999999999997 | O372: =SUM(M372:N372) -> 473.13
A373: 3399 | B373: EOL VENTOS DE SANTO URIEL | C373: 14.583.703/0001-02 | D373: 180.09999999999999 | E373: 0 | F373: 0 | G373: 0 | H373: 0 | I373: 0 | J373: 0 | K373: 199.08000000000001 | L373: 0 | M373: =SUM(J373:L373)-18.98 -> 180.10000000000002 | N373: 18.98 | O373: =SUM(M373:N373) -> 199.08000000000001
A374: 3401 | B374: RAESA (UTE CRISTIANO DA ROCHA) | C374: 07.386.098/0002-97 | D374: 1207.73 | E374: 0 | F374: 0 | G374: 0 | H374: 0 | I374: 0 | J374: 0 | K374: 1335.04 | L374: 0 | M374: =SUM(J374:L374)-127.31 -> 1207.73 | N374: 127.31 | O374: =SUM(M374:N374) -> 1335.04
A375: 3402 | B375: UHE TELES PIRES | C375: 12.810.896/0005-87 | D375: 74190.589999999997 | E375: 0 | F375: 0 | G375: 0 | H375: 0 | I375: 0 | J375: 0 | K375: 82011.25 | L375: 0 | M375: =SUM(J375:L375)-7820.66 -> 74190.589999999997 | N375: 7820.6599999999999 | O375: =SUM(M375:N375) -> 82011.25
A376: 3403 | B376: DESA (EOL MORRO DOS VENTOS II) | C376: 15.207.271/0001-90 | D376: 274.79000000000002 | E376: 0 | F376: 0 | G376: 0 | H376: 0 | I376: 0 | J376: 0 | K376: 303.75999999999999 | L376: 0 | M376: =SUM(J376:L376)-28.97 -> 274.78999999999996 | N376: 28.969999999999999 | O376: =SUM(M376:N376) -> 303.75999999999999
A377: 3404 | B377: EOL REDUTO | C377: 14.527.003/0001-92 | D377: 295.81 | E377: 0 | F377: 0 | G377: 0 | H377: 0 | I377: 0 | J377: 0 | K377: 326.99000000000001 | L377: 0 | M377: =SUM(J377:L377)-31.18 -> 295.81 | N377: 31.18 | O377: =SUM(M377:N377) -> 326.99000000000001
A378: 3405 | B378: EOL CHUÍ IX | C378: 42.873.310/0003-22 | D378: 176.69 | E378: 0 | F378: 0 | G378: 0 | H378: 0 | I378: 0 | J378: 0 | K378: 195.31999999999999 | L378: 0 | M378: =SUM(J378:L378)-18.63 -> 176.69 | N378: 18.629999999999999 | O378: =SUM(M378:N378) -> 195.31999999999999
A379: 3406 | B379: EOL VENTOS DE SANTA JOANA IX | C379: 19.082.784/0002-53 | D379: 170.16 | E379: 0 | F379: 0 | G379: 0 | H379: 0 | I379: 0 | J379: 0 | K379: 188.09999999999999 | L379: 0 | M379: =SUM(J379:L379)-17.94 -> 170.16 | N379: 17.940000000000001 | O379: =SUM(M379:N379) -> 188.09999999999999
A380: 3407 | B380: EOL VENTOS DE SANTA JOANA X | C380: 19.082.754/0002-47 | D380: 170.16 | E380: 0 | F380: 0 | G380: 0 | H380: 0 | I380: 0 | J380: 0 | K380: 188.09999999999999 | L380: 0 | M380: =SUM(J380:L380)-17.94 -> 170.16 | N380: 17.940000000000001 | O380: =SUM(M380:N380) -> 188.09999999999999
A381: 3408 | B381: EOL VENTOS DE SANTA JOANA XI | C381: 19.082.675/0002-36 | D381: 170.16 | E381: 0 | F381: 0 | G381: 0 | H381: 0 | I381: 0 | J381: 0 | K381: 188.09999999999999 | L381: 0 | M381: =SUM(J381:L381)-17.94 -> 170.16 | N381: 17.940000000000001 | O381: =SUM(M381:N381) -> 188.09999999999999
A382: 3409 | B382: EOL VENTOS DE SANTA JOANA XII | C382: 19.082.701/0002-26 | D382: 166.13999999999999 | E382: 0 | F382: 0 | G382: 0 | H382: 0 | I382: 0 | J382: 0 | K382: 183.65000000000001 | L382: 0 | M382: =SUM(J382:L382)-17.51 -> 166.14000000000001 | N382: 17.510000000000002 | O382: =SUM(M382:N382) -> 183.65000000000001
A383: 3410 | B383: EOL VENTOS DE SANTA JOANA XIII | C383: 19.082.800/0002-08 | D383: 170.16 | E383: 0 | F383: 0 | G383: 0 | H383: 0 | I383: 0 | J383: 0 | K383: 188.09999999999999 | L383: 0 | M383: =SUM(J383:L383)-17.94 -> 170.16 | N383: 17.940000000000001 | O383: =SUM(M383:N383) -> 188.09999999999999
A384: 3411 | B384: EOL VENTOS DE SANTA JOANA XV | C384: 19.082.728/0002-19 | D384: 166.13999999999999 | E384: 0 | F384: 0 | G384: 0 | H384: 0 | I384: 0 | J384: 0 | K384: 183.65000000000001 | L384: 0 | M384: =SUM(J384:L384)-17.51 -> 166.14000000000001 | N384: 17.510000000000002 | O384: =SUM(M384:N384) -> 183.65000000000001
A385: 3412 | B385: EOL VENTOS DE SANTA JOANA XVI | C385: 19.082.822/0002-78 | D385: 166.13999999999999 | E385: 0 | F385: 0 | G385: 0 | H385: 0 | I385: 0 | J385: 0 | K385: 183.65000000000001 | L385: 0 | M385: =SUM(J385:L385)-17.51 -> 166.14000000000001 | N385: 17.510000000000002 | O385: =SUM(M385:N385) -> 183.65000000000001
A386: 3413 | B386: EOL VENTOS DE SANTO ONOFRE I | C386: 19.022.138/0001-10 | D386: 244.34999999999999 | E386: 0 | F386: 0 | G386: 0 | H386: 0 | I386: 0 | J386: 0 | K386: 270.11000000000001 | L386: 0 | M386: =SUM(J386:L386)-25.76 -> 244.35000000000002 | N386: 25.760000000000002 | O386: =SUM(M386:N386) -> 270.11000000000001
A387: 3414 | B387: EOL VENTOS DE SANTO ONOFRE II | C387: 19.022.974/0001-02 | D387: 242.72 | E387: 0 | F387: 0 | G387: 0 | H387: 0 | I387: 0 | J387: 0 | K387: 268.31 | L387: 0 | M387: =SUM(J387:L387)-25.59 -> 242.72 | N387: 25.59 | O387: =SUM(M387:N387) -> 268.31
A388: 3415 | B388: EOL VENTOS DE SANTO ONOFRE III | C388: 19.023.342/0001-55 | D388: 244.34999999999999 | E388: 0 | F388: 0 | G388: 0 | H388: 0 | I388: 0 | J388: 0 | K388: 270.11000000000001 | L388: 0 | M388: =SUM(J388:L388)-25.76 -> 244.35000000000002 | N388: 25.760000000000002 | O388: =SUM(M388:N388) -> 270.11000000000001
A389: 3416 | B389: EOL VENTOS DE SANTA JOANA II | C389: 19.023.213/0001-67 | D389: 244.34999999999999 | E389: 0 | F389: 0 | G389: 0 | H389: 0 | I389: 0 | J389: 0 | K389: 270.11000000000001 | L389: 0 | M389: =SUM(J389:L389)-25.76 -> 244.35000000000002 | N389: 25.760000000000002 | O389: =SUM(M389:N389) -> 270.11000000000001
A390: 3417 | B390: EOL VENTOS DE SANTA JOANA VI | C390: 19.022.818/0001-33 | D390: 243.53999999999999 | E390: 0 | F390: 0 | G390: 0 | H390: 0 | I390: 0 | J390: 0 | K390: 269.20999999999998 | L390: 0 | M390: =SUM(J390:L390)-25.67 -> 243.53999999999996 | N390: 25.670000000000002 | O390: =SUM(M390:N390) -> 269.20999999999998
A391: 3418 | B391: EOL VENTOS DE SANTA JOANA VIII | C391: 19.022.356/0001-54 | D391: 243.53999999999999 | E391: 0 | F391: 0 | G391: 0 | H391: 0 | I391: 0 | J391: 0 | K391: 269.20999999999998 | L391: 0 | M391: =SUM(J391:L391)-25.67 -> 243.53999999999996 | N391: 25.670000000000002 | O391: =SUM(M391:N391) -> 269.20999999999998
A392: 3419 | B392: EOL VENTOS DE SANTA JOANA XIV | C392: 19.023.513/0001-46 | D392: 244.34999999999999 | E392: 0 | F392: 0 | G392: 0 | H392: 0 | I392: 0 | J392: 0 | K392: 270.11000000000001 | L392: 0 | M392: =SUM(J392:L392)-25.76 -> 244.35000000000002 | N392: 25.760000000000002 | O392: =SUM(M392:N392) -> 270.11000000000001
A393: 3420 | B393: EOL BARAÚNAS I | C393: 19.354.626/0002-05 | D393: 596.53999999999996 | E393: 0 | F393: 0 | G393: 0 | H393: 0 | I393: 0 | J393: 0 | K393: 659.41999999999996 | L393: 0 | M393: =SUM(J393:L393)-62.88 -> 596.53999999999996 | N393: 62.880000000000003 | O393: =SUM(M393:N393) -> 659.41999999999996
A394: 3421 | B394: EOL MORRO BRANCO I | C394: 19.353.878/0002-10 | D394: 297.85000000000002 | E394: 0 | F394: 0 | G394: 0 | H394: 0 | I394: 0 | J394: 0 | K394: 329.25 | L394: 0 | M394: =SUM(J394:L394)-31.4 -> 297.85000000000002 | N394: 31.399999999999999 | O394: =SUM(M394:N394) -> 329.25
A395: 3422 | B395: EOL MUSSAMBE | C395: 19.353.849/0002-58 | D395: 297.85000000000002 | E395: 0 | F395: 0 | G395: 0 | H395: 0 | I395: 0 | J395: 0 | K395: 329.25 | L395: 0 | M395: =SUM(J395:L395)-31.4 -> 297.85000000000002 | N395: 31.399999999999999 | O395: =SUM(M395:N395) -> 329.25
A396: 3423 | B396: UFV FONTES SOLAR I e II | C396: 18.303.676/0002-09 | D396: 40.75 | E396: 0 | F396: 0 | G396: 0 | H396: 0 | I396: 0 | J396: 0 | K396: 45.049999999999997 | L396: 0 | M396: =SUM(J396:L396)-4.3 -> 40.75 | N396: 4.2999999999999998 | O396: =SUM(M396:N396) -> 45.049999999999997
A397: 3424 | B397: EOL ASSURUÁ II | C397: 19.246.799/0002-00 | D397: 361.54000000000002 | E397: 0 | F397: 0 | G397: 0 | H397: 0 | I397: 0 | J397: 0 | K397: 399.64999999999998 | L397: 0 | M397: =SUM(J397:L397)-38.11 -> 361.53999999999996 | N397: 38.109999999999999 | O397: =SUM(M397:N397) -> 399.64999999999998
A398: 3425 | B398: EOL ASSURUÁ V | C398: 19.246.831/0002-57 | D398: 244.00999999999999 | E398: 0 | F398: 0 | G398: 0 | H398: 0 | I398: 0 | J398: 0 | K398: 269.73000000000002 | L398: 0 | M398: =SUM(J398:L398)-25.72 -> 244.01000000000002 | N398: 25.719999999999999 | O398: =SUM(M398:N398) -> 269.73000000000002
A399: 3426 | B399: EOL ASSURUÁ VII | C399: 19.246.849/0002-59 | D399: 220.53 | E399: 0 | F399: 0 | G399: 0 | H399: 0 | I399: 0 | J399: 0 | K399: 243.78 | L399: 0 | M399: =SUM(J399:L399)-23.25 -> 220.53 | N399: 23.25 | O399: =SUM(M399:N399) -> 243.78
A400: 3427 | B400: EOL CARNAÚBAS | C400: 14.535.588/0001-92 | D400: 301.62 | E400: 0 | F400: 0 | G400: 0 | H400: 0 | I400: 0 | J400: 0 | K400: 333.41000000000003 | L400: 0 | M400: =SUM(J400:L400)-31.79 -> 301.62 | N400: 31.789999999999999 | O400: =SUM(M400:N400) -> 333.41000000000003
A401: 3428 | B401: EOL SÃO JOÃO | C401: 14.535.646/0001-88 | D401: 301.62 | E401: 0 | F401: 0 | G401: 0 | H401: 0 | I401: 0 | J401: 0 | K401: 333.41000000000003 | L401: 0 | M401: =SUM(J401:L401)-31.79 -> 301.62 | N401: 31.789999999999999 | O401: =SUM(M401:N401) -> 333.41000000000003
A402: 3429 | B402: EOL SANTO CRISTO | C402: 14.535.540/0001-84 | D402: 296.81 | E402: 0 | F402: 0 | G402: 0 | H402: 0 | I402: 0 | J402: 0 | K402: 328.10000000000002 | L402: 0 | M402: =SUM(J402:L402)-31.29 -> 296.81 | N402: 31.289999999999999 | O402: =SUM(M402:N402) -> 328.10000000000002
A403: 3430 | B403: EOL CAETITÉ A | C403: 19.233.858/0002-05 | D403: 191.44999999999999 | E403: 0 | F403: 0 | G403: 0 | H403: 0 | I403: 0 | J403: 0 | K403: 211.63 | L403: 0 | M403: =SUM(J403:L403)-20.18 -> 191.44999999999999 | N403: 20.18 | O403: =SUM(M403:N403) -> 211.63
A404: 3431 | B404: EOL CAETITÉ B | C404: 19.235.607/0002-60 | D404: 177.59999999999999 | E404: 0 | F404: 0 | G404: 0 | H404: 0 | I404: 0 | J404: 0 | K404: 196.31999999999999 | L404: 0 | M404: =SUM(J404:L404)-18.72 -> 177.59999999999999 | N404: 18.719999999999999 | O404: =SUM(M404:N404) -> 196.31999999999999
A405: 3432 | B405: EOL CAETITÉ C | C405: 19.560.109/0002-92 | D405: 68.900000000000006 | E405: 0 | F405: 0 | G405: 0 | H405: 0 | I405: 0 | J405: 0 | K405: 76.159999999999997 | L405: 0 | M405: =SUM(J405:L405)-7.26 -> 68.899999999999991 | N405: 7.2599999999999998 | O405: =SUM(M405:N405) -> 76.159999999999997
A406: 3433 | B406: EOL VENTOS DA ANDORINHA | C406: 17.613.512/0002-07 | D406: 359.39999999999998 | E406: 0 | F406: 0 | G406: 0 | H406: 0 | I406: 0 | J406: 0 | K406: 397.29000000000002 | L406: 0 | M406: =SUM(J406:L406)-37.89 -> 359.40000000000003 | N406: 37.890000000000001 | O406: =SUM(M406:N406) -> 397.29000000000002
A407: 3434 | B407: EOL VENTOS DE CAMPO FORMOSO I | C407: 17.613.280/0002-97 | D407: 359.39999999999998 | E407: 0 | F407: 0 | G407: 0 | H407: 0 | I407: 0 | J407: 0 | K407: 397.29000000000002 | L407: 0 | M407: =SUM(J407:L407)-37.89 -> 359.40000000000003 | N407: 37.890000000000001 | O407: =SUM(M407:N407) -> 397.29000000000002
A408: 3435 | B408: EOL VENTOS DE CAMPO FORMOSO II | C408: 17.613.629/0002-90 | D408: 359.39999999999998 | E408: 0 | F408: 0 | G408: 0 | H408: 0 | I408: 0 | J408: 0 | K408: 397.29000000000002 | L408: 0 | M408: =SUM(J408:L408)-37.89 -> 359.40000000000003 | N408: 37.890000000000001 | O408: =SUM(M408:N408) -> 397.29000000000002
A409: 3436 | B409: EOL VENTOS DE MORRINHOS | C409: 17.613.286/0002-64 | D409: 359.39999999999998 | E409: 0 | F409: 0 | G409: 0 | H409: 0 | I409: 0 | J409: 0 | K409: 397.29000000000002 | L409: 0 | M409: =SUM(J409:L409)-37.89 -> 359.40000000000003 | N409: 37.890000000000001 | O409: =SUM(M409:N409) -> 397.29000000000002
A410: 3437 | B410: EOL VERACE 24 | C410: 42.873.310/0003-22 | D410: 194.36000000000001 | E410: 0 | F410: 0 | G410: 0 | H410: 0 | I410: 0 | J410: 0 | K410: 214.84999999999999 | L410: 0 | M410: =SUM(J410:L410)-20.49 -> 194.35999999999999 | N410: 20.489999999999998 | O410: =SUM(M410:N410) -> 214.84999999999999
A411: 3438 | B411: EOL VERACE 25 | C411: 42.873.310/0003-22 | D411: 70.519999999999996 | E411: 0 | F411: 0 | G411: 0 | H411: 0 | I411: 0 | J411: 0 | K411: 77.950000000000003 | L411: 0 | M411: =SUM(J411:L411)-7.43 -> 70.52000000000001 | N411: 7.4299999999999997 | O411: =SUM(M411:N411) -> 77.950000000000017
A412: 3439 | B412: EOL VERACE 26 | C412: 42.873.310/0003-22 | D412: 141.27000000000001 | E412: 0 | F412: 0 | G412: 0 | H412: 0 | I412: 0 | J412: 0 | K412: 156.16 | L412: 0 | M412: =SUM(J412:L412)-14.89 -> 141.26999999999998 | N412: 14.890000000000001 | O412: =SUM(M412:N412) -> 156.15999999999997
A413: 3440 | B413: EOL VERACE 27 | C413: 42.873.310/0003-22 | D413: 158.91 | E413: 0 | F413: 0 | G413: 0 | H413: 0 | I413: 0 | J413: 0 | K413: 175.66 | L413: 0 | M413: =SUM(J413:L413)-16.75 -> 158.91 | N413: 16.75 | O413: =SUM(M413:N413) -> 175.66
A414: 3441 | B414: EOL VERACE 28 | C414: 42.873.310/0003-22 | D414: 123.62 | E414: 0 | F414: 0 | G414: 0 | H414: 0 | I414: 0 | J414: 0 | K414: 136.65000000000001 | L414: 0 | M414: =SUM(J414:L414)-13.03 -> 123.62 | N414: 13.029999999999999 | O414: =SUM(M414:N414) -> 136.65000000000001
A415: 3442 | B415: EOL VERACE 29 | C415: 42.873.310/0003-22 | D415: 176.69 | E415: 0 | F415: 0 | G415: 0 | H415: 0 | I415: 0 | J415: 0 | K415: 195.31999999999999 | L415: 0 | M415: =SUM(J415:L415)-18.63 -> 176.69 | N415: 18.629999999999999 | O415: =SUM(M415:N415) -> 195.31999999999999
A416: 3443 | B416: EOL VERACE 30 | C416: 42.873.310/0003-22 | D416: 176.69 | E416: 0 | F416: 0 | G416: 0 | H416: 0 | I416: 0 | J416: 0 | K416: 195.31999999999999 | L416: 0 | M416: =SUM(J416:L416)-18.63 -> 176.69 | N416: 18.629999999999999 | O416: =SUM(M416:N416) -> 195.31999999999999
A417: 3444 | B417: EOL VERACE 31 | C417: 42.873.310/0003-22 | D417: 88.260000000000005 | E417: 0 | F417: 0 | G417: 0 | H417: 0 | I417: 0 | J417: 0 | K417: 97.560000000000002 | L417: 0 | M417: =SUM(J417:L417)-9.3 -> 88.260000000000005 | N417: 9.3000000000000007 | O417: =SUM(M417:N417) -> 97.560000000000002
A418: 3445 | B418: EOL VERACE 35 | C418: 42.873.310/0003-22 | D418: 123.62 | E418: 0 | F418: 0 | G418: 0 | H418: 0 | I418: 0 | J418: 0 | K418: 136.65000000000001 | L418: 0 | M418: =SUM(J418:L418)-13.03 -> 123.62 | N418: 13.029999999999999 | O418: =SUM(M418:N418) -> 136.65000000000001
A419: 3446 | B419: EOL VERACE 36 | C419: 42.873.310/0003-22 | D419: 212.02000000000001 | E419: 0 | F419: 0 | G419: 0 | H419: 0 | I419: 0 | J419: 0 | K419: 234.37 | L419: 0 | M419: =SUM(J419:L419)-22.35 -> 212.02000000000001 | N419: 22.350000000000001 | O419: =SUM(M419:N419) -> 234.37
A420: 3447 | B420: EOL CAPÃO DO INGLÊS | C420: 02.016.507/0001-69 | D420: 95.25 | E420: 0 | F420: 0 | G420: 0 | H420: 0 | I420: 0 | J420: 0 | K420: 105.29000000000001 | L420: 0 | M420: =SUM(J420:L420)-10.04 -> 95.25 | N420: 10.039999999999999 | O420: =SUM(M420:N420) -> 105.28999999999999
A421: 3448 | B421: EOL COXILHA SECA | C421: 02.016.507/0001-69 | D421: 288.98000000000002 | E421: 0 | F421: 0 | G421: 0 | H421: 0 | I421: 0 | J421: 0 | K421: 319.44 | L421: 0 | M421: =SUM(J421:L421)-30.46 -> 288.98000000000002 | N421: 30.460000000000001 | O421: =SUM(M421:N421) -> 319.44
A422: 3449 | B422: EOL GALPÕES | C422: 02.016.507/0001-69 | D422: 76.390000000000001 | E422: 0 | F422: 0 | G422: 0 | H422: 0 | I422: 0 | J422: 0 | K422: 84.439999999999998 | L422: 0 | M422: =SUM(J422:L422)-8.05 -> 76.390000000000001 | N422: 8.0500000000000007 | O422: =SUM(M422:N422) -> 84.439999999999998
A423: 3450 | B423: EOL VENTOS DO SERTÃO | C423: 17.613.432/0002-51 | D423: 359.39999999999998 | E423: 0 | F423: 0 | G423: 0 | H423: 0 | I423: 0 | J423: 0 | K423: 397.29000000000002 | L423: 0 | M423: =SUM(J423:L423)-37.89 -> 359.40000000000003 | N423: 37.890000000000001 | O423: =SUM(M423:N423) -> 397.29000000000002
A424: 3451 | B424: EOL VENTOS DE SANTA BRÍGIDA I | C424: 17.875.304/0001-03 | D424: 111.3 | E424: 0 | F424: 0 | G424: 0 | H424: 0 | I424: 0 | J424: 0 | K424: 123.03 | L424: 0 | M424: =SUM(J424:L424)-11.73 -> 111.3 | N424: 11.73 | O424: =SUM(M424:N424) -> 123.03
A425: 3452 | B425: EOL VENTOS DE SANTA BRÍGIDA II | C425: 17.875.194/0001-71 | D425: 222.81 | E425: 0 | F425: 0 | G425: 0 | H425: 0 | I425: 0 | J425: 0 | K425: 246.30000000000001 | L425: 0 | M425: =SUM(J425:L425)-23.49 -> 222.81 | N425: 23.489999999999998 | O425: =SUM(M425:N425) -> 246.30000000000001
A426: 3453 | B426: EOL VENTOS DE SANTA BRÍGIDA III | C426: 17.875.184/0001-36 | D426: 235.78 | E426: 0 | F426: 0 | G426: 0 | H426: 0 | I426: 0 | J426: 0 | K426: 260.63 | L426: 0 | M426: =SUM(J426:L426)-24.85 -> 235.78 | N426: 24.850000000000001 | O426: =SUM(M426:N426) -> 260.63
A427: 3454 | B427: EOL VENTOS DE SANTA BRÍGIDA IV | C427: 17.875.122/0001-24 | D427: 222.81 | E427: 0 | F427: 0 | G427: 0 | H427: 0 | I427: 0 | J427: 0 | K427: 246.30000000000001 | L427: 0 | M427: =SUM(J427:L427)-23.49 -> 222.81 | N427: 23.489999999999998 | O427: =SUM(M427:N427) -> 246.30000000000001
A428: 3455 | B428: EOL VENTOS DE SANTA BRÍGIDA V | C428: 17.875.103/0001-06 | D428: 235.78 | E428: 0 | F428: 0 | G428: 0 | H428: 0 | I428: 0 | J428: 0 | K428: 260.63 | L428: 0 | M428: =SUM(J428:L428)-24.85 -> 235.78 | N428: 24.850000000000001 | O428: =SUM(M428:N428) -> 260.63
A429: 3456 | B429: EOL VENTOS DE SANTA BRÍGIDA VI | C429: 17.875.341/0001-03 | D429: 235.78 | E429: 0 | F429: 0 | G429: 0 | H429: 0 | I429: 0 | J429: 0 | K429: 260.63 | L429: 0 | M429: =SUM(J429:L429)-24.85 -> 235.78 | N429: 24.850000000000001 | O429: =SUM(M429:N429) -> 260.63
A430: 3457 | B430: EOL VENTOS DE SANTA BRÍGIDA VII | C430: 17.875.270/0001-49 | D430: 222.81 | E430: 0 | F430: 0 | G430: 0 | H430: 0 | I430: 0 | J430: 0 | K430: 246.30000000000001 | L430: 0 | M430: =SUM(J430:L430)-23.49 -> 222.81 | N430: 23.489999999999998 | O430: =SUM(M430:N430) -> 246.30000000000001
A431: 3458 | B431: EOL ESPERANÇA | C431: 19.011.517/0002-95 | D431: 443.75999999999999 | E431: 0 | F431: 0 | G431: 0 | H431: 0 | I431: 0 | J431: 0 | K431: 490.54000000000002 | L431: 0 | M431: =SUM(J431:L431)-46.78 -> 443.75999999999999 | N431: 46.780000000000001 | O431: =SUM(M431:N431) -> 490.53999999999996
A432: 3459 | B432: EOL MANIÇOBA | C432: 19.011.479/0002-70 | D432: 474.75 | E432: 0 | F432: 0 | G432: 0 | H432: 0 | I432: 0 | J432: 0 | K432: 524.78999999999996 | L432: 0 | M432: =SUM(J432:L432)-50.04 -> 474.74999999999994 | N432: 50.039999999999999 | O432: =SUM(M432:N432) -> 524.78999999999996
A433: 3460 | B433: EOL DAMASCENA | C433: 19.046.080/0002-25 | D433: 474.75 | E433: 0 | F433: 0 | G433: 0 | H433: 0 | I433: 0 | J433: 0 | K433: 524.78999999999996 | L433: 0 | M433: =SUM(J433:L433)-50.04 -> 474.74999999999994 | N433: 50.039999999999999 | O433: =SUM(M433:N433) -> 524.78999999999996
A434: 3461 | B434: EOL VENTOS DE SANTA JOANA I | C434: 19.724.929/0002-72 | D434: 234.96000000000001 | E434: 0 | F434: 0 | G434: 0 | H434: 0 | I434: 0 | J434: 0 | K434: 259.73000000000002 | L434: 0 | M434: =SUM(J434:L434)-24.77 -> 234.96000000000001 | N434: 24.77 | O434: =SUM(M434:N434) -> 259.73000000000002
A435: 3462 | B435: EOL VENTOS DE SANTA JOANA IV | C435: 19.725.614/0002-40 | D435: 221.13999999999999 | E435: 0 | F435: 0 | G435: 0 | H435: 0 | I435: 0 | J435: 0 | K435: 244.44999999999999 | L435: 0 | M435: =SUM(J435:L435)-23.31 -> 221.13999999999999 | N435: 23.309999999999999 | O435: =SUM(M435:N435) -> 244.44999999999999
A436: 3463 | B436: EOL VENTOS DE SANTA JOANA V | C436: 19.725.631/0002-87 | D436: 234.96000000000001 | E436: 0 | F436: 0 | G436: 0 | H436: 0 | I436: 0 | J436: 0 | K436: 259.73000000000002 | L436: 0 | M436: =SUM(J436:L436)-24.77 -> 234.96000000000001 | N436: 24.77 | O436: =SUM(M436:N436) -> 259.73000000000002
A437: 3464 | B437: EOL VENTOS DE SANTA JOANA VII | C437: 19.725.315/0002-05 | D437: 234.96000000000001 | E437: 0 | F437: 0 | G437: 0 | H437: 0 | I437: 0 | J437: 0 | K437: 259.73000000000002 | L437: 0 | M437: =SUM(J437:L437)-24.77 -> 234.96000000000001 | N437: 24.77 | O437: =SUM(M437:N437) -> 259.73000000000002
A438: 3465 | B438: EOL VENTOS DE SANTO AUGUSTO III | C438: 17.875.483/0002-51 | D438: 240.65000000000001 | E438: 0 | F438: 0 | G438: 0 | H438: 0 | I438: 0 | J438: 0 | K438: 266.01999999999998 | L438: 0 | M438: =SUM(J438:L438)-25.37 -> 240.64999999999998 | N438: 25.370000000000001 | O438: =SUM(M438:N438) -> 266.01999999999998
A439: 3466 | B439: EOL VENTOS DE SANTO AUGUSTO IV | C439: 19.781.992/0002-40 | D439: 234.96000000000001 | E439: 0 | F439: 0 | G439: 0 | H439: 0 | I439: 0 | J439: 0 | K439: 259.73000000000002 | L439: 0 | M439: =SUM(J439:L439)-24.77 -> 234.96000000000001 | N439: 24.77 | O439: =SUM(M439:N439) -> 259.73000000000002
A440: 3467 | B440: EOL VENTOS DE SANTO AUGUSTO V | C440: 17.875.427/0002-17 | D440: 240.65000000000001 | E440: 0 | F440: 0 | G440: 0 | H440: 0 | I440: 0 | J440: 0 | K440: 266.01999999999998 | L440: 0 | M440: =SUM(J440:L440)-25.37 -> 240.64999999999998 | N440: 25.370000000000001 | O440: =SUM(M440:N440) -> 266.01999999999998
A441: 3468 | B441: EOL SERRA DAS VACAS I | C441: 18.127.269/0001-07 | D441: 183.15000000000001 | E441: 0 | F441: 0 | G441: 0 | H441: 0 | I441: 0 | J441: 0 | K441: 202.46000000000001 | L441: 0 | M441: =SUM(J441:L441)-19.31 -> 183.15000000000001 | N441: 19.309999999999999 | O441: =SUM(M441:N441) -> 202.46000000000001
A442: 3469 | B442: EOL SERRA DAS VACAS II | C442: 19.224.741/0001-84 | D442: 172.28 | E442: 0 | F442: 0 | G442: 0 | H442: 0 | I442: 0 | J442: 0 | K442: 190.44 | L442: 0 | M442: =SUM(J442:L442)-18.16 -> 172.28 | N442: 18.16 | O442: =SUM(M442:N442) -> 190.44
A443: 3470 | B443: EOL SERRA DAS VACAS IV | C443: 19.694.146/0001-02 | D443: 176.11000000000001 | E443: 0 | F443: 0 | G443: 0 | H443: 0 | I443: 0 | J443: 0 | K443: 194.66999999999999 | L443: 0 | M443: =SUM(J443:L443)-18.56 -> 176.10999999999999 | N443: 18.559999999999999 | O443: =SUM(M443:N443) -> 194.66999999999999
A444: 3471 | B444: EOL VERACE 34 | C444: 42.873.310/0003-22 | D444: 141.27000000000001 | E444: 0 | F444: 0 | G444: 0 | H444: 0 | I444: 0 | J444: 0 | K444: 156.16 | L444: 0 | M444: =SUM(J444:L444)-14.89 -> 141.26999999999998 | N444: 14.890000000000001 | O444: =SUM(M444:N444) -> 156.15999999999997
A445: 3472 | B445: EOL CAIÇARA I | C445: 15.313.271/0001-74 | D445: 256.33999999999997 | E445: 0 | F445: 0 | G445: 0 | H445: 0 | I445: 0 | J445: 0 | K445: 283.36000000000001 | L445: 0 | M445: =SUM(J445:L445)-27.02 -> 256.34000000000003 | N445: 27.02 | O445: =SUM(M445:N445) -> 283.36000000000001
A446: 3473 | B446: EOL CAIÇARA II | C446: 15.313.113/0001-14 | D446: 170.97999999999999 | E446: 0 | F446: 0 | G446: 0 | H446: 0 | I446: 0 | J446: 0 | K446: 189 | L446: 0 | M446: =SUM(J446:L446)-18.02 -> 170.97999999999999 | N446: 18.02 | O446: =SUM(M446:N446) -> 189
A447: 3474 | B447: EOL JUNCO I | C447: 15.313.226/0001-10 | D447: 228.40000000000001 | E447: 0 | F447: 0 | G447: 0 | H447: 0 | I447: 0 | J447: 0 | K447: 252.47999999999999 | L447: 0 | M447: =SUM(J447:L447)-24.08 -> 228.39999999999998 | N447: 24.079999999999998 | O447: =SUM(M447:N447) -> 252.47999999999996
A448: 3475 | B448: EOL JUNCO II | C448: 15.313.187/0001-50 | D448: 227.91999999999999 | E448: 0 | F448: 0 | G448: 0 | H448: 0 | I448: 0 | J448: 0 | K448: 251.94999999999999 | L448: 0 | M448: =SUM(J448:L448)-24.03 -> 227.91999999999999 | N448: 24.030000000000001 | O448: =SUM(M448:N448) -> 251.94999999999999
A449: 3476 | B449: EOL SERRA DAS VACAS III | C449: 19.694.110/0001-29 | D449: 186.88 | E449: 0 | F449: 0 | G449: 0 | H449: 0 | I449: 0 | J449: 0 | K449: 206.58000000000001 | L449: 0 | M449: =SUM(J449:L449)-19.7 -> 186.88000000000002 | N449: 19.699999999999999 | O449: =SUM(M449:N449) -> 206.58000000000001
A450: 3477 | B450: RENOVA (EOL ABIL) | C450: 18.911.031/0001-60 | D450: 194.97 | E450: 0 | F450: 0 | G450: 0 | H450: 0 | I450: 0 | J450: 0 | K450: 215.52000000000001 | L450: 0 | M450: =SUM(J450:L450)-20.55 -> 194.97 | N450: 20.550000000000001 | O450: =SUM(M450:N450) -> 215.52000000000001
A451: 3478 | B451: EOL BORGO | C451: 12.041.341/0001-94 | D451: 227.05000000000001 | E451: 0 | F451: 0 | G451: 0 | H451: 0 | I451: 0 | J451: 0 | K451: 250.97999999999999 | L451: 0 | M451: =SUM(J451:L451)-23.93 -> 227.04999999999998 | N451: 23.93 | O451: =SUM(M451:N451) -> 250.97999999999999
A452: 3479 | B452: EOL CAETITÉ | C452: 11.201.767/0001-03 | D452: 337.87 | E452: 0 | F452: 0 | G452: 0 | H452: 0 | I452: 0 | J452: 0 | K452: 373.49000000000001 | L452: 0 | M452: =SUM(J452:L452)-35.62 -> 337.87 | N452: 35.619999999999997 | O452: =SUM(M452:N452) -> 373.49000000000001
A453: 3480 | B453: EOL ESPIGÃO | C453: 11.197.321/0001-44 | D453: 113.52 | E453: 0 | F453: 0 | G453: 0 | H453: 0 | I453: 0 | J453: 0 | K453: 125.48999999999999 | L453: 0 | M453: =SUM(J453:L453)-11.97 -> 113.52 | N453: 11.970000000000001 | O453: =SUM(M453:N453) -> 125.48999999999999
A454: 3481 | B454: RENOVA (EOL FOLHA DE SERRA) | C454: 18.910.740/0001-20 | D454: 178.44 | E454: 0 | F454: 0 | G454: 0 | H454: 0 | I454: 0 | J454: 0 | K454: 197.25 | L454: 0 | M454: =SUM(J454:L454)-18.81 -> 178.44 | N454: 18.809999999999999 | O454: =SUM(M454:N454) -> 197.25
A455: 3482 | B455: RENOVA (EOL JABUTICABA) | C455: 18.870.194/0001-41 | D455: 73.890000000000001 | E455: 0 | F455: 0 | G455: 0 | H455: 0 | I455: 0 | J455: 0 | K455: 81.680000000000007 | L455: 0 | M455: =SUM(J455:L455)-7.79 -> 73.890000000000001 | N455: 7.79 | O455: =SUM(M455:N455) -> 81.680000000000007
A456: 3483 | B456: RENOVA (EOL J. DO CERRADO) | C456: 18.870.265/0001-06 | D456: 172.78999999999999 | E456: 0 | F456: 0 | G456: 0 | H456: 0 | I456: 0 | J456: 0 | K456: 191 | L456: 0 | M456: =SUM(J456:L456)-18.21 -> 172.78999999999999 | N456: 18.210000000000001 | O456: =SUM(M456:N456) -> 191
A457: 3484 | B457: EOL PELOURINHO | C457: 12.048.031/0001-00 | D457: 245.97 | E457: 0 | F457: 0 | G457: 0 | H457: 0 | I457: 0 | J457: 0 | K457: 271.89999999999998 | L457: 0 | M457: =SUM(J457:L457)-25.93 -> 245.96999999999997 | N457: 25.93 | O457: =SUM(M457:N457) -> 271.89999999999998
A458: 3485 | B458: EOL S. DO ESPINHAÇO | C458: 12.049.958/0001-56 | D458: 208.13 | E458: 0 | F458: 0 | G458: 0 | H458: 0 | I458: 0 | J458: 0 | K458: 230.06999999999999 | L458: 0 | M458: =SUM(J458:L458)-21.94 -> 208.13 | N458: 21.940000000000001 | O458: =SUM(M458:N458) -> 230.06999999999999
A459: 3486 | B459: RENOVA (EOL TÁBUA) | C459: 18.870.007/0001-20 | D459: 123.56 | E459: 0 | F459: 0 | G459: 0 | H459: 0 | I459: 0 | J459: 0 | K459: 136.58000000000001 | L459: 0 | M459: =SUM(J459:L459)-13.02 -> 123.56000000000002 | N459: 13.02 | O459: =SUM(M459:N459) -> 136.58000000000001
A460: 3487 | B460: RENOVA (EOL VAQUETA) | C460: 18.684.356/0001-57 | D460: 192.52000000000001 | E460: 0 | F460: 0 | G460: 0 | H460: 0 | I460: 0 | J460: 0 | K460: 212.81 | L460: 0 | M460: =SUM(J460:L460)-20.29 -> 192.52000000000001 | N460: 20.289999999999999 | O460: =SUM(M460:N460) -> 212.81
A461: 3488 | B461: EOL ANGICAL | C461: 14.570.783/0002-34 | D461: 144.38 | E461: 0 | F461: 0 | G461: 0 | H461: 0 | I461: 0 | J461: 0 | K461: 159.59999999999999 | L461: 0 | M461: =SUM(J461:L461)-15.22 -> 144.38 | N461: 15.220000000000001 | O461: =SUM(M461:N461) -> 159.59999999999999
A462: 3489 | B462: EOL CAITITU | C462: 14.570.861/0002-09 | D462: 247.55000000000001 | E462: 0 | F462: 0 | G462: 0 | H462: 0 | I462: 0 | J462: 0 | K462: 273.64999999999998 | L462: 0 | M462: =SUM(J462:L462)-26.1 -> 247.54999999999998 | N462: 26.100000000000001 | O462: =SUM(M462:N462) -> 273.64999999999998
A463: 3490 | B463: EOL COQUEIRINHO | C463: 14.570.819/0002-80 | D463: 329.99000000000001 | E463: 0 | F463: 0 | G463: 0 | H463: 0 | I463: 0 | J463: 0 | K463: 364.77999999999997 | L463: 0 | M463: =SUM(J463:L463)-34.79 -> 329.98999999999995 | N463: 34.789999999999999 | O463: =SUM(M463:N463) -> 364.77999999999997
A464: 3491 | B464: EOL CORRUPIÃO | C464: 14.570.800/0002-33 | D464: 309.38 | E464: 0 | F464: 0 | G464: 0 | H464: 0 | I464: 0 | J464: 0 | K464: 341.99000000000001 | L464: 0 | M464: =SUM(J464:L464)-32.61 -> 309.38 | N464: 32.609999999999999 | O464: =SUM(M464:N464) -> 341.99000000000001
A465: 3492 | B465: EOL INHAMBU | C465: 14.572.367/0002-75 | D465: 337.87 | E465: 0 | F465: 0 | G465: 0 | H465: 0 | I465: 0 | J465: 0 | K465: 373.49000000000001 | L465: 0 | M465: =SUM(J465:L465)-35.62 -> 337.87 | N465: 35.619999999999997 | O465: =SUM(M465:N465) -> 373.49000000000001
A466: 3493 | B466: EOL TAMANDUÁ MIRIM | C466: 14.571.068/0002-16 | D466: 329.99000000000001 | E466: 0 | F466: 0 | G466: 0 | H466: 0 | I466: 0 | J466: 0 | K466: 364.77999999999997 | L466: 0 | M466: =SUM(J466:L466)-34.79 -> 329.98999999999995 | N466: 34.789999999999999 | O466: =SUM(M466:N466) -> 364.77999999999997
A467: 3494 | B467: EOL TEIU | C467: 14.570.839/0002-50 | D467: 185.59999999999999 | E467: 0 | F467: 0 | G467: 0 | H467: 0 | I467: 0 | J467: 0 | K467: 205.16 | L467: 0 | M467: =SUM(J467:L467)-19.56 -> 185.59999999999999 | N467: 19.559999999999999 | O467: =SUM(M467:N467) -> 205.16
A468: 3495 | B468: EOL VENTOS DE SANTA JOANA III | C468: 19.725.354/0002-02 | D468: 240.65000000000001 | E468: 0 | F468: 0 | G468: 0 | H468: 0 | I468: 0 | J468: 0 | K468: 266.01999999999998 | L468: 0 | M468: =SUM(J468:L468)-25.37 -> 240.64999999999998 | N468: 25.370000000000001 | O468: =SUM(M468:N468) -> 266.01999999999998
A469: 3496 | B469: EDP (UHE CACHOEIRA CALDEIRÃO) | C469: 17.200.920/0001-56 | D469: 3707.6900000000001 | E469: 0 | F469: 0 | G469: 0 | H469: 0 | I469: 0 | J469: 0 | K469: 4098.5299999999997 | L469: 0 | M469: =SUM(J469:L469)-390.84 -> 3707.6899999999996 | N469: 390.83999999999997 | O469: =SUM(M469:N469) -> 4098.5299999999997
A470: 3497 | B470: EOL ITAREMA II | C470: 19.560.074/0002-91 | D470: 242.78 | E470: 0 | F470: 0 | G470: 0 | H470: 0 | I470: 0 | J470: 0 | K470: 268.37 | L470: 0 | M470: =SUM(J470:L470)-25.59 -> 242.78 | N470: 25.59 | O470: =SUM(M470:N470) -> 268.37
A471: 3498 | B471: EOL ITAREMA V | C471: 19.560.868/0002-55 | D471: 188.02000000000001 | E471: 0 | F471: 0 | G471: 0 | H471: 0 | I471: 0 | J471: 0 | K471: 207.84 | L471: 0 | M471: =SUM(J471:L471)-19.82 -> 188.02000000000001 | N471: 19.82 | O471: =SUM(M471:N471) -> 207.84
A472: 3499 | B472: EOL S. DE SANTANA I | C472: 12.848.401/0001-85 | D472: 211.24000000000001 | E472: 0 | F472: 0 | G472: 0 | H472: 0 | I472: 0 | J472: 0 | K472: 233.50999999999999 | L472: 0 | M472: =SUM(J472:L472)-22.27 -> 211.23999999999998 | N472: 22.27 | O472: =SUM(M472:N472) -> 233.50999999999999
A473: 3500 | B473: EOL S. DE SANTANA II | C473: 12.851.098/0001-70 | D473: 308.88999999999999 | E473: 0 | F473: 0 | G473: 0 | H473: 0 | I473: 0 | J473: 0 | K473: 341.44999999999999 | L473: 0 | M473: =SUM(J473:L473)-32.56 -> 308.88999999999999 | N473: 32.560000000000002 | O473: =SUM(M473:N473) -> 341.44999999999999
A474: 3501 | B474: EOL S. DE SANTANA III | C474: 12.848.783/0001-47 | D474: 316.31999999999999 | E474: 0 | F474: 0 | G474: 0 | H474: 0 | I474: 0 | J474: 0 | K474: 349.66000000000003 | L474: 0 | M474: =SUM(J474:L474)-33.34 -> 316.32000000000005 | N474: 33.340000000000003 | O474: =SUM(M474:N474) -> 349.66000000000008
A475: 3502 | B475: EOL ITAREMA I | C475: 19.560.032/0002-50 | D475: 242.63999999999999 | E475: 0 | F475: 0 | G475: 0 | H475: 0 | I475: 0 | J475: 0 | K475: 268.22000000000003 | L475: 0 | M475: =SUM(J475:L475)-25.58 -> 242.64000000000004 | N475: 25.579999999999998 | O475: =SUM(M475:N475) -> 268.22000000000003
A476: 3503 | B476: EOL ITAREMA III | C476: 19.560.839/0002-93 | D476: 133.68000000000001 | E476: 0 | F476: 0 | G476: 0 | H476: 0 | I476: 0 | J476: 0 | K476: 147.77000000000001 | L476: 0 | M476: =SUM(J476:L476)-14.09 -> 133.68000000000001 | N476: 14.09 | O476: =SUM(M476:N476) -> 147.77000000000001
A477: 3504 | B477: EOL BARAÚNAS II | C477: 19.905.679/0002-77 | D477: 237.22 | E477: 0 | F477: 0 | G477: 0 | H477: 0 | I477: 0 | J477: 0 | K477: 262.23000000000002 | L477: 0 | M477: =SUM(J477:L477)-25.01 -> 237.22000000000003 | N477: 25.010000000000002 | O477: =SUM(M477:N477) -> 262.23000000000002
A478: 3505 | B478: EOL BANDA DE COURO | C478: 19.905.727/0002-27 | D478: 278.52999999999997 | E478: 0 | F478: 0 | G478: 0 | H478: 0 | I478: 0 | J478: 0 | K478: 307.88999999999999 | L478: 0 | M478: =SUM(J478:L478)-29.36 -> 278.52999999999997 | N478: 29.359999999999999 | O478: =SUM(M478:N478) -> 307.88999999999999
A479: 3507 | B479: EOL CACIMBAS I | C479: 13.389.543/0002-75 | D479: 138.40000000000001 | E479: 0 | F479: 0 | G479: 0 | H479: 0 | I479: 0 | J479: 0 | K479: 152.99000000000001 | L479: 0 | M479: =SUM(J479:L479)-14.59 -> 138.40000000000001 | N479: 14.59 | O479: =SUM(M479:N479) -> 152.99000000000001
A480: 3508 | B480: UTE KLABIN CELULOSE | C480: 89.637.490/0165-72 | D480: 1620.0699999999999 | E480: 0 | F480: 0 | G480: 0 | H480: 0 | I480: 0 | J480: 0 | K480: 1790.8499999999999 | L480: 0 | M480: =SUM(J480:L480)-170.78 -> 1620.0699999999999 | N480: 170.78 | O480: =SUM(M480:N480) -> 1790.8499999999999
A481: 3509 | B481: EOL BAIXA DO FEIJÃO I | C481: 14.496.492/0002-43 | D481: 288.98000000000002 | E481: 0 | F481: 0 | G481: 0 | H481: 0 | I481: 0 | J481: 0 | K481: 319.44 | L481: 0 | M481: =SUM(J481:L481)-30.46 -> 288.98000000000002 | N481: 30.460000000000001 | O481: =SUM(M481:N481) -> 319.44
A482: 3510 | B482: EOL BAIXA DO FEIJÃO II | C482: 14.496.545/0002-26 | D482: 288.00999999999999 | E482: 0 | F482: 0 | G482: 0 | H482: 0 | I482: 0 | J482: 0 | K482: 318.37 | L482: 0 | M482: =SUM(J482:L482)-30.36 -> 288.00999999999999 | N482: 30.359999999999999 | O482: =SUM(M482:N482) -> 318.37
A483: 3511 | B483: EOL BAIXA DO FEIJÃO III | C483: 14.496.290/0002-00 | D483: 289.56999999999999 | E483: 0 | F483: 0 | G483: 0 | H483: 0 | I483: 0 | J483: 0 | K483: 320.08999999999997 | L483: 0 | M483: =SUM(J483:L483)-30.52 -> 289.56999999999999 | N483: 30.52 | O483: =SUM(M483:N483) -> 320.08999999999997
A484: 3512 | B484: EOL BAIXA DO FEIJÃO IV | C484: 14.496.317/0002-56 | D484: 291.30000000000001 | E484: 0 | F484: 0 | G484: 0 | H484: 0 | I484: 0 | J484: 0 | K484: 322.00999999999999 | L484: 0 | M484: =SUM(J484:L484)-30.71 -> 291.30000000000001 | N484: 30.710000000000001 | O484: =SUM(M484:N484) -> 322.00999999999999
A485: 3513 | B485: EOL VENTOS DOS GUARÁS I | C485: 13.344.343/0002-04 | D485: 389.14999999999998 | E485: 0 | F485: 0 | G485: 0 | H485: 0 | I485: 0 | J485: 0 | K485: 430.17000000000002 | L485: 0 | M485: =SUM(J485:L485)-41.02 -> 389.15000000000003 | N485: 41.020000000000003 | O485: =SUM(M485:N485) -> 430.17000000000002
A486: 3514 | B486: CPFL (EOL CAMPO DOS VENTOS I) | C486: 10.797.890/0001-68 | D486: 203.55000000000001 | E486: 0 | F486: 0 | G486: 0 | H486: 0 | I486: 0 | J486: 0 | K486: 225.00999999999999 | L486: 0 | M486: =SUM(J486:L486)-21.46 -> 203.54999999999998 | N486: 21.460000000000001 | O486: =SUM(M486:N486) -> 225.00999999999999
A487: 3515 | B487: CPFL (EOL CAMPO DOS VENTOS III) | C487: 10.797.891/0001-02 | D487: 203.21000000000001 | E487: 0 | F487: 0 | G487: 0 | H487: 0 | I487: 0 | J487: 0 | K487: 224.63 | L487: 0 | M487: =SUM(J487:L487)-21.42 -> 203.20999999999998 | N487: 21.420000000000002 | O487: =SUM(M487:N487) -> 224.63
A488: 3516 | B488: CPFL (EOL CAMPO DOS VENTOS V) | C488: 10.797.888/0001-99 | D488: 202.84999999999999 | E488: 0 | F488: 0 | G488: 0 | H488: 0 | I488: 0 | J488: 0 | K488: 224.22999999999999 | L488: 0 | M488: =SUM(J488:L488)-21.38 -> 202.84999999999999 | N488: 21.379999999999999 | O488: =SUM(M488:N488) -> 224.22999999999999
A489: 3517 | B489: EOL VENTOS DE SÃO CLEMENTE 1 | C489: 21.014.004/0002-80 | D489: 313.19999999999999 | E489: 0 | F489: 0 | G489: 0 | H489: 0 | I489: 0 | J489: 0 | K489: 346.22000000000003 | L489: 0 | M489: =SUM(J489:L489)-33.02 -> 313.20000000000005 | N489: 33.020000000000003 | O489: =SUM(M489:N489) -> 346.22000000000003
A490: 3518 | B490: EOL VENTOS DE SÃO CLEMENTE 2 | C490: 21.014.134/0002-12 | D490: 313.19999999999999 | E490: 0 | F490: 0 | G490: 0 | H490: 0 | I490: 0 | J490: 0 | K490: 346.22000000000003 | L490: 0 | M490: =SUM(J490:L490)-33.02 -> 313.20000000000005 | N490: 33.020000000000003 | O490: =SUM(M490:N490) -> 346.22000000000003
A491: 3519 | B491: EOL VENTOS DE SÃO CLEMENTE 3 | C491: 21.014.090/0002-20 | D491: 313.19999999999999 | E491: 0 | F491: 0 | G491: 0 | H491: 0 | I491: 0 | J491: 0 | K491: 346.22000000000003 | L491: 0 | M491: =SUM(J491:L491)-33.02 -> 313.20000000000005 | N491: 33.020000000000003 | O491: =SUM(M491:N491) -> 346.22000000000003
A492: 3520 | B492: EOL VENTOS DE SÃO CLEMENTE 4 | C492: 21.013.854/0002-63 | D492: 313.19999999999999 | E492: 0 | F492: 0 | G492: 0 | H492: 0 | I492: 0 | J492: 0 | K492: 346.22000000000003 | L492: 0 | M492: =SUM(J492:L492)-33.02 -> 313.20000000000005 | N492: 33.020000000000003 | O492: =SUM(M492:N492) -> 346.22000000000003
A493: 3521 | B493: EOL VENTOS DE SÃO CLEMENTE 5 | C493: 21.013.993/0002-97 | D493: 313.19999999999999 | E493: 0 | F493: 0 | G493: 0 | H493: 0 | I493: 0 | J493: 0 | K493: 346.22000000000003 | L493: 0 | M493: =SUM(J493:L493)-33.02 -> 313.20000000000005 | N493: 33.020000000000003 | O493: =SUM(M493:N493) -> 346.22000000000003
A494: 3522 | B494: EOL VENTOS DE SÃO CLEMENTE 6 | C494: 21.013.968/0002-03 | D494: 277.63999999999999 | E494: 0 | F494: 0 | G494: 0 | H494: 0 | I494: 0 | J494: 0 | K494: 306.91000000000003 | L494: 0 | M494: =SUM(J494:L494)-29.27 -> 277.64000000000004 | N494: 29.27 | O494: =SUM(M494:N494) -> 306.91000000000003
A495: 3523 | B495: EOL VENTOS DE SÃO CLEMENTE 7 | C495: 21.013.833/0002-48 | D495: 261.89999999999998 | E495: 0 | F495: 0 | G495: 0 | H495: 0 | I495: 0 | J495: 0 | K495: 289.50999999999999 | L495: 0 | M495: =SUM(J495:L495)-27.61 -> 261.89999999999998 | N495: 27.609999999999999 | O495: =SUM(M495:N495) -> 289.50999999999999
A496: 3524 | B496: EOL VENTOS DE SÃO CLEMENTE 8 | C496: 21.013.880/0002-91 | D496: 223.22 | E496: 0 | F496: 0 | G496: 0 | H496: 0 | I496: 0 | J496: 0 | K496: 246.75 | L496: 0 | M496: =SUM(J496:L496)-23.53 -> 223.22 | N496: 23.530000000000001 | O496: =SUM(M496:N496) -> 246.75
A497: 3525 | B497: EOL VENTOS DE SANTA EDWIGES | C497: 12.960.082/0001-03 | D497: 303.67000000000002 | E497: 0 | F497: 0 | G497: 0 | H497: 0 | I497: 0 | J497: 0 | K497: 335.68000000000001 | L497: 0 | M497: =SUM(J497:L497)-32.01 -> 303.67000000000002 | N497: 32.009999999999998 | O497: =SUM(M497:N497) -> 335.68000000000001
A498: 3526 | B498: EOL VENTOS DE SANTA FATIMA | C498: 12.960.065/0001-68 | D498: 304.69 | E498: 0 | F498: 0 | G498: 0 | H498: 0 | I498: 0 | J498: 0 | K498: 336.81 | L498: 0 | M498: =SUM(J498:L498)-32.12 -> 304.69 | N498: 32.119999999999997 | O498: =SUM(M498:N498) -> 336.81
A499: 3527 | B499: EOL VENTOS DE SANTA REGINA | C499: 12.960.071/0001-15 | D499: 303.05000000000001 | E499: 0 | F499: 0 | G499: 0 | H499: 0 | I499: 0 | J499: 0 | K499: 335 | L499: 0 | M499: =SUM(J499:L499)-31.95 -> 303.05000000000001 | N499: 31.949999999999999 | O499: =SUM(M499:N499) -> 335
A500: 3528 | B500: EOL VENTOS DE SANTO ADRIANO | C500: 10.823.648/0001-11 | D500: 303.05000000000001 | E500: 0 | F500: 0 | G500: 0 | H500: 0 | I500: 0 | J500: 0 | K500: 335 | L500: 0 | M500: =SUM(J500:L500)-31.95 -> 303.05000000000001 | N500: 31.949999999999999 | O500: =SUM(M500:N500) -> 335
A501: 3529 | B501: EOL VENTOS DE SANTO ALBANO | C501: 10.656.606/0001-33 | D501: 303.05000000000001 | E501: 0 | F501: 0 | G501: 0 | H501: 0 | I501: 0 | J501: 0 | K501: 335 | L501: 0 | M501: =SUM(J501:L501)-31.95 -> 303.05000000000001 | N501: 31.949999999999999 | O501: =SUM(M501:N501) -> 335
A502: 3530 | B502: EOL ITAREMA IV | C502: 20.553.751/0002-23 | D502: 259.30000000000001 | E502: 0 | F502: 0 | G502: 0 | H502: 0 | I502: 0 | J502: 0 | K502: 286.63 | L502: 0 | M502: =SUM(J502:L502)-27.33 -> 259.30000000000001 | N502: 27.329999999999998 | O502: =SUM(M502:N502) -> 286.63
A503: 3531 | B503: EOL ITAREMA VI | C503: 20.533.879/0002-25 | D503: 296.68000000000001 | E503: 0 | F503: 0 | G503: 0 | H503: 0 | I503: 0 | J503: 0 | K503: 327.94999999999999 | L503: 0 | M503: =SUM(J503:L503)-31.27 -> 296.68000000000001 | N503: 31.27 | O503: =SUM(M503:N503) -> 327.94999999999999
A504: 3532 | B504: EOL ITAREMA VII | C504: 20.533.473/0002-42 | D504: 259.30000000000001 | E504: 0 | F504: 0 | G504: 0 | H504: 0 | I504: 0 | J504: 0 | K504: 286.63 | L504: 0 | M504: =SUM(J504:L504)-27.33 -> 259.30000000000001 | N504: 27.329999999999998 | O504: =SUM(M504:N504) -> 286.63
A505: 3533 | B505: EOL ESTRELA | C505: 09.265.464/0002-85 | D505: 209.78999999999999 | E505: 0 | F505: 0 | G505: 0 | H505: 0 | I505: 0 | J505: 0 | K505: 231.90000000000001 | L505: 0 | M505: =SUM(J505:L505)-22.11 -> 209.79000000000002 | N505: 22.109999999999999 | O505: =SUM(M505:N505) -> 231.90000000000003
A506: 3534 | B506: EOL OURO VERDE | C506: 16.849.271/0002-37 | D506: 217.53 | E506: 0 | F506: 0 | G506: 0 | H506: 0 | I506: 0 | J506: 0 | K506: 240.46000000000001 | L506: 0 | M506: =SUM(J506:L506)-22.93 -> 217.53 | N506: 22.93 | O506: =SUM(M506:N506) -> 240.46000000000001
A507: 3535 | B507: EOL SANTA MONICA I | C507: 12.445.328/0002-81 | D507: 138.40000000000001 | E507: 0 | F507: 0 | G507: 0 | H507: 0 | I507: 0 | J507: 0 | K507: 152.99000000000001 | L507: 0 | M507: =SUM(J507:L507)-14.59 -> 138.40000000000001 | N507: 14.59 | O507: =SUM(M507:N507) -> 152.99000000000001
A508: 3536 | B508: UHE SÃO ROQUE | C508: 15.116.321/0002-04 | D508: 2459.3099999999999 | E508: 0 | F508: 0 | G508: 0 | H508: 0 | I508: 0 | J508: 0 | K508: 2718.5500000000002 | L508: 0 | M508: =SUM(J508:L508)-259.24 -> 2459.3100000000004 | N508: 259.24000000000001 | O508: =SUM(M508:N508) -> 2718.5500000000002
A509: 3537 | B509: EOL ITAREMA VIII | C509: 20.533.310/0002-60 | D509: 259.30000000000001 | E509: 0 | F509: 0 | G509: 0 | H509: 0 | I509: 0 | J509: 0 | K509: 286.63 | L509: 0 | M509: =SUM(J509:L509)-27.33 -> 259.30000000000001 | N509: 27.329999999999998 | O509: =SUM(M509:N509) -> 286.63
A510: 3538 | B510: EOL ITAREMA IX | C510: 20.533.377/0002-02 | D510: 371.60000000000002 | E510: 0 | F510: 0 | G510: 0 | H510: 0 | I510: 0 | J510: 0 | K510: 410.76999999999998 | L510: 0 | M510: =SUM(J510:L510)-39.17 -> 371.59999999999997 | N510: 39.170000000000002 | O510: =SUM(M510:N510) -> 410.76999999999998
A511: 3539 | B511: EOL MACAMBIRA I | C511: 15.231.588/0001-61 | D511: 154.41999999999999 | E511: 0 | F511: 0 | G511: 0 | H511: 0 | I511: 0 | J511: 0 | K511: 170.69999999999999 | L511: 0 | M511: =SUM(J511:L511)-16.28 -> 154.41999999999999 | N511: 16.280000000000001 | O511: =SUM(M511:N511) -> 170.69999999999999
A512: 3540 | B512: EOL MACAMBIRA II | C512: 15.231.448/0001-93 | D512: 142.97 | E512: 0 | F512: 0 | G512: 0 | H512: 0 | I512: 0 | J512: 0 | K512: 158.03999999999999 | L512: 0 | M512: =SUM(J512:L512)-15.07 -> 142.97 | N512: 15.07 | O512: =SUM(M512:N512) -> 158.03999999999999
A513: 3541 | B513: RPE (RIO PARANA ENERGIA) | C513: 23.096.269/0001-19 | D513: 108985.94 | E513: 0 | F513: 0 | G513: 0 | H513: 0 | I513: 0 | J513: 0 | K513: 120474.49000000001 | L513: 0 | M513: =SUM(J513:L513)-11488.55 -> 108985.94 | N513: 11488.549999999999 | O513: =SUM(M513:N513) -> 120474.49000000001
A514: 3542 | B514: EOL VILA AMAZONAS V | C514: 20.339.203/0001-14 | D514: 209.11000000000001 | E514: 0 | F514: 0 | G514: 0 | H514: 0 | I514: 0 | J514: 0 | K514: 231.15000000000001 | L514: 0 | M514: =SUM(J514:L514)-22.04 -> 209.11000000000001 | N514: 22.039999999999999 | O514: =SUM(M514:N514) -> 231.15000000000001
A515: 3543 | B515: EOL VILA PARÁ I | C515: 20.318.451/0001-89 | D515: 255.25 | E515: 0 | F515: 0 | G515: 0 | H515: 0 | I515: 0 | J515: 0 | K515: 282.16000000000003 | L515: 0 | M515: =SUM(J515:L515)-26.91 -> 255.25000000000003 | N515: 26.91 | O515: =SUM(M515:N515) -> 282.16000000000003
A516: 3544 | B516: EOL CATAVENTOS ACARAÚ I | C516: 10.902.268/0001-72 | D516: 269.36000000000001 | E516: 0 | F516: 0 | G516: 0 | H516: 0 | I516: 0 | J516: 0 | K516: 297.75 | L516: 0 | M516: =SUM(J516:L516)-28.39 -> 269.36000000000001 | N516: 28.390000000000001 | O516: =SUM(M516:N516) -> 297.75
A517: 3545 | B517: EOL VENTOS DE SÃO BENEDITO | C517: 12.053.657/0001-04 | D517: 326.88 | E517: 0 | F517: 0 | G517: 0 | H517: 0 | I517: 0 | J517: 0 | K517: 361.33999999999997 | L517: 0 | M517: =SUM(J517:L517)-34.46 -> 326.88 | N517: 34.460000000000001 | O517: =SUM(M517:N517) -> 361.33999999999997
A518: 3546 | B518: EOL VENTOS DE SANTA ANGELINA | C518: 10.682.436/0001-61 | D518: 303.05000000000001 | E518: 0 | F518: 0 | G518: 0 | H518: 0 | I518: 0 | J518: 0 | K518: 335 | L518: 0 | M518: =SUM(J518:L518)-31.95 -> 303.05000000000001 | N518: 31.949999999999999 | O518: =SUM(M518:N518) -> 335
A519: 3547 | B519: EOL VENTOS DE SANTA BARBARA | C519: 12.960.046/0001-31 | D519: 303.05000000000001 | E519: 0 | F519: 0 | G519: 0 | H519: 0 | I519: 0 | J519: 0 | K519: 335 | L519: 0 | M519: =SUM(J519:L519)-31.95 -> 303.05000000000001 | N519: 31.949999999999999 | O519: =SUM(M519:N519) -> 335
A520: 3548 | B520: EOL VILA PARÁ II | C520: 20.318.810/0001-06 | D520: 233.44 | E520: 0 | F520: 0 | G520: 0 | H520: 0 | I520: 0 | J520: 0 | K520: 258.05000000000001 | L520: 0 | M520: =SUM(J520:L520)-24.61 -> 233.44 | N520: 24.609999999999999 | O520: =SUM(M520:N520) -> 258.05000000000001
A521: 3549 | B521: EOL VILA PARÁ III | C521: 20.318.427/0001-40 | D521: 232.56999999999999 | E521: 0 | F521: 0 | G521: 0 | H521: 0 | I521: 0 | J521: 0 | K521: 257.08999999999997 | L521: 0 | M521: =SUM(J521:L521)-24.52 -> 232.56999999999996 | N521: 24.52 | O521: =SUM(M521:N521) -> 257.08999999999997
A522: 3550 | B522: EOL SÃO DOMINGOS | C522: 12.053.825/0001-53 | D522: 205.87 | E522: 0 | F522: 0 | G522: 0 | H522: 0 | I522: 0 | J522: 0 | K522: 227.56999999999999 | L522: 0 | M522: =SUM(J522:L522)-21.7 -> 205.87 | N522: 21.699999999999999 | O522: =SUM(M522:N522) -> 227.56999999999999
A523: 3551 | B523: EOL AURA MANGUEIRA VII | C523: 20.593.647/0002-62 | D523: 270.88999999999999 | E523: 0 | F523: 0 | G523: 0 | H523: 0 | I523: 0 | J523: 0 | K523: 299.44999999999999 | L523: 0 | M523: =SUM(J523:L523)-28.56 -> 270.88999999999999 | N523: 28.559999999999999 | O523: =SUM(M523:N523) -> 299.44999999999999
A524: 3552 | B524: EOL AURA MIRIM II | C524: 20.586.118/0002-31 | D524: 338.67000000000002 | E524: 0 | F524: 0 | G524: 0 | H524: 0 | I524: 0 | J524: 0 | K524: 374.37 | L524: 0 | M524: =SUM(J524:L524)-35.7 -> 338.67000000000002 | N524: 35.700000000000003 | O524: =SUM(M524:N524) -> 374.37
A525: 3553 | B525: UTE CSP | C525: 09.509.535/0001-67 | D525: 1160.28 | E525: 0 | F525: 0 | G525: 0 | H525: 0 | I525: 0 | J525: 0 | K525: 1282.5899999999999 | L525: 0 | M525: =SUM(J525:L525)-122.31 -> 1160.28 | N525: 122.31 | O525: =SUM(M525:N525) -> 1282.5899999999999
A526: 3554 | B526: UFV CALDEIRÃO GRANDE V | C526: 12.960.110/0001-84 | D526: 279.25 | E526: 0 | F526: 0 | G526: 0 | H526: 0 | I526: 0 | J526: 0 | K526: 308.69 | L526: 0 | M526: =SUM(J526:L526)-29.44 -> 279.25 | N526: 29.440000000000001 | O526: =SUM(M526:N526) -> 308.69
A527: 3555 | B527: EOL VENTO FORMOSO | C527: 12.774.042/0001-69 | D527: 246.97 | E527: 0 | F527: 0 | G527: 0 | H527: 0 | I527: 0 | J527: 0 | K527: 273 | L527: 0 | M527: =SUM(J527:L527)-26.03 -> 246.97 | N527: 26.030000000000001 | O527: =SUM(M527:N527) -> 273
A528: 3556 | B528: EOL VENTOS DO MORRO DO CHAPÉU | C528: 12.774.017/0001-85 | D528: 246.5 | E528: 0 | F528: 0 | G528: 0 | H528: 0 | I528: 0 | J528: 0 | K528: 272.48000000000002 | L528: 0 | M528: =SUM(J528:L528)-25.98 -> 246.50000000000003 | N528: 25.98 | O528: =SUM(M528:N528) -> 272.48000000000002
A529: 3557 | B529: EOL VENTOS DO PARAZINHO | C529: 12.773.991/0001-24 | D529: 260.23000000000002 | E529: 0 | F529: 0 | G529: 0 | H529: 0 | I529: 0 | J529: 0 | K529: 287.66000000000003 | L529: 0 | M529: =SUM(J529:L529)-27.43 -> 260.23000000000002 | N529: 27.43 | O529: =SUM(M529:N529) -> 287.66000000000003
A530: 3558 | B530: EOL VENTOS DE TIANGUÁ NORTE | C530: 12.773.953/0001-71 | D530: 261.73000000000002 | E530: 0 | F530: 0 | G530: 0 | H530: 0 | I530: 0 | J530: 0 | K530: 289.31999999999999 | L530: 0 | M530: =SUM(J530:L530)-27.59 -> 261.73000000000002 | N530: 27.59 | O530: =SUM(M530:N530) -> 289.31999999999999
A531: 3559 | B531: EOL VENTOS DE TIANGUÁ | C531: 12.773.911/0001-30 | D531: 249.22999999999999 | E531: 0 | F531: 0 | G531: 0 | H531: 0 | I531: 0 | J531: 0 | K531: 275.5 | L531: 0 | M531: =SUM(J531:L531)-26.27 -> 249.22999999999999 | N531: 26.27 | O531: =SUM(M531:N531) -> 275.5
A532: 3560 | B532: EOL VENTOS DE SANTO DIMAS | C532: 13.329.931/0001-80 | D532: 281.05000000000001 | E532: 0 | F532: 0 | G532: 0 | H532: 0 | I532: 0 | J532: 0 | K532: 310.68000000000001 | L532: 0 | M532: =SUM(J532:L532)-29.63 -> 281.05000000000001 | N532: 29.629999999999999 | O532: =SUM(M532:N532) -> 310.68000000000001
A533: 3561 | B533: EOL CABEÇO PRETO III | C533: 15.231.615/0001-04 | D533: 253.16 | E533: 0 | F533: 0 | G533: 0 | H533: 0 | I533: 0 | J533: 0 | K533: 279.85000000000002 | L533: 0 | M533: =SUM(J533:L533)-26.69 -> 253.16000000000003 | N533: 26.690000000000001 | O533: =SUM(M533:N533) -> 279.85000000000002
A534: 3562 | B534: EOL CABEÇO PRETO V | C534: 15.231.547/0001-75 | D534: 249.97999999999999 | E534: 0 | F534: 0 | G534: 0 | H534: 0 | I534: 0 | J534: 0 | K534: 276.32999999999998 | L534: 0 | M534: =SUM(J534:L534)-26.35 -> 249.97999999999999 | N534: 26.350000000000001 | O534: =SUM(M534:N534) -> 276.32999999999998
A535: 3563 | B535: EOL CABEÇO PRETO VI | C535: 15.231.479/0001-44 | D535: 172.44999999999999 | E535: 0 | F535: 0 | G535: 0 | H535: 0 | I535: 0 | J535: 0 | K535: 190.63 | L535: 0 | M535: =SUM(J535:L535)-18.18 -> 172.44999999999999 | N535: 18.18 | O535: =SUM(M535:N535) -> 190.63
A536: 3564 | B536: COPEL (UHE GOV PARIGOT) | C536: 04.370.282/0001-70 | D536: 4586.2700000000004 | E536: 0 | F536: 0 | G536: 0 | H536: 0 | I536: 0 | J536: 0 | K536: 5069.7200000000003 | L536: 0 | M536: =SUM(J536:L536)-483.45 -> 4586.2700000000004 | N536: 483.44999999999999 | O536: =SUM(M536:N536) -> 5069.7200000000003
A537: 3565 | B537: EOL AURA MANGUEIRA XI | C537: 19.869.512/0002-06 | D537: 77.620000000000005 | E537: 0 | F537: 0 | G537: 0 | H537: 0 | I537: 0 | J537: 0 | K537: 85.799999999999997 | L537: 0 | M537: =SUM(J537:L537)-8.18 -> 77.620000000000005 | N537: 8.1799999999999997 | O537: =SUM(M537:N537) -> 85.800000000000011
A538: 3566 | B538: EOL CALANGO 6 | C538: 19.560.837/0002-02 | D538: 334.67000000000002 | E538: 0 | F538: 0 | G538: 0 | H538: 0 | I538: 0 | J538: 0 | K538: 369.94999999999999 | L538: 0 | M538: =SUM(J538:L538)-35.28 -> 334.66999999999996 | N538: 35.280000000000001 | O538: =SUM(M538:N538) -> 369.94999999999993
A539: 3567 | B539: EOL SANTANA I | C539: 19.560.874/0002-02 | D539: 334.44 | E539: 0 | F539: 0 | G539: 0 | H539: 0 | I539: 0 | J539: 0 | K539: 369.69 | L539: 0 | M539: =SUM(J539:L539)-35.25 -> 334.44 | N539: 35.25 | O539: =SUM(M539:N539) -> 369.69
A540: 3568 | B540: EOL SANTANA II | C540: 19.588.049/0002-16 | D540: 267.36000000000001 | E540: 0 | F540: 0 | G540: 0 | H540: 0 | I540: 0 | J540: 0 | K540: 295.54000000000002 | L540: 0 | M540: =SUM(J540:L540)-28.18 -> 267.36000000000001 | N540: 28.18 | O540: =SUM(M540:N540) -> 295.54000000000002
A541: 3569 | B541: EOL SANTA MÔNICA | C541: 12.053.687/0001-02 | D541: 236.00999999999999 | E541: 0 | F541: 0 | G541: 0 | H541: 0 | I541: 0 | J541: 0 | K541: 260.88999999999999 | L541: 0 | M541: =SUM(J541:L541)-24.88 -> 236.00999999999999 | N541: 24.879999999999999 | O541: =SUM(M541:N541) -> 260.88999999999999
A542: 3570 | B542: EOL VENTOS DE SÃO MARTINHO | C542: 13.330.011/0001-81 | D542: 119.18000000000001 | E542: 0 | F542: 0 | G542: 0 | H542: 0 | I542: 0 | J542: 0 | K542: 131.74000000000001 | L542: 0 | M542: =SUM(J542:L542)-12.56 -> 119.18000000000001 | N542: 12.56 | O542: =SUM(M542:N542) -> 131.74000000000001
A543: 3571 | B543: UFV CALDEIRÃO GRANDE II | C543: 12.960.094/0001-20 | D543: 281.87 | E543: 0 | F543: 0 | G543: 0 | H543: 0 | I543: 0 | J543: 0 | K543: 311.57999999999998 | L543: 0 | M543: =SUM(J543:L543)-29.71 -> 281.87 | N543: 29.710000000000001 | O543: =SUM(M543:N543) -> 311.57999999999998
A544: 3572 | B544: UFV CALDEIRÃO GRANDE I | C544: 12.960.103/0001-82 | D544: 281.95999999999998 | E544: 0 | F544: 0 | G544: 0 | H544: 0 | I544: 0 | J544: 0 | K544: 311.68000000000001 | L544: 0 | M544: =SUM(J544:L544)-29.72 -> 281.96000000000004 | N544: 29.719999999999999 | O544: =SUM(M544:N544) -> 311.68000000000006
A545: 3573 | B545: UFV CALDEIRÃO GRANDE III | C545: 12.964.095/0001-42 | D545: 279.25 | E545: 0 | F545: 0 | G545: 0 | H545: 0 | I545: 0 | J545: 0 | K545: 308.69 | L545: 0 | M545: =SUM(J545:L545)-29.44 -> 279.25 | N545: 29.440000000000001 | O545: =SUM(M545:N545) -> 308.69
A546: 3574 | B546: UFV CALDEIRÃO GRANDE VI | C546: 12.960.127/0001-31 | D546: 279.25 | E546: 0 | F546: 0 | G546: 0 | H546: 0 | I546: 0 | J546: 0 | K546: 308.69 | L546: 0 | M546: =SUM(J546:L546)-29.44 -> 279.25 | N546: 29.440000000000001 | O546: =SUM(M546:N546) -> 308.69
A547: 3575 | B547: UFV CALDEIRÃO GRANDE IV | C547: 10.656.568/0001-19 | D547: 279.25 | E547: 0 | F547: 0 | G547: 0 | H547: 0 | I547: 0 | J547: 0 | K547: 308.69 | L547: 0 | M547: =SUM(J547:L547)-29.44 -> 279.25 | N547: 29.440000000000001 | O547: =SUM(M547:N547) -> 308.69
A548: 3576 | B548: UFV CALDEIRÃO GRANDE VII | C548: 12.960.117/0001-04 | D548: 281.13999999999999 | E548: 0 | F548: 0 | G548: 0 | H548: 0 | I548: 0 | J548: 0 | K548: 310.77999999999997 | L548: 0 | M548: =SUM(J548:L548)-29.64 -> 281.13999999999999 | N548: 29.640000000000001 | O548: =SUM(M548:N548) -> 310.77999999999997
A549: 3577 | B549: PCH SERRA DOS CAVALINHOS I | C549: 09.199.675/0002-67 | D549: 241.38 | E549: 0 | F549: 0 | G549: 0 | H549: 0 | I549: 0 | J549: 0 | K549: 266.81999999999999 | L549: 0 | M549: =SUM(J549:L549)-25.44 -> 241.38 | N549: 25.440000000000001 | O549: =SUM(M549:N549) -> 266.81999999999999
A550: 3578 | B550: EOL AURA MANGUEIRA XV | C550: 19.944.650/0002-02 | D550: 155.21000000000001 | E550: 0 | F550: 0 | G550: 0 | H550: 0 | I550: 0 | J550: 0 | K550: 171.56999999999999 | L550: 0 | M550: =SUM(J550:L550)-16.36 -> 155.20999999999998 | N550: 16.359999999999999 | O550: =SUM(M550:N550) -> 171.56999999999999
A551: 3579 | B551: EOL AURA MIRIM IV | C551: 19.941.770/0002-48 | D551: 129.34999999999999 | E551: 0 | F551: 0 | G551: 0 | H551: 0 | I551: 0 | J551: 0 | K551: 142.99000000000001 | L551: 0 | M551: =SUM(J551:L551)-13.64 -> 129.35000000000002 | N551: 13.640000000000001 | O551: =SUM(M551:N551) -> 142.99000000000001
A552: 3580 | B552: EOL SANTA ÚRSULA | C552: 12.053.891/0001-23 | D552: 220.03 | E552: 0 | F552: 0 | G552: 0 | H552: 0 | I552: 0 | J552: 0 | K552: 243.22 | L552: 0 | M552: =SUM(J552:L552)-23.19 -> 220.03 | N552: 23.190000000000001 | O552: =SUM(M552:N552) -> 243.22
A553: 3581 | B553: EOL VENTOS DE SANTO AUGUSTO VIII | C553: 14.676.003/0002-35 | D553: 157.33000000000001 | E553: 0 | F553: 0 | G553: 0 | H553: 0 | I553: 0 | J553: 0 | K553: 173.91 | L553: 0 | M553: =SUM(J553:L553)-16.58 -> 157.32999999999998 | N553: 16.579999999999998 | O553: =SUM(M553:N553) -> 173.90999999999997
A554: 3582 | B554: EOL VENTOS DE SANTO AUGUSTO II | C554: 15.673.911/0002-38 | D554: 232.15000000000001 | E554: 0 | F554: 0 | G554: 0 | H554: 0 | I554: 0 | J554: 0 | K554: 256.62 | L554: 0 | M554: =SUM(J554:L554)-24.47 -> 232.15000000000001 | N554: 24.469999999999999 | O554: =SUM(M554:N554) -> 256.62
A555: 3583 | B555: EOL VENTOS DE SANTO ESTEVAO V | C555: 15.674.805/0002-79 | D555: 232.15000000000001 | E555: 0 | F555: 0 | G555: 0 | H555: 0 | I555: 0 | J555: 0 | K555: 256.62 | L555: 0 | M555: =SUM(J555:L555)-24.47 -> 232.15000000000001 | N555: 24.469999999999999 | O555: =SUM(M555:N555) -> 256.62
A556: 3584 | B556: EOL VENTOS DE SANTO ESTEVAO III | C556: 15.674.836/0002-20 | D556: 251.46000000000001 | E556: 0 | F556: 0 | G556: 0 | H556: 0 | I556: 0 | J556: 0 | K556: 277.97000000000003 | L556: 0 | M556: =SUM(J556:L556)-26.51 -> 251.46000000000004 | N556: 26.510000000000002 | O556: =SUM(M556:N556) -> 277.97000000000003
A557: 3585 | B557: EOL AURA MANGUEIRA XII | C557: 19.888.199/0002-45 | D557: 129.34 | E557: 0 | F557: 0 | G557: 0 | H557: 0 | I557: 0 | J557: 0 | K557: 142.97 | L557: 0 | M557: =SUM(J557:L557)-13.63 -> 129.34 | N557: 13.630000000000001 | O557: =SUM(M557:N557) -> 142.97
A558: 3586 | B558: EOL AURA MANGUEIRA XIII | C558: 19.868.433/0002-72 | D558: 129.31 | E558: 0 | F558: 0 | G558: 0 | H558: 0 | I558: 0 | J558: 0 | K558: 142.94 | L558: 0 | M558: =SUM(J558:L558)-13.63 -> 129.31 | N558: 13.630000000000001 | O558: =SUM(M558:N558) -> 142.94
A559: 3587 | B559: UFV ITUVERAVA 1 E 2 | C559: 21.619.094/0003-13 | D559: 214.91999999999999 | E559: 0 | F559: 0 | G559: 0 | H559: 0 | I559: 0 | J559: 0 | K559: 237.58000000000001 | L559: 0 | M559: =SUM(J559:L559)-22.66 -> 214.92000000000002 | N559: 22.66 | O559: =SUM(M559:N559) -> 237.58000000000001
A560: 3588 | B560: EOL PONTAL 2A | C560: 15.355.380/0001-54 | D560: 154.5 | E560: 0 | F560: 0 | G560: 0 | H560: 0 | I560: 0 | J560: 0 | K560: 170.78999999999999 | L560: 0 | M560: =SUM(J560:L560)-16.29 -> 154.5 | N560: 16.289999999999999 | O560: =SUM(M560:N560) -> 170.78999999999999
A561: 3589 | B561: EOL PONTAL 2B | C561: 12.752.290/0001-09 | D561: 70.760000000000005 | E561: 0 | F561: 0 | G561: 0 | H561: 0 | I561: 0 | J561: 0 | K561: 78.219999999999999 | L561: 0 | M561: =SUM(J561:L561)-7.46 -> 70.760000000000005 | N561: 7.46 | O561: =SUM(M561:N561) -> 78.219999999999999
A562: 3590 | B562: EOL PONTAL 3B | C562: 15.355.485/0001-03 | D562: 207.90000000000001 | E562: 0 | F562: 0 | G562: 0 | H562: 0 | I562: 0 | J562: 0 | K562: 229.81999999999999 | L562: 0 | M562: =SUM(J562:L562)-21.92 -> 207.89999999999998 | N562: 21.920000000000002 | O562: =SUM(M562:N562) -> 229.81999999999999
A563: 3591 | B563: CEMIG (UHE TRES MARIAS) | C563: 06.981.176/0001-58 | D563: 7068.3999999999996 | E563: 0 | F563: 0 | G563: 0 | H563: 0 | I563: 0 | J563: 0 | K563: 7813.5 | L563: 0 | M563: =SUM(J563:L563)-745.1 -> 7068.3999999999996 | N563: 745.10000000000002 | O563: =SUM(M563:N563) -> 7813.5
A564: 3592 | B564: EOL AURA MANGUEIRA XVII | C564: 19.896.691/0002-62 | D564: 129.31 | E564: 0 | F564: 0 | G564: 0 | H564: 0 | I564: 0 | J564: 0 | K564: 142.94 | L564: 0 | M564: =SUM(J564:L564)-13.63 -> 129.31 | N564: 13.630000000000001 | O564: =SUM(M564:N564) -> 142.94
A565: 3593 | B565: EOL AURA MIRIM VI | C565: 19.891.491/0002-17 | D565: 77.549999999999997 | E565: 0 | F565: 0 | G565: 0 | H565: 0 | I565: 0 | J565: 0 | K565: 85.719999999999999 | L565: 0 | M565: =SUM(J565:L565)-8.17 -> 77.549999999999997 | N565: 8.1699999999999999 | O565: =SUM(M565:N565) -> 85.719999999999999
A566: 3594 | B566: EOL AURA MIRIM VIII | C566: 19.917.214/0002-36 | D566: 77.549999999999997 | E566: 0 | F566: 0 | G566: 0 | H566: 0 | I566: 0 | J566: 0 | K566: 85.719999999999999 | L566: 0 | M566: =SUM(J566:L566)-8.17 -> 77.549999999999997 | N566: 8.1699999999999999 | O566: =SUM(M566:N566) -> 85.719999999999999
A567: 3595 | B567: EOL BONS VENTOS CACIMBAS 2 | C567: 19.953.139/0002-69 | D567: 191.36000000000001 | E567: 0 | F567: 0 | G567: 0 | H567: 0 | I567: 0 | J567: 0 | K567: 211.53 | L567: 0 | M567: =SUM(J567:L567)-20.17 -> 191.36000000000001 | N567: 20.170000000000002 | O567: =SUM(M567:N567) -> 211.53000000000003
A568: 3596 | B568: EOL VENTOS DE SANTO AUGUSTO I | C568: 15.674.987/0002-88 | D568: 154.72 | E568: 0 | F568: 0 | G568: 0 | H568: 0 | I568: 0 | J568: 0 | K568: 171.03 | L568: 0 | M568: =SUM(J568:L568)-16.31 -> 154.72 | N568: 16.309999999999999 | O568: =SUM(M568:N568) -> 171.03
A569: 3597 | B569: EOL VENTOS DE SANTO AUGUSTO VII | C569: 15.673.881/0002-60 | D569: 154.72 | E569: 0 | F569: 0 | G569: 0 | H569: 0 | I569: 0 | J569: 0 | K569: 171.03 | L569: 0 | M569: =SUM(J569:L569)-16.31 -> 154.72 | N569: 16.309999999999999 | O569: =SUM(M569:N569) -> 171.03
A570: 3598 | B570: EOL VENTOS DE SÃO VIRGÍLIO 02 | C570: 21.480.086/0002-58 | D570: 288.49000000000001 | E570: 0 | F570: 0 | G570: 0 | H570: 0 | I570: 0 | J570: 0 | K570: 318.89999999999998 | L570: 0 | M570: =SUM(J570:L570)-30.41 -> 288.48999999999995 | N570: 30.41 | O570: =SUM(M570:N570) -> 318.89999999999998
A571: 3599 | B571: UFV ITUVERAVA 3 E 4 | C571: 21.602.288/0003-06 | D571: 229.55000000000001 | E571: 0 | F571: 0 | G571: 0 | H571: 0 | I571: 0 | J571: 0 | K571: 253.75 | L571: 0 | M571: =SUM(J571:L571)-24.2 -> 229.55000000000001 | N571: 24.199999999999999 | O571: =SUM(M571:N571) -> 253.75
A572: 3600 | B572: UFV ITUVERAVA 5 6 E 7 | C572: 21.619.125/0003-36 | D572: 332.13999999999999 | E572: 0 | F572: 0 | G572: 0 | H572: 0 | I572: 0 | J572: 0 | K572: 367.14999999999998 | L572: 0 | M572: =SUM(J572:L572)-35.01 -> 332.13999999999999 | N572: 35.009999999999998 | O572: =SUM(M572:N572) -> 367.14999999999998
A573: 3601 | B573: UTE CARAMURU | C573: 00.080.671/0001-00 | D573: 87.489999999999995 | E573: 0 | F573: 0 | G573: 0 | H573: 0 | I573: 0 | J573: 0 | K573: 96.709999999999994 | L573: 0 | M573: =SUM(J573:L573)-9.22 -> 87.489999999999995 | N573: 9.2200000000000006 | O573: =SUM(M573:N573) -> 96.709999999999994
A574: 3602 | B574: EOL VENTOS DE SANTO ONOFRE IV | C574: 21.480.328/0002-03 | D574: 262.60000000000002 | E574: 0 | F574: 0 | G574: 0 | H574: 0 | I574: 0 | J574: 0 | K574: 290.27999999999997 | L574: 0 | M574: =SUM(J574:L574)-27.68 -> 262.59999999999997 | N574: 27.68 | O574: =SUM(M574:N574) -> 290.27999999999997
A575: 3603 | B575: EOL VENTOS DE SANTO AUGUSTO VI | C575: 15.673.793/0002-68 | D575: 251.46000000000001 | E575: 0 | F575: 0 | G575: 0 | H575: 0 | I575: 0 | J575: 0 | K575: 277.97000000000003 | L575: 0 | M575: =SUM(J575:L575)-26.51 -> 251.46000000000004 | N575: 26.510000000000002 | O575: =SUM(M575:N575) -> 277.97000000000003
A576: 3604 | B576: EOL AURA MANGUEIRA IV | C576: 19.869.355/0002-20 | D576: 181.12 | E576: 0 | F576: 0 | G576: 0 | H576: 0 | I576: 0 | J576: 0 | K576: 200.21000000000001 | L576: 0 | M576: =SUM(J576:L576)-19.09 -> 181.12 | N576: 19.09 | O576: =SUM(M576:N576) -> 200.21000000000001
A577: 3605 | B577: EOL VENTOS DE SÃO VIRGÍLIO 01 | C577: 21.479.982/0002-05 | D577: 284.44 | E577: 0 | F577: 0 | G577: 0 | H577: 0 | I577: 0 | J577: 0 | K577: 314.42000000000002 | L577: 0 | M577: =SUM(J577:L577)-29.98 -> 284.44 | N577: 29.98 | O577: =SUM(M577:N577) -> 314.42000000000002
A578: 3606 | B578: EOL VILA ACRE I | C578: 24.061.085/0001-86 | D578: 221.84999999999999 | E578: 0 | F578: 0 | G578: 0 | H578: 0 | I578: 0 | J578: 0 | K578: 245.24000000000001 | L578: 0 | M578: =SUM(J578:L578)-23.39 -> 221.85000000000002 | N578: 23.390000000000001 | O578: =SUM(M578:N578) -> 245.24000000000001
A579: 3607 | B579: EOL AURA MANGUEIRA VI | C579: 19.888.311/0002-48 | D579: 232.99000000000001 | E579: 0 | F579: 0 | G579: 0 | H579: 0 | I579: 0 | J579: 0 | K579: 257.55000000000001 | L579: 0 | M579: =SUM(J579:L579)-24.56 -> 232.99000000000001 | N579: 24.559999999999999 | O579: =SUM(M579:N579) -> 257.55000000000001
A580: 3608 | B580: EOL PEDRA CHEIROSA | C580: 10.883.378/0001-34 | D580: 200.40000000000001 | E580: 0 | F580: 0 | G580: 0 | H580: 0 | I580: 0 | J580: 0 | K580: 221.52000000000001 | L580: 0 | M580: =SUM(J580:L580)-21.12 -> 200.40000000000001 | N580: 21.120000000000001 | O580: =SUM(M580:N580) -> 221.52000000000001
A581: 3609 | B581: UFV NOVA OLINDA 8 | C581: 23.566.105/0003-70 | D581: 100.98 | E581: 0 | F581: 0 | G581: 0 | H581: 0 | I581: 0 | J581: 0 | K581: 111.62 | L581: 0 | M581: =SUM(J581:L581)-10.64 -> 100.98 | N581: 10.640000000000001 | O581: =SUM(M581:N581) -> 111.62
A582: 3610 | B582: UFV NOVA OLINDA 10 | C582: 23.416.727/0003-11 | D582: 100.98999999999999 | E582: 0 | F582: 0 | G582: 0 | H582: 0 | I582: 0 | J582: 0 | K582: 111.64 | L582: 0 | M582: =SUM(J582:L582)-10.65 -> 100.98999999999999 | N582: 10.65 | O582: =SUM(M582:N582) -> 111.64
A583: 3611 | B583: UFV NOVA OLINDA 12 | C583: 23.414.549/0003-90 | D583: 101.29000000000001 | E583: 0 | F583: 0 | G583: 0 | H583: 0 | I583: 0 | J583: 0 | K583: 111.97 | L583: 0 | M583: =SUM(J583:L583)-10.68 -> 101.28999999999999 | N583: 10.68 | O583: =SUM(M583:N583) -> 111.97
A584: 3612 | B584: UFV NOVA OLINDA 14 | C584: 23.399.563/0003-61 | D584: 100.64 | E584: 0 | F584: 0 | G584: 0 | H584: 0 | I584: 0 | J584: 0 | K584: 111.25 | L584: 0 | M584: =SUM(J584:L584)-10.61 -> 100.64 | N584: 10.609999999999999 | O584: =SUM(M584:N584) -> 111.25
A585: 3613 | B585: EOL DELTA 3 I | C585: 23.598.517/0002-00 | D585: 190.34 | E585: 0 | F585: 0 | G585: 0 | H585: 0 | I585: 0 | J585: 0 | K585: 210.40000000000001 | L585: 0 | M585: =SUM(J585:L585)-20.06 -> 190.34 | N585: 20.059999999999999 | O585: =SUM(M585:N585) -> 210.40000000000001
A586: 3614 | B586: EOL DELTA 3 II | C586: 23.598.858/0002-86 | D586: 190.34 | E586: 0 | F586: 0 | G586: 0 | H586: 0 | I586: 0 | J586: 0 | K586: 210.40000000000001 | L586: 0 | M586: =SUM(J586:L586)-20.06 -> 190.34 | N586: 20.059999999999999 | O586: =SUM(M586:N586) -> 210.40000000000001
A587: 3615 | B587: EOL DELTA 3 III | C587: 23.598.847/0002-04 | D587: 190.34 | E587: 0 | F587: 0 | G587: 0 | H587: 0 | I587: 0 | J587: 0 | K587: 210.40000000000001 | L587: 0 | M587: =SUM(J587:L587)-20.06 -> 190.34 | N587: 20.059999999999999 | O587: =SUM(M587:N587) -> 210.40000000000001
A588: 3616 | B588: EOL VENTOS DE SÃO VICENTE 14 | C588: 21.869.347/0001-45 | D588: 248.36000000000001 | E588: 0 | F588: 0 | G588: 0 | H588: 0 | I588: 0 | J588: 0 | K588: 274.54000000000002 | L588: 0 | M588: =SUM(J588:L588)-26.18 -> 248.36000000000001 | N588: 26.18 | O588: =SUM(M588:N588) -> 274.54000000000002
A589: 3617 | B589: EOL DELTA 3 V | C589: 23.598.829/0002-14 | D589: 190.34 | E589: 0 | F589: 0 | G589: 0 | H589: 0 | I589: 0 | J589: 0 | K589: 210.40000000000001 | L589: 0 | M589: =SUM(J589:L589)-20.06 -> 190.34 | N589: 20.059999999999999 | O589: =SUM(M589:N589) -> 210.40000000000001
A590: 3618 | B590: EOL DELTA 3 VI | C590: 23.598.831/0002-93 | D590: 190.34 | E590: 0 | F590: 0 | G590: 0 | H590: 0 | I590: 0 | J590: 0 | K590: 210.40000000000001 | L590: 0 | M590: =SUM(J590:L590)-20.06 -> 190.34 | N590: 20.059999999999999 | O590: =SUM(M590:N590) -> 210.40000000000001
A591: 3619 | B591: EOL DELTA 3 VII | C591: 23.598.844/0002-62 | D591: 190.75 | E591: 0 | F591: 0 | G591: 0 | H591: 0 | I591: 0 | J591: 0 | K591: 210.86000000000001 | L591: 0 | M591: =SUM(J591:L591)-20.11 -> 190.75 | N591: 20.109999999999999 | O591: =SUM(M591:N591) -> 210.86000000000001
A592: 3620 | B592: EOL DELTA 3 VIII | C592: 15.190.472/0002-02 | D592: 204.09999999999999 | E592: 0 | F592: 0 | G592: 0 | H592: 0 | I592: 0 | J592: 0 | K592: 225.61000000000001 | L592: 0 | M592: =SUM(J592:L592)-21.51 -> 204.10000000000002 | N592: 21.510000000000002 | O592: =SUM(M592:N592) -> 225.61000000000001
A593: 3621 | B593: EOL VENTOS DE SANTO ESTEVAO I | C593: 16.712.566/0002-67 | D593: 212.75999999999999 | E593: 0 | F593: 0 | G593: 0 | H593: 0 | I593: 0 | J593: 0 | K593: 235.19 | L593: 0 | M593: =SUM(J593:L593)-22.43 -> 212.75999999999999 | N593: 22.43 | O593: =SUM(M593:N593) -> 235.19
A594: 3622 | B594: EOL VENTOS DE SANTO ESTEVAO II | C594: 16.603.387/0002-91 | D594: 212.75999999999999 | E594: 0 | F594: 0 | G594: 0 | H594: 0 | I594: 0 | J594: 0 | K594: 235.19 | L594: 0 | M594: =SUM(J594:L594)-22.43 -> 212.75999999999999 | N594: 22.43 | O594: =SUM(M594:N594) -> 235.19
A595: 3623 | B595: EOL VENTOS DE SANTO ESTEVAO IV | C595: 21.480.026/0002-35 | D595: 284.44 | E595: 0 | F595: 0 | G595: 0 | H595: 0 | I595: 0 | J595: 0 | K595: 314.42000000000002 | L595: 0 | M595: =SUM(J595:L595)-29.98 -> 284.44 | N595: 29.98 | O595: =SUM(M595:N595) -> 314.42000000000002
A596: 3624 | B596: UFV LAPA 2 | C596: 23.509.564/0002-30 | D596: 106.06 | E596: 0 | F596: 0 | G596: 0 | H596: 0 | I596: 0 | J596: 0 | K596: 117.23999999999999 | L596: 0 | M596: =SUM(J596:L596)-11.18 -> 106.06 | N596: 11.18 | O596: =SUM(M596:N596) -> 117.24000000000001
A597: 3625 | B597: EOL PEDRA CHEIROSA II | C597: 10.883.587/0001-88 | D597: 183.31 | E597: 0 | F597: 0 | G597: 0 | H597: 0 | I597: 0 | J597: 0 | K597: 202.63 | L597: 0 | M597: =SUM(J597:L597)-19.32 -> 183.31 | N597: 19.32 | O597: =SUM(M597:N597) -> 202.63
A598: 3626 | B598: EOL DELTA 3 IV | C598: 23.598.842/0002-73 | D598: 190.34 | E598: 0 | F598: 0 | G598: 0 | H598: 0 | I598: 0 | J598: 0 | K598: 210.40000000000001 | L598: 0 | M598: =SUM(J598:L598)-20.06 -> 190.34 | N598: 20.059999999999999 | O598: =SUM(M598:N598) -> 210.40000000000001
A599: 3627 | B599: EOL CRISTALÂNDIA I | C599: 22.499.471/0003-90 | D599: 240.47999999999999 | E599: 0 | F599: 0 | G599: 0 | H599: 0 | I599: 0 | J599: 0 | K599: 265.82999999999998 | L599: 0 | M599: =SUM(J599:L599)-25.35 -> 240.47999999999999 | N599: 25.350000000000001 | O599: =SUM(M599:N599) -> 265.82999999999998
A600: 3628 | B600: EOL CRISTALÂNDIA II | C600: 23.049.225/0003-08 | D600: 240.47999999999999 | E600: 0 | F600: 0 | G600: 0 | H600: 0 | I600: 0 | J600: 0 | K600: 265.82999999999998 | L600: 0 | M600: =SUM(J600:L600)-25.35 -> 240.47999999999999 | N600: 25.350000000000001 | O600: =SUM(M600:N600) -> 265.82999999999998
A601: 3629 | B601: EOL DELFINA IV | C601: 21.553.603/0003-52 | D601: 82.109999999999999 | E601: 0 | F601: 0 | G601: 0 | H601: 0 | I601: 0 | J601: 0 | K601: 90.769999999999996 | L601: 0 | M601: =SUM(J601:L601)-8.66 -> 82.109999999999999 | N601: 8.6600000000000001 | O601: =SUM(M601:N601) -> 90.769999999999996
A602: 3630 | B602: EOL DELFINA V | C602: 21.552.886/0003-18 | D602: 828.92999999999995 | E602: 0 | F602: 0 | G602: 0 | H602: 0 | I602: 0 | J602: 0 | K602: 916.30999999999995 | L602: 0 | M602: =SUM(J602:L602)-87.38 -> 828.92999999999995 | N602: 87.379999999999995 | O602: =SUM(M602:N602) -> 916.30999999999995
A603: 3631 | B603: EOL VENTOS DE SÃO VIRGÍLIO 03 | C603: 21.480.051/0002-19 | D603: 189.19 | E603: 0 | F603: 0 | G603: 0 | H603: 0 | I603: 0 | J603: 0 | K603: 209.13 | L603: 0 | M603: =SUM(J603:L603)-19.94 -> 189.19 | N603: 19.940000000000001 | O603: =SUM(M603:N603) -> 209.13
A604: 3632 | B604: ELETRONORTE (UTE MAUA 3) | C604: 00.357.038/0001-16 | D604: 6008.9700000000003 | E604: 0 | F604: 0 | G604: 0 | H604: 0 | I604: 0 | J604: 0 | K604: 6642.3900000000003 | L604: 0 | M604: =SUM(J604:L604)-633.42 -> 6008.9700000000003 | N604: 633.41999999999996 | O604: =SUM(M604:N604) -> 6642.3900000000003
A605: 3633 | B605: EOL DREEN CUTIA | C605: 21.917.808/0001-08 | D605: 209.19999999999999 | E605: 0 | F605: 0 | G605: 0 | H605: 0 | I605: 0 | J605: 0 | K605: 231.25 | L605: 0 | M605: =SUM(J605:L605)-22.05 -> 209.19999999999999 | N605: 22.050000000000001 | O605: =SUM(M605:N605) -> 231.25
A606: 3634 | B606: EOL DREEN GUAJIRU | C606: 21.957.870/0001-23 | D606: 191.05000000000001 | E606: 0 | F606: 0 | G606: 0 | H606: 0 | I606: 0 | J606: 0 | K606: 211.19 | L606: 0 | M606: =SUM(J606:L606)-20.14 -> 191.05000000000001 | N606: 20.140000000000001 | O606: =SUM(M606:N606) -> 211.19
A607: 3635 | B607: EOL GE JANGADA | C607: 21.957.722/0001-09 | D607: 248.31 | E607: 0 | F607: 0 | G607: 0 | H607: 0 | I607: 0 | J607: 0 | K607: 274.49000000000001 | L607: 0 | M607: =SUM(J607:L607)-26.18 -> 248.31 | N607: 26.18 | O607: =SUM(M607:N607) -> 274.49000000000001
A608: 3636 | B608: EOL GE MARIA HELENA | C608: 21.909.793/0001-36 | D608: 248.31 | E608: 0 | F608: 0 | G608: 0 | H608: 0 | I608: 0 | J608: 0 | K608: 274.49000000000001 | L608: 0 | M608: =SUM(J608:L608)-26.18 -> 248.31 | N608: 26.18 | O608: =SUM(M608:N608) -> 274.49000000000001
A609: 3637 | B609: EOL POTIGUAR | C609: 21.957.968/0001-80 | D609: 248.31 | E609: 0 | F609: 0 | G609: 0 | H609: 0 | I609: 0 | J609: 0 | K609: 274.49000000000001 | L609: 0 | M609: =SUM(J609:L609)-26.18 -> 248.31 | N609: 26.18 | O609: =SUM(M609:N609) -> 274.49000000000001
A610: 3638 | B610: EOL ESPERANÇA DO NORDESTE | C610: 21.916.951/0001-85 | D610: 248.31 | E610: 0 | F610: 0 | G610: 0 | H610: 0 | I610: 0 | J610: 0 | K610: 274.49000000000001 | L610: 0 | M610: =SUM(J610:L610)-26.18 -> 248.31 | N610: 26.18 | O610: =SUM(M610:N610) -> 274.49000000000001
A611: 3639 | B611: EOL PARAÍSO DOS V DO NORDESTE | C611: 21.909.032/0001-84 | D611: 248.31 | E611: 0 | F611: 0 | G611: 0 | H611: 0 | I611: 0 | J611: 0 | K611: 274.49000000000001 | L611: 0 | M611: =SUM(J611:L611)-26.18 -> 248.31 | N611: 26.18 | O611: =SUM(M611:N611) -> 274.49000000000001
A612: 3640 | B612: EOL TAMANDUA MIRIM 2 | C612: 33.541.368/0001-16 | D612: 143.25 | E612: 0 | F612: 0 | G612: 0 | H612: 0 | I612: 0 | J612: 0 | K612: 158.34999999999999 | L612: 0 | M612: =SUM(J612:L612)-15.1 -> 143.25 | N612: 15.1 | O612: =SUM(M612:N612) -> 158.34999999999999
A613: 3641 | B613: EOL PAPAGAIO | C613: 33.541.368/0001-16 | D613: 81.599999999999994 | E613: 0 | F613: 0 | G613: 0 | H613: 0 | I613: 0 | J613: 0 | K613: 90.200000000000003 | L613: 0 | M613: =SUM(J613:L613)-8.6 -> 81.600000000000009 | N613: 8.5999999999999996 | O613: =SUM(M613:N613) -> 90.200000000000003
A614: 3642 | B614: EOL CORRUPIAO 3 | C614: 33.541.368/0001-16 | D614: 82.019999999999996 | E614: 0 | F614: 0 | G614: 0 | H614: 0 | I614: 0 | J614: 0 | K614: 90.670000000000002 | L614: 0 | M614: =SUM(J614:L614)-8.65 -> 82.019999999999996 | N614: 8.6500000000000004 | O614: =SUM(M614:N614) -> 90.670000000000002
A615: 3643 | B615: EOL COQUEIRINHO 2 | C615: 33.541.368/0001-16 | D615: 130.80000000000001 | E615: 0 | F615: 0 | G615: 0 | H615: 0 | I615: 0 | J615: 0 | K615: 144.59 | L615: 0 | M615: =SUM(J615:L615)-13.79 -> 130.80000000000001 | N615: 13.789999999999999 | O615: =SUM(M615:N615) -> 144.59
A616: 3644 | B616: EOL CARCARÁ | C616: 33.541.368/0001-16 | D616: 82.150000000000006 | E616: 0 | F616: 0 | G616: 0 | H616: 0 | I616: 0 | J616: 0 | K616: 90.810000000000002 | L616: 0 | M616: =SUM(J616:L616)-8.66 -> 82.150000000000006 | N616: 8.6600000000000001 | O616: =SUM(M616:N616) -> 90.810000000000002
A617: 3645 | B617: EOL CAITITU 2 | C617: 33.541.368/0001-16 | D617: 82.189999999999998 | E617: 0 | F617: 0 | G617: 0 | H617: 0 | I617: 0 | J617: 0 | K617: 90.849999999999994 | L617: 0 | M617: =SUM(J617:L617)-8.66 -> 82.189999999999998 | N617: 8.6600000000000001 | O617: =SUM(M617:N617) -> 90.849999999999994
A618: 3646 | B618: EOL CAITITU 3 | C618: 33.541.368/0001-16 | D618: 82.189999999999998 | E618: 0 | F618: 0 | G618: 0 | H618: 0 | I618: 0 | J618: 0 | K618: 90.849999999999994 | L618: 0 | M618: =SUM(J618:L618)-8.66 -> 82.189999999999998 | N618: 8.6600000000000001 | O618: =SUM(M618:N618) -> 90.849999999999994
A619: 3647 | B619: EOL ANGICAL 2 | C619: 33.541.368/0001-16 | D619: 82.189999999999998 | E619: 0 | F619: 0 | G619: 0 | H619: 0 | I619: 0 | J619: 0 | K619: 90.849999999999994 | L619: 0 | M619: =SUM(J619:L619)-8.66 -> 82.189999999999998 | N619: 8.6600000000000001 | O619: =SUM(M619:N619) -> 90.849999999999994
A620: 3648 | B620: EOL ARAPAPÁ | C620: 33.541.368/0001-16 | D620: 32.829999999999998 | E620: 0 | F620: 0 | G620: 0 | H620: 0 | I620: 0 | J620: 0 | K620: 36.289999999999999 | L620: 0 | M620: =SUM(J620:L620)-3.46 -> 32.829999999999998 | N620: 3.46 | O620: =SUM(M620:N620) -> 36.289999999999999
A621: 3649 | B621: EOL ACAUÃ | C621: 33.541.368/0001-16 | D621: 52.350000000000001 | E621: 0 | F621: 0 | G621: 0 | H621: 0 | I621: 0 | J621: 0 | K621: 57.869999999999997 | L621: 0 | M621: =SUM(J621:L621)-5.52 -> 52.349999999999994 | N621: 5.5199999999999996 | O621: =SUM(M621:N621) -> 57.86999999999999
A622: 3650 | B622: EOL TEIU 2 | C622: 33.541.368/0001-16 | D622: 66.079999999999998 | E622: 0 | F622: 0 | G622: 0 | H622: 0 | I622: 0 | J622: 0 | K622: 73.049999999999997 | L622: 0 | M622: =SUM(J622:L622)-6.97 -> 66.079999999999998 | N622: 6.9699999999999998 | O622: =SUM(M622:N622) -> 73.049999999999997
A623: 3672 | B623: RENOVA (EOL ANGICO) | C623: 18.870.073/0001-08 | D623: 63.630000000000003 | E623: 0 | F623: 0 | G623: 0 | H623: 0 | I623: 0 | J623: 0 | K623: 70.340000000000003 | L623: 0 | M623: =SUM(J623:L623)-6.71 -> 63.630000000000003 | N623: 6.71 | O623: =SUM(M623:N623) -> 70.340000000000003
A624: 3673 | B624: RENOVA (EOL SABIU) | C624: 17.305.829/0001-03 | D624: 108.45 | E624: 0 | F624: 0 | G624: 0 | H624: 0 | I624: 0 | J624: 0 | K624: 119.88 | L624: 0 | M624: =SUM(J624:L624)-11.43 -> 108.44999999999999 | N624: 11.43 | O624: =SUM(M624:N624) -> 119.88
A625: 3674 | B625: RENOVA (EOL PAU D’ÁGUA) | C625: 17.250.513/0001-53 | D625: 144.09 | E625: 0 | F625: 0 | G625: 0 | H625: 0 | I625: 0 | J625: 0 | K625: 159.28 | L625: 0 | M625: =SUM(J625:L625)-15.19 -> 144.09 | N625: 15.19 | O625: =SUM(M625:N625) -> 159.28
A626: 3675 | B626: RENOVA (EOL MANINEIRO) | C626: 18.560.162/0001-40 | D626: 110.84 | E626: 0 | F626: 0 | G626: 0 | H626: 0 | I626: 0 | J626: 0 | K626: 122.52 | L626: 0 | M626: =SUM(J626:L626)-11.68 -> 110.84 | N626: 11.68 | O626: =SUM(M626:N626) -> 122.52000000000001
A627: 3676 | B627: RENOVA (EOL FACHEIO) | C627: 18.559.964/0001-30 | D627: 132.09999999999999 | E627: 0 | F627: 0 | G627: 0 | H627: 0 | I627: 0 | J627: 0 | K627: 146.03 | L627: 0 | M627: =SUM(J627:L627)-13.93 -> 132.09999999999999 | N627: 13.93 | O627: =SUM(M627:N627) -> 146.03
A628: 3677 | B628: RENOVA (EOL UMBUZEIRO) | C628: 18.560.273/0001-56 | D628: 151.06999999999999 | E628: 0 | F628: 0 | G628: 0 | H628: 0 | I628: 0 | J628: 0 | K628: 166.99000000000001 | L628: 0 | M628: =SUM(J628:L628)-15.92 -> 151.07000000000002 | N628: 15.92 | O628: =SUM(M628:N628) -> 166.99000000000001
A629: 3678 | B629: RENOVA (EOL CEDRO) | C629: 17.330.840/0001-15 | D629: 97 | E629: 0 | F629: 0 | G629: 0 | H629: 0 | I629: 0 | J629: 0 | K629: 107.23 | L629: 0 | M629: =SUM(J629:L629)-10.23 -> 97 | N629: 10.23 | O629: =SUM(M629:N629) -> 107.23
A630: 3679 | B630: RENOVA (EOL JATAÍ) | C630: 18.560.347/0001-54 | D630: 129.72 | E630: 0 | F630: 0 | G630: 0 | H630: 0 | I630: 0 | J630: 0 | K630: 143.38999999999999 | L630: 0 | M630: =SUM(J630:L630)-13.67 -> 129.72 | N630: 13.67 | O630: =SUM(M630:N630) -> 143.38999999999999
A631: 3680 | B631: RENOVA (EOL BARBATIMÃO) | C631: 19.502.908/0001-21 | D631: 129.72 | E631: 0 | F631: 0 | G631: 0 | H631: 0 | I631: 0 | J631: 0 | K631: 143.38999999999999 | L631: 0 | M631: =SUM(J631:L631)-13.67 -> 129.72 | N631: 13.67 | O631: =SUM(M631:N631) -> 143.38999999999999
A632: 3681 | B632: RENOVA (EOL IMBURANA MACHO) | C632: 19.502.538/0001-22 | D632: 129.72 | E632: 0 | F632: 0 | G632: 0 | H632: 0 | I632: 0 | J632: 0 | K632: 143.38999999999999 | L632: 0 | M632: =SUM(J632:L632)-13.67 -> 129.72 | N632: 13.67 | O632: =SUM(M632:N632) -> 143.38999999999999
A633: 3682 | B633: RENOVA (EOL AMESCLA) | C633: 19.502.635/0001-15 | D633: 108.05 | E633: 0 | F633: 0 | G633: 0 | H633: 0 | I633: 0 | J633: 0 | K633: 119.44 | L633: 0 | M633: =SUM(J633:L633)-11.39 -> 108.05 | N633: 11.390000000000001 | O633: =SUM(M633:N633) -> 119.44
A634: 3683 | B634: RENOVA (EOL JUAZEIRO) | C634: 19.502.341/0001-93 | D634: 151.31 | E634: 0 | F634: 0 | G634: 0 | H634: 0 | I634: 0 | J634: 0 | K634: 167.25999999999999 | L634: 0 | M634: =SUM(J634:L634)-15.95 -> 151.31 | N634: 15.949999999999999 | O634: =SUM(M634:N634) -> 167.25999999999999
A635: 3684 | B635: RENOVA (EOL ANGELIM) | C635: 19.502.690/0001-05 | D635: 172.91 | E635: 0 | F635: 0 | G635: 0 | H635: 0 | I635: 0 | J635: 0 | K635: 191.13999999999999 | L635: 0 | M635: =SUM(J635:L635)-18.23 -> 172.91 | N635: 18.23 | O635: =SUM(M635:N635) -> 191.13999999999999
A636: 3685 | B636: RENOVA (EOL VELLOZIA) | C636: 18.560.475/0001-06 | D636: 132.18000000000001 | E636: 0 | F636: 0 | G636: 0 | H636: 0 | I636: 0 | J636: 0 | K636: 146.11000000000001 | L636: 0 | M636: =SUM(J636:L636)-13.93 -> 132.18000000000001 | N636: 13.93 | O636: =SUM(M636:N636) -> 146.11000000000001
A637: 3686 | B637: RENOVA (EOL TABOQUINHA) | C637: 18.870.116/0001-47 | D637: 169.78999999999999 | E637: 0 | F637: 0 | G637: 0 | H637: 0 | I637: 0 | J637: 0 | K637: 187.69 | L637: 0 | M637: =SUM(J637:L637)-17.9 -> 169.78999999999999 | N637: 17.899999999999999 | O637: =SUM(M637:N637) -> 187.69
A638: 3687 | B638: RENOVA (EOL ACÁCIA) | C638: 18.919.425/0001-64 | D638: 127.31 | E638: 0 | F638: 0 | G638: 0 | H638: 0 | I638: 0 | J638: 0 | K638: 140.72999999999999 | L638: 0 | M638: =SUM(J638:L638)-13.42 -> 127.30999999999999 | N638: 13.42 | O638: =SUM(M638:N638) -> 140.72999999999999
A639: 3688 | B639: RENOVA (EOL SÃO SALVADOR) | C639: 11.197.380/0001-12 | D639: 223.99000000000001 | E639: 0 | F639: 0 | G639: 0 | H639: 0 | I639: 0 | J639: 0 | K639: 247.59999999999999 | L639: 0 | M639: =SUM(J639:L639)-23.61 -> 223.99000000000001 | N639: 23.609999999999999 | O639: =SUM(M639:N639) -> 247.60000000000002
A640: 3689 | B640: EOL VENTOS DE SÃO VICENTE 12 | C640: 21.877.685/0001-29 | D640: 248.84 | E640: 0 | F640: 0 | G640: 0 | H640: 0 | I640: 0 | J640: 0 | K640: 275.06999999999999 | L640: 0 | M640: =SUM(J640:L640)-26.23 -> 248.84 | N640: 26.23 | O640: =SUM(M640:N640) -> 275.06999999999999
A641: 3690 | B641: EOL DELFINA III | C641: 21.556.441/0003-06 | D641: 287.25999999999999 | E641: 0 | F641: 0 | G641: 0 | H641: 0 | I641: 0 | J641: 0 | K641: 317.54000000000002 | L641: 0 | M641: =SUM(J641:L641)-30.28 -> 287.25999999999999 | N641: 30.280000000000001 | O641: =SUM(M641:N641) -> 317.53999999999996
A642: 3691 | B642: EOL DELFINA VI | C642: 21.553.640/0003-60 | D642: 308.31 | E642: 0 | F642: 0 | G642: 0 | H642: 0 | I642: 0 | J642: 0 | K642: 340.81 | L642: 0 | M642: =SUM(J642:L642)-32.5 -> 308.31 | N642: 32.5 | O642: =SUM(M642:N642) -> 340.81
A643: 3692 | B643: EOL DELFINA VII | C643: 21.599.114/0003-31 | D643: 308.31 | E643: 0 | F643: 0 | G643: 0 | H643: 0 | I643: 0 | J643: 0 | K643: 340.81 | L643: 0 | M643: =SUM(J643:L643)-32.5 -> 308.31 | N643: 32.5 | O643: =SUM(M643:N643) -> 340.81
A644: 3693 | B644: EOL JAU | C644: 17.227.909/0002-60 | D644: 876.21000000000004 | E644: 0 | F644: 0 | G644: 0 | H644: 0 | I644: 0 | J644: 0 | K644: 968.57000000000005 | L644: 0 | M644: =SUM(J644:L644)-92.36 -> 876.21000000000004 | N644: 92.359999999999999 | O644: =SUM(M644:N644) -> 968.57000000000005
A645: 3694 | B645: UFV HORIZONTE MP 1 | C645: 23.399.589/0002-29 | D645: 259.76999999999998 | E645: 0 | F645: 0 | G645: 0 | H645: 0 | I645: 0 | J645: 0 | K645: 287.14999999999998 | L645: 0 | M645: =SUM(J645:L645)-27.38 -> 259.76999999999998 | N645: 27.379999999999999 | O645: =SUM(M645:N645) -> 287.14999999999998
A646: 3695 | B646: EOL DOIS RIACHOS | C646: 17.018.370/0002-30 | D646: 542.26999999999998 | E646: 0 | F646: 0 | G646: 0 | H646: 0 | I646: 0 | J646: 0 | K646: 599.42999999999995 | L646: 0 | M646: =SUM(J646:L646)-57.16 -> 542.26999999999998 | N646: 57.159999999999997 | O646: =SUM(M646:N646) -> 599.42999999999995
A647: 3696 | B647: EOL ASSURUÁ IV | C647: 21.544.129/0002-11 | D647: 330.82999999999998 | E647: 0 | F647: 0 | G647: 0 | H647: 0 | I647: 0 | J647: 0 | K647: 365.69999999999999 | L647: 0 | M647: =SUM(J647:L647)-34.87 -> 330.82999999999998 | N647: 34.869999999999997 | O647: =SUM(M647:N647) -> 365.69999999999999
A648: 3697 | B648: EOL UNIÃO DOS VENTOS 12 | C648: 18.265.320/0001-39 | D648: 258.06999999999999 | E648: 0 | F648: 0 | G648: 0 | H648: 0 | I648: 0 | J648: 0 | K648: 285.26999999999998 | L648: 0 | M648: =SUM(J648:L648)-27.2 -> 258.06999999999999 | N648: 27.199999999999999 | O648: =SUM(M648:N648) -> 285.26999999999998
A649: 3698 | B649: EOL UNIÃO DOS VENTOS 13 | C649: 17.143.971/0001-93 | D649: 193.41999999999999 | E649: 0 | F649: 0 | G649: 0 | H649: 0 | I649: 0 | J649: 0 | K649: 213.81 | L649: 0 | M649: =SUM(J649:L649)-20.39 -> 193.42000000000002 | N649: 20.390000000000001 | O649: =SUM(M649:N649) -> 213.81
A650: 3699 | B650: EOL UNIÃO DOS VENTOS 14 | C650: 17.143.838/0001-37 | D650: 215.59999999999999 | E650: 0 | F650: 0 | G650: 0 | H650: 0 | I650: 0 | J650: 0 | K650: 238.33000000000001 | L650: 0 | M650: =SUM(J650:L650)-22.73 -> 215.60000000000002 | N650: 22.73 | O650: =SUM(M650:N650) -> 238.33000000000001
A651: 3700 | B651: EOL UNIÃO DOS VENTOS 15 | C651: 13.783.102/0001-72 | D651: 312.93000000000001 | E651: 0 | F651: 0 | G651: 0 | H651: 0 | I651: 0 | J651: 0 | K651: 345.92000000000002 | L651: 0 | M651: =SUM(J651:L651)-32.99 -> 312.93000000000001 | N651: 32.990000000000002 | O651: =SUM(M651:N651) -> 345.92000000000002
A652: 3701 | B652: EOL UNIÃO DOS VENTOS 16 | C652: 17.205.697/0001-30 | D652: 298.18000000000001 | E652: 0 | F652: 0 | G652: 0 | H652: 0 | I652: 0 | J652: 0 | K652: 329.61000000000001 | L652: 0 | M652: =SUM(J652:L652)-31.43 -> 298.18000000000001 | N652: 31.43 | O652: =SUM(M652:N652) -> 329.61000000000001
A653: 3702 | B653: EOL VENTOS DE SÃO VICENTE 13 | C653: 21.877.676/0001-38 | D653: 248.78999999999999 | E653: 0 | F653: 0 | G653: 0 | H653: 0 | I653: 0 | J653: 0 | K653: 275.01999999999998 | L653: 0 | M653: =SUM(J653:L653)-26.23 -> 248.78999999999999 | N653: 26.23 | O653: =SUM(M653:N653) -> 275.01999999999998
A654: 3703 | B654: EOL PEDRA RAJADA | C654: 21.909.246/0001-50 | D654: 176 | E654: 0 | F654: 0 | G654: 0 | H654: 0 | I654: 0 | J654: 0 | K654: 194.55000000000001 | L654: 0 | M654: =SUM(J654:L654)-18.55 -> 176 | N654: 18.550000000000001 | O654: =SUM(M654:N654) -> 194.55000000000001
A655: 3704 | B655: EOL PEDRA RAJADA II | C655: 21.909.399/0001-06 | D655: 176 | E655: 0 | F655: 0 | G655: 0 | H655: 0 | I655: 0 | J655: 0 | K655: 194.55000000000001 | L655: 0 | M655: =SUM(J655:L655)-18.55 -> 176 | N655: 18.550000000000001 | O655: =SUM(M655:N655) -> 194.55000000000001
A656: 3705 | B656: EOL SERRA DAS VACAS V | C656: 22.357.375/0001-46 | D656: 219.47 | E656: 0 | F656: 0 | G656: 0 | H656: 0 | I656: 0 | J656: 0 | K656: 242.61000000000001 | L656: 0 | M656: =SUM(J656:L656)-23.14 -> 219.47000000000003 | N656: 23.140000000000001 | O656: =SUM(M656:N656) -> 242.61000000000001
A657: 3706 | B657: EOL SERRA DAS VACAS VII | C657: 22.193.319/0001-13 | D657: 219.47 | E657: 0 | F657: 0 | G657: 0 | H657: 0 | I657: 0 | J657: 0 | K657: 242.61000000000001 | L657: 0 | M657: =SUM(J657:L657)-23.14 -> 219.47000000000003 | N657: 23.140000000000001 | O657: =SUM(M657:N657) -> 242.61000000000001
A658: 3711 | B658: EOL VENTOS DE SÃO VICENTE 8 | C658: 21.840.617/0001-95 | D658: 249.40000000000001 | E658: 0 | F658: 0 | G658: 0 | H658: 0 | I658: 0 | J658: 0 | K658: 275.69 | L658: 0 | M658: =SUM(J658:L658)-26.29 -> 249.40000000000001 | N658: 26.289999999999999 | O658: =SUM(M658:N658) -> 275.69
A659: 3712 | B659: EOL VENTOS DE SÃO VICENTE 11 | C659: 23.037.357/0001-40 | D659: 249.59 | E659: 0 | F659: 0 | G659: 0 | H659: 0 | I659: 0 | J659: 0 | K659: 275.89999999999998 | L659: 0 | M659: =SUM(J659:L659)-26.31 -> 249.58999999999997 | N659: 26.309999999999999 | O659: =SUM(M659:N659) -> 275.89999999999998
A660: 3713 | B660: EOL ASSURUÁ III | C660: 21.544.084/0002-85 | D660: 140.63 | E660: 0 | F660: 0 | G660: 0 | H660: 0 | I660: 0 | J660: 0 | K660: 155.44999999999999 | L660: 0 | M660: =SUM(J660:L660)-14.82 -> 140.63 | N660: 14.82 | O660: =SUM(M660:N660) -> 155.44999999999999
A661: 3714 | B661: EOL CAPOEIRAS III | C661: 21.543.971/0002-39 | D661: 305.29000000000002 | E661: 0 | F661: 0 | G661: 0 | H661: 0 | I661: 0 | J661: 0 | K661: 337.47000000000003 | L661: 0 | M661: =SUM(J661:L661)-32.18 -> 305.29000000000002 | N661: 32.18 | O661: =SUM(M661:N661) -> 337.47000000000003
A662: 3715 | B662: EOL CURRAL DE PEDRAS I | C662: 21.541.973/0002-99 | D662: 225.94999999999999 | E662: 0 | F662: 0 | G662: 0 | H662: 0 | I662: 0 | J662: 0 | K662: 249.77000000000001 | L662: 0 | M662: =SUM(J662:L662)-23.82 -> 225.95000000000002 | N662: 23.82 | O662: =SUM(M662:N662) -> 249.77000000000001
A663: 3716 | B663: EOL CURRAL DE PEDRAS II | C663: 21.544.255/0002-76 | D663: 307.44999999999999 | E663: 0 | F663: 0 | G663: 0 | H663: 0 | I663: 0 | J663: 0 | K663: 339.86000000000001 | L663: 0 | M663: =SUM(J663:L663)-32.41 -> 307.45000000000005 | N663: 32.409999999999997 | O663: =SUM(M663:N663) -> 339.86000000000001
A664: 3717 | B664: EOL DIAMANTE II | C664: 21.544.216/0002-79 | D664: 195.40000000000001 | E664: 0 | F664: 0 | G664: 0 | H664: 0 | I664: 0 | J664: 0 | K664: 216 | L664: 0 | M664: =SUM(J664:L664)-20.6 -> 195.40000000000001 | N664: 20.600000000000001 | O664: =SUM(M664:N664) -> 216
A665: 3718 | B665: EOL DIAMANTE III | C665: 21.543.994/0002-43 | D665: 198.34999999999999 | E665: 0 | F665: 0 | G665: 0 | H665: 0 | I665: 0 | J665: 0 | K665: 219.25999999999999 | L665: 0 | M665: =SUM(J665:L665)-20.91 -> 198.34999999999999 | N665: 20.91 | O665: =SUM(M665:N665) -> 219.25999999999999
A666: 3719 | B666: EOL LARANJEIRAS I | C666: 21.544.025/0002-07 | D666: 314.93000000000001 | E666: 0 | F666: 0 | G666: 0 | H666: 0 | I666: 0 | J666: 0 | K666: 348.13 | L666: 0 | M666: =SUM(J666:L666)-33.2 -> 314.93000000000001 | N666: 33.200000000000003 | O666: =SUM(M666:N666) -> 348.13
A667: 3720 | B667: EOL LARANJEIRAS II | C667: 21.544.159/0002-28 | D667: 340.48000000000002 | E667: 0 | F667: 0 | G667: 0 | H667: 0 | I667: 0 | J667: 0 | K667: 376.37 | L667: 0 | M667: =SUM(J667:L667)-35.89 -> 340.48000000000002 | N667: 35.890000000000001 | O667: =SUM(M667:N667) -> 376.37
A668: 3721 | B668: EOL LARANJEIRAS V | C668: 21.544.060/0002-26 | D668: 284.22000000000003 | E668: 0 | F668: 0 | G668: 0 | H668: 0 | I668: 0 | J668: 0 | K668: 314.18000000000001 | L668: 0 | M668: =SUM(J668:L668)-29.96 -> 284.22000000000003 | N668: 29.960000000000001 | O668: =SUM(M668:N668) -> 314.18000000000001
A669: 3722 | B669: UFV FLORESTA I | C669: 23.741.570/0001-38 | D669: 102.86 | E669: 0 | F669: 0 | G669: 0 | H669: 0 | I669: 0 | J669: 0 | K669: 113.7 | L669: 0 | M669: =SUM(J669:L669)-10.84 -> 102.86 | N669: 10.84 | O669: =SUM(M669:N669) -> 113.7
A670: 3723 | B670: UFV FLORESTA II | C670: 23.741.520/0001-50 | D670: 102.86 | E670: 0 | F670: 0 | G670: 0 | H670: 0 | I670: 0 | J670: 0 | K670: 113.7 | L670: 0 | M670: =SUM(J670:L670)-10.84 -> 102.86 | N670: 10.84 | O670: =SUM(M670:N670) -> 113.7
A671: 3724 | B671: UFV FLORESTA III | C671: 23.723.730/0001-16 | D671: 69.549999999999997 | E671: 0 | F671: 0 | G671: 0 | H671: 0 | I671: 0 | J671: 0 | K671: 76.879999999999995 | L671: 0 | M671: =SUM(J671:L671)-7.33 -> 69.549999999999997 | N671: 7.3300000000000001 | O671: =SUM(M671:N671) -> 76.879999999999995
A672: 3725 | B672: UHE SAO MANOEL | C672: 18.494.537/0004-63 | D672: 19168.779999999999 | E672: 0 | F672: 0 | G672: 0 | H672: 0 | I672: 0 | J672: 0 | K672: 21189.419999999998 | L672: 0 | M672: =SUM(J672:L672)-2020.64 -> 19168.779999999999 | N672: 2020.6400000000001 | O672: =SUM(M672:N672) -> 21189.419999999998
A673: 3726 | B673: EOL VENTOS DE SÃO VICENTE 10 | C673: 21.840.567/0001-46 | D673: 248.83000000000001 | E673: 0 | F673: 0 | G673: 0 | H673: 0 | I673: 0 | J673: 0 | K673: 275.06 | L673: 0 | M673: =SUM(J673:L673)-26.23 -> 248.83000000000001 | N673: 26.23 | O673: =SUM(M673:N673) -> 275.06
A674: 3727 | B674: EOL VENTOS DE SÃO VICENTE 09 | C674: 21.716.502/0001-93 | D674: 249.11000000000001 | E674: 0 | F674: 0 | G674: 0 | H674: 0 | I674: 0 | J674: 0 | K674: 275.37 | L674: 0 | M674: =SUM(J674:L674)-26.26 -> 249.11000000000001 | N674: 26.260000000000002 | O674: =SUM(M674:N674) -> 275.37
A675: 3728 | B675: EOL GARROTE | C675: 10.272.489/0001-04 | D675: 216.31999999999999 | E675: 0 | F675: 0 | G675: 0 | H675: 0 | I675: 0 | J675: 0 | K675: 239.12 | L675: 0 | M675: =SUM(J675:L675)-22.8 -> 216.31999999999999 | N675: 22.800000000000001 | O675: =SUM(M675:N675) -> 239.12
A676: 3729 | B676: EOL SANTO INÁCIO III | C676: 12.009.141/0001-54 | D676: 276.70999999999998 | E676: 0 | F676: 0 | G676: 0 | H676: 0 | I676: 0 | J676: 0 | K676: 305.88 | L676: 0 | M676: =SUM(J676:L676)-29.17 -> 276.70999999999998 | N676: 29.170000000000002 | O676: =SUM(M676:N676) -> 305.88
A677: 3730 | B677: EOL SANTO INÁCIO IV | C677: 11.738.349/0001-41 | D677: 217.86000000000001 | E677: 0 | F677: 0 | G677: 0 | H677: 0 | I677: 0 | J677: 0 | K677: 240.83000000000001 | L677: 0 | M677: =SUM(J677:L677)-22.97 -> 217.86000000000001 | N677: 22.969999999999999 | O677: =SUM(M677:N677) -> 240.83000000000001
A678: 3731 | B678: EOL SÃO RAIMUNDO | C678: 10.408.112/0001-30 | D678: 218.13999999999999 | E678: 0 | F678: 0 | G678: 0 | H678: 0 | I678: 0 | J678: 0 | K678: 241.13 | L678: 0 | M678: =SUM(J678:L678)-22.99 -> 218.13999999999999 | N678: 22.989999999999998 | O678: =SUM(M678:N678) -> 241.13
A679: 3732 | B679: UHE SINOP | C679: 19.527.586/0001-75 | D679: 10232.26 | E679: 0 | F679: 0 | G679: 0 | H679: 0 | I679: 0 | J679: 0 | K679: 11310.870000000001 | L679: 0 | M679: =SUM(J679:L679)-1078.61 -> 10232.26 | N679: 1078.6099999999999 | O679: =SUM(M679:N679) -> 11310.870000000001
A680: 3733 | B680: EOL AVENTURA I | C680: 19.980.957/0002-50 | D680: 284.20999999999998 | E680: 0 | F680: 0 | G680: 0 | H680: 0 | I680: 0 | J680: 0 | K680: 314.17000000000002 | L680: 0 | M680: =SUM(J680:L680)-29.96 -> 284.21000000000004 | N680: 29.960000000000001 | O680: =SUM(M680:N680) -> 314.17000000000002
A681: 3734 | B681: EOL MORRO DO CHAPÉU I | C681: 21.868.992/0003-05 | D681: 584.98000000000002 | E681: 0 | F681: 0 | G681: 0 | H681: 0 | I681: 0 | J681: 0 | K681: 646.63999999999999 | L681: 0 | M681: =SUM(J681:L681)-61.66 -> 584.98000000000002 | N681: 61.659999999999997 | O681: =SUM(M681:N681) -> 646.63999999999999
A682: 3735 | B682: EOL MORRO DO CHAPÉU II | C682: 21.869.008/0003-20 | D682: 565.15999999999997 | E682: 0 | F682: 0 | G682: 0 | H682: 0 | I682: 0 | J682: 0 | K682: 624.74000000000001 | L682: 0 | M682: =SUM(J682:L682)-59.58 -> 565.15999999999997 | N682: 59.579999999999998 | O682: =SUM(M682:N682) -> 624.74000000000001
A683: 3736 | B683: EOL BOA VISTA DA LAGOINHA | C683: 21.996.671/0003-96 | D683: 312.69999999999999 | E683: 0 | F683: 0 | G683: 0 | H683: 0 | I683: 0 | J683: 0 | K683: 345.66000000000003 | L683: 0 | M683: =SUM(J683:L683)-32.96 -> 312.70000000000005 | N683: 32.960000000000001 | O683: =SUM(M683:N683) -> 345.66000000000003
A684: 3737 | B684: EOL VENTOS DE SANTO ABRAÃO | C684: 21.869.030/0003-70 | D684: 291.81 | E684: 0 | F684: 0 | G684: 0 | H684: 0 | I684: 0 | J684: 0 | K684: 322.56999999999999 | L684: 0 | M684: =SUM(J684:L684)-30.76 -> 291.81 | N684: 30.760000000000002 | O684: =SUM(M684:N684) -> 322.56999999999999
A685: 3738 | B685: EOL CABEÇO VERMELHO | C685: 20.024.563/0001-27 | D685: 272.11000000000001 | E685: 0 | F685: 0 | G685: 0 | H685: 0 | I685: 0 | J685: 0 | K685: 300.79000000000002 | L685: 0 | M685: =SUM(J685:L685)-28.68 -> 272.11000000000001 | N685: 28.68 | O685: =SUM(M685:N685) -> 300.79000000000002
A686: 3739 | B686: EOL CABEÇO VERMELHO II | C686: 20.024.516/0001-83 | D686: 160.97999999999999 | E686: 0 | F686: 0 | G686: 0 | H686: 0 | I686: 0 | J686: 0 | K686: 177.94999999999999 | L686: 0 | M686: =SUM(J686:L686)-16.97 -> 160.97999999999999 | N686: 16.969999999999999 | O686: =SUM(M686:N686) -> 177.94999999999999
A687: 3740 | B687: UFV COREMAS I | C687: 14.285.232/0001-48 | D687: 200.38 | E687: 0 | F687: 0 | G687: 0 | H687: 0 | I687: 0 | J687: 0 | K687: 221.5 | L687: 0 | M687: =SUM(J687:L687)-21.12 -> 200.38 | N687: 21.120000000000001 | O687: =SUM(M687:N687) -> 221.5
A688: 3741 | B688: UFV COREMAS II | C688: 14.285.242/0001-83 | D688: 177.91999999999999 | E688: 0 | F688: 0 | G688: 0 | H688: 0 | I688: 0 | J688: 0 | K688: 196.68000000000001 | L688: 0 | M688: =SUM(J688:L688)-18.76 -> 177.92000000000002 | N688: 18.760000000000002 | O688: =SUM(M688:N688) -> 196.68000000000001
A689: 3742 | B689: UHE JAGUARA | C689: 28.925.264/0002-56 | D689: 10805.01 | E689: 0 | F689: 0 | G689: 0 | H689: 0 | I689: 0 | J689: 0 | K689: 11944 | L689: 0 | M689: =SUM(J689:L689)-1138.99 -> 10805.01 | N689: 1138.99 | O689: =SUM(M689:N689) -> 11944
A690: 3743 | B690: UHE VOLTA GRANDE | C690: 25.176.391/0002-01 | D690: 10659.790000000001 | E690: 0 | F690: 0 | G690: 0 | H690: 0 | I690: 0 | J690: 0 | K690: 11783.469999999999 | L690: 0 | M690: =SUM(J690:L690)-1123.68 -> 10659.789999999999 | N690: 1123.6800000000001 | O690: =SUM(M690:N690) -> 11783.469999999999
A691: 3744 | B691: UTE PROSPERIDADE I | C691: 23.857.764/0001-01 | D691: 384.42000000000002 | E691: 0 | F691: 0 | G691: 0 | H691: 0 | I691: 0 | J691: 0 | K691: 424.94 | L691: 0 | M691: =SUM(J691:L691)-40.52 -> 384.42000000000002 | N691: 40.520000000000003 | O691: =SUM(M691:N691) -> 424.94
A692: 3745 | B692: CÉU AZUL (CONS. BAIXO IGUAÇU) | C692: 09.136.819/0002-36 | D692: 4330.3699999999999 | E692: 0 | F692: 0 | G692: 0 | H692: 0 | I692: 0 | J692: 0 | K692: 4786.8500000000004 | L692: 0 | M692: =SUM(J692:L692)-456.48 -> 4330.3700000000008 | N692: 456.48000000000002 | O692: =SUM(M692:N692) -> 4786.8500000000004
A693: 3746 | B693: EOL SERRA DA BABILÔNIA II | C693: 24.263.234/0002-70 | D693: 284.25999999999999 | E693: 0 | F693: 0 | G693: 0 | H693: 0 | I693: 0 | J693: 0 | K693: 314.22000000000003 | L693: 0 | M693: =SUM(J693:L693)-29.96 -> 284.26000000000005 | N693: 29.960000000000001 | O693: =SUM(M693:N693) -> 314.22000000000003
A694: 3747 | B694: EOL SERRA DA BABILÔNIA VI | C694: 24.325.137/0002-65 | D694: 260.48000000000002 | E694: 0 | F694: 0 | G694: 0 | H694: 0 | I694: 0 | J694: 0 | K694: 287.94 | L694: 0 | M694: =SUM(J694:L694)-27.46 -> 260.48000000000002 | N694: 27.460000000000001 | O694: =SUM(M694:N694) -> 287.94
A695: 3748 | B695: DIAMANTE | C695: 27.093.977/0002-38 | D695: 9364.0799999999999 | E695: 0 | F695: 0 | G695: 0 | H695: 0 | I695: 0 | J695: 0 | K695: 10351.18 | L695: 0 | M695: =SUM(J695:L695)-987.1 -> 9364.0799999999999 | N695: 987.10000000000002 | O695: =SUM(M695:N695) -> 10351.18
A696: 3749 | B696: UHE SÃO SIMÃO | C696: 27.352.303/0002-00 | D696: 49244.650000000001 | E696: 0 | F696: 0 | G696: 0 | H696: 0 | I696: 0 | J696: 0 | K696: 54435.68 | L696: 0 | M696: =SUM(J696:L696)-5191.03 -> 49244.650000000001 | N696: 5191.0299999999997 | O696: =SUM(M696:N696) -> 54435.68
A697: 3750 | B697: UFV COREMAS III | C697: 24.342.513/0001-49 | D697: 206.30000000000001 | E697: 0 | F697: 0 | G697: 0 | H697: 0 | I697: 0 | J697: 0 | K697: 228.05000000000001 | L697: 0 | M697: =SUM(J697:L697)-21.75 -> 206.30000000000001 | N697: 21.75 | O697: =SUM(M697:N697) -> 228.05000000000001
A698: 3751 | B698: EOL CAMPO LARGO I | C698: 16.756.565/0002-14 | D698: 387.42000000000002 | E698: 0 | F698: 0 | G698: 0 | H698: 0 | I698: 0 | J698: 0 | K698: 428.25999999999999 | L698: 0 | M698: =SUM(J698:L698)-40.84 -> 387.41999999999996 | N698: 40.840000000000003 | O698: =SUM(M698:N698) -> 428.25999999999999
A699: 3752 | B699: EOL CAMPO LARGO III | C699: 16.755.810/0002-79 | D699: 307.38 | E699: 0 | F699: 0 | G699: 0 | H699: 0 | I699: 0 | J699: 0 | K699: 339.77999999999997 | L699: 0 | M699: =SUM(J699:L699)-32.4 -> 307.38 | N699: 32.399999999999999 | O699: =SUM(M699:N699) -> 339.77999999999997
A700: 3753 | B700: EOL CAMPO LARGO IV | C700: 16.756.341/0002-02 | D700: 307.38 | E700: 0 | F700: 0 | G700: 0 | H700: 0 | I700: 0 | J700: 0 | K700: 339.77999999999997 | L700: 0 | M700: =SUM(J700:L700)-32.4 -> 307.38 | N700: 32.399999999999999 | O700: =SUM(M700:N700) -> 339.77999999999997
A701: 3754 | B701: EOL CAMPO LARGO VII | C701: 16.757.011/0002-31 | D701: 307.38 | E701: 0 | F701: 0 | G701: 0 | H701: 0 | I701: 0 | J701: 0 | K701: 339.77999999999997 | L701: 0 | M701: =SUM(J701:L701)-32.4 -> 307.38 | N701: 32.399999999999999 | O701: =SUM(M701:N701) -> 339.77999999999997
A702: 3755 | B702: EOL AURA LAGOA DO BARRO 07 | C702: 21.959.329/0002-35 | D702: 263.85000000000002 | E702: 0 | F702: 0 | G702: 0 | H702: 0 | I702: 0 | J702: 0 | K702: 291.66000000000003 | L702: 0 | M702: =SUM(J702:L702)-27.81 -> 263.85000000000002 | N702: 27.809999999999999 | O702: =SUM(M702:N702) -> 291.66000000000003
A703: 3756 | B703: EOL AURA QUEIMADA NOVA 03 | C703: 21.959.361/0002-10 | D703: 87.780000000000001 | E703: 0 | F703: 0 | G703: 0 | H703: 0 | I703: 0 | J703: 0 | K703: 97.030000000000001 | L703: 0 | M703: =SUM(J703:L703)-9.25 -> 87.780000000000001 | N703: 9.25 | O703: =SUM(M703:N703) -> 97.030000000000001
A704: 3757 | B704: EOL VENTOS DA SANTA BEATRIZ | C704: 13.346.161/0002-64 | D704: 270.49000000000001 | E704: 0 | F704: 0 | G704: 0 | H704: 0 | I704: 0 | J704: 0 | K704: 299 | L704: 0 | M704: =SUM(J704:L704)-28.51 -> 270.49000000000001 | N704: 28.510000000000002 | O704: =SUM(M704:N704) -> 299
A705: 3758 | B705: EOL VENTOS DE SANTA APARECIDA | C705: 13.346.095/0002-22 | D705: 274.88 | E705: 0 | F705: 0 | G705: 0 | H705: 0 | I705: 0 | J705: 0 | K705: 303.86000000000001 | L705: 0 | M705: =SUM(J705:L705)-28.98 -> 274.88 | N705: 28.98 | O705: =SUM(M705:N705) -> 303.86000000000001
A706: 3759 | B706: EOL VENTOS DE SANTA AURORA | C706: 13.346.039/0002-98 | D706: 273.05000000000001 | E706: 0 | F706: 0 | G706: 0 | H706: 0 | I706: 0 | J706: 0 | K706: 301.82999999999998 | L706: 0 | M706: =SUM(J706:L706)-28.78 -> 273.04999999999995 | N706: 28.780000000000001 | O706: =SUM(M706:N706) -> 301.82999999999993
A707: 3760 | B707: EOL VENTOS DE SANTA EMILIA | C707: 13.346.108/0002-63 | D707: 283.35000000000002 | E707: 0 | F707: 0 | G707: 0 | H707: 0 | I707: 0 | J707: 0 | K707: 313.22000000000003 | L707: 0 | M707: =SUM(J707:L707)-29.87 -> 283.35000000000002 | N707: 29.870000000000001 | O707: =SUM(M707:N707) -> 313.22000000000003
A708: 3761 | B708: EOL VENTOS DE SÃO GABRIEL | C708: 13.346.102/0002-96 | D708: 269.93000000000001 | E708: 0 | F708: 0 | G708: 0 | H708: 0 | I708: 0 | J708: 0 | K708: 298.38 | L708: 0 | M708: =SUM(J708:L708)-28.45 -> 269.93000000000001 | N708: 28.449999999999999 | O708: =SUM(M708:N708) -> 298.38
A709: 3762 | B709: EOL SERRA DA BABILÔNIA X | C709: 24.263.312/0002-37 | D709: 284.16000000000003 | E709: 0 | F709: 0 | G709: 0 | H709: 0 | I709: 0 | J709: 0 | K709: 314.11000000000001 | L709: 0 | M709: =SUM(J709:L709)-29.95 -> 284.16000000000003 | N709: 29.949999999999999 | O709: =SUM(M709:N709) -> 314.11000000000001
A710: 3763 | B710: EOL SERRA DA BABILÔNIA XI | C710: 24.263.070/0002-81 | D710: 284.19 | E710: 0 | F710: 0 | G710: 0 | H710: 0 | I710: 0 | J710: 0 | K710: 314.14999999999998 | L710: 0 | M710: =SUM(J710:L710)-29.96 -> 284.19 | N710: 29.960000000000001 | O710: =SUM(M710:N710) -> 314.14999999999998
A711: 3764 | B711: EOL SERRA DA BABILÔNIA VII | C711: 24.325.076/0002-36 | D711: 284.16000000000003 | E711: 0 | F711: 0 | G711: 0 | H711: 0 | I711: 0 | J711: 0 | K711: 314.11000000000001 | L711: 0 | M711: =SUM(J711:L711)-29.95 -> 284.16000000000003 | N711: 29.949999999999999 | O711: =SUM(M711:N711) -> 314.11000000000001
A712: 3765 | B712: EOL VENTOS DA BAHIA I | C712: 23.888.783/0001-97 | D712: 288.29000000000002 | E712: 0 | F712: 0 | G712: 0 | H712: 0 | I712: 0 | J712: 0 | K712: 318.68000000000001 | L712: 0 | M712: =SUM(J712:L712)-30.39 -> 288.29000000000002 | N712: 30.390000000000001 | O712: =SUM(M712:N712) -> 318.68000000000001
A713: 3766 | B713: EOL VENTOS DA BAHIA III | C713: 23.888.824/0001-45 | D713: 310.45999999999998 | E713: 0 | F713: 0 | G713: 0 | H713: 0 | I713: 0 | J713: 0 | K713: 343.19 | L713: 0 | M713: =SUM(J713:L713)-32.73 -> 310.45999999999998 | N713: 32.729999999999997 | O713: =SUM(M713:N713) -> 343.19
A714: 3767 | B714: EOL VENTOS DA BAHIA IX | C714: 23.890.926/0001-03 | D714: 288.29000000000002 | E714: 0 | F714: 0 | G714: 0 | H714: 0 | I714: 0 | J714: 0 | K714: 318.68000000000001 | L714: 0 | M714: =SUM(J714:L714)-30.39 -> 288.29000000000002 | N714: 30.390000000000001 | O714: =SUM(M714:N714) -> 318.68000000000001
A715: 3768 | B715: EOL VENTOS DA BAHIA XVIII | C715: 23.888.804/0001-74 | D715: 288.19 | E715: 0 | F715: 0 | G715: 0 | H715: 0 | I715: 0 | J715: 0 | K715: 318.56999999999999 | L715: 0 | M715: =SUM(J715:L715)-30.38 -> 288.19 | N715: 30.379999999999999 | O715: =SUM(M715:N715) -> 318.56999999999999
A716: 3769 | B716: EOL SÃO BENTO DO NORTE I | C716: 21.216.892/0001-32 | D716: 216.44 | E716: 0 | F716: 0 | G716: 0 | H716: 0 | I716: 0 | J716: 0 | K716: 239.25999999999999 | L716: 0 | M716: =SUM(J716:L716)-22.82 -> 216.44 | N716: 22.82 | O716: =SUM(M716:N716) -> 239.25999999999999
A717: 3770 | B717: EOL SÃO BENTO DO NORTE II | C717: 21.216.877/0001-94 | D717: 215.97 | E717: 0 | F717: 0 | G717: 0 | H717: 0 | I717: 0 | J717: 0 | K717: 238.74000000000001 | L717: 0 | M717: =SUM(J717:L717)-22.77 -> 215.97 | N717: 22.77 | O717: =SUM(M717:N717) -> 238.74000000000001
A718: 3771 | B718: EOL SÃO MIGUEL I | C718: 21.216.915/0001-09 | D718: 194.81 | E718: 0 | F718: 0 | G718: 0 | H718: 0 | I718: 0 | J718: 0 | K718: 215.34999999999999 | L718: 0 | M718: =SUM(J718:L718)-20.54 -> 194.81 | N718: 20.539999999999999 | O718: =SUM(M718:N718) -> 215.34999999999999
A719: 3772 | B719: EOL SÃO MIGUEL II | C719: 21.216.925/0001-44 | D719: 194.81 | E719: 0 | F719: 0 | G719: 0 | H719: 0 | I719: 0 | J719: 0 | K719: 215.34999999999999 | L719: 0 | M719: =SUM(J719:L719)-20.54 -> 194.81 | N719: 20.539999999999999 | O719: =SUM(M719:N719) -> 215.34999999999999
A720: 3773 | B720: EOL SÃO MIGUEL III | C720: 21.216.439/0001-26 | D720: 195.02000000000001 | E720: 0 | F720: 0 | G720: 0 | H720: 0 | I720: 0 | J720: 0 | K720: 215.58000000000001 | L720: 0 | M720: =SUM(J720:L720)-20.56 -> 195.02000000000001 | N720: 20.559999999999999 | O720: =SUM(M720:N720) -> 215.58000000000001
A721: 3774 | B721: EOL SÃO BENTO DO NORTE III | C721: 21.216.857/0001-13 | D721: 214.75999999999999 | E721: 0 | F721: 0 | G721: 0 | H721: 0 | I721: 0 | J721: 0 | K721: 237.40000000000001 | L721: 0 | M721: =SUM(J721:L721)-22.64 -> 214.75999999999999 | N721: 22.640000000000001 | O721: =SUM(M721:N721) -> 237.39999999999998
A722: 3775 | B722: EOL CAMPO LARGO XVI | C722: 17.828.934/0002-08 | D722: 388.92000000000002 | E722: 0 | F722: 0 | G722: 0 | H722: 0 | I722: 0 | J722: 0 | K722: 429.92000000000002 | L722: 0 | M722: =SUM(J722:L722)-41 -> 388.92000000000002 | N722: 41 | O722: =SUM(M722:N722) -> 429.92000000000002
A723: 3776 | B723: EOL SERRA DA BABILÔNIA IX | C723: 24.263.209/0002-97 | D723: 284.16000000000003 | E723: 0 | F723: 0 | G723: 0 | H723: 0 | I723: 0 | J723: 0 | K723: 314.11000000000001 | L723: 0 | M723: =SUM(J723:L723)-29.95 -> 284.16000000000003 | N723: 29.949999999999999 | O723: =SUM(M723:N723) -> 314.11000000000001
A724: 3777 | B724: EOL SERRA DA BABILÔNIA XII | C724: 24.263.276/0002-01 | D724: 284.19 | E724: 0 | F724: 0 | G724: 0 | H724: 0 | I724: 0 | J724: 0 | K724: 314.14999999999998 | L724: 0 | M724: =SUM(J724:L724)-29.96 -> 284.19 | N724: 29.960000000000001 | O724: =SUM(M724:N724) -> 314.14999999999998
A725: 3778 | B725: EOL AURA LAGOA DO BARRO 01 | C725: 21.951.779/0002-81 | D725: 263.85000000000002 | E725: 0 | F725: 0 | G725: 0 | H725: 0 | I725: 0 | J725: 0 | K725: 291.66000000000003 | L725: 0 | M725: =SUM(J725:L725)-27.81 -> 263.85000000000002 | N725: 27.809999999999999 | O725: =SUM(M725:N725) -> 291.66000000000003
A726: 3779 | B726: EOL GOIABEIRA | C726: 15.321.064/0001-61 | D726: 15.94 | E726: 0 | F726: 0 | G726: 0 | H726: 0 | I726: 0 | J726: 0 | K726: 17.620000000000001 | L726: 0 | M726: =SUM(J726:L726)-1.68 -> 15.940000000000001 | N726: 1.6799999999999999 | O726: =SUM(M726:N726) -> 17.620000000000001
A727: 3781 | B727: EOL SANTA CATARINA | C727: 15.321.146/0001-06 | D727: 20.440000000000001 | E727: 0 | F727: 0 | G727: 0 | H727: 0 | I727: 0 | J727: 0 | K727: 22.59 | L727: 0 | M727: =SUM(J727:L727)-2.15 -> 20.440000000000001 | N727: 2.1499999999999999 | O727: =SUM(M727:N727) -> 22.59
A728: 3783 | B728: EOL VENTOS DE HORIZONTE | C728: 15.253.350/0001-37 | D728: 15.56 | E728: 0 | F728: 0 | G728: 0 | H728: 0 | I728: 0 | J728: 0 | K728: 17.199999999999999 | L728: 0 | M728: =SUM(J728:L728)-1.64 -> 15.559999999999999 | N728: 1.6399999999999999 | O728: =SUM(M728:N728) -> 17.199999999999999
A729: 3784 | B729: EOL AURA LAGOA DO BARRO 02 | C729: 21.951.809/0002-50 | D729: 263.85000000000002 | E729: 0 | F729: 0 | G729: 0 | H729: 0 | I729: 0 | J729: 0 | K729: 291.66000000000003 | L729: 0 | M729: =SUM(J729:L729)-27.81 -> 263.85000000000002 | N729: 27.809999999999999 | O729: =SUM(M729:N729) -> 291.66000000000003
A730: 3785 | B730: EOL AURA LAGOA DO BARRO 05 | C730: 21.949.390/0002-00 | D730: 234.38 | E730: 0 | F730: 0 | G730: 0 | H730: 0 | I730: 0 | J730: 0 | K730: 259.08999999999997 | L730: 0 | M730: =SUM(J730:L730)-24.71 -> 234.37999999999997 | N730: 24.710000000000001 | O730: =SUM(M730:N730) -> 259.08999999999997
A731: 3786 | B731: UFV APODI I | C731: 24.424.331/0001-17 | D731: 242.69999999999999 | E731: 0 | F731: 0 | G731: 0 | H731: 0 | I731: 0 | J731: 0 | K731: 268.27999999999997 | L731: 0 | M731: =SUM(J731:L731)-25.58 -> 242.69999999999999 | N731: 25.579999999999998 | O731: =SUM(M731:N731) -> 268.27999999999997
A732: 3787 | B732: UFV APODI II | C732: 24.424.175/0001-94 | D732: 242.69999999999999 | E732: 0 | F732: 0 | G732: 0 | H732: 0 | I732: 0 | J732: 0 | K732: 268.27999999999997 | L732: 0 | M732: =SUM(J732:L732)-25.58 -> 242.69999999999999 | N732: 25.579999999999998 | O732: =SUM(M732:N732) -> 268.27999999999997
A733: 3788 | B733: UFV APODI III | C733: 24.424.233/0001-80 | D733: 242.69999999999999 | E733: 0 | F733: 0 | G733: 0 | H733: 0 | I733: 0 | J733: 0 | K733: 268.27999999999997 | L733: 0 | M733: =SUM(J733:L733)-25.58 -> 242.69999999999999 | N733: 25.579999999999998 | O733: =SUM(M733:N733) -> 268.27999999999997
A734: 3789 | B734: UFV APODI IV | C734: 24.424.369/0001-90 | D734: 242.69999999999999 | E734: 0 | F734: 0 | G734: 0 | H734: 0 | I734: 0 | J734: 0 | K734: 268.27999999999997 | L734: 0 | M734: =SUM(J734:L734)-25.58 -> 242.69999999999999 | N734: 25.579999999999998 | O734: =SUM(M734:N734) -> 268.27999999999997
A735: 3790 | B735: EOL BOA ESPERANÇA I | C735: 21.909.323/0001-72 | D735: 282.48000000000002 | E735: 0 | F735: 0 | G735: 0 | H735: 0 | I735: 0 | J735: 0 | K735: 312.25999999999999 | L735: 0 | M735: =SUM(J735:L735)-29.78 -> 282.48000000000002 | N735: 29.780000000000001 | O735: =SUM(M735:N735) -> 312.25999999999999
A736: 3791 | B736: EOL SERRA DA BABILÔNIA VIII | C736: 24.263.248/0002-94 | D736: 284.16000000000003 | E736: 0 | F736: 0 | G736: 0 | H736: 0 | I736: 0 | J736: 0 | K736: 314.11000000000001 | L736: 0 | M736: =SUM(J736:L736)-29.95 -> 284.16000000000003 | N736: 29.949999999999999 | O736: =SUM(M736:N736) -> 314.11000000000001
A737: 3792 | B737: EOL AURA LAGOA DO BARRO 06 | C737: 21.959.389/0002-58 | D737: 263.85000000000002 | E737: 0 | F737: 0 | G737: 0 | H737: 0 | I737: 0 | J737: 0 | K737: 291.66000000000003 | L737: 0 | M737: =SUM(J737:L737)-27.81 -> 263.85000000000002 | N737: 27.809999999999999 | O737: =SUM(M737:N737) -> 291.66000000000003
A738: 3793 | B738: EOL CAMPO LARGO V | C738: 16.757.107/0002-08 | D738: 307.38 | E738: 0 | F738: 0 | G738: 0 | H738: 0 | I738: 0 | J738: 0 | K738: 339.77999999999997 | L738: 0 | M738: =SUM(J738:L738)-32.4 -> 307.38 | N738: 32.399999999999999 | O738: =SUM(M738:N738) -> 339.77999999999997
A739: 3794 | B739: EOL CAMPO LARGO VI | C739: 16.756.943/0002-60 | D739: 307.38 | E739: 0 | F739: 0 | G739: 0 | H739: 0 | I739: 0 | J739: 0 | K739: 339.77999999999997 | L739: 0 | M739: =SUM(J739:L739)-32.4 -> 307.38 | N739: 32.399999999999999 | O739: =SUM(M739:N739) -> 339.77999999999997
A740: 3795 | B740: EOL CAMPO LARGO XVIII | C740: 17.889.739/0002-80 | D740: 387.42000000000002 | E740: 0 | F740: 0 | G740: 0 | H740: 0 | I740: 0 | J740: 0 | K740: 428.25999999999999 | L740: 0 | M740: =SUM(J740:L740)-40.84 -> 387.41999999999996 | N740: 40.840000000000003 | O740: =SUM(M740:N740) -> 428.25999999999999
A741: 3796 | B741: EOL CAMPO LARGO XXI | C741: 17.878.526/0002-52 | D741: 307.44 | E741: 0 | F741: 0 | G741: 0 | H741: 0 | I741: 0 | J741: 0 | K741: 339.85000000000002 | L741: 0 | M741: =SUM(J741:L741)-32.41 -> 307.44000000000005 | N741: 32.409999999999997 | O741: =SUM(M741:N741) -> 339.85000000000002
A742: 3797 | B742: EOL AURA LAGOA DO BARRO 03 | C742: 21.951.750/0002-08 | D742: 263.85000000000002 | E742: 0 | F742: 0 | G742: 0 | H742: 0 | I742: 0 | J742: 0 | K742: 291.66000000000003 | L742: 0 | M742: =SUM(J742:L742)-27.81 -> 263.85000000000002 | N742: 27.809999999999999 | O742: =SUM(M742:N742) -> 291.66000000000003
A743: 3798 | B743: EOL AURA LAGOA DO BARRO 04 | C743: 21.951.831/0002-08 | D743: 263.85000000000002 | E743: 0 | F743: 0 | G743: 0 | H743: 0 | I743: 0 | J743: 0 | K743: 291.66000000000003 | L743: 0 | M743: =SUM(J743:L743)-27.81 -> 263.85000000000002 | N743: 27.809999999999999 | O743: =SUM(M743:N743) -> 291.66000000000003
A744: 3799 | B744: UFV JUAZEIRO SOLAR I | C744: 24.302.618/0001-74 | D744: 290.24000000000001 | E744: 0 | F744: 0 | G744: 0 | H744: 0 | I744: 0 | J744: 0 | K744: 320.83999999999997 | L744: 0 | M744: =SUM(J744:L744)-30.6 -> 290.23999999999995 | N744: 30.600000000000001 | O744: =SUM(M744:N744) -> 320.83999999999997
A745: 3800 | B745: UFV JUAZEIRO SOLAR II | C745: 24.227.619/0001-00 | D745: 290.24000000000001 | E745: 0 | F745: 0 | G745: 0 | H745: 0 | I745: 0 | J745: 0 | K745: 320.83999999999997 | L745: 0 | M745: =SUM(J745:L745)-30.6 -> 290.23999999999995 | N745: 30.600000000000001 | O745: =SUM(M745:N745) -> 320.83999999999997
A746: 3801 | B746: UFV JUAZEIRO SOLAR III | C746: 24.358.177/0001-22 | D746: 290.24000000000001 | E746: 0 | F746: 0 | G746: 0 | H746: 0 | I746: 0 | J746: 0 | K746: 320.83999999999997 | L746: 0 | M746: =SUM(J746:L746)-30.6 -> 290.23999999999995 | N746: 30.600000000000001 | O746: =SUM(M746:N746) -> 320.83999999999997
A747: 3802 | B747: UFV JUAZEIRO SOLAR IV | C747: 24.168.509/0001-06 | D747: 290.24000000000001 | E747: 0 | F747: 0 | G747: 0 | H747: 0 | I747: 0 | J747: 0 | K747: 320.83999999999997 | L747: 0 | M747: =SUM(J747:L747)-30.6 -> 290.23999999999995 | N747: 30.600000000000001 | O747: =SUM(M747:N747) -> 320.83999999999997
A748: 3803 | B748: EOL LARANJEIRAS III | C748: 21.816.037/0002-43 | D748: 266.25999999999999 | E748: 0 | F748: 0 | G748: 0 | H748: 0 | I748: 0 | J748: 0 | K748: 294.32999999999998 | L748: 0 | M748: =SUM(J748:L748)-28.07 -> 266.25999999999999 | N748: 28.07 | O748: =SUM(M748:N748) -> 294.32999999999998
A749: 3804 | B749: EOL LARANJEIRAS IX | C749: 21.815.934/0002-32 | D749: 266.20999999999998 | E749: 0 | F749: 0 | G749: 0 | H749: 0 | I749: 0 | J749: 0 | K749: 294.26999999999998 | L749: 0 | M749: =SUM(J749:L749)-28.06 -> 266.20999999999998 | N749: 28.059999999999999 | O749: =SUM(M749:N749) -> 294.26999999999998
A750: 3805 | B750: EOL DELTA 5 I | C750: 29.296.171/0002-72 | D750: 345.88 | E750: 0 | F750: 0 | G750: 0 | H750: 0 | I750: 0 | J750: 0 | K750: 382.33999999999997 | L750: 0 | M750: =SUM(J750:L750)-36.46 -> 345.88 | N750: 36.460000000000001 | O750: =SUM(M750:N750) -> 382.33999999999997
A751: 3806 | B751: EOL DELTA 5 II | C751: 29.303.897/0002-95 | D751: 347.44 | E751: 0 | F751: 0 | G751: 0 | H751: 0 | I751: 0 | J751: 0 | K751: 384.06 | L751: 0 | M751: =SUM(J751:L751)-36.62 -> 347.44 | N751: 36.619999999999997 | O751: =SUM(M751:N751) -> 384.06
A752: 3807 | B752: COPEL (CONS. BAIXO IGUAÇU) | C752: 04.370.282/0001-70 | D752: 1855.8699999999999 | E752: 0 | F752: 0 | G752: 0 | H752: 0 | I752: 0 | J752: 0 | K752: 2051.5 | L752: 0 | M752: =SUM(J752:L752)-195.63 -> 1855.8699999999999 | N752: 195.63 | O752: =SUM(M752:N752) -> 2051.5
A753: 3808 | B753: EOL CAMPO LARGO II | C753: 16.913.777/0002-68 | D753: 401.14999999999998 | E753: 0 | F753: 0 | G753: 0 | H753: 0 | I753: 0 | J753: 0 | K753: 443.44 | L753: 0 | M753: =SUM(J753:L753)-42.29 -> 401.14999999999998 | N753: 42.289999999999999 | O753: =SUM(M753:N753) -> 443.44
A754: 3809 | B754: EOL CAMPO LARGO XV | C754: 17.928.199/0002-04 | D754: 387.42000000000002 | E754: 0 | F754: 0 | G754: 0 | H754: 0 | I754: 0 | J754: 0 | K754: 428.25999999999999 | L754: 0 | M754: =SUM(J754:L754)-40.84 -> 387.41999999999996 | N754: 40.840000000000003 | O754: =SUM(M754:N754) -> 428.25999999999999
A755: 3810 | B755: EOL DELTA 6 I | C755: 29.296.141/0002-66 | D755: 380.50999999999999 | E755: 0 | F755: 0 | G755: 0 | H755: 0 | I755: 0 | J755: 0 | K755: 420.62 | L755: 0 | M755: =SUM(J755:L755)-40.11 -> 380.50999999999999 | N755: 40.109999999999999 | O755: =SUM(M755:N755) -> 420.62
A756: 3811 | B756: EOL DELTA 6 II | C756: 29.296.975/0002-71 | D756: 311.29000000000002 | E756: 0 | F756: 0 | G756: 0 | H756: 0 | I756: 0 | J756: 0 | K756: 344.10000000000002 | L756: 0 | M756: =SUM(J756:L756)-32.81 -> 311.29000000000002 | N756: 32.810000000000002 | O756: =SUM(M756:N756) -> 344.10000000000002
A757: 3812 | B757: EOL UMBURANAS 8 | C757: 20.168.405/0002-21 | D757: 227.41 | E757: 0 | F757: 0 | G757: 0 | H757: 0 | I757: 0 | J757: 0 | K757: 251.38 | L757: 0 | M757: =SUM(J757:L757)-23.97 -> 227.41 | N757: 23.969999999999999 | O757: =SUM(M757:N757) -> 251.38
A758: 3813 | B758: EOL UMBURANAS 11 | C758: 20.168.074/0002-20 | D758: 136.16 | E758: 0 | F758: 0 | G758: 0 | H758: 0 | I758: 0 | J758: 0 | K758: 150.50999999999999 | L758: 0 | M758: =SUM(J758:L758)-14.35 -> 136.16 | N758: 14.35 | O758: =SUM(M758:N758) -> 150.50999999999999
A759: 3814 | B759: EOL UMBURANAS 13 | C759: 20.168.462/0002-00 | D759: 183.03999999999999 | E759: 0 | F759: 0 | G759: 0 | H759: 0 | I759: 0 | J759: 0 | K759: 202.33000000000001 | L759: 0 | M759: =SUM(J759:L759)-19.29 -> 183.04000000000002 | N759: 19.289999999999999 | O759: =SUM(M759:N759) -> 202.33000000000001
A760: 3815 | B760: EOL UMBURANAS 16 | C760: 20.168.152/0002-96 | D760: 228.66 | E760: 0 | F760: 0 | G760: 0 | H760: 0 | I760: 0 | J760: 0 | K760: 252.75999999999999 | L760: 0 | M760: =SUM(J760:L760)-24.1 -> 228.66 | N760: 24.100000000000001 | O760: =SUM(M760:N760) -> 252.75999999999999
A761: 3816 | B761: EOL UMBURANAS 17 | C761: 20.168.158/0002-63 | D761: 236.97999999999999 | E761: 0 | F761: 0 | G761: 0 | H761: 0 | I761: 0 | J761: 0 | K761: 261.95999999999998 | L761: 0 | M761: =SUM(J761:L761)-24.98 -> 236.97999999999999 | N761: 24.98 | O761: =SUM(M761:N761) -> 261.95999999999998
A762: 3817 | B762: EOL UMBURANAS 18 | C762: 20.168.194/0002-27 | D762: 68.049999999999997 | E762: 0 | F762: 0 | G762: 0 | H762: 0 | I762: 0 | J762: 0 | K762: 75.219999999999999 | L762: 0 | M762: =SUM(J762:L762)-7.17 -> 68.049999999999997 | N762: 7.1699999999999999 | O762: =SUM(M762:N762) -> 75.219999999999999
A763: 3818 | B763: EOL UMBURANAS 19 | C763: 20.168.112/0002-44 | D763: 261.67000000000002 | E763: 0 | F763: 0 | G763: 0 | H763: 0 | I763: 0 | J763: 0 | K763: 289.25 | L763: 0 | M763: =SUM(J763:L763)-27.58 -> 261.67000000000002 | N763: 27.579999999999998 | O763: =SUM(M763:N763) -> 289.25
A764: 3819 | B764: EOL UMBURANAS 21 | C764: 20.168.743/0002-63 | D764: 235.47999999999999 | E764: 0 | F764: 0 | G764: 0 | H764: 0 | I764: 0 | J764: 0 | K764: 260.30000000000001 | L764: 0 | M764: =SUM(J764:L764)-24.82 -> 235.48000000000002 | N764: 24.82 | O764: =SUM(M764:N764) -> 260.30000000000001
A765: 3820 | B765: EOL UMBURANAS 23 | C765: 20.168.788/0002-38 | D765: 157.55000000000001 | E765: 0 | F765: 0 | G765: 0 | H765: 0 | I765: 0 | J765: 0 | K765: 174.16 | L765: 0 | M765: =SUM(J765:L765)-16.61 -> 157.55000000000001 | N765: 16.609999999999999 | O765: =SUM(M765:N765) -> 174.16000000000003
A766: 3821 | B766: EOL UMBURANAS 25 | C766: 19.281.805/0002-60 | D766: 182.94999999999999 | E766: 0 | F766: 0 | G766: 0 | H766: 0 | I766: 0 | J766: 0 | K766: 202.24000000000001 | L766: 0 | M766: =SUM(J766:L766)-19.29 -> 182.95000000000002 | N766: 19.289999999999999 | O766: =SUM(M766:N766) -> 202.24000000000001
A767: 3822 | B767: UTE AMANDINA II | C767: 21.228.540/0001-05 | D767: 652.22000000000003 | E767: 0 | F767: 0 | G767: 0 | H767: 0 | I767: 0 | J767: 0 | K767: 720.97000000000003 | L767: 0 | M767: =SUM(J767:L767)-68.75 -> 652.22000000000003 | N767: 68.75 | O767: =SUM(M767:N767) -> 720.97000000000003
A768: 3823 | B768: EOL UMBURANAS 9 | C768: 20.168.824/0002-63 | D768: 158.96000000000001 | E768: 0 | F768: 0 | G768: 0 | H768: 0 | I768: 0 | J768: 0 | K768: 175.72 | L768: 0 | M768: =SUM(J768:L768)-16.76 -> 158.96000000000001 | N768: 16.760000000000002 | O768: =SUM(M768:N768) -> 175.72
A769: 3824 | B769: EOL UMBURANAS 10 | C769: 20.168.229/0002-28 | D769: 181.84999999999999 | E769: 0 | F769: 0 | G769: 0 | H769: 0 | I769: 0 | J769: 0 | K769: 201.02000000000001 | L769: 0 | M769: =SUM(J769:L769)-19.17 -> 181.85000000000002 | N769: 19.170000000000002 | O769: =SUM(M769:N769) -> 201.02000000000004
A770: 3825 | B770: EOL UMBURANAS 5 | C770: 20.168.051/0002-15 | D770: 159.00999999999999 | E770: 0 | F770: 0 | G770: 0 | H770: 0 | I770: 0 | J770: 0 | K770: 175.77000000000001 | L770: 0 | M770: =SUM(J770:L770)-16.76 -> 159.01000000000002 | N770: 16.760000000000002 | O770: =SUM(M770:N770) -> 175.77000000000001
A771: 3826 | B771: EOL UMBURANAS 6 | C771: 20.168.283/0002-73 | D771: 181.88 | E771: 0 | F771: 0 | G771: 0 | H771: 0 | I771: 0 | J771: 0 | K771: 201.05000000000001 | L771: 0 | M771: =SUM(J771:L771)-19.17 -> 181.88 | N771: 19.170000000000002 | O771: =SUM(M771:N771) -> 201.05000000000001
A772: 3827 | B772: UTE PAMPA SUL | C772: 04.739.720/0002-05 | D772: 6667.75 | E772: 0 | F772: 0 | G772: 0 | H772: 0 | I772: 0 | J772: 0 | K772: 7370.6199999999999 | L772: 0 | M772: =SUM(J772:L772)-702.87 -> 6667.75 | N772: 702.87 | O772: =SUM(M772:N772) -> 7370.6199999999999
A773: 3828 | B773: EOL UMBURANAS 3 | C773: 20.168.215/0002-04 | D773: 181.81 | E773: 0 | F773: 0 | G773: 0 | H773: 0 | I773: 0 | J773: 0 | K773: 200.97999999999999 | L773: 0 | M773: =SUM(J773:L773)-19.17 -> 181.81 | N773: 19.170000000000002 | O773: =SUM(M773:N773) -> 200.98000000000002
A774: 3829 | B774: EOL UMBURANAS 15 | C774: 20.168.124/0002-79 | D774: 181.81 | E774: 0 | F774: 0 | G774: 0 | H774: 0 | I774: 0 | J774: 0 | K774: 200.97999999999999 | L774: 0 | M774: =SUM(J774:L774)-19.17 -> 181.81 | N774: 19.170000000000002 | O774: =SUM(M774:N774) -> 200.98000000000002
A775: 3830 | B775: EOL UMBURANAS 1 | C775: 20.168.187/0002-25 | D775: 227.52000000000001 | E775: 0 | F775: 0 | G775: 0 | H775: 0 | I775: 0 | J775: 0 | K775: 251.5 | L775: 0 | M775: =SUM(J775:L775)-23.98 -> 227.52000000000001 | N775: 23.98 | O775: =SUM(M775:N775) -> 251.5
A776: 3831 | B776: EOL UMBURANAS 2 | C776: 20.168.242/0002-87 | D776: 227.52000000000001 | E776: 0 | F776: 0 | G776: 0 | H776: 0 | I776: 0 | J776: 0 | K776: 251.5 | L776: 0 | M776: =SUM(J776:L776)-23.98 -> 227.52000000000001 | N776: 23.98 | O776: =SUM(M776:N776) -> 251.5
A777: 3832 | B777: UHE COLÍDER | C777: 04.370.282/0003-31 | D777: 13294.9 | E777: 0 | F777: 0 | G777: 0 | H777: 0 | I777: 0 | J777: 0 | K777: 14696.360000000001 | L777: 0 | M777: =SUM(J777:L777)-1401.46 -> 13294.900000000001 | N777: 1401.46 | O777: =SUM(M777:N777) -> 14696.360000000001
A778: 3833 | B778: UTE PORTO DE SERGIPE I | C778: 23.758.522/0001-52 | D778: 30960.75 | E778: 0 | F778: 0 | G778: 0 | H778: 0 | I778: 0 | J778: 0 | K778: 34224.419999999998 | L778: 0 | M778: =SUM(J778:L778)-3263.67 -> 30960.75 | N778: 3263.6700000000001 | O778: =SUM(M778:N778) -> 34224.419999999998
A779: 3834 | B779: EOL ZEUS II | C779: 25.174.955/0001-96 | D779: 422.25 | E779: 0 | F779: 0 | G779: 0 | H779: 0 | I779: 0 | J779: 0 | K779: 466.75999999999999 | L779: 0 | M779: =SUM(J779:L779)-44.51 -> 422.25 | N779: 44.509999999999998 | O779: =SUM(M779:N779) -> 466.75999999999999
A780: 3835 | B780: PCH BANDEIRANTE | C780: 15.743.124/0002-15 | D780: 197.19 | E780: 0 | F780: 0 | G780: 0 | H780: 0 | I780: 0 | J780: 0 | K780: 217.97999999999999 | L780: 0 | M780: =SUM(J780:L780)-20.79 -> 197.19 | N780: 20.789999999999999 | O780: =SUM(M780:N780) -> 217.97999999999999
A781: 3836 | B781: PCH AREADO | C781: 23.670.551/0002-49 | D781: 109.97 | E781: 0 | F781: 0 | G781: 0 | H781: 0 | I781: 0 | J781: 0 | K781: 121.56 | L781: 0 | M781: =SUM(J781:L781)-11.59 -> 109.97 | N781: 11.59 | O781: =SUM(M781:N781) -> 121.56
A782: 3840 | B782: EOL DELTA 7 I | C782: 30.866.542/0002-93 | D782: 278.29000000000002 | E782: 0 | F782: 0 | G782: 0 | H782: 0 | I782: 0 | J782: 0 | K782: 307.63 | L782: 0 | M782: =SUM(J782:L782)-29.34 -> 278.29000000000002 | N782: 29.34 | O782: =SUM(M782:N782) -> 307.63
A783: 3841 | B783: EOL DELTA 7 II | C783: 30.905.225/0002-39 | D783: 364.00999999999999 | E783: 0 | F783: 0 | G783: 0 | H783: 0 | I783: 0 | J783: 0 | K783: 402.38 | L783: 0 | M783: =SUM(J783:L783)-38.37 -> 364.00999999999999 | N783: 38.369999999999997 | O783: =SUM(M783:N783) -> 402.38
A784: 3842 | B784: EOL DELTA 8 I | C784: 30.866.547/0002-16 | D784: 364.00999999999999 | E784: 0 | F784: 0 | G784: 0 | H784: 0 | I784: 0 | J784: 0 | K784: 402.38 | L784: 0 | M784: =SUM(J784:L784)-38.37 -> 364.00999999999999 | N784: 38.369999999999997 | O784: =SUM(M784:N784) -> 402.38
A785: 3844 | B785: EOL JANDAIA I | C785: 15.253.373/0002-22 | D785: 37.780000000000001 | E785: 0 | F785: 0 | G785: 0 | H785: 0 | I785: 0 | J785: 0 | K785: 41.759999999999998 | L785: 0 | M785: =SUM(J785:L785)-3.98 -> 37.780000000000001 | N785: 3.98 | O785: =SUM(M785:N785) -> 41.759999999999998
A786: 3845 | B786: UFV SÃO GONÇALO 22 | C786: 29.579.676/0001-63 | D786: 672.42999999999995 | E786: 0 | F786: 0 | G786: 0 | H786: 0 | I786: 0 | J786: 0 | K786: 743.30999999999995 | L786: 0 | M786: =SUM(J786:L786)-70.88 -> 672.42999999999995 | N786: 70.879999999999995 | O786: =SUM(M786:N786) -> 743.30999999999995
A787: 3846 | B787: EOL VENTOS DE VILA ACRE II | C787: 29.523.731/0001-01 | D787: 397.62 | E787: 0 | F787: 0 | G787: 0 | H787: 0 | I787: 0 | J787: 0 | K787: 439.52999999999997 | L787: 0 | M787: =SUM(J787:L787)-41.91 -> 397.62 | N787: 41.909999999999997 | O787: =SUM(M787:N787) -> 439.52999999999997
A788: 3848 | B788: UHE BALBINA | C788: 00.357.038/0001-16 | D788: 3327.3899999999999 | E788: 0 | F788: 0 | G788: 0 | H788: 0 | I788: 0 | J788: 0 | K788: 3678.1399999999999 | L788: 0 | M788: =SUM(J788:L788)-350.75 -> 3327.3899999999999 | N788: 350.75 | O788: =SUM(M788:N788) -> 3678.1399999999999
A789: 3849 | B789: UFV SÃO GONÇALO 1 | C789: 25.176.404/0001-61 | D789: 614.33000000000004 | E789: 0 | F789: 0 | G789: 0 | H789: 0 | I789: 0 | J789: 0 | K789: 679.09000000000003 | L789: 0 | M789: =SUM(J789:L789)-64.76 -> 614.33000000000004 | N789: 64.760000000000005 | O789: =SUM(M789:N789) -> 679.09000000000003
A790: 3850 | B790: UFV SÃO GONÇALO 21 | C790: 29.325.940/0001-32 | D790: 672.42999999999995 | E790: 0 | F790: 0 | G790: 0 | H790: 0 | I790: 0 | J790: 0 | K790: 743.30999999999995 | L790: 0 | M790: =SUM(J790:L790)-70.88 -> 672.42999999999995 | N790: 70.879999999999995 | O790: =SUM(M790:N790) -> 743.30999999999995
A791: 3851 | B791: EOL VENTOS DE VILA CEARÁ II | C791: 29.498.495/0001-02 | D791: 419.98000000000002 | E791: 0 | F791: 0 | G791: 0 | H791: 0 | I791: 0 | J791: 0 | K791: 464.25 | L791: 0 | M791: =SUM(J791:L791)-44.27 -> 419.98000000000002 | N791: 44.270000000000003 | O791: =SUM(M791:N791) -> 464.25
A792: 3852 | B792: EOL VENTOS DE VILA CEARÁ I | C792: 29.498.486/0001-11 | D792: 431.95999999999998 | E792: 0 | F792: 0 | G792: 0 | H792: 0 | I792: 0 | J792: 0 | K792: 477.49000000000001 | L792: 0 | M792: =SUM(J792:L792)-45.53 -> 431.96000000000004 | N792: 45.530000000000001 | O792: =SUM(M792:N792) -> 477.49000000000001
A793: 3853 | B793: UFV SÃO GONÇALO 2 | C793: 29.310.192/0001-14 | D793: 672.42999999999995 | E793: 0 | F793: 0 | G793: 0 | H793: 0 | I793: 0 | J793: 0 | K793: 743.30999999999995 | L793: 0 | M793: =SUM(J793:L793)-70.88 -> 672.42999999999995 | N793: 70.879999999999995 | O793: =SUM(M793:N793) -> 743.30999999999995
A794: 3854 | B794: UFV SÃO GONÇALO 3 | C794: 29.298.774/0001-22 | D794: 614.33000000000004 | E794: 0 | F794: 0 | G794: 0 | H794: 0 | I794: 0 | J794: 0 | K794: 679.09000000000003 | L794: 0 | M794: =SUM(J794:L794)-64.76 -> 614.33000000000004 | N794: 64.760000000000005 | O794: =SUM(M794:N794) -> 679.09000000000003
A795: 3855 | B795: EOL VILA RIO GRANDE DO NORTE I | C795: 29.401.264/0002-10 | D795: 271.49000000000001 | E795: 0 | F795: 0 | G795: 0 | H795: 0 | I795: 0 | J795: 0 | K795: 300.11000000000001 | L795: 0 | M795: =SUM(J795:L795)-28.62 -> 271.49000000000001 | N795: 28.620000000000001 | O795: =SUM(M795:N795) -> 300.11000000000001
A796: 3856 | B796: EOL VILA RIO GRANDE DO NORTE II | C796: 29.320.977/0002-59 | D796: 407.17000000000002 | E796: 0 | F796: 0 | G796: 0 | H796: 0 | I796: 0 | J796: 0 | K796: 450.08999999999997 | L796: 0 | M796: =SUM(J796:L796)-42.92 -> 407.16999999999996 | N796: 42.920000000000002 | O796: =SUM(M796:N796) -> 450.08999999999997
A797: 3857 | B797: EOL VILA SERGIPE I | C797: 29.330.011/0002-00 | D797: 407.73000000000002 | E797: 0 | F797: 0 | G797: 0 | H797: 0 | I797: 0 | J797: 0 | K797: 450.70999999999998 | L797: 0 | M797: =SUM(J797:L797)-42.98 -> 407.72999999999996 | N797: 42.979999999999997 | O797: =SUM(M797:N797) -> 450.70999999999998
A798: 3858 | B798: EOL VENTOS DE VILA PARAÍBA II | C798: 29.498.479/0001-10 | D798: 411.54000000000002 | E798: 0 | F798: 0 | G798: 0 | H798: 0 | I798: 0 | J798: 0 | K798: 454.92000000000002 | L798: 0 | M798: =SUM(J798:L798)-43.38 -> 411.54000000000002 | N798: 43.380000000000003 | O798: =SUM(M798:N798) -> 454.92000000000002
A799: 3859 | B799: UFV ETESA 17 SÃO JOÃO DO PIAUÍ I | C799: 30.520.122/0001-70 | D799: 430.14999999999998 | E799: 0 | F799: 0 | G799: 0 | H799: 0 | I799: 0 | J799: 0 | K799: 475.49000000000001 | L799: 0 | M799: =SUM(J799:L799)-45.34 -> 430.14999999999998 | N799: 45.340000000000003 | O799: =SUM(M799:N799) -> 475.49000000000001
A800: 3860 | B800: UFV ETESA 18 SÃO JOÃO DO PIAUÍ II | C800: 30.432.072/0001-79 | D800: 430.14999999999998 | E800: 0 | F800: 0 | G800: 0 | H800: 0 | I800: 0 | J800: 0 | K800: 475.49000000000001 | L800: 0 | M800: =SUM(J800:L800)-45.34 -> 430.14999999999998 | N800: 45.340000000000003 | O800: =SUM(M800:N800) -> 475.49000000000001
A801: 3861 | B801: UFV ETESA 19 SÃO JOÃO DO PIAUÍ III | C801: 30.486.042/0001-45 | D801: 430.14999999999998 | E801: 0 | F801: 0 | G801: 0 | H801: 0 | I801: 0 | J801: 0 | K801: 475.49000000000001 | L801: 0 | M801: =SUM(J801:L801)-45.34 -> 430.14999999999998 | N801: 45.340000000000003 | O801: =SUM(M801:N801) -> 475.49000000000001
A802: 3862 | B802: UFV ETESA 20 SÃO JOÃO DO PIAUÍ IV | C802: 30.425.445/0001-84 | D802: 385.74000000000001 | E802: 0 | F802: 0 | G802: 0 | H802: 0 | I802: 0 | J802: 0 | K802: 426.39999999999998 | L802: 0 | M802: =SUM(J802:L802)-40.66 -> 385.74000000000001 | N802: 40.659999999999997 | O802: =SUM(M802:N802) -> 426.39999999999998
A803: 3863 | B803: UFV ETESA 21 SÃO JOÃO DO PIAUÍ V | C803: 30.456.405/0001-08 | D803: 385.74000000000001 | E803: 0 | F803: 0 | G803: 0 | H803: 0 | I803: 0 | J803: 0 | K803: 426.39999999999998 | L803: 0 | M803: =SUM(J803:L803)-40.66 -> 385.74000000000001 | N803: 40.659999999999997 | O803: =SUM(M803:N803) -> 426.39999999999998
A804: 3864 | B804: UFV ETESA 22 SÃO JOÃO DO PIAUÍ VI | C804: 30.421.756/0001-75 | D804: 426.20999999999998 | E804: 0 | F804: 0 | G804: 0 | H804: 0 | I804: 0 | J804: 0 | K804: 471.13999999999999 | L804: 0 | M804: =SUM(J804:L804)-44.93 -> 426.20999999999998 | N804: 44.93 | O804: =SUM(M804:N804) -> 471.13999999999999
A805: 3865 | B805: UFV SÃO GONÇALO 4 | C805: 29.300.841/0001-04 | D805: 672.42999999999995 | E805: 0 | F805: 0 | G805: 0 | H805: 0 | I805: 0 | J805: 0 | K805: 743.30999999999995 | L805: 0 | M805: =SUM(J805:L805)-70.88 -> 672.42999999999995 | N805: 70.879999999999995 | O805: =SUM(M805:N805) -> 743.30999999999995
A806: 3866 | B806: UFV SÃO GONÇALO 10 | C806: 29.325.687/0001-17 | D806: 672.42999999999995 | E806: 0 | F806: 0 | G806: 0 | H806: 0 | I806: 0 | J806: 0 | K806: 743.30999999999995 | L806: 0 | M806: =SUM(J806:L806)-70.88 -> 672.42999999999995 | N806: 70.879999999999995 | O806: =SUM(M806:N806) -> 743.30999999999995
A807: 3867 | B807: EOL VENTOS DE VILA PARAÍBA I | C807: 29.523.723/0001-57 | D807: 435.77999999999997 | E807: 0 | F807: 0 | G807: 0 | H807: 0 | I807: 0 | J807: 0 | K807: 481.72000000000003 | L807: 0 | M807: =SUM(J807:L807)-45.94 -> 435.78000000000003 | N807: 45.939999999999998 | O807: =SUM(M807:N807) -> 481.72000000000003
A808: 3868 | B808: UFV SÃO GONÇALO 5 | C808: 29.298.803/0001-56 | D808: 672.42999999999995 | E808: 0 | F808: 0 | G808: 0 | H808: 0 | I808: 0 | J808: 0 | K808: 743.30999999999995 | L808: 0 | M808: =SUM(J808:L808)-70.88 -> 672.42999999999995 | N808: 70.879999999999995 | O808: =SUM(M808:N808) -> 743.30999999999995
A809: 3869 | B809: UFV SÃO GONÇALO 6 | C809: 29.710.913/0001-83 | D809: 554.51999999999998 | E809: 0 | F809: 0 | G809: 0 | H809: 0 | I809: 0 | J809: 0 | K809: 612.97000000000003 | L809: 0 | M809: =SUM(J809:L809)-58.45 -> 554.51999999999998 | N809: 58.450000000000003 | O809: =SUM(M809:N809) -> 612.97000000000003
A810: 3870 | B810: EOL VENTOS DE SÃO JANUÁRIO 20 | C810: 14.675.949/0002-87 | D810: 78.700000000000003 | E810: 0 | F810: 0 | G810: 0 | H810: 0 | I810: 0 | J810: 0 | K810: 87 | L810: 0 | M810: =SUM(J810:L810)-8.3 -> 78.700000000000003 | N810: 8.3000000000000007 | O810: =SUM(M810:N810) -> 87
A811: 3871 | B811: EOL VENTOS DE SÃO JANUÁRIO 21 | C811: 22.777.483/0002-59 | D811: 78.700000000000003 | E811: 0 | F811: 0 | G811: 0 | H811: 0 | I811: 0 | J811: 0 | K811: 87 | L811: 0 | M811: =SUM(J811:L811)-8.3 -> 78.700000000000003 | N811: 8.3000000000000007 | O811: =SUM(M811:N811) -> 87
A812: 3872 | B812: EOL VILA SERGIPE II | C812: 30.321.925/0002-86 | D812: 420.01999999999998 | E812: 0 | F812: 0 | G812: 0 | H812: 0 | I812: 0 | J812: 0 | K812: 464.30000000000001 | L812: 0 | M812: =SUM(J812:L812)-44.28 -> 420.01999999999998 | N812: 44.280000000000001 | O812: =SUM(M812:N812) -> 464.29999999999995
A813: 3873 | B813: EOL VILA MARANHÃO III | C813: 31.449.173/0001-15 | D813: 417.41000000000003 | E813: 0 | F813: 0 | G813: 0 | H813: 0 | I813: 0 | J813: 0 | K813: 461.41000000000003 | L813: 0 | M813: =SUM(J813:L813)-44 -> 417.41000000000003 | N813: 44 | O813: =SUM(M813:N813) -> 461.41000000000003
A814: 3874 | B814: UHE GOV BENTO MUNHOZ (FOZ DO AREIA) | C814: 35.742.218/0001-04 | D814: 29305.720000000001 | E814: 0 | F814: 0 | G814: 0 | H814: 0 | I814: 0 | J814: 0 | K814: 32394.93 | L814: 0 | M814: =SUM(J814:L814)-3089.21 -> 29305.720000000001 | N814: 3089.21 | O814: =SUM(M814:N814) -> 32394.93
A815: 3875 | B815: RENOVA (EOL PAU SANTO) | C815: 18.560.214/0001-88 | D815: 179.66 | E815: 0 | F815: 0 | G815: 0 | H815: 0 | I815: 0 | J815: 0 | K815: 198.59999999999999 | L815: 0 | M815: =SUM(J815:L815)-18.94 -> 179.66 | N815: 18.940000000000001 | O815: =SUM(M815:N815) -> 198.59999999999999
A816: 3876 | B816: UFV SÃO GONÇALO 7 | C816: 29.618.737/0001-54 | D816: 419.31 | E816: 0 | F816: 0 | G816: 0 | H816: 0 | I816: 0 | J816: 0 | K816: 463.50999999999999 | L816: 0 | M816: =SUM(J816:L816)-44.2 -> 419.31 | N816: 44.200000000000003 | O816: =SUM(M816:N816) -> 463.50999999999999
A817: 3877 | B817: UFV SÃO GONÇALO 8 | C817: 29.618.787/0001-31 | D817: 419.31 | E817: 0 | F817: 0 | G817: 0 | H817: 0 | I817: 0 | J817: 0 | K817: 463.50999999999999 | L817: 0 | M817: =SUM(J817:L817)-44.2 -> 419.31 | N817: 44.200000000000003 | O817: =SUM(M817:N817) -> 463.50999999999999
A818: 3878 | B818: UFV SÃO GONÇALO 11 | C818: 29.617.203/0001-03 | D818: 419.31 | E818: 0 | F818: 0 | G818: 0 | H818: 0 | I818: 0 | J818: 0 | K818: 463.50999999999999 | L818: 0 | M818: =SUM(J818:L818)-44.2 -> 419.31 | N818: 44.200000000000003 | O818: =SUM(M818:N818) -> 463.50999999999999
A819: 3879 | B819: UFV SÃO GONÇALO 12 | C819: 29.711.106/0001-85 | D819: 419.31 | E819: 0 | F819: 0 | G819: 0 | H819: 0 | I819: 0 | J819: 0 | K819: 463.50999999999999 | L819: 0 | M819: =SUM(J819:L819)-44.2 -> 419.31 | N819: 44.200000000000003 | O819: =SUM(M819:N819) -> 463.50999999999999
A820: 3880 | B820: EOL VILA SERGIPE III | C820: 30.311.178/0002-03 | D820: 186.25 | E820: 0 | F820: 0 | G820: 0 | H820: 0 | I820: 0 | J820: 0 | K820: 205.88 | L820: 0 | M820: =SUM(J820:L820)-19.63 -> 186.25 | N820: 19.629999999999999 | O820: =SUM(M820:N820) -> 205.88
A821: 3881 | B821: EOL VILA CEARÁ I | C821: 31.478.575/0001-48 | D821: 416.75 | E821: 0 | F821: 0 | G821: 0 | H821: 0 | I821: 0 | J821: 0 | K821: 460.68000000000001 | L821: 0 | M821: =SUM(J821:L821)-43.93 -> 416.75 | N821: 43.93 | O821: =SUM(M821:N821) -> 460.68000000000001
A822: 3882 | B822: EOL VENTOS DE SÃO JANUÁRIO 22 | C822: 13.346.056/0002-25 | D822: 78.700000000000003 | E822: 0 | F822: 0 | G822: 0 | H822: 0 | I822: 0 | J822: 0 | K822: 87 | L822: 0 | M822: =SUM(J822:L822)-8.3 -> 78.700000000000003 | N822: 8.3000000000000007 | O822: =SUM(M822:N822) -> 87
A823: 3883 | B823: EOL VILA PIAUÍ III | C823: 30.311.141/0002-77 | D823: 466.75 | E823: 0 | F823: 0 | G823: 0 | H823: 0 | I823: 0 | J823: 0 | K823: 515.95000000000005 | L823: 0 | M823: =SUM(J823:L823)-49.2 -> 466.75000000000006 | N823: 49.200000000000003 | O823: =SUM(M823:N823) -> 515.95000000000005
A824: 3884 | B824: EOL VENTOS DE SANTA ÂNGELA 1 | C824: 25.174.579/0001-30 | D824: 451.13 | E824: 0 | F824: 0 | G824: 0 | H824: 0 | I824: 0 | J824: 0 | K824: 498.69 | L824: 0 | M824: =SUM(J824:L824)-47.56 -> 451.13 | N824: 47.560000000000002 | O824: =SUM(M824:N824) -> 498.69
A825: 3885 | B825: EOL VENTOS DE SANTA ÂNGELA 2 | C825: 25.176.787/0001-78 | D825: 451.13 | E825: 0 | F825: 0 | G825: 0 | H825: 0 | I825: 0 | J825: 0 | K825: 498.69 | L825: 0 | M825: =SUM(J825:L825)-47.56 -> 451.13 | N825: 47.560000000000002 | O825: =SUM(M825:N825) -> 498.69
A826: 3886 | B826: EOL VENTOS DE SANTA ÂNGELA 3 | C826: 25.289.277/0001-07 | D826: 451.13 | E826: 0 | F826: 0 | G826: 0 | H826: 0 | I826: 0 | J826: 0 | K826: 498.69 | L826: 0 | M826: =SUM(J826:L826)-47.56 -> 451.13 | N826: 47.560000000000002 | O826: =SUM(M826:N826) -> 498.69
A827: 3887 | B827: EOL VENTOS DE SANTA ÂNGELA 4 | C827: 25.289.246/0001-56 | D827: 451.13 | E827: 0 | F827: 0 | G827: 0 | H827: 0 | I827: 0 | J827: 0 | K827: 498.69 | L827: 0 | M827: =SUM(J827:L827)-47.56 -> 451.13 | N827: 47.560000000000002 | O827: =SUM(M827:N827) -> 498.69
A828: 3888 | B828: EOL VENTOS DE SANTA ÂNGELA 9 | C828: 29.616.957/0001-49 | D828: 635.38999999999999 | E828: 0 | F828: 0 | G828: 0 | H828: 0 | I828: 0 | J828: 0 | K828: 702.37 | L828: 0 | M828: =SUM(J828:L828)-66.98 -> 635.38999999999999 | N828: 66.980000000000004 | O828: =SUM(M828:N828) -> 702.37
A829: 3889 | B829: EOL VENTOS DE SANTA ÂNGELA 10 | C829: 29.616.881/0001-51 | D829: 590.50999999999999 | E829: 0 | F829: 0 | G829: 0 | H829: 0 | I829: 0 | J829: 0 | K829: 652.75999999999999 | L829: 0 | M829: =SUM(J829:L829)-62.25 -> 590.50999999999999 | N829: 62.25 | O829: =SUM(M829:N829) -> 652.75999999999999
A830: 3890 | B830: EOL VENTOS DE SANTA ÂNGELA 11 | C830: 29.552.535/0001-57 | D830: 638.76999999999998 | E830: 0 | F830: 0 | G830: 0 | H830: 0 | I830: 0 | J830: 0 | K830: 706.10000000000002 | L830: 0 | M830: =SUM(J830:L830)-67.33 -> 638.76999999999998 | N830: 67.329999999999998 | O830: =SUM(M830:N830) -> 706.10000000000002
A831: 3891 | B831: EOL VENTOS DE SANTA ÂNGELA 14 | C831: 29.576.419/0001-78 | D831: 617.05999999999995 | E831: 0 | F831: 0 | G831: 0 | H831: 0 | I831: 0 | J831: 0 | K831: 682.11000000000001 | L831: 0 | M831: =SUM(J831:L831)-65.05 -> 617.06000000000006 | N831: 65.049999999999997 | O831: =SUM(M831:N831) -> 682.11000000000001
A832: 3892 | B832: EOL VENTOS DE SANTA ÂNGELA 15 | C832: 29.559.244/0001-90 | D832: 626.60000000000002 | E832: 0 | F832: 0 | G832: 0 | H832: 0 | I832: 0 | J832: 0 | K832: 692.64999999999998 | L832: 0 | M832: =SUM(J832:L832)-66.05 -> 626.60000000000002 | N832: 66.049999999999997 | O832: =SUM(M832:N832) -> 692.64999999999998
A833: 3893 | B833: EOL VILA MARANHÃO I | C833: 30.097.726/0001-55 | D833: 427.04000000000002 | E833: 0 | F833: 0 | G833: 0 | H833: 0 | I833: 0 | J833: 0 | K833: 472.06 | L833: 0 | M833: =SUM(J833:L833)-45.02 -> 427.04000000000002 | N833: 45.020000000000003 | O833: =SUM(M833:N833) -> 472.06
A834: 3894 | B834: EOL INHAMBU 2 | C834: 30.519.343/0001-28 | D834: 182.16 | E834: 0 | F834: 0 | G834: 0 | H834: 0 | I834: 0 | J834: 0 | K834: 201.36000000000001 | L834: 0 | M834: =SUM(J834:L834)-19.2 -> 182.16000000000003 | N834: 19.199999999999999 | O834: =SUM(M834:N834) -> 201.36000000000001
A835: 3895 | B835: EOL VILA PIAUÍ I | C835: 30.321.883/0002-83 | D835: 419.11000000000001 | E835: 0 | F835: 0 | G835: 0 | H835: 0 | I835: 0 | J835: 0 | K835: 463.29000000000002 | L835: 0 | M835: =SUM(J835:L835)-44.18 -> 419.11000000000001 | N835: 44.18 | O835: =SUM(M835:N835) -> 463.29000000000002
A836: 3896 | B836: EOL VILA PIAUÍ II | C836: 30.311.116/0002-93 | D836: 418.66000000000003 | E836: 0 | F836: 0 | G836: 0 | H836: 0 | I836: 0 | J836: 0 | K836: 462.79000000000002 | L836: 0 | M836: =SUM(J836:L836)-44.13 -> 418.66000000000003 | N836: 44.130000000000003 | O836: =SUM(M836:N836) -> 462.79000000000002
A837: 3897 | B837: EOL VENTOS DE SÃO JANUÁRIO 13 | C837: 30.558.294/0001-32 | D837: 66.879999999999995 | E837: 0 | F837: 0 | G837: 0 | H837: 0 | I837: 0 | J837: 0 | K837: 73.930000000000007 | L837: 0 | M837: =SUM(J837:L837)-7.05 -> 66.88000000000001 | N837: 7.0499999999999998 | O837: =SUM(M837:N837) -> 73.930000000000007
A838: 3898 | B838: EOL VILA MARANHÃO II | C838: 31.004.703/0001-11 | D838: 417.56 | E838: 0 | F838: 0 | G838: 0 | H838: 0 | I838: 0 | J838: 0 | K838: 461.57999999999998 | L838: 0 | M838: =SUM(J838:L838)-44.02 -> 417.56 | N838: 44.020000000000003 | O838: =SUM(M838:N838) -> 461.57999999999998
A839: 3899 | B839: EOL VENTOS DE SANTA ÂNGELA 5 | C839: 25.289.292/0001-55 | D839: 448.63999999999999 | E839: 0 | F839: 0 | G839: 0 | H839: 0 | I839: 0 | J839: 0 | K839: 495.93000000000001 | L839: 0 | M839: =SUM(J839:L839)-47.29 -> 448.63999999999999 | N839: 47.289999999999999 | O839: =SUM(M839:N839) -> 495.93000000000001
A840: 3900 | B840: EOL VENTOS DE SANTA ÂNGELA 6 | C840: 25.289.215/0001-03 | D840: 448.63999999999999 | E840: 0 | F840: 0 | G840: 0 | H840: 0 | I840: 0 | J840: 0 | K840: 495.93000000000001 | L840: 0 | M840: =SUM(J840:L840)-47.29 -> 448.63999999999999 | N840: 47.289999999999999 | O840: =SUM(M840:N840) -> 495.93000000000001
A841: 3901 | B841: EOL VENTOS DE SANTA ÂNGELA 7 | C841: 25.289.312/0001-98 | D841: 358.85000000000002 | E841: 0 | F841: 0 | G841: 0 | H841: 0 | I841: 0 | J841: 0 | K841: 396.68000000000001 | L841: 0 | M841: =SUM(J841:L841)-37.83 -> 358.85000000000002 | N841: 37.829999999999998 | O841: =SUM(M841:N841) -> 396.68000000000001
A842: 3902 | B842: EOL VENTOS DE SANTA ÂNGELA 8 | C842: 29.559.160/0001-57 | D842: 448.63999999999999 | E842: 0 | F842: 0 | G842: 0 | H842: 0 | I842: 0 | J842: 0 | K842: 495.93000000000001 | L842: 0 | M842: =SUM(J842:L842)-47.29 -> 448.63999999999999 | N842: 47.289999999999999 | O842: =SUM(M842:N842) -> 495.93000000000001
A843: 3903 | B843: EOL VENTOS DE SÃO JANUÁRIO 14 | C843: 30.558.337/0001-80 | D843: 66.879999999999995 | E843: 0 | F843: 0 | G843: 0 | H843: 0 | I843: 0 | J843: 0 | K843: 73.930000000000007 | L843: 0 | M843: =SUM(J843:L843)-7.05 -> 66.88000000000001 | N843: 7.0499999999999998 | O843: =SUM(M843:N843) -> 73.930000000000007
A844: 3904 | B844: EOL SÃO FERNANDO I | C844: 23.008.029/0001-15 | D844: 878.82000000000005 | E844: 0 | F844: 0 | G844: 0 | H844: 0 | I844: 0 | J844: 0 | K844: 971.46000000000004 | L844: 0 | M844: =SUM(J844:L844)-92.64 -> 878.82000000000005 | N844: 92.640000000000001 | O844: =SUM(M844:N844) -> 971.46000000000004
A845: 3905 | B845: EOL SÃO FERNANDO II | C845: 32.132.033/0001-81 | D845: 997.97000000000003 | E845: 0 | F845: 0 | G845: 0 | H845: 0 | I845: 0 | J845: 0 | K845: 1103.1700000000001 | L845: 0 | M845: =SUM(J845:L845)-105.2 -> 997.97000000000003 | N845: 105.2 | O845: =SUM(M845:N845) -> 1103.1700000000001
A846: 3906 | B846: EOL CORRUPIÃO 2 | C846: 30.519.369/0001-76 | D846: 209.58000000000001 | E846: 0 | F846: 0 | G846: 0 | H846: 0 | I846: 0 | J846: 0 | K846: 231.66999999999999 | L846: 0 | M846: =SUM(J846:L846)-22.09 -> 209.57999999999998 | N846: 22.09 | O846: =SUM(M846:N846) -> 231.66999999999999
A847: 3907 | B847: EOL VENTOS DE SÃO JANUÁRIO 04 | C847: 30.558.320/0001-22 | D847: 396.24000000000001 | E847: 0 | F847: 0 | G847: 0 | H847: 0 | I847: 0 | J847: 0 | K847: 438.00999999999999 | L847: 0 | M847: =SUM(J847:L847)-41.77 -> 396.24000000000001 | N847: 41.770000000000003 | O847: =SUM(M847:N847) -> 438.00999999999999
A848: 3908 | B848: EOL SERRA DO FOGO | C848: 33.295.705/0002-13 | D848: 363.45999999999998 | E848: 0 | F848: 0 | G848: 0 | H848: 0 | I848: 0 | J848: 0 | K848: 401.76999999999998 | L848: 0 | M848: =SUM(J848:L848)-38.31 -> 363.45999999999998 | N848: 38.310000000000002 | O848: =SUM(M848:N848) -> 401.76999999999998
A849: 3909 | B849: EOL SERRA DO VENTO | C849: 33.269.273/0002-76 | D849: 363.45999999999998 | E849: 0 | F849: 0 | G849: 0 | H849: 0 | I849: 0 | J849: 0 | K849: 401.76999999999998 | L849: 0 | M849: =SUM(J849:L849)-38.31 -> 363.45999999999998 | N849: 38.310000000000002 | O849: =SUM(M849:N849) -> 401.76999999999998
A850: 3910 | B850: EOL VENTOS DE SÃO JANUÁRIO 01 | C850: 30.558.359/0001-40 | D850: 452.85000000000002 | E850: 0 | F850: 0 | G850: 0 | H850: 0 | I850: 0 | J850: 0 | K850: 500.58999999999997 | L850: 0 | M850: =SUM(J850:L850)-47.74 -> 452.84999999999997 | N850: 47.740000000000002 | O850: =SUM(M850:N850) -> 500.58999999999997
A851: 3911 | B851: EOL VENTOS DE SÃO JANUÁRIO 03 | C851: 31.818.977/0001-44 | D851: 488.98000000000002 | E851: 0 | F851: 0 | G851: 0 | H851: 0 | I851: 0 | J851: 0 | K851: 540.51999999999998 | L851: 0 | M851: =SUM(J851:L851)-51.54 -> 488.97999999999996 | N851: 51.539999999999999 | O851: =SUM(M851:N851) -> 540.51999999999998
A852: 3912 | B852: EOL CASA NOVA A | C852: 33.541.368/0001-16 | D852: 308.43000000000001 | E852: 0 | F852: 0 | G852: 0 | H852: 0 | I852: 0 | J852: 0 | K852: 340.94 | L852: 0 | M852: =SUM(J852:L852)-32.51 -> 308.43000000000001 | N852: 32.509999999999998 | O852: =SUM(M852:N852) -> 340.94
A853: 3913 | B853: EOL VENTOS DE SÃO JANUÁRIO 05 | C853: 31.818.981/0001-02 | D853: 66.879999999999995 | E853: 0 | F853: 0 | G853: 0 | H853: 0 | I853: 0 | J853: 0 | K853: 73.930000000000007 | L853: 0 | M853: =SUM(J853:L853)-7.05 -> 66.88000000000001 | N853: 7.0499999999999998 | O853: =SUM(M853:N853) -> 73.930000000000007
A854: 3914 | B854: EOL UMBURANA DE CHEIRO | C854: 33.295.664/0002-65 | D854: 363.45999999999998 | E854: 0 | F854: 0 | G854: 0 | H854: 0 | I854: 0 | J854: 0 | K854: 401.76999999999998 | L854: 0 | M854: =SUM(J854:L854)-38.31 -> 363.45999999999998 | N854: 38.310000000000002 | O854: =SUM(M854:N854) -> 401.76999999999998
A855: 3915 | B855: EOL ARARINHA AZUL | C855: 30.519.323/0001-57 | D855: 249.44999999999999 | E855: 0 | F855: 0 | G855: 0 | H855: 0 | I855: 0 | J855: 0 | K855: 275.75 | L855: 0 | M855: =SUM(J855:L855)-26.3 -> 249.44999999999999 | N855: 26.300000000000001 | O855: =SUM(M855:N855) -> 275.75
A856: 3916 | B856: EOL CAMPO LARGO IX | C856: 17.995.695/0002-72 | D856: 297.05000000000001 | E856: 0 | F856: 0 | G856: 0 | H856: 0 | I856: 0 | J856: 0 | K856: 328.36000000000001 | L856: 0 | M856: =SUM(J856:L856)-31.31 -> 297.05000000000001 | N856: 31.309999999999999 | O856: =SUM(M856:N856) -> 328.36000000000001
A857: 3917 | B857: EOL CAMPO LARGO X | C857: 17.815.305/0002-35 | D857: 394.51999999999998 | E857: 0 | F857: 0 | G857: 0 | H857: 0 | I857: 0 | J857: 0 | K857: 436.11000000000001 | L857: 0 | M857: =SUM(J857:L857)-41.59 -> 394.51999999999998 | N857: 41.590000000000003 | O857: =SUM(M857:N857) -> 436.11000000000001
A858: 3918 | B858: EOL CAMPO LARGO XIV | C858: 17.829.499/0002-28 | D858: 246.77000000000001 | E858: 0 | F858: 0 | G858: 0 | H858: 0 | I858: 0 | J858: 0 | K858: 272.77999999999997 | L858: 0 | M858: =SUM(J858:L858)-26.01 -> 246.76999999999998 | N858: 26.010000000000002 | O858: =SUM(M858:N858) -> 272.77999999999997
A859: 3919 | B859: EOL VENTOS DE SÃO FERNANDO 3 | C859: 32.671.163/0001-92 | D859: 270.94 | E859: 0 | F859: 0 | G859: 0 | H859: 0 | I859: 0 | J859: 0 | K859: 299.5 | L859: 0 | M859: =SUM(J859:L859)-28.56 -> 270.94 | N859: 28.559999999999999 | O859: =SUM(M859:N859) -> 299.5
A860: 3920 | B860: EOL CAMPO LARGO XVII | C860: 17.916.887/0002-46 | D860: 346.47000000000003 | E860: 0 | F860: 0 | G860: 0 | H860: 0 | I860: 0 | J860: 0 | K860: 382.99000000000001 | L860: 0 | M860: =SUM(J860:L860)-36.52 -> 346.47000000000003 | N860: 36.520000000000003 | O860: =SUM(M860:N860) -> 382.99000000000001
A861: 3921 | B861: EOL CAMPO LARGO XIX | C861: 17.928.213/0002-61 | D861: 394.19999999999999 | E861: 0 | F861: 0 | G861: 0 | H861: 0 | I861: 0 | J861: 0 | K861: 435.75 | L861: 0 | M861: =SUM(J861:L861)-41.55 -> 394.19999999999999 | N861: 41.549999999999997 | O861: =SUM(M861:N861) -> 435.75
A862: 3922 | B862: EOL TEIÚ 3 | C862: 30.534.321/0001-37 | D862: 276.58999999999997 | E862: 0 | F862: 0 | G862: 0 | H862: 0 | I862: 0 | J862: 0 | K862: 305.75 | L862: 0 | M862: =SUM(J862:L862)-29.16 -> 276.58999999999997 | N862: 29.16 | O862: =SUM(M862:N862) -> 305.75
A863: 3923 | B863: EOL SERROTE II | C863: 32.398.720/0001-43 | D863: 256.42000000000002 | E863: 0 | F863: 0 | G863: 0 | H863: 0 | I863: 0 | J863: 0 | K863: 283.44999999999999 | L863: 0 | M863: =SUM(J863:L863)-27.03 -> 256.41999999999996 | N863: 27.030000000000001 | O863: =SUM(M863:N863) -> 283.44999999999993
A864: 3924 | B864: EOL SERROTE III | C864: 32.398.682/0001-29 | D864: 213.59999999999999 | E864: 0 | F864: 0 | G864: 0 | H864: 0 | I864: 0 | J864: 0 | K864: 236.12 | L864: 0 | M864: =SUM(J864:L864)-22.52 -> 213.59999999999999 | N864: 22.52 | O864: =SUM(M864:N864) -> 236.12
A865: 3925 | B865: EOL VENTOS DE SÃO JANUÁRIO 06 | C865: 31.810.453/0001-07 | D865: 60.189999999999998 | E865: 0 | F865: 0 | G865: 0 | H865: 0 | I865: 0 | J865: 0 | K865: 66.530000000000001 | L865: 0 | M865: =SUM(J865:L865)-6.34 -> 60.189999999999998 | N865: 6.3399999999999999 | O865: =SUM(M865:N865) -> 66.530000000000001
A866: 3926 | B866: EOL VENTOS DE SÃO JANUÁRIO 11 | C866: 31.810.445/0001-60 | D866: 611.22000000000003 | E866: 0 | F866: 0 | G866: 0 | H866: 0 | I866: 0 | J866: 0 | K866: 675.64999999999998 | L866: 0 | M866: =SUM(J866:L866)-64.43 -> 611.22000000000003 | N866: 64.430000000000007 | O866: =SUM(M866:N866) -> 675.65000000000009
A867: 3927 | B867: EOL AVENTURA II | C867: 17.875.511/0002-30 | D867: 292.76999999999998 | E867: 0 | F867: 0 | G867: 0 | H867: 0 | I867: 0 | J867: 0 | K867: 323.63 | L867: 0 | M867: =SUM(J867:L867)-30.86 -> 292.76999999999998 | N867: 30.859999999999999 | O867: =SUM(M867:N867) -> 323.63
A868: 3928 | B868: EOL AVENTURA IV | C868: 28.525.891/0002-08 | D868: 412.06999999999999 | E868: 0 | F868: 0 | G868: 0 | H868: 0 | I868: 0 | J868: 0 | K868: 455.50999999999999 | L868: 0 | M868: =SUM(J868:L868)-43.44 -> 412.06999999999999 | N868: 43.439999999999998 | O868: =SUM(M868:N868) -> 455.50999999999999
A869: 3929 | B869: EOL CAMPO LARGO XX | C869: 17.929.168/0002-60 | D869: 443.55000000000001 | E869: 0 | F869: 0 | G869: 0 | H869: 0 | I869: 0 | J869: 0 | K869: 490.31 | L869: 0 | M869: =SUM(J869:L869)-46.76 -> 443.55000000000001 | N869: 46.759999999999998 | O869: =SUM(M869:N869) -> 490.31
A870: 3930 | B870: EOL POTIGUAR B31 | C870: 34.327.393/0001-64 | D870: 505.14999999999998 | E870: 0 | F870: 0 | G870: 0 | H870: 0 | I870: 0 | J870: 0 | K870: 558.39999999999998 | L870: 0 | M870: =SUM(J870:L870)-53.25 -> 505.14999999999998 | N870: 53.25 | O870: =SUM(M870:N870) -> 558.39999999999998
A871: 3931 | B871: EOL POTIGUAR B32 | C871: 34.327.409/0001-39 | D871: 552.5 | E871: 0 | F871: 0 | G871: 0 | H871: 0 | I871: 0 | J871: 0 | K871: 610.74000000000001 | L871: 0 | M871: =SUM(J871:L871)-58.24 -> 552.5 | N871: 58.240000000000002 | O871: =SUM(M871:N871) -> 610.74000000000001
A872: 3932 | B872: EOL VENTOS DE SÃO FERNANDO 4 | C872: 33.701.101/0001-49 | D872: 929.30999999999995 | E872: 0 | F872: 0 | G872: 0 | H872: 0 | I872: 0 | J872: 0 | K872: 1027.27 | L872: 0 | M872: =SUM(J872:L872)-97.96 -> 929.30999999999995 | N872: 97.959999999999994 | O872: =SUM(M872:N872) -> 1027.27
A873: 3933 | B873: EOL VENTOS DE SÃO JANUÁRIO 10 | C873: 31.810.448/0001-02 | D873: 611.22000000000003 | E873: 0 | F873: 0 | G873: 0 | H873: 0 | I873: 0 | J873: 0 | K873: 675.64999999999998 | L873: 0 | M873: =SUM(J873:L873)-64.43 -> 611.22000000000003 | N873: 64.430000000000007 | O873: =SUM(M873:N873) -> 675.65000000000009
A874: 3934 | B874: EOL SERROTE I | C874: 32.398.775/0001-53 | D874: 256.42000000000002 | E874: 0 | F874: 0 | G874: 0 | H874: 0 | I874: 0 | J874: 0 | K874: 283.44999999999999 | L874: 0 | M874: =SUM(J874:L874)-27.03 -> 256.41999999999996 | N874: 27.030000000000001 | O874: =SUM(M874:N874) -> 283.44999999999993
A875: 3935 | B875: EOL SERROTE IV | C875: 32.398.772/0001-10 | D875: 170.88 | E875: 0 | F875: 0 | G875: 0 | H875: 0 | I875: 0 | J875: 0 | K875: 188.88999999999999 | L875: 0 | M875: =SUM(J875:L875)-18.01 -> 170.88 | N875: 18.010000000000002 | O875: =SUM(M875:N875) -> 188.88999999999999
A876: 3936 | B876: EOL SERROTE V | C876: 32.398.761/0001-30 | D876: 299.13999999999999 | E876: 0 | F876: 0 | G876: 0 | H876: 0 | I876: 0 | J876: 0 | K876: 330.67000000000002 | L876: 0 | M876: =SUM(J876:L876)-31.53 -> 299.13999999999999 | N876: 31.530000000000001 | O876: =SUM(M876:N876) -> 330.66999999999996
A877: 3937 | B877: UFV FLOR DE MANDACARU | C877: 12.009.135/0001-05 | D877: 22.379999999999999 | E877: 0 | F877: 0 | G877: 0 | H877: 0 | I877: 0 | J877: 0 | K877: 24.739999999999998 | L877: 0 | M877: =SUM(J877:L877)-2.36 -> 22.379999999999999 | N877: 2.3599999999999999 | O877: =SUM(M877:N877) -> 24.739999999999998
A878: 3938 | B878: EOL VENTOS DE SANTA ÂNGELA 20 | C878: 29.552.939/0001-40 | D878: 433.52999999999997 | E878: 0 | F878: 0 | G878: 0 | H878: 0 | I878: 0 | J878: 0 | K878: 479.23000000000002 | L878: 0 | M878: =SUM(J878:L878)-45.7 -> 433.53000000000003 | N878: 45.700000000000003 | O878: =SUM(M878:N878) -> 479.23000000000002
A879: 3939 | B879: EOL VENTOS DE SANTA ÂNGELA 21 | C879: 29.616.162/0001-30 | D879: 390.33999999999997 | E879: 0 | F879: 0 | G879: 0 | H879: 0 | I879: 0 | J879: 0 | K879: 431.49000000000001 | L879: 0 | M879: =SUM(J879:L879)-41.15 -> 390.34000000000003 | N879: 41.149999999999999 | O879: =SUM(M879:N879) -> 431.49000000000001
A880: 3940 | B880: UFV SÃO GONÇALO 18 | C880: 31.752.294/0001-31 | D880: 517.48000000000002 | E880: 0 | F880: 0 | G880: 0 | H880: 0 | I880: 0 | J880: 0 | K880: 572.02999999999997 | L880: 0 | M880: =SUM(J880:L880)-54.55 -> 517.48000000000002 | N880: 54.549999999999997 | O880: =SUM(M880:N880) -> 572.02999999999997
A881: 3941 | B881: UTE GNA I | C881: 23.449.511/0001-90 | D881: 24487.75 | E881: 0 | F881: 0 | G881: 0 | H881: 0 | I881: 0 | J881: 0 | K881: 27069.080000000002 | L881: 0 | M881: =SUM(J881:L881)-2581.33 -> 24487.75 | N881: 2581.3299999999999 | O881: =SUM(M881:N881) -> 27069.080000000002
A882: 3942 | B882: EOL CRISTALÂNDIA III | C882: 23.049.225/0003-08 | D882: 240.47999999999999 | E882: 0 | F882: 0 | G882: 0 | H882: 0 | I882: 0 | J882: 0 | K882: 265.82999999999998 | L882: 0 | M882: =SUM(J882:L882)-25.35 -> 240.47999999999999 | N882: 25.350000000000001 | O882: =SUM(M882:N882) -> 265.82999999999998
A883: 3943 | B883: EOL AVENTURA III | C883: 29.302.365/0002-33 | D883: 353.13999999999999 | E883: 0 | F883: 0 | G883: 0 | H883: 0 | I883: 0 | J883: 0 | K883: 390.37 | L883: 0 | M883: =SUM(J883:L883)-37.23 -> 353.13999999999999 | N883: 37.229999999999997 | O883: =SUM(M883:N883) -> 390.37
A884: 3944 | B884: EOL SERROTE VII | C884: 32.398.767/0001-07 | D884: 299.13999999999999 | E884: 0 | F884: 0 | G884: 0 | H884: 0 | I884: 0 | J884: 0 | K884: 330.67000000000002 | L884: 0 | M884: =SUM(J884:L884)-31.53 -> 299.13999999999999 | N884: 31.530000000000001 | O884: =SUM(M884:N884) -> 330.66999999999996
A885: 3945 | B885: EOL SERROTE VIII | C885: 32.398.765/0001-18 | D885: 299.13999999999999 | E885: 0 | F885: 0 | G885: 0 | H885: 0 | I885: 0 | J885: 0 | K885: 330.67000000000002 | L885: 0 | M885: =SUM(J885:L885)-31.53 -> 299.13999999999999 | N885: 31.530000000000001 | O885: =SUM(M885:N885) -> 330.66999999999996
A886: 3946 | B886: EOL POTIGUAR B33 | C886: 34.327.417/0001-85 | D886: 670.88999999999999 | E886: 0 | F886: 0 | G886: 0 | H886: 0 | I886: 0 | J886: 0 | K886: 741.61000000000001 | L886: 0 | M886: =SUM(J886:L886)-70.72 -> 670.88999999999999 | N886: 70.719999999999999 | O886: =SUM(M886:N886) -> 741.61000000000001
A887: 3947 | B887: EOL SERRA DA BABILÔNIA A | C887: 30.063.842/0002-34 | D887: 304.27999999999997 | E887: 0 | F887: 0 | G887: 0 | H887: 0 | I887: 0 | J887: 0 | K887: 336.36000000000001 | L887: 0 | M887: =SUM(J887:L887)-32.08 -> 304.28000000000003 | N887: 32.079999999999998 | O887: =SUM(M887:N887) -> 336.36000000000001
A888: 3948 | B888: EOL SERRA DA BABILÔNIA B | C888: 29.527.877/0002-06 | D888: 361.81999999999999 | E888: 0 | F888: 0 | G888: 0 | H888: 0 | I888: 0 | J888: 0 | K888: 399.95999999999998 | L888: 0 | M888: =SUM(J888:L888)-38.14 -> 361.81999999999999 | N888: 38.140000000000001 | O888: =SUM(M888:N888) -> 399.95999999999998
A889: 3949 | B889: EOL VENTOS DE SANTA ÂNGELA 12 | C889: 29.722.095/0001-39 | D889: 352.72000000000003 | E889: 0 | F889: 0 | G889: 0 | H889: 0 | I889: 0 | J889: 0 | K889: 389.89999999999998 | L889: 0 | M889: =SUM(J889:L889)-37.18 -> 352.71999999999997 | N889: 37.18 | O889: =SUM(M889:N889) -> 389.89999999999998
A890: 3950 | B890: EOL VENTOS DE SANTA ÂNGELA 13 | C890: 29.310.217/0001-80 | D890: 332.68000000000001 | E890: 0 | F890: 0 | G890: 0 | H890: 0 | I890: 0 | J890: 0 | K890: 367.75 | L890: 0 | M890: =SUM(J890:L890)-35.07 -> 332.68000000000001 | N890: 35.07 | O890: =SUM(M890:N890) -> 367.75
A891: 3951 | B891: EOL VENTOS DE SANTA ÂNGELA 18 | C891: 29.710.906/0001-81 | D891: 368.47000000000003 | E891: 0 | F891: 0 | G891: 0 | H891: 0 | I891: 0 | J891: 0 | K891: 407.31 | L891: 0 | M891: =SUM(J891:L891)-38.84 -> 368.47000000000003 | N891: 38.840000000000003 | O891: =SUM(M891:N891) -> 407.31000000000006
A892: 3952 | B892: EOL GAMELEIRA | C892: 07.099.001/0001-84 | D892: 235.55000000000001 | E892: 0 | F892: 0 | G892: 0 | H892: 0 | I892: 0 | J892: 0 | K892: 260.38 | L892: 0 | M892: =SUM(J892:L892)-24.83 -> 235.55000000000001 | N892: 24.829999999999998 | O892: =SUM(M892:N892) -> 260.38
A893: 3953 | B893: EOL FAROL DE TOUROS | C893: 10.369.836/0001-11 | D893: 329.89999999999998 | E893: 0 | F893: 0 | G893: 0 | H893: 0 | I893: 0 | J893: 0 | K893: 364.68000000000001 | L893: 0 | M893: =SUM(J893:L893)-34.78 -> 329.89999999999998 | N893: 34.780000000000001 | O893: =SUM(M893:N893) -> 364.67999999999995
A894: 3954 | B894: EOL COSTA DAS DUNAS | C894: 10.401.225/0001-03 | D894: 379.94999999999999 | E894: 0 | F894: 0 | G894: 0 | H894: 0 | I894: 0 | J894: 0 | K894: 420 | L894: 0 | M894: =SUM(J894:L894)-40.05 -> 379.94999999999999 | N894: 40.049999999999997 | O894: =SUM(M894:N894) -> 420
A895: 3955 | B895: EOL FIGUEIRA BRANCA | C895: 09.665.352/0001-30 | D895: 141.25 | E895: 0 | F895: 0 | G895: 0 | H895: 0 | I895: 0 | J895: 0 | K895: 156.13999999999999 | L895: 0 | M895: =SUM(J895:L895)-14.89 -> 141.25 | N895: 14.890000000000001 | O895: =SUM(M895:N895) -> 156.13999999999999
A896: 3957 | B896: EOL AVENTURA V | C896: 28.946.365/0002-03 | D896: 409.44 | E896: 0 | F896: 0 | G896: 0 | H896: 0 | I896: 0 | J896: 0 | K896: 452.60000000000002 | L896: 0 | M896: =SUM(J896:L896)-43.16 -> 409.44000000000005 | N896: 43.159999999999997 | O896: =SUM(M896:N896) -> 452.60000000000002
A897: 3958 | B897: EOL CAMPO LARGO VIII | C897: 18.001.918/0002-00 | D897: 394.19999999999999 | E897: 0 | F897: 0 | G897: 0 | H897: 0 | I897: 0 | J897: 0 | K897: 435.75 | L897: 0 | M897: =SUM(J897:L897)-41.55 -> 394.19999999999999 | N897: 41.549999999999997 | O897: =SUM(M897:N897) -> 435.75
A898: 3959 | B898: EOL CAMPO LARGO XI | C898: 17.955.471/0002-37 | D898: 197.55000000000001 | E898: 0 | F898: 0 | G898: 0 | H898: 0 | I898: 0 | J898: 0 | K898: 218.37 | L898: 0 | M898: =SUM(J898:L898)-20.82 -> 197.55000000000001 | N898: 20.82 | O898: =SUM(M898:N898) -> 218.37
A899: 3960 | B899: EOL CAMPO LARGO XII | C899: 17.846.141/0002-03 | D899: 640.59000000000003 | E899: 0 | F899: 0 | G899: 0 | H899: 0 | I899: 0 | J899: 0 | K899: 708.12 | L899: 0 | M899: =SUM(J899:L899)-67.53 -> 640.59000000000003 | N899: 67.530000000000001 | O899: =SUM(M899:N899) -> 708.12
A900: 3961 | B900: EOL CAMPO LARGO XIII | C900: 17.995.969/0002-23 | D900: 492.77999999999997 | E900: 0 | F900: 0 | G900: 0 | H900: 0 | I900: 0 | J900: 0 | K900: 544.73000000000002 | L900: 0 | M900: =SUM(J900:L900)-51.95 -> 492.78000000000003 | N900: 51.950000000000003 | O900: =SUM(M900:N900) -> 544.73000000000002
A901: 3962 | B901: EOL CAMPO LARGO XXII | C901: 18.154.009/0002-01 | D901: 394.19999999999999 | E901: 0 | F901: 0 | G901: 0 | H901: 0 | I901: 0 | J901: 0 | K901: 435.75 | L901: 0 | M901: =SUM(J901:L901)-41.55 -> 394.19999999999999 | N901: 41.549999999999997 | O901: =SUM(M901:N901) -> 435.75
A902: 3963 | B902: UFV SÃO GONÇALO 19 | C902: 31.752.301/0001-03 | D902: 528.02999999999997 | E902: 0 | F902: 0 | G902: 0 | H902: 0 | I902: 0 | J902: 0 | K902: 583.69000000000005 | L902: 0 | M902: =SUM(J902:L902)-55.66 -> 528.03000000000009 | N902: 55.659999999999997 | O902: =SUM(M902:N902) -> 583.69000000000005
A903: 3964 | B903: EOL VENTOS DE SANTA ÂNGELA 19 | C903: 29.552.605/0001-77 | D903: 432.20999999999998 | E903: 0 | F903: 0 | G903: 0 | H903: 0 | I903: 0 | J903: 0 | K903: 477.76999999999998 | L903: 0 | M903: =SUM(J903:L903)-45.56 -> 432.20999999999998 | N903: 45.560000000000002 | O903: =SUM(M903:N903) -> 477.76999999999998
A904: 3965 | B904: EOL SERROTE VI | C904: 32.398.764/0001-73 | D904: 299.13999999999999 | E904: 0 | F904: 0 | G904: 0 | H904: 0 | I904: 0 | J904: 0 | K904: 330.67000000000002 | L904: 0 | M904: =SUM(J904:L904)-31.53 -> 299.13999999999999 | N904: 31.530000000000001 | O904: =SUM(M904:N904) -> 330.66999999999996
A905: 3966 | B905: EOL VENTOS DE VILA MATO GROSSO I | C905: 34.109.229/0001-80 | D905: 598.82000000000005 | E905: 0 | F905: 0 | G905: 0 | H905: 0 | I905: 0 | J905: 0 | K905: 661.94000000000005 | L905: 0 | M905: =SUM(J905:L905)-63.12 -> 598.82000000000005 | N905: 63.119999999999997 | O905: =SUM(M905:N905) -> 661.94000000000005
A906: 3967 | B906: EOL TERRA SANTA I | C906: 24.895.239/0001-35 | D906: 680.49000000000001 | E906: 0 | F906: 0 | G906: 0 | H906: 0 | I906: 0 | J906: 0 | K906: 752.22000000000003 | L906: 0 | M906: =SUM(J906:L906)-71.73 -> 680.49000000000001 | N906: 71.730000000000004 | O906: =SUM(M906:N906) -> 752.22000000000003
A907: 3968 | B907: EOL TERRA SANTA II | C907: 24.894.829/0001-43 | D907: 371.72000000000003 | E907: 0 | F907: 0 | G907: 0 | H907: 0 | I907: 0 | J907: 0 | K907: 410.89999999999998 | L907: 0 | M907: =SUM(J907:L907)-39.18 -> 371.71999999999997 | N907: 39.18 | O907: =SUM(M907:N907) -> 410.89999999999998
A908: 3969 | B908: EOL SERRA DA BABILÔNIA C | C908: 29.591.504/0002-96 | D908: 380.44 | E908: 0 | F908: 0 | G908: 0 | H908: 0 | I908: 0 | J908: 0 | K908: 420.54000000000002 | L908: 0 | M908: =SUM(J908:L908)-40.1 -> 380.44 | N908: 40.100000000000001 | O908: =SUM(M908:N908) -> 420.54000000000002
A909: 3970 | B909: EOL SERRA DA BABILÔNIA D | C909: 30.062.725/0002-56 | D909: 356.5 | E909: 0 | F909: 0 | G909: 0 | H909: 0 | I909: 0 | J909: 0 | K909: 394.07999999999998 | L909: 0 | M909: =SUM(J909:L909)-37.58 -> 356.5 | N909: 37.579999999999998 | O909: =SUM(M909:N909) -> 394.07999999999998
A910: 3971 | B910: UTE CGVE INNOVA | C910: 04.229.761/0011-42 | D910: 142.91 | E910: 0 | F910: 0 | G910: 0 | H910: 0 | I910: 0 | J910: 0 | K910: 157.97 | L910: 0 | M910: =SUM(J910:L910)-15.06 -> 142.91 | N910: 15.06 | O910: =SUM(M910:N910) -> 157.97
A911: 3972 | B911: EOL SERRA DA BABILÔNIA F | C911: 30.234.798/0002-88 | D911: 304.20999999999998 | E911: 0 | F911: 0 | G911: 0 | H911: 0 | I911: 0 | J911: 0 | K911: 336.27999999999997 | L911: 0 | M911: =SUM(J911:L911)-32.07 -> 304.20999999999998 | N911: 32.07 | O911: =SUM(M911:N911) -> 336.27999999999997
A912: 3973 | B912: EOL VENTOS DE SANTA ÂNGELA 16 | C912: 29.711.059/0001-70 | D912: 368.35000000000002 | E912: 0 | F912: 0 | G912: 0 | H912: 0 | I912: 0 | J912: 0 | K912: 407.18000000000001 | L912: 0 | M912: =SUM(J912:L912)-38.83 -> 368.35000000000002 | N912: 38.829999999999998 | O912: =SUM(M912:N912) -> 407.18000000000001
A913: 3974 | B913: EOL VENTOS DE SANTA ÂNGELA 17 | C913: 29.579.025/0001-73 | D913: 681.47000000000003 | E913: 0 | F913: 0 | G913: 0 | H913: 0 | I913: 0 | J913: 0 | K913: 753.30999999999995 | L913: 0 | M913: =SUM(J913:L913)-71.84 -> 681.46999999999991 | N913: 71.840000000000003 | O913: =SUM(M913:N913) -> 753.30999999999995
A914: 3975 | B914: UFV SÃO GONÇALO 17 | C914: 31.762.229/0001-97 | D914: 512.36000000000001 | E914: 0 | F914: 0 | G914: 0 | H914: 0 | I914: 0 | J914: 0 | K914: 566.37 | L914: 0 | M914: =SUM(J914:L914)-54.01 -> 512.36000000000001 | N914: 54.009999999999998 | O914: =SUM(M914:N914) -> 566.37
A915: 3976 | B915: EOL SERRA DA BABILÔNIA E | C915: 30.062.736/0002-36 | D915: 380.47000000000003 | E915: 0 | F915: 0 | G915: 0 | H915: 0 | I915: 0 | J915: 0 | K915: 420.57999999999998 | L915: 0 | M915: =SUM(J915:L915)-40.11 -> 380.46999999999997 | N915: 40.109999999999999 | O915: =SUM(M915:N915) -> 420.57999999999998
A916: 3977 | B916: EOL VENTOS DE SANTA MARTINA 01 | C916: 29.845.768/0002-29 | D916: 122.73 | E916: 0 | F916: 0 | G916: 0 | H916: 0 | I916: 0 | J916: 0 | K916: 135.66999999999999 | L916: 0 | M916: =SUM(J916:L916)-12.94 -> 122.72999999999999 | N916: 12.94 | O916: =SUM(M916:N916) -> 135.66999999999999
A917: 3978 | B917: EOL VENTOS DE SANTA MARTINA 09 | C917: 29.845.721/0002-65 | D917: 122.73 | E917: 0 | F917: 0 | G917: 0 | H917: 0 | I917: 0 | J917: 0 | K917: 135.66999999999999 | L917: 0 | M917: =SUM(J917:L917)-12.94 -> 122.72999999999999 | N917: 12.94 | O917: =SUM(M917:N917) -> 135.66999999999999
A918: 3979 | B918: EOL VENTOS DE SANTA MARTINA 10 | C918: 29.845.784/0002-11 | D918: 122.73 | E918: 0 | F918: 0 | G918: 0 | H918: 0 | I918: 0 | J918: 0 | K918: 135.66999999999999 | L918: 0 | M918: =SUM(J918:L918)-12.94 -> 122.72999999999999 | N918: 12.94 | O918: =SUM(M918:N918) -> 135.66999999999999
A919: 3980 | B919: EOL VENTOS DE SANTA MARTINA 11 | C919: 29.845.761/0002-07 | D919: 122.73 | E919: 0 | F919: 0 | G919: 0 | H919: 0 | I919: 0 | J919: 0 | K919: 135.66999999999999 | L919: 0 | M919: =SUM(J919:L919)-12.94 -> 122.72999999999999 | N919: 12.94 | O919: =SUM(M919:N919) -> 135.66999999999999
A920: 3981 | B920: EOL VENTOS DE SANTA MARTINA 12 | C920: 29.845.751/0002-71 | D920: 122.73 | E920: 0 | F920: 0 | G920: 0 | H920: 0 | I920: 0 | J920: 0 | K920: 135.66999999999999 | L920: 0 | M920: =SUM(J920:L920)-12.94 -> 122.72999999999999 | N920: 12.94 | O920: =SUM(M920:N920) -> 135.66999999999999
A921: 3982 | B921: EOL VENTOS DE SANTA MARTINA 13 | C921: 29.845.794/0002-57 | D921: 130.90000000000001 | E921: 0 | F921: 0 | G921: 0 | H921: 0 | I921: 0 | J921: 0 | K921: 144.69999999999999 | L921: 0 | M921: =SUM(J921:L921)-13.8 -> 130.89999999999998 | N921: 13.800000000000001 | O921: =SUM(M921:N921) -> 144.69999999999999
A922: 3983 | B922: EOL VENTOS DE SANTA MARTINA 14 | C922: 29.845.733/0002-90 | D922: 122.73 | E922: 0 | F922: 0 | G922: 0 | H922: 0 | I922: 0 | J922: 0 | K922: 135.66999999999999 | L922: 0 | M922: =SUM(J922:L922)-12.94 -> 122.72999999999999 | N922: 12.94 | O922: =SUM(M922:N922) -> 135.66999999999999
A923: 3984 | B923: EOL TODA ENERGIA | C923: 36.160.050/0001-83 | D923: 308.61000000000001 | E923: 0 | F923: 0 | G923: 0 | H923: 0 | I923: 0 | J923: 0 | K923: 341.13999999999999 | L923: 0 | M923: =SUM(J923:L923)-32.53 -> 308.61000000000001 | N923: 32.530000000000001 | O923: =SUM(M923:N923) -> 341.13999999999999
A924: 3985 | B924: EOL VENTOS DE SÃO JANUÁRIO 23 | C924: 23.037.514/0002-06 | D924: 91.819999999999993 | E924: 0 | F924: 0 | G924: 0 | H924: 0 | I924: 0 | J924: 0 | K924: 101.5 | L924: 0 | M924: =SUM(J924:L924)-9.68 -> 91.819999999999993 | N924: 9.6799999999999997 | O924: =SUM(M924:N924) -> 101.5
A925: 3986 | B925: UFV SÃO GONÇALO 15 | C925: 31.752.283/0001-51 | D925: 512.36000000000001 | E925: 0 | F925: 0 | G925: 0 | H925: 0 | I925: 0 | J925: 0 | K925: 566.37 | L925: 0 | M925: =SUM(J925:L925)-54.01 -> 512.36000000000001 | N925: 54.009999999999998 | O925: =SUM(M925:N925) -> 566.37
A926: 3987 | B926: UHE PORTO PRIMAVERA | C926: 60.933.603/0001-78 | D926: 42373.989999999998 | E926: 0 | F926: 0 | G926: 0 | H926: 0 | I926: 0 | J926: 0 | K926: 46840.760000000002 | L926: 0 | M926: =SUM(J926:L926)-4466.77 -> 42373.990000000005 | N926: 4466.7700000000004 | O926: =SUM(M926:N926) -> 46840.760000000009
A927: 3988 | B927: UFV SÃO GONÇALO 14 | C927: 31.791.620/0001-10 | D927: 512.36000000000001 | E927: 0 | F927: 0 | G927: 0 | H927: 0 | I927: 0 | J927: 0 | K927: 566.37 | L927: 0 | M927: =SUM(J927:L927)-54.01 -> 512.36000000000001 | N927: 54.009999999999998 | O927: =SUM(M927:N927) -> 566.37
A928: 3989 | B928: EOL CUMARU I | C928: 31.211.298/0002-93 | D928: 479.62 | E928: 0 | F928: 0 | G928: 0 | H928: 0 | I928: 0 | J928: 0 | K928: 530.17999999999995 | L928: 0 | M928: =SUM(J928:L928)-50.56 -> 479.61999999999995 | N928: 50.560000000000002 | O928: =SUM(M928:N928) -> 530.17999999999995
A929: 3990 | B929: EOL CUMARU II | C929: 31.216.345/0002-91 | D929: 479.62 | E929: 0 | F929: 0 | G929: 0 | H929: 0 | I929: 0 | J929: 0 | K929: 530.17999999999995 | L929: 0 | M929: =SUM(J929:L929)-50.56 -> 479.61999999999995 | N929: 50.560000000000002 | O929: =SUM(M929:N929) -> 530.17999999999995
A930: 3991 | B930: EOL VILA ESPÍRITO SANTO I | C930: 34.043.696/0001-55 | D930: 372.55000000000001 | E930: 0 | F930: 0 | G930: 0 | H930: 0 | I930: 0 | J930: 0 | K930: 411.81999999999999 | L930: 0 | M930: =SUM(J930:L930)-39.27 -> 372.55000000000001 | N930: 39.270000000000003 | O930: =SUM(M930:N930) -> 411.81999999999999
A931: 3992 | B931: UFV TERRA DO SOL XI | C931: 31.533.486/0001-57 | D931: 562.24000000000001 | E931: 0 | F931: 0 | G931: 0 | H931: 0 | I931: 0 | J931: 0 | K931: 621.50999999999999 | L931: 0 | M931: =SUM(J931:L931)-59.27 -> 562.24000000000001 | N931: 59.270000000000003 | O931: =SUM(M931:N931) -> 621.50999999999999
A932: 3993 | B932: UFV SOL DO SERTÃO XXXVI | C932: 31.533.486/0001-57 | D932: 480.23000000000002 | E932: 0 | F932: 0 | G932: 0 | H932: 0 | I932: 0 | J932: 0 | K932: 530.85000000000002 | L932: 0 | M932: =SUM(J932:L932)-50.62 -> 480.23000000000002 | N932: 50.619999999999997 | O932: =SUM(M932:N932) -> 530.85000000000002
A933: 3994 | B933: UFV SOL DO SERTÃO VIII | C933: 31.534.389/0001-89 | D933: 1124.4300000000001 | E933: 0 | F933: 0 | G933: 0 | H933: 0 | I933: 0 | J933: 0 | K933: 1242.96 | L933: 0 | M933: =SUM(J933:L933)-118.53 -> 1124.4300000000001 | N933: 118.53 | O933: =SUM(M933:N933) -> 1242.96
A934: 3995 | B934: UFV SOL DO SERTÃO XIII | C934: 31.512.705/0001-11 | D934: 883.46000000000004 | E934: 0 | F934: 0 | G934: 0 | H934: 0 | I934: 0 | J934: 0 | K934: 976.59000000000003 | L934: 0 | M934: =SUM(J934:L934)-93.13 -> 883.46000000000004 | N934: 93.129999999999995 | O934: =SUM(M934:N934) -> 976.59000000000003
A935: 3996 | B935: EOL ANGICOS II | C935: 33.511.191/0001-05 | D935: 327.06999999999999 | E935: 0 | F935: 0 | G935: 0 | H935: 0 | I935: 0 | J935: 0 | K935: 361.55000000000001 | L935: 0 | M935: =SUM(J935:L935)-34.48 -> 327.06999999999999 | N935: 34.479999999999997 | O935: =SUM(M935:N935) -> 361.55000000000001
A936: 3997 | B936: EOL VILA ESPÍRITO SANTO III | C936: 34.043.685/0001-75 | D936: 419.08999999999997 | E936: 0 | F936: 0 | G936: 0 | H936: 0 | I936: 0 | J936: 0 | K936: 463.26999999999998 | L936: 0 | M936: =SUM(J936:L936)-44.18 -> 419.08999999999997 | N936: 44.18 | O936: =SUM(M936:N936) -> 463.26999999999998
A937: 3998 | B937: EOL VILA ESPÍRITO SANTO IV | C937: 34.011.712/0001-28 | D937: 424.02999999999997 | E937: 0 | F937: 0 | G937: 0 | H937: 0 | I937: 0 | J937: 0 | K937: 468.73000000000002 | L937: 0 | M937: =SUM(J937:L937)-44.7 -> 424.03000000000003 | N937: 44.700000000000003 | O937: =SUM(M937:N937) -> 468.73000000000002
A938: 3999 | B938: EOL VILA ESPÍRITO SANTO V | C938: 34.135.249/0001-26 | D938: 419.08999999999997 | E938: 0 | F938: 0 | G938: 0 | H938: 0 | I938: 0 | J938: 0 | K938: 463.26999999999998 | L938: 0 | M938: =SUM(J938:L938)-44.18 -> 419.08999999999997 | N938: 44.18 | O938: =SUM(M938:N938) -> 463.26999999999998
A939: 40005 | B939: BTG PACTUAL | C939: 30.306.294/0002-26 | D939: 126.11 | E939: 0 | F939: 0 | G939: 0 | H939: 0 | I939: 0 | J939: 139.40000000000001 | K939: 0 | L939: 0 | M939: =SUM(J939:L939)-13.29 -> 126.11000000000001 | N939: 13.289999999999999 | O939: =SUM(M939:N939) -> 139.40000000000001
A940: 4001 | B940: UFV SOL DO SERTÃO XII | C940: 31.534.389/0001-89 | D940: 643.60000000000002 | E940: 0 | F940: 0 | G940: 0 | H940: 0 | I940: 0 | J940: 0 | K940: 711.44000000000005 | L940: 0 | M940: =SUM(J940:L940)-67.84 -> 643.60000000000002 | N940: 67.840000000000003 | O940: =SUM(M940:N940) -> 711.44000000000005
A941: 4002 | B941: UFV SOL DO SERTÃO XXXV | C941: 31.512.705/0001-11 | D941: 320.79000000000002 | E941: 0 | F941: 0 | G941: 0 | H941: 0 | I941: 0 | J941: 0 | K941: 354.61000000000001 | L941: 0 | M941: =SUM(J941:L941)-33.82 -> 320.79000000000002 | N941: 33.82 | O941: =SUM(M941:N941) -> 354.61000000000001
A942: 4003 | B942: EOL CUMARU III | C942: 31.216.014/0002-51 | D942: 479.62 | E942: 0 | F942: 0 | G942: 0 | H942: 0 | I942: 0 | J942: 0 | K942: 530.17999999999995 | L942: 0 | M942: =SUM(J942:L942)-50.56 -> 479.61999999999995 | N942: 50.560000000000002 | O942: =SUM(M942:N942) -> 530.17999999999995
A943: 4004 | B943: EOL CUMARU IV | C943: 31.211.130/0002-88 | D943: 479.62 | E943: 0 | F943: 0 | G943: 0 | H943: 0 | I943: 0 | J943: 0 | K943: 530.17999999999995 | L943: 0 | M943: =SUM(J943:L943)-50.56 -> 479.61999999999995 | N943: 50.560000000000002 | O943: =SUM(M943:N943) -> 530.17999999999995
A944: 4005 | B944: EOL CUMARU V | C944: 31.210.772/0003-43 | D944: 431.67000000000002 | E944: 0 | F944: 0 | G944: 0 | H944: 0 | I944: 0 | J944: 0 | K944: 477.17000000000002 | L944: 0 | M944: =SUM(J944:L944)-45.5 -> 431.67000000000002 | N944: 45.5 | O944: =SUM(M944:N944) -> 477.17000000000002
A945: 4006 | B945: EOL FILGUEIRA II | C945: 33.486.296/0001-51 | D945: 311.36000000000001 | E945: 0 | F945: 0 | G945: 0 | H945: 0 | I945: 0 | J945: 0 | K945: 344.18000000000001 | L945: 0 | M945: =SUM(J945:L945)-32.82 -> 311.36000000000001 | N945: 32.82 | O945: =SUM(M945:N945) -> 344.18000000000001
A946: 4012 | B946: EOL VENTOS DA BAHIA XIV | C946: 31.818.978/0001-99 | D946: 502.79000000000002 | E946: 0 | F946: 0 | G946: 0 | H946: 0 | I946: 0 | J946: 0 | K946: 555.78999999999996 | L946: 0 | M946: =SUM(J946:L946)-53 -> 502.78999999999996 | N946: 53 | O946: =SUM(M946:N946) -> 555.78999999999996
A947: 4013 | B947: UFV ALEX IX | C947: 30.567.568/0001-50 | D947: 382.58999999999997 | E947: 0 | F947: 0 | G947: 0 | H947: 0 | I947: 0 | J947: 0 | K947: 422.92000000000002 | L947: 0 | M947: =SUM(J947:L947)-40.33 -> 382.59000000000003 | N947: 40.329999999999998 | O947: =SUM(M947:N947) -> 422.92000000000002
A948: 4014 | B948: UFV ALEX X | C948: 30.567.559/0001-69 | D948: 321.13999999999999 | E948: 0 | F948: 0 | G948: 0 | H948: 0 | I948: 0 | J948: 0 | K948: 354.99000000000001 | L948: 0 | M948: =SUM(J948:L948)-33.85 -> 321.13999999999999 | N948: 33.850000000000001 | O948: =SUM(M948:N948) -> 354.99000000000001
A949: 4015 | B949: EOL ANGICOS I | C949: 33.511.173/0001-23 | D949: 280.32999999999998 | E949: 0 | F949: 0 | G949: 0 | H949: 0 | I949: 0 | J949: 0 | K949: 309.88 | L949: 0 | M949: =SUM(J949:L949)-29.55 -> 280.32999999999998 | N949: 29.550000000000001 | O949: =SUM(M949:N949) -> 309.88
A950: 4018 | B950: EOL SERRA DO MATO I | C950: 32.398.781/0001-00 | D950: 225.50999999999999 | E950: 0 | F950: 0 | G950: 0 | H950: 0 | I950: 0 | J950: 0 | K950: 249.28 | L950: 0 | M950: =SUM(J950:L950)-23.77 -> 225.50999999999999 | N950: 23.77 | O950: =SUM(M950:N950) -> 249.28
A951: 4019 | B951: EOL VENTOS DE SANTA ESPERANÇA 08 | C951: 29.641.225/0002-90 | D951: 291.48000000000002 | E951: 0 | F951: 0 | G951: 0 | H951: 0 | I951: 0 | J951: 0 | K951: 322.20999999999998 | L951: 0 | M951: =SUM(J951:L951)-30.73 -> 291.47999999999996 | N951: 30.73 | O951: =SUM(M951:N951) -> 322.20999999999998
A952: 4020 | B952: EOL VENTOS DE SANTA ESPERANÇA 15 | C952: 29.552.609/0002-36 | D952: 714.91999999999996 | E952: 0 | F952: 0 | G952: 0 | H952: 0 | I952: 0 | J952: 0 | K952: 790.27999999999997 | L952: 0 | M952: =SUM(J952:L952)-75.36 -> 714.91999999999996 | N952: 75.359999999999999 | O952: =SUM(M952:N952) -> 790.27999999999997
A953: 4021 | B953: EOL VENTOS DE SANTA ESPERANÇA 16 | C953: 29.552.662/0002-37 | D953: 453.07999999999998 | E953: 0 | F953: 0 | G953: 0 | H953: 0 | I953: 0 | J953: 0 | K953: 500.83999999999997 | L953: 0 | M953: =SUM(J953:L953)-47.76 -> 453.07999999999998 | N953: 47.759999999999998 | O953: =SUM(M953:N953) -> 500.83999999999997
A954: 4022 | B954: EOL VENTOS DE SANTA ESPERANÇA 17 | C954: 29.587.306/0002-59 | D954: 649.96000000000004 | E954: 0 | F954: 0 | G954: 0 | H954: 0 | I954: 0 | J954: 0 | K954: 718.47000000000003 | L954: 0 | M954: =SUM(J954:L954)-68.51 -> 649.96000000000004 | N954: 68.510000000000005 | O954: =SUM(M954:N954) -> 718.47000000000003
A955: 4023 | B955: EOL VENTOS DE SANTA ESPERANÇA 21 | C955: 29.579.544/0002-12 | D955: 498.39999999999998 | E955: 0 | F955: 0 | G955: 0 | H955: 0 | I955: 0 | J955: 0 | K955: 550.94000000000005 | L955: 0 | M955: =SUM(J955:L955)-52.54 -> 498.40000000000003 | N955: 52.539999999999999 | O955: =SUM(M955:N955) -> 550.94000000000005
A956: 4024 | B956: EOL VENTOS DE SANTA ESPERANÇA 22 | C956: 29.618.696/0002-87 | D956: 498.39999999999998 | E956: 0 | F956: 0 | G956: 0 | H956: 0 | I956: 0 | J956: 0 | K956: 550.94000000000005 | L956: 0 | M956: =SUM(J956:L956)-52.54 -> 498.40000000000003 | N956: 52.539999999999999 | O956: =SUM(M956:N956) -> 550.94000000000005
A957: 4025 | B957: EOL VILA ESPÍRITO SANTO II | C957: 34.011.705/0001-26 | D957: 419.08999999999997 | E957: 0 | F957: 0 | G957: 0 | H957: 0 | I957: 0 | J957: 0 | K957: 463.26999999999998 | L957: 0 | M957: =SUM(J957:L957)-44.18 -> 419.08999999999997 | N957: 44.18 | O957: =SUM(M957:N957) -> 463.26999999999998
A958: 4026 | B958: UTE FS SORRISO | C958: 20.003.699/0002-31 | D958: 227.75999999999999 | E958: 0 | F958: 0 | G958: 0 | H958: 0 | I958: 0 | J958: 0 | K958: 251.77000000000001 | L958: 0 | M958: =SUM(J958:L958)-24.01 -> 227.76000000000002 | N958: 24.010000000000002 | O958: =SUM(M958:N958) -> 251.77000000000001
A959: 4027 | B959: EOL AFONSO BEZERRA I | C959: 33.511.218/0001-60 | D959: 327.06999999999999 | E959: 0 | F959: 0 | G959: 0 | H959: 0 | I959: 0 | J959: 0 | K959: 361.55000000000001 | L959: 0 | M959: =SUM(J959:L959)-34.48 -> 327.06999999999999 | N959: 34.479999999999997 | O959: =SUM(M959:N959) -> 361.55000000000001
A960: 4028 | B960: EOL AFONSO BEZERRA II | C960: 33.511.255/0001-78 | D960: 327.06999999999999 | E960: 0 | F960: 0 | G960: 0 | H960: 0 | I960: 0 | J960: 0 | K960: 361.55000000000001 | L960: 0 | M960: =SUM(J960:L960)-34.48 -> 327.06999999999999 | N960: 34.479999999999997 | O960: =SUM(M960:N960) -> 361.55000000000001
A961: 4029 | B961: UTE PUMA II | C961: 89.637.490/0165-72 | D961: 577.99000000000001 | E961: 0 | F961: 0 | G961: 0 | H961: 0 | I961: 0 | J961: 0 | K961: 638.91999999999996 | L961: 0 | M961: =SUM(J961:L961)-60.93 -> 577.99000000000001 | N961: 60.93 | O961: =SUM(M961:N961) -> 638.91999999999996
A962: 4030 | B962: UFV ALEX I | C962: 30.567.624/0001-56 | D962: 382.58999999999997 | E962: 0 | F962: 0 | G962: 0 | H962: 0 | I962: 0 | J962: 0 | K962: 422.92000000000002 | L962: 0 | M962: =SUM(J962:L962)-40.33 -> 382.59000000000003 | N962: 40.329999999999998 | O962: =SUM(M962:N962) -> 422.92000000000002
A963: 4031 | B963: UFV ALEX III | C963: 30.567.591/0001-44 | D963: 382.58999999999997 | E963: 0 | F963: 0 | G963: 0 | H963: 0 | I963: 0 | J963: 0 | K963: 422.92000000000002 | L963: 0 | M963: =SUM(J963:L963)-40.33 -> 382.59000000000003 | N963: 40.329999999999998 | O963: =SUM(M963:N963) -> 422.92000000000002
A964: 4032 | B964: UFV ALEX IV | C964: 30.567.615/0001-65 | D964: 382.58999999999997 | E964: 0 | F964: 0 | G964: 0 | H964: 0 | I964: 0 | J964: 0 | K964: 422.92000000000002 | L964: 0 | M964: =SUM(J964:L964)-40.33 -> 382.59000000000003 | N964: 40.329999999999998 | O964: =SUM(M964:N964) -> 422.92000000000002
A965: 4033 | B965: UFV ALEX V | C965: 30.567.603/0001-30 | D965: 382.58999999999997 | E965: 0 | F965: 0 | G965: 0 | H965: 0 | I965: 0 | J965: 0 | K965: 422.92000000000002 | L965: 0 | M965: =SUM(J965:L965)-40.33 -> 382.59000000000003 | N965: 40.329999999999998 | O965: =SUM(M965:N965) -> 422.92000000000002
A966: 4034 | B966: UFV ALEX VI | C966: 30.567.543/0001-56 | D966: 382.58999999999997 | E966: 0 | F966: 0 | G966: 0 | H966: 0 | I966: 0 | J966: 0 | K966: 422.92000000000002 | L966: 0 | M966: =SUM(J966:L966)-40.33 -> 382.59000000000003 | N966: 40.329999999999998 | O966: =SUM(M966:N966) -> 422.92000000000002
A967: 4035 | B967: UFV ALEX VII | C967: 30.567.582/0001-53 | D967: 382.58999999999997 | E967: 0 | F967: 0 | G967: 0 | H967: 0 | I967: 0 | J967: 0 | K967: 422.92000000000002 | L967: 0 | M967: =SUM(J967:L967)-40.33 -> 382.59000000000003 | N967: 40.329999999999998 | O967: =SUM(M967:N967) -> 422.92000000000002
A968: 4036 | B968: UFV ALEX VIII | C968: 30.567.573/0001-62 | D968: 382.58999999999997 | E968: 0 | F968: 0 | G968: 0 | H968: 0 | I968: 0 | J968: 0 | K968: 422.92000000000002 | L968: 0 | M968: =SUM(J968:L968)-40.33 -> 382.59000000000003 | N968: 40.329999999999998 | O968: =SUM(M968:N968) -> 422.92000000000002
A969: 4037 | B969: UTE BRACELL | C969: 53.943.098/0001-87 | D969: 1781.04 | E969: 0 | F969: 0 | G969: 0 | H969: 0 | I969: 0 | J969: 0 | K969: 1968.78 | L969: 0 | M969: =SUM(J969:L969)-187.74 -> 1781.04 | N969: 187.74000000000001 | O969: =SUM(M969:N969) -> 1968.78
A970: 4038 | B970: EOL FILGUEIRA I | C970: 33.486.289/0001-50 | D970: 428.12 | E970: 0 | F970: 0 | G970: 0 | H970: 0 | I970: 0 | J970: 0 | K970: 473.25 | L970: 0 | M970: =SUM(J970:L970)-45.13 -> 428.12 | N970: 45.130000000000003 | O970: =SUM(M970:N970) -> 473.25
A971: 4039 | B971: EOL SERRA DO MATO II | C971: 32.326.077/0001-42 | D971: 225.50999999999999 | E971: 0 | F971: 0 | G971: 0 | H971: 0 | I971: 0 | J971: 0 | K971: 249.28 | L971: 0 | M971: =SUM(J971:L971)-23.77 -> 225.50999999999999 | N971: 23.77 | O971: =SUM(M971:N971) -> 249.28
A972: 4040 | B972: EOL VENTOS DE SANTA ESPERANÇA 25 | C972: 29.616.244/0002-66 | D972: 291.48000000000002 | E972: 0 | F972: 0 | G972: 0 | H972: 0 | I972: 0 | J972: 0 | K972: 322.20999999999998 | L972: 0 | M972: =SUM(J972:L972)-30.73 -> 291.47999999999996 | N972: 30.73 | O972: =SUM(M972:N972) -> 322.20999999999998
A973: 4041 | B973: EOL VENTOS DE SANTA ESPERANÇA 26 | C973: 29.617.129/0002-06 | D973: 498.39999999999998 | E973: 0 | F973: 0 | G973: 0 | H973: 0 | I973: 0 | J973: 0 | K973: 550.94000000000005 | L973: 0 | M973: =SUM(J973:L973)-52.54 -> 498.40000000000003 | N973: 52.539999999999999 | O973: =SUM(M973:N973) -> 550.94000000000005
A974: 4042 | B974: EOL VILA ALAGOAS II | C974: 34.109.311/0001-05 | D974: 232.90000000000001 | E974: 0 | F974: 0 | G974: 0 | H974: 0 | I974: 0 | J974: 0 | K974: 257.44999999999999 | L974: 0 | M974: =SUM(J974:L974)-24.55 -> 232.89999999999998 | N974: 24.550000000000001 | O974: =SUM(M974:N974) -> 257.44999999999999
A975: 4043 | B975: UFV SOL DO SERTÃO XIV | C975: 31.512.705/0001-11 | D975: 240.53 | E975: 0 | F975: 0 | G975: 0 | H975: 0 | I975: 0 | J975: 0 | K975: 265.88999999999999 | L975: 0 | M975: =SUM(J975:L975)-25.36 -> 240.52999999999997 | N975: 25.359999999999999 | O975: =SUM(M975:N975) -> 265.88999999999999
A976: 4044 | B976: UFV TERRA DO SOL VII | C976: 31.533.486/0001-57 | D976: 643 | E976: 0 | F976: 0 | G976: 0 | H976: 0 | I976: 0 | J976: 0 | K976: 710.77999999999997 | L976: 0 | M976: =SUM(J976:L976)-67.78 -> 643 | N976: 67.780000000000001 | O976: =SUM(M976:N976) -> 710.77999999999997
A977: 4047 | B977: UFV COREMAS VII | C977: 34.920.805/0001-75 | D977: 300.69999999999999 | E977: 0 | F977: 0 | G977: 0 | H977: 0 | I977: 0 | J977: 0 | K977: 332.39999999999998 | L977: 0 | M977: =SUM(J977:L977)-31.7 -> 300.69999999999999 | N977: 31.699999999999999 | O977: =SUM(M977:N977) -> 332.39999999999998
A978: 4048 | B978: EOL TACAICÓ II | C978: 32.829.695/0002-96 | D978: 600.52999999999997 | E978: 0 | F978: 0 | G978: 0 | H978: 0 | I978: 0 | J978: 0 | K978: 663.83000000000004 | L978: 0 | M978: =SUM(J978:L978)-63.3 -> 600.53000000000009 | N978: 63.299999999999997 | O978: =SUM(M978:N978) -> 663.83000000000004
A979: 4049 | B979: EOL VENTOS DA BAHIA XIII | C979: 31.810.463/0001-42 | D979: 754.07000000000005 | E979: 0 | F979: 0 | G979: 0 | H979: 0 | I979: 0 | J979: 0 | K979: 833.55999999999995 | L979: 0 | M979: =SUM(J979:L979)-79.49 -> 754.06999999999994 | N979: 79.489999999999995 | O979: =SUM(M979:N979) -> 833.55999999999995
A980: 4050 | B980: UFV JUAZEIRO SOLAR VI | C980: 34.742.960/0001-49 | D980: 581.95000000000005 | E980: 0 | F980: 0 | G980: 0 | H980: 0 | I980: 0 | J980: 0 | K980: 643.29999999999995 | L980: 0 | M980: =SUM(J980:L980)-61.35 -> 581.94999999999993 | N980: 61.350000000000001 | O980: =SUM(M980:N980) -> 643.29999999999995
A981: 4051 | B981: UFV JUAZEIRO SOLAR VIII | C981: 34.742.951/0001-58 | D981: 187 | E981: 0 | F981: 0 | G981: 0 | H981: 0 | I981: 0 | J981: 0 | K981: 206.71000000000001 | L981: 0 | M981: =SUM(J981:L981)-19.71 -> 187 | N981: 19.710000000000001 | O981: =SUM(M981:N981) -> 206.71000000000001
A982: 4052 | B982: UFV JUAZEIRO SOLAR V | C982: 34.742.964/0001-27 | D982: 581.95000000000005 | E982: 0 | F982: 0 | G982: 0 | H982: 0 | I982: 0 | J982: 0 | K982: 643.29999999999995 | L982: 0 | M982: =SUM(J982:L982)-61.35 -> 581.94999999999993 | N982: 61.350000000000001 | O982: =SUM(M982:N982) -> 643.29999999999995
A983: 4053 | B983: UFV JUAZEIRO SOLAR VII | C983: 34.751.530/0001-93 | D983: 581.95000000000005 | E983: 0 | F983: 0 | G983: 0 | H983: 0 | I983: 0 | J983: 0 | K983: 643.29999999999995 | L983: 0 | M983: =SUM(J983:L983)-61.35 -> 581.94999999999993 | N983: 61.350000000000001 | O983: =SUM(M983:N983) -> 643.29999999999995
A984: 4054 | B984: EOL PAU FERRO II | C984: 32.829.774/0002-05 | D984: 582.08000000000004 | E984: 0 | F984: 0 | G984: 0 | H984: 0 | I984: 0 | J984: 0 | K984: 643.44000000000005 | L984: 0 | M984: =SUM(J984:L984)-61.36 -> 582.08000000000004 | N984: 61.359999999999999 | O984: =SUM(M984:N984) -> 643.44000000000005
A985: 4055 | B985: EOL SERRA DO MATO III | C985: 32.326.123/0001-03 | D985: 225.50999999999999 | E985: 0 | F985: 0 | G985: 0 | H985: 0 | I985: 0 | J985: 0 | K985: 249.28 | L985: 0 | M985: =SUM(J985:L985)-23.77 -> 225.50999999999999 | N985: 23.77 | O985: =SUM(M985:N985) -> 249.28
A986: 4058 | B986: EOL AURA QUEIMADA NOVA 01 | C986: 35.572.851/0002-74 | D986: 367.98000000000002 | E986: 0 | F986: 0 | G986: 0 | H986: 0 | I986: 0 | J986: 0 | K986: 406.76999999999998 | L986: 0 | M986: =SUM(J986:L986)-38.79 -> 367.97999999999996 | N986: 38.789999999999999 | O986: =SUM(M986:N986) -> 406.76999999999998
A987: 4059 | B987: EOL GRAVIER | C987: 23.793.827/0001-03 | D987: 790.89999999999998 | E987: 0 | F987: 0 | G987: 0 | H987: 0 | I987: 0 | J987: 0 | K987: 874.26999999999998 | L987: 0 | M987: =SUM(J987:L987)-83.37 -> 790.89999999999998 | N987: 83.370000000000005 | O987: =SUM(M987:N987) -> 874.26999999999998
A988: 4060 | B988: EOL VENTOS DE SANTA ESPERANÇA 13 | C988: 29.552.763/0002-08 | D988: 520.00999999999999 | E988: 0 | F988: 0 | G988: 0 | H988: 0 | I988: 0 | J988: 0 | K988: 574.83000000000004 | L988: 0 | M988: =SUM(J988:L988)-54.82 -> 520.00999999999999 | N988: 54.82 | O988: =SUM(M988:N988) -> 574.83000000000004
A989: 4061 | B989: EOL AURA QUEIMADA NOVA 02 | C989: 35.603.267/0002-39 | D989: 565.70000000000005 | E989: 0 | F989: 0 | G989: 0 | H989: 0 | I989: 0 | J989: 0 | K989: 625.33000000000004 | L989: 0 | M989: =SUM(J989:L989)-59.63 -> 565.70000000000005 | N989: 59.630000000000003 | O989: =SUM(M989:N989) -> 625.33000000000004
A990: 4062 | B990: UFV COREMAS IV | C990: 34.921.036/0001-20 | D990: 300.69999999999999 | E990: 0 | F990: 0 | G990: 0 | H990: 0 | I990: 0 | J990: 0 | K990: 332.39999999999998 | L990: 0 | M990: =SUM(J990:L990)-31.7 -> 300.69999999999999 | N990: 31.699999999999999 | O990: =SUM(M990:N990) -> 332.39999999999998
A991: 4063 | B991: UFV COREMAS V | C991: 34.920.838/0001-15 | D991: 300.69999999999999 | E991: 0 | F991: 0 | G991: 0 | H991: 0 | I991: 0 | J991: 0 | K991: 332.39999999999998 | L991: 0 | M991: =SUM(J991:L991)-31.7 -> 300.69999999999999 | N991: 31.699999999999999 | O991: =SUM(M991:N991) -> 332.39999999999998
A992: 4064 | B992: UFV COREMAS VI | C992: 34.850.666/0001-50 | D992: 300.69999999999999 | E992: 0 | F992: 0 | G992: 0 | H992: 0 | I992: 0 | J992: 0 | K992: 332.39999999999998 | L992: 0 | M992: =SUM(J992:L992)-31.7 -> 300.69999999999999 | N992: 31.699999999999999 | O992: =SUM(M992:N992) -> 332.39999999999998
A993: 4067 | B993: EOL VENTOS DA BAHIA XXIII | C993: 31.782.653/0001-01 | D993: 754.00999999999999 | E993: 0 | F993: 0 | G993: 0 | H993: 0 | I993: 0 | J993: 0 | K993: 833.49000000000001 | L993: 0 | M993: =SUM(J993:L993)-79.48 -> 754.00999999999999 | N993: 79.480000000000004 | O993: =SUM(M993:N993) -> 833.49000000000001
A994: 4068 | B994: EOL SERRA DO MATO IV | C994: 32.326.120/0001-70 | D994: 225.50999999999999 | E994: 0 | F994: 0 | G994: 0 | H994: 0 | I994: 0 | J994: 0 | K994: 249.28 | L994: 0 | M994: =SUM(J994:L994)-23.77 -> 225.50999999999999 | N994: 23.77 | O994: =SUM(M994:N994) -> 249.28
A995: 4069 | B995: EOL SERRA DO MATO V | C995: 32.326.115/0001-67 | D995: 225.50999999999999 | E995: 0 | F995: 0 | G995: 0 | H995: 0 | I995: 0 | J995: 0 | K995: 249.28 | L995: 0 | M995: =SUM(J995:L995)-23.77 -> 225.50999999999999 | N995: 23.77 | O995: =SUM(M995:N995) -> 249.28
A996: 4070 | B996: EOL SERRA DO MATO VI | C996: 32.326.113/0001-78 | D996: 180.41 | E996: 0 | F996: 0 | G996: 0 | H996: 0 | I996: 0 | J996: 0 | K996: 199.43000000000001 | L996: 0 | M996: =SUM(J996:L996)-19.02 -> 180.41 | N996: 19.02 | O996: =SUM(M996:N996) -> 199.43000000000001
A997: 4071 | B997: EOL ACAUÃ III | C997: 35.842.711/0001-98 | D997: 227.88999999999999 | E997: 0 | F997: 0 | G997: 0 | H997: 0 | I997: 0 | J997: 0 | K997: 251.91 | L997: 0 | M997: =SUM(J997:L997)-24.02 -> 227.88999999999999 | N997: 24.02 | O997: =SUM(M997:N997) -> 251.91
A998: 4072 | B998: EOL AFONSO BEZERRA III | C998: 33.511.325/0001-98 | D998: 327.06999999999999 | E998: 0 | F998: 0 | G998: 0 | H998: 0 | I998: 0 | J998: 0 | K998: 361.55000000000001 | L998: 0 | M998: =SUM(J998:L998)-34.48 -> 327.06999999999999 | N998: 34.479999999999997 | O998: =SUM(M998:N998) -> 361.55000000000001
A999: 4073 | B999: EOL AFONSO BEZERRA IV | C999: 33.511.347/0001-58 | D999: 186.96000000000001 | E999: 0 | F999: 0 | G999: 0 | H999: 0 | I999: 0 | J999: 0 | K999: 206.66999999999999 | L999: 0 | M999: =SUM(J999:L999)-19.71 -> 186.95999999999998 | N999: 19.710000000000001 | O999: =SUM(M999:N999) -> 206.66999999999999
A1000: 4076 | B1000: UFV COREMAS VIII | C1000: 36.571.485/0001-10 | D1000: 300.69999999999999 | E1000: 0 | F1000: 0 | G1000: 0 | H1000: 0 | I1000: 0 | J1000: 0 | K1000: 332.39999999999998 | L1000: 0 | M1000: =SUM(J1000:L1000)-31.7 -> 300.69999999999999 | N1000: 31.699999999999999 | O1000: =SUM(M1000:N1000) -> 332.39999999999998
A1001: 4077 | B1001: EOL TUCANO VI | C1001: 36.230.315/0001-72 | D1001: 499.11000000000001 | E1001: 0 | F1001: 0 | G1001: 0 | H1001: 0 | I1001: 0 | J1001: 0 | K1001: 551.72000000000003 | L1001: 0 | M1001: =SUM(J1001:L1001)-52.61 -> 499.11000000000001 | N1001: 52.609999999999999 | O1001: =SUM(M1001:N1001) -> 551.72000000000003
A1002: 4103 | B1002: UFV BELMONTE 1-1 | C1002: 30.418.521/0001-24 | D1002: 555.37 | E1002: 0 | F1002: 0 | G1002: 0 | H1002: 0 | I1002: 0 | J1002: 0 | K1002: 613.90999999999997 | L1002: 0 | M1002: =SUM(J1002:L1002)-58.54 -> 555.37 | N1002: 58.539999999999999 | O1002: =SUM(M1002:N1002) -> 613.90999999999997
A1003: 4104 | B1003: UFV BELMONTE 1-2 | C1003: 30.418.521/0001-24 | D1003: 555.37 | E1003: 0 | F1003: 0 | G1003: 0 | H1003: 0 | I1003: 0 | J1003: 0 | K1003: 613.90999999999997 | L1003: 0 | M1003: =SUM(J1003:L1003)-58.54 -> 555.37 | N1003: 58.539999999999999 | O1003: =SUM(M1003:N1003) -> 613.90999999999997
A1004: 4105 | B1004: UFV BELMONTE 1-3 | C1004: 30.418.521/0001-24 | D1004: 555.37 | E1004: 0 | F1004: 0 | G1004: 0 | H1004: 0 | I1004: 0 | J1004: 0 | K1004: 613.90999999999997 | L1004: 0 | M1004: =SUM(J1004:L1004)-58.54 -> 555.37 | N1004: 58.539999999999999 | O1004: =SUM(M1004:N1004) -> 613.90999999999997
A1005: 4106 | B1005: UFV BELMONTE 1-4 | C1005: 30.418.521/0001-24 | D1005: 55.539999999999999 | E1005: 0 | F1005: 0 | G1005: 0 | H1005: 0 | I1005: 0 | J1005: 0 | K1005: 61.390000000000001 | L1005: 0 | M1005: =SUM(J1005:L1005)-5.85 -> 55.539999999999999 | N1005: 5.8499999999999996 | O1005: =SUM(M1005:N1005) -> 61.390000000000001
A1006: 4107 | B1006: UFV BELMONTE 2-1 | C1006: 30.418.547/0001-72 | D1006: 570.40999999999997 | E1006: 0 | F1006: 0 | G1006: 0 | H1006: 0 | I1006: 0 | J1006: 0 | K1006: 630.53999999999996 | L1006: 0 | M1006: =SUM(J1006:L1006)-60.13 -> 570.40999999999997 | N1006: 60.130000000000003 | O1006: =SUM(M1006:N1006) -> 630.53999999999996
A1007: 4108 | B1007: UFV BELMONTE 2-2 | C1007: 30.418.547/0001-72 | D1007: 570.40999999999997 | E1007: 0 | F1007: 0 | G1007: 0 | H1007: 0 | I1007: 0 | J1007: 0 | K1007: 630.53999999999996 | L1007: 0 | M1007: =SUM(J1007:L1007)-60.13 -> 570.40999999999997 | N1007: 60.130000000000003 | O1007: =SUM(M1007:N1007) -> 630.53999999999996
A1008: 4109 | B1008: UFV BELMONTE 2-3 | C1008: 30.418.547/0001-72 | D1008: 570.40999999999997 | E1008: 0 | F1008: 0 | G1008: 0 | H1008: 0 | I1008: 0 | J1008: 0 | K1008: 630.53999999999996 | L1008: 0 | M1008: =SUM(J1008:L1008)-60.13 -> 570.40999999999997 | N1008: 60.130000000000003 | O1008: =SUM(M1008:N1008) -> 630.53999999999996
A1009: 4110 | B1009: UFV BELMONTE 2-4 | C1009: 30.418.547/0001-72 | D1009: 570.40999999999997 | E1009: 0 | F1009: 0 | G1009: 0 | H1009: 0 | I1009: 0 | J1009: 0 | K1009: 630.53999999999996 | L1009: 0 | M1009: =SUM(J1009:L1009)-60.13 -> 570.40999999999997 | N1009: 60.130000000000003 | O1009: =SUM(M1009:N1009) -> 630.53999999999996
A1010: 4111 | B1010: UFV BELMONTE 2-5 | C1010: 30.418.547/0001-72 | D1010: 570.40999999999997 | E1010: 0 | F1010: 0 | G1010: 0 | H1010: 0 | I1010: 0 | J1010: 0 | K1010: 630.53999999999996 | L1010: 0 | M1010: =SUM(J1010:L1010)-60.13 -> 570.40999999999997 | N1010: 60.130000000000003 | O1010: =SUM(M1010:N1010) -> 630.53999999999996
A1011: 4112 | B1011: UFV BELMONTE 2-6 | C1011: 30.418.547/0001-72 | D1011: 570.40999999999997 | E1011: 0 | F1011: 0 | G1011: 0 | H1011: 0 | I1011: 0 | J1011: 0 | K1011: 630.53999999999996 | L1011: 0 | M1011: =SUM(J1011:L1011)-60.13 -> 570.40999999999997 | N1011: 60.130000000000003 | O1011: =SUM(M1011:N1011) -> 630.53999999999996
A1012: 4113 | B1012: UFV LAVRAS 1 | C1012: 30.806.144/0001-09 | D1012: 263.62 | E1012: 0 | F1012: 0 | G1012: 0 | H1012: 0 | I1012: 0 | J1012: 0 | K1012: 291.41000000000003 | L1012: 0 | M1012: =SUM(J1012:L1012)-27.79 -> 263.62 | N1012: 27.789999999999999 | O1012: =SUM(M1012:N1012) -> 291.41000000000003
A1013: 4114 | B1013: UFV LAVRAS 2 | C1013: 30.806.150/0001-58 | D1013: 263.62 | E1013: 0 | F1013: 0 | G1013: 0 | H1013: 0 | I1013: 0 | J1013: 0 | K1013: 291.41000000000003 | L1013: 0 | M1013: =SUM(J1013:L1013)-27.79 -> 263.62 | N1013: 27.789999999999999 | O1013: =SUM(M1013:N1013) -> 291.41000000000003
A1014: 4115 | B1014: UFV LAVRAS 3 | C1014: 30.806.162/0001-82 | D1014: 263.62 | E1014: 0 | F1014: 0 | G1014: 0 | H1014: 0 | I1014: 0 | J1014: 0 | K1014: 291.41000000000003 | L1014: 0 | M1014: =SUM(J1014:L1014)-27.79 -> 263.62 | N1014: 27.789999999999999 | O1014: =SUM(M1014:N1014) -> 291.41000000000003
A1015: 4116 | B1015: UFV LAVRAS 4 | C1015: 30.806.156/0001-25 | D1015: 263.62 | E1015: 0 | F1015: 0 | G1015: 0 | H1015: 0 | I1015: 0 | J1015: 0 | K1015: 291.41000000000003 | L1015: 0 | M1015: =SUM(J1015:L1015)-27.79 -> 263.62 | N1015: 27.789999999999999 | O1015: =SUM(M1015:N1015) -> 291.41000000000003
A1016: 4117 | B1016: UFV LAVRAS 5 | C1016: 30.806.179/0001-30 | D1016: 263.62 | E1016: 0 | F1016: 0 | G1016: 0 | H1016: 0 | I1016: 0 | J1016: 0 | K1016: 291.41000000000003 | L1016: 0 | M1016: =SUM(J1016:L1016)-27.79 -> 263.62 | N1016: 27.789999999999999 | O1016: =SUM(M1016:N1016) -> 291.41000000000003
A1017: 4118 | B1017: UFV XAXADO 1 | C1017: 37.427.693/0001-03 | D1017: 363.35000000000002 | E1017: 0 | F1017: 0 | G1017: 0 | H1017: 0 | I1017: 0 | J1017: 0 | K1017: 401.64999999999998 | L1017: 0 | M1017: =SUM(J1017:L1017)-38.3 -> 363.34999999999997 | N1017: 38.299999999999997 | O1017: =SUM(M1017:N1017) -> 401.64999999999998
A1018: 4119 | B1018: UFV XAXADO 2 | C1018: 37.427.699/0001-80 | D1018: 363.35000000000002 | E1018: 0 | F1018: 0 | G1018: 0 | H1018: 0 | I1018: 0 | J1018: 0 | K1018: 401.64999999999998 | L1018: 0 | M1018: =SUM(J1018:L1018)-38.3 -> 363.34999999999997 | N1018: 38.299999999999997 | O1018: =SUM(M1018:N1018) -> 401.64999999999998
A1019: 4120 | B1019: UFV XAXADO 3 | C1019: 37.427.691/0001-14 | D1019: 363.35000000000002 | E1019: 0 | F1019: 0 | G1019: 0 | H1019: 0 | I1019: 0 | J1019: 0 | K1019: 401.64999999999998 | L1019: 0 | M1019: =SUM(J1019:L1019)-38.3 -> 363.34999999999997 | N1019: 38.299999999999997 | O1019: =SUM(M1019:N1019) -> 401.64999999999998
A1020: 4121 | B1020: EOL VENTOS DA BAHIA XXVII | C1020: 32.124.546/0001-40 | D1020: 753.63 | E1020: 0 | F1020: 0 | G1020: 0 | H1020: 0 | I1020: 0 | J1020: 0 | K1020: 833.07000000000005 | L1020: 0 | M1020: =SUM(J1020:L1020)-79.44 -> 753.63000000000011 | N1020: 79.439999999999998 | O1020: =SUM(M1020:N1020) -> 833.07000000000016
A1021: 4122 | B1021: EOL CANUDOS I | C1021: 35.474.191/0001-08 | D1021: 511.44 | E1021: 0 | F1021: 0 | G1021: 0 | H1021: 0 | I1021: 0 | J1021: 0 | K1021: 565.35000000000002 | L1021: 0 | M1021: =SUM(J1021:L1021)-53.91 -> 511.44000000000005 | N1021: 53.909999999999997 | O1021: =SUM(M1021:N1021) -> 565.35000000000002
A1022: 4123 | B1022: EOL TUCANO VII | C1022: 36.230.329/0001-96 | D1022: 561.5 | E1022: 0 | F1022: 0 | G1022: 0 | H1022: 0 | I1022: 0 | J1022: 0 | K1022: 620.69000000000005 | L1022: 0 | M1022: =SUM(J1022:L1022)-59.19 -> 561.5 | N1022: 59.189999999999998 | O1022: =SUM(M1022:N1022) -> 620.69000000000005
A1023: 4125 | B1023: EOL TUCANO VIII | C1023: 36.230.295/0001-30 | D1023: 499.11000000000001 | E1023: 0 | F1023: 0 | G1023: 0 | H1023: 0 | I1023: 0 | J1023: 0 | K1023: 551.72000000000003 | L1023: 0 | M1023: =SUM(J1023:L1023)-52.61 -> 499.11000000000001 | N1023: 52.609999999999999 | O1023: =SUM(M1023:N1023) -> 551.72000000000003
A1024: 4126 | B1024: EOL CANUDOS II | C1024: 35.417.771/0001-63 | D1024: 511.44 | E1024: 0 | F1024: 0 | G1024: 0 | H1024: 0 | I1024: 0 | J1024: 0 | K1024: 565.35000000000002 | L1024: 0 | M1024: =SUM(J1024:L1024)-53.91 -> 511.44000000000005 | N1024: 53.909999999999997 | O1024: =SUM(M1024:N1024) -> 565.35000000000002
A1025: 4127 | B1025: UTE PARNAÍBA V | C1025: 15.743.303/0001-71 | D1025: 10288.809999999999 | E1025: 0 | F1025: 0 | G1025: 0 | H1025: 0 | I1025: 0 | J1025: 0 | K1025: 11373.389999999999 | L1025: 0 | M1025: =SUM(J1025:L1025)-1084.58 -> 10288.809999999999 | N1025: 1084.5799999999999 | O1025: =SUM(M1025:N1025) -> 11373.389999999999
A1026: 4128 | B1026: EOL BOQUEIRAO I | C1026: 31.252.889/0002-09 | D1026: 462.82999999999998 | E1026: 0 | F1026: 0 | G1026: 0 | H1026: 0 | I1026: 0 | J1026: 0 | K1026: 511.62 | L1026: 0 | M1026: =SUM(J1026:L1026)-48.79 -> 462.82999999999998 | N1026: 48.789999999999999 | O1026: =SUM(M1026:N1026) -> 511.62
A1027: 4129 | B1027: EOL BOQUEIRAO II | C1027: 31.232.196/0002-54 | D1027: 414.48000000000002 | E1027: 0 | F1027: 0 | G1027: 0 | H1027: 0 | I1027: 0 | J1027: 0 | K1027: 458.17000000000002 | L1027: 0 | M1027: =SUM(J1027:L1027)-43.69 -> 414.48000000000002 | N1027: 43.689999999999998 | O1027: =SUM(M1027:N1027) -> 458.17000000000002
A1028: 4130 | B1028: EOL JERUSALÉM I | C1028: 30.785.922/0002-01 | D1028: 396.69999999999999 | E1028: 0 | F1028: 0 | G1028: 0 | H1028: 0 | I1028: 0 | J1028: 0 | K1028: 438.51999999999998 | L1028: 0 | M1028: =SUM(J1028:L1028)-41.82 -> 396.69999999999999 | N1028: 41.82 | O1028: =SUM(M1028:N1028) -> 438.51999999999998
A1029: 4131 | B1029: EOL JERUSALÉM II | C1029: 30.798.864/0002-42 | D1029: 397.38999999999999 | E1029: 0 | F1029: 0 | G1029: 0 | H1029: 0 | I1029: 0 | J1029: 0 | K1029: 439.27999999999997 | L1029: 0 | M1029: =SUM(J1029:L1029)-41.89 -> 397.38999999999999 | N1029: 41.890000000000001 | O1029: =SUM(M1029:N1029) -> 439.27999999999997
A1030: 4132 | B1030: EOL JERUSALÉM III | C1030: 31.231.701/0002-46 | D1030: 397.25 | E1030: 0 | F1030: 0 | G1030: 0 | H1030: 0 | I1030: 0 | J1030: 0 | K1030: 439.13 | L1030: 0 | M1030: =SUM(J1030:L1030)-41.88 -> 397.25 | N1030: 41.880000000000003 | O1030: =SUM(M1030:N1030) -> 439.13
A1031: 4133 | B1031: EOL JERUSALÉM IV | C1031: 31.207.208/0002-90 | D1031: 396.43000000000001 | E1031: 0 | F1031: 0 | G1031: 0 | H1031: 0 | I1031: 0 | J1031: 0 | K1031: 438.22000000000003 | L1031: 0 | M1031: =SUM(J1031:L1031)-41.79 -> 396.43000000000001 | N1031: 41.789999999999999 | O1031: =SUM(M1031:N1031) -> 438.22000000000003
A1032: 4134 | B1032: EOL JERUSALÉM V | C1032: 31.207.206/0002-00 | D1032: 396.66000000000003 | E1032: 0 | F1032: 0 | G1032: 0 | H1032: 0 | I1032: 0 | J1032: 0 | K1032: 438.47000000000003 | L1032: 0 | M1032: =SUM(J1032:L1032)-41.81 -> 396.66000000000003 | N1032: 41.810000000000002 | O1032: =SUM(M1032:N1032) -> 438.47000000000003
A1033: 4135 | B1033: EOL JERUSALÉM VI | C1033: 31.190.337/0002-13 | D1033: 453.06999999999999 | E1033: 0 | F1033: 0 | G1033: 0 | H1033: 0 | I1033: 0 | J1033: 0 | K1033: 500.82999999999998 | L1033: 0 | M1033: =SUM(J1033:L1033)-47.76 -> 453.06999999999999 | N1033: 47.759999999999998 | O1033: =SUM(M1033:N1033) -> 500.82999999999998
A1034: 4136 | B1034: EOL MONTE VERDE I | C1034: 31.199.583/0002-36 | D1034: 911.14999999999998 | E1034: 0 | F1034: 0 | G1034: 0 | H1034: 0 | I1034: 0 | J1034: 0 | K1034: 1007.2 | L1034: 0 | M1034: =SUM(J1034:L1034)-96.05 -> 911.15000000000009 | N1034: 96.049999999999997 | O1034: =SUM(M1034:N1034) -> 1007.2
A1035: 4137 | B1035: EOL MONTE VERDE II | C1035: 31.199.569/0002-32 | D1035: 911.64999999999998 | E1035: 0 | F1035: 0 | G1035: 0 | H1035: 0 | I1035: 0 | J1035: 0 | K1035: 1007.75 | L1035: 0 | M1035: =SUM(J1035:L1035)-96.1 -> 911.64999999999998 | N1035: 96.099999999999994 | O1035: =SUM(M1035:N1035) -> 1007.75
A1036: 4138 | B1036: EOL MONTE VERDE III | C1036: 31.199.512/0002-33 | D1036: 798.19000000000005 | E1036: 0 | F1036: 0 | G1036: 0 | H1036: 0 | I1036: 0 | J1036: 0 | K1036: 882.33000000000004 | L1036: 0 | M1036: =SUM(J1036:L1036)-84.14 -> 798.19000000000005 | N1036: 84.140000000000001 | O1036: =SUM(M1036:N1036) -> 882.33000000000004
A1037: 4139 | B1037: EOL MONTE VERDE IV | C1037: 31.199.598/0002-02 | D1037: 627.60000000000002 | E1037: 0 | F1037: 0 | G1037: 0 | H1037: 0 | I1037: 0 | J1037: 0 | K1037: 693.75999999999999 | L1037: 0 | M1037: =SUM(J1037:L1037)-66.16 -> 627.60000000000002 | N1037: 66.159999999999997 | O1037: =SUM(M1037:N1037) -> 693.75999999999999
A1038: 4140 | B1038: EOL MONTE VERDE V | C1038: 31.199.661/0002-00 | D1038: 454.36000000000001 | E1038: 0 | F1038: 0 | G1038: 0 | H1038: 0 | I1038: 0 | J1038: 0 | K1038: 502.25999999999999 | L1038: 0 | M1038: =SUM(J1038:L1038)-47.9 -> 454.36000000000001 | N1038: 47.899999999999999 | O1038: =SUM(M1038:N1038) -> 502.25999999999999
A1039: 4141 | B1039: EOL MONTE VERDE VI | C1039: 31.199.538/0002-81 | D1039: 509.50999999999999 | E1039: 0 | F1039: 0 | G1039: 0 | H1039: 0 | I1039: 0 | J1039: 0 | K1039: 563.22000000000003 | L1039: 0 | M1039: =SUM(J1039:L1039)-53.71 -> 509.51000000000005 | N1039: 53.710000000000001 | O1039: =SUM(M1039:N1039) -> 563.22000000000003
A1040: 4142 | B1040: UFV SERRA DO MEL I | C1040: 35.835.582/0001-00 | D1040: 1421.6500000000001 | E1040: 0 | F1040: 0 | G1040: 0 | H1040: 0 | I1040: 0 | J1040: 0 | K1040: 1571.51 | L1040: 0 | M1040: =SUM(J1040:L1040)-149.86 -> 1421.6500000000001 | N1040: 149.86000000000001 | O1040: =SUM(M1040:N1040) -> 1571.5100000000002
A1041: 4143 | B1041: UFV SERRA DO MEL II | C1041: 35.835.571/0001-20 | D1041: 1065.8900000000001 | E1041: 0 | F1041: 0 | G1041: 0 | H1041: 0 | I1041: 0 | J1041: 0 | K1041: 1178.25 | L1041: 0 | M1041: =SUM(J1041:L1041)-112.36 -> 1065.8900000000001 | N1041: 112.36 | O1041: =SUM(M1041:N1041) -> 1178.25
A1042: 4144 | B1042: EOL BARAÚNAS XX | C1042: 34.986.678/0002-98 | D1042: 383.87 | E1042: 0 | F1042: 0 | G1042: 0 | H1042: 0 | I1042: 0 | J1042: 0 | K1042: 424.32999999999998 | L1042: 0 | M1042: =SUM(J1042:L1042)-40.46 -> 383.87 | N1042: 40.460000000000001 | O1042: =SUM(M1042:N1042) -> 424.32999999999998
A1043: 4145 | B1043: EOL MORRO BRANCO II | C1043: 35.040.621/0002-64 | D1043: 366.25999999999999 | E1043: 0 | F1043: 0 | G1043: 0 | H1043: 0 | I1043: 0 | J1043: 0 | K1043: 404.87 | L1043: 0 | M1043: =SUM(J1043:L1043)-38.61 -> 366.25999999999999 | N1043: 38.609999999999999 | O1043: =SUM(M1043:N1043) -> 404.87
A1044: 4146 | B1044: UFV FUTURA 1 | C1044: 37.349.957/0001-58 | D1044: 353.54000000000002 | E1044: 0 | F1044: 0 | G1044: 0 | H1044: 0 | I1044: 0 | J1044: 0 | K1044: 390.81 | L1044: 0 | M1044: =SUM(J1044:L1044)-37.27 -> 353.54000000000002 | N1044: 37.270000000000003 | O1044: =SUM(M1044:N1044) -> 390.81
A1045: 4147 | B1045: UFV FUTURA 2 | C1045: 37.349.957/0001-58 | D1045: 356.56999999999999 | E1045: 0 | F1045: 0 | G1045: 0 | H1045: 0 | I1045: 0 | J1045: 0 | K1045: 394.16000000000003 | L1045: 0 | M1045: =SUM(J1045:L1045)-37.59 -> 356.57000000000005 | N1045: 37.590000000000003 | O1045: =SUM(M1045:N1045) -> 394.16000000000008
A1046: 4148 | B1046: UFV FUTURA 3 | C1046: 37.349.957/0001-58 | D1046: 352.88 | E1046: 0 | F1046: 0 | G1046: 0 | H1046: 0 | I1046: 0 | J1046: 0 | K1046: 390.07999999999998 | L1046: 0 | M1046: =SUM(J1046:L1046)-37.2 -> 352.88 | N1046: 37.200000000000003 | O1046: =SUM(M1046:N1046) -> 390.07999999999998
A1047: 4149 | B1047: UFV FUTURA 4 | C1047: 37.349.957/0001-58 | D1047: 355.07999999999998 | E1047: 0 | F1047: 0 | G1047: 0 | H1047: 0 | I1047: 0 | J1047: 0 | K1047: 392.50999999999999 | L1047: 0 | M1047: =SUM(J1047:L1047)-37.43 -> 355.07999999999998 | N1047: 37.43 | O1047: =SUM(M1047:N1047) -> 392.50999999999999
A1048: 4150 | B1048: UFV FUTURA 5 | C1048: 37.349.892/0001-40 | D1048: 352.88 | E1048: 0 | F1048: 0 | G1048: 0 | H1048: 0 | I1048: 0 | J1048: 0 | K1048: 390.07999999999998 | L1048: 0 | M1048: =SUM(J1048:L1048)-37.2 -> 352.88 | N1048: 37.200000000000003 | O1048: =SUM(M1048:N1048) -> 390.07999999999998
A1049: 4151 | B1049: UFV FUTURA 6 | C1049: 37.349.892/0001-40 | D1049: 354.72000000000003 | E1049: 0 | F1049: 0 | G1049: 0 | H1049: 0 | I1049: 0 | J1049: 0 | K1049: 392.11000000000001 | L1049: 0 | M1049: =SUM(J1049:L1049)-37.39 -> 354.72000000000003 | N1049: 37.390000000000001 | O1049: =SUM(M1049:N1049) -> 392.11000000000001
A1050: 4152 | B1050: UFV FUTURA 7 | C1050: 37.349.892/0001-40 | D1050: 352.88 | E1050: 0 | F1050: 0 | G1050: 0 | H1050: 0 | I1050: 0 | J1050: 0 | K1050: 390.07999999999998 | L1050: 0 | M1050: =SUM(J1050:L1050)-37.2 -> 352.88 | N1050: 37.200000000000003 | O1050: =SUM(M1050:N1050) -> 390.07999999999998
A1051: 4153 | B1051: UFV FUTURA 8 | C1051: 37.349.892/0001-40 | D1051: 354.99000000000001 | E1051: 0 | F1051: 0 | G1051: 0 | H1051: 0 | I1051: 0 | J1051: 0 | K1051: 392.41000000000003 | L1051: 0 | M1051: =SUM(J1051:L1051)-37.42 -> 354.99000000000001 | N1051: 37.420000000000002 | O1051: =SUM(M1051:N1051) -> 392.41000000000003
A1052: 4154 | B1052: UFV FUTURA 9 | C1052: 37.350.010/0001-67 | D1052: 352.88 | E1052: 0 | F1052: 0 | G1052: 0 | H1052: 0 | I1052: 0 | J1052: 0 | K1052: 390.07999999999998 | L1052: 0 | M1052: =SUM(J1052:L1052)-37.2 -> 352.88 | N1052: 37.200000000000003 | O1052: =SUM(M1052:N1052) -> 390.07999999999998
A1053: 4155 | B1053: UFV FUTURA 10 | C1053: 37.350.010/0001-67 | D1053: 353.47000000000003 | E1053: 0 | F1053: 0 | G1053: 0 | H1053: 0 | I1053: 0 | J1053: 0 | K1053: 390.73000000000002 | L1053: 0 | M1053: =SUM(J1053:L1053)-37.26 -> 353.47000000000003 | N1053: 37.259999999999998 | O1053: =SUM(M1053:N1053) -> 390.73000000000002
A1054: 4156 | B1054: UFV FUTURA 11 | C1054: 37.350.010/0001-67 | D1054: 353.75999999999999 | E1054: 0 | F1054: 0 | G1054: 0 | H1054: 0 | I1054: 0 | J1054: 0 | K1054: 391.05000000000001 | L1054: 0 | M1054: =SUM(J1054:L1054)-37.29 -> 353.75999999999999 | N1054: 37.289999999999999 | O1054: =SUM(M1054:N1054) -> 391.05000000000001
A1055: 4157 | B1055: UFV FUTURA 12 | C1055: 37.350.010/0001-67 | D1055: 354.30000000000001 | E1055: 0 | F1055: 0 | G1055: 0 | H1055: 0 | I1055: 0 | J1055: 0 | K1055: 391.64999999999998 | L1055: 0 | M1055: =SUM(J1055:L1055)-37.35 -> 354.29999999999995 | N1055: 37.350000000000001 | O1055: =SUM(M1055:N1055) -> 391.64999999999998
A1056: 4158 | B1056: UFV FUTURA 13 | C1056: 37.349.956/0001-03 | D1056: 352.88 | E1056: 0 | F1056: 0 | G1056: 0 | H1056: 0 | I1056: 0 | J1056: 0 | K1056: 390.07999999999998 | L1056: 0 | M1056: =SUM(J1056:L1056)-37.2 -> 352.88 | N1056: 37.200000000000003 | O1056: =SUM(M1056:N1056) -> 390.07999999999998
A1057: 4159 | B1057: UFV FUTURA 14 | C1057: 37.349.956/0001-03 | D1057: 352.88 | E1057: 0 | F1057: 0 | G1057: 0 | H1057: 0 | I1057: 0 | J1057: 0 | K1057: 390.07999999999998 | L1057: 0 | M1057: =SUM(J1057:L1057)-37.2 -> 352.88 | N1057: 37.200000000000003 | O1057: =SUM(M1057:N1057) -> 390.07999999999998
A1058: 4160 | B1058: UFV FUTURA 15 | C1058: 37.349.956/0001-03 | D1058: 353.16000000000003 | E1058: 0 | F1058: 0 | G1058: 0 | H1058: 0 | I1058: 0 | J1058: 0 | K1058: 390.38999999999999 | L1058: 0 | M1058: =SUM(J1058:L1058)-37.23 -> 353.15999999999997 | N1058: 37.229999999999997 | O1058: =SUM(M1058:N1058) -> 390.38999999999999
A1059: 4161 | B1059: UFV FUTURA 16 | C1059: 37.349.956/0001-03 | D1059: 352.88 | E1059: 0 | F1059: 0 | G1059: 0 | H1059: 0 | I1059: 0 | J1059: 0 | K1059: 390.07999999999998 | L1059: 0 | M1059: =SUM(J1059:L1059)-37.2 -> 352.88 | N1059: 37.200000000000003 | O1059: =SUM(M1059:N1059) -> 390.07999999999998
A1060: 4162 | B1060: UFV FUTURA 17 | C1060: 37.349.956/0001-03 | D1060: 352.88 | E1060: 0 | F1060: 0 | G1060: 0 | H1060: 0 | I1060: 0 | J1060: 0 | K1060: 390.07999999999998 | L1060: 0 | M1060: =SUM(J1060:L1060)-37.2 -> 352.88 | N1060: 37.200000000000003 | O1060: =SUM(M1060:N1060) -> 390.07999999999998
A1061: 4163 | B1061: UFV FUTURA 18 | C1061: 37.349.910/0001-94 | D1061: 354.26999999999998 | E1061: 0 | F1061: 0 | G1061: 0 | H1061: 0 | I1061: 0 | J1061: 0 | K1061: 391.61000000000001 | L1061: 0 | M1061: =SUM(J1061:L1061)-37.34 -> 354.26999999999998 | N1061: 37.340000000000003 | O1061: =SUM(M1061:N1061) -> 391.61000000000001
A1062: 4164 | B1062: UFV FUTURA 19 | C1062: 37.349.910/0001-94 | D1062: 352.88 | E1062: 0 | F1062: 0 | G1062: 0 | H1062: 0 | I1062: 0 | J1062: 0 | K1062: 390.07999999999998 | L1062: 0 | M1062: =SUM(J1062:L1062)-37.2 -> 352.88 | N1062: 37.200000000000003 | O1062: =SUM(M1062:N1062) -> 390.07999999999998
A1063: 4165 | B1063: UFV FUTURA 20 | C1063: 37.349.910/0001-94 | D1063: 352.88 | E1063: 0 | F1063: 0 | G1063: 0 | H1063: 0 | I1063: 0 | J1063: 0 | K1063: 390.07999999999998 | L1063: 0 | M1063: =SUM(J1063:L1063)-37.2 -> 352.88 | N1063: 37.200000000000003 | O1063: =SUM(M1063:N1063) -> 390.07999999999998
A1064: 4166 | B1064: UFV FUTURA 21 | C1064: 37.576.883/0001-92 | D1064: 352.88 | E1064: 0 | F1064: 0 | G1064: 0 | H1064: 0 | I1064: 0 | J1064: 0 | K1064: 390.07999999999998 | L1064: 0 | M1064: =SUM(J1064:L1064)-37.2 -> 352.88 | N1064: 37.200000000000003 | O1064: =SUM(M1064:N1064) -> 390.07999999999998
A1065: 4167 | B1065: UFV FUTURA 22 | C1065: 37.576.883/0001-92 | D1065: 352.88 | E1065: 0 | F1065: 0 | G1065: 0 | H1065: 0 | I1065: 0 | J1065: 0 | K1065: 390.07999999999998 | L1065: 0 | M1065: =SUM(J1065:L1065)-37.2 -> 352.88 | N1065: 37.200000000000003 | O1065: =SUM(M1065:N1065) -> 390.07999999999998
A1066: 4168 | B1066: EOL JANDAIRA I | C1066: 35.823.538/0002-61 | D1066: 108.79000000000001 | E1066: 0 | F1066: 0 | G1066: 0 | H1066: 0 | I1066: 0 | J1066: 0 | K1066: 120.26000000000001 | L1066: 0 | M1066: =SUM(J1066:L1066)-11.47 -> 108.79000000000001 | N1066: 11.470000000000001 | O1066: =SUM(M1066:N1066) -> 120.26000000000001
A1067: 4169 | B1067: EOL TUCANO X | C1067: 35.636.816/0001-90 | D1067: 436.72000000000003 | E1067: 0 | F1067: 0 | G1067: 0 | H1067: 0 | I1067: 0 | J1067: 0 | K1067: 482.75999999999999 | L1067: 0 | M1067: =SUM(J1067:L1067)-46.04 -> 436.71999999999997 | N1067: 46.039999999999999 | O1067: =SUM(M1067:N1067) -> 482.75999999999999
A1068: 4170 | B1068: EOL ACAUÃ I | C1068: 35.842.703/0001-41 | D1068: 297.57999999999998 | E1068: 0 | F1068: 0 | G1068: 0 | H1068: 0 | I1068: 0 | J1068: 0 | K1068: 328.94999999999999 | L1068: 0 | M1068: =SUM(J1068:L1068)-31.37 -> 297.57999999999998 | N1068: 31.370000000000001 | O1068: =SUM(M1068:N1068) -> 328.94999999999999
A1069: 4171 | B1069: EOL BARAÚNAS XV | C1069: 34.986.689/0002-78 | D1069: 597.13999999999999 | E1069: 0 | F1069: 0 | G1069: 0 | H1069: 0 | I1069: 0 | J1069: 0 | K1069: 660.09000000000003 | L1069: 0 | M1069: =SUM(J1069:L1069)-62.95 -> 597.13999999999999 | N1069: 62.950000000000003 | O1069: =SUM(M1069:N1069) -> 660.09000000000003
A1070: 4172 | B1070: UTE LWARCEL | C1070: 53.943.098/0001-87 | D1070: 62.799999999999997 | E1070: 0 | F1070: 0 | G1070: 0 | H1070: 0 | I1070: 0 | J1070: 0 | K1070: 69.420000000000002 | L1070: 0 | M1070: =SUM(J1070:L1070)-6.62 -> 62.800000000000004 | N1070: 6.6200000000000001 | O1070: =SUM(M1070:N1070) -> 69.420000000000002
A1071: 4173 | B1071: UFV SERRA DO MEL V | C1071: 39.702.823/0001-02 | D1071: 532.39999999999998 | E1071: 0 | F1071: 0 | G1071: 0 | H1071: 0 | I1071: 0 | J1071: 0 | K1071: 588.51999999999998 | L1071: 0 | M1071: =SUM(J1071:L1071)-56.12 -> 532.39999999999998 | N1071: 56.119999999999997 | O1071: =SUM(M1071:N1071) -> 588.51999999999998
A1072: 4174 | B1072: UFV SERRA DO MEL VI | C1072: 39.702.834/0001-84 | D1072: 532.39999999999998 | E1072: 0 | F1072: 0 | G1072: 0 | H1072: 0 | I1072: 0 | J1072: 0 | K1072: 588.51999999999998 | L1072: 0 | M1072: =SUM(J1072:L1072)-56.12 -> 532.39999999999998 | N1072: 56.119999999999997 | O1072: =SUM(M1072:N1072) -> 588.51999999999998
A1073: 4175 | B1073: UFV SERRA DO MEL III | C1073: 39.702.802/0001-89 | D1073: 757.25999999999999 | E1073: 0 | F1073: 0 | G1073: 0 | H1073: 0 | I1073: 0 | J1073: 0 | K1073: 837.09000000000003 | L1073: 0 | M1073: =SUM(J1073:L1073)-79.83 -> 757.25999999999999 | N1073: 79.829999999999998 | O1073: =SUM(M1073:N1073) -> 837.09000000000003
A1074: 4176 | B1074: UFV SERRA DO MEL IV | C1074: 39.702.815/0001-58 | D1074: 732.14999999999998 | E1074: 0 | F1074: 0 | G1074: 0 | H1074: 0 | I1074: 0 | J1074: 0 | K1074: 809.33000000000004 | L1074: 0 | M1074: =SUM(J1074:L1074)-77.18 -> 732.15000000000009 | N1074: 77.180000000000007 | O1074: =SUM(M1074:N1074) -> 809.33000000000015
A1075: 4177 | B1075: EOL TUCANO III | C1075: 35.836.427/0001-09 | D1075: 436.72000000000003 | E1075: 0 | F1075: 0 | G1075: 0 | H1075: 0 | I1075: 0 | J1075: 0 | K1075: 482.75999999999999 | L1075: 0 | M1075: =SUM(J1075:L1075)-46.04 -> 436.71999999999997 | N1075: 46.039999999999999 | O1075: =SUM(M1075:N1075) -> 482.75999999999999
A1076: 4178 | B1076: EOL ACAUÃ II | C1076: 35.842.703/0001-41 | D1076: 247.97999999999999 | E1076: 0 | F1076: 0 | G1076: 0 | H1076: 0 | I1076: 0 | J1076: 0 | K1076: 274.12 | L1076: 0 | M1076: =SUM(J1076:L1076)-26.14 -> 247.98000000000002 | N1076: 26.140000000000001 | O1076: =SUM(M1076:N1076) -> 274.12
A1077: 4179 | B1077: EOL VENTOS DE SÃO ROQUE 01 | C1077: 31.594.049/0001-43 | D1077: 572.71000000000004 | E1077: 0 | F1077: 0 | G1077: 0 | H1077: 0 | I1077: 0 | J1077: 0 | K1077: 633.08000000000004 | L1077: 0 | M1077: =SUM(J1077:L1077)-60.37 -> 572.71000000000004 | N1077: 60.369999999999997 | O1077: =SUM(M1077:N1077) -> 633.08000000000004
A1078: 4180 | B1078: EOL VENTOS DE SÃO ROQUE 08 | C1078: 31.596.728/0001-51 | D1078: 572.71000000000004 | E1078: 0 | F1078: 0 | G1078: 0 | H1078: 0 | I1078: 0 | J1078: 0 | K1078: 633.08000000000004 | L1078: 0 | M1078: =SUM(J1078:L1078)-60.37 -> 572.71000000000004 | N1078: 60.369999999999997 | O1078: =SUM(M1078:N1078) -> 633.08000000000004
A1079: 4181 | B1079: EOL VENTOS DE SÃO VITOR 01 | C1079: 35.469.795/0001-66 | D1079: 369.79000000000002 | E1079: 0 | F1079: 0 | G1079: 0 | H1079: 0 | I1079: 0 | J1079: 0 | K1079: 408.76999999999998 | L1079: 0 | M1079: =SUM(J1079:L1079)-38.98 -> 369.78999999999996 | N1079: 38.979999999999997 | O1079: =SUM(M1079:N1079) -> 408.76999999999998
A1080: 4182 | B1080: EOL BAIXA DO SÍTIO | C1080: 35.842.708/0001-74 | D1080: 499.06999999999999 | E1080: 0 | F1080: 0 | G1080: 0 | H1080: 0 | I1080: 0 | J1080: 0 | K1080: 551.67999999999995 | L1080: 0 | M1080: =SUM(J1080:L1080)-52.61 -> 499.06999999999994 | N1080: 52.609999999999999 | O1080: =SUM(M1080:N1080) -> 551.67999999999995
A1081: 4183 | B1081: EOL BARAÚNAS IV | C1081: 34.986.649/0002-26 | D1081: 511.82999999999998 | E1081: 0 | F1081: 0 | G1081: 0 | H1081: 0 | I1081: 0 | J1081: 0 | K1081: 565.77999999999997 | L1081: 0 | M1081: =SUM(J1081:L1081)-53.95 -> 511.82999999999998 | N1081: 53.950000000000003 | O1081: =SUM(M1081:N1081) -> 565.77999999999997
A1082: 4184 | B1082: EOL JANDAÍRA II | C1082: 35.824.347/0002-14 | D1082: 252.56 | E1082: 0 | F1082: 0 | G1082: 0 | H1082: 0 | I1082: 0 | J1082: 0 | K1082: 279.18000000000001 | L1082: 0 | M1082: =SUM(J1082:L1082)-26.62 -> 252.56 | N1082: 26.620000000000001 | O1082: =SUM(M1082:N1082) -> 279.18000000000001
A1083: 4185 | B1083: EOL JANDAÍRA III | C1083: 35.823.536/0002-72 | D1083: 287.64999999999998 | E1083: 0 | F1083: 0 | G1083: 0 | H1083: 0 | I1083: 0 | J1083: 0 | K1083: 317.97000000000003 | L1083: 0 | M1083: =SUM(J1083:L1083)-30.32 -> 287.65000000000003 | N1083: 30.32 | O1083: =SUM(M1083:N1083) -> 317.97000000000003
A1084: 4186 | B1084: EOL JANDAÍRA IV | C1084: 35.823.577/0002-69 | D1084: 286.49000000000001 | E1084: 0 | F1084: 0 | G1084: 0 | H1084: 0 | I1084: 0 | J1084: 0 | K1084: 316.69 | L1084: 0 | M1084: =SUM(J1084:L1084)-30.2 -> 286.49000000000001 | N1084: 30.199999999999999 | O1084: =SUM(M1084:N1084) -> 316.69
A1085: 4187 | B1085: UFV LAR DO SOL 1 | C1085: 32.222.320/0001-82 | D1085: 554.15999999999997 | E1085: 0 | F1085: 0 | G1085: 0 | H1085: 0 | I1085: 0 | J1085: 0 | K1085: 612.58000000000004 | L1085: 0 | M1085: =SUM(J1085:L1085)-58.42 -> 554.16000000000008 | N1085: 58.420000000000002 | O1085: =SUM(M1085:N1085) -> 612.58000000000004
A1086: 4188 | B1086: UFV LAR DO SOL 2 | C1086: 32.222.320/0001-82 | D1086: 554.15999999999997 | E1086: 0 | F1086: 0 | G1086: 0 | H1086: 0 | I1086: 0 | J1086: 0 | K1086: 612.58000000000004 | L1086: 0 | M1086: =SUM(J1086:L1086)-58.42 -> 554.16000000000008 | N1086: 58.420000000000002 | O1086: =SUM(M1086:N1086) -> 612.58000000000004
A1087: 4189 | B1087: UFV LAR DO SOL 7 | C1087: 31.345.445/0001-37 | D1087: 554.15999999999997 | E1087: 0 | F1087: 0 | G1087: 0 | H1087: 0 | I1087: 0 | J1087: 0 | K1087: 612.58000000000004 | L1087: 0 | M1087: =SUM(J1087:L1087)-58.42 -> 554.16000000000008 | N1087: 58.420000000000002 | O1087: =SUM(M1087:N1087) -> 612.58000000000004
A1088: 4190 | B1088: UFV LAR DO SOL 8 | C1088: 31.345.445/0001-37 | D1088: 554.15999999999997 | E1088: 0 | F1088: 0 | G1088: 0 | H1088: 0 | I1088: 0 | J1088: 0 | K1088: 612.58000000000004 | L1088: 0 | M1088: =SUM(J1088:L1088)-58.42 -> 554.16000000000008 | N1088: 58.420000000000002 | O1088: =SUM(M1088:N1088) -> 612.58000000000004
A1089: 4191 | B1089: UFV LAR DO SOL 9 | C1089: 31.345.569/0001-12 | D1089: 554.15999999999997 | E1089: 0 | F1089: 0 | G1089: 0 | H1089: 0 | I1089: 0 | J1089: 0 | K1089: 612.58000000000004 | L1089: 0 | M1089: =SUM(J1089:L1089)-58.42 -> 554.16000000000008 | N1089: 58.420000000000002 | O1089: =SUM(M1089:N1089) -> 612.58000000000004
A1090: 4192 | B1090: UFV LAR DO SOL 10 | C1090: 31.345.569/0001-12 | D1090: 554.15999999999997 | E1090: 0 | F1090: 0 | G1090: 0 | H1090: 0 | I1090: 0 | J1090: 0 | K1090: 612.58000000000004 | L1090: 0 | M1090: =SUM(J1090:L1090)-58.42 -> 554.16000000000008 | N1090: 58.420000000000002 | O1090: =SUM(M1090:N1090) -> 612.58000000000004
A1091: 4193 | B1091: EOL TUCANO IV | C1091: 35.836.426/0001-64 | D1091: 436.72000000000003 | E1091: 0 | F1091: 0 | G1091: 0 | H1091: 0 | I1091: 0 | J1091: 0 | K1091: 482.75999999999999 | L1091: 0 | M1091: =SUM(J1091:L1091)-46.04 -> 436.71999999999997 | N1091: 46.039999999999999 | O1091: =SUM(M1091:N1091) -> 482.75999999999999
A1092: 4194 | B1092: EOL TUCANO XVI | C1092: 35.806.317/0002-85 | D1092: 124.78 | E1092: 0 | F1092: 0 | G1092: 0 | H1092: 0 | I1092: 0 | J1092: 0 | K1092: 137.93000000000001 | L1092: 0 | M1092: =SUM(J1092:L1092)-13.15 -> 124.78 | N1092: 13.15 | O1092: =SUM(M1092:N1092) -> 137.93000000000001
A1093: 4195 | B1093: EOL VENTOS DE SÃO ROQUE 02 | C1093: 31.596.667/0001-22 | D1093: 572.71000000000004 | E1093: 0 | F1093: 0 | G1093: 0 | H1093: 0 | I1093: 0 | J1093: 0 | K1093: 633.08000000000004 | L1093: 0 | M1093: =SUM(J1093:L1093)-60.37 -> 572.71000000000004 | N1093: 60.369999999999997 | O1093: =SUM(M1093:N1093) -> 633.08000000000004
A1094: 4196 | B1094: EOL VENTOS DE SÃO ROQUE 04 | C1094: 31.594.122/0001-87 | D1094: 572.71000000000004 | E1094: 0 | F1094: 0 | G1094: 0 | H1094: 0 | I1094: 0 | J1094: 0 | K1094: 633.08000000000004 | L1094: 0 | M1094: =SUM(J1094:L1094)-60.37 -> 572.71000000000004 | N1094: 60.369999999999997 | O1094: =SUM(M1094:N1094) -> 633.08000000000004
A1095: 4197 | B1095: EOL VENTOS DE SÃO ROQUE 11 | C1095: 31.595.917/0001-00 | D1095: 572.71000000000004 | E1095: 0 | F1095: 0 | G1095: 0 | H1095: 0 | I1095: 0 | J1095: 0 | K1095: 633.08000000000004 | L1095: 0 | M1095: =SUM(J1095:L1095)-60.37 -> 572.71000000000004 | N1095: 60.369999999999997 | O1095: =SUM(M1095:N1095) -> 633.08000000000004
A1096: 4198 | B1096: EOL VENTOS DE SÃO ROQUE 16 | C1096: 31.595.857/0001-25 | D1096: 572.71000000000004 | E1096: 0 | F1096: 0 | G1096: 0 | H1096: 0 | I1096: 0 | J1096: 0 | K1096: 633.08000000000004 | L1096: 0 | M1096: =SUM(J1096:L1096)-60.37 -> 572.71000000000004 | N1096: 60.369999999999997 | O1096: =SUM(M1096:N1096) -> 633.08000000000004
A1097: 4199 | B1097: EOL VENTOS DE SÃO ROQUE 17 | C1097: 31.594.065/0001-36 | D1097: 572.71000000000004 | E1097: 0 | F1097: 0 | G1097: 0 | H1097: 0 | I1097: 0 | J1097: 0 | K1097: 633.08000000000004 | L1097: 0 | M1097: =SUM(J1097:L1097)-60.37 -> 572.71000000000004 | N1097: 60.369999999999997 | O1097: =SUM(M1097:N1097) -> 633.08000000000004
A1098: 4200 | B1098: EOL VENTOS DE SÃO ROQUE 18 | C1098: 31.596.016/0001-32 | D1098: 572.71000000000004 | E1098: 0 | F1098: 0 | G1098: 0 | H1098: 0 | I1098: 0 | J1098: 0 | K1098: 633.08000000000004 | L1098: 0 | M1098: =SUM(J1098:L1098)-60.37 -> 572.71000000000004 | N1098: 60.369999999999997 | O1098: =SUM(M1098:N1098) -> 633.08000000000004
A1099: 4201 | B1099: EOL VENTOS DE SANTA EUGÊNIA 02 | C1099: 35.637.246/0002-34 | D1099: 128.02000000000001 | E1099: 0 | F1099: 0 | G1099: 0 | H1099: 0 | I1099: 0 | J1099: 0 | K1099: 141.50999999999999 | L1099: 0 | M1099: =SUM(J1099:L1099)-13.49 -> 128.01999999999998 | N1099: 13.49 | O1099: =SUM(M1099:N1099) -> 141.50999999999999
A1100: 4202 | B1100: EOL VENTOS DE SANTA EUGÊNIA 07 | C1100: 35.637.246/0002-34 | D1100: 192.03 | E1100: 0 | F1100: 0 | G1100: 0 | H1100: 0 | I1100: 0 | J1100: 0 | K1100: 212.27000000000001 | L1100: 0 | M1100: =SUM(J1100:L1100)-20.24 -> 192.03 | N1100: 20.239999999999998 | O1100: =SUM(M1100:N1100) -> 212.27000000000001
A1101: 4203 | B1101: EOL VENTOS DE SÃO VITOR 02 | C1101: 35.477.401/0001-11 | D1101: 363.94999999999999 | E1101: 0 | F1101: 0 | G1101: 0 | H1101: 0 | I1101: 0 | J1101: 0 | K1101: 402.31999999999999 | L1101: 0 | M1101: =SUM(J1101:L1101)-38.37 -> 363.94999999999999 | N1101: 38.369999999999997 | O1101: =SUM(M1101:N1101) -> 402.31999999999999
A1102: 4204 | B1102: EOL VENTOS DE SÃO VITOR 03 | C1102: 35.402.454/0001-73 | D1102: 369.79000000000002 | E1102: 0 | F1102: 0 | G1102: 0 | H1102: 0 | I1102: 0 | J1102: 0 | K1102: 408.76999999999998 | L1102: 0 | M1102: =SUM(J1102:L1102)-38.98 -> 369.78999999999996 | N1102: 38.979999999999997 | O1102: =SUM(M1102:N1102) -> 408.76999999999998
A1103: 4205 | B1103: EOL VENTOS DE SÃO VITOR 06 | C1103: 35.402.868/0001-00 | D1103: 369.79000000000002 | E1103: 0 | F1103: 0 | G1103: 0 | H1103: 0 | I1103: 0 | J1103: 0 | K1103: 408.76999999999998 | L1103: 0 | M1103: =SUM(J1103:L1103)-38.98 -> 369.78999999999996 | N1103: 38.979999999999997 | O1103: =SUM(M1103:N1103) -> 408.76999999999998
A1104: 4206 | B1104: EOL TUCANO II | C1104: 35.806.317/0001-02 | D1104: 249.55000000000001 | E1104: 0 | F1104: 0 | G1104: 0 | H1104: 0 | I1104: 0 | J1104: 0 | K1104: 275.86000000000001 | L1104: 0 | M1104: =SUM(J1104:L1104)-26.31 -> 249.55000000000001 | N1104: 26.309999999999999 | O1104: =SUM(M1104:N1104) -> 275.86000000000001
A1105: 4207 | B1105: EOL VENTOS DE SANTA EUGÊNIA 01 | C1105: 35.637.424/0002-27 | D1105: 566.46000000000004 | E1105: 0 | F1105: 0 | G1105: 0 | H1105: 0 | I1105: 0 | J1105: 0 | K1105: 626.16999999999996 | L1105: 0 | M1105: =SUM(J1105:L1105)-59.71 -> 566.45999999999992 | N1105: 59.710000000000001 | O1105: =SUM(M1105:N1105) -> 626.16999999999996
A1106: 4208 | B1106: EOL VENTOS DE SÃO VITOR 04 | C1106: 35.402.592/0001-52 | D1106: 369.79000000000002 | E1106: 0 | F1106: 0 | G1106: 0 | H1106: 0 | I1106: 0 | J1106: 0 | K1106: 408.76999999999998 | L1106: 0 | M1106: =SUM(J1106:L1106)-38.98 -> 369.78999999999996 | N1106: 38.979999999999997 | O1106: =SUM(M1106:N1106) -> 408.76999999999998
A1107: 4209 | B1107: EOL VENTOS DE SÃO VITOR 05 | C1107: 35.402.703/0001-20 | D1107: 369.79000000000002 | E1107: 0 | F1107: 0 | G1107: 0 | H1107: 0 | I1107: 0 | J1107: 0 | K1107: 408.76999999999998 | L1107: 0 | M1107: =SUM(J1107:L1107)-38.98 -> 369.78999999999996 | N1107: 38.979999999999997 | O1107: =SUM(M1107:N1107) -> 408.76999999999998
A1108: 4210 | B1108: UTE VIANA 1 | C1108: 09.043.782/0004-63 | D1108: 687.34000000000003 | E1108: 0 | F1108: 0 | G1108: 0 | H1108: 0 | I1108: 0 | J1108: 0 | K1108: 759.78999999999996 | L1108: 0 | M1108: =SUM(J1108:L1108)-72.45 -> 687.33999999999992 | N1108: 72.450000000000003 | O1108: =SUM(M1108:N1108) -> 759.78999999999996
A1109: 4212 | B1109: EOL VENTOS DE SANTO APOLINÁRIO | C1109: 23.037.442/0001-08 | D1109: 428.38 | E1109: 0 | F1109: 0 | G1109: 0 | H1109: 0 | I1109: 0 | J1109: 0 | K1109: 473.54000000000002 | L1109: 0 | M1109: =SUM(J1109:L1109)-45.16 -> 428.38 | N1109: 45.159999999999997 | O1109: =SUM(M1109:N1109) -> 473.53999999999996
A1110: 4213 | B1110: EOL VENTOS DE SANTA ALEXANDRINA | C1110: 23.037.493/0001-30 | D1110: 536.74000000000001 | E1110: 0 | F1110: 0 | G1110: 0 | H1110: 0 | I1110: 0 | J1110: 0 | K1110: 593.32000000000005 | L1110: 0 | M1110: =SUM(J1110:L1110)-56.58 -> 536.74000000000001 | N1110: 56.579999999999998 | O1110: =SUM(M1110:N1110) -> 593.32000000000005
A1111: 4214 | B1111: EOL VENTOS DE SÃO JOÃO PAULO II | C1111: 23.037.337/0001-79 | D1111: 374.75999999999999 | E1111: 0 | F1111: 0 | G1111: 0 | H1111: 0 | I1111: 0 | J1111: 0 | K1111: 414.25999999999999 | L1111: 0 | M1111: =SUM(J1111:L1111)-39.5 -> 374.75999999999999 | N1111: 39.5 | O1111: =SUM(M1111:N1111) -> 414.25999999999999
A1112: 4215 | B1112: UFV JANAUBA 1 | C1112: 37.380.592/0001-24 | D1112: 602.62 | E1112: 0 | F1112: 0 | G1112: 0 | H1112: 0 | I1112: 0 | J1112: 0 | K1112: 666.13999999999999 | L1112: 0 | M1112: =SUM(J1112:L1112)-63.52 -> 602.62 | N1112: 63.520000000000003 | O1112: =SUM(M1112:N1112) -> 666.13999999999999
A1113: 4216 | B1113: UFV JANAUBA 3 | C1113: 37.381.467/0001-39 | D1113: 602.62 | E1113: 0 | F1113: 0 | G1113: 0 | H1113: 0 | I1113: 0 | J1113: 0 | K1113: 666.13999999999999 | L1113: 0 | M1113: =SUM(J1113:L1113)-63.52 -> 602.62 | N1113: 63.520000000000003 | O1113: =SUM(M1113:N1113) -> 666.13999999999999
A1114: 4217 | B1114: UFV JANAUBA 4 | C1114: 37.381.255/0001-51 | D1114: 602.62 | E1114: 0 | F1114: 0 | G1114: 0 | H1114: 0 | I1114: 0 | J1114: 0 | K1114: 666.13999999999999 | L1114: 0 | M1114: =SUM(J1114:L1114)-63.52 -> 602.62 | N1114: 63.520000000000003 | O1114: =SUM(M1114:N1114) -> 666.13999999999999
A1115: 4218 | B1115: EOL VENTOS DE SANTO ANTERO | C1115: 22.246.333/0001-38 | D1115: 585.48000000000002 | E1115: 0 | F1115: 0 | G1115: 0 | H1115: 0 | I1115: 0 | J1115: 0 | K1115: 647.20000000000005 | L1115: 0 | M1115: =SUM(J1115:L1115)-61.72 -> 585.48000000000002 | N1115: 61.719999999999999 | O1115: =SUM(M1115:N1115) -> 647.20000000000005
A1116: 4219 | B1116: EOL VENTOS DE SÃO BERNARDO | C1116: 21.893.166/0001-54 | D1116: 526.38 | E1116: 0 | F1116: 0 | G1116: 0 | H1116: 0 | I1116: 0 | J1116: 0 | K1116: 581.87 | L1116: 0 | M1116: =SUM(J1116:L1116)-55.49 -> 526.38 | N1116: 55.490000000000002 | O1116: =SUM(M1116:N1116) -> 581.87
A1117: 4220 | B1117: EOL VENTOS DE SANTA EUGÊNIA 03 | C1117: 35.636.507/0002-00 | D1117: 447.95999999999998 | E1117: 0 | F1117: 0 | G1117: 0 | H1117: 0 | I1117: 0 | J1117: 0 | K1117: 495.18000000000001 | L1117: 0 | M1117: =SUM(J1117:L1117)-47.22 -> 447.96000000000004 | N1117: 47.219999999999999 | O1117: =SUM(M1117:N1117) -> 495.18000000000006
A1118: 4222 | B1118: EOL OITIS 1 | C1118: 34.211.213/0002-65 | D1118: 583.29999999999995 | E1118: 0 | F1118: 0 | G1118: 0 | H1118: 0 | I1118: 0 | J1118: 0 | K1118: 644.78999999999996 | L1118: 0 | M1118: =SUM(J1118:L1118)-61.49 -> 583.29999999999995 | N1118: 61.490000000000002 | O1118: =SUM(M1118:N1118) -> 644.78999999999996
A1119: 4223 | B1119: EOL OITIS 5 | C1119: 34.211.252/0002-62 | D1119: 590.51999999999998 | E1119: 0 | F1119: 0 | G1119: 0 | H1119: 0 | I1119: 0 | J1119: 0 | K1119: 652.76999999999998 | L1119: 0 | M1119: =SUM(J1119:L1119)-62.25 -> 590.51999999999998 | N1119: 62.25 | O1119: =SUM(M1119:N1119) -> 652.76999999999998
A1120: 4224 | B1120: EOL OITIS 6 | C1120: 34.211.096/0002-30 | D1120: 590.51999999999998 | E1120: 0 | F1120: 0 | G1120: 0 | H1120: 0 | I1120: 0 | J1120: 0 | K1120: 652.76999999999998 | L1120: 0 | M1120: =SUM(J1120:L1120)-62.25 -> 590.51999999999998 | N1120: 62.25 | O1120: =SUM(M1120:N1120) -> 652.76999999999998
A1121: 4225 | B1121: EOL OITIS 7 | C1121: 34.211.395/0002-74 | D1121: 590.51999999999998 | E1121: 0 | F1121: 0 | G1121: 0 | H1121: 0 | I1121: 0 | J1121: 0 | K1121: 652.76999999999998 | L1121: 0 | M1121: =SUM(J1121:L1121)-62.25 -> 590.51999999999998 | N1121: 62.25 | O1121: =SUM(M1121:N1121) -> 652.76999999999998
A1122: 4226 | B1122: EOL OITIS 22 | C1122: 34.211.180/0002-53 | D1122: 590.51999999999998 | E1122: 0 | F1122: 0 | G1122: 0 | H1122: 0 | I1122: 0 | J1122: 0 | K1122: 652.76999999999998 | L1122: 0 | M1122: =SUM(J1122:L1122)-62.25 -> 590.51999999999998 | N1122: 62.25 | O1122: =SUM(M1122:N1122) -> 652.76999999999998
A1123: 4227 | B1123: EOL AW SÃO JOÃO | C1123: 33.268.331/0001-66 | D1123: 286.31999999999999 | E1123: 0 | F1123: 0 | G1123: 0 | H1123: 0 | I1123: 0 | J1123: 0 | K1123: 316.5 | L1123: 0 | M1123: =SUM(J1123:L1123)-30.18 -> 286.31999999999999 | N1123: 30.18 | O1123: =SUM(M1123:N1123) -> 316.5
A1124: 4228 | B1124: EOL AW SANTA RÉGIA | C1124: 33.268.312/0001-30 | D1124: 424.30000000000001 | E1124: 0 | F1124: 0 | G1124: 0 | H1124: 0 | I1124: 0 | J1124: 0 | K1124: 469.02999999999997 | L1124: 0 | M1124: =SUM(J1124:L1124)-44.73 -> 424.29999999999995 | N1124: 44.729999999999997 | O1124: =SUM(M1124:N1124) -> 469.02999999999997
A1125: 4229 | B1125: UFV JANAUBA 2 | C1125: 37.405.455/0001-05 | D1125: 602.62 | E1125: 0 | F1125: 0 | G1125: 0 | H1125: 0 | I1125: 0 | J1125: 0 | K1125: 666.13999999999999 | L1125: 0 | M1125: =SUM(J1125:L1125)-63.52 -> 602.62 | N1125: 63.520000000000003 | O1125: =SUM(M1125:N1125) -> 666.13999999999999
A1126: 4230 | B1126: UFV JANAUBA 9 | C1126: 37.381.180/0001-09 | D1126: 602.62 | E1126: 0 | F1126: 0 | G1126: 0 | H1126: 0 | I1126: 0 | J1126: 0 | K1126: 666.13999999999999 | L1126: 0 | M1126: =SUM(J1126:L1126)-63.52 -> 602.62 | N1126: 63.520000000000003 | O1126: =SUM(M1126:N1126) -> 666.13999999999999
A1127: 4231 | B1127: EOL VENTOS DE SÃO VITOR 07 | C1127: 35.402.953/0001-60 | D1127: 517.70000000000005 | E1127: 0 | F1127: 0 | G1127: 0 | H1127: 0 | I1127: 0 | J1127: 0 | K1127: 572.26999999999998 | L1127: 0 | M1127: =SUM(J1127:L1127)-54.57 -> 517.69999999999993 | N1127: 54.57 | O1127: =SUM(M1127:N1127) -> 572.26999999999998
A1128: 4232 | B1128: EOL VENTOS DE SÃO JANUÁRIO 15 | C1128: 35.865.644/0002-08 | D1128: 113.54000000000001 | E1128: 0 | F1128: 0 | G1128: 0 | H1128: 0 | I1128: 0 | J1128: 0 | K1128: 125.51000000000001 | L1128: 0 | M1128: =SUM(J1128:L1128)-11.97 -> 113.54000000000001 | N1128: 11.970000000000001 | O1128: =SUM(M1128:N1128) -> 125.51000000000001
A1129: 4233 | B1129: EOL VENTOS DE SÃO JANUÁRIO 16 | C1129: 35.874.355/0002-75 | D1129: 113.54000000000001 | E1129: 0 | F1129: 0 | G1129: 0 | H1129: 0 | I1129: 0 | J1129: 0 | K1129: 125.51000000000001 | L1129: 0 | M1129: =SUM(J1129:L1129)-11.97 -> 113.54000000000001 | N1129: 11.970000000000001 | O1129: =SUM(M1129:N1129) -> 125.51000000000001
A1130: 4234 | B1130: EOL VENTOS DE SÃO JANUÁRIO 17 | C1130: 35.859.013/0002-86 | D1130: 113.54000000000001 | E1130: 0 | F1130: 0 | G1130: 0 | H1130: 0 | I1130: 0 | J1130: 0 | K1130: 125.51000000000001 | L1130: 0 | M1130: =SUM(J1130:L1130)-11.97 -> 113.54000000000001 | N1130: 11.970000000000001 | O1130: =SUM(M1130:N1130) -> 125.51000000000001
A1131: 4235 | B1131: EOL VENTOS DE SÃO JANUÁRIO 18 | C1131: 35.865.623/0002-92 | D1131: 113.54000000000001 | E1131: 0 | F1131: 0 | G1131: 0 | H1131: 0 | I1131: 0 | J1131: 0 | K1131: 125.51000000000001 | L1131: 0 | M1131: =SUM(J1131:L1131)-11.97 -> 113.54000000000001 | N1131: 11.970000000000001 | O1131: =SUM(M1131:N1131) -> 125.51000000000001
A1132: 4236 | B1132: EOL VENTOS DE SÃO JANUÁRIO 19 | C1132: 35.865.638/0002-50 | D1132: 113.54000000000001 | E1132: 0 | F1132: 0 | G1132: 0 | H1132: 0 | I1132: 0 | J1132: 0 | K1132: 125.51000000000001 | L1132: 0 | M1132: =SUM(J1132:L1132)-11.97 -> 113.54000000000001 | N1132: 11.970000000000001 | O1132: =SUM(M1132:N1132) -> 125.51000000000001
A1133: 4237 | B1133: UFV JANAUBA 8 | C1133: 37.381.661/0001-14 | D1133: 602.62 | E1133: 0 | F1133: 0 | G1133: 0 | H1133: 0 | I1133: 0 | J1133: 0 | K1133: 666.13999999999999 | L1133: 0 | M1133: =SUM(J1133:L1133)-63.52 -> 602.62 | N1133: 63.520000000000003 | O1133: =SUM(M1133:N1133) -> 666.13999999999999
A1134: 4238 | B1134: UFV JANAUBA 12 | C1134: 37.381.730/0001-90 | D1134: 602.62 | E1134: 0 | F1134: 0 | G1134: 0 | H1134: 0 | I1134: 0 | J1134: 0 | K1134: 666.13999999999999 | L1134: 0 | M1134: =SUM(J1134:L1134)-63.52 -> 602.62 | N1134: 63.520000000000003 | O1134: =SUM(M1134:N1134) -> 666.13999999999999
A1135: 4239 | B1135: UFV JANAUBA 13 | C1135: 37.405.654/0001-05 | D1135: 602.62 | E1135: 0 | F1135: 0 | G1135: 0 | H1135: 0 | I1135: 0 | J1135: 0 | K1135: 666.13999999999999 | L1135: 0 | M1135: =SUM(J1135:L1135)-63.52 -> 602.62 | N1135: 63.520000000000003 | O1135: =SUM(M1135:N1135) -> 666.13999999999999
A1136: 4240 | B1136: UFV JANAUBA 14 | C1136: 37.380.661/0001-08 | D1136: 602.62 | E1136: 0 | F1136: 0 | G1136: 0 | H1136: 0 | I1136: 0 | J1136: 0 | K1136: 666.13999999999999 | L1136: 0 | M1136: =SUM(J1136:L1136)-63.52 -> 602.62 | N1136: 63.520000000000003 | O1136: =SUM(M1136:N1136) -> 666.13999999999999
A1137: 4241 | B1137: UFV LAVRAS 6 | C1137: 35.306.327/0001-70 | D1137: 258.19 | E1137: 0 | F1137: 0 | G1137: 0 | H1137: 0 | I1137: 0 | J1137: 0 | K1137: 285.41000000000003 | L1137: 0 | M1137: =SUM(J1137:L1137)-27.22 -> 258.19000000000005 | N1137: 27.219999999999999 | O1137: =SUM(M1137:N1137) -> 285.41000000000008
A1138: 4242 | B1138: UFV LAVRAS 7 | C1138: 35.357.719/0001-69 | D1138: 199.69 | E1138: 0 | F1138: 0 | G1138: 0 | H1138: 0 | I1138: 0 | J1138: 0 | K1138: 220.74000000000001 | L1138: 0 | M1138: =SUM(J1138:L1138)-21.05 -> 199.69 | N1138: 21.050000000000001 | O1138: =SUM(M1138:N1138) -> 220.74000000000001
A1139: 4243 | B1139: UFV LAVRAS 8 | C1139: 35.357.729/0001-02 | D1139: 199.69 | E1139: 0 | F1139: 0 | G1139: 0 | H1139: 0 | I1139: 0 | J1139: 0 | K1139: 220.74000000000001 | L1139: 0 | M1139: =SUM(J1139:L1139)-21.05 -> 199.69 | N1139: 21.050000000000001 | O1139: =SUM(M1139:N1139) -> 220.74000000000001
A1140: 4250 | B1140: EOL OITIS 2 | C1140: 34.238.187/0002-69 | D1140: 328.06999999999999 | E1140: 0 | F1140: 0 | G1140: 0 | H1140: 0 | I1140: 0 | J1140: 0 | K1140: 362.64999999999998 | L1140: 0 | M1140: =SUM(J1140:L1140)-34.58 -> 328.06999999999999 | N1140: 34.579999999999998 | O1140: =SUM(M1140:N1140) -> 362.64999999999998
A1141: 4251 | B1141: EOL VENTOS DE SANTO ALDERICO | C1141: 23.037.528/0001-30 | D1141: 482.87 | E1141: 0 | F1141: 0 | G1141: 0 | H1141: 0 | I1141: 0 | J1141: 0 | K1141: 533.76999999999998 | L1141: 0 | M1141: =SUM(J1141:L1141)-50.9 -> 482.87 | N1141: 50.899999999999999 | O1141: =SUM(M1141:N1141) -> 533.76999999999998
A1142: 4252 | B1142: EOL VENTOS DE SÃO CRISPIM | C1142: 23.037.375/0001-21 | D1142: 590.02999999999997 | E1142: 0 | F1142: 0 | G1142: 0 | H1142: 0 | I1142: 0 | J1142: 0 | K1142: 652.23000000000002 | L1142: 0 | M1142: =SUM(J1142:L1142)-62.2 -> 590.02999999999997 | N1142: 62.200000000000003 | O1142: =SUM(M1142:N1142) -> 652.23000000000002
A1143: 4253 | B1143: UHE TUCURUÍ | C1143: 00.357.038/0001-16 | D1143: 177066.04000000001 | E1143: 0 | F1143: 0 | G1143: 0 | H1143: 0 | I1143: 0 | J1143: 0 | K1143: 195731.12 | L1143: 0 | M1143: =SUM(J1143:L1143)-18665.08 -> 177066.03999999998 | N1143: 18665.080000000002 | O1143: =SUM(M1143:N1143) -> 195731.12
A1144: 4254 | B1144: UFV RIBEIRO GONÇALVES I | C1144: 31.711.512/0001-90 | D1144: 186.56999999999999 | E1144: 0 | F1144: 0 | G1144: 0 | H1144: 0 | I1144: 0 | J1144: 0 | K1144: 206.24000000000001 | L1144: 0 | M1144: =SUM(J1144:L1144)-19.67 -> 186.56999999999999 | N1144: 19.670000000000002 | O1144: =SUM(M1144:N1144) -> 206.24000000000001
A1145: 4255 | B1145: UFV RIBEIRO GONÇALVES II | C1145: 31.711.512/0001-90 | D1145: 433.29000000000002 | E1145: 0 | F1145: 0 | G1145: 0 | H1145: 0 | I1145: 0 | J1145: 0 | K1145: 478.95999999999998 | L1145: 0 | M1145: =SUM(J1145:L1145)-45.67 -> 433.28999999999996 | N1145: 45.670000000000002 | O1145: =SUM(M1145:N1145) -> 478.95999999999998
A1146: 4256 | B1146: UFV RIBEIRO GONÇALVES III | C1146: 31.711.512/0001-90 | D1146: 433.29000000000002 | E1146: 0 | F1146: 0 | G1146: 0 | H1146: 0 | I1146: 0 | J1146: 0 | K1146: 478.95999999999998 | L1146: 0 | M1146: =SUM(J1146:L1146)-45.67 -> 433.28999999999996 | N1146: 45.670000000000002 | O1146: =SUM(M1146:N1146) -> 478.95999999999998
A1147: 4257 | B1147: UFV RIBEIRO GONÇALVES IV | C1147: 31.711.512/0001-90 | D1147: 236.34 | E1147: 0 | F1147: 0 | G1147: 0 | H1147: 0 | I1147: 0 | J1147: 0 | K1147: 261.25 | L1147: 0 | M1147: =SUM(J1147:L1147)-24.91 -> 236.34 | N1147: 24.91 | O1147: =SUM(M1147:N1147) -> 261.25
A1148: 4258 | B1148: EOL ASSURUÁ 4 I | C1148: 38.112.927/0002-77 | D1148: 422.17000000000002 | E1148: 0 | F1148: 0 | G1148: 0 | H1148: 0 | I1148: 0 | J1148: 0 | K1148: 466.67000000000002 | L1148: 0 | M1148: =SUM(J1148:L1148)-44.5 -> 422.17000000000002 | N1148: 44.5 | O1148: =SUM(M1148:N1148) -> 466.67000000000002
A1149: 4259 | B1149: EOL ASSURUÁ 4 VI | C1149: 38.049.608/0002-64 | D1149: 422.17000000000002 | E1149: 0 | F1149: 0 | G1149: 0 | H1149: 0 | I1149: 0 | J1149: 0 | K1149: 466.67000000000002 | L1149: 0 | M1149: =SUM(J1149:L1149)-44.5 -> 422.17000000000002 | N1149: 44.5 | O1149: =SUM(M1149:N1149) -> 466.67000000000002
A1150: 4260 | B1150: UFV JANAUBA 5 | C1150: 37.380.653/0001-53 | D1150: 602.62 | E1150: 0 | F1150: 0 | G1150: 0 | H1150: 0 | I1150: 0 | J1150: 0 | K1150: 666.13999999999999 | L1150: 0 | M1150: =SUM(J1150:L1150)-63.52 -> 602.62 | N1150: 63.520000000000003 | O1150: =SUM(M1150:N1150) -> 666.13999999999999
A1151: 4261 | B1151: UFV JANAUBA 10 | C1151: 37.405.824/0001-51 | D1151: 602.62 | E1151: 0 | F1151: 0 | G1151: 0 | H1151: 0 | I1151: 0 | J1151: 0 | K1151: 666.13999999999999 | L1151: 0 | M1151: =SUM(J1151:L1151)-63.52 -> 602.62 | N1151: 63.520000000000003 | O1151: =SUM(M1151:N1151) -> 666.13999999999999
A1152: 4262 | B1152: EOL OITIS 3 | C1152: 34.238.239/0002-05 | D1152: 590.51999999999998 | E1152: 0 | F1152: 0 | G1152: 0 | H1152: 0 | I1152: 0 | J1152: 0 | K1152: 652.76999999999998 | L1152: 0 | M1152: =SUM(J1152:L1152)-62.25 -> 590.51999999999998 | N1152: 62.25 | O1152: =SUM(M1152:N1152) -> 652.76999999999998
A1153: 4263 | B1153: EOL OITIS 8 | C1153: 34.211.894/0002-61 | D1153: 583.29999999999995 | E1153: 0 | F1153: 0 | G1153: 0 | H1153: 0 | I1153: 0 | J1153: 0 | K1153: 644.78999999999996 | L1153: 0 | M1153: =SUM(J1153:L1153)-61.49 -> 583.29999999999995 | N1153: 61.490000000000002 | O1153: =SUM(M1153:N1153) -> 644.78999999999996
A1154: 4264 | B1154: EOL OITIS 21 | C1154: 34.211.419/0002-95 | D1154: 524.90999999999997 | E1154: 0 | F1154: 0 | G1154: 0 | H1154: 0 | I1154: 0 | J1154: 0 | K1154: 580.24000000000001 | L1154: 0 | M1154: =SUM(J1154:L1154)-55.33 -> 524.90999999999997 | N1154: 55.329999999999998 | O1154: =SUM(M1154:N1154) -> 580.24000000000001
A1155: 4265 | B1155: EOL VENTOS DE SÃO CIRÍACO | C1155: 23.037.398/0001-36 | D1155: 591.91999999999996 | E1155: 0 | F1155: 0 | G1155: 0 | H1155: 0 | I1155: 0 | J1155: 0 | K1155: 654.32000000000005 | L1155: 0 | M1155: =SUM(J1155:L1155)-62.4 -> 591.92000000000007 | N1155: 62.399999999999999 | O1155: =SUM(M1155:N1155) -> 654.32000000000005
A1156: 4266 | B1156: EOL VENTOS DE SÃO CIRO | C1156: 23.037.463/0001-23 | D1156: 425.45999999999998 | E1156: 0 | F1156: 0 | G1156: 0 | H1156: 0 | I1156: 0 | J1156: 0 | K1156: 470.31 | L1156: 0 | M1156: =SUM(J1156:L1156)-44.85 -> 425.45999999999998 | N1156: 44.850000000000001 | O1156: =SUM(M1156:N1156) -> 470.31
A1157: 4267 | B1157: EOL VENTOS DE SANTA EUGÊNIA 12 | C1157: 35.636.507/0002-00 | D1157: 447.83999999999997 | E1157: 0 | F1157: 0 | G1157: 0 | H1157: 0 | I1157: 0 | J1157: 0 | K1157: 495.05000000000001 | L1157: 0 | M1157: =SUM(J1157:L1157)-47.21 -> 447.84000000000003 | N1157: 47.210000000000001 | O1157: =SUM(M1157:N1157) -> 495.05000000000001
A1158: 4268 | B1158: EOL VENTOS DE SANTA EUGÊNIA 05 | C1158: 35.636.502/0002-79 | D1158: 383.82999999999998 | E1158: 0 | F1158: 0 | G1158: 0 | H1158: 0 | I1158: 0 | J1158: 0 | K1158: 424.29000000000002 | L1158: 0 | M1158: =SUM(J1158:L1158)-40.46 -> 383.83000000000004 | N1158: 40.460000000000001 | O1158: =SUM(M1158:N1158) -> 424.29000000000002
A1159: 4269 | B1159: RENOVA (EOL QUINA) | C1159: 18.560.032/0001-07 | D1159: 108.31 | E1159: 0 | F1159: 0 | G1159: 0 | H1159: 0 | I1159: 0 | J1159: 0 | K1159: 119.73 | L1159: 0 | M1159: =SUM(J1159:L1159)-11.42 -> 108.31 | N1159: 11.42 | O1159: =SUM(M1159:N1159) -> 119.73
A1160: 4270 | B1160: RENOVA (EOL MULUNGU) | C1160: 18.560.032/0001-07 | D1160: 136.28 | E1160: 0 | F1160: 0 | G1160: 0 | H1160: 0 | I1160: 0 | J1160: 0 | K1160: 150.65000000000001 | L1160: 0 | M1160: =SUM(J1160:L1160)-14.37 -> 136.28 | N1160: 14.369999999999999 | O1160: =SUM(M1160:N1160) -> 150.65000000000001
A1161: 4271 | B1161: UFV JANAUBA 6 | C1161: 37.380.936/0001-03 | D1161: 602.62 | E1161: 0 | F1161: 0 | G1161: 0 | H1161: 0 | I1161: 0 | J1161: 0 | K1161: 666.13999999999999 | L1161: 0 | M1161: =SUM(J1161:L1161)-63.52 -> 602.62 | N1161: 63.520000000000003 | O1161: =SUM(M1161:N1161) -> 666.13999999999999
A1162: 4272 | B1162: UFV JANAUBA 7 | C1162: 37.380.859/0001-83 | D1162: 602.62 | E1162: 0 | F1162: 0 | G1162: 0 | H1162: 0 | I1162: 0 | J1162: 0 | K1162: 666.13999999999999 | L1162: 0 | M1162: =SUM(J1162:L1162)-63.52 -> 602.62 | N1162: 63.520000000000003 | O1162: =SUM(M1162:N1162) -> 666.13999999999999
A1163: 4273 | B1163: EOL OITIS 4 | C1163: 34.211.484/0002-10 | D1163: 590.51999999999998 | E1163: 0 | F1163: 0 | G1163: 0 | H1163: 0 | I1163: 0 | J1163: 0 | K1163: 652.76999999999998 | L1163: 0 | M1163: =SUM(J1163:L1163)-62.25 -> 590.51999999999998 | N1163: 62.25 | O1163: =SUM(M1163:N1163) -> 652.76999999999998
A1164: 4274 | B1164: EOL VENTOS DE SÃO CAIO | C1164: 23.037.422/0001-37 | D1164: 425.74000000000001 | E1164: 0 | F1164: 0 | G1164: 0 | H1164: 0 | I1164: 0 | J1164: 0 | K1164: 470.62 | L1164: 0 | M1164: =SUM(J1164:L1164)-44.88 -> 425.74000000000001 | N1164: 44.880000000000003 | O1164: =SUM(M1164:N1164) -> 470.62
A1165: 4275 | B1165: EOL VENTOS DE SÃO VITOR 10 | C1165: 35.403.117/0001-09 | D1165: 530.33000000000004 | E1165: 0 | F1165: 0 | G1165: 0 | H1165: 0 | I1165: 0 | J1165: 0 | K1165: 586.23000000000002 | L1165: 0 | M1165: =SUM(J1165:L1165)-55.9 -> 530.33000000000004 | N1165: 55.899999999999999 | O1165: =SUM(M1165:N1165) -> 586.23000000000002
A1166: 4276 | B1166: EOL VENTOS DE SANTA EUGÊNIA 08 | C1166: 35.636.502/0002-79 | D1166: 319.94 | E1166: 0 | F1166: 0 | G1166: 0 | H1166: 0 | I1166: 0 | J1166: 0 | K1166: 353.67000000000002 | L1166: 0 | M1166: =SUM(J1166:L1166)-33.73 -> 319.94 | N1166: 33.729999999999997 | O1166: =SUM(M1166:N1166) -> 353.67000000000002
A1167: 4277 | B1167: EOL VENTOS DE SÃO VITOR 11 | C1167: 35.403.207/0001-91 | D1167: 378.80000000000001 | E1167: 0 | F1167: 0 | G1167: 0 | H1167: 0 | I1167: 0 | J1167: 0 | K1167: 418.73000000000002 | L1167: 0 | M1167: =SUM(J1167:L1167)-39.93 -> 378.80000000000001 | N1167: 39.93 | O1167: =SUM(M1167:N1167) -> 418.73000000000002
A1168: 4278 | B1168: EOL SANTO AGOSTINHO 13 | C1168: 20.667.603/0003-10 | D1168: 430.14999999999998 | E1168: 0 | F1168: 0 | G1168: 0 | H1168: 0 | I1168: 0 | J1168: 0 | K1168: 475.49000000000001 | L1168: 0 | M1168: =SUM(J1168:L1168)-45.34 -> 430.14999999999998 | N1168: 45.340000000000003 | O1168: =SUM(M1168:N1168) -> 475.49000000000001
A1169: 4279 | B1169: EOL SANTO AGOSTINHO 26 | C1169: 23.079.885/0002-42 | D1169: 501.83999999999997 | E1169: 0 | F1169: 0 | G1169: 0 | H1169: 0 | I1169: 0 | J1169: 0 | K1169: 554.74000000000001 | L1169: 0 | M1169: =SUM(J1169:L1169)-52.9 -> 501.84000000000003 | N1169: 52.899999999999999 | O1169: =SUM(M1169:N1169) -> 554.74000000000001
A1170: 4280 | B1170: EOL VENTOS DE SANTA EUGÊNIA 11 | C1170: 35.639.141/0002-14 | D1170: 321.94999999999999 | E1170: 0 | F1170: 0 | G1170: 0 | H1170: 0 | I1170: 0 | J1170: 0 | K1170: 355.88999999999999 | L1170: 0 | M1170: =SUM(J1170:L1170)-33.94 -> 321.94999999999999 | N1170: 33.939999999999998 | O1170: =SUM(M1170:N1170) -> 355.88999999999999
A1171: 4283 | B1171: EOL VENTOS DE SANTA EUGÊNIA 13 | C1171: 35.654.188/0002-57 | D1171: 511.63 | E1171: 0 | F1171: 0 | G1171: 0 | H1171: 0 | I1171: 0 | J1171: 0 | K1171: 565.55999999999995 | L1171: 0 | M1171: =SUM(J1171:L1171)-53.93 -> 511.62999999999994 | N1171: 53.93 | O1171: =SUM(M1171:N1171) -> 565.55999999999995
A1172: 4284 | B1172: EOL ANEMUS WIND 1 | C1172: 29.481.536/0001-58 | D1172: 427.81999999999999 | E1172: 0 | F1172: 0 | G1172: 0 | H1172: 0 | I1172: 0 | J1172: 0 | K1172: 472.92000000000002 | L1172: 0 | M1172: =SUM(J1172:L1172)-45.1 -> 427.81999999999999 | N1172: 45.100000000000001 | O1172: =SUM(M1172:N1172) -> 472.92000000000002
A1173: 4285 | B1173: EOL VENTOS DE SÃO VITOR 09 | C1173: 35.403.066/0001-07 | D1173: 378.80000000000001 | E1173: 0 | F1173: 0 | G1173: 0 | H1173: 0 | I1173: 0 | J1173: 0 | K1173: 418.73000000000002 | L1173: 0 | M1173: =SUM(J1173:L1173)-39.93 -> 378.80000000000001 | N1173: 39.93 | O1173: =SUM(M1173:N1173) -> 418.73000000000002
A1174: 4286 | B1174: UFV JANAUBA 11 | C1174: 37.381.300/0001-78 | D1174: 602.62 | E1174: 0 | F1174: 0 | G1174: 0 | H1174: 0 | I1174: 0 | J1174: 0 | K1174: 666.13999999999999 | L1174: 0 | M1174: =SUM(J1174:L1174)-63.52 -> 602.62 | N1174: 63.520000000000003 | O1174: =SUM(M1174:N1174) -> 666.13999999999999
A1175: 4287 | B1175: EOL OITIS 9 | C1175: 34.211.291/0002-60 | D1175: 590.51999999999998 | E1175: 0 | F1175: 0 | G1175: 0 | H1175: 0 | I1175: 0 | J1175: 0 | K1175: 652.76999999999998 | L1175: 0 | M1175: =SUM(J1175:L1175)-62.25 -> 590.51999999999998 | N1175: 62.25 | O1175: =SUM(M1175:N1175) -> 652.76999999999998
A1176: 4288 | B1176: EOL CASA NOVA II | C1176: 33.541.368/0001-16 | D1176: 266.82999999999998 | E1176: 0 | F1176: 0 | G1176: 0 | H1176: 0 | I1176: 0 | J1176: 0 | K1176: 294.95999999999998 | L1176: 0 | M1176: =SUM(J1176:L1176)-28.13 -> 266.82999999999998 | N1176: 28.129999999999999 | O1176: =SUM(M1176:N1176) -> 294.95999999999998
A1177: 4289 | B1177: EOL CASA NOVA III | C1177: 33.541.368/0001-16 | D1177: 250.63 | E1177: 0 | F1177: 0 | G1177: 0 | H1177: 0 | I1177: 0 | J1177: 0 | K1177: 277.05000000000001 | L1177: 0 | M1177: =SUM(J1177:L1177)-26.42 -> 250.63 | N1177: 26.420000000000002 | O1177: =SUM(M1177:N1177) -> 277.05000000000001
A1178: 4290 | B1178: EOL ASSURUÁ 4 II | C1178: 38.286.402/0002-58 | D1178: 369.39999999999998 | E1178: 0 | F1178: 0 | G1178: 0 | H1178: 0 | I1178: 0 | J1178: 0 | K1178: 408.33999999999997 | L1178: 0 | M1178: =SUM(J1178:L1178)-38.94 -> 369.39999999999998 | N1178: 38.939999999999998 | O1178: =SUM(M1178:N1178) -> 408.33999999999997
A1179: 4291 | B1179: EOL ASSURUÁ 4 III | C1179: 38.112.944/0002-04 | D1179: 422.17000000000002 | E1179: 0 | F1179: 0 | G1179: 0 | H1179: 0 | I1179: 0 | J1179: 0 | K1179: 466.67000000000002 | L1179: 0 | M1179: =SUM(J1179:L1179)-44.5 -> 422.17000000000002 | N1179: 44.5 | O1179: =SUM(M1179:N1179) -> 466.67000000000002
A1180: 4292 | B1180: EOL ANEMUS WIND 2 | C1180: 29.492.546/0001-99 | D1180: 522.88999999999999 | E1180: 0 | F1180: 0 | G1180: 0 | H1180: 0 | I1180: 0 | J1180: 0 | K1180: 578.00999999999999 | L1180: 0 | M1180: =SUM(J1180:L1180)-55.12 -> 522.88999999999999 | N1180: 55.119999999999997 | O1180: =SUM(M1180:N1180) -> 578.00999999999999
A1181: 4293 | B1181: EOL TUCANO IX | C1181: 35.805.346/0001-41 | D1181: 475.91000000000003 | E1181: 0 | F1181: 0 | G1181: 0 | H1181: 0 | I1181: 0 | J1181: 0 | K1181: 526.08000000000004 | L1181: 0 | M1181: =SUM(J1181:L1181)-50.17 -> 475.91000000000003 | N1181: 50.170000000000002 | O1181: =SUM(M1181:N1181) -> 526.08000000000004
A1182: 4294 | B1182: EOL TUCANO XI | C1182: 35.805.346/0001-41 | D1182: 356.93000000000001 | E1182: 0 | F1182: 0 | G1182: 0 | H1182: 0 | I1182: 0 | J1182: 0 | K1182: 394.56 | L1182: 0 | M1182: =SUM(J1182:L1182)-37.63 -> 356.93000000000001 | N1182: 37.630000000000003 | O1182: =SUM(M1182:N1182) -> 394.56
A1183: 4295 | B1183: UFV AC III | C1183: 33.592.510/0167-43 | D1183: 569.25999999999999 | E1183: 0 | F1183: 0 | G1183: 0 | H1183: 0 | I1183: 0 | J1183: 0 | K1183: 629.26999999999998 | L1183: 0 | M1183: =SUM(J1183:L1183)-60.01 -> 569.25999999999999 | N1183: 60.009999999999998 | O1183: =SUM(M1183:N1183) -> 629.26999999999998
A1184: 4296 | B1184: UFV AC IV | C1184: 33.592.510/0167-43 | D1184: 593.03999999999996 | E1184: 0 | F1184: 0 | G1184: 0 | H1184: 0 | I1184: 0 | J1184: 0 | K1184: 655.54999999999995 | L1184: 0 | M1184: =SUM(J1184:L1184)-62.51 -> 593.03999999999996 | N1184: 62.509999999999998 | O1184: =SUM(M1184:N1184) -> 655.54999999999995
A1185: 4297 | B1185: UFV AC IX | C1185: 33.592.510/0167-43 | D1185: 347.63 | E1185: 0 | F1185: 0 | G1185: 0 | H1185: 0 | I1185: 0 | J1185: 0 | K1185: 384.26999999999998 | L1185: 0 | M1185: =SUM(J1185:L1185)-36.64 -> 347.63 | N1185: 36.640000000000001 | O1185: =SUM(M1185:N1185) -> 384.26999999999998
A1186: 4298 | B1186: UFV AC V | C1186: 33.592.510/0167-43 | D1186: 593.03999999999996 | E1186: 0 | F1186: 0 | G1186: 0 | H1186: 0 | I1186: 0 | J1186: 0 | K1186: 655.54999999999995 | L1186: 0 | M1186: =SUM(J1186:L1186)-62.51 -> 593.03999999999996 | N1186: 62.509999999999998 | O1186: =SUM(M1186:N1186) -> 655.54999999999995
A1187: 4299 | B1187: UFV AC VI | C1187: 33.592.510/0167-43 | D1187: 593.03999999999996 | E1187: 0 | F1187: 0 | G1187: 0 | H1187: 0 | I1187: 0 | J1187: 0 | K1187: 655.54999999999995 | L1187: 0 | M1187: =SUM(J1187:L1187)-62.51 -> 593.03999999999996 | N1187: 62.509999999999998 | O1187: =SUM(M1187:N1187) -> 655.54999999999995
A1188: 4300 | B1188: UFV AC VII | C1188: 33.592.510/0167-43 | D1188: 463.50999999999999 | E1188: 0 | F1188: 0 | G1188: 0 | H1188: 0 | I1188: 0 | J1188: 0 | K1188: 512.37 | L1188: 0 | M1188: =SUM(J1188:L1188)-48.86 -> 463.50999999999999 | N1188: 48.859999999999999 | O1188: =SUM(M1188:N1188) -> 512.37
A1189: 4301 | B1189: UFV AC VIII | C1189: 33.592.510/0167-43 | D1189: 463.50999999999999 | E1189: 0 | F1189: 0 | G1189: 0 | H1189: 0 | I1189: 0 | J1189: 0 | K1189: 512.37 | L1189: 0 | M1189: =SUM(J1189:L1189)-48.86 -> 463.50999999999999 | N1189: 48.859999999999999 | O1189: =SUM(M1189:N1189) -> 512.37
A1190: 4302 | B1190: UFV AC X | C1190: 33.592.510/0167-43 | D1190: 463.50999999999999 | E1190: 0 | F1190: 0 | G1190: 0 | H1190: 0 | I1190: 0 | J1190: 0 | K1190: 512.37 | L1190: 0 | M1190: =SUM(J1190:L1190)-48.86 -> 463.50999999999999 | N1190: 48.859999999999999 | O1190: =SUM(M1190:N1190) -> 512.37
A1191: 4303 | B1191: UFV AC XIX | C1191: 33.592.510/0167-43 | D1191: 569.25999999999999 | E1191: 0 | F1191: 0 | G1191: 0 | H1191: 0 | I1191: 0 | J1191: 0 | K1191: 629.26999999999998 | L1191: 0 | M1191: =SUM(J1191:L1191)-60.01 -> 569.25999999999999 | N1191: 60.009999999999998 | O1191: =SUM(M1191:N1191) -> 629.26999999999998
A1192: 4304 | B1192: UFV AC XV | C1192: 33.592.510/0167-43 | D1192: 741.29999999999995 | E1192: 0 | F1192: 0 | G1192: 0 | H1192: 0 | I1192: 0 | J1192: 0 | K1192: 819.44000000000005 | L1192: 0 | M1192: =SUM(J1192:L1192)-78.14 -> 741.30000000000007 | N1192: 78.140000000000001 | O1192: =SUM(M1192:N1192) -> 819.44000000000005
A1193: 4305 | B1193: UFV AC XVI | C1193: 33.592.510/0167-43 | D1193: 593.03999999999996 | E1193: 0 | F1193: 0 | G1193: 0 | H1193: 0 | I1193: 0 | J1193: 0 | K1193: 655.54999999999995 | L1193: 0 | M1193: =SUM(J1193:L1193)-62.51 -> 593.03999999999996 | N1193: 62.509999999999998 | O1193: =SUM(M1193:N1193) -> 655.54999999999995
A1194: 4306 | B1194: UFV AC XVII | C1194: 33.592.510/0167-43 | D1194: 741.29999999999995 | E1194: 0 | F1194: 0 | G1194: 0 | H1194: 0 | I1194: 0 | J1194: 0 | K1194: 819.44000000000005 | L1194: 0 | M1194: =SUM(J1194:L1194)-78.14 -> 741.30000000000007 | N1194: 78.140000000000001 | O1194: =SUM(M1194:N1194) -> 819.44000000000005
A1195: 4307 | B1195: UFV AC XVIII | C1195: 33.592.510/0167-43 | D1195: 593.03999999999996 | E1195: 0 | F1195: 0 | G1195: 0 | H1195: 0 | I1195: 0 | J1195: 0 | K1195: 655.54999999999995 | L1195: 0 | M1195: =SUM(J1195:L1195)-62.51 -> 593.03999999999996 | N1195: 62.509999999999998 | O1195: =SUM(M1195:N1195) -> 655.54999999999995
A1196: 4308 | B1196: UFV AC XX | C1196: 33.592.510/0167-43 | D1196: 569.25999999999999 | E1196: 0 | F1196: 0 | G1196: 0 | H1196: 0 | I1196: 0 | J1196: 0 | K1196: 629.26999999999998 | L1196: 0 | M1196: =SUM(J1196:L1196)-60.01 -> 569.25999999999999 | N1196: 60.009999999999998 | O1196: =SUM(M1196:N1196) -> 629.26999999999998
A1197: 4309 | B1197: UFV AC XXI | C1197: 33.592.510/0167-43 | D1197: 593.03999999999996 | E1197: 0 | F1197: 0 | G1197: 0 | H1197: 0 | I1197: 0 | J1197: 0 | K1197: 655.54999999999995 | L1197: 0 | M1197: =SUM(J1197:L1197)-62.51 -> 593.03999999999996 | N1197: 62.509999999999998 | O1197: =SUM(M1197:N1197) -> 655.54999999999995
A1198: 4310 | B1198: UFV AC XXII | C1198: 33.592.510/0167-43 | D1198: 593.03999999999996 | E1198: 0 | F1198: 0 | G1198: 0 | H1198: 0 | I1198: 0 | J1198: 0 | K1198: 655.54999999999995 | L1198: 0 | M1198: =SUM(J1198:L1198)-62.51 -> 593.03999999999996 | N1198: 62.509999999999998 | O1198: =SUM(M1198:N1198) -> 655.54999999999995
A1199: 4311 | B1199: UFV AC XXIII | C1199: 33.592.510/0167-43 | D1199: 593.03999999999996 | E1199: 0 | F1199: 0 | G1199: 0 | H1199: 0 | I1199: 0 | J1199: 0 | K1199: 655.54999999999995 | L1199: 0 | M1199: =SUM(J1199:L1199)-62.51 -> 593.03999999999996 | N1199: 62.509999999999998 | O1199: =SUM(M1199:N1199) -> 655.54999999999995
A1200: 4312 | B1200: EOL SERRA DO SERIDÓ VI | C1200: 35.882.365/0001-71 | D1200: 438.56999999999999 | E1200: 0 | F1200: 0 | G1200: 0 | H1200: 0 | I1200: 0 | J1200: 0 | K1200: 484.80000000000001 | L1200: 0 | M1200: =SUM(J1200:L1200)-46.23 -> 438.56999999999999 | N1200: 46.229999999999997 | O1200: =SUM(M1200:N1200) -> 484.80000000000001
A1201: 4313 | B1201: EOL BREJINHOS A | C1201: 33.485.728/0001-00 | D1201: 433.20999999999998 | E1201: 0 | F1201: 0 | G1201: 0 | H1201: 0 | I1201: 0 | J1201: 0 | K1201: 478.88 | L1201: 0 | M1201: =SUM(J1201:L1201)-45.67 -> 433.20999999999998 | N1201: 45.670000000000002 | O1201: =SUM(M1201:N1201) -> 478.88
A1202: 4314 | B1202: EOL BREJINHOS B | C1202: 33.485.874/0001-35 | D1202: 481.39999999999998 | E1202: 0 | F1202: 0 | G1202: 0 | H1202: 0 | I1202: 0 | J1202: 0 | K1202: 532.14999999999998 | L1202: 0 | M1202: =SUM(J1202:L1202)-50.75 -> 481.39999999999998 | N1202: 50.75 | O1202: =SUM(M1202:N1202) -> 532.14999999999998
A1203: 4315 | B1203: EOL CAETITE E | C1203: 33.471.379/0001-77 | D1203: 433.20999999999998 | E1203: 0 | F1203: 0 | G1203: 0 | H1203: 0 | I1203: 0 | J1203: 0 | K1203: 478.88 | L1203: 0 | M1203: =SUM(J1203:L1203)-45.67 -> 433.20999999999998 | N1203: 45.670000000000002 | O1203: =SUM(M1203:N1203) -> 478.88
A1204: 4316 | B1204: EOL CAETITE F | C1204: 33.468.809/0001-00 | D1204: 288.88999999999999 | E1204: 0 | F1204: 0 | G1204: 0 | H1204: 0 | I1204: 0 | J1204: 0 | K1204: 319.33999999999997 | L1204: 0 | M1204: =SUM(J1204:L1204)-30.45 -> 288.88999999999999 | N1204: 30.449999999999999 | O1204: =SUM(M1204:N1204) -> 319.33999999999997
A1205: 4317 | B1205: EOL ASSURUÁ 4 IV | C1205: 38.050.924/0002-56 | D1205: 422.17000000000002 | E1205: 0 | F1205: 0 | G1205: 0 | H1205: 0 | I1205: 0 | J1205: 0 | K1205: 466.67000000000002 | L1205: 0 | M1205: =SUM(J1205:L1205)-44.5 -> 422.17000000000002 | N1205: 44.5 | O1205: =SUM(M1205:N1205) -> 466.67000000000002
A1206: 4318 | B1206: EOL ASSURUÁ 4 V | C1206: 38.049.586/0002-32 | D1206: 422.17000000000002 | E1206: 0 | F1206: 0 | G1206: 0 | H1206: 0 | I1206: 0 | J1206: 0 | K1206: 466.67000000000002 | L1206: 0 | M1206: =SUM(J1206:L1206)-44.5 -> 422.17000000000002 | N1206: 44.5 | O1206: =SUM(M1206:N1206) -> 466.67000000000002
A1207: 4319 | B1207: EOL ANEMUS WIND 3 | C1207: 38.350.307/0001-95 | D1207: 617.96000000000004 | E1207: 0 | F1207: 0 | G1207: 0 | H1207: 0 | I1207: 0 | J1207: 0 | K1207: 683.10000000000002 | L1207: 0 | M1207: =SUM(J1207:L1207)-65.14 -> 617.96000000000004 | N1207: 65.140000000000001 | O1207: =SUM(M1207:N1207) -> 683.10000000000002
A1208: 4324 | B1208: UTE MARLIM AZUL | C1208: 29.884.534/0002-90 | D1208: 14593.84 | E1208: 0 | F1208: 0 | G1208: 0 | H1208: 0 | I1208: 0 | J1208: 0 | K1208: 16132.219999999999 | L1208: 0 | M1208: =SUM(J1208:L1208)-1538.38 -> 14593.84 | N1208: 1538.3800000000001 | O1208: =SUM(M1208:N1208) -> 16132.220000000001
A1209: 4325 | B1209: EOL OITIS 10 | C1209: 34.211.456/0002-01 | D1209: 590.51999999999998 | E1209: 0 | F1209: 0 | G1209: 0 | H1209: 0 | I1209: 0 | J1209: 0 | K1209: 652.76999999999998 | L1209: 0 | M1209: =SUM(J1209:L1209)-62.25 -> 590.51999999999998 | N1209: 62.25 | O1209: =SUM(M1209:N1209) -> 652.76999999999998
A1210: 4326 | B1210: EOL SERRA DO SERIDÓ IX | C1210: 35.831.535/0001-99 | D1210: 493.5 | E1210: 0 | F1210: 0 | G1210: 0 | H1210: 0 | I1210: 0 | J1210: 0 | K1210: 545.51999999999998 | L1210: 0 | M1210: =SUM(J1210:L1210)-52.02 -> 493.5 | N1210: 52.020000000000003 | O1210: =SUM(M1210:N1210) -> 545.51999999999998
A1211: 4327 | B1211: EOL VENTOS DE SANTA EUGÊNIA 10 | C1211: 35.654.189/0002-00 | D1211: 514.85000000000002 | E1211: 0 | F1211: 0 | G1211: 0 | H1211: 0 | I1211: 0 | J1211: 0 | K1211: 569.12 | L1211: 0 | M1211: =SUM(J1211:L1211)-54.27 -> 514.85000000000002 | N1211: 54.270000000000003 | O1211: =SUM(M1211:N1211) -> 569.12
A1212: 4328 | B1212: EOL VENTOS DE SÃO VITOR 08 | C1212: 35.403.030/0001-23 | D1212: 378.80000000000001 | E1212: 0 | F1212: 0 | G1212: 0 | H1212: 0 | I1212: 0 | J1212: 0 | K1212: 418.73000000000002 | L1212: 0 | M1212: =SUM(J1212:L1212)-39.93 -> 378.80000000000001 | N1212: 39.93 | O1212: =SUM(M1212:N1212) -> 418.73000000000002
A1213: 4329 | B1213: EOL VENTOS DE SANTA LEIA 01 | C1213: 35.865.635/0002-17 | D1213: 152.58000000000001 | E1213: 0 | F1213: 0 | G1213: 0 | H1213: 0 | I1213: 0 | J1213: 0 | K1213: 168.66 | L1213: 0 | M1213: =SUM(J1213:L1213)-16.08 -> 152.57999999999998 | N1213: 16.079999999999998 | O1213: =SUM(M1213:N1213) -> 168.65999999999997
A1214: 4330 | B1214: EOL VENTOS DE SANTA LEIA 02 | C1214: 35.865.640/0002-20 | D1214: 152.58000000000001 | E1214: 0 | F1214: 0 | G1214: 0 | H1214: 0 | I1214: 0 | J1214: 0 | K1214: 168.66 | L1214: 0 | M1214: =SUM(J1214:L1214)-16.08 -> 152.57999999999998 | N1214: 16.079999999999998 | O1214: =SUM(M1214:N1214) -> 168.65999999999997
A1215: 4331 | B1215: EOL VENTOS DE SANTA LEIA 03 | C1215: 35.865.651/0002-00 | D1215: 152.58000000000001 | E1215: 0 | F1215: 0 | G1215: 0 | H1215: 0 | I1215: 0 | J1215: 0 | K1215: 168.66 | L1215: 0 | M1215: =SUM(J1215:L1215)-16.08 -> 152.57999999999998 | N1215: 16.079999999999998 | O1215: =SUM(M1215:N1215) -> 168.65999999999997
A1216: 4332 | B1216: EOL VENTOS DE SANTA LEIA 04 | C1216: 35.874.343/0002-40 | D1216: 151.68000000000001 | E1216: 0 | F1216: 0 | G1216: 0 | H1216: 0 | I1216: 0 | J1216: 0 | K1216: 167.66999999999999 | L1216: 0 | M1216: =SUM(J1216:L1216)-15.99 -> 151.67999999999998 | N1216: 15.99 | O1216: =SUM(M1216:N1216) -> 167.66999999999999
A1217: 4333 | B1217: EOL VENTOS DE SANTA LEIA 05 | C1217: 35.989.467/0002-71 | D1217: 152.58000000000001 | E1217: 0 | F1217: 0 | G1217: 0 | H1217: 0 | I1217: 0 | J1217: 0 | K1217: 168.66 | L1217: 0 | M1217: =SUM(J1217:L1217)-16.08 -> 152.57999999999998 | N1217: 16.079999999999998 | O1217: =SUM(M1217:N1217) -> 168.65999999999997
A1218: 4334 | B1218: EOL VENTOS DE SANTA LEIA 12 | C1218: 35.859.036/0002-90 | D1218: 146.69999999999999 | E1218: 0 | F1218: 0 | G1218: 0 | H1218: 0 | I1218: 0 | J1218: 0 | K1218: 162.16 | L1218: 0 | M1218: =SUM(J1218:L1218)-15.46 -> 146.69999999999999 | N1218: 15.460000000000001 | O1218: =SUM(M1218:N1218) -> 162.16
A1219: 4335 | B1219: EOL VENTOS DE SANTA LEIA 13 | C1219: 35.896.824/0002-57 | D1219: 149.41999999999999 | E1219: 0 | F1219: 0 | G1219: 0 | H1219: 0 | I1219: 0 | J1219: 0 | K1219: 165.16999999999999 | L1219: 0 | M1219: =SUM(J1219:L1219)-15.75 -> 149.41999999999999 | N1219: 15.75 | O1219: =SUM(M1219:N1219) -> 165.16999999999999
A1220: 4336 | B1220: EOL VENTOS DE SANTA LEIA 14 | C1220: 35.865.649/0002-30 | D1220: 149.41999999999999 | E1220: 0 | F1220: 0 | G1220: 0 | H1220: 0 | I1220: 0 | J1220: 0 | K1220: 165.16999999999999 | L1220: 0 | M1220: =SUM(J1220:L1220)-15.75 -> 149.41999999999999 | N1220: 15.75 | O1220: =SUM(M1220:N1220) -> 165.16999999999999
A1221: 4337 | B1221: EOL SANTO AGOSTINHO 14 | C1221: 20.666.572/0002-00 | D1221: 71.689999999999998 | E1221: 0 | F1221: 0 | G1221: 0 | H1221: 0 | I1221: 0 | J1221: 0 | K1221: 79.25 | L1221: 0 | M1221: =SUM(J1221:L1221)-7.56 -> 71.689999999999998 | N1221: 7.5599999999999996 | O1221: =SUM(M1221:N1221) -> 79.25
A1222: 4338 | B1222: EOL SANTO AGOSTINHO 25 | C1222: 23.079.920/0002-23 | D1222: 286.76999999999998 | E1222: 0 | F1222: 0 | G1222: 0 | H1222: 0 | I1222: 0 | J1222: 0 | K1222: 317 | L1222: 0 | M1222: =SUM(J1222:L1222)-30.23 -> 286.76999999999998 | N1222: 30.23 | O1222: =SUM(M1222:N1222) -> 317
A1223: 4339 | B1223: UFV SERRA DO MATO III | C1223: 36.205.095/0001-27 | D1223: 530.27999999999997 | E1223: 0 | F1223: 0 | G1223: 0 | H1223: 0 | I1223: 0 | J1223: 0 | K1223: 586.17999999999995 | L1223: 0 | M1223: =SUM(J1223:L1223)-55.9 -> 530.27999999999997 | N1223: 55.899999999999999 | O1223: =SUM(M1223:N1223) -> 586.17999999999995
A1224: 4340 | B1224: UFV SERRA DO MATO IV | C1224: 36.159.672/0001-91 | D1224: 607.60000000000002 | E1224: 0 | F1224: 0 | G1224: 0 | H1224: 0 | I1224: 0 | J1224: 0 | K1224: 671.64999999999998 | L1224: 0 | M1224: =SUM(J1224:L1224)-64.05 -> 607.60000000000002 | N1224: 64.049999999999997 | O1224: =SUM(M1224:N1224) -> 671.64999999999998
A1225: 4341 | B1225: UFV PITOMBEIRA | C1225: 19.382.073/0001-13 | D1225: 534.84000000000003 | E1225: 0 | F1225: 0 | G1225: 0 | H1225: 0 | I1225: 0 | J1225: 0 | K1225: 591.22000000000003 | L1225: 0 | M1225: =SUM(J1225:L1225)-56.38 -> 534.84000000000003 | N1225: 56.380000000000003 | O1225: =SUM(M1225:N1225) -> 591.22000000000003
A1226: 4342 | B1226: EOL SANTO AGOSTINHO 17 | C1226: 20.666.636/0002-65 | D1226: 501.83999999999997 | E1226: 0 | F1226: 0 | G1226: 0 | H1226: 0 | I1226: 0 | J1226: 0 | K1226: 554.74000000000001 | L1226: 0 | M1226: =SUM(J1226:L1226)-52.9 -> 501.84000000000003 | N1226: 52.899999999999999 | O1226: =SUM(M1226:N1226) -> 554.74000000000001
A1227: 4343 | B1227: EOL VENTOS DE SANTA EUGÊNIA 06 | C1227: 35.636.424/0002-02 | D1227: 383.82999999999998 | E1227: 0 | F1227: 0 | G1227: 0 | H1227: 0 | I1227: 0 | J1227: 0 | K1227: 424.29000000000002 | L1227: 0 | M1227: =SUM(J1227:L1227)-40.46 -> 383.83000000000004 | N1227: 40.460000000000001 | O1227: =SUM(M1227:N1227) -> 424.29000000000002
A1228: 4344 | B1228: EOL VENTOS DE SANTA EUGÊNIA 09 | C1228: 35.636.427/0002-46 | D1228: 447.73000000000002 | E1228: 0 | F1228: 0 | G1228: 0 | H1228: 0 | I1228: 0 | J1228: 0 | K1228: 494.93000000000001 | L1228: 0 | M1228: =SUM(J1228:L1228)-47.2 -> 447.73000000000002 | N1228: 47.200000000000003 | O1228: =SUM(M1228:N1228) -> 494.93000000000001
A1229: 4345 | B1229: UFV CIRANDA 1 | C1229: 35.912.298/0001-90 | D1229: 572.61000000000001 | E1229: 0 | F1229: 0 | G1229: 0 | H1229: 0 | I1229: 0 | J1229: 0 | K1229: 632.97000000000003 | L1229: 0 | M1229: =SUM(J1229:L1229)-60.36 -> 572.61000000000001 | N1229: 60.359999999999999 | O1229: =SUM(M1229:N1229) -> 632.97000000000003
A1230: 4346 | B1230: UFV CIRANDA 2 | C1230: 35.911.733/0001-62 | D1230: 572.61000000000001 | E1230: 0 | F1230: 0 | G1230: 0 | H1230: 0 | I1230: 0 | J1230: 0 | K1230: 632.97000000000003 | L1230: 0 | M1230: =SUM(J1230:L1230)-60.36 -> 572.61000000000001 | N1230: 60.359999999999999 | O1230: =SUM(M1230:N1230) -> 632.97000000000003
A1231: 4347 | B1231: UFV CIRANDA 3 | C1231: 35.911.730/0001-29 | D1231: 572.61000000000001 | E1231: 0 | F1231: 0 | G1231: 0 | H1231: 0 | I1231: 0 | J1231: 0 | K1231: 632.97000000000003 | L1231: 0 | M1231: =SUM(J1231:L1231)-60.36 -> 572.61000000000001 | N1231: 60.359999999999999 | O1231: =SUM(M1231:N1231) -> 632.97000000000003
A1232: 4348 | B1232: UFV JANAUBA 15 | C1232: 37.380.978/0001-36 | D1232: 602.62 | E1232: 0 | F1232: 0 | G1232: 0 | H1232: 0 | I1232: 0 | J1232: 0 | K1232: 666.13999999999999 | L1232: 0 | M1232: =SUM(J1232:L1232)-63.52 -> 602.62 | N1232: 63.520000000000003 | O1232: =SUM(M1232:N1232) -> 666.13999999999999
A1233: 4349 | B1233: EOL SERRA DO SERIDO VII | C1233: 35.831.892/0001-57 | D1233: 438.67000000000002 | E1233: 0 | F1233: 0 | G1233: 0 | H1233: 0 | I1233: 0 | J1233: 0 | K1233: 484.91000000000003 | L1233: 0 | M1233: =SUM(J1233:L1233)-46.24 -> 438.67000000000002 | N1233: 46.240000000000002 | O1233: =SUM(M1233:N1233) -> 484.91000000000003
A1234: 4350 | B1234: UFV JANAUBA 16 | C1234: 37.381.026/0001-37 | D1234: 602.62 | E1234: 0 | F1234: 0 | G1234: 0 | H1234: 0 | I1234: 0 | J1234: 0 | K1234: 666.13999999999999 | L1234: 0 | M1234: =SUM(J1234:L1234)-63.52 -> 602.62 | N1234: 63.520000000000003 | O1234: =SUM(M1234:N1234) -> 666.13999999999999
A1235: 4351 | B1235: FURNAS-G | C1235: 23.274.194/0001-19 | D1235: 139429.60999999999 | E1235: 0 | F1235: 0 | G1235: 0 | H1235: 0 | I1235: 0 | J1235: 0 | K1235: 154127.32000000001 | L1235: 0 | M1235: =SUM(J1235:L1235)-14697.71 -> 139429.61000000002 | N1235: 14697.709999999999 | O1235: =SUM(M1235:N1235) -> 154127.32000000001
A1236: 4352 | B1236: UFV JANAUBA 17 | C1236: 37.381.244/0001-71 | D1236: 602.62 | E1236: 0 | F1236: 0 | G1236: 0 | H1236: 0 | I1236: 0 | J1236: 0 | K1236: 666.13999999999999 | L1236: 0 | M1236: =SUM(J1236:L1236)-63.52 -> 602.62 | N1236: 63.520000000000003 | O1236: =SUM(M1236:N1236) -> 666.13999999999999
A1237: 4353 | B1237: UHE SERRA DA MESA | C1237: 23.274.194/0001-19 | D1237: 24865.830000000002 | E1237: 0 | F1237: 0 | G1237: 0 | H1237: 0 | I1237: 0 | J1237: 0 | K1237: 27487.009999999998 | L1237: 0 | M1237: =SUM(J1237:L1237)-2621.18 -> 24865.829999999998 | N1237: 2621.1799999999998 | O1237: =SUM(M1237:N1237) -> 27487.009999999998
A1238: 4354 | B1238: UFV JANAUBA 18 | C1238: 37.404.973/0001-04 | D1238: 602.62 | E1238: 0 | F1238: 0 | G1238: 0 | H1238: 0 | I1238: 0 | J1238: 0 | K1238: 666.13999999999999 | L1238: 0 | M1238: =SUM(J1238:L1238)-63.52 -> 602.62 | N1238: 63.520000000000003 | O1238: =SUM(M1238:N1238) -> 666.13999999999999
A1239: 4355 | B1239: UFV JANAUBA 19 | C1239: 37.405.468/0001-76 | D1239: 602.62 | E1239: 0 | F1239: 0 | G1239: 0 | H1239: 0 | I1239: 0 | J1239: 0 | K1239: 666.13999999999999 | L1239: 0 | M1239: =SUM(J1239:L1239)-63.52 -> 602.62 | N1239: 63.520000000000003 | O1239: =SUM(M1239:N1239) -> 666.13999999999999
A1240: 4356 | B1240: UFV JANAUBA 20 | C1240: 37.381.136/0001-07 | D1240: 602.62 | E1240: 0 | F1240: 0 | G1240: 0 | H1240: 0 | I1240: 0 | J1240: 0 | K1240: 666.13999999999999 | L1240: 0 | M1240: =SUM(J1240:L1240)-63.52 -> 602.62 | N1240: 63.520000000000003 | O1240: =SUM(M1240:N1240) -> 666.13999999999999
A1241: 4357 | B1241: EOL SERRA DO SERIDO III | C1241: 35.835.835/0001-46 | D1241: 438.67000000000002 | E1241: 0 | F1241: 0 | G1241: 0 | H1241: 0 | I1241: 0 | J1241: 0 | K1241: 484.91000000000003 | L1241: 0 | M1241: =SUM(J1241:L1241)-46.24 -> 438.67000000000002 | N1241: 46.240000000000002 | O1241: =SUM(M1241:N1241) -> 484.91000000000003
A1242: 4358 | B1242: EOL VENTOS DE SAO ROQUE 05 | C1242: 36.051.519/0001-46 | D1242: 519.34000000000003 | E1242: 0 | F1242: 0 | G1242: 0 | H1242: 0 | I1242: 0 | J1242: 0 | K1242: 574.09000000000003 | L1242: 0 | M1242: =SUM(J1242:L1242)-54.75 -> 519.34000000000003 | N1242: 54.75 | O1242: =SUM(M1242:N1242) -> 574.09000000000003
A1243: 4359 | B1243: EOL VENTOS DE SAO ROQUE 03 | C1243: 36.051.515/0001-68 | D1243: 519.34000000000003 | E1243: 0 | F1243: 0 | G1243: 0 | H1243: 0 | I1243: 0 | J1243: 0 | K1243: 574.09000000000003 | L1243: 0 | M1243: =SUM(J1243:L1243)-54.75 -> 519.34000000000003 | N1243: 54.75 | O1243: =SUM(M1243:N1243) -> 574.09000000000003
A1244: 4360 | B1244: EOL VENTOS DE SAO VITOR 12 | C1244: 35.436.200/0001-76 | D1244: 378.80000000000001 | E1244: 0 | F1244: 0 | G1244: 0 | H1244: 0 | I1244: 0 | J1244: 0 | K1244: 418.73000000000002 | L1244: 0 | M1244: =SUM(J1244:L1244)-39.93 -> 378.80000000000001 | N1244: 39.93 | O1244: =SUM(M1244:N1244) -> 418.73000000000002
A1245: 4361 | B1245: EOL VENTOS DE SAO VITOR 13 | C1245: 35.436.176/0001-75 | D1245: 372.24000000000001 | E1245: 0 | F1245: 0 | G1245: 0 | H1245: 0 | I1245: 0 | J1245: 0 | K1245: 411.48000000000002 | L1245: 0 | M1245: =SUM(J1245:L1245)-39.24 -> 372.24000000000001 | N1245: 39.240000000000002 | O1245: =SUM(M1245:N1245) -> 411.48000000000002
A1246: 4362 | B1246: EOL VENTOS DE SAO VITOR 14 | C1246: 35.477.384/0001-12 | D1246: 446.69 | E1246: 0 | F1246: 0 | G1246: 0 | H1246: 0 | I1246: 0 | J1246: 0 | K1246: 493.77999999999997 | L1246: 0 | M1246: =SUM(J1246:L1246)-47.09 -> 446.68999999999994 | N1246: 47.090000000000003 | O1246: =SUM(M1246:N1246) -> 493.77999999999997
A1247: 4363 | B1247: EOL ASSURUÁ 5 III | C1247: 35.497.092/0002-22 | D1247: 480.63 | E1247: 0 | F1247: 0 | G1247: 0 | H1247: 0 | I1247: 0 | J1247: 0 | K1247: 531.28999999999996 | L1247: 0 | M1247: =SUM(J1247:L1247)-50.66 -> 480.63 | N1247: 50.659999999999997 | O1247: =SUM(M1247:N1247) -> 531.28999999999996
A1248: 4364 | B1248: EOL ASSURUÁ 5 V | C1248: 42.929.707/0002-08 | D1248: 408.06 | E1248: 0 | F1248: 0 | G1248: 0 | H1248: 0 | I1248: 0 | J1248: 0 | K1248: 451.06999999999999 | L1248: 0 | M1248: =SUM(J1248:L1248)-43.01 -> 408.06 | N1248: 43.009999999999998 | O1248: =SUM(M1248:N1248) -> 451.06999999999999
A1249: 4365 | B1249: EOL AURA TANQUE NOVO 01 | C1249: 35.718.914/0002-58 | D1249: 293.27999999999997 | E1249: 0 | F1249: 0 | G1249: 0 | H1249: 0 | I1249: 0 | J1249: 0 | K1249: 324.19999999999999 | L1249: 0 | M1249: =SUM(J1249:L1249)-30.92 -> 293.27999999999997 | N1249: 30.920000000000002 | O1249: =SUM(M1249:N1249) -> 324.19999999999999
A1250: 4366 | B1250: EOL AURA TANQUE NOVO 02 | C1250: 35.655.215/0002-06 | D1250: 195.52000000000001 | E1250: 0 | F1250: 0 | G1250: 0 | H1250: 0 | I1250: 0 | J1250: 0 | K1250: 216.13 | L1250: 0 | M1250: =SUM(J1250:L1250)-20.61 -> 195.51999999999998 | N1250: 20.609999999999999 | O1250: =SUM(M1250:N1250) -> 216.13
A1251: 4367 | B1251: UFV SANTA LUZIA 1 | C1251: 40.585.991/0001-36 | D1251: 529.51999999999998 | E1251: 0 | F1251: 0 | G1251: 0 | H1251: 0 | I1251: 0 | J1251: 0 | K1251: 585.34000000000003 | L1251: 0 | M1251: =SUM(J1251:L1251)-55.82 -> 529.51999999999998 | N1251: 55.82 | O1251: =SUM(M1251:N1251) -> 585.34000000000003
A1252: 4368 | B1252: UFV SANTA LUZIA 2 | C1252: 40.586.002/0001-29 | D1252: 529.51999999999998 | E1252: 0 | F1252: 0 | G1252: 0 | H1252: 0 | I1252: 0 | J1252: 0 | K1252: 585.34000000000003 | L1252: 0 | M1252: =SUM(J1252:L1252)-55.82 -> 529.51999999999998 | N1252: 55.82 | O1252: =SUM(M1252:N1252) -> 585.34000000000003
A1253: 4369 | B1253: UFV SANTA LUZIA 3 | C1253: 40.586.027/0001-22 | D1253: 529.51999999999998 | E1253: 0 | F1253: 0 | G1253: 0 | H1253: 0 | I1253: 0 | J1253: 0 | K1253: 585.34000000000003 | L1253: 0 | M1253: =SUM(J1253:L1253)-55.82 -> 529.51999999999998 | N1253: 55.82 | O1253: =SUM(M1253:N1253) -> 585.34000000000003
A1254: 4370 | B1254: UFV SANTA LUZIA 4 | C1254: 40.586.043/0001-15 | D1254: 529.51999999999998 | E1254: 0 | F1254: 0 | G1254: 0 | H1254: 0 | I1254: 0 | J1254: 0 | K1254: 585.34000000000003 | L1254: 0 | M1254: =SUM(J1254:L1254)-55.82 -> 529.51999999999998 | N1254: 55.82 | O1254: =SUM(M1254:N1254) -> 585.34000000000003
A1255: 4371 | B1255: UFV SANTA LUZIA 5 | C1255: 40.790.472/0001-00 | D1255: 394.38 | E1255: 0 | F1255: 0 | G1255: 0 | H1255: 0 | I1255: 0 | J1255: 0 | K1255: 435.94999999999999 | L1255: 0 | M1255: =SUM(J1255:L1255)-41.57 -> 394.38 | N1255: 41.57 | O1255: =SUM(M1255:N1255) -> 435.94999999999999
A1256: 4372 | B1256: UFV SANTA LUZIA 6 | C1256: 40.586.566/0001-61 | D1256: 529.51999999999998 | E1256: 0 | F1256: 0 | G1256: 0 | H1256: 0 | I1256: 0 | J1256: 0 | K1256: 585.34000000000003 | L1256: 0 | M1256: =SUM(J1256:L1256)-55.82 -> 529.51999999999998 | N1256: 55.82 | O1256: =SUM(M1256:N1256) -> 585.34000000000003
A1257: 4373 | B1257: UFV SANTA LUZIA 7 | C1257: 40.586.619/0001-44 | D1257: 394.38 | E1257: 0 | F1257: 0 | G1257: 0 | H1257: 0 | I1257: 0 | J1257: 0 | K1257: 435.94999999999999 | L1257: 0 | M1257: =SUM(J1257:L1257)-41.57 -> 394.38 | N1257: 41.57 | O1257: =SUM(M1257:N1257) -> 435.94999999999999
A1258: 4374 | B1258: UTE PROSPERIDADE II | C1258: 23.857.764/0001-01 | D1258: 565.87 | E1258: 0 | F1258: 0 | G1258: 0 | H1258: 0 | I1258: 0 | J1258: 0 | K1258: 625.51999999999998 | L1258: 0 | M1258: =SUM(J1258:L1258)-59.65 -> 565.87 | N1258: 59.649999999999999 | O1258: =SUM(M1258:N1258) -> 625.51999999999998
A1259: 4375 | B1259: UTE PROSPERIDADE III | C1259: 23.857.764/0001-01 | D1259: 678.27999999999997 | E1259: 0 | F1259: 0 | G1259: 0 | H1259: 0 | I1259: 0 | J1259: 0 | K1259: 749.77999999999997 | L1259: 0 | M1259: =SUM(J1259:L1259)-71.5 -> 678.27999999999997 | N1259: 71.5 | O1259: =SUM(M1259:N1259) -> 749.77999999999997
A1260: 4376 | B1260: EOL SANTO AGOSTINHO 27 | C1260: 23.193.334/0002-05 | D1260: 430.14999999999998 | E1260: 0 | F1260: 0 | G1260: 0 | H1260: 0 | I1260: 0 | J1260: 0 | K1260: 475.49000000000001 | L1260: 0 | M1260: =SUM(J1260:L1260)-45.34 -> 430.14999999999998 | N1260: 45.340000000000003 | O1260: =SUM(M1260:N1260) -> 475.49000000000001
A1261: 4377 | B1261: EOL VENTOS DE SANTA EUGÊNIA 14 | C1261: 35.636.427/0002-46 | D1261: 257.54000000000002 | E1261: 0 | F1261: 0 | G1261: 0 | H1261: 0 | I1261: 0 | J1261: 0 | K1261: 284.69 | L1261: 0 | M1261: =SUM(J1261:L1261)-27.15 -> 257.54000000000002 | N1261: 27.149999999999999 | O1261: =SUM(M1261:N1261) -> 284.69
A1262: 4378 | B1262: EOL VENTOS DE SANTA LUZIA 01 | C1262: 41.489.453/0001-00 | D1262: 516.46000000000004 | E1262: 0 | F1262: 0 | G1262: 0 | H1262: 0 | I1262: 0 | J1262: 0 | K1262: 570.89999999999998 | L1262: 0 | M1262: =SUM(J1262:L1262)-54.44 -> 516.46000000000004 | N1262: 54.439999999999998 | O1262: =SUM(M1262:N1262) -> 570.90000000000009
A1263: 4379 | B1263: EOL VENTOS DE SAO ROQUE 06 | C1263: 36.677.071/0001-70 | D1263: 519.34000000000003 | E1263: 0 | F1263: 0 | G1263: 0 | H1263: 0 | I1263: 0 | J1263: 0 | K1263: 574.09000000000003 | L1263: 0 | M1263: =SUM(J1263:L1263)-54.75 -> 519.34000000000003 | N1263: 54.75 | O1263: =SUM(M1263:N1263) -> 574.09000000000003
A1264: 4380 | B1264: EOL VENTOS DE SAO ROQUE 07 | C1264: 36.051.524/0001-59 | D1264: 519.34000000000003 | E1264: 0 | F1264: 0 | G1264: 0 | H1264: 0 | I1264: 0 | J1264: 0 | K1264: 574.09000000000003 | L1264: 0 | M1264: =SUM(J1264:L1264)-54.75 -> 519.34000000000003 | N1264: 54.75 | O1264: =SUM(M1264:N1264) -> 574.09000000000003
A1265: 4381 | B1265: EOL VENTOS DE SÃO ROQUE 13 | C1265: 31.596.793/0001-87 | D1265: 519.34000000000003 | E1265: 0 | F1265: 0 | G1265: 0 | H1265: 0 | I1265: 0 | J1265: 0 | K1265: 574.09000000000003 | L1265: 0 | M1265: =SUM(J1265:L1265)-54.75 -> 519.34000000000003 | N1265: 54.75 | O1265: =SUM(M1265:N1265) -> 574.09000000000003
A1266: 4382 | B1266: EOL VENTOS DE SAO ROQUE 19 | C1266: 31.596.421/0001-50 | D1266: 519.34000000000003 | E1266: 0 | F1266: 0 | G1266: 0 | H1266: 0 | I1266: 0 | J1266: 0 | K1266: 574.09000000000003 | L1266: 0 | M1266: =SUM(J1266:L1266)-54.75 -> 519.34000000000003 | N1266: 54.75 | O1266: =SUM(M1266:N1266) -> 574.09000000000003
A1267: 4383 | B1267: EOL VENTOS DE SAO ROQUE 22 | C1267: 31.596.769/0001-48 | D1267: 519.34000000000003 | E1267: 0 | F1267: 0 | G1267: 0 | H1267: 0 | I1267: 0 | J1267: 0 | K1267: 574.09000000000003 | L1267: 0 | M1267: =SUM(J1267:L1267)-54.75 -> 519.34000000000003 | N1267: 54.75 | O1267: =SUM(M1267:N1267) -> 574.09000000000003
A1268: 4384 | B1268: EOL VENTOS DE SÃO ROQUE 26 | C1268: 31.594.093/0001-53 | D1268: 519.34000000000003 | E1268: 0 | F1268: 0 | G1268: 0 | H1268: 0 | I1268: 0 | J1268: 0 | K1268: 574.09000000000003 | L1268: 0 | M1268: =SUM(J1268:L1268)-54.75 -> 519.34000000000003 | N1268: 54.75 | O1268: =SUM(M1268:N1268) -> 574.09000000000003
A1269: 4385 | B1269: EOL VENTOS DE SAO ROQUE 29 | C1269: 31.595.987/0001-68 | D1269: 389.5 | E1269: 0 | F1269: 0 | G1269: 0 | H1269: 0 | I1269: 0 | J1269: 0 | K1269: 430.56 | L1269: 0 | M1269: =SUM(J1269:L1269)-41.06 -> 389.5 | N1269: 41.060000000000002 | O1269: =SUM(M1269:N1269) -> 430.56
A1270: 4386 | B1270: UFV LAR DO SOL 3 | C1270: 31.321.803/0001-71 | D1270: 554.15999999999997 | E1270: 0 | F1270: 0 | G1270: 0 | H1270: 0 | I1270: 0 | J1270: 0 | K1270: 612.58000000000004 | L1270: 0 | M1270: =SUM(J1270:L1270)-58.42 -> 554.16000000000008 | N1270: 58.420000000000002 | O1270: =SUM(M1270:N1270) -> 612.58000000000004
A1271: 4387 | B1271: UFV LAR DO SOL 4 | C1271: 31.321.803/0001-71 | D1271: 554.15999999999997 | E1271: 0 | F1271: 0 | G1271: 0 | H1271: 0 | I1271: 0 | J1271: 0 | K1271: 612.58000000000004 | L1271: 0 | M1271: =SUM(J1271:L1271)-58.42 -> 554.16000000000008 | N1271: 58.420000000000002 | O1271: =SUM(M1271:N1271) -> 612.58000000000004
A1272: 4388 | B1272: UFV LAR DO SOL 5 | C1272: 31.321.885/0001-54 | D1272: 554.15999999999997 | E1272: 0 | F1272: 0 | G1272: 0 | H1272: 0 | I1272: 0 | J1272: 0 | K1272: 612.58000000000004 | L1272: 0 | M1272: =SUM(J1272:L1272)-58.42 -> 554.16000000000008 | N1272: 58.420000000000002 | O1272: =SUM(M1272:N1272) -> 612.58000000000004
A1273: 4389 | B1273: UFV LAR DO SOL 6 | C1273: 31.414.665/0001-75 | D1273: 554.15999999999997 | E1273: 0 | F1273: 0 | G1273: 0 | H1273: 0 | I1273: 0 | J1273: 0 | K1273: 612.58000000000004 | L1273: 0 | M1273: =SUM(J1273:L1273)-58.42 -> 554.16000000000008 | N1273: 58.420000000000002 | O1273: =SUM(M1273:N1273) -> 612.58000000000004
A1274: 4390 | B1274: EOL SANTO AGOSTINHO 04 | C1274: 20.675.170/0002-64 | D1274: 430.14999999999998 | E1274: 0 | F1274: 0 | G1274: 0 | H1274: 0 | I1274: 0 | J1274: 0 | K1274: 475.49000000000001 | L1274: 0 | M1274: =SUM(J1274:L1274)-45.34 -> 430.14999999999998 | N1274: 45.340000000000003 | O1274: =SUM(M1274:N1274) -> 475.49000000000001
A1275: 4391 | B1275: UFV SANTA LUZIA 9 | C1275: 40.586.767/0001-69 | D1275: 387.45999999999998 | E1275: 0 | F1275: 0 | G1275: 0 | H1275: 0 | I1275: 0 | J1275: 0 | K1275: 428.30000000000001 | L1275: 0 | M1275: =SUM(J1275:L1275)-40.84 -> 387.46000000000004 | N1275: 40.840000000000003 | O1275: =SUM(M1275:N1275) -> 428.30000000000007
A1276: 4392 | B1276: EOL AURA CAETITE 01 | C1276: 35.655.205/0002-70 | D1276: 289.10000000000002 | E1276: 0 | F1276: 0 | G1276: 0 | H1276: 0 | I1276: 0 | J1276: 0 | K1276: 319.56999999999999 | L1276: 0 | M1276: =SUM(J1276:L1276)-30.47 -> 289.10000000000002 | N1276: 30.469999999999999 | O1276: =SUM(M1276:N1276) -> 319.57000000000005
A1277: 4393 | B1277: EOL AURA CAETITE 02 | C1277: 35.655.200/0002-48 | D1277: 391.07999999999998 | E1277: 0 | F1277: 0 | G1277: 0 | H1277: 0 | I1277: 0 | J1277: 0 | K1277: 432.30000000000001 | L1277: 0 | M1277: =SUM(J1277:L1277)-41.22 -> 391.08000000000004 | N1277: 41.219999999999999 | O1277: =SUM(M1277:N1277) -> 432.30000000000007
A1278: 4394 | B1278: UTE PORTO DAS ÁGUAS II | C1278: 08.322.396/0001-03 | D1278: 887.26999999999998 | E1278: 0 | F1278: 0 | G1278: 0 | H1278: 0 | I1278: 0 | J1278: 0 | K1278: 980.79999999999995 | L1278: 0 | M1278: =SUM(J1278:L1278)-93.53 -> 887.26999999999998 | N1278: 93.530000000000001 | O1278: =SUM(M1278:N1278) -> 980.79999999999995
A1279: 4395 | B1279: EOL AURA CAETITE 03 | C1279: 35.655.028/0002-22 | D1279: 391.07999999999998 | E1279: 0 | F1279: 0 | G1279: 0 | H1279: 0 | I1279: 0 | J1279: 0 | K1279: 432.30000000000001 | L1279: 0 | M1279: =SUM(J1279:L1279)-41.22 -> 391.08000000000004 | N1279: 41.219999999999999 | O1279: =SUM(M1279:N1279) -> 432.30000000000007
A1280: 4396 | B1280: EOL AURA TANQUE NOVO 03 | C1280: 35.655.024/0002-44 | D1280: 144.52000000000001 | E1280: 0 | F1280: 0 | G1280: 0 | H1280: 0 | I1280: 0 | J1280: 0 | K1280: 159.75 | L1280: 0 | M1280: =SUM(J1280:L1280)-15.23 -> 144.52000000000001 | N1280: 15.23 | O1280: =SUM(M1280:N1280) -> 159.75
A1281: 4397 | B1281: EOL SERRA DA MANGABEIRA | C1281: 35.924.128/0002-07 | D1281: 932.21000000000004 | E1281: 0 | F1281: 0 | G1281: 0 | H1281: 0 | I1281: 0 | J1281: 0 | K1281: 1030.48 | L1281: 0 | M1281: =SUM(J1281:L1281)-98.27 -> 932.21000000000004 | N1281: 98.269999999999996 | O1281: =SUM(M1281:N1281) -> 1030.48
A1282: 4398 | B1282: UFV SOLAR IRECE 01 | C1282: 25.215.822/0001-10 | D1282: 796.47000000000003 | E1282: 0 | F1282: 0 | G1282: 0 | H1282: 0 | I1282: 0 | J1282: 0 | K1282: 880.42999999999995 | L1282: 0 | M1282: =SUM(J1282:L1282)-83.96 -> 796.46999999999991 | N1282: 83.959999999999994 | O1282: =SUM(M1282:N1282) -> 880.42999999999995
A1283: 4399 | B1283: UFV DUNAMIS I | C1283: 32.708.258/0001-33 | D1283: 327.69999999999999 | E1283: 0 | F1283: 0 | G1283: 0 | H1283: 0 | I1283: 0 | J1283: 0 | K1283: 362.24000000000001 | L1283: 0 | M1283: =SUM(J1283:L1283)-34.54 -> 327.69999999999999 | N1283: 34.539999999999999 | O1283: =SUM(M1283:N1283) -> 362.24000000000001
A1284: 4400 | B1284: UFV DUNAMIS II | C1284: 32.708.258/0001-33 | D1284: 327.69999999999999 | E1284: 0 | F1284: 0 | G1284: 0 | H1284: 0 | I1284: 0 | J1284: 0 | K1284: 362.24000000000001 | L1284: 0 | M1284: =SUM(J1284:L1284)-34.54 -> 327.69999999999999 | N1284: 34.539999999999999 | O1284: =SUM(M1284:N1284) -> 362.24000000000001
A1285: 4401 | B1285: UFV DUNAMIS III | C1285: 32.708.258/0001-33 | D1285: 327.69999999999999 | E1285: 0 | F1285: 0 | G1285: 0 | H1285: 0 | I1285: 0 | J1285: 0 | K1285: 362.24000000000001 | L1285: 0 | M1285: =SUM(J1285:L1285)-34.54 -> 327.69999999999999 | N1285: 34.539999999999999 | O1285: =SUM(M1285:N1285) -> 362.24000000000001
A1286: 4402 | B1286: UFV DUNAMIS IV | C1286: 32.708.258/0001-33 | D1286: 327.69999999999999 | E1286: 0 | F1286: 0 | G1286: 0 | H1286: 0 | I1286: 0 | J1286: 0 | K1286: 362.24000000000001 | L1286: 0 | M1286: =SUM(J1286:L1286)-34.54 -> 327.69999999999999 | N1286: 34.539999999999999 | O1286: =SUM(M1286:N1286) -> 362.24000000000001
A1287: 4403 | B1287: EOL ASSURUA 5 I | C1287: 38.297.095/0002-00 | D1287: 476.07999999999998 | E1287: 0 | F1287: 0 | G1287: 0 | H1287: 0 | I1287: 0 | J1287: 0 | K1287: 526.26999999999998 | L1287: 0 | M1287: =SUM(J1287:L1287)-50.19 -> 476.07999999999998 | N1287: 50.189999999999998 | O1287: =SUM(M1287:N1287) -> 526.26999999999998
A1288: 4404 | B1288: EOL ASSURUA 5 VI | C1288: 42.931.551/0002-08 | D1288: 408.06 | E1288: 0 | F1288: 0 | G1288: 0 | H1288: 0 | I1288: 0 | J1288: 0 | K1288: 451.06999999999999 | L1288: 0 | M1288: =SUM(J1288:L1288)-43.01 -> 408.06 | N1288: 43.009999999999998 | O1288: =SUM(M1288:N1288) -> 451.06999999999999
A1289: 4405 | B1289: EOL AURA CAETITE 04 | C1289: 35.655.010/0002-20 | D1289: 240.88999999999999 | E1289: 0 | F1289: 0 | G1289: 0 | H1289: 0 | I1289: 0 | J1289: 0 | K1289: 266.27999999999997 | L1289: 0 | M1289: =SUM(J1289:L1289)-25.39 -> 240.88999999999999 | N1289: 25.390000000000001 | O1289: =SUM(M1289:N1289) -> 266.27999999999997
A1290: 4406 | B1290: EOL SANTO AGOSTINHO 03 | C1290: 20.675.156/0002-60 | D1290: 143.38 | E1290: 0 | F1290: 0 | G1290: 0 | H1290: 0 | I1290: 0 | J1290: 0 | K1290: 158.49000000000001 | L1290: 0 | M1290: =SUM(J1290:L1290)-15.11 -> 143.38 | N1290: 15.109999999999999 | O1290: =SUM(M1290:N1290) -> 158.49000000000001
A1291: 4407 | B1291: EOL SANTO AGOSTINHO 05 | C1291: 20.675.180/0002-08 | D1291: 645.23000000000002 | E1291: 0 | F1291: 0 | G1291: 0 | H1291: 0 | I1291: 0 | J1291: 0 | K1291: 713.25 | L1291: 0 | M1291: =SUM(J1291:L1291)-68.02 -> 645.23000000000002 | N1291: 68.019999999999996 | O1291: =SUM(M1291:N1291) -> 713.25
A1292: 4408 | B1292: EOL SERRA DO SERIDÓ II | C1292: 35.831.799/0001-42 | D1292: 164.46000000000001 | E1292: 0 | F1292: 0 | G1292: 0 | H1292: 0 | I1292: 0 | J1292: 0 | K1292: 181.80000000000001 | L1292: 0 | M1292: =SUM(J1292:L1292)-17.34 -> 164.46000000000001 | N1292: 17.34 | O1292: =SUM(M1292:N1292) -> 181.80000000000001
A1293: 4409 | B1293: EOL SERRA DO SERIDÓ IV | C1293: 35.957.107/0001-07 | D1293: 438.62 | E1293: 0 | F1293: 0 | G1293: 0 | H1293: 0 | I1293: 0 | J1293: 0 | K1293: 484.86000000000001 | L1293: 0 | M1293: =SUM(J1293:L1293)-46.24 -> 438.62 | N1293: 46.240000000000002 | O1293: =SUM(M1293:N1293) -> 484.86000000000001
A1294: 4410 | B1294: EOL VENTOS DE SANTA LUZIA 02 | C1294: 41.413.101/0002-52 | D1294: 516.46000000000004 | E1294: 0 | F1294: 0 | G1294: 0 | H1294: 0 | I1294: 0 | J1294: 0 | K1294: 570.89999999999998 | L1294: 0 | M1294: =SUM(J1294:L1294)-54.44 -> 516.46000000000004 | N1294: 54.439999999999998 | O1294: =SUM(M1294:N1294) -> 570.90000000000009
A1295: 4411 | B1295: EOL BONS VENTOS CACIMBAS 3 | C1295: 19.953.139/0003-40 | D1295: 120.37 | E1295: 0 | F1295: 0 | G1295: 0 | H1295: 0 | I1295: 0 | J1295: 0 | K1295: 133.06 | L1295: 0 | M1295: =SUM(J1295:L1295)-12.69 -> 120.37 | N1295: 12.69 | O1295: =SUM(M1295:N1295) -> 133.06
A1296: 4412 | B1296: EOL BONS VENTOS CACIMBAS 4 | C1296: 19.953.139/0004-20 | D1296: 86.849999999999994 | E1296: 0 | F1296: 0 | G1296: 0 | H1296: 0 | I1296: 0 | J1296: 0 | K1296: 96.010000000000005 | L1296: 0 | M1296: =SUM(J1296:L1296)-9.16 -> 86.850000000000009 | N1296: 9.1600000000000001 | O1296: =SUM(M1296:N1296) -> 96.010000000000005
A1297: 4413 | B1297: EOL BONS VENTOS CACIMBAS 5 | C1297: 19.953.139/0005-01 | D1297: 174.24000000000001 | E1297: 0 | F1297: 0 | G1297: 0 | H1297: 0 | I1297: 0 | J1297: 0 | K1297: 192.61000000000001 | L1297: 0 | M1297: =SUM(J1297:L1297)-18.37 -> 174.24000000000001 | N1297: 18.370000000000001 | O1297: =SUM(M1297:N1297) -> 192.61000000000001
A1298: 4414 | B1298: EOL BONS VENTOS CACIMBAS 7 | C1298: 19.953.139/0006-92 | D1298: 139.19 | E1298: 0 | F1298: 0 | G1298: 0 | H1298: 0 | I1298: 0 | J1298: 0 | K1298: 153.86000000000001 | L1298: 0 | M1298: =SUM(J1298:L1298)-14.67 -> 139.19000000000003 | N1298: 14.67 | O1298: =SUM(M1298:N1298) -> 153.86000000000001
A1299: 4415 | B1299: EOL CAETITE D | C1299: 33.457.932/0001-17 | D1299: 528.95000000000005 | E1299: 0 | F1299: 0 | G1299: 0 | H1299: 0 | I1299: 0 | J1299: 0 | K1299: 584.71000000000004 | L1299: 0 | M1299: =SUM(J1299:L1299)-55.76 -> 528.95000000000005 | N1299: 55.759999999999998 | O1299: =SUM(M1299:N1299) -> 584.71000000000004
A1300: 4429 | B1300: EOL CAJUÍNA A1 | C1300: 36.952.007/0001-50 | D1300: 453.08999999999997 | E1300: 0 | F1300: 0 | G1300: 0 | H1300: 0 | I1300: 0 | J1300: 0 | K1300: 500.85000000000002 | L1300: 0 | M1300: =SUM(J1300:L1300)-47.76 -> 453.09000000000003 | N1300: 47.759999999999998 | O1300: =SUM(M1300:N1300) -> 500.85000000000002
A1301: 4430 | B1301: EOL CAJUÍNA A2 | C1301: 36.952.033/0001-89 | D1301: 453.08999999999997 | E1301: 0 | F1301: 0 | G1301: 0 | H1301: 0 | I1301: 0 | J1301: 0 | K1301: 500.85000000000002 | L1301: 0 | M1301: =SUM(J1301:L1301)-47.76 -> 453.09000000000003 | N1301: 47.759999999999998 | O1301: =SUM(M1301:N1301) -> 500.85000000000002
A1302: 4431 | B1302: EOL CAJUÍNA A6 | C1302: 36.957.780/0001-00 | D1302: 512.32000000000005 | E1302: 0 | F1302: 0 | G1302: 0 | H1302: 0 | I1302: 0 | J1302: 0 | K1302: 566.33000000000004 | L1302: 0 | M1302: =SUM(J1302:L1302)-54.01 -> 512.32000000000005 | N1302: 54.009999999999998 | O1302: =SUM(M1302:N1302) -> 566.33000000000004
A1303: 4432 | B1303: UFV MAURITI 1 | C1303: 31.886.399/0002-64 | D1303: 540.94000000000005 | E1303: 0 | F1303: 0 | G1303: 0 | H1303: 0 | I1303: 0 | J1303: 0 | K1303: 597.96000000000004 | L1303: 0 | M1303: =SUM(J1303:L1303)-57.02 -> 540.94000000000005 | N1303: 57.020000000000003 | O1303: =SUM(M1303:N1303) -> 597.96000000000004
A1304: 4433 | B1304: UFV MAURITI 2 | C1304: 29.103.647/0002-01 | D1304: 270.47000000000003 | E1304: 0 | F1304: 0 | G1304: 0 | H1304: 0 | I1304: 0 | J1304: 0 | K1304: 298.98000000000002 | L1304: 0 | M1304: =SUM(J1304:L1304)-28.51 -> 270.47000000000003 | N1304: 28.510000000000002 | O1304: =SUM(M1304:N1304) -> 298.98000000000002
A1305: 4434 | B1305: UFV MAURITI 3 | C1305: 29.168.859/0002-77 | D1305: 540.94000000000005 | E1305: 0 | F1305: 0 | G1305: 0 | H1305: 0 | I1305: 0 | J1305: 0 | K1305: 597.96000000000004 | L1305: 0 | M1305: =SUM(J1305:L1305)-57.02 -> 540.94000000000005 | N1305: 57.020000000000003 | O1305: =SUM(M1305:N1305) -> 597.96000000000004
A1306: 4435 | B1306: UFV MAURITI 4 | C1306: 29.469.320/0002-58 | D1306: 540.94000000000005 | E1306: 0 | F1306: 0 | G1306: 0 | H1306: 0 | I1306: 0 | J1306: 0 | K1306: 597.96000000000004 | L1306: 0 | M1306: =SUM(J1306:L1306)-57.02 -> 540.94000000000005 | N1306: 57.020000000000003 | O1306: =SUM(M1306:N1306) -> 597.96000000000004
A1307: 4436 | B1307: UFV MAURITI 5 | C1307: 29.103.664/0002-49 | D1307: 540.94000000000005 | E1307: 0 | F1307: 0 | G1307: 0 | H1307: 0 | I1307: 0 | J1307: 0 | K1307: 597.96000000000004 | L1307: 0 | M1307: =SUM(J1307:L1307)-57.02 -> 540.94000000000005 | N1307: 57.020000000000003 | O1307: =SUM(M1307:N1307) -> 597.96000000000004
A1308: 4437 | B1308: UFV MAURITI 6 | C1308: 29.103.672/0002-95 | D1308: 540.94000000000005 | E1308: 0 | F1308: 0 | G1308: 0 | H1308: 0 | I1308: 0 | J1308: 0 | K1308: 597.96000000000004 | L1308: 0 | M1308: =SUM(J1308:L1308)-57.02 -> 540.94000000000005 | N1308: 57.020000000000003 | O1308: =SUM(M1308:N1308) -> 597.96000000000004
A1309: 4438 | B1309: UFV MAURITI 7 | C1309: 31.153.615/0002-62 | D1309: 162.28 | E1309: 0 | F1309: 0 | G1309: 0 | H1309: 0 | I1309: 0 | J1309: 0 | K1309: 179.38999999999999 | L1309: 0 | M1309: =SUM(J1309:L1309)-17.11 -> 162.27999999999997 | N1309: 17.109999999999999 | O1309: =SUM(M1309:N1309) -> 179.38999999999999
A1310: 4439 | B1310: UFV MAURITI 8 | C1310: 31.159.183/0002-05 | D1310: 540.94000000000005 | E1310: 0 | F1310: 0 | G1310: 0 | H1310: 0 | I1310: 0 | J1310: 0 | K1310: 597.96000000000004 | L1310: 0 | M1310: =SUM(J1310:L1310)-57.02 -> 540.94000000000005 | N1310: 57.020000000000003 | O1310: =SUM(M1310:N1310) -> 597.96000000000004
A1311: 4440 | B1311: UFV MAURITI 9 | C1311: 31.864.512/0002-00 | D1311: 108.19 | E1311: 0 | F1311: 0 | G1311: 0 | H1311: 0 | I1311: 0 | J1311: 0 | K1311: 119.59 | L1311: 0 | M1311: =SUM(J1311:L1311)-11.4 -> 108.19 | N1311: 11.4 | O1311: =SUM(M1311:N1311) -> 119.59
A1312: 4441 | B1312: UTE PROSPERIDADE IV | C1312: 23.857.764/0001-01 | D1312: 145.06 | E1312: 0 | F1312: 0 | G1312: 0 | H1312: 0 | I1312: 0 | J1312: 0 | K1312: 160.34999999999999 | L1312: 0 | M1312: =SUM(J1312:L1312)-15.29 -> 145.06 | N1312: 15.289999999999999 | O1312: =SUM(M1312:N1312) -> 160.34999999999999
A1313: 4442 | B1313: EOL SANTO AGOSTINHO 06 | C1313: 20.675.196/0002-02 | D1313: 286.76999999999998 | E1313: 0 | F1313: 0 | G1313: 0 | H1313: 0 | I1313: 0 | J1313: 0 | K1313: 317 | L1313: 0 | M1313: =SUM(J1313:L1313)-30.23 -> 286.76999999999998 | N1313: 30.23 | O1313: =SUM(M1313:N1313) -> 317
A1314: 4444 | B1314: UTE ASOLO 2 | C1314: 41.675.130/0001-01 | D1314: 455.25999999999999 | E1314: 0 | F1314: 0 | G1314: 0 | H1314: 0 | I1314: 0 | J1314: 0 | K1314: 503.25 | L1314: 0 | M1314: =SUM(J1314:L1314)-47.99 -> 455.25999999999999 | N1314: 47.990000000000002 | O1314: =SUM(M1314:N1314) -> 503.25
A1315: 4445 | B1315: EOL VENTOS DE SANTA LUZIA 03 | C1315: 41.489.491/0002-44 | D1315: 516.46000000000004 | E1315: 0 | F1315: 0 | G1315: 0 | H1315: 0 | I1315: 0 | J1315: 0 | K1315: 570.89999999999998 | L1315: 0 | M1315: =SUM(J1315:L1315)-54.44 -> 516.46000000000004 | N1315: 54.439999999999998 | O1315: =SUM(M1315:N1315) -> 570.90000000000009
A1316: 4446 | B1316: UFV SAO FRANCISCO I | C1316: 48.209.587/0001-70 | D1316: 551.25999999999999 | E1316: 0 | F1316: 0 | G1316: 0 | H1316: 0 | I1316: 0 | J1316: 0 | K1316: 609.37 | L1316: 0 | M1316: =SUM(J1316:L1316)-58.11 -> 551.25999999999999 | N1316: 58.109999999999999 | O1316: =SUM(M1316:N1316) -> 609.37
A1317: 4447 | B1317: UFV SAO FRANCISCO II | C1317: 48.346.774/0001-03 | D1317: 551.25999999999999 | E1317: 0 | F1317: 0 | G1317: 0 | H1317: 0 | I1317: 0 | J1317: 0 | K1317: 609.37 | L1317: 0 | M1317: =SUM(J1317:L1317)-58.11 -> 551.25999999999999 | N1317: 58.109999999999999 | O1317: =SUM(M1317:N1317) -> 609.37
A1318: 4448 | B1318: UFV SAO FRANCISCO III | C1318: 48.177.875/0001-90 | D1318: 551.25999999999999 | E1318: 0 | F1318: 0 | G1318: 0 | H1318: 0 | I1318: 0 | J1318: 0 | K1318: 609.37 | L1318: 0 | M1318: =SUM(J1318:L1318)-58.11 -> 551.25999999999999 | N1318: 58.109999999999999 | O1318: =SUM(M1318:N1318) -> 609.37
A1319: 4449 | B1319: UHE PASSO REAL | C1319: 33.042.730/0001-04 | D1319: 2133.8499999999999 | E1319: 0 | F1319: 0 | G1319: 0 | H1319: 0 | I1319: 0 | J1319: 0 | K1319: 2358.79 | L1319: 0 | M1319: =SUM(J1319:L1319)-224.94 -> 2133.8499999999999 | N1319: 224.94 | O1319: =SUM(M1319:N1319) -> 2358.79
A1320: 4451 | B1320: UHE ITAUBA | C1320: 33.042.730/0001-04 | D1320: 8694.2900000000009 | E1320: 0 | F1320: 0 | G1320: 0 | H1320: 0 | I1320: 0 | J1320: 0 | K1320: 9610.7800000000007 | L1320: 0 | M1320: =SUM(J1320:L1320)-916.49 -> 8694.2900000000009 | N1320: 916.49000000000001 | O1320: =SUM(M1320:N1320) -> 9610.7800000000007
A1321: 4459 | B1321: EOL CAJUÍNA A3 | C1321: 36.951.946/0001-80 | D1321: 726.80999999999995 | E1321: 0 | F1321: 0 | G1321: 0 | H1321: 0 | I1321: 0 | J1321: 0 | K1321: 803.42999999999995 | L1321: 0 | M1321: =SUM(J1321:L1321)-76.62 -> 726.80999999999995 | N1321: 76.620000000000005 | O1321: =SUM(M1321:N1321) -> 803.42999999999995
A1322: 4460 | B1322: EOL CAJUÍNA A4 | C1322: 36.951.974/0001-06 | D1322: 763.19000000000005 | E1322: 0 | F1322: 0 | G1322: 0 | H1322: 0 | I1322: 0 | J1322: 0 | K1322: 843.63999999999999 | L1322: 0 | M1322: =SUM(J1322:L1322)-80.45 -> 763.18999999999994 | N1322: 80.450000000000003 | O1322: =SUM(M1322:N1322) -> 843.63999999999999
A1323: 4461 | B1323: EOL CAJUÍNA A5 | C1323: 36.957.768/0001-03 | D1323: 787.54999999999995 | E1323: 0 | F1323: 0 | G1323: 0 | H1323: 0 | I1323: 0 | J1323: 0 | K1323: 870.57000000000005 | L1323: 0 | M1323: =SUM(J1323:L1323)-83.02 -> 787.55000000000007 | N1323: 83.019999999999996 | O1323: =SUM(M1323:N1323) -> 870.57000000000005
A1324: 4462 | B1324: EOL CAJUÍNA A7 | C1324: 36.957.804/0001-20 | D1324: 517.80999999999995 | E1324: 0 | F1324: 0 | G1324: 0 | H1324: 0 | I1324: 0 | J1324: 0 | K1324: 572.38999999999999 | L1324: 0 | M1324: =SUM(J1324:L1324)-54.58 -> 517.80999999999995 | N1324: 54.579999999999998 | O1324: =SUM(M1324:N1324) -> 572.38999999999999
A1325: 4463 | B1325: EOL ASSURUÁ 5 II | C1325: 38.297.116/0002-98 | D1325: 544.07000000000005 | E1325: 0 | F1325: 0 | G1325: 0 | H1325: 0 | I1325: 0 | J1325: 0 | K1325: 601.41999999999996 | L1325: 0 | M1325: =SUM(J1325:L1325)-57.35 -> 544.06999999999994 | N1325: 57.350000000000001 | O1325: =SUM(M1325:N1325) -> 601.41999999999996
A1326: 4464 | B1326: EOL ASSURUÁ 5 IV | C1326: 42.929.694/0002-77 | D1326: 544.07000000000005 | E1326: 0 | F1326: 0 | G1326: 0 | H1326: 0 | I1326: 0 | J1326: 0 | K1326: 601.41999999999996 | L1326: 0 | M1326: =SUM(J1326:L1326)-57.35 -> 544.06999999999994 | N1326: 57.350000000000001 | O1326: =SUM(M1326:N1326) -> 601.41999999999996
A1327: 4465 | B1327: EOL KAIROS WIND 1 | C1327: 42.166.169/0001-66 | D1327: 397.22000000000003 | E1327: 0 | F1327: 0 | G1327: 0 | H1327: 0 | I1327: 0 | J1327: 0 | K1327: 439.08999999999997 | L1327: 0 | M1327: =SUM(J1327:L1327)-41.87 -> 397.21999999999997 | N1327: 41.869999999999997 | O1327: =SUM(M1327:N1327) -> 439.08999999999997
A1328: 4466 | B1328: UFV NOVA OLINDA 9 | C1328: 23.566.105/0003-70 | D1328: 100.72 | E1328: 0 | F1328: 0 | G1328: 0 | H1328: 0 | I1328: 0 | J1328: 0 | K1328: 111.34 | L1328: 0 | M1328: =SUM(J1328:L1328)-10.62 -> 100.72 | N1328: 10.619999999999999 | O1328: =SUM(M1328:N1328) -> 111.34
A1329: 4467 | B1329: UFV NOVA OLINDA 11 | C1329: 23.416.727/0003-11 | D1329: 100.78 | E1329: 0 | F1329: 0 | G1329: 0 | H1329: 0 | I1329: 0 | J1329: 0 | K1329: 111.40000000000001 | L1329: 0 | M1329: =SUM(J1329:L1329)-10.62 -> 100.78 | N1329: 10.619999999999999 | O1329: =SUM(M1329:N1329) -> 111.40000000000001
A1330: 4468 | B1330: UFV NOVA OLINDA 13 | C1330: 23.414.549/0003-90 | D1330: 100.67 | E1330: 0 | F1330: 0 | G1330: 0 | H1330: 0 | I1330: 0 | J1330: 0 | K1330: 111.28 | L1330: 0 | M1330: =SUM(J1330:L1330)-10.61 -> 100.67 | N1330: 10.609999999999999 | O1330: =SUM(M1330:N1330) -> 111.28
A1331: 4469 | B1331: UFV LAPA 3 | C1331: 23.509.564/0002-30 | D1331: 106.06 | E1331: 0 | F1331: 0 | G1331: 0 | H1331: 0 | I1331: 0 | J1331: 0 | K1331: 117.23999999999999 | L1331: 0 | M1331: =SUM(J1331:L1331)-11.18 -> 106.06 | N1331: 11.18 | O1331: =SUM(M1331:N1331) -> 117.24000000000001
A1332: 4470 | B1332: UFV SANTA LUZIA 8 | C1332: 40.586.796/0001-20 | D1332: 529.51999999999998 | E1332: 0 | F1332: 0 | G1332: 0 | H1332: 0 | I1332: 0 | J1332: 0 | K1332: 585.34000000000003 | L1332: 0 | M1332: =SUM(J1332:L1332)-55.82 -> 529.51999999999998 | N1332: 55.82 | O1332: =SUM(M1332:N1332) -> 585.34000000000003
A1333: 4471 | B1333: EOL SANTO AGOSTINHO 18 | C1333: 20.666.659/0002-70 | D1333: 358.45999999999998 | E1333: 0 | F1333: 0 | G1333: 0 | H1333: 0 | I1333: 0 | J1333: 0 | K1333: 396.25 | L1333: 0 | M1333: =SUM(J1333:L1333)-37.79 -> 358.45999999999998 | N1333: 37.789999999999999 | O1333: =SUM(M1333:N1333) -> 396.25
A1334: 4472 | B1334: EOL SANTO AGOSTINHO 21 | C1334: 20.666.720/0002-89 | D1334: 358.45999999999998 | E1334: 0 | F1334: 0 | G1334: 0 | H1334: 0 | I1334: 0 | J1334: 0 | K1334: 396.25 | L1334: 0 | M1334: =SUM(J1334:L1334)-37.79 -> 358.45999999999998 | N1334: 37.789999999999999 | O1334: =SUM(M1334:N1334) -> 396.25
A1335: 4473 | B1335: EOL MUNDO NOVO V | C1335: 41.760.884/0001-60 | D1335: 223.15000000000001 | E1335: 0 | F1335: 0 | G1335: 0 | H1335: 0 | I1335: 0 | J1335: 0 | K1335: 246.66999999999999 | L1335: 0 | M1335: =SUM(J1335:L1335)-23.52 -> 223.14999999999998 | N1335: 23.52 | O1335: =SUM(M1335:N1335) -> 246.66999999999999
A1336: 4474 | B1336: EOL MUNDO NOVO VI | C1336: 41.725.168/0001-41 | D1336: 449.42000000000002 | E1336: 0 | F1336: 0 | G1336: 0 | H1336: 0 | I1336: 0 | J1336: 0 | K1336: 496.79000000000002 | L1336: 0 | M1336: =SUM(J1336:L1336)-47.37 -> 449.42000000000002 | N1336: 47.369999999999997 | O1336: =SUM(M1336:N1336) -> 496.79000000000002
A1337: 4475 | B1337: EOL MUNDO NOVO VII | C1337: 41.760.915/0001-82 | D1337: 449.42000000000002 | E1337: 0 | F1337: 0 | G1337: 0 | H1337: 0 | I1337: 0 | J1337: 0 | K1337: 496.79000000000002 | L1337: 0 | M1337: =SUM(J1337:L1337)-47.37 -> 449.42000000000002 | N1337: 47.369999999999997 | O1337: =SUM(M1337:N1337) -> 496.79000000000002
A1338: 4476 | B1338: EOL CAJUÍNA B9 | C1338: 36.957.862/0001-54 | D1338: 649 | E1338: 0 | F1338: 0 | G1338: 0 | H1338: 0 | I1338: 0 | J1338: 0 | K1338: 717.40999999999997 | L1338: 0 | M1338: =SUM(J1338:L1338)-68.41 -> 649 | N1338: 68.409999999999997 | O1338: =SUM(M1338:N1338) -> 717.40999999999997
A1339: 4477 | B1339: EOL AROEIRA 1 | C1339: 38.094.930/0001-24 | D1339: 536.96000000000004 | E1339: 0 | F1339: 0 | G1339: 0 | H1339: 0 | I1339: 0 | J1339: 0 | K1339: 593.55999999999995 | L1339: 0 | M1339: =SUM(J1339:L1339)-56.6 -> 536.95999999999992 | N1339: 56.600000000000001 | O1339: =SUM(M1339:N1339) -> 593.55999999999995
A1340: 4478 | B1340: EOL AROEIRA 2 | C1340: 38.130.244/0002-42 | D1340: 488.45999999999998 | E1340: 0 | F1340: 0 | G1340: 0 | H1340: 0 | I1340: 0 | J1340: 0 | K1340: 539.95000000000005 | L1340: 0 | M1340: =SUM(J1340:L1340)-51.49 -> 488.46000000000004 | N1340: 51.490000000000002 | O1340: =SUM(M1340:N1340) -> 539.95000000000005
A1341: 4479 | B1341: EOL AROEIRA 3 | C1341: 39.364.731/0001-51 | D1341: 488.45999999999998 | E1341: 0 | F1341: 0 | G1341: 0 | H1341: 0 | I1341: 0 | J1341: 0 | K1341: 539.95000000000005 | L1341: 0 | M1341: =SUM(J1341:L1341)-51.49 -> 488.46000000000004 | N1341: 51.490000000000002 | O1341: =SUM(M1341:N1341) -> 539.95000000000005
A1342: 4480 | B1342: EOL AROEIRA 4 | C1342: 39.334.976/0001-36 | D1342: 488.45999999999998 | E1342: 0 | F1342: 0 | G1342: 0 | H1342: 0 | I1342: 0 | J1342: 0 | K1342: 539.95000000000005 | L1342: 0 | M1342: =SUM(J1342:L1342)-51.49 -> 488.46000000000004 | N1342: 51.490000000000002 | O1342: =SUM(M1342:N1342) -> 539.95000000000005
A1343: 4481 | B1343: EOL AROEIRA 5 | C1343: 38.091.465/0001-78 | D1343: 488.45999999999998 | E1343: 0 | F1343: 0 | G1343: 0 | H1343: 0 | I1343: 0 | J1343: 0 | K1343: 539.95000000000005 | L1343: 0 | M1343: =SUM(J1343:L1343)-51.49 -> 488.46000000000004 | N1343: 51.490000000000002 | O1343: =SUM(M1343:N1343) -> 539.95000000000005
A1344: 4497 | B1344: EOL SANTO AGOSTINHO 01 | C1344: 20.675.133/0002-56 | D1344: 215.08000000000001 | E1344: 0 | F1344: 0 | G1344: 0 | H1344: 0 | I1344: 0 | J1344: 0 | K1344: 237.75 | L1344: 0 | M1344: =SUM(J1344:L1344)-22.67 -> 215.07999999999998 | N1344: 22.670000000000002 | O1344: =SUM(M1344:N1344) -> 237.75
A1345: 4498 | B1345: EOL SANTO AGOSTINHO 02 | C1345: 20.675.144/0002-36 | D1345: 358.45999999999998 | E1345: 0 | F1345: 0 | G1345: 0 | H1345: 0 | I1345: 0 | J1345: 0 | K1345: 396.25 | L1345: 0 | M1345: =SUM(J1345:L1345)-37.79 -> 358.45999999999998 | N1345: 37.789999999999999 | O1345: =SUM(M1345:N1345) -> 396.25
A1346: 4507 | B1346: EOL CAJUÍNA B12 | C1346: 37.002.801/0001-04 | D1346: 453.08999999999997 | E1346: 0 | F1346: 0 | G1346: 0 | H1346: 0 | I1346: 0 | J1346: 0 | K1346: 500.85000000000002 | L1346: 0 | M1346: =SUM(J1346:L1346)-47.76 -> 453.09000000000003 | N1346: 47.759999999999998 | O1346: =SUM(M1346:N1346) -> 500.85000000000002
A1347: 4508 | B1347: EOL VENTOS DE SANTA LUZIA 04 | C1347: 41.483.602/0002-05 | D1347: 446.24000000000001 | E1347: 0 | F1347: 0 | G1347: 0 | H1347: 0 | I1347: 0 | J1347: 0 | K1347: 493.27999999999997 | L1347: 0 | M1347: =SUM(J1347:L1347)-47.04 -> 446.23999999999995 | N1347: 47.039999999999999 | O1347: =SUM(M1347:N1347) -> 493.27999999999997
A1348: 4509 | B1348: EOL AROEIRA 6 | C1348: 38.131.056/0002-39 | D1348: 438.81 | E1348: 0 | F1348: 0 | G1348: 0 | H1348: 0 | I1348: 0 | J1348: 0 | K1348: 485.06999999999999 | L1348: 0 | M1348: =SUM(J1348:L1348)-46.26 -> 438.81 | N1348: 46.259999999999998 | O1348: =SUM(M1348:N1348) -> 485.06999999999999
A1349: 4535 | B1349: ASS CHAFARIZ 2 | C1349: 22.548.637/0002-30 | D1349: 11702.389999999999 | E1349: 0 | F1349: 0 | G1349: 0 | H1349: 0 | I1349: 0 | J1349: 0 | K1349: 12935.98 | L1349: 0 | M1349: =SUM(J1349:L1349)-1233.59 -> 11702.389999999999 | N1349: 1233.5899999999999 | O1349: =SUM(M1349:N1349) -> 12935.98
A1350: 4536 | B1350: EOL CAJUINA B11 | C1350: 37.020.274/0001-52 | D1350: 768.47000000000003 | E1350: 0 | F1350: 0 | G1350: 0 | H1350: 0 | I1350: 0 | J1350: 0 | K1350: 849.48000000000002 | L1350: 0 | M1350: =SUM(J1350:L1350)-81.01 -> 768.47000000000003 | N1350: 81.010000000000005 | O1350: =SUM(M1350:N1350) -> 849.48000000000002
A1351: 4537 | B1351: EOL CAJUINA B16 | C1351: 36.957.817/0001-08 | D1351: 194.19 | E1351: 0 | F1351: 0 | G1351: 0 | H1351: 0 | I1351: 0 | J1351: 0 | K1351: 214.66 | L1351: 0 | M1351: =SUM(J1351:L1351)-20.47 -> 194.19 | N1351: 20.469999999999999 | O1351: =SUM(M1351:N1351) -> 214.66
A1352: 4538 | B1352: EOL CAJUINA B18 | C1352: 37.020.270/0001-74 | D1352: 258.91000000000003 | E1352: 0 | F1352: 0 | G1352: 0 | H1352: 0 | I1352: 0 | J1352: 0 | K1352: 286.19999999999999 | L1352: 0 | M1352: =SUM(J1352:L1352)-27.29 -> 258.90999999999997 | N1352: 27.289999999999999 | O1352: =SUM(M1352:N1352) -> 286.19999999999999
A1353: 4539 | B1353: EOL CAJUINA C15 | C1353: 36.957.786/0001-87 | D1353: 556.13999999999999 | E1353: 0 | F1353: 0 | G1353: 0 | H1353: 0 | I1353: 0 | J1353: 0 | K1353: 614.75999999999999 | L1353: 0 | M1353: =SUM(J1353:L1353)-58.62 -> 556.13999999999999 | N1353: 58.619999999999997 | O1353: =SUM(M1353:N1353) -> 614.75999999999999
A1354: 4540 | B1354: EOL CAJUINA C16 | C1354: 36.951.989/0001-66 | D1354: 102.2 | E1354: 0 | F1354: 0 | G1354: 0 | H1354: 0 | I1354: 0 | J1354: 0 | K1354: 112.97 | L1354: 0 | M1354: =SUM(J1354:L1354)-10.77 -> 102.2 | N1354: 10.77 | O1354: =SUM(M1354:N1354) -> 112.97
A1355: 4541 | B1355: EOL CAJUINA E6 | C1355: 36.952.001/0001-83 | D1355: 707.79999999999995 | E1355: 0 | F1355: 0 | G1355: 0 | H1355: 0 | I1355: 0 | J1355: 0 | K1355: 782.40999999999997 | L1355: 0 | M1355: =SUM(J1355:L1355)-74.61 -> 707.79999999999995 | N1355: 74.609999999999999 | O1355: =SUM(M1355:N1355) -> 782.40999999999997
A1356: 4558 | B1356: EOL SÃO RICARDO 01 | C1356: 37.053.489/0001-70 | D1356: 270.66000000000003 | E1356: 0 | F1356: 0 | G1356: 0 | H1356: 0 | I1356: 0 | J1356: 0 | K1356: 299.19 | L1356: 0 | M1356: =SUM(J1356:L1356)-28.53 -> 270.65999999999997 | N1356: 28.530000000000001 | O1356: =SUM(M1356:N1356) -> 299.18999999999994
A1357: 4559 | B1357: EOL SÃO RICARDO 02 | C1357: 37.002.800/0001-51 | D1357: 338.31999999999999 | E1357: 0 | F1357: 0 | G1357: 0 | H1357: 0 | I1357: 0 | J1357: 0 | K1357: 373.98000000000002 | L1357: 0 | M1357: =SUM(J1357:L1357)-35.66 -> 338.32000000000005 | N1357: 35.659999999999997 | O1357: =SUM(M1357:N1357) -> 373.98000000000002
A1358: 4560 | B1358: EOL CAJUÍNA B14 | C1358: 36.957.823/0001-57 | D1358: 588.34000000000003 | E1358: 0 | F1358: 0 | G1358: 0 | H1358: 0 | I1358: 0 | J1358: 0 | K1358: 650.36000000000001 | L1358: 0 | M1358: =SUM(J1358:L1358)-62.02 -> 588.34000000000003 | N1358: 62.020000000000003 | O1358: =SUM(M1358:N1358) -> 650.36000000000001
A1359: 4561 | B1359: EOL CAJUÍNA B15 | C1359: 37.002.822/0001-11 | D1359: 457.60000000000002 | E1359: 0 | F1359: 0 | G1359: 0 | H1359: 0 | I1359: 0 | J1359: 0 | K1359: 505.83999999999997 | L1359: 0 | M1359: =SUM(J1359:L1359)-48.24 -> 457.59999999999997 | N1359: 48.240000000000002 | O1359: =SUM(M1359:N1359) -> 505.83999999999997
A1360: 4567 | B1360: EOL CAJUÍNA B13 | C1360: 36.957.856/0001-05 | D1360: 522.97000000000003 | E1360: 0 | F1360: 0 | G1360: 0 | H1360: 0 | I1360: 0 | J1360: 0 | K1360: 578.10000000000002 | L1360: 0 | M1360: =SUM(J1360:L1360)-55.13 -> 522.97000000000003 | N1360: 55.130000000000003 | O1360: =SUM(M1360:N1360) -> 578.10000000000002
A1361: 4577 | B1361: EOL TUCANO V | C1361: 35.805.346/0001-41 | D1361: 237.94999999999999 | E1361: 0 | F1361: 0 | G1361: 0 | H1361: 0 | I1361: 0 | J1361: 0 | K1361: 263.02999999999997 | L1361: 0 | M1361: =SUM(J1361:L1361)-25.08 -> 237.94999999999999 | N1361: 25.079999999999998 | O1361: =SUM(M1361:N1361) -> 263.02999999999997
A1362: 4578 | B1362: EOL TUCANO XIII | C1362: 35.805.346/0001-41 | D1362: 416.42000000000002 | E1362: 0 | F1362: 0 | G1362: 0 | H1362: 0 | I1362: 0 | J1362: 0 | K1362: 460.31999999999999 | L1362: 0 | M1362: =SUM(J1362:L1362)-43.9 -> 416.42000000000002 | N1362: 43.899999999999999 | O1362: =SUM(M1362:N1362) -> 460.31999999999999
A1363: 4579 | B1363: EOL TUCANO XVII | C1363: 35.805.346/0001-41 | D1363: 178.47 | E1363: 0 | F1363: 0 | G1363: 0 | H1363: 0 | I1363: 0 | J1363: 0 | K1363: 197.28 | L1363: 0 | M1363: =SUM(J1363:L1363)-18.81 -> 178.47 | N1363: 18.809999999999999 | O1363: =SUM(M1363:N1363) -> 197.28
A1364: 4585 | B1364: EOL KAIRÓS WIND 2 | C1364: 42.422.214/0001-04 | D1364: 397.22000000000003 | E1364: 0 | F1364: 0 | G1364: 0 | H1364: 0 | I1364: 0 | J1364: 0 | K1364: 439.08999999999997 | L1364: 0 | M1364: =SUM(J1364:L1364)-41.87 -> 397.21999999999997 | N1364: 41.869999999999997 | O1364: =SUM(M1364:N1364) -> 439.08999999999997
A1365: 4586 | B1365: UFV HELIO VALGAS 2 | C1365: 32.431.507/0001-96 | D1365: 597.54999999999995 | E1365: 0 | F1365: 0 | G1365: 0 | H1365: 0 | I1365: 0 | J1365: 0 | K1365: 660.53999999999996 | L1365: 0 | M1365: =SUM(J1365:L1365)-62.99 -> 597.54999999999995 | N1365: 62.990000000000002 | O1365: =SUM(M1365:N1365) -> 660.53999999999996
A1366: 4587 | B1366: UFV HELIO VALGAS 3 | C1366: 32.431.516/0001-87 | D1366: 597.54999999999995 | E1366: 0 | F1366: 0 | G1366: 0 | H1366: 0 | I1366: 0 | J1366: 0 | K1366: 660.53999999999996 | L1366: 0 | M1366: =SUM(J1366:L1366)-62.99 -> 597.54999999999995 | N1366: 62.990000000000002 | O1366: =SUM(M1366:N1366) -> 660.53999999999996
A1367: 4588 | B1367: UFV HELIO VALGAS 4 | C1367: 32.431.516/0001-87 | D1367: 597.54999999999995 | E1367: 0 | F1367: 0 | G1367: 0 | H1367: 0 | I1367: 0 | J1367: 0 | K1367: 660.53999999999996 | L1367: 0 | M1367: =SUM(J1367:L1367)-62.99 -> 597.54999999999995 | N1367: 62.990000000000002 | O1367: =SUM(M1367:N1367) -> 660.53999999999996
A1368: 4589 | B1368: UFV HELIO VALGAS 5 | C1368: 32.431.510/0001-00 | D1368: 597.54999999999995 | E1368: 0 | F1368: 0 | G1368: 0 | H1368: 0 | I1368: 0 | J1368: 0 | K1368: 660.53999999999996 | L1368: 0 | M1368: =SUM(J1368:L1368)-62.99 -> 597.54999999999995 | N1368: 62.990000000000002 | O1368: =SUM(M1368:N1368) -> 660.53999999999996
A1369: 4590 | B1369: UFV HELIO VALGAS 6 | C1369: 32.431.510/0001-00 | D1369: 597.54999999999995 | E1369: 0 | F1369: 0 | G1369: 0 | H1369: 0 | I1369: 0 | J1369: 0 | K1369: 660.53999999999996 | L1369: 0 | M1369: =SUM(J1369:L1369)-62.99 -> 597.54999999999995 | N1369: 62.990000000000002 | O1369: =SUM(M1369:N1369) -> 660.53999999999996
A1370: 4591 | B1370: EOL AROEIRA 7 | C1370: 38.090.834/0002-99 | D1370: 536.96000000000004 | E1370: 0 | F1370: 0 | G1370: 0 | H1370: 0 | I1370: 0 | J1370: 0 | K1370: 593.55999999999995 | L1370: 0 | M1370: =SUM(J1370:L1370)-56.6 -> 536.95999999999992 | N1370: 56.600000000000001 | O1370: =SUM(M1370:N1370) -> 593.55999999999995
A1371: 4592 | B1371: UFV HELIO VALGAS 7 | C1371: 40.224.338/0001-41 | D1371: 597.54999999999995 | E1371: 0 | F1371: 0 | G1371: 0 | H1371: 0 | I1371: 0 | J1371: 0 | K1371: 660.53999999999996 | L1371: 0 | M1371: =SUM(J1371:L1371)-62.99 -> 597.54999999999995 | N1371: 62.990000000000002 | O1371: =SUM(M1371:N1371) -> 660.53999999999996
A1372: 4593 | B1372: UFV HELIO VALGAS 8 | C1372: 40.224.338/0001-41 | D1372: 747.65999999999997 | E1372: 0 | F1372: 0 | G1372: 0 | H1372: 0 | I1372: 0 | J1372: 0 | K1372: 826.47000000000003 | L1372: 0 | M1372: =SUM(J1372:L1372)-78.81 -> 747.66000000000008 | N1372: 78.810000000000002 | O1372: =SUM(M1372:N1372) -> 826.47000000000003
A1373: 4594 | B1373: UFV HELIO VALGAS 9 | C1373: 40.114.336/0001-08 | D1373: 598.02999999999997 | E1373: 0 | F1373: 0 | G1373: 0 | H1373: 0 | I1373: 0 | J1373: 0 | K1373: 661.07000000000005 | L1373: 0 | M1373: =SUM(J1373:L1373)-63.04 -> 598.03000000000009 | N1373: 63.039999999999999 | O1373: =SUM(M1373:N1373) -> 661.07000000000005
A1374: 4595 | B1374: UFV HELIO VALGAS 10 | C1374: 40.114.336/0001-08 | D1374: 601.13 | E1374: 0 | F1374: 0 | G1374: 0 | H1374: 0 | I1374: 0 | J1374: 0 | K1374: 664.5 | L1374: 0 | M1374: =SUM(J1374:L1374)-63.37 -> 601.13 | N1374: 63.369999999999997 | O1374: =SUM(M1374:N1374) -> 664.5
A1375: 4606 | B1375: EOL KAIROS WIND 6 | C1375: 44.031.923/0001-86 | D1375: 446.87 | E1375: 0 | F1375: 0 | G1375: 0 | H1375: 0 | I1375: 0 | J1375: 0 | K1375: 493.98000000000002 | L1375: 0 | M1375: =SUM(J1375:L1375)-47.11 -> 446.87 | N1375: 47.109999999999999 | O1375: =SUM(M1375:N1375) -> 493.98000000000002
A1376: 4607 | B1376: UFV HELIO VALGAS 1 | C1376: 32.431.507/0001-96 | D1376: 597.54999999999995 | E1376: 0 | F1376: 0 | G1376: 0 | H1376: 0 | I1376: 0 | J1376: 0 | K1376: 660.53999999999996 | L1376: 0 | M1376: =SUM(J1376:L1376)-62.99 -> 597.54999999999995 | N1376: 62.990000000000002 | O1376: =SUM(M1376:N1376) -> 660.53999999999996
A1377: 4608 | B1377: EOL PEDRA PINTADA I | C1377: 42.046.559/0002-83 | D1377: 601.20000000000005 | E1377: 0 | F1377: 0 | G1377: 0 | H1377: 0 | I1377: 0 | J1377: 0 | K1377: 664.57000000000005 | L1377: 0 | M1377: =SUM(J1377:L1377)-63.37 -> 601.20000000000005 | N1377: 63.369999999999997 | O1377: =SUM(M1377:N1377) -> 664.57000000000005
A1378: 4609 | B1378: EOL PEDRA PINTADA II | C1378: 42.261.997/0002-64 | D1378: 603.59000000000003 | E1378: 0 | F1378: 0 | G1378: 0 | H1378: 0 | I1378: 0 | J1378: 0 | K1378: 667.22000000000003 | L1378: 0 | M1378: =SUM(J1378:L1378)-63.63 -> 603.59000000000003 | N1378: 63.630000000000003 | O1378: =SUM(M1378:N1378) -> 667.22000000000003
A1379: 4610 | B1379: EOL PEDRA PINTADA III | C1379: 41.982.031/0002-53 | D1379: 533.21000000000004 | E1379: 0 | F1379: 0 | G1379: 0 | H1379: 0 | I1379: 0 | J1379: 0 | K1379: 589.41999999999996 | L1379: 0 | M1379: =SUM(J1379:L1379)-56.21 -> 533.20999999999992 | N1379: 56.210000000000001 | O1379: =SUM(M1379:N1379) -> 589.41999999999996
A1380: 4611 | B1380: EOL PEDRA PINTADA IV | C1380: 41.983.083/0003-25 | D1380: 598.82000000000005 | E1380: 0 | F1380: 0 | G1380: 0 | H1380: 0 | I1380: 0 | J1380: 0 | K1380: 661.94000000000005 | L1380: 0 | M1380: =SUM(J1380:L1380)-63.12 -> 598.82000000000005 | N1380: 63.119999999999997 | O1380: =SUM(M1380:N1380) -> 661.94000000000005
A1381: 4612 | B1381: UFV HORIZONTE MP 2 | C1381: 23.399.589/0001-48 | D1381: 255.61000000000001 | E1381: 0 | F1381: 0 | G1381: 0 | H1381: 0 | I1381: 0 | J1381: 0 | K1381: 282.55000000000001 | L1381: 0 | M1381: =SUM(J1381:L1381)-26.94 -> 255.61000000000001 | N1381: 26.940000000000001 | O1381: =SUM(M1381:N1381) -> 282.55000000000001
A1382: 4613 | B1382: UFV HORIZONTE MP 11 | C1382: 23.399.589/0001-48 | D1382: 197.09 | E1382: 0 | F1382: 0 | G1382: 0 | H1382: 0 | I1382: 0 | J1382: 0 | K1382: 217.87 | L1382: 0 | M1382: =SUM(J1382:L1382)-20.78 -> 197.09 | N1382: 20.780000000000001 | O1382: =SUM(M1382:N1382) -> 217.87
A1383: 4614 | B1383: UFV RIBEIRO GONÇALVES VI | C1383: 31.711.512/0001-90 | D1383: 392.76999999999998 | E1383: 0 | F1383: 0 | G1383: 0 | H1383: 0 | I1383: 0 | J1383: 0 | K1383: 434.17000000000002 | L1383: 0 | M1383: =SUM(J1383:L1383)-41.4 -> 392.77000000000004 | N1383: 41.399999999999999 | O1383: =SUM(M1383:N1383) -> 434.17000000000002
A1384: 4615 | B1384: UFV RIBEIRO GONÇALVES VII | C1384: 31.711.512/0001-90 | D1384: 353.48000000000002 | E1384: 0 | F1384: 0 | G1384: 0 | H1384: 0 | I1384: 0 | J1384: 0 | K1384: 390.74000000000001 | L1384: 0 | M1384: =SUM(J1384:L1384)-37.26 -> 353.48000000000002 | N1384: 37.259999999999998 | O1384: =SUM(M1384:N1384) -> 390.74000000000001
A1385: 4616 | B1385: UFV RIBEIRO GONÇALVES VIII | C1385: 31.711.512/0001-90 | D1385: 353.48000000000002 | E1385: 0 | F1385: 0 | G1385: 0 | H1385: 0 | I1385: 0 | J1385: 0 | K1385: 390.74000000000001 | L1385: 0 | M1385: =SUM(J1385:L1385)-37.26 -> 353.48000000000002 | N1385: 37.259999999999998 | O1385: =SUM(M1385:N1385) -> 390.74000000000001
A1386: 4617 | B1386: EOL AROEIRA 8 | C1386: 39.336.768/0001-76 | D1386: 488.45999999999998 | E1386: 0 | F1386: 0 | G1386: 0 | H1386: 0 | I1386: 0 | J1386: 0 | K1386: 539.95000000000005 | L1386: 0 | M1386: =SUM(J1386:L1386)-51.49 -> 488.46000000000004 | N1386: 51.490000000000002 | O1386: =SUM(M1386:N1386) -> 539.95000000000005
A1387: 4618 | B1387: UFV MENDUBIM I | C1387: 45.991.644/0001-27 | D1387: 427.82999999999998 | E1387: 0 | F1387: 0 | G1387: 0 | H1387: 0 | I1387: 0 | J1387: 0 | K1387: 472.93000000000001 | L1387: 0 | M1387: =SUM(J1387:L1387)-45.1 -> 427.82999999999998 | N1387: 45.100000000000001 | O1387: =SUM(M1387:N1387) -> 472.93000000000001
A1388: 4619 | B1388: UFV MENDUBIM II | C1388: 45.991.741/0001-10 | D1388: 374.35000000000002 | E1388: 0 | F1388: 0 | G1388: 0 | H1388: 0 | I1388: 0 | J1388: 0 | K1388: 413.81 | L1388: 0 | M1388: =SUM(J1388:L1388)-39.46 -> 374.35000000000002 | N1388: 39.460000000000001 | O1388: =SUM(M1388:N1388) -> 413.81
A1389: 4620 | B1389: UFV MENDUBIM III | C1389: 45.991.823/0001-64 | D1389: 427.82999999999998 | E1389: 0 | F1389: 0 | G1389: 0 | H1389: 0 | I1389: 0 | J1389: 0 | K1389: 472.93000000000001 | L1389: 0 | M1389: =SUM(J1389:L1389)-45.1 -> 427.82999999999998 | N1389: 45.100000000000001 | O1389: =SUM(M1389:N1389) -> 472.93000000000001
A1390: 4621 | B1390: UFV MENDUBIM IV | C1390: 45.991.863/0001-06 | D1390: 427.82999999999998 | E1390: 0 | F1390: 0 | G1390: 0 | H1390: 0 | I1390: 0 | J1390: 0 | K1390: 472.93000000000001 | L1390: 0 | M1390: =SUM(J1390:L1390)-45.1 -> 427.82999999999998 | N1390: 45.100000000000001 | O1390: =SUM(M1390:N1390) -> 472.93000000000001
A1391: 4622 | B1391: UFV MENDUBIM V | C1391: 45.991.921/0001-00 | D1391: 374.35000000000002 | E1391: 0 | F1391: 0 | G1391: 0 | H1391: 0 | I1391: 0 | J1391: 0 | K1391: 413.81 | L1391: 0 | M1391: =SUM(J1391:L1391)-39.46 -> 374.35000000000002 | N1391: 39.460000000000001 | O1391: =SUM(M1391:N1391) -> 413.81
A1392: 4623 | B1392: UFV MENDUBIM VI | C1392: 45.991.972/0001-23 | D1392: 374.35000000000002 | E1392: 0 | F1392: 0 | G1392: 0 | H1392: 0 | I1392: 0 | J1392: 0 | K1392: 413.81 | L1392: 0 | M1392: =SUM(J1392:L1392)-39.46 -> 374.35000000000002 | N1392: 39.460000000000001 | O1392: =SUM(M1392:N1392) -> 413.81
A1393: 4624 | B1393: UFV MENDUBIM VII | C1393: 45.992.035/0001-92 | D1393: 374.35000000000002 | E1393: 0 | F1393: 0 | G1393: 0 | H1393: 0 | I1393: 0 | J1393: 0 | K1393: 413.81 | L1393: 0 | M1393: =SUM(J1393:L1393)-39.46 -> 374.35000000000002 | N1393: 39.460000000000001 | O1393: =SUM(M1393:N1393) -> 413.81
A1394: 4625 | B1394: UFV MENDUBIM VIII | C1394: 45.992.085/0001-70 | D1394: 374.35000000000002 | E1394: 0 | F1394: 0 | G1394: 0 | H1394: 0 | I1394: 0 | J1394: 0 | K1394: 413.81 | L1394: 0 | M1394: =SUM(J1394:L1394)-39.46 -> 374.35000000000002 | N1394: 39.460000000000001 | O1394: =SUM(M1394:N1394) -> 413.81
A1395: 4626 | B1395: UFV MENDUBIM IX | C1395: 45.992.149/0001-32 | D1395: 427.82999999999998 | E1395: 0 | F1395: 0 | G1395: 0 | H1395: 0 | I1395: 0 | J1395: 0 | K1395: 472.93000000000001 | L1395: 0 | M1395: =SUM(J1395:L1395)-45.1 -> 427.82999999999998 | N1395: 45.100000000000001 | O1395: =SUM(M1395:N1395) -> 472.93000000000001
A1396: 4627 | B1396: UFV MENDUBIM X | C1396: 45.992.184/0001-51 | D1396: 267.38999999999999 | E1396: 0 | F1396: 0 | G1396: 0 | H1396: 0 | I1396: 0 | J1396: 0 | K1396: 295.57999999999998 | L1396: 0 | M1396: =SUM(J1396:L1396)-28.19 -> 267.38999999999999 | N1396: 28.190000000000001 | O1396: =SUM(M1396:N1396) -> 295.57999999999998
A1397: 4628 | B1397: UFV MENDUBIM XI | C1397: 45.992.228/0001-43 | D1397: 641.74000000000001 | E1397: 0 | F1397: 0 | G1397: 0 | H1397: 0 | I1397: 0 | J1397: 0 | K1397: 709.38999999999999 | L1397: 0 | M1397: =SUM(J1397:L1397)-67.65 -> 641.74000000000001 | N1397: 67.650000000000006 | O1397: =SUM(M1397:N1397) -> 709.38999999999999
A1398: 4629 | B1398: EOL VENTOS DE SANTO ANTÔNIO 01 | C1398: 42.495.343/0002-03 | D1398: 520.33000000000004 | E1398: 0 | F1398: 0 | G1398: 0 | H1398: 0 | I1398: 0 | J1398: 0 | K1398: 575.17999999999995 | L1398: 0 | M1398: =SUM(J1398:L1398)-54.85 -> 520.32999999999993 | N1398: 54.850000000000001 | O1398: =SUM(M1398:N1398) -> 575.17999999999995
A1399: 4630 | B1399: UFV MENDUBIM XII | C1399: 45.992.261/0001-73 | D1399: 320.87 | E1399: 0 | F1399: 0 | G1399: 0 | H1399: 0 | I1399: 0 | J1399: 0 | K1399: 354.69 | L1399: 0 | M1399: =SUM(J1399:L1399)-33.82 -> 320.87 | N1399: 33.82 | O1399: =SUM(M1399:N1399) -> 354.69
A1400: 4631 | B1400: UFV MENDUBIM XIII | C1400: 45.992.304/0001-10 | D1400: 427.82999999999998 | E1400: 0 | F1400: 0 | G1400: 0 | H1400: 0 | I1400: 0 | J1400: 0 | K1400: 472.93000000000001 | L1400: 0 | M1400: =SUM(J1400:L1400)-45.1 -> 427.82999999999998 | N1400: 45.100000000000001 | O1400: =SUM(M1400:N1400) -> 472.93000000000001
A1401: 4632 | B1401: EOL MORRO 2 | C1401: 42.625.774/0002-39 | D1401: 419.93000000000001 | E1401: 0 | F1401: 0 | G1401: 0 | H1401: 0 | I1401: 0 | J1401: 0 | K1401: 464.19999999999999 | L1401: 0 | M1401: =SUM(J1401:L1401)-44.27 -> 419.93000000000001 | N1401: 44.270000000000003 | O1401: =SUM(M1401:N1401) -> 464.19999999999999
A1402: 4633 | B1402: EOL OESTE SERIDÓ VI | C1402: 25.216.818/0001-77 | D1402: 191.40000000000001 | E1402: 0 | F1402: 0 | G1402: 0 | H1402: 0 | I1402: 0 | J1402: 0 | K1402: 211.58000000000001 | L1402: 0 | M1402: =SUM(J1402:L1402)-20.18 -> 191.40000000000001 | N1402: 20.18 | O1402: =SUM(M1402:N1402) -> 211.58000000000001
A1403: 4634 | B1403: EOL OESTE SERIDÓ X | C1403: 36.641.948/0001-73 | D1403: 287.10000000000002 | E1403: 0 | F1403: 0 | G1403: 0 | H1403: 0 | I1403: 0 | J1403: 0 | K1403: 317.36000000000001 | L1403: 0 | M1403: =SUM(J1403:L1403)-30.26 -> 287.10000000000002 | N1403: 30.260000000000002 | O1403: =SUM(M1403:N1403) -> 317.36000000000001
A1404: 4635 | B1404: EOL OESTE SERIDÓ XII | C1404: 36.641.357/0001-04 | D1404: 334.94999999999999 | E1404: 0 | F1404: 0 | G1404: 0 | H1404: 0 | I1404: 0 | J1404: 0 | K1404: 370.25999999999999 | L1404: 0 | M1404: =SUM(J1404:L1404)-35.31 -> 334.94999999999999 | N1404: 35.310000000000002 | O1404: =SUM(M1404:N1404) -> 370.25999999999999
A1405: 4636 | B1405: EOL SERRA DAS VACAS A | C1405: 28.029.264/0001-97 | D1405: 429.68000000000001 | E1405: 0 | F1405: 0 | G1405: 0 | H1405: 0 | I1405: 0 | J1405: 0 | K1405: 474.97000000000003 | L1405: 0 | M1405: =SUM(J1405:L1405)-45.29 -> 429.68000000000001 | N1405: 45.289999999999999 | O1405: =SUM(M1405:N1405) -> 474.97000000000003
A1406: 4637 | B1406: EOL SERRA DAS VACAS B | C1406: 28.228.040/0001-04 | D1406: 380.94 | E1406: 0 | F1406: 0 | G1406: 0 | H1406: 0 | I1406: 0 | J1406: 0 | K1406: 421.10000000000002 | L1406: 0 | M1406: =SUM(J1406:L1406)-40.16 -> 380.94000000000005 | N1406: 40.159999999999997 | O1406: =SUM(M1406:N1406) -> 421.10000000000002
A1407: 4638 | B1407: UFV SERRA DO MEL VII | C1407: 46.545.021/0001-93 | D1407: 542.50999999999999 | E1407: 0 | F1407: 0 | G1407: 0 | H1407: 0 | I1407: 0 | J1407: 0 | K1407: 599.70000000000005 | L1407: 0 | M1407: =SUM(J1407:L1407)-57.19 -> 542.50999999999999 | N1407: 57.189999999999998 | O1407: =SUM(M1407:N1407) -> 599.70000000000005
A1408: 4639 | B1408: UFV MARANGATU 1 | C1408: 41.977.332/0001-08 | D1408: 317.01999999999998 | E1408: 0 | F1408: 0 | G1408: 0 | H1408: 0 | I1408: 0 | J1408: 0 | K1408: 350.44 | L1408: 0 | M1408: =SUM(J1408:L1408)-33.42 -> 317.01999999999998 | N1408: 33.420000000000002 | O1408: =SUM(M1408:N1408) -> 350.44
A1409: 4640 | B1409: UFV MARANGATU 2 | C1409: 42.066.785/0001-45 | D1409: 317.70999999999998 | E1409: 0 | F1409: 0 | G1409: 0 | H1409: 0 | I1409: 0 | J1409: 0 | K1409: 351.19999999999999 | L1409: 0 | M1409: =SUM(J1409:L1409)-33.49 -> 317.70999999999998 | N1409: 33.490000000000002 | O1409: =SUM(M1409:N1409) -> 351.19999999999999
A1410: 4641 | B1410: UFV MARANGATU 3 | C1410: 42.066.812/0001-80 | D1410: 318.56 | E1410: 0 | F1410: 0 | G1410: 0 | H1410: 0 | I1410: 0 | J1410: 0 | K1410: 352.13999999999999 | L1410: 0 | M1410: =SUM(J1410:L1410)-33.58 -> 318.56 | N1410: 33.579999999999998 | O1410: =SUM(M1410:N1410) -> 352.13999999999999
A1411: 4642 | B1411: UFV MARANGATU 4 | C1411: 42.066.826/0001-01 | D1411: 317.50999999999999 | E1411: 0 | F1411: 0 | G1411: 0 | H1411: 0 | I1411: 0 | J1411: 0 | K1411: 350.98000000000002 | L1411: 0 | M1411: =SUM(J1411:L1411)-33.47 -> 317.50999999999999 | N1411: 33.469999999999999 | O1411: =SUM(M1411:N1411) -> 350.98000000000002
A1412: 4643 | B1412: UFV MARANGATU 5 | C1412: 42.066.841/0001-41 | D1412: 318.11000000000001 | E1412: 0 | F1412: 0 | G1412: 0 | H1412: 0 | I1412: 0 | J1412: 0 | K1412: 351.63999999999999 | L1412: 0 | M1412: =SUM(J1412:L1412)-33.53 -> 318.11000000000001 | N1412: 33.530000000000001 | O1412: =SUM(M1412:N1412) -> 351.63999999999999
A1413: 4644 | B1413: UFV MARANGATU 6 | C1413: 42.066.887/0001-60 | D1413: 318.80000000000001 | E1413: 0 | F1413: 0 | G1413: 0 | H1413: 0 | I1413: 0 | J1413: 0 | K1413: 352.41000000000003 | L1413: 0 | M1413: =SUM(J1413:L1413)-33.61 -> 318.80000000000001 | N1413: 33.609999999999999 | O1413: =SUM(M1413:N1413) -> 352.41000000000003
A1414: 4645 | B1414: UFV MARANGATU 7 | C1414: 42.066.900/0001-81 | D1414: 317.95999999999998 | E1414: 0 | F1414: 0 | G1414: 0 | H1414: 0 | I1414: 0 | J1414: 0 | K1414: 351.48000000000002 | L1414: 0 | M1414: =SUM(J1414:L1414)-33.52 -> 317.96000000000004 | N1414: 33.520000000000003 | O1414: =SUM(M1414:N1414) -> 351.48000000000002
A1415: 4646 | B1415: UFV MARANGATU 8 | C1415: 42.066.920/0001-52 | D1415: 318.16000000000003 | E1415: 0 | F1415: 0 | G1415: 0 | H1415: 0 | I1415: 0 | J1415: 0 | K1415: 351.69999999999999 | L1415: 0 | M1415: =SUM(J1415:L1415)-33.54 -> 318.15999999999997 | N1415: 33.539999999999999 | O1415: =SUM(M1415:N1415) -> 351.69999999999999
A1416: 4647 | B1416: UFV MARANGATU 9 | C1416: 42.066.942/0001-12 | D1416: 318.92000000000002 | E1416: 0 | F1416: 0 | G1416: 0 | H1416: 0 | I1416: 0 | J1416: 0 | K1416: 352.54000000000002 | L1416: 0 | M1416: =SUM(J1416:L1416)-33.62 -> 318.92000000000002 | N1416: 33.619999999999997 | O1416: =SUM(M1416:N1416) -> 352.54000000000002
A1417: 4648 | B1417: UFV MARANGATU 10 | C1417: 42.066.958/0001-25 | D1417: 319.14999999999998 | E1417: 0 | F1417: 0 | G1417: 0 | H1417: 0 | I1417: 0 | J1417: 0 | K1417: 352.79000000000002 | L1417: 0 | M1417: =SUM(J1417:L1417)-33.64 -> 319.15000000000003 | N1417: 33.640000000000001 | O1417: =SUM(M1417:N1417) -> 352.79000000000002
A1418: 4649 | B1418: UFV MARANGATU 11 | C1418: 42.066.972/0001-29 | D1418: 318.18000000000001 | E1418: 0 | F1418: 0 | G1418: 0 | H1418: 0 | I1418: 0 | J1418: 0 | K1418: 351.72000000000003 | L1418: 0 | M1418: =SUM(J1418:L1418)-33.54 -> 318.18000000000001 | N1418: 33.539999999999999 | O1418: =SUM(M1418:N1418) -> 351.72000000000003
A1419: 4650 | B1419: UFV MARANGATU 12 | C1419: 42.066.994/0001-99 | D1419: 318.26999999999998 | E1419: 0 | F1419: 0 | G1419: 0 | H1419: 0 | I1419: 0 | J1419: 0 | K1419: 351.81999999999999 | L1419: 0 | M1419: =SUM(J1419:L1419)-33.55 -> 318.26999999999998 | N1419: 33.549999999999997 | O1419: =SUM(M1419:N1419) -> 351.81999999999999
A1420: 4651 | B1420: UFV JAÍBA CN | C1420: 37.995.403/0001-28 | D1420: 338.54000000000002 | E1420: 0 | F1420: 0 | G1420: 0 | H1420: 0 | I1420: 0 | J1420: 0 | K1420: 374.23000000000002 | L1420: 0 | M1420: =SUM(J1420:L1420)-35.69 -> 338.54000000000002 | N1420: 35.689999999999998 | O1420: =SUM(M1420:N1420) -> 374.23000000000002
A1421: 4652 | B1421: EOL VENTOS DE SANTA LUZIA 11 | C1421: 42.538.271/0002-26 | D1421: 572.36000000000001 | E1421: 0 | F1421: 0 | G1421: 0 | H1421: 0 | I1421: 0 | J1421: 0 | K1421: 632.69000000000005 | L1421: 0 | M1421: =SUM(J1421:L1421)-60.33 -> 572.36000000000001 | N1421: 60.329999999999998 | O1421: =SUM(M1421:N1421) -> 632.69000000000005
A1422: 4653 | B1422: EOL VENTOS DE SANTA LUZIA 12 | C1422: 42.495.350/0003-88 | D1422: 624.39999999999998 | E1422: 0 | F1422: 0 | G1422: 0 | H1422: 0 | I1422: 0 | J1422: 0 | K1422: 690.22000000000003 | L1422: 0 | M1422: =SUM(J1422:L1422)-65.82 -> 624.40000000000009 | N1422: 65.819999999999993 | O1422: =SUM(M1422:N1422) -> 690.22000000000003
A1423: 4654 | B1423: EOL VENTOS DE SANTA LUZIA 13 | C1423: 42.455.678/0002-90 | D1423: 624.39999999999998 | E1423: 0 | F1423: 0 | G1423: 0 | H1423: 0 | I1423: 0 | J1423: 0 | K1423: 690.22000000000003 | L1423: 0 | M1423: =SUM(J1423:L1423)-65.82 -> 624.40000000000009 | N1423: 65.819999999999993 | O1423: =SUM(M1423:N1423) -> 690.22000000000003
A1424: 5002 | B1424: ALCOA-P | C1424: 23.637.697/0001-01 | D1424: 1438.1300000000001 | E1424: 0 | F1424: 0 | G1424: 0 | H1424: 0 | I1424: 0 | J1424: 0 | K1424: 1589.73 | L1424: 0 | M1424: =SUM(J1424:L1424)-151.6 -> 1438.1300000000001 | N1424: 151.59999999999999 | O1424: =SUM(M1424:N1424) -> 1589.73
A1425: 5006 | B1425: CBA(CABREÚVA)-P | C1425: 61.409.892/0003-35 | D1425: 20604.779999999999 | E1425: 0 | F1425: 0 | G1425: 0 | H1425: 0 | I1425: 0 | J1425: 0 | K1425: 22776.790000000001 | L1425: 0 | M1425: =SUM(J1425:L1425)-2172.01 -> 20604.779999999999 | N1425: 2172.0100000000002 | O1425: =SUM(M1425:N1425) -> 22776.790000000001
A1426: 5007 | B1426: CSN ARAUCARIA | C1426: 33.042.730/0134-35 | D1426: 633.17999999999995 | E1426: 0 | F1426: 0 | G1426: 0 | H1426: 0 | I1426: 0 | J1426: 0 | K1426: 699.92999999999995 | L1426: 0 | M1426: =SUM(J1426:L1426)-66.75 -> 633.17999999999995 | N1426: 66.75 | O1426: =SUM(M1426:N1426) -> 699.92999999999995
A1427: 5008 | B1427: VALE(ITABIRA)-P | C1427: 33.592.510/0164-09 | D1427: 3547.5999999999999 | E1427: 0 | F1427: 0 | G1427: 0 | H1427: 0 | I1427: 0 | J1427: 0 | K1427: 3921.5599999999999 | L1427: 0 | M1427: =SUM(J1427:L1427)-373.96 -> 3547.5999999999999 | N1427: 373.95999999999998 | O1427: =SUM(M1427:N1427) -> 3921.5599999999999
A1428: 5011 | B1428: FIBRAPLAC-P | C1428: 04.176.791/0002-47 | D1428: 923.36000000000001 | E1428: 0 | F1428: 0 | G1428: 0 | H1428: 0 | I1428: 0 | J1428: 0 | K1428: 1020.6900000000001 | L1428: 0 | M1428: =SUM(J1428:L1428)-97.33 -> 923.36000000000001 | N1428: 97.329999999999998 | O1428: =SUM(M1428:N1428) -> 1020.6900000000001
A1429: 5017 | B1429: INNOVA-P | C1429: 04.229.761/0011-42 | D1429: 131.96000000000001 | E1429: 0 | F1429: 0 | G1429: 0 | H1429: 0 | I1429: 0 | J1429: 0 | K1429: 145.87 | L1429: 0 | M1429: =SUM(J1429:L1429)-13.91 -> 131.96000000000001 | N1429: 13.91 | O1429: =SUM(M1429:N1429) -> 145.87
A1430: 5019 | B1430: ANGLO AMERICAN(NIQUELÂNDIA)-P | C1430: 42.184.226/0017-05 | D1430: 1255.6600000000001 | E1430: 0 | F1430: 0 | G1430: 0 | H1430: 0 | I1430: 0 | J1430: 0 | K1430: 1388.02 | L1430: 0 | M1430: =SUM(J1430:L1430)-132.36 -> 1255.6599999999999 | N1430: 132.36000000000001 | O1430: =SUM(M1430:N1430) -> 1388.02
A1431: 5022 | B1431: ALUMAR(REFINARIA)-P | C1431: 00.655.209/0001-93 | D1431: 2415.0700000000002 | E1431: 0 | F1431: 0 | G1431: 0 | H1431: 0 | I1431: 0 | J1431: 0 | K1431: 2669.6500000000001 | L1431: 0 | M1431: =SUM(J1431:L1431)-254.58 -> 2415.0700000000002 | N1431: 254.58000000000001 | O1431: =SUM(M1431:N1431) -> 2669.6500000000001
A1432: 5023 | B1432: ALUMAR(REDUÇÃO)-P | C1432: 00.655.209/0001-93 | D1432: 17242.439999999999 | E1432: 0 | F1432: 0 | G1432: 0 | H1432: 0 | I1432: 0 | J1432: 0 | K1432: 19060.02 | L1432: 0 | M1432: =SUM(J1432:L1432)-1817.58 -> 17242.440000000002 | N1432: 1817.5799999999999 | O1432: =SUM(M1432:N1432) -> 19060.020000000004
A1433: 5024 | B1433: OXITENO-P | C1433: 62.545.686/0018-00 | D1433: 171.21000000000001 | E1433: 0 | F1433: 0 | G1433: 0 | H1433: 0 | I1433: 0 | J1433: 0 | K1433: 189.25999999999999 | L1433: 0 | M1433: =SUM(J1433:L1433)-18.05 -> 171.20999999999998 | N1433: 18.050000000000001 | O1433: =SUM(M1433:N1433) -> 189.25999999999999
A1434: 5025 | B1434: ARLANXEO (DSM)-P | C1434: 29.667.227/0012-20 | D1434: 315.70999999999998 | E1434: 0 | F1434: 0 | G1434: 0 | H1434: 0 | I1434: 0 | J1434: 0 | K1434: 348.99000000000001 | L1434: 0 | M1434: =SUM(J1434:L1434)-33.28 -> 315.71000000000004 | N1434: 33.280000000000001 | O1434: =SUM(M1434:N1434) -> 348.99000000000001
A1435: 5026 | B1435: ALBRAS-P | C1435: 05.053.020/0003-06 | D1435: 28720.529999999999 | E1435: 0 | F1435: 0 | G1435: 0 | H1435: 0 | I1435: 0 | J1435: 0 | K1435: 31748.049999999999 | L1435: 0 | M1435: =SUM(J1435:L1435)-3027.52 -> 28720.529999999999 | N1435: 3027.52 | O1435: =SUM(M1435:N1435) -> 31748.049999999999
A1436: 5028 | B1436: NOVA ERA SILICON-P | C1436: 19.795.665/0001-67 | D1436: 1228.1199999999999 | E1436: 0 | F1436: 0 | G1436: 0 | H1436: 0 | I1436: 0 | J1436: 0 | K1436: 1357.5799999999999 | L1436: 0 | M1436: =SUM(J1436:L1436)-129.46 -> 1228.1199999999999 | N1436: 129.46000000000001 | O1436: =SUM(M1436:N1436) -> 1357.5799999999999
A1437: 5029 | B1437: UNIPAR CARBOCLORO-P | C1437: 33.958.695/0001-78 | D1437: 3982.7600000000002 | E1437: 0 | F1437: 0 | G1437: 0 | H1437: 0 | I1437: 0 | J1437: 0 | K1437: 4402.6000000000004 | L1437: 0 | M1437: =SUM(J1437:L1437)-419.84 -> 3982.7600000000002 | N1437: 419.83999999999997 | O1437: =SUM(M1437:N1437) -> 4402.6000000000004
A1438: 5034 | B1438: CARAMURU-P | C1438: 00.080.671/0001-00 | D1438: 314.22000000000003 | E1438: 0 | F1438: 0 | G1438: 0 | H1438: 0 | I1438: 0 | J1438: 0 | K1438: 347.33999999999997 | L1438: 0 | M1438: =SUM(J1438:L1438)-33.12 -> 314.21999999999997 | N1438: 33.119999999999997 | O1438: =SUM(M1438:N1438) -> 347.33999999999997
A1439: 5035 | B1439: NOURYON (AKZO) | C1439: 05.869.996/0001-90 | D1439: 1958.8699999999999 | E1439: 0 | F1439: 0 | G1439: 0 | H1439: 0 | I1439: 0 | J1439: 0 | K1439: 2165.3600000000001 | L1439: 0 | M1439: =SUM(J1439:L1439)-206.49 -> 1958.8700000000001 | N1439: 206.49000000000001 | O1439: =SUM(M1439:N1439) -> 2165.3600000000001
A1440: 5036 | B1440: GERDAU(SP)-P | C1440: 07.358.761/0041-56 | D1440: 2043.74 | E1440: 0 | F1440: 0 | G1440: 0 | H1440: 0 | I1440: 0 | J1440: 0 | K1440: 2259.1799999999998 | L1440: 0 | M1440: =SUM(J1440:L1440)-215.44 -> 2043.7399999999998 | N1440: 215.44 | O1440: =SUM(M1440:N1440) -> 2259.1799999999998
A1441: 5040 | B1441: WHITE MARTINS(IPATINGA)-P | C1441: 35.820.448/0155-91 | D1441: 1100.5699999999999 | E1441: 0 | F1441: 0 | G1441: 0 | H1441: 0 | I1441: 0 | J1441: 0 | K1441: 1216.5799999999999 | L1441: 0 | M1441: =SUM(J1441:L1441)-116.01 -> 1100.5699999999999 | N1441: 116.01000000000001 | O1441: =SUM(M1441:N1441) -> 1216.5799999999999
A1442: 5041 | B1442: USIMINAS-P | C1442: 60.894.730/0025-82 | D1442: 8066.5 | E1442: 0 | F1442: 0 | G1442: 0 | H1442: 0 | I1442: 0 | J1442: 0 | K1442: 8916.8099999999995 | L1442: 0 | M1442: =SUM(J1442:L1442)-850.31 -> 8066.5 | N1442: 850.30999999999995 | O1442: =SUM(M1442:N1442) -> 8916.8099999999995
A1443: 5042 | B1443: WHITE MARTINS(TRIUNFO)-P | C1443: 35.820.448/0064-10 | D1443: 287.82999999999998 | E1443: 0 | F1443: 0 | G1443: 0 | H1443: 0 | I1443: 0 | J1443: 0 | K1443: 318.17000000000002 | L1443: 0 | M1443: =SUM(J1443:L1443)-30.34 -> 287.83000000000004 | N1443: 30.34 | O1443: =SUM(M1443:N1443) -> 318.17000000000002
A1444: 5046 | B1444: VALE(BRUCUTU)-P | C1444: 33.592.510/0447-98 | D1444: 2178.5300000000002 | E1444: 0 | F1444: 0 | G1444: 0 | H1444: 0 | I1444: 0 | J1444: 0 | K1444: 2408.1799999999998 | L1444: 0 | M1444: =SUM(J1444:L1444)-229.65 -> 2178.5299999999997 | N1444: 229.65000000000001 | O1444: =SUM(M1444:N1444) -> 2408.1799999999998
A1445: 5047 | B1445: MESSER GASES (LINDE) | C1445: 60.619.202/0072-31 | D1445: 686.49000000000001 | E1445: 0 | F1445: 0 | G1445: 0 | H1445: 0 | I1445: 0 | J1445: 0 | K1445: 758.86000000000001 | L1445: 0 | M1445: =SUM(J1445:L1445)-72.37 -> 686.49000000000001 | N1445: 72.370000000000005 | O1445: =SUM(M1445:N1445) -> 758.86000000000001
A1446: 5048 | B1446: ARLANXEO (PETROFLEX)-P | C1446: 29.667.227/0006-81 | D1446: 283.32999999999998 | E1446: 0 | F1446: 0 | G1446: 0 | H1446: 0 | I1446: 0 | J1446: 0 | K1446: 313.19999999999999 | L1446: 0 | M1446: =SUM(J1446:L1446)-29.87 -> 283.32999999999998 | N1446: 29.870000000000001 | O1446: =SUM(M1446:N1446) -> 313.19999999999999
A1447: 5049 | B1447: APERAM (ACESITA)-P | C1447: 33.390.170/0013-12 | D1447: 3812.5999999999999 | E1447: 0 | F1447: 0 | G1447: 0 | H1447: 0 | I1447: 0 | J1447: 0 | K1447: 4214.5 | L1447: 0 | M1447: =SUM(J1447:L1447)-401.9 -> 3812.5999999999999 | N1447: 401.89999999999998 | O1447: =SUM(M1447:N1447) -> 4214.5
A1448: 5060 | B1448: VALE(AGUA LIMPA)-P | C1448: 33.592.510/0413-49 | D1448: 132.46000000000001 | E1448: 0 | F1448: 0 | G1448: 0 | H1448: 0 | I1448: 0 | J1448: 0 | K1448: 146.41999999999999 | L1448: 0 | M1448: =SUM(J1448:L1448)-13.96 -> 132.45999999999998 | N1448: 13.960000000000001 | O1448: =SUM(M1448:N1448) -> 146.41999999999999
A1449: 5061 | B1449: ARCELORMITTAL(MONLEVADE)-P | C1449: 17.469.701/0066-12 | D1449: 4647.0600000000004 | E1449: 0 | F1449: 0 | G1449: 0 | H1449: 0 | I1449: 0 | J1449: 0 | K1449: 5136.9200000000001 | L1449: 0 | M1449: =SUM(J1449:L1449)-489.86 -> 4647.0600000000004 | N1449: 489.86000000000001 | O1449: =SUM(M1449:N1449) -> 5136.9200000000001
A1450: 5062 | B1450: WHITE MARTINS(MONLEVADE)-P | C1450: 35.820.448/0135-48 | D1450: 1369.4000000000001 | E1450: 0 | F1450: 0 | G1450: 0 | H1450: 0 | I1450: 0 | J1450: 0 | K1450: 1513.75 | L1450: 0 | M1450: =SUM(J1450:L1450)-144.35 -> 1369.4000000000001 | N1450: 144.34999999999999 | O1450: =SUM(M1450:N1450) -> 1513.75
A1451: 5065 | B1451: ANGLOGOLD ASHANTI-P | C1451: 18.565.382/0007-51 | D1451: 961.53999999999996 | E1451: 0 | F1451: 0 | G1451: 0 | H1451: 0 | I1451: 0 | J1451: 0 | K1451: 1062.9000000000001 | L1451: 0 | M1451: =SUM(J1451:L1451)-101.36 -> 961.54000000000008 | N1451: 101.36 | O1451: =SUM(M1451:N1451) -> 1062.9000000000001
A1452: 5066 | B1452: MOSAIC POTÁSSIO(FERTILIZANTES) | C1452: 31.009.644/0001-74 | D1452: 825.19000000000005 | E1452: 0 | F1452: 0 | G1452: 0 | H1452: 0 | I1452: 0 | J1452: 0 | K1452: 912.17999999999995 | L1452: 0 | M1452: =SUM(J1452:L1452)-86.99 -> 825.18999999999994 | N1452: 86.989999999999995 | O1452: =SUM(M1452:N1452) -> 912.17999999999995
A1453: 5067 | B1453: MINERAÇÃO MARACÁ-P | C1453: 86.902.053/0001-13 | D1453: 1879.05 | E1453: 0 | F1453: 0 | G1453: 0 | H1453: 0 | I1453: 0 | J1453: 0 | K1453: 2077.1300000000001 | L1453: 0 | M1453: =SUM(J1453:L1453)-198.08 -> 1879.0500000000002 | N1453: 198.08000000000001 | O1453: =SUM(M1453:N1453) -> 2077.1300000000001
A1454: 5068 | B1454: PARAGOMINAS-P | C1454: 12.094.570/0004-10 | D1454: 1761.3699999999999 | E1454: 0 | F1454: 0 | G1454: 0 | H1454: 0 | I1454: 0 | J1454: 0 | K1454: 1947.04 | L1454: 0 | M1454: =SUM(J1454:L1454)-185.67 -> 1761.3699999999999 | N1454: 185.66999999999999 | O1454: =SUM(M1454:N1454) -> 1947.04
A1455: 5070 | B1455: CBA (NIQUELÂNDIA) | C1455: 61.409.892/0224-95 | D1455: 0 | E1455: 0 | F1455: 0 | G1455: 0 | H1455: 0 | I1455: 0 | J1455: 0 | K1455: 0 | L1455: 0 | M1455: =SUM(J1455:L1455)-0 -> 0 | N1455: 0 | O1455: =SUM(M1455:N1455) -> 0
A1456: 5072 | B1456: BRF(SADIA) | C1456: 01.838.723/0394-14 | D1456: 722.21000000000004 | E1456: 0 | F1456: 0 | G1456: 0 | H1456: 0 | I1456: 0 | J1456: 0 | K1456: 798.34000000000003 | L1456: 0 | M1456: =SUM(J1456:L1456)-76.13 -> 722.21000000000004 | N1456: 76.129999999999995 | O1456: =SUM(M1456:N1456) -> 798.34000000000003
A1457: 5073 | B1457: ANGLOGOLD (SÃO BENTO)-P | C1457: 18.565.382/0001-66 | D1457: 585.82000000000005 | E1457: 0 | F1457: 0 | G1457: 0 | H1457: 0 | I1457: 0 | J1457: 0 | K1457: 647.57000000000005 | L1457: 0 | M1457: =SUM(J1457:L1457)-61.75 -> 585.82000000000005 | N1457: 61.75 | O1457: =SUM(M1457:N1457) -> 647.57000000000005
A1458: 5074 | B1458: WHITE MARTINS(BARAO COCAIS)-P | C1458: 35.820.448/0044-76 | D1458: 185.72999999999999 | E1458: 0 | F1458: 0 | G1458: 0 | H1458: 0 | I1458: 0 | J1458: 0 | K1458: 205.31 | L1458: 0 | M1458: =SUM(J1458:L1458)-19.58 -> 185.73000000000002 | N1458: 19.579999999999998 | O1458: =SUM(M1458:N1458) -> 205.31
A1459: 5076 | B1459: VALE (MINERAÇÃO ONÇA-PUMA)-P | C1459: 48.256.824/0006-68 | D1459: 3939.04 | E1459: 0 | F1459: 0 | G1459: 0 | H1459: 0 | I1459: 0 | J1459: 0 | K1459: 4354.2700000000004 | L1459: 0 | M1459: =SUM(J1459:L1459)-415.23 -> 3939.0400000000004 | N1459: 415.23000000000002 | O1459: =SUM(M1459:N1459) -> 4354.2700000000004
A1460: 5077 | B1460: KINROSS(RPM)-P | C1460: 20.346.524/0001-46 | D1460: 4334.3199999999997 | E1460: 0 | F1460: 0 | G1460: 0 | H1460: 0 | I1460: 0 | J1460: 0 | K1460: 4791.21 | L1460: 0 | M1460: =SUM(J1460:L1460)-456.89 -> 4334.3199999999997 | N1460: 456.88999999999999 | O1460: =SUM(M1460:N1460) -> 4791.21
A1461: 5078 | B1461: ARCELORMITTAL (SBM)-P | C1461: 17.469.701/0260-52 | D1461: 2577.46 | E1461: 0 | F1461: 0 | G1461: 0 | H1461: 0 | I1461: 0 | J1461: 0 | K1461: 2849.1599999999999 | L1461: 0 | M1461: =SUM(J1461:L1461)-271.7 -> 2577.46 | N1461: 271.69999999999999 | O1461: =SUM(M1461:N1461) -> 2849.1599999999999
A1462: 5079 | B1462: REPAR-P | C1462: 33.000.167/0809-70 | D1462: 1116.29 | E1462: 0 | F1462: 0 | G1462: 0 | H1462: 0 | I1462: 0 | J1462: 0 | K1462: 1233.96 | L1462: 0 | M1462: =SUM(J1462:L1462)-117.67 -> 1116.29 | N1462: 117.67 | O1462: =SUM(M1462:N1462) -> 1233.96
A1463: 5080 | B1463: BRASKEM (COPESUL)-P | C1463: 42.150.391/0038-62 | D1463: 6679.1300000000001 | E1463: 0 | F1463: 0 | G1463: 0 | H1463: 0 | I1463: 0 | J1463: 0 | K1463: 7383.1999999999998 | L1463: 0 | M1463: =SUM(J1463:L1463)-704.07 -> 6679.1300000000001 | N1463: 704.07000000000005 | O1463: =SUM(M1463:N1463) -> 7383.1999999999998
A1464: 5083 | B1464: ATLANTIC NICKEL (MIRABELA) | C1464: 74.127.010/0004-71 | D1464: 1086.71 | E1464: 0 | F1464: 0 | G1464: 0 | H1464: 0 | I1464: 0 | J1464: 0 | K1464: 1201.26 | L1464: 0 | M1464: =SUM(J1464:L1464)-114.55 -> 1086.71 | N1464: 114.55 | O1464: =SUM(M1464:N1464) -> 1201.26
A1465: 5084 | B1465: CASTERTECH-P | C1465: 08.304.706/0001-59 | D1465: 626.97000000000003 | E1465: 0 | F1465: 0 | G1465: 0 | H1465: 0 | I1465: 0 | J1465: 0 | K1465: 693.05999999999995 | L1465: 0 | M1465: =SUM(J1465:L1465)-66.09 -> 626.96999999999991 | N1465: 66.090000000000003 | O1465: =SUM(M1465:N1465) -> 693.05999999999995
A1466: 5087 | B1466: COTEMINAS(CAMP. GRANDE) | C1466: 07.663.140/0006-01 | D1466: 1831.3699999999999 | E1466: 0 | F1466: 0 | G1466: 0 | H1466: 0 | I1466: 0 | J1466: 0 | K1466: 2024.4200000000001 | L1466: 0 | M1466: =SUM(J1466:L1466)-193.05 -> 1831.3700000000001 | N1466: 193.05000000000001 | O1466: =SUM(M1466:N1466) -> 2024.4200000000001
A1467: 5088 | B1467: VALLOUREC | C1467: 08.689.024/0002-92 | D1467: 4464.1700000000001 | E1467: 0 | F1467: 0 | G1467: 0 | H1467: 0 | I1467: 0 | J1467: 0 | K1467: 4934.75 | L1467: 0 | M1467: =SUM(J1467:L1467)-470.58 -> 4464.1700000000001 | N1467: 470.57999999999998 | O1467: =SUM(M1467:N1467) -> 4934.75
A1468: 5091 | B1468: ANGLO AMERICAN (BARRO ALTO) | C1468: 42.184.226/0011-01 | D1468: 6417.0900000000001 | E1468: 0 | F1468: 0 | G1468: 0 | H1468: 0 | I1468: 0 | J1468: 0 | K1468: 7093.54 | L1468: 0 | M1468: =SUM(J1468:L1468)-676.45 -> 6417.0900000000001 | N1468: 676.45000000000005 | O1468: =SUM(M1468:N1468) -> 7093.54
A1469: 5092 | B1469: VIPAL | C1469: 87.870.952/0001-44 | D1469: 434.39999999999998 | E1469: 0 | F1469: 0 | G1469: 0 | H1469: 0 | I1469: 0 | J1469: 0 | K1469: 480.19 | L1469: 0 | M1469: =SUM(J1469:L1469)-45.79 -> 434.39999999999998 | N1469: 45.789999999999999 | O1469: =SUM(M1469:N1469) -> 480.19
A1470: 5094 | B1470: UTE SANTA LUZIA I-CARGA | C1470: 08.906.558/0001-42 | D1470: 64.310000000000002 | E1470: 0 | F1470: 0 | G1470: 0 | H1470: 0 | I1470: 0 | J1470: 0 | K1470: 71.090000000000003 | L1470: 0 | M1470: =SUM(J1470:L1470)-6.78 -> 64.310000000000002 | N1470: 6.7800000000000002 | O1470: =SUM(M1470:N1470) -> 71.090000000000003
A1471: 5096 | B1471: SJC (UTE QUIRINÓPOLIS)-CARGA | C1471: 10.249.419/0002-16 | D1471: 80.180000000000007 | E1471: 0 | F1471: 0 | G1471: 0 | H1471: 0 | I1471: 0 | J1471: 0 | K1471: 88.629999999999995 | L1471: 0 | M1471: =SUM(J1471:L1471)-8.45 -> 80.179999999999993 | N1471: 8.4499999999999993 | O1471: =SUM(M1471:N1471) -> 88.629999999999995
A1472: 5097 | B1472: UTE ELDORADO-CARGA | C1472: 05.620.523/0002-35 | D1472: 177.33000000000001 | E1472: 0 | F1472: 0 | G1472: 0 | H1472: 0 | I1472: 0 | J1472: 0 | K1472: 196.02000000000001 | L1472: 0 | M1472: =SUM(J1472:L1472)-18.69 -> 177.33000000000001 | N1472: 18.690000000000001 | O1472: =SUM(M1472:N1472) -> 196.02000000000001
A1473: 5098 | B1473: TERNIUM(UTE ATLÂNTICO)-RC | C1473: 07.005.330/0001-19 | D1473: 8425.75 | E1473: 0 | F1473: 0 | G1473: 0 | H1473: 0 | I1473: 0 | J1473: 0 | K1473: 9313.9300000000003 | L1473: 0 | M1473: =SUM(J1473:L1473)-888.18 -> 8425.75 | N1473: 888.17999999999995 | O1473: =SUM(M1473:N1473) -> 9313.9300000000003
A1474: 5100 | B1474: VALE SALOBO | C1474: 33.931.478/0002-75 | D1474: 5133.9399999999996 | E1474: 0 | F1474: 0 | G1474: 0 | H1474: 0 | I1474: 0 | J1474: 0 | K1474: 5675.1199999999999 | L1474: 0 | M1474: =SUM(J1474:L1474)-541.18 -> 5133.9399999999996 | N1474: 541.17999999999995 | O1474: =SUM(M1474:N1474) -> 5675.1199999999999
A1475: 5101 | B1475: KLABIN | C1475: 89.637.490/0133-95 | D1475: 4872.29 | E1475: 0 | F1475: 0 | G1475: 0 | H1475: 0 | I1475: 0 | J1475: 0 | K1475: 5385.8900000000003 | L1475: 0 | M1475: =SUM(J1475:L1475)-513.6 -> 4872.29 | N1475: 513.60000000000002 | O1475: =SUM(M1475:N1475) -> 5385.8900000000003
A1476: 5102 | B1476: BERNECK (CARGA)-P | C1476: 81.905.176/0001-94 | D1476: 969.76999999999998 | E1476: 0 | F1476: 0 | G1476: 0 | H1476: 0 | I1476: 0 | J1476: 0 | K1476: 1072 | L1476: 0 | M1476: =SUM(J1476:L1476)-102.23 -> 969.76999999999998 | N1476: 102.23 | O1476: =SUM(M1476:N1476) -> 1072
A1477: 5103 | B1477: UNIPAR INDUPA (SOLVAY) | C1477: 61.460.325/0004-94 | D1477: 3256.6300000000001 | E1477: 0 | F1477: 0 | G1477: 0 | H1477: 0 | I1477: 0 | J1477: 0 | K1477: 3599.9200000000001 | L1477: 0 | M1477: =SUM(J1477:L1477)-343.29 -> 3256.6300000000001 | N1477: 343.29000000000002 | O1477: =SUM(M1477:N1477) -> 3599.9200000000001
A1478: 5104 | B1478: UTE COSTA RICA-CARGA | C1478: 08.070.566/0016-88 | D1478: 0 | E1478: 0 | F1478: 0 | G1478: 0 | H1478: 0 | I1478: 0 | J1478: 0 | K1478: 0 | L1478: 0 | M1478: =SUM(J1478:L1478)-0 -> 0 | N1478: 0 | O1478: =SUM(M1478:N1478) -> 0
A1479: 5105 | B1479: MATARIPE (RLAM) | C1479: 41.777.706/0001-41 | D1479: 1776.99 | E1479: 0 | F1479: 0 | G1479: 0 | H1479: 0 | I1479: 0 | J1479: 0 | K1479: 1964.3099999999999 | L1479: 0 | M1479: =SUM(J1479:L1479)-187.32 -> 1776.99 | N1479: 187.31999999999999 | O1479: =SUM(M1479:N1479) -> 1964.3099999999999
A1480: 5106 | B1480: PROQUIGEL (PETROBRAS FAFEN) | C1480: 27.515.154/0020-35 | D1480: 507.64999999999998 | E1480: 0 | F1480: 0 | G1480: 0 | H1480: 0 | I1480: 0 | J1480: 0 | K1480: 561.15999999999997 | L1480: 0 | M1480: =SUM(J1480:L1480)-53.51 -> 507.64999999999998 | N1480: 53.509999999999998 | O1480: =SUM(M1480:N1480) -> 561.15999999999997
A1481: 5107 | B1481: RIMA | C1481: 18.279.158/0010-07 | D1481: 2883.5 | E1481: 0 | F1481: 0 | G1481: 0 | H1481: 0 | I1481: 0 | J1481: 0 | K1481: 3187.46 | L1481: 0 | M1481: =SUM(J1481:L1481)-303.96 -> 2883.5 | N1481: 303.95999999999998 | O1481: =SUM(M1481:N1481) -> 3187.46
A1482: 5108 | B1482: TOYOTA | C1482: 59.104.760/0006-04 | D1482: 249.5 | E1482: 0 | F1482: 0 | G1482: 0 | H1482: 0 | I1482: 0 | J1482: 0 | K1482: 275.80000000000001 | L1482: 0 | M1482: =SUM(J1482:L1482)-26.3 -> 249.5 | N1482: 26.300000000000001 | O1482: =SUM(M1482:N1482) -> 275.80000000000001
A1483: 5111 | B1483: ANGLO FERROUS | C1483: 02.359.572/0004-30 | D1483: 3637.54 | E1483: 0 | F1483: 0 | G1483: 0 | H1483: 0 | I1483: 0 | J1483: 0 | K1483: 4020.98 | L1483: 0 | M1483: =SUM(J1483:L1483)-383.44 -> 3637.54 | N1483: 383.44 | O1483: =SUM(M1483:N1483) -> 4020.98
A1484: 5114 | B1484: UTE MORRO VERMELHO-CARGA | C1484: 08.070.566/0012-54 | D1484: 0 | E1484: 0 | F1484: 0 | G1484: 0 | H1484: 0 | I1484: 0 | J1484: 0 | K1484: 0 | L1484: 0 | M1484: =SUM(J1484:L1484)-0 -> 0 | N1484: 0 | O1484: =SUM(M1484:N1484) -> 0
A1485: 5115 | B1485: VALE S11D (MINA SERRA SUL) | C1485: 33.592.510/0089-96 | D1485: 825.45000000000005 | E1485: 0 | F1485: 0 | G1485: 0 | H1485: 0 | I1485: 0 | J1485: 0 | K1485: 912.46000000000004 | L1485: 0 | M1485: =SUM(J1485:L1485)-87.01 -> 825.45000000000005 | N1485: 87.010000000000005 | O1485: =SUM(M1485:N1485) -> 912.46000000000004
A1486: 5116 | B1486: VALE MINA CONCEIÇÃO | C1486: 33.592.510/0164-09 | D1486: 3697.7600000000002 | E1486: 0 | F1486: 0 | G1486: 0 | H1486: 0 | I1486: 0 | J1486: 0 | K1486: 4087.5500000000002 | L1486: 0 | M1486: =SUM(J1486:L1486)-389.79 -> 3697.7600000000002 | N1486: 389.79000000000002 | O1486: =SUM(M1486:N1486) -> 4087.5500000000002
A1487: 5117 | B1487: PETROBRAS(RNEST) | C1487: 33.000.167/1111-08 | D1487: 1206.6900000000001 | E1487: 0 | F1487: 0 | G1487: 0 | H1487: 0 | I1487: 0 | J1487: 0 | K1487: 1333.8900000000001 | L1487: 0 | M1487: =SUM(J1487:L1487)-127.2 -> 1206.6900000000001 | N1487: 127.2 | O1487: =SUM(M1487:N1487) -> 1333.8900000000001
A1488: 5118 | B1488: UTE ALTO TAQUARI-CARGA | C1488: 08.070.566/0017-69 | D1488: 0 | E1488: 0 | F1488: 0 | G1488: 0 | H1488: 0 | I1488: 0 | J1488: 0 | K1488: 0 | L1488: 0 | M1488: =SUM(J1488:L1488)-0 -> 0 | N1488: 0 | O1488: =SUM(M1488:N1488) -> 0
A1489: 5119 | B1489: COSAN (UTE JATAI)-CARGA | C1489: 18.686.104/0001-67 | D1489: 0 | E1489: 0 | F1489: 0 | G1489: 0 | H1489: 0 | I1489: 0 | J1489: 0 | K1489: 0 | L1489: 0 | M1489: =SUM(J1489:L1489)-0 -> 0 | N1489: 0 | O1489: =SUM(M1489:N1489) -> 0
A1490: 5120 | B1490: AÇO VERDE (GUSA) | C1490: 07.636.657/0002-70 | D1490: 1630.2 | E1490: 0 | F1490: 0 | G1490: 0 | H1490: 0 | I1490: 0 | J1490: 0 | K1490: 1802.04 | L1490: 0 | M1490: =SUM(J1490:L1490)-171.84 -> 1630.2 | N1490: 171.84 | O1490: =SUM(M1490:N1490) -> 1802.04
A1491: 5124 | B1491: SAMARCO GERMANO-P | C1491: 16.628.281/0003-23 | D1491: 2336.5799999999999 | E1491: 0 | F1491: 0 | G1491: 0 | H1491: 0 | I1491: 0 | J1491: 0 | K1491: 2582.8899999999999 | L1491: 0 | M1491: =SUM(J1491:L1491)-246.31 -> 2336.5799999999999 | N1491: 246.31 | O1491: =SUM(M1491:N1491) -> 2582.8899999999999
A1492: 5125 | B1492: TROPICAL BIOENERGIA-(CARGA) | C1492: 08.195.806/0001-94 | D1492: 146.88999999999999 | E1492: 0 | F1492: 0 | G1492: 0 | H1492: 0 | I1492: 0 | J1492: 0 | K1492: 162.37 | L1492: 0 | M1492: =SUM(J1492:L1492)-15.48 -> 146.89000000000001 | N1492: 15.48 | O1492: =SUM(M1492:N1492) -> 162.37
A1493: 5126 | B1493: GV DO BRASIL | C1493: 12.884.632/0001-44 | D1493: 2400.1799999999998 | E1493: 0 | F1493: 0 | G1493: 0 | H1493: 0 | I1493: 0 | J1493: 0 | K1493: 2653.1900000000001 | L1493: 0 | M1493: =SUM(J1493:L1493)-253.01 -> 2400.1800000000003 | N1493: 253.00999999999999 | O1493: =SUM(M1493:N1493) -> 2653.1900000000005
A1494: 5127 | B1494: NORFIL | C1494: 02.341.494/0001-01 | D1494: 1427.78 | E1494: 0 | F1494: 0 | G1494: 0 | H1494: 0 | I1494: 0 | J1494: 0 | K1494: 1578.29 | L1494: 0 | M1494: =SUM(J1494:L1494)-150.51 -> 1427.78 | N1494: 150.50999999999999 | O1494: =SUM(M1494:N1494) -> 1578.29
A1495: 5128 | B1495: VALE(VARGEM GRANDE) | C1495: 33.592.510/0034-12 | D1495: 4554.2799999999997 | E1495: 0 | F1495: 0 | G1495: 0 | H1495: 0 | I1495: 0 | J1495: 0 | K1495: 5034.3599999999997 | L1495: 0 | M1495: =SUM(J1495:L1495)-480.08 -> 4554.2799999999997 | N1495: 480.07999999999998 | O1495: =SUM(M1495:N1495) -> 5034.3599999999997
A1496: 5129 | B1496: WHITE MARTINS (JECEABA) | C1496: 35.820.448/0195-89 | D1496: 306.31 | E1496: 0 | F1496: 0 | G1496: 0 | H1496: 0 | I1496: 0 | J1496: 0 | K1496: 338.60000000000002 | L1496: 0 | M1496: =SUM(J1496:L1496)-32.29 -> 306.31 | N1496: 32.289999999999999 | O1496: =SUM(M1496:N1496) -> 338.60000000000002
A1497: 5130 | B1497: CMPC | C1497: 11.234.954/0001-85 | D1497: 5.2400000000000002 | E1497: 0 | F1497: 0 | G1497: 0 | H1497: 0 | I1497: 0 | J1497: 0 | K1497: 5.79 | L1497: 0 | M1497: =SUM(J1497:L1497)-0.55 -> 5.2400000000000002 | N1497: 0.55000000000000004 | O1497: =SUM(M1497:N1497) -> 5.79
A1498: 5131 | B1498: CIMENTO APODI | C1498: 10.260.249/0003-51 | D1498: 510.69999999999999 | E1498: 0 | F1498: 0 | G1498: 0 | H1498: 0 | I1498: 0 | J1498: 0 | K1498: 564.52999999999997 | L1498: 0 | M1498: =SUM(J1498:L1498)-53.83 -> 510.69999999999999 | N1498: 53.829999999999998 | O1498: =SUM(M1498:N1498) -> 564.52999999999997
A1499: 5132 | B1499: CODEVASF(PISF) | C1499: 00.399.857/0001-26 | D1499: 3518.8000000000002 | E1499: 0 | F1499: 0 | G1499: 0 | H1499: 0 | I1499: 0 | J1499: 0 | K1499: 3889.73 | L1499: 0 | M1499: =SUM(J1499:L1499)-370.93 -> 3518.8000000000002 | N1499: 370.93000000000001 | O1499: =SUM(M1499:N1499) -> 3889.73
A1500: 5133 | B1500: ELIZABETH CIMENTOS | C1500: 12.186.380/0001-80 | D1500: 558.50999999999999 | E1500: 0 | F1500: 0 | G1500: 0 | H1500: 0 | I1500: 0 | J1500: 0 | K1500: 617.38 | L1500: 0 | M1500: =SUM(J1500:L1500)-58.87 -> 558.50999999999999 | N1500: 58.869999999999997 | O1500: =SUM(M1500:N1500) -> 617.38
A1501: 5134 | B1501: CIA DE CIMENTO DA PARAÍBA | C1501: 12.616.864/0002-00 | D1501: 648.01999999999998 | E1501: 0 | F1501: 0 | G1501: 0 | H1501: 0 | I1501: 0 | J1501: 0 | K1501: 716.33000000000004 | L1501: 0 | M1501: =SUM(J1501:L1501)-68.31 -> 648.01999999999998 | N1501: 68.310000000000002 | O1501: =SUM(M1501:N1501) -> 716.32999999999993
A1502: 5135 | B1502: CIA SIDERURGICA DO PECEM-CARGA | C1502: 09.509.535/0001-67 | D1502: 2522.0700000000002 | E1502: 0 | F1502: 0 | G1502: 0 | H1502: 0 | I1502: 0 | J1502: 0 | K1502: 2787.9299999999998 | L1502: 0 | M1502: =SUM(J1502:L1502)-265.86 -> 2522.0699999999997 | N1502: 265.86000000000001 | O1502: =SUM(M1502:N1502) -> 2787.9299999999998
A1503: 5136 | B1503: UTE KLABIN-(CARGA) | C1503: 89.637.490/0165-72 | D1503: 3426.25 | E1503: 0 | F1503: 0 | G1503: 0 | H1503: 0 | I1503: 0 | J1503: 0 | K1503: 3787.4200000000001 | L1503: 0 | M1503: =SUM(J1503:L1503)-361.17 -> 3426.25 | N1503: 361.17000000000002 | O1503: =SUM(M1503:N1503) -> 3787.4200000000001
A1504: 5137 | B1504: GERDAU (CHARQUEADAS) | C1504: 33.611.500/0182-47 | D1504: 2571.6199999999999 | E1504: 0 | F1504: 0 | G1504: 0 | H1504: 0 | I1504: 0 | J1504: 0 | K1504: 2842.6999999999998 | L1504: 0 | M1504: =SUM(J1504:L1504)-271.08 -> 2571.6199999999999 | N1504: 271.07999999999998 | O1504: =SUM(M1504:N1504) -> 2842.6999999999998
A1505: 5138 | B1505: UTE IACO-(CARGA) | C1505: 07.895.728/0006-82 | D1505: 78.950000000000003 | E1505: 0 | F1505: 0 | G1505: 0 | H1505: 0 | I1505: 0 | J1505: 0 | K1505: 87.269999999999996 | L1505: 0 | M1505: =SUM(J1505:L1505)-8.32 -> 78.949999999999989 | N1505: 8.3200000000000003 | O1505: =SUM(M1505:N1505) -> 87.269999999999982
A1506: 5139 | B1506: CERRADINHO (P. DAS AGUAS)-CARGA | C1506: 08.322.396/0001-03 | D1506: 0 | E1506: 0 | F1506: 0 | G1506: 0 | H1506: 0 | I1506: 0 | J1506: 0 | K1506: 0 | L1506: 0 | M1506: =SUM(J1506:L1506)-0 -> 0 | N1506: 0 | O1506: =SUM(M1506:N1506) -> 0
A1507: 5143 | B1507: VALE PELOTIZAÇÃO | C1507: 33.592.510/0434-73 | D1507: 962 | E1507: 0 | F1507: 0 | G1507: 0 | H1507: 0 | I1507: 0 | J1507: 0 | K1507: 1063.4100000000001 | L1507: 0 | M1507: =SUM(J1507:L1507)-101.41 -> 962.00000000000011 | N1507: 101.41 | O1507: =SUM(M1507:N1507) -> 1063.4100000000001
A1508: 5144 | B1508: JBS COUROS ITUMBIARA | C1508: 02.916.265/0098-92 | D1508: 125.13 | E1508: 0 | F1508: 0 | G1508: 0 | H1508: 0 | I1508: 0 | J1508: 0 | K1508: 138.31999999999999 | L1508: 0 | M1508: =SUM(J1508:L1508)-13.19 -> 125.13 | N1508: 13.19 | O1508: =SUM(M1508:N1508) -> 138.31999999999999
A1509: 5145 | B1509: WHITE MARTINS CUBATÃO | C1509: 35.820.448/0174-54 | D1509: 222.16999999999999 | E1509: 0 | F1509: 0 | G1509: 0 | H1509: 0 | I1509: 0 | J1509: 0 | K1509: 245.59 | L1509: 0 | M1509: =SUM(J1509:L1509)-23.42 -> 222.17000000000002 | N1509: 23.420000000000002 | O1509: =SUM(M1509:N1509) -> 245.59000000000003
A1510: 5146 | B1510: USIMINAS CUBATÃO | C1510: 60.894.730/0063-08 | D1510: 2925.1900000000001 | E1510: 0 | F1510: 0 | G1510: 0 | H1510: 0 | I1510: 0 | J1510: 0 | K1510: 3233.54 | L1510: 0 | M1510: =SUM(J1510:L1510)-308.35 -> 2925.1900000000001 | N1510: 308.35000000000002 | O1510: =SUM(M1510:N1510) -> 3233.54
A1511: 5147 | B1511: PETROBRAS SIX | C1511: 40.254.927/0001-72 | D1511: 457.44 | E1511: 0 | F1511: 0 | G1511: 0 | H1511: 0 | I1511: 0 | J1511: 0 | K1511: 505.66000000000003 | L1511: 0 | M1511: =SUM(J1511:L1511)-48.22 -> 457.44000000000005 | N1511: 48.219999999999999 | O1511: =SUM(M1511:N1511) -> 505.66000000000008
A1512: 5149 | B1512: ARLANXEO CABO | C1512: 29.667.227/0010-68 | D1512: 258.42000000000002 | E1512: 0 | F1512: 0 | G1512: 0 | H1512: 0 | I1512: 0 | J1512: 0 | K1512: 285.66000000000003 | L1512: 0 | M1512: =SUM(J1512:L1512)-27.24 -> 258.42000000000002 | N1512: 27.239999999999998 | O1512: =SUM(M1512:N1512) -> 285.66000000000003
A1513: 5150 | B1513: VOTORANTIM JARDIM | C1513: 10.656.452/0023-95 | D1513: 1322.1600000000001 | E1513: 0 | F1513: 0 | G1513: 0 | H1513: 0 | I1513: 0 | J1513: 0 | K1513: 1461.53 | L1513: 0 | M1513: =SUM(J1513:L1513)-139.37 -> 1322.1599999999999 | N1513: 139.37 | O1513: =SUM(M1513:N1513) -> 1461.5299999999997
A1514: 5151 | B1514: VOTORANTIM RIO BRANCO | C1514: 01.637.895/0106-00 | D1514: 2288.8899999999999 | E1514: 0 | F1514: 0 | G1514: 0 | H1514: 0 | I1514: 0 | J1514: 0 | K1514: 2530.1700000000001 | L1514: 0 | M1514: =SUM(J1514:L1514)-241.28 -> 2288.8899999999999 | N1514: 241.28 | O1514: =SUM(M1514:N1514) -> 2530.1700000000001
A1515: 5152 | B1515: ARCELORMITTAL (JOINVILLE) | C1515: 17.469.701/0106-44 | D1515: 2174.9899999999998 | E1515: 0 | F1515: 0 | G1515: 0 | H1515: 0 | I1515: 0 | J1515: 0 | K1515: 2404.2600000000002 | L1515: 0 | M1515: =SUM(J1515:L1515)-229.27 -> 2174.9900000000002 | N1515: 229.27000000000001 | O1515: =SUM(M1515:N1515) -> 2404.2600000000002
A1516: 5153 | B1516: UTE CUBATÃO - CARGA | C1516: 33.000.167/0116-50 | D1516: 873.88999999999999 | E1516: 0 | F1516: 0 | G1516: 0 | H1516: 0 | I1516: 0 | J1516: 0 | K1516: 966.00999999999999 | L1516: 0 | M1516: =SUM(J1516:L1516)-92.12 -> 873.88999999999999 | N1516: 92.120000000000005 | O1516: =SUM(M1516:N1516) -> 966.00999999999999
A1517: 5154 | B1517: GERDAU (INDUSTRIAL) | C1517: 07.358.761/0007-54 | D1517: 898.83000000000004 | E1517: 0 | F1517: 0 | G1517: 0 | H1517: 0 | I1517: 0 | J1517: 0 | K1517: 993.58000000000004 | L1517: 0 | M1517: =SUM(J1517:L1517)-94.75 -> 898.83000000000004 | N1517: 94.75 | O1517: =SUM(M1517:N1517) -> 993.58000000000004
A1518: 5156 | B1518: VOTORANTIM SOBRAL | C1518: 10.656.452/0053-00 | D1518: 645.88 | E1518: 0 | F1518: 0 | G1518: 0 | H1518: 0 | I1518: 0 | J1518: 0 | K1518: 713.96000000000004 | L1518: 0 | M1518: =SUM(J1518:L1518)-68.08 -> 645.88 | N1518: 68.079999999999998 | O1518: =SUM(M1518:N1518) -> 713.96000000000004
A1519: 5157 | B1519: ARAUCO | C1519: 00.606.549/0026-82 | D1519: 395.31 | E1519: 0 | F1519: 0 | G1519: 0 | H1519: 0 | I1519: 0 | J1519: 0 | K1519: 436.98000000000002 | L1519: 0 | M1519: =SUM(J1519:L1519)-41.67 -> 395.31 | N1519: 41.670000000000002 | O1519: =SUM(M1519:N1519) -> 436.98000000000002
A1520: 5158 | B1520: PETROBRAS (COMPERJ) | C1520: 33.000.167/0125-41 | D1520: 987.37 | E1520: 0 | F1520: 0 | G1520: 0 | H1520: 0 | I1520: 0 | J1520: 0 | K1520: 1091.45 | L1520: 0 | M1520: =SUM(J1520:L1520)-104.08 -> 987.37 | N1520: 104.08 | O1520: =SUM(M1520:N1520) -> 1091.45
A1521: 5159 | B1521: MINERAÇÃO DARDANELOS | C1521: 42.416.651/0027-46 | D1521: 505.25 | E1521: 0 | F1521: 0 | G1521: 0 | H1521: 0 | I1521: 0 | J1521: 0 | K1521: 558.50999999999999 | L1521: 0 | M1521: =SUM(J1521:L1521)-53.26 -> 505.25 | N1521: 53.259999999999998 | O1521: =SUM(M1521:N1521) -> 558.50999999999999
A1522: 5160 | B1522: HNK (PE) | C1522: 50.221.019/0054-48 | D1522: 78.590000000000003 | E1522: 0 | F1522: 0 | G1522: 0 | H1522: 0 | I1522: 0 | J1522: 0 | K1522: 86.870000000000005 | L1522: 0 | M1522: =SUM(J1522:L1522)-8.28 -> 78.590000000000003 | N1522: 8.2799999999999994 | O1522: =SUM(M1522:N1522) -> 86.870000000000005
A1523: 5161 | B1523: MINERAÇÃO VALE VERDE | C1523: 08.650.571/0001-83 | D1523: 1349.51 | E1523: 0 | F1523: 0 | G1523: 0 | H1523: 0 | I1523: 0 | J1523: 0 | K1523: 1491.77 | L1523: 0 | M1523: =SUM(J1523:L1523)-142.26 -> 1349.51 | N1523: 142.25999999999999 | O1523: =SUM(M1523:N1523) -> 1491.77
A1524: 5162 | B1524: BRACELL (CARGA) | C1524: 53.943.098/0001-87 | D1524: 107.41 | E1524: 0 | F1524: 0 | G1524: 0 | H1524: 0 | I1524: 0 | J1524: 0 | K1524: 118.73 | L1524: 0 | M1524: =SUM(J1524:L1524)-11.32 -> 107.41 | N1524: 11.32 | O1524: =SUM(M1524:N1524) -> 118.72999999999999
A1525: 5164 | B1525: HEINEKEN CAXIAS | C1525: 02.864.417/0020-90 | D1525: 63.590000000000003 | E1525: 0 | F1525: 0 | G1525: 0 | H1525: 0 | I1525: 0 | J1525: 0 | K1525: 70.290000000000006 | L1525: 0 | M1525: =SUM(J1525:L1525)-6.7 -> 63.590000000000003 | N1525: 6.7000000000000002 | O1525: =SUM(M1525:N1525) -> 70.290000000000006
A1526: 5165 | B1526: FIAT(PE) | C1526: 16.701.716/0036-86 | D1526: 2255.7199999999998 | E1526: 0 | F1526: 0 | G1526: 0 | H1526: 0 | I1526: 0 | J1526: 0 | K1526: 2493.5 | L1526: 0 | M1526: =SUM(J1526:L1526)-237.78 -> 2255.7199999999998 | N1526: 237.78 | O1526: =SUM(M1526:N1526) -> 2493.5
A1527: 5166 | B1527: A100 ROW | C1527: 12.147.176/0018-06 | D1527: 357.05000000000001 | E1527: 0 | F1527: 0 | G1527: 0 | H1527: 0 | I1527: 0 | J1527: 0 | K1527: 394.69 | L1527: 0 | M1527: =SUM(J1527:L1527)-37.64 -> 357.05000000000001 | N1527: 37.640000000000001 | O1527: =SUM(M1527:N1527) -> 394.69
A1528: 5168 | B1528: UTE FS SORRISO (CARGA) | C1528: 20.003.699/0002-31 | D1528: 180.86000000000001 | E1528: 0 | F1528: 0 | G1528: 0 | H1528: 0 | I1528: 0 | J1528: 0 | K1528: 199.93000000000001 | L1528: 0 | M1528: =SUM(J1528:L1528)-19.07 -> 180.86000000000001 | N1528: 19.07 | O1528: =SUM(M1528:N1528) -> 199.93000000000001
A1529: 5169 | B1529: PETROBRAS (REPLAN) | C1529: 33.000.167/0643-47 | D1529: 2437.4400000000001 | E1529: 0 | F1529: 0 | G1529: 0 | H1529: 0 | I1529: 0 | J1529: 0 | K1529: 2694.3800000000001 | L1529: 0 | M1529: =SUM(J1529:L1529)-256.94 -> 2437.4400000000001 | N1529: 256.94 | O1529: =SUM(M1529:N1529) -> 2694.3800000000001
A1530: 5170 | B1530: GERDAU (MOGI) | C1530: 33.611.500/0178-60 | D1530: 0 | E1530: 0 | F1530: 0 | G1530: 0 | H1530: 0 | I1530: 0 | J1530: 0 | K1530: 0 | L1530: 0 | M1530: =SUM(J1530:L1530)-0 -> 0 | N1530: 0 | O1530: =SUM(M1530:N1530) -> 0
A1531: 5171 | B1531: UTE LWARCEL (CARGA) | C1531: 53.943.098/0001-87 | D1531: 120.39 | E1531: 0 | F1531: 0 | G1531: 0 | H1531: 0 | I1531: 0 | J1531: 0 | K1531: 133.08000000000001 | L1531: 0 | M1531: =SUM(J1531:L1531)-12.69 -> 120.39000000000001 | N1531: 12.69 | O1531: =SUM(M1531:N1531) -> 133.08000000000001
A1532: 5172 | B1532: UTE MARLIM AZUL (CARGA) | C1532: 29.884.534/0002-90 | D1532: 233.33000000000001 | E1532: 0 | F1532: 0 | G1532: 0 | H1532: 0 | I1532: 0 | J1532: 0 | K1532: 257.93000000000001 | L1532: 0 | M1532: =SUM(J1532:L1532)-24.6 -> 233.33000000000001 | N1532: 24.600000000000001 | O1532: =SUM(M1532:N1532) -> 257.93000000000001
A1533: 5173 | B1533: SINOBRAS | C1533: 07.933.914/0001-54 | D1533: 2982.5599999999999 | E1533: 0 | F1533: 0 | G1533: 0 | H1533: 0 | I1533: 0 | J1533: 0 | K1533: 3296.96 | L1533: 0 | M1533: =SUM(J1533:L1533)-314.4 -> 2982.5599999999999 | N1533: 314.39999999999998 | O1533: =SUM(M1533:N1533) -> 3296.96
A1534: 5174 | B1534: AIR LIQUIDE | C1534: 00.331.788/0020-81 | D1534: 124.39 | E1534: 0 | F1534: 0 | G1534: 0 | H1534: 0 | I1534: 0 | J1534: 0 | K1534: 137.5 | L1534: 0 | M1534: =SUM(J1534:L1534)-13.11 -> 124.39 | N1534: 13.109999999999999 | O1534: =SUM(M1534:N1534) -> 137.5
A1535: 5175 | B1535: UTE NARDINI (CARGA) | C1535: 48.708.267/0015-60 | D1535: 52.640000000000001 | E1535: 0 | F1535: 0 | G1535: 0 | H1535: 0 | I1535: 0 | J1535: 0 | K1535: 58.189999999999998 | L1535: 0 | M1535: =SUM(J1535:L1535)-5.55 -> 52.640000000000001 | N1535: 5.5499999999999998 | O1535: =SUM(M1535:N1535) -> 58.189999999999998
A1536: 5176 | B1536: ALPEK | C1536: 08.220.101/0001-80 | D1536: 1611.78 | E1536: 0 | F1536: 0 | G1536: 0 | H1536: 0 | I1536: 0 | J1536: 0 | K1536: 1781.6800000000001 | L1536: 0 | M1536: =SUM(J1536:L1536)-169.9 -> 1611.78 | N1536: 169.90000000000001 | O1536: =SUM(M1536:N1536) -> 1781.6800000000001
A1537: 5177 | B1537: ARAGUAIA NM | C1537: 97.515.035/0007-90 | D1537: 2890.0700000000002 | E1537: 0 | F1537: 0 | G1537: 0 | H1537: 0 | I1537: 0 | J1537: 0 | K1537: 3194.7199999999998 | L1537: 0 | M1537: =SUM(J1537:L1537)-304.65 -> 2890.0699999999997 | N1537: 304.64999999999998 | O1537: =SUM(M1537:N1537) -> 3194.7199999999998
A1538: 5178 | B1538: GERDAU ARAUCÁRIA | C1538: 07.358.761/0048-22 | D1538: 1264.02 | E1538: 0 | F1538: 0 | G1538: 0 | H1538: 0 | I1538: 0 | J1538: 0 | K1538: 1397.26 | L1538: 0 | M1538: =SUM(J1538:L1538)-133.24 -> 1264.02 | N1538: 133.24000000000001 | O1538: =SUM(M1538:N1538) -> 1397.26
A1539: 5179 | B1539: PERÓXIDOS | C1539: 51.784.262/0001-25 | D1539: 596.27999999999997 | E1539: 0 | F1539: 0 | G1539: 0 | H1539: 0 | I1539: 0 | J1539: 0 | K1539: 659.13999999999999 | L1539: 0 | M1539: =SUM(J1539:L1539)-62.86 -> 596.27999999999997 | N1539: 62.859999999999999 | O1539: =SUM(M1539:N1539) -> 659.13999999999999
A1540: 5180 | B1540: UTE ASOLO 2 (CARGA) | C1540: 41.675.130/0001-01 | D1540: 2.52 | E1540: 0 | F1540: 0 | G1540: 0 | H1540: 0 | I1540: 0 | J1540: 0 | K1540: 2.79 | L1540: 0 | M1540: =SUM(J1540:L1540)-0.27 -> 2.52 | N1540: 0.27000000000000002 | O1540: =SUM(M1540:N1540) -> 2.79
A1541: 5181 | B1541: WHB AUTOMOTIVE | C1541: 01.261.681/0001-04 | D1541: 1400.1400000000001 | E1541: 0 | F1541: 0 | G1541: 0 | H1541: 0 | I1541: 0 | J1541: 0 | K1541: 1547.73 | L1541: 0 | M1541: =SUM(J1541:L1541)-147.59 -> 1400.1400000000001 | N1541: 147.59 | O1541: =SUM(M1541:N1541) -> 1547.73
A1542: 5182 | B1542: UTE PORTO DAS AGUAS II (CARGA) | C1542: 08.322.396/0001-03 | D1542: 26.32 | E1542: 0 | F1542: 0 | G1542: 0 | H1542: 0 | I1542: 0 | J1542: 0 | K1542: 29.09 | L1542: 0 | M1542: =SUM(J1542:L1542)-2.77 -> 26.32 | N1542: 2.77 | O1542: =SUM(M1542:N1542) -> 29.09
A1543: 6012 | B1543: TRADENER | C1543: 02.691.745/0001-70 | D1543: 7055.79 | E1543: 0 | F1543: 0 | G1543: 0 | H1543: 0 | I1543: 0 | J1543: 7799.5600000000004 | K1543: 0 | L1543: 0 | M1543: =SUM(J1543:L1543)-743.77 -> 7055.7900000000009 | N1543: 743.76999999999998 | O1543: =SUM(M1543:N1543) -> 7799.5600000000013
A1544: 8002 | B1544: BRASKEM(COPENE)-PL | C1544: 42.150.391/0001-70 | D1544: 4812.3000000000002 | E1544: 0 | F1544: 0 | G1544: 0 | H1544: 0 | I1544: 0 | J1544: 0 | K1544: 5319.5799999999999 | L1544: 0 | M1544: =SUM(J1544:L1544)-507.28 -> 4812.3000000000002 | N1544: 507.27999999999997 | O1544: =SUM(M1544:N1544) -> 5319.5799999999999
A1545: 8003 | B1545: BRASKEM(UCS-AL)-PL | C1545: 42.150.391/0022-03 | D1545: 5997.79 | E1545: 0 | F1545: 0 | G1545: 0 | H1545: 0 | I1545: 0 | J1545: 0 | K1545: 6630.04 | L1545: 0 | M1545: =SUM(J1545:L1545)-632.25 -> 5997.79 | N1545: 632.25 | O1545: =SUM(M1545:N1545) -> 6630.04
A1546: 8005 | B1546: PARANAPANEMA(CAR. METAIS)-PL | C1546: 60.398.369/0004-79 | D1546: 1540.1700000000001 | E1546: 0 | F1546: 0 | G1546: 0 | H1546: 0 | I1546: 0 | J1546: 0 | K1546: 1702.52 | L1546: 0 | M1546: =SUM(J1546:L1546)-162.35 -> 1540.1700000000001 | N1546: 162.34999999999999 | O1546: =SUM(M1546:N1546) -> 1702.52
A1547: 8006 | B1547: DOW-PL | C1547: 60.435.351/0017-14 | D1547: 4762.3199999999997 | E1547: 0 | F1547: 0 | G1547: 0 | H1547: 0 | I1547: 0 | J1547: 0 | K1547: 5264.3299999999999 | L1547: 0 | M1547: =SUM(J1547:L1547)-502.01 -> 4762.3199999999997 | N1547: 502.00999999999999 | O1547: =SUM(M1547:N1547) -> 5264.3299999999999
A1548: 8008 | B1548: FERBASA-PL | C1548: 15.141.799/0001-03 | D1548: 8890.0400000000009 | E1548: 0 | F1548: 0 | G1548: 0 | H1548: 0 | I1548: 0 | J1548: 0 | K1548: 9827.1700000000001 | L1548: 0 | M1548: =SUM(J1548:L1548)-937.13 -> 8890.0400000000009 | N1548: 937.13 | O1548: =SUM(M1548:N1548) -> 9827.1700000000001
A1549: 8009 | B1549: GERDAU(AÇONORTE)-PL | C1549: 07.358.761/0051-28 | D1549: 831.11000000000001 | E1549: 0 | F1549: 0 | G1549: 0 | H1549: 0 | I1549: 0 | J1549: 0 | K1549: 918.72000000000003 | L1549: 0 | M1549: =SUM(J1549:L1549)-87.61 -> 831.11000000000001 | N1549: 87.609999999999999 | O1549: =SUM(M1549:N1549) -> 918.72000000000003
A1550: 8010 | B1550: GERDAU(USIBA)-PL | C1550: 07.358.761/0005-92 | D1550: 79.010000000000005 | E1550: 0 | F1550: 0 | G1550: 0 | H1550: 0 | I1550: 0 | J1550: 0 | K1550: 87.340000000000003 | L1550: 0 | M1550: =SUM(J1550:L1550)-8.33 -> 79.010000000000005 | N1550: 8.3300000000000001 | O1550: =SUM(M1550:N1550) -> 87.340000000000003
A1551: 8011 | B1551: LIBRA-PL | C1551: 10.500.221/0001-82 | D1551: 216.87 | E1551: 0 | F1551: 0 | G1551: 0 | H1551: 0 | I1551: 0 | J1551: 0 | K1551: 239.72999999999999 | L1551: 0 | M1551: =SUM(J1551:L1551)-22.86 -> 216.87 | N1551: 22.859999999999999 | O1551: =SUM(M1551:N1551) -> 239.73000000000002
A1552: 8012 | B1552: MINERAÇÃO CARAÍBA-PL | C1552: 42.509.257/0001-13 | D1552: 886.01999999999998 | E1552: 0 | F1552: 0 | G1552: 0 | H1552: 0 | I1552: 0 | J1552: 0 | K1552: 979.41999999999996 | L1552: 0 | M1552: =SUM(J1552:L1552)-93.4 -> 886.01999999999998 | N1552: 93.400000000000006 | O1552: =SUM(M1552:N1552) -> 979.41999999999996
A1553: 8013 | B1553: VALE MANGANES (RDM)-PL | C1553: 15.144.306/0001-99 | D1553: 0 | E1553: 0 | F1553: 0 | G1553: 0 | H1553: 0 | I1553: 0 | J1553: 0 | K1553: 0 | L1553: 0 | M1553: =SUM(J1553:L1553)-0 -> 0 | N1553: 0 | O1553: =SUM(M1553:N1553) -> 0
A1554: 8014 | B1554: HNK(P. SCHINCARIOL)-PL | C1554: 50.221.019/0057-90 | D1554: 422.75 | E1554: 0 | F1554: 0 | G1554: 0 | H1554: 0 | I1554: 0 | J1554: 0 | K1554: 467.31 | L1554: 0 | M1554: =SUM(J1554:L1554)-44.56 -> 422.75 | N1554: 44.560000000000002 | O1554: =SUM(M1554:N1554) -> 467.31
A1555: 8015 | B1555: ALUNORTE-PL | C1555: 05.848.387/0003-16 | D1555: 10370.4 | E1555: 0 | F1555: 0 | G1555: 0 | H1555: 0 | I1555: 0 | J1555: 0 | K1555: 11463.58 | L1555: 0 | M1555: =SUM(J1555:L1555)-1093.18 -> 10370.4 | N1555: 1093.1800000000001 | O1555: =SUM(M1555:N1555) -> 11463.58
A1556: 8016 | B1556: VALE(MINA)-PL | C1556: 33.592.510/0370-74 | D1556: 1204.9300000000001 | E1556: 0 | F1556: 0 | G1556: 0 | H1556: 0 | I1556: 0 | J1556: 0 | K1556: 1331.95 | L1556: 0 | M1556: =SUM(J1556:L1556)-127.02 -> 1204.9300000000001 | N1556: 127.02 | O1556: =SUM(M1556:N1556) -> 1331.95
A1557: 8017 | B1557: VALE(SOSSEGO)-PL | C1557: 33.931.478/0009-41 | D1557: 777.95000000000005 | E1557: 0 | F1557: 0 | G1557: 0 | H1557: 0 | I1557: 0 | J1557: 0 | K1557: 859.96000000000004 | L1557: 0 | M1557: =SUM(J1557:L1557)-82.01 -> 777.95000000000005 | N1557: 82.010000000000005 | O1557: =SUM(M1557:N1557) -> 859.96000000000004
A1558: 8019 | B1558: VALE(PORTO)-PL | C1558: 33.592.510/0424-00 | D1558: 2200.3600000000001 | E1558: 0 | F1558: 0 | G1558: 0 | H1558: 0 | I1558: 0 | J1558: 0 | K1558: 2432.3099999999999 | L1558: 0 | M1558: =SUM(J1558:L1558)-231.95 -> 2200.3600000000001 | N1558: 231.94999999999999 | O1558: =SUM(M1558:N1558) -> 2432.3099999999999
A1559: 8020 | B1559: PALMYRA(DOW CORNING)-PL | C1559: 04.872.297/0001-36 | D1559: 1954.3900000000001 | E1559: 0 | F1559: 0 | G1559: 0 | H1559: 0 | I1559: 0 | J1559: 0 | K1559: 2160.4099999999999 | L1559: 0 | M1559: =SUM(J1559:L1559)-206.02 -> 1954.3899999999999 | N1559: 206.02000000000001 | O1559: =SUM(M1559:N1559) -> 2160.4099999999999
A1560: Total Geral | D1560: =SUM(D18:D1559) -> 6999931.7599999942 | E1560: =SUM(E18:E1559) -> 235096.20000000001 | F1560: =SUM(F18:F1559) -> 0 | G1560: =SUM(G18:G1559) -> 0 | H1560: =SUM(H18:H1559) -> 0 | I1560: =SUM(I18:I1559) -> 0 | J1560: =SUM(J18:J1559) -> 255590.05000000002 | K1560: =SUM(K18:K1559) -> 7494453.4699999895 | L1560: =SUM(L18:L1559) -> 247651.08000000002 | M1560: =SUM(M18:M1559) -> 7235027.9599999944 | N1560: =SUM(N18:N1559) -> 762666.64000000199 | O1560: =SUM(O18:O1559) -> 7997694.5999999922