B1: Relatório de Aviso de Crédito
A2: 1174 | B2: Empresa: ELETROSUL (FOTE) | D2: Número AVC: | E2: 33975
D4: Receita Anual Permitida | E4: 19682184.390000001
D5: Recebimento Mensal (receita Anual/12) | E5: 1640182.03
D6: Receita Permitida | E6: 1640182.03
D7: PIS/PASEP e COFINS * | E7: 209441.01999999999
D8: Antecipação | E8: -66743.600000000006
D9: Parcela de Ajuste do Ciclo Anterior | E9: -51557.57
D10: Rede de Fronteira | E10: 532905.59999999998
D11: Total s/ PIS/PASEP e COFINS | E11: 2054786.46
D12: Total c/ PIS/PASEP e COFINS | E12: 2264227.48
D14: * Alíquota PIS/PASEP e COFINS = 9,25% (com RGR = 0,00%)
B16: Usuárias | C16: CNPJ | D16: Rede Básica | E16: Total de Fronteira | F16: Quota Proinfa | G16: Quota CCC Sist. Interligado | H16: Quota CCC Sist. Isolado | I16: Quota CDE | J16: 1a. Parcela dia 15/11/2023 | K16: 2a. Parcela dia 25/11/2023 | L16: 3a. Parcela dia 05/12/2023 | M16: Total s/ PIS/PASEP e COFINS | N16: PIS/PASEP e COFINS | O16: Total c/ PIS/PASEP e COFINS
A17: 2001 | B17: RGE SUL (AES-SUL) | C17: 02.016.440/0001-62 | D17: 41297.440000000002 | E17: 195225.60000000001 | F17: 0 | G17: 0 | H17: 0 | I17: 0 | J17: 0 | K17: 260631.45000000001 | L17: 0 | M17: =SUM(J17:L17)-24108.41 -> 236523.04000000001 | N17: 24108.41 | O17: =SUM(M17:N17) -> 260631.45000000001
A18: 2002 | B18: EDP SAO PAULO (BANDEIRANTE) | C18: 02.302.100/0001-06 | D18: 27988.220000000001 | E18: 0 | F18: 0 | G18: 0 | H18: 0 | I18: 0 | J18: 10280.34 | K18: 10280.34 | L18: 10280.33 | M18: =SUM(J18:L18)-2852.79 -> 27988.220000000001 | N18: 2852.79 | O18: =SUM(M18:N18) -> 30841.010000000002
A19: 2004 | B19: ENERGISA SUL-SUDESTE | C19: 07.282.377/0001-20 | D19: 7135.4899999999998 | E19: 0 | F19: 0 | G19: 0 | H19: 0 | I19: 0 | J19: 0 | K19: 7862.8000000000002 | L19: 0 | M19: =SUM(J19:L19)-727.31 -> 7135.4899999999998 | N19: 727.30999999999995 | O19: =SUM(M19:N19) -> 7862.7999999999993
A20: 2006 | B20: CBA | C20: 61.409.892/0003-35 | D20: 475.10000000000002 | E20: 0 | F20: 0 | G20: 0 | H20: 0 | I20: 0 | J20: 0 | K20: 523.52999999999997 | L20: 0 | M20: =SUM(J20:L20)-48.43 -> 475.09999999999997 | N20: 48.43 | O20: =SUM(M20:N20) -> 523.52999999999997
A21: 2007 | B21: EQUATORIAL ALAGOAS (CEAL) | C21: 12.272.084/0001-00 | D21: 9793.9400000000005 | E21: 0 | F21: 0 | G21: 0 | H21: 0 | I21: 0 | J21: 0 | K21: 10792.219999999999 | L21: 0 | M21: =SUM(J21:L21)-998.28 -> 9793.9399999999987 | N21: 998.27999999999997 | O21: =SUM(M21:N21) -> 10792.219999999999
A22: 2008 | B22: CEB | C22: 07.522.669/0001-92 | D22: 12382.110000000001 | E22: 0 | F22: 0 | G22: 0 | H22: 0 | I22: 0 | J22: 0 | K22: 13644.200000000001 | L22: 0 | M22: =SUM(J22:L22)-1262.09 -> 12382.110000000001 | N22: 1262.0899999999999 | O22: =SUM(M22:N22) -> 13644.200000000001
A23: 2009 | B23: CEEE-D | C23: 08.467.115/0001-00 | D23: 26760.040000000001 | E23: 0 | F23: 0 | G23: 0 | H23: 0 | I23: 0 | J23: 9829.2199999999993 | K23: 9829.2199999999993 | L23: 9829.2099999999991 | M23: =SUM(J23:L23)-2727.61 -> 26760.039999999997 | N23: 2727.6100000000001 | O23: =SUM(M23:N23) -> 29487.649999999998
A24: 2011 | B24: CELESC | C24: 08.336.783/0001-90 | D24: 58092.889999999999 | E24: 337680 | F24: 0 | G24: 0 | H24: 0 | I24: 0 | J24: 145371.13 | K24: 145371.13 | L24: 145371.12 | M24: =SUM(J24:L24)-40340.49 -> 395772.89000000001 | N24: 40340.489999999998 | O24: =SUM(M24:N24) -> 436113.38
A25: 2012 | B25: CELG-D | C25: 01.543.032/0001-04 | D25: 24326.18 | E25: 0 | F25: 0 | G25: 0 | H25: 0 | I25: 0 | J25: 0 | K25: 0 | L25: 26805.709999999999 | M25: =SUM(J25:L25)-2479.53 -> 24326.18 | N25: 2479.5300000000002 | O25: =SUM(M25:N25) -> 26805.709999999999
A26: 2013 | B26: EQUATORIAL PARA (CELPA) | C26: 04.895.728/0001-80 | D26: 23467.720000000001 | E26: 0 | F26: 0 | G26: 0 | H26: 0 | I26: 0 | J26: 8619.9200000000001 | K26: 8619.9200000000001 | L26: 8619.9099999999999 | M26: =SUM(J26:L26)-2392.03 -> 23467.720000000001 | N26: 2392.0300000000002 | O26: =SUM(M26:N26) -> 25859.75
A27: 2014 | B27: CELPE | C27: 10.835.932/0001-08 | D27: 23374.700000000001 | E27: 0 | F27: 0 | G27: 0 | H27: 0 | I27: 0 | J27: 0 | K27: 25757.25 | L27: 0 | M27: =SUM(J27:L27)-2382.55 -> 23374.700000000001 | N27: 2382.5500000000002 | O27: =SUM(M27:N27) -> 25757.25
A28: 2016 | B28: ENERGISA TO (CELTINS) | C28: 25.086.034/0001-71 | D28: 4049.0599999999999 | E28: 0 | F28: 0 | G28: 0 | H28: 0 | I28: 0 | J28: 0 | K28: 4461.7700000000004 | L28: 0 | M28: =SUM(J28:L28)-412.71 -> 4049.0600000000004 | N28: 412.70999999999998 | O28: =SUM(M28:N28) -> 4461.7700000000004
A29: 2017 | B29: EQUATORIAL MARANHÃO (CEMAR) | C29: 06.272.793/0001-84 | D29: 12908.389999999999 | E29: 0 | F29: 0 | G29: 0 | H29: 0 | I29: 0 | J29: 0 | K29: 14224.120000000001 | L29: 0 | M29: =SUM(J29:L29)-1315.73 -> 12908.390000000001 | N29: 1315.73 | O29: =SUM(M29:N29) -> 14224.120000000001
A30: 2018 | B30: ENERGISA MT (CEMAT) | C30: 03.467.321/0001-99 | D30: 15276.889999999999 | E30: 0 | F30: 0 | G30: 0 | H30: 0 | I30: 0 | J30: 0 | K30: 16834.040000000001 | L30: 0 | M30: =SUM(J30:L30)-1557.15 -> 15276.890000000001 | N30: 1557.1500000000001 | O30: =SUM(M30:N30) -> 16834.040000000001
A31: 2019 | B31: CEMIG-D | C31: 06.981.180/0001-16 | D31: 81518.330000000002 | E31: 0 | F31: 0 | G31: 0 | H31: 0 | I31: 0 | J31: 0 | K31: 89827.360000000001 | L31: 0 | M31: =SUM(J31:L31)-8309.03 -> 81518.330000000002 | N31: 8309.0300000000007 | O31: =SUM(M31:N31) -> 89827.360000000001
A32: 2020 | B32: EQUATORIAL PIAUI (CEPISA) | C32: 06.840.748/0001-89 | D32: 8345.5499999999993 | E32: 0 | F32: 0 | G32: 0 | H32: 0 | I32: 0 | J32: 0 | K32: 9196.2000000000007 | L32: 0 | M32: =SUM(J32:L32)-850.65 -> 8345.5500000000011 | N32: 850.64999999999998 | O32: =SUM(M32:N32) -> 9196.2000000000007
A33: 2021 | B33: AMPLA | C33: 33.050.071/0001-58 | D33: 24946 | E33: 0 | F33: 0 | G33: 0 | H33: 0 | I33: 0 | J33: 9162.8999999999996 | K33: 9162.8999999999996 | L33: 9162.9099999999999 | M33: =SUM(J33:L33)-2542.71 -> 24946 | N33: 2542.71 | O33: =SUM(M33:N33) -> 27488.709999999999
A34: 2024 | B34: JAGUARI | C34: 53.859.112/0001-69 | D34: 6109.3400000000001 | E34: 0 | F34: 0 | G34: 0 | H34: 0 | I34: 0 | J34: 0 | K34: 6732.0600000000004 | L34: 0 | M34: =SUM(J34:L34)-622.72 -> 6109.3400000000001 | N34: 622.72000000000003 | O34: =SUM(M34:N34) -> 6732.0600000000004
A35: 2025 | B35: COELBA-D | C35: 15.139.629/0001-94 | D35: 42619.07 | E35: 0 | F35: 0 | G35: 0 | H35: 0 | I35: 0 | J35: 0 | K35: 46963.160000000003 | L35: 0 | M35: =SUM(J35:L35)-4344.09 -> 42619.070000000007 | N35: 4344.0900000000001 | O35: =SUM(M35:N35) -> 46963.160000000003
A36: 2026 | B36: COELCE | C36: 07.047.251/0001-70 | D36: 17129.16 | E36: 0 | F36: 0 | G36: 0 | H36: 0 | I36: 0 | J36: 0 | K36: 18875.110000000001 | L36: 0 | M36: =SUM(J36:L36)-1745.95 -> 17129.16 | N36: 1745.95 | O36: =SUM(M36:N36) -> 18875.110000000001
A37: 2027 | B37: COPEL-D | C37: 04.368.898/0001-06 | D37: 76221.410000000003 | E37: 0 | F37: 0 | G37: 0 | H37: 0 | I37: 0 | J37: 0 | K37: 83990.529999999999 | L37: 0 | M37: =SUM(J37:L37)-7769.12 -> 76221.410000000003 | N37: 7769.1199999999999 | O37: =SUM(M37:N37) -> 83990.529999999999
A38: 2028 | B38: COSERN | C38: 08.324.196/0001-81 | D38: 8265.2199999999993 | E38: 0 | F38: 0 | G38: 0 | H38: 0 | I38: 0 | J38: 0 | K38: 9107.6800000000003 | L38: 0 | M38: =SUM(J38:L38)-842.46 -> 8265.2200000000012 | N38: 842.46000000000004 | O38: =SUM(M38:N38) -> 9107.6800000000003
A39: 2030 | B39: CPFL-D | C39: 33.050.196/0001-88 | D39: 53519.269999999997 | E39: 0 | F39: 0 | G39: 0 | H39: 0 | I39: 0 | J39: 0 | K39: 58974.400000000001 | L39: 0 | M39: =SUM(J39:L39)-5455.13 -> 53519.270000000004 | N39: 5455.1300000000001 | O39: =SUM(M39:N39) -> 58974.400000000001
A40: 2032 | B40: DME | C40: 23.664.303/0001-04 | D40: 697.55999999999995 | E40: 0 | F40: 0 | G40: 0 | H40: 0 | I40: 0 | J40: 0 | K40: 768.65999999999997 | L40: 0 | M40: =SUM(J40:L40)-71.1 -> 697.55999999999995 | N40: 71.099999999999994 | O40: =SUM(M40:N40) -> 768.65999999999997
A41: 2033 | B41: ELEKTRO | C41: 02.328.280/0001-97 | D41: 32755.459999999999 | E41: 0 | F41: 0 | G41: 0 | H41: 0 | I41: 0 | J41: 0 | K41: 36094.169999999998 | L41: 0 | M41: =SUM(J41:L41)-3338.71 -> 32755.459999999999 | N41: 3338.71 | O41: =SUM(M41:N41) -> 36094.169999999998
A42: 2035 | B42: ELETROPAULO | C42: 61.695.227/0001-93 | D42: 71339.039999999994 | E42: 0 | F42: 0 | G42: 0 | H42: 0 | I42: 0 | J42: 0 | K42: 78610.509999999995 | L42: 0 | M42: =SUM(J42:L42)-7271.47 -> 71339.039999999994 | N42: 7271.4700000000003 | O42: =SUM(M42:N42) -> 78610.509999999995
A43: 2036 | B43: ENERGISA SE (ENERGIPE) | C43: 13.017.462/0001-63 | D43: 3961.2199999999998 | E43: 0 | F43: 0 | G43: 0 | H43: 0 | I43: 0 | J43: 0 | K43: 4364.9799999999996 | L43: 0 | M43: =SUM(J43:L43)-403.76 -> 3961.2199999999993 | N43: 403.75999999999999 | O43: =SUM(M43:N43) -> 4364.9799999999996
A44: 2037 | B44: ENERGISA MS (ENERSUL) | C44: 15.413.826/0001-50 | D44: 10396.139999999999 | E44: 0 | F44: 0 | G44: 0 | H44: 0 | I44: 0 | J44: 0 | K44: 11455.799999999999 | L44: 0 | M44: =SUM(J44:L44)-1059.66 -> 10396.139999999999 | N44: 1059.6600000000001 | O44: =SUM(M44:N44) -> 11455.799999999999
A45: 2038 | B45: EDP ES | C45: 28.152.650/0001-71 | D45: 15359.07 | E45: 0 | F45: 0 | G45: 0 | H45: 0 | I45: 0 | J45: 0 | K45: 16924.599999999999 | L45: 0 | M45: =SUM(J45:L45)-1565.53 -> 15359.069999999998 | N45: 1565.53 | O45: =SUM(M45:N45) -> 16924.599999999999
A46: 2040 | B46: LIGHT-D | C46: 60.444.437/0001-46 | D46: 47060.620000000003 | E46: 0 | F46: 0 | G46: 0 | H46: 0 | I46: 0 | J46: 0 | K46: 51857.43 | L46: 0 | M46: =SUM(J46:L46)-4796.81 -> 47060.620000000003 | N46: 4796.8100000000004 | O46: =SUM(M46:N46) -> 51857.43
A47: 2042 | B47: PIRATININGA | C47: 04.172.213/0001-51 | D47: 23220.27 | E47: 0 | F47: 0 | G47: 0 | H47: 0 | I47: 0 | J47: 0 | K47: 25587.07 | L47: 0 | M47: =SUM(J47:L47)-2366.8 -> 23220.27 | N47: 2366.8000000000002 | O47: =SUM(M47:N47) -> 25587.07
A48: 2044 | B48: ENERGISA PB (SAELPA) | C48: 09.095.183/0001-40 | D48: 8134.0600000000004 | E48: 0 | F48: 0 | G48: 0 | H48: 0 | I48: 0 | J48: 0 | K48: 8963.1499999999996 | L48: 0 | M48: =SUM(J48:L48)-829.09 -> 8134.0599999999995 | N48: 829.09000000000003 | O48: =SUM(M48:N48) -> 8963.1499999999996
A49: 2048 | B49: SULGIPE | C49: 13.255.658/0001-96 | D49: 650.60000000000002 | E49: 0 | F49: 0 | G49: 0 | H49: 0 | I49: 0 | J49: 0 | K49: 716.90999999999997 | L49: 0 | M49: =SUM(J49:L49)-66.31 -> 650.59999999999991 | N49: 66.310000000000002 | O49: =SUM(M49:N49) -> 716.90999999999985
A50: 2050 | B50: ELFSM | C50: 27.485.069/0001-09 | D50: 684.38999999999999 | E50: 0 | F50: 0 | G50: 0 | H50: 0 | I50: 0 | J50: 0 | K50: 754.14999999999998 | L50: 0 | M50: =SUM(J50:L50)-69.76 -> 684.38999999999999 | N50: 69.760000000000005 | O50: =SUM(M50:N50) -> 754.14999999999998
A51: 2051 | B51: ENERGISA MG (CFLCL) | C51: 19.527.639/0001-58 | D51: 1202.8 | E51: 0 | F51: 0 | G51: 0 | H51: 0 | I51: 0 | J51: 0 | K51: 1325.4000000000001 | L51: 0 | M51: =SUM(J51:L51)-122.6 -> 1202.8000000000002 | N51: 122.59999999999999 | O51: =SUM(M51:N51) -> 1325.4000000000001
A52: 2052 | B52: DCELT (IGUAÇÚ) | C52: 83.855.973/0001-30 | D52: 30.760000000000002 | E52: 0 | F52: 0 | G52: 0 | H52: 0 | I52: 0 | J52: 0 | K52: 33.899999999999999 | L52: 0 | M52: =SUM(J52:L52)-3.14 -> 30.759999999999998 | N52: 3.1400000000000001 | O52: =SUM(M52:N52) -> 33.899999999999999
A53: 2053 | B53: ENERGISA AC (ELETROACRE) | C53: 04.065.033/0001-70 | D53: 908.45000000000005 | E53: 0 | F53: 0 | G53: 0 | H53: 0 | I53: 0 | J53: 0 | K53: 1001.05 | L53: 0 | M53: =SUM(J53:L53)-92.6 -> 908.44999999999993 | N53: 92.599999999999994 | O53: =SUM(M53:N53) -> 1001.05
A54: 2054 | B54: ENERGISA RONDONIA (CERON) | C54: 05.914.650/0001-66 | D54: 4066.9400000000001 | E54: 0 | F54: 0 | G54: 0 | H54: 0 | I54: 0 | J54: 0 | K54: 4481.4799999999996 | L54: 0 | M54: =SUM(J54:L54)-414.54 -> 4066.9399999999996 | N54: 414.54000000000002 | O54: =SUM(M54:N54) -> 4481.4799999999996
A55: 2055 | B55: COPREL | C55: 90.660.754/0001-60 | D55: 480.51999999999998 | E55: 0 | F55: 0 | G55: 0 | H55: 0 | I55: 0 | J55: 0 | K55: 529.5 | L55: 0 | M55: =SUM(J55:L55)-48.98 -> 480.51999999999998 | N55: 48.979999999999997 | O55: =SUM(M55:N55) -> 529.5
A56: 2057 | B56: HIDROPAN | C56: 91.982.348/0001-87 | D56: 237.03 | E56: 0 | F56: 0 | G56: 0 | H56: 0 | I56: 0 | J56: 0 | K56: 261.19 | L56: 0 | M56: =SUM(J56:L56)-24.16 -> 237.03 | N56: 24.16 | O56: =SUM(M56:N56) -> 261.19
A57: 2058 | B57: ELETROCAR | C57: 88.446.034/0001-55 | D57: 429 | E57: 0 | F57: 0 | G57: 0 | H57: 0 | I57: 0 | J57: 0 | K57: 472.73000000000002 | L57: 0 | M57: =SUM(J57:L57)-43.73 -> 429 | N57: 43.729999999999997 | O57: =SUM(M57:N57) -> 472.73000000000002
A58: 2059 | B58: CERTAJA | C58: 97.839.922/0001-29 | D58: 251.63999999999999 | E58: 0 | F58: 0 | G58: 0 | H58: 0 | I58: 0 | J58: 0 | K58: 277.29000000000002 | L58: 0 | M58: =SUM(J58:L58)-25.65 -> 251.64000000000001 | N58: 25.649999999999999 | O58: =SUM(M58:N58) -> 277.29000000000002
A59: 2060 | B59: DEMEI | C59: 95.289.500/0001-00 | D59: 604.13999999999999 | E59: 0 | F59: 0 | G59: 0 | H59: 0 | I59: 0 | J59: 0 | K59: 665.72000000000003 | L59: 0 | M59: =SUM(J59:L59)-61.58 -> 604.13999999999999 | N59: 61.579999999999998 | O59: =SUM(M59:N59) -> 665.72000000000003
A60: 2061 | B60: CERILUZ | C60: 87.656.989/0001-74 | D60: 174.78 | E60: 0 | F60: 0 | G60: 0 | H60: 0 | I60: 0 | J60: 0 | K60: 192.59999999999999 | L60: 0 | M60: =SUM(J60:L60)-17.82 -> 174.78 | N60: 17.82 | O60: =SUM(M60:N60) -> 192.59999999999999
A61: 2063 | B61: COOPERA | C61: 83.646.653/0001-70 | D61: 493.63999999999999 | E61: 0 | F61: 0 | G61: 0 | H61: 0 | I61: 0 | J61: 0 | K61: 543.96000000000004 | L61: 0 | M61: =SUM(J61:L61)-50.32 -> 493.64000000000004 | N61: 50.32 | O61: =SUM(M61:N61) -> 543.96000000000004
A62: 2064 | B62: CEA-D | C62: 05.965.546/0001-09 | D62: 1835.48 | E62: 0 | F62: 0 | G62: 0 | H62: 0 | I62: 0 | J62: 0 | K62: 2022.5699999999999 | L62: 0 | M62: =SUM(J62:L62)-187.09 -> 1835.48 | N62: 187.09 | O62: =SUM(M62:N62) -> 2022.5699999999999
A63: 2065 | B63: AMAZONAS-D | C63: 02.341.467/0001-20 | D63: 11901.18 | E63: 0 | F63: 0 | G63: 0 | H63: 0 | I63: 0 | J63: 0 | K63: 13114.25 | L63: 0 | M63: =SUM(J63:L63)-1213.07 -> 11901.18 | N63: 1213.0699999999999 | O63: =SUM(M63:N63) -> 13114.25
A64: 2066 | B64: COOPERLUZ | C64: 95.824.322/0001-61 | D64: 161.06 | E64: 0 | F64: 0 | G64: 0 | H64: 0 | I64: 0 | J64: 0 | K64: 177.47999999999999 | L64: 0 | M64: =SUM(J64:L64)-16.42 -> 161.06 | N64: 16.420000000000002 | O64: =SUM(M64:N64) -> 177.48000000000002
A65: 2067 | B65: NOVA PALMA | C65: 89.889.604/0001-44 | D65: 11.44 | E65: 0 | F65: 0 | G65: 0 | H65: 0 | I65: 0 | J65: 0 | K65: 12.609999999999999 | L65: 0 | M65: =SUM(J65:L65)-1.17 -> 11.44 | N65: 1.1699999999999999 | O65: =SUM(M65:N65) -> 12.609999999999999
A66: 2068 | B66: CHESP(SÃO PATRÍCIO) | C66: 01.377.555/0001-10 | D66: 236.52000000000001 | E66: 0 | F66: 0 | G66: 0 | H66: 0 | I66: 0 | J66: 0 | K66: 260.63 | L66: 0 | M66: =SUM(J66:L66)-24.11 -> 236.51999999999998 | N66: 24.109999999999999 | O66: =SUM(M66:N66) -> 260.63
A67: 2069 | B67: FORCEL | C67: 79.850.574/0001-09 | D67: 6.7000000000000002 | E67: 0 | F67: 0 | G67: 0 | H67: 0 | I67: 0 | J67: 0 | K67: 7.3799999999999999 | L67: 0 | M67: =SUM(J67:L67)-0.68 -> 6.7000000000000002 | N67: 0.68000000000000005 | O67: =SUM(M67:N67) -> 7.3799999999999999
A68: 2070 | B68: MUXENERGIA | C68: 97.578.090/0001-34 | D68: 10.1 | E68: 0 | F68: 0 | G68: 0 | H68: 0 | I68: 0 | J68: 0 | K68: 11.130000000000001 | L68: 0 | M68: =SUM(J68:L68)-1.03 -> 10.100000000000001 | N68: 1.03 | O68: =SUM(M68:N68) -> 11.130000000000001
A69: 2071 | B69: CERMISSÕES | C69: 97.081.434/0001-03 | D69: 186.38 | E69: 0 | F69: 0 | G69: 0 | H69: 0 | I69: 0 | J69: 0 | K69: 205.38 | L69: 0 | M69: =SUM(J69:L69)-19 -> 186.38 | N69: 19 | O69: =SUM(M69:N69) -> 205.38
A70: 2072 | B70: COCEL | C70: 75.805.895/0001-30 | D70: 37.770000000000003 | E70: 0 | F70: 0 | G70: 0 | H70: 0 | I70: 0 | J70: 0 | K70: 41.619999999999997 | L70: 0 | M70: =SUM(J70:L70)-3.85 -> 37.769999999999996 | N70: 3.8500000000000001 | O70: =SUM(M70:N70) -> 41.619999999999997
A71: 2073 | B71: CEMIRIM | C71: 52.777.034/0001-90 | D71: 187.36000000000001 | E71: 0 | F71: 0 | G71: 0 | H71: 0 | I71: 0 | J71: 0 | K71: 206.46000000000001 | L71: 0 | M71: =SUM(J71:L71)-19.1 -> 187.36000000000001 | N71: 19.100000000000001 | O71: =SUM(M71:N71) -> 206.46000000000001
A72: 2074 | B72: CERTEL ENERGIA | C72: 09.257.558/0001-21 | D72: 914.75 | E72: 0 | F72: 0 | G72: 0 | H72: 0 | I72: 0 | J72: 0 | K72: 1007.99 | L72: 0 | M72: =SUM(J72:L72)-93.24 -> 914.75 | N72: 93.239999999999995 | O72: =SUM(M72:N72) -> 1007.99
A73: 2075 | B73: CERTHIL | C73: 98.042.963/0001-52 | D73: 130.66 | E73: 0 | F73: 0 | G73: 0 | H73: 0 | I73: 0 | J73: 0 | K73: 143.97999999999999 | L73: 0 | M73: =SUM(J73:L73)-13.32 -> 130.66 | N73: 13.32 | O73: =SUM(M73:N73) -> 143.97999999999999
A74: 2076 | B74: COOPERALIANÇA | C74: 83.647.990/0001-81 | D74: 33.689999999999998 | E74: 0 | F74: 0 | G74: 0 | H74: 0 | I74: 0 | J74: 0 | K74: 37.119999999999997 | L74: 0 | M74: =SUM(J74:L74)-3.43 -> 33.689999999999998 | N74: 3.4300000000000002 | O74: =SUM(M74:N74) -> 37.119999999999997
A75: 2077 | B75: CERSUL | C75: 86.512.670/0001-02 | D75: 240.16999999999999 | E75: 0 | F75: 0 | G75: 0 | H75: 0 | I75: 0 | J75: 0 | K75: 264.64999999999998 | L75: 0 | M75: =SUM(J75:L75)-24.48 -> 240.16999999999999 | N75: 24.48 | O75: =SUM(M75:N75) -> 264.64999999999998
A76: 2078 | B76: COOPERCOCAL | C76: 86.532.348/0001-45 | D76: 158.66999999999999 | E76: 0 | F76: 0 | G76: 0 | H76: 0 | I76: 0 | J76: 0 | K76: 174.84 | L76: 0 | M76: =SUM(J76:L76)-16.17 -> 158.67000000000002 | N76: 16.170000000000002 | O76: =SUM(M76:N76) -> 174.84000000000003
A77: 3001 | B77: AES TIETÊ | C77: 00.194.724/0001-13 | D77: 6207.8100000000004 | E77: 0 | F77: 0 | G77: 0 | H77: 0 | I77: 0 | J77: 0 | K77: 6840.5600000000004 | L77: 0 | M77: =SUM(J77:L77)-632.75 -> 6207.8100000000004 | N77: 632.75 | O77: =SUM(M77:N77) -> 6840.5600000000004
A78: 3003 | B78: ALCOA (CONS. MACHADINHO) | C78: 23.637.697/0001-01 | D78: 1111.24 | E78: 0 | F78: 0 | G78: 0 | H78: 0 | I78: 0 | J78: 0 | K78: 1224.51 | L78: 0 | M78: =SUM(J78:L78)-113.27 -> 1111.24 | N78: 113.27 | O78: =SUM(M78:N78) -> 1224.51
A79: 3004 | B79: ARCELORMITTAL (CONS. GUILMAN AMORIM | C79: 17.469.701/0066-12 | D79: 187.19 | E79: 0 | F79: 0 | G79: 0 | H79: 0 | I79: 0 | J79: 0 | K79: 206.27000000000001 | L79: 0 | M79: =SUM(J79:L79)-19.08 -> 187.19 | N79: 19.079999999999998 | O79: =SUM(M79:N79) -> 206.26999999999998
A80: 3005 | B80: MACHADINHO PART (CONS. MACHADINHO) | C80: 22.686.342/0001-40 | D80: 227.75999999999999 | E80: 0 | F80: 0 | G80: 0 | H80: 0 | I80: 0 | J80: 0 | K80: 250.97999999999999 | L80: 0 | M80: =SUM(J80:L80)-23.22 -> 227.75999999999999 | N80: 23.219999999999999 | O80: =SUM(M80:N80) -> 250.97999999999999
A81: 3007 | B81: CBA (CONS. MACHADINHO) | C81: 24.241.083/0001-79 | D81: 1188.0899999999999 | E81: 0 | F81: 0 | G81: 0 | H81: 0 | I81: 0 | J81: 0 | K81: 1309.1900000000001 | L81: 0 | M81: =SUM(J81:L81)-121.1 -> 1188.0900000000001 | N81: 121.09999999999999 | O81: =SUM(M81:N81) -> 1309.1900000000001
A82: 3008 | B82: CBA (UHE PIRAJÚ) | C82: 61.409.892/0001-73 | D82: 276.13999999999999 | E82: 0 | F82: 0 | G82: 0 | H82: 0 | I82: 0 | J82: 0 | K82: 304.29000000000002 | L82: 0 | M82: =SUM(J82:L82)-28.15 -> 276.14000000000004 | N82: 28.149999999999999 | O82: =SUM(M82:N82) -> 304.29000000000002
A83: 3009 | B83: CEB LAJEADO (CONS. LAJEADO) | C83: 03.677.638/0001-50 | D83: 786.30999999999995 | E83: 0 | F83: 0 | G83: 0 | H83: 0 | I83: 0 | J83: 0 | K83: 866.46000000000004 | L83: 0 | M83: =SUM(J83:L83)-80.15 -> 786.31000000000006 | N83: 80.150000000000006 | O83: =SUM(M83:N83) -> 866.46000000000004
A84: 3011 | B84: CEEE(CONS. DONA FRANCISCA) | C84: 39.881.421/0001-04 | D84: 70.230000000000004 | E84: 0 | F84: 0 | G84: 0 | H84: 0 | I84: 0 | J84: 0 | K84: 77.390000000000001 | L84: 0 | M84: =SUM(J84:L84)-7.16 -> 70.230000000000004 | N84: 7.1600000000000001 | O84: =SUM(M84:N84) -> 77.390000000000001
A85: 3012 | B85: CEEE(CONS. MACHADINHO) | C85: 39.881.421/0001-04 | D85: 238.72 | E85: 0 | F85: 0 | G85: 0 | H85: 0 | I85: 0 | J85: 0 | K85: 263.05000000000001 | L85: 0 | M85: =SUM(J85:L85)-24.33 -> 238.72000000000003 | N85: 24.329999999999998 | O85: =SUM(M85:N85) -> 263.05000000000001
A86: 3015 | B86: CEMIG-G | C86: 06.981.176/0001-58 | D86: 6897.8199999999997 | E86: 0 | F86: 0 | G86: 0 | H86: 0 | I86: 0 | J86: 0 | K86: 7600.8999999999996 | L86: 0 | M86: =SUM(J86:L86)-703.08 -> 6897.8199999999997 | N86: 703.08000000000004 | O86: =SUM(M86:N86) -> 7600.8999999999996
A87: 3021 | B87: CGTEE | C87: 02.016.507/0001-69 | D87: 1313.79 | E87: 0 | F87: 0 | G87: 0 | H87: 0 | I87: 0 | J87: 0 | K87: 1447.7 | L87: 0 | M87: =SUM(J87:L87)-133.91 -> 1313.79 | N87: 133.91 | O87: =SUM(M87:N87) -> 1447.7
A88: 3022 | B88: CHESF-G | C88: 33.541.368/0001-16 | D88: 46883.190000000002 | E88: 0 | F88: 0 | G88: 0 | H88: 0 | I88: 0 | J88: 0 | K88: 51661.919999999998 | L88: 0 | M88: =SUM(J88:L88)-4778.73 -> 46883.190000000002 | N88: 4778.7299999999996 | O88: =SUM(M88:N88) -> 51661.919999999998
A89: 3025 | B89: COPEL-G | C89: 04.370.282/0001-70 | D89: 10367.530000000001 | E89: 0 | F89: 0 | G89: 0 | H89: 0 | I89: 0 | J89: 0 | K89: 11424.280000000001 | L89: 0 | M89: =SUM(J89:L89)-1056.75 -> 10367.530000000001 | N89: 1056.75 | O89: =SUM(M89:N89) -> 11424.280000000001
A90: 3026 | B90: UEG ARAUCÁRIA | C90: 02.743.574/0001-85 | D90: 1468.3699999999999 | E90: 0 | F90: 0 | G90: 0 | H90: 0 | I90: 0 | J90: 0 | K90: 1618.04 | L90: 0 | M90: =SUM(J90:L90)-149.67 -> 1468.3699999999999 | N90: 149.66999999999999 | O90: =SUM(M90:N90) -> 1618.04
A91: 3027 | B91: COTEMINAS(CONS. PORTO ESTRELA) | C91: 07.663.140/0001-99 | D91: 100.3 | E91: 0 | F91: 0 | G91: 0 | H91: 0 | I91: 0 | J91: 0 | K91: 110.52 | L91: 0 | M91: =SUM(J91:L91)-10.22 -> 100.3 | N91: 10.220000000000001 | O91: =SUM(M91:N91) -> 110.52
A92: 3033 | B92: DFESA(CONS. DONA FRANCISCA) | C92: 02.832.860/0003-89 | D92: 397.94999999999999 | E92: 0 | F92: 0 | G92: 0 | H92: 0 | I92: 0 | J92: 0 | K92: 438.50999999999999 | L92: 0 | M92: =SUM(J92:L92)-40.56 -> 397.94999999999999 | N92: 40.560000000000002 | O92: =SUM(M92:N92) -> 438.50999999999999
A93: 3034 | B93: DME(CONS. MACHADINHO) | C93: 23.664.303/0001-04 | D93: 117.95999999999999 | E93: 0 | F93: 0 | G93: 0 | H93: 0 | I93: 0 | J93: 0 | K93: 129.97999999999999 | L93: 0 | M93: =SUM(J93:L93)-12.02 -> 117.95999999999999 | N93: 12.02 | O93: =SUM(M93:N93) -> 129.97999999999999
A94: 3035 | B94: RIO PARANAPANEMA(DUKE ENERGY) | C94: 02.998.301/0001-81 | D94: 6927.2799999999997 | E94: 0 | F94: 0 | G94: 0 | H94: 0 | I94: 0 | J94: 0 | K94: 7633.3699999999999 | L94: 0 | M94: =SUM(J94:L94)-706.09 -> 6927.2799999999997 | N94: 706.09000000000003 | O94: =SUM(M94:N94) -> 7633.3699999999999
A95: 3038 | B95: PETROBRAS (UTE MARIO LAGO) | C95: 33.000.167/0087-81 | D95: 3005.1100000000001 | E95: 0 | F95: 0 | G95: 0 | H95: 0 | I95: 0 | J95: 0 | K95: 3311.4200000000001 | L95: 0 | M95: =SUM(J95:L95)-306.31 -> 3005.1100000000001 | N95: 306.31 | O95: =SUM(M95:N95) -> 3311.4200000000001
A96: 3039 | B96: ELETRONORTE-G | C96: 00.357.038/0001-16 | D96: 1559.03 | E96: 0 | F96: 0 | G96: 0 | H96: 0 | I96: 0 | J96: 0 | K96: 1717.9400000000001 | L96: 0 | M96: =SUM(J96:L96)-158.91 -> 1559.03 | N96: 158.91 | O96: =SUM(M96:N96) -> 1717.9400000000001
A97: 3040 | B97: ELETRONUCLEAR | C97: 42.540.211/0001-67 | D97: 8108.6300000000001 | E97: 0 | F97: 0 | G97: 0 | H97: 0 | I97: 0 | J97: 0 | K97: 8935.1299999999992 | L97: 0 | M97: =SUM(J97:L97)-826.5 -> 8108.6299999999992 | N97: 826.5 | O97: =SUM(M97:N97) -> 8935.1299999999992
A98: 3044 | B98: FURNAS(APM MANSO) | C98: 23.274.194/0001-19 | D98: 1111.0699999999999 | E98: 0 | F98: 0 | G98: 0 | H98: 0 | I98: 0 | J98: 0 | K98: 1224.3199999999999 | L98: 0 | M98: =SUM(J98:L98)-113.25 -> 1111.0699999999999 | N98: 113.25 | O98: =SUM(M98:N98) -> 1224.3199999999999
A99: 3045 | B99: INVESTCO(CONS. LAJEADO) | C99: 00.644.907/0001-93 | D99: 39.710000000000001 | E99: 0 | F99: 0 | G99: 0 | H99: 0 | I99: 0 | J99: 0 | K99: 43.759999999999998 | L99: 0 | M99: =SUM(J99:L99)-4.05 -> 39.710000000000001 | N99: 4.0499999999999998 | O99: =SUM(M99:N99) -> 43.759999999999998
A100: 3046 | B100: ITAPEBI(UHE ITAPEBI) | C100: 02.397.080/0002-77 | D100: 1035.6600000000001 | E100: 0 | F100: 0 | G100: 0 | H100: 0 | I100: 0 | J100: 0 | K100: 1141.22 | L100: 0 | M100: =SUM(J100:L100)-105.56 -> 1035.6600000000001 | N100: 105.56 | O100: =SUM(M100:N100) -> 1141.22
A101: 3047 | B101: ITASA (CONS. ITÁ) | C101: 01.355.994/0002-02 | D101: 3200.6700000000001 | E101: 0 | F101: 0 | G101: 0 | H101: 0 | I101: 0 | J101: 0 | K101: 3526.9099999999999 | L101: 0 | M101: =SUM(J101:L101)-326.24 -> 3200.6700000000001 | N101: 326.24000000000001 | O101: =SUM(M101:N101) -> 3526.9099999999999
A102: 3048 | B102: ITIQUIRA(UHE ITIQUIRA) | C102: 02.808.298/0017-53 | D102: 798.15999999999997 | E102: 0 | F102: 0 | G102: 0 | H102: 0 | I102: 0 | J102: 0 | K102: 879.51999999999998 | L102: 0 | M102: =SUM(J102:L102)-81.36 -> 798.15999999999997 | N102: 81.359999999999999 | O102: =SUM(M102:N102) -> 879.51999999999998
A103: 3052 | B103: PETROBRAS(UTE TERMOCEARÁ) | C103: 33.000.167/0104-17 | D103: 826.88999999999999 | E103: 0 | F103: 0 | G103: 0 | H103: 0 | I103: 0 | J103: 0 | K103: 911.16999999999996 | L103: 0 | M103: =SUM(J103:L103)-84.28 -> 826.88999999999999 | N103: 84.280000000000001 | O103: =SUM(M103:N103) -> 911.16999999999996
A104: 3054 | B104: PAULISTA LAJEADO(CONS. LAJEADO) | C104: 03.491.603/0001-21 | D104: 275.20999999999998 | E104: 0 | F104: 0 | G104: 0 | H104: 0 | I104: 0 | J104: 0 | K104: 303.25999999999999 | L104: 0 | M104: =SUM(J104:L104)-28.05 -> 275.20999999999998 | N104: 28.050000000000001 | O104: =SUM(M104:N104) -> 303.25999999999999
A105: 3055 | B105: PETROBRAS (UTE SEPÉ-TIARAJU) | C105: 33.000.167/0071-14 | D105: 797.82000000000005 | E105: 0 | F105: 0 | G105: 0 | H105: 0 | I105: 0 | J105: 0 | K105: 879.13999999999999 | L105: 0 | M105: =SUM(J105:L105)-81.32 -> 797.81999999999994 | N105: 81.319999999999993 | O105: =SUM(M105:N105) -> 879.13999999999987
A106: 3057 | B106: PETROBRAS(UTE FERNAN GASPARIAN) | C106: 33.000.167/0026-60 | D106: 584.70000000000005 | E106: 0 | F106: 0 | G106: 0 | H106: 0 | I106: 0 | J106: 0 | K106: 644.29999999999995 | L106: 0 | M106: =SUM(J106:L106)-59.6 -> 584.69999999999993 | N106: 59.600000000000001 | O106: =SUM(M106:N106) -> 644.29999999999995
A107: 3058 | B107: PETROBRAS (UTE CELSO FURTADO) | C107: 33.000.167/0024-06 | D107: 587.27999999999997 | E107: 0 | F107: 0 | G107: 0 | H107: 0 | I107: 0 | J107: 0 | K107: 647.13999999999999 | L107: 0 | M107: =SUM(J107:L107)-59.86 -> 587.27999999999997 | N107: 59.859999999999999 | O107: =SUM(M107:N107) -> 647.13999999999999
A108: 3061 | B108: LAJEADO ENERGIA(CONS. LAJEADO) | C108: 03.460.864/0002-65 | D108: 2870.0500000000002 | E108: 0 | F108: 0 | G108: 0 | H108: 0 | I108: 0 | J108: 0 | K108: 3162.5900000000001 | L108: 0 | M108: =SUM(J108:L108)-292.54 -> 2870.0500000000002 | N108: 292.54000000000002 | O108: =SUM(M108:N108) -> 3162.5900000000001
A109: 3062 | B109: VCB(CONS. MACHADINHO) | C109: 28.323.127/0001-60 | D109: 242.49000000000001 | E109: 0 | F109: 0 | G109: 0 | H109: 0 | I109: 0 | J109: 0 | K109: 267.20999999999998 | L109: 0 | M109: =SUM(J109:L109)-24.72 -> 242.48999999999998 | N109: 24.719999999999999 | O109: =SUM(M109:N109) -> 267.20999999999998
A110: 3064 | B110: SAMARCO(CONS.GUILMAN AMORIM) | C110: 16.628.281/0003-23 | D110: 179.84999999999999 | E110: 0 | F110: 0 | G110: 0 | H110: 0 | I110: 0 | J110: 0 | K110: 198.18000000000001 | L110: 0 | M110: =SUM(J110:L110)-18.33 -> 179.85000000000002 | N110: 18.329999999999998 | O110: =SUM(M110:N110) -> 198.18000000000001
A111: 3068 | B111: TERMOPERNAMBUCO(UTE TERMOPERN.) | C111: 03.795.050/0002-81 | D111: 1968.53 | E111: 0 | F111: 0 | G111: 0 | H111: 0 | I111: 0 | J111: 0 | K111: 2169.1799999999998 | L111: 0 | M111: =SUM(J111:L111)-200.65 -> 1968.5299999999997 | N111: 200.65000000000001 | O111: =SUM(M111:N111) -> 2169.1799999999998
A112: 3069 | B112: ENGIE | C112: 02.474.103/0001-19 | D112: 14893.74 | E112: 0 | F112: 0 | G112: 0 | H112: 0 | I112: 0 | J112: 0 | K112: 16411.830000000002 | L112: 0 | M112: =SUM(J112:L112)-1518.09 -> 14893.740000000002 | N112: 1518.0899999999999 | O112: =SUM(M112:N112) -> 16411.830000000002
A113: 3070 | B113: ENGIE (CONS. ITÁ) | C113: 02.474.103/0001-19 | D113: 2372.5 | E113: 0 | F113: 0 | G113: 0 | H113: 0 | I113: 0 | J113: 0 | K113: 2614.3299999999999 | L113: 0 | M113: =SUM(J113:L113)-241.83 -> 2372.5 | N113: 241.83000000000001 | O113: =SUM(M113:N113) -> 2614.3299999999999
A114: 3071 | B114: ENGIE (CONS. MACHADINHO) | C114: 02.474.103/0001-19 | D114: 832.45000000000005 | E114: 0 | F114: 0 | G114: 0 | H114: 0 | I114: 0 | J114: 0 | K114: 917.29999999999995 | L114: 0 | M114: =SUM(J114:L114)-84.85 -> 832.44999999999993 | N114: 84.849999999999994 | O114: =SUM(M114:N114) -> 917.29999999999995
A115: 3072 | B115: VALE (VALESUL-CONS. MACHADINHO) | C115: 33.592.510/0005-88 | D115: 357.97000000000003 | E115: 0 | F115: 0 | G115: 0 | H115: 0 | I115: 0 | J115: 0 | K115: 394.45999999999998 | L115: 0 | M115: =SUM(J115:L115)-36.49 -> 357.96999999999997 | N115: 36.490000000000002 | O115: =SUM(M115:N115) -> 394.45999999999998
A116: 3073 | B116: EMAE | C116: 02.302.101/0001-42 | D116: 188.99000000000001 | E116: 0 | F116: 0 | G116: 0 | H116: 0 | I116: 0 | J116: 0 | K116: 208.25 | L116: 0 | M116: =SUM(J116:L116)-19.26 -> 188.99000000000001 | N116: 19.260000000000002 | O116: =SUM(M116:N116) -> 208.25
A117: 3074 | B117: CGTF(UTE FORTALEZA) | C117: 04.423.567/0016-08 | D117: 1220.8099999999999 | E117: 0 | F117: 0 | G117: 0 | H117: 0 | I117: 0 | J117: 0 | K117: 1345.25 | L117: 0 | M117: =SUM(J117:L117)-124.44 -> 1220.8099999999999 | N117: 124.44 | O117: =SUM(M117:N117) -> 1345.25
A118: 3078 | B118: NORTE FLUMINENSE(UTE NORTE FLUM.) | C118: 03.258.983/0002-30 | D118: 2825.4400000000001 | E118: 0 | F118: 0 | G118: 0 | H118: 0 | I118: 0 | J118: 0 | K118: 3113.4299999999998 | L118: 0 | M118: =SUM(J118:L118)-287.99 -> 2825.4399999999996 | N118: 287.99000000000001 | O118: =SUM(M118:N118) -> 3113.4299999999994
A119: 3079 | B119: CDSA | C119: 01.672.223/0001-68 | D119: 2688.7199999999998 | E119: 0 | F119: 0 | G119: 0 | H119: 0 | I119: 0 | J119: 0 | K119: 2962.7800000000002 | L119: 0 | M119: =SUM(J119:L119)-274.06 -> 2688.7200000000003 | N119: 274.06 | O119: =SUM(M119:N119) -> 2962.7800000000002
A120: 3083 | B120: VOTORANTIM(UHE PEDRA DO CAVALO) | C120: 10.656.452/0066-25 | D120: 489.20999999999998 | E120: 0 | F120: 0 | G120: 0 | H120: 0 | I120: 0 | J120: 0 | K120: 539.07000000000005 | L120: 0 | M120: =SUM(J120:L120)-49.86 -> 489.21000000000004 | N120: 49.859999999999999 | O120: =SUM(M120:N120) -> 539.07000000000005
A121: 3084 | B121: CERAN | C121: 04.237.975/0001-99 | D121: 1216.0999999999999 | E121: 0 | F121: 0 | G121: 0 | H121: 0 | I121: 0 | J121: 0 | K121: 1340.0599999999999 | L121: 0 | M121: =SUM(J121:L121)-123.96 -> 1216.0999999999999 | N121: 123.95999999999999 | O121: =SUM(M121:N121) -> 1340.0599999999999
A122: 3090 | B122: BAESA (UHE BARRA GRANDE) | C122: 04.781.143/0001-39 | D122: 2728.5599999999999 | E122: 0 | F122: 0 | G122: 0 | H122: 0 | I122: 0 | J122: 0 | K122: 3006.6799999999998 | L122: 0 | M122: =SUM(J122:L122)-278.12 -> 2728.5599999999999 | N122: 278.12 | O122: =SUM(M122:N122) -> 3006.6799999999998
A123: 3095 | B123: PETROBRAS(UTE JESUS S. PEREIRA) | C123: 33.000.167/0148-38 | D123: 1431.8499999999999 | E123: 0 | F123: 0 | G123: 0 | H123: 0 | I123: 0 | J123: 0 | K123: 1577.8 | L123: 0 | M123: =SUM(J123:L123)-145.95 -> 1431.8499999999999 | N123: 145.94999999999999 | O123: =SUM(M123:N123) -> 1577.8
A124: 3097 | B124: CEMIG(UHE IRAPÉ) | C124: 06.981.176/0001-58 | D124: 1315.54 | E124: 0 | F124: 0 | G124: 0 | H124: 0 | I124: 0 | J124: 0 | K124: 1449.6300000000001 | L124: 0 | M124: =SUM(J124:L124)-134.09 -> 1315.5400000000002 | N124: 134.09 | O124: =SUM(M124:N124) -> 1449.6300000000001
A125: 3098 | B125: VERACEL(UTE VERACEL) | C125: 40.551.996/0001-48 | D125: 31.039999999999999 | E125: 0 | F125: 0 | G125: 0 | H125: 0 | I125: 0 | J125: 0 | K125: 34.200000000000003 | L125: 0 | M125: =SUM(J125:L125)-3.16 -> 31.040000000000003 | N125: 3.1600000000000001 | O125: =SUM(M125:N125) -> 34.200000000000003
A126: 3102 | B126: ENERPEIXE(UHE PEIXE ANGICAL) | C126: 04.426.411/0003-66 | D126: 2112.0700000000002 | E126: 0 | F126: 0 | G126: 0 | H126: 0 | I126: 0 | J126: 0 | K126: 2327.3499999999999 | L126: 0 | M126: =SUM(J126:L126)-215.28 -> 2112.0699999999997 | N126: 215.28 | O126: =SUM(M126:N126) -> 2327.3499999999999
A127: 3103 | B127: ENERCAN (UHE CAMPOS NOVOS) | C127: 03.356.967/0001-07 | D127: 3408.9499999999998 | E127: 0 | F127: 0 | G127: 0 | H127: 0 | I127: 0 | J127: 0 | K127: 3756.4200000000001 | L127: 0 | M127: =SUM(J127:L127)-347.47 -> 3408.9499999999998 | N127: 347.47000000000003 | O127: =SUM(M127:N127) -> 3756.4200000000001
A128: 3108 | B128: VENTOS DO SUL | C128: 06.016.348/0002-34 | D128: 507.80000000000001 | E128: 0 | F128: 0 | G128: 0 | H128: 0 | I128: 0 | J128: 0 | K128: 559.55999999999995 | L128: 0 | M128: =SUM(J128:L128)-51.76 -> 507.79999999999995 | N128: 51.759999999999998 | O128: =SUM(M128:N128) -> 559.55999999999995
A129: 3119 | B129: BSE-G | C129: 03.059.729/0001-21 | D129: 627 | E129: 0 | F129: 0 | G129: 0 | H129: 0 | I129: 0 | J129: 0 | K129: 690.90999999999997 | L129: 0 | M129: =SUM(J129:L129)-63.91 -> 627 | N129: 63.909999999999997 | O129: =SUM(M129:N129) -> 690.90999999999997
A130: 3120 | B130: BRENTECH(UTE GOIANIA 2) | C130: 07.921.085/0001-90 | D130: 555.73000000000002 | E130: 0 | F130: 0 | G130: 0 | H130: 0 | I130: 0 | J130: 0 | K130: 612.37 | L130: 0 | M130: =SUM(J130:L130)-56.64 -> 555.73000000000002 | N130: 56.640000000000001 | O130: =SUM(M130:N130) -> 612.37
A131: 3121 | B131: UTE GUARANI (UTE AREMBEPE) | C131: 23.865.997/0001-48 | D131: 482.52999999999997 | E131: 0 | F131: 0 | G131: 0 | H131: 0 | I131: 0 | J131: 0 | K131: 531.71000000000004 | L131: 0 | M131: =SUM(J131:L131)-49.18 -> 482.53000000000003 | N131: 49.18 | O131: =SUM(M131:N131) -> 531.71000000000004
A132: 3122 | B132: EPESA | C132: 06.212.748/0001-34 | D132: 871.24000000000001 | E132: 0 | F132: 0 | G132: 0 | H132: 0 | I132: 0 | J132: 0 | K132: 960.03999999999996 | L132: 0 | M132: =SUM(J132:L132)-88.8 -> 871.24000000000001 | N132: 88.799999999999997 | O132: =SUM(M132:N132) -> 960.03999999999996
A133: 3123 | B133: UTE APOENA (UTE MURICY) | C133: 23.865.997/0001-48 | D133: 472.97000000000003 | E133: 0 | F133: 0 | G133: 0 | H133: 0 | I133: 0 | J133: 0 | K133: 521.17999999999995 | L133: 0 | M133: =SUM(J133:L133)-48.21 -> 472.96999999999997 | N133: 48.210000000000001 | O133: =SUM(M133:N133) -> 521.17999999999995
A134: 3126 | B134: PETROBRAS(UTE EUZEBIO ROCHA) | C134: 33.000.167/0116-50 | D134: 532.87 | E134: 0 | F134: 0 | G134: 0 | H134: 0 | I134: 0 | J134: 0 | K134: 587.17999999999995 | L134: 0 | M134: =SUM(J134:L134)-54.31 -> 532.86999999999989 | N134: 54.310000000000002 | O134: =SUM(M134:N134) -> 587.17999999999984
A135: 3127 | B135: PRAIA FORMOSA | C135: 08.439.659/0008-27 | D135: 429.82999999999998 | E135: 0 | F135: 0 | G135: 0 | H135: 0 | I135: 0 | J135: 0 | K135: 473.63999999999999 | L135: 0 | M135: =SUM(J135:L135)-43.81 -> 429.82999999999998 | N135: 43.810000000000002 | O135: =SUM(M135:N135) -> 473.63999999999999
A136: 3130 | B136: ICARAIZINHO | C136: 08.439.659/0009-08 | D136: 240.55000000000001 | E136: 0 | F136: 0 | G136: 0 | H136: 0 | I136: 0 | J136: 0 | K136: 265.06999999999999 | L136: 0 | M136: =SUM(J136:L136)-24.52 -> 240.54999999999998 | N136: 24.52 | O136: =SUM(M136:N136) -> 265.06999999999999
A137: 3133 | B137: BAGUARI(CONS. BAGUARI) | C137: 07.799.995/0001-41 | D137: 207.06 | E137: 0 | F137: 0 | G137: 0 | H137: 0 | I137: 0 | J137: 0 | K137: 228.16999999999999 | L137: 0 | M137: =SUM(J137:L137)-21.11 -> 207.06 | N137: 21.109999999999999 | O137: =SUM(M137:N137) -> 228.17000000000002
A138: 3134 | B138: GERA MARANHÃO (GERANORTE) | C138: 09.110.880/0001-23 | D138: 1267.9400000000001 | E138: 0 | F138: 0 | G138: 0 | H138: 0 | I138: 0 | J138: 0 | K138: 1397.1800000000001 | L138: 0 | M138: =SUM(J138:L138)-129.24 -> 1267.9400000000001 | N138: 129.24000000000001 | O138: =SUM(M138:N138) -> 1397.1800000000001
A139: 3135 | B139: BONS VENTOS | C139: 08.439.659/0001-50 | D139: 584.30999999999995 | E139: 0 | F139: 0 | G139: 0 | H139: 0 | I139: 0 | J139: 0 | K139: 643.87 | L139: 0 | M139: =SUM(J139:L139)-59.56 -> 584.30999999999995 | N139: 59.560000000000002 | O139: =SUM(M139:N139) -> 643.86999999999989
A140: 3136 | B140: VIANA | C140: 09.043.782/0002-00 | D140: 697.17999999999995 | E140: 0 | F140: 0 | G140: 0 | H140: 0 | I140: 0 | J140: 0 | K140: 768.24000000000001 | L140: 0 | M140: =SUM(J140:L140)-71.06 -> 697.18000000000006 | N140: 71.060000000000002 | O140: =SUM(M140:N140) -> 768.24000000000001
A141: 3137 | B141: BORBOREMA(UTE CAMP. GRANDE) | C141: 09.036.424/0001-80 | D141: 846.91999999999996 | E141: 0 | F141: 0 | G141: 0 | H141: 0 | I141: 0 | J141: 0 | K141: 933.25 | L141: 0 | M141: =SUM(J141:L141)-86.33 -> 846.91999999999996 | N141: 86.329999999999998 | O141: =SUM(M141:N141) -> 933.25
A142: 3138 | B142: ENERGIMP (VOLTA DO RIO) | C142: 07.063.713/0002-24 | D142: 186.97 | E142: 0 | F142: 0 | G142: 0 | H142: 0 | I142: 0 | J142: 0 | K142: 206.03 | L142: 0 | M142: =SUM(J142:L142)-19.06 -> 186.97 | N142: 19.059999999999999 | O142: =SUM(M142:N142) -> 206.03
A143: 3139 | B143: ENERGIMP (PRAIA DO MORGADO) | C143: 07.063.963/0001-83 | D143: 122.16 | E143: 0 | F143: 0 | G143: 0 | H143: 0 | I143: 0 | J143: 0 | K143: 134.61000000000001 | L143: 0 | M143: =SUM(J143:L143)-12.45 -> 122.16000000000001 | N143: 12.449999999999999 | O143: =SUM(M143:N143) -> 134.61000000000001
A144: 3140 | B144: RIO VERDE(UHE SALTO) | C144: 05.252.008/0001-69 | D144: 609.38999999999999 | E144: 0 | F144: 0 | G144: 0 | H144: 0 | I144: 0 | J144: 0 | K144: 671.5 | L144: 0 | M144: =SUM(J144:L144)-62.11 -> 609.38999999999999 | N144: 62.109999999999999 | O144: =SUM(M144:N144) -> 671.5
A145: 3141 | B145: FOZ DO RIO CLARO | C145: 07.823.262/0001-03 | D145: 347.66000000000003 | E145: 0 | F145: 0 | G145: 0 | H145: 0 | I145: 0 | J145: 0 | K145: 383.10000000000002 | L145: 0 | M145: =SUM(J145:L145)-35.44 -> 347.66000000000003 | N145: 35.439999999999998 | O145: =SUM(M145:N145) -> 383.10000000000002
A146: 3142 | B146: UTE CAÇU I | C146: 08.598.391/0001-08 | D146: 478.25999999999999 | E146: 0 | F146: 0 | G146: 0 | H146: 0 | I146: 0 | J146: 0 | K146: 527.00999999999999 | L146: 0 | M146: =SUM(J146:L146)-48.75 -> 478.25999999999999 | N146: 48.75 | O146: =SUM(M146:N146) -> 527.00999999999999
A147: 3143 | B147: KINROSS (CAÇU B.-COQUEIROS) | C147: 20.346.524/0005-70 | D147: 815.42999999999995 | E147: 0 | F147: 0 | G147: 0 | H147: 0 | I147: 0 | J147: 0 | K147: 898.54999999999995 | L147: 0 | M147: =SUM(J147:L147)-83.12 -> 815.42999999999995 | N147: 83.120000000000005 | O147: =SUM(M147:N147) -> 898.54999999999995
A148: 3144 | B148: CANDEIAS-G | C148: 10.508.162/0001-99 | D148: 934 | E148: 0 | F148: 0 | G148: 0 | H148: 0 | I148: 0 | J148: 0 | K148: 1029.2 | L148: 0 | M148: =SUM(J148:L148)-95.2 -> 934 | N148: 95.200000000000003 | O148: =SUM(M148:N148) -> 1029.2
A149: 3145 | B149: CBA(RIO VERDINHO) | C149: 61.409.892/0210-90 | D149: 479.60000000000002 | E149: 0 | F149: 0 | G149: 0 | H149: 0 | I149: 0 | J149: 0 | K149: 528.48000000000002 | L149: 0 | M149: =SUM(J149:L149)-48.88 -> 479.60000000000002 | N149: 48.880000000000003 | O149: =SUM(M149:N149) -> 528.48000000000002
A150: 3151 | B150: FOZ DO CHAPECÓ | C150: 04.591.168/0001-70 | D150: 4732.5900000000001 | E150: 0 | F150: 0 | G150: 0 | H150: 0 | I150: 0 | J150: 0 | K150: 5214.9799999999996 | L150: 0 | M150: =SUM(J150:L150)-482.39 -> 4732.5899999999992 | N150: 482.38999999999999 | O150: =SUM(M150:N150) -> 5214.9799999999996
A151: 3152 | B151: EPASA | C151: 10.366.780/0001-41 | D151: 999.25 | E151: 0 | F151: 0 | G151: 0 | H151: 0 | I151: 0 | J151: 0 | K151: 1101.0999999999999 | L151: 0 | M151: =SUM(J151:L151)-101.85 -> 999.24999999999989 | N151: 101.84999999999999 | O151: =SUM(M151:N151) -> 1101.0999999999999
A152: 3153 | B152: UTE SANTA LUZIA I | C152: 08.906.558/0001-42 | D152: 380.5 | E152: 0 | F152: 0 | G152: 0 | H152: 0 | I152: 0 | J152: 0 | K152: 419.27999999999997 | L152: 0 | M152: =SUM(J152:L152)-38.78 -> 380.5 | N152: 38.780000000000001 | O152: =SUM(M152:N152) -> 419.27999999999997
A153: 3155 | B153: UTE BOA VISTA | C153: 24.222.394/0001-90 | D153: 188.84 | E153: 0 | F153: 0 | G153: 0 | H153: 0 | I153: 0 | J153: 0 | K153: 208.09 | L153: 0 | M153: =SUM(J153:L153)-19.25 -> 188.84 | N153: 19.25 | O153: =SUM(M153:N153) -> 208.09
A154: 3156 | B154: TERNIUM(UTE ATLÂNTICO) | C154: 07.005.330/0001-19 | D154: 926.32000000000005 | E154: 0 | F154: 0 | G154: 0 | H154: 0 | I154: 0 | J154: 0 | K154: 1020.74 | L154: 0 | M154: =SUM(J154:L154)-94.42 -> 926.32000000000005 | N154: 94.420000000000002 | O154: =SUM(M154:N154) -> 1020.74
A155: 3158 | B155: CEE(CONS. ESTREITO) | C155: 08.976.022/0002-84 | D155: 2078.1300000000001 | E155: 0 | F155: 0 | G155: 0 | H155: 0 | I155: 0 | J155: 0 | K155: 2289.9499999999998 | L155: 0 | M155: =SUM(J155:L155)-211.82 -> 2078.1299999999997 | N155: 211.81999999999999 | O155: =SUM(M155:N155) -> 2289.9499999999998
A156: 3159 | B156: ESTREITO PART(CONS. ESTREITO) | C156: 22.686.355/0001-19 | D156: 230.27000000000001 | E156: 0 | F156: 0 | G156: 0 | H156: 0 | I156: 0 | J156: 0 | K156: 253.74000000000001 | L156: 0 | M156: =SUM(J156:L156)-23.47 -> 230.27000000000001 | N156: 23.469999999999999 | O156: =SUM(M156:N156) -> 253.74000000000001
A157: 3160 | B157: ESTREITO(CONS. ESTREITO) | C157: 07.089.298/0002-88 | D157: 1321.97 | E157: 0 | F157: 0 | G157: 0 | H157: 0 | I157: 0 | J157: 0 | K157: 1456.72 | L157: 0 | M157: =SUM(J157:L157)-134.75 -> 1321.97 | N157: 134.75 | O157: =SUM(M157:N157) -> 1456.72
A158: 3161 | B158: VALE(CONS. ESTREITO) | C158: 33.592.510/0091-00 | D158: 1555.8699999999999 | E158: 0 | F158: 0 | G158: 0 | H158: 0 | I158: 0 | J158: 0 | K158: 1714.46 | L158: 0 | M158: =SUM(J158:L158)-158.59 -> 1555.8700000000001 | N158: 158.59 | O158: =SUM(M158:N158) -> 1714.46
A159: 3166 | B159: SJC (UTE QUIRINÓPOLIS) | C159: 10.249.419/0002-16 | D159: 168.18000000000001 | E159: 0 | F159: 0 | G159: 0 | H159: 0 | I159: 0 | J159: 0 | K159: 185.31999999999999 | L159: 0 | M159: =SUM(J159:L159)-17.14 -> 168.18000000000001 | N159: 17.140000000000001 | O159: =SUM(M159:N159) -> 185.31999999999999
A160: 3167 | B160: EOL CERRO CHATO I | C160: 02.016.507/0001-69 | D160: 52.289999999999999 | E160: 0 | F160: 0 | G160: 0 | H160: 0 | I160: 0 | J160: 0 | K160: 57.619999999999997 | L160: 0 | M160: =SUM(J160:L160)-5.33 -> 52.289999999999999 | N160: 5.3300000000000001 | O160: =SUM(M160:N160) -> 57.619999999999997
A161: 3168 | B161: EOL CERRO CHATO II | C161: 02.016.507/0001-69 | D161: 52.259999999999998 | E161: 0 | F161: 0 | G161: 0 | H161: 0 | I161: 0 | J161: 0 | K161: 57.590000000000003 | L161: 0 | M161: =SUM(J161:L161)-5.33 -> 52.260000000000005 | N161: 5.3300000000000001 | O161: =SUM(M161:N161) -> 57.590000000000003
A162: 3169 | B162: EOL CERRO CHATO III | C162: 02.016.507/0001-69 | D162: 52.369999999999997 | E162: 0 | F162: 0 | G162: 0 | H162: 0 | I162: 0 | J162: 0 | K162: 57.710000000000001 | L162: 0 | M162: =SUM(J162:L162)-5.34 -> 52.370000000000005 | N162: 5.3399999999999999 | O162: =SUM(M162:N162) -> 57.710000000000008
A163: 3170 | B163: UTE ELDORADO | C163: 05.620.523/0002-35 | D163: 389.43000000000001 | E163: 0 | F163: 0 | G163: 0 | H163: 0 | I163: 0 | J163: 0 | K163: 429.12 | L163: 0 | M163: =SUM(J163:L163)-39.69 -> 389.43000000000001 | N163: 39.689999999999998 | O163: =SUM(M163:N163) -> 429.12
A164: 3172 | B164: BAGUARI ENERGIA(CONS. BAGUARI) | C164: 09.568.947/0001-78 | D164: 198.94 | E164: 0 | F164: 0 | G164: 0 | H164: 0 | I164: 0 | J164: 0 | K164: 219.22 | L164: 0 | M164: =SUM(J164:L164)-20.28 -> 198.94 | N164: 20.280000000000001 | O164: =SUM(M164:N164) -> 219.22
A165: 3173 | B165: UTE PORTO DO PECÉM | C165: 08.976.495/0001-09 | D165: 3118.9200000000001 | E165: 0 | F165: 0 | G165: 0 | H165: 0 | I165: 0 | J165: 0 | K165: 3436.8299999999999 | L165: 0 | M165: =SUM(J165:L165)-317.91 -> 3118.9200000000001 | N165: 317.91000000000003 | O165: =SUM(M165:N165) -> 3436.8299999999999
A166: 3174 | B166: AGUAS DA PEDRA(UHE DARNANELOS) | C166: 08.768.414/0001-77 | D166: 1596.1199999999999 | E166: 0 | F166: 0 | G166: 0 | H166: 0 | I166: 0 | J166: 0 | K166: 1758.8099999999999 | L166: 0 | M166: =SUM(J166:L166)-162.69 -> 1596.1199999999999 | N166: 162.69 | O166: =SUM(M166:N166) -> 1758.8099999999999
A167: 3175 | B167: UTE BERNECK | C167: 81.905.176/0001-94 | D167: 28.390000000000001 | E167: 0 | F167: 0 | G167: 0 | H167: 0 | I167: 0 | J167: 0 | K167: 31.280000000000001 | L167: 0 | M167: =SUM(J167:L167)-2.89 -> 28.390000000000001 | N167: 2.8900000000000001 | O167: =SUM(M167:N167) -> 31.280000000000001
A168: 3176 | B168: PORTO DO ITAQUI | C168: 08.219.477/0001-74 | D168: 1486.0699999999999 | E168: 0 | F168: 0 | G168: 0 | H168: 0 | I168: 0 | J168: 0 | K168: 1637.54 | L168: 0 | M168: =SUM(J168:L168)-151.47 -> 1486.0699999999999 | N168: 151.47 | O168: =SUM(M168:N168) -> 1637.54
A169: 3177 | B169: CERRADINHO(UTE PORTO DAS AGUAS) | C169: 08.322.396/0001-03 | D169: 892.23000000000002 | E169: 0 | F169: 0 | G169: 0 | H169: 0 | I169: 0 | J169: 0 | K169: 983.16999999999996 | L169: 0 | M169: =SUM(J169:L169)-90.94 -> 892.23000000000002 | N169: 90.939999999999998 | O169: =SUM(M169:N169) -> 983.17000000000007
A170: 3178 | B170: UTE COSTA RICA | C170: 08.070.566/0016-88 | D170: 197.69 | E170: 0 | F170: 0 | G170: 0 | H170: 0 | I170: 0 | J170: 0 | K170: 217.84 | L170: 0 | M170: =SUM(J170:L170)-20.15 -> 197.69 | N170: 20.149999999999999 | O170: =SUM(M170:N170) -> 217.84
A171: 3179 | B171: UTE NARDINI | C171: 48.708.267/0015-60 | D171: 130.22 | E171: 0 | F171: 0 | G171: 0 | H171: 0 | I171: 0 | J171: 0 | K171: 143.49000000000001 | L171: 0 | M171: =SUM(J171:L171)-13.27 -> 130.22 | N171: 13.27 | O171: =SUM(M171:N171) -> 143.49000000000001
A172: 3181 | B172: CEPASA(UTE PALMEIRAS DE GOIÁS) | C172: 13.348.048/0001-37 | D172: 770.04999999999995 | E172: 0 | F172: 0 | G172: 0 | H172: 0 | I172: 0 | J172: 0 | K172: 848.53999999999996 | L172: 0 | M172: =SUM(J172:L172)-78.49 -> 770.04999999999995 | N172: 78.489999999999995 | O172: =SUM(M172:N172) -> 848.53999999999996
A173: 3182 | B173: NEW ENERGY(EOL ALEGRIA I) | C173: 04.245.220/0002-17 | D173: 222.58000000000001 | E173: 0 | F173: 0 | G173: 0 | H173: 0 | I173: 0 | J173: 0 | K173: 245.27000000000001 | L173: 0 | M173: =SUM(J173:L173)-22.69 -> 222.58000000000001 | N173: 22.690000000000001 | O173: =SUM(M173:N173) -> 245.27000000000001
A174: 3183 | B174: SAESA(UHE SANTO ANTÔNIO) | C174: 09.391.823/0002-40 | D174: 32539.439999999999 | E174: 0 | F174: 0 | G174: 0 | H174: 0 | I174: 0 | J174: 35856.129999999997 | K174: 0 | L174: 0 | M174: =SUM(J174:L174)-3316.69 -> 32539.439999999999 | N174: 3316.6900000000001 | O174: =SUM(M174:N174) -> 35856.129999999997
A175: 3184 | B175: EMPA(PCH INDAIAZINHO) | C175: 11.254.582/0002-30 | D175: 30.879999999999999 | E175: 0 | F175: 0 | G175: 0 | H175: 0 | I175: 0 | J175: 0 | K175: 34.030000000000001 | L175: 0 | M175: =SUM(J175:L175)-3.15 -> 30.880000000000003 | N175: 3.1499999999999999 | O175: =SUM(M175:N175) -> 34.030000000000001
A176: 3185 | B176: EMPA(PCH INDAIÁ GRANDE) | C176: 10.400.065/0002-69 | D176: 49.420000000000002 | E176: 0 | F176: 0 | G176: 0 | H176: 0 | I176: 0 | J176: 0 | K176: 54.460000000000001 | L176: 0 | M176: =SUM(J176:L176)-5.04 -> 49.420000000000002 | N176: 5.04 | O176: =SUM(M176:N176) -> 54.460000000000001
A177: 3186 | B177: NEW ENERGY(EOL ALEGRIA II) | C177: 04.245.220/0002-17 | D177: 437.25 | E177: 0 | F177: 0 | G177: 0 | H177: 0 | I177: 0 | J177: 0 | K177: 481.81999999999999 | L177: 0 | M177: =SUM(J177:L177)-44.57 -> 437.25 | N177: 44.57 | O177: =SUM(M177:N177) -> 481.81999999999999
A178: 3187 | B178: VENTOS DA LAGOA(EOL SANGR.2-3) | C178: 11.603.076/0002-09 | D178: 89.769999999999996 | E178: 0 | F178: 0 | G178: 0 | H178: 0 | I178: 0 | J178: 0 | K178: 98.920000000000002 | L178: 0 | M178: =SUM(J178:L178)-9.15 -> 89.769999999999996 | N178: 9.1500000000000004 | O178: =SUM(M178:N178) -> 98.920000000000002
A179: 3192 | B179: EOL MACAUBAS | C179: 09.194.393/0002-77 | D179: 75.659999999999997 | E179: 0 | F179: 0 | G179: 0 | H179: 0 | I179: 0 | J179: 0 | K179: 83.370000000000005 | L179: 0 | M179: =SUM(J179:L179)-7.71 -> 75.660000000000011 | N179: 7.71 | O179: =SUM(M179:N179) -> 83.370000000000005
A180: 3193 | B180: EOL N. HORIZONTE | C180: 09.214.349/0002-81 | D180: 75.659999999999997 | E180: 0 | F180: 0 | G180: 0 | H180: 0 | I180: 0 | J180: 0 | K180: 83.370000000000005 | L180: 0 | M180: =SUM(J180:L180)-7.71 -> 75.660000000000011 | N180: 7.71 | O180: =SUM(M180:N180) -> 83.370000000000005
A181: 3194 | B181: EOL SEABRA | C181: 09.196.341/0002-30 | D181: 75.659999999999997 | E181: 0 | F181: 0 | G181: 0 | H181: 0 | I181: 0 | J181: 0 | K181: 83.370000000000005 | L181: 0 | M181: =SUM(J181:L181)-7.71 -> 75.660000000000011 | N181: 7.71 | O181: =SUM(M181:N181) -> 83.370000000000005
A182: 3195 | B182: PCH PEZZI | C182: 09.199.579/0002-19 | D182: 30.52 | E182: 0 | F182: 0 | G182: 0 | H182: 0 | I182: 0 | J182: 0 | K182: 33.630000000000003 | L182: 0 | M182: =SUM(J182:L182)-3.11 -> 30.520000000000003 | N182: 3.1099999999999999 | O182: =SUM(M182:N182) -> 33.630000000000003
A183: 3196 | B183: CPFL (EOL SANTA CLARA I) | C183: 10.797.899/0002-50 | D183: 71.409999999999997 | E183: 0 | F183: 0 | G183: 0 | H183: 0 | I183: 0 | J183: 0 | K183: 78.689999999999998 | L183: 0 | M183: =SUM(J183:L183)-7.28 -> 71.409999999999997 | N183: 7.2800000000000002 | O183: =SUM(M183:N183) -> 78.689999999999998
A184: 3197 | B184: CPFL (EOL SANTA CLARA II) | C184: 10.797.908/0002-02 | D184: 71.409999999999997 | E184: 0 | F184: 0 | G184: 0 | H184: 0 | I184: 0 | J184: 0 | K184: 78.689999999999998 | L184: 0 | M184: =SUM(J184:L184)-7.28 -> 71.409999999999997 | N184: 7.2800000000000002 | O184: =SUM(M184:N184) -> 78.689999999999998
A185: 3198 | B185: CPFL (EOL SANTA CLARA III) | C185: 10.797.910/0002-81 | D185: 71.629999999999995 | E185: 0 | F185: 0 | G185: 0 | H185: 0 | I185: 0 | J185: 0 | K185: 78.930000000000007 | L185: 0 | M185: =SUM(J185:L185)-7.3 -> 71.63000000000001 | N185: 7.2999999999999998 | O185: =SUM(M185:N185) -> 78.930000000000007
A186: 3199 | B186: CPFL (EOL SANTA CLARA IV) | C186: 10.797.907/0002-68 | D186: 71.409999999999997 | E186: 0 | F186: 0 | G186: 0 | H186: 0 | I186: 0 | J186: 0 | K186: 78.689999999999998 | L186: 0 | M186: =SUM(J186:L186)-7.28 -> 71.409999999999997 | N186: 7.2800000000000002 | O186: =SUM(M186:N186) -> 78.689999999999998
A187: 3200 | B187: CPFL (EOL SANTA CLARA V) | C187: 10.797.909/0002-57 | D187: 71.409999999999997 | E187: 0 | F187: 0 | G187: 0 | H187: 0 | I187: 0 | J187: 0 | K187: 78.689999999999998 | L187: 0 | M187: =SUM(J187:L187)-7.28 -> 71.409999999999997 | N187: 7.2800000000000002 | O187: =SUM(M187:N187) -> 78.689999999999998
A188: 3201 | B188: CPFL (EOL SANTA CLARA VI) | C188: 10.797.906/0002-13 | D188: 71.409999999999997 | E188: 0 | F188: 0 | G188: 0 | H188: 0 | I188: 0 | J188: 0 | K188: 78.689999999999998 | L188: 0 | M188: =SUM(J188:L188)-7.28 -> 71.409999999999997 | N188: 7.2800000000000002 | O188: =SUM(M188:N188) -> 78.689999999999998
A189: 3202 | B189: CPFL (EOL EURUS VI) | C189: 10.797.905/0002-79 | D189: 19.039999999999999 | E189: 0 | F189: 0 | G189: 0 | H189: 0 | I189: 0 | J189: 0 | K189: 20.98 | L189: 0 | M189: =SUM(J189:L189)-1.94 -> 19.039999999999999 | N189: 1.9399999999999999 | O189: =SUM(M189:N189) -> 20.98
A190: 3203 | B190: EOL ALVORADA | C190: 11.349.807/0001-50 | D190: 19.629999999999999 | E190: 0 | F190: 0 | G190: 0 | H190: 0 | I190: 0 | J190: 0 | K190: 21.629999999999999 | L190: 0 | M190: =SUM(J190:L190)-2 -> 19.629999999999999 | N190: 2 | O190: =SUM(M190:N190) -> 21.629999999999999
A191: 3204 | B191: EOL CANDIBA | C191: 11.349.756/0001-67 | D191: 24.73 | E191: 0 | F191: 0 | G191: 0 | H191: 0 | I191: 0 | J191: 0 | K191: 27.25 | L191: 0 | M191: =SUM(J191:L191)-2.52 -> 24.73 | N191: 2.52 | O191: =SUM(M191:N191) -> 27.25
A192: 3205 | B192: EOL GUANAMBI | C192: 11.350.499/0001-83 | D192: 53.579999999999998 | E192: 0 | F192: 0 | G192: 0 | H192: 0 | I192: 0 | J192: 0 | K192: 59.039999999999999 | L192: 0 | M192: =SUM(J192:L192)-5.46 -> 53.579999999999998 | N192: 5.46 | O192: =SUM(M192:N192) -> 59.039999999999999
A193: 3206 | B193: EOL GUIRAPÁ | C193: 11.345.796/0001-30 | D193: 73.599999999999994 | E193: 0 | F193: 0 | G193: 0 | H193: 0 | I193: 0 | J193: 0 | K193: 81.099999999999994 | L193: 0 | M193: =SUM(J193:L193)-7.5 -> 73.599999999999994 | N193: 7.5 | O193: =SUM(M193:N193) -> 81.099999999999994
A194: 3207 | B194: EOL IGAPORÃ | C194: 11.366.011/0001-06 | D194: 73.599999999999994 | E194: 0 | F194: 0 | G194: 0 | H194: 0 | I194: 0 | J194: 0 | K194: 81.099999999999994 | L194: 0 | M194: =SUM(J194:L194)-7.5 -> 73.599999999999994 | N194: 7.5 | O194: =SUM(M194:N194) -> 81.099999999999994
A195: 3208 | B195: EOL ILHEUS | C195: 11.366.468/0001-10 | D195: 28.850000000000001 | E195: 0 | F195: 0 | G195: 0 | H195: 0 | I195: 0 | J195: 0 | K195: 31.789999999999999 | L195: 0 | M195: =SUM(J195:L195)-2.94 -> 28.849999999999998 | N195: 2.9399999999999999 | O195: =SUM(M195:N195) -> 31.789999999999999
A196: 3209 | B196: EOL PAJEÚ DO VENTO | C196: 11.365.985/0001-75 | D196: 65.939999999999998 | E196: 0 | F196: 0 | G196: 0 | H196: 0 | I196: 0 | J196: 0 | K196: 72.659999999999997 | L196: 0 | M196: =SUM(J196:L196)-6.72 -> 65.939999999999998 | N196: 6.7199999999999998 | O196: =SUM(M196:N196) -> 72.659999999999997
A197: 3210 | B197: EOL PINDAÍ | C197: 11.350.542/0001-00 | D197: 61.82 | E197: 0 | F197: 0 | G197: 0 | H197: 0 | I197: 0 | J197: 0 | K197: 68.120000000000005 | L197: 0 | M197: =SUM(J197:L197)-6.3 -> 61.820000000000007 | N197: 6.2999999999999998 | O197: =SUM(M197:N197) -> 68.120000000000005
A198: 3211 | B198: EOL PORTO SEGURO | C198: 11.366.056/0001-80 | D198: 16.489999999999998 | E198: 0 | F198: 0 | G198: 0 | H198: 0 | I198: 0 | J198: 0 | K198: 18.170000000000002 | L198: 0 | M198: =SUM(J198:L198)-1.68 -> 16.490000000000002 | N198: 1.6799999999999999 | O198: =SUM(M198:N198) -> 18.170000000000002
A199: 3212 | B199: EOL RIO VERDE | C199: 11.350.476/0001-79 | D199: 73.599999999999994 | E199: 0 | F199: 0 | G199: 0 | H199: 0 | I199: 0 | J199: 0 | K199: 81.099999999999994 | L199: 0 | M199: =SUM(J199:L199)-7.5 -> 73.599999999999994 | N199: 7.5 | O199: =SUM(M199:N199) -> 81.099999999999994
A200: 3213 | B200: EOL SERRA DO SALTO | C200: 11.349.836/0001-12 | D200: 49.460000000000001 | E200: 0 | F200: 0 | G200: 0 | H200: 0 | I200: 0 | J200: 0 | K200: 54.5 | L200: 0 | M200: =SUM(J200:L200)-5.04 -> 49.460000000000001 | N200: 5.04 | O200: =SUM(M200:N200) -> 54.5
A201: 3215 | B201: EOL PLANALTINA | C201: 11.363.327/0001-44 | D201: 70.060000000000002 | E201: 0 | F201: 0 | G201: 0 | H201: 0 | I201: 0 | J201: 0 | K201: 77.200000000000003 | L201: 0 | M201: =SUM(J201:L201)-7.14 -> 70.060000000000002 | N201: 7.1399999999999997 | O201: =SUM(M201:N201) -> 77.200000000000003
A202: 3216 | B202: EOL LICÍNIO DE ALMEIDA | C202: 11.349.904/0001-43 | D202: 61.82 | E202: 0 | F202: 0 | G202: 0 | H202: 0 | I202: 0 | J202: 0 | K202: 68.120000000000005 | L202: 0 | M202: =SUM(J202:L202)-6.3 -> 61.820000000000007 | N202: 6.2999999999999998 | O202: =SUM(M202:N202) -> 68.120000000000005
A203: 3217 | B203: EOL N.S. DA CONCEIÇÃO | C203: 11.371.340/0001-45 | D203: 73.599999999999994 | E203: 0 | F203: 0 | G203: 0 | H203: 0 | I203: 0 | J203: 0 | K203: 81.099999999999994 | L203: 0 | M203: =SUM(J203:L203)-7.5 -> 73.599999999999994 | N203: 7.5 | O203: =SUM(M203:N203) -> 81.099999999999994
A204: 3219 | B204: DESA (EOL MORRO DOS VENTOS I) | C204: 11.686.050/0001-90 | D204: 68.129999999999995 | E204: 0 | F204: 0 | G204: 0 | H204: 0 | I204: 0 | J204: 0 | K204: 75.069999999999993 | L204: 0 | M204: =SUM(J204:L204)-6.94 -> 68.129999999999995 | N204: 6.9400000000000004 | O204: =SUM(M204:N204) -> 75.069999999999993
A205: 3220 | B205: DESA (EOL MORRO DOS VENTOS III) | C205: 11.686.100/0001-30 | D205: 68.870000000000005 | E205: 0 | F205: 0 | G205: 0 | H205: 0 | I205: 0 | J205: 0 | K205: 75.890000000000001 | L205: 0 | M205: =SUM(J205:L205)-7.02 -> 68.870000000000005 | N205: 7.0199999999999996 | O205: =SUM(M205:N205) -> 75.890000000000001
A206: 3221 | B206: DESA (EOL MORRO DOS VENTOS IV) | C206: 11.686.202/0001-55 | D206: 68.870000000000005 | E206: 0 | F206: 0 | G206: 0 | H206: 0 | I206: 0 | J206: 0 | K206: 75.890000000000001 | L206: 0 | M206: =SUM(J206:L206)-7.02 -> 68.870000000000005 | N206: 7.0199999999999996 | O206: =SUM(M206:N206) -> 75.890000000000001
A207: 3222 | B207: DESA (EOL MORRO DOS VENTOS IX) | C207: 11.686.103/0001-73 | D207: 70.090000000000003 | E207: 0 | F207: 0 | G207: 0 | H207: 0 | I207: 0 | J207: 0 | K207: 77.230000000000004 | L207: 0 | M207: =SUM(J207:L207)-7.14 -> 70.090000000000003 | N207: 7.1399999999999997 | O207: =SUM(M207:N207) -> 77.230000000000004
A208: 3223 | B208: DESA (EOL MORRO DOS VENTOS VI) | C208: 11.686.150/0001-17 | D208: 66.909999999999997 | E208: 0 | F208: 0 | G208: 0 | H208: 0 | I208: 0 | J208: 0 | K208: 73.730000000000004 | L208: 0 | M208: =SUM(J208:L208)-6.82 -> 66.909999999999997 | N208: 6.8200000000000003 | O208: =SUM(M208:N208) -> 73.72999999999999
A209: 3224 | B209: COPEL (GJC) | C209: 04.370.282/0001-70 | D209: 628.73000000000002 | E209: 0 | F209: 0 | G209: 0 | H209: 0 | I209: 0 | J209: 0 | K209: 692.82000000000005 | L209: 0 | M209: =SUM(J209:L209)-64.09 -> 628.73000000000002 | N209: 64.090000000000003 | O209: =SUM(M209:N209) -> 692.82000000000005
A210: 3225 | B210: CGT ELETROSUL (GJC) | C210: 02.016.507/0001-69 | D210: 604.08000000000004 | E210: 0 | F210: 0 | G210: 0 | H210: 0 | I210: 0 | J210: 0 | K210: 665.64999999999998 | L210: 0 | M210: =SUM(J210:L210)-61.57 -> 604.07999999999993 | N210: 61.57 | O210: =SUM(M210:N210) -> 665.64999999999998
A211: 3226 | B211: PCH SERRA DOS CAVALINHOS II | C211: 09.199.572/0002-05 | D211: 46.590000000000003 | E211: 0 | F211: 0 | G211: 0 | H211: 0 | I211: 0 | J211: 0 | K211: 51.340000000000003 | L211: 0 | M211: =SUM(J211:L211)-4.75 -> 46.590000000000003 | N211: 4.75 | O211: =SUM(M211:N211) -> 51.340000000000003
A212: 3227 | B212: VENTOS DO LITORAL(OSORIO 2-3) | C212: 11.627.075/0002-02 | D212: 88.849999999999994 | E212: 0 | F212: 0 | G212: 0 | H212: 0 | I212: 0 | J212: 0 | K212: 97.909999999999997 | L212: 0 | M212: =SUM(J212:L212)-9.06 -> 88.849999999999994 | N212: 9.0600000000000005 | O212: =SUM(M212:N212) -> 97.909999999999997
A213: 3228 | B213: PECEM II | C213: 10.471.487/0001-44 | D213: 1511.1700000000001 | E213: 0 | F213: 0 | G213: 0 | H213: 0 | I213: 0 | J213: 0 | K213: 1665.2 | L213: 0 | M213: =SUM(J213:L213)-154.03 -> 1511.1700000000001 | N213: 154.03 | O213: =SUM(M213:N213) -> 1665.2
A214: 3229 | B214: UTE SUAPE II | C214: 09.373.678/0003-56 | D214: 1454.9200000000001 | E214: 0 | F214: 0 | G214: 0 | H214: 0 | I214: 0 | J214: 0 | K214: 1603.22 | L214: 0 | M214: =SUM(J214:L214)-148.3 -> 1454.9200000000001 | N214: 148.30000000000001 | O214: =SUM(M214:N214) -> 1603.22
A215: 3230 | B215: UTE AGUA EMENDADA | C215: 08.070.566/0011-73 | D215: 180.62 | E215: 0 | F215: 0 | G215: 0 | H215: 0 | I215: 0 | J215: 0 | K215: 199.03 | L215: 0 | M215: =SUM(J215:L215)-18.41 -> 180.62 | N215: 18.41 | O215: =SUM(M215:N215) -> 199.03
A216: 3231 | B216: UTE MORRO VERMELHO | C216: 08.070.566/0012-54 | D216: 200.25999999999999 | E216: 0 | F216: 0 | G216: 0 | H216: 0 | I216: 0 | J216: 0 | K216: 220.66999999999999 | L216: 0 | M216: =SUM(J216:L216)-20.41 -> 200.25999999999999 | N216: 20.41 | O216: =SUM(M216:N216) -> 220.66999999999999
A217: 3232 | B217: PARNAÍBA(UTE MARANHÃO IV e V) | C217: 15.743.303/0001-71 | D217: 2833.6599999999999 | E217: 0 | F217: 0 | G217: 0 | H217: 0 | I217: 0 | J217: 0 | K217: 3122.4899999999998 | L217: 0 | M217: =SUM(J217:L217)-288.83 -> 2833.6599999999999 | N217: 288.82999999999998 | O217: =SUM(M217:N217) -> 3122.4899999999998
A218: 3234 | B218: EOL SETE GAMELEIRAS | C218: 12.710.327/0002-17 | D218: 73.359999999999999 | E218: 0 | F218: 0 | G218: 0 | H218: 0 | I218: 0 | J218: 0 | K218: 80.840000000000003 | L218: 0 | M218: =SUM(J218:L218)-7.48 -> 73.359999999999999 | N218: 7.4800000000000004 | O218: =SUM(M218:N218) -> 80.840000000000003
A219: 3235 | B219: EOL SÃO PEDRO DO LAGO | C219: 12.709.813/0002-15 | D219: 75.25 | E219: 0 | F219: 0 | G219: 0 | H219: 0 | I219: 0 | J219: 0 | K219: 82.920000000000002 | L219: 0 | M219: =SUM(J219:L219)-7.67 -> 75.25 | N219: 7.6699999999999999 | O219: =SUM(M219:N219) -> 82.920000000000002
A220: 3236 | B220: EOL PEDRA BRANCA | C220: 12.709.996/0002-79 | D220: 73.359999999999999 | E220: 0 | F220: 0 | G220: 0 | H220: 0 | I220: 0 | J220: 0 | K220: 80.840000000000003 | L220: 0 | M220: =SUM(J220:L220)-7.48 -> 73.359999999999999 | N220: 7.4800000000000004 | O220: =SUM(M220:N220) -> 80.840000000000003
A221: 3237 | B221: COSAN (UTE JATAI) | C221: 18.686.104/0001-67 | D221: 786.14999999999998 | E221: 0 | F221: 0 | G221: 0 | H221: 0 | I221: 0 | J221: 0 | K221: 866.27999999999997 | L221: 0 | M221: =SUM(J221:L221)-80.13 -> 786.14999999999998 | N221: 80.129999999999995 | O221: =SUM(M221:N221) -> 866.27999999999997
A222: 3239 | B222: ENERGIMP (EOL BURITI) | C222: 11.646.785/0001-90 | D222: 64.099999999999994 | E222: 0 | F222: 0 | G222: 0 | H222: 0 | I222: 0 | J222: 0 | K222: 70.629999999999995 | L222: 0 | M222: =SUM(J222:L222)-6.53 -> 64.099999999999994 | N222: 6.5300000000000002 | O222: =SUM(M222:N222) -> 70.629999999999995
A223: 3240 | B223: ENERGIMP (EOL CAJUCOCO) | C223: 11.646.760/0001-97 | D223: 64.25 | E223: 0 | F223: 0 | G223: 0 | H223: 0 | I223: 0 | J223: 0 | K223: 70.799999999999997 | L223: 0 | M223: =SUM(J223:L223)-6.55 -> 64.25 | N223: 6.5499999999999998 | O223: =SUM(M223:N223) -> 70.799999999999997
A224: 3242 | B224: EOL ICARAÍ I | C224: 11.476.987/0001-31 | D224: 55.560000000000002 | E224: 0 | F224: 0 | G224: 0 | H224: 0 | I224: 0 | J224: 0 | K224: 61.219999999999999 | L224: 0 | M224: =SUM(J224:L224)-5.66 -> 55.560000000000002 | N224: 5.6600000000000001 | O224: =SUM(M224:N224) -> 61.219999999999999
A225: 3243 | B225: EOL ICARAÍ II | C225: 11.477.001/0001-48 | D225: 154.03 | E225: 0 | F225: 0 | G225: 0 | H225: 0 | I225: 0 | J225: 0 | K225: 169.72999999999999 | L225: 0 | M225: =SUM(J225:L225)-15.7 -> 154.03 | N225: 15.699999999999999 | O225: =SUM(M225:N225) -> 169.72999999999999
A226: 3244 | B226: UTE PERNAMBUCO III | C226: 10.502.676/0001-37 | D226: 754.25 | E226: 0 | F226: 0 | G226: 0 | H226: 0 | I226: 0 | J226: 0 | K226: 831.13 | L226: 0 | M226: =SUM(J226:L226)-76.88 -> 754.25 | N226: 76.879999999999995 | O226: =SUM(M226:N226) -> 831.13
A227: 3245 | B227: ENERGIMP (EOL COQUEIRO) | C227: 11.646.832/0001-04 | D227: 57.719999999999999 | E227: 0 | F227: 0 | G227: 0 | H227: 0 | I227: 0 | J227: 0 | K227: 63.600000000000001 | L227: 0 | M227: =SUM(J227:L227)-5.88 -> 57.719999999999999 | N227: 5.8799999999999999 | O227: =SUM(M227:N227) -> 63.600000000000001
A228: 3249 | B228: ADECOAGRO(UTE AMANDINA) | C228: 07.903.169/0017-68 | D228: 149.19999999999999 | E228: 0 | F228: 0 | G228: 0 | H228: 0 | I228: 0 | J228: 0 | K228: 164.41 | L228: 0 | M228: =SUM(J228:L228)-15.21 -> 149.19999999999999 | N228: 15.210000000000001 | O228: =SUM(M228:N228) -> 164.41
A229: 3250 | B229: UTE ALTO TAQUARI | C229: 08.070.566/0017-69 | D229: 171.65000000000001 | E229: 0 | F229: 0 | G229: 0 | H229: 0 | I229: 0 | J229: 0 | K229: 189.15000000000001 | L229: 0 | M229: =SUM(J229:L229)-17.5 -> 171.65000000000001 | N229: 17.5 | O229: =SUM(M229:N229) -> 189.15000000000001
A230: 3251 | B230: EOL CAETITE 2 | C230: 12.106.989/0002-82 | D230: 72.269999999999996 | E230: 0 | F230: 0 | G230: 0 | H230: 0 | I230: 0 | J230: 0 | K230: 79.640000000000001 | L230: 0 | M230: =SUM(J230:L230)-7.37 -> 72.269999999999996 | N230: 7.3700000000000001 | O230: =SUM(M230:N230) -> 79.640000000000001
A231: 3252 | B231: EOL CAETITE 3 | C231: 12.106.879/0002-10 | D231: 71.760000000000005 | E231: 0 | F231: 0 | G231: 0 | H231: 0 | I231: 0 | J231: 0 | K231: 79.069999999999993 | L231: 0 | M231: =SUM(J231:L231)-7.31 -> 71.759999999999991 | N231: 7.3099999999999996 | O231: =SUM(M231:N231) -> 79.069999999999993
A232: 3258 | B232: EOL ATLANTICA I | C232: 12.773.558/0002-70 | D232: 46.229999999999997 | E232: 0 | F232: 0 | G232: 0 | H232: 0 | I232: 0 | J232: 0 | K232: 50.939999999999998 | L232: 0 | M232: =SUM(J232:L232)-4.71 -> 46.229999999999997 | N232: 4.71 | O232: =SUM(M232:N232) -> 50.939999999999998
A233: 3259 | B233: EOL ATLANTICA II | C233: 12.963.869/0002-00 | D233: 46.229999999999997 | E233: 0 | F233: 0 | G233: 0 | H233: 0 | I233: 0 | J233: 0 | K233: 50.939999999999998 | L233: 0 | M233: =SUM(J233:L233)-4.71 -> 46.229999999999997 | N233: 4.71 | O233: =SUM(M233:N233) -> 50.939999999999998
A234: 3260 | B234: EOL ATLANTICA IV | C234: 12.981.225/0002-36 | D234: 46.229999999999997 | E234: 0 | F234: 0 | G234: 0 | H234: 0 | I234: 0 | J234: 0 | K234: 50.939999999999998 | L234: 0 | M234: =SUM(J234:L234)-4.71 -> 46.229999999999997 | N234: 4.71 | O234: =SUM(M234:N234) -> 50.939999999999998
A235: 3261 | B235: EOL ATLANTICA V | C235: 12.864.421/0002-20 | D235: 46.859999999999999 | E235: 0 | F235: 0 | G235: 0 | H235: 0 | I235: 0 | J235: 0 | K235: 51.640000000000001 | L235: 0 | M235: =SUM(J235:L235)-4.78 -> 46.859999999999999 | N235: 4.7800000000000002 | O235: =SUM(M235:N235) -> 51.640000000000001
A236: 3262 | B236: BRASVENTOS (EOL MIASSABA III) | C236: 11.839.616/0001-77 | D236: 329.76999999999998 | E236: 0 | F236: 0 | G236: 0 | H236: 0 | I236: 0 | J236: 0 | K236: 363.38 | L236: 0 | M236: =SUM(J236:L236)-33.61 -> 329.76999999999998 | N236: 33.609999999999999 | O236: =SUM(M236:N236) -> 363.38
A237: 3263 | B237: ESBR (UHE JIRAU) | C237: 09.029.666/0004-90 | D237: 35085.730000000003 | E237: 0 | F237: 0 | G237: 0 | H237: 0 | I237: 0 | J237: 0 | K237: 38661.959999999999 | L237: 0 | M237: =SUM(J237:L237)-3576.23 -> 35085.729999999996 | N237: 3576.23 | O237: =SUM(M237:N237) -> 38661.959999999999
A238: 3264 | B238: UTE SUZANO | C238: 16.404.287/0222-05 | D238: 374.35000000000002 | E238: 0 | F238: 0 | G238: 0 | H238: 0 | I238: 0 | J238: 0 | K238: 412.50999999999999 | L238: 0 | M238: =SUM(J238:L238)-38.16 -> 374.35000000000002 | N238: 38.159999999999997 | O238: =SUM(M238:N238) -> 412.50999999999999
A239: 3265 | B239: EOL REI DOS VENTOS 3 | C239: 11.637.104/0001-28 | D239: 289.56 | E239: 0 | F239: 0 | G239: 0 | H239: 0 | I239: 0 | J239: 0 | K239: 319.06999999999999 | L239: 0 | M239: =SUM(J239:L239)-29.51 -> 289.56 | N239: 29.510000000000002 | O239: =SUM(M239:N239) -> 319.06999999999999
A240: 3266 | B240: RIO CANOAS (UHE GARIBALDI) | C240: 11.316.814/0001-56 | D240: 565.85000000000002 | E240: 0 | F240: 0 | G240: 0 | H240: 0 | I240: 0 | J240: 0 | K240: 623.52999999999997 | L240: 0 | M240: =SUM(J240:L240)-57.68 -> 565.85000000000002 | N240: 57.68 | O240: =SUM(M240:N240) -> 623.52999999999997
A241: 3267 | B241: EOL REI DOS VENTOS 1 | C241: 11.637.090/0001-42 | D241: 281.51999999999998 | E241: 0 | F241: 0 | G241: 0 | H241: 0 | I241: 0 | J241: 0 | K241: 310.20999999999998 | L241: 0 | M241: =SUM(J241:L241)-28.69 -> 281.51999999999998 | N241: 28.690000000000001 | O241: =SUM(M241:N241) -> 310.20999999999998
A242: 3268 | B242: EOL DREEN OLHO DAGUA | C242: 12.723.444/0001-34 | D242: 72.200000000000003 | E242: 0 | F242: 0 | G242: 0 | H242: 0 | I242: 0 | J242: 0 | K242: 79.560000000000002 | L242: 0 | M242: =SUM(J242:L242)-7.36 -> 72.200000000000003 | N242: 7.3600000000000003 | O242: =SUM(M242:N242) -> 79.560000000000002
A243: 3269 | B243: EOL DREEN BOA VISTA | C243: 12.723.413/0001-83 | D243: 33.799999999999997 | E243: 0 | F243: 0 | G243: 0 | H243: 0 | I243: 0 | J243: 0 | K243: 37.25 | L243: 0 | M243: =SUM(J243:L243)-3.45 -> 33.799999999999997 | N243: 3.4500000000000002 | O243: =SUM(M243:N243) -> 37.25
A244: 3270 | B244: EOL ASA BRANCA IV | C244: 11.681.456/0002-61 | D244: 72.75 | E244: 0 | F244: 0 | G244: 0 | H244: 0 | I244: 0 | J244: 0 | K244: 80.170000000000002 | L244: 0 | M244: =SUM(J244:L244)-7.42 -> 72.75 | N244: 7.4199999999999999 | O244: =SUM(M244:N244) -> 80.170000000000002
A245: 3271 | B245: EOL ASA BRANCA VI | C245: 11.694.617/0002-51 | D245: 72.75 | E245: 0 | F245: 0 | G245: 0 | H245: 0 | I245: 0 | J245: 0 | K245: 80.170000000000002 | L245: 0 | M245: =SUM(J245:L245)-7.42 -> 72.75 | N245: 7.4199999999999999 | O245: =SUM(M245:N245) -> 80.170000000000002
A246: 3272 | B246: EOL ASA BRANCA VIII | C246: 11.694.621/0002-10 | D246: 72.75 | E246: 0 | F246: 0 | G246: 0 | H246: 0 | I246: 0 | J246: 0 | K246: 80.170000000000002 | L246: 0 | M246: =SUM(J246:L246)-7.42 -> 72.75 | N246: 7.4199999999999999 | O246: =SUM(M246:N246) -> 80.170000000000002
A247: 3273 | B247: EOL CALANGO 1 | C247: 12.106.898/0002-47 | D247: 64.920000000000002 | E247: 0 | F247: 0 | G247: 0 | H247: 0 | I247: 0 | J247: 0 | K247: 71.540000000000006 | L247: 0 | M247: =SUM(J247:L247)-6.62 -> 64.920000000000002 | N247: 6.6200000000000001 | O247: =SUM(M247:N247) -> 71.540000000000006
A248: 3274 | B248: EOL CALANGO 2 | C248: 12.107.047/0002-19 | D248: 64.989999999999995 | E248: 0 | F248: 0 | G248: 0 | H248: 0 | I248: 0 | J248: 0 | K248: 71.609999999999999 | L248: 0 | M248: =SUM(J248:L248)-6.62 -> 64.989999999999995 | N248: 6.6200000000000001 | O248: =SUM(M248:N248) -> 71.609999999999999
A249: 3275 | B249: EOL CALANGO 3 | C249: 12.106.962/0002-90 | D249: 65.120000000000005 | E249: 0 | F249: 0 | G249: 0 | H249: 0 | I249: 0 | J249: 0 | K249: 71.760000000000005 | L249: 0 | M249: =SUM(J249:L249)-6.64 -> 65.120000000000005 | N249: 6.6399999999999997 | O249: =SUM(M249:N249) -> 71.760000000000005
A250: 3276 | B250: EOL CALANGO 4 | C250: 12.106.862/0002-63 | D250: 64.629999999999995 | E250: 0 | F250: 0 | G250: 0 | H250: 0 | I250: 0 | J250: 0 | K250: 71.219999999999999 | L250: 0 | M250: =SUM(J250:L250)-6.59 -> 64.629999999999995 | N250: 6.5899999999999999 | O250: =SUM(M250:N250) -> 71.219999999999999
A251: 3277 | B251: EOL CALANGO 5 | C251: 12.159.338/0002-50 | D251: 64.519999999999996 | E251: 0 | F251: 0 | G251: 0 | H251: 0 | I251: 0 | J251: 0 | K251: 71.099999999999994 | L251: 0 | M251: =SUM(J251:L251)-6.58 -> 64.519999999999996 | N251: 6.5800000000000001 | O251: =SUM(M251:N251) -> 71.099999999999994
A252: 3278 | B252: EOL RENASCENÇA I | C252: 12.831.777/0002-68 | D252: 72.019999999999996 | E252: 0 | F252: 0 | G252: 0 | H252: 0 | I252: 0 | J252: 0 | K252: 79.359999999999999 | L252: 0 | M252: =SUM(J252:L252)-7.34 -> 72.019999999999996 | N252: 7.3399999999999999 | O252: =SUM(M252:N252) -> 79.359999999999999
A253: 3279 | B253: EOL RENASCENÇA II | C253: 12.831.668/0002-40 | D253: 72.019999999999996 | E253: 0 | F253: 0 | G253: 0 | H253: 0 | I253: 0 | J253: 0 | K253: 79.359999999999999 | L253: 0 | M253: =SUM(J253:L253)-7.34 -> 72.019999999999996 | N253: 7.3399999999999999 | O253: =SUM(M253:N253) -> 79.359999999999999
A254: 3280 | B254: EOL RENASCENÇA III | C254: 12.833.445/0002-12 | D254: 72.019999999999996 | E254: 0 | F254: 0 | G254: 0 | H254: 0 | I254: 0 | J254: 0 | K254: 79.359999999999999 | L254: 0 | M254: =SUM(J254:L254)-7.34 -> 72.019999999999996 | N254: 7.3399999999999999 | O254: =SUM(M254:N254) -> 79.359999999999999
A255: 3281 | B255: EOL RENASCENÇA IV | C255: 12.833.899/0002-93 | D255: 72.019999999999996 | E255: 0 | F255: 0 | G255: 0 | H255: 0 | I255: 0 | J255: 0 | K255: 79.359999999999999 | L255: 0 | M255: =SUM(J255:L255)-7.34 -> 72.019999999999996 | N255: 7.3399999999999999 | O255: =SUM(M255:N255) -> 79.359999999999999
A256: 3282 | B256: EOL VENTOS DE SÃO MIGUEL | C256: 12.833.419/0002-94 | D256: 72.019999999999996 | E256: 0 | F256: 0 | G256: 0 | H256: 0 | I256: 0 | J256: 0 | K256: 79.359999999999999 | L256: 0 | M256: =SUM(J256:L256)-7.34 -> 72.019999999999996 | N256: 7.3399999999999999 | O256: =SUM(M256:N256) -> 79.359999999999999
A257: 3283 | B257: EOL FLEIXEIRAS I | C257: 09.096.120/0002-90 | D257: 60.840000000000003 | E257: 0 | F257: 0 | G257: 0 | H257: 0 | I257: 0 | J257: 0 | K257: 67.040000000000006 | L257: 0 | M257: =SUM(J257:L257)-6.2 -> 60.840000000000003 | N257: 6.2000000000000002 | O257: =SUM(M257:N257) -> 67.040000000000006
A258: 3284 | B258: EOL GUAJIRÚ | C258: 08.701.973/0002-40 | D258: 60.840000000000003 | E258: 0 | F258: 0 | G258: 0 | H258: 0 | I258: 0 | J258: 0 | K258: 67.040000000000006 | L258: 0 | M258: =SUM(J258:L258)-6.2 -> 60.840000000000003 | N258: 6.2000000000000002 | O258: =SUM(M258:N258) -> 67.040000000000006
A259: 3285 | B259: EOL MUNDAÚ | C259: 08.629.553/0002-09 | D259: 46.299999999999997 | E259: 0 | F259: 0 | G259: 0 | H259: 0 | I259: 0 | J259: 0 | K259: 51.020000000000003 | L259: 0 | M259: =SUM(J259:L259)-4.72 -> 46.300000000000004 | N259: 4.7199999999999998 | O259: =SUM(M259:N259) -> 51.020000000000003
A260: 3286 | B260: EOL TRAIRÍ | C260: 09.252.423/0002-54 | D260: 52.920000000000002 | E260: 0 | F260: 0 | G260: 0 | H260: 0 | I260: 0 | J260: 0 | K260: 58.310000000000002 | L260: 0 | M260: =SUM(J260:L260)-5.39 -> 52.920000000000002 | N260: 5.3899999999999997 | O260: =SUM(M260:N260) -> 58.310000000000002
A261: 3287 | B261: EOL FAISA I | C261: 11.619.268/0001-22 | D261: 63.829999999999998 | E261: 0 | F261: 0 | G261: 0 | H261: 0 | I261: 0 | J261: 0 | K261: 70.340000000000003 | L261: 0 | M261: =SUM(J261:L261)-6.51 -> 63.830000000000005 | N261: 6.5099999999999998 | O261: =SUM(M261:N261) -> 70.340000000000003
A262: 3288 | B262: EOL FAISA II | C262: 11.619.388/0001-20 | D262: 59.130000000000003 | E262: 0 | F262: 0 | G262: 0 | H262: 0 | I262: 0 | J262: 0 | K262: 65.159999999999997 | L262: 0 | M262: =SUM(J262:L262)-6.03 -> 59.129999999999995 | N262: 6.0300000000000002 | O262: =SUM(M262:N262) -> 65.159999999999997
A263: 3289 | B263: EOL FAISA III | C263: 11.619.413/0001-75 | D263: 54.420000000000002 | E263: 0 | F263: 0 | G263: 0 | H263: 0 | I263: 0 | J263: 0 | K263: 59.969999999999999 | L263: 0 | M263: =SUM(J263:L263)-5.55 -> 54.420000000000002 | N263: 5.5499999999999998 | O263: =SUM(M263:N263) -> 59.969999999999999
A264: 3290 | B264: EOL FAISA IV | C264: 11.619.342/0001-00 | D264: 54.420000000000002 | E264: 0 | F264: 0 | G264: 0 | H264: 0 | I264: 0 | J264: 0 | K264: 59.969999999999999 | L264: 0 | M264: =SUM(J264:L264)-5.55 -> 54.420000000000002 | N264: 5.5499999999999998 | O264: =SUM(M264:N264) -> 59.969999999999999
A265: 3291 | B265: EOL FAISA V | C265: 11.652.254/0001-00 | D265: 63.829999999999998 | E265: 0 | F265: 0 | G265: 0 | H265: 0 | I265: 0 | J265: 0 | K265: 70.340000000000003 | L265: 0 | M265: =SUM(J265:L265)-6.51 -> 63.830000000000005 | N265: 6.5099999999999998 | O265: =SUM(M265:N265) -> 70.340000000000003
A266: 3292 | B266: EOL TAÍBA ÁGUIA | C266: 11.477.009/0001-04 | D266: 50.509999999999998 | E266: 0 | F266: 0 | G266: 0 | H266: 0 | I266: 0 | J266: 0 | K266: 55.659999999999997 | L266: 0 | M266: =SUM(J266:L266)-5.15 -> 50.509999999999998 | N266: 5.1500000000000004 | O266: =SUM(M266:N266) -> 55.659999999999997
A267: 3293 | B267: EOL TAÍBA ANDORINHA | C267: 11.477.020/0001-74 | D267: 32.060000000000002 | E267: 0 | F267: 0 | G267: 0 | H267: 0 | I267: 0 | J267: 0 | K267: 35.329999999999998 | L267: 0 | M267: =SUM(J267:L267)-3.27 -> 32.059999999999995 | N267: 3.27 | O267: =SUM(M267:N267) -> 35.329999999999998
A268: 3294 | B268: EOL COLÔNIA | C268: 11.476.958/0001-70 | D268: 41.310000000000002 | E268: 0 | F268: 0 | G268: 0 | H268: 0 | I268: 0 | J268: 0 | K268: 45.520000000000003 | L268: 0 | M268: =SUM(J268:L268)-4.21 -> 41.310000000000002 | N268: 4.21 | O268: =SUM(M268:N268) -> 45.520000000000003
A269: 3295 | B269: EOL EMBUACA | C269: 10.288.461/0001-65 | D269: 55.810000000000002 | E269: 0 | F269: 0 | G269: 0 | H269: 0 | I269: 0 | J269: 0 | K269: 61.5 | L269: 0 | M269: =SUM(J269:L269)-5.69 -> 55.810000000000002 | N269: 5.6900000000000004 | O269: =SUM(M269:N269) -> 61.5
A270: 3296 | B270: CPFL (EOL CAMPO DOS VENTOS II) | C270: 10.797.889/0002-14 | D270: 74.040000000000006 | E270: 0 | F270: 0 | G270: 0 | H270: 0 | I270: 0 | J270: 0 | K270: 81.590000000000003 | L270: 0 | M270: =SUM(J270:L270)-7.55 -> 74.040000000000006 | N270: 7.5499999999999998 | O270: =SUM(M270:N270) -> 81.590000000000003
A271: 3297 | B271: EOL SÃO BENTO DO NORTE | C271: 12.723.384/0001-50 | D271: 67.480000000000004 | E271: 0 | F271: 0 | G271: 0 | H271: 0 | I271: 0 | J271: 0 | K271: 74.359999999999999 | L271: 0 | M271: =SUM(J271:L271)-6.88 -> 67.480000000000004 | N271: 6.8799999999999999 | O271: =SUM(M271:N271) -> 74.359999999999999
A272: 3298 | B272: EOL ASA BRANCA V | C272: 11.681.458/0002-50 | D272: 66.859999999999999 | E272: 0 | F272: 0 | G272: 0 | H272: 0 | I272: 0 | J272: 0 | K272: 73.670000000000002 | L272: 0 | M272: =SUM(J272:L272)-6.81 -> 66.859999999999999 | N272: 6.8099999999999996 | O272: =SUM(M272:N272) -> 73.670000000000002
A273: 3299 | B273: EOL ASA BRANCA VII | C273: 11.694.618/0002-04 | D273: 66.859999999999999 | E273: 0 | F273: 0 | G273: 0 | H273: 0 | I273: 0 | J273: 0 | K273: 73.670000000000002 | L273: 0 | M273: =SUM(J273:L273)-6.81 -> 66.859999999999999 | N273: 6.8099999999999996 | O273: =SUM(M273:N273) -> 73.670000000000002
A274: 3300 | B274: PETROBRAS (UTE B. FLUMINENSE) | C274: 33.000.167/0238-29 | D274: 2078.1199999999999 | E274: 0 | F274: 0 | G274: 0 | H274: 0 | I274: 0 | J274: 0 | K274: 2289.9400000000001 | L274: 0 | M274: =SUM(J274:L274)-211.82 -> 2078.1199999999999 | N274: 211.81999999999999 | O274: =SUM(M274:N274) -> 2289.9400000000001
A275: 3301 | B275: EOL MAR E TERRA | C275: 10.288.438/0001-70 | D275: 55.399999999999999 | E275: 0 | F275: 0 | G275: 0 | H275: 0 | I275: 0 | J275: 0 | K275: 61.049999999999997 | L275: 0 | M275: =SUM(J275:L275)-5.65 -> 55.399999999999999 | N275: 5.6500000000000004 | O275: =SUM(M275:N275) -> 61.049999999999997
A276: 3302 | B276: EOL BELA VISTA | C276: 10.288.502/0001-13 | D276: 65.969999999999999 | E276: 0 | F276: 0 | G276: 0 | H276: 0 | I276: 0 | J276: 0 | K276: 72.689999999999998 | L276: 0 | M276: =SUM(J276:L276)-6.72 -> 65.969999999999999 | N276: 6.7199999999999998 | O276: =SUM(M276:N276) -> 72.689999999999998
A277: 3303 | B277: EOL PAU FERRO | C277: 14.422.424/0002-30 | D277: 74.430000000000007 | E277: 0 | F277: 0 | G277: 0 | H277: 0 | I277: 0 | J277: 0 | K277: 82.019999999999996 | L277: 0 | M277: =SUM(J277:L277)-7.59 -> 74.429999999999993 | N277: 7.5899999999999999 | O277: =SUM(M277:N277) -> 82.019999999999996
A278: 3304 | B278: EOL PEDRA DO GERONIMO | C278: 14.422.483/0002-08 | D278: 74.430000000000007 | E278: 0 | F278: 0 | G278: 0 | H278: 0 | I278: 0 | J278: 0 | K278: 82.019999999999996 | L278: 0 | M278: =SUM(J278:L278)-7.59 -> 74.429999999999993 | N278: 7.5899999999999999 | O278: =SUM(M278:N278) -> 82.019999999999996
A279: 3305 | B279: EOL TACAICÓ | C279: 14.411.251/0002-54 | D279: 45.719999999999999 | E279: 0 | F279: 0 | G279: 0 | H279: 0 | I279: 0 | J279: 0 | K279: 50.380000000000003 | L279: 0 | M279: =SUM(J279:L279)-4.66 -> 45.719999999999999 | N279: 4.6600000000000001 | O279: =SUM(M279:N279) -> 50.379999999999995
A280: 3306 | B280: UTE TROPICAL BIOENERGIA | C280: 08.195.806/0001-94 | D280: 197.78999999999999 | E280: 0 | F280: 0 | G280: 0 | H280: 0 | I280: 0 | J280: 0 | K280: 217.94999999999999 | L280: 0 | M280: =SUM(J280:L280)-20.16 -> 197.78999999999999 | N280: 20.16 | O280: =SUM(M280:N280) -> 217.94999999999999
A281: 3307 | B281: EOL PALMAS | C281: 10.656.525/0001-33 | D281: 40.359999999999999 | E281: 0 | F281: 0 | G281: 0 | H281: 0 | I281: 0 | J281: 0 | K281: 44.469999999999999 | L281: 0 | M281: =SUM(J281:L281)-4.11 -> 40.359999999999999 | N281: 4.1100000000000003 | O281: =SUM(M281:N281) -> 44.469999999999999
A282: 3308 | B282: EOL ILHA GRANDE | C282: 08.624.273/0001-19 | D282: 63.990000000000002 | E282: 0 | F282: 0 | G282: 0 | H282: 0 | I282: 0 | J282: 0 | K282: 70.510000000000005 | L282: 0 | M282: =SUM(J282:L282)-6.52 -> 63.990000000000009 | N282: 6.5199999999999996 | O282: =SUM(M282:N282) -> 70.510000000000005
A283: 3309 | B283: EOL RIBEIRÃO | C283: 10.656.583/0001-67 | D283: 46.520000000000003 | E283: 0 | F283: 0 | G283: 0 | H283: 0 | I283: 0 | J283: 0 | K283: 51.259999999999998 | L283: 0 | M283: =SUM(J283:L283)-4.74 -> 46.519999999999996 | N283: 4.7400000000000002 | O283: =SUM(M283:N283) -> 51.259999999999998
A284: 3310 | B284: UTE IACO | C284: 07.895.728/0006-82 | D284: 192.90000000000001 | E284: 0 | F284: 0 | G284: 0 | H284: 0 | I284: 0 | J284: 0 | K284: 212.56 | L284: 0 | M284: =SUM(J284:L284)-19.66 -> 192.90000000000001 | N284: 19.66 | O284: =SUM(M284:N284) -> 212.56
A285: 3312 | B285: EOL IBIRAPUITÃ I | C285: 14.608.116/0001-12 | D285: 43.409999999999997 | E285: 0 | F285: 0 | G285: 0 | H285: 0 | I285: 0 | J285: 0 | K285: 47.829999999999998 | L285: 0 | M285: =SUM(J285:L285)-4.42 -> 43.409999999999997 | N285: 4.4199999999999999 | O285: =SUM(M285:N285) -> 47.829999999999998
A286: 3313 | B286: PARNAÍBA II | C286: 14.578.002/0001-77 | D286: 2977.8699999999999 | E286: 0 | F286: 0 | G286: 0 | H286: 0 | I286: 0 | J286: 0 | K286: 3281.4000000000001 | L286: 0 | M286: =SUM(J286:L286)-303.53 -> 2977.8699999999999 | N286: 303.52999999999997 | O286: =SUM(M286:N286) -> 3281.3999999999996
A287: 3314 | B287: UTE ERB CANDEIAS | C287: 12.901.925/0001-92 | D287: 19.309999999999999 | E287: 0 | F287: 0 | G287: 0 | H287: 0 | I287: 0 | J287: 0 | K287: 21.280000000000001 | L287: 0 | M287: =SUM(J287:L287)-1.97 -> 19.310000000000002 | N287: 1.97 | O287: =SUM(M287:N287) -> 21.280000000000001
A288: 3315 | B288: EOL UNIÃO DOS VENTOS 1 | C288: 13.336.223/0001-76 | D288: 50.530000000000001 | E288: 0 | F288: 0 | G288: 0 | H288: 0 | I288: 0 | J288: 0 | K288: 55.68 | L288: 0 | M288: =SUM(J288:L288)-5.15 -> 50.530000000000001 | N288: 5.1500000000000004 | O288: =SUM(M288:N288) -> 55.68
A289: 3316 | B289: EOL UNIÃO DOS VENTOS 2 | C289: 13.336.463/0001-70 | D289: 50.759999999999998 | E289: 0 | F289: 0 | G289: 0 | H289: 0 | I289: 0 | J289: 0 | K289: 55.93 | L289: 0 | M289: =SUM(J289:L289)-5.17 -> 50.759999999999998 | N289: 5.1699999999999999 | O289: =SUM(M289:N289) -> 55.93
A290: 3317 | B290: EOL UNIÃO DOS VENTOS 3 | C290: 13.336.480/0001-08 | D290: 50.25 | E290: 0 | F290: 0 | G290: 0 | H290: 0 | I290: 0 | J290: 0 | K290: 55.369999999999997 | L290: 0 | M290: =SUM(J290:L290)-5.12 -> 50.25 | N290: 5.1200000000000001 | O290: =SUM(M290:N290) -> 55.369999999999997
A291: 3318 | B291: EOL UNIÃO DOS VENTOS 4 | C291: 13.336.491/0001-98 | D291: 25.27 | E291: 0 | F291: 0 | G291: 0 | H291: 0 | I291: 0 | J291: 0 | K291: 27.850000000000001 | L291: 0 | M291: =SUM(J291:L291)-2.58 -> 25.270000000000003 | N291: 2.5800000000000001 | O291: =SUM(M291:N291) -> 27.850000000000001
A292: 3319 | B292: EOL UNIÃO DOS VENTOS 5 | C292: 13.336.386/0001-59 | D292: 53.549999999999997 | E292: 0 | F292: 0 | G292: 0 | H292: 0 | I292: 0 | J292: 0 | K292: 59.009999999999998 | L292: 0 | M292: =SUM(J292:L292)-5.46 -> 53.549999999999997 | N292: 5.46 | O292: =SUM(M292:N292) -> 59.009999999999998
A293: 3320 | B293: EOL UNIÃO DOS VENTOS 6 | C293: 13.336.397/0001-39 | D293: 28.800000000000001 | E293: 0 | F293: 0 | G293: 0 | H293: 0 | I293: 0 | J293: 0 | K293: 31.739999999999998 | L293: 0 | M293: =SUM(J293:L293)-2.94 -> 28.799999999999997 | N293: 2.9399999999999999 | O293: =SUM(M293:N293) -> 31.739999999999998
A294: 3321 | B294: EOL UNIÃO DOS VENTOS 7 | C294: 13.341.988/0001-02 | D294: 32.600000000000001 | E294: 0 | F294: 0 | G294: 0 | H294: 0 | I294: 0 | J294: 0 | K294: 35.920000000000002 | L294: 0 | M294: =SUM(J294:L294)-3.32 -> 32.600000000000001 | N294: 3.3199999999999998 | O294: =SUM(M294:N294) -> 35.920000000000002
A295: 3322 | B295: EOL UNIÃO DOS VENTOS 8 | C295: 13.336.404/0001-00 | D295: 34.640000000000001 | E295: 0 | F295: 0 | G295: 0 | H295: 0 | I295: 0 | J295: 0 | K295: 38.170000000000002 | L295: 0 | M295: =SUM(J295:L295)-3.53 -> 34.640000000000001 | N295: 3.5299999999999998 | O295: =SUM(M295:N295) -> 38.170000000000002
A296: 3323 | B296: EOL UNIÃO DOS VENTOS 9 | C296: 13.336.428/0001-51 | D296: 25.75 | E296: 0 | F296: 0 | G296: 0 | H296: 0 | I296: 0 | J296: 0 | K296: 28.370000000000001 | L296: 0 | M296: =SUM(J296:L296)-2.62 -> 25.75 | N296: 2.6200000000000001 | O296: =SUM(M296:N296) -> 28.370000000000001
A297: 3324 | B297: EOL UNIÃO DOS VENTOS 10 | C297: 13.336.415/0001-82 | D297: 32.950000000000003 | E297: 0 | F297: 0 | G297: 0 | H297: 0 | I297: 0 | J297: 0 | K297: 36.310000000000002 | L297: 0 | M297: =SUM(J297:L297)-3.36 -> 32.950000000000003 | N297: 3.3599999999999999 | O297: =SUM(M297:N297) -> 36.310000000000002
A298: 3325 | B298: UTE PARNAÍBA IV | C298: 14.578.002/0001-77 | D298: 221.34999999999999 | E298: 0 | F298: 0 | G298: 0 | H298: 0 | I298: 0 | J298: 0 | K298: 243.91 | L298: 0 | M298: =SUM(J298:L298)-22.56 -> 221.34999999999999 | N298: 22.559999999999999 | O298: =SUM(M298:N298) -> 243.91
A299: 3326 | B299: EOL PRIMAVERA | C299: 12.851.871/0004-40 | D299: 71.840000000000003 | E299: 0 | F299: 0 | G299: 0 | H299: 0 | I299: 0 | J299: 0 | K299: 79.159999999999997 | L299: 0 | M299: =SUM(J299:L299)-7.32 -> 71.840000000000003 | N299: 7.3200000000000003 | O299: =SUM(M299:N299) -> 79.159999999999997
A300: 3327 | B300: EOL MODELO I | C300: 14.512.809/0002-98 | D300: 72.549999999999997 | E300: 0 | F300: 0 | G300: 0 | H300: 0 | I300: 0 | J300: 0 | K300: 79.939999999999998 | L300: 0 | M300: =SUM(J300:L300)-7.39 -> 72.549999999999997 | N300: 7.3899999999999997 | O300: =SUM(M300:N300) -> 79.939999999999998
A301: 3328 | B301: EOL MODELO II | C301: 14.504.489/0002-24 | D301: 63.130000000000003 | E301: 0 | F301: 0 | G301: 0 | H301: 0 | I301: 0 | J301: 0 | K301: 69.560000000000002 | L301: 0 | M301: =SUM(J301:L301)-6.43 -> 63.130000000000003 | N301: 6.4299999999999997 | O301: =SUM(M301:N301) -> 69.560000000000002
A302: 3329 | B302: EOL SÃO JUDAS | C302: 12.851.951/0003-15 | D302: 71.180000000000007 | E302: 0 | F302: 0 | G302: 0 | H302: 0 | I302: 0 | J302: 0 | K302: 78.439999999999998 | L302: 0 | M302: =SUM(J302:L302)-7.26 -> 71.179999999999993 | N302: 7.2599999999999998 | O302: =SUM(M302:N302) -> 78.439999999999998
A303: 3330 | B303: EOL CRISTAL | C303: 12.851.920/0003-64 | D303: 71.489999999999995 | E303: 0 | F303: 0 | G303: 0 | H303: 0 | I303: 0 | J303: 0 | K303: 78.780000000000001 | L303: 0 | M303: =SUM(J303:L303)-7.29 -> 71.489999999999995 | N303: 7.29 | O303: =SUM(M303:N303) -> 78.780000000000001
A304: 3331 | B304: EOL PEDRA PRETA | C304: 09.665.342/0002-86 | D304: 49.18 | E304: 0 | F304: 0 | G304: 0 | H304: 0 | I304: 0 | J304: 0 | K304: 54.189999999999998 | L304: 0 | M304: =SUM(J304:L304)-5.01 -> 49.18 | N304: 5.0099999999999998 | O304: =SUM(M304:N304) -> 54.189999999999998
A305: 3332 | B305: EOL COSTA BRANCA | C305: 09.665.392/0002-63 | D305: 49.219999999999999 | E305: 0 | F305: 0 | G305: 0 | H305: 0 | I305: 0 | J305: 0 | K305: 54.240000000000002 | L305: 0 | M305: =SUM(J305:L305)-5.02 -> 49.219999999999999 | N305: 5.0199999999999996 | O305: =SUM(M305:N305) -> 54.239999999999995
A306: 3333 | B306: EOL JUREMAS | C306: 09.665.446/0002-90 | D306: 38.649999999999999 | E306: 0 | F306: 0 | G306: 0 | H306: 0 | I306: 0 | J306: 0 | K306: 42.590000000000003 | L306: 0 | M306: =SUM(J306:L306)-3.94 -> 38.650000000000006 | N306: 3.9399999999999999 | O306: =SUM(M306:N306) -> 42.590000000000003
A307: 3334 | B307: EOL MACACOS | C307: 07.091.059/0002-62 | D307: 49.170000000000002 | E307: 0 | F307: 0 | G307: 0 | H307: 0 | I307: 0 | J307: 0 | K307: 54.18 | L307: 0 | M307: =SUM(J307:L307)-5.01 -> 49.170000000000002 | N307: 5.0099999999999998 | O307: =SUM(M307:N307) -> 54.18
A308: 3335 | B308: EOL EMILIANA | C308: 14.422.996/0002-19 | D308: 67.090000000000003 | E308: 0 | F308: 0 | G308: 0 | H308: 0 | I308: 0 | J308: 0 | K308: 73.930000000000007 | L308: 0 | M308: =SUM(J308:L308)-6.84 -> 67.090000000000003 | N308: 6.8399999999999999 | O308: =SUM(M308:N308) -> 73.930000000000007
A309: 3336 | B309: EOL JOANA | C309: 14.423.010/0002-25 | D309: 67.090000000000003 | E309: 0 | F309: 0 | G309: 0 | H309: 0 | I309: 0 | J309: 0 | K309: 73.930000000000007 | L309: 0 | M309: =SUM(J309:L309)-6.84 -> 67.090000000000003 | N309: 6.8399999999999999 | O309: =SUM(M309:N309) -> 73.930000000000007
A310: 3337 | B310: UHE SANTO ANTONIO JARI | C310: 03.581.989/0003-24 | D310: 1277.0599999999999 | E310: 0 | F310: 0 | G310: 0 | H310: 0 | I310: 0 | J310: 0 | K310: 1407.23 | L310: 0 | M310: =SUM(J310:L310)-130.17 -> 1277.0599999999999 | N310: 130.16999999999999 | O310: =SUM(M310:N310) -> 1407.23
A311: 3338 | B311: EOL CARCARÁ I | C311: 14.535.594/0001-40 | D311: 72.569999999999993 | E311: 0 | F311: 0 | G311: 0 | H311: 0 | I311: 0 | J311: 0 | K311: 79.969999999999999 | L311: 0 | M311: =SUM(J311:L311)-7.4 -> 72.569999999999993 | N311: 7.4000000000000004 | O311: =SUM(M311:N311) -> 79.969999999999999
A312: 3339 | B312: DESA (EOL EURUS I) | C312: 12.652.614/0001-37 | D312: 73.090000000000003 | E312: 0 | F312: 0 | G312: 0 | H312: 0 | I312: 0 | J312: 0 | K312: 80.540000000000006 | L312: 0 | M312: =SUM(J312:L312)-7.45 -> 73.090000000000003 | N312: 7.4500000000000002 | O312: =SUM(M312:N312) -> 80.540000000000006
A313: 3340 | B313: DESA (EOL EURUS III) | C313: 12.652.634/0001-08 | D313: 71.709999999999994 | E313: 0 | F313: 0 | G313: 0 | H313: 0 | I313: 0 | J313: 0 | K313: 79.019999999999996 | L313: 0 | M313: =SUM(J313:L313)-7.31 -> 71.709999999999994 | N313: 7.3099999999999996 | O313: =SUM(M313:N313) -> 79.019999999999996
A314: 3341 | B314: EOL CARCARÁ II | C314: 15.394.399/0001-00 | D314: 57.090000000000003 | E314: 0 | F314: 0 | G314: 0 | H314: 0 | I314: 0 | J314: 0 | K314: 62.909999999999997 | L314: 0 | M314: =SUM(J314:L314)-5.82 -> 57.089999999999996 | N314: 5.8200000000000003 | O314: =SUM(M314:N314) -> 62.909999999999997
A315: 3342 | B315: EOL RENASCENÇA V | C315: 10.797.904/0001-43 | D315: 72.140000000000001 | E315: 0 | F315: 0 | G315: 0 | H315: 0 | I315: 0 | J315: 0 | K315: 79.489999999999995 | L315: 0 | M315: =SUM(J315:L315)-7.35 -> 72.140000000000001 | N315: 7.3499999999999996 | O315: =SUM(M315:N315) -> 79.489999999999995
A316: 3343 | B316: ATLANTIC (EOL EURUS II) | C316: 10.797.897/0001-80 | D316: 72.140000000000001 | E316: 0 | F316: 0 | G316: 0 | H316: 0 | I316: 0 | J316: 0 | K316: 79.489999999999995 | L316: 0 | M316: =SUM(J316:L316)-7.35 -> 72.140000000000001 | N316: 7.3499999999999996 | O316: =SUM(M316:N316) -> 79.489999999999995
A317: 3344 | B317: EOL SANTO ANTÔNIO DE PÁDUA | C317: 09.601.233/0001-14 | D317: 31.780000000000001 | E317: 0 | F317: 0 | G317: 0 | H317: 0 | I317: 0 | J317: 0 | K317: 35.020000000000003 | L317: 0 | M317: =SUM(J317:L317)-3.24 -> 31.780000000000001 | N317: 3.2400000000000002 | O317: =SUM(M317:N317) -> 35.020000000000003
A318: 3345 | B318: EOL SÃO CRISTOVÃO | C318: 10.272.500/0001-36 | D318: 57.350000000000001 | E318: 0 | F318: 0 | G318: 0 | H318: 0 | I318: 0 | J318: 0 | K318: 63.200000000000003 | L318: 0 | M318: =SUM(J318:L318)-5.85 -> 57.350000000000001 | N318: 5.8499999999999996 | O318: =SUM(M318:N318) -> 63.200000000000003
A319: 3346 | B319: EOL SÃO JORGE | C319: 09.571.485/0001-48 | D319: 54.159999999999997 | E319: 0 | F319: 0 | G319: 0 | H319: 0 | I319: 0 | J319: 0 | K319: 59.68 | L319: 0 | M319: =SUM(J319:L319)-5.52 -> 54.159999999999997 | N319: 5.5199999999999996 | O319: =SUM(M319:N319) -> 59.679999999999993
A320: 3347 | B320: EOL V. DO NORDESTE | C320: 11.204.086/0001-90 | D320: 57.700000000000003 | E320: 0 | F320: 0 | G320: 0 | H320: 0 | I320: 0 | J320: 0 | K320: 63.579999999999998 | L320: 0 | M320: =SUM(J320:L320)-5.88 -> 57.699999999999996 | N320: 5.8799999999999999 | O320: =SUM(M320:N320) -> 63.579999999999998
A321: 3348 | B321: EOL TANQUE | C321: 12.048.059/0001-39 | D321: 73.599999999999994 | E321: 0 | F321: 0 | G321: 0 | H321: 0 | I321: 0 | J321: 0 | K321: 81.099999999999994 | L321: 0 | M321: =SUM(J321:L321)-7.5 -> 73.599999999999994 | N321: 7.5 | O321: =SUM(M321:N321) -> 81.099999999999994
A322: 3349 | B322: EOL SERAÍMA | C322: 12.047.526/0001-06 | D322: 73.599999999999994 | E322: 0 | F322: 0 | G322: 0 | H322: 0 | I322: 0 | J322: 0 | K322: 81.099999999999994 | L322: 0 | M322: =SUM(J322:L322)-7.5 -> 73.599999999999994 | N322: 7.5 | O322: =SUM(M322:N322) -> 81.099999999999994
A323: 3350 | B323: EOL DOS ARAÇAS | C323: 11.201.833/0001-37 | D323: 73.599999999999994 | E323: 0 | F323: 0 | G323: 0 | H323: 0 | I323: 0 | J323: 0 | K323: 81.099999999999994 | L323: 0 | M323: =SUM(J323:L323)-7.5 -> 73.599999999999994 | N323: 7.5 | O323: =SUM(M323:N323) -> 81.099999999999994
A324: 3351 | B324: EOL DA PRATA | C324: 11.366.231/0001-30 | D324: 53.579999999999998 | E324: 0 | F324: 0 | G324: 0 | H324: 0 | I324: 0 | J324: 0 | K324: 59.039999999999999 | L324: 0 | M324: =SUM(J324:L324)-5.46 -> 53.579999999999998 | N324: 5.46 | O324: =SUM(M324:N324) -> 59.039999999999999
A325: 3352 | B325: EOL CAETITÉ 1 | C325: 12.158.428/0002-27 | D325: 61.549999999999997 | E325: 0 | F325: 0 | G325: 0 | H325: 0 | I325: 0 | J325: 0 | K325: 67.819999999999993 | L325: 0 | M325: =SUM(J325:L325)-6.27 -> 61.549999999999997 | N325: 6.2699999999999996 | O325: =SUM(M325:N325) -> 67.819999999999993
A326: 3353 | B326: EOL TERRAL | C326: 15.394.357/0001-79 | D326: 57.090000000000003 | E326: 0 | F326: 0 | G326: 0 | H326: 0 | I326: 0 | J326: 0 | K326: 62.909999999999997 | L326: 0 | M326: =SUM(J326:L326)-5.82 -> 57.089999999999996 | N326: 5.8200000000000003 | O326: =SUM(M326:N326) -> 62.909999999999997
A327: 3354 | B327: TIJOA (UHE TRES IRMÃOS) | C327: 14.522.198/0001-88 | D327: 4186.1099999999997 | E327: 0 | F327: 0 | G327: 0 | H327: 0 | I327: 0 | J327: 0 | K327: 4612.79 | L327: 0 | M327: =SUM(J327:L327)-426.68 -> 4186.1099999999997 | N327: 426.68000000000001 | O327: =SUM(M327:N327) -> 4612.79
A328: 3355 | B328: EOL FAROL | C328: 12.723.335/0001-17 | D328: 43.590000000000003 | E328: 0 | F328: 0 | G328: 0 | H328: 0 | I328: 0 | J328: 0 | K328: 48.030000000000001 | L328: 0 | M328: =SUM(J328:L328)-4.44 -> 43.590000000000003 | N328: 4.4400000000000004 | O328: =SUM(M328:N328) -> 48.030000000000001
A329: 3356 | B329: UTE TROPICAL BIOENERGIA II | C329: 08.195.806/0001-94 | D329: 88.049999999999997 | E329: 0 | F329: 0 | G329: 0 | H329: 0 | I329: 0 | J329: 0 | K329: 97.019999999999996 | L329: 0 | M329: =SUM(J329:L329)-8.97 -> 88.049999999999997 | N329: 8.9700000000000006 | O329: =SUM(M329:N329) -> 97.019999999999996
A330: 3357 | B330: UHE FERREIRA GOMES | C330: 12.489.315/0001-23 | D330: 1084.3099999999999 | E330: 0 | F330: 0 | G330: 0 | H330: 0 | I330: 0 | J330: 0 | K330: 1194.8299999999999 | L330: 0 | M330: =SUM(J330:L330)-110.52 -> 1084.3099999999999 | N330: 110.52 | O330: =SUM(M330:N330) -> 1194.8299999999999
A331: 3358 | B331: VENTOS DOS INDIOS (INDIOS 2-3) | C331: 11.622.264/0002-84 | D331: 92.810000000000002 | E331: 0 | F331: 0 | G331: 0 | H331: 0 | I331: 0 | J331: 0 | K331: 102.27 | L331: 0 | M331: =SUM(J331:L331)-9.46 -> 92.810000000000002 | N331: 9.4600000000000009 | O331: =SUM(M331:N331) -> 102.27000000000001
A332: 3359 | B332: NORTE ENERGIA (BELO MONTE) | C332: 12.300.288/0001-07 | D332: 57979.849999999999 | E332: 0 | F332: 0 | G332: 0 | H332: 0 | I332: 0 | J332: 0 | K332: 63889.639999999999 | L332: 0 | M332: =SUM(J332:L332)-5909.79 -> 57979.849999999999 | N332: 5909.79 | O332: =SUM(M332:N332) -> 63889.639999999999
A333: 3360 | B333: EOL MORRÃO | C333: 12.049.829/0001-68 | D333: 66.030000000000001 | E333: 0 | F333: 0 | G333: 0 | H333: 0 | I333: 0 | J333: 0 | K333: 72.760000000000005 | L333: 0 | M333: =SUM(J333:L333)-6.73 -> 66.030000000000001 | N333: 6.7300000000000004 | O333: =SUM(M333:N333) -> 72.760000000000005
A334: 3361 | B334: ACARI (EOL RIACHÃO I) | C334: 12.959.291/0001-29 | D334: 65.590000000000003 | E334: 0 | F334: 0 | G334: 0 | H334: 0 | I334: 0 | J334: 0 | K334: 72.280000000000001 | L334: 0 | M334: =SUM(J334:L334)-6.69 -> 65.590000000000003 | N334: 6.6900000000000004 | O334: =SUM(M334:N334) -> 72.280000000000001
A335: 3362 | B335: ALBUQUERQUE (EOL RIACHÃO II) | C335: 12.960.216/0001-88 | D335: 60.380000000000003 | E335: 0 | F335: 0 | G335: 0 | H335: 0 | I335: 0 | J335: 0 | K335: 66.530000000000001 | L335: 0 | M335: =SUM(J335:L335)-6.15 -> 60.380000000000003 | N335: 6.1500000000000004 | O335: =SUM(M335:N335) -> 66.530000000000001
A336: 3363 | B336: ANEMOI (EOL RIACHÃO IV) | C336: 12.959.327/0001-74 | D336: 66.140000000000001 | E336: 0 | F336: 0 | G336: 0 | H336: 0 | I336: 0 | J336: 0 | K336: 72.879999999999995 | L336: 0 | M336: =SUM(J336:L336)-6.74 -> 66.140000000000001 | N336: 6.7400000000000002 | O336: =SUM(M336:N336) -> 72.879999999999995
A337: 3364 | B337: APELIOTES (EOL RIACHÃO VI) | C337: 12.959.413/0001-87 | D337: 66.299999999999997 | E337: 0 | F337: 0 | G337: 0 | H337: 0 | I337: 0 | J337: 0 | K337: 73.060000000000002 | L337: 0 | M337: =SUM(J337:L337)-6.76 -> 66.299999999999997 | N337: 6.7599999999999998 | O337: =SUM(M337:N337) -> 73.060000000000002
A338: 3365 | B338: ARENA (EOL RIACHÃO VII) | C338: 11.781.913/0001-09 | D338: 66.409999999999997 | E338: 0 | F338: 0 | G338: 0 | H338: 0 | I338: 0 | J338: 0 | K338: 73.180000000000007 | L338: 0 | M338: =SUM(J338:L338)-6.77 -> 66.410000000000011 | N338: 6.7699999999999996 | O338: =SUM(M338:N338) -> 73.180000000000007
A339: 3366 | B339: EOL SANTA HELENA | C339: 12.053.929/0002-49 | D339: 78.670000000000002 | E339: 0 | F339: 0 | G339: 0 | H339: 0 | I339: 0 | J339: 0 | K339: 86.689999999999998 | L339: 0 | M339: =SUM(J339:L339)-8.02 -> 78.670000000000002 | N339: 8.0199999999999996 | O339: =SUM(M339:N339) -> 86.689999999999998
A340: 3367 | B340: EOL SM | C340: 12.053.787/0002-10 | D340: 77.75 | E340: 0 | F340: 0 | G340: 0 | H340: 0 | I340: 0 | J340: 0 | K340: 85.670000000000002 | L340: 0 | M340: =SUM(J340:L340)-7.92 -> 77.75 | N340: 7.9199999999999999 | O340: =SUM(M340:N340) -> 85.670000000000002
A341: 3368 | B341: EOL VERACE I | C341: 42.873.310/0003-22 | D341: 35.149999999999999 | E341: 0 | F341: 0 | G341: 0 | H341: 0 | I341: 0 | J341: 0 | K341: 38.729999999999997 | L341: 0 | M341: =SUM(J341:L341)-3.58 -> 35.149999999999999 | N341: 3.5800000000000001 | O341: =SUM(M341:N341) -> 38.729999999999997
A342: 3369 | B342: EOL VERACE II | C342: 42.873.310/0003-22 | D342: 35.130000000000003 | E342: 0 | F342: 0 | G342: 0 | H342: 0 | I342: 0 | J342: 0 | K342: 38.710000000000001 | L342: 0 | M342: =SUM(J342:L342)-3.58 -> 35.130000000000003 | N342: 3.5800000000000001 | O342: =SUM(M342:N342) -> 38.710000000000001
A343: 3370 | B343: EOL VERACE III | C343: 42.873.310/0003-22 | D343: 45.950000000000003 | E343: 0 | F343: 0 | G343: 0 | H343: 0 | I343: 0 | J343: 0 | K343: 50.630000000000003 | L343: 0 | M343: =SUM(J343:L343)-4.68 -> 45.950000000000003 | N343: 4.6799999999999997 | O343: =SUM(M343:N343) -> 50.630000000000003
A344: 3371 | B344: EOL VERACE IV | C344: 42.873.310/0003-22 | D344: 53.030000000000001 | E344: 0 | F344: 0 | G344: 0 | H344: 0 | I344: 0 | J344: 0 | K344: 58.439999999999998 | L344: 0 | M344: =SUM(J344:L344)-5.41 -> 53.030000000000001 | N344: 5.4100000000000001 | O344: =SUM(M344:N344) -> 58.439999999999998
A345: 3372 | B345: EOL VERACE V | C345: 42.873.310/0003-22 | D345: 52.719999999999999 | E345: 0 | F345: 0 | G345: 0 | H345: 0 | I345: 0 | J345: 0 | K345: 58.090000000000003 | L345: 0 | M345: =SUM(J345:L345)-5.37 -> 52.720000000000006 | N345: 5.3700000000000001 | O345: =SUM(M345:N345) -> 58.090000000000003
A346: 3373 | B346: EOL VERACE VI | C346: 42.873.310/0003-22 | D346: 32 | E346: 0 | F346: 0 | G346: 0 | H346: 0 | I346: 0 | J346: 0 | K346: 35.259999999999998 | L346: 0 | M346: =SUM(J346:L346)-3.26 -> 32 | N346: 3.2599999999999998 | O346: =SUM(M346:N346) -> 35.259999999999998
A347: 3374 | B347: EOL VERACE VII | C347: 42.873.310/0003-22 | D347: 53.009999999999998 | E347: 0 | F347: 0 | G347: 0 | H347: 0 | I347: 0 | J347: 0 | K347: 58.409999999999997 | L347: 0 | M347: =SUM(J347:L347)-5.4 -> 53.009999999999998 | N347: 5.4000000000000004 | O347: =SUM(M347:N347) -> 58.409999999999997
A348: 3375 | B348: EOL VERACE VIII | C348: 42.873.310/0003-22 | D348: 45.899999999999999 | E348: 0 | F348: 0 | G348: 0 | H348: 0 | I348: 0 | J348: 0 | K348: 50.579999999999998 | L348: 0 | M348: =SUM(J348:L348)-4.68 -> 45.899999999999999 | N348: 4.6799999999999997 | O348: =SUM(M348:N348) -> 50.579999999999998
A349: 3376 | B349: EOL VERACE IX | C349: 42.873.310/0003-22 | D349: 52.880000000000003 | E349: 0 | F349: 0 | G349: 0 | H349: 0 | I349: 0 | J349: 0 | K349: 58.270000000000003 | L349: 0 | M349: =SUM(J349:L349)-5.39 -> 52.880000000000003 | N349: 5.3899999999999997 | O349: =SUM(M349:N349) -> 58.270000000000003
A350: 3377 | B350: EOL VERACE X | C350: 42.873.310/0003-22 | D350: 49.520000000000003 | E350: 0 | F350: 0 | G350: 0 | H350: 0 | I350: 0 | J350: 0 | K350: 54.57 | L350: 0 | M350: =SUM(J350:L350)-5.05 -> 49.520000000000003 | N350: 5.0499999999999998 | O350: =SUM(M350:N350) -> 54.57
A351: 3378 | B351: EOL AMETISTA | C351: 11.201.885/0001-03 | D351: 68.840000000000003 | E351: 0 | F351: 0 | G351: 0 | H351: 0 | I351: 0 | J351: 0 | K351: 75.859999999999999 | L351: 0 | M351: =SUM(J351:L351)-7.02 -> 68.840000000000003 | N351: 7.0199999999999996 | O351: =SUM(M351:N351) -> 75.859999999999999
A352: 3379 | B352: EOL DOURADOS | C352: 12.041.319/0001-44 | D352: 68.890000000000001 | E352: 0 | F352: 0 | G352: 0 | H352: 0 | I352: 0 | J352: 0 | K352: 75.909999999999997 | L352: 0 | M352: =SUM(J352:L352)-7.02 -> 68.890000000000001 | N352: 7.0199999999999996 | O352: =SUM(M352:N352) -> 75.909999999999997
A353: 3380 | B353: EOL MARON | C353: 12.041.214/0001-95 | D353: 73.200000000000003 | E353: 0 | F353: 0 | G353: 0 | H353: 0 | I353: 0 | J353: 0 | K353: 80.659999999999997 | L353: 0 | M353: =SUM(J353:L353)-7.46 -> 73.200000000000003 | N353: 7.46 | O353: =SUM(M353:N353) -> 80.659999999999997
A354: 3381 | B354: EOL PILÕES | C354: 11.201.797/0001-01 | D354: 73.200000000000003 | E354: 0 | F354: 0 | G354: 0 | H354: 0 | I354: 0 | J354: 0 | K354: 80.659999999999997 | L354: 0 | M354: =SUM(J354:L354)-7.46 -> 73.200000000000003 | N354: 7.46 | O354: =SUM(M354:N354) -> 80.659999999999997
A355: 3382 | B355: EOL MALHADINHA I | C355: 14.080.223/0002-00 | D355: 45.189999999999998 | E355: 0 | F355: 0 | G355: 0 | H355: 0 | I355: 0 | J355: 0 | K355: 49.799999999999997 | L355: 0 | M355: =SUM(J355:L355)-4.61 -> 45.189999999999998 | N355: 4.6100000000000003 | O355: =SUM(M355:N355) -> 49.799999999999997
A356: 3383 | B356: UTE CMPC | C356: 11.234.954/0001-85 | D356: 53.880000000000003 | E356: 0 | F356: 0 | G356: 0 | H356: 0 | I356: 0 | J356: 0 | K356: 59.369999999999997 | L356: 0 | M356: =SUM(J356:L356)-5.49 -> 53.879999999999995 | N356: 5.4900000000000002 | O356: =SUM(M356:N356) -> 59.369999999999997
A357: 3384 | B357: EOL ASA BRANCA I | C357: 12.802.855/0001-15 | D357: 65.430000000000007 | E357: 0 | F357: 0 | G357: 0 | H357: 0 | I357: 0 | J357: 0 | K357: 72.099999999999994 | L357: 0 | M357: =SUM(J357:L357)-6.67 -> 65.429999999999993 | N357: 6.6699999999999999 | O357: =SUM(M357:N357) -> 72.099999999999994
A358: 3385 | B358: EOL ASA BRANCA II | C358: 12.802.844/0001-35 | D358: 74.409999999999997 | E358: 0 | F358: 0 | G358: 0 | H358: 0 | I358: 0 | J358: 0 | K358: 81.989999999999995 | L358: 0 | M358: =SUM(J358:L358)-7.58 -> 74.409999999999997 | N358: 7.5800000000000001 | O358: =SUM(M358:N358) -> 81.989999999999995
A359: 3386 | B359: EOL ASA BRANCA III | C359: 12.802.835/0001-44 | D359: 64.260000000000005 | E359: 0 | F359: 0 | G359: 0 | H359: 0 | I359: 0 | J359: 0 | K359: 70.810000000000002 | L359: 0 | M359: =SUM(J359:L359)-6.55 -> 64.260000000000005 | N359: 6.5499999999999998 | O359: =SUM(M359:N359) -> 70.810000000000002
A360: 3387 | B360: EOL EURUS IV | C360: 12.802.866/0001-03 | D360: 78.019999999999996 | E360: 0 | F360: 0 | G360: 0 | H360: 0 | I360: 0 | J360: 0 | K360: 85.969999999999999 | L360: 0 | M360: =SUM(J360:L360)-7.95 -> 78.019999999999996 | N360: 7.9500000000000002 | O360: =SUM(M360:N360) -> 85.969999999999999
A361: 3388 | B361: ALIANÇA (CONS. PORTO ESTRELA) | C361: 12.009.135/0001-05 | D361: 200.59999999999999 | E361: 0 | F361: 0 | G361: 0 | H361: 0 | I361: 0 | J361: 0 | K361: 221.05000000000001 | L361: 0 | M361: =SUM(J361:L361)-20.45 -> 200.60000000000002 | N361: 20.449999999999999 | O361: =SUM(M361:N361) -> 221.05000000000001
A362: 3389 | B362: ALIANÇA (UHE AIMORÉS) | C362: 12.009.135/0001-05 | D362: 949.94000000000005 | E362: 0 | F362: 0 | G362: 0 | H362: 0 | I362: 0 | J362: 0 | K362: 1046.77 | L362: 0 | M362: =SUM(J362:L362)-96.83 -> 949.93999999999994 | N362: 96.829999999999998 | O362: =SUM(M362:N362) -> 1046.77
A363: 3390 | B363: EOL LANCHINHA | C363: 14.603.978/0001-52 | D363: 68.299999999999997 | E363: 0 | F363: 0 | G363: 0 | H363: 0 | I363: 0 | J363: 0 | K363: 75.260000000000005 | L363: 0 | M363: =SUM(J363:L363)-6.96 -> 68.300000000000011 | N363: 6.96 | O363: =SUM(M363:N363) -> 75.260000000000005
A364: 3391 | B364: EOL PELADO | C364: 14.604.100/0001-31 | D364: 48.43 | E364: 0 | F364: 0 | G364: 0 | H364: 0 | I364: 0 | J364: 0 | K364: 53.369999999999997 | L364: 0 | M364: =SUM(J364:L364)-4.94 -> 48.43 | N364: 4.9400000000000004 | O364: =SUM(M364:N364) -> 53.369999999999997
A365: 3392 | B365: EOL CHUÍ I | C365: 42.873.310/0002-41 | D365: 42.840000000000003 | E365: 0 | F365: 0 | G365: 0 | H365: 0 | I365: 0 | J365: 0 | K365: 47.210000000000001 | L365: 0 | M365: =SUM(J365:L365)-4.37 -> 42.840000000000003 | N365: 4.3700000000000001 | O365: =SUM(M365:N365) -> 47.210000000000001
A366: 3393 | B366: EOL CHUÍ II | C366: 42.873.310/0002-41 | D366: 38.920000000000002 | E366: 0 | F366: 0 | G366: 0 | H366: 0 | I366: 0 | J366: 0 | K366: 42.890000000000001 | L366: 0 | M366: =SUM(J366:L366)-3.97 -> 38.920000000000002 | N366: 3.9700000000000002 | O366: =SUM(M366:N366) -> 42.890000000000001
A367: 3394 | B367: EOL CHUÍ IV | C367: 42.873.310/0002-41 | D367: 38.880000000000003 | E367: 0 | F367: 0 | G367: 0 | H367: 0 | I367: 0 | J367: 0 | K367: 42.840000000000003 | L367: 0 | M367: =SUM(J367:L367)-3.96 -> 38.880000000000003 | N367: 3.96 | O367: =SUM(M367:N367) -> 42.840000000000003
A368: 3395 | B368: EOL CHUÍ V | C368: 42.873.310/0002-41 | D368: 52.899999999999999 | E368: 0 | F368: 0 | G368: 0 | H368: 0 | I368: 0 | J368: 0 | K368: 58.289999999999999 | L368: 0 | M368: =SUM(J368:L368)-5.39 -> 52.899999999999999 | N368: 5.3899999999999997 | O368: =SUM(M368:N368) -> 58.289999999999999
A369: 3396 | B369: EOL MINUANO I | C369: 42.873.310/0002-41 | D369: 38.340000000000003 | E369: 0 | F369: 0 | G369: 0 | H369: 0 | I369: 0 | J369: 0 | K369: 42.25 | L369: 0 | M369: =SUM(J369:L369)-3.91 -> 38.340000000000003 | N369: 3.9100000000000001 | O369: =SUM(M369:N369) -> 42.25
A370: 3397 | B370: EOL MINUANO II | C370: 42.873.310/0002-41 | D370: 41.950000000000003 | E370: 0 | F370: 0 | G370: 0 | H370: 0 | I370: 0 | J370: 0 | K370: 46.229999999999997 | L370: 0 | M370: =SUM(J370:L370)-4.28 -> 41.949999999999996 | N370: 4.2800000000000002 | O370: =SUM(M370:N370) -> 46.229999999999997
A371: 3398 | B371: PETROBRAS (UTE U-50) | C371: 33.000.167/1111-08 | D371: 93.060000000000002 | E371: 0 | F371: 0 | G371: 0 | H371: 0 | I371: 0 | J371: 0 | K371: 102.55 | L371: 0 | M371: =SUM(J371:L371)-9.49 -> 93.060000000000002 | N371: 9.4900000000000002 | O371: =SUM(M371:N371) -> 102.55
A372: 3399 | B372: EOL VENTOS DE SANTO URIEL | C372: 14.583.703/0001-02 | D372: 39.159999999999997 | E372: 0 | F372: 0 | G372: 0 | H372: 0 | I372: 0 | J372: 0 | K372: 43.149999999999999 | L372: 0 | M372: =SUM(J372:L372)-3.99 -> 39.159999999999997 | N372: 3.9900000000000002 | O372: =SUM(M372:N372) -> 43.149999999999999
A373: 3401 | B373: RAESA (UTE CRISTIANO DA ROCHA) | C373: 07.386.098/0002-97 | D373: 262.57999999999998 | E373: 0 | F373: 0 | G373: 0 | H373: 0 | I373: 0 | J373: 0 | K373: 289.33999999999997 | L373: 0 | M373: =SUM(J373:L373)-26.76 -> 262.57999999999998 | N373: 26.760000000000002 | O373: =SUM(M373:N373) -> 289.33999999999997
A374: 3402 | B374: UHE TELES PIRES | C374: 12.810.896/0005-87 | D374: 16130.049999999999 | E374: 0 | F374: 0 | G374: 0 | H374: 0 | I374: 0 | J374: 0 | K374: 17774.16 | L374: 0 | M374: =SUM(J374:L374)-1644.11 -> 16130.049999999999 | N374: 1644.1099999999999 | O374: =SUM(M374:N374) -> 17774.16
A375: 3403 | B375: DESA (EOL MORRO DOS VENTOS II) | C375: 15.207.271/0001-90 | D375: 59.740000000000002 | E375: 0 | F375: 0 | G375: 0 | H375: 0 | I375: 0 | J375: 0 | K375: 65.829999999999998 | L375: 0 | M375: =SUM(J375:L375)-6.09 -> 59.739999999999995 | N375: 6.0899999999999999 | O375: =SUM(M375:N375) -> 65.829999999999998
A376: 3404 | B376: EOL REDUTO | C376: 14.527.003/0001-92 | D376: 64.310000000000002 | E376: 0 | F376: 0 | G376: 0 | H376: 0 | I376: 0 | J376: 0 | K376: 70.870000000000005 | L376: 0 | M376: =SUM(J376:L376)-6.56 -> 64.310000000000002 | N376: 6.5599999999999996 | O376: =SUM(M376:N376) -> 70.870000000000005
A377: 3405 | B377: EOL CHUÍ IX | C377: 42.873.310/0003-22 | D377: 38.420000000000002 | E377: 0 | F377: 0 | G377: 0 | H377: 0 | I377: 0 | J377: 0 | K377: 42.340000000000003 | L377: 0 | M377: =SUM(J377:L377)-3.92 -> 38.420000000000002 | N377: 3.9199999999999999 | O377: =SUM(M377:N377) -> 42.340000000000003
A378: 3406 | B378: EOL VENTOS DE SANTA JOANA IX | C378: 19.082.784/0002-53 | D378: 37 | E378: 0 | F378: 0 | G378: 0 | H378: 0 | I378: 0 | J378: 0 | K378: 40.770000000000003 | L378: 0 | M378: =SUM(J378:L378)-3.77 -> 37 | N378: 3.77 | O378: =SUM(M378:N378) -> 40.770000000000003
A379: 3407 | B379: EOL VENTOS DE SANTA JOANA X | C379: 19.082.754/0002-47 | D379: 37 | E379: 0 | F379: 0 | G379: 0 | H379: 0 | I379: 0 | J379: 0 | K379: 40.770000000000003 | L379: 0 | M379: =SUM(J379:L379)-3.77 -> 37 | N379: 3.77 | O379: =SUM(M379:N379) -> 40.770000000000003
A380: 3408 | B380: EOL VENTOS DE SANTA JOANA XI | C380: 19.082.675/0002-36 | D380: 37 | E380: 0 | F380: 0 | G380: 0 | H380: 0 | I380: 0 | J380: 0 | K380: 40.770000000000003 | L380: 0 | M380: =SUM(J380:L380)-3.77 -> 37 | N380: 3.77 | O380: =SUM(M380:N380) -> 40.770000000000003
A381: 3409 | B381: EOL VENTOS DE SANTA JOANA XII | C381: 19.082.701/0002-26 | D381: 36.119999999999997 | E381: 0 | F381: 0 | G381: 0 | H381: 0 | I381: 0 | J381: 0 | K381: 39.799999999999997 | L381: 0 | M381: =SUM(J381:L381)-3.68 -> 36.119999999999997 | N381: 3.6800000000000002 | O381: =SUM(M381:N381) -> 39.799999999999997
A382: 3410 | B382: EOL VENTOS DE SANTA JOANA XIII | C382: 19.082.800/0002-08 | D382: 37 | E382: 0 | F382: 0 | G382: 0 | H382: 0 | I382: 0 | J382: 0 | K382: 40.770000000000003 | L382: 0 | M382: =SUM(J382:L382)-3.77 -> 37 | N382: 3.77 | O382: =SUM(M382:N382) -> 40.770000000000003
A383: 3411 | B383: EOL VENTOS DE SANTA JOANA XV | C383: 19.082.728/0002-19 | D383: 36.119999999999997 | E383: 0 | F383: 0 | G383: 0 | H383: 0 | I383: 0 | J383: 0 | K383: 39.799999999999997 | L383: 0 | M383: =SUM(J383:L383)-3.68 -> 36.119999999999997 | N383: 3.6800000000000002 | O383: =SUM(M383:N383) -> 39.799999999999997
A384: 3412 | B384: EOL VENTOS DE SANTA JOANA XVI | C384: 19.082.822/0002-78 | D384: 36.119999999999997 | E384: 0 | F384: 0 | G384: 0 | H384: 0 | I384: 0 | J384: 0 | K384: 39.799999999999997 | L384: 0 | M384: =SUM(J384:L384)-3.68 -> 36.119999999999997 | N384: 3.6800000000000002 | O384: =SUM(M384:N384) -> 39.799999999999997
A385: 3413 | B385: EOL VENTOS DE SANTO ONOFRE I | C385: 19.022.138/0001-10 | D385: 53.130000000000003 | E385: 0 | F385: 0 | G385: 0 | H385: 0 | I385: 0 | J385: 0 | K385: 58.549999999999997 | L385: 0 | M385: =SUM(J385:L385)-5.42 -> 53.129999999999995 | N385: 5.4199999999999999 | O385: =SUM(M385:N385) -> 58.549999999999997
A386: 3414 | B386: EOL VENTOS DE SANTO ONOFRE II | C386: 19.022.974/0001-02 | D386: 52.770000000000003 | E386: 0 | F386: 0 | G386: 0 | H386: 0 | I386: 0 | J386: 0 | K386: 58.149999999999999 | L386: 0 | M386: =SUM(J386:L386)-5.38 -> 52.769999999999996 | N386: 5.3799999999999999 | O386: =SUM(M386:N386) -> 58.149999999999999
A387: 3415 | B387: EOL VENTOS DE SANTO ONOFRE III | C387: 19.023.342/0001-55 | D387: 53.130000000000003 | E387: 0 | F387: 0 | G387: 0 | H387: 0 | I387: 0 | J387: 0 | K387: 58.549999999999997 | L387: 0 | M387: =SUM(J387:L387)-5.42 -> 53.129999999999995 | N387: 5.4199999999999999 | O387: =SUM(M387:N387) -> 58.549999999999997
A388: 3416 | B388: EOL VENTOS DE SANTA JOANA II | C388: 19.023.213/0001-67 | D388: 53.130000000000003 | E388: 0 | F388: 0 | G388: 0 | H388: 0 | I388: 0 | J388: 0 | K388: 58.549999999999997 | L388: 0 | M388: =SUM(J388:L388)-5.42 -> 53.129999999999995 | N388: 5.4199999999999999 | O388: =SUM(M388:N388) -> 58.549999999999997
A389: 3417 | B389: EOL VENTOS DE SANTA JOANA VI | C389: 19.022.818/0001-33 | D389: 52.950000000000003 | E389: 0 | F389: 0 | G389: 0 | H389: 0 | I389: 0 | J389: 0 | K389: 58.350000000000001 | L389: 0 | M389: =SUM(J389:L389)-5.4 -> 52.950000000000003 | N389: 5.4000000000000004 | O389: =SUM(M389:N389) -> 58.350000000000001
A390: 3418 | B390: EOL VENTOS DE SANTA JOANA VIII | C390: 19.022.356/0001-54 | D390: 52.950000000000003 | E390: 0 | F390: 0 | G390: 0 | H390: 0 | I390: 0 | J390: 0 | K390: 58.350000000000001 | L390: 0 | M390: =SUM(J390:L390)-5.4 -> 52.950000000000003 | N390: 5.4000000000000004 | O390: =SUM(M390:N390) -> 58.350000000000001
A391: 3419 | B391: EOL VENTOS DE SANTA JOANA XIV | C391: 19.023.513/0001-46 | D391: 53.130000000000003 | E391: 0 | F391: 0 | G391: 0 | H391: 0 | I391: 0 | J391: 0 | K391: 58.549999999999997 | L391: 0 | M391: =SUM(J391:L391)-5.42 -> 53.129999999999995 | N391: 5.4199999999999999 | O391: =SUM(M391:N391) -> 58.549999999999997
A392: 3420 | B392: EOL BARAÚNAS I | C392: 19.354.626/0002-05 | D392: 129.69999999999999 | E392: 0 | F392: 0 | G392: 0 | H392: 0 | I392: 0 | J392: 0 | K392: 142.91999999999999 | L392: 0 | M392: =SUM(J392:L392)-13.22 -> 129.69999999999999 | N392: 13.220000000000001 | O392: =SUM(M392:N392) -> 142.91999999999999
A393: 3421 | B393: EOL MORRO BRANCO I | C393: 19.353.878/0002-10 | D393: 64.760000000000005 | E393: 0 | F393: 0 | G393: 0 | H393: 0 | I393: 0 | J393: 0 | K393: 71.359999999999999 | L393: 0 | M393: =SUM(J393:L393)-6.6 -> 64.760000000000005 | N393: 6.5999999999999996 | O393: =SUM(M393:N393) -> 71.359999999999999
A394: 3422 | B394: EOL MUSSAMBE | C394: 19.353.849/0002-58 | D394: 64.760000000000005 | E394: 0 | F394: 0 | G394: 0 | H394: 0 | I394: 0 | J394: 0 | K394: 71.359999999999999 | L394: 0 | M394: =SUM(J394:L394)-6.6 -> 64.760000000000005 | N394: 6.5999999999999996 | O394: =SUM(M394:N394) -> 71.359999999999999
A395: 3423 | B395: UFV FONTES SOLAR I e II | C395: 18.303.676/0002-09 | D395: 8.8599999999999994 | E395: 0 | F395: 0 | G395: 0 | H395: 0 | I395: 0 | J395: 0 | K395: 9.7599999999999998 | L395: 0 | M395: =SUM(J395:L395)-0.9 -> 8.8599999999999994 | N395: 0.90000000000000002 | O395: =SUM(M395:N395) -> 9.7599999999999998
A396: 3424 | B396: EOL ASSURUÁ II | C396: 19.246.799/0002-00 | D396: 78.599999999999994 | E396: 0 | F396: 0 | G396: 0 | H396: 0 | I396: 0 | J396: 0 | K396: 86.609999999999999 | L396: 0 | M396: =SUM(J396:L396)-8.01 -> 78.599999999999994 | N396: 8.0099999999999998 | O396: =SUM(M396:N396) -> 86.609999999999999
A397: 3425 | B397: EOL ASSURUÁ V | C397: 19.246.831/0002-57 | D397: 53.049999999999997 | E397: 0 | F397: 0 | G397: 0 | H397: 0 | I397: 0 | J397: 0 | K397: 58.460000000000001 | L397: 0 | M397: =SUM(J397:L397)-5.41 -> 53.049999999999997 | N397: 5.4100000000000001 | O397: =SUM(M397:N397) -> 58.459999999999994
A398: 3426 | B398: EOL ASSURUÁ VII | C398: 19.246.849/0002-59 | D398: 47.950000000000003 | E398: 0 | F398: 0 | G398: 0 | H398: 0 | I398: 0 | J398: 0 | K398: 52.840000000000003 | L398: 0 | M398: =SUM(J398:L398)-4.89 -> 47.950000000000003 | N398: 4.8899999999999997 | O398: =SUM(M398:N398) -> 52.840000000000003
A399: 3427 | B399: EOL CARNAÚBAS | C399: 14.535.588/0001-92 | D399: 65.579999999999998 | E399: 0 | F399: 0 | G399: 0 | H399: 0 | I399: 0 | J399: 0 | K399: 72.260000000000005 | L399: 0 | M399: =SUM(J399:L399)-6.68 -> 65.580000000000013 | N399: 6.6799999999999997 | O399: =SUM(M399:N399) -> 72.260000000000019
A400: 3428 | B400: EOL SÃO JOÃO | C400: 14.535.646/0001-88 | D400: 65.579999999999998 | E400: 0 | F400: 0 | G400: 0 | H400: 0 | I400: 0 | J400: 0 | K400: 72.260000000000005 | L400: 0 | M400: =SUM(J400:L400)-6.68 -> 65.580000000000013 | N400: 6.6799999999999997 | O400: =SUM(M400:N400) -> 72.260000000000019
A401: 3429 | B401: EOL SANTO CRISTO | C401: 14.535.540/0001-84 | D401: 64.530000000000001 | E401: 0 | F401: 0 | G401: 0 | H401: 0 | I401: 0 | J401: 0 | K401: 71.109999999999999 | L401: 0 | M401: =SUM(J401:L401)-6.58 -> 64.530000000000001 | N401: 6.5800000000000001 | O401: =SUM(M401:N401) -> 71.109999999999999
A402: 3430 | B402: EOL CAETITÉ A | C402: 19.233.858/0002-05 | D402: 41.619999999999997 | E402: 0 | F402: 0 | G402: 0 | H402: 0 | I402: 0 | J402: 0 | K402: 45.859999999999999 | L402: 0 | M402: =SUM(J402:L402)-4.24 -> 41.619999999999997 | N402: 4.2400000000000002 | O402: =SUM(M402:N402) -> 45.859999999999999
A403: 3431 | B403: EOL CAETITÉ B | C403: 19.235.607/0002-60 | D403: 38.609999999999999 | E403: 0 | F403: 0 | G403: 0 | H403: 0 | I403: 0 | J403: 0 | K403: 42.549999999999997 | L403: 0 | M403: =SUM(J403:L403)-3.94 -> 38.609999999999999 | N403: 3.9399999999999999 | O403: =SUM(M403:N403) -> 42.549999999999997
A404: 3432 | B404: EOL CAETITÉ C | C404: 19.560.109/0002-92 | D404: 14.98 | E404: 0 | F404: 0 | G404: 0 | H404: 0 | I404: 0 | J404: 0 | K404: 16.510000000000002 | L404: 0 | M404: =SUM(J404:L404)-1.53 -> 14.980000000000002 | N404: 1.53 | O404: =SUM(M404:N404) -> 16.510000000000002
A405: 3433 | B405: EOL VENTOS DA ANDORINHA | C405: 17.613.512/0002-07 | D405: 78.140000000000001 | E405: 0 | F405: 0 | G405: 0 | H405: 0 | I405: 0 | J405: 0 | K405: 86.099999999999994 | L405: 0 | M405: =SUM(J405:L405)-7.96 -> 78.140000000000001 | N405: 7.96 | O405: =SUM(M405:N405) -> 86.099999999999994
A406: 3434 | B406: EOL VENTOS DE CAMPO FORMOSO I | C406: 17.613.280/0002-97 | D406: 78.140000000000001 | E406: 0 | F406: 0 | G406: 0 | H406: 0 | I406: 0 | J406: 0 | K406: 86.099999999999994 | L406: 0 | M406: =SUM(J406:L406)-7.96 -> 78.140000000000001 | N406: 7.96 | O406: =SUM(M406:N406) -> 86.099999999999994
A407: 3435 | B407: EOL VENTOS DE CAMPO FORMOSO II | C407: 17.613.629/0002-90 | D407: 78.140000000000001 | E407: 0 | F407: 0 | G407: 0 | H407: 0 | I407: 0 | J407: 0 | K407: 86.099999999999994 | L407: 0 | M407: =SUM(J407:L407)-7.96 -> 78.140000000000001 | N407: 7.96 | O407: =SUM(M407:N407) -> 86.099999999999994
A408: 3436 | B408: EOL VENTOS DE MORRINHOS | C408: 17.613.286/0002-64 | D408: 78.140000000000001 | E408: 0 | F408: 0 | G408: 0 | H408: 0 | I408: 0 | J408: 0 | K408: 86.099999999999994 | L408: 0 | M408: =SUM(J408:L408)-7.96 -> 78.140000000000001 | N408: 7.96 | O408: =SUM(M408:N408) -> 86.099999999999994
A409: 3437 | B409: EOL VERACE 24 | C409: 42.873.310/0003-22 | D409: 42.259999999999998 | E409: 0 | F409: 0 | G409: 0 | H409: 0 | I409: 0 | J409: 0 | K409: 46.57 | L409: 0 | M409: =SUM(J409:L409)-4.31 -> 42.259999999999998 | N409: 4.3099999999999996 | O409: =SUM(M409:N409) -> 46.57
A410: 3438 | B410: EOL VERACE 25 | C410: 42.873.310/0003-22 | D410: 15.33 | E410: 0 | F410: 0 | G410: 0 | H410: 0 | I410: 0 | J410: 0 | K410: 16.890000000000001 | L410: 0 | M410: =SUM(J410:L410)-1.56 -> 15.33 | N410: 1.5600000000000001 | O410: =SUM(M410:N410) -> 16.890000000000001
A411: 3439 | B411: EOL VERACE 26 | C411: 42.873.310/0003-22 | D411: 30.710000000000001 | E411: 0 | F411: 0 | G411: 0 | H411: 0 | I411: 0 | J411: 0 | K411: 33.840000000000003 | L411: 0 | M411: =SUM(J411:L411)-3.13 -> 30.710000000000004 | N411: 3.1299999999999999 | O411: =SUM(M411:N411) -> 33.840000000000003
A412: 3440 | B412: EOL VERACE 27 | C412: 42.873.310/0003-22 | D412: 34.549999999999997 | E412: 0 | F412: 0 | G412: 0 | H412: 0 | I412: 0 | J412: 0 | K412: 38.07 | L412: 0 | M412: =SUM(J412:L412)-3.52 -> 34.549999999999997 | N412: 3.52 | O412: =SUM(M412:N412) -> 38.07
A413: 3441 | B413: EOL VERACE 28 | C413: 42.873.310/0003-22 | D413: 26.879999999999999 | E413: 0 | F413: 0 | G413: 0 | H413: 0 | I413: 0 | J413: 0 | K413: 29.620000000000001 | L413: 0 | M413: =SUM(J413:L413)-2.74 -> 26.880000000000003 | N413: 2.7400000000000002 | O413: =SUM(M413:N413) -> 29.620000000000005
A414: 3442 | B414: EOL VERACE 29 | C414: 42.873.310/0003-22 | D414: 38.420000000000002 | E414: 0 | F414: 0 | G414: 0 | H414: 0 | I414: 0 | J414: 0 | K414: 42.340000000000003 | L414: 0 | M414: =SUM(J414:L414)-3.92 -> 38.420000000000002 | N414: 3.9199999999999999 | O414: =SUM(M414:N414) -> 42.340000000000003
A415: 3443 | B415: EOL VERACE 30 | C415: 42.873.310/0003-22 | D415: 38.420000000000002 | E415: 0 | F415: 0 | G415: 0 | H415: 0 | I415: 0 | J415: 0 | K415: 42.340000000000003 | L415: 0 | M415: =SUM(J415:L415)-3.92 -> 38.420000000000002 | N415: 3.9199999999999999 | O415: =SUM(M415:N415) -> 42.340000000000003
A416: 3444 | B416: EOL VERACE 31 | C416: 42.873.310/0003-22 | D416: 19.190000000000001 | E416: 0 | F416: 0 | G416: 0 | H416: 0 | I416: 0 | J416: 0 | K416: 21.149999999999999 | L416: 0 | M416: =SUM(J416:L416)-1.96 -> 19.189999999999998 | N416: 1.96 | O416: =SUM(M416:N416) -> 21.149999999999999
A417: 3445 | B417: EOL VERACE 35 | C417: 42.873.310/0003-22 | D417: 26.879999999999999 | E417: 0 | F417: 0 | G417: 0 | H417: 0 | I417: 0 | J417: 0 | K417: 29.620000000000001 | L417: 0 | M417: =SUM(J417:L417)-2.74 -> 26.880000000000003 | N417: 2.7400000000000002 | O417: =SUM(M417:N417) -> 29.620000000000005
A418: 3446 | B418: EOL VERACE 36 | C418: 42.873.310/0003-22 | D418: 46.100000000000001 | E418: 0 | F418: 0 | G418: 0 | H418: 0 | I418: 0 | J418: 0 | K418: 50.799999999999997 | L418: 0 | M418: =SUM(J418:L418)-4.7 -> 46.099999999999994 | N418: 4.7000000000000002 | O418: =SUM(M418:N418) -> 50.799999999999997
A419: 3447 | B419: EOL CAPÃO DO INGLÊS | C419: 02.016.507/0001-69 | D419: 20.710000000000001 | E419: 0 | F419: 0 | G419: 0 | H419: 0 | I419: 0 | J419: 0 | K419: 22.82 | L419: 0 | M419: =SUM(J419:L419)-2.11 -> 20.710000000000001 | N419: 2.1099999999999999 | O419: =SUM(M419:N419) -> 22.82
A420: 3448 | B420: EOL COXILHA SECA | C420: 02.016.507/0001-69 | D420: 62.829999999999998 | E420: 0 | F420: 0 | G420: 0 | H420: 0 | I420: 0 | J420: 0 | K420: 69.230000000000004 | L420: 0 | M420: =SUM(J420:L420)-6.4 -> 62.830000000000005 | N420: 6.4000000000000004 | O420: =SUM(M420:N420) -> 69.230000000000004
A421: 3449 | B421: EOL GALPÕES | C421: 02.016.507/0001-69 | D421: 16.609999999999999 | E421: 0 | F421: 0 | G421: 0 | H421: 0 | I421: 0 | J421: 0 | K421: 18.300000000000001 | L421: 0 | M421: =SUM(J421:L421)-1.69 -> 16.609999999999999 | N421: 1.6899999999999999 | O421: =SUM(M421:N421) -> 18.300000000000001
A422: 3450 | B422: EOL VENTOS DO SERTÃO | C422: 17.613.432/0002-51 | D422: 78.140000000000001 | E422: 0 | F422: 0 | G422: 0 | H422: 0 | I422: 0 | J422: 0 | K422: 86.099999999999994 | L422: 0 | M422: =SUM(J422:L422)-7.96 -> 78.140000000000001 | N422: 7.96 | O422: =SUM(M422:N422) -> 86.099999999999994
A423: 3451 | B423: EOL VENTOS DE SANTA BRÍGIDA I | C423: 17.875.304/0001-03 | D423: 24.199999999999999 | E423: 0 | F423: 0 | G423: 0 | H423: 0 | I423: 0 | J423: 0 | K423: 26.670000000000002 | L423: 0 | M423: =SUM(J423:L423)-2.47 -> 24.200000000000003 | N423: 2.4700000000000002 | O423: =SUM(M423:N423) -> 26.670000000000002
A424: 3452 | B424: EOL VENTOS DE SANTA BRÍGIDA II | C424: 17.875.194/0001-71 | D424: 48.439999999999998 | E424: 0 | F424: 0 | G424: 0 | H424: 0 | I424: 0 | J424: 0 | K424: 53.380000000000003 | L424: 0 | M424: =SUM(J424:L424)-4.94 -> 48.440000000000005 | N424: 4.9400000000000004 | O424: =SUM(M424:N424) -> 53.380000000000003
A425: 3453 | B425: EOL VENTOS DE SANTA BRÍGIDA III | C425: 17.875.184/0001-36 | D425: 51.259999999999998 | E425: 0 | F425: 0 | G425: 0 | H425: 0 | I425: 0 | J425: 0 | K425: 56.479999999999997 | L425: 0 | M425: =SUM(J425:L425)-5.22 -> 51.259999999999998 | N425: 5.2199999999999998 | O425: =SUM(M425:N425) -> 56.479999999999997
A426: 3454 | B426: EOL VENTOS DE SANTA BRÍGIDA IV | C426: 17.875.122/0001-24 | D426: 48.439999999999998 | E426: 0 | F426: 0 | G426: 0 | H426: 0 | I426: 0 | J426: 0 | K426: 53.380000000000003 | L426: 0 | M426: =SUM(J426:L426)-4.94 -> 48.440000000000005 | N426: 4.9400000000000004 | O426: =SUM(M426:N426) -> 53.380000000000003
A427: 3455 | B427: EOL VENTOS DE SANTA BRÍGIDA V | C427: 17.875.103/0001-06 | D427: 51.259999999999998 | E427: 0 | F427: 0 | G427: 0 | H427: 0 | I427: 0 | J427: 0 | K427: 56.479999999999997 | L427: 0 | M427: =SUM(J427:L427)-5.22 -> 51.259999999999998 | N427: 5.2199999999999998 | O427: =SUM(M427:N427) -> 56.479999999999997
A428: 3456 | B428: EOL VENTOS DE SANTA BRÍGIDA VI | C428: 17.875.341/0001-03 | D428: 51.259999999999998 | E428: 0 | F428: 0 | G428: 0 | H428: 0 | I428: 0 | J428: 0 | K428: 56.479999999999997 | L428: 0 | M428: =SUM(J428:L428)-5.22 -> 51.259999999999998 | N428: 5.2199999999999998 | O428: =SUM(M428:N428) -> 56.479999999999997
A429: 3457 | B429: EOL VENTOS DE SANTA BRÍGIDA VII | C429: 17.875.270/0001-49 | D429: 48.439999999999998 | E429: 0 | F429: 0 | G429: 0 | H429: 0 | I429: 0 | J429: 0 | K429: 53.380000000000003 | L429: 0 | M429: =SUM(J429:L429)-4.94 -> 48.440000000000005 | N429: 4.9400000000000004 | O429: =SUM(M429:N429) -> 53.380000000000003
A430: 3458 | B430: EOL ESPERANÇA | C430: 19.011.517/0002-95 | D430: 96.480000000000004 | E430: 0 | F430: 0 | G430: 0 | H430: 0 | I430: 0 | J430: 0 | K430: 106.31 | L430: 0 | M430: =SUM(J430:L430)-9.83 -> 96.480000000000004 | N430: 9.8300000000000001 | O430: =SUM(M430:N430) -> 106.31
A431: 3459 | B431: EOL MANIÇOBA | C431: 19.011.479/0002-70 | D431: 103.22 | E431: 0 | F431: 0 | G431: 0 | H431: 0 | I431: 0 | J431: 0 | K431: 113.73999999999999 | L431: 0 | M431: =SUM(J431:L431)-10.52 -> 103.22 | N431: 10.52 | O431: =SUM(M431:N431) -> 113.73999999999999
A432: 3460 | B432: EOL DAMASCENA | C432: 19.046.080/0002-25 | D432: 103.22 | E432: 0 | F432: 0 | G432: 0 | H432: 0 | I432: 0 | J432: 0 | K432: 113.73999999999999 | L432: 0 | M432: =SUM(J432:L432)-10.52 -> 103.22 | N432: 10.52 | O432: =SUM(M432:N432) -> 113.73999999999999
A433: 3461 | B433: EOL VENTOS DE SANTA JOANA I | C433: 19.724.929/0002-72 | D433: 51.079999999999998 | E433: 0 | F433: 0 | G433: 0 | H433: 0 | I433: 0 | J433: 0 | K433: 56.289999999999999 | L433: 0 | M433: =SUM(J433:L433)-5.21 -> 51.079999999999998 | N433: 5.21 | O433: =SUM(M433:N433) -> 56.289999999999999
A434: 3462 | B434: EOL VENTOS DE SANTA JOANA IV | C434: 19.725.614/0002-40 | D434: 48.079999999999998 | E434: 0 | F434: 0 | G434: 0 | H434: 0 | I434: 0 | J434: 0 | K434: 52.979999999999997 | L434: 0 | M434: =SUM(J434:L434)-4.9 -> 48.079999999999998 | N434: 4.9000000000000004 | O434: =SUM(M434:N434) -> 52.979999999999997
A435: 3463 | B435: EOL VENTOS DE SANTA JOANA V | C435: 19.725.631/0002-87 | D435: 51.079999999999998 | E435: 0 | F435: 0 | G435: 0 | H435: 0 | I435: 0 | J435: 0 | K435: 56.289999999999999 | L435: 0 | M435: =SUM(J435:L435)-5.21 -> 51.079999999999998 | N435: 5.21 | O435: =SUM(M435:N435) -> 56.289999999999999
A436: 3464 | B436: EOL VENTOS DE SANTA JOANA VII | C436: 19.725.315/0002-05 | D436: 51.079999999999998 | E436: 0 | F436: 0 | G436: 0 | H436: 0 | I436: 0 | J436: 0 | K436: 56.289999999999999 | L436: 0 | M436: =SUM(J436:L436)-5.21 -> 51.079999999999998 | N436: 5.21 | O436: =SUM(M436:N436) -> 56.289999999999999
A437: 3465 | B437: EOL VENTOS DE SANTO AUGUSTO III | C437: 17.875.483/0002-51 | D437: 52.32 | E437: 0 | F437: 0 | G437: 0 | H437: 0 | I437: 0 | J437: 0 | K437: 57.649999999999999 | L437: 0 | M437: =SUM(J437:L437)-5.33 -> 52.32 | N437: 5.3300000000000001 | O437: =SUM(M437:N437) -> 57.649999999999999
A438: 3466 | B438: EOL VENTOS DE SANTO AUGUSTO IV | C438: 19.781.992/0002-40 | D438: 51.079999999999998 | E438: 0 | F438: 0 | G438: 0 | H438: 0 | I438: 0 | J438: 0 | K438: 56.289999999999999 | L438: 0 | M438: =SUM(J438:L438)-5.21 -> 51.079999999999998 | N438: 5.21 | O438: =SUM(M438:N438) -> 56.289999999999999
A439: 3467 | B439: EOL VENTOS DE SANTO AUGUSTO V | C439: 17.875.427/0002-17 | D439: 52.32 | E439: 0 | F439: 0 | G439: 0 | H439: 0 | I439: 0 | J439: 0 | K439: 57.649999999999999 | L439: 0 | M439: =SUM(J439:L439)-5.33 -> 52.32 | N439: 5.3300000000000001 | O439: =SUM(M439:N439) -> 57.649999999999999
A440: 3468 | B440: EOL SERRA DAS VACAS I | C440: 18.127.269/0001-07 | D440: 39.82 | E440: 0 | F440: 0 | G440: 0 | H440: 0 | I440: 0 | J440: 0 | K440: 43.880000000000003 | L440: 0 | M440: =SUM(J440:L440)-4.06 -> 39.82 | N440: 4.0599999999999996 | O440: =SUM(M440:N440) -> 43.880000000000003
A441: 3469 | B441: EOL SERRA DAS VACAS II | C441: 19.224.741/0001-84 | D441: 37.460000000000001 | E441: 0 | F441: 0 | G441: 0 | H441: 0 | I441: 0 | J441: 0 | K441: 41.280000000000001 | L441: 0 | M441: =SUM(J441:L441)-3.82 -> 37.460000000000001 | N441: 3.8199999999999998 | O441: =SUM(M441:N441) -> 41.280000000000001
A442: 3470 | B442: EOL SERRA DAS VACAS IV | C442: 19.694.146/0001-02 | D442: 38.289999999999999 | E442: 0 | F442: 0 | G442: 0 | H442: 0 | I442: 0 | J442: 0 | K442: 42.189999999999998 | L442: 0 | M442: =SUM(J442:L442)-3.9 -> 38.289999999999999 | N442: 3.8999999999999999 | O442: =SUM(M442:N442) -> 42.189999999999998
A443: 3471 | B443: EOL VERACE 34 | C443: 42.873.310/0003-22 | D443: 30.710000000000001 | E443: 0 | F443: 0 | G443: 0 | H443: 0 | I443: 0 | J443: 0 | K443: 33.840000000000003 | L443: 0 | M443: =SUM(J443:L443)-3.13 -> 30.710000000000004 | N443: 3.1299999999999999 | O443: =SUM(M443:N443) -> 33.840000000000003
A444: 3472 | B444: EOL CAIÇARA I | C444: 15.313.271/0001-74 | D444: 55.729999999999997 | E444: 0 | F444: 0 | G444: 0 | H444: 0 | I444: 0 | J444: 0 | K444: 61.409999999999997 | L444: 0 | M444: =SUM(J444:L444)-5.68 -> 55.729999999999997 | N444: 5.6799999999999997 | O444: =SUM(M444:N444) -> 61.409999999999997
A445: 3473 | B445: EOL CAIÇARA II | C445: 15.313.113/0001-14 | D445: 37.170000000000002 | E445: 0 | F445: 0 | G445: 0 | H445: 0 | I445: 0 | J445: 0 | K445: 40.960000000000001 | L445: 0 | M445: =SUM(J445:L445)-3.79 -> 37.170000000000002 | N445: 3.79 | O445: =SUM(M445:N445) -> 40.960000000000001
A446: 3474 | B446: EOL JUNCO I | C446: 15.313.226/0001-10 | D446: 49.659999999999997 | E446: 0 | F446: 0 | G446: 0 | H446: 0 | I446: 0 | J446: 0 | K446: 54.719999999999999 | L446: 0 | M446: =SUM(J446:L446)-5.06 -> 49.659999999999997 | N446: 5.0599999999999996 | O446: =SUM(M446:N446) -> 54.719999999999999
A447: 3475 | B447: EOL JUNCO II | C447: 15.313.187/0001-50 | D447: 49.549999999999997 | E447: 0 | F447: 0 | G447: 0 | H447: 0 | I447: 0 | J447: 0 | K447: 54.600000000000001 | L447: 0 | M447: =SUM(J447:L447)-5.05 -> 49.550000000000004 | N447: 5.0499999999999998 | O447: =SUM(M447:N447) -> 54.600000000000001
A448: 3476 | B448: EOL SERRA DAS VACAS III | C448: 19.694.110/0001-29 | D448: 40.630000000000003 | E448: 0 | F448: 0 | G448: 0 | H448: 0 | I448: 0 | J448: 0 | K448: 44.770000000000003 | L448: 0 | M448: =SUM(J448:L448)-4.14 -> 40.630000000000003 | N448: 4.1399999999999997 | O448: =SUM(M448:N448) -> 44.770000000000003
A449: 3477 | B449: RENOVA (EOL ABIL) | C449: 18.911.031/0001-60 | D449: 42.390000000000001 | E449: 0 | F449: 0 | G449: 0 | H449: 0 | I449: 0 | J449: 0 | K449: 46.710000000000001 | L449: 0 | M449: =SUM(J449:L449)-4.32 -> 42.390000000000001 | N449: 4.3200000000000003 | O449: =SUM(M449:N449) -> 46.710000000000001
A450: 3478 | B450: EOL BORGO | C450: 12.041.341/0001-94 | D450: 49.359999999999999 | E450: 0 | F450: 0 | G450: 0 | H450: 0 | I450: 0 | J450: 0 | K450: 54.390000000000001 | L450: 0 | M450: =SUM(J450:L450)-5.03 -> 49.359999999999999 | N450: 5.0300000000000002 | O450: =SUM(M450:N450) -> 54.390000000000001
A451: 3479 | B451: EOL CAETITÉ | C451: 11.201.767/0001-03 | D451: 73.459999999999994 | E451: 0 | F451: 0 | G451: 0 | H451: 0 | I451: 0 | J451: 0 | K451: 80.950000000000003 | L451: 0 | M451: =SUM(J451:L451)-7.49 -> 73.460000000000008 | N451: 7.4900000000000002 | O451: =SUM(M451:N451) -> 80.950000000000003
A452: 3480 | B452: EOL ESPIGÃO | C452: 11.197.321/0001-44 | D452: 24.68 | E452: 0 | F452: 0 | G452: 0 | H452: 0 | I452: 0 | J452: 0 | K452: 27.199999999999999 | L452: 0 | M452: =SUM(J452:L452)-2.52 -> 24.68 | N452: 2.52 | O452: =SUM(M452:N452) -> 27.199999999999999
A453: 3481 | B453: RENOVA (EOL FOLHA DE SERRA) | C453: 18.910.740/0001-20 | D453: 38.799999999999997 | E453: 0 | F453: 0 | G453: 0 | H453: 0 | I453: 0 | J453: 0 | K453: 42.75 | L453: 0 | M453: =SUM(J453:L453)-3.95 -> 38.799999999999997 | N453: 3.9500000000000002 | O453: =SUM(M453:N453) -> 42.75
A454: 3482 | B454: RENOVA (EOL JABUTICABA) | C454: 18.870.194/0001-41 | D454: 16.059999999999999 | E454: 0 | F454: 0 | G454: 0 | H454: 0 | I454: 0 | J454: 0 | K454: 17.699999999999999 | L454: 0 | M454: =SUM(J454:L454)-1.64 -> 16.059999999999999 | N454: 1.6399999999999999 | O454: =SUM(M454:N454) -> 17.699999999999999
A455: 3483 | B455: RENOVA (EOL J. DO CERRADO) | C455: 18.870.265/0001-06 | D455: 37.57 | E455: 0 | F455: 0 | G455: 0 | H455: 0 | I455: 0 | J455: 0 | K455: 41.399999999999999 | L455: 0 | M455: =SUM(J455:L455)-3.83 -> 37.57 | N455: 3.8300000000000001 | O455: =SUM(M455:N455) -> 41.399999999999999
A456: 3484 | B456: EOL PELOURINHO | C456: 12.048.031/0001-00 | D456: 53.479999999999997 | E456: 0 | F456: 0 | G456: 0 | H456: 0 | I456: 0 | J456: 0 | K456: 58.93 | L456: 0 | M456: =SUM(J456:L456)-5.45 -> 53.479999999999997 | N456: 5.4500000000000002 | O456: =SUM(M456:N456) -> 58.93
A457: 3485 | B457: EOL S. DO ESPINHAÇO | C457: 12.049.958/0001-56 | D457: 45.25 | E457: 0 | F457: 0 | G457: 0 | H457: 0 | I457: 0 | J457: 0 | K457: 49.859999999999999 | L457: 0 | M457: =SUM(J457:L457)-4.61 -> 45.25 | N457: 4.6100000000000003 | O457: =SUM(M457:N457) -> 49.859999999999999
A458: 3486 | B458: RENOVA (EOL TÁBUA) | C458: 18.870.007/0001-20 | D458: 26.859999999999999 | E458: 0 | F458: 0 | G458: 0 | H458: 0 | I458: 0 | J458: 0 | K458: 29.600000000000001 | L458: 0 | M458: =SUM(J458:L458)-2.74 -> 26.859999999999999 | N458: 2.7400000000000002 | O458: =SUM(M458:N458) -> 29.600000000000001
A459: 3487 | B459: RENOVA (EOL VAQUETA) | C459: 18.684.356/0001-57 | D459: 41.859999999999999 | E459: 0 | F459: 0 | G459: 0 | H459: 0 | I459: 0 | J459: 0 | K459: 46.130000000000003 | L459: 0 | M459: =SUM(J459:L459)-4.27 -> 41.859999999999999 | N459: 4.2699999999999996 | O459: =SUM(M459:N459) -> 46.129999999999995
A460: 3488 | B460: EOL ANGICAL | C460: 14.570.783/0002-34 | D460: 31.390000000000001 | E460: 0 | F460: 0 | G460: 0 | H460: 0 | I460: 0 | J460: 0 | K460: 34.590000000000003 | L460: 0 | M460: =SUM(J460:L460)-3.2 -> 31.390000000000004 | N460: 3.2000000000000002 | O460: =SUM(M460:N460) -> 34.590000000000003
A461: 3489 | B461: EOL CAITITU | C461: 14.570.861/0002-09 | D461: 53.82 | E461: 0 | F461: 0 | G461: 0 | H461: 0 | I461: 0 | J461: 0 | K461: 59.310000000000002 | L461: 0 | M461: =SUM(J461:L461)-5.49 -> 53.82 | N461: 5.4900000000000002 | O461: =SUM(M461:N461) -> 59.310000000000002
A462: 3490 | B462: EOL COQUEIRINHO | C462: 14.570.819/0002-80 | D462: 71.739999999999995 | E462: 0 | F462: 0 | G462: 0 | H462: 0 | I462: 0 | J462: 0 | K462: 79.049999999999997 | L462: 0 | M462: =SUM(J462:L462)-7.31 -> 71.739999999999995 | N462: 7.3099999999999996 | O462: =SUM(M462:N462) -> 79.049999999999997
A463: 3491 | B463: EOL CORRUPIÃO | C463: 14.570.800/0002-33 | D463: 67.260000000000005 | E463: 0 | F463: 0 | G463: 0 | H463: 0 | I463: 0 | J463: 0 | K463: 74.120000000000005 | L463: 0 | M463: =SUM(J463:L463)-6.86 -> 67.260000000000005 | N463: 6.8600000000000003 | O463: =SUM(M463:N463) -> 74.120000000000005
A464: 3492 | B464: EOL INHAMBU | C464: 14.572.367/0002-75 | D464: 73.459999999999994 | E464: 0 | F464: 0 | G464: 0 | H464: 0 | I464: 0 | J464: 0 | K464: 80.950000000000003 | L464: 0 | M464: =SUM(J464:L464)-7.49 -> 73.460000000000008 | N464: 7.4900000000000002 | O464: =SUM(M464:N464) -> 80.950000000000003
A465: 3493 | B465: EOL TAMANDUÁ MIRIM | C465: 14.571.068/0002-16 | D465: 71.739999999999995 | E465: 0 | F465: 0 | G465: 0 | H465: 0 | I465: 0 | J465: 0 | K465: 79.049999999999997 | L465: 0 | M465: =SUM(J465:L465)-7.31 -> 71.739999999999995 | N465: 7.3099999999999996 | O465: =SUM(M465:N465) -> 79.049999999999997
A466: 3494 | B466: EOL TEIU | C466: 14.570.839/0002-50 | D466: 40.350000000000001 | E466: 0 | F466: 0 | G466: 0 | H466: 0 | I466: 0 | J466: 0 | K466: 44.460000000000001 | L466: 0 | M466: =SUM(J466:L466)-4.11 -> 40.350000000000001 | N466: 4.1100000000000003 | O466: =SUM(M466:N466) -> 44.460000000000001
A467: 3495 | B467: EOL VENTOS DE SANTA JOANA III | C467: 19.725.354/0002-02 | D467: 52.32 | E467: 0 | F467: 0 | G467: 0 | H467: 0 | I467: 0 | J467: 0 | K467: 57.649999999999999 | L467: 0 | M467: =SUM(J467:L467)-5.33 -> 52.32 | N467: 5.3300000000000001 | O467: =SUM(M467:N467) -> 57.649999999999999
A468: 3496 | B468: EDP (UHE CACHOEIRA CALDEIRÃO) | C468: 17.200.920/0001-56 | D468: 806.10000000000002 | E468: 0 | F468: 0 | G468: 0 | H468: 0 | I468: 0 | J468: 0 | K468: 888.25999999999999 | L468: 0 | M468: =SUM(J468:L468)-82.16 -> 806.10000000000002 | N468: 82.159999999999997 | O468: =SUM(M468:N468) -> 888.25999999999999
A469: 3497 | B469: EOL ITAREMA II | C469: 19.560.074/0002-91 | D469: 52.780000000000001 | E469: 0 | F469: 0 | G469: 0 | H469: 0 | I469: 0 | J469: 0 | K469: 58.159999999999997 | L469: 0 | M469: =SUM(J469:L469)-5.38 -> 52.779999999999994 | N469: 5.3799999999999999 | O469: =SUM(M469:N469) -> 58.159999999999997
A470: 3498 | B470: EOL ITAREMA V | C470: 19.560.868/0002-55 | D470: 40.880000000000003 | E470: 0 | F470: 0 | G470: 0 | H470: 0 | I470: 0 | J470: 0 | K470: 45.049999999999997 | L470: 0 | M470: =SUM(J470:L470)-4.17 -> 40.879999999999995 | N470: 4.1699999999999999 | O470: =SUM(M470:N470) -> 45.049999999999997
A471: 3499 | B471: EOL S. DE SANTANA I | C471: 12.848.401/0001-85 | D471: 45.93 | E471: 0 | F471: 0 | G471: 0 | H471: 0 | I471: 0 | J471: 0 | K471: 50.609999999999999 | L471: 0 | M471: =SUM(J471:L471)-4.68 -> 45.93 | N471: 4.6799999999999997 | O471: =SUM(M471:N471) -> 50.609999999999999
A472: 3500 | B472: EOL S. DE SANTANA II | C472: 12.851.098/0001-70 | D472: 67.159999999999997 | E472: 0 | F472: 0 | G472: 0 | H472: 0 | I472: 0 | J472: 0 | K472: 74.010000000000005 | L472: 0 | M472: =SUM(J472:L472)-6.85 -> 67.160000000000011 | N472: 6.8499999999999996 | O472: =SUM(M472:N472) -> 74.010000000000005
A473: 3501 | B473: EOL S. DE SANTANA III | C473: 12.848.783/0001-47 | D473: 68.769999999999996 | E473: 0 | F473: 0 | G473: 0 | H473: 0 | I473: 0 | J473: 0 | K473: 75.780000000000001 | L473: 0 | M473: =SUM(J473:L473)-7.01 -> 68.769999999999996 | N473: 7.0099999999999998 | O473: =SUM(M473:N473) -> 75.780000000000001
A474: 3502 | B474: EOL ITAREMA I | C474: 19.560.032/0002-50 | D474: 52.75 | E474: 0 | F474: 0 | G474: 0 | H474: 0 | I474: 0 | J474: 0 | K474: 58.130000000000003 | L474: 0 | M474: =SUM(J474:L474)-5.38 -> 52.75 | N474: 5.3799999999999999 | O474: =SUM(M474:N474) -> 58.130000000000003
A475: 3503 | B475: EOL ITAREMA III | C475: 19.560.839/0002-93 | D475: 29.059999999999999 | E475: 0 | F475: 0 | G475: 0 | H475: 0 | I475: 0 | J475: 0 | K475: 32.020000000000003 | L475: 0 | M475: =SUM(J475:L475)-2.96 -> 29.060000000000002 | N475: 2.96 | O475: =SUM(M475:N475) -> 32.020000000000003
A476: 3504 | B476: EOL BARAÚNAS II | C476: 19.905.679/0002-77 | D476: 51.57 | E476: 0 | F476: 0 | G476: 0 | H476: 0 | I476: 0 | J476: 0 | K476: 56.829999999999998 | L476: 0 | M476: =SUM(J476:L476)-5.26 -> 51.57 | N476: 5.2599999999999998 | O476: =SUM(M476:N476) -> 56.829999999999998
A477: 3505 | B477: EOL BANDA DE COURO | C477: 19.905.727/0002-27 | D477: 60.560000000000002 | E477: 0 | F477: 0 | G477: 0 | H477: 0 | I477: 0 | J477: 0 | K477: 66.730000000000004 | L477: 0 | M477: =SUM(J477:L477)-6.17 -> 60.560000000000002 | N477: 6.1699999999999999 | O477: =SUM(M477:N477) -> 66.730000000000004
A478: 3507 | B478: EOL CACIMBAS I | C478: 13.389.543/0002-75 | D478: 30.09 | E478: 0 | F478: 0 | G478: 0 | H478: 0 | I478: 0 | J478: 0 | K478: 33.159999999999997 | L478: 0 | M478: =SUM(J478:L478)-3.07 -> 30.089999999999996 | N478: 3.0699999999999998 | O478: =SUM(M478:N478) -> 33.159999999999997
A479: 3508 | B479: UTE KLABIN CELULOSE | C479: 89.637.490/0165-72 | D479: 352.23000000000002 | E479: 0 | F479: 0 | G479: 0 | H479: 0 | I479: 0 | J479: 0 | K479: 388.13 | L479: 0 | M479: =SUM(J479:L479)-35.9 -> 352.23000000000002 | N479: 35.899999999999999 | O479: =SUM(M479:N479) -> 388.13
A480: 3509 | B480: EOL BAIXA DO FEIJÃO I | C480: 14.496.492/0002-43 | D480: 62.829999999999998 | E480: 0 | F480: 0 | G480: 0 | H480: 0 | I480: 0 | J480: 0 | K480: 69.230000000000004 | L480: 0 | M480: =SUM(J480:L480)-6.4 -> 62.830000000000005 | N480: 6.4000000000000004 | O480: =SUM(M480:N480) -> 69.230000000000004
A481: 3510 | B481: EOL BAIXA DO FEIJÃO II | C481: 14.496.545/0002-26 | D481: 62.619999999999997 | E481: 0 | F481: 0 | G481: 0 | H481: 0 | I481: 0 | J481: 0 | K481: 69 | L481: 0 | M481: =SUM(J481:L481)-6.38 -> 62.619999999999997 | N481: 6.3799999999999999 | O481: =SUM(M481:N481) -> 69
A482: 3511 | B482: EOL BAIXA DO FEIJÃO III | C482: 14.496.290/0002-00 | D482: 62.960000000000001 | E482: 0 | F482: 0 | G482: 0 | H482: 0 | I482: 0 | J482: 0 | K482: 69.379999999999995 | L482: 0 | M482: =SUM(J482:L482)-6.42 -> 62.959999999999994 | N482: 6.4199999999999999 | O482: =SUM(M482:N482) -> 69.379999999999995
A483: 3512 | B483: EOL BAIXA DO FEIJÃO IV | C483: 14.496.317/0002-56 | D483: 63.329999999999998 | E483: 0 | F483: 0 | G483: 0 | H483: 0 | I483: 0 | J483: 0 | K483: 69.790000000000006 | L483: 0 | M483: =SUM(J483:L483)-6.46 -> 63.330000000000005 | N483: 6.46 | O483: =SUM(M483:N483) -> 69.790000000000006
A484: 3513 | B484: EOL VENTOS DOS GUARÁS I | C484: 13.344.343/0002-04 | D484: 84.609999999999999 | E484: 0 | F484: 0 | G484: 0 | H484: 0 | I484: 0 | J484: 0 | K484: 93.230000000000004 | L484: 0 | M484: =SUM(J484:L484)-8.62 -> 84.609999999999999 | N484: 8.6199999999999992 | O484: =SUM(M484:N484) -> 93.230000000000004
A485: 3514 | B485: CPFL (EOL CAMPO DOS VENTOS I) | C485: 10.797.890/0001-68 | D485: 44.259999999999998 | E485: 0 | F485: 0 | G485: 0 | H485: 0 | I485: 0 | J485: 0 | K485: 48.770000000000003 | L485: 0 | M485: =SUM(J485:L485)-4.51 -> 44.260000000000005 | N485: 4.5099999999999998 | O485: =SUM(M485:N485) -> 48.770000000000003
A486: 3515 | B486: CPFL (EOL CAMPO DOS VENTOS III) | C486: 10.797.891/0001-02 | D486: 44.18 | E486: 0 | F486: 0 | G486: 0 | H486: 0 | I486: 0 | J486: 0 | K486: 48.68 | L486: 0 | M486: =SUM(J486:L486)-4.5 -> 44.18 | N486: 4.5 | O486: =SUM(M486:N486) -> 48.68
A487: 3516 | B487: CPFL (EOL CAMPO DOS VENTOS V) | C487: 10.797.888/0001-99 | D487: 44.100000000000001 | E487: 0 | F487: 0 | G487: 0 | H487: 0 | I487: 0 | J487: 0 | K487: 48.600000000000001 | L487: 0 | M487: =SUM(J487:L487)-4.5 -> 44.100000000000001 | N487: 4.5 | O487: =SUM(M487:N487) -> 48.600000000000001
A488: 3517 | B488: EOL VENTOS DE SÃO CLEMENTE 1 | C488: 21.014.004/0002-80 | D488: 68.090000000000003 | E488: 0 | F488: 0 | G488: 0 | H488: 0 | I488: 0 | J488: 0 | K488: 75.030000000000001 | L488: 0 | M488: =SUM(J488:L488)-6.94 -> 68.090000000000003 | N488: 6.9400000000000004 | O488: =SUM(M488:N488) -> 75.030000000000001
A489: 3518 | B489: EOL VENTOS DE SÃO CLEMENTE 2 | C489: 21.014.134/0002-12 | D489: 68.090000000000003 | E489: 0 | F489: 0 | G489: 0 | H489: 0 | I489: 0 | J489: 0 | K489: 75.030000000000001 | L489: 0 | M489: =SUM(J489:L489)-6.94 -> 68.090000000000003 | N489: 6.9400000000000004 | O489: =SUM(M489:N489) -> 75.030000000000001
A490: 3519 | B490: EOL VENTOS DE SÃO CLEMENTE 3 | C490: 21.014.090/0002-20 | D490: 68.090000000000003 | E490: 0 | F490: 0 | G490: 0 | H490: 0 | I490: 0 | J490: 0 | K490: 75.030000000000001 | L490: 0 | M490: =SUM(J490:L490)-6.94 -> 68.090000000000003 | N490: 6.9400000000000004 | O490: =SUM(M490:N490) -> 75.030000000000001
A491: 3520 | B491: EOL VENTOS DE SÃO CLEMENTE 4 | C491: 21.013.854/0002-63 | D491: 68.090000000000003 | E491: 0 | F491: 0 | G491: 0 | H491: 0 | I491: 0 | J491: 0 | K491: 75.030000000000001 | L491: 0 | M491: =SUM(J491:L491)-6.94 -> 68.090000000000003 | N491: 6.9400000000000004 | O491: =SUM(M491:N491) -> 75.030000000000001
A492: 3521 | B492: EOL VENTOS DE SÃO CLEMENTE 5 | C492: 21.013.993/0002-97 | D492: 68.090000000000003 | E492: 0 | F492: 0 | G492: 0 | H492: 0 | I492: 0 | J492: 0 | K492: 75.030000000000001 | L492: 0 | M492: =SUM(J492:L492)-6.94 -> 68.090000000000003 | N492: 6.9400000000000004 | O492: =SUM(M492:N492) -> 75.030000000000001
A493: 3522 | B493: EOL VENTOS DE SÃO CLEMENTE 6 | C493: 21.013.968/0002-03 | D493: 60.359999999999999 | E493: 0 | F493: 0 | G493: 0 | H493: 0 | I493: 0 | J493: 0 | K493: 66.510000000000005 | L493: 0 | M493: =SUM(J493:L493)-6.15 -> 60.360000000000007 | N493: 6.1500000000000004 | O493: =SUM(M493:N493) -> 66.510000000000005
A494: 3523 | B494: EOL VENTOS DE SÃO CLEMENTE 7 | C494: 21.013.833/0002-48 | D494: 56.939999999999998 | E494: 0 | F494: 0 | G494: 0 | H494: 0 | I494: 0 | J494: 0 | K494: 62.740000000000002 | L494: 0 | M494: =SUM(J494:L494)-5.8 -> 56.940000000000005 | N494: 5.7999999999999998 | O494: =SUM(M494:N494) -> 62.740000000000002
A495: 3524 | B495: EOL VENTOS DE SÃO CLEMENTE 8 | C495: 21.013.880/0002-91 | D495: 48.530000000000001 | E495: 0 | F495: 0 | G495: 0 | H495: 0 | I495: 0 | J495: 0 | K495: 53.479999999999997 | L495: 0 | M495: =SUM(J495:L495)-4.95 -> 48.529999999999994 | N495: 4.9500000000000002 | O495: =SUM(M495:N495) -> 53.479999999999997
A496: 3525 | B496: EOL VENTOS DE SANTA EDWIGES | C496: 12.960.082/0001-03 | D496: 66.019999999999996 | E496: 0 | F496: 0 | G496: 0 | H496: 0 | I496: 0 | J496: 0 | K496: 72.75 | L496: 0 | M496: =SUM(J496:L496)-6.73 -> 66.019999999999996 | N496: 6.7300000000000004 | O496: =SUM(M496:N496) -> 72.75
A497: 3526 | B497: EOL VENTOS DE SANTA FATIMA | C497: 12.960.065/0001-68 | D497: 66.239999999999995 | E497: 0 | F497: 0 | G497: 0 | H497: 0 | I497: 0 | J497: 0 | K497: 72.989999999999995 | L497: 0 | M497: =SUM(J497:L497)-6.75 -> 66.239999999999995 | N497: 6.75 | O497: =SUM(M497:N497) -> 72.989999999999995
A498: 3527 | B498: EOL VENTOS DE SANTA REGINA | C498: 12.960.071/0001-15 | D498: 65.890000000000001 | E498: 0 | F498: 0 | G498: 0 | H498: 0 | I498: 0 | J498: 0 | K498: 72.609999999999999 | L498: 0 | M498: =SUM(J498:L498)-6.72 -> 65.890000000000001 | N498: 6.7199999999999998 | O498: =SUM(M498:N498) -> 72.609999999999999
A499: 3528 | B499: EOL VENTOS DE SANTO ADRIANO | C499: 10.823.648/0001-11 | D499: 65.890000000000001 | E499: 0 | F499: 0 | G499: 0 | H499: 0 | I499: 0 | J499: 0 | K499: 72.609999999999999 | L499: 0 | M499: =SUM(J499:L499)-6.72 -> 65.890000000000001 | N499: 6.7199999999999998 | O499: =SUM(M499:N499) -> 72.609999999999999
A500: 3529 | B500: EOL VENTOS DE SANTO ALBANO | C500: 10.656.606/0001-33 | D500: 65.890000000000001 | E500: 0 | F500: 0 | G500: 0 | H500: 0 | I500: 0 | J500: 0 | K500: 72.609999999999999 | L500: 0 | M500: =SUM(J500:L500)-6.72 -> 65.890000000000001 | N500: 6.7199999999999998 | O500: =SUM(M500:N500) -> 72.609999999999999
A501: 3530 | B501: EOL ITAREMA IV | C501: 20.553.751/0002-23 | D501: 56.369999999999997 | E501: 0 | F501: 0 | G501: 0 | H501: 0 | I501: 0 | J501: 0 | K501: 62.119999999999997 | L501: 0 | M501: =SUM(J501:L501)-5.75 -> 56.369999999999997 | N501: 5.75 | O501: =SUM(M501:N501) -> 62.119999999999997
A502: 3531 | B502: EOL ITAREMA VI | C502: 20.533.879/0002-25 | D502: 64.5 | E502: 0 | F502: 0 | G502: 0 | H502: 0 | I502: 0 | J502: 0 | K502: 71.069999999999993 | L502: 0 | M502: =SUM(J502:L502)-6.57 -> 64.5 | N502: 6.5700000000000003 | O502: =SUM(M502:N502) -> 71.069999999999993
A503: 3532 | B503: EOL ITAREMA VII | C503: 20.533.473/0002-42 | D503: 56.369999999999997 | E503: 0 | F503: 0 | G503: 0 | H503: 0 | I503: 0 | J503: 0 | K503: 62.119999999999997 | L503: 0 | M503: =SUM(J503:L503)-5.75 -> 56.369999999999997 | N503: 5.75 | O503: =SUM(M503:N503) -> 62.119999999999997
A504: 3533 | B504: EOL ESTRELA | C504: 09.265.464/0002-85 | D504: 45.609999999999999 | E504: 0 | F504: 0 | G504: 0 | H504: 0 | I504: 0 | J504: 0 | K504: 50.259999999999998 | L504: 0 | M504: =SUM(J504:L504)-4.65 -> 45.609999999999999 | N504: 4.6500000000000004 | O504: =SUM(M504:N504) -> 50.259999999999998
A505: 3534 | B505: EOL OURO VERDE | C505: 16.849.271/0002-37 | D505: 47.289999999999999 | E505: 0 | F505: 0 | G505: 0 | H505: 0 | I505: 0 | J505: 0 | K505: 52.109999999999999 | L505: 0 | M505: =SUM(J505:L505)-4.82 -> 47.289999999999999 | N505: 4.8200000000000003 | O505: =SUM(M505:N505) -> 52.109999999999999
A506: 3535 | B506: EOL SANTA MONICA I | C506: 12.445.328/0002-81 | D506: 30.09 | E506: 0 | F506: 0 | G506: 0 | H506: 0 | I506: 0 | J506: 0 | K506: 33.159999999999997 | L506: 0 | M506: =SUM(J506:L506)-3.07 -> 30.089999999999996 | N506: 3.0699999999999998 | O506: =SUM(M506:N506) -> 33.159999999999997
A507: 3536 | B507: UHE SÃO ROQUE | C507: 15.116.321/0002-04 | D507: 534.69000000000005 | E507: 0 | F507: 0 | G507: 0 | H507: 0 | I507: 0 | J507: 0 | K507: 589.19000000000005 | L507: 0 | M507: =SUM(J507:L507)-54.5 -> 534.69000000000005 | N507: 54.5 | O507: =SUM(M507:N507) -> 589.19000000000005
A508: 3537 | B508: EOL ITAREMA VIII | C508: 20.533.310/0002-60 | D508: 56.369999999999997 | E508: 0 | F508: 0 | G508: 0 | H508: 0 | I508: 0 | J508: 0 | K508: 62.119999999999997 | L508: 0 | M508: =SUM(J508:L508)-5.75 -> 56.369999999999997 | N508: 5.75 | O508: =SUM(M508:N508) -> 62.119999999999997
A509: 3538 | B509: EOL ITAREMA IX | C509: 20.533.377/0002-02 | D509: 80.790000000000006 | E509: 0 | F509: 0 | G509: 0 | H509: 0 | I509: 0 | J509: 0 | K509: 89.019999999999996 | L509: 0 | M509: =SUM(J509:L509)-8.23 -> 80.789999999999992 | N509: 8.2300000000000004 | O509: =SUM(M509:N509) -> 89.019999999999996
A510: 3539 | B510: EOL MACAMBIRA I | C510: 15.231.588/0001-61 | D510: 33.57 | E510: 0 | F510: 0 | G510: 0 | H510: 0 | I510: 0 | J510: 0 | K510: 36.990000000000002 | L510: 0 | M510: =SUM(J510:L510)-3.42 -> 33.57 | N510: 3.4199999999999999 | O510: =SUM(M510:N510) -> 36.990000000000002
A511: 3540 | B511: EOL MACAMBIRA II | C511: 15.231.448/0001-93 | D511: 31.079999999999998 | E511: 0 | F511: 0 | G511: 0 | H511: 0 | I511: 0 | J511: 0 | K511: 34.25 | L511: 0 | M511: =SUM(J511:L511)-3.17 -> 31.079999999999998 | N511: 3.1699999999999999 | O511: =SUM(M511:N511) -> 34.25
A512: 3541 | B512: RPE (RIO PARANA ENERGIA) | C512: 23.096.269/0001-19 | D512: 23695.029999999999 | E512: 0 | F512: 0 | G512: 0 | H512: 0 | I512: 0 | J512: 0 | K512: 26110.23 | L512: 0 | M512: =SUM(J512:L512)-2415.2 -> 23695.029999999999 | N512: 2415.1999999999998 | O512: =SUM(M512:N512) -> 26110.23
A513: 3542 | B513: EOL VILA AMAZONAS V | C513: 20.339.203/0001-14 | D513: 45.460000000000001 | E513: 0 | F513: 0 | G513: 0 | H513: 0 | I513: 0 | J513: 0 | K513: 50.090000000000003 | L513: 0 | M513: =SUM(J513:L513)-4.63 -> 45.460000000000001 | N513: 4.6299999999999999 | O513: =SUM(M513:N513) -> 50.090000000000003
A514: 3543 | B514: EOL VILA PARÁ I | C514: 20.318.451/0001-89 | D514: 55.490000000000002 | E514: 0 | F514: 0 | G514: 0 | H514: 0 | I514: 0 | J514: 0 | K514: 61.149999999999999 | L514: 0 | M514: =SUM(J514:L514)-5.66 -> 55.489999999999995 | N514: 5.6600000000000001 | O514: =SUM(M514:N514) -> 61.149999999999991
A515: 3544 | B515: EOL CATAVENTOS ACARAÚ I | C515: 10.902.268/0001-72 | D515: 58.560000000000002 | E515: 0 | F515: 0 | G515: 0 | H515: 0 | I515: 0 | J515: 0 | K515: 64.530000000000001 | L515: 0 | M515: =SUM(J515:L515)-5.97 -> 58.560000000000002 | N515: 5.9699999999999998 | O515: =SUM(M515:N515) -> 64.530000000000001
A516: 3545 | B516: EOL VENTOS DE SÃO BENEDITO | C516: 12.053.657/0001-04 | D516: 71.069999999999993 | E516: 0 | F516: 0 | G516: 0 | H516: 0 | I516: 0 | J516: 0 | K516: 78.310000000000002 | L516: 0 | M516: =SUM(J516:L516)-7.24 -> 71.070000000000007 | N516: 7.2400000000000002 | O516: =SUM(M516:N516) -> 78.310000000000002
A517: 3546 | B517: EOL VENTOS DE SANTA ANGELINA | C517: 10.682.436/0001-61 | D517: 65.890000000000001 | E517: 0 | F517: 0 | G517: 0 | H517: 0 | I517: 0 | J517: 0 | K517: 72.609999999999999 | L517: 0 | M517: =SUM(J517:L517)-6.72 -> 65.890000000000001 | N517: 6.7199999999999998 | O517: =SUM(M517:N517) -> 72.609999999999999
A518: 3547 | B518: EOL VENTOS DE SANTA BARBARA | C518: 12.960.046/0001-31 | D518: 65.890000000000001 | E518: 0 | F518: 0 | G518: 0 | H518: 0 | I518: 0 | J518: 0 | K518: 72.609999999999999 | L518: 0 | M518: =SUM(J518:L518)-6.72 -> 65.890000000000001 | N518: 6.7199999999999998 | O518: =SUM(M518:N518) -> 72.609999999999999
A519: 3548 | B519: EOL VILA PARÁ II | C519: 20.318.810/0001-06 | D519: 50.75 | E519: 0 | F519: 0 | G519: 0 | H519: 0 | I519: 0 | J519: 0 | K519: 55.920000000000002 | L519: 0 | M519: =SUM(J519:L519)-5.17 -> 50.75 | N519: 5.1699999999999999 | O519: =SUM(M519:N519) -> 55.920000000000002
A520: 3549 | B520: EOL VILA PARÁ III | C520: 20.318.427/0001-40 | D520: 50.560000000000002 | E520: 0 | F520: 0 | G520: 0 | H520: 0 | I520: 0 | J520: 0 | K520: 55.710000000000001 | L520: 0 | M520: =SUM(J520:L520)-5.15 -> 50.560000000000002 | N520: 5.1500000000000004 | O520: =SUM(M520:N520) -> 55.710000000000001
A521: 3550 | B521: EOL SÃO DOMINGOS | C521: 12.053.825/0001-53 | D521: 44.759999999999998 | E521: 0 | F521: 0 | G521: 0 | H521: 0 | I521: 0 | J521: 0 | K521: 49.32 | L521: 0 | M521: =SUM(J521:L521)-4.56 -> 44.759999999999998 | N521: 4.5599999999999996 | O521: =SUM(M521:N521) -> 49.32
A522: 3551 | B522: EOL AURA MANGUEIRA VII | C522: 20.593.647/0002-62 | D522: 58.890000000000001 | E522: 0 | F522: 0 | G522: 0 | H522: 0 | I522: 0 | J522: 0 | K522: 64.890000000000001 | L522: 0 | M522: =SUM(J522:L522)-6 -> 58.890000000000001 | N522: 6 | O522: =SUM(M522:N522) -> 64.890000000000001
A523: 3552 | B523: EOL AURA MIRIM II | C523: 20.586.118/0002-31 | D523: 73.629999999999995 | E523: 0 | F523: 0 | G523: 0 | H523: 0 | I523: 0 | J523: 0 | K523: 81.129999999999995 | L523: 0 | M523: =SUM(J523:L523)-7.5 -> 73.629999999999995 | N523: 7.5 | O523: =SUM(M523:N523) -> 81.129999999999995
A524: 3553 | B524: UTE CSP | C524: 09.509.535/0001-67 | D524: 252.25999999999999 | E524: 0 | F524: 0 | G524: 0 | H524: 0 | I524: 0 | J524: 0 | K524: 277.97000000000003 | L524: 0 | M524: =SUM(J524:L524)-25.71 -> 252.26000000000002 | N524: 25.710000000000001 | O524: =SUM(M524:N524) -> 277.97000000000003
A525: 3554 | B525: UFV CALDEIRÃO GRANDE V | C525: 12.960.110/0001-84 | D525: 60.710000000000001 | E525: 0 | F525: 0 | G525: 0 | H525: 0 | I525: 0 | J525: 0 | K525: 66.900000000000006 | L525: 0 | M525: =SUM(J525:L525)-6.19 -> 60.710000000000008 | N525: 6.1900000000000004 | O525: =SUM(M525:N525) -> 66.900000000000006
A526: 3555 | B526: EOL VENTO FORMOSO | C526: 12.774.042/0001-69 | D526: 53.689999999999998 | E526: 0 | F526: 0 | G526: 0 | H526: 0 | I526: 0 | J526: 0 | K526: 59.159999999999997 | L526: 0 | M526: =SUM(J526:L526)-5.47 -> 53.689999999999998 | N526: 5.4699999999999998 | O526: =SUM(M526:N526) -> 59.159999999999997
A527: 3556 | B527: EOL VENTOS DO MORRO DO CHAPÉU | C527: 12.774.017/0001-85 | D527: 53.590000000000003 | E527: 0 | F527: 0 | G527: 0 | H527: 0 | I527: 0 | J527: 0 | K527: 59.049999999999997 | L527: 0 | M527: =SUM(J527:L527)-5.46 -> 53.589999999999996 | N527: 5.46 | O527: =SUM(M527:N527) -> 59.049999999999997
A528: 3557 | B528: EOL VENTOS DO PARAZINHO | C528: 12.773.991/0001-24 | D528: 56.579999999999998 | E528: 0 | F528: 0 | G528: 0 | H528: 0 | I528: 0 | J528: 0 | K528: 62.350000000000001 | L528: 0 | M528: =SUM(J528:L528)-5.77 -> 56.579999999999998 | N528: 5.7699999999999996 | O528: =SUM(M528:N528) -> 62.349999999999994
A529: 3558 | B529: EOL VENTOS DE TIANGUÁ NORTE | C529: 12.773.953/0001-71 | D529: 56.899999999999999 | E529: 0 | F529: 0 | G529: 0 | H529: 0 | I529: 0 | J529: 0 | K529: 62.700000000000003 | L529: 0 | M529: =SUM(J529:L529)-5.8 -> 56.900000000000006 | N529: 5.7999999999999998 | O529: =SUM(M529:N529) -> 62.700000000000003
A530: 3559 | B530: EOL VENTOS DE TIANGUÁ | C530: 12.773.911/0001-30 | D530: 54.189999999999998 | E530: 0 | F530: 0 | G530: 0 | H530: 0 | I530: 0 | J530: 0 | K530: 59.710000000000001 | L530: 0 | M530: =SUM(J530:L530)-5.52 -> 54.189999999999998 | N530: 5.5199999999999996 | O530: =SUM(M530:N530) -> 59.709999999999994
A531: 3560 | B531: EOL VENTOS DE SANTO DIMAS | C531: 13.329.931/0001-80 | D531: 61.100000000000001 | E531: 0 | F531: 0 | G531: 0 | H531: 0 | I531: 0 | J531: 0 | K531: 67.329999999999998 | L531: 0 | M531: =SUM(J531:L531)-6.23 -> 61.099999999999994 | N531: 6.2300000000000004 | O531: =SUM(M531:N531) -> 67.329999999999998
A532: 3561 | B532: EOL CABEÇO PRETO III | C532: 15.231.615/0001-04 | D532: 55.039999999999999 | E532: 0 | F532: 0 | G532: 0 | H532: 0 | I532: 0 | J532: 0 | K532: 60.649999999999999 | L532: 0 | M532: =SUM(J532:L532)-5.61 -> 55.039999999999999 | N532: 5.6100000000000003 | O532: =SUM(M532:N532) -> 60.649999999999999
A533: 3562 | B533: EOL CABEÇO PRETO V | C533: 15.231.547/0001-75 | D533: 54.350000000000001 | E533: 0 | F533: 0 | G533: 0 | H533: 0 | I533: 0 | J533: 0 | K533: 59.890000000000001 | L533: 0 | M533: =SUM(J533:L533)-5.54 -> 54.350000000000001 | N533: 5.54 | O533: =SUM(M533:N533) -> 59.890000000000001
A534: 3563 | B534: EOL CABEÇO PRETO VI | C534: 15.231.479/0001-44 | D534: 37.490000000000002 | E534: 0 | F534: 0 | G534: 0 | H534: 0 | I534: 0 | J534: 0 | K534: 41.310000000000002 | L534: 0 | M534: =SUM(J534:L534)-3.82 -> 37.490000000000002 | N534: 3.8199999999999998 | O534: =SUM(M534:N534) -> 41.310000000000002
A535: 3564 | B535: COPEL (UHE GOV PARIGOT) | C535: 04.370.282/0001-70 | D535: 997.12 | E535: 0 | F535: 0 | G535: 0 | H535: 0 | I535: 0 | J535: 0 | K535: 1098.75 | L535: 0 | M535: =SUM(J535:L535)-101.63 -> 997.12 | N535: 101.63 | O535: =SUM(M535:N535) -> 1098.75
A536: 3565 | B536: EOL AURA MANGUEIRA XI | C536: 19.869.512/0002-06 | D536: 16.879999999999999 | E536: 0 | F536: 0 | G536: 0 | H536: 0 | I536: 0 | J536: 0 | K536: 18.600000000000001 | L536: 0 | M536: =SUM(J536:L536)-1.72 -> 16.880000000000003 | N536: 1.72 | O536: =SUM(M536:N536) -> 18.600000000000001
A537: 3566 | B537: EOL CALANGO 6 | C537: 19.560.837/0002-02 | D537: 72.760000000000005 | E537: 0 | F537: 0 | G537: 0 | H537: 0 | I537: 0 | J537: 0 | K537: 80.180000000000007 | L537: 0 | M537: =SUM(J537:L537)-7.42 -> 72.760000000000005 | N537: 7.4199999999999999 | O537: =SUM(M537:N537) -> 80.180000000000007
A538: 3567 | B538: EOL SANTANA I | C538: 19.560.874/0002-02 | D538: 72.709999999999994 | E538: 0 | F538: 0 | G538: 0 | H538: 0 | I538: 0 | J538: 0 | K538: 80.120000000000005 | L538: 0 | M538: =SUM(J538:L538)-7.41 -> 72.710000000000008 | N538: 7.4100000000000001 | O538: =SUM(M538:N538) -> 80.120000000000005
A539: 3568 | B539: EOL SANTANA II | C539: 19.588.049/0002-16 | D539: 58.130000000000003 | E539: 0 | F539: 0 | G539: 0 | H539: 0 | I539: 0 | J539: 0 | K539: 64.060000000000002 | L539: 0 | M539: =SUM(J539:L539)-5.93 -> 58.130000000000003 | N539: 5.9299999999999997 | O539: =SUM(M539:N539) -> 64.060000000000002
A540: 3569 | B540: EOL SANTA MÔNICA | C540: 12.053.687/0001-02 | D540: 51.310000000000002 | E540: 0 | F540: 0 | G540: 0 | H540: 0 | I540: 0 | J540: 0 | K540: 56.539999999999999 | L540: 0 | M540: =SUM(J540:L540)-5.23 -> 51.310000000000002 | N540: 5.2300000000000004 | O540: =SUM(M540:N540) -> 56.540000000000006
A541: 3570 | B541: EOL VENTOS DE SÃO MARTINHO | C541: 13.330.011/0001-81 | D541: 25.91 | E541: 0 | F541: 0 | G541: 0 | H541: 0 | I541: 0 | J541: 0 | K541: 28.550000000000001 | L541: 0 | M541: =SUM(J541:L541)-2.64 -> 25.91 | N541: 2.6400000000000001 | O541: =SUM(M541:N541) -> 28.550000000000001
A542: 3571 | B542: UFV CALDEIRÃO GRANDE II | C542: 12.960.094/0001-20 | D542: 61.280000000000001 | E542: 0 | F542: 0 | G542: 0 | H542: 0 | I542: 0 | J542: 0 | K542: 67.530000000000001 | L542: 0 | M542: =SUM(J542:L542)-6.25 -> 61.280000000000001 | N542: 6.25 | O542: =SUM(M542:N542) -> 67.530000000000001
A543: 3572 | B543: UFV CALDEIRÃO GRANDE I | C543: 12.960.103/0001-82 | D543: 61.299999999999997 | E543: 0 | F543: 0 | G543: 0 | H543: 0 | I543: 0 | J543: 0 | K543: 67.549999999999997 | L543: 0 | M543: =SUM(J543:L543)-6.25 -> 61.299999999999997 | N543: 6.25 | O543: =SUM(M543:N543) -> 67.549999999999997
A544: 3573 | B544: UFV CALDEIRÃO GRANDE III | C544: 12.964.095/0001-42 | D544: 60.710000000000001 | E544: 0 | F544: 0 | G544: 0 | H544: 0 | I544: 0 | J544: 0 | K544: 66.900000000000006 | L544: 0 | M544: =SUM(J544:L544)-6.19 -> 60.710000000000008 | N544: 6.1900000000000004 | O544: =SUM(M544:N544) -> 66.900000000000006
A545: 3574 | B545: UFV CALDEIRÃO GRANDE VI | C545: 12.960.127/0001-31 | D545: 60.710000000000001 | E545: 0 | F545: 0 | G545: 0 | H545: 0 | I545: 0 | J545: 0 | K545: 66.900000000000006 | L545: 0 | M545: =SUM(J545:L545)-6.19 -> 60.710000000000008 | N545: 6.1900000000000004 | O545: =SUM(M545:N545) -> 66.900000000000006
A546: 3575 | B546: UFV CALDEIRÃO GRANDE IV | C546: 10.656.568/0001-19 | D546: 60.710000000000001 | E546: 0 | F546: 0 | G546: 0 | H546: 0 | I546: 0 | J546: 0 | K546: 66.900000000000006 | L546: 0 | M546: =SUM(J546:L546)-6.19 -> 60.710000000000008 | N546: 6.1900000000000004 | O546: =SUM(M546:N546) -> 66.900000000000006
A547: 3576 | B547: UFV CALDEIRÃO GRANDE VII | C547: 12.960.117/0001-04 | D547: 61.119999999999997 | E547: 0 | F547: 0 | G547: 0 | H547: 0 | I547: 0 | J547: 0 | K547: 67.349999999999994 | L547: 0 | M547: =SUM(J547:L547)-6.23 -> 61.11999999999999 | N547: 6.2300000000000004 | O547: =SUM(M547:N547) -> 67.349999999999994
A548: 3577 | B548: PCH SERRA DOS CAVALINHOS I | C548: 09.199.675/0002-67 | D548: 52.479999999999997 | E548: 0 | F548: 0 | G548: 0 | H548: 0 | I548: 0 | J548: 0 | K548: 57.829999999999998 | L548: 0 | M548: =SUM(J548:L548)-5.35 -> 52.479999999999997 | N548: 5.3499999999999996 | O548: =SUM(M548:N548) -> 57.829999999999998
A549: 3578 | B549: EOL AURA MANGUEIRA XV | C549: 19.944.650/0002-02 | D549: 33.740000000000002 | E549: 0 | F549: 0 | G549: 0 | H549: 0 | I549: 0 | J549: 0 | K549: 37.18 | L549: 0 | M549: =SUM(J549:L549)-3.44 -> 33.740000000000002 | N549: 3.4399999999999999 | O549: =SUM(M549:N549) -> 37.18
A550: 3579 | B550: EOL AURA MIRIM IV | C550: 19.941.770/0002-48 | D550: 28.120000000000001 | E550: 0 | F550: 0 | G550: 0 | H550: 0 | I550: 0 | J550: 0 | K550: 30.989999999999998 | L550: 0 | M550: =SUM(J550:L550)-2.87 -> 28.119999999999997 | N550: 2.8700000000000001 | O550: =SUM(M550:N550) -> 30.989999999999998
A551: 3580 | B551: EOL SANTA ÚRSULA | C551: 12.053.891/0001-23 | D551: 47.840000000000003 | E551: 0 | F551: 0 | G551: 0 | H551: 0 | I551: 0 | J551: 0 | K551: 52.719999999999999 | L551: 0 | M551: =SUM(J551:L551)-4.88 -> 47.839999999999996 | N551: 4.8799999999999999 | O551: =SUM(M551:N551) -> 52.719999999999999
A552: 3581 | B552: EOL VENTOS DE SANTO AUGUSTO VIII | C552: 14.676.003/0002-35 | D552: 34.210000000000001 | E552: 0 | F552: 0 | G552: 0 | H552: 0 | I552: 0 | J552: 0 | K552: 37.700000000000003 | L552: 0 | M552: =SUM(J552:L552)-3.49 -> 34.210000000000001 | N552: 3.4900000000000002 | O552: =SUM(M552:N552) -> 37.700000000000003
A553: 3582 | B553: EOL VENTOS DE SANTO AUGUSTO II | C553: 15.673.911/0002-38 | D553: 50.469999999999999 | E553: 0 | F553: 0 | G553: 0 | H553: 0 | I553: 0 | J553: 0 | K553: 55.609999999999999 | L553: 0 | M553: =SUM(J553:L553)-5.14 -> 50.469999999999999 | N553: 5.1399999999999997 | O553: =SUM(M553:N553) -> 55.609999999999999
A554: 3583 | B554: EOL VENTOS DE SANTO ESTEVAO V | C554: 15.674.805/0002-79 | D554: 50.469999999999999 | E554: 0 | F554: 0 | G554: 0 | H554: 0 | I554: 0 | J554: 0 | K554: 55.609999999999999 | L554: 0 | M554: =SUM(J554:L554)-5.14 -> 50.469999999999999 | N554: 5.1399999999999997 | O554: =SUM(M554:N554) -> 55.609999999999999
A555: 3584 | B555: EOL VENTOS DE SANTO ESTEVAO III | C555: 15.674.836/0002-20 | D555: 54.670000000000002 | E555: 0 | F555: 0 | G555: 0 | H555: 0 | I555: 0 | J555: 0 | K555: 60.240000000000002 | L555: 0 | M555: =SUM(J555:L555)-5.57 -> 54.670000000000002 | N555: 5.5700000000000003 | O555: =SUM(M555:N555) -> 60.240000000000002
A556: 3585 | B556: EOL AURA MANGUEIRA XII | C556: 19.888.199/0002-45 | D556: 28.120000000000001 | E556: 0 | F556: 0 | G556: 0 | H556: 0 | I556: 0 | J556: 0 | K556: 30.989999999999998 | L556: 0 | M556: =SUM(J556:L556)-2.87 -> 28.119999999999997 | N556: 2.8700000000000001 | O556: =SUM(M556:N556) -> 30.989999999999998
A557: 3586 | B557: EOL AURA MANGUEIRA XIII | C557: 19.868.433/0002-72 | D557: 28.109999999999999 | E557: 0 | F557: 0 | G557: 0 | H557: 0 | I557: 0 | J557: 0 | K557: 30.98 | L557: 0 | M557: =SUM(J557:L557)-2.87 -> 28.109999999999999 | N557: 2.8700000000000001 | O557: =SUM(M557:N557) -> 30.98
A558: 3587 | B558: UFV ITUVERAVA 1 E 2 | C558: 21.619.094/0003-13 | D558: 46.729999999999997 | E558: 0 | F558: 0 | G558: 0 | H558: 0 | I558: 0 | J558: 0 | K558: 51.490000000000002 | L558: 0 | M558: =SUM(J558:L558)-4.76 -> 46.730000000000004 | N558: 4.7599999999999998 | O558: =SUM(M558:N558) -> 51.490000000000002
A559: 3588 | B559: EOL PONTAL 2A | C559: 15.355.380/0001-54 | D559: 33.590000000000003 | E559: 0 | F559: 0 | G559: 0 | H559: 0 | I559: 0 | J559: 0 | K559: 37.009999999999998 | L559: 0 | M559: =SUM(J559:L559)-3.42 -> 33.589999999999996 | N559: 3.4199999999999999 | O559: =SUM(M559:N559) -> 37.009999999999998
A560: 3589 | B560: EOL PONTAL 2B | C560: 12.752.290/0001-09 | D560: 15.380000000000001 | E560: 0 | F560: 0 | G560: 0 | H560: 0 | I560: 0 | J560: 0 | K560: 16.949999999999999 | L560: 0 | M560: =SUM(J560:L560)-1.57 -> 15.379999999999999 | N560: 1.5700000000000001 | O560: =SUM(M560:N560) -> 16.949999999999999
A561: 3590 | B561: EOL PONTAL 3B | C561: 15.355.485/0001-03 | D561: 45.200000000000003 | E561: 0 | F561: 0 | G561: 0 | H561: 0 | I561: 0 | J561: 0 | K561: 49.810000000000002 | L561: 0 | M561: =SUM(J561:L561)-4.61 -> 45.200000000000003 | N561: 4.6100000000000003 | O561: =SUM(M561:N561) -> 49.810000000000002
A562: 3591 | B562: CEMIG (UHE TRES MARIAS) | C562: 06.981.176/0001-58 | D562: 1536.77 | E562: 0 | F562: 0 | G562: 0 | H562: 0 | I562: 0 | J562: 0 | K562: 1693.4100000000001 | L562: 0 | M562: =SUM(J562:L562)-156.64 -> 1536.77 | N562: 156.63999999999999 | O562: =SUM(M562:N562) -> 1693.4099999999999
A563: 3592 | B563: EOL AURA MANGUEIRA XVII | C563: 19.896.691/0002-62 | D563: 28.109999999999999 | E563: 0 | F563: 0 | G563: 0 | H563: 0 | I563: 0 | J563: 0 | K563: 30.98 | L563: 0 | M563: =SUM(J563:L563)-2.87 -> 28.109999999999999 | N563: 2.8700000000000001 | O563: =SUM(M563:N563) -> 30.98
A564: 3593 | B564: EOL AURA MIRIM VI | C564: 19.891.491/0002-17 | D564: 16.859999999999999 | E564: 0 | F564: 0 | G564: 0 | H564: 0 | I564: 0 | J564: 0 | K564: 18.579999999999998 | L564: 0 | M564: =SUM(J564:L564)-1.72 -> 16.859999999999999 | N564: 1.72 | O564: =SUM(M564:N564) -> 18.579999999999998
A565: 3594 | B565: EOL AURA MIRIM VIII | C565: 19.917.214/0002-36 | D565: 16.859999999999999 | E565: 0 | F565: 0 | G565: 0 | H565: 0 | I565: 0 | J565: 0 | K565: 18.579999999999998 | L565: 0 | M565: =SUM(J565:L565)-1.72 -> 16.859999999999999 | N565: 1.72 | O565: =SUM(M565:N565) -> 18.579999999999998
A566: 3595 | B566: EOL BONS VENTOS CACIMBAS 2 | C566: 19.953.139/0002-69 | D566: 41.600000000000001 | E566: 0 | F566: 0 | G566: 0 | H566: 0 | I566: 0 | J566: 0 | K566: 45.840000000000003 | L566: 0 | M566: =SUM(J566:L566)-4.24 -> 41.600000000000001 | N566: 4.2400000000000002 | O566: =SUM(M566:N566) -> 45.840000000000003
A567: 3596 | B567: EOL VENTOS DE SANTO AUGUSTO I | C567: 15.674.987/0002-88 | D567: 33.640000000000001 | E567: 0 | F567: 0 | G567: 0 | H567: 0 | I567: 0 | J567: 0 | K567: 37.07 | L567: 0 | M567: =SUM(J567:L567)-3.43 -> 33.640000000000001 | N567: 3.4300000000000002 | O567: =SUM(M567:N567) -> 37.07
A568: 3597 | B568: EOL VENTOS DE SANTO AUGUSTO VII | C568: 15.673.881/0002-60 | D568: 33.640000000000001 | E568: 0 | F568: 0 | G568: 0 | H568: 0 | I568: 0 | J568: 0 | K568: 37.07 | L568: 0 | M568: =SUM(J568:L568)-3.43 -> 33.640000000000001 | N568: 3.4300000000000002 | O568: =SUM(M568:N568) -> 37.07
A569: 3598 | B569: EOL VENTOS DE SÃO VIRGÍLIO 02 | C569: 21.480.086/0002-58 | D569: 62.719999999999999 | E569: 0 | F569: 0 | G569: 0 | H569: 0 | I569: 0 | J569: 0 | K569: 69.109999999999999 | L569: 0 | M569: =SUM(J569:L569)-6.39 -> 62.719999999999999 | N569: 6.3899999999999997 | O569: =SUM(M569:N569) -> 69.109999999999999
A570: 3599 | B570: UFV ITUVERAVA 3 E 4 | C570: 21.602.288/0003-06 | D570: 49.909999999999997 | E570: 0 | F570: 0 | G570: 0 | H570: 0 | I570: 0 | J570: 0 | K570: 55 | L570: 0 | M570: =SUM(J570:L570)-5.09 -> 49.909999999999997 | N570: 5.0899999999999999 | O570: =SUM(M570:N570) -> 55
A571: 3600 | B571: UFV ITUVERAVA 5 6 E 7 | C571: 21.619.125/0003-36 | D571: 72.209999999999994 | E571: 0 | F571: 0 | G571: 0 | H571: 0 | I571: 0 | J571: 0 | K571: 79.569999999999993 | L571: 0 | M571: =SUM(J571:L571)-7.36 -> 72.209999999999994 | N571: 7.3600000000000003 | O571: =SUM(M571:N571) -> 79.569999999999993
A572: 3601 | B572: UTE CARAMURU | C572: 00.080.671/0001-00 | D572: 19.02 | E572: 0 | F572: 0 | G572: 0 | H572: 0 | I572: 0 | J572: 0 | K572: 20.960000000000001 | L572: 0 | M572: =SUM(J572:L572)-1.94 -> 19.02 | N572: 1.9399999999999999 | O572: =SUM(M572:N572) -> 20.960000000000001
A573: 3602 | B573: EOL VENTOS DE SANTO ONOFRE IV | C573: 21.480.328/0002-03 | D573: 57.090000000000003 | E573: 0 | F573: 0 | G573: 0 | H573: 0 | I573: 0 | J573: 0 | K573: 62.909999999999997 | L573: 0 | M573: =SUM(J573:L573)-5.82 -> 57.089999999999996 | N573: 5.8200000000000003 | O573: =SUM(M573:N573) -> 62.909999999999997
A574: 3603 | B574: EOL VENTOS DE SANTO AUGUSTO VI | C574: 15.673.793/0002-68 | D574: 54.670000000000002 | E574: 0 | F574: 0 | G574: 0 | H574: 0 | I574: 0 | J574: 0 | K574: 60.240000000000002 | L574: 0 | M574: =SUM(J574:L574)-5.57 -> 54.670000000000002 | N574: 5.5700000000000003 | O574: =SUM(M574:N574) -> 60.240000000000002
A575: 3604 | B575: EOL AURA MANGUEIRA IV | C575: 19.869.355/0002-20 | D575: 39.380000000000003 | E575: 0 | F575: 0 | G575: 0 | H575: 0 | I575: 0 | J575: 0 | K575: 43.390000000000001 | L575: 0 | M575: =SUM(J575:L575)-4.01 -> 39.380000000000003 | N575: 4.0099999999999998 | O575: =SUM(M575:N575) -> 43.390000000000001
A576: 3605 | B576: EOL VENTOS DE SÃO VIRGÍLIO 01 | C576: 21.479.982/0002-05 | D576: 61.840000000000003 | E576: 0 | F576: 0 | G576: 0 | H576: 0 | I576: 0 | J576: 0 | K576: 68.140000000000001 | L576: 0 | M576: =SUM(J576:L576)-6.3 -> 61.840000000000003 | N576: 6.2999999999999998 | O576: =SUM(M576:N576) -> 68.140000000000001
A577: 3606 | B577: EOL VILA ACRE I | C577: 24.061.085/0001-86 | D577: 48.229999999999997 | E577: 0 | F577: 0 | G577: 0 | H577: 0 | I577: 0 | J577: 0 | K577: 53.149999999999999 | L577: 0 | M577: =SUM(J577:L577)-4.92 -> 48.229999999999997 | N577: 4.9199999999999999 | O577: =SUM(M577:N577) -> 53.149999999999999
A578: 3607 | B578: EOL AURA MANGUEIRA VI | C578: 19.888.311/0002-48 | D578: 50.659999999999997 | E578: 0 | F578: 0 | G578: 0 | H578: 0 | I578: 0 | J578: 0 | K578: 55.82 | L578: 0 | M578: =SUM(J578:L578)-5.16 -> 50.659999999999997 | N578: 5.1600000000000001 | O578: =SUM(M578:N578) -> 55.819999999999993
A579: 3608 | B579: EOL PEDRA CHEIROSA | C579: 10.883.378/0001-34 | D579: 43.57 | E579: 0 | F579: 0 | G579: 0 | H579: 0 | I579: 0 | J579: 0 | K579: 48.009999999999998 | L579: 0 | M579: =SUM(J579:L579)-4.44 -> 43.57 | N579: 4.4400000000000004 | O579: =SUM(M579:N579) -> 48.009999999999998
A580: 3609 | B580: UFV NOVA OLINDA 8 | C580: 23.566.105/0003-70 | D580: 21.949999999999999 | E580: 0 | F580: 0 | G580: 0 | H580: 0 | I580: 0 | J580: 0 | K580: 24.190000000000001 | L580: 0 | M580: =SUM(J580:L580)-2.24 -> 21.950000000000003 | N580: 2.2400000000000002 | O580: =SUM(M580:N580) -> 24.190000000000005
A581: 3610 | B581: UFV NOVA OLINDA 10 | C581: 23.416.727/0003-11 | D581: 21.960000000000001 | E581: 0 | F581: 0 | G581: 0 | H581: 0 | I581: 0 | J581: 0 | K581: 24.199999999999999 | L581: 0 | M581: =SUM(J581:L581)-2.24 -> 21.960000000000001 | N581: 2.2400000000000002 | O581: =SUM(M581:N581) -> 24.200000000000003
A582: 3611 | B582: UFV NOVA OLINDA 12 | C582: 23.414.549/0003-90 | D582: 22.02 | E582: 0 | F582: 0 | G582: 0 | H582: 0 | I582: 0 | J582: 0 | K582: 24.260000000000002 | L582: 0 | M582: =SUM(J582:L582)-2.24 -> 22.020000000000003 | N582: 2.2400000000000002 | O582: =SUM(M582:N582) -> 24.260000000000005
A583: 3612 | B583: UFV NOVA OLINDA 14 | C583: 23.399.563/0003-61 | D583: 21.879999999999999 | E583: 0 | F583: 0 | G583: 0 | H583: 0 | I583: 0 | J583: 0 | K583: 24.109999999999999 | L583: 0 | M583: =SUM(J583:L583)-2.23 -> 21.879999999999999 | N583: 2.23 | O583: =SUM(M583:N583) -> 24.109999999999999
A584: 3613 | B584: EOL DELTA 3 I | C584: 23.598.517/0002-00 | D584: 41.380000000000003 | E584: 0 | F584: 0 | G584: 0 | H584: 0 | I584: 0 | J584: 0 | K584: 45.600000000000001 | L584: 0 | M584: =SUM(J584:L584)-4.22 -> 41.380000000000003 | N584: 4.2199999999999998 | O584: =SUM(M584:N584) -> 45.600000000000001
A585: 3614 | B585: EOL DELTA 3 II | C585: 23.598.858/0002-86 | D585: 41.380000000000003 | E585: 0 | F585: 0 | G585: 0 | H585: 0 | I585: 0 | J585: 0 | K585: 45.600000000000001 | L585: 0 | M585: =SUM(J585:L585)-4.22 -> 41.380000000000003 | N585: 4.2199999999999998 | O585: =SUM(M585:N585) -> 45.600000000000001
A586: 3615 | B586: EOL DELTA 3 III | C586: 23.598.847/0002-04 | D586: 41.380000000000003 | E586: 0 | F586: 0 | G586: 0 | H586: 0 | I586: 0 | J586: 0 | K586: 45.600000000000001 | L586: 0 | M586: =SUM(J586:L586)-4.22 -> 41.380000000000003 | N586: 4.2199999999999998 | O586: =SUM(M586:N586) -> 45.600000000000001
A587: 3616 | B587: EOL VENTOS DE SÃO VICENTE 14 | C587: 21.869.347/0001-45 | D587: 54 | E587: 0 | F587: 0 | G587: 0 | H587: 0 | I587: 0 | J587: 0 | K587: 59.5 | L587: 0 | M587: =SUM(J587:L587)-5.5 -> 54 | N587: 5.5 | O587: =SUM(M587:N587) -> 59.5
A588: 3617 | B588: EOL DELTA 3 V | C588: 23.598.829/0002-14 | D588: 41.380000000000003 | E588: 0 | F588: 0 | G588: 0 | H588: 0 | I588: 0 | J588: 0 | K588: 45.600000000000001 | L588: 0 | M588: =SUM(J588:L588)-4.22 -> 41.380000000000003 | N588: 4.2199999999999998 | O588: =SUM(M588:N588) -> 45.600000000000001
A589: 3618 | B589: EOL DELTA 3 VI | C589: 23.598.831/0002-93 | D589: 41.380000000000003 | E589: 0 | F589: 0 | G589: 0 | H589: 0 | I589: 0 | J589: 0 | K589: 45.600000000000001 | L589: 0 | M589: =SUM(J589:L589)-4.22 -> 41.380000000000003 | N589: 4.2199999999999998 | O589: =SUM(M589:N589) -> 45.600000000000001
A590: 3619 | B590: EOL DELTA 3 VII | C590: 23.598.844/0002-62 | D590: 41.469999999999999 | E590: 0 | F590: 0 | G590: 0 | H590: 0 | I590: 0 | J590: 0 | K590: 45.700000000000003 | L590: 0 | M590: =SUM(J590:L590)-4.23 -> 41.469999999999999 | N590: 4.2300000000000004 | O590: =SUM(M590:N590) -> 45.700000000000003
A591: 3620 | B591: EOL DELTA 3 VIII | C591: 15.190.472/0002-02 | D591: 44.369999999999997 | E591: 0 | F591: 0 | G591: 0 | H591: 0 | I591: 0 | J591: 0 | K591: 48.890000000000001 | L591: 0 | M591: =SUM(J591:L591)-4.52 -> 44.370000000000005 | N591: 4.5199999999999996 | O591: =SUM(M591:N591) -> 48.890000000000001
A592: 3621 | B592: EOL VENTOS DE SANTO ESTEVAO I | C592: 16.712.566/0002-67 | D592: 46.259999999999998 | E592: 0 | F592: 0 | G592: 0 | H592: 0 | I592: 0 | J592: 0 | K592: 50.979999999999997 | L592: 0 | M592: =SUM(J592:L592)-4.72 -> 46.259999999999998 | N592: 4.7199999999999998 | O592: =SUM(M592:N592) -> 50.979999999999997
A593: 3622 | B593: EOL VENTOS DE SANTO ESTEVAO II | C593: 16.603.387/0002-91 | D593: 46.259999999999998 | E593: 0 | F593: 0 | G593: 0 | H593: 0 | I593: 0 | J593: 0 | K593: 50.979999999999997 | L593: 0 | M593: =SUM(J593:L593)-4.72 -> 46.259999999999998 | N593: 4.7199999999999998 | O593: =SUM(M593:N593) -> 50.979999999999997
A594: 3623 | B594: EOL VENTOS DE SANTO ESTEVAO IV | C594: 21.480.026/0002-35 | D594: 61.840000000000003 | E594: 0 | F594: 0 | G594: 0 | H594: 0 | I594: 0 | J594: 0 | K594: 68.140000000000001 | L594: 0 | M594: =SUM(J594:L594)-6.3 -> 61.840000000000003 | N594: 6.2999999999999998 | O594: =SUM(M594:N594) -> 68.140000000000001
A595: 3624 | B595: UFV LAPA 2 | C595: 23.509.564/0002-30 | D595: 23.059999999999999 | E595: 0 | F595: 0 | G595: 0 | H595: 0 | I595: 0 | J595: 0 | K595: 25.41 | L595: 0 | M595: =SUM(J595:L595)-2.35 -> 23.059999999999999 | N595: 2.3500000000000001 | O595: =SUM(M595:N595) -> 25.41
A596: 3625 | B596: EOL PEDRA CHEIROSA II | C596: 10.883.587/0001-88 | D596: 39.850000000000001 | E596: 0 | F596: 0 | G596: 0 | H596: 0 | I596: 0 | J596: 0 | K596: 43.909999999999997 | L596: 0 | M596: =SUM(J596:L596)-4.06 -> 39.849999999999994 | N596: 4.0599999999999996 | O596: =SUM(M596:N596) -> 43.909999999999997
A597: 3626 | B597: EOL DELTA 3 IV | C597: 23.598.842/0002-73 | D597: 41.380000000000003 | E597: 0 | F597: 0 | G597: 0 | H597: 0 | I597: 0 | J597: 0 | K597: 45.600000000000001 | L597: 0 | M597: =SUM(J597:L597)-4.22 -> 41.380000000000003 | N597: 4.2199999999999998 | O597: =SUM(M597:N597) -> 45.600000000000001
A598: 3627 | B598: EOL CRISTALÂNDIA I | C598: 22.499.471/0003-90 | D598: 52.280000000000001 | E598: 0 | F598: 0 | G598: 0 | H598: 0 | I598: 0 | J598: 0 | K598: 57.609999999999999 | L598: 0 | M598: =SUM(J598:L598)-5.33 -> 52.280000000000001 | N598: 5.3300000000000001 | O598: =SUM(M598:N598) -> 57.609999999999999
A599: 3628 | B599: EOL CRISTALÂNDIA II | C599: 23.049.225/0003-08 | D599: 52.280000000000001 | E599: 0 | F599: 0 | G599: 0 | H599: 0 | I599: 0 | J599: 0 | K599: 57.609999999999999 | L599: 0 | M599: =SUM(J599:L599)-5.33 -> 52.280000000000001 | N599: 5.3300000000000001 | O599: =SUM(M599:N599) -> 57.609999999999999
A600: 3629 | B600: EOL DELFINA IV | C600: 21.553.603/0003-52 | D600: 17.850000000000001 | E600: 0 | F600: 0 | G600: 0 | H600: 0 | I600: 0 | J600: 0 | K600: 19.670000000000002 | L600: 0 | M600: =SUM(J600:L600)-1.82 -> 17.850000000000001 | N600: 1.8200000000000001 | O600: =SUM(M600:N600) -> 19.670000000000002
A601: 3630 | B601: EOL DELFINA V | C601: 21.552.886/0003-18 | D601: 180.22 | E601: 0 | F601: 0 | G601: 0 | H601: 0 | I601: 0 | J601: 0 | K601: 198.59 | L601: 0 | M601: =SUM(J601:L601)-18.37 -> 180.22 | N601: 18.370000000000001 | O601: =SUM(M601:N601) -> 198.59
A602: 3631 | B602: EOL VENTOS DE SÃO VIRGÍLIO 03 | C602: 21.480.051/0002-19 | D602: 41.130000000000003 | E602: 0 | F602: 0 | G602: 0 | H602: 0 | I602: 0 | J602: 0 | K602: 45.32 | L602: 0 | M602: =SUM(J602:L602)-4.19 -> 41.130000000000003 | N602: 4.1900000000000004 | O602: =SUM(M602:N602) -> 45.32
A603: 3632 | B603: ELETRONORTE (UTE MAUA 3) | C603: 00.357.038/0001-16 | D603: 1306.4300000000001 | E603: 0 | F603: 0 | G603: 0 | H603: 0 | I603: 0 | J603: 0 | K603: 1439.5899999999999 | L603: 0 | M603: =SUM(J603:L603)-133.16 -> 1306.4299999999998 | N603: 133.16 | O603: =SUM(M603:N603) -> 1439.5899999999999
A604: 3633 | B604: EOL DREEN CUTIA | C604: 21.917.808/0001-08 | D604: 45.479999999999997 | E604: 0 | F604: 0 | G604: 0 | H604: 0 | I604: 0 | J604: 0 | K604: 50.119999999999997 | L604: 0 | M604: =SUM(J604:L604)-4.64 -> 45.479999999999997 | N604: 4.6399999999999997 | O604: =SUM(M604:N604) -> 50.119999999999997
A605: 3634 | B605: EOL DREEN GUAJIRU | C605: 21.957.870/0001-23 | D605: 41.539999999999999 | E605: 0 | F605: 0 | G605: 0 | H605: 0 | I605: 0 | J605: 0 | K605: 45.770000000000003 | L605: 0 | M605: =SUM(J605:L605)-4.23 -> 41.540000000000006 | N605: 4.2300000000000004 | O605: =SUM(M605:N605) -> 45.77000000000001
A606: 3635 | B606: EOL GE JANGADA | C606: 21.957.722/0001-09 | D606: 53.990000000000002 | E606: 0 | F606: 0 | G606: 0 | H606: 0 | I606: 0 | J606: 0 | K606: 59.490000000000002 | L606: 0 | M606: =SUM(J606:L606)-5.5 -> 53.990000000000002 | N606: 5.5 | O606: =SUM(M606:N606) -> 59.490000000000002
A607: 3636 | B607: EOL GE MARIA HELENA | C607: 21.909.793/0001-36 | D607: 53.990000000000002 | E607: 0 | F607: 0 | G607: 0 | H607: 0 | I607: 0 | J607: 0 | K607: 59.490000000000002 | L607: 0 | M607: =SUM(J607:L607)-5.5 -> 53.990000000000002 | N607: 5.5 | O607: =SUM(M607:N607) -> 59.490000000000002
A608: 3637 | B608: EOL POTIGUAR | C608: 21.957.968/0001-80 | D608: 53.990000000000002 | E608: 0 | F608: 0 | G608: 0 | H608: 0 | I608: 0 | J608: 0 | K608: 59.490000000000002 | L608: 0 | M608: =SUM(J608:L608)-5.5 -> 53.990000000000002 | N608: 5.5 | O608: =SUM(M608:N608) -> 59.490000000000002
A609: 3638 | B609: EOL ESPERANÇA DO NORDESTE | C609: 21.916.951/0001-85 | D609: 53.990000000000002 | E609: 0 | F609: 0 | G609: 0 | H609: 0 | I609: 0 | J609: 0 | K609: 59.490000000000002 | L609: 0 | M609: =SUM(J609:L609)-5.5 -> 53.990000000000002 | N609: 5.5 | O609: =SUM(M609:N609) -> 59.490000000000002
A610: 3639 | B610: EOL PARAÍSO DOS V DO NORDESTE | C610: 21.909.032/0001-84 | D610: 53.990000000000002 | E610: 0 | F610: 0 | G610: 0 | H610: 0 | I610: 0 | J610: 0 | K610: 59.490000000000002 | L610: 0 | M610: =SUM(J610:L610)-5.5 -> 53.990000000000002 | N610: 5.5 | O610: =SUM(M610:N610) -> 59.490000000000002
A611: 3640 | B611: EOL TAMANDUA MIRIM 2 | C611: 33.541.368/0001-16 | D611: 31.140000000000001 | E611: 0 | F611: 0 | G611: 0 | H611: 0 | I611: 0 | J611: 0 | K611: 34.310000000000002 | L611: 0 | M611: =SUM(J611:L611)-3.17 -> 31.140000000000001 | N611: 3.1699999999999999 | O611: =SUM(M611:N611) -> 34.310000000000002
A612: 3641 | B612: EOL PAPAGAIO | C612: 33.541.368/0001-16 | D612: 17.739999999999998 | E612: 0 | F612: 0 | G612: 0 | H612: 0 | I612: 0 | J612: 0 | K612: 19.550000000000001 | L612: 0 | M612: =SUM(J612:L612)-1.81 -> 17.740000000000002 | N612: 1.8100000000000001 | O612: =SUM(M612:N612) -> 19.550000000000001
A613: 3642 | B613: EOL CORRUPIAO 3 | C613: 33.541.368/0001-16 | D613: 17.829999999999998 | E613: 0 | F613: 0 | G613: 0 | H613: 0 | I613: 0 | J613: 0 | K613: 19.649999999999999 | L613: 0 | M613: =SUM(J613:L613)-1.82 -> 17.829999999999998 | N613: 1.8200000000000001 | O613: =SUM(M613:N613) -> 19.649999999999999
A614: 3643 | B614: EOL COQUEIRINHO 2 | C614: 33.541.368/0001-16 | D614: 28.440000000000001 | E614: 0 | F614: 0 | G614: 0 | H614: 0 | I614: 0 | J614: 0 | K614: 31.34 | L614: 0 | M614: =SUM(J614:L614)-2.9 -> 28.440000000000001 | N614: 2.8999999999999999 | O614: =SUM(M614:N614) -> 31.34
A615: 3644 | B615: EOL CARCARÁ | C615: 33.541.368/0001-16 | D615: 17.859999999999999 | E615: 0 | F615: 0 | G615: 0 | H615: 0 | I615: 0 | J615: 0 | K615: 19.68 | L615: 0 | M615: =SUM(J615:L615)-1.82 -> 17.859999999999999 | N615: 1.8200000000000001 | O615: =SUM(M615:N615) -> 19.68
A616: 3645 | B616: EOL CAITITU 2 | C616: 33.541.368/0001-16 | D616: 17.870000000000001 | E616: 0 | F616: 0 | G616: 0 | H616: 0 | I616: 0 | J616: 0 | K616: 19.690000000000001 | L616: 0 | M616: =SUM(J616:L616)-1.82 -> 17.870000000000001 | N616: 1.8200000000000001 | O616: =SUM(M616:N616) -> 19.690000000000001
A617: 3646 | B617: EOL CAITITU 3 | C617: 33.541.368/0001-16 | D617: 17.870000000000001 | E617: 0 | F617: 0 | G617: 0 | H617: 0 | I617: 0 | J617: 0 | K617: 19.690000000000001 | L617: 0 | M617: =SUM(J617:L617)-1.82 -> 17.870000000000001 | N617: 1.8200000000000001 | O617: =SUM(M617:N617) -> 19.690000000000001
A618: 3647 | B618: EOL ANGICAL 2 | C618: 33.541.368/0001-16 | D618: 17.870000000000001 | E618: 0 | F618: 0 | G618: 0 | H618: 0 | I618: 0 | J618: 0 | K618: 19.690000000000001 | L618: 0 | M618: =SUM(J618:L618)-1.82 -> 17.870000000000001 | N618: 1.8200000000000001 | O618: =SUM(M618:N618) -> 19.690000000000001
A619: 3648 | B619: EOL ARAPAPÁ | C619: 33.541.368/0001-16 | D619: 7.1399999999999997 | E619: 0 | F619: 0 | G619: 0 | H619: 0 | I619: 0 | J619: 0 | K619: 7.8700000000000001 | L619: 0 | M619: =SUM(J619:L619)-0.73 -> 7.1400000000000006 | N619: 0.72999999999999998 | O619: =SUM(M619:N619) -> 7.870000000000001
A620: 3649 | B620: EOL ACAUÃ | C620: 33.541.368/0001-16 | D620: 11.380000000000001 | E620: 0 | F620: 0 | G620: 0 | H620: 0 | I620: 0 | J620: 0 | K620: 12.539999999999999 | L620: 0 | M620: =SUM(J620:L620)-1.16 -> 11.379999999999999 | N620: 1.1599999999999999 | O620: =SUM(M620:N620) -> 12.539999999999999
A621: 3650 | B621: EOL TEIU 2 | C621: 33.541.368/0001-16 | D621: 14.369999999999999 | E621: 0 | F621: 0 | G621: 0 | H621: 0 | I621: 0 | J621: 0 | K621: 15.83 | L621: 0 | M621: =SUM(J621:L621)-1.46 -> 14.370000000000001 | N621: 1.46 | O621: =SUM(M621:N621) -> 15.830000000000002
A622: 3672 | B622: RENOVA (EOL ANGICO) | C622: 18.870.073/0001-08 | D622: 13.83 | E622: 0 | F622: 0 | G622: 0 | H622: 0 | I622: 0 | J622: 0 | K622: 15.24 | L622: 0 | M622: =SUM(J622:L622)-1.41 -> 13.83 | N622: 1.4099999999999999 | O622: =SUM(M622:N622) -> 15.24
A623: 3673 | B623: RENOVA (EOL SABIU) | C623: 17.305.829/0001-03 | D623: 23.579999999999998 | E623: 0 | F623: 0 | G623: 0 | H623: 0 | I623: 0 | J623: 0 | K623: 25.98 | L623: 0 | M623: =SUM(J623:L623)-2.4 -> 23.580000000000002 | N623: 2.3999999999999999 | O623: =SUM(M623:N623) -> 25.98
A624: 3674 | B624: RENOVA (EOL PAU D’ÁGUA) | C624: 17.250.513/0001-53 | D624: 31.329999999999998 | E624: 0 | F624: 0 | G624: 0 | H624: 0 | I624: 0 | J624: 0 | K624: 34.520000000000003 | L624: 0 | M624: =SUM(J624:L624)-3.19 -> 31.330000000000002 | N624: 3.1899999999999999 | O624: =SUM(M624:N624) -> 34.520000000000003
A625: 3675 | B625: RENOVA (EOL MANINEIRO) | C625: 18.560.162/0001-40 | D625: 24.100000000000001 | E625: 0 | F625: 0 | G625: 0 | H625: 0 | I625: 0 | J625: 0 | K625: 26.559999999999999 | L625: 0 | M625: =SUM(J625:L625)-2.46 -> 24.099999999999998 | N625: 2.46 | O625: =SUM(M625:N625) -> 26.559999999999999
A626: 3676 | B626: RENOVA (EOL FACHEIO) | C626: 18.559.964/0001-30 | D626: 28.719999999999999 | E626: 0 | F626: 0 | G626: 0 | H626: 0 | I626: 0 | J626: 0 | K626: 31.649999999999999 | L626: 0 | M626: =SUM(J626:L626)-2.93 -> 28.719999999999999 | N626: 2.9300000000000002 | O626: =SUM(M626:N626) -> 31.649999999999999
A627: 3677 | B627: RENOVA (EOL UMBUZEIRO) | C627: 18.560.273/0001-56 | D627: 32.840000000000003 | E627: 0 | F627: 0 | G627: 0 | H627: 0 | I627: 0 | J627: 0 | K627: 36.189999999999998 | L627: 0 | M627: =SUM(J627:L627)-3.35 -> 32.839999999999996 | N627: 3.3500000000000001 | O627: =SUM(M627:N627) -> 36.189999999999998
A628: 3678 | B628: RENOVA (EOL CEDRO) | C628: 17.330.840/0001-15 | D628: 21.09 | E628: 0 | F628: 0 | G628: 0 | H628: 0 | I628: 0 | J628: 0 | K628: 23.239999999999998 | L628: 0 | M628: =SUM(J628:L628)-2.15 -> 21.09 | N628: 2.1499999999999999 | O628: =SUM(M628:N628) -> 23.239999999999998
A629: 3679 | B629: RENOVA (EOL JATAÍ) | C629: 18.560.347/0001-54 | D629: 28.199999999999999 | E629: 0 | F629: 0 | G629: 0 | H629: 0 | I629: 0 | J629: 0 | K629: 31.07 | L629: 0 | M629: =SUM(J629:L629)-2.87 -> 28.199999999999999 | N629: 2.8700000000000001 | O629: =SUM(M629:N629) -> 31.07
A630: 3680 | B630: RENOVA (EOL BARBATIMÃO) | C630: 19.502.908/0001-21 | D630: 28.199999999999999 | E630: 0 | F630: 0 | G630: 0 | H630: 0 | I630: 0 | J630: 0 | K630: 31.07 | L630: 0 | M630: =SUM(J630:L630)-2.87 -> 28.199999999999999 | N630: 2.8700000000000001 | O630: =SUM(M630:N630) -> 31.07
A631: 3681 | B631: RENOVA (EOL IMBURANA MACHO) | C631: 19.502.538/0001-22 | D631: 28.199999999999999 | E631: 0 | F631: 0 | G631: 0 | H631: 0 | I631: 0 | J631: 0 | K631: 31.07 | L631: 0 | M631: =SUM(J631:L631)-2.87 -> 28.199999999999999 | N631: 2.8700000000000001 | O631: =SUM(M631:N631) -> 31.07
A632: 3682 | B632: RENOVA (EOL AMESCLA) | C632: 19.502.635/0001-15 | D632: 23.489999999999998 | E632: 0 | F632: 0 | G632: 0 | H632: 0 | I632: 0 | J632: 0 | K632: 25.879999999999999 | L632: 0 | M632: =SUM(J632:L632)-2.39 -> 23.489999999999998 | N632: 2.3900000000000001 | O632: =SUM(M632:N632) -> 25.879999999999999
A633: 3683 | B633: RENOVA (EOL JUAZEIRO) | C633: 19.502.341/0001-93 | D633: 32.899999999999999 | E633: 0 | F633: 0 | G633: 0 | H633: 0 | I633: 0 | J633: 0 | K633: 36.25 | L633: 0 | M633: =SUM(J633:L633)-3.35 -> 32.899999999999999 | N633: 3.3500000000000001 | O633: =SUM(M633:N633) -> 36.25
A634: 3684 | B634: RENOVA (EOL ANGELIM) | C634: 19.502.690/0001-05 | D634: 37.590000000000003 | E634: 0 | F634: 0 | G634: 0 | H634: 0 | I634: 0 | J634: 0 | K634: 41.420000000000002 | L634: 0 | M634: =SUM(J634:L634)-3.83 -> 37.590000000000003 | N634: 3.8300000000000001 | O634: =SUM(M634:N634) -> 41.420000000000002
A635: 3685 | B635: RENOVA (EOL VELLOZIA) | C635: 18.560.475/0001-06 | D635: 28.739999999999998 | E635: 0 | F635: 0 | G635: 0 | H635: 0 | I635: 0 | J635: 0 | K635: 31.670000000000002 | L635: 0 | M635: =SUM(J635:L635)-2.93 -> 28.740000000000002 | N635: 2.9300000000000002 | O635: =SUM(M635:N635) -> 31.670000000000002
A636: 3686 | B636: RENOVA (EOL TABOQUINHA) | C636: 18.870.116/0001-47 | D636: 36.909999999999997 | E636: 0 | F636: 0 | G636: 0 | H636: 0 | I636: 0 | J636: 0 | K636: 40.670000000000002 | L636: 0 | M636: =SUM(J636:L636)-3.76 -> 36.910000000000004 | N636: 3.7599999999999998 | O636: =SUM(M636:N636) -> 40.670000000000002
A637: 3687 | B637: RENOVA (EOL ACÁCIA) | C637: 18.919.425/0001-64 | D637: 27.68 | E637: 0 | F637: 0 | G637: 0 | H637: 0 | I637: 0 | J637: 0 | K637: 30.5 | L637: 0 | M637: =SUM(J637:L637)-2.82 -> 27.68 | N637: 2.8199999999999998 | O637: =SUM(M637:N637) -> 30.5
A638: 3688 | B638: RENOVA (EOL SÃO SALVADOR) | C638: 11.197.380/0001-12 | D638: 48.700000000000003 | E638: 0 | F638: 0 | G638: 0 | H638: 0 | I638: 0 | J638: 0 | K638: 53.659999999999997 | L638: 0 | M638: =SUM(J638:L638)-4.96 -> 48.699999999999996 | N638: 4.96 | O638: =SUM(M638:N638) -> 53.659999999999997
A639: 3689 | B639: EOL VENTOS DE SÃO VICENTE 12 | C639: 21.877.685/0001-29 | D639: 54.100000000000001 | E639: 0 | F639: 0 | G639: 0 | H639: 0 | I639: 0 | J639: 0 | K639: 59.609999999999999 | L639: 0 | M639: =SUM(J639:L639)-5.51 -> 54.100000000000001 | N639: 5.5099999999999998 | O639: =SUM(M639:N639) -> 59.609999999999999
A640: 3690 | B640: EOL DELFINA III | C640: 21.556.441/0003-06 | D640: 62.450000000000003 | E640: 0 | F640: 0 | G640: 0 | H640: 0 | I640: 0 | J640: 0 | K640: 68.819999999999993 | L640: 0 | M640: =SUM(J640:L640)-6.37 -> 62.449999999999996 | N640: 6.3700000000000001 | O640: =SUM(M640:N640) -> 68.819999999999993
A641: 3691 | B641: EOL DELFINA VI | C641: 21.553.640/0003-60 | D641: 67.030000000000001 | E641: 0 | F641: 0 | G641: 0 | H641: 0 | I641: 0 | J641: 0 | K641: 73.859999999999999 | L641: 0 | M641: =SUM(J641:L641)-6.83 -> 67.030000000000001 | N641: 6.8300000000000001 | O641: =SUM(M641:N641) -> 73.859999999999999
A642: 3692 | B642: EOL DELFINA VII | C642: 21.599.114/0003-31 | D642: 67.030000000000001 | E642: 0 | F642: 0 | G642: 0 | H642: 0 | I642: 0 | J642: 0 | K642: 73.859999999999999 | L642: 0 | M642: =SUM(J642:L642)-6.83 -> 67.030000000000001 | N642: 6.8300000000000001 | O642: =SUM(M642:N642) -> 73.859999999999999
A643: 3693 | B643: EOL JAU | C643: 17.227.909/0002-60 | D643: 190.5 | E643: 0 | F643: 0 | G643: 0 | H643: 0 | I643: 0 | J643: 0 | K643: 209.91999999999999 | L643: 0 | M643: =SUM(J643:L643)-19.42 -> 190.5 | N643: 19.420000000000002 | O643: =SUM(M643:N643) -> 209.92000000000002
A644: 3694 | B644: UFV HORIZONTE MP 1 | C644: 23.399.589/0002-29 | D644: 56.479999999999997 | E644: 0 | F644: 0 | G644: 0 | H644: 0 | I644: 0 | J644: 0 | K644: 62.240000000000002 | L644: 0 | M644: =SUM(J644:L644)-5.76 -> 56.480000000000004 | N644: 5.7599999999999998 | O644: =SUM(M644:N644) -> 62.240000000000002
A645: 3695 | B645: EOL DOIS RIACHOS | C645: 17.018.370/0002-30 | D645: 117.90000000000001 | E645: 0 | F645: 0 | G645: 0 | H645: 0 | I645: 0 | J645: 0 | K645: 129.91999999999999 | L645: 0 | M645: =SUM(J645:L645)-12.02 -> 117.89999999999999 | N645: 12.02 | O645: =SUM(M645:N645) -> 129.91999999999999
A646: 3696 | B646: EOL ASSURUÁ IV | C646: 21.544.129/0002-11 | D646: 71.930000000000007 | E646: 0 | F646: 0 | G646: 0 | H646: 0 | I646: 0 | J646: 0 | K646: 79.260000000000005 | L646: 0 | M646: =SUM(J646:L646)-7.33 -> 71.930000000000007 | N646: 7.3300000000000001 | O646: =SUM(M646:N646) -> 79.260000000000005
A647: 3697 | B647: EOL UNIÃO DOS VENTOS 12 | C647: 18.265.320/0001-39 | D647: 56.109999999999999 | E647: 0 | F647: 0 | G647: 0 | H647: 0 | I647: 0 | J647: 0 | K647: 61.829999999999998 | L647: 0 | M647: =SUM(J647:L647)-5.72 -> 56.109999999999999 | N647: 5.7199999999999998 | O647: =SUM(M647:N647) -> 61.829999999999998
A648: 3698 | B648: EOL UNIÃO DOS VENTOS 13 | C648: 17.143.971/0001-93 | D648: 42.049999999999997 | E648: 0 | F648: 0 | G648: 0 | H648: 0 | I648: 0 | J648: 0 | K648: 46.340000000000003 | L648: 0 | M648: =SUM(J648:L648)-4.29 -> 42.050000000000004 | N648: 4.29 | O648: =SUM(M648:N648) -> 46.340000000000003
A649: 3699 | B649: EOL UNIÃO DOS VENTOS 14 | C649: 17.143.838/0001-37 | D649: 46.869999999999997 | E649: 0 | F649: 0 | G649: 0 | H649: 0 | I649: 0 | J649: 0 | K649: 51.649999999999999 | L649: 0 | M649: =SUM(J649:L649)-4.78 -> 46.869999999999997 | N649: 4.7800000000000002 | O649: =SUM(M649:N649) -> 51.649999999999999
A650: 3700 | B650: EOL UNIÃO DOS VENTOS 15 | C650: 13.783.102/0001-72 | D650: 68.040000000000006 | E650: 0 | F650: 0 | G650: 0 | H650: 0 | I650: 0 | J650: 0 | K650: 74.980000000000004 | L650: 0 | M650: =SUM(J650:L650)-6.94 -> 68.040000000000006 | N650: 6.9400000000000004 | O650: =SUM(M650:N650) -> 74.980000000000004
A651: 3701 | B651: EOL UNIÃO DOS VENTOS 16 | C651: 17.205.697/0001-30 | D651: 64.829999999999998 | E651: 0 | F651: 0 | G651: 0 | H651: 0 | I651: 0 | J651: 0 | K651: 71.439999999999998 | L651: 0 | M651: =SUM(J651:L651)-6.61 -> 64.829999999999998 | N651: 6.6100000000000003 | O651: =SUM(M651:N651) -> 71.439999999999998
A652: 3702 | B652: EOL VENTOS DE SÃO VICENTE 13 | C652: 21.877.676/0001-38 | D652: 54.090000000000003 | E652: 0 | F652: 0 | G652: 0 | H652: 0 | I652: 0 | J652: 0 | K652: 59.600000000000001 | L652: 0 | M652: =SUM(J652:L652)-5.51 -> 54.090000000000003 | N652: 5.5099999999999998 | O652: =SUM(M652:N652) -> 59.600000000000001
A653: 3703 | B653: EOL PEDRA RAJADA | C653: 21.909.246/0001-50 | D653: 38.259999999999998 | E653: 0 | F653: 0 | G653: 0 | H653: 0 | I653: 0 | J653: 0 | K653: 42.159999999999997 | L653: 0 | M653: =SUM(J653:L653)-3.9 -> 38.259999999999998 | N653: 3.8999999999999999 | O653: =SUM(M653:N653) -> 42.159999999999997
A654: 3704 | B654: EOL PEDRA RAJADA II | C654: 21.909.399/0001-06 | D654: 38.259999999999998 | E654: 0 | F654: 0 | G654: 0 | H654: 0 | I654: 0 | J654: 0 | K654: 42.159999999999997 | L654: 0 | M654: =SUM(J654:L654)-3.9 -> 38.259999999999998 | N654: 3.8999999999999999 | O654: =SUM(M654:N654) -> 42.159999999999997
A655: 3705 | B655: EOL SERRA DAS VACAS V | C655: 22.357.375/0001-46 | D655: 47.719999999999999 | E655: 0 | F655: 0 | G655: 0 | H655: 0 | I655: 0 | J655: 0 | K655: 52.579999999999998 | L655: 0 | M655: =SUM(J655:L655)-4.86 -> 47.719999999999999 | N655: 4.8600000000000003 | O655: =SUM(M655:N655) -> 52.579999999999998
A656: 3706 | B656: EOL SERRA DAS VACAS VII | C656: 22.193.319/0001-13 | D656: 47.719999999999999 | E656: 0 | F656: 0 | G656: 0 | H656: 0 | I656: 0 | J656: 0 | K656: 52.579999999999998 | L656: 0 | M656: =SUM(J656:L656)-4.86 -> 47.719999999999999 | N656: 4.8600000000000003 | O656: =SUM(M656:N656) -> 52.579999999999998
A657: 3711 | B657: EOL VENTOS DE SÃO VICENTE 8 | C657: 21.840.617/0001-95 | D657: 54.219999999999999 | E657: 0 | F657: 0 | G657: 0 | H657: 0 | I657: 0 | J657: 0 | K657: 59.75 | L657: 0 | M657: =SUM(J657:L657)-5.53 -> 54.219999999999999 | N657: 5.5300000000000002 | O657: =SUM(M657:N657) -> 59.75
A658: 3712 | B658: EOL VENTOS DE SÃO VICENTE 11 | C658: 23.037.357/0001-40 | D658: 54.259999999999998 | E658: 0 | F658: 0 | G658: 0 | H658: 0 | I658: 0 | J658: 0 | K658: 59.789999999999999 | L658: 0 | M658: =SUM(J658:L658)-5.53 -> 54.259999999999998 | N658: 5.5300000000000002 | O658: =SUM(M658:N658) -> 59.789999999999999
A659: 3713 | B659: EOL ASSURUÁ III | C659: 21.544.084/0002-85 | D659: 30.579999999999998 | E659: 0 | F659: 0 | G659: 0 | H659: 0 | I659: 0 | J659: 0 | K659: 33.700000000000003 | L659: 0 | M659: =SUM(J659:L659)-3.12 -> 30.580000000000002 | N659: 3.1200000000000001 | O659: =SUM(M659:N659) -> 33.700000000000003
A660: 3714 | B660: EOL CAPOEIRAS III | C660: 21.543.971/0002-39 | D660: 66.370000000000005 | E660: 0 | F660: 0 | G660: 0 | H660: 0 | I660: 0 | J660: 0 | K660: 73.129999999999995 | L660: 0 | M660: =SUM(J660:L660)-6.76 -> 66.36999999999999 | N660: 6.7599999999999998 | O660: =SUM(M660:N660) -> 73.129999999999995
A661: 3715 | B661: EOL CURRAL DE PEDRAS I | C661: 21.541.973/0002-99 | D661: 49.130000000000003 | E661: 0 | F661: 0 | G661: 0 | H661: 0 | I661: 0 | J661: 0 | K661: 54.140000000000001 | L661: 0 | M661: =SUM(J661:L661)-5.01 -> 49.130000000000003 | N661: 5.0099999999999998 | O661: =SUM(M661:N661) -> 54.140000000000001
A662: 3716 | B662: EOL CURRAL DE PEDRAS II | C662: 21.544.255/0002-76 | D662: 66.840000000000003 | E662: 0 | F662: 0 | G662: 0 | H662: 0 | I662: 0 | J662: 0 | K662: 73.650000000000006 | L662: 0 | M662: =SUM(J662:L662)-6.81 -> 66.840000000000003 | N662: 6.8099999999999996 | O662: =SUM(M662:N662) -> 73.650000000000006
A663: 3717 | B663: EOL DIAMANTE II | C663: 21.544.216/0002-79 | D663: 42.479999999999997 | E663: 0 | F663: 0 | G663: 0 | H663: 0 | I663: 0 | J663: 0 | K663: 46.810000000000002 | L663: 0 | M663: =SUM(J663:L663)-4.33 -> 42.480000000000004 | N663: 4.3300000000000001 | O663: =SUM(M663:N663) -> 46.810000000000002
A664: 3718 | B664: EOL DIAMANTE III | C664: 21.543.994/0002-43 | D664: 43.119999999999997 | E664: 0 | F664: 0 | G664: 0 | H664: 0 | I664: 0 | J664: 0 | K664: 47.520000000000003 | L664: 0 | M664: =SUM(J664:L664)-4.4 -> 43.120000000000005 | N664: 4.4000000000000004 | O664: =SUM(M664:N664) -> 47.520000000000003
A665: 3719 | B665: EOL LARANJEIRAS I | C665: 21.544.025/0002-07 | D665: 68.469999999999999 | E665: 0 | F665: 0 | G665: 0 | H665: 0 | I665: 0 | J665: 0 | K665: 75.450000000000003 | L665: 0 | M665: =SUM(J665:L665)-6.98 -> 68.469999999999999 | N665: 6.9800000000000004 | O665: =SUM(M665:N665) -> 75.450000000000003
A666: 3720 | B666: EOL LARANJEIRAS II | C666: 21.544.159/0002-28 | D666: 74.019999999999996 | E666: 0 | F666: 0 | G666: 0 | H666: 0 | I666: 0 | J666: 0 | K666: 81.560000000000002 | L666: 0 | M666: =SUM(J666:L666)-7.54 -> 74.019999999999996 | N666: 7.54 | O666: =SUM(M666:N666) -> 81.560000000000002
A667: 3721 | B667: EOL LARANJEIRAS V | C667: 21.544.060/0002-26 | D667: 61.789999999999999 | E667: 0 | F667: 0 | G667: 0 | H667: 0 | I667: 0 | J667: 0 | K667: 68.090000000000003 | L667: 0 | M667: =SUM(J667:L667)-6.3 -> 61.790000000000006 | N667: 6.2999999999999998 | O667: =SUM(M667:N667) -> 68.090000000000003
A668: 3722 | B668: UFV FLORESTA I | C668: 23.741.570/0001-38 | D668: 22.359999999999999 | E668: 0 | F668: 0 | G668: 0 | H668: 0 | I668: 0 | J668: 0 | K668: 24.640000000000001 | L668: 0 | M668: =SUM(J668:L668)-2.28 -> 22.359999999999999 | N668: 2.2799999999999998 | O668: =SUM(M668:N668) -> 24.640000000000001
A669: 3723 | B669: UFV FLORESTA II | C669: 23.741.520/0001-50 | D669: 22.359999999999999 | E669: 0 | F669: 0 | G669: 0 | H669: 0 | I669: 0 | J669: 0 | K669: 24.640000000000001 | L669: 0 | M669: =SUM(J669:L669)-2.28 -> 22.359999999999999 | N669: 2.2799999999999998 | O669: =SUM(M669:N669) -> 24.640000000000001
A670: 3724 | B670: UFV FLORESTA III | C670: 23.723.730/0001-16 | D670: 15.119999999999999 | E670: 0 | F670: 0 | G670: 0 | H670: 0 | I670: 0 | J670: 0 | K670: 16.66 | L670: 0 | M670: =SUM(J670:L670)-1.54 -> 15.120000000000001 | N670: 1.54 | O670: =SUM(M670:N670) -> 16.66
A671: 3725 | B671: UHE SAO MANOEL | C671: 18.494.537/0004-63 | D671: 4167.5600000000004 | E671: 0 | F671: 0 | G671: 0 | H671: 0 | I671: 0 | J671: 0 | K671: 4592.3500000000004 | L671: 0 | M671: =SUM(J671:L671)-424.79 -> 4167.5600000000004 | N671: 424.79000000000002 | O671: =SUM(M671:N671) -> 4592.3500000000004
A672: 3726 | B672: EOL VENTOS DE SÃO VICENTE 10 | C672: 21.840.567/0001-46 | D672: 54.100000000000001 | E672: 0 | F672: 0 | G672: 0 | H672: 0 | I672: 0 | J672: 0 | K672: 59.609999999999999 | L672: 0 | M672: =SUM(J672:L672)-5.51 -> 54.100000000000001 | N672: 5.5099999999999998 | O672: =SUM(M672:N672) -> 59.609999999999999
A673: 3727 | B673: EOL VENTOS DE SÃO VICENTE 09 | C673: 21.716.502/0001-93 | D673: 54.159999999999997 | E673: 0 | F673: 0 | G673: 0 | H673: 0 | I673: 0 | J673: 0 | K673: 59.68 | L673: 0 | M673: =SUM(J673:L673)-5.52 -> 54.159999999999997 | N673: 5.5199999999999996 | O673: =SUM(M673:N673) -> 59.679999999999993
A674: 3728 | B674: EOL GARROTE | C674: 10.272.489/0001-04 | D674: 47.030000000000001 | E674: 0 | F674: 0 | G674: 0 | H674: 0 | I674: 0 | J674: 0 | K674: 51.82 | L674: 0 | M674: =SUM(J674:L674)-4.79 -> 47.030000000000001 | N674: 4.79 | O674: =SUM(M674:N674) -> 51.82
A675: 3729 | B675: EOL SANTO INÁCIO III | C675: 12.009.141/0001-54 | D675: 60.159999999999997 | E675: 0 | F675: 0 | G675: 0 | H675: 0 | I675: 0 | J675: 0 | K675: 66.290000000000006 | L675: 0 | M675: =SUM(J675:L675)-6.13 -> 60.160000000000004 | N675: 6.1299999999999999 | O675: =SUM(M675:N675) -> 66.290000000000006
A676: 3730 | B676: EOL SANTO INÁCIO IV | C676: 11.738.349/0001-41 | D676: 47.369999999999997 | E676: 0 | F676: 0 | G676: 0 | H676: 0 | I676: 0 | J676: 0 | K676: 52.200000000000003 | L676: 0 | M676: =SUM(J676:L676)-4.83 -> 47.370000000000005 | N676: 4.8300000000000001 | O676: =SUM(M676:N676) -> 52.200000000000003
A677: 3731 | B677: EOL SÃO RAIMUNDO | C677: 10.408.112/0001-30 | D677: 47.43 | E677: 0 | F677: 0 | G677: 0 | H677: 0 | I677: 0 | J677: 0 | K677: 52.259999999999998 | L677: 0 | M677: =SUM(J677:L677)-4.83 -> 47.43 | N677: 4.8300000000000001 | O677: =SUM(M677:N677) -> 52.259999999999998
A678: 3732 | B678: UHE SINOP | C678: 19.527.586/0001-75 | D678: 2224.6300000000001 | E678: 0 | F678: 0 | G678: 0 | H678: 0 | I678: 0 | J678: 0 | K678: 2451.3800000000001 | L678: 0 | M678: =SUM(J678:L678)-226.75 -> 2224.6300000000001 | N678: 226.75 | O678: =SUM(M678:N678) -> 2451.3800000000001
A679: 3733 | B679: EOL AVENTURA I | C679: 19.980.957/0002-50 | D679: 61.789999999999999 | E679: 0 | F679: 0 | G679: 0 | H679: 0 | I679: 0 | J679: 0 | K679: 68.090000000000003 | L679: 0 | M679: =SUM(J679:L679)-6.3 -> 61.790000000000006 | N679: 6.2999999999999998 | O679: =SUM(M679:N679) -> 68.090000000000003
A680: 3734 | B680: EOL MORRO DO CHAPÉU I | C680: 21.868.992/0003-05 | D680: 127.18000000000001 | E680: 0 | F680: 0 | G680: 0 | H680: 0 | I680: 0 | J680: 0 | K680: 140.13999999999999 | L680: 0 | M680: =SUM(J680:L680)-12.96 -> 127.17999999999998 | N680: 12.960000000000001 | O680: =SUM(M680:N680) -> 140.13999999999999
A681: 3735 | B681: EOL MORRO DO CHAPÉU II | C681: 21.869.008/0003-20 | D681: 122.87 | E681: 0 | F681: 0 | G681: 0 | H681: 0 | I681: 0 | J681: 0 | K681: 135.38999999999999 | L681: 0 | M681: =SUM(J681:L681)-12.52 -> 122.86999999999999 | N681: 12.52 | O681: =SUM(M681:N681) -> 135.38999999999999
A682: 3736 | B682: EOL BOA VISTA DA LAGOINHA | C682: 21.996.671/0003-96 | D682: 67.989999999999995 | E682: 0 | F682: 0 | G682: 0 | H682: 0 | I682: 0 | J682: 0 | K682: 74.920000000000002 | L682: 0 | M682: =SUM(J682:L682)-6.93 -> 67.990000000000009 | N682: 6.9299999999999997 | O682: =SUM(M682:N682) -> 74.920000000000016
A683: 3737 | B683: EOL VENTOS DE SANTO ABRAÃO | C683: 21.869.030/0003-70 | D683: 63.439999999999998 | E683: 0 | F683: 0 | G683: 0 | H683: 0 | I683: 0 | J683: 0 | K683: 69.909999999999997 | L683: 0 | M683: =SUM(J683:L683)-6.47 -> 63.439999999999998 | N683: 6.4699999999999998 | O683: =SUM(M683:N683) -> 69.909999999999997
A684: 3738 | B684: EOL CABEÇO VERMELHO | C684: 20.024.563/0001-27 | D684: 59.159999999999997 | E684: 0 | F684: 0 | G684: 0 | H684: 0 | I684: 0 | J684: 0 | K684: 65.189999999999998 | L684: 0 | M684: =SUM(J684:L684)-6.03 -> 59.159999999999997 | N684: 6.0300000000000002 | O684: =SUM(M684:N684) -> 65.189999999999998
A685: 3739 | B685: EOL CABEÇO VERMELHO II | C685: 20.024.516/0001-83 | D685: 35 | E685: 0 | F685: 0 | G685: 0 | H685: 0 | I685: 0 | J685: 0 | K685: 38.57 | L685: 0 | M685: =SUM(J685:L685)-3.57 -> 35 | N685: 3.5699999999999998 | O685: =SUM(M685:N685) -> 38.57
A686: 3740 | B686: UFV COREMAS I | C686: 14.285.232/0001-48 | D686: 43.57 | E686: 0 | F686: 0 | G686: 0 | H686: 0 | I686: 0 | J686: 0 | K686: 48.009999999999998 | L686: 0 | M686: =SUM(J686:L686)-4.44 -> 43.57 | N686: 4.4400000000000004 | O686: =SUM(M686:N686) -> 48.009999999999998
A687: 3741 | B687: UFV COREMAS II | C687: 14.285.242/0001-83 | D687: 38.68 | E687: 0 | F687: 0 | G687: 0 | H687: 0 | I687: 0 | J687: 0 | K687: 42.619999999999997 | L687: 0 | M687: =SUM(J687:L687)-3.94 -> 38.68 | N687: 3.9399999999999999 | O687: =SUM(M687:N687) -> 42.619999999999997
A688: 3742 | B688: UHE JAGUARA | C688: 28.925.264/0002-56 | D688: 2349.1599999999999 | E688: 0 | F688: 0 | G688: 0 | H688: 0 | I688: 0 | J688: 0 | K688: 2588.6100000000001 | L688: 0 | M688: =SUM(J688:L688)-239.45 -> 2349.1600000000003 | N688: 239.44999999999999 | O688: =SUM(M688:N688) -> 2588.6100000000001
A689: 3743 | B689: UHE VOLTA GRANDE | C689: 25.176.391/0002-01 | D689: 2317.5799999999999 | E689: 0 | F689: 0 | G689: 0 | H689: 0 | I689: 0 | J689: 0 | K689: 2553.8099999999999 | L689: 0 | M689: =SUM(J689:L689)-236.23 -> 2317.5799999999999 | N689: 236.22999999999999 | O689: =SUM(M689:N689) -> 2553.8099999999999
A690: 3744 | B690: UTE PROSPERIDADE I | C690: 23.857.764/0001-01 | D690: 83.579999999999998 | E690: 0 | F690: 0 | G690: 0 | H690: 0 | I690: 0 | J690: 0 | K690: 92.099999999999994 | L690: 0 | M690: =SUM(J690:L690)-8.52 -> 83.579999999999998 | N690: 8.5199999999999996 | O690: =SUM(M690:N690) -> 92.099999999999994
A691: 3745 | B691: CÉU AZUL (CONS. BAIXO IGUAÇU) | C691: 09.136.819/0002-36 | D691: 941.48000000000002 | E691: 0 | F691: 0 | G691: 0 | H691: 0 | I691: 0 | J691: 0 | K691: 1037.4400000000001 | L691: 0 | M691: =SUM(J691:L691)-95.96 -> 941.48000000000002 | N691: 95.959999999999994 | O691: =SUM(M691:N691) -> 1037.4400000000001
A692: 3746 | B692: EOL SERRA DA BABILÔNIA II | C692: 24.263.234/0002-70 | D692: 61.799999999999997 | E692: 0 | F692: 0 | G692: 0 | H692: 0 | I692: 0 | J692: 0 | K692: 68.099999999999994 | L692: 0 | M692: =SUM(J692:L692)-6.3 -> 61.799999999999997 | N692: 6.2999999999999998 | O692: =SUM(M692:N692) -> 68.099999999999994
A693: 3747 | B693: EOL SERRA DA BABILÔNIA VI | C693: 24.325.137/0002-65 | D693: 56.630000000000003 | E693: 0 | F693: 0 | G693: 0 | H693: 0 | I693: 0 | J693: 0 | K693: 62.399999999999999 | L693: 0 | M693: =SUM(J693:L693)-5.77 -> 56.629999999999995 | N693: 5.7699999999999996 | O693: =SUM(M693:N693) -> 62.399999999999991
A694: 3748 | B694: DIAMANTE | C694: 27.093.977/0002-38 | D694: 2035.8800000000001 | E694: 0 | F694: 0 | G694: 0 | H694: 0 | I694: 0 | J694: 0 | K694: 2243.3899999999999 | L694: 0 | M694: =SUM(J694:L694)-207.51 -> 2035.8799999999999 | N694: 207.50999999999999 | O694: =SUM(M694:N694) -> 2243.3899999999999
A695: 3749 | B695: UHE SÃO SIMÃO | C695: 27.352.303/0002-00 | D695: 10706.459999999999 | E695: 0 | F695: 0 | G695: 0 | H695: 0 | I695: 0 | J695: 0 | K695: 11797.75 | L695: 0 | M695: =SUM(J695:L695)-1091.29 -> 10706.459999999999 | N695: 1091.29 | O695: =SUM(M695:N695) -> 11797.75
A696: 3750 | B696: UFV COREMAS III | C696: 24.342.513/0001-49 | D696: 44.850000000000001 | E696: 0 | F696: 0 | G696: 0 | H696: 0 | I696: 0 | J696: 0 | K696: 49.420000000000002 | L696: 0 | M696: =SUM(J696:L696)-4.57 -> 44.850000000000001 | N696: 4.5700000000000003 | O696: =SUM(M696:N696) -> 49.420000000000002
A697: 3751 | B697: EOL CAMPO LARGO I | C697: 16.756.565/0002-14 | D697: 84.230000000000004 | E697: 0 | F697: 0 | G697: 0 | H697: 0 | I697: 0 | J697: 0 | K697: 92.819999999999993 | L697: 0 | M697: =SUM(J697:L697)-8.59 -> 84.22999999999999 | N697: 8.5899999999999999 | O697: =SUM(M697:N697) -> 92.819999999999993
A698: 3752 | B698: EOL CAMPO LARGO III | C698: 16.755.810/0002-79 | D698: 66.829999999999998 | E698: 0 | F698: 0 | G698: 0 | H698: 0 | I698: 0 | J698: 0 | K698: 73.640000000000001 | L698: 0 | M698: =SUM(J698:L698)-6.81 -> 66.829999999999998 | N698: 6.8099999999999996 | O698: =SUM(M698:N698) -> 73.640000000000001
A699: 3753 | B699: EOL CAMPO LARGO IV | C699: 16.756.341/0002-02 | D699: 66.829999999999998 | E699: 0 | F699: 0 | G699: 0 | H699: 0 | I699: 0 | J699: 0 | K699: 73.640000000000001 | L699: 0 | M699: =SUM(J699:L699)-6.81 -> 66.829999999999998 | N699: 6.8099999999999996 | O699: =SUM(M699:N699) -> 73.640000000000001
A700: 3754 | B700: EOL CAMPO LARGO VII | C700: 16.757.011/0002-31 | D700: 66.829999999999998 | E700: 0 | F700: 0 | G700: 0 | H700: 0 | I700: 0 | J700: 0 | K700: 73.640000000000001 | L700: 0 | M700: =SUM(J700:L700)-6.81 -> 66.829999999999998 | N700: 6.8099999999999996 | O700: =SUM(M700:N700) -> 73.640000000000001
A701: 3755 | B701: EOL AURA LAGOA DO BARRO 07 | C701: 21.959.329/0002-35 | D701: 57.369999999999997 | E701: 0 | F701: 0 | G701: 0 | H701: 0 | I701: 0 | J701: 0 | K701: 63.219999999999999 | L701: 0 | M701: =SUM(J701:L701)-5.85 -> 57.369999999999997 | N701: 5.8499999999999996 | O701: =SUM(M701:N701) -> 63.219999999999999
A702: 3756 | B702: EOL AURA QUEIMADA NOVA 03 | C702: 21.959.361/0002-10 | D702: 19.079999999999998 | E702: 0 | F702: 0 | G702: 0 | H702: 0 | I702: 0 | J702: 0 | K702: 21.02 | L702: 0 | M702: =SUM(J702:L702)-1.94 -> 19.079999999999998 | N702: 1.9399999999999999 | O702: =SUM(M702:N702) -> 21.02
A703: 3757 | B703: EOL VENTOS DA SANTA BEATRIZ | C703: 13.346.161/0002-64 | D703: 58.810000000000002 | E703: 0 | F703: 0 | G703: 0 | H703: 0 | I703: 0 | J703: 0 | K703: 64.799999999999997 | L703: 0 | M703: =SUM(J703:L703)-5.99 -> 58.809999999999995 | N703: 5.9900000000000002 | O703: =SUM(M703:N703) -> 64.799999999999997
A704: 3758 | B704: EOL VENTOS DE SANTA APARECIDA | C704: 13.346.095/0002-22 | D704: 59.759999999999998 | E704: 0 | F704: 0 | G704: 0 | H704: 0 | I704: 0 | J704: 0 | K704: 65.849999999999994 | L704: 0 | M704: =SUM(J704:L704)-6.09 -> 59.759999999999991 | N704: 6.0899999999999999 | O704: =SUM(M704:N704) -> 65.849999999999994
A705: 3759 | B705: EOL VENTOS DE SANTA AURORA | C705: 13.346.039/0002-98 | D705: 59.369999999999997 | E705: 0 | F705: 0 | G705: 0 | H705: 0 | I705: 0 | J705: 0 | K705: 65.420000000000002 | L705: 0 | M705: =SUM(J705:L705)-6.05 -> 59.370000000000005 | N705: 6.0499999999999998 | O705: =SUM(M705:N705) -> 65.420000000000002
A706: 3760 | B706: EOL VENTOS DE SANTA EMILIA | C706: 13.346.108/0002-63 | D706: 61.600000000000001 | E706: 0 | F706: 0 | G706: 0 | H706: 0 | I706: 0 | J706: 0 | K706: 67.879999999999995 | L706: 0 | M706: =SUM(J706:L706)-6.28 -> 61.599999999999994 | N706: 6.2800000000000002 | O706: =SUM(M706:N706) -> 67.879999999999995
A707: 3761 | B707: EOL VENTOS DE SÃO GABRIEL | C707: 13.346.102/0002-96 | D707: 58.689999999999998 | E707: 0 | F707: 0 | G707: 0 | H707: 0 | I707: 0 | J707: 0 | K707: 64.670000000000002 | L707: 0 | M707: =SUM(J707:L707)-5.98 -> 58.689999999999998 | N707: 5.9800000000000004 | O707: =SUM(M707:N707) -> 64.670000000000002
A708: 3762 | B708: EOL SERRA DA BABILÔNIA X | C708: 24.263.312/0002-37 | D708: 61.780000000000001 | E708: 0 | F708: 0 | G708: 0 | H708: 0 | I708: 0 | J708: 0 | K708: 68.079999999999998 | L708: 0 | M708: =SUM(J708:L708)-6.3 -> 61.780000000000001 | N708: 6.2999999999999998 | O708: =SUM(M708:N708) -> 68.079999999999998
A709: 3763 | B709: EOL SERRA DA BABILÔNIA XI | C709: 24.263.070/0002-81 | D709: 61.789999999999999 | E709: 0 | F709: 0 | G709: 0 | H709: 0 | I709: 0 | J709: 0 | K709: 68.090000000000003 | L709: 0 | M709: =SUM(J709:L709)-6.3 -> 61.790000000000006 | N709: 6.2999999999999998 | O709: =SUM(M709:N709) -> 68.090000000000003
A710: 3764 | B710: EOL SERRA DA BABILÔNIA VII | C710: 24.325.076/0002-36 | D710: 61.780000000000001 | E710: 0 | F710: 0 | G710: 0 | H710: 0 | I710: 0 | J710: 0 | K710: 68.079999999999998 | L710: 0 | M710: =SUM(J710:L710)-6.3 -> 61.780000000000001 | N710: 6.2999999999999998 | O710: =SUM(M710:N710) -> 68.079999999999998
A711: 3765 | B711: EOL VENTOS DA BAHIA I | C711: 23.888.783/0001-97 | D711: 62.68 | E711: 0 | F711: 0 | G711: 0 | H711: 0 | I711: 0 | J711: 0 | K711: 69.069999999999993 | L711: 0 | M711: =SUM(J711:L711)-6.39 -> 62.679999999999993 | N711: 6.3899999999999997 | O711: =SUM(M711:N711) -> 69.069999999999993
A712: 3766 | B712: EOL VENTOS DA BAHIA III | C712: 23.888.824/0001-45 | D712: 67.5 | E712: 0 | F712: 0 | G712: 0 | H712: 0 | I712: 0 | J712: 0 | K712: 74.379999999999995 | L712: 0 | M712: =SUM(J712:L712)-6.88 -> 67.5 | N712: 6.8799999999999999 | O712: =SUM(M712:N712) -> 74.379999999999995
A713: 3767 | B713: EOL VENTOS DA BAHIA IX | C713: 23.890.926/0001-03 | D713: 62.68 | E713: 0 | F713: 0 | G713: 0 | H713: 0 | I713: 0 | J713: 0 | K713: 69.069999999999993 | L713: 0 | M713: =SUM(J713:L713)-6.39 -> 62.679999999999993 | N713: 6.3899999999999997 | O713: =SUM(M713:N713) -> 69.069999999999993
A714: 3768 | B714: EOL VENTOS DA BAHIA XVIII | C714: 23.888.804/0001-74 | D714: 62.659999999999997 | E714: 0 | F714: 0 | G714: 0 | H714: 0 | I714: 0 | J714: 0 | K714: 69.049999999999997 | L714: 0 | M714: =SUM(J714:L714)-6.39 -> 62.659999999999997 | N714: 6.3899999999999997 | O714: =SUM(M714:N714) -> 69.049999999999997
A715: 3769 | B715: EOL SÃO BENTO DO NORTE I | C715: 21.216.892/0001-32 | D715: 47.060000000000002 | E715: 0 | F715: 0 | G715: 0 | H715: 0 | I715: 0 | J715: 0 | K715: 51.859999999999999 | L715: 0 | M715: =SUM(J715:L715)-4.8 -> 47.060000000000002 | N715: 4.7999999999999998 | O715: =SUM(M715:N715) -> 51.859999999999999
A716: 3770 | B716: EOL SÃO BENTO DO NORTE II | C716: 21.216.877/0001-94 | D716: 46.950000000000003 | E716: 0 | F716: 0 | G716: 0 | H716: 0 | I716: 0 | J716: 0 | K716: 51.740000000000002 | L716: 0 | M716: =SUM(J716:L716)-4.79 -> 46.950000000000003 | N716: 4.79 | O716: =SUM(M716:N716) -> 51.740000000000002
A717: 3771 | B717: EOL SÃO MIGUEL I | C717: 21.216.915/0001-09 | D717: 42.350000000000001 | E717: 0 | F717: 0 | G717: 0 | H717: 0 | I717: 0 | J717: 0 | K717: 46.670000000000002 | L717: 0 | M717: =SUM(J717:L717)-4.32 -> 42.350000000000001 | N717: 4.3200000000000003 | O717: =SUM(M717:N717) -> 46.670000000000002
A718: 3772 | B718: EOL SÃO MIGUEL II | C718: 21.216.925/0001-44 | D718: 42.350000000000001 | E718: 0 | F718: 0 | G718: 0 | H718: 0 | I718: 0 | J718: 0 | K718: 46.670000000000002 | L718: 0 | M718: =SUM(J718:L718)-4.32 -> 42.350000000000001 | N718: 4.3200000000000003 | O718: =SUM(M718:N718) -> 46.670000000000002
A719: 3773 | B719: EOL SÃO MIGUEL III | C719: 21.216.439/0001-26 | D719: 42.399999999999999 | E719: 0 | F719: 0 | G719: 0 | H719: 0 | I719: 0 | J719: 0 | K719: 46.719999999999999 | L719: 0 | M719: =SUM(J719:L719)-4.32 -> 42.399999999999999 | N719: 4.3200000000000003 | O719: =SUM(M719:N719) -> 46.719999999999999
A720: 3774 | B720: EOL SÃO BENTO DO NORTE III | C720: 21.216.857/0001-13 | D720: 46.689999999999998 | E720: 0 | F720: 0 | G720: 0 | H720: 0 | I720: 0 | J720: 0 | K720: 51.450000000000003 | L720: 0 | M720: =SUM(J720:L720)-4.76 -> 46.690000000000005 | N720: 4.7599999999999998 | O720: =SUM(M720:N720) -> 51.450000000000003
A721: 3775 | B721: EOL CAMPO LARGO XVI | C721: 17.828.934/0002-08 | D721: 84.560000000000002 | E721: 0 | F721: 0 | G721: 0 | H721: 0 | I721: 0 | J721: 0 | K721: 93.180000000000007 | L721: 0 | M721: =SUM(J721:L721)-8.62 -> 84.560000000000002 | N721: 8.6199999999999992 | O721: =SUM(M721:N721) -> 93.180000000000007
A722: 3776 | B722: EOL SERRA DA BABILÔNIA IX | C722: 24.263.209/0002-97 | D722: 61.780000000000001 | E722: 0 | F722: 0 | G722: 0 | H722: 0 | I722: 0 | J722: 0 | K722: 68.079999999999998 | L722: 0 | M722: =SUM(J722:L722)-6.3 -> 61.780000000000001 | N722: 6.2999999999999998 | O722: =SUM(M722:N722) -> 68.079999999999998
A723: 3777 | B723: EOL SERRA DA BABILÔNIA XII | C723: 24.263.276/0002-01 | D723: 61.789999999999999 | E723: 0 | F723: 0 | G723: 0 | H723: 0 | I723: 0 | J723: 0 | K723: 68.090000000000003 | L723: 0 | M723: =SUM(J723:L723)-6.3 -> 61.790000000000006 | N723: 6.2999999999999998 | O723: =SUM(M723:N723) -> 68.090000000000003
A724: 3778 | B724: EOL AURA LAGOA DO BARRO 01 | C724: 21.951.779/0002-81 | D724: 57.369999999999997 | E724: 0 | F724: 0 | G724: 0 | H724: 0 | I724: 0 | J724: 0 | K724: 63.219999999999999 | L724: 0 | M724: =SUM(J724:L724)-5.85 -> 57.369999999999997 | N724: 5.8499999999999996 | O724: =SUM(M724:N724) -> 63.219999999999999
A725: 3779 | B725: EOL GOIABEIRA | C725: 15.321.064/0001-61 | D725: 3.4700000000000002 | E725: 0 | F725: 0 | G725: 0 | H725: 0 | I725: 0 | J725: 0 | K725: 3.8199999999999998 | L725: 0 | M725: =SUM(J725:L725)-0.35 -> 3.4699999999999998 | N725: 0.34999999999999998 | O725: =SUM(M725:N725) -> 3.8199999999999998
A726: 3781 | B726: EOL SANTA CATARINA | C726: 15.321.146/0001-06 | D726: 4.4400000000000004 | E726: 0 | F726: 0 | G726: 0 | H726: 0 | I726: 0 | J726: 0 | K726: 4.8899999999999997 | L726: 0 | M726: =SUM(J726:L726)-0.45 -> 4.4399999999999995 | N726: 0.45000000000000001 | O726: =SUM(M726:N726) -> 4.8899999999999997
A727: 3783 | B727: EOL VENTOS DE HORIZONTE | C727: 15.253.350/0001-37 | D727: 3.3799999999999999 | E727: 0 | F727: 0 | G727: 0 | H727: 0 | I727: 0 | J727: 0 | K727: 3.7200000000000002 | L727: 0 | M727: =SUM(J727:L727)-0.34 -> 3.3800000000000003 | N727: 0.34000000000000002 | O727: =SUM(M727:N727) -> 3.7200000000000002
A728: 3784 | B728: EOL AURA LAGOA DO BARRO 02 | C728: 21.951.809/0002-50 | D728: 57.369999999999997 | E728: 0 | F728: 0 | G728: 0 | H728: 0 | I728: 0 | J728: 0 | K728: 63.219999999999999 | L728: 0 | M728: =SUM(J728:L728)-5.85 -> 57.369999999999997 | N728: 5.8499999999999996 | O728: =SUM(M728:N728) -> 63.219999999999999
A729: 3785 | B729: EOL AURA LAGOA DO BARRO 05 | C729: 21.949.390/0002-00 | D729: 50.960000000000001 | E729: 0 | F729: 0 | G729: 0 | H729: 0 | I729: 0 | J729: 0 | K729: 56.149999999999999 | L729: 0 | M729: =SUM(J729:L729)-5.19 -> 50.960000000000001 | N729: 5.1900000000000004 | O729: =SUM(M729:N729) -> 56.149999999999999
A730: 3786 | B730: UFV APODI I | C730: 24.424.331/0001-17 | D730: 52.770000000000003 | E730: 0 | F730: 0 | G730: 0 | H730: 0 | I730: 0 | J730: 0 | K730: 58.149999999999999 | L730: 0 | M730: =SUM(J730:L730)-5.38 -> 52.769999999999996 | N730: 5.3799999999999999 | O730: =SUM(M730:N730) -> 58.149999999999999
A731: 3787 | B731: UFV APODI II | C731: 24.424.175/0001-94 | D731: 52.770000000000003 | E731: 0 | F731: 0 | G731: 0 | H731: 0 | I731: 0 | J731: 0 | K731: 58.149999999999999 | L731: 0 | M731: =SUM(J731:L731)-5.38 -> 52.769999999999996 | N731: 5.3799999999999999 | O731: =SUM(M731:N731) -> 58.149999999999999
A732: 3788 | B732: UFV APODI III | C732: 24.424.233/0001-80 | D732: 52.770000000000003 | E732: 0 | F732: 0 | G732: 0 | H732: 0 | I732: 0 | J732: 0 | K732: 58.149999999999999 | L732: 0 | M732: =SUM(J732:L732)-5.38 -> 52.769999999999996 | N732: 5.3799999999999999 | O732: =SUM(M732:N732) -> 58.149999999999999
A733: 3789 | B733: UFV APODI IV | C733: 24.424.369/0001-90 | D733: 52.770000000000003 | E733: 0 | F733: 0 | G733: 0 | H733: 0 | I733: 0 | J733: 0 | K733: 58.149999999999999 | L733: 0 | M733: =SUM(J733:L733)-5.38 -> 52.769999999999996 | N733: 5.3799999999999999 | O733: =SUM(M733:N733) -> 58.149999999999999
A734: 3790 | B734: EOL BOA ESPERANÇA I | C734: 21.909.323/0001-72 | D734: 61.409999999999997 | E734: 0 | F734: 0 | G734: 0 | H734: 0 | I734: 0 | J734: 0 | K734: 67.670000000000002 | L734: 0 | M734: =SUM(J734:L734)-6.26 -> 61.410000000000004 | N734: 6.2599999999999998 | O734: =SUM(M734:N734) -> 67.670000000000002
A735: 3791 | B735: EOL SERRA DA BABILÔNIA VIII | C735: 24.263.248/0002-94 | D735: 61.780000000000001 | E735: 0 | F735: 0 | G735: 0 | H735: 0 | I735: 0 | J735: 0 | K735: 68.079999999999998 | L735: 0 | M735: =SUM(J735:L735)-6.3 -> 61.780000000000001 | N735: 6.2999999999999998 | O735: =SUM(M735:N735) -> 68.079999999999998
A736: 3792 | B736: EOL AURA LAGOA DO BARRO 06 | C736: 21.959.389/0002-58 | D736: 57.369999999999997 | E736: 0 | F736: 0 | G736: 0 | H736: 0 | I736: 0 | J736: 0 | K736: 63.219999999999999 | L736: 0 | M736: =SUM(J736:L736)-5.85 -> 57.369999999999997 | N736: 5.8499999999999996 | O736: =SUM(M736:N736) -> 63.219999999999999
A737: 3793 | B737: EOL CAMPO LARGO V | C737: 16.757.107/0002-08 | D737: 66.829999999999998 | E737: 0 | F737: 0 | G737: 0 | H737: 0 | I737: 0 | J737: 0 | K737: 73.640000000000001 | L737: 0 | M737: =SUM(J737:L737)-6.81 -> 66.829999999999998 | N737: 6.8099999999999996 | O737: =SUM(M737:N737) -> 73.640000000000001
A738: 3794 | B738: EOL CAMPO LARGO VI | C738: 16.756.943/0002-60 | D738: 66.829999999999998 | E738: 0 | F738: 0 | G738: 0 | H738: 0 | I738: 0 | J738: 0 | K738: 73.640000000000001 | L738: 0 | M738: =SUM(J738:L738)-6.81 -> 66.829999999999998 | N738: 6.8099999999999996 | O738: =SUM(M738:N738) -> 73.640000000000001
A739: 3795 | B739: EOL CAMPO LARGO XVIII | C739: 17.889.739/0002-80 | D739: 84.230000000000004 | E739: 0 | F739: 0 | G739: 0 | H739: 0 | I739: 0 | J739: 0 | K739: 92.819999999999993 | L739: 0 | M739: =SUM(J739:L739)-8.59 -> 84.22999999999999 | N739: 8.5899999999999999 | O739: =SUM(M739:N739) -> 92.819999999999993
A740: 3796 | B740: EOL CAMPO LARGO XXI | C740: 17.878.526/0002-52 | D740: 66.840000000000003 | E740: 0 | F740: 0 | G740: 0 | H740: 0 | I740: 0 | J740: 0 | K740: 73.650000000000006 | L740: 0 | M740: =SUM(J740:L740)-6.81 -> 66.840000000000003 | N740: 6.8099999999999996 | O740: =SUM(M740:N740) -> 73.650000000000006
A741: 3797 | B741: EOL AURA LAGOA DO BARRO 03 | C741: 21.951.750/0002-08 | D741: 57.369999999999997 | E741: 0 | F741: 0 | G741: 0 | H741: 0 | I741: 0 | J741: 0 | K741: 63.219999999999999 | L741: 0 | M741: =SUM(J741:L741)-5.85 -> 57.369999999999997 | N741: 5.8499999999999996 | O741: =SUM(M741:N741) -> 63.219999999999999
A742: 3798 | B742: EOL AURA LAGOA DO BARRO 04 | C742: 21.951.831/0002-08 | D742: 57.369999999999997 | E742: 0 | F742: 0 | G742: 0 | H742: 0 | I742: 0 | J742: 0 | K742: 63.219999999999999 | L742: 0 | M742: =SUM(J742:L742)-5.85 -> 57.369999999999997 | N742: 5.8499999999999996 | O742: =SUM(M742:N742) -> 63.219999999999999
A743: 3799 | B743: UFV JUAZEIRO SOLAR I | C743: 24.302.618/0001-74 | D743: 63.100000000000001 | E743: 0 | F743: 0 | G743: 0 | H743: 0 | I743: 0 | J743: 0 | K743: 69.530000000000001 | L743: 0 | M743: =SUM(J743:L743)-6.43 -> 63.100000000000001 | N743: 6.4299999999999997 | O743: =SUM(M743:N743) -> 69.530000000000001
A744: 3800 | B744: UFV JUAZEIRO SOLAR II | C744: 24.227.619/0001-00 | D744: 63.100000000000001 | E744: 0 | F744: 0 | G744: 0 | H744: 0 | I744: 0 | J744: 0 | K744: 69.530000000000001 | L744: 0 | M744: =SUM(J744:L744)-6.43 -> 63.100000000000001 | N744: 6.4299999999999997 | O744: =SUM(M744:N744) -> 69.530000000000001
A745: 3801 | B745: UFV JUAZEIRO SOLAR III | C745: 24.358.177/0001-22 | D745: 63.100000000000001 | E745: 0 | F745: 0 | G745: 0 | H745: 0 | I745: 0 | J745: 0 | K745: 69.530000000000001 | L745: 0 | M745: =SUM(J745:L745)-6.43 -> 63.100000000000001 | N745: 6.4299999999999997 | O745: =SUM(M745:N745) -> 69.530000000000001
A746: 3802 | B746: UFV JUAZEIRO SOLAR IV | C746: 24.168.509/0001-06 | D746: 63.100000000000001 | E746: 0 | F746: 0 | G746: 0 | H746: 0 | I746: 0 | J746: 0 | K746: 69.530000000000001 | L746: 0 | M746: =SUM(J746:L746)-6.43 -> 63.100000000000001 | N746: 6.4299999999999997 | O746: =SUM(M746:N746) -> 69.530000000000001
A747: 3803 | B747: EOL LARANJEIRAS III | C747: 21.816.037/0002-43 | D747: 57.890000000000001 | E747: 0 | F747: 0 | G747: 0 | H747: 0 | I747: 0 | J747: 0 | K747: 63.789999999999999 | L747: 0 | M747: =SUM(J747:L747)-5.9 -> 57.890000000000001 | N747: 5.9000000000000004 | O747: =SUM(M747:N747) -> 63.789999999999999
A748: 3804 | B748: EOL LARANJEIRAS IX | C748: 21.815.934/0002-32 | D748: 57.880000000000003 | E748: 0 | F748: 0 | G748: 0 | H748: 0 | I748: 0 | J748: 0 | K748: 63.780000000000001 | L748: 0 | M748: =SUM(J748:L748)-5.9 -> 57.880000000000003 | N748: 5.9000000000000004 | O748: =SUM(M748:N748) -> 63.780000000000001
A749: 3805 | B749: EOL DELTA 5 I | C749: 29.296.171/0002-72 | D749: 75.200000000000003 | E749: 0 | F749: 0 | G749: 0 | H749: 0 | I749: 0 | J749: 0 | K749: 82.870000000000005 | L749: 0 | M749: =SUM(J749:L749)-7.67 -> 75.200000000000003 | N749: 7.6699999999999999 | O749: =SUM(M749:N749) -> 82.870000000000005
A750: 3806 | B750: EOL DELTA 5 II | C750: 29.303.897/0002-95 | D750: 75.540000000000006 | E750: 0 | F750: 0 | G750: 0 | H750: 0 | I750: 0 | J750: 0 | K750: 83.239999999999995 | L750: 0 | M750: =SUM(J750:L750)-7.7 -> 75.539999999999992 | N750: 7.7000000000000002 | O750: =SUM(M750:N750) -> 83.239999999999995
A751: 3807 | B751: COPEL (CONS. BAIXO IGUAÇU) | C751: 04.370.282/0001-70 | D751: 403.49000000000001 | E751: 0 | F751: 0 | G751: 0 | H751: 0 | I751: 0 | J751: 0 | K751: 444.62 | L751: 0 | M751: =SUM(J751:L751)-41.13 -> 403.49000000000001 | N751: 41.130000000000003 | O751: =SUM(M751:N751) -> 444.62
A752: 3808 | B752: EOL CAMPO LARGO II | C752: 16.913.777/0002-68 | D752: 87.219999999999999 | E752: 0 | F752: 0 | G752: 0 | H752: 0 | I752: 0 | J752: 0 | K752: 96.109999999999999 | L752: 0 | M752: =SUM(J752:L752)-8.89 -> 87.219999999999999 | N752: 8.8900000000000006 | O752: =SUM(M752:N752) -> 96.109999999999999
A753: 3809 | B753: EOL CAMPO LARGO XV | C753: 17.928.199/0002-04 | D753: 84.230000000000004 | E753: 0 | F753: 0 | G753: 0 | H753: 0 | I753: 0 | J753: 0 | K753: 92.819999999999993 | L753: 0 | M753: =SUM(J753:L753)-8.59 -> 84.22999999999999 | N753: 8.5899999999999999 | O753: =SUM(M753:N753) -> 92.819999999999993
A754: 3810 | B754: EOL DELTA 6 I | C754: 29.296.141/0002-66 | D754: 82.730000000000004 | E754: 0 | F754: 0 | G754: 0 | H754: 0 | I754: 0 | J754: 0 | K754: 91.159999999999997 | L754: 0 | M754: =SUM(J754:L754)-8.43 -> 82.72999999999999 | N754: 8.4299999999999997 | O754: =SUM(M754:N754) -> 91.159999999999997
A755: 3811 | B755: EOL DELTA 6 II | C755: 29.296.975/0002-71 | D755: 67.680000000000007 | E755: 0 | F755: 0 | G755: 0 | H755: 0 | I755: 0 | J755: 0 | K755: 74.579999999999998 | L755: 0 | M755: =SUM(J755:L755)-6.9 -> 67.679999999999993 | N755: 6.9000000000000004 | O755: =SUM(M755:N755) -> 74.579999999999998
A756: 3812 | B756: EOL UMBURANAS 8 | C756: 20.168.405/0002-21 | D756: 49.439999999999998 | E756: 0 | F756: 0 | G756: 0 | H756: 0 | I756: 0 | J756: 0 | K756: 54.479999999999997 | L756: 0 | M756: =SUM(J756:L756)-5.04 -> 49.439999999999998 | N756: 5.04 | O756: =SUM(M756:N756) -> 54.479999999999997
A757: 3813 | B757: EOL UMBURANAS 11 | C757: 20.168.074/0002-20 | D757: 29.600000000000001 | E757: 0 | F757: 0 | G757: 0 | H757: 0 | I757: 0 | J757: 0 | K757: 32.619999999999997 | L757: 0 | M757: =SUM(J757:L757)-3.02 -> 29.599999999999998 | N757: 3.02 | O757: =SUM(M757:N757) -> 32.619999999999997
A758: 3814 | B758: EOL UMBURANAS 13 | C758: 20.168.462/0002-00 | D758: 39.799999999999997 | E758: 0 | F758: 0 | G758: 0 | H758: 0 | I758: 0 | J758: 0 | K758: 43.859999999999999 | L758: 0 | M758: =SUM(J758:L758)-4.06 -> 39.799999999999997 | N758: 4.0599999999999996 | O758: =SUM(M758:N758) -> 43.859999999999999
A759: 3815 | B759: EOL UMBURANAS 16 | C759: 20.168.152/0002-96 | D759: 49.710000000000001 | E759: 0 | F759: 0 | G759: 0 | H759: 0 | I759: 0 | J759: 0 | K759: 54.780000000000001 | L759: 0 | M759: =SUM(J759:L759)-5.07 -> 49.710000000000001 | N759: 5.0700000000000003 | O759: =SUM(M759:N759) -> 54.780000000000001
A760: 3816 | B760: EOL UMBURANAS 17 | C760: 20.168.158/0002-63 | D760: 51.520000000000003 | E760: 0 | F760: 0 | G760: 0 | H760: 0 | I760: 0 | J760: 0 | K760: 56.770000000000003 | L760: 0 | M760: =SUM(J760:L760)-5.25 -> 51.520000000000003 | N760: 5.25 | O760: =SUM(M760:N760) -> 56.770000000000003
A761: 3817 | B761: EOL UMBURANAS 18 | C761: 20.168.194/0002-27 | D761: 14.789999999999999 | E761: 0 | F761: 0 | G761: 0 | H761: 0 | I761: 0 | J761: 0 | K761: 16.300000000000001 | L761: 0 | M761: =SUM(J761:L761)-1.51 -> 14.790000000000001 | N761: 1.51 | O761: =SUM(M761:N761) -> 16.300000000000001
A762: 3818 | B762: EOL UMBURANAS 19 | C762: 20.168.112/0002-44 | D762: 56.890000000000001 | E762: 0 | F762: 0 | G762: 0 | H762: 0 | I762: 0 | J762: 0 | K762: 62.689999999999998 | L762: 0 | M762: =SUM(J762:L762)-5.8 -> 56.890000000000001 | N762: 5.7999999999999998 | O762: =SUM(M762:N762) -> 62.689999999999998
A763: 3819 | B763: EOL UMBURANAS 21 | C763: 20.168.743/0002-63 | D763: 51.200000000000003 | E763: 0 | F763: 0 | G763: 0 | H763: 0 | I763: 0 | J763: 0 | K763: 56.420000000000002 | L763: 0 | M763: =SUM(J763:L763)-5.22 -> 51.200000000000003 | N763: 5.2199999999999998 | O763: =SUM(M763:N763) -> 56.420000000000002
A764: 3820 | B764: EOL UMBURANAS 23 | C764: 20.168.788/0002-38 | D764: 34.25 | E764: 0 | F764: 0 | G764: 0 | H764: 0 | I764: 0 | J764: 0 | K764: 37.740000000000002 | L764: 0 | M764: =SUM(J764:L764)-3.49 -> 34.25 | N764: 3.4900000000000002 | O764: =SUM(M764:N764) -> 37.740000000000002
A765: 3821 | B765: EOL UMBURANAS 25 | C765: 19.281.805/0002-60 | D765: 39.780000000000001 | E765: 0 | F765: 0 | G765: 0 | H765: 0 | I765: 0 | J765: 0 | K765: 43.829999999999998 | L765: 0 | M765: =SUM(J765:L765)-4.05 -> 39.780000000000001 | N765: 4.0499999999999998 | O765: =SUM(M765:N765) -> 43.829999999999998
A766: 3822 | B766: UTE AMANDINA II | C766: 21.228.540/0001-05 | D766: 141.80000000000001 | E766: 0 | F766: 0 | G766: 0 | H766: 0 | I766: 0 | J766: 0 | K766: 156.25 | L766: 0 | M766: =SUM(J766:L766)-14.45 -> 141.80000000000001 | N766: 14.449999999999999 | O766: =SUM(M766:N766) -> 156.25
A767: 3823 | B767: EOL UMBURANAS 9 | C767: 20.168.824/0002-63 | D767: 34.560000000000002 | E767: 0 | F767: 0 | G767: 0 | H767: 0 | I767: 0 | J767: 0 | K767: 38.079999999999998 | L767: 0 | M767: =SUM(J767:L767)-3.52 -> 34.559999999999995 | N767: 3.52 | O767: =SUM(M767:N767) -> 38.079999999999998
A768: 3824 | B768: EOL UMBURANAS 10 | C768: 20.168.229/0002-28 | D768: 39.539999999999999 | E768: 0 | F768: 0 | G768: 0 | H768: 0 | I768: 0 | J768: 0 | K768: 43.57 | L768: 0 | M768: =SUM(J768:L768)-4.03 -> 39.539999999999999 | N768: 4.0300000000000002 | O768: =SUM(M768:N768) -> 43.57
A769: 3825 | B769: EOL UMBURANAS 5 | C769: 20.168.051/0002-15 | D769: 34.57 | E769: 0 | F769: 0 | G769: 0 | H769: 0 | I769: 0 | J769: 0 | K769: 38.090000000000003 | L769: 0 | M769: =SUM(J769:L769)-3.52 -> 34.57 | N769: 3.52 | O769: =SUM(M769:N769) -> 38.090000000000003
A770: 3826 | B770: EOL UMBURANAS 6 | C770: 20.168.283/0002-73 | D770: 39.539999999999999 | E770: 0 | F770: 0 | G770: 0 | H770: 0 | I770: 0 | J770: 0 | K770: 43.57 | L770: 0 | M770: =SUM(J770:L770)-4.03 -> 39.539999999999999 | N770: 4.0300000000000002 | O770: =SUM(M770:N770) -> 43.57
A771: 3827 | B771: UTE PAMPA SUL | C771: 04.739.720/0002-05 | D771: 1449.6600000000001 | E771: 0 | F771: 0 | G771: 0 | H771: 0 | I771: 0 | J771: 0 | K771: 1597.4200000000001 | L771: 0 | M771: =SUM(J771:L771)-147.76 -> 1449.6600000000001 | N771: 147.75999999999999 | O771: =SUM(M771:N771) -> 1597.4200000000001
A772: 3828 | B772: EOL UMBURANAS 3 | C772: 20.168.215/0002-04 | D772: 39.530000000000001 | E772: 0 | F772: 0 | G772: 0 | H772: 0 | I772: 0 | J772: 0 | K772: 43.560000000000002 | L772: 0 | M772: =SUM(J772:L772)-4.03 -> 39.530000000000001 | N772: 4.0300000000000002 | O772: =SUM(M772:N772) -> 43.560000000000002
A773: 3829 | B773: EOL UMBURANAS 15 | C773: 20.168.124/0002-79 | D773: 39.530000000000001 | E773: 0 | F773: 0 | G773: 0 | H773: 0 | I773: 0 | J773: 0 | K773: 43.560000000000002 | L773: 0 | M773: =SUM(J773:L773)-4.03 -> 39.530000000000001 | N773: 4.0300000000000002 | O773: =SUM(M773:N773) -> 43.560000000000002
A774: 3830 | B774: EOL UMBURANAS 1 | C774: 20.168.187/0002-25 | D774: 49.469999999999999 | E774: 0 | F774: 0 | G774: 0 | H774: 0 | I774: 0 | J774: 0 | K774: 54.509999999999998 | L774: 0 | M774: =SUM(J774:L774)-5.04 -> 49.469999999999999 | N774: 5.04 | O774: =SUM(M774:N774) -> 54.509999999999998
A775: 3831 | B775: EOL UMBURANAS 2 | C775: 20.168.242/0002-87 | D775: 49.469999999999999 | E775: 0 | F775: 0 | G775: 0 | H775: 0 | I775: 0 | J775: 0 | K775: 54.509999999999998 | L775: 0 | M775: =SUM(J775:L775)-5.04 -> 49.469999999999999 | N775: 5.04 | O775: =SUM(M775:N775) -> 54.509999999999998
A776: 3832 | B776: UHE COLÍDER | C776: 04.370.282/0003-31 | D776: 2890.4899999999998 | E776: 0 | F776: 0 | G776: 0 | H776: 0 | I776: 0 | J776: 0 | K776: 3185.1100000000001 | L776: 0 | M776: =SUM(J776:L776)-294.62 -> 2890.4900000000002 | N776: 294.62 | O776: =SUM(M776:N776) -> 3185.1100000000001
A777: 3833 | B777: UTE PORTO DE SERGIPE I | C777: 23.758.522/0001-52 | D777: 6731.29 | E777: 0 | F777: 0 | G777: 0 | H777: 0 | I777: 0 | J777: 0 | K777: 7417.3999999999996 | L777: 0 | M777: =SUM(J777:L777)-686.11 -> 6731.29 | N777: 686.11000000000001 | O777: =SUM(M777:N777) -> 7417.3999999999996
A778: 3834 | B778: EOL ZEUS II | C778: 25.174.955/0001-96 | D778: 91.799999999999997 | E778: 0 | F778: 0 | G778: 0 | H778: 0 | I778: 0 | J778: 0 | K778: 101.16 | L778: 0 | M778: =SUM(J778:L778)-9.36 -> 91.799999999999997 | N778: 9.3599999999999994 | O778: =SUM(M778:N778) -> 101.16
A779: 3835 | B779: PCH BANDEIRANTE | C779: 15.743.124/0002-15 | D779: 42.869999999999997 | E779: 0 | F779: 0 | G779: 0 | H779: 0 | I779: 0 | J779: 0 | K779: 47.240000000000002 | L779: 0 | M779: =SUM(J779:L779)-4.37 -> 42.870000000000005 | N779: 4.3700000000000001 | O779: =SUM(M779:N779) -> 47.240000000000002
A780: 3836 | B780: PCH AREADO | C780: 23.670.551/0002-49 | D780: 23.91 | E780: 0 | F780: 0 | G780: 0 | H780: 0 | I780: 0 | J780: 0 | K780: 26.350000000000001 | L780: 0 | M780: =SUM(J780:L780)-2.44 -> 23.91 | N780: 2.4399999999999999 | O780: =SUM(M780:N780) -> 26.350000000000001
A781: 3840 | B781: EOL DELTA 7 I | C781: 30.866.542/0002-93 | D781: 60.5 | E781: 0 | F781: 0 | G781: 0 | H781: 0 | I781: 0 | J781: 0 | K781: 66.670000000000002 | L781: 0 | M781: =SUM(J781:L781)-6.17 -> 60.5 | N781: 6.1699999999999999 | O781: =SUM(M781:N781) -> 66.670000000000002
A782: 3841 | B782: EOL DELTA 7 II | C782: 30.905.225/0002-39 | D782: 79.140000000000001 | E782: 0 | F782: 0 | G782: 0 | H782: 0 | I782: 0 | J782: 0 | K782: 87.209999999999994 | L782: 0 | M782: =SUM(J782:L782)-8.07 -> 79.139999999999986 | N782: 8.0700000000000003 | O782: =SUM(M782:N782) -> 87.20999999999998
A783: 3842 | B783: EOL DELTA 8 I | C783: 30.866.547/0002-16 | D783: 79.140000000000001 | E783: 0 | F783: 0 | G783: 0 | H783: 0 | I783: 0 | J783: 0 | K783: 87.209999999999994 | L783: 0 | M783: =SUM(J783:L783)-8.07 -> 79.139999999999986 | N783: 8.0700000000000003 | O783: =SUM(M783:N783) -> 87.20999999999998
A784: 3844 | B784: EOL JANDAIA I | C784: 15.253.373/0002-22 | D784: 8.2100000000000009 | E784: 0 | F784: 0 | G784: 0 | H784: 0 | I784: 0 | J784: 0 | K784: 9.0500000000000007 | L784: 0 | M784: =SUM(J784:L784)-0.84 -> 8.2100000000000009 | N784: 0.83999999999999997 | O784: =SUM(M784:N784) -> 9.0500000000000007
A785: 3845 | B785: UFV SÃO GONÇALO 22 | C785: 29.579.676/0001-63 | D785: 146.19999999999999 | E785: 0 | F785: 0 | G785: 0 | H785: 0 | I785: 0 | J785: 0 | K785: 161.09999999999999 | L785: 0 | M785: =SUM(J785:L785)-14.9 -> 146.19999999999999 | N785: 14.9 | O785: =SUM(M785:N785) -> 161.09999999999999
A786: 3846 | B786: EOL VENTOS DE VILA ACRE II | C786: 29.523.731/0001-01 | D786: 86.450000000000003 | E786: 0 | F786: 0 | G786: 0 | H786: 0 | I786: 0 | J786: 0 | K786: 95.260000000000005 | L786: 0 | M786: =SUM(J786:L786)-8.81 -> 86.450000000000003 | N786: 8.8100000000000005 | O786: =SUM(M786:N786) -> 95.260000000000005
A787: 3848 | B787: UHE BALBINA | C787: 00.357.038/0001-16 | D787: 723.41999999999996 | E787: 0 | F787: 0 | G787: 0 | H787: 0 | I787: 0 | J787: 0 | K787: 797.15999999999997 | L787: 0 | M787: =SUM(J787:L787)-73.74 -> 723.41999999999996 | N787: 73.739999999999995 | O787: =SUM(M787:N787) -> 797.15999999999997
A788: 3849 | B788: UFV SÃO GONÇALO 1 | C788: 25.176.404/0001-61 | D788: 133.56 | E788: 0 | F788: 0 | G788: 0 | H788: 0 | I788: 0 | J788: 0 | K788: 147.16999999999999 | L788: 0 | M788: =SUM(J788:L788)-13.61 -> 133.56 | N788: 13.609999999999999 | O788: =SUM(M788:N788) -> 147.17000000000002
A789: 3850 | B789: UFV SÃO GONÇALO 21 | C789: 29.325.940/0001-32 | D789: 146.19999999999999 | E789: 0 | F789: 0 | G789: 0 | H789: 0 | I789: 0 | J789: 0 | K789: 161.09999999999999 | L789: 0 | M789: =SUM(J789:L789)-14.9 -> 146.19999999999999 | N789: 14.9 | O789: =SUM(M789:N789) -> 161.09999999999999
A790: 3851 | B790: EOL VENTOS DE VILA CEARÁ II | C790: 29.498.495/0001-02 | D790: 91.310000000000002 | E790: 0 | F790: 0 | G790: 0 | H790: 0 | I790: 0 | J790: 0 | K790: 100.62 | L790: 0 | M790: =SUM(J790:L790)-9.31 -> 91.310000000000002 | N790: 9.3100000000000005 | O790: =SUM(M790:N790) -> 100.62
A791: 3852 | B791: EOL VENTOS DE VILA CEARÁ I | C791: 29.498.486/0001-11 | D791: 93.920000000000002 | E791: 0 | F791: 0 | G791: 0 | H791: 0 | I791: 0 | J791: 0 | K791: 103.48999999999999 | L791: 0 | M791: =SUM(J791:L791)-9.57 -> 93.919999999999987 | N791: 9.5700000000000003 | O791: =SUM(M791:N791) -> 103.48999999999998
A792: 3853 | B792: UFV SÃO GONÇALO 2 | C792: 29.310.192/0001-14 | D792: 146.19999999999999 | E792: 0 | F792: 0 | G792: 0 | H792: 0 | I792: 0 | J792: 0 | K792: 161.09999999999999 | L792: 0 | M792: =SUM(J792:L792)-14.9 -> 146.19999999999999 | N792: 14.9 | O792: =SUM(M792:N792) -> 161.09999999999999
A793: 3854 | B793: UFV SÃO GONÇALO 3 | C793: 29.298.774/0001-22 | D793: 133.56 | E793: 0 | F793: 0 | G793: 0 | H793: 0 | I793: 0 | J793: 0 | K793: 147.16999999999999 | L793: 0 | M793: =SUM(J793:L793)-13.61 -> 133.56 | N793: 13.609999999999999 | O793: =SUM(M793:N793) -> 147.17000000000002
A794: 3855 | B794: EOL VILA RIO GRANDE DO NORTE I | C794: 29.401.264/0002-10 | D794: 59.020000000000003 | E794: 0 | F794: 0 | G794: 0 | H794: 0 | I794: 0 | J794: 0 | K794: 65.040000000000006 | L794: 0 | M794: =SUM(J794:L794)-6.02 -> 59.02000000000001 | N794: 6.0199999999999996 | O794: =SUM(M794:N794) -> 65.040000000000006
A795: 3856 | B795: EOL VILA RIO GRANDE DO NORTE II | C795: 29.320.977/0002-59 | D795: 88.530000000000001 | E795: 0 | F795: 0 | G795: 0 | H795: 0 | I795: 0 | J795: 0 | K795: 97.549999999999997 | L795: 0 | M795: =SUM(J795:L795)-9.02 -> 88.530000000000001 | N795: 9.0199999999999996 | O795: =SUM(M795:N795) -> 97.549999999999997
A796: 3857 | B796: EOL VILA SERGIPE I | C796: 29.330.011/0002-00 | D796: 88.650000000000006 | E796: 0 | F796: 0 | G796: 0 | H796: 0 | I796: 0 | J796: 0 | K796: 97.689999999999998 | L796: 0 | M796: =SUM(J796:L796)-9.04 -> 88.650000000000006 | N796: 9.0399999999999991 | O796: =SUM(M796:N796) -> 97.689999999999998
A797: 3858 | B797: EOL VENTOS DE VILA PARAÍBA II | C797: 29.498.479/0001-10 | D797: 89.469999999999999 | E797: 0 | F797: 0 | G797: 0 | H797: 0 | I797: 0 | J797: 0 | K797: 98.590000000000003 | L797: 0 | M797: =SUM(J797:L797)-9.12 -> 89.469999999999999 | N797: 9.1199999999999992 | O797: =SUM(M797:N797) -> 98.590000000000003
A798: 3859 | B798: UFV ETESA 17 SÃO JOÃO DO PIAUÍ I | C798: 30.520.122/0001-70 | D798: 93.519999999999996 | E798: 0 | F798: 0 | G798: 0 | H798: 0 | I798: 0 | J798: 0 | K798: 103.05 | L798: 0 | M798: =SUM(J798:L798)-9.53 -> 93.519999999999996 | N798: 9.5299999999999994 | O798: =SUM(M798:N798) -> 103.05
A799: 3860 | B799: UFV ETESA 18 SÃO JOÃO DO PIAUÍ II | C799: 30.432.072/0001-79 | D799: 93.519999999999996 | E799: 0 | F799: 0 | G799: 0 | H799: 0 | I799: 0 | J799: 0 | K799: 103.05 | L799: 0 | M799: =SUM(J799:L799)-9.53 -> 93.519999999999996 | N799: 9.5299999999999994 | O799: =SUM(M799:N799) -> 103.05
A800: 3861 | B800: UFV ETESA 19 SÃO JOÃO DO PIAUÍ III | C800: 30.486.042/0001-45 | D800: 93.519999999999996 | E800: 0 | F800: 0 | G800: 0 | H800: 0 | I800: 0 | J800: 0 | K800: 103.05 | L800: 0 | M800: =SUM(J800:L800)-9.53 -> 93.519999999999996 | N800: 9.5299999999999994 | O800: =SUM(M800:N800) -> 103.05
A801: 3862 | B801: UFV ETESA 20 SÃO JOÃO DO PIAUÍ IV | C801: 30.425.445/0001-84 | D801: 83.859999999999999 | E801: 0 | F801: 0 | G801: 0 | H801: 0 | I801: 0 | J801: 0 | K801: 92.409999999999997 | L801: 0 | M801: =SUM(J801:L801)-8.55 -> 83.859999999999999 | N801: 8.5500000000000007 | O801: =SUM(M801:N801) -> 92.409999999999997
A802: 3863 | B802: UFV ETESA 21 SÃO JOÃO DO PIAUÍ V | C802: 30.456.405/0001-08 | D802: 83.859999999999999 | E802: 0 | F802: 0 | G802: 0 | H802: 0 | I802: 0 | J802: 0 | K802: 92.409999999999997 | L802: 0 | M802: =SUM(J802:L802)-8.55 -> 83.859999999999999 | N802: 8.5500000000000007 | O802: =SUM(M802:N802) -> 92.409999999999997
A803: 3864 | B803: UFV ETESA 22 SÃO JOÃO DO PIAUÍ VI | C803: 30.421.756/0001-75 | D803: 92.659999999999997 | E803: 0 | F803: 0 | G803: 0 | H803: 0 | I803: 0 | J803: 0 | K803: 102.09999999999999 | L803: 0 | M803: =SUM(J803:L803)-9.44 -> 92.659999999999997 | N803: 9.4399999999999995 | O803: =SUM(M803:N803) -> 102.09999999999999
A804: 3865 | B804: UFV SÃO GONÇALO 4 | C804: 29.300.841/0001-04 | D804: 146.19999999999999 | E804: 0 | F804: 0 | G804: 0 | H804: 0 | I804: 0 | J804: 0 | K804: 161.09999999999999 | L804: 0 | M804: =SUM(J804:L804)-14.9 -> 146.19999999999999 | N804: 14.9 | O804: =SUM(M804:N804) -> 161.09999999999999
A805: 3866 | B805: UFV SÃO GONÇALO 10 | C805: 29.325.687/0001-17 | D805: 146.19999999999999 | E805: 0 | F805: 0 | G805: 0 | H805: 0 | I805: 0 | J805: 0 | K805: 161.09999999999999 | L805: 0 | M805: =SUM(J805:L805)-14.9 -> 146.19999999999999 | N805: 14.9 | O805: =SUM(M805:N805) -> 161.09999999999999
A806: 3867 | B806: EOL VENTOS DE VILA PARAÍBA I | C806: 29.523.723/0001-57 | D806: 94.739999999999995 | E806: 0 | F806: 0 | G806: 0 | H806: 0 | I806: 0 | J806: 0 | K806: 104.40000000000001 | L806: 0 | M806: =SUM(J806:L806)-9.66 -> 94.740000000000009 | N806: 9.6600000000000001 | O806: =SUM(M806:N806) -> 104.40000000000001
A807: 3868 | B807: UFV SÃO GONÇALO 5 | C807: 29.298.803/0001-56 | D807: 146.19999999999999 | E807: 0 | F807: 0 | G807: 0 | H807: 0 | I807: 0 | J807: 0 | K807: 161.09999999999999 | L807: 0 | M807: =SUM(J807:L807)-14.9 -> 146.19999999999999 | N807: 14.9 | O807: =SUM(M807:N807) -> 161.09999999999999
A808: 3869 | B808: UFV SÃO GONÇALO 6 | C808: 29.710.913/0001-83 | D808: 120.56 | E808: 0 | F808: 0 | G808: 0 | H808: 0 | I808: 0 | J808: 0 | K808: 132.84999999999999 | L808: 0 | M808: =SUM(J808:L808)-12.29 -> 120.56 | N808: 12.289999999999999 | O808: =SUM(M808:N808) -> 132.84999999999999
A809: 3870 | B809: EOL VENTOS DE SÃO JANUÁRIO 20 | C809: 14.675.949/0002-87 | D809: 17.109999999999999 | E809: 0 | F809: 0 | G809: 0 | H809: 0 | I809: 0 | J809: 0 | K809: 18.850000000000001 | L809: 0 | M809: =SUM(J809:L809)-1.74 -> 17.110000000000003 | N809: 1.74 | O809: =SUM(M809:N809) -> 18.850000000000001
A810: 3871 | B810: EOL VENTOS DE SÃO JANUÁRIO 21 | C810: 22.777.483/0002-59 | D810: 17.109999999999999 | E810: 0 | F810: 0 | G810: 0 | H810: 0 | I810: 0 | J810: 0 | K810: 18.850000000000001 | L810: 0 | M810: =SUM(J810:L810)-1.74 -> 17.110000000000003 | N810: 1.74 | O810: =SUM(M810:N810) -> 18.850000000000001
A811: 3872 | B811: EOL VILA SERGIPE II | C811: 30.321.925/0002-86 | D811: 91.319999999999993 | E811: 0 | F811: 0 | G811: 0 | H811: 0 | I811: 0 | J811: 0 | K811: 100.63 | L811: 0 | M811: =SUM(J811:L811)-9.31 -> 91.319999999999993 | N811: 9.3100000000000005 | O811: =SUM(M811:N811) -> 100.63
A812: 3873 | B812: EOL VILA MARANHÃO III | C812: 31.449.173/0001-15 | D812: 90.75 | E812: 0 | F812: 0 | G812: 0 | H812: 0 | I812: 0 | J812: 0 | K812: 100 | L812: 0 | M812: =SUM(J812:L812)-9.25 -> 90.75 | N812: 9.25 | O812: =SUM(M812:N812) -> 100
A813: 3874 | B813: UHE GOV BENTO MUNHOZ (FOZ DO AREIA) | C813: 35.742.218/0001-04 | D813: 6371.46 | E813: 0 | F813: 0 | G813: 0 | H813: 0 | I813: 0 | J813: 0 | K813: 7020.8900000000003 | L813: 0 | M813: =SUM(J813:L813)-649.43 -> 6371.46 | N813: 649.42999999999995 | O813: =SUM(M813:N813) -> 7020.8900000000003
A814: 3875 | B814: RENOVA (EOL PAU SANTO) | C814: 18.560.214/0001-88 | D814: 39.060000000000002 | E814: 0 | F814: 0 | G814: 0 | H814: 0 | I814: 0 | J814: 0 | K814: 43.039999999999999 | L814: 0 | M814: =SUM(J814:L814)-3.98 -> 39.060000000000002 | N814: 3.98 | O814: =SUM(M814:N814) -> 43.039999999999999
A815: 3876 | B815: UFV SÃO GONÇALO 7 | C815: 29.618.737/0001-54 | D815: 91.159999999999997 | E815: 0 | F815: 0 | G815: 0 | H815: 0 | I815: 0 | J815: 0 | K815: 100.45 | L815: 0 | M815: =SUM(J815:L815)-9.29 -> 91.159999999999997 | N815: 9.2899999999999991 | O815: =SUM(M815:N815) -> 100.44999999999999
A816: 3877 | B816: UFV SÃO GONÇALO 8 | C816: 29.618.787/0001-31 | D816: 91.159999999999997 | E816: 0 | F816: 0 | G816: 0 | H816: 0 | I816: 0 | J816: 0 | K816: 100.45 | L816: 0 | M816: =SUM(J816:L816)-9.29 -> 91.159999999999997 | N816: 9.2899999999999991 | O816: =SUM(M816:N816) -> 100.44999999999999
A817: 3878 | B817: UFV SÃO GONÇALO 11 | C817: 29.617.203/0001-03 | D817: 91.159999999999997 | E817: 0 | F817: 0 | G817: 0 | H817: 0 | I817: 0 | J817: 0 | K817: 100.45 | L817: 0 | M817: =SUM(J817:L817)-9.29 -> 91.159999999999997 | N817: 9.2899999999999991 | O817: =SUM(M817:N817) -> 100.44999999999999
A818: 3879 | B818: UFV SÃO GONÇALO 12 | C818: 29.711.106/0001-85 | D818: 91.159999999999997 | E818: 0 | F818: 0 | G818: 0 | H818: 0 | I818: 0 | J818: 0 | K818: 100.45 | L818: 0 | M818: =SUM(J818:L818)-9.29 -> 91.159999999999997 | N818: 9.2899999999999991 | O818: =SUM(M818:N818) -> 100.44999999999999
A819: 3880 | B819: EOL VILA SERGIPE III | C819: 30.311.178/0002-03 | D819: 40.490000000000002 | E819: 0 | F819: 0 | G819: 0 | H819: 0 | I819: 0 | J819: 0 | K819: 44.619999999999997 | L819: 0 | M819: =SUM(J819:L819)-4.13 -> 40.489999999999995 | N819: 4.1299999999999999 | O819: =SUM(M819:N819) -> 44.619999999999997
A820: 3881 | B820: EOL VILA CEARÁ I | C820: 31.478.575/0001-48 | D820: 90.609999999999999 | E820: 0 | F820: 0 | G820: 0 | H820: 0 | I820: 0 | J820: 0 | K820: 99.849999999999994 | L820: 0 | M820: =SUM(J820:L820)-9.24 -> 90.609999999999999 | N820: 9.2400000000000002 | O820: =SUM(M820:N820) -> 99.849999999999994
A821: 3882 | B821: EOL VENTOS DE SÃO JANUÁRIO 22 | C821: 13.346.056/0002-25 | D821: 17.109999999999999 | E821: 0 | F821: 0 | G821: 0 | H821: 0 | I821: 0 | J821: 0 | K821: 18.850000000000001 | L821: 0 | M821: =SUM(J821:L821)-1.74 -> 17.110000000000003 | N821: 1.74 | O821: =SUM(M821:N821) -> 18.850000000000001
A822: 3883 | B822: EOL VILA PIAUÍ III | C822: 30.311.141/0002-77 | D822: 101.48 | E822: 0 | F822: 0 | G822: 0 | H822: 0 | I822: 0 | J822: 0 | K822: 111.81999999999999 | L822: 0 | M822: =SUM(J822:L822)-10.34 -> 101.47999999999999 | N822: 10.34 | O822: =SUM(M822:N822) -> 111.81999999999999
A823: 3884 | B823: EOL VENTOS DE SANTA ÂNGELA 1 | C823: 25.174.579/0001-30 | D823: 98.079999999999998 | E823: 0 | F823: 0 | G823: 0 | H823: 0 | I823: 0 | J823: 0 | K823: 108.08 | L823: 0 | M823: =SUM(J823:L823)-10 -> 98.079999999999998 | N823: 10 | O823: =SUM(M823:N823) -> 108.08
A824: 3885 | B824: EOL VENTOS DE SANTA ÂNGELA 2 | C824: 25.176.787/0001-78 | D824: 98.079999999999998 | E824: 0 | F824: 0 | G824: 0 | H824: 0 | I824: 0 | J824: 0 | K824: 108.08 | L824: 0 | M824: =SUM(J824:L824)-10 -> 98.079999999999998 | N824: 10 | O824: =SUM(M824:N824) -> 108.08
A825: 3886 | B825: EOL VENTOS DE SANTA ÂNGELA 3 | C825: 25.289.277/0001-07 | D825: 98.079999999999998 | E825: 0 | F825: 0 | G825: 0 | H825: 0 | I825: 0 | J825: 0 | K825: 108.08 | L825: 0 | M825: =SUM(J825:L825)-10 -> 98.079999999999998 | N825: 10 | O825: =SUM(M825:N825) -> 108.08
A826: 3887 | B826: EOL VENTOS DE SANTA ÂNGELA 4 | C826: 25.289.246/0001-56 | D826: 98.079999999999998 | E826: 0 | F826: 0 | G826: 0 | H826: 0 | I826: 0 | J826: 0 | K826: 108.08 | L826: 0 | M826: =SUM(J826:L826)-10 -> 98.079999999999998 | N826: 10 | O826: =SUM(M826:N826) -> 108.08
A827: 3888 | B827: EOL VENTOS DE SANTA ÂNGELA 9 | C827: 29.616.957/0001-49 | D827: 138.13999999999999 | E827: 0 | F827: 0 | G827: 0 | H827: 0 | I827: 0 | J827: 0 | K827: 152.22 | L827: 0 | M827: =SUM(J827:L827)-14.08 -> 138.13999999999999 | N827: 14.08 | O827: =SUM(M827:N827) -> 152.22
A828: 3889 | B828: EOL VENTOS DE SANTA ÂNGELA 10 | C828: 29.616.881/0001-51 | D828: 128.38 | E828: 0 | F828: 0 | G828: 0 | H828: 0 | I828: 0 | J828: 0 | K828: 141.47 | L828: 0 | M828: =SUM(J828:L828)-13.09 -> 128.38 | N828: 13.09 | O828: =SUM(M828:N828) -> 141.47
A829: 3890 | B829: EOL VENTOS DE SANTA ÂNGELA 11 | C829: 29.552.535/0001-57 | D829: 138.88 | E829: 0 | F829: 0 | G829: 0 | H829: 0 | I829: 0 | J829: 0 | K829: 153.03999999999999 | L829: 0 | M829: =SUM(J829:L829)-14.16 -> 138.88 | N829: 14.16 | O829: =SUM(M829:N829) -> 153.03999999999999
A830: 3891 | B830: EOL VENTOS DE SANTA ÂNGELA 14 | C830: 29.576.419/0001-78 | D830: 134.16 | E830: 0 | F830: 0 | G830: 0 | H830: 0 | I830: 0 | J830: 0 | K830: 147.83000000000001 | L830: 0 | M830: =SUM(J830:L830)-13.67 -> 134.16000000000003 | N830: 13.67 | O830: =SUM(M830:N830) -> 147.83000000000001
A831: 3892 | B831: EOL VENTOS DE SANTA ÂNGELA 15 | C831: 29.559.244/0001-90 | D831: 136.22999999999999 | E831: 0 | F831: 0 | G831: 0 | H831: 0 | I831: 0 | J831: 0 | K831: 150.12 | L831: 0 | M831: =SUM(J831:L831)-13.89 -> 136.23000000000002 | N831: 13.890000000000001 | O831: =SUM(M831:N831) -> 150.12
A832: 3893 | B832: EOL VILA MARANHÃO I | C832: 30.097.726/0001-55 | D832: 92.840000000000003 | E832: 0 | F832: 0 | G832: 0 | H832: 0 | I832: 0 | J832: 0 | K832: 102.3 | L832: 0 | M832: =SUM(J832:L832)-9.46 -> 92.840000000000003 | N832: 9.4600000000000009 | O832: =SUM(M832:N832) -> 102.30000000000001
A833: 3894 | B833: EOL INHAMBU 2 | C833: 30.519.343/0001-28 | D833: 39.600000000000001 | E833: 0 | F833: 0 | G833: 0 | H833: 0 | I833: 0 | J833: 0 | K833: 43.640000000000001 | L833: 0 | M833: =SUM(J833:L833)-4.04 -> 39.600000000000001 | N833: 4.04 | O833: =SUM(M833:N833) -> 43.640000000000001
A834: 3895 | B834: EOL VILA PIAUÍ I | C834: 30.321.883/0002-83 | D834: 91.120000000000005 | E834: 0 | F834: 0 | G834: 0 | H834: 0 | I834: 0 | J834: 0 | K834: 100.41 | L834: 0 | M834: =SUM(J834:L834)-9.29 -> 91.120000000000005 | N834: 9.2899999999999991 | O834: =SUM(M834:N834) -> 100.41
A835: 3896 | B835: EOL VILA PIAUÍ II | C835: 30.311.116/0002-93 | D835: 91.019999999999996 | E835: 0 | F835: 0 | G835: 0 | H835: 0 | I835: 0 | J835: 0 | K835: 100.3 | L835: 0 | M835: =SUM(J835:L835)-9.28 -> 91.019999999999996 | N835: 9.2799999999999994 | O835: =SUM(M835:N835) -> 100.3
A836: 3897 | B836: EOL VENTOS DE SÃO JANUÁRIO 13 | C836: 30.558.294/0001-32 | D836: 14.539999999999999 | E836: 0 | F836: 0 | G836: 0 | H836: 0 | I836: 0 | J836: 0 | K836: 16.02 | L836: 0 | M836: =SUM(J836:L836)-1.48 -> 14.539999999999999 | N836: 1.48 | O836: =SUM(M836:N836) -> 16.02
A837: 3898 | B837: EOL VILA MARANHÃO II | C837: 31.004.703/0001-11 | D837: 90.780000000000001 | E837: 0 | F837: 0 | G837: 0 | H837: 0 | I837: 0 | J837: 0 | K837: 100.03 | L837: 0 | M837: =SUM(J837:L837)-9.25 -> 90.780000000000001 | N837: 9.25 | O837: =SUM(M837:N837) -> 100.03
A838: 3899 | B838: EOL VENTOS DE SANTA ÂNGELA 5 | C838: 25.289.292/0001-55 | D838: 97.540000000000006 | E838: 0 | F838: 0 | G838: 0 | H838: 0 | I838: 0 | J838: 0 | K838: 107.48 | L838: 0 | M838: =SUM(J838:L838)-9.94 -> 97.540000000000006 | N838: 9.9399999999999995 | O838: =SUM(M838:N838) -> 107.48
A839: 3900 | B839: EOL VENTOS DE SANTA ÂNGELA 6 | C839: 25.289.215/0001-03 | D839: 97.540000000000006 | E839: 0 | F839: 0 | G839: 0 | H839: 0 | I839: 0 | J839: 0 | K839: 107.48 | L839: 0 | M839: =SUM(J839:L839)-9.94 -> 97.540000000000006 | N839: 9.9399999999999995 | O839: =SUM(M839:N839) -> 107.48
A840: 3901 | B840: EOL VENTOS DE SANTA ÂNGELA 7 | C840: 25.289.312/0001-98 | D840: 78.019999999999996 | E840: 0 | F840: 0 | G840: 0 | H840: 0 | I840: 0 | J840: 0 | K840: 85.969999999999999 | L840: 0 | M840: =SUM(J840:L840)-7.95 -> 78.019999999999996 | N840: 7.9500000000000002 | O840: =SUM(M840:N840) -> 85.969999999999999
A841: 3902 | B841: EOL VENTOS DE SANTA ÂNGELA 8 | C841: 29.559.160/0001-57 | D841: 97.540000000000006 | E841: 0 | F841: 0 | G841: 0 | H841: 0 | I841: 0 | J841: 0 | K841: 107.48 | L841: 0 | M841: =SUM(J841:L841)-9.94 -> 97.540000000000006 | N841: 9.9399999999999995 | O841: =SUM(M841:N841) -> 107.48
A842: 3903 | B842: EOL VENTOS DE SÃO JANUÁRIO 14 | C842: 30.558.337/0001-80 | D842: 14.539999999999999 | E842: 0 | F842: 0 | G842: 0 | H842: 0 | I842: 0 | J842: 0 | K842: 16.02 | L842: 0 | M842: =SUM(J842:L842)-1.48 -> 14.539999999999999 | N842: 1.48 | O842: =SUM(M842:N842) -> 16.02
A843: 3904 | B843: EOL SÃO FERNANDO I | C843: 23.008.029/0001-15 | D843: 191.06999999999999 | E843: 0 | F843: 0 | G843: 0 | H843: 0 | I843: 0 | J843: 0 | K843: 210.55000000000001 | L843: 0 | M843: =SUM(J843:L843)-19.48 -> 191.07000000000002 | N843: 19.48 | O843: =SUM(M843:N843) -> 210.55000000000001
A844: 3905 | B844: EOL SÃO FERNANDO II | C844: 32.132.033/0001-81 | D844: 216.97 | E844: 0 | F844: 0 | G844: 0 | H844: 0 | I844: 0 | J844: 0 | K844: 239.09 | L844: 0 | M844: =SUM(J844:L844)-22.12 -> 216.97 | N844: 22.120000000000001 | O844: =SUM(M844:N844) -> 239.09
A845: 3906 | B845: EOL CORRUPIÃO 2 | C845: 30.519.369/0001-76 | D845: 45.57 | E845: 0 | F845: 0 | G845: 0 | H845: 0 | I845: 0 | J845: 0 | K845: 50.210000000000001 | L845: 0 | M845: =SUM(J845:L845)-4.64 -> 45.57 | N845: 4.6399999999999997 | O845: =SUM(M845:N845) -> 50.210000000000001
A846: 3907 | B846: EOL VENTOS DE SÃO JANUÁRIO 04 | C846: 30.558.320/0001-22 | D846: 86.150000000000006 | E846: 0 | F846: 0 | G846: 0 | H846: 0 | I846: 0 | J846: 0 | K846: 94.930000000000007 | L846: 0 | M846: =SUM(J846:L846)-8.78 -> 86.150000000000006 | N846: 8.7799999999999994 | O846: =SUM(M846:N846) -> 94.930000000000007
A847: 3908 | B847: EOL SERRA DO FOGO | C847: 33.295.705/0002-13 | D847: 79.019999999999996 | E847: 0 | F847: 0 | G847: 0 | H847: 0 | I847: 0 | J847: 0 | K847: 87.069999999999993 | L847: 0 | M847: =SUM(J847:L847)-8.05 -> 79.019999999999996 | N847: 8.0500000000000007 | O847: =SUM(M847:N847) -> 87.069999999999993
A848: 3909 | B848: EOL SERRA DO VENTO | C848: 33.269.273/0002-76 | D848: 79.019999999999996 | E848: 0 | F848: 0 | G848: 0 | H848: 0 | I848: 0 | J848: 0 | K848: 87.069999999999993 | L848: 0 | M848: =SUM(J848:L848)-8.05 -> 79.019999999999996 | N848: 8.0500000000000007 | O848: =SUM(M848:N848) -> 87.069999999999993
A849: 3910 | B849: EOL VENTOS DE SÃO JANUÁRIO 01 | C849: 30.558.359/0001-40 | D849: 98.450000000000003 | E849: 0 | F849: 0 | G849: 0 | H849: 0 | I849: 0 | J849: 0 | K849: 108.48 | L849: 0 | M849: =SUM(J849:L849)-10.03 -> 98.450000000000003 | N849: 10.029999999999999 | O849: =SUM(M849:N849) -> 108.48
A850: 3911 | B850: EOL VENTOS DE SÃO JANUÁRIO 03 | C850: 31.818.977/0001-44 | D850: 106.31 | E850: 0 | F850: 0 | G850: 0 | H850: 0 | I850: 0 | J850: 0 | K850: 117.15000000000001 | L850: 0 | M850: =SUM(J850:L850)-10.84 -> 106.31 | N850: 10.84 | O850: =SUM(M850:N850) -> 117.15000000000001
A851: 3912 | B851: EOL CASA NOVA A | C851: 33.541.368/0001-16 | D851: 67.060000000000002 | E851: 0 | F851: 0 | G851: 0 | H851: 0 | I851: 0 | J851: 0 | K851: 73.900000000000006 | L851: 0 | M851: =SUM(J851:L851)-6.84 -> 67.060000000000002 | N851: 6.8399999999999999 | O851: =SUM(M851:N851) -> 73.900000000000006
A852: 3913 | B852: EOL VENTOS DE SÃO JANUÁRIO 05 | C852: 31.818.981/0001-02 | D852: 14.539999999999999 | E852: 0 | F852: 0 | G852: 0 | H852: 0 | I852: 0 | J852: 0 | K852: 16.02 | L852: 0 | M852: =SUM(J852:L852)-1.48 -> 14.539999999999999 | N852: 1.48 | O852: =SUM(M852:N852) -> 16.02
A853: 3914 | B853: EOL UMBURANA DE CHEIRO | C853: 33.295.664/0002-65 | D853: 79.019999999999996 | E853: 0 | F853: 0 | G853: 0 | H853: 0 | I853: 0 | J853: 0 | K853: 87.069999999999993 | L853: 0 | M853: =SUM(J853:L853)-8.05 -> 79.019999999999996 | N853: 8.0500000000000007 | O853: =SUM(M853:N853) -> 87.069999999999993
A854: 3915 | B854: EOL ARARINHA AZUL | C854: 30.519.323/0001-57 | D854: 54.229999999999997 | E854: 0 | F854: 0 | G854: 0 | H854: 0 | I854: 0 | J854: 0 | K854: 59.759999999999998 | L854: 0 | M854: =SUM(J854:L854)-5.53 -> 54.229999999999997 | N854: 5.5300000000000002 | O854: =SUM(M854:N854) -> 59.759999999999998
A855: 3916 | B855: EOL CAMPO LARGO IX | C855: 17.995.695/0002-72 | D855: 64.579999999999998 | E855: 0 | F855: 0 | G855: 0 | H855: 0 | I855: 0 | J855: 0 | K855: 71.159999999999997 | L855: 0 | M855: =SUM(J855:L855)-6.58 -> 64.579999999999998 | N855: 6.5800000000000001 | O855: =SUM(M855:N855) -> 71.159999999999997
A856: 3917 | B856: EOL CAMPO LARGO X | C856: 17.815.305/0002-35 | D856: 85.769999999999996 | E856: 0 | F856: 0 | G856: 0 | H856: 0 | I856: 0 | J856: 0 | K856: 94.510000000000005 | L856: 0 | M856: =SUM(J856:L856)-8.74 -> 85.77000000000001 | N856: 8.7400000000000002 | O856: =SUM(M856:N856) -> 94.510000000000005
A857: 3918 | B857: EOL CAMPO LARGO XIV | C857: 17.829.499/0002-28 | D857: 53.649999999999999 | E857: 0 | F857: 0 | G857: 0 | H857: 0 | I857: 0 | J857: 0 | K857: 59.119999999999997 | L857: 0 | M857: =SUM(J857:L857)-5.47 -> 53.649999999999999 | N857: 5.4699999999999998 | O857: =SUM(M857:N857) -> 59.119999999999997
A858: 3919 | B858: EOL VENTOS DE SÃO FERNANDO 3 | C858: 32.671.163/0001-92 | D858: 58.909999999999997 | E858: 0 | F858: 0 | G858: 0 | H858: 0 | I858: 0 | J858: 0 | K858: 64.909999999999997 | L858: 0 | M858: =SUM(J858:L858)-6 -> 58.909999999999997 | N858: 6 | O858: =SUM(M858:N858) -> 64.909999999999997
A859: 3920 | B859: EOL CAMPO LARGO XVII | C859: 17.916.887/0002-46 | D859: 75.329999999999998 | E859: 0 | F859: 0 | G859: 0 | H859: 0 | I859: 0 | J859: 0 | K859: 83.010000000000005 | L859: 0 | M859: =SUM(J859:L859)-7.68 -> 75.330000000000013 | N859: 7.6799999999999997 | O859: =SUM(M859:N859) -> 83.010000000000019
A860: 3921 | B860: EOL CAMPO LARGO XIX | C860: 17.928.213/0002-61 | D860: 85.700000000000003 | E860: 0 | F860: 0 | G860: 0 | H860: 0 | I860: 0 | J860: 0 | K860: 94.439999999999998 | L860: 0 | M860: =SUM(J860:L860)-8.74 -> 85.700000000000003 | N860: 8.7400000000000002 | O860: =SUM(M860:N860) -> 94.439999999999998
A861: 3922 | B861: EOL TEIÚ 3 | C861: 30.534.321/0001-37 | D861: 60.130000000000003 | E861: 0 | F861: 0 | G861: 0 | H861: 0 | I861: 0 | J861: 0 | K861: 66.260000000000005 | L861: 0 | M861: =SUM(J861:L861)-6.13 -> 60.130000000000003 | N861: 6.1299999999999999 | O861: =SUM(M861:N861) -> 66.260000000000005
A862: 3923 | B862: EOL SERROTE II | C862: 32.398.720/0001-43 | D862: 55.75 | E862: 0 | F862: 0 | G862: 0 | H862: 0 | I862: 0 | J862: 0 | K862: 61.43 | L862: 0 | M862: =SUM(J862:L862)-5.68 -> 55.75 | N862: 5.6799999999999997 | O862: =SUM(M862:N862) -> 61.43
A863: 3924 | B863: EOL SERROTE III | C863: 32.398.682/0001-29 | D863: 46.439999999999998 | E863: 0 | F863: 0 | G863: 0 | H863: 0 | I863: 0 | J863: 0 | K863: 51.170000000000002 | L863: 0 | M863: =SUM(J863:L863)-4.73 -> 46.439999999999998 | N863: 4.7300000000000004 | O863: =SUM(M863:N863) -> 51.170000000000002
A864: 3925 | B864: EOL VENTOS DE SÃO JANUÁRIO 06 | C864: 31.810.453/0001-07 | D864: 13.09 | E864: 0 | F864: 0 | G864: 0 | H864: 0 | I864: 0 | J864: 0 | K864: 14.42 | L864: 0 | M864: =SUM(J864:L864)-1.33 -> 13.09 | N864: 1.3300000000000001 | O864: =SUM(M864:N864) -> 14.42
A865: 3926 | B865: EOL VENTOS DE SÃO JANUÁRIO 11 | C865: 31.810.445/0001-60 | D865: 132.88999999999999 | E865: 0 | F865: 0 | G865: 0 | H865: 0 | I865: 0 | J865: 0 | K865: 146.44 | L865: 0 | M865: =SUM(J865:L865)-13.55 -> 132.88999999999999 | N865: 13.550000000000001 | O865: =SUM(M865:N865) -> 146.44
A866: 3927 | B866: EOL AVENTURA II | C866: 17.875.511/0002-30 | D866: 63.649999999999999 | E866: 0 | F866: 0 | G866: 0 | H866: 0 | I866: 0 | J866: 0 | K866: 70.140000000000001 | L866: 0 | M866: =SUM(J866:L866)-6.49 -> 63.649999999999999 | N866: 6.4900000000000002 | O866: =SUM(M866:N866) -> 70.140000000000001
A867: 3928 | B867: EOL AVENTURA IV | C867: 28.525.891/0002-08 | D867: 89.590000000000003 | E867: 0 | F867: 0 | G867: 0 | H867: 0 | I867: 0 | J867: 0 | K867: 98.719999999999999 | L867: 0 | M867: =SUM(J867:L867)-9.13 -> 89.590000000000003 | N867: 9.1300000000000008 | O867: =SUM(M867:N867) -> 98.719999999999999
A868: 3929 | B868: EOL CAMPO LARGO XX | C868: 17.929.168/0002-60 | D868: 96.430000000000007 | E868: 0 | F868: 0 | G868: 0 | H868: 0 | I868: 0 | J868: 0 | K868: 106.26000000000001 | L868: 0 | M868: =SUM(J868:L868)-9.83 -> 96.430000000000007 | N868: 9.8300000000000001 | O868: =SUM(M868:N868) -> 106.26000000000001
A869: 3930 | B869: EOL POTIGUAR B31 | C869: 34.327.393/0001-64 | D869: 109.83 | E869: 0 | F869: 0 | G869: 0 | H869: 0 | I869: 0 | J869: 0 | K869: 121.02 | L869: 0 | M869: =SUM(J869:L869)-11.19 -> 109.83 | N869: 11.19 | O869: =SUM(M869:N869) -> 121.02
A870: 3931 | B870: EOL POTIGUAR B32 | C870: 34.327.409/0001-39 | D870: 120.12 | E870: 0 | F870: 0 | G870: 0 | H870: 0 | I870: 0 | J870: 0 | K870: 132.36000000000001 | L870: 0 | M870: =SUM(J870:L870)-12.24 -> 120.12000000000002 | N870: 12.24 | O870: =SUM(M870:N870) -> 132.36000000000001
A871: 3932 | B871: EOL VENTOS DE SÃO FERNANDO 4 | C871: 33.701.101/0001-49 | D871: 202.05000000000001 | E871: 0 | F871: 0 | G871: 0 | H871: 0 | I871: 0 | J871: 0 | K871: 222.63999999999999 | L871: 0 | M871: =SUM(J871:L871)-20.59 -> 202.04999999999998 | N871: 20.59 | O871: =SUM(M871:N871) -> 222.63999999999999
A872: 3933 | B872: EOL VENTOS DE SÃO JANUÁRIO 10 | C872: 31.810.448/0001-02 | D872: 132.88999999999999 | E872: 0 | F872: 0 | G872: 0 | H872: 0 | I872: 0 | J872: 0 | K872: 146.44 | L872: 0 | M872: =SUM(J872:L872)-13.55 -> 132.88999999999999 | N872: 13.550000000000001 | O872: =SUM(M872:N872) -> 146.44
A873: 3934 | B873: EOL SERROTE I | C873: 32.398.775/0001-53 | D873: 55.75 | E873: 0 | F873: 0 | G873: 0 | H873: 0 | I873: 0 | J873: 0 | K873: 61.43 | L873: 0 | M873: =SUM(J873:L873)-5.68 -> 55.75 | N873: 5.6799999999999997 | O873: =SUM(M873:N873) -> 61.43
A874: 3935 | B874: EOL SERROTE IV | C874: 32.398.772/0001-10 | D874: 37.149999999999999 | E874: 0 | F874: 0 | G874: 0 | H874: 0 | I874: 0 | J874: 0 | K874: 40.939999999999998 | L874: 0 | M874: =SUM(J874:L874)-3.79 -> 37.149999999999999 | N874: 3.79 | O874: =SUM(M874:N874) -> 40.939999999999998
A875: 3936 | B875: EOL SERROTE V | C875: 32.398.761/0001-30 | D875: 65.040000000000006 | E875: 0 | F875: 0 | G875: 0 | H875: 0 | I875: 0 | J875: 0 | K875: 71.670000000000002 | L875: 0 | M875: =SUM(J875:L875)-6.63 -> 65.040000000000006 | N875: 6.6299999999999999 | O875: =SUM(M875:N875) -> 71.670000000000002
A876: 3937 | B876: UFV FLOR DE MANDACARU | C876: 12.009.135/0001-05 | D876: 4.8700000000000001 | E876: 0 | F876: 0 | G876: 0 | H876: 0 | I876: 0 | J876: 0 | K876: 5.3700000000000001 | L876: 0 | M876: =SUM(J876:L876)-0.5 -> 4.8700000000000001 | N876: 0.5 | O876: =SUM(M876:N876) -> 5.3700000000000001
A877: 3938 | B877: EOL VENTOS DE SANTA ÂNGELA 20 | C877: 29.552.939/0001-40 | D877: 94.25 | E877: 0 | F877: 0 | G877: 0 | H877: 0 | I877: 0 | J877: 0 | K877: 103.86 | L877: 0 | M877: =SUM(J877:L877)-9.61 -> 94.25 | N877: 9.6099999999999994 | O877: =SUM(M877:N877) -> 103.86
A878: 3939 | B878: EOL VENTOS DE SANTA ÂNGELA 21 | C878: 29.616.162/0001-30 | D878: 84.859999999999999 | E878: 0 | F878: 0 | G878: 0 | H878: 0 | I878: 0 | J878: 0 | K878: 93.510000000000005 | L878: 0 | M878: =SUM(J878:L878)-8.65 -> 84.859999999999999 | N878: 8.6500000000000004 | O878: =SUM(M878:N878) -> 93.510000000000005
A879: 3940 | B879: UFV SÃO GONÇALO 18 | C879: 31.752.294/0001-31 | D879: 112.51000000000001 | E879: 0 | F879: 0 | G879: 0 | H879: 0 | I879: 0 | J879: 0 | K879: 123.98 | L879: 0 | M879: =SUM(J879:L879)-11.47 -> 112.51000000000001 | N879: 11.470000000000001 | O879: =SUM(M879:N879) -> 123.98
A880: 3941 | B880: UTE GNA I | C880: 23.449.511/0001-90 | D880: 5323.9700000000003 | E880: 0 | F880: 0 | G880: 0 | H880: 0 | I880: 0 | J880: 0 | K880: 5866.6300000000001 | L880: 0 | M880: =SUM(J880:L880)-542.66 -> 5323.9700000000003 | N880: 542.65999999999997 | O880: =SUM(M880:N880) -> 5866.6300000000001
A881: 3942 | B881: EOL CRISTALÂNDIA III | C881: 23.049.225/0003-08 | D881: 52.280000000000001 | E881: 0 | F881: 0 | G881: 0 | H881: 0 | I881: 0 | J881: 0 | K881: 57.609999999999999 | L881: 0 | M881: =SUM(J881:L881)-5.33 -> 52.280000000000001 | N881: 5.3300000000000001 | O881: =SUM(M881:N881) -> 57.609999999999999
A882: 3943 | B882: EOL AVENTURA III | C882: 29.302.365/0002-33 | D882: 76.780000000000001 | E882: 0 | F882: 0 | G882: 0 | H882: 0 | I882: 0 | J882: 0 | K882: 84.609999999999999 | L882: 0 | M882: =SUM(J882:L882)-7.83 -> 76.780000000000001 | N882: 7.8300000000000001 | O882: =SUM(M882:N882) -> 84.609999999999999
A883: 3944 | B883: EOL SERROTE VII | C883: 32.398.767/0001-07 | D883: 65.040000000000006 | E883: 0 | F883: 0 | G883: 0 | H883: 0 | I883: 0 | J883: 0 | K883: 71.670000000000002 | L883: 0 | M883: =SUM(J883:L883)-6.63 -> 65.040000000000006 | N883: 6.6299999999999999 | O883: =SUM(M883:N883) -> 71.670000000000002
A884: 3945 | B884: EOL SERROTE VIII | C884: 32.398.765/0001-18 | D884: 65.040000000000006 | E884: 0 | F884: 0 | G884: 0 | H884: 0 | I884: 0 | J884: 0 | K884: 71.670000000000002 | L884: 0 | M884: =SUM(J884:L884)-6.63 -> 65.040000000000006 | N884: 6.6299999999999999 | O884: =SUM(M884:N884) -> 71.670000000000002
A885: 3946 | B885: EOL POTIGUAR B33 | C885: 34.327.417/0001-85 | D885: 145.86000000000001 | E885: 0 | F885: 0 | G885: 0 | H885: 0 | I885: 0 | J885: 0 | K885: 160.72999999999999 | L885: 0 | M885: =SUM(J885:L885)-14.87 -> 145.85999999999999 | N885: 14.869999999999999 | O885: =SUM(M885:N885) -> 160.72999999999999
A886: 3947 | B886: EOL SERRA DA BABILÔNIA A | C886: 30.063.842/0002-34 | D886: 66.150000000000006 | E886: 0 | F886: 0 | G886: 0 | H886: 0 | I886: 0 | J886: 0 | K886: 72.890000000000001 | L886: 0 | M886: =SUM(J886:L886)-6.74 -> 66.150000000000006 | N886: 6.7400000000000002 | O886: =SUM(M886:N886) -> 72.890000000000001
A887: 3948 | B887: EOL SERRA DA BABILÔNIA B | C887: 29.527.877/0002-06 | D887: 78.659999999999997 | E887: 0 | F887: 0 | G887: 0 | H887: 0 | I887: 0 | J887: 0 | K887: 86.680000000000007 | L887: 0 | M887: =SUM(J887:L887)-8.02 -> 78.660000000000011 | N887: 8.0199999999999996 | O887: =SUM(M887:N887) -> 86.680000000000007
A888: 3949 | B888: EOL VENTOS DE SANTA ÂNGELA 12 | C888: 29.722.095/0001-39 | D888: 76.689999999999998 | E888: 0 | F888: 0 | G888: 0 | H888: 0 | I888: 0 | J888: 0 | K888: 84.510000000000005 | L888: 0 | M888: =SUM(J888:L888)-7.82 -> 76.689999999999998 | N888: 7.8200000000000003 | O888: =SUM(M888:N888) -> 84.509999999999991
A889: 3950 | B889: EOL VENTOS DE SANTA ÂNGELA 13 | C889: 29.310.217/0001-80 | D889: 72.329999999999998 | E889: 0 | F889: 0 | G889: 0 | H889: 0 | I889: 0 | J889: 0 | K889: 79.700000000000003 | L889: 0 | M889: =SUM(J889:L889)-7.37 -> 72.329999999999998 | N889: 7.3700000000000001 | O889: =SUM(M889:N889) -> 79.700000000000003
A890: 3951 | B890: EOL VENTOS DE SANTA ÂNGELA 18 | C890: 29.710.906/0001-81 | D890: 80.109999999999999 | E890: 0 | F890: 0 | G890: 0 | H890: 0 | I890: 0 | J890: 0 | K890: 88.280000000000001 | L890: 0 | M890: =SUM(J890:L890)-8.17 -> 80.109999999999999 | N890: 8.1699999999999999 | O890: =SUM(M890:N890) -> 88.280000000000001
A891: 3952 | B891: EOL GAMELEIRA | C891: 07.099.001/0001-84 | D891: 51.210000000000001 | E891: 0 | F891: 0 | G891: 0 | H891: 0 | I891: 0 | J891: 0 | K891: 56.43 | L891: 0 | M891: =SUM(J891:L891)-5.22 -> 51.210000000000001 | N891: 5.2199999999999998 | O891: =SUM(M891:N891) -> 56.43
A892: 3953 | B892: EOL FAROL DE TOUROS | C892: 10.369.836/0001-11 | D892: 71.730000000000004 | E892: 0 | F892: 0 | G892: 0 | H892: 0 | I892: 0 | J892: 0 | K892: 79.040000000000006 | L892: 0 | M892: =SUM(J892:L892)-7.31 -> 71.730000000000004 | N892: 7.3099999999999996 | O892: =SUM(M892:N892) -> 79.040000000000006
A893: 3954 | B893: EOL COSTA DAS DUNAS | C893: 10.401.225/0001-03 | D893: 82.609999999999999 | E893: 0 | F893: 0 | G893: 0 | H893: 0 | I893: 0 | J893: 0 | K893: 91.030000000000001 | L893: 0 | M893: =SUM(J893:L893)-8.42 -> 82.609999999999999 | N893: 8.4199999999999999 | O893: =SUM(M893:N893) -> 91.030000000000001
A894: 3955 | B894: EOL FIGUEIRA BRANCA | C894: 09.665.352/0001-30 | D894: 30.710000000000001 | E894: 0 | F894: 0 | G894: 0 | H894: 0 | I894: 0 | J894: 0 | K894: 33.840000000000003 | L894: 0 | M894: =SUM(J894:L894)-3.13 -> 30.710000000000004 | N894: 3.1299999999999999 | O894: =SUM(M894:N894) -> 33.840000000000003
A895: 3957 | B895: EOL AVENTURA V | C895: 28.946.365/0002-03 | D895: 89.019999999999996 | E895: 0 | F895: 0 | G895: 0 | H895: 0 | I895: 0 | J895: 0 | K895: 98.090000000000003 | L895: 0 | M895: =SUM(J895:L895)-9.07 -> 89.02000000000001 | N895: 9.0700000000000003 | O895: =SUM(M895:N895) -> 98.090000000000003
A896: 3958 | B896: EOL CAMPO LARGO VIII | C896: 18.001.918/0002-00 | D896: 85.700000000000003 | E896: 0 | F896: 0 | G896: 0 | H896: 0 | I896: 0 | J896: 0 | K896: 94.439999999999998 | L896: 0 | M896: =SUM(J896:L896)-8.74 -> 85.700000000000003 | N896: 8.7400000000000002 | O896: =SUM(M896:N896) -> 94.439999999999998
A897: 3959 | B897: EOL CAMPO LARGO XI | C897: 17.955.471/0002-37 | D897: 42.950000000000003 | E897: 0 | F897: 0 | G897: 0 | H897: 0 | I897: 0 | J897: 0 | K897: 47.329999999999998 | L897: 0 | M897: =SUM(J897:L897)-4.38 -> 42.949999999999996 | N897: 4.3799999999999999 | O897: =SUM(M897:N897) -> 47.329999999999998
A898: 3960 | B898: EOL CAMPO LARGO XII | C898: 17.846.141/0002-03 | D898: 139.27000000000001 | E898: 0 | F898: 0 | G898: 0 | H898: 0 | I898: 0 | J898: 0 | K898: 153.47 | L898: 0 | M898: =SUM(J898:L898)-14.2 -> 139.27000000000001 | N898: 14.199999999999999 | O898: =SUM(M898:N898) -> 153.47
A899: 3961 | B899: EOL CAMPO LARGO XIII | C899: 17.995.969/0002-23 | D899: 107.14 | E899: 0 | F899: 0 | G899: 0 | H899: 0 | I899: 0 | J899: 0 | K899: 118.06 | L899: 0 | M899: =SUM(J899:L899)-10.92 -> 107.14 | N899: 10.92 | O899: =SUM(M899:N899) -> 118.06
A900: 3962 | B900: EOL CAMPO LARGO XXII | C900: 18.154.009/0002-01 | D900: 85.700000000000003 | E900: 0 | F900: 0 | G900: 0 | H900: 0 | I900: 0 | J900: 0 | K900: 94.439999999999998 | L900: 0 | M900: =SUM(J900:L900)-8.74 -> 85.700000000000003 | N900: 8.7400000000000002 | O900: =SUM(M900:N900) -> 94.439999999999998
A901: 3963 | B901: UFV SÃO GONÇALO 19 | C901: 31.752.301/0001-03 | D901: 114.8 | E901: 0 | F901: 0 | G901: 0 | H901: 0 | I901: 0 | J901: 0 | K901: 126.5 | L901: 0 | M901: =SUM(J901:L901)-11.7 -> 114.8 | N901: 11.699999999999999 | O901: =SUM(M901:N901) -> 126.5
A902: 3964 | B902: EOL VENTOS DE SANTA ÂNGELA 19 | C902: 29.552.605/0001-77 | D902: 93.969999999999999 | E902: 0 | F902: 0 | G902: 0 | H902: 0 | I902: 0 | J902: 0 | K902: 103.55 | L902: 0 | M902: =SUM(J902:L902)-9.58 -> 93.969999999999999 | N902: 9.5800000000000001 | O902: =SUM(M902:N902) -> 103.55
A903: 3965 | B903: EOL SERROTE VI | C903: 32.398.764/0001-73 | D903: 65.040000000000006 | E903: 0 | F903: 0 | G903: 0 | H903: 0 | I903: 0 | J903: 0 | K903: 71.670000000000002 | L903: 0 | M903: =SUM(J903:L903)-6.63 -> 65.040000000000006 | N903: 6.6299999999999999 | O903: =SUM(M903:N903) -> 71.670000000000002
A904: 3966 | B904: EOL VENTOS DE VILA MATO GROSSO I | C904: 34.109.229/0001-80 | D904: 130.19 | E904: 0 | F904: 0 | G904: 0 | H904: 0 | I904: 0 | J904: 0 | K904: 143.46000000000001 | L904: 0 | M904: =SUM(J904:L904)-13.27 -> 130.19 | N904: 13.27 | O904: =SUM(M904:N904) -> 143.46000000000001
A905: 3967 | B905: EOL TERRA SANTA I | C905: 24.895.239/0001-35 | D905: 147.94999999999999 | E905: 0 | F905: 0 | G905: 0 | H905: 0 | I905: 0 | J905: 0 | K905: 163.03 | L905: 0 | M905: =SUM(J905:L905)-15.08 -> 147.94999999999999 | N905: 15.08 | O905: =SUM(M905:N905) -> 163.03
A906: 3968 | B906: EOL TERRA SANTA II | C906: 24.894.829/0001-43 | D906: 80.819999999999993 | E906: 0 | F906: 0 | G906: 0 | H906: 0 | I906: 0 | J906: 0 | K906: 89.060000000000002 | L906: 0 | M906: =SUM(J906:L906)-8.24 -> 80.820000000000007 | N906: 8.2400000000000002 | O906: =SUM(M906:N906) -> 89.060000000000002
A907: 3969 | B907: EOL SERRA DA BABILÔNIA C | C907: 29.591.504/0002-96 | D907: 82.709999999999994 | E907: 0 | F907: 0 | G907: 0 | H907: 0 | I907: 0 | J907: 0 | K907: 91.140000000000001 | L907: 0 | M907: =SUM(J907:L907)-8.43 -> 82.710000000000008 | N907: 8.4299999999999997 | O907: =SUM(M907:N907) -> 91.140000000000015
A908: 3970 | B908: EOL SERRA DA BABILÔNIA D | C908: 30.062.725/0002-56 | D908: 77.510000000000005 | E908: 0 | F908: 0 | G908: 0 | H908: 0 | I908: 0 | J908: 0 | K908: 85.409999999999997 | L908: 0 | M908: =SUM(J908:L908)-7.9 -> 77.509999999999991 | N908: 7.9000000000000004 | O908: =SUM(M908:N908) -> 85.409999999999997
A909: 3971 | B909: UTE CGVE INNOVA | C909: 04.229.761/0011-42 | D909: 31.07 | E909: 0 | F909: 0 | G909: 0 | H909: 0 | I909: 0 | J909: 0 | K909: 34.240000000000002 | L909: 0 | M909: =SUM(J909:L909)-3.17 -> 31.07 | N909: 3.1699999999999999 | O909: =SUM(M909:N909) -> 34.240000000000002
A910: 3972 | B910: EOL SERRA DA BABILÔNIA F | C910: 30.234.798/0002-88 | D910: 66.140000000000001 | E910: 0 | F910: 0 | G910: 0 | H910: 0 | I910: 0 | J910: 0 | K910: 72.879999999999995 | L910: 0 | M910: =SUM(J910:L910)-6.74 -> 66.140000000000001 | N910: 6.7400000000000002 | O910: =SUM(M910:N910) -> 72.879999999999995
A911: 3973 | B911: EOL VENTOS DE SANTA ÂNGELA 16 | C911: 29.711.059/0001-70 | D911: 80.079999999999998 | E911: 0 | F911: 0 | G911: 0 | H911: 0 | I911: 0 | J911: 0 | K911: 88.239999999999995 | L911: 0 | M911: =SUM(J911:L911)-8.16 -> 80.079999999999998 | N911: 8.1600000000000001 | O911: =SUM(M911:N911) -> 88.239999999999995
A912: 3974 | B912: EOL VENTOS DE SANTA ÂNGELA 17 | C912: 29.579.025/0001-73 | D912: 148.16 | E912: 0 | F912: 0 | G912: 0 | H912: 0 | I912: 0 | J912: 0 | K912: 163.25999999999999 | L912: 0 | M912: =SUM(J912:L912)-15.1 -> 148.16 | N912: 15.1 | O912: =SUM(M912:N912) -> 163.25999999999999
A913: 3975 | B913: UFV SÃO GONÇALO 17 | C913: 31.762.229/0001-97 | D913: 111.39 | E913: 0 | F913: 0 | G913: 0 | H913: 0 | I913: 0 | J913: 0 | K913: 122.73999999999999 | L913: 0 | M913: =SUM(J913:L913)-11.35 -> 111.39 | N913: 11.35 | O913: =SUM(M913:N913) -> 122.73999999999999
A914: 3976 | B914: EOL SERRA DA BABILÔNIA E | C914: 30.062.736/0002-36 | D914: 82.719999999999999 | E914: 0 | F914: 0 | G914: 0 | H914: 0 | I914: 0 | J914: 0 | K914: 91.150000000000006 | L914: 0 | M914: =SUM(J914:L914)-8.43 -> 82.719999999999999 | N914: 8.4299999999999997 | O914: =SUM(M914:N914) -> 91.150000000000006
A915: 3977 | B915: EOL VENTOS DE SANTA MARTINA 01 | C915: 29.845.768/0002-29 | D915: 26.68 | E915: 0 | F915: 0 | G915: 0 | H915: 0 | I915: 0 | J915: 0 | K915: 29.399999999999999 | L915: 0 | M915: =SUM(J915:L915)-2.72 -> 26.68 | N915: 2.7200000000000002 | O915: =SUM(M915:N915) -> 29.399999999999999
A916: 3978 | B916: EOL VENTOS DE SANTA MARTINA 09 | C916: 29.845.721/0002-65 | D916: 26.68 | E916: 0 | F916: 0 | G916: 0 | H916: 0 | I916: 0 | J916: 0 | K916: 29.399999999999999 | L916: 0 | M916: =SUM(J916:L916)-2.72 -> 26.68 | N916: 2.7200000000000002 | O916: =SUM(M916:N916) -> 29.399999999999999
A917: 3979 | B917: EOL VENTOS DE SANTA MARTINA 10 | C917: 29.845.784/0002-11 | D917: 26.68 | E917: 0 | F917: 0 | G917: 0 | H917: 0 | I917: 0 | J917: 0 | K917: 29.399999999999999 | L917: 0 | M917: =SUM(J917:L917)-2.72 -> 26.68 | N917: 2.7200000000000002 | O917: =SUM(M917:N917) -> 29.399999999999999
A918: 3980 | B918: EOL VENTOS DE SANTA MARTINA 11 | C918: 29.845.761/0002-07 | D918: 26.68 | E918: 0 | F918: 0 | G918: 0 | H918: 0 | I918: 0 | J918: 0 | K918: 29.399999999999999 | L918: 0 | M918: =SUM(J918:L918)-2.72 -> 26.68 | N918: 2.7200000000000002 | O918: =SUM(M918:N918) -> 29.399999999999999
A919: 3981 | B919: EOL VENTOS DE SANTA MARTINA 12 | C919: 29.845.751/0002-71 | D919: 26.68 | E919: 0 | F919: 0 | G919: 0 | H919: 0 | I919: 0 | J919: 0 | K919: 29.399999999999999 | L919: 0 | M919: =SUM(J919:L919)-2.72 -> 26.68 | N919: 2.7200000000000002 | O919: =SUM(M919:N919) -> 29.399999999999999
A920: 3982 | B920: EOL VENTOS DE SANTA MARTINA 13 | C920: 29.845.794/0002-57 | D920: 28.460000000000001 | E920: 0 | F920: 0 | G920: 0 | H920: 0 | I920: 0 | J920: 0 | K920: 31.359999999999999 | L920: 0 | M920: =SUM(J920:L920)-2.9 -> 28.460000000000001 | N920: 2.8999999999999999 | O920: =SUM(M920:N920) -> 31.359999999999999
A921: 3983 | B921: EOL VENTOS DE SANTA MARTINA 14 | C921: 29.845.733/0002-90 | D921: 26.68 | E921: 0 | F921: 0 | G921: 0 | H921: 0 | I921: 0 | J921: 0 | K921: 29.399999999999999 | L921: 0 | M921: =SUM(J921:L921)-2.72 -> 26.68 | N921: 2.7200000000000002 | O921: =SUM(M921:N921) -> 29.399999999999999
A922: 3984 | B922: EOL TODA ENERGIA | C922: 36.160.050/0001-83 | D922: 67.099999999999994 | E922: 0 | F922: 0 | G922: 0 | H922: 0 | I922: 0 | J922: 0 | K922: 73.939999999999998 | L922: 0 | M922: =SUM(J922:L922)-6.84 -> 67.099999999999994 | N922: 6.8399999999999999 | O922: =SUM(M922:N922) -> 73.939999999999998
A923: 3985 | B923: EOL VENTOS DE SÃO JANUÁRIO 23 | C923: 23.037.514/0002-06 | D923: 19.960000000000001 | E923: 0 | F923: 0 | G923: 0 | H923: 0 | I923: 0 | J923: 0 | K923: 21.989999999999998 | L923: 0 | M923: =SUM(J923:L923)-2.03 -> 19.959999999999997 | N923: 2.0299999999999998 | O923: =SUM(M923:N923) -> 21.989999999999998
A924: 3986 | B924: UFV SÃO GONÇALO 15 | C924: 31.752.283/0001-51 | D924: 111.39 | E924: 0 | F924: 0 | G924: 0 | H924: 0 | I924: 0 | J924: 0 | K924: 122.73999999999999 | L924: 0 | M924: =SUM(J924:L924)-11.35 -> 111.39 | N924: 11.35 | O924: =SUM(M924:N924) -> 122.73999999999999
A925: 3987 | B925: UHE PORTO PRIMAVERA | C925: 60.933.603/0001-78 | D925: 9212.6900000000005 | E925: 0 | F925: 0 | G925: 0 | H925: 0 | I925: 0 | J925: 0 | K925: 10151.719999999999 | L925: 0 | M925: =SUM(J925:L925)-939.03 -> 9212.6899999999987 | N925: 939.02999999999997 | O925: =SUM(M925:N925) -> 10151.719999999999
A926: 3988 | B926: UFV SÃO GONÇALO 14 | C926: 31.791.620/0001-10 | D926: 111.39 | E926: 0 | F926: 0 | G926: 0 | H926: 0 | I926: 0 | J926: 0 | K926: 122.73999999999999 | L926: 0 | M926: =SUM(J926:L926)-11.35 -> 111.39 | N926: 11.35 | O926: =SUM(M926:N926) -> 122.73999999999999
A927: 3989 | B927: EOL CUMARU I | C927: 31.211.298/0002-93 | D927: 104.28 | E927: 0 | F927: 0 | G927: 0 | H927: 0 | I927: 0 | J927: 0 | K927: 114.91 | L927: 0 | M927: =SUM(J927:L927)-10.63 -> 104.28 | N927: 10.630000000000001 | O927: =SUM(M927:N927) -> 114.91
A928: 3990 | B928: EOL CUMARU II | C928: 31.216.345/0002-91 | D928: 104.28 | E928: 0 | F928: 0 | G928: 0 | H928: 0 | I928: 0 | J928: 0 | K928: 114.91 | L928: 0 | M928: =SUM(J928:L928)-10.63 -> 104.28 | N928: 10.630000000000001 | O928: =SUM(M928:N928) -> 114.91
A929: 3991 | B929: EOL VILA ESPÍRITO SANTO I | C929: 34.043.696/0001-55 | D929: 81 | E929: 0 | F929: 0 | G929: 0 | H929: 0 | I929: 0 | J929: 0 | K929: 89.260000000000005 | L929: 0 | M929: =SUM(J929:L929)-8.26 -> 81 | N929: 8.2599999999999998 | O929: =SUM(M929:N929) -> 89.260000000000005
A930: 3992 | B930: UFV TERRA DO SOL XI | C930: 31.533.486/0001-57 | D930: 122.23999999999999 | E930: 0 | F930: 0 | G930: 0 | H930: 0 | I930: 0 | J930: 0 | K930: 134.69999999999999 | L930: 0 | M930: =SUM(J930:L930)-12.46 -> 122.23999999999998 | N930: 12.460000000000001 | O930: =SUM(M930:N930) -> 134.69999999999999
A931: 3993 | B931: UFV SOL DO SERTÃO XXXVI | C931: 31.533.486/0001-57 | D931: 104.41 | E931: 0 | F931: 0 | G931: 0 | H931: 0 | I931: 0 | J931: 0 | K931: 115.05 | L931: 0 | M931: =SUM(J931:L931)-10.64 -> 104.41 | N931: 10.640000000000001 | O931: =SUM(M931:N931) -> 115.05
A932: 3994 | B932: UFV SOL DO SERTÃO VIII | C932: 31.534.389/0001-89 | D932: 244.47 | E932: 0 | F932: 0 | G932: 0 | H932: 0 | I932: 0 | J932: 0 | K932: 269.38999999999999 | L932: 0 | M932: =SUM(J932:L932)-24.92 -> 244.46999999999997 | N932: 24.920000000000002 | O932: =SUM(M932:N932) -> 269.38999999999999
A933: 3995 | B933: UFV SOL DO SERTÃO XIII | C933: 31.512.705/0001-11 | D933: 192.08000000000001 | E933: 0 | F933: 0 | G933: 0 | H933: 0 | I933: 0 | J933: 0 | K933: 211.66 | L933: 0 | M933: =SUM(J933:L933)-19.58 -> 192.07999999999998 | N933: 19.579999999999998 | O933: =SUM(M933:N933) -> 211.65999999999997
A934: 3996 | B934: EOL ANGICOS II | C934: 33.511.191/0001-05 | D934: 71.109999999999999 | E934: 0 | F934: 0 | G934: 0 | H934: 0 | I934: 0 | J934: 0 | K934: 78.359999999999999 | L934: 0 | M934: =SUM(J934:L934)-7.25 -> 71.109999999999999 | N934: 7.25 | O934: =SUM(M934:N934) -> 78.359999999999999
A935: 3997 | B935: EOL VILA ESPÍRITO SANTO III | C935: 34.043.685/0001-75 | D935: 91.120000000000005 | E935: 0 | F935: 0 | G935: 0 | H935: 0 | I935: 0 | J935: 0 | K935: 100.41 | L935: 0 | M935: =SUM(J935:L935)-9.29 -> 91.120000000000005 | N935: 9.2899999999999991 | O935: =SUM(M935:N935) -> 100.41
A936: 3998 | B936: EOL VILA ESPÍRITO SANTO IV | C936: 34.011.712/0001-28 | D936: 92.189999999999998 | E936: 0 | F936: 0 | G936: 0 | H936: 0 | I936: 0 | J936: 0 | K936: 101.59 | L936: 0 | M936: =SUM(J936:L936)-9.4 -> 92.189999999999998 | N936: 9.4000000000000004 | O936: =SUM(M936:N936) -> 101.59
A937: 3999 | B937: EOL VILA ESPÍRITO SANTO V | C937: 34.135.249/0001-26 | D937: 91.120000000000005 | E937: 0 | F937: 0 | G937: 0 | H937: 0 | I937: 0 | J937: 0 | K937: 100.41 | L937: 0 | M937: =SUM(J937:L937)-9.29 -> 91.120000000000005 | N937: 9.2899999999999991 | O937: =SUM(M937:N937) -> 100.41
A938: 40005 | B938: BTG PACTUAL | C938: 30.306.294/0002-26 | D938: 27.420000000000002 | E938: 0 | F938: 0 | G938: 0 | H938: 0 | I938: 0 | J938: 30.210000000000001 | K938: 0 | L938: 0 | M938: =SUM(J938:L938)-2.79 -> 27.420000000000002 | N938: 2.79 | O938: =SUM(M938:N938) -> 30.210000000000001
A939: 4001 | B939: UFV SOL DO SERTÃO XII | C939: 31.534.389/0001-89 | D939: 139.93000000000001 | E939: 0 | F939: 0 | G939: 0 | H939: 0 | I939: 0 | J939: 0 | K939: 154.19 | L939: 0 | M939: =SUM(J939:L939)-14.26 -> 139.93000000000001 | N939: 14.26 | O939: =SUM(M939:N939) -> 154.19
A940: 4002 | B940: UFV SOL DO SERTÃO XXXV | C940: 31.512.705/0001-11 | D940: 69.739999999999995 | E940: 0 | F940: 0 | G940: 0 | H940: 0 | I940: 0 | J940: 0 | K940: 76.849999999999994 | L940: 0 | M940: =SUM(J940:L940)-7.11 -> 69.739999999999995 | N940: 7.1100000000000003 | O940: =SUM(M940:N940) -> 76.849999999999994
A941: 4003 | B941: EOL CUMARU III | C941: 31.216.014/0002-51 | D941: 104.28 | E941: 0 | F941: 0 | G941: 0 | H941: 0 | I941: 0 | J941: 0 | K941: 114.91 | L941: 0 | M941: =SUM(J941:L941)-10.63 -> 104.28 | N941: 10.630000000000001 | O941: =SUM(M941:N941) -> 114.91
A942: 4004 | B942: EOL CUMARU IV | C942: 31.211.130/0002-88 | D942: 104.28 | E942: 0 | F942: 0 | G942: 0 | H942: 0 | I942: 0 | J942: 0 | K942: 114.91 | L942: 0 | M942: =SUM(J942:L942)-10.63 -> 104.28 | N942: 10.630000000000001 | O942: =SUM(M942:N942) -> 114.91
A943: 4005 | B943: EOL CUMARU V | C943: 31.210.772/0003-43 | D943: 93.849999999999994 | E943: 0 | F943: 0 | G943: 0 | H943: 0 | I943: 0 | J943: 0 | K943: 103.42 | L943: 0 | M943: =SUM(J943:L943)-9.57 -> 93.849999999999994 | N943: 9.5700000000000003 | O943: =SUM(M943:N943) -> 103.41999999999999
A944: 4006 | B944: EOL FILGUEIRA II | C944: 33.486.296/0001-51 | D944: 67.689999999999998 | E944: 0 | F944: 0 | G944: 0 | H944: 0 | I944: 0 | J944: 0 | K944: 74.590000000000003 | L944: 0 | M944: =SUM(J944:L944)-6.9 -> 67.689999999999998 | N944: 6.9000000000000004 | O944: =SUM(M944:N944) -> 74.590000000000003
A945: 4012 | B945: EOL VENTOS DA BAHIA XIV | C945: 31.818.978/0001-99 | D945: 109.31 | E945: 0 | F945: 0 | G945: 0 | H945: 0 | I945: 0 | J945: 0 | K945: 120.45 | L945: 0 | M945: =SUM(J945:L945)-11.14 -> 109.31 | N945: 11.140000000000001 | O945: =SUM(M945:N945) -> 120.45
A946: 4013 | B946: UFV ALEX IX | C946: 30.567.568/0001-50 | D946: 83.180000000000007 | E946: 0 | F946: 0 | G946: 0 | H946: 0 | I946: 0 | J946: 0 | K946: 91.659999999999997 | L946: 0 | M946: =SUM(J946:L946)-8.48 -> 83.179999999999993 | N946: 8.4800000000000004 | O946: =SUM(M946:N946) -> 91.659999999999997
A947: 4014 | B947: UFV ALEX X | C947: 30.567.559/0001-69 | D947: 69.819999999999993 | E947: 0 | F947: 0 | G947: 0 | H947: 0 | I947: 0 | J947: 0 | K947: 76.939999999999998 | L947: 0 | M947: =SUM(J947:L947)-7.12 -> 69.819999999999993 | N947: 7.1200000000000001 | O947: =SUM(M947:N947) -> 76.939999999999998
A948: 4015 | B948: EOL ANGICOS I | C948: 33.511.173/0001-23 | D948: 60.950000000000003 | E948: 0 | F948: 0 | G948: 0 | H948: 0 | I948: 0 | J948: 0 | K948: 67.159999999999997 | L948: 0 | M948: =SUM(J948:L948)-6.21 -> 60.949999999999996 | N948: 6.21 | O948: =SUM(M948:N948) -> 67.159999999999997
A949: 4018 | B949: EOL SERRA DO MATO I | C949: 32.398.781/0001-00 | D949: 49.030000000000001 | E949: 0 | F949: 0 | G949: 0 | H949: 0 | I949: 0 | J949: 0 | K949: 54.030000000000001 | L949: 0 | M949: =SUM(J949:L949)-5 -> 49.030000000000001 | N949: 5 | O949: =SUM(M949:N949) -> 54.030000000000001
A950: 4019 | B950: EOL VENTOS DE SANTA ESPERANÇA 08 | C950: 29.641.225/0002-90 | D950: 63.369999999999997 | E950: 0 | F950: 0 | G950: 0 | H950: 0 | I950: 0 | J950: 0 | K950: 69.829999999999998 | L950: 0 | M950: =SUM(J950:L950)-6.46 -> 63.369999999999997 | N950: 6.46 | O950: =SUM(M950:N950) -> 69.829999999999998
A951: 4020 | B951: EOL VENTOS DE SANTA ESPERANÇA 15 | C951: 29.552.609/0002-36 | D951: 155.43000000000001 | E951: 0 | F951: 0 | G951: 0 | H951: 0 | I951: 0 | J951: 0 | K951: 171.27000000000001 | L951: 0 | M951: =SUM(J951:L951)-15.84 -> 155.43000000000001 | N951: 15.84 | O951: =SUM(M951:N951) -> 171.27000000000001
A952: 4021 | B952: EOL VENTOS DE SANTA ESPERANÇA 16 | C952: 29.552.662/0002-37 | D952: 98.510000000000005 | E952: 0 | F952: 0 | G952: 0 | H952: 0 | I952: 0 | J952: 0 | K952: 108.55 | L952: 0 | M952: =SUM(J952:L952)-10.04 -> 98.509999999999991 | N952: 10.039999999999999 | O952: =SUM(M952:N952) -> 108.54999999999998
A953: 4022 | B953: EOL VENTOS DE SANTA ESPERANÇA 17 | C953: 29.587.306/0002-59 | D953: 141.31 | E953: 0 | F953: 0 | G953: 0 | H953: 0 | I953: 0 | J953: 0 | K953: 155.71000000000001 | L953: 0 | M953: =SUM(J953:L953)-14.4 -> 141.31 | N953: 14.4 | O953: =SUM(M953:N953) -> 155.71000000000001
A954: 4023 | B954: EOL VENTOS DE SANTA ESPERANÇA 21 | C954: 29.579.544/0002-12 | D954: 108.36 | E954: 0 | F954: 0 | G954: 0 | H954: 0 | I954: 0 | J954: 0 | K954: 119.40000000000001 | L954: 0 | M954: =SUM(J954:L954)-11.04 -> 108.36000000000001 | N954: 11.039999999999999 | O954: =SUM(M954:N954) -> 119.40000000000001
A955: 4024 | B955: EOL VENTOS DE SANTA ESPERANÇA 22 | C955: 29.618.696/0002-87 | D955: 108.36 | E955: 0 | F955: 0 | G955: 0 | H955: 0 | I955: 0 | J955: 0 | K955: 119.40000000000001 | L955: 0 | M955: =SUM(J955:L955)-11.04 -> 108.36000000000001 | N955: 11.039999999999999 | O955: =SUM(M955:N955) -> 119.40000000000001
A956: 4025 | B956: EOL VILA ESPÍRITO SANTO II | C956: 34.011.705/0001-26 | D956: 91.120000000000005 | E956: 0 | F956: 0 | G956: 0 | H956: 0 | I956: 0 | J956: 0 | K956: 100.41 | L956: 0 | M956: =SUM(J956:L956)-9.29 -> 91.120000000000005 | N956: 9.2899999999999991 | O956: =SUM(M956:N956) -> 100.41
A957: 4026 | B957: UTE FS SORRISO | C957: 20.003.699/0002-31 | D957: 49.520000000000003 | E957: 0 | F957: 0 | G957: 0 | H957: 0 | I957: 0 | J957: 0 | K957: 54.57 | L957: 0 | M957: =SUM(J957:L957)-5.05 -> 49.520000000000003 | N957: 5.0499999999999998 | O957: =SUM(M957:N957) -> 54.57
A958: 4027 | B958: EOL AFONSO BEZERRA I | C958: 33.511.218/0001-60 | D958: 71.109999999999999 | E958: 0 | F958: 0 | G958: 0 | H958: 0 | I958: 0 | J958: 0 | K958: 78.359999999999999 | L958: 0 | M958: =SUM(J958:L958)-7.25 -> 71.109999999999999 | N958: 7.25 | O958: =SUM(M958:N958) -> 78.359999999999999
A959: 4028 | B959: EOL AFONSO BEZERRA II | C959: 33.511.255/0001-78 | D959: 71.109999999999999 | E959: 0 | F959: 0 | G959: 0 | H959: 0 | I959: 0 | J959: 0 | K959: 78.359999999999999 | L959: 0 | M959: =SUM(J959:L959)-7.25 -> 71.109999999999999 | N959: 7.25 | O959: =SUM(M959:N959) -> 78.359999999999999
A960: 4029 | B960: UTE PUMA II | C960: 89.637.490/0165-72 | D960: 125.66 | E960: 0 | F960: 0 | G960: 0 | H960: 0 | I960: 0 | J960: 0 | K960: 138.47 | L960: 0 | M960: =SUM(J960:L960)-12.81 -> 125.66 | N960: 12.81 | O960: =SUM(M960:N960) -> 138.47
A961: 4030 | B961: UFV ALEX I | C961: 30.567.624/0001-56 | D961: 83.180000000000007 | E961: 0 | F961: 0 | G961: 0 | H961: 0 | I961: 0 | J961: 0 | K961: 91.659999999999997 | L961: 0 | M961: =SUM(J961:L961)-8.48 -> 83.179999999999993 | N961: 8.4800000000000004 | O961: =SUM(M961:N961) -> 91.659999999999997
A962: 4031 | B962: UFV ALEX III | C962: 30.567.591/0001-44 | D962: 83.180000000000007 | E962: 0 | F962: 0 | G962: 0 | H962: 0 | I962: 0 | J962: 0 | K962: 91.659999999999997 | L962: 0 | M962: =SUM(J962:L962)-8.48 -> 83.179999999999993 | N962: 8.4800000000000004 | O962: =SUM(M962:N962) -> 91.659999999999997
A963: 4032 | B963: UFV ALEX IV | C963: 30.567.615/0001-65 | D963: 83.180000000000007 | E963: 0 | F963: 0 | G963: 0 | H963: 0 | I963: 0 | J963: 0 | K963: 91.659999999999997 | L963: 0 | M963: =SUM(J963:L963)-8.48 -> 83.179999999999993 | N963: 8.4800000000000004 | O963: =SUM(M963:N963) -> 91.659999999999997
A964: 4033 | B964: UFV ALEX V | C964: 30.567.603/0001-30 | D964: 83.180000000000007 | E964: 0 | F964: 0 | G964: 0 | H964: 0 | I964: 0 | J964: 0 | K964: 91.659999999999997 | L964: 0 | M964: =SUM(J964:L964)-8.48 -> 83.179999999999993 | N964: 8.4800000000000004 | O964: =SUM(M964:N964) -> 91.659999999999997
A965: 4034 | B965: UFV ALEX VI | C965: 30.567.543/0001-56 | D965: 83.180000000000007 | E965: 0 | F965: 0 | G965: 0 | H965: 0 | I965: 0 | J965: 0 | K965: 91.659999999999997 | L965: 0 | M965: =SUM(J965:L965)-8.48 -> 83.179999999999993 | N965: 8.4800000000000004 | O965: =SUM(M965:N965) -> 91.659999999999997
A966: 4035 | B966: UFV ALEX VII | C966: 30.567.582/0001-53 | D966: 83.180000000000007 | E966: 0 | F966: 0 | G966: 0 | H966: 0 | I966: 0 | J966: 0 | K966: 91.659999999999997 | L966: 0 | M966: =SUM(J966:L966)-8.48 -> 83.179999999999993 | N966: 8.4800000000000004 | O966: =SUM(M966:N966) -> 91.659999999999997
A967: 4036 | B967: UFV ALEX VIII | C967: 30.567.573/0001-62 | D967: 83.180000000000007 | E967: 0 | F967: 0 | G967: 0 | H967: 0 | I967: 0 | J967: 0 | K967: 91.659999999999997 | L967: 0 | M967: =SUM(J967:L967)-8.48 -> 83.179999999999993 | N967: 8.4800000000000004 | O967: =SUM(M967:N967) -> 91.659999999999997
A968: 4037 | B968: UTE BRACELL | C968: 53.943.098/0001-87 | D968: 387.22000000000003 | E968: 0 | F968: 0 | G968: 0 | H968: 0 | I968: 0 | J968: 0 | K968: 426.69 | L968: 0 | M968: =SUM(J968:L968)-39.47 -> 387.22000000000003 | N968: 39.469999999999999 | O968: =SUM(M968:N968) -> 426.69000000000005
A969: 4038 | B969: EOL FILGUEIRA I | C969: 33.486.289/0001-50 | D969: 93.079999999999998 | E969: 0 | F969: 0 | G969: 0 | H969: 0 | I969: 0 | J969: 0 | K969: 102.56999999999999 | L969: 0 | M969: =SUM(J969:L969)-9.49 -> 93.079999999999998 | N969: 9.4900000000000002 | O969: =SUM(M969:N969) -> 102.56999999999999
A970: 4039 | B970: EOL SERRA DO MATO II | C970: 32.326.077/0001-42 | D970: 49.030000000000001 | E970: 0 | F970: 0 | G970: 0 | H970: 0 | I970: 0 | J970: 0 | K970: 54.030000000000001 | L970: 0 | M970: =SUM(J970:L970)-5 -> 49.030000000000001 | N970: 5 | O970: =SUM(M970:N970) -> 54.030000000000001
A971: 4040 | B971: EOL VENTOS DE SANTA ESPERANÇA 25 | C971: 29.616.244/0002-66 | D971: 63.369999999999997 | E971: 0 | F971: 0 | G971: 0 | H971: 0 | I971: 0 | J971: 0 | K971: 69.829999999999998 | L971: 0 | M971: =SUM(J971:L971)-6.46 -> 63.369999999999997 | N971: 6.46 | O971: =SUM(M971:N971) -> 69.829999999999998
A972: 4041 | B972: EOL VENTOS DE SANTA ESPERANÇA 26 | C972: 29.617.129/0002-06 | D972: 108.36 | E972: 0 | F972: 0 | G972: 0 | H972: 0 | I972: 0 | J972: 0 | K972: 119.40000000000001 | L972: 0 | M972: =SUM(J972:L972)-11.04 -> 108.36000000000001 | N972: 11.039999999999999 | O972: =SUM(M972:N972) -> 119.40000000000001
A973: 4042 | B973: EOL VILA ALAGOAS II | C973: 34.109.311/0001-05 | D973: 50.640000000000001 | E973: 0 | F973: 0 | G973: 0 | H973: 0 | I973: 0 | J973: 0 | K973: 55.799999999999997 | L973: 0 | M973: =SUM(J973:L973)-5.16 -> 50.640000000000001 | N973: 5.1600000000000001 | O973: =SUM(M973:N973) -> 55.799999999999997
A974: 4043 | B974: UFV SOL DO SERTÃO XIV | C974: 31.512.705/0001-11 | D974: 52.289999999999999 | E974: 0 | F974: 0 | G974: 0 | H974: 0 | I974: 0 | J974: 0 | K974: 57.619999999999997 | L974: 0 | M974: =SUM(J974:L974)-5.33 -> 52.289999999999999 | N974: 5.3300000000000001 | O974: =SUM(M974:N974) -> 57.619999999999997
A975: 4044 | B975: UFV TERRA DO SOL VII | C975: 31.533.486/0001-57 | D975: 139.80000000000001 | E975: 0 | F975: 0 | G975: 0 | H975: 0 | I975: 0 | J975: 0 | K975: 154.05000000000001 | L975: 0 | M975: =SUM(J975:L975)-14.25 -> 139.80000000000001 | N975: 14.25 | O975: =SUM(M975:N975) -> 154.05000000000001
A976: 4047 | B976: UFV COREMAS VII | C976: 34.920.805/0001-75 | D976: 65.379999999999995 | E976: 0 | F976: 0 | G976: 0 | H976: 0 | I976: 0 | J976: 0 | K976: 72.040000000000006 | L976: 0 | M976: =SUM(J976:L976)-6.66 -> 65.38000000000001 | N976: 6.6600000000000001 | O976: =SUM(M976:N976) -> 72.040000000000006
A977: 4048 | B977: EOL TACAICÓ II | C977: 32.829.695/0002-96 | D977: 130.56 | E977: 0 | F977: 0 | G977: 0 | H977: 0 | I977: 0 | J977: 0 | K977: 143.87 | L977: 0 | M977: =SUM(J977:L977)-13.31 -> 130.56 | N977: 13.31 | O977: =SUM(M977:N977) -> 143.87
A978: 4049 | B978: EOL VENTOS DA BAHIA XIII | C978: 31.810.463/0001-42 | D978: 163.94 | E978: 0 | F978: 0 | G978: 0 | H978: 0 | I978: 0 | J978: 0 | K978: 180.65000000000001 | L978: 0 | M978: =SUM(J978:L978)-16.71 -> 163.94 | N978: 16.710000000000001 | O978: =SUM(M978:N978) -> 180.65000000000001
A979: 4050 | B979: UFV JUAZEIRO SOLAR VI | C979: 34.742.960/0001-49 | D979: 126.52 | E979: 0 | F979: 0 | G979: 0 | H979: 0 | I979: 0 | J979: 0 | K979: 139.41999999999999 | L979: 0 | M979: =SUM(J979:L979)-12.9 -> 126.51999999999998 | N979: 12.9 | O979: =SUM(M979:N979) -> 139.41999999999999
A980: 4051 | B980: UFV JUAZEIRO SOLAR VIII | C980: 34.742.951/0001-58 | D980: 40.659999999999997 | E980: 0 | F980: 0 | G980: 0 | H980: 0 | I980: 0 | J980: 0 | K980: 44.799999999999997 | L980: 0 | M980: =SUM(J980:L980)-4.14 -> 40.659999999999997 | N980: 4.1399999999999997 | O980: =SUM(M980:N980) -> 44.799999999999997
A981: 4052 | B981: UFV JUAZEIRO SOLAR V | C981: 34.742.964/0001-27 | D981: 126.52 | E981: 0 | F981: 0 | G981: 0 | H981: 0 | I981: 0 | J981: 0 | K981: 139.41999999999999 | L981: 0 | M981: =SUM(J981:L981)-12.9 -> 126.51999999999998 | N981: 12.9 | O981: =SUM(M981:N981) -> 139.41999999999999
A982: 4053 | B982: UFV JUAZEIRO SOLAR VII | C982: 34.751.530/0001-93 | D982: 126.52 | E982: 0 | F982: 0 | G982: 0 | H982: 0 | I982: 0 | J982: 0 | K982: 139.41999999999999 | L982: 0 | M982: =SUM(J982:L982)-12.9 -> 126.51999999999998 | N982: 12.9 | O982: =SUM(M982:N982) -> 139.41999999999999
A983: 4054 | B983: EOL PAU FERRO II | C983: 32.829.774/0002-05 | D983: 126.55 | E983: 0 | F983: 0 | G983: 0 | H983: 0 | I983: 0 | J983: 0 | K983: 139.44999999999999 | L983: 0 | M983: =SUM(J983:L983)-12.9 -> 126.54999999999998 | N983: 12.9 | O983: =SUM(M983:N983) -> 139.44999999999999
A984: 4055 | B984: EOL SERRA DO MATO III | C984: 32.326.123/0001-03 | D984: 49.030000000000001 | E984: 0 | F984: 0 | G984: 0 | H984: 0 | I984: 0 | J984: 0 | K984: 54.030000000000001 | L984: 0 | M984: =SUM(J984:L984)-5 -> 49.030000000000001 | N984: 5 | O984: =SUM(M984:N984) -> 54.030000000000001
A985: 4058 | B985: EOL AURA QUEIMADA NOVA 01 | C985: 35.572.851/0002-74 | D985: 80 | E985: 0 | F985: 0 | G985: 0 | H985: 0 | I985: 0 | J985: 0 | K985: 88.150000000000006 | L985: 0 | M985: =SUM(J985:L985)-8.15 -> 80 | N985: 8.1500000000000004 | O985: =SUM(M985:N985) -> 88.150000000000006
A986: 4059 | B986: EOL GRAVIER | C986: 23.793.827/0001-03 | D986: 171.94999999999999 | E986: 0 | F986: 0 | G986: 0 | H986: 0 | I986: 0 | J986: 0 | K986: 189.47999999999999 | L986: 0 | M986: =SUM(J986:L986)-17.53 -> 171.94999999999999 | N986: 17.530000000000001 | O986: =SUM(M986:N986) -> 189.47999999999999
A987: 4060 | B987: EOL VENTOS DE SANTA ESPERANÇA 13 | C987: 29.552.763/0002-08 | D987: 113.06 | E987: 0 | F987: 0 | G987: 0 | H987: 0 | I987: 0 | J987: 0 | K987: 124.58 | L987: 0 | M987: =SUM(J987:L987)-11.52 -> 113.06 | N987: 11.52 | O987: =SUM(M987:N987) -> 124.58
A988: 4061 | B988: EOL AURA QUEIMADA NOVA 02 | C988: 35.603.267/0002-39 | D988: 122.98999999999999 | E988: 0 | F988: 0 | G988: 0 | H988: 0 | I988: 0 | J988: 0 | K988: 135.53 | L988: 0 | M988: =SUM(J988:L988)-12.54 -> 122.99000000000001 | N988: 12.539999999999999 | O988: =SUM(M988:N988) -> 135.53
A989: 4062 | B989: UFV COREMAS IV | C989: 34.921.036/0001-20 | D989: 65.379999999999995 | E989: 0 | F989: 0 | G989: 0 | H989: 0 | I989: 0 | J989: 0 | K989: 72.040000000000006 | L989: 0 | M989: =SUM(J989:L989)-6.66 -> 65.38000000000001 | N989: 6.6600000000000001 | O989: =SUM(M989:N989) -> 72.040000000000006
A990: 4063 | B990: UFV COREMAS V | C990: 34.920.838/0001-15 | D990: 65.379999999999995 | E990: 0 | F990: 0 | G990: 0 | H990: 0 | I990: 0 | J990: 0 | K990: 72.040000000000006 | L990: 0 | M990: =SUM(J990:L990)-6.66 -> 65.38000000000001 | N990: 6.6600000000000001 | O990: =SUM(M990:N990) -> 72.040000000000006
A991: 4064 | B991: UFV COREMAS VI | C991: 34.850.666/0001-50 | D991: 65.379999999999995 | E991: 0 | F991: 0 | G991: 0 | H991: 0 | I991: 0 | J991: 0 | K991: 72.040000000000006 | L991: 0 | M991: =SUM(J991:L991)-6.66 -> 65.38000000000001 | N991: 6.6600000000000001 | O991: =SUM(M991:N991) -> 72.040000000000006
A992: 4067 | B992: EOL VENTOS DA BAHIA XXIII | C992: 31.782.653/0001-01 | D992: 163.93000000000001 | E992: 0 | F992: 0 | G992: 0 | H992: 0 | I992: 0 | J992: 0 | K992: 180.63999999999999 | L992: 0 | M992: =SUM(J992:L992)-16.71 -> 163.92999999999998 | N992: 16.710000000000001 | O992: =SUM(M992:N992) -> 180.63999999999999
A993: 4068 | B993: EOL SERRA DO MATO IV | C993: 32.326.120/0001-70 | D993: 49.030000000000001 | E993: 0 | F993: 0 | G993: 0 | H993: 0 | I993: 0 | J993: 0 | K993: 54.030000000000001 | L993: 0 | M993: =SUM(J993:L993)-5 -> 49.030000000000001 | N993: 5 | O993: =SUM(M993:N993) -> 54.030000000000001
A994: 4069 | B994: EOL SERRA DO MATO V | C994: 32.326.115/0001-67 | D994: 49.030000000000001 | E994: 0 | F994: 0 | G994: 0 | H994: 0 | I994: 0 | J994: 0 | K994: 54.030000000000001 | L994: 0 | M994: =SUM(J994:L994)-5 -> 49.030000000000001 | N994: 5 | O994: =SUM(M994:N994) -> 54.030000000000001
A995: 4070 | B995: EOL SERRA DO MATO VI | C995: 32.326.113/0001-78 | D995: 39.219999999999999 | E995: 0 | F995: 0 | G995: 0 | H995: 0 | I995: 0 | J995: 0 | K995: 43.219999999999999 | L995: 0 | M995: =SUM(J995:L995)-4 -> 39.219999999999999 | N995: 4 | O995: =SUM(M995:N995) -> 43.219999999999999
A996: 4071 | B996: EOL ACAUÃ III | C996: 35.842.711/0001-98 | D996: 49.549999999999997 | E996: 0 | F996: 0 | G996: 0 | H996: 0 | I996: 0 | J996: 0 | K996: 54.600000000000001 | L996: 0 | M996: =SUM(J996:L996)-5.05 -> 49.550000000000004 | N996: 5.0499999999999998 | O996: =SUM(M996:N996) -> 54.600000000000001
A997: 4072 | B997: EOL AFONSO BEZERRA III | C997: 33.511.325/0001-98 | D997: 71.109999999999999 | E997: 0 | F997: 0 | G997: 0 | H997: 0 | I997: 0 | J997: 0 | K997: 78.359999999999999 | L997: 0 | M997: =SUM(J997:L997)-7.25 -> 71.109999999999999 | N997: 7.25 | O997: =SUM(M997:N997) -> 78.359999999999999
A998: 4073 | B998: EOL AFONSO BEZERRA IV | C998: 33.511.347/0001-58 | D998: 40.649999999999999 | E998: 0 | F998: 0 | G998: 0 | H998: 0 | I998: 0 | J998: 0 | K998: 44.789999999999999 | L998: 0 | M998: =SUM(J998:L998)-4.14 -> 40.649999999999999 | N998: 4.1399999999999997 | O998: =SUM(M998:N998) -> 44.789999999999999
A999: 4076 | B999: UFV COREMAS VIII | C999: 36.571.485/0001-10 | D999: 65.379999999999995 | E999: 0 | F999: 0 | G999: 0 | H999: 0 | I999: 0 | J999: 0 | K999: 72.040000000000006 | L999: 0 | M999: =SUM(J999:L999)-6.66 -> 65.38000000000001 | N999: 6.6600000000000001 | O999: =SUM(M999:N999) -> 72.040000000000006
A1000: 4077 | B1000: EOL TUCANO VI | C1000: 36.230.315/0001-72 | D1000: 108.51000000000001 | E1000: 0 | F1000: 0 | G1000: 0 | H1000: 0 | I1000: 0 | J1000: 0 | K1000: 119.56999999999999 | L1000: 0 | M1000: =SUM(J1000:L1000)-11.06 -> 108.50999999999999 | N1000: 11.06 | O1000: =SUM(M1000:N1000) -> 119.56999999999999
A1001: 4103 | B1001: UFV BELMONTE 1-1 | C1001: 30.418.521/0001-24 | D1001: 120.75 | E1001: 0 | F1001: 0 | G1001: 0 | H1001: 0 | I1001: 0 | J1001: 0 | K1001: 133.06 | L1001: 0 | M1001: =SUM(J1001:L1001)-12.31 -> 120.75 | N1001: 12.31 | O1001: =SUM(M1001:N1001) -> 133.06
A1002: 4104 | B1002: UFV BELMONTE 1-2 | C1002: 30.418.521/0001-24 | D1002: 120.75 | E1002: 0 | F1002: 0 | G1002: 0 | H1002: 0 | I1002: 0 | J1002: 0 | K1002: 133.06 | L1002: 0 | M1002: =SUM(J1002:L1002)-12.31 -> 120.75 | N1002: 12.31 | O1002: =SUM(M1002:N1002) -> 133.06
A1003: 4105 | B1003: UFV BELMONTE 1-3 | C1003: 30.418.521/0001-24 | D1003: 120.75 | E1003: 0 | F1003: 0 | G1003: 0 | H1003: 0 | I1003: 0 | J1003: 0 | K1003: 133.06 | L1003: 0 | M1003: =SUM(J1003:L1003)-12.31 -> 120.75 | N1003: 12.31 | O1003: =SUM(M1003:N1003) -> 133.06
A1004: 4106 | B1004: UFV BELMONTE 1-4 | C1004: 30.418.521/0001-24 | D1004: 12.07 | E1004: 0 | F1004: 0 | G1004: 0 | H1004: 0 | I1004: 0 | J1004: 0 | K1004: 13.300000000000001 | L1004: 0 | M1004: =SUM(J1004:L1004)-1.23 -> 12.07 | N1004: 1.23 | O1004: =SUM(M1004:N1004) -> 13.300000000000001
A1005: 4107 | B1005: UFV BELMONTE 2-1 | C1005: 30.418.547/0001-72 | D1005: 124.02 | E1005: 0 | F1005: 0 | G1005: 0 | H1005: 0 | I1005: 0 | J1005: 0 | K1005: 136.66 | L1005: 0 | M1005: =SUM(J1005:L1005)-12.64 -> 124.02 | N1005: 12.640000000000001 | O1005: =SUM(M1005:N1005) -> 136.66
A1006: 4108 | B1006: UFV BELMONTE 2-2 | C1006: 30.418.547/0001-72 | D1006: 124.02 | E1006: 0 | F1006: 0 | G1006: 0 | H1006: 0 | I1006: 0 | J1006: 0 | K1006: 136.66 | L1006: 0 | M1006: =SUM(J1006:L1006)-12.64 -> 124.02 | N1006: 12.640000000000001 | O1006: =SUM(M1006:N1006) -> 136.66
A1007: 4109 | B1007: UFV BELMONTE 2-3 | C1007: 30.418.547/0001-72 | D1007: 124.02 | E1007: 0 | F1007: 0 | G1007: 0 | H1007: 0 | I1007: 0 | J1007: 0 | K1007: 136.66 | L1007: 0 | M1007: =SUM(J1007:L1007)-12.64 -> 124.02 | N1007: 12.640000000000001 | O1007: =SUM(M1007:N1007) -> 136.66
A1008: 4110 | B1008: UFV BELMONTE 2-4 | C1008: 30.418.547/0001-72 | D1008: 124.02 | E1008: 0 | F1008: 0 | G1008: 0 | H1008: 0 | I1008: 0 | J1008: 0 | K1008: 136.66 | L1008: 0 | M1008: =SUM(J1008:L1008)-12.64 -> 124.02 | N1008: 12.640000000000001 | O1008: =SUM(M1008:N1008) -> 136.66
A1009: 4111 | B1009: UFV BELMONTE 2-5 | C1009: 30.418.547/0001-72 | D1009: 124.02 | E1009: 0 | F1009: 0 | G1009: 0 | H1009: 0 | I1009: 0 | J1009: 0 | K1009: 136.66 | L1009: 0 | M1009: =SUM(J1009:L1009)-12.64 -> 124.02 | N1009: 12.640000000000001 | O1009: =SUM(M1009:N1009) -> 136.66
A1010: 4112 | B1010: UFV BELMONTE 2-6 | C1010: 30.418.547/0001-72 | D1010: 124.02 | E1010: 0 | F1010: 0 | G1010: 0 | H1010: 0 | I1010: 0 | J1010: 0 | K1010: 136.66 | L1010: 0 | M1010: =SUM(J1010:L1010)-12.64 -> 124.02 | N1010: 12.640000000000001 | O1010: =SUM(M1010:N1010) -> 136.66
A1011: 4113 | B1011: UFV LAVRAS 1 | C1011: 30.806.144/0001-09 | D1011: 57.310000000000002 | E1011: 0 | F1011: 0 | G1011: 0 | H1011: 0 | I1011: 0 | J1011: 0 | K1011: 63.149999999999999 | L1011: 0 | M1011: =SUM(J1011:L1011)-5.84 -> 57.310000000000002 | N1011: 5.8399999999999999 | O1011: =SUM(M1011:N1011) -> 63.150000000000006
A1012: 4114 | B1012: UFV LAVRAS 2 | C1012: 30.806.150/0001-58 | D1012: 57.310000000000002 | E1012: 0 | F1012: 0 | G1012: 0 | H1012: 0 | I1012: 0 | J1012: 0 | K1012: 63.149999999999999 | L1012: 0 | M1012: =SUM(J1012:L1012)-5.84 -> 57.310000000000002 | N1012: 5.8399999999999999 | O1012: =SUM(M1012:N1012) -> 63.150000000000006
A1013: 4115 | B1013: UFV LAVRAS 3 | C1013: 30.806.162/0001-82 | D1013: 57.310000000000002 | E1013: 0 | F1013: 0 | G1013: 0 | H1013: 0 | I1013: 0 | J1013: 0 | K1013: 63.149999999999999 | L1013: 0 | M1013: =SUM(J1013:L1013)-5.84 -> 57.310000000000002 | N1013: 5.8399999999999999 | O1013: =SUM(M1013:N1013) -> 63.150000000000006
A1014: 4116 | B1014: UFV LAVRAS 4 | C1014: 30.806.156/0001-25 | D1014: 57.310000000000002 | E1014: 0 | F1014: 0 | G1014: 0 | H1014: 0 | I1014: 0 | J1014: 0 | K1014: 63.149999999999999 | L1014: 0 | M1014: =SUM(J1014:L1014)-5.84 -> 57.310000000000002 | N1014: 5.8399999999999999 | O1014: =SUM(M1014:N1014) -> 63.150000000000006
A1015: 4117 | B1015: UFV LAVRAS 5 | C1015: 30.806.179/0001-30 | D1015: 57.310000000000002 | E1015: 0 | F1015: 0 | G1015: 0 | H1015: 0 | I1015: 0 | J1015: 0 | K1015: 63.149999999999999 | L1015: 0 | M1015: =SUM(J1015:L1015)-5.84 -> 57.310000000000002 | N1015: 5.8399999999999999 | O1015: =SUM(M1015:N1015) -> 63.150000000000006
A1016: 4118 | B1016: UFV XAXADO 1 | C1016: 37.427.693/0001-03 | D1016: 79 | E1016: 0 | F1016: 0 | G1016: 0 | H1016: 0 | I1016: 0 | J1016: 0 | K1016: 87.049999999999997 | L1016: 0 | M1016: =SUM(J1016:L1016)-8.05 -> 79 | N1016: 8.0500000000000007 | O1016: =SUM(M1016:N1016) -> 87.049999999999997
A1017: 4119 | B1017: UFV XAXADO 2 | C1017: 37.427.699/0001-80 | D1017: 79 | E1017: 0 | F1017: 0 | G1017: 0 | H1017: 0 | I1017: 0 | J1017: 0 | K1017: 87.049999999999997 | L1017: 0 | M1017: =SUM(J1017:L1017)-8.05 -> 79 | N1017: 8.0500000000000007 | O1017: =SUM(M1017:N1017) -> 87.049999999999997
A1018: 4120 | B1018: UFV XAXADO 3 | C1018: 37.427.691/0001-14 | D1018: 79 | E1018: 0 | F1018: 0 | G1018: 0 | H1018: 0 | I1018: 0 | J1018: 0 | K1018: 87.049999999999997 | L1018: 0 | M1018: =SUM(J1018:L1018)-8.05 -> 79 | N1018: 8.0500000000000007 | O1018: =SUM(M1018:N1018) -> 87.049999999999997
A1019: 4121 | B1019: EOL VENTOS DA BAHIA XXVII | C1019: 32.124.546/0001-40 | D1019: 163.84999999999999 | E1019: 0 | F1019: 0 | G1019: 0 | H1019: 0 | I1019: 0 | J1019: 0 | K1019: 180.55000000000001 | L1019: 0 | M1019: =SUM(J1019:L1019)-16.7 -> 163.85000000000002 | N1019: 16.699999999999999 | O1019: =SUM(M1019:N1019) -> 180.55000000000001
A1020: 4122 | B1020: EOL CANUDOS I | C1020: 35.474.191/0001-08 | D1020: 111.19 | E1020: 0 | F1020: 0 | G1020: 0 | H1020: 0 | I1020: 0 | J1020: 0 | K1020: 122.52 | L1020: 0 | M1020: =SUM(J1020:L1020)-11.33 -> 111.19 | N1020: 11.33 | O1020: =SUM(M1020:N1020) -> 122.52
A1021: 4123 | B1021: EOL TUCANO VII | C1021: 36.230.329/0001-96 | D1021: 122.08 | E1021: 0 | F1021: 0 | G1021: 0 | H1021: 0 | I1021: 0 | J1021: 0 | K1021: 134.52000000000001 | L1021: 0 | M1021: =SUM(J1021:L1021)-12.44 -> 122.08000000000001 | N1021: 12.44 | O1021: =SUM(M1021:N1021) -> 134.52000000000001
A1022: 4125 | B1022: EOL TUCANO VIII | C1022: 36.230.295/0001-30 | D1022: 108.51000000000001 | E1022: 0 | F1022: 0 | G1022: 0 | H1022: 0 | I1022: 0 | J1022: 0 | K1022: 119.56999999999999 | L1022: 0 | M1022: =SUM(J1022:L1022)-11.06 -> 108.50999999999999 | N1022: 11.06 | O1022: =SUM(M1022:N1022) -> 119.56999999999999
A1023: 4126 | B1023: EOL CANUDOS II | C1023: 35.417.771/0001-63 | D1023: 111.19 | E1023: 0 | F1023: 0 | G1023: 0 | H1023: 0 | I1023: 0 | J1023: 0 | K1023: 122.52 | L1023: 0 | M1023: =SUM(J1023:L1023)-11.33 -> 111.19 | N1023: 11.33 | O1023: =SUM(M1023:N1023) -> 122.52
A1024: 4127 | B1024: UTE PARNAÍBA V | C1024: 15.743.303/0001-71 | D1024: 2236.9299999999998 | E1024: 0 | F1024: 0 | G1024: 0 | H1024: 0 | I1024: 0 | J1024: 0 | K1024: 2464.9400000000001 | L1024: 0 | M1024: =SUM(J1024:L1024)-228.01 -> 2236.9300000000003 | N1024: 228.00999999999999 | O1024: =SUM(M1024:N1024) -> 2464.9400000000005
A1025: 4128 | B1025: EOL BOQUEIRAO I | C1025: 31.252.889/0002-09 | D1025: 100.63 | E1025: 0 | F1025: 0 | G1025: 0 | H1025: 0 | I1025: 0 | J1025: 0 | K1025: 110.89 | L1025: 0 | M1025: =SUM(J1025:L1025)-10.26 -> 100.63 | N1025: 10.26 | O1025: =SUM(M1025:N1025) -> 110.89
A1026: 4129 | B1026: EOL BOQUEIRAO II | C1026: 31.232.196/0002-54 | D1026: 90.109999999999999 | E1026: 0 | F1026: 0 | G1026: 0 | H1026: 0 | I1026: 0 | J1026: 0 | K1026: 99.290000000000006 | L1026: 0 | M1026: =SUM(J1026:L1026)-9.18 -> 90.110000000000014 | N1026: 9.1799999999999997 | O1026: =SUM(M1026:N1026) -> 99.29000000000002
A1027: 4130 | B1027: EOL JERUSALÉM I | C1027: 30.785.922/0002-01 | D1027: 86.25 | E1027: 0 | F1027: 0 | G1027: 0 | H1027: 0 | I1027: 0 | J1027: 0 | K1027: 95.040000000000006 | L1027: 0 | M1027: =SUM(J1027:L1027)-8.79 -> 86.25 | N1027: 8.7899999999999991 | O1027: =SUM(M1027:N1027) -> 95.039999999999992
A1028: 4131 | B1028: EOL JERUSALÉM II | C1028: 30.798.864/0002-42 | D1028: 86.400000000000006 | E1028: 0 | F1028: 0 | G1028: 0 | H1028: 0 | I1028: 0 | J1028: 0 | K1028: 95.209999999999994 | L1028: 0 | M1028: =SUM(J1028:L1028)-8.81 -> 86.399999999999991 | N1028: 8.8100000000000005 | O1028: =SUM(M1028:N1028) -> 95.209999999999994
A1029: 4132 | B1029: EOL JERUSALÉM III | C1029: 31.231.701/0002-46 | D1029: 86.370000000000005 | E1029: 0 | F1029: 0 | G1029: 0 | H1029: 0 | I1029: 0 | J1029: 0 | K1029: 95.170000000000002 | L1029: 0 | M1029: =SUM(J1029:L1029)-8.8 -> 86.370000000000005 | N1029: 8.8000000000000007 | O1029: =SUM(M1029:N1029) -> 95.170000000000002
A1030: 4133 | B1030: EOL JERUSALÉM IV | C1030: 31.207.208/0002-90 | D1030: 86.189999999999998 | E1030: 0 | F1030: 0 | G1030: 0 | H1030: 0 | I1030: 0 | J1030: 0 | K1030: 94.980000000000004 | L1030: 0 | M1030: =SUM(J1030:L1030)-8.79 -> 86.189999999999998 | N1030: 8.7899999999999991 | O1030: =SUM(M1030:N1030) -> 94.97999999999999
A1031: 4134 | B1031: EOL JERUSALÉM V | C1031: 31.207.206/0002-00 | D1031: 86.239999999999995 | E1031: 0 | F1031: 0 | G1031: 0 | H1031: 0 | I1031: 0 | J1031: 0 | K1031: 95.030000000000001 | L1031: 0 | M1031: =SUM(J1031:L1031)-8.79 -> 86.240000000000009 | N1031: 8.7899999999999991 | O1031: =SUM(M1031:N1031) -> 95.030000000000001
A1032: 4135 | B1032: EOL JERUSALÉM VI | C1032: 31.190.337/0002-13 | D1032: 98.5 | E1032: 0 | F1032: 0 | G1032: 0 | H1032: 0 | I1032: 0 | J1032: 0 | K1032: 108.54000000000001 | L1032: 0 | M1032: =SUM(J1032:L1032)-10.04 -> 98.5 | N1032: 10.039999999999999 | O1032: =SUM(M1032:N1032) -> 108.53999999999999
A1033: 4136 | B1033: EOL MONTE VERDE I | C1033: 31.199.583/0002-36 | D1033: 198.09999999999999 | E1033: 0 | F1033: 0 | G1033: 0 | H1033: 0 | I1033: 0 | J1033: 0 | K1033: 218.28999999999999 | L1033: 0 | M1033: =SUM(J1033:L1033)-20.19 -> 198.09999999999999 | N1033: 20.190000000000001 | O1033: =SUM(M1033:N1033) -> 218.28999999999999
A1034: 4137 | B1034: EOL MONTE VERDE II | C1034: 31.199.569/0002-32 | D1034: 198.21000000000001 | E1034: 0 | F1034: 0 | G1034: 0 | H1034: 0 | I1034: 0 | J1034: 0 | K1034: 218.41 | L1034: 0 | M1034: =SUM(J1034:L1034)-20.2 -> 198.21000000000001 | N1034: 20.199999999999999 | O1034: =SUM(M1034:N1034) -> 218.41
A1035: 4138 | B1035: EOL MONTE VERDE III | C1035: 31.199.512/0002-33 | D1035: 173.53999999999999 | E1035: 0 | F1035: 0 | G1035: 0 | H1035: 0 | I1035: 0 | J1035: 0 | K1035: 191.22999999999999 | L1035: 0 | M1035: =SUM(J1035:L1035)-17.69 -> 173.53999999999999 | N1035: 17.690000000000001 | O1035: =SUM(M1035:N1035) -> 191.22999999999999
A1036: 4139 | B1036: EOL MONTE VERDE IV | C1036: 31.199.598/0002-02 | D1036: 136.44999999999999 | E1036: 0 | F1036: 0 | G1036: 0 | H1036: 0 | I1036: 0 | J1036: 0 | K1036: 150.36000000000001 | L1036: 0 | M1036: =SUM(J1036:L1036)-13.91 -> 136.45000000000002 | N1036: 13.91 | O1036: =SUM(M1036:N1036) -> 150.36000000000001
A1037: 4140 | B1037: EOL MONTE VERDE V | C1037: 31.199.661/0002-00 | D1037: 98.780000000000001 | E1037: 0 | F1037: 0 | G1037: 0 | H1037: 0 | I1037: 0 | J1037: 0 | K1037: 108.84999999999999 | L1037: 0 | M1037: =SUM(J1037:L1037)-10.07 -> 98.780000000000001 | N1037: 10.07 | O1037: =SUM(M1037:N1037) -> 108.84999999999999
A1038: 4141 | B1038: EOL MONTE VERDE VI | C1038: 31.199.538/0002-81 | D1038: 110.77 | E1038: 0 | F1038: 0 | G1038: 0 | H1038: 0 | I1038: 0 | J1038: 0 | K1038: 122.06 | L1038: 0 | M1038: =SUM(J1038:L1038)-11.29 -> 110.77000000000001 | N1038: 11.289999999999999 | O1038: =SUM(M1038:N1038) -> 122.06
A1039: 4142 | B1039: UFV SERRA DO MEL I | C1039: 35.835.582/0001-00 | D1039: 309.08999999999997 | E1039: 0 | F1039: 0 | G1039: 0 | H1039: 0 | I1039: 0 | J1039: 0 | K1039: 340.60000000000002 | L1039: 0 | M1039: =SUM(J1039:L1039)-31.51 -> 309.09000000000003 | N1039: 31.510000000000002 | O1039: =SUM(M1039:N1039) -> 340.60000000000002
A1040: 4143 | B1040: UFV SERRA DO MEL II | C1040: 35.835.571/0001-20 | D1040: 231.74000000000001 | E1040: 0 | F1040: 0 | G1040: 0 | H1040: 0 | I1040: 0 | J1040: 0 | K1040: 255.36000000000001 | L1040: 0 | M1040: =SUM(J1040:L1040)-23.62 -> 231.74000000000001 | N1040: 23.620000000000001 | O1040: =SUM(M1040:N1040) -> 255.36000000000001
A1041: 4144 | B1041: EOL BARAÚNAS XX | C1041: 34.986.678/0002-98 | D1041: 83.459999999999994 | E1041: 0 | F1041: 0 | G1041: 0 | H1041: 0 | I1041: 0 | J1041: 0 | K1041: 91.969999999999999 | L1041: 0 | M1041: =SUM(J1041:L1041)-8.51 -> 83.459999999999994 | N1041: 8.5099999999999998 | O1041: =SUM(M1041:N1041) -> 91.969999999999999
A1042: 4145 | B1042: EOL MORRO BRANCO II | C1042: 35.040.621/0002-64 | D1042: 79.629999999999995 | E1042: 0 | F1042: 0 | G1042: 0 | H1042: 0 | I1042: 0 | J1042: 0 | K1042: 87.75 | L1042: 0 | M1042: =SUM(J1042:L1042)-8.12 -> 79.629999999999995 | N1042: 8.1199999999999992 | O1042: =SUM(M1042:N1042) -> 87.75
A1043: 4146 | B1043: UFV FUTURA 1 | C1043: 37.349.957/0001-58 | D1043: 76.859999999999999 | E1043: 0 | F1043: 0 | G1043: 0 | H1043: 0 | I1043: 0 | J1043: 0 | K1043: 84.689999999999998 | L1043: 0 | M1043: =SUM(J1043:L1043)-7.83 -> 76.859999999999999 | N1043: 7.8300000000000001 | O1043: =SUM(M1043:N1043) -> 84.689999999999998
A1044: 4147 | B1044: UFV FUTURA 2 | C1044: 37.349.957/0001-58 | D1044: 77.519999999999996 | E1044: 0 | F1044: 0 | G1044: 0 | H1044: 0 | I1044: 0 | J1044: 0 | K1044: 85.420000000000002 | L1044: 0 | M1044: =SUM(J1044:L1044)-7.9 -> 77.519999999999996 | N1044: 7.9000000000000004 | O1044: =SUM(M1044:N1044) -> 85.420000000000002
A1045: 4148 | B1045: UFV FUTURA 3 | C1045: 37.349.957/0001-58 | D1045: 76.719999999999999 | E1045: 0 | F1045: 0 | G1045: 0 | H1045: 0 | I1045: 0 | J1045: 0 | K1045: 84.540000000000006 | L1045: 0 | M1045: =SUM(J1045:L1045)-7.82 -> 76.719999999999999 | N1045: 7.8200000000000003 | O1045: =SUM(M1045:N1045) -> 84.539999999999992
A1046: 4149 | B1046: UFV FUTURA 4 | C1046: 37.349.957/0001-58 | D1046: 77.200000000000003 | E1046: 0 | F1046: 0 | G1046: 0 | H1046: 0 | I1046: 0 | J1046: 0 | K1046: 85.069999999999993 | L1046: 0 | M1046: =SUM(J1046:L1046)-7.87 -> 77.199999999999989 | N1046: 7.8700000000000001 | O1046: =SUM(M1046:N1046) -> 85.069999999999993
A1047: 4150 | B1047: UFV FUTURA 5 | C1047: 37.349.892/0001-40 | D1047: 76.719999999999999 | E1047: 0 | F1047: 0 | G1047: 0 | H1047: 0 | I1047: 0 | J1047: 0 | K1047: 84.540000000000006 | L1047: 0 | M1047: =SUM(J1047:L1047)-7.82 -> 76.719999999999999 | N1047: 7.8200000000000003 | O1047: =SUM(M1047:N1047) -> 84.539999999999992
A1048: 4151 | B1048: UFV FUTURA 6 | C1048: 37.349.892/0001-40 | D1048: 77.120000000000005 | E1048: 0 | F1048: 0 | G1048: 0 | H1048: 0 | I1048: 0 | J1048: 0 | K1048: 84.980000000000004 | L1048: 0 | M1048: =SUM(J1048:L1048)-7.86 -> 77.120000000000005 | N1048: 7.8600000000000003 | O1048: =SUM(M1048:N1048) -> 84.980000000000004
A1049: 4152 | B1049: UFV FUTURA 7 | C1049: 37.349.892/0001-40 | D1049: 76.719999999999999 | E1049: 0 | F1049: 0 | G1049: 0 | H1049: 0 | I1049: 0 | J1049: 0 | K1049: 84.540000000000006 | L1049: 0 | M1049: =SUM(J1049:L1049)-7.82 -> 76.719999999999999 | N1049: 7.8200000000000003 | O1049: =SUM(M1049:N1049) -> 84.539999999999992
A1050: 4153 | B1050: UFV FUTURA 8 | C1050: 37.349.892/0001-40 | D1050: 77.180000000000007 | E1050: 0 | F1050: 0 | G1050: 0 | H1050: 0 | I1050: 0 | J1050: 0 | K1050: 85.049999999999997 | L1050: 0 | M1050: =SUM(J1050:L1050)-7.87 -> 77.179999999999993 | N1050: 7.8700000000000001 | O1050: =SUM(M1050:N1050) -> 85.049999999999997
A1051: 4154 | B1051: UFV FUTURA 9 | C1051: 37.350.010/0001-67 | D1051: 76.719999999999999 | E1051: 0 | F1051: 0 | G1051: 0 | H1051: 0 | I1051: 0 | J1051: 0 | K1051: 84.540000000000006 | L1051: 0 | M1051: =SUM(J1051:L1051)-7.82 -> 76.719999999999999 | N1051: 7.8200000000000003 | O1051: =SUM(M1051:N1051) -> 84.539999999999992
A1052: 4155 | B1052: UFV FUTURA 10 | C1052: 37.350.010/0001-67 | D1052: 76.849999999999994 | E1052: 0 | F1052: 0 | G1052: 0 | H1052: 0 | I1052: 0 | J1052: 0 | K1052: 84.680000000000007 | L1052: 0 | M1052: =SUM(J1052:L1052)-7.83 -> 76.850000000000009 | N1052: 7.8300000000000001 | O1052: =SUM(M1052:N1052) -> 84.680000000000007
A1053: 4156 | B1053: UFV FUTURA 11 | C1053: 37.350.010/0001-67 | D1053: 76.909999999999997 | E1053: 0 | F1053: 0 | G1053: 0 | H1053: 0 | I1053: 0 | J1053: 0 | K1053: 84.75 | L1053: 0 | M1053: =SUM(J1053:L1053)-7.84 -> 76.909999999999997 | N1053: 7.8399999999999999 | O1053: =SUM(M1053:N1053) -> 84.75
A1054: 4157 | B1054: UFV FUTURA 12 | C1054: 37.350.010/0001-67 | D1054: 77.030000000000001 | E1054: 0 | F1054: 0 | G1054: 0 | H1054: 0 | I1054: 0 | J1054: 0 | K1054: 84.879999999999995 | L1054: 0 | M1054: =SUM(J1054:L1054)-7.85 -> 77.030000000000001 | N1054: 7.8499999999999996 | O1054: =SUM(M1054:N1054) -> 84.879999999999995
A1055: 4158 | B1055: UFV FUTURA 13 | C1055: 37.349.956/0001-03 | D1055: 76.719999999999999 | E1055: 0 | F1055: 0 | G1055: 0 | H1055: 0 | I1055: 0 | J1055: 0 | K1055: 84.540000000000006 | L1055: 0 | M1055: =SUM(J1055:L1055)-7.82 -> 76.719999999999999 | N1055: 7.8200000000000003 | O1055: =SUM(M1055:N1055) -> 84.539999999999992
A1056: 4159 | B1056: UFV FUTURA 14 | C1056: 37.349.956/0001-03 | D1056: 76.719999999999999 | E1056: 0 | F1056: 0 | G1056: 0 | H1056: 0 | I1056: 0 | J1056: 0 | K1056: 84.540000000000006 | L1056: 0 | M1056: =SUM(J1056:L1056)-7.82 -> 76.719999999999999 | N1056: 7.8200000000000003 | O1056: =SUM(M1056:N1056) -> 84.539999999999992
A1057: 4160 | B1057: UFV FUTURA 15 | C1057: 37.349.956/0001-03 | D1057: 76.780000000000001 | E1057: 0 | F1057: 0 | G1057: 0 | H1057: 0 | I1057: 0 | J1057: 0 | K1057: 84.609999999999999 | L1057: 0 | M1057: =SUM(J1057:L1057)-7.83 -> 76.780000000000001 | N1057: 7.8300000000000001 | O1057: =SUM(M1057:N1057) -> 84.609999999999999
A1058: 4161 | B1058: UFV FUTURA 16 | C1058: 37.349.956/0001-03 | D1058: 76.719999999999999 | E1058: 0 | F1058: 0 | G1058: 0 | H1058: 0 | I1058: 0 | J1058: 0 | K1058: 84.540000000000006 | L1058: 0 | M1058: =SUM(J1058:L1058)-7.82 -> 76.719999999999999 | N1058: 7.8200000000000003 | O1058: =SUM(M1058:N1058) -> 84.539999999999992
A1059: 4162 | B1059: UFV FUTURA 17 | C1059: 37.349.956/0001-03 | D1059: 76.719999999999999 | E1059: 0 | F1059: 0 | G1059: 0 | H1059: 0 | I1059: 0 | J1059: 0 | K1059: 84.540000000000006 | L1059: 0 | M1059: =SUM(J1059:L1059)-7.82 -> 76.719999999999999 | N1059: 7.8200000000000003 | O1059: =SUM(M1059:N1059) -> 84.539999999999992
A1060: 4163 | B1060: UFV FUTURA 18 | C1060: 37.349.910/0001-94 | D1060: 77.019999999999996 | E1060: 0 | F1060: 0 | G1060: 0 | H1060: 0 | I1060: 0 | J1060: 0 | K1060: 84.870000000000005 | L1060: 0 | M1060: =SUM(J1060:L1060)-7.85 -> 77.02000000000001 | N1060: 7.8499999999999996 | O1060: =SUM(M1060:N1060) -> 84.870000000000005
A1061: 4164 | B1061: UFV FUTURA 19 | C1061: 37.349.910/0001-94 | D1061: 76.719999999999999 | E1061: 0 | F1061: 0 | G1061: 0 | H1061: 0 | I1061: 0 | J1061: 0 | K1061: 84.540000000000006 | L1061: 0 | M1061: =SUM(J1061:L1061)-7.82 -> 76.719999999999999 | N1061: 7.8200000000000003 | O1061: =SUM(M1061:N1061) -> 84.539999999999992
A1062: 4165 | B1062: UFV FUTURA 20 | C1062: 37.349.910/0001-94 | D1062: 76.719999999999999 | E1062: 0 | F1062: 0 | G1062: 0 | H1062: 0 | I1062: 0 | J1062: 0 | K1062: 84.540000000000006 | L1062: 0 | M1062: =SUM(J1062:L1062)-7.82 -> 76.719999999999999 | N1062: 7.8200000000000003 | O1062: =SUM(M1062:N1062) -> 84.539999999999992
A1063: 4166 | B1063: UFV FUTURA 21 | C1063: 37.576.883/0001-92 | D1063: 76.719999999999999 | E1063: 0 | F1063: 0 | G1063: 0 | H1063: 0 | I1063: 0 | J1063: 0 | K1063: 84.540000000000006 | L1063: 0 | M1063: =SUM(J1063:L1063)-7.82 -> 76.719999999999999 | N1063: 7.8200000000000003 | O1063: =SUM(M1063:N1063) -> 84.539999999999992
A1064: 4167 | B1064: UFV FUTURA 22 | C1064: 37.576.883/0001-92 | D1064: 76.719999999999999 | E1064: 0 | F1064: 0 | G1064: 0 | H1064: 0 | I1064: 0 | J1064: 0 | K1064: 84.540000000000006 | L1064: 0 | M1064: =SUM(J1064:L1064)-7.82 -> 76.719999999999999 | N1064: 7.8200000000000003 | O1064: =SUM(M1064:N1064) -> 84.539999999999992
A1065: 4168 | B1065: EOL JANDAIRA I | C1065: 35.823.538/0002-61 | D1065: 23.649999999999999 | E1065: 0 | F1065: 0 | G1065: 0 | H1065: 0 | I1065: 0 | J1065: 0 | K1065: 26.059999999999999 | L1065: 0 | M1065: =SUM(J1065:L1065)-2.41 -> 23.649999999999999 | N1065: 2.4100000000000001 | O1065: =SUM(M1065:N1065) -> 26.059999999999999
A1066: 4169 | B1066: EOL TUCANO X | C1066: 35.636.816/0001-90 | D1066: 94.950000000000003 | E1066: 0 | F1066: 0 | G1066: 0 | H1066: 0 | I1066: 0 | J1066: 0 | K1066: 104.63 | L1066: 0 | M1066: =SUM(J1066:L1066)-9.68 -> 94.949999999999989 | N1066: 9.6799999999999997 | O1066: =SUM(M1066:N1066) -> 104.63
A1067: 4170 | B1067: EOL ACAUÃ I | C1067: 35.842.703/0001-41 | D1067: 64.700000000000003 | E1067: 0 | F1067: 0 | G1067: 0 | H1067: 0 | I1067: 0 | J1067: 0 | K1067: 71.290000000000006 | L1067: 0 | M1067: =SUM(J1067:L1067)-6.59 -> 64.700000000000003 | N1067: 6.5899999999999999 | O1067: =SUM(M1067:N1067) -> 71.290000000000006
A1068: 4171 | B1068: EOL BARAÚNAS XV | C1068: 34.986.689/0002-78 | D1068: 129.83000000000001 | E1068: 0 | F1068: 0 | G1068: 0 | H1068: 0 | I1068: 0 | J1068: 0 | K1068: 143.06 | L1068: 0 | M1068: =SUM(J1068:L1068)-13.23 -> 129.83000000000001 | N1068: 13.23 | O1068: =SUM(M1068:N1068) -> 143.06
A1069: 4172 | B1069: UTE LWARCEL | C1069: 53.943.098/0001-87 | D1069: 13.65 | E1069: 0 | F1069: 0 | G1069: 0 | H1069: 0 | I1069: 0 | J1069: 0 | K1069: 15.039999999999999 | L1069: 0 | M1069: =SUM(J1069:L1069)-1.39 -> 13.649999999999999 | N1069: 1.3899999999999999 | O1069: =SUM(M1069:N1069) -> 15.039999999999999
A1070: 4173 | B1070: UFV SERRA DO MEL V | C1070: 39.702.823/0001-02 | D1070: 115.75 | E1070: 0 | F1070: 0 | G1070: 0 | H1070: 0 | I1070: 0 | J1070: 0 | K1070: 127.55 | L1070: 0 | M1070: =SUM(J1070:L1070)-11.8 -> 115.75 | N1070: 11.800000000000001 | O1070: =SUM(M1070:N1070) -> 127.55
A1071: 4174 | B1071: UFV SERRA DO MEL VI | C1071: 39.702.834/0001-84 | D1071: 115.75 | E1071: 0 | F1071: 0 | G1071: 0 | H1071: 0 | I1071: 0 | J1071: 0 | K1071: 127.55 | L1071: 0 | M1071: =SUM(J1071:L1071)-11.8 -> 115.75 | N1071: 11.800000000000001 | O1071: =SUM(M1071:N1071) -> 127.55
A1072: 4175 | B1072: UFV SERRA DO MEL III | C1072: 39.702.802/0001-89 | D1072: 164.63999999999999 | E1072: 0 | F1072: 0 | G1072: 0 | H1072: 0 | I1072: 0 | J1072: 0 | K1072: 181.41999999999999 | L1072: 0 | M1072: =SUM(J1072:L1072)-16.78 -> 164.63999999999999 | N1072: 16.780000000000001 | O1072: =SUM(M1072:N1072) -> 181.41999999999999
A1073: 4176 | B1073: UFV SERRA DO MEL IV | C1073: 39.702.815/0001-58 | D1073: 159.18000000000001 | E1073: 0 | F1073: 0 | G1073: 0 | H1073: 0 | I1073: 0 | J1073: 0 | K1073: 175.40000000000001 | L1073: 0 | M1073: =SUM(J1073:L1073)-16.22 -> 159.18000000000001 | N1073: 16.219999999999999 | O1073: =SUM(M1073:N1073) -> 175.40000000000001
A1074: 4177 | B1074: EOL TUCANO III | C1074: 35.836.427/0001-09 | D1074: 94.950000000000003 | E1074: 0 | F1074: 0 | G1074: 0 | H1074: 0 | I1074: 0 | J1074: 0 | K1074: 104.63 | L1074: 0 | M1074: =SUM(J1074:L1074)-9.68 -> 94.949999999999989 | N1074: 9.6799999999999997 | O1074: =SUM(M1074:N1074) -> 104.63
A1075: 4178 | B1075: EOL ACAUÃ II | C1075: 35.842.703/0001-41 | D1075: 53.909999999999997 | E1075: 0 | F1075: 0 | G1075: 0 | H1075: 0 | I1075: 0 | J1075: 0 | K1075: 59.399999999999999 | L1075: 0 | M1075: =SUM(J1075:L1075)-5.49 -> 53.909999999999997 | N1075: 5.4900000000000002 | O1075: =SUM(M1075:N1075) -> 59.399999999999999
A1076: 4179 | B1076: EOL VENTOS DE SÃO ROQUE 01 | C1076: 31.594.049/0001-43 | D1076: 124.52 | E1076: 0 | F1076: 0 | G1076: 0 | H1076: 0 | I1076: 0 | J1076: 0 | K1076: 137.21000000000001 | L1076: 0 | M1076: =SUM(J1076:L1076)-12.69 -> 124.52000000000001 | N1076: 12.69 | O1076: =SUM(M1076:N1076) -> 137.21000000000001
A1077: 4180 | B1077: EOL VENTOS DE SÃO ROQUE 08 | C1077: 31.596.728/0001-51 | D1077: 124.52 | E1077: 0 | F1077: 0 | G1077: 0 | H1077: 0 | I1077: 0 | J1077: 0 | K1077: 137.21000000000001 | L1077: 0 | M1077: =SUM(J1077:L1077)-12.69 -> 124.52000000000001 | N1077: 12.69 | O1077: =SUM(M1077:N1077) -> 137.21000000000001
A1078: 4181 | B1078: EOL VENTOS DE SÃO VITOR 01 | C1078: 35.469.795/0001-66 | D1078: 80.400000000000006 | E1078: 0 | F1078: 0 | G1078: 0 | H1078: 0 | I1078: 0 | J1078: 0 | K1078: 88.599999999999994 | L1078: 0 | M1078: =SUM(J1078:L1078)-8.2 -> 80.399999999999991 | N1078: 8.1999999999999993 | O1078: =SUM(M1078:N1078) -> 88.599999999999994
A1079: 4182 | B1079: EOL BAIXA DO SÍTIO | C1079: 35.842.708/0001-74 | D1079: 108.5 | E1079: 0 | F1079: 0 | G1079: 0 | H1079: 0 | I1079: 0 | J1079: 0 | K1079: 119.56 | L1079: 0 | M1079: =SUM(J1079:L1079)-11.06 -> 108.5 | N1079: 11.06 | O1079: =SUM(M1079:N1079) -> 119.56
A1080: 4183 | B1080: EOL BARAÚNAS IV | C1080: 34.986.649/0002-26 | D1080: 111.28 | E1080: 0 | F1080: 0 | G1080: 0 | H1080: 0 | I1080: 0 | J1080: 0 | K1080: 122.62 | L1080: 0 | M1080: =SUM(J1080:L1080)-11.34 -> 111.28 | N1080: 11.34 | O1080: =SUM(M1080:N1080) -> 122.62
A1081: 4184 | B1081: EOL JANDAÍRA II | C1081: 35.824.347/0002-14 | D1081: 54.909999999999997 | E1081: 0 | F1081: 0 | G1081: 0 | H1081: 0 | I1081: 0 | J1081: 0 | K1081: 60.509999999999998 | L1081: 0 | M1081: =SUM(J1081:L1081)-5.6 -> 54.909999999999997 | N1081: 5.5999999999999996 | O1081: =SUM(M1081:N1081) -> 60.509999999999998
A1082: 4185 | B1082: EOL JANDAÍRA III | C1082: 35.823.536/0002-72 | D1082: 62.539999999999999 | E1082: 0 | F1082: 0 | G1082: 0 | H1082: 0 | I1082: 0 | J1082: 0 | K1082: 68.909999999999997 | L1082: 0 | M1082: =SUM(J1082:L1082)-6.37 -> 62.539999999999999 | N1082: 6.3700000000000001 | O1082: =SUM(M1082:N1082) -> 68.909999999999997
A1083: 4186 | B1083: EOL JANDAÍRA IV | C1083: 35.823.577/0002-69 | D1083: 62.289999999999999 | E1083: 0 | F1083: 0 | G1083: 0 | H1083: 0 | I1083: 0 | J1083: 0 | K1083: 68.640000000000001 | L1083: 0 | M1083: =SUM(J1083:L1083)-6.35 -> 62.289999999999999 | N1083: 6.3499999999999996 | O1083: =SUM(M1083:N1083) -> 68.640000000000001
A1084: 4187 | B1084: UFV LAR DO SOL 1 | C1084: 32.222.320/0001-82 | D1084: 120.48 | E1084: 0 | F1084: 0 | G1084: 0 | H1084: 0 | I1084: 0 | J1084: 0 | K1084: 132.75999999999999 | L1084: 0 | M1084: =SUM(J1084:L1084)-12.28 -> 120.47999999999999 | N1084: 12.279999999999999 | O1084: =SUM(M1084:N1084) -> 132.75999999999999
A1085: 4188 | B1085: UFV LAR DO SOL 2 | C1085: 32.222.320/0001-82 | D1085: 120.48 | E1085: 0 | F1085: 0 | G1085: 0 | H1085: 0 | I1085: 0 | J1085: 0 | K1085: 132.75999999999999 | L1085: 0 | M1085: =SUM(J1085:L1085)-12.28 -> 120.47999999999999 | N1085: 12.279999999999999 | O1085: =SUM(M1085:N1085) -> 132.75999999999999
A1086: 4189 | B1086: UFV LAR DO SOL 7 | C1086: 31.345.445/0001-37 | D1086: 120.48 | E1086: 0 | F1086: 0 | G1086: 0 | H1086: 0 | I1086: 0 | J1086: 0 | K1086: 132.75999999999999 | L1086: 0 | M1086: =SUM(J1086:L1086)-12.28 -> 120.47999999999999 | N1086: 12.279999999999999 | O1086: =SUM(M1086:N1086) -> 132.75999999999999
A1087: 4190 | B1087: UFV LAR DO SOL 8 | C1087: 31.345.445/0001-37 | D1087: 120.48 | E1087: 0 | F1087: 0 | G1087: 0 | H1087: 0 | I1087: 0 | J1087: 0 | K1087: 132.75999999999999 | L1087: 0 | M1087: =SUM(J1087:L1087)-12.28 -> 120.47999999999999 | N1087: 12.279999999999999 | O1087: =SUM(M1087:N1087) -> 132.75999999999999
A1088: 4191 | B1088: UFV LAR DO SOL 9 | C1088: 31.345.569/0001-12 | D1088: 120.48 | E1088: 0 | F1088: 0 | G1088: 0 | H1088: 0 | I1088: 0 | J1088: 0 | K1088: 132.75999999999999 | L1088: 0 | M1088: =SUM(J1088:L1088)-12.28 -> 120.47999999999999 | N1088: 12.279999999999999 | O1088: =SUM(M1088:N1088) -> 132.75999999999999
A1089: 4192 | B1089: UFV LAR DO SOL 10 | C1089: 31.345.569/0001-12 | D1089: 120.48 | E1089: 0 | F1089: 0 | G1089: 0 | H1089: 0 | I1089: 0 | J1089: 0 | K1089: 132.75999999999999 | L1089: 0 | M1089: =SUM(J1089:L1089)-12.28 -> 120.47999999999999 | N1089: 12.279999999999999 | O1089: =SUM(M1089:N1089) -> 132.75999999999999
A1090: 4193 | B1090: EOL TUCANO IV | C1090: 35.836.426/0001-64 | D1090: 94.950000000000003 | E1090: 0 | F1090: 0 | G1090: 0 | H1090: 0 | I1090: 0 | J1090: 0 | K1090: 104.63 | L1090: 0 | M1090: =SUM(J1090:L1090)-9.68 -> 94.949999999999989 | N1090: 9.6799999999999997 | O1090: =SUM(M1090:N1090) -> 104.63
A1091: 4194 | B1091: EOL TUCANO XVI | C1091: 35.806.317/0002-85 | D1091: 27.129999999999999 | E1091: 0 | F1091: 0 | G1091: 0 | H1091: 0 | I1091: 0 | J1091: 0 | K1091: 29.899999999999999 | L1091: 0 | M1091: =SUM(J1091:L1091)-2.77 -> 27.129999999999999 | N1091: 2.77 | O1091: =SUM(M1091:N1091) -> 29.899999999999999
A1092: 4195 | B1092: EOL VENTOS DE SÃO ROQUE 02 | C1092: 31.596.667/0001-22 | D1092: 124.52 | E1092: 0 | F1092: 0 | G1092: 0 | H1092: 0 | I1092: 0 | J1092: 0 | K1092: 137.21000000000001 | L1092: 0 | M1092: =SUM(J1092:L1092)-12.69 -> 124.52000000000001 | N1092: 12.69 | O1092: =SUM(M1092:N1092) -> 137.21000000000001
A1093: 4196 | B1093: EOL VENTOS DE SÃO ROQUE 04 | C1093: 31.594.122/0001-87 | D1093: 124.52 | E1093: 0 | F1093: 0 | G1093: 0 | H1093: 0 | I1093: 0 | J1093: 0 | K1093: 137.21000000000001 | L1093: 0 | M1093: =SUM(J1093:L1093)-12.69 -> 124.52000000000001 | N1093: 12.69 | O1093: =SUM(M1093:N1093) -> 137.21000000000001
A1094: 4197 | B1094: EOL VENTOS DE SÃO ROQUE 11 | C1094: 31.595.917/0001-00 | D1094: 124.52 | E1094: 0 | F1094: 0 | G1094: 0 | H1094: 0 | I1094: 0 | J1094: 0 | K1094: 137.21000000000001 | L1094: 0 | M1094: =SUM(J1094:L1094)-12.69 -> 124.52000000000001 | N1094: 12.69 | O1094: =SUM(M1094:N1094) -> 137.21000000000001
A1095: 4198 | B1095: EOL VENTOS DE SÃO ROQUE 16 | C1095: 31.595.857/0001-25 | D1095: 124.52 | E1095: 0 | F1095: 0 | G1095: 0 | H1095: 0 | I1095: 0 | J1095: 0 | K1095: 137.21000000000001 | L1095: 0 | M1095: =SUM(J1095:L1095)-12.69 -> 124.52000000000001 | N1095: 12.69 | O1095: =SUM(M1095:N1095) -> 137.21000000000001
A1096: 4199 | B1096: EOL VENTOS DE SÃO ROQUE 17 | C1096: 31.594.065/0001-36 | D1096: 124.52 | E1096: 0 | F1096: 0 | G1096: 0 | H1096: 0 | I1096: 0 | J1096: 0 | K1096: 137.21000000000001 | L1096: 0 | M1096: =SUM(J1096:L1096)-12.69 -> 124.52000000000001 | N1096: 12.69 | O1096: =SUM(M1096:N1096) -> 137.21000000000001
A1097: 4200 | B1097: EOL VENTOS DE SÃO ROQUE 18 | C1097: 31.596.016/0001-32 | D1097: 124.52 | E1097: 0 | F1097: 0 | G1097: 0 | H1097: 0 | I1097: 0 | J1097: 0 | K1097: 137.21000000000001 | L1097: 0 | M1097: =SUM(J1097:L1097)-12.69 -> 124.52000000000001 | N1097: 12.69 | O1097: =SUM(M1097:N1097) -> 137.21000000000001
A1098: 4201 | B1098: EOL VENTOS DE SANTA EUGÊNIA 02 | C1098: 35.637.246/0002-34 | D1098: 27.829999999999998 | E1098: 0 | F1098: 0 | G1098: 0 | H1098: 0 | I1098: 0 | J1098: 0 | K1098: 30.670000000000002 | L1098: 0 | M1098: =SUM(J1098:L1098)-2.84 -> 27.830000000000002 | N1098: 2.8399999999999999 | O1098: =SUM(M1098:N1098) -> 30.670000000000002
A1099: 4202 | B1099: EOL VENTOS DE SANTA EUGÊNIA 07 | C1099: 35.637.246/0002-34 | D1099: 41.75 | E1099: 0 | F1099: 0 | G1099: 0 | H1099: 0 | I1099: 0 | J1099: 0 | K1099: 46.009999999999998 | L1099: 0 | M1099: =SUM(J1099:L1099)-4.26 -> 41.75 | N1099: 4.2599999999999998 | O1099: =SUM(M1099:N1099) -> 46.009999999999998
A1100: 4203 | B1100: EOL VENTOS DE SÃO VITOR 02 | C1100: 35.477.401/0001-11 | D1100: 79.129999999999995 | E1100: 0 | F1100: 0 | G1100: 0 | H1100: 0 | I1100: 0 | J1100: 0 | K1100: 87.200000000000003 | L1100: 0 | M1100: =SUM(J1100:L1100)-8.07 -> 79.129999999999995 | N1100: 8.0700000000000003 | O1100: =SUM(M1100:N1100) -> 87.199999999999989
A1101: 4204 | B1101: EOL VENTOS DE SÃO VITOR 03 | C1101: 35.402.454/0001-73 | D1101: 80.400000000000006 | E1101: 0 | F1101: 0 | G1101: 0 | H1101: 0 | I1101: 0 | J1101: 0 | K1101: 88.599999999999994 | L1101: 0 | M1101: =SUM(J1101:L1101)-8.2 -> 80.399999999999991 | N1101: 8.1999999999999993 | O1101: =SUM(M1101:N1101) -> 88.599999999999994
A1102: 4205 | B1102: EOL VENTOS DE SÃO VITOR 06 | C1102: 35.402.868/0001-00 | D1102: 80.400000000000006 | E1102: 0 | F1102: 0 | G1102: 0 | H1102: 0 | I1102: 0 | J1102: 0 | K1102: 88.599999999999994 | L1102: 0 | M1102: =SUM(J1102:L1102)-8.2 -> 80.399999999999991 | N1102: 8.1999999999999993 | O1102: =SUM(M1102:N1102) -> 88.599999999999994
A1103: 4206 | B1103: EOL TUCANO II | C1103: 35.806.317/0001-02 | D1103: 54.259999999999998 | E1103: 0 | F1103: 0 | G1103: 0 | H1103: 0 | I1103: 0 | J1103: 0 | K1103: 59.789999999999999 | L1103: 0 | M1103: =SUM(J1103:L1103)-5.53 -> 54.259999999999998 | N1103: 5.5300000000000002 | O1103: =SUM(M1103:N1103) -> 59.789999999999999
A1104: 4207 | B1104: EOL VENTOS DE SANTA EUGÊNIA 01 | C1104: 35.637.424/0002-27 | D1104: 123.16 | E1104: 0 | F1104: 0 | G1104: 0 | H1104: 0 | I1104: 0 | J1104: 0 | K1104: 135.71000000000001 | L1104: 0 | M1104: =SUM(J1104:L1104)-12.55 -> 123.16000000000001 | N1104: 12.550000000000001 | O1104: =SUM(M1104:N1104) -> 135.71000000000001
A1105: 4208 | B1105: EOL VENTOS DE SÃO VITOR 04 | C1105: 35.402.592/0001-52 | D1105: 80.400000000000006 | E1105: 0 | F1105: 0 | G1105: 0 | H1105: 0 | I1105: 0 | J1105: 0 | K1105: 88.599999999999994 | L1105: 0 | M1105: =SUM(J1105:L1105)-8.2 -> 80.399999999999991 | N1105: 8.1999999999999993 | O1105: =SUM(M1105:N1105) -> 88.599999999999994
A1106: 4209 | B1106: EOL VENTOS DE SÃO VITOR 05 | C1106: 35.402.703/0001-20 | D1106: 80.400000000000006 | E1106: 0 | F1106: 0 | G1106: 0 | H1106: 0 | I1106: 0 | J1106: 0 | K1106: 88.599999999999994 | L1106: 0 | M1106: =SUM(J1106:L1106)-8.2 -> 80.399999999999991 | N1106: 8.1999999999999993 | O1106: =SUM(M1106:N1106) -> 88.599999999999994
A1107: 4210 | B1107: UTE VIANA 1 | C1107: 09.043.782/0004-63 | D1107: 149.44 | E1107: 0 | F1107: 0 | G1107: 0 | H1107: 0 | I1107: 0 | J1107: 0 | K1107: 164.66999999999999 | L1107: 0 | M1107: =SUM(J1107:L1107)-15.23 -> 149.44 | N1107: 15.23 | O1107: =SUM(M1107:N1107) -> 164.66999999999999
A1108: 4212 | B1108: EOL VENTOS DE SANTO APOLINÁRIO | C1108: 23.037.442/0001-08 | D1108: 93.140000000000001 | E1108: 0 | F1108: 0 | G1108: 0 | H1108: 0 | I1108: 0 | J1108: 0 | K1108: 102.63 | L1108: 0 | M1108: =SUM(J1108:L1108)-9.49 -> 93.140000000000001 | N1108: 9.4900000000000002 | O1108: =SUM(M1108:N1108) -> 102.63
A1109: 4213 | B1109: EOL VENTOS DE SANTA ALEXANDRINA | C1109: 23.037.493/0001-30 | D1109: 116.7 | E1109: 0 | F1109: 0 | G1109: 0 | H1109: 0 | I1109: 0 | J1109: 0 | K1109: 128.59999999999999 | L1109: 0 | M1109: =SUM(J1109:L1109)-11.9 -> 116.69999999999999 | N1109: 11.9 | O1109: =SUM(M1109:N1109) -> 128.59999999999999
A1110: 4214 | B1110: EOL VENTOS DE SÃO JOÃO PAULO II | C1110: 23.037.337/0001-79 | D1110: 81.480000000000004 | E1110: 0 | F1110: 0 | G1110: 0 | H1110: 0 | I1110: 0 | J1110: 0 | K1110: 89.790000000000006 | L1110: 0 | M1110: =SUM(J1110:L1110)-8.31 -> 81.480000000000004 | N1110: 8.3100000000000005 | O1110: =SUM(M1110:N1110) -> 89.790000000000006
A1111: 4215 | B1111: UFV JANAUBA 1 | C1111: 37.380.592/0001-24 | D1111: 131.02000000000001 | E1111: 0 | F1111: 0 | G1111: 0 | H1111: 0 | I1111: 0 | J1111: 0 | K1111: 144.37 | L1111: 0 | M1111: =SUM(J1111:L1111)-13.35 -> 131.02000000000001 | N1111: 13.35 | O1111: =SUM(M1111:N1111) -> 144.37
A1112: 4216 | B1112: UFV JANAUBA 3 | C1112: 37.381.467/0001-39 | D1112: 131.02000000000001 | E1112: 0 | F1112: 0 | G1112: 0 | H1112: 0 | I1112: 0 | J1112: 0 | K1112: 144.37 | L1112: 0 | M1112: =SUM(J1112:L1112)-13.35 -> 131.02000000000001 | N1112: 13.35 | O1112: =SUM(M1112:N1112) -> 144.37
A1113: 4217 | B1113: UFV JANAUBA 4 | C1113: 37.381.255/0001-51 | D1113: 131.02000000000001 | E1113: 0 | F1113: 0 | G1113: 0 | H1113: 0 | I1113: 0 | J1113: 0 | K1113: 144.37 | L1113: 0 | M1113: =SUM(J1113:L1113)-13.35 -> 131.02000000000001 | N1113: 13.35 | O1113: =SUM(M1113:N1113) -> 144.37
A1114: 4218 | B1114: EOL VENTOS DE SANTO ANTERO | C1114: 22.246.333/0001-38 | D1114: 127.29000000000001 | E1114: 0 | F1114: 0 | G1114: 0 | H1114: 0 | I1114: 0 | J1114: 0 | K1114: 140.25999999999999 | L1114: 0 | M1114: =SUM(J1114:L1114)-12.97 -> 127.28999999999999 | N1114: 12.970000000000001 | O1114: =SUM(M1114:N1114) -> 140.25999999999999
A1115: 4219 | B1115: EOL VENTOS DE SÃO BERNARDO | C1115: 21.893.166/0001-54 | D1115: 114.44 | E1115: 0 | F1115: 0 | G1115: 0 | H1115: 0 | I1115: 0 | J1115: 0 | K1115: 126.09999999999999 | L1115: 0 | M1115: =SUM(J1115:L1115)-11.66 -> 114.44 | N1115: 11.66 | O1115: =SUM(M1115:N1115) -> 126.09999999999999
A1116: 4220 | B1116: EOL VENTOS DE SANTA EUGÊNIA 03 | C1116: 35.636.507/0002-00 | D1116: 97.390000000000001 | E1116: 0 | F1116: 0 | G1116: 0 | H1116: 0 | I1116: 0 | J1116: 0 | K1116: 107.31999999999999 | L1116: 0 | M1116: =SUM(J1116:L1116)-9.93 -> 97.389999999999986 | N1116: 9.9299999999999997 | O1116: =SUM(M1116:N1116) -> 107.31999999999999
A1117: 4222 | B1117: EOL OITIS 1 | C1117: 34.211.213/0002-65 | D1117: 126.81999999999999 | E1117: 0 | F1117: 0 | G1117: 0 | H1117: 0 | I1117: 0 | J1117: 0 | K1117: 139.75 | L1117: 0 | M1117: =SUM(J1117:L1117)-12.93 -> 126.81999999999999 | N1117: 12.93 | O1117: =SUM(M1117:N1117) -> 139.75
A1118: 4223 | B1118: EOL OITIS 5 | C1118: 34.211.252/0002-62 | D1118: 128.38999999999999 | E1118: 0 | F1118: 0 | G1118: 0 | H1118: 0 | I1118: 0 | J1118: 0 | K1118: 141.47999999999999 | L1118: 0 | M1118: =SUM(J1118:L1118)-13.09 -> 128.38999999999999 | N1118: 13.09 | O1118: =SUM(M1118:N1118) -> 141.47999999999999
A1119: 4224 | B1119: EOL OITIS 6 | C1119: 34.211.096/0002-30 | D1119: 128.38999999999999 | E1119: 0 | F1119: 0 | G1119: 0 | H1119: 0 | I1119: 0 | J1119: 0 | K1119: 141.47999999999999 | L1119: 0 | M1119: =SUM(J1119:L1119)-13.09 -> 128.38999999999999 | N1119: 13.09 | O1119: =SUM(M1119:N1119) -> 141.47999999999999
A1120: 4225 | B1120: EOL OITIS 7 | C1120: 34.211.395/0002-74 | D1120: 128.38999999999999 | E1120: 0 | F1120: 0 | G1120: 0 | H1120: 0 | I1120: 0 | J1120: 0 | K1120: 141.47999999999999 | L1120: 0 | M1120: =SUM(J1120:L1120)-13.09 -> 128.38999999999999 | N1120: 13.09 | O1120: =SUM(M1120:N1120) -> 141.47999999999999
A1121: 4226 | B1121: EOL OITIS 22 | C1121: 34.211.180/0002-53 | D1121: 128.38999999999999 | E1121: 0 | F1121: 0 | G1121: 0 | H1121: 0 | I1121: 0 | J1121: 0 | K1121: 141.47999999999999 | L1121: 0 | M1121: =SUM(J1121:L1121)-13.09 -> 128.38999999999999 | N1121: 13.09 | O1121: =SUM(M1121:N1121) -> 141.47999999999999
A1122: 4227 | B1122: EOL AW SÃO JOÃO | C1122: 33.268.331/0001-66 | D1122: 62.25 | E1122: 0 | F1122: 0 | G1122: 0 | H1122: 0 | I1122: 0 | J1122: 0 | K1122: 68.599999999999994 | L1122: 0 | M1122: =SUM(J1122:L1122)-6.35 -> 62.249999999999993 | N1122: 6.3499999999999996 | O1122: =SUM(M1122:N1122) -> 68.599999999999994
A1123: 4228 | B1123: EOL AW SANTA RÉGIA | C1123: 33.268.312/0001-30 | D1123: 92.25 | E1123: 0 | F1123: 0 | G1123: 0 | H1123: 0 | I1123: 0 | J1123: 0 | K1123: 101.65000000000001 | L1123: 0 | M1123: =SUM(J1123:L1123)-9.4 -> 92.25 | N1123: 9.4000000000000004 | O1123: =SUM(M1123:N1123) -> 101.65000000000001
A1124: 4229 | B1124: UFV JANAUBA 2 | C1124: 37.405.455/0001-05 | D1124: 131.02000000000001 | E1124: 0 | F1124: 0 | G1124: 0 | H1124: 0 | I1124: 0 | J1124: 0 | K1124: 144.37 | L1124: 0 | M1124: =SUM(J1124:L1124)-13.35 -> 131.02000000000001 | N1124: 13.35 | O1124: =SUM(M1124:N1124) -> 144.37
A1125: 4230 | B1125: UFV JANAUBA 9 | C1125: 37.381.180/0001-09 | D1125: 131.02000000000001 | E1125: 0 | F1125: 0 | G1125: 0 | H1125: 0 | I1125: 0 | J1125: 0 | K1125: 144.37 | L1125: 0 | M1125: =SUM(J1125:L1125)-13.35 -> 131.02000000000001 | N1125: 13.35 | O1125: =SUM(M1125:N1125) -> 144.37
A1126: 4231 | B1126: EOL VENTOS DE SÃO VITOR 07 | C1126: 35.402.953/0001-60 | D1126: 112.56 | E1126: 0 | F1126: 0 | G1126: 0 | H1126: 0 | I1126: 0 | J1126: 0 | K1126: 124.03 | L1126: 0 | M1126: =SUM(J1126:L1126)-11.47 -> 112.56 | N1126: 11.470000000000001 | O1126: =SUM(M1126:N1126) -> 124.03
A1127: 4232 | B1127: EOL VENTOS DE SÃO JANUÁRIO 15 | C1127: 35.865.644/0002-08 | D1127: 24.68 | E1127: 0 | F1127: 0 | G1127: 0 | H1127: 0 | I1127: 0 | J1127: 0 | K1127: 27.199999999999999 | L1127: 0 | M1127: =SUM(J1127:L1127)-2.52 -> 24.68 | N1127: 2.52 | O1127: =SUM(M1127:N1127) -> 27.199999999999999
A1128: 4233 | B1128: EOL VENTOS DE SÃO JANUÁRIO 16 | C1128: 35.874.355/0002-75 | D1128: 24.68 | E1128: 0 | F1128: 0 | G1128: 0 | H1128: 0 | I1128: 0 | J1128: 0 | K1128: 27.199999999999999 | L1128: 0 | M1128: =SUM(J1128:L1128)-2.52 -> 24.68 | N1128: 2.52 | O1128: =SUM(M1128:N1128) -> 27.199999999999999
A1129: 4234 | B1129: EOL VENTOS DE SÃO JANUÁRIO 17 | C1129: 35.859.013/0002-86 | D1129: 24.68 | E1129: 0 | F1129: 0 | G1129: 0 | H1129: 0 | I1129: 0 | J1129: 0 | K1129: 27.199999999999999 | L1129: 0 | M1129: =SUM(J1129:L1129)-2.52 -> 24.68 | N1129: 2.52 | O1129: =SUM(M1129:N1129) -> 27.199999999999999
A1130: 4235 | B1130: EOL VENTOS DE SÃO JANUÁRIO 18 | C1130: 35.865.623/0002-92 | D1130: 24.68 | E1130: 0 | F1130: 0 | G1130: 0 | H1130: 0 | I1130: 0 | J1130: 0 | K1130: 27.199999999999999 | L1130: 0 | M1130: =SUM(J1130:L1130)-2.52 -> 24.68 | N1130: 2.52 | O1130: =SUM(M1130:N1130) -> 27.199999999999999
A1131: 4236 | B1131: EOL VENTOS DE SÃO JANUÁRIO 19 | C1131: 35.865.638/0002-50 | D1131: 24.68 | E1131: 0 | F1131: 0 | G1131: 0 | H1131: 0 | I1131: 0 | J1131: 0 | K1131: 27.199999999999999 | L1131: 0 | M1131: =SUM(J1131:L1131)-2.52 -> 24.68 | N1131: 2.52 | O1131: =SUM(M1131:N1131) -> 27.199999999999999
A1132: 4237 | B1132: UFV JANAUBA 8 | C1132: 37.381.661/0001-14 | D1132: 131.02000000000001 | E1132: 0 | F1132: 0 | G1132: 0 | H1132: 0 | I1132: 0 | J1132: 0 | K1132: 144.37 | L1132: 0 | M1132: =SUM(J1132:L1132)-13.35 -> 131.02000000000001 | N1132: 13.35 | O1132: =SUM(M1132:N1132) -> 144.37
A1133: 4238 | B1133: UFV JANAUBA 12 | C1133: 37.381.730/0001-90 | D1133: 131.02000000000001 | E1133: 0 | F1133: 0 | G1133: 0 | H1133: 0 | I1133: 0 | J1133: 0 | K1133: 144.37 | L1133: 0 | M1133: =SUM(J1133:L1133)-13.35 -> 131.02000000000001 | N1133: 13.35 | O1133: =SUM(M1133:N1133) -> 144.37
A1134: 4239 | B1134: UFV JANAUBA 13 | C1134: 37.405.654/0001-05 | D1134: 131.02000000000001 | E1134: 0 | F1134: 0 | G1134: 0 | H1134: 0 | I1134: 0 | J1134: 0 | K1134: 144.37 | L1134: 0 | M1134: =SUM(J1134:L1134)-13.35 -> 131.02000000000001 | N1134: 13.35 | O1134: =SUM(M1134:N1134) -> 144.37
A1135: 4240 | B1135: UFV JANAUBA 14 | C1135: 37.380.661/0001-08 | D1135: 131.02000000000001 | E1135: 0 | F1135: 0 | G1135: 0 | H1135: 0 | I1135: 0 | J1135: 0 | K1135: 144.37 | L1135: 0 | M1135: =SUM(J1135:L1135)-13.35 -> 131.02000000000001 | N1135: 13.35 | O1135: =SUM(M1135:N1135) -> 144.37
A1136: 4241 | B1136: UFV LAVRAS 6 | C1136: 35.306.327/0001-70 | D1136: 56.130000000000003 | E1136: 0 | F1136: 0 | G1136: 0 | H1136: 0 | I1136: 0 | J1136: 0 | K1136: 61.850000000000001 | L1136: 0 | M1136: =SUM(J1136:L1136)-5.72 -> 56.130000000000003 | N1136: 5.7199999999999998 | O1136: =SUM(M1136:N1136) -> 61.850000000000001
A1137: 4242 | B1137: UFV LAVRAS 7 | C1137: 35.357.719/0001-69 | D1137: 43.420000000000002 | E1137: 0 | F1137: 0 | G1137: 0 | H1137: 0 | I1137: 0 | J1137: 0 | K1137: 47.850000000000001 | L1137: 0 | M1137: =SUM(J1137:L1137)-4.43 -> 43.420000000000002 | N1137: 4.4299999999999997 | O1137: =SUM(M1137:N1137) -> 47.850000000000001
A1138: 4243 | B1138: UFV LAVRAS 8 | C1138: 35.357.729/0001-02 | D1138: 43.420000000000002 | E1138: 0 | F1138: 0 | G1138: 0 | H1138: 0 | I1138: 0 | J1138: 0 | K1138: 47.850000000000001 | L1138: 0 | M1138: =SUM(J1138:L1138)-4.43 -> 43.420000000000002 | N1138: 4.4299999999999997 | O1138: =SUM(M1138:N1138) -> 47.850000000000001
A1139: 4250 | B1139: EOL OITIS 2 | C1139: 34.238.187/0002-69 | D1139: 71.329999999999998 | E1139: 0 | F1139: 0 | G1139: 0 | H1139: 0 | I1139: 0 | J1139: 0 | K1139: 78.599999999999994 | L1139: 0 | M1139: =SUM(J1139:L1139)-7.27 -> 71.329999999999998 | N1139: 7.2699999999999996 | O1139: =SUM(M1139:N1139) -> 78.599999999999994
A1140: 4251 | B1140: EOL VENTOS DE SANTO ALDERICO | C1140: 23.037.528/0001-30 | D1140: 104.98 | E1140: 0 | F1140: 0 | G1140: 0 | H1140: 0 | I1140: 0 | J1140: 0 | K1140: 115.68000000000001 | L1140: 0 | M1140: =SUM(J1140:L1140)-10.7 -> 104.98 | N1140: 10.699999999999999 | O1140: =SUM(M1140:N1140) -> 115.68000000000001
A1141: 4252 | B1141: EOL VENTOS DE SÃO CRISPIM | C1141: 23.037.375/0001-21 | D1141: 128.28 | E1141: 0 | F1141: 0 | G1141: 0 | H1141: 0 | I1141: 0 | J1141: 0 | K1141: 141.36000000000001 | L1141: 0 | M1141: =SUM(J1141:L1141)-13.08 -> 128.28 | N1141: 13.08 | O1141: =SUM(M1141:N1141) -> 141.36000000000001
A1142: 4253 | B1142: UHE TUCURUÍ | C1142: 00.357.038/0001-16 | D1142: 38496.580000000002 | E1142: 0 | F1142: 0 | G1142: 0 | H1142: 0 | I1142: 0 | J1142: 14140.16 | K1142: 14140.16 | L1142: 14140.15 | M1142: =SUM(J1142:L1142)-3923.89 -> 38496.580000000002 | N1142: 3923.8899999999999 | O1142: =SUM(M1142:N1142) -> 42420.470000000001
A1143: 4254 | B1143: UFV RIBEIRO GONÇALVES I | C1143: 31.711.512/0001-90 | D1143: 40.560000000000002 | E1143: 0 | F1143: 0 | G1143: 0 | H1143: 0 | I1143: 0 | J1143: 0 | K1143: 44.689999999999998 | L1143: 0 | M1143: =SUM(J1143:L1143)-4.13 -> 40.559999999999995 | N1143: 4.1299999999999999 | O1143: =SUM(M1143:N1143) -> 44.689999999999998
A1144: 4255 | B1144: UFV RIBEIRO GONÇALVES II | C1144: 31.711.512/0001-90 | D1144: 94.200000000000003 | E1144: 0 | F1144: 0 | G1144: 0 | H1144: 0 | I1144: 0 | J1144: 0 | K1144: 103.8 | L1144: 0 | M1144: =SUM(J1144:L1144)-9.6 -> 94.200000000000003 | N1144: 9.5999999999999996 | O1144: =SUM(M1144:N1144) -> 103.8
A1145: 4256 | B1145: UFV RIBEIRO GONÇALVES III | C1145: 31.711.512/0001-90 | D1145: 94.200000000000003 | E1145: 0 | F1145: 0 | G1145: 0 | H1145: 0 | I1145: 0 | J1145: 0 | K1145: 103.8 | L1145: 0 | M1145: =SUM(J1145:L1145)-9.6 -> 94.200000000000003 | N1145: 9.5999999999999996 | O1145: =SUM(M1145:N1145) -> 103.8
A1146: 4257 | B1146: UFV RIBEIRO GONÇALVES IV | C1146: 31.711.512/0001-90 | D1146: 51.380000000000003 | E1146: 0 | F1146: 0 | G1146: 0 | H1146: 0 | I1146: 0 | J1146: 0 | K1146: 56.619999999999997 | L1146: 0 | M1146: =SUM(J1146:L1146)-5.24 -> 51.379999999999995 | N1146: 5.2400000000000002 | O1146: =SUM(M1146:N1146) -> 56.619999999999997
A1147: 4258 | B1147: EOL ASSURUÁ 4 I | C1147: 38.112.927/0002-77 | D1147: 91.790000000000006 | E1147: 0 | F1147: 0 | G1147: 0 | H1147: 0 | I1147: 0 | J1147: 0 | K1147: 101.15000000000001 | L1147: 0 | M1147: =SUM(J1147:L1147)-9.36 -> 91.790000000000006 | N1147: 9.3599999999999994 | O1147: =SUM(M1147:N1147) -> 101.15000000000001
A1148: 4259 | B1148: EOL ASSURUÁ 4 VI | C1148: 38.049.608/0002-64 | D1148: 91.790000000000006 | E1148: 0 | F1148: 0 | G1148: 0 | H1148: 0 | I1148: 0 | J1148: 0 | K1148: 101.15000000000001 | L1148: 0 | M1148: =SUM(J1148:L1148)-9.36 -> 91.790000000000006 | N1148: 9.3599999999999994 | O1148: =SUM(M1148:N1148) -> 101.15000000000001
A1149: 4260 | B1149: UFV JANAUBA 5 | C1149: 37.380.653/0001-53 | D1149: 131.02000000000001 | E1149: 0 | F1149: 0 | G1149: 0 | H1149: 0 | I1149: 0 | J1149: 0 | K1149: 144.37 | L1149: 0 | M1149: =SUM(J1149:L1149)-13.35 -> 131.02000000000001 | N1149: 13.35 | O1149: =SUM(M1149:N1149) -> 144.37
A1150: 4261 | B1150: UFV JANAUBA 10 | C1150: 37.405.824/0001-51 | D1150: 131.02000000000001 | E1150: 0 | F1150: 0 | G1150: 0 | H1150: 0 | I1150: 0 | J1150: 0 | K1150: 144.37 | L1150: 0 | M1150: =SUM(J1150:L1150)-13.35 -> 131.02000000000001 | N1150: 13.35 | O1150: =SUM(M1150:N1150) -> 144.37
A1151: 4262 | B1151: EOL OITIS 3 | C1151: 34.238.239/0002-05 | D1151: 128.38999999999999 | E1151: 0 | F1151: 0 | G1151: 0 | H1151: 0 | I1151: 0 | J1151: 0 | K1151: 141.47999999999999 | L1151: 0 | M1151: =SUM(J1151:L1151)-13.09 -> 128.38999999999999 | N1151: 13.09 | O1151: =SUM(M1151:N1151) -> 141.47999999999999
A1152: 4263 | B1152: EOL OITIS 8 | C1152: 34.211.894/0002-61 | D1152: 126.81999999999999 | E1152: 0 | F1152: 0 | G1152: 0 | H1152: 0 | I1152: 0 | J1152: 0 | K1152: 139.75 | L1152: 0 | M1152: =SUM(J1152:L1152)-12.93 -> 126.81999999999999 | N1152: 12.93 | O1152: =SUM(M1152:N1152) -> 139.75
A1153: 4264 | B1153: EOL OITIS 21 | C1153: 34.211.419/0002-95 | D1153: 114.12 | E1153: 0 | F1153: 0 | G1153: 0 | H1153: 0 | I1153: 0 | J1153: 0 | K1153: 125.75 | L1153: 0 | M1153: =SUM(J1153:L1153)-11.63 -> 114.12 | N1153: 11.630000000000001 | O1153: =SUM(M1153:N1153) -> 125.75
A1154: 4265 | B1154: EOL VENTOS DE SÃO CIRÍACO | C1154: 23.037.398/0001-36 | D1154: 128.69 | E1154: 0 | F1154: 0 | G1154: 0 | H1154: 0 | I1154: 0 | J1154: 0 | K1154: 141.81 | L1154: 0 | M1154: =SUM(J1154:L1154)-13.12 -> 128.69 | N1154: 13.119999999999999 | O1154: =SUM(M1154:N1154) -> 141.81
A1155: 4266 | B1155: EOL VENTOS DE SÃO CIRO | C1155: 23.037.463/0001-23 | D1155: 92.5 | E1155: 0 | F1155: 0 | G1155: 0 | H1155: 0 | I1155: 0 | J1155: 0 | K1155: 101.93000000000001 | L1155: 0 | M1155: =SUM(J1155:L1155)-9.43 -> 92.5 | N1155: 9.4299999999999997 | O1155: =SUM(M1155:N1155) -> 101.93000000000001
A1156: 4267 | B1156: EOL VENTOS DE SANTA EUGÊNIA 12 | C1156: 35.636.507/0002-00 | D1156: 97.370000000000005 | E1156: 0 | F1156: 0 | G1156: 0 | H1156: 0 | I1156: 0 | J1156: 0 | K1156: 107.29000000000001 | L1156: 0 | M1156: =SUM(J1156:L1156)-9.92 -> 97.370000000000005 | N1156: 9.9199999999999999 | O1156: =SUM(M1156:N1156) -> 107.29000000000001
A1157: 4268 | B1157: EOL VENTOS DE SANTA EUGÊNIA 05 | C1157: 35.636.502/0002-79 | D1157: 83.450000000000003 | E1157: 0 | F1157: 0 | G1157: 0 | H1157: 0 | I1157: 0 | J1157: 0 | K1157: 91.959999999999994 | L1157: 0 | M1157: =SUM(J1157:L1157)-8.51 -> 83.449999999999989 | N1157: 8.5099999999999998 | O1157: =SUM(M1157:N1157) -> 91.959999999999994
A1158: 4269 | B1158: RENOVA (EOL QUINA) | C1158: 18.560.032/0001-07 | D1158: 23.550000000000001 | E1158: 0 | F1158: 0 | G1158: 0 | H1158: 0 | I1158: 0 | J1158: 0 | K1158: 25.949999999999999 | L1158: 0 | M1158: =SUM(J1158:L1158)-2.4 -> 23.550000000000001 | N1158: 2.3999999999999999 | O1158: =SUM(M1158:N1158) -> 25.949999999999999
A1159: 4270 | B1159: RENOVA (EOL MULUNGU) | C1159: 18.560.032/0001-07 | D1159: 29.629999999999999 | E1159: 0 | F1159: 0 | G1159: 0 | H1159: 0 | I1159: 0 | J1159: 0 | K1159: 32.649999999999999 | L1159: 0 | M1159: =SUM(J1159:L1159)-3.02 -> 29.629999999999999 | N1159: 3.02 | O1159: =SUM(M1159:N1159) -> 32.649999999999999
A1160: 4271 | B1160: UFV JANAUBA 6 | C1160: 37.380.936/0001-03 | D1160: 131.02000000000001 | E1160: 0 | F1160: 0 | G1160: 0 | H1160: 0 | I1160: 0 | J1160: 0 | K1160: 144.37 | L1160: 0 | M1160: =SUM(J1160:L1160)-13.35 -> 131.02000000000001 | N1160: 13.35 | O1160: =SUM(M1160:N1160) -> 144.37
A1161: 4272 | B1161: UFV JANAUBA 7 | C1161: 37.380.859/0001-83 | D1161: 131.02000000000001 | E1161: 0 | F1161: 0 | G1161: 0 | H1161: 0 | I1161: 0 | J1161: 0 | K1161: 144.37 | L1161: 0 | M1161: =SUM(J1161:L1161)-13.35 -> 131.02000000000001 | N1161: 13.35 | O1161: =SUM(M1161:N1161) -> 144.37
A1162: 4273 | B1162: EOL OITIS 4 | C1162: 34.211.484/0002-10 | D1162: 128.38999999999999 | E1162: 0 | F1162: 0 | G1162: 0 | H1162: 0 | I1162: 0 | J1162: 0 | K1162: 141.47999999999999 | L1162: 0 | M1162: =SUM(J1162:L1162)-13.09 -> 128.38999999999999 | N1162: 13.09 | O1162: =SUM(M1162:N1162) -> 141.47999999999999
A1163: 4274 | B1163: EOL VENTOS DE SÃO CAIO | C1163: 23.037.422/0001-37 | D1163: 92.560000000000002 | E1163: 0 | F1163: 0 | G1163: 0 | H1163: 0 | I1163: 0 | J1163: 0 | K1163: 101.98999999999999 | L1163: 0 | M1163: =SUM(J1163:L1163)-9.43 -> 92.560000000000002 | N1163: 9.4299999999999997 | O1163: =SUM(M1163:N1163) -> 101.99000000000001
A1164: 4275 | B1164: EOL VENTOS DE SÃO VITOR 10 | C1164: 35.403.117/0001-09 | D1164: 115.3 | E1164: 0 | F1164: 0 | G1164: 0 | H1164: 0 | I1164: 0 | J1164: 0 | K1164: 127.05 | L1164: 0 | M1164: =SUM(J1164:L1164)-11.75 -> 115.3 | N1164: 11.75 | O1164: =SUM(M1164:N1164) -> 127.05
A1165: 4276 | B1165: EOL VENTOS DE SANTA EUGÊNIA 08 | C1165: 35.636.502/0002-79 | D1165: 69.560000000000002 | E1165: 0 | F1165: 0 | G1165: 0 | H1165: 0 | I1165: 0 | J1165: 0 | K1165: 76.650000000000006 | L1165: 0 | M1165: =SUM(J1165:L1165)-7.09 -> 69.560000000000002 | N1165: 7.0899999999999999 | O1165: =SUM(M1165:N1165) -> 76.650000000000006
A1166: 4277 | B1166: EOL VENTOS DE SÃO VITOR 11 | C1166: 35.403.207/0001-91 | D1166: 82.359999999999999 | E1166: 0 | F1166: 0 | G1166: 0 | H1166: 0 | I1166: 0 | J1166: 0 | K1166: 90.75 | L1166: 0 | M1166: =SUM(J1166:L1166)-8.39 -> 82.359999999999999 | N1166: 8.3900000000000006 | O1166: =SUM(M1166:N1166) -> 90.75
A1167: 4278 | B1167: EOL SANTO AGOSTINHO 13 | C1167: 20.667.603/0003-10 | D1167: 93.519999999999996 | E1167: 0 | F1167: 0 | G1167: 0 | H1167: 0 | I1167: 0 | J1167: 0 | K1167: 103.05 | L1167: 0 | M1167: =SUM(J1167:L1167)-9.53 -> 93.519999999999996 | N1167: 9.5299999999999994 | O1167: =SUM(M1167:N1167) -> 103.05
A1168: 4279 | B1168: EOL SANTO AGOSTINHO 26 | C1168: 23.079.885/0002-42 | D1168: 109.11 | E1168: 0 | F1168: 0 | G1168: 0 | H1168: 0 | I1168: 0 | J1168: 0 | K1168: 120.23 | L1168: 0 | M1168: =SUM(J1168:L1168)-11.12 -> 109.11 | N1168: 11.119999999999999 | O1168: =SUM(M1168:N1168) -> 120.23
A1169: 4280 | B1169: EOL VENTOS DE SANTA EUGÊNIA 11 | C1169: 35.639.141/0002-14 | D1169: 70 | E1169: 0 | F1169: 0 | G1169: 0 | H1169: 0 | I1169: 0 | J1169: 0 | K1169: 77.129999999999995 | L1169: 0 | M1169: =SUM(J1169:L1169)-7.13 -> 70 | N1169: 7.1299999999999999 | O1169: =SUM(M1169:N1169) -> 77.129999999999995
A1170: 4283 | B1170: EOL VENTOS DE SANTA EUGÊNIA 13 | C1170: 35.654.188/0002-57 | D1170: 111.23 | E1170: 0 | F1170: 0 | G1170: 0 | H1170: 0 | I1170: 0 | J1170: 0 | K1170: 122.56999999999999 | L1170: 0 | M1170: =SUM(J1170:L1170)-11.34 -> 111.22999999999999 | N1170: 11.34 | O1170: =SUM(M1170:N1170) -> 122.56999999999999
A1171: 4284 | B1171: EOL ANEMUS WIND 1 | C1171: 29.481.536/0001-58 | D1171: 93.010000000000005 | E1171: 0 | F1171: 0 | G1171: 0 | H1171: 0 | I1171: 0 | J1171: 0 | K1171: 102.48999999999999 | L1171: 0 | M1171: =SUM(J1171:L1171)-9.48 -> 93.009999999999991 | N1171: 9.4800000000000004 | O1171: =SUM(M1171:N1171) -> 102.48999999999999
A1172: 4285 | B1172: EOL VENTOS DE SÃO VITOR 09 | C1172: 35.403.066/0001-07 | D1172: 82.359999999999999 | E1172: 0 | F1172: 0 | G1172: 0 | H1172: 0 | I1172: 0 | J1172: 0 | K1172: 90.75 | L1172: 0 | M1172: =SUM(J1172:L1172)-8.39 -> 82.359999999999999 | N1172: 8.3900000000000006 | O1172: =SUM(M1172:N1172) -> 90.75
A1173: 4286 | B1173: UFV JANAUBA 11 | C1173: 37.381.300/0001-78 | D1173: 131.02000000000001 | E1173: 0 | F1173: 0 | G1173: 0 | H1173: 0 | I1173: 0 | J1173: 0 | K1173: 144.37 | L1173: 0 | M1173: =SUM(J1173:L1173)-13.35 -> 131.02000000000001 | N1173: 13.35 | O1173: =SUM(M1173:N1173) -> 144.37
A1174: 4287 | B1174: EOL OITIS 9 | C1174: 34.211.291/0002-60 | D1174: 128.38999999999999 | E1174: 0 | F1174: 0 | G1174: 0 | H1174: 0 | I1174: 0 | J1174: 0 | K1174: 141.47999999999999 | L1174: 0 | M1174: =SUM(J1174:L1174)-13.09 -> 128.38999999999999 | N1174: 13.09 | O1174: =SUM(M1174:N1174) -> 141.47999999999999
A1175: 4288 | B1175: EOL CASA NOVA II | C1175: 33.541.368/0001-16 | D1175: 58.009999999999998 | E1175: 0 | F1175: 0 | G1175: 0 | H1175: 0 | I1175: 0 | J1175: 0 | K1175: 63.920000000000002 | L1175: 0 | M1175: =SUM(J1175:L1175)-5.91 -> 58.010000000000005 | N1175: 5.9100000000000001 | O1175: =SUM(M1175:N1175) -> 63.920000000000002
A1176: 4289 | B1176: EOL CASA NOVA III | C1176: 33.541.368/0001-16 | D1176: 54.490000000000002 | E1176: 0 | F1176: 0 | G1176: 0 | H1176: 0 | I1176: 0 | J1176: 0 | K1176: 60.039999999999999 | L1176: 0 | M1176: =SUM(J1176:L1176)-5.55 -> 54.490000000000002 | N1176: 5.5499999999999998 | O1176: =SUM(M1176:N1176) -> 60.039999999999999
A1177: 4290 | B1177: EOL ASSURUÁ 4 II | C1177: 38.286.402/0002-58 | D1177: 80.310000000000002 | E1177: 0 | F1177: 0 | G1177: 0 | H1177: 0 | I1177: 0 | J1177: 0 | K1177: 88.5 | L1177: 0 | M1177: =SUM(J1177:L1177)-8.19 -> 80.310000000000002 | N1177: 8.1899999999999995 | O1177: =SUM(M1177:N1177) -> 88.5
A1178: 4291 | B1178: EOL ASSURUÁ 4 III | C1178: 38.112.944/0002-04 | D1178: 91.790000000000006 | E1178: 0 | F1178: 0 | G1178: 0 | H1178: 0 | I1178: 0 | J1178: 0 | K1178: 101.15000000000001 | L1178: 0 | M1178: =SUM(J1178:L1178)-9.36 -> 91.790000000000006 | N1178: 9.3599999999999994 | O1178: =SUM(M1178:N1178) -> 101.15000000000001
A1179: 4292 | B1179: EOL ANEMUS WIND 2 | C1179: 29.492.546/0001-99 | D1179: 113.68000000000001 | E1179: 0 | F1179: 0 | G1179: 0 | H1179: 0 | I1179: 0 | J1179: 0 | K1179: 125.27 | L1179: 0 | M1179: =SUM(J1179:L1179)-11.59 -> 113.67999999999999 | N1179: 11.59 | O1179: =SUM(M1179:N1179) -> 125.27
A1180: 4293 | B1180: EOL TUCANO IX | C1180: 35.805.346/0001-41 | D1180: 103.47 | E1180: 0 | F1180: 0 | G1180: 0 | H1180: 0 | I1180: 0 | J1180: 0 | K1180: 114.02 | L1180: 0 | M1180: =SUM(J1180:L1180)-10.55 -> 103.47 | N1180: 10.550000000000001 | O1180: =SUM(M1180:N1180) -> 114.02
A1181: 4294 | B1181: EOL TUCANO XI | C1181: 35.805.346/0001-41 | D1181: 77.599999999999994 | E1181: 0 | F1181: 0 | G1181: 0 | H1181: 0 | I1181: 0 | J1181: 0 | K1181: 85.510000000000005 | L1181: 0 | M1181: =SUM(J1181:L1181)-7.91 -> 77.600000000000009 | N1181: 7.9100000000000001 | O1181: =SUM(M1181:N1181) -> 85.510000000000005
A1182: 4295 | B1182: UFV AC III | C1182: 33.592.510/0167-43 | D1182: 123.77 | E1182: 0 | F1182: 0 | G1182: 0 | H1182: 0 | I1182: 0 | J1182: 0 | K1182: 136.38999999999999 | L1182: 0 | M1182: =SUM(J1182:L1182)-12.62 -> 123.76999999999998 | N1182: 12.619999999999999 | O1182: =SUM(M1182:N1182) -> 136.38999999999999
A1183: 4296 | B1183: UFV AC IV | C1183: 33.592.510/0167-43 | D1183: 128.93000000000001 | E1183: 0 | F1183: 0 | G1183: 0 | H1183: 0 | I1183: 0 | J1183: 0 | K1183: 142.06999999999999 | L1183: 0 | M1183: =SUM(J1183:L1183)-13.14 -> 128.93000000000001 | N1183: 13.140000000000001 | O1183: =SUM(M1183:N1183) -> 142.06999999999999
A1184: 4297 | B1184: UFV AC IX | C1184: 33.592.510/0167-43 | D1184: 75.579999999999998 | E1184: 0 | F1184: 0 | G1184: 0 | H1184: 0 | I1184: 0 | J1184: 0 | K1184: 83.280000000000001 | L1184: 0 | M1184: =SUM(J1184:L1184)-7.7 -> 75.579999999999998 | N1184: 7.7000000000000002 | O1184: =SUM(M1184:N1184) -> 83.280000000000001
A1185: 4298 | B1185: UFV AC V | C1185: 33.592.510/0167-43 | D1185: 128.93000000000001 | E1185: 0 | F1185: 0 | G1185: 0 | H1185: 0 | I1185: 0 | J1185: 0 | K1185: 142.06999999999999 | L1185: 0 | M1185: =SUM(J1185:L1185)-13.14 -> 128.93000000000001 | N1185: 13.140000000000001 | O1185: =SUM(M1185:N1185) -> 142.06999999999999
A1186: 4299 | B1186: UFV AC VI | C1186: 33.592.510/0167-43 | D1186: 128.93000000000001 | E1186: 0 | F1186: 0 | G1186: 0 | H1186: 0 | I1186: 0 | J1186: 0 | K1186: 142.06999999999999 | L1186: 0 | M1186: =SUM(J1186:L1186)-13.14 -> 128.93000000000001 | N1186: 13.140000000000001 | O1186: =SUM(M1186:N1186) -> 142.06999999999999
A1187: 4300 | B1187: UFV AC VII | C1187: 33.592.510/0167-43 | D1187: 100.77 | E1187: 0 | F1187: 0 | G1187: 0 | H1187: 0 | I1187: 0 | J1187: 0 | K1187: 111.04000000000001 | L1187: 0 | M1187: =SUM(J1187:L1187)-10.27 -> 100.77000000000001 | N1187: 10.27 | O1187: =SUM(M1187:N1187) -> 111.04000000000001
A1188: 4301 | B1188: UFV AC VIII | C1188: 33.592.510/0167-43 | D1188: 100.77 | E1188: 0 | F1188: 0 | G1188: 0 | H1188: 0 | I1188: 0 | J1188: 0 | K1188: 111.04000000000001 | L1188: 0 | M1188: =SUM(J1188:L1188)-10.27 -> 100.77000000000001 | N1188: 10.27 | O1188: =SUM(M1188:N1188) -> 111.04000000000001
A1189: 4302 | B1189: UFV AC X | C1189: 33.592.510/0167-43 | D1189: 100.77 | E1189: 0 | F1189: 0 | G1189: 0 | H1189: 0 | I1189: 0 | J1189: 0 | K1189: 111.04000000000001 | L1189: 0 | M1189: =SUM(J1189:L1189)-10.27 -> 100.77000000000001 | N1189: 10.27 | O1189: =SUM(M1189:N1189) -> 111.04000000000001
A1190: 4303 | B1190: UFV AC XIX | C1190: 33.592.510/0167-43 | D1190: 123.77 | E1190: 0 | F1190: 0 | G1190: 0 | H1190: 0 | I1190: 0 | J1190: 0 | K1190: 136.38999999999999 | L1190: 0 | M1190: =SUM(J1190:L1190)-12.62 -> 123.76999999999998 | N1190: 12.619999999999999 | O1190: =SUM(M1190:N1190) -> 136.38999999999999
A1191: 4304 | B1191: UFV AC XV | C1191: 33.592.510/0167-43 | D1191: 161.16999999999999 | E1191: 0 | F1191: 0 | G1191: 0 | H1191: 0 | I1191: 0 | J1191: 0 | K1191: 177.59999999999999 | L1191: 0 | M1191: =SUM(J1191:L1191)-16.43 -> 161.16999999999999 | N1191: 16.43 | O1191: =SUM(M1191:N1191) -> 177.59999999999999
A1192: 4305 | B1192: UFV AC XVI | C1192: 33.592.510/0167-43 | D1192: 128.93000000000001 | E1192: 0 | F1192: 0 | G1192: 0 | H1192: 0 | I1192: 0 | J1192: 0 | K1192: 142.06999999999999 | L1192: 0 | M1192: =SUM(J1192:L1192)-13.14 -> 128.93000000000001 | N1192: 13.140000000000001 | O1192: =SUM(M1192:N1192) -> 142.06999999999999
A1193: 4306 | B1193: UFV AC XVII | C1193: 33.592.510/0167-43 | D1193: 161.16999999999999 | E1193: 0 | F1193: 0 | G1193: 0 | H1193: 0 | I1193: 0 | J1193: 0 | K1193: 177.59999999999999 | L1193: 0 | M1193: =SUM(J1193:L1193)-16.43 -> 161.16999999999999 | N1193: 16.43 | O1193: =SUM(M1193:N1193) -> 177.59999999999999
A1194: 4307 | B1194: UFV AC XVIII | C1194: 33.592.510/0167-43 | D1194: 128.93000000000001 | E1194: 0 | F1194: 0 | G1194: 0 | H1194: 0 | I1194: 0 | J1194: 0 | K1194: 142.06999999999999 | L1194: 0 | M1194: =SUM(J1194:L1194)-13.14 -> 128.93000000000001 | N1194: 13.140000000000001 | O1194: =SUM(M1194:N1194) -> 142.06999999999999
A1195: 4308 | B1195: UFV AC XX | C1195: 33.592.510/0167-43 | D1195: 123.77 | E1195: 0 | F1195: 0 | G1195: 0 | H1195: 0 | I1195: 0 | J1195: 0 | K1195: 136.38999999999999 | L1195: 0 | M1195: =SUM(J1195:L1195)-12.62 -> 123.76999999999998 | N1195: 12.619999999999999 | O1195: =SUM(M1195:N1195) -> 136.38999999999999
A1196: 4309 | B1196: UFV AC XXI | C1196: 33.592.510/0167-43 | D1196: 128.93000000000001 | E1196: 0 | F1196: 0 | G1196: 0 | H1196: 0 | I1196: 0 | J1196: 0 | K1196: 142.06999999999999 | L1196: 0 | M1196: =SUM(J1196:L1196)-13.14 -> 128.93000000000001 | N1196: 13.140000000000001 | O1196: =SUM(M1196:N1196) -> 142.06999999999999
A1197: 4310 | B1197: UFV AC XXII | C1197: 33.592.510/0167-43 | D1197: 128.93000000000001 | E1197: 0 | F1197: 0 | G1197: 0 | H1197: 0 | I1197: 0 | J1197: 0 | K1197: 142.06999999999999 | L1197: 0 | M1197: =SUM(J1197:L1197)-13.14 -> 128.93000000000001 | N1197: 13.140000000000001 | O1197: =SUM(M1197:N1197) -> 142.06999999999999
A1198: 4311 | B1198: UFV AC XXIII | C1198: 33.592.510/0167-43 | D1198: 128.93000000000001 | E1198: 0 | F1198: 0 | G1198: 0 | H1198: 0 | I1198: 0 | J1198: 0 | K1198: 142.06999999999999 | L1198: 0 | M1198: =SUM(J1198:L1198)-13.14 -> 128.93000000000001 | N1198: 13.140000000000001 | O1198: =SUM(M1198:N1198) -> 142.06999999999999
A1199: 4312 | B1199: EOL SERRA DO SERIDÓ VI | C1199: 35.882.365/0001-71 | D1199: 95.349999999999994 | E1199: 0 | F1199: 0 | G1199: 0 | H1199: 0 | I1199: 0 | J1199: 0 | K1199: 105.06999999999999 | L1199: 0 | M1199: =SUM(J1199:L1199)-9.72 -> 95.349999999999994 | N1199: 9.7200000000000006 | O1199: =SUM(M1199:N1199) -> 105.06999999999999
A1200: 4313 | B1200: EOL BREJINHOS A | C1200: 33.485.728/0001-00 | D1200: 94.189999999999998 | E1200: 0 | F1200: 0 | G1200: 0 | H1200: 0 | I1200: 0 | J1200: 0 | K1200: 103.79000000000001 | L1200: 0 | M1200: =SUM(J1200:L1200)-9.6 -> 94.190000000000012 | N1200: 9.5999999999999996 | O1200: =SUM(M1200:N1200) -> 103.79000000000001
A1201: 4314 | B1201: EOL BREJINHOS B | C1201: 33.485.874/0001-35 | D1201: 104.66 | E1201: 0 | F1201: 0 | G1201: 0 | H1201: 0 | I1201: 0 | J1201: 0 | K1201: 115.33 | L1201: 0 | M1201: =SUM(J1201:L1201)-10.67 -> 104.66 | N1201: 10.67 | O1201: =SUM(M1201:N1201) -> 115.33
A1202: 4315 | B1202: EOL CAETITE E | C1202: 33.471.379/0001-77 | D1202: 94.189999999999998 | E1202: 0 | F1202: 0 | G1202: 0 | H1202: 0 | I1202: 0 | J1202: 0 | K1202: 103.79000000000001 | L1202: 0 | M1202: =SUM(J1202:L1202)-9.6 -> 94.190000000000012 | N1202: 9.5999999999999996 | O1202: =SUM(M1202:N1202) -> 103.79000000000001
A1203: 4316 | B1203: EOL CAETITE F | C1203: 33.468.809/0001-00 | D1203: 62.810000000000002 | E1203: 0 | F1203: 0 | G1203: 0 | H1203: 0 | I1203: 0 | J1203: 0 | K1203: 69.209999999999994 | L1203: 0 | M1203: =SUM(J1203:L1203)-6.4 -> 62.809999999999995 | N1203: 6.4000000000000004 | O1203: =SUM(M1203:N1203) -> 69.209999999999994
A1204: 4317 | B1204: EOL ASSURUÁ 4 IV | C1204: 38.050.924/0002-56 | D1204: 91.790000000000006 | E1204: 0 | F1204: 0 | G1204: 0 | H1204: 0 | I1204: 0 | J1204: 0 | K1204: 101.15000000000001 | L1204: 0 | M1204: =SUM(J1204:L1204)-9.36 -> 91.790000000000006 | N1204: 9.3599999999999994 | O1204: =SUM(M1204:N1204) -> 101.15000000000001
A1205: 4318 | B1205: EOL ASSURUÁ 4 V | C1205: 38.049.586/0002-32 | D1205: 91.790000000000006 | E1205: 0 | F1205: 0 | G1205: 0 | H1205: 0 | I1205: 0 | J1205: 0 | K1205: 101.15000000000001 | L1205: 0 | M1205: =SUM(J1205:L1205)-9.36 -> 91.790000000000006 | N1205: 9.3599999999999994 | O1205: =SUM(M1205:N1205) -> 101.15000000000001
A1206: 4319 | B1206: EOL ANEMUS WIND 3 | C1206: 38.350.307/0001-95 | D1206: 134.34999999999999 | E1206: 0 | F1206: 0 | G1206: 0 | H1206: 0 | I1206: 0 | J1206: 0 | K1206: 148.03999999999999 | L1206: 0 | M1206: =SUM(J1206:L1206)-13.69 -> 134.34999999999999 | N1206: 13.69 | O1206: =SUM(M1206:N1206) -> 148.03999999999999
A1207: 4324 | B1207: UTE MARLIM AZUL | C1207: 29.884.534/0002-90 | D1207: 3172.9000000000001 | E1207: 0 | F1207: 0 | G1207: 0 | H1207: 0 | I1207: 0 | J1207: 0 | K1207: 3496.3099999999999 | L1207: 0 | M1207: =SUM(J1207:L1207)-323.41 -> 3172.9000000000001 | N1207: 323.41000000000003 | O1207: =SUM(M1207:N1207) -> 3496.3099999999999
A1208: 4325 | B1208: EOL OITIS 10 | C1208: 34.211.456/0002-01 | D1208: 128.38999999999999 | E1208: 0 | F1208: 0 | G1208: 0 | H1208: 0 | I1208: 0 | J1208: 0 | K1208: 141.47999999999999 | L1208: 0 | M1208: =SUM(J1208:L1208)-13.09 -> 128.38999999999999 | N1208: 13.09 | O1208: =SUM(M1208:N1208) -> 141.47999999999999
A1209: 4326 | B1209: EOL SERRA DO SERIDÓ IX | C1209: 35.831.535/0001-99 | D1209: 107.29000000000001 | E1209: 0 | F1209: 0 | G1209: 0 | H1209: 0 | I1209: 0 | J1209: 0 | K1209: 118.23 | L1209: 0 | M1209: =SUM(J1209:L1209)-10.94 -> 107.29000000000001 | N1209: 10.94 | O1209: =SUM(M1209:N1209) -> 118.23
A1210: 4327 | B1210: EOL VENTOS DE SANTA EUGÊNIA 10 | C1210: 35.654.189/0002-00 | D1210: 111.93000000000001 | E1210: 0 | F1210: 0 | G1210: 0 | H1210: 0 | I1210: 0 | J1210: 0 | K1210: 123.34 | L1210: 0 | M1210: =SUM(J1210:L1210)-11.41 -> 111.93000000000001 | N1210: 11.41 | O1210: =SUM(M1210:N1210) -> 123.34
A1211: 4328 | B1211: EOL VENTOS DE SÃO VITOR 08 | C1211: 35.403.030/0001-23 | D1211: 82.359999999999999 | E1211: 0 | F1211: 0 | G1211: 0 | H1211: 0 | I1211: 0 | J1211: 0 | K1211: 90.75 | L1211: 0 | M1211: =SUM(J1211:L1211)-8.39 -> 82.359999999999999 | N1211: 8.3900000000000006 | O1211: =SUM(M1211:N1211) -> 90.75
A1212: 4329 | B1212: EOL VENTOS DE SANTA LEIA 01 | C1212: 35.865.635/0002-17 | D1212: 33.170000000000002 | E1212: 0 | F1212: 0 | G1212: 0 | H1212: 0 | I1212: 0 | J1212: 0 | K1212: 36.549999999999997 | L1212: 0 | M1212: =SUM(J1212:L1212)-3.38 -> 33.169999999999995 | N1212: 3.3799999999999999 | O1212: =SUM(M1212:N1212) -> 36.549999999999997
A1213: 4330 | B1213: EOL VENTOS DE SANTA LEIA 02 | C1213: 35.865.640/0002-20 | D1213: 33.170000000000002 | E1213: 0 | F1213: 0 | G1213: 0 | H1213: 0 | I1213: 0 | J1213: 0 | K1213: 36.549999999999997 | L1213: 0 | M1213: =SUM(J1213:L1213)-3.38 -> 33.169999999999995 | N1213: 3.3799999999999999 | O1213: =SUM(M1213:N1213) -> 36.549999999999997
A1214: 4331 | B1214: EOL VENTOS DE SANTA LEIA 03 | C1214: 35.865.651/0002-00 | D1214: 33.170000000000002 | E1214: 0 | F1214: 0 | G1214: 0 | H1214: 0 | I1214: 0 | J1214: 0 | K1214: 36.549999999999997 | L1214: 0 | M1214: =SUM(J1214:L1214)-3.38 -> 33.169999999999995 | N1214: 3.3799999999999999 | O1214: =SUM(M1214:N1214) -> 36.549999999999997
A1215: 4332 | B1215: EOL VENTOS DE SANTA LEIA 04 | C1215: 35.874.343/0002-40 | D1215: 32.979999999999997 | E1215: 0 | F1215: 0 | G1215: 0 | H1215: 0 | I1215: 0 | J1215: 0 | K1215: 36.340000000000003 | L1215: 0 | M1215: =SUM(J1215:L1215)-3.36 -> 32.980000000000004 | N1215: 3.3599999999999999 | O1215: =SUM(M1215:N1215) -> 36.340000000000003
A1216: 4333 | B1216: EOL VENTOS DE SANTA LEIA 05 | C1216: 35.989.467/0002-71 | D1216: 33.170000000000002 | E1216: 0 | F1216: 0 | G1216: 0 | H1216: 0 | I1216: 0 | J1216: 0 | K1216: 36.549999999999997 | L1216: 0 | M1216: =SUM(J1216:L1216)-3.38 -> 33.169999999999995 | N1216: 3.3799999999999999 | O1216: =SUM(M1216:N1216) -> 36.549999999999997
A1217: 4334 | B1217: EOL VENTOS DE SANTA LEIA 12 | C1217: 35.859.036/0002-90 | D1217: 31.890000000000001 | E1217: 0 | F1217: 0 | G1217: 0 | H1217: 0 | I1217: 0 | J1217: 0 | K1217: 35.140000000000001 | L1217: 0 | M1217: =SUM(J1217:L1217)-3.25 -> 31.890000000000001 | N1217: 3.25 | O1217: =SUM(M1217:N1217) -> 35.140000000000001
A1218: 4335 | B1218: EOL VENTOS DE SANTA LEIA 13 | C1218: 35.896.824/0002-57 | D1218: 32.490000000000002 | E1218: 0 | F1218: 0 | G1218: 0 | H1218: 0 | I1218: 0 | J1218: 0 | K1218: 35.799999999999997 | L1218: 0 | M1218: =SUM(J1218:L1218)-3.31 -> 32.489999999999995 | N1218: 3.3100000000000001 | O1218: =SUM(M1218:N1218) -> 35.799999999999997
A1219: 4336 | B1219: EOL VENTOS DE SANTA LEIA 14 | C1219: 35.865.649/0002-30 | D1219: 32.490000000000002 | E1219: 0 | F1219: 0 | G1219: 0 | H1219: 0 | I1219: 0 | J1219: 0 | K1219: 35.799999999999997 | L1219: 0 | M1219: =SUM(J1219:L1219)-3.31 -> 32.489999999999995 | N1219: 3.3100000000000001 | O1219: =SUM(M1219:N1219) -> 35.799999999999997
A1220: 4337 | B1220: EOL SANTO AGOSTINHO 14 | C1220: 20.666.572/0002-00 | D1220: 15.59 | E1220: 0 | F1220: 0 | G1220: 0 | H1220: 0 | I1220: 0 | J1220: 0 | K1220: 17.18 | L1220: 0 | M1220: =SUM(J1220:L1220)-1.59 -> 15.59 | N1220: 1.5900000000000001 | O1220: =SUM(M1220:N1220) -> 17.18
A1221: 4338 | B1221: EOL SANTO AGOSTINHO 25 | C1221: 23.079.920/0002-23 | D1221: 62.350000000000001 | E1221: 0 | F1221: 0 | G1221: 0 | H1221: 0 | I1221: 0 | J1221: 0 | K1221: 68.709999999999994 | L1221: 0 | M1221: =SUM(J1221:L1221)-6.36 -> 62.349999999999994 | N1221: 6.3600000000000003 | O1221: =SUM(M1221:N1221) -> 68.709999999999994
A1222: 4339 | B1222: UFV SERRA DO MATO III | C1222: 36.205.095/0001-27 | D1222: 115.29000000000001 | E1222: 0 | F1222: 0 | G1222: 0 | H1222: 0 | I1222: 0 | J1222: 0 | K1222: 127.04000000000001 | L1222: 0 | M1222: =SUM(J1222:L1222)-11.75 -> 115.29000000000001 | N1222: 11.75 | O1222: =SUM(M1222:N1222) -> 127.04000000000001
A1223: 4340 | B1223: UFV SERRA DO MATO IV | C1223: 36.159.672/0001-91 | D1223: 132.09999999999999 | E1223: 0 | F1223: 0 | G1223: 0 | H1223: 0 | I1223: 0 | J1223: 0 | K1223: 145.56 | L1223: 0 | M1223: =SUM(J1223:L1223)-13.46 -> 132.09999999999999 | N1223: 13.460000000000001 | O1223: =SUM(M1223:N1223) -> 145.56
A1224: 4341 | B1224: UFV PITOMBEIRA | C1224: 19.382.073/0001-13 | D1224: 116.28 | E1224: 0 | F1224: 0 | G1224: 0 | H1224: 0 | I1224: 0 | J1224: 0 | K1224: 128.13 | L1224: 0 | M1224: =SUM(J1224:L1224)-11.85 -> 116.28 | N1224: 11.85 | O1224: =SUM(M1224:N1224) -> 128.13
A1225: 4342 | B1225: EOL SANTO AGOSTINHO 17 | C1225: 20.666.636/0002-65 | D1225: 109.11 | E1225: 0 | F1225: 0 | G1225: 0 | H1225: 0 | I1225: 0 | J1225: 0 | K1225: 120.23 | L1225: 0 | M1225: =SUM(J1225:L1225)-11.12 -> 109.11 | N1225: 11.119999999999999 | O1225: =SUM(M1225:N1225) -> 120.23
A1226: 4343 | B1226: EOL VENTOS DE SANTA EUGÊNIA 06 | C1226: 35.636.424/0002-02 | D1226: 83.450000000000003 | E1226: 0 | F1226: 0 | G1226: 0 | H1226: 0 | I1226: 0 | J1226: 0 | K1226: 91.959999999999994 | L1226: 0 | M1226: =SUM(J1226:L1226)-8.51 -> 83.449999999999989 | N1226: 8.5099999999999998 | O1226: =SUM(M1226:N1226) -> 91.959999999999994
A1227: 4344 | B1227: EOL VENTOS DE SANTA EUGÊNIA 09 | C1227: 35.636.427/0002-46 | D1227: 97.340000000000003 | E1227: 0 | F1227: 0 | G1227: 0 | H1227: 0 | I1227: 0 | J1227: 0 | K1227: 107.26000000000001 | L1227: 0 | M1227: =SUM(J1227:L1227)-9.92 -> 97.340000000000003 | N1227: 9.9199999999999999 | O1227: =SUM(M1227:N1227) -> 107.26000000000001
A1228: 4345 | B1228: UFV CIRANDA 1 | C1228: 35.912.298/0001-90 | D1228: 124.48999999999999 | E1228: 0 | F1228: 0 | G1228: 0 | H1228: 0 | I1228: 0 | J1228: 0 | K1228: 137.18000000000001 | L1228: 0 | M1228: =SUM(J1228:L1228)-12.69 -> 124.49000000000001 | N1228: 12.69 | O1228: =SUM(M1228:N1228) -> 137.18000000000001
A1229: 4346 | B1229: UFV CIRANDA 2 | C1229: 35.911.733/0001-62 | D1229: 124.48999999999999 | E1229: 0 | F1229: 0 | G1229: 0 | H1229: 0 | I1229: 0 | J1229: 0 | K1229: 137.18000000000001 | L1229: 0 | M1229: =SUM(J1229:L1229)-12.69 -> 124.49000000000001 | N1229: 12.69 | O1229: =SUM(M1229:N1229) -> 137.18000000000001
A1230: 4347 | B1230: UFV CIRANDA 3 | C1230: 35.911.730/0001-29 | D1230: 124.48999999999999 | E1230: 0 | F1230: 0 | G1230: 0 | H1230: 0 | I1230: 0 | J1230: 0 | K1230: 137.18000000000001 | L1230: 0 | M1230: =SUM(J1230:L1230)-12.69 -> 124.49000000000001 | N1230: 12.69 | O1230: =SUM(M1230:N1230) -> 137.18000000000001
A1231: 4348 | B1231: UFV JANAUBA 15 | C1231: 37.380.978/0001-36 | D1231: 131.02000000000001 | E1231: 0 | F1231: 0 | G1231: 0 | H1231: 0 | I1231: 0 | J1231: 0 | K1231: 144.37 | L1231: 0 | M1231: =SUM(J1231:L1231)-13.35 -> 131.02000000000001 | N1231: 13.35 | O1231: =SUM(M1231:N1231) -> 144.37
A1232: 4349 | B1232: EOL SERRA DO SERIDO VII | C1232: 35.831.892/0001-57 | D1232: 95.370000000000005 | E1232: 0 | F1232: 0 | G1232: 0 | H1232: 0 | I1232: 0 | J1232: 0 | K1232: 105.09 | L1232: 0 | M1232: =SUM(J1232:L1232)-9.72 -> 95.370000000000005 | N1232: 9.7200000000000006 | O1232: =SUM(M1232:N1232) -> 105.09
A1233: 4350 | B1233: UFV JANAUBA 16 | C1233: 37.381.026/0001-37 | D1233: 131.02000000000001 | E1233: 0 | F1233: 0 | G1233: 0 | H1233: 0 | I1233: 0 | J1233: 0 | K1233: 144.37 | L1233: 0 | M1233: =SUM(J1233:L1233)-13.35 -> 131.02000000000001 | N1233: 13.35 | O1233: =SUM(M1233:N1233) -> 144.37
A1234: 4351 | B1234: FURNAS-G | C1234: 23.274.194/0001-19 | D1234: 30313.900000000001 | E1234: 0 | F1234: 0 | G1234: 0 | H1234: 0 | I1234: 0 | J1234: 0 | K1234: 33403.75 | L1234: 0 | M1234: =SUM(J1234:L1234)-3089.85 -> 30313.900000000001 | N1234: 3089.8499999999999 | O1234: =SUM(M1234:N1234) -> 33403.75
A1235: 4352 | B1235: UFV JANAUBA 17 | C1235: 37.381.244/0001-71 | D1235: 131.02000000000001 | E1235: 0 | F1235: 0 | G1235: 0 | H1235: 0 | I1235: 0 | J1235: 0 | K1235: 144.37 | L1235: 0 | M1235: =SUM(J1235:L1235)-13.35 -> 131.02000000000001 | N1235: 13.35 | O1235: =SUM(M1235:N1235) -> 144.37
A1236: 4353 | B1236: UHE SERRA DA MESA | C1236: 23.274.194/0001-19 | D1236: 5406.1700000000001 | E1236: 0 | F1236: 0 | G1236: 0 | H1236: 0 | I1236: 0 | J1236: 0 | K1236: 5957.21 | L1236: 0 | M1236: =SUM(J1236:L1236)-551.04 -> 5406.1700000000001 | N1236: 551.03999999999996 | O1236: =SUM(M1236:N1236) -> 5957.21
A1237: 4354 | B1237: UFV JANAUBA 18 | C1237: 37.404.973/0001-04 | D1237: 131.02000000000001 | E1237: 0 | F1237: 0 | G1237: 0 | H1237: 0 | I1237: 0 | J1237: 0 | K1237: 144.37 | L1237: 0 | M1237: =SUM(J1237:L1237)-13.35 -> 131.02000000000001 | N1237: 13.35 | O1237: =SUM(M1237:N1237) -> 144.37
A1238: 4355 | B1238: UFV JANAUBA 19 | C1238: 37.405.468/0001-76 | D1238: 131.02000000000001 | E1238: 0 | F1238: 0 | G1238: 0 | H1238: 0 | I1238: 0 | J1238: 0 | K1238: 144.37 | L1238: 0 | M1238: =SUM(J1238:L1238)-13.35 -> 131.02000000000001 | N1238: 13.35 | O1238: =SUM(M1238:N1238) -> 144.37
A1239: 4356 | B1239: UFV JANAUBA 20 | C1239: 37.381.136/0001-07 | D1239: 131.02000000000001 | E1239: 0 | F1239: 0 | G1239: 0 | H1239: 0 | I1239: 0 | J1239: 0 | K1239: 144.37 | L1239: 0 | M1239: =SUM(J1239:L1239)-13.35 -> 131.02000000000001 | N1239: 13.35 | O1239: =SUM(M1239:N1239) -> 144.37
A1240: 4357 | B1240: EOL SERRA DO SERIDO III | C1240: 35.835.835/0001-46 | D1240: 95.370000000000005 | E1240: 0 | F1240: 0 | G1240: 0 | H1240: 0 | I1240: 0 | J1240: 0 | K1240: 105.09 | L1240: 0 | M1240: =SUM(J1240:L1240)-9.72 -> 95.370000000000005 | N1240: 9.7200000000000006 | O1240: =SUM(M1240:N1240) -> 105.09
A1241: 4358 | B1241: EOL VENTOS DE SAO ROQUE 05 | C1241: 36.051.519/0001-46 | D1241: 112.91 | E1241: 0 | F1241: 0 | G1241: 0 | H1241: 0 | I1241: 0 | J1241: 0 | K1241: 124.42 | L1241: 0 | M1241: =SUM(J1241:L1241)-11.51 -> 112.91 | N1241: 11.51 | O1241: =SUM(M1241:N1241) -> 124.42
A1242: 4359 | B1242: EOL VENTOS DE SAO ROQUE 03 | C1242: 36.051.515/0001-68 | D1242: 112.91 | E1242: 0 | F1242: 0 | G1242: 0 | H1242: 0 | I1242: 0 | J1242: 0 | K1242: 124.42 | L1242: 0 | M1242: =SUM(J1242:L1242)-11.51 -> 112.91 | N1242: 11.51 | O1242: =SUM(M1242:N1242) -> 124.42
A1243: 4360 | B1243: EOL VENTOS DE SAO VITOR 12 | C1243: 35.436.200/0001-76 | D1243: 82.359999999999999 | E1243: 0 | F1243: 0 | G1243: 0 | H1243: 0 | I1243: 0 | J1243: 0 | K1243: 90.75 | L1243: 0 | M1243: =SUM(J1243:L1243)-8.39 -> 82.359999999999999 | N1243: 8.3900000000000006 | O1243: =SUM(M1243:N1243) -> 90.75
A1244: 4361 | B1244: EOL VENTOS DE SAO VITOR 13 | C1244: 35.436.176/0001-75 | D1244: 80.930000000000007 | E1244: 0 | F1244: 0 | G1244: 0 | H1244: 0 | I1244: 0 | J1244: 0 | K1244: 89.180000000000007 | L1244: 0 | M1244: =SUM(J1244:L1244)-8.25 -> 80.930000000000007 | N1244: 8.25 | O1244: =SUM(M1244:N1244) -> 89.180000000000007
A1245: 4362 | B1245: EOL VENTOS DE SAO VITOR 14 | C1245: 35.477.384/0001-12 | D1245: 97.120000000000005 | E1245: 0 | F1245: 0 | G1245: 0 | H1245: 0 | I1245: 0 | J1245: 0 | K1245: 107.02 | L1245: 0 | M1245: =SUM(J1245:L1245)-9.9 -> 97.11999999999999 | N1245: 9.9000000000000004 | O1245: =SUM(M1245:N1245) -> 107.02
A1246: 4363 | B1246: EOL ASSURUÁ 5 III | C1246: 35.497.092/0002-22 | D1246: 104.5 | E1246: 0 | F1246: 0 | G1246: 0 | H1246: 0 | I1246: 0 | J1246: 0 | K1246: 115.15000000000001 | L1246: 0 | M1246: =SUM(J1246:L1246)-10.65 -> 104.5 | N1246: 10.65 | O1246: =SUM(M1246:N1246) -> 115.15000000000001
A1247: 4364 | B1247: EOL ASSURUÁ 5 V | C1247: 42.929.707/0002-08 | D1247: 88.719999999999999 | E1247: 0 | F1247: 0 | G1247: 0 | H1247: 0 | I1247: 0 | J1247: 0 | K1247: 97.760000000000005 | L1247: 0 | M1247: =SUM(J1247:L1247)-9.04 -> 88.719999999999999 | N1247: 9.0399999999999991 | O1247: =SUM(M1247:N1247) -> 97.759999999999991
A1248: 4365 | B1248: EOL AURA TANQUE NOVO 01 | C1248: 35.718.914/0002-58 | D1248: 63.759999999999998 | E1248: 0 | F1248: 0 | G1248: 0 | H1248: 0 | I1248: 0 | J1248: 0 | K1248: 70.260000000000005 | L1248: 0 | M1248: =SUM(J1248:L1248)-6.5 -> 63.760000000000005 | N1248: 6.5 | O1248: =SUM(M1248:N1248) -> 70.260000000000005
A1249: 4366 | B1249: EOL AURA TANQUE NOVO 02 | C1249: 35.655.215/0002-06 | D1249: 42.509999999999998 | E1249: 0 | F1249: 0 | G1249: 0 | H1249: 0 | I1249: 0 | J1249: 0 | K1249: 46.840000000000003 | L1249: 0 | M1249: =SUM(J1249:L1249)-4.33 -> 42.510000000000005 | N1249: 4.3300000000000001 | O1249: =SUM(M1249:N1249) -> 46.840000000000003
A1250: 4367 | B1250: UFV SANTA LUZIA 1 | C1250: 40.585.991/0001-36 | D1250: 115.13 | E1250: 0 | F1250: 0 | G1250: 0 | H1250: 0 | I1250: 0 | J1250: 0 | K1250: 126.87 | L1250: 0 | M1250: =SUM(J1250:L1250)-11.74 -> 115.13000000000001 | N1250: 11.74 | O1250: =SUM(M1250:N1250) -> 126.87
A1251: 4368 | B1251: UFV SANTA LUZIA 2 | C1251: 40.586.002/0001-29 | D1251: 115.13 | E1251: 0 | F1251: 0 | G1251: 0 | H1251: 0 | I1251: 0 | J1251: 0 | K1251: 126.87 | L1251: 0 | M1251: =SUM(J1251:L1251)-11.74 -> 115.13000000000001 | N1251: 11.74 | O1251: =SUM(M1251:N1251) -> 126.87
A1252: 4369 | B1252: UFV SANTA LUZIA 3 | C1252: 40.586.027/0001-22 | D1252: 115.13 | E1252: 0 | F1252: 0 | G1252: 0 | H1252: 0 | I1252: 0 | J1252: 0 | K1252: 126.87 | L1252: 0 | M1252: =SUM(J1252:L1252)-11.74 -> 115.13000000000001 | N1252: 11.74 | O1252: =SUM(M1252:N1252) -> 126.87
A1253: 4370 | B1253: UFV SANTA LUZIA 4 | C1253: 40.586.043/0001-15 | D1253: 115.13 | E1253: 0 | F1253: 0 | G1253: 0 | H1253: 0 | I1253: 0 | J1253: 0 | K1253: 126.87 | L1253: 0 | M1253: =SUM(J1253:L1253)-11.74 -> 115.13000000000001 | N1253: 11.74 | O1253: =SUM(M1253:N1253) -> 126.87
A1254: 4371 | B1254: UFV SANTA LUZIA 5 | C1254: 40.790.472/0001-00 | D1254: 85.739999999999995 | E1254: 0 | F1254: 0 | G1254: 0 | H1254: 0 | I1254: 0 | J1254: 0 | K1254: 94.480000000000004 | L1254: 0 | M1254: =SUM(J1254:L1254)-8.74 -> 85.740000000000009 | N1254: 8.7400000000000002 | O1254: =SUM(M1254:N1254) -> 94.480000000000004
A1255: 4372 | B1255: UFV SANTA LUZIA 6 | C1255: 40.586.566/0001-61 | D1255: 115.13 | E1255: 0 | F1255: 0 | G1255: 0 | H1255: 0 | I1255: 0 | J1255: 0 | K1255: 126.87 | L1255: 0 | M1255: =SUM(J1255:L1255)-11.74 -> 115.13000000000001 | N1255: 11.74 | O1255: =SUM(M1255:N1255) -> 126.87
A1256: 4373 | B1256: UFV SANTA LUZIA 7 | C1256: 40.586.619/0001-44 | D1256: 85.739999999999995 | E1256: 0 | F1256: 0 | G1256: 0 | H1256: 0 | I1256: 0 | J1256: 0 | K1256: 94.480000000000004 | L1256: 0 | M1256: =SUM(J1256:L1256)-8.74 -> 85.740000000000009 | N1256: 8.7400000000000002 | O1256: =SUM(M1256:N1256) -> 94.480000000000004
A1257: 4374 | B1257: UTE PROSPERIDADE II | C1257: 23.857.764/0001-01 | D1257: 123.03 | E1257: 0 | F1257: 0 | G1257: 0 | H1257: 0 | I1257: 0 | J1257: 0 | K1257: 135.56999999999999 | L1257: 0 | M1257: =SUM(J1257:L1257)-12.54 -> 123.03 | N1257: 12.539999999999999 | O1257: =SUM(M1257:N1257) -> 135.56999999999999
A1258: 4375 | B1258: UTE PROSPERIDADE III | C1258: 23.857.764/0001-01 | D1258: 147.47 | E1258: 0 | F1258: 0 | G1258: 0 | H1258: 0 | I1258: 0 | J1258: 0 | K1258: 162.5 | L1258: 0 | M1258: =SUM(J1258:L1258)-15.03 -> 147.47 | N1258: 15.029999999999999 | O1258: =SUM(M1258:N1258) -> 162.5
A1259: 4376 | B1259: EOL SANTO AGOSTINHO 27 | C1259: 23.193.334/0002-05 | D1259: 93.519999999999996 | E1259: 0 | F1259: 0 | G1259: 0 | H1259: 0 | I1259: 0 | J1259: 0 | K1259: 103.05 | L1259: 0 | M1259: =SUM(J1259:L1259)-9.53 -> 93.519999999999996 | N1259: 9.5299999999999994 | O1259: =SUM(M1259:N1259) -> 103.05
A1260: 4377 | B1260: EOL VENTOS DE SANTA EUGÊNIA 14 | C1260: 35.636.427/0002-46 | D1260: 55.990000000000002 | E1260: 0 | F1260: 0 | G1260: 0 | H1260: 0 | I1260: 0 | J1260: 0 | K1260: 61.700000000000003 | L1260: 0 | M1260: =SUM(J1260:L1260)-5.71 -> 55.990000000000002 | N1260: 5.71 | O1260: =SUM(M1260:N1260) -> 61.700000000000003
A1261: 4378 | B1261: EOL VENTOS DE SANTA LUZIA 01 | C1261: 41.489.453/0001-00 | D1261: 112.28 | E1261: 0 | F1261: 0 | G1261: 0 | H1261: 0 | I1261: 0 | J1261: 0 | K1261: 123.72 | L1261: 0 | M1261: =SUM(J1261:L1261)-11.44 -> 112.28 | N1261: 11.44 | O1261: =SUM(M1261:N1261) -> 123.72
A1262: 4379 | B1262: EOL VENTOS DE SAO ROQUE 06 | C1262: 36.677.071/0001-70 | D1262: 112.91 | E1262: 0 | F1262: 0 | G1262: 0 | H1262: 0 | I1262: 0 | J1262: 0 | K1262: 124.42 | L1262: 0 | M1262: =SUM(J1262:L1262)-11.51 -> 112.91 | N1262: 11.51 | O1262: =SUM(M1262:N1262) -> 124.42
A1263: 4380 | B1263: EOL VENTOS DE SAO ROQUE 07 | C1263: 36.051.524/0001-59 | D1263: 112.91 | E1263: 0 | F1263: 0 | G1263: 0 | H1263: 0 | I1263: 0 | J1263: 0 | K1263: 124.42 | L1263: 0 | M1263: =SUM(J1263:L1263)-11.51 -> 112.91 | N1263: 11.51 | O1263: =SUM(M1263:N1263) -> 124.42
A1264: 4381 | B1264: EOL VENTOS DE SÃO ROQUE 13 | C1264: 31.596.793/0001-87 | D1264: 112.91 | E1264: 0 | F1264: 0 | G1264: 0 | H1264: 0 | I1264: 0 | J1264: 0 | K1264: 124.42 | L1264: 0 | M1264: =SUM(J1264:L1264)-11.51 -> 112.91 | N1264: 11.51 | O1264: =SUM(M1264:N1264) -> 124.42
A1265: 4382 | B1265: EOL VENTOS DE SAO ROQUE 19 | C1265: 31.596.421/0001-50 | D1265: 112.91 | E1265: 0 | F1265: 0 | G1265: 0 | H1265: 0 | I1265: 0 | J1265: 0 | K1265: 124.42 | L1265: 0 | M1265: =SUM(J1265:L1265)-11.51 -> 112.91 | N1265: 11.51 | O1265: =SUM(M1265:N1265) -> 124.42
A1266: 4383 | B1266: EOL VENTOS DE SAO ROQUE 22 | C1266: 31.596.769/0001-48 | D1266: 112.91 | E1266: 0 | F1266: 0 | G1266: 0 | H1266: 0 | I1266: 0 | J1266: 0 | K1266: 124.42 | L1266: 0 | M1266: =SUM(J1266:L1266)-11.51 -> 112.91 | N1266: 11.51 | O1266: =SUM(M1266:N1266) -> 124.42
A1267: 4384 | B1267: EOL VENTOS DE SÃO ROQUE 26 | C1267: 31.594.093/0001-53 | D1267: 112.91 | E1267: 0 | F1267: 0 | G1267: 0 | H1267: 0 | I1267: 0 | J1267: 0 | K1267: 124.42 | L1267: 0 | M1267: =SUM(J1267:L1267)-11.51 -> 112.91 | N1267: 11.51 | O1267: =SUM(M1267:N1267) -> 124.42
A1268: 4385 | B1268: EOL VENTOS DE SAO ROQUE 29 | C1268: 31.595.987/0001-68 | D1268: 84.680000000000007 | E1268: 0 | F1268: 0 | G1268: 0 | H1268: 0 | I1268: 0 | J1268: 0 | K1268: 93.310000000000002 | L1268: 0 | M1268: =SUM(J1268:L1268)-8.63 -> 84.680000000000007 | N1268: 8.6300000000000008 | O1268: =SUM(M1268:N1268) -> 93.310000000000002
A1269: 4386 | B1269: UFV LAR DO SOL 3 | C1269: 31.321.803/0001-71 | D1269: 120.48 | E1269: 0 | F1269: 0 | G1269: 0 | H1269: 0 | I1269: 0 | J1269: 0 | K1269: 132.75999999999999 | L1269: 0 | M1269: =SUM(J1269:L1269)-12.28 -> 120.47999999999999 | N1269: 12.279999999999999 | O1269: =SUM(M1269:N1269) -> 132.75999999999999
A1270: 4387 | B1270: UFV LAR DO SOL 4 | C1270: 31.321.803/0001-71 | D1270: 120.48 | E1270: 0 | F1270: 0 | G1270: 0 | H1270: 0 | I1270: 0 | J1270: 0 | K1270: 132.75999999999999 | L1270: 0 | M1270: =SUM(J1270:L1270)-12.28 -> 120.47999999999999 | N1270: 12.279999999999999 | O1270: =SUM(M1270:N1270) -> 132.75999999999999
A1271: 4388 | B1271: UFV LAR DO SOL 5 | C1271: 31.321.885/0001-54 | D1271: 120.48 | E1271: 0 | F1271: 0 | G1271: 0 | H1271: 0 | I1271: 0 | J1271: 0 | K1271: 132.75999999999999 | L1271: 0 | M1271: =SUM(J1271:L1271)-12.28 -> 120.47999999999999 | N1271: 12.279999999999999 | O1271: =SUM(M1271:N1271) -> 132.75999999999999
A1272: 4389 | B1272: UFV LAR DO SOL 6 | C1272: 31.414.665/0001-75 | D1272: 120.48 | E1272: 0 | F1272: 0 | G1272: 0 | H1272: 0 | I1272: 0 | J1272: 0 | K1272: 132.75999999999999 | L1272: 0 | M1272: =SUM(J1272:L1272)-12.28 -> 120.47999999999999 | N1272: 12.279999999999999 | O1272: =SUM(M1272:N1272) -> 132.75999999999999
A1273: 4390 | B1273: EOL SANTO AGOSTINHO 04 | C1273: 20.675.170/0002-64 | D1273: 93.519999999999996 | E1273: 0 | F1273: 0 | G1273: 0 | H1273: 0 | I1273: 0 | J1273: 0 | K1273: 103.05 | L1273: 0 | M1273: =SUM(J1273:L1273)-9.53 -> 93.519999999999996 | N1273: 9.5299999999999994 | O1273: =SUM(M1273:N1273) -> 103.05
A1274: 4391 | B1274: UFV SANTA LUZIA 9 | C1274: 40.586.767/0001-69 | D1274: 84.239999999999995 | E1274: 0 | F1274: 0 | G1274: 0 | H1274: 0 | I1274: 0 | J1274: 0 | K1274: 92.829999999999998 | L1274: 0 | M1274: =SUM(J1274:L1274)-8.59 -> 84.239999999999995 | N1274: 8.5899999999999999 | O1274: =SUM(M1274:N1274) -> 92.829999999999998
A1275: 4392 | B1275: EOL AURA CAETITE 01 | C1275: 35.655.205/0002-70 | D1275: 62.850000000000001 | E1275: 0 | F1275: 0 | G1275: 0 | H1275: 0 | I1275: 0 | J1275: 0 | K1275: 69.260000000000005 | L1275: 0 | M1275: =SUM(J1275:L1275)-6.41 -> 62.850000000000009 | N1275: 6.4100000000000001 | O1275: =SUM(M1275:N1275) -> 69.260000000000005
A1276: 4393 | B1276: EOL AURA CAETITE 02 | C1276: 35.655.200/0002-48 | D1276: 85.030000000000001 | E1276: 0 | F1276: 0 | G1276: 0 | H1276: 0 | I1276: 0 | J1276: 0 | K1276: 93.700000000000003 | L1276: 0 | M1276: =SUM(J1276:L1276)-8.67 -> 85.030000000000001 | N1276: 8.6699999999999999 | O1276: =SUM(M1276:N1276) -> 93.700000000000003
A1277: 4394 | B1277: UTE PORTO DAS ÁGUAS II | C1277: 08.322.396/0001-03 | D1277: 192.90000000000001 | E1277: 0 | F1277: 0 | G1277: 0 | H1277: 0 | I1277: 0 | J1277: 0 | K1277: 212.56 | L1277: 0 | M1277: =SUM(J1277:L1277)-19.66 -> 192.90000000000001 | N1277: 19.66 | O1277: =SUM(M1277:N1277) -> 212.56
A1278: 4395 | B1278: EOL AURA CAETITE 03 | C1278: 35.655.028/0002-22 | D1278: 85.030000000000001 | E1278: 0 | F1278: 0 | G1278: 0 | H1278: 0 | I1278: 0 | J1278: 0 | K1278: 93.700000000000003 | L1278: 0 | M1278: =SUM(J1278:L1278)-8.67 -> 85.030000000000001 | N1278: 8.6699999999999999 | O1278: =SUM(M1278:N1278) -> 93.700000000000003
A1279: 4396 | B1279: EOL AURA TANQUE NOVO 03 | C1279: 35.655.024/0002-44 | D1279: 31.420000000000002 | E1279: 0 | F1279: 0 | G1279: 0 | H1279: 0 | I1279: 0 | J1279: 0 | K1279: 34.619999999999997 | L1279: 0 | M1279: =SUM(J1279:L1279)-3.2 -> 31.419999999999998 | N1279: 3.2000000000000002 | O1279: =SUM(M1279:N1279) -> 34.619999999999997
A1280: 4397 | B1280: EOL SERRA DA MANGABEIRA | C1280: 35.924.128/0002-07 | D1280: 202.68000000000001 | E1280: 0 | F1280: 0 | G1280: 0 | H1280: 0 | I1280: 0 | J1280: 0 | K1280: 223.34 | L1280: 0 | M1280: =SUM(J1280:L1280)-20.66 -> 202.68000000000001 | N1280: 20.66 | O1280: =SUM(M1280:N1280) -> 223.34
A1281: 4398 | B1281: UFV SOLAR IRECE 01 | C1281: 25.215.822/0001-10 | D1281: 173.16 | E1281: 0 | F1281: 0 | G1281: 0 | H1281: 0 | I1281: 0 | J1281: 0 | K1281: 190.81 | L1281: 0 | M1281: =SUM(J1281:L1281)-17.65 -> 173.16 | N1281: 17.649999999999999 | O1281: =SUM(M1281:N1281) -> 190.81
A1282: 4399 | B1282: UFV DUNAMIS I | C1282: 32.708.258/0001-33 | D1282: 71.25 | E1282: 0 | F1282: 0 | G1282: 0 | H1282: 0 | I1282: 0 | J1282: 0 | K1282: 78.510000000000005 | L1282: 0 | M1282: =SUM(J1282:L1282)-7.26 -> 71.25 | N1282: 7.2599999999999998 | O1282: =SUM(M1282:N1282) -> 78.510000000000005
A1283: 4400 | B1283: UFV DUNAMIS II | C1283: 32.708.258/0001-33 | D1283: 71.25 | E1283: 0 | F1283: 0 | G1283: 0 | H1283: 0 | I1283: 0 | J1283: 0 | K1283: 78.510000000000005 | L1283: 0 | M1283: =SUM(J1283:L1283)-7.26 -> 71.25 | N1283: 7.2599999999999998 | O1283: =SUM(M1283:N1283) -> 78.510000000000005
A1284: 4401 | B1284: UFV DUNAMIS III | C1284: 32.708.258/0001-33 | D1284: 71.25 | E1284: 0 | F1284: 0 | G1284: 0 | H1284: 0 | I1284: 0 | J1284: 0 | K1284: 78.510000000000005 | L1284: 0 | M1284: =SUM(J1284:L1284)-7.26 -> 71.25 | N1284: 7.2599999999999998 | O1284: =SUM(M1284:N1284) -> 78.510000000000005
A1285: 4402 | B1285: UFV DUNAMIS IV | C1285: 32.708.258/0001-33 | D1285: 71.25 | E1285: 0 | F1285: 0 | G1285: 0 | H1285: 0 | I1285: 0 | J1285: 0 | K1285: 78.510000000000005 | L1285: 0 | M1285: =SUM(J1285:L1285)-7.26 -> 71.25 | N1285: 7.2599999999999998 | O1285: =SUM(M1285:N1285) -> 78.510000000000005
A1286: 4403 | B1286: EOL ASSURUA 5 I | C1286: 38.297.095/0002-00 | D1286: 103.51000000000001 | E1286: 0 | F1286: 0 | G1286: 0 | H1286: 0 | I1286: 0 | J1286: 0 | K1286: 114.06 | L1286: 0 | M1286: =SUM(J1286:L1286)-10.55 -> 103.51000000000001 | N1286: 10.550000000000001 | O1286: =SUM(M1286:N1286) -> 114.06
A1287: 4404 | B1287: EOL ASSURUA 5 VI | C1287: 42.931.551/0002-08 | D1287: 88.719999999999999 | E1287: 0 | F1287: 0 | G1287: 0 | H1287: 0 | I1287: 0 | J1287: 0 | K1287: 97.760000000000005 | L1287: 0 | M1287: =SUM(J1287:L1287)-9.04 -> 88.719999999999999 | N1287: 9.0399999999999991 | O1287: =SUM(M1287:N1287) -> 97.759999999999991
A1288: 4405 | B1288: EOL AURA CAETITE 04 | C1288: 35.655.010/0002-20 | D1288: 52.369999999999997 | E1288: 0 | F1288: 0 | G1288: 0 | H1288: 0 | I1288: 0 | J1288: 0 | K1288: 57.710000000000001 | L1288: 0 | M1288: =SUM(J1288:L1288)-5.34 -> 52.370000000000005 | N1288: 5.3399999999999999 | O1288: =SUM(M1288:N1288) -> 57.710000000000008
A1289: 4406 | B1289: EOL SANTO AGOSTINHO 03 | C1289: 20.675.156/0002-60 | D1289: 31.170000000000002 | E1289: 0 | F1289: 0 | G1289: 0 | H1289: 0 | I1289: 0 | J1289: 0 | K1289: 34.350000000000001 | L1289: 0 | M1289: =SUM(J1289:L1289)-3.18 -> 31.170000000000002 | N1289: 3.1800000000000002 | O1289: =SUM(M1289:N1289) -> 34.350000000000001
A1290: 4407 | B1290: EOL SANTO AGOSTINHO 05 | C1290: 20.675.180/0002-08 | D1290: 140.28 | E1290: 0 | F1290: 0 | G1290: 0 | H1290: 0 | I1290: 0 | J1290: 0 | K1290: 154.58000000000001 | L1290: 0 | M1290: =SUM(J1290:L1290)-14.3 -> 140.28 | N1290: 14.300000000000001 | O1290: =SUM(M1290:N1290) -> 154.58000000000001
A1291: 4408 | B1291: EOL SERRA DO SERIDÓ II | C1291: 35.831.799/0001-42 | D1291: 35.759999999999998 | E1291: 0 | F1291: 0 | G1291: 0 | H1291: 0 | I1291: 0 | J1291: 0 | K1291: 39.399999999999999 | L1291: 0 | M1291: =SUM(J1291:L1291)-3.64 -> 35.759999999999998 | N1291: 3.6400000000000001 | O1291: =SUM(M1291:N1291) -> 39.399999999999999
A1292: 4409 | B1292: EOL SERRA DO SERIDÓ IV | C1292: 35.957.107/0001-07 | D1292: 95.359999999999999 | E1292: 0 | F1292: 0 | G1292: 0 | H1292: 0 | I1292: 0 | J1292: 0 | K1292: 105.08 | L1292: 0 | M1292: =SUM(J1292:L1292)-9.72 -> 95.359999999999999 | N1292: 9.7200000000000006 | O1292: =SUM(M1292:N1292) -> 105.08
A1293: 4410 | B1293: EOL VENTOS DE SANTA LUZIA 02 | C1293: 41.413.101/0002-52 | D1293: 112.28 | E1293: 0 | F1293: 0 | G1293: 0 | H1293: 0 | I1293: 0 | J1293: 0 | K1293: 123.72 | L1293: 0 | M1293: =SUM(J1293:L1293)-11.44 -> 112.28 | N1293: 11.44 | O1293: =SUM(M1293:N1293) -> 123.72
A1294: 4411 | B1294: EOL BONS VENTOS CACIMBAS 3 | C1294: 19.953.139/0003-40 | D1294: 26.170000000000002 | E1294: 0 | F1294: 0 | G1294: 0 | H1294: 0 | I1294: 0 | J1294: 0 | K1294: 28.84 | L1294: 0 | M1294: =SUM(J1294:L1294)-2.67 -> 26.170000000000002 | N1294: 2.6699999999999999 | O1294: =SUM(M1294:N1294) -> 28.840000000000003
A1295: 4412 | B1295: EOL BONS VENTOS CACIMBAS 4 | C1295: 19.953.139/0004-20 | D1295: 18.879999999999999 | E1295: 0 | F1295: 0 | G1295: 0 | H1295: 0 | I1295: 0 | J1295: 0 | K1295: 20.800000000000001 | L1295: 0 | M1295: =SUM(J1295:L1295)-1.92 -> 18.880000000000003 | N1295: 1.9199999999999999 | O1295: =SUM(M1295:N1295) -> 20.800000000000004
A1296: 4413 | B1296: EOL BONS VENTOS CACIMBAS 5 | C1296: 19.953.139/0005-01 | D1296: 37.880000000000003 | E1296: 0 | F1296: 0 | G1296: 0 | H1296: 0 | I1296: 0 | J1296: 0 | K1296: 41.740000000000002 | L1296: 0 | M1296: =SUM(J1296:L1296)-3.86 -> 37.880000000000003 | N1296: 3.8599999999999999 | O1296: =SUM(M1296:N1296) -> 41.740000000000002
A1297: 4414 | B1297: EOL BONS VENTOS CACIMBAS 7 | C1297: 19.953.139/0006-92 | D1297: 30.260000000000002 | E1297: 0 | F1297: 0 | G1297: 0 | H1297: 0 | I1297: 0 | J1297: 0 | K1297: 33.340000000000003 | L1297: 0 | M1297: =SUM(J1297:L1297)-3.08 -> 30.260000000000005 | N1297: 3.0800000000000001 | O1297: =SUM(M1297:N1297) -> 33.340000000000003
A1298: 4415 | B1298: EOL CAETITE D | C1298: 33.457.932/0001-17 | D1298: 115 | E1298: 0 | F1298: 0 | G1298: 0 | H1298: 0 | I1298: 0 | J1298: 0 | K1298: 126.72 | L1298: 0 | M1298: =SUM(J1298:L1298)-11.72 -> 115 | N1298: 11.720000000000001 | O1298: =SUM(M1298:N1298) -> 126.72
A1299: 4429 | B1299: EOL CAJUÍNA A1 | C1299: 36.952.007/0001-50 | D1299: 98.510000000000005 | E1299: 0 | F1299: 0 | G1299: 0 | H1299: 0 | I1299: 0 | J1299: 0 | K1299: 108.55 | L1299: 0 | M1299: =SUM(J1299:L1299)-10.04 -> 98.509999999999991 | N1299: 10.039999999999999 | O1299: =SUM(M1299:N1299) -> 108.54999999999998
A1300: 4430 | B1300: EOL CAJUÍNA A2 | C1300: 36.952.033/0001-89 | D1300: 98.510000000000005 | E1300: 0 | F1300: 0 | G1300: 0 | H1300: 0 | I1300: 0 | J1300: 0 | K1300: 108.55 | L1300: 0 | M1300: =SUM(J1300:L1300)-10.04 -> 98.509999999999991 | N1300: 10.039999999999999 | O1300: =SUM(M1300:N1300) -> 108.54999999999998
A1301: 4431 | B1301: EOL CAJUÍNA A6 | C1301: 36.957.780/0001-00 | D1301: 111.38 | E1301: 0 | F1301: 0 | G1301: 0 | H1301: 0 | I1301: 0 | J1301: 0 | K1301: 122.73 | L1301: 0 | M1301: =SUM(J1301:L1301)-11.35 -> 111.38000000000001 | N1301: 11.35 | O1301: =SUM(M1301:N1301) -> 122.73
A1302: 4432 | B1302: UFV MAURITI 1 | C1302: 31.886.399/0002-64 | D1302: 117.61 | E1302: 0 | F1302: 0 | G1302: 0 | H1302: 0 | I1302: 0 | J1302: 0 | K1302: 129.59999999999999 | L1302: 0 | M1302: =SUM(J1302:L1302)-11.99 -> 117.61 | N1302: 11.99 | O1302: =SUM(M1302:N1302) -> 129.59999999999999
A1303: 4433 | B1303: UFV MAURITI 2 | C1303: 29.103.647/0002-01 | D1303: 58.799999999999997 | E1303: 0 | F1303: 0 | G1303: 0 | H1303: 0 | I1303: 0 | J1303: 0 | K1303: 64.790000000000006 | L1303: 0 | M1303: =SUM(J1303:L1303)-5.99 -> 58.800000000000004 | N1303: 5.9900000000000002 | O1303: =SUM(M1303:N1303) -> 64.790000000000006
A1304: 4434 | B1304: UFV MAURITI 3 | C1304: 29.168.859/0002-77 | D1304: 117.61 | E1304: 0 | F1304: 0 | G1304: 0 | H1304: 0 | I1304: 0 | J1304: 0 | K1304: 129.59999999999999 | L1304: 0 | M1304: =SUM(J1304:L1304)-11.99 -> 117.61 | N1304: 11.99 | O1304: =SUM(M1304:N1304) -> 129.59999999999999
A1305: 4435 | B1305: UFV MAURITI 4 | C1305: 29.469.320/0002-58 | D1305: 117.61 | E1305: 0 | F1305: 0 | G1305: 0 | H1305: 0 | I1305: 0 | J1305: 0 | K1305: 129.59999999999999 | L1305: 0 | M1305: =SUM(J1305:L1305)-11.99 -> 117.61 | N1305: 11.99 | O1305: =SUM(M1305:N1305) -> 129.59999999999999
A1306: 4436 | B1306: UFV MAURITI 5 | C1306: 29.103.664/0002-49 | D1306: 117.61 | E1306: 0 | F1306: 0 | G1306: 0 | H1306: 0 | I1306: 0 | J1306: 0 | K1306: 129.59999999999999 | L1306: 0 | M1306: =SUM(J1306:L1306)-11.99 -> 117.61 | N1306: 11.99 | O1306: =SUM(M1306:N1306) -> 129.59999999999999
A1307: 4437 | B1307: UFV MAURITI 6 | C1307: 29.103.672/0002-95 | D1307: 117.61 | E1307: 0 | F1307: 0 | G1307: 0 | H1307: 0 | I1307: 0 | J1307: 0 | K1307: 129.59999999999999 | L1307: 0 | M1307: =SUM(J1307:L1307)-11.99 -> 117.61 | N1307: 11.99 | O1307: =SUM(M1307:N1307) -> 129.59999999999999
A1308: 4438 | B1308: UFV MAURITI 7 | C1308: 31.153.615/0002-62 | D1308: 35.280000000000001 | E1308: 0 | F1308: 0 | G1308: 0 | H1308: 0 | I1308: 0 | J1308: 0 | K1308: 38.880000000000003 | L1308: 0 | M1308: =SUM(J1308:L1308)-3.6 -> 35.280000000000001 | N1308: 3.6000000000000001 | O1308: =SUM(M1308:N1308) -> 38.880000000000003
A1309: 4439 | B1309: UFV MAURITI 8 | C1309: 31.159.183/0002-05 | D1309: 117.61 | E1309: 0 | F1309: 0 | G1309: 0 | H1309: 0 | I1309: 0 | J1309: 0 | K1309: 129.59999999999999 | L1309: 0 | M1309: =SUM(J1309:L1309)-11.99 -> 117.61 | N1309: 11.99 | O1309: =SUM(M1309:N1309) -> 129.59999999999999
A1310: 4440 | B1310: UFV MAURITI 9 | C1310: 31.864.512/0002-00 | D1310: 23.52 | E1310: 0 | F1310: 0 | G1310: 0 | H1310: 0 | I1310: 0 | J1310: 0 | K1310: 25.920000000000002 | L1310: 0 | M1310: =SUM(J1310:L1310)-2.4 -> 23.520000000000003 | N1310: 2.3999999999999999 | O1310: =SUM(M1310:N1310) -> 25.920000000000002
A1311: 4441 | B1311: UTE PROSPERIDADE IV | C1311: 23.857.764/0001-01 | D1311: 31.539999999999999 | E1311: 0 | F1311: 0 | G1311: 0 | H1311: 0 | I1311: 0 | J1311: 0 | K1311: 34.75 | L1311: 0 | M1311: =SUM(J1311:L1311)-3.21 -> 31.539999999999999 | N1311: 3.21 | O1311: =SUM(M1311:N1311) -> 34.75
A1312: 4442 | B1312: EOL SANTO AGOSTINHO 06 | C1312: 20.675.196/0002-02 | D1312: 62.350000000000001 | E1312: 0 | F1312: 0 | G1312: 0 | H1312: 0 | I1312: 0 | J1312: 0 | K1312: 68.709999999999994 | L1312: 0 | M1312: =SUM(J1312:L1312)-6.36 -> 62.349999999999994 | N1312: 6.3600000000000003 | O1312: =SUM(M1312:N1312) -> 68.709999999999994
A1313: 4444 | B1313: UTE ASOLO 2 | C1313: 41.675.130/0001-01 | D1313: 98.980000000000004 | E1313: 0 | F1313: 0 | G1313: 0 | H1313: 0 | I1313: 0 | J1313: 0 | K1313: 109.06999999999999 | L1313: 0 | M1313: =SUM(J1313:L1313)-10.09 -> 98.97999999999999 | N1313: 10.09 | O1313: =SUM(M1313:N1313) -> 109.06999999999999
A1314: 4445 | B1314: EOL VENTOS DE SANTA LUZIA 03 | C1314: 41.489.491/0002-44 | D1314: 112.28 | E1314: 0 | F1314: 0 | G1314: 0 | H1314: 0 | I1314: 0 | J1314: 0 | K1314: 123.72 | L1314: 0 | M1314: =SUM(J1314:L1314)-11.44 -> 112.28 | N1314: 11.44 | O1314: =SUM(M1314:N1314) -> 123.72
A1315: 4446 | B1315: UFV SAO FRANCISCO I | C1315: 48.209.587/0001-70 | D1315: 119.84999999999999 | E1315: 0 | F1315: 0 | G1315: 0 | H1315: 0 | I1315: 0 | J1315: 0 | K1315: 132.06999999999999 | L1315: 0 | M1315: =SUM(J1315:L1315)-12.22 -> 119.84999999999999 | N1315: 12.220000000000001 | O1315: =SUM(M1315:N1315) -> 132.06999999999999
A1316: 4447 | B1316: UFV SAO FRANCISCO II | C1316: 48.346.774/0001-03 | D1316: 119.84999999999999 | E1316: 0 | F1316: 0 | G1316: 0 | H1316: 0 | I1316: 0 | J1316: 0 | K1316: 132.06999999999999 | L1316: 0 | M1316: =SUM(J1316:L1316)-12.22 -> 119.84999999999999 | N1316: 12.220000000000001 | O1316: =SUM(M1316:N1316) -> 132.06999999999999
A1317: 4448 | B1317: UFV SAO FRANCISCO III | C1317: 48.177.875/0001-90 | D1317: 119.84999999999999 | E1317: 0 | F1317: 0 | G1317: 0 | H1317: 0 | I1317: 0 | J1317: 0 | K1317: 132.06999999999999 | L1317: 0 | M1317: =SUM(J1317:L1317)-12.22 -> 119.84999999999999 | N1317: 12.220000000000001 | O1317: =SUM(M1317:N1317) -> 132.06999999999999
A1318: 4449 | B1318: UHE PASSO REAL | C1318: 33.042.730/0001-04 | D1318: 463.93000000000001 | E1318: 0 | F1318: 0 | G1318: 0 | H1318: 0 | I1318: 0 | J1318: 0 | K1318: 511.22000000000003 | L1318: 0 | M1318: =SUM(J1318:L1318)-47.29 -> 463.93000000000001 | N1318: 47.289999999999999 | O1318: =SUM(M1318:N1318) -> 511.22000000000003
A1319: 4451 | B1319: UHE ITAUBA | C1319: 33.042.730/0001-04 | D1319: 1890.26 | E1319: 0 | F1319: 0 | G1319: 0 | H1319: 0 | I1319: 0 | J1319: 0 | K1319: 2082.9299999999998 | L1319: 0 | M1319: =SUM(J1319:L1319)-192.67 -> 1890.2599999999998 | N1319: 192.66999999999999 | O1319: =SUM(M1319:N1319) -> 2082.9299999999998
A1320: 4459 | B1320: EOL CAJUÍNA A3 | C1320: 36.951.946/0001-80 | D1320: 158.02000000000001 | E1320: 0 | F1320: 0 | G1320: 0 | H1320: 0 | I1320: 0 | J1320: 0 | K1320: 174.13 | L1320: 0 | M1320: =SUM(J1320:L1320)-16.11 -> 158.01999999999998 | N1320: 16.109999999999999 | O1320: =SUM(M1320:N1320) -> 174.13
A1321: 4460 | B1321: EOL CAJUÍNA A4 | C1321: 36.951.974/0001-06 | D1321: 165.93000000000001 | E1321: 0 | F1321: 0 | G1321: 0 | H1321: 0 | I1321: 0 | J1321: 0 | K1321: 182.84 | L1321: 0 | M1321: =SUM(J1321:L1321)-16.91 -> 165.93000000000001 | N1321: 16.91 | O1321: =SUM(M1321:N1321) -> 182.84
A1322: 4461 | B1322: EOL CAJUÍNA A5 | C1322: 36.957.768/0001-03 | D1322: 171.22 | E1322: 0 | F1322: 0 | G1322: 0 | H1322: 0 | I1322: 0 | J1322: 0 | K1322: 188.66999999999999 | L1322: 0 | M1322: =SUM(J1322:L1322)-17.45 -> 171.22 | N1322: 17.449999999999999 | O1322: =SUM(M1322:N1322) -> 188.66999999999999
A1323: 4462 | B1323: EOL CAJUÍNA A7 | C1323: 36.957.804/0001-20 | D1323: 112.58 | E1323: 0 | F1323: 0 | G1323: 0 | H1323: 0 | I1323: 0 | J1323: 0 | K1323: 124.06 | L1323: 0 | M1323: =SUM(J1323:L1323)-11.48 -> 112.58 | N1323: 11.48 | O1323: =SUM(M1323:N1323) -> 124.06
A1324: 4463 | B1324: EOL ASSURUÁ 5 II | C1324: 38.297.116/0002-98 | D1324: 118.29000000000001 | E1324: 0 | F1324: 0 | G1324: 0 | H1324: 0 | I1324: 0 | J1324: 0 | K1324: 130.34999999999999 | L1324: 0 | M1324: =SUM(J1324:L1324)-12.06 -> 118.28999999999999 | N1324: 12.06 | O1324: =SUM(M1324:N1324) -> 130.34999999999999
A1325: 4464 | B1325: EOL ASSURUÁ 5 IV | C1325: 42.929.694/0002-77 | D1325: 118.29000000000001 | E1325: 0 | F1325: 0 | G1325: 0 | H1325: 0 | I1325: 0 | J1325: 0 | K1325: 130.34999999999999 | L1325: 0 | M1325: =SUM(J1325:L1325)-12.06 -> 118.28999999999999 | N1325: 12.06 | O1325: =SUM(M1325:N1325) -> 130.34999999999999
A1326: 4465 | B1326: EOL KAIROS WIND 1 | C1326: 42.166.169/0001-66 | D1326: 86.359999999999999 | E1326: 0 | F1326: 0 | G1326: 0 | H1326: 0 | I1326: 0 | J1326: 0 | K1326: 95.159999999999997 | L1326: 0 | M1326: =SUM(J1326:L1326)-8.8 -> 86.359999999999999 | N1326: 8.8000000000000007 | O1326: =SUM(M1326:N1326) -> 95.159999999999997
A1327: 4466 | B1327: UFV NOVA OLINDA 9 | C1327: 23.566.105/0003-70 | D1327: 21.899999999999999 | E1327: 0 | F1327: 0 | G1327: 0 | H1327: 0 | I1327: 0 | J1327: 0 | K1327: 24.129999999999999 | L1327: 0 | M1327: =SUM(J1327:L1327)-2.23 -> 21.899999999999999 | N1327: 2.23 | O1327: =SUM(M1327:N1327) -> 24.129999999999999
A1328: 4467 | B1328: UFV NOVA OLINDA 11 | C1328: 23.416.727/0003-11 | D1328: 21.91 | E1328: 0 | F1328: 0 | G1328: 0 | H1328: 0 | I1328: 0 | J1328: 0 | K1328: 24.140000000000001 | L1328: 0 | M1328: =SUM(J1328:L1328)-2.23 -> 21.91 | N1328: 2.23 | O1328: =SUM(M1328:N1328) -> 24.140000000000001
A1329: 4468 | B1329: UFV NOVA OLINDA 13 | C1329: 23.414.549/0003-90 | D1329: 21.890000000000001 | E1329: 0 | F1329: 0 | G1329: 0 | H1329: 0 | I1329: 0 | J1329: 0 | K1329: 24.120000000000001 | L1329: 0 | M1329: =SUM(J1329:L1329)-2.23 -> 21.890000000000001 | N1329: 2.23 | O1329: =SUM(M1329:N1329) -> 24.120000000000001
A1330: 4469 | B1330: UFV LAPA 3 | C1330: 23.509.564/0002-30 | D1330: 23.059999999999999 | E1330: 0 | F1330: 0 | G1330: 0 | H1330: 0 | I1330: 0 | J1330: 0 | K1330: 25.41 | L1330: 0 | M1330: =SUM(J1330:L1330)-2.35 -> 23.059999999999999 | N1330: 2.3500000000000001 | O1330: =SUM(M1330:N1330) -> 25.41
A1331: 4470 | B1331: UFV SANTA LUZIA 8 | C1331: 40.586.796/0001-20 | D1331: 115.13 | E1331: 0 | F1331: 0 | G1331: 0 | H1331: 0 | I1331: 0 | J1331: 0 | K1331: 126.87 | L1331: 0 | M1331: =SUM(J1331:L1331)-11.74 -> 115.13000000000001 | N1331: 11.74 | O1331: =SUM(M1331:N1331) -> 126.87
A1332: 4471 | B1332: EOL SANTO AGOSTINHO 18 | C1332: 20.666.659/0002-70 | D1332: 77.930000000000007 | E1332: 0 | F1332: 0 | G1332: 0 | H1332: 0 | I1332: 0 | J1332: 0 | K1332: 85.870000000000005 | L1332: 0 | M1332: =SUM(J1332:L1332)-7.94 -> 77.930000000000007 | N1332: 7.9400000000000004 | O1332: =SUM(M1332:N1332) -> 85.870000000000005
A1333: 4472 | B1333: EOL SANTO AGOSTINHO 21 | C1333: 20.666.720/0002-89 | D1333: 77.930000000000007 | E1333: 0 | F1333: 0 | G1333: 0 | H1333: 0 | I1333: 0 | J1333: 0 | K1333: 85.870000000000005 | L1333: 0 | M1333: =SUM(J1333:L1333)-7.94 -> 77.930000000000007 | N1333: 7.9400000000000004 | O1333: =SUM(M1333:N1333) -> 85.870000000000005
A1334: 4473 | B1334: EOL MUNDO NOVO V | C1334: 41.760.884/0001-60 | D1334: 48.520000000000003 | E1334: 0 | F1334: 0 | G1334: 0 | H1334: 0 | I1334: 0 | J1334: 0 | K1334: 53.469999999999999 | L1334: 0 | M1334: =SUM(J1334:L1334)-4.95 -> 48.519999999999996 | N1334: 4.9500000000000002 | O1334: =SUM(M1334:N1334) -> 53.469999999999999
A1335: 4474 | B1335: EOL MUNDO NOVO VI | C1335: 41.725.168/0001-41 | D1335: 97.709999999999994 | E1335: 0 | F1335: 0 | G1335: 0 | H1335: 0 | I1335: 0 | J1335: 0 | K1335: 107.67 | L1335: 0 | M1335: =SUM(J1335:L1335)-9.96 -> 97.710000000000008 | N1335: 9.9600000000000009 | O1335: =SUM(M1335:N1335) -> 107.67000000000002
A1336: 4475 | B1336: EOL MUNDO NOVO VII | C1336: 41.760.915/0001-82 | D1336: 97.709999999999994 | E1336: 0 | F1336: 0 | G1336: 0 | H1336: 0 | I1336: 0 | J1336: 0 | K1336: 107.67 | L1336: 0 | M1336: =SUM(J1336:L1336)-9.96 -> 97.710000000000008 | N1336: 9.9600000000000009 | O1336: =SUM(M1336:N1336) -> 107.67000000000002
A1337: 4476 | B1337: EOL CAJUÍNA B9 | C1337: 36.957.862/0001-54 | D1337: 141.09999999999999 | E1337: 0 | F1337: 0 | G1337: 0 | H1337: 0 | I1337: 0 | J1337: 0 | K1337: 155.47999999999999 | L1337: 0 | M1337: =SUM(J1337:L1337)-14.38 -> 141.09999999999999 | N1337: 14.380000000000001 | O1337: =SUM(M1337:N1337) -> 155.47999999999999
A1338: 4477 | B1338: EOL AROEIRA 1 | C1338: 38.094.930/0001-24 | D1338: 116.73999999999999 | E1338: 0 | F1338: 0 | G1338: 0 | H1338: 0 | I1338: 0 | J1338: 0 | K1338: 128.63999999999999 | L1338: 0 | M1338: =SUM(J1338:L1338)-11.9 -> 116.73999999999998 | N1338: 11.9 | O1338: =SUM(M1338:N1338) -> 128.63999999999999
A1339: 4478 | B1339: EOL AROEIRA 2 | C1339: 38.130.244/0002-42 | D1339: 106.2 | E1339: 0 | F1339: 0 | G1339: 0 | H1339: 0 | I1339: 0 | J1339: 0 | K1339: 117.02 | L1339: 0 | M1339: =SUM(J1339:L1339)-10.82 -> 106.19999999999999 | N1339: 10.82 | O1339: =SUM(M1339:N1339) -> 117.01999999999998
A1340: 4479 | B1340: EOL AROEIRA 3 | C1340: 39.364.731/0001-51 | D1340: 106.2 | E1340: 0 | F1340: 0 | G1340: 0 | H1340: 0 | I1340: 0 | J1340: 0 | K1340: 117.02 | L1340: 0 | M1340: =SUM(J1340:L1340)-10.82 -> 106.19999999999999 | N1340: 10.82 | O1340: =SUM(M1340:N1340) -> 117.01999999999998
A1341: 4480 | B1341: EOL AROEIRA 4 | C1341: 39.334.976/0001-36 | D1341: 106.2 | E1341: 0 | F1341: 0 | G1341: 0 | H1341: 0 | I1341: 0 | J1341: 0 | K1341: 117.02 | L1341: 0 | M1341: =SUM(J1341:L1341)-10.82 -> 106.19999999999999 | N1341: 10.82 | O1341: =SUM(M1341:N1341) -> 117.01999999999998
A1342: 4481 | B1342: EOL AROEIRA 5 | C1342: 38.091.465/0001-78 | D1342: 106.2 | E1342: 0 | F1342: 0 | G1342: 0 | H1342: 0 | I1342: 0 | J1342: 0 | K1342: 117.02 | L1342: 0 | M1342: =SUM(J1342:L1342)-10.82 -> 106.19999999999999 | N1342: 10.82 | O1342: =SUM(M1342:N1342) -> 117.01999999999998
A1343: 4497 | B1343: EOL SANTO AGOSTINHO 01 | C1343: 20.675.133/0002-56 | D1343: 46.759999999999998 | E1343: 0 | F1343: 0 | G1343: 0 | H1343: 0 | I1343: 0 | J1343: 0 | K1343: 51.530000000000001 | L1343: 0 | M1343: =SUM(J1343:L1343)-4.77 -> 46.760000000000005 | N1343: 4.7699999999999996 | O1343: =SUM(M1343:N1343) -> 51.530000000000001
A1344: 4498 | B1344: EOL SANTO AGOSTINHO 02 | C1344: 20.675.144/0002-36 | D1344: 77.930000000000007 | E1344: 0 | F1344: 0 | G1344: 0 | H1344: 0 | I1344: 0 | J1344: 0 | K1344: 85.870000000000005 | L1344: 0 | M1344: =SUM(J1344:L1344)-7.94 -> 77.930000000000007 | N1344: 7.9400000000000004 | O1344: =SUM(M1344:N1344) -> 85.870000000000005
A1345: 4507 | B1345: EOL CAJUÍNA B12 | C1345: 37.002.801/0001-04 | D1345: 98.510000000000005 | E1345: 0 | F1345: 0 | G1345: 0 | H1345: 0 | I1345: 0 | J1345: 0 | K1345: 108.55 | L1345: 0 | M1345: =SUM(J1345:L1345)-10.04 -> 98.509999999999991 | N1345: 10.039999999999999 | O1345: =SUM(M1345:N1345) -> 108.54999999999998
A1346: 4508 | B1346: EOL VENTOS DE SANTA LUZIA 04 | C1346: 41.483.602/0002-05 | D1346: 97.019999999999996 | E1346: 0 | F1346: 0 | G1346: 0 | H1346: 0 | I1346: 0 | J1346: 0 | K1346: 106.91 | L1346: 0 | M1346: =SUM(J1346:L1346)-9.89 -> 97.019999999999996 | N1346: 9.8900000000000006 | O1346: =SUM(M1346:N1346) -> 106.91
A1347: 4509 | B1347: EOL AROEIRA 6 | C1347: 38.131.056/0002-39 | D1347: 95.400000000000006 | E1347: 0 | F1347: 0 | G1347: 0 | H1347: 0 | I1347: 0 | J1347: 0 | K1347: 105.12 | L1347: 0 | M1347: =SUM(J1347:L1347)-9.72 -> 95.400000000000006 | N1347: 9.7200000000000006 | O1347: =SUM(M1347:N1347) -> 105.12
A1348: 4535 | B1348: ASS CHAFARIZ 2 | C1348: 22.548.637/0002-30 | D1348: 2544.2600000000002 | E1348: 0 | F1348: 0 | G1348: 0 | H1348: 0 | I1348: 0 | J1348: 0 | K1348: 2803.5900000000001 | L1348: 0 | M1348: =SUM(J1348:L1348)-259.33 -> 2544.2600000000002 | N1348: 259.32999999999998 | O1348: =SUM(M1348:N1348) -> 2803.5900000000001
A1349: 4536 | B1349: EOL CAJUINA B11 | C1349: 37.020.274/0001-52 | D1349: 167.08000000000001 | E1349: 0 | F1349: 0 | G1349: 0 | H1349: 0 | I1349: 0 | J1349: 0 | K1349: 184.11000000000001 | L1349: 0 | M1349: =SUM(J1349:L1349)-17.03 -> 167.08000000000001 | N1349: 17.030000000000001 | O1349: =SUM(M1349:N1349) -> 184.11000000000001
A1350: 4537 | B1350: EOL CAJUINA B16 | C1350: 36.957.817/0001-08 | D1350: 42.219999999999999 | E1350: 0 | F1350: 0 | G1350: 0 | H1350: 0 | I1350: 0 | J1350: 0 | K1350: 46.520000000000003 | L1350: 0 | M1350: =SUM(J1350:L1350)-4.3 -> 42.220000000000006 | N1350: 4.2999999999999998 | O1350: =SUM(M1350:N1350) -> 46.520000000000003
A1351: 4538 | B1351: EOL CAJUINA B18 | C1351: 37.020.270/0001-74 | D1351: 56.289999999999999 | E1351: 0 | F1351: 0 | G1351: 0 | H1351: 0 | I1351: 0 | J1351: 0 | K1351: 62.030000000000001 | L1351: 0 | M1351: =SUM(J1351:L1351)-5.74 -> 56.289999999999999 | N1351: 5.7400000000000002 | O1351: =SUM(M1351:N1351) -> 62.030000000000001
A1352: 4539 | B1352: EOL CAJUINA C15 | C1352: 36.957.786/0001-87 | D1352: 120.91 | E1352: 0 | F1352: 0 | G1352: 0 | H1352: 0 | I1352: 0 | J1352: 0 | K1352: 133.22999999999999 | L1352: 0 | M1352: =SUM(J1352:L1352)-12.32 -> 120.91 | N1352: 12.32 | O1352: =SUM(M1352:N1352) -> 133.22999999999999
A1353: 4540 | B1353: EOL CAJUINA C16 | C1353: 36.951.989/0001-66 | D1353: 22.219999999999999 | E1353: 0 | F1353: 0 | G1353: 0 | H1353: 0 | I1353: 0 | J1353: 0 | K1353: 24.48 | L1353: 0 | M1353: =SUM(J1353:L1353)-2.26 -> 22.219999999999999 | N1353: 2.2599999999999998 | O1353: =SUM(M1353:N1353) -> 24.479999999999997
A1354: 4541 | B1354: EOL CAJUINA E6 | C1354: 36.952.001/0001-83 | D1354: 153.88999999999999 | E1354: 0 | F1354: 0 | G1354: 0 | H1354: 0 | I1354: 0 | J1354: 0 | K1354: 169.58000000000001 | L1354: 0 | M1354: =SUM(J1354:L1354)-15.69 -> 153.89000000000001 | N1354: 15.69 | O1354: =SUM(M1354:N1354) -> 169.58000000000001
A1355: 4558 | B1355: EOL SÃO RICARDO 01 | C1355: 37.053.489/0001-70 | D1355: 58.840000000000003 | E1355: 0 | F1355: 0 | G1355: 0 | H1355: 0 | I1355: 0 | J1355: 0 | K1355: 64.840000000000003 | L1355: 0 | M1355: =SUM(J1355:L1355)-6 -> 58.840000000000003 | N1355: 6 | O1355: =SUM(M1355:N1355) -> 64.840000000000003
A1356: 4559 | B1356: EOL SÃO RICARDO 02 | C1356: 37.002.800/0001-51 | D1356: 73.549999999999997 | E1356: 0 | F1356: 0 | G1356: 0 | H1356: 0 | I1356: 0 | J1356: 0 | K1356: 81.049999999999997 | L1356: 0 | M1356: =SUM(J1356:L1356)-7.5 -> 73.549999999999997 | N1356: 7.5 | O1356: =SUM(M1356:N1356) -> 81.049999999999997
A1357: 4560 | B1357: EOL CAJUÍNA B14 | C1357: 36.957.823/0001-57 | D1357: 127.91 | E1357: 0 | F1357: 0 | G1357: 0 | H1357: 0 | I1357: 0 | J1357: 0 | K1357: 140.94999999999999 | L1357: 0 | M1357: =SUM(J1357:L1357)-13.04 -> 127.91 | N1357: 13.039999999999999 | O1357: =SUM(M1357:N1357) -> 140.94999999999999
A1358: 4561 | B1358: EOL CAJUÍNA B15 | C1358: 37.002.822/0001-11 | D1358: 99.489999999999995 | E1358: 0 | F1358: 0 | G1358: 0 | H1358: 0 | I1358: 0 | J1358: 0 | K1358: 109.63 | L1358: 0 | M1358: =SUM(J1358:L1358)-10.14 -> 99.489999999999995 | N1358: 10.140000000000001 | O1358: =SUM(M1358:N1358) -> 109.63
A1359: 4567 | B1359: EOL CAJUÍNA B13 | C1359: 36.957.856/0001-05 | D1359: 113.7 | E1359: 0 | F1359: 0 | G1359: 0 | H1359: 0 | I1359: 0 | J1359: 0 | K1359: 125.29000000000001 | L1359: 0 | M1359: =SUM(J1359:L1359)-11.59 -> 113.7 | N1359: 11.59 | O1359: =SUM(M1359:N1359) -> 125.29000000000001
A1360: 4577 | B1360: EOL TUCANO V | C1360: 35.805.346/0001-41 | D1360: 51.729999999999997 | E1360: 0 | F1360: 0 | G1360: 0 | H1360: 0 | I1360: 0 | J1360: 0 | K1360: 57 | L1360: 0 | M1360: =SUM(J1360:L1360)-5.27 -> 51.730000000000004 | N1360: 5.2699999999999996 | O1360: =SUM(M1360:N1360) -> 57
A1361: 4578 | B1361: EOL TUCANO XIII | C1361: 35.805.346/0001-41 | D1361: 90.540000000000006 | E1361: 0 | F1361: 0 | G1361: 0 | H1361: 0 | I1361: 0 | J1361: 0 | K1361: 99.769999999999996 | L1361: 0 | M1361: =SUM(J1361:L1361)-9.23 -> 90.539999999999992 | N1361: 9.2300000000000004 | O1361: =SUM(M1361:N1361) -> 99.769999999999996
A1362: 4579 | B1362: EOL TUCANO XVII | C1362: 35.805.346/0001-41 | D1362: 38.799999999999997 | E1362: 0 | F1362: 0 | G1362: 0 | H1362: 0 | I1362: 0 | J1362: 0 | K1362: 42.75 | L1362: 0 | M1362: =SUM(J1362:L1362)-3.95 -> 38.799999999999997 | N1362: 3.9500000000000002 | O1362: =SUM(M1362:N1362) -> 42.75
A1363: 4585 | B1363: EOL KAIRÓS WIND 2 | C1363: 42.422.214/0001-04 | D1363: 86.359999999999999 | E1363: 0 | F1363: 0 | G1363: 0 | H1363: 0 | I1363: 0 | J1363: 0 | K1363: 95.159999999999997 | L1363: 0 | M1363: =SUM(J1363:L1363)-8.8 -> 86.359999999999999 | N1363: 8.8000000000000007 | O1363: =SUM(M1363:N1363) -> 95.159999999999997
A1364: 4586 | B1364: UFV HELIO VALGAS 2 | C1364: 32.431.507/0001-96 | D1364: 129.91 | E1364: 0 | F1364: 0 | G1364: 0 | H1364: 0 | I1364: 0 | J1364: 0 | K1364: 143.15000000000001 | L1364: 0 | M1364: =SUM(J1364:L1364)-13.24 -> 129.91 | N1364: 13.24 | O1364: =SUM(M1364:N1364) -> 143.15000000000001
A1365: 4587 | B1365: UFV HELIO VALGAS 3 | C1365: 32.431.516/0001-87 | D1365: 129.91 | E1365: 0 | F1365: 0 | G1365: 0 | H1365: 0 | I1365: 0 | J1365: 0 | K1365: 143.15000000000001 | L1365: 0 | M1365: =SUM(J1365:L1365)-13.24 -> 129.91 | N1365: 13.24 | O1365: =SUM(M1365:N1365) -> 143.15000000000001
A1366: 4588 | B1366: UFV HELIO VALGAS 4 | C1366: 32.431.516/0001-87 | D1366: 129.91 | E1366: 0 | F1366: 0 | G1366: 0 | H1366: 0 | I1366: 0 | J1366: 0 | K1366: 143.15000000000001 | L1366: 0 | M1366: =SUM(J1366:L1366)-13.24 -> 129.91 | N1366: 13.24 | O1366: =SUM(M1366:N1366) -> 143.15000000000001
A1367: 4589 | B1367: UFV HELIO VALGAS 5 | C1367: 32.431.510/0001-00 | D1367: 129.91 | E1367: 0 | F1367: 0 | G1367: 0 | H1367: 0 | I1367: 0 | J1367: 0 | K1367: 143.15000000000001 | L1367: 0 | M1367: =SUM(J1367:L1367)-13.24 -> 129.91 | N1367: 13.24 | O1367: =SUM(M1367:N1367) -> 143.15000000000001
A1368: 4590 | B1368: UFV HELIO VALGAS 6 | C1368: 32.431.510/0001-00 | D1368: 129.91 | E1368: 0 | F1368: 0 | G1368: 0 | H1368: 0 | I1368: 0 | J1368: 0 | K1368: 143.15000000000001 | L1368: 0 | M1368: =SUM(J1368:L1368)-13.24 -> 129.91 | N1368: 13.24 | O1368: =SUM(M1368:N1368) -> 143.15000000000001
A1369: 4591 | B1369: EOL AROEIRA 7 | C1369: 38.090.834/0002-99 | D1369: 116.73999999999999 | E1369: 0 | F1369: 0 | G1369: 0 | H1369: 0 | I1369: 0 | J1369: 0 | K1369: 128.63999999999999 | L1369: 0 | M1369: =SUM(J1369:L1369)-11.9 -> 116.73999999999998 | N1369: 11.9 | O1369: =SUM(M1369:N1369) -> 128.63999999999999
A1370: 4592 | B1370: UFV HELIO VALGAS 7 | C1370: 40.224.338/0001-41 | D1370: 129.91 | E1370: 0 | F1370: 0 | G1370: 0 | H1370: 0 | I1370: 0 | J1370: 0 | K1370: 143.15000000000001 | L1370: 0 | M1370: =SUM(J1370:L1370)-13.24 -> 129.91 | N1370: 13.24 | O1370: =SUM(M1370:N1370) -> 143.15000000000001
A1371: 4593 | B1371: UFV HELIO VALGAS 8 | C1371: 40.224.338/0001-41 | D1371: 162.55000000000001 | E1371: 0 | F1371: 0 | G1371: 0 | H1371: 0 | I1371: 0 | J1371: 0 | K1371: 179.12 | L1371: 0 | M1371: =SUM(J1371:L1371)-16.57 -> 162.55000000000001 | N1371: 16.57 | O1371: =SUM(M1371:N1371) -> 179.12
A1372: 4594 | B1372: UFV HELIO VALGAS 9 | C1372: 40.114.336/0001-08 | D1372: 130.02000000000001 | E1372: 0 | F1372: 0 | G1372: 0 | H1372: 0 | I1372: 0 | J1372: 0 | K1372: 143.27000000000001 | L1372: 0 | M1372: =SUM(J1372:L1372)-13.25 -> 130.02000000000001 | N1372: 13.25 | O1372: =SUM(M1372:N1372) -> 143.27000000000001
A1373: 4595 | B1373: UFV HELIO VALGAS 10 | C1373: 40.114.336/0001-08 | D1373: 130.69 | E1373: 0 | F1373: 0 | G1373: 0 | H1373: 0 | I1373: 0 | J1373: 0 | K1373: 144.00999999999999 | L1373: 0 | M1373: =SUM(J1373:L1373)-13.32 -> 130.69 | N1373: 13.32 | O1373: =SUM(M1373:N1373) -> 144.00999999999999
A1374: 4606 | B1374: EOL KAIROS WIND 6 | C1374: 44.031.923/0001-86 | D1374: 97.159999999999997 | E1374: 0 | F1374: 0 | G1374: 0 | H1374: 0 | I1374: 0 | J1374: 0 | K1374: 107.06 | L1374: 0 | M1374: =SUM(J1374:L1374)-9.9 -> 97.159999999999997 | N1374: 9.9000000000000004 | O1374: =SUM(M1374:N1374) -> 107.06
A1375: 4607 | B1375: UFV HELIO VALGAS 1 | C1375: 32.431.507/0001-96 | D1375: 129.91 | E1375: 0 | F1375: 0 | G1375: 0 | H1375: 0 | I1375: 0 | J1375: 0 | K1375: 143.15000000000001 | L1375: 0 | M1375: =SUM(J1375:L1375)-13.24 -> 129.91 | N1375: 13.24 | O1375: =SUM(M1375:N1375) -> 143.15000000000001
A1376: 4608 | B1376: EOL PEDRA PINTADA I | C1376: 42.046.559/0002-83 | D1376: 130.71000000000001 | E1376: 0 | F1376: 0 | G1376: 0 | H1376: 0 | I1376: 0 | J1376: 0 | K1376: 144.03 | L1376: 0 | M1376: =SUM(J1376:L1376)-13.32 -> 130.71000000000001 | N1376: 13.32 | O1376: =SUM(M1376:N1376) -> 144.03
A1377: 4609 | B1377: EOL PEDRA PINTADA II | C1377: 42.261.997/0002-64 | D1377: 131.22999999999999 | E1377: 0 | F1377: 0 | G1377: 0 | H1377: 0 | I1377: 0 | J1377: 0 | K1377: 144.61000000000001 | L1377: 0 | M1377: =SUM(J1377:L1377)-13.38 -> 131.23000000000002 | N1377: 13.380000000000001 | O1377: =SUM(M1377:N1377) -> 144.61000000000001
A1378: 4610 | B1378: EOL PEDRA PINTADA III | C1378: 41.982.031/0002-53 | D1378: 115.93000000000001 | E1378: 0 | F1378: 0 | G1378: 0 | H1378: 0 | I1378: 0 | J1378: 0 | K1378: 127.75 | L1378: 0 | M1378: =SUM(J1378:L1378)-11.82 -> 115.93000000000001 | N1378: 11.82 | O1378: =SUM(M1378:N1378) -> 127.75
A1379: 4611 | B1379: EOL PEDRA PINTADA IV | C1379: 41.983.083/0003-25 | D1379: 130.19 | E1379: 0 | F1379: 0 | G1379: 0 | H1379: 0 | I1379: 0 | J1379: 0 | K1379: 143.46000000000001 | L1379: 0 | M1379: =SUM(J1379:L1379)-13.27 -> 130.19 | N1379: 13.27 | O1379: =SUM(M1379:N1379) -> 143.46000000000001
A1380: 4612 | B1380: UFV HORIZONTE MP 2 | C1380: 23.399.589/0001-48 | D1380: 55.57 | E1380: 0 | F1380: 0 | G1380: 0 | H1380: 0 | I1380: 0 | J1380: 0 | K1380: 61.229999999999997 | L1380: 0 | M1380: =SUM(J1380:L1380)-5.66 -> 55.569999999999993 | N1380: 5.6600000000000001 | O1380: =SUM(M1380:N1380) -> 61.22999999999999
A1381: 4613 | B1381: UFV HORIZONTE MP 11 | C1381: 23.399.589/0001-48 | D1381: 42.850000000000001 | E1381: 0 | F1381: 0 | G1381: 0 | H1381: 0 | I1381: 0 | J1381: 0 | K1381: 47.219999999999999 | L1381: 0 | M1381: =SUM(J1381:L1381)-4.37 -> 42.850000000000001 | N1381: 4.3700000000000001 | O1381: =SUM(M1381:N1381) -> 47.219999999999999
A1382: 4614 | B1382: UFV RIBEIRO GONÇALVES VI | C1382: 31.711.512/0001-90 | D1382: 85.390000000000001 | E1382: 0 | F1382: 0 | G1382: 0 | H1382: 0 | I1382: 0 | J1382: 0 | K1382: 94.090000000000003 | L1382: 0 | M1382: =SUM(J1382:L1382)-8.7 -> 85.390000000000001 | N1382: 8.6999999999999993 | O1382: =SUM(M1382:N1382) -> 94.090000000000003
A1383: 4615 | B1383: UFV RIBEIRO GONÇALVES VII | C1383: 31.711.512/0001-90 | D1383: 76.849999999999994 | E1383: 0 | F1383: 0 | G1383: 0 | H1383: 0 | I1383: 0 | J1383: 0 | K1383: 84.680000000000007 | L1383: 0 | M1383: =SUM(J1383:L1383)-7.83 -> 76.850000000000009 | N1383: 7.8300000000000001 | O1383: =SUM(M1383:N1383) -> 84.680000000000007
A1384: 4616 | B1384: UFV RIBEIRO GONÇALVES VIII | C1384: 31.711.512/0001-90 | D1384: 76.849999999999994 | E1384: 0 | F1384: 0 | G1384: 0 | H1384: 0 | I1384: 0 | J1384: 0 | K1384: 84.680000000000007 | L1384: 0 | M1384: =SUM(J1384:L1384)-7.83 -> 76.850000000000009 | N1384: 7.8300000000000001 | O1384: =SUM(M1384:N1384) -> 84.680000000000007
A1385: 4617 | B1385: EOL AROEIRA 8 | C1385: 39.336.768/0001-76 | D1385: 106.2 | E1385: 0 | F1385: 0 | G1385: 0 | H1385: 0 | I1385: 0 | J1385: 0 | K1385: 117.02 | L1385: 0 | M1385: =SUM(J1385:L1385)-10.82 -> 106.19999999999999 | N1385: 10.82 | O1385: =SUM(M1385:N1385) -> 117.01999999999998
A1386: 4618 | B1386: UFV MENDUBIM I | C1386: 45.991.644/0001-27 | D1386: 93.019999999999996 | E1386: 0 | F1386: 0 | G1386: 0 | H1386: 0 | I1386: 0 | J1386: 0 | K1386: 102.5 | L1386: 0 | M1386: =SUM(J1386:L1386)-9.48 -> 93.019999999999996 | N1386: 9.4800000000000004 | O1386: =SUM(M1386:N1386) -> 102.5
A1387: 4619 | B1387: UFV MENDUBIM II | C1387: 45.991.741/0001-10 | D1387: 81.390000000000001 | E1387: 0 | F1387: 0 | G1387: 0 | H1387: 0 | I1387: 0 | J1387: 0 | K1387: 89.689999999999998 | L1387: 0 | M1387: =SUM(J1387:L1387)-8.3 -> 81.390000000000001 | N1387: 8.3000000000000007 | O1387: =SUM(M1387:N1387) -> 89.689999999999998
A1388: 4620 | B1388: UFV MENDUBIM III | C1388: 45.991.823/0001-64 | D1388: 93.019999999999996 | E1388: 0 | F1388: 0 | G1388: 0 | H1388: 0 | I1388: 0 | J1388: 0 | K1388: 102.5 | L1388: 0 | M1388: =SUM(J1388:L1388)-9.48 -> 93.019999999999996 | N1388: 9.4800000000000004 | O1388: =SUM(M1388:N1388) -> 102.5
A1389: 4621 | B1389: UFV MENDUBIM IV | C1389: 45.991.863/0001-06 | D1389: 93.019999999999996 | E1389: 0 | F1389: 0 | G1389: 0 | H1389: 0 | I1389: 0 | J1389: 0 | K1389: 102.5 | L1389: 0 | M1389: =SUM(J1389:L1389)-9.48 -> 93.019999999999996 | N1389: 9.4800000000000004 | O1389: =SUM(M1389:N1389) -> 102.5
A1390: 4622 | B1390: UFV MENDUBIM V | C1390: 45.991.921/0001-00 | D1390: 81.390000000000001 | E1390: 0 | F1390: 0 | G1390: 0 | H1390: 0 | I1390: 0 | J1390: 0 | K1390: 89.689999999999998 | L1390: 0 | M1390: =SUM(J1390:L1390)-8.3 -> 81.390000000000001 | N1390: 8.3000000000000007 | O1390: =SUM(M1390:N1390) -> 89.689999999999998
A1391: 4623 | B1391: UFV MENDUBIM VI | C1391: 45.991.972/0001-23 | D1391: 81.390000000000001 | E1391: 0 | F1391: 0 | G1391: 0 | H1391: 0 | I1391: 0 | J1391: 0 | K1391: 89.689999999999998 | L1391: 0 | M1391: =SUM(J1391:L1391)-8.3 -> 81.390000000000001 | N1391: 8.3000000000000007 | O1391: =SUM(M1391:N1391) -> 89.689999999999998
A1392: 4624 | B1392: UFV MENDUBIM VII | C1392: 45.992.035/0001-92 | D1392: 81.390000000000001 | E1392: 0 | F1392: 0 | G1392: 0 | H1392: 0 | I1392: 0 | J1392: 0 | K1392: 89.689999999999998 | L1392: 0 | M1392: =SUM(J1392:L1392)-8.3 -> 81.390000000000001 | N1392: 8.3000000000000007 | O1392: =SUM(M1392:N1392) -> 89.689999999999998
A1393: 4625 | B1393: UFV MENDUBIM VIII | C1393: 45.992.085/0001-70 | D1393: 81.390000000000001 | E1393: 0 | F1393: 0 | G1393: 0 | H1393: 0 | I1393: 0 | J1393: 0 | K1393: 89.689999999999998 | L1393: 0 | M1393: =SUM(J1393:L1393)-8.3 -> 81.390000000000001 | N1393: 8.3000000000000007 | O1393: =SUM(M1393:N1393) -> 89.689999999999998
A1394: 4626 | B1394: UFV MENDUBIM IX | C1394: 45.992.149/0001-32 | D1394: 93.019999999999996 | E1394: 0 | F1394: 0 | G1394: 0 | H1394: 0 | I1394: 0 | J1394: 0 | K1394: 102.5 | L1394: 0 | M1394: =SUM(J1394:L1394)-9.48 -> 93.019999999999996 | N1394: 9.4800000000000004 | O1394: =SUM(M1394:N1394) -> 102.5
A1395: 4627 | B1395: UFV MENDUBIM X | C1395: 45.992.184/0001-51 | D1395: 58.130000000000003 | E1395: 0 | F1395: 0 | G1395: 0 | H1395: 0 | I1395: 0 | J1395: 0 | K1395: 64.060000000000002 | L1395: 0 | M1395: =SUM(J1395:L1395)-5.93 -> 58.130000000000003 | N1395: 5.9299999999999997 | O1395: =SUM(M1395:N1395) -> 64.060000000000002
A1396: 4628 | B1396: UFV MENDUBIM XI | C1396: 45.992.228/0001-43 | D1396: 139.52000000000001 | E1396: 0 | F1396: 0 | G1396: 0 | H1396: 0 | I1396: 0 | J1396: 0 | K1396: 153.74000000000001 | L1396: 0 | M1396: =SUM(J1396:L1396)-14.22 -> 139.52000000000001 | N1396: 14.220000000000001 | O1396: =SUM(M1396:N1396) -> 153.74000000000001
A1397: 4629 | B1397: EOL VENTOS DE SANTO ANTÔNIO 01 | C1397: 42.495.343/0002-03 | D1397: 113.13 | E1397: 0 | F1397: 0 | G1397: 0 | H1397: 0 | I1397: 0 | J1397: 0 | K1397: 124.66 | L1397: 0 | M1397: =SUM(J1397:L1397)-11.53 -> 113.13 | N1397: 11.529999999999999 | O1397: =SUM(M1397:N1397) -> 124.66
A1398: 4630 | B1398: UFV MENDUBIM XII | C1398: 45.992.261/0001-73 | D1398: 69.760000000000005 | E1398: 0 | F1398: 0 | G1398: 0 | H1398: 0 | I1398: 0 | J1398: 0 | K1398: 76.870000000000005 | L1398: 0 | M1398: =SUM(J1398:L1398)-7.11 -> 69.760000000000005 | N1398: 7.1100000000000003 | O1398: =SUM(M1398:N1398) -> 76.870000000000005
A1399: 4631 | B1399: UFV MENDUBIM XIII | C1399: 45.992.304/0001-10 | D1399: 93.019999999999996 | E1399: 0 | F1399: 0 | G1399: 0 | H1399: 0 | I1399: 0 | J1399: 0 | K1399: 102.5 | L1399: 0 | M1399: =SUM(J1399:L1399)-9.48 -> 93.019999999999996 | N1399: 9.4800000000000004 | O1399: =SUM(M1399:N1399) -> 102.5
A1400: 4632 | B1400: EOL MORRO 2 | C1400: 42.625.774/0002-39 | D1400: 91.299999999999997 | E1400: 0 | F1400: 0 | G1400: 0 | H1400: 0 | I1400: 0 | J1400: 0 | K1400: 100.61 | L1400: 0 | M1400: =SUM(J1400:L1400)-9.31 -> 91.299999999999997 | N1400: 9.3100000000000005 | O1400: =SUM(M1400:N1400) -> 100.61
A1401: 4633 | B1401: EOL OESTE SERIDÓ VI | C1401: 25.216.818/0001-77 | D1401: 41.609999999999999 | E1401: 0 | F1401: 0 | G1401: 0 | H1401: 0 | I1401: 0 | J1401: 0 | K1401: 45.850000000000001 | L1401: 0 | M1401: =SUM(J1401:L1401)-4.24 -> 41.609999999999999 | N1401: 4.2400000000000002 | O1401: =SUM(M1401:N1401) -> 45.850000000000001
A1402: 4634 | B1402: EOL OESTE SERIDÓ X | C1402: 36.641.948/0001-73 | D1402: 62.420000000000002 | E1402: 0 | F1402: 0 | G1402: 0 | H1402: 0 | I1402: 0 | J1402: 0 | K1402: 68.780000000000001 | L1402: 0 | M1402: =SUM(J1402:L1402)-6.36 -> 62.420000000000002 | N1402: 6.3600000000000003 | O1402: =SUM(M1402:N1402) -> 68.780000000000001
A1403: 4635 | B1403: EOL OESTE SERIDÓ XII | C1403: 36.641.357/0001-04 | D1403: 72.819999999999993 | E1403: 0 | F1403: 0 | G1403: 0 | H1403: 0 | I1403: 0 | J1403: 0 | K1403: 80.239999999999995 | L1403: 0 | M1403: =SUM(J1403:L1403)-7.42 -> 72.819999999999993 | N1403: 7.4199999999999999 | O1403: =SUM(M1403:N1403) -> 80.239999999999995
A1404: 4636 | B1404: EOL SERRA DAS VACAS A | C1404: 28.029.264/0001-97 | D1404: 93.420000000000002 | E1404: 0 | F1404: 0 | G1404: 0 | H1404: 0 | I1404: 0 | J1404: 0 | K1404: 102.94 | L1404: 0 | M1404: =SUM(J1404:L1404)-9.52 -> 93.420000000000002 | N1404: 9.5199999999999996 | O1404: =SUM(M1404:N1404) -> 102.94
A1405: 4637 | B1405: EOL SERRA DAS VACAS B | C1405: 28.228.040/0001-04 | D1405: 82.819999999999993 | E1405: 0 | F1405: 0 | G1405: 0 | H1405: 0 | I1405: 0 | J1405: 0 | K1405: 91.260000000000005 | L1405: 0 | M1405: =SUM(J1405:L1405)-8.44 -> 82.820000000000007 | N1405: 8.4399999999999995 | O1405: =SUM(M1405:N1405) -> 91.260000000000005
A1406: 4638 | B1406: UFV SERRA DO MEL VII | C1406: 46.545.021/0001-93 | D1406: 117.95 | E1406: 0 | F1406: 0 | G1406: 0 | H1406: 0 | I1406: 0 | J1406: 0 | K1406: 129.97 | L1406: 0 | M1406: =SUM(J1406:L1406)-12.02 -> 117.95 | N1406: 12.02 | O1406: =SUM(M1406:N1406) -> 129.97
A1407: 4639 | B1407: UFV MARANGATU 1 | C1407: 41.977.332/0001-08 | D1407: 68.920000000000002 | E1407: 0 | F1407: 0 | G1407: 0 | H1407: 0 | I1407: 0 | J1407: 0 | K1407: 75.939999999999998 | L1407: 0 | M1407: =SUM(J1407:L1407)-7.02 -> 68.920000000000002 | N1407: 7.0199999999999996 | O1407: =SUM(M1407:N1407) -> 75.939999999999998
A1408: 4640 | B1408: UFV MARANGATU 2 | C1408: 42.066.785/0001-45 | D1408: 69.079999999999998 | E1408: 0 | F1408: 0 | G1408: 0 | H1408: 0 | I1408: 0 | J1408: 0 | K1408: 76.120000000000005 | L1408: 0 | M1408: =SUM(J1408:L1408)-7.04 -> 69.079999999999998 | N1408: 7.04 | O1408: =SUM(M1408:N1408) -> 76.120000000000005
A1409: 4641 | B1409: UFV MARANGATU 3 | C1409: 42.066.812/0001-80 | D1409: 69.260000000000005 | E1409: 0 | F1409: 0 | G1409: 0 | H1409: 0 | I1409: 0 | J1409: 0 | K1409: 76.319999999999993 | L1409: 0 | M1409: =SUM(J1409:L1409)-7.06 -> 69.259999999999991 | N1409: 7.0599999999999996 | O1409: =SUM(M1409:N1409) -> 76.319999999999993
A1410: 4642 | B1410: UFV MARANGATU 4 | C1410: 42.066.826/0001-01 | D1410: 69.030000000000001 | E1410: 0 | F1410: 0 | G1410: 0 | H1410: 0 | I1410: 0 | J1410: 0 | K1410: 76.069999999999993 | L1410: 0 | M1410: =SUM(J1410:L1410)-7.04 -> 69.029999999999987 | N1410: 7.04 | O1410: =SUM(M1410:N1410) -> 76.069999999999993
A1411: 4643 | B1411: UFV MARANGATU 5 | C1411: 42.066.841/0001-41 | D1411: 69.159999999999997 | E1411: 0 | F1411: 0 | G1411: 0 | H1411: 0 | I1411: 0 | J1411: 0 | K1411: 76.209999999999994 | L1411: 0 | M1411: =SUM(J1411:L1411)-7.05 -> 69.159999999999997 | N1411: 7.0499999999999998 | O1411: =SUM(M1411:N1411) -> 76.209999999999994
A1412: 4644 | B1412: UFV MARANGATU 6 | C1412: 42.066.887/0001-60 | D1412: 69.310000000000002 | E1412: 0 | F1412: 0 | G1412: 0 | H1412: 0 | I1412: 0 | J1412: 0 | K1412: 76.370000000000005 | L1412: 0 | M1412: =SUM(J1412:L1412)-7.06 -> 69.310000000000002 | N1412: 7.0599999999999996 | O1412: =SUM(M1412:N1412) -> 76.370000000000005
A1413: 4645 | B1413: UFV MARANGATU 7 | C1413: 42.066.900/0001-81 | D1413: 69.129999999999995 | E1413: 0 | F1413: 0 | G1413: 0 | H1413: 0 | I1413: 0 | J1413: 0 | K1413: 76.180000000000007 | L1413: 0 | M1413: =SUM(J1413:L1413)-7.05 -> 69.13000000000001 | N1413: 7.0499999999999998 | O1413: =SUM(M1413:N1413) -> 76.180000000000007
A1414: 4646 | B1414: UFV MARANGATU 8 | C1414: 42.066.920/0001-52 | D1414: 69.170000000000002 | E1414: 0 | F1414: 0 | G1414: 0 | H1414: 0 | I1414: 0 | J1414: 0 | K1414: 76.219999999999999 | L1414: 0 | M1414: =SUM(J1414:L1414)-7.05 -> 69.170000000000002 | N1414: 7.0499999999999998 | O1414: =SUM(M1414:N1414) -> 76.219999999999999
A1415: 4647 | B1415: UFV MARANGATU 9 | C1415: 42.066.942/0001-12 | D1415: 69.340000000000003 | E1415: 0 | F1415: 0 | G1415: 0 | H1415: 0 | I1415: 0 | J1415: 0 | K1415: 76.409999999999997 | L1415: 0 | M1415: =SUM(J1415:L1415)-7.07 -> 69.340000000000003 | N1415: 7.0700000000000003 | O1415: =SUM(M1415:N1415) -> 76.409999999999997
A1416: 4648 | B1416: UFV MARANGATU 10 | C1416: 42.066.958/0001-25 | D1416: 69.390000000000001 | E1416: 0 | F1416: 0 | G1416: 0 | H1416: 0 | I1416: 0 | J1416: 0 | K1416: 76.459999999999994 | L1416: 0 | M1416: =SUM(J1416:L1416)-7.07 -> 69.389999999999986 | N1416: 7.0700000000000003 | O1416: =SUM(M1416:N1416) -> 76.45999999999998
A1417: 4649 | B1417: UFV MARANGATU 11 | C1417: 42.066.972/0001-29 | D1417: 69.180000000000007 | E1417: 0 | F1417: 0 | G1417: 0 | H1417: 0 | I1417: 0 | J1417: 0 | K1417: 76.230000000000004 | L1417: 0 | M1417: =SUM(J1417:L1417)-7.05 -> 69.180000000000007 | N1417: 7.0499999999999998 | O1417: =SUM(M1417:N1417) -> 76.230000000000004
A1418: 4650 | B1418: UFV MARANGATU 12 | C1418: 42.066.994/0001-99 | D1418: 69.200000000000003 | E1418: 0 | F1418: 0 | G1418: 0 | H1418: 0 | I1418: 0 | J1418: 0 | K1418: 76.25 | L1418: 0 | M1418: =SUM(J1418:L1418)-7.05 -> 69.200000000000003 | N1418: 7.0499999999999998 | O1418: =SUM(M1418:N1418) -> 76.25
A1419: 4651 | B1419: UFV JAÍBA CN | C1419: 37.995.403/0001-28 | D1419: 73.599999999999994 | E1419: 0 | F1419: 0 | G1419: 0 | H1419: 0 | I1419: 0 | J1419: 0 | K1419: 81.099999999999994 | L1419: 0 | M1419: =SUM(J1419:L1419)-7.5 -> 73.599999999999994 | N1419: 7.5 | O1419: =SUM(M1419:N1419) -> 81.099999999999994
A1420: 4652 | B1420: EOL VENTOS DE SANTA LUZIA 11 | C1420: 42.538.271/0002-26 | D1420: 124.44 | E1420: 0 | F1420: 0 | G1420: 0 | H1420: 0 | I1420: 0 | J1420: 0 | K1420: 137.12 | L1420: 0 | M1420: =SUM(J1420:L1420)-12.68 -> 124.44 | N1420: 12.68 | O1420: =SUM(M1420:N1420) -> 137.12
A1421: 4653 | B1421: EOL VENTOS DE SANTA LUZIA 12 | C1421: 42.495.350/0003-88 | D1421: 135.75 | E1421: 0 | F1421: 0 | G1421: 0 | H1421: 0 | I1421: 0 | J1421: 0 | K1421: 149.59 | L1421: 0 | M1421: =SUM(J1421:L1421)-13.84 -> 135.75 | N1421: 13.84 | O1421: =SUM(M1421:N1421) -> 149.59
A1422: 4654 | B1422: EOL VENTOS DE SANTA LUZIA 13 | C1422: 42.455.678/0002-90 | D1422: 135.75 | E1422: 0 | F1422: 0 | G1422: 0 | H1422: 0 | I1422: 0 | J1422: 0 | K1422: 149.59 | L1422: 0 | M1422: =SUM(J1422:L1422)-13.84 -> 135.75 | N1422: 13.84 | O1422: =SUM(M1422:N1422) -> 149.59
A1423: 5002 | B1423: ALCOA-P | C1423: 23.637.697/0001-01 | D1423: 312.67000000000002 | E1423: 0 | F1423: 0 | G1423: 0 | H1423: 0 | I1423: 0 | J1423: 0 | K1423: 344.54000000000002 | L1423: 0 | M1423: =SUM(J1423:L1423)-31.87 -> 312.67000000000002 | N1423: 31.870000000000001 | O1423: =SUM(M1423:N1423) -> 344.54000000000002
A1424: 5006 | B1424: CBA(CABREÚVA)-P | C1424: 61.409.892/0003-35 | D1424: 4479.7600000000002 | E1424: 0 | F1424: 0 | G1424: 0 | H1424: 0 | I1424: 0 | J1424: 0 | K1424: 4936.3699999999999 | L1424: 0 | M1424: =SUM(J1424:L1424)-456.61 -> 4479.7600000000002 | N1424: 456.61000000000001 | O1424: =SUM(M1424:N1424) -> 4936.3699999999999
A1425: 5007 | B1425: CSN ARAUCARIA | C1425: 33.042.730/0134-35 | D1425: 137.66 | E1425: 0 | F1425: 0 | G1425: 0 | H1425: 0 | I1425: 0 | J1425: 0 | K1425: 151.69 | L1425: 0 | M1425: =SUM(J1425:L1425)-14.03 -> 137.66 | N1425: 14.029999999999999 | O1425: =SUM(M1425:N1425) -> 151.69
A1426: 5008 | B1426: VALE(ITABIRA)-P | C1426: 33.592.510/0164-09 | D1426: 771.29999999999995 | E1426: 0 | F1426: 0 | G1426: 0 | H1426: 0 | I1426: 0 | J1426: 0 | K1426: 849.91999999999996 | L1426: 0 | M1426: =SUM(J1426:L1426)-78.62 -> 771.29999999999995 | N1426: 78.620000000000005 | O1426: =SUM(M1426:N1426) -> 849.91999999999996
A1427: 5011 | B1427: FIBRAPLAC-P | C1427: 04.176.791/0002-47 | D1427: 200.75 | E1427: 0 | F1427: 0 | G1427: 0 | H1427: 0 | I1427: 0 | J1427: 0 | K1427: 221.21000000000001 | L1427: 0 | M1427: =SUM(J1427:L1427)-20.46 -> 200.75 | N1427: 20.460000000000001 | O1427: =SUM(M1427:N1427) -> 221.21000000000001
A1428: 5017 | B1428: INNOVA-P | C1428: 04.229.761/0011-42 | D1428: 28.690000000000001 | E1428: 0 | F1428: 0 | G1428: 0 | H1428: 0 | I1428: 0 | J1428: 0 | K1428: 31.609999999999999 | L1428: 0 | M1428: =SUM(J1428:L1428)-2.92 -> 28.689999999999998 | N1428: 2.9199999999999999 | O1428: =SUM(M1428:N1428) -> 31.609999999999999
A1429: 5019 | B1429: ANGLO AMERICAN(NIQUELÂNDIA)-P | C1429: 42.184.226/0017-05 | D1429: 273 | E1429: 0 | F1429: 0 | G1429: 0 | H1429: 0 | I1429: 0 | J1429: 0 | K1429: 300.82999999999998 | L1429: 0 | M1429: =SUM(J1429:L1429)-27.83 -> 273 | N1429: 27.829999999999998 | O1429: =SUM(M1429:N1429) -> 300.82999999999998
A1430: 5022 | B1430: ALUMAR(REFINARIA)-P | C1430: 00.655.209/0001-93 | D1430: 525.07000000000005 | E1430: 0 | F1430: 0 | G1430: 0 | H1430: 0 | I1430: 0 | J1430: 0 | K1430: 578.59000000000003 | L1430: 0 | M1430: =SUM(J1430:L1430)-53.52 -> 525.07000000000005 | N1430: 53.520000000000003 | O1430: =SUM(M1430:N1430) -> 578.59000000000003
A1431: 5023 | B1431: ALUMAR(REDUÇÃO)-P | C1431: 00.655.209/0001-93 | D1431: 3748.7399999999998 | E1431: 0 | F1431: 0 | G1431: 0 | H1431: 0 | I1431: 0 | J1431: 0 | K1431: 4130.8400000000001 | L1431: 0 | M1431: =SUM(J1431:L1431)-382.1 -> 3748.7400000000002 | N1431: 382.10000000000002 | O1431: =SUM(M1431:N1431) -> 4130.8400000000001
A1432: 5024 | B1432: OXITENO-P | C1432: 62.545.686/0018-00 | D1432: 37.219999999999999 | E1432: 0 | F1432: 0 | G1432: 0 | H1432: 0 | I1432: 0 | J1432: 0 | K1432: 41.009999999999998 | L1432: 0 | M1432: =SUM(J1432:L1432)-3.79 -> 37.219999999999999 | N1432: 3.79 | O1432: =SUM(M1432:N1432) -> 41.009999999999998
A1433: 5025 | B1433: ARLANXEO (DSM)-P | C1433: 29.667.227/0012-20 | D1433: 68.640000000000001 | E1433: 0 | F1433: 0 | G1433: 0 | H1433: 0 | I1433: 0 | J1433: 0 | K1433: 75.640000000000001 | L1433: 0 | M1433: =SUM(J1433:L1433)-7 -> 68.640000000000001 | N1433: 7 | O1433: =SUM(M1433:N1433) -> 75.640000000000001
A1434: 5026 | B1434: ALBRAS-P | C1434: 05.053.020/0003-06 | D1434: 6244.2399999999998 | E1434: 0 | F1434: 0 | G1434: 0 | H1434: 0 | I1434: 0 | J1434: 0 | K1434: 6880.71 | L1434: 0 | M1434: =SUM(J1434:L1434)-636.47 -> 6244.2399999999998 | N1434: 636.47000000000003 | O1434: =SUM(M1434:N1434) -> 6880.71
A1435: 5028 | B1435: NOVA ERA SILICON-P | C1435: 19.795.665/0001-67 | D1435: 267.00999999999999 | E1435: 0 | F1435: 0 | G1435: 0 | H1435: 0 | I1435: 0 | J1435: 0 | K1435: 294.23000000000002 | L1435: 0 | M1435: =SUM(J1435:L1435)-27.22 -> 267.00999999999999 | N1435: 27.219999999999999 | O1435: =SUM(M1435:N1435) -> 294.23000000000002
A1436: 5029 | B1436: UNIPAR CARBOCLORO-P | C1436: 33.958.695/0001-78 | D1436: 865.90999999999997 | E1436: 0 | F1436: 0 | G1436: 0 | H1436: 0 | I1436: 0 | J1436: 0 | K1436: 954.16999999999996 | L1436: 0 | M1436: =SUM(J1436:L1436)-88.26 -> 865.90999999999997 | N1436: 88.260000000000005 | O1436: =SUM(M1436:N1436) -> 954.16999999999996
A1437: 5034 | B1437: CARAMURU-P | C1437: 00.080.671/0001-00 | D1437: 68.310000000000002 | E1437: 0 | F1437: 0 | G1437: 0 | H1437: 0 | I1437: 0 | J1437: 0 | K1437: 75.269999999999996 | L1437: 0 | M1437: =SUM(J1437:L1437)-6.96 -> 68.310000000000002 | N1437: 6.96 | O1437: =SUM(M1437:N1437) -> 75.269999999999996
A1438: 5035 | B1438: NOURYON (AKZO) | C1438: 05.869.996/0001-90 | D1438: 425.88 | E1438: 0 | F1438: 0 | G1438: 0 | H1438: 0 | I1438: 0 | J1438: 0 | K1438: 469.29000000000002 | L1438: 0 | M1438: =SUM(J1438:L1438)-43.41 -> 425.88 | N1438: 43.409999999999997 | O1438: =SUM(M1438:N1438) -> 469.28999999999996
A1439: 5036 | B1439: GERDAU(SP)-P | C1439: 07.358.761/0041-56 | D1439: 444.33999999999997 | E1439: 0 | F1439: 0 | G1439: 0 | H1439: 0 | I1439: 0 | J1439: 0 | K1439: 489.63 | L1439: 0 | M1439: =SUM(J1439:L1439)-45.29 -> 444.33999999999997 | N1439: 45.289999999999999 | O1439: =SUM(M1439:N1439) -> 489.63
A1440: 5040 | B1440: WHITE MARTINS(IPATINGA)-P | C1440: 35.820.448/0155-91 | D1440: 239.28 | E1440: 0 | F1440: 0 | G1440: 0 | H1440: 0 | I1440: 0 | J1440: 0 | K1440: 263.67000000000002 | L1440: 0 | M1440: =SUM(J1440:L1440)-24.39 -> 239.28000000000003 | N1440: 24.390000000000001 | O1440: =SUM(M1440:N1440) -> 263.67000000000002
A1441: 5041 | B1441: USIMINAS-P | C1441: 60.894.730/0025-82 | D1441: 1753.77 | E1441: 0 | F1441: 0 | G1441: 0 | H1441: 0 | I1441: 0 | J1441: 0 | K1441: 1932.53 | L1441: 0 | M1441: =SUM(J1441:L1441)-178.76 -> 1753.77 | N1441: 178.75999999999999 | O1441: =SUM(M1441:N1441) -> 1932.53
A1442: 5042 | B1442: WHITE MARTINS(TRIUNFO)-P | C1442: 35.820.448/0064-10 | D1442: 62.579999999999998 | E1442: 0 | F1442: 0 | G1442: 0 | H1442: 0 | I1442: 0 | J1442: 0 | K1442: 68.959999999999994 | L1442: 0 | M1442: =SUM(J1442:L1442)-6.38 -> 62.579999999999991 | N1442: 6.3799999999999999 | O1442: =SUM(M1442:N1442) -> 68.959999999999994
A1443: 5046 | B1443: VALE(BRUCUTU)-P | C1443: 33.592.510/0447-98 | D1443: 473.63999999999999 | E1443: 0 | F1443: 0 | G1443: 0 | H1443: 0 | I1443: 0 | J1443: 0 | K1443: 521.91999999999996 | L1443: 0 | M1443: =SUM(J1443:L1443)-48.28 -> 473.63999999999999 | N1443: 48.280000000000001 | O1443: =SUM(M1443:N1443) -> 521.91999999999996
A1444: 5047 | B1444: MESSER GASES (LINDE) | C1444: 60.619.202/0072-31 | D1444: 149.25 | E1444: 0 | F1444: 0 | G1444: 0 | H1444: 0 | I1444: 0 | J1444: 0 | K1444: 164.46000000000001 | L1444: 0 | M1444: =SUM(J1444:L1444)-15.21 -> 149.25 | N1444: 15.210000000000001 | O1444: =SUM(M1444:N1444) -> 164.46000000000001
A1445: 5048 | B1445: ARLANXEO (PETROFLEX)-P | C1445: 29.667.227/0006-81 | D1445: 61.600000000000001 | E1445: 0 | F1445: 0 | G1445: 0 | H1445: 0 | I1445: 0 | J1445: 0 | K1445: 67.879999999999995 | L1445: 0 | M1445: =SUM(J1445:L1445)-6.28 -> 61.599999999999994 | N1445: 6.2800000000000002 | O1445: =SUM(M1445:N1445) -> 67.879999999999995
A1446: 5049 | B1446: APERAM (ACESITA)-P | C1446: 33.390.170/0013-12 | D1446: 828.90999999999997 | E1446: 0 | F1446: 0 | G1446: 0 | H1446: 0 | I1446: 0 | J1446: 0 | K1446: 913.39999999999998 | L1446: 0 | M1446: =SUM(J1446:L1446)-84.49 -> 828.90999999999997 | N1446: 84.489999999999995 | O1446: =SUM(M1446:N1446) -> 913.39999999999998
A1447: 5060 | B1447: VALE(AGUA LIMPA)-P | C1447: 33.592.510/0413-49 | D1447: 28.800000000000001 | E1447: 0 | F1447: 0 | G1447: 0 | H1447: 0 | I1447: 0 | J1447: 0 | K1447: 31.739999999999998 | L1447: 0 | M1447: =SUM(J1447:L1447)-2.94 -> 28.799999999999997 | N1447: 2.9399999999999999 | O1447: =SUM(M1447:N1447) -> 31.739999999999998
A1448: 5061 | B1448: ARCELORMITTAL(MONLEVADE)-P | C1448: 17.469.701/0066-12 | D1448: 1010.33 | E1448: 0 | F1448: 0 | G1448: 0 | H1448: 0 | I1448: 0 | J1448: 0 | K1448: 1113.3099999999999 | L1448: 0 | M1448: =SUM(J1448:L1448)-102.98 -> 1010.3299999999999 | N1448: 102.98 | O1448: =SUM(M1448:N1448) -> 1113.3099999999999
A1449: 5062 | B1449: WHITE MARTINS(MONLEVADE)-P | C1449: 35.820.448/0135-48 | D1449: 297.73000000000002 | E1449: 0 | F1449: 0 | G1449: 0 | H1449: 0 | I1449: 0 | J1449: 0 | K1449: 328.07999999999998 | L1449: 0 | M1449: =SUM(J1449:L1449)-30.35 -> 297.72999999999996 | N1449: 30.350000000000001 | O1449: =SUM(M1449:N1449) -> 328.07999999999998
A1450: 5065 | B1450: ANGLOGOLD ASHANTI-P | C1450: 18.565.382/0007-51 | D1450: 209.05000000000001 | E1450: 0 | F1450: 0 | G1450: 0 | H1450: 0 | I1450: 0 | J1450: 0 | K1450: 230.36000000000001 | L1450: 0 | M1450: =SUM(J1450:L1450)-21.31 -> 209.05000000000001 | N1450: 21.309999999999999 | O1450: =SUM(M1450:N1450) -> 230.36000000000001
A1451: 5066 | B1451: MOSAIC POTÁSSIO(FERTILIZANTES) | C1451: 31.009.644/0001-74 | D1451: 179.41 | E1451: 0 | F1451: 0 | G1451: 0 | H1451: 0 | I1451: 0 | J1451: 0 | K1451: 197.69999999999999 | L1451: 0 | M1451: =SUM(J1451:L1451)-18.29 -> 179.41 | N1451: 18.289999999999999 | O1451: =SUM(M1451:N1451) -> 197.69999999999999
A1452: 5067 | B1452: MINERAÇÃO MARACÁ-P | C1452: 86.902.053/0001-13 | D1452: 408.52999999999997 | E1452: 0 | F1452: 0 | G1452: 0 | H1452: 0 | I1452: 0 | J1452: 0 | K1452: 450.17000000000002 | L1452: 0 | M1452: =SUM(J1452:L1452)-41.64 -> 408.53000000000003 | N1452: 41.640000000000001 | O1452: =SUM(M1452:N1452) -> 450.17000000000002
A1453: 5068 | B1453: PARAGOMINAS-P | C1453: 12.094.570/0004-10 | D1453: 382.94999999999999 | E1453: 0 | F1453: 0 | G1453: 0 | H1453: 0 | I1453: 0 | J1453: 0 | K1453: 421.98000000000002 | L1453: 0 | M1453: =SUM(J1453:L1453)-39.03 -> 382.95000000000005 | N1453: 39.030000000000001 | O1453: =SUM(M1453:N1453) -> 421.98000000000002
A1454: 5070 | B1454: CBA (NIQUELÂNDIA) | C1454: 61.409.892/0224-95 | D1454: 0 | E1454: 0 | F1454: 0 | G1454: 0 | H1454: 0 | I1454: 0 | J1454: 0 | K1454: 0 | L1454: 0 | M1454: =SUM(J1454:L1454)-0 -> 0 | N1454: 0 | O1454: =SUM(M1454:N1454) -> 0
A1455: 5072 | B1455: BRF(SADIA) | C1455: 01.838.723/0394-14 | D1455: 157.02000000000001 | E1455: 0 | F1455: 0 | G1455: 0 | H1455: 0 | I1455: 0 | J1455: 0 | K1455: 173.02000000000001 | L1455: 0 | M1455: =SUM(J1455:L1455)-16 -> 157.02000000000001 | N1455: 16 | O1455: =SUM(M1455:N1455) -> 173.02000000000001
A1456: 5073 | B1456: ANGLOGOLD (SÃO BENTO)-P | C1456: 18.565.382/0001-66 | D1456: 127.37 | E1456: 0 | F1456: 0 | G1456: 0 | H1456: 0 | I1456: 0 | J1456: 0 | K1456: 140.34999999999999 | L1456: 0 | M1456: =SUM(J1456:L1456)-12.98 -> 127.36999999999999 | N1456: 12.98 | O1456: =SUM(M1456:N1456) -> 140.34999999999999
A1457: 5074 | B1457: WHITE MARTINS(BARAO COCAIS)-P | C1457: 35.820.448/0044-76 | D1457: 40.380000000000003 | E1457: 0 | F1457: 0 | G1457: 0 | H1457: 0 | I1457: 0 | J1457: 0 | K1457: 44.5 | L1457: 0 | M1457: =SUM(J1457:L1457)-4.12 -> 40.380000000000003 | N1457: 4.1200000000000001 | O1457: =SUM(M1457:N1457) -> 44.5
A1458: 5076 | B1458: VALE (MINERAÇÃO ONÇA-PUMA)-P | C1458: 48.256.824/0006-68 | D1458: 856.39999999999998 | E1458: 0 | F1458: 0 | G1458: 0 | H1458: 0 | I1458: 0 | J1458: 0 | K1458: 943.69000000000005 | L1458: 0 | M1458: =SUM(J1458:L1458)-87.29 -> 856.40000000000009 | N1458: 87.290000000000006 | O1458: =SUM(M1458:N1458) -> 943.69000000000005
A1459: 5077 | B1459: KINROSS(RPM)-P | C1459: 20.346.524/0001-46 | D1459: 942.34000000000003 | E1459: 0 | F1459: 0 | G1459: 0 | H1459: 0 | I1459: 0 | J1459: 0 | K1459: 1038.3900000000001 | L1459: 0 | M1459: =SUM(J1459:L1459)-96.05 -> 942.34000000000015 | N1459: 96.049999999999997 | O1459: =SUM(M1459:N1459) -> 1038.3900000000001
A1460: 5078 | B1460: ARCELORMITTAL (SBM)-P | C1460: 17.469.701/0260-52 | D1460: 560.38 | E1460: 0 | F1460: 0 | G1460: 0 | H1460: 0 | I1460: 0 | J1460: 0 | K1460: 617.5 | L1460: 0 | M1460: =SUM(J1460:L1460)-57.12 -> 560.38 | N1460: 57.119999999999997 | O1460: =SUM(M1460:N1460) -> 617.5
A1461: 5079 | B1461: REPAR-P | C1461: 33.000.167/0809-70 | D1461: 242.69999999999999 | E1461: 0 | F1461: 0 | G1461: 0 | H1461: 0 | I1461: 0 | J1461: 0 | K1461: 267.44 | L1461: 0 | M1461: =SUM(J1461:L1461)-24.74 -> 242.69999999999999 | N1461: 24.739999999999998 | O1461: =SUM(M1461:N1461) -> 267.44
A1462: 5080 | B1462: BRASKEM (COPESUL)-P | C1462: 42.150.391/0038-62 | D1462: 1452.1300000000001 | E1462: 0 | F1462: 0 | G1462: 0 | H1462: 0 | I1462: 0 | J1462: 0 | K1462: 1600.1400000000001 | L1462: 0 | M1462: =SUM(J1462:L1462)-148.01 -> 1452.1300000000001 | N1462: 148.00999999999999 | O1462: =SUM(M1462:N1462) -> 1600.1400000000001
A1463: 5083 | B1463: ATLANTIC NICKEL (MIRABELA) | C1463: 74.127.010/0004-71 | D1463: 236.27000000000001 | E1463: 0 | F1463: 0 | G1463: 0 | H1463: 0 | I1463: 0 | J1463: 0 | K1463: 260.35000000000002 | L1463: 0 | M1463: =SUM(J1463:L1463)-24.08 -> 236.27000000000004 | N1463: 24.079999999999998 | O1463: =SUM(M1463:N1463) -> 260.35000000000002
A1464: 5084 | B1464: CASTERTECH-P | C1464: 08.304.706/0001-59 | D1464: 136.31 | E1464: 0 | F1464: 0 | G1464: 0 | H1464: 0 | I1464: 0 | J1464: 0 | K1464: 150.19999999999999 | L1464: 0 | M1464: =SUM(J1464:L1464)-13.89 -> 136.31 | N1464: 13.890000000000001 | O1464: =SUM(M1464:N1464) -> 150.19999999999999
A1465: 5087 | B1465: COTEMINAS(CAMP. GRANDE) | C1465: 07.663.140/0006-01 | D1465: 398.16000000000003 | E1465: 0 | F1465: 0 | G1465: 0 | H1465: 0 | I1465: 0 | J1465: 0 | K1465: 438.74000000000001 | L1465: 0 | M1465: =SUM(J1465:L1465)-40.58 -> 398.16000000000003 | N1465: 40.579999999999998 | O1465: =SUM(M1465:N1465) -> 438.74000000000001
A1466: 5088 | B1466: VALLOUREC | C1466: 08.689.024/0002-92 | D1466: 970.57000000000005 | E1466: 0 | F1466: 0 | G1466: 0 | H1466: 0 | I1466: 0 | J1466: 0 | K1466: 1069.5 | L1466: 0 | M1466: =SUM(J1466:L1466)-98.93 -> 970.56999999999994 | N1466: 98.930000000000007 | O1466: =SUM(M1466:N1466) -> 1069.5
A1467: 5091 | B1467: ANGLO AMERICAN (BARRO ALTO) | C1467: 42.184.226/0011-01 | D1467: 1395.1600000000001 | E1467: 0 | F1467: 0 | G1467: 0 | H1467: 0 | I1467: 0 | J1467: 0 | K1467: 1537.3699999999999 | L1467: 0 | M1467: =SUM(J1467:L1467)-142.21 -> 1395.1599999999999 | N1467: 142.21000000000001 | O1467: =SUM(M1467:N1467) -> 1537.3699999999999
A1468: 5092 | B1468: VIPAL | C1468: 87.870.952/0001-44 | D1468: 94.439999999999998 | E1468: 0 | F1468: 0 | G1468: 0 | H1468: 0 | I1468: 0 | J1468: 0 | K1468: 104.06999999999999 | L1468: 0 | M1468: =SUM(J1468:L1468)-9.63 -> 94.439999999999998 | N1468: 9.6300000000000008 | O1468: =SUM(M1468:N1468) -> 104.06999999999999
A1469: 5094 | B1469: UTE SANTA LUZIA I-CARGA | C1469: 08.906.558/0001-42 | D1469: 13.98 | E1469: 0 | F1469: 0 | G1469: 0 | H1469: 0 | I1469: 0 | J1469: 0 | K1469: 15.4 | L1469: 0 | M1469: =SUM(J1469:L1469)-1.42 -> 13.98 | N1469: 1.4199999999999999 | O1469: =SUM(M1469:N1469) -> 15.4
A1470: 5096 | B1470: SJC (UTE QUIRINÓPOLIS)-CARGA | C1470: 10.249.419/0002-16 | D1470: 17.43 | E1470: 0 | F1470: 0 | G1470: 0 | H1470: 0 | I1470: 0 | J1470: 0 | K1470: 19.210000000000001 | L1470: 0 | M1470: =SUM(J1470:L1470)-1.78 -> 17.43 | N1470: 1.78 | O1470: =SUM(M1470:N1470) -> 19.210000000000001
A1471: 5097 | B1471: UTE ELDORADO-CARGA | C1471: 05.620.523/0002-35 | D1471: 38.549999999999997 | E1471: 0 | F1471: 0 | G1471: 0 | H1471: 0 | I1471: 0 | J1471: 0 | K1471: 42.479999999999997 | L1471: 0 | M1471: =SUM(J1471:L1471)-3.93 -> 38.549999999999997 | N1471: 3.9300000000000002 | O1471: =SUM(M1471:N1471) -> 42.479999999999997
A1472: 5098 | B1472: TERNIUM(UTE ATLÂNTICO)-RC | C1472: 07.005.330/0001-19 | D1472: 1831.8699999999999 | E1472: 0 | F1472: 0 | G1472: 0 | H1472: 0 | I1472: 0 | J1472: 0 | K1472: 2018.5899999999999 | L1472: 0 | M1472: =SUM(J1472:L1472)-186.72 -> 1831.8699999999999 | N1472: 186.72 | O1472: =SUM(M1472:N1472) -> 2018.5899999999999
A1473: 5100 | B1473: VALE SALOBO | C1473: 33.931.478/0002-75 | D1473: 1116.1900000000001 | E1473: 0 | F1473: 0 | G1473: 0 | H1473: 0 | I1473: 0 | J1473: 0 | K1473: 1229.96 | L1473: 0 | M1473: =SUM(J1473:L1473)-113.77 -> 1116.1900000000001 | N1473: 113.77 | O1473: =SUM(M1473:N1473) -> 1229.96
A1474: 5101 | B1474: KLABIN | C1474: 89.637.490/0133-95 | D1474: 1059.3 | E1474: 0 | F1474: 0 | G1474: 0 | H1474: 0 | I1474: 0 | J1474: 0 | K1474: 1167.27 | L1474: 0 | M1474: =SUM(J1474:L1474)-107.97 -> 1059.3 | N1474: 107.97 | O1474: =SUM(M1474:N1474) -> 1167.27
A1475: 5102 | B1475: BERNECK (CARGA)-P | C1475: 81.905.176/0001-94 | D1475: 210.84 | E1475: 0 | F1475: 0 | G1475: 0 | H1475: 0 | I1475: 0 | J1475: 0 | K1475: 232.33000000000001 | L1475: 0 | M1475: =SUM(J1475:L1475)-21.49 -> 210.84 | N1475: 21.489999999999998 | O1475: =SUM(M1475:N1475) -> 232.33000000000001
A1476: 5103 | B1476: UNIPAR INDUPA (SOLVAY) | C1476: 61.460.325/0004-94 | D1476: 708.03999999999996 | E1476: 0 | F1476: 0 | G1476: 0 | H1476: 0 | I1476: 0 | J1476: 0 | K1476: 780.21000000000004 | L1476: 0 | M1476: =SUM(J1476:L1476)-72.17 -> 708.04000000000008 | N1476: 72.170000000000002 | O1476: =SUM(M1476:N1476) -> 780.21000000000004
A1477: 5104 | B1477: UTE COSTA RICA-CARGA | C1477: 08.070.566/0016-88 | D1477: 0 | E1477: 0 | F1477: 0 | G1477: 0 | H1477: 0 | I1477: 0 | J1477: 0 | K1477: 0 | L1477: 0 | M1477: =SUM(J1477:L1477)-0 -> 0 | N1477: 0 | O1477: =SUM(M1477:N1477) -> 0
A1478: 5105 | B1478: MATARIPE (RLAM) | C1478: 41.777.706/0001-41 | D1478: 386.33999999999997 | E1478: 0 | F1478: 0 | G1478: 0 | H1478: 0 | I1478: 0 | J1478: 0 | K1478: 425.72000000000003 | L1478: 0 | M1478: =SUM(J1478:L1478)-39.38 -> 386.34000000000003 | N1478: 39.380000000000003 | O1478: =SUM(M1478:N1478) -> 425.72000000000003
A1479: 5106 | B1479: PROQUIGEL (PETROBRAS FAFEN) | C1479: 27.515.154/0020-35 | D1479: 110.37 | E1479: 0 | F1479: 0 | G1479: 0 | H1479: 0 | I1479: 0 | J1479: 0 | K1479: 121.62 | L1479: 0 | M1479: =SUM(J1479:L1479)-11.25 -> 110.37 | N1479: 11.25 | O1479: =SUM(M1479:N1479) -> 121.62
A1480: 5107 | B1480: RIMA | C1480: 18.279.158/0010-07 | D1480: 626.90999999999997 | E1480: 0 | F1480: 0 | G1480: 0 | H1480: 0 | I1480: 0 | J1480: 0 | K1480: 690.80999999999995 | L1480: 0 | M1480: =SUM(J1480:L1480)-63.9 -> 626.90999999999997 | N1480: 63.899999999999999 | O1480: =SUM(M1480:N1480) -> 690.80999999999995
A1481: 5108 | B1481: TOYOTA | C1481: 59.104.760/0006-04 | D1481: 54.25 | E1481: 0 | F1481: 0 | G1481: 0 | H1481: 0 | I1481: 0 | J1481: 0 | K1481: 59.780000000000001 | L1481: 0 | M1481: =SUM(J1481:L1481)-5.53 -> 54.25 | N1481: 5.5300000000000002 | O1481: =SUM(M1481:N1481) -> 59.780000000000001
A1482: 5111 | B1482: ANGLO FERROUS | C1482: 02.359.572/0004-30 | D1482: 790.85000000000002 | E1482: 0 | F1482: 0 | G1482: 0 | H1482: 0 | I1482: 0 | J1482: 0 | K1482: 871.46000000000004 | L1482: 0 | M1482: =SUM(J1482:L1482)-80.61 -> 790.85000000000002 | N1482: 80.609999999999999 | O1482: =SUM(M1482:N1482) -> 871.46000000000004
A1483: 5114 | B1483: UTE MORRO VERMELHO-CARGA | C1483: 08.070.566/0012-54 | D1483: 0 | E1483: 0 | F1483: 0 | G1483: 0 | H1483: 0 | I1483: 0 | J1483: 0 | K1483: 0 | L1483: 0 | M1483: =SUM(J1483:L1483)-0 -> 0 | N1483: 0 | O1483: =SUM(M1483:N1483) -> 0
A1484: 5115 | B1484: VALE S11D (MINA SERRA SUL) | C1484: 33.592.510/0089-96 | D1484: 179.46000000000001 | E1484: 0 | F1484: 0 | G1484: 0 | H1484: 0 | I1484: 0 | J1484: 0 | K1484: 197.75 | L1484: 0 | M1484: =SUM(J1484:L1484)-18.29 -> 179.46000000000001 | N1484: 18.289999999999999 | O1484: =SUM(M1484:N1484) -> 197.75
A1485: 5116 | B1485: VALE MINA CONCEIÇÃO | C1485: 33.592.510/0164-09 | D1485: 803.94000000000005 | E1485: 0 | F1485: 0 | G1485: 0 | H1485: 0 | I1485: 0 | J1485: 0 | K1485: 885.88 | L1485: 0 | M1485: =SUM(J1485:L1485)-81.94 -> 803.94000000000005 | N1485: 81.939999999999998 | O1485: =SUM(M1485:N1485) -> 885.88000000000011
A1486: 5117 | B1486: PETROBRAS(RNEST) | C1486: 33.000.167/1111-08 | D1486: 262.35000000000002 | E1486: 0 | F1486: 0 | G1486: 0 | H1486: 0 | I1486: 0 | J1486: 0 | K1486: 289.08999999999997 | L1486: 0 | M1486: =SUM(J1486:L1486)-26.74 -> 262.34999999999997 | N1486: 26.739999999999998 | O1486: =SUM(M1486:N1486) -> 289.08999999999997
A1487: 5118 | B1487: UTE ALTO TAQUARI-CARGA | C1487: 08.070.566/0017-69 | D1487: 0 | E1487: 0 | F1487: 0 | G1487: 0 | H1487: 0 | I1487: 0 | J1487: 0 | K1487: 0 | L1487: 0 | M1487: =SUM(J1487:L1487)-0 -> 0 | N1487: 0 | O1487: =SUM(M1487:N1487) -> 0
A1488: 5119 | B1488: COSAN (UTE JATAI)-CARGA | C1488: 18.686.104/0001-67 | D1488: 0 | E1488: 0 | F1488: 0 | G1488: 0 | H1488: 0 | I1488: 0 | J1488: 0 | K1488: 0 | L1488: 0 | M1488: =SUM(J1488:L1488)-0 -> 0 | N1488: 0 | O1488: =SUM(M1488:N1488) -> 0
A1489: 5120 | B1489: AÇO VERDE (GUSA) | C1489: 07.636.657/0002-70 | D1489: 354.43000000000001 | E1489: 0 | F1489: 0 | G1489: 0 | H1489: 0 | I1489: 0 | J1489: 0 | K1489: 390.56 | L1489: 0 | M1489: =SUM(J1489:L1489)-36.13 -> 354.43000000000001 | N1489: 36.130000000000003 | O1489: =SUM(M1489:N1489) -> 390.56
A1490: 5124 | B1490: SAMARCO GERMANO-P | C1490: 16.628.281/0003-23 | D1490: 508 | E1490: 0 | F1490: 0 | G1490: 0 | H1490: 0 | I1490: 0 | J1490: 0 | K1490: 559.77999999999997 | L1490: 0 | M1490: =SUM(J1490:L1490)-51.78 -> 508 | N1490: 51.780000000000001 | O1490: =SUM(M1490:N1490) -> 559.77999999999997
A1491: 5125 | B1491: TROPICAL BIOENERGIA-(CARGA) | C1491: 08.195.806/0001-94 | D1491: 31.940000000000001 | E1491: 0 | F1491: 0 | G1491: 0 | H1491: 0 | I1491: 0 | J1491: 0 | K1491: 35.200000000000003 | L1491: 0 | M1491: =SUM(J1491:L1491)-3.26 -> 31.940000000000005 | N1491: 3.2599999999999998 | O1491: =SUM(M1491:N1491) -> 35.200000000000003
A1492: 5126 | B1492: GV DO BRASIL | C1492: 12.884.632/0001-44 | D1492: 521.83000000000004 | E1492: 0 | F1492: 0 | G1492: 0 | H1492: 0 | I1492: 0 | J1492: 0 | K1492: 575.01999999999998 | L1492: 0 | M1492: =SUM(J1492:L1492)-53.19 -> 521.82999999999993 | N1492: 53.189999999999998 | O1492: =SUM(M1492:N1492) -> 575.01999999999998
A1493: 5127 | B1493: NORFIL | C1493: 02.341.494/0001-01 | D1493: 310.42000000000002 | E1493: 0 | F1493: 0 | G1493: 0 | H1493: 0 | I1493: 0 | J1493: 0 | K1493: 342.06 | L1493: 0 | M1493: =SUM(J1493:L1493)-31.64 -> 310.42000000000002 | N1493: 31.640000000000001 | O1493: =SUM(M1493:N1493) -> 342.06
A1494: 5128 | B1494: VALE(VARGEM GRANDE) | C1494: 33.592.510/0034-12 | D1494: 990.15999999999997 | E1494: 0 | F1494: 0 | G1494: 0 | H1494: 0 | I1494: 0 | J1494: 0 | K1494: 1091.0899999999999 | L1494: 0 | M1494: =SUM(J1494:L1494)-100.93 -> 990.15999999999985 | N1494: 100.93000000000001 | O1494: =SUM(M1494:N1494) -> 1091.0899999999999
A1495: 5129 | B1495: WHITE MARTINS (JECEABA) | C1495: 35.820.448/0195-89 | D1495: 66.599999999999994 | E1495: 0 | F1495: 0 | G1495: 0 | H1495: 0 | I1495: 0 | J1495: 0 | K1495: 73.390000000000001 | L1495: 0 | M1495: =SUM(J1495:L1495)-6.79 -> 66.599999999999994 | N1495: 6.79 | O1495: =SUM(M1495:N1495) -> 73.390000000000001
A1496: 5130 | B1496: CMPC | C1496: 11.234.954/0001-85 | D1496: 1.1399999999999999 | E1496: 0 | F1496: 0 | G1496: 0 | H1496: 0 | I1496: 0 | J1496: 0 | K1496: 1.26 | L1496: 0 | M1496: =SUM(J1496:L1496)-0.12 -> 1.1400000000000001 | N1496: 0.12 | O1496: =SUM(M1496:N1496) -> 1.2600000000000002
A1497: 5131 | B1497: CIMENTO APODI | C1497: 10.260.249/0003-51 | D1497: 111.03 | E1497: 0 | F1497: 0 | G1497: 0 | H1497: 0 | I1497: 0 | J1497: 0 | K1497: 122.34999999999999 | L1497: 0 | M1497: =SUM(J1497:L1497)-11.32 -> 111.03 | N1497: 11.32 | O1497: =SUM(M1497:N1497) -> 122.34999999999999
A1498: 5132 | B1498: CODEVASF(PISF) | C1498: 00.399.857/0001-26 | D1498: 765.02999999999997 | E1498: 0 | F1498: 0 | G1498: 0 | H1498: 0 | I1498: 0 | J1498: 0 | K1498: 843.00999999999999 | L1498: 0 | M1498: =SUM(J1498:L1498)-77.98 -> 765.02999999999997 | N1498: 77.980000000000004 | O1498: =SUM(M1498:N1498) -> 843.00999999999999
A1499: 5133 | B1499: ELIZABETH CIMENTOS | C1499: 12.186.380/0001-80 | D1499: 121.43000000000001 | E1499: 0 | F1499: 0 | G1499: 0 | H1499: 0 | I1499: 0 | J1499: 0 | K1499: 133.81 | L1499: 0 | M1499: =SUM(J1499:L1499)-12.38 -> 121.43000000000001 | N1499: 12.380000000000001 | O1499: =SUM(M1499:N1499) -> 133.81
A1500: 5134 | B1500: CIA DE CIMENTO DA PARAÍBA | C1500: 12.616.864/0002-00 | D1500: 140.88999999999999 | E1500: 0 | F1500: 0 | G1500: 0 | H1500: 0 | I1500: 0 | J1500: 0 | K1500: 155.25 | L1500: 0 | M1500: =SUM(J1500:L1500)-14.36 -> 140.88999999999999 | N1500: 14.359999999999999 | O1500: =SUM(M1500:N1500) -> 155.25
A1501: 5135 | B1501: CIA SIDERURGICA DO PECEM-CARGA | C1501: 09.509.535/0001-67 | D1501: 548.33000000000004 | E1501: 0 | F1501: 0 | G1501: 0 | H1501: 0 | I1501: 0 | J1501: 0 | K1501: 604.22000000000003 | L1501: 0 | M1501: =SUM(J1501:L1501)-55.89 -> 548.33000000000004 | N1501: 55.890000000000001 | O1501: =SUM(M1501:N1501) -> 604.22000000000003
A1502: 5136 | B1502: UTE KLABIN-(CARGA) | C1502: 89.637.490/0165-72 | D1502: 744.90999999999997 | E1502: 0 | F1502: 0 | G1502: 0 | H1502: 0 | I1502: 0 | J1502: 0 | K1502: 820.84000000000003 | L1502: 0 | M1502: =SUM(J1502:L1502)-75.93 -> 744.91000000000008 | N1502: 75.930000000000007 | O1502: =SUM(M1502:N1502) -> 820.84000000000015
A1503: 5137 | B1503: GERDAU (CHARQUEADAS) | C1503: 33.611.500/0182-47 | D1503: 559.11000000000001 | E1503: 0 | F1503: 0 | G1503: 0 | H1503: 0 | I1503: 0 | J1503: 0 | K1503: 616.10000000000002 | L1503: 0 | M1503: =SUM(J1503:L1503)-56.99 -> 559.11000000000001 | N1503: 56.990000000000002 | O1503: =SUM(M1503:N1503) -> 616.10000000000002
A1504: 5138 | B1504: UTE IACO-(CARGA) | C1504: 07.895.728/0006-82 | D1504: 17.170000000000002 | E1504: 0 | F1504: 0 | G1504: 0 | H1504: 0 | I1504: 0 | J1504: 0 | K1504: 18.920000000000002 | L1504: 0 | M1504: =SUM(J1504:L1504)-1.75 -> 17.170000000000002 | N1504: 1.75 | O1504: =SUM(M1504:N1504) -> 18.920000000000002
A1505: 5139 | B1505: CERRADINHO (P. DAS AGUAS)-CARGA | C1505: 08.322.396/0001-03 | D1505: 0 | E1505: 0 | F1505: 0 | G1505: 0 | H1505: 0 | I1505: 0 | J1505: 0 | K1505: 0 | L1505: 0 | M1505: =SUM(J1505:L1505)-0 -> 0 | N1505: 0 | O1505: =SUM(M1505:N1505) -> 0
A1506: 5143 | B1506: VALE PELOTIZAÇÃO | C1506: 33.592.510/0434-73 | D1506: 209.15000000000001 | E1506: 0 | F1506: 0 | G1506: 0 | H1506: 0 | I1506: 0 | J1506: 0 | K1506: 230.47 | L1506: 0 | M1506: =SUM(J1506:L1506)-21.32 -> 209.15000000000001 | N1506: 21.32 | O1506: =SUM(M1506:N1506) -> 230.47
A1507: 5144 | B1507: JBS COUROS ITUMBIARA | C1507: 02.916.265/0098-92 | D1507: 27.199999999999999 | E1507: 0 | F1507: 0 | G1507: 0 | H1507: 0 | I1507: 0 | J1507: 0 | K1507: 29.969999999999999 | L1507: 0 | M1507: =SUM(J1507:L1507)-2.77 -> 27.199999999999999 | N1507: 2.77 | O1507: =SUM(M1507:N1507) -> 29.969999999999999
A1508: 5145 | B1508: WHITE MARTINS CUBATÃO | C1508: 35.820.448/0174-54 | D1508: 48.299999999999997 | E1508: 0 | F1508: 0 | G1508: 0 | H1508: 0 | I1508: 0 | J1508: 0 | K1508: 53.219999999999999 | L1508: 0 | M1508: =SUM(J1508:L1508)-4.92 -> 48.299999999999997 | N1508: 4.9199999999999999 | O1508: =SUM(M1508:N1508) -> 53.219999999999999
A1509: 5146 | B1509: USIMINAS CUBATÃO | C1509: 60.894.730/0063-08 | D1509: 635.98000000000002 | E1509: 0 | F1509: 0 | G1509: 0 | H1509: 0 | I1509: 0 | J1509: 0 | K1509: 700.79999999999995 | L1509: 0 | M1509: =SUM(J1509:L1509)-64.82 -> 635.98000000000002 | N1509: 64.819999999999993 | O1509: =SUM(M1509:N1509) -> 700.79999999999995
A1510: 5147 | B1510: PETROBRAS SIX | C1510: 40.254.927/0001-72 | D1510: 99.450000000000003 | E1510: 0 | F1510: 0 | G1510: 0 | H1510: 0 | I1510: 0 | J1510: 0 | K1510: 109.59 | L1510: 0 | M1510: =SUM(J1510:L1510)-10.14 -> 99.450000000000003 | N1510: 10.140000000000001 | O1510: =SUM(M1510:N1510) -> 109.59
A1511: 5149 | B1511: ARLANXEO CABO | C1511: 29.667.227/0010-68 | D1511: 56.18 | E1511: 0 | F1511: 0 | G1511: 0 | H1511: 0 | I1511: 0 | J1511: 0 | K1511: 61.909999999999997 | L1511: 0 | M1511: =SUM(J1511:L1511)-5.73 -> 56.179999999999993 | N1511: 5.7300000000000004 | O1511: =SUM(M1511:N1511) -> 61.909999999999997
A1512: 5150 | B1512: VOTORANTIM JARDIM | C1512: 10.656.452/0023-95 | D1512: 287.45999999999998 | E1512: 0 | F1512: 0 | G1512: 0 | H1512: 0 | I1512: 0 | J1512: 0 | K1512: 316.75999999999999 | L1512: 0 | M1512: =SUM(J1512:L1512)-29.3 -> 287.45999999999998 | N1512: 29.300000000000001 | O1512: =SUM(M1512:N1512) -> 316.75999999999999
A1513: 5151 | B1513: VOTORANTIM RIO BRANCO | C1513: 01.637.895/0106-00 | D1513: 497.63999999999999 | E1513: 0 | F1513: 0 | G1513: 0 | H1513: 0 | I1513: 0 | J1513: 0 | K1513: 548.36000000000001 | L1513: 0 | M1513: =SUM(J1513:L1513)-50.72 -> 497.63999999999999 | N1513: 50.719999999999999 | O1513: =SUM(M1513:N1513) -> 548.36000000000001
A1514: 5152 | B1514: ARCELORMITTAL (JOINVILLE) | C1514: 17.469.701/0106-44 | D1514: 472.87 | E1514: 0 | F1514: 0 | G1514: 0 | H1514: 0 | I1514: 0 | J1514: 0 | K1514: 521.07000000000005 | L1514: 0 | M1514: =SUM(J1514:L1514)-48.2 -> 472.87000000000006 | N1514: 48.200000000000003 | O1514: =SUM(M1514:N1514) -> 521.07000000000005
A1515: 5153 | B1515: UTE CUBATÃO - CARGA | C1515: 33.000.167/0116-50 | D1515: 190 | E1515: 0 | F1515: 0 | G1515: 0 | H1515: 0 | I1515: 0 | J1515: 0 | K1515: 209.37 | L1515: 0 | M1515: =SUM(J1515:L1515)-19.37 -> 190 | N1515: 19.370000000000001 | O1515: =SUM(M1515:N1515) -> 209.37
A1516: 5154 | B1516: GERDAU (INDUSTRIAL) | C1516: 07.358.761/0007-54 | D1516: 195.41999999999999 | E1516: 0 | F1516: 0 | G1516: 0 | H1516: 0 | I1516: 0 | J1516: 0 | K1516: 215.34 | L1516: 0 | M1516: =SUM(J1516:L1516)-19.92 -> 195.42000000000002 | N1516: 19.920000000000002 | O1516: =SUM(M1516:N1516) -> 215.34000000000003
A1517: 5156 | B1517: VOTORANTIM SOBRAL | C1517: 10.656.452/0053-00 | D1517: 140.41999999999999 | E1517: 0 | F1517: 0 | G1517: 0 | H1517: 0 | I1517: 0 | J1517: 0 | K1517: 154.72999999999999 | L1517: 0 | M1517: =SUM(J1517:L1517)-14.31 -> 140.41999999999999 | N1517: 14.31 | O1517: =SUM(M1517:N1517) -> 154.72999999999999
A1518: 5157 | B1518: ARAUCO | C1518: 00.606.549/0026-82 | D1518: 85.950000000000003 | E1518: 0 | F1518: 0 | G1518: 0 | H1518: 0 | I1518: 0 | J1518: 0 | K1518: 94.709999999999994 | L1518: 0 | M1518: =SUM(J1518:L1518)-8.76 -> 85.949999999999989 | N1518: 8.7599999999999998 | O1518: =SUM(M1518:N1518) -> 94.709999999999994
A1519: 5158 | B1519: PETROBRAS (COMPERJ) | C1519: 33.000.167/0125-41 | D1519: 214.66999999999999 | E1519: 0 | F1519: 0 | G1519: 0 | H1519: 0 | I1519: 0 | J1519: 0 | K1519: 236.55000000000001 | L1519: 0 | M1519: =SUM(J1519:L1519)-21.88 -> 214.67000000000002 | N1519: 21.879999999999999 | O1519: =SUM(M1519:N1519) -> 236.55000000000001
A1520: 5159 | B1520: MINERAÇÃO DARDANELOS | C1520: 42.416.651/0027-46 | D1520: 109.84999999999999 | E1520: 0 | F1520: 0 | G1520: 0 | H1520: 0 | I1520: 0 | J1520: 0 | K1520: 121.05 | L1520: 0 | M1520: =SUM(J1520:L1520)-11.2 -> 109.84999999999999 | N1520: 11.199999999999999 | O1520: =SUM(M1520:N1520) -> 121.05
A1521: 5160 | B1521: HNK (PE) | C1521: 50.221.019/0054-48 | D1521: 17.09 | E1521: 0 | F1521: 0 | G1521: 0 | H1521: 0 | I1521: 0 | J1521: 0 | K1521: 18.829999999999998 | L1521: 0 | M1521: =SUM(J1521:L1521)-1.74 -> 17.09 | N1521: 1.74 | O1521: =SUM(M1521:N1521) -> 18.829999999999998
A1522: 5161 | B1522: MINERAÇÃO VALE VERDE | C1522: 08.650.571/0001-83 | D1522: 293.39999999999998 | E1522: 0 | F1522: 0 | G1522: 0 | H1522: 0 | I1522: 0 | J1522: 0 | K1522: 323.31 | L1522: 0 | M1522: =SUM(J1522:L1522)-29.91 -> 293.39999999999998 | N1522: 29.91 | O1522: =SUM(M1522:N1522) -> 323.31
A1523: 5162 | B1523: BRACELL (CARGA) | C1523: 53.943.098/0001-87 | D1523: 23.350000000000001 | E1523: 0 | F1523: 0 | G1523: 0 | H1523: 0 | I1523: 0 | J1523: 0 | K1523: 25.73 | L1523: 0 | M1523: =SUM(J1523:L1523)-2.38 -> 23.350000000000001 | N1523: 2.3799999999999999 | O1523: =SUM(M1523:N1523) -> 25.73
A1524: 5164 | B1524: HEINEKEN CAXIAS | C1524: 02.864.417/0020-90 | D1524: 13.83 | E1524: 0 | F1524: 0 | G1524: 0 | H1524: 0 | I1524: 0 | J1524: 0 | K1524: 15.24 | L1524: 0 | M1524: =SUM(J1524:L1524)-1.41 -> 13.83 | N1524: 1.4099999999999999 | O1524: =SUM(M1524:N1524) -> 15.24
A1525: 5165 | B1525: FIAT(PE) | C1525: 16.701.716/0036-86 | D1525: 490.42000000000002 | E1525: 0 | F1525: 0 | G1525: 0 | H1525: 0 | I1525: 0 | J1525: 0 | K1525: 540.40999999999997 | L1525: 0 | M1525: =SUM(J1525:L1525)-49.99 -> 490.41999999999996 | N1525: 49.990000000000002 | O1525: =SUM(M1525:N1525) -> 540.40999999999997
A1526: 5166 | B1526: A100 ROW | C1526: 12.147.176/0018-06 | D1526: 77.629999999999995 | E1526: 0 | F1526: 0 | G1526: 0 | H1526: 0 | I1526: 0 | J1526: 0 | K1526: 85.540000000000006 | L1526: 0 | M1526: =SUM(J1526:L1526)-7.91 -> 77.63000000000001 | N1526: 7.9100000000000001 | O1526: =SUM(M1526:N1526) -> 85.540000000000006
A1527: 5168 | B1527: UTE FS SORRISO (CARGA) | C1527: 20.003.699/0002-31 | D1527: 39.32 | E1527: 0 | F1527: 0 | G1527: 0 | H1527: 0 | I1527: 0 | J1527: 0 | K1527: 43.329999999999998 | L1527: 0 | M1527: =SUM(J1527:L1527)-4.01 -> 39.32 | N1527: 4.0099999999999998 | O1527: =SUM(M1527:N1527) -> 43.329999999999998
A1528: 5169 | B1528: PETROBRAS (REPLAN) | C1528: 33.000.167/0643-47 | D1528: 529.92999999999995 | E1528: 0 | F1528: 0 | G1528: 0 | H1528: 0 | I1528: 0 | J1528: 0 | K1528: 583.94000000000005 | L1528: 0 | M1528: =SUM(J1528:L1528)-54.01 -> 529.93000000000006 | N1528: 54.009999999999998 | O1528: =SUM(M1528:N1528) -> 583.94000000000005
A1529: 5170 | B1529: GERDAU (MOGI) | C1529: 33.611.500/0178-60 | D1529: 0 | E1529: 0 | F1529: 0 | G1529: 0 | H1529: 0 | I1529: 0 | J1529: 0 | K1529: 0 | L1529: 0 | M1529: =SUM(J1529:L1529)-0 -> 0 | N1529: 0 | O1529: =SUM(M1529:N1529) -> 0
A1530: 5171 | B1530: UTE LWARCEL (CARGA) | C1530: 53.943.098/0001-87 | D1530: 26.170000000000002 | E1530: 0 | F1530: 0 | G1530: 0 | H1530: 0 | I1530: 0 | J1530: 0 | K1530: 28.84 | L1530: 0 | M1530: =SUM(J1530:L1530)-2.67 -> 26.170000000000002 | N1530: 2.6699999999999999 | O1530: =SUM(M1530:N1530) -> 28.840000000000003
A1531: 5172 | B1531: UTE MARLIM AZUL (CARGA) | C1531: 29.884.534/0002-90 | D1531: 50.729999999999997 | E1531: 0 | F1531: 0 | G1531: 0 | H1531: 0 | I1531: 0 | J1531: 0 | K1531: 55.899999999999999 | L1531: 0 | M1531: =SUM(J1531:L1531)-5.17 -> 50.729999999999997 | N1531: 5.1699999999999999 | O1531: =SUM(M1531:N1531) -> 55.899999999999999
A1532: 5173 | B1532: SINOBRAS | C1532: 07.933.914/0001-54 | D1532: 648.45000000000005 | E1532: 0 | F1532: 0 | G1532: 0 | H1532: 0 | I1532: 0 | J1532: 0 | K1532: 714.54999999999995 | L1532: 0 | M1532: =SUM(J1532:L1532)-66.1 -> 648.44999999999993 | N1532: 66.099999999999994 | O1532: =SUM(M1532:N1532) -> 714.54999999999995
A1533: 5174 | B1533: AIR LIQUIDE | C1533: 00.331.788/0020-81 | D1533: 27.039999999999999 | E1533: 0 | F1533: 0 | G1533: 0 | H1533: 0 | I1533: 0 | J1533: 0 | K1533: 29.800000000000001 | L1533: 0 | M1533: =SUM(J1533:L1533)-2.76 -> 27.039999999999999 | N1533: 2.7599999999999998 | O1533: =SUM(M1533:N1533) -> 29.799999999999997
A1534: 5175 | B1534: UTE NARDINI (CARGA) | C1534: 48.708.267/0015-60 | D1534: 11.44 | E1534: 0 | F1534: 0 | G1534: 0 | H1534: 0 | I1534: 0 | J1534: 0 | K1534: 12.609999999999999 | L1534: 0 | M1534: =SUM(J1534:L1534)-1.17 -> 11.44 | N1534: 1.1699999999999999 | O1534: =SUM(M1534:N1534) -> 12.609999999999999
A1535: 5176 | B1535: ALPEK | C1535: 08.220.101/0001-80 | D1535: 350.42000000000002 | E1535: 0 | F1535: 0 | G1535: 0 | H1535: 0 | I1535: 0 | J1535: 0 | K1535: 386.13999999999999 | L1535: 0 | M1535: =SUM(J1535:L1535)-35.72 -> 350.41999999999996 | N1535: 35.719999999999999 | O1535: =SUM(M1535:N1535) -> 386.13999999999999
A1536: 5177 | B1536: ARAGUAIA NM | C1536: 97.515.035/0007-90 | D1536: 628.34000000000003 | E1536: 0 | F1536: 0 | G1536: 0 | H1536: 0 | I1536: 0 | J1536: 0 | K1536: 692.38999999999999 | L1536: 0 | M1536: =SUM(J1536:L1536)-64.05 -> 628.34000000000003 | N1536: 64.049999999999997 | O1536: =SUM(M1536:N1536) -> 692.38999999999999
A1537: 5178 | B1537: GERDAU ARAUCÁRIA | C1537: 07.358.761/0048-22 | D1537: 274.81 | E1537: 0 | F1537: 0 | G1537: 0 | H1537: 0 | I1537: 0 | J1537: 0 | K1537: 302.81999999999999 | L1537: 0 | M1537: =SUM(J1537:L1537)-28.01 -> 274.81 | N1537: 28.010000000000002 | O1537: =SUM(M1537:N1537) -> 302.81999999999999
A1538: 5179 | B1538: PERÓXIDOS | C1538: 51.784.262/0001-25 | D1538: 129.63999999999999 | E1538: 0 | F1538: 0 | G1538: 0 | H1538: 0 | I1538: 0 | J1538: 0 | K1538: 142.84999999999999 | L1538: 0 | M1538: =SUM(J1538:L1538)-13.21 -> 129.63999999999999 | N1538: 13.210000000000001 | O1538: =SUM(M1538:N1538) -> 142.84999999999999
A1539: 5180 | B1539: UTE ASOLO 2 (CARGA) | C1539: 41.675.130/0001-01 | D1539: 0.55000000000000004 | E1539: 0 | F1539: 0 | G1539: 0 | H1539: 0 | I1539: 0 | J1539: 0 | K1539: 0.60999999999999999 | L1539: 0 | M1539: =SUM(J1539:L1539)-0.06 -> 0.55000000000000004 | N1539: 5.9999999999999998e-002 | O1539: =SUM(M1539:N1539) -> 0.6100000000000001
A1540: 5181 | B1540: WHB AUTOMOTIVE | C1540: 01.261.681/0001-04 | D1540: 304.41000000000003 | E1540: 0 | F1540: 0 | G1540: 0 | H1540: 0 | I1540: 0 | J1540: 0 | K1540: 335.44 | L1540: 0 | M1540: =SUM(J1540:L1540)-31.03 -> 304.40999999999997 | N1540: 31.030000000000001 | O1540: =SUM(M1540:N1540) -> 335.43999999999994
A1541: 5182 | B1541: UTE PORTO DAS AGUAS II (CARGA) | C1541: 08.322.396/0001-03 | D1541: 5.7199999999999998 | E1541: 0 | F1541: 0 | G1541: 0 | H1541: 0 | I1541: 0 | J1541: 0 | K1541: 6.2999999999999998 | L1541: 0 | M1541: =SUM(J1541:L1541)-0.58 -> 5.7199999999999998 | N1541: 0.57999999999999996 | O1541: =SUM(M1541:N1541) -> 6.2999999999999998
A1542: 6012 | B1542: TRADENER | C1542: 02.691.745/0001-70 | D1542: 1534.03 | E1542: 0 | F1542: 0 | G1542: 0 | H1542: 0 | I1542: 0 | J1542: 1690.3900000000001 | K1542: 0 | L1542: 0 | M1542: =SUM(J1542:L1542)-156.36 -> 1534.0300000000002 | N1542: 156.36000000000001 | O1542: =SUM(M1542:N1542) -> 1690.3900000000003
A1543: 8002 | B1543: BRASKEM(COPENE)-PL | C1543: 42.150.391/0001-70 | D1543: 1046.26 | E1543: 0 | F1543: 0 | G1543: 0 | H1543: 0 | I1543: 0 | J1543: 0 | K1543: 1152.9000000000001 | L1543: 0 | M1543: =SUM(J1543:L1543)-106.64 -> 1046.26 | N1543: 106.64 | O1543: =SUM(M1543:N1543) -> 1152.9000000000001
A1544: 8003 | B1544: BRASKEM(UCS-AL)-PL | C1544: 42.150.391/0022-03 | D1544: 1304 | E1544: 0 | F1544: 0 | G1544: 0 | H1544: 0 | I1544: 0 | J1544: 0 | K1544: 1436.9100000000001 | L1544: 0 | M1544: =SUM(J1544:L1544)-132.91 -> 1304 | N1544: 132.91 | O1544: =SUM(M1544:N1544) -> 1436.9100000000001
A1545: 8005 | B1545: PARANAPANEMA(CAR. METAIS)-PL | C1545: 60.398.369/0004-79 | D1545: 334.85000000000002 | E1545: 0 | F1545: 0 | G1545: 0 | H1545: 0 | I1545: 0 | J1545: 0 | K1545: 368.98000000000002 | L1545: 0 | M1545: =SUM(J1545:L1545)-34.13 -> 334.85000000000002 | N1545: 34.130000000000003 | O1545: =SUM(M1545:N1545) -> 368.98000000000002
A1546: 8006 | B1546: DOW-PL | C1546: 60.435.351/0017-14 | D1546: 1035.3900000000001 | E1546: 0 | F1546: 0 | G1546: 0 | H1546: 0 | I1546: 0 | J1546: 0 | K1546: 1140.9300000000001 | L1546: 0 | M1546: =SUM(J1546:L1546)-105.54 -> 1035.3900000000001 | N1546: 105.54000000000001 | O1546: =SUM(M1546:N1546) -> 1140.9300000000001
A1547: 8008 | B1547: FERBASA-PL | C1547: 15.141.799/0001-03 | D1547: 1932.8199999999999 | E1547: 0 | F1547: 0 | G1547: 0 | H1547: 0 | I1547: 0 | J1547: 0 | K1547: 2129.8299999999999 | L1547: 0 | M1547: =SUM(J1547:L1547)-197.01 -> 1932.8199999999999 | N1547: 197.00999999999999 | O1547: =SUM(M1547:N1547) -> 2129.8299999999999
A1548: 8009 | B1548: GERDAU(AÇONORTE)-PL | C1548: 07.358.761/0051-28 | D1548: 180.69999999999999 | E1548: 0 | F1548: 0 | G1548: 0 | H1548: 0 | I1548: 0 | J1548: 0 | K1548: 199.12 | L1548: 0 | M1548: =SUM(J1548:L1548)-18.42 -> 180.69999999999999 | N1548: 18.420000000000002 | O1548: =SUM(M1548:N1548) -> 199.12
A1549: 8010 | B1549: GERDAU(USIBA)-PL | C1549: 07.358.761/0005-92 | D1549: 17.18 | E1549: 0 | F1549: 0 | G1549: 0 | H1549: 0 | I1549: 0 | J1549: 0 | K1549: 18.93 | L1549: 0 | M1549: =SUM(J1549:L1549)-1.75 -> 17.18 | N1549: 1.75 | O1549: =SUM(M1549:N1549) -> 18.93
A1550: 8011 | B1550: LIBRA-PL | C1550: 10.500.221/0001-82 | D1550: 47.149999999999999 | E1550: 0 | F1550: 0 | G1550: 0 | H1550: 0 | I1550: 0 | J1550: 0 | K1550: 51.960000000000001 | L1550: 0 | M1550: =SUM(J1550:L1550)-4.81 -> 47.149999999999999 | N1550: 4.8099999999999996 | O1550: =SUM(M1550:N1550) -> 51.960000000000001
A1551: 8012 | B1551: MINERAÇÃO CARAÍBA-PL | C1551: 42.509.257/0001-13 | D1551: 192.63 | E1551: 0 | F1551: 0 | G1551: 0 | H1551: 0 | I1551: 0 | J1551: 0 | K1551: 212.25999999999999 | L1551: 0 | M1551: =SUM(J1551:L1551)-19.63 -> 192.63 | N1551: 19.629999999999999 | O1551: =SUM(M1551:N1551) -> 212.25999999999999
A1552: 8013 | B1552: VALE MANGANES (RDM)-PL | C1552: 15.144.306/0001-99 | D1552: 0 | E1552: 0 | F1552: 0 | G1552: 0 | H1552: 0 | I1552: 0 | J1552: 0 | K1552: 0 | L1552: 0 | M1552: =SUM(J1552:L1552)-0 -> 0 | N1552: 0 | O1552: =SUM(M1552:N1552) -> 0
A1553: 8014 | B1553: HNK(P. SCHINCARIOL)-PL | C1553: 50.221.019/0057-90 | D1553: 91.909999999999997 | E1553: 0 | F1553: 0 | G1553: 0 | H1553: 0 | I1553: 0 | J1553: 0 | K1553: 101.28 | L1553: 0 | M1553: =SUM(J1553:L1553)-9.37 -> 91.909999999999997 | N1553: 9.3699999999999992 | O1553: =SUM(M1553:N1553) -> 101.28
A1554: 8015 | B1554: ALUNORTE-PL | C1554: 05.848.387/0003-16 | D1554: 2254.6700000000001 | E1554: 0 | F1554: 0 | G1554: 0 | H1554: 0 | I1554: 0 | J1554: 0 | K1554: 2484.48 | L1554: 0 | M1554: =SUM(J1554:L1554)-229.81 -> 2254.6700000000001 | N1554: 229.81 | O1554: =SUM(M1554:N1554) -> 2484.48
A1555: 8016 | B1555: VALE(MINA)-PL | C1555: 33.592.510/0370-74 | D1555: 261.97000000000003 | E1555: 0 | F1555: 0 | G1555: 0 | H1555: 0 | I1555: 0 | J1555: 0 | K1555: 288.67000000000002 | L1555: 0 | M1555: =SUM(J1555:L1555)-26.7 -> 261.97000000000003 | N1555: 26.699999999999999 | O1555: =SUM(M1555:N1555) -> 288.67000000000002
A1556: 8017 | B1556: VALE(SOSSEGO)-PL | C1556: 33.931.478/0009-41 | D1556: 169.13999999999999 | E1556: 0 | F1556: 0 | G1556: 0 | H1556: 0 | I1556: 0 | J1556: 0 | K1556: 186.38 | L1556: 0 | M1556: =SUM(J1556:L1556)-17.24 -> 169.13999999999999 | N1556: 17.239999999999998 | O1556: =SUM(M1556:N1556) -> 186.38
A1557: 8019 | B1557: VALE(PORTO)-PL | C1557: 33.592.510/0424-00 | D1557: 478.38999999999999 | E1557: 0 | F1557: 0 | G1557: 0 | H1557: 0 | I1557: 0 | J1557: 0 | K1557: 527.14999999999998 | L1557: 0 | M1557: =SUM(J1557:L1557)-48.76 -> 478.38999999999999 | N1557: 48.759999999999998 | O1557: =SUM(M1557:N1557) -> 527.14999999999998
A1558: 8020 | B1558: PALMYRA(DOW CORNING)-PL | C1558: 04.872.297/0001-36 | D1558: 424.91000000000003 | E1558: 0 | F1558: 0 | G1558: 0 | H1558: 0 | I1558: 0 | J1558: 0 | K1558: 468.22000000000003 | L1558: 0 | M1558: =SUM(J1558:L1558)-43.31 -> 424.91000000000003 | N1558: 43.310000000000002 | O1558: =SUM(M1558:N1558) -> 468.22000000000003
A1559: Total Geral | D1559: =SUM(D17:D1558) -> 1521880.8599999975 | E1559: =SUM(E17:E1558) -> 532905.59999999998 | F1559: =SUM(F17:F1558) -> 0 | G1559: =SUM(G17:G1558) -> 0 | H1559: =SUM(H17:H1558) -> 0 | I1559: =SUM(I17:I1558) -> 0 | J1559: =SUM(J17:J1558) -> 234980.40000000002 | K1559: =SUM(K17:K1558) -> 1805037.7400000056 | L1559: =SUM(L17:L1558) -> 224209.34 | M1559: =SUM(M17:M1558) -> 2054786.4599999974 | N1559: =SUM(N17:N1558) -> 209441.01999999993 | O1559: =SUM(O17:O1558) -> 2264227.4799999963