B1: Relatório de Aviso de Crédito
A2: 1067 | B2: Empresa: ELETROSUL (SE MISSÕES) | D2: Número AVC: | E2: 33872
D4: Receita Anual Permitida | E4: 3536103.3599999999
D5: Recebimento Mensal (receita Anual/12) | E5: 294675.28000000003
D6: Receita Permitida | E6: 294675.28000000003
D7: PIS/PASEP e COFINS * | E7: 53765.809999999903
D8: Antecipação | E8: -12214.610000000001
D9: Parcela de Ajuste do Ciclo Anterior | E9: -5810.8199999999997
D10: Receita Melhorias RMEL | E10: 74.890000000000001
D11: Receita de novas obras RBNI | E11: 5416.1899999999996
D12: Rede de Fronteira | E12: 227906.47
D13: Total s/ PIS/PASEP e COFINS | E13: 510047.40000000002
D14: Total c/ PIS/PASEP e COFINS | E14: 563813.20999999985
D16: * Alíquota PIS/PASEP e COFINS = 9,25% (com RGR = 2,60%)
B18: Usuárias | C18: CNPJ | D18: Rede Básica | E18: Total de Fronteira | F18: Quota Proinfa | G18: Quota CCC Sist. Interligado | H18: Quota CCC Sist. Isolado | I18: Quota CDE | J18: 1a. Parcela dia 15/11/2023 | K18: 2a. Parcela dia 25/11/2023 | L18: 3a. Parcela dia 05/12/2023 | M18: Total s/ PIS/PASEP e COFINS | N18: PIS/PASEP e COFINS | O18: Total c/ PIS/PASEP e COFINS
A19: 2001 | B19: RGE SUL (AES-SUL) | C19: 02.016.440/0001-62 | D19: 7656.1199999999999 | E19: 135121.47 | F19: 0 | G19: 0 | H19: 0 | I19: 0 | J19: 0 | K19: 157828.22 | L19: 0 | M19: =SUM(J19:L19)-15050.63 -> 142777.59 | N19: 15050.629999999999 | O19: =SUM(M19:N19) -> 157828.22
A20: 2002 | B20: EDP SAO PAULO (BANDEIRANTE) | C20: 02.302.100/0001-06 | D20: 5188.7299999999996 | E20: 0 | F20: 0 | G20: 0 | H20: 0 | I20: 0 | J20: 0 | K20: 5735.6899999999996 | L20: 0 | M20: =SUM(J20:L20)-546.96 -> 5188.7299999999996 | N20: 546.96000000000004 | O20: =SUM(M20:N20) -> 5735.6899999999996
A21: 2004 | B21: ENERGISA SUL-SUDESTE | C21: 07.282.377/0001-20 | D21: 1322.8499999999999 | E21: 0 | F21: 0 | G21: 0 | H21: 0 | I21: 0 | J21: 0 | K21: 1462.3 | L21: 0 | M21: =SUM(J21:L21)-139.45 -> 1322.8499999999999 | N21: 139.44999999999999 | O21: =SUM(M21:N21) -> 1462.3
A22: 2006 | B22: CBA | C22: 61.409.892/0003-35 | D22: 88.079999999999998 | E22: 0 | F22: 0 | G22: 0 | H22: 0 | I22: 0 | J22: 0 | K22: 97.359999999999999 | L22: 0 | M22: =SUM(J22:L22)-9.28 -> 88.079999999999998 | N22: 9.2799999999999994 | O22: =SUM(M22:N22) -> 97.359999999999999
A23: 2007 | B23: EQUATORIAL ALAGOAS (CEAL) | C23: 12.272.084/0001-00 | D23: 1815.6900000000001 | E23: 0 | F23: 0 | G23: 0 | H23: 0 | I23: 0 | J23: 0 | K23: 2007.0899999999999 | L23: 0 | M23: =SUM(J23:L23)-191.4 -> 1815.6899999999998 | N23: 191.40000000000001 | O23: =SUM(M23:N23) -> 2007.0899999999999
A24: 2008 | B24: CEB | C24: 07.522.669/0001-92 | D24: 2295.5100000000002 | E24: 0 | F24: 0 | G24: 0 | H24: 0 | I24: 0 | J24: 0 | K24: 2537.4899999999998 | L24: 0 | M24: =SUM(J24:L24)-241.98 -> 2295.5099999999998 | N24: 241.97999999999999 | O24: =SUM(M24:N24) -> 2537.4899999999998
A25: 2009 | B25: CEEE-D | C25: 08.467.115/0001-00 | D25: 4961.0299999999997 | E25: 0 | F25: 0 | G25: 0 | H25: 0 | I25: 0 | J25: 0 | K25: 5483.9899999999998 | L25: 0 | M25: =SUM(J25:L25)-522.96 -> 4961.0299999999997 | N25: 522.96000000000004 | O25: =SUM(M25:N25) -> 5483.9899999999998
A26: 2011 | B26: CELESC | C26: 08.336.783/0001-90 | D26: 10769.82 | E26: 0 | F26: 0 | G26: 0 | H26: 0 | I26: 0 | J26: 0 | K26: 11905.1 | L26: 0 | M26: =SUM(J26:L26)-1135.28 -> 10769.82 | N26: 1135.28 | O26: =SUM(M26:N26) -> 11905.1
A27: 2012 | B27: CELG-D | C27: 01.543.032/0001-04 | D27: 4509.8199999999997 | E27: 0 | F27: 0 | G27: 0 | H27: 0 | I27: 0 | J27: 0 | K27: 4985.21 | L27: 0 | M27: =SUM(J27:L27)-475.39 -> 4509.8199999999997 | N27: 475.38999999999999 | O27: =SUM(M27:N27) -> 4985.21
A28: 2013 | B28: EQUATORIAL PARA (CELPA) | C28: 04.895.728/0001-80 | D28: 4350.6700000000001 | E28: 0 | F28: 0 | G28: 0 | H28: 0 | I28: 0 | J28: 0 | K28: 4809.29 | L28: 0 | M28: =SUM(J28:L28)-458.62 -> 4350.6700000000001 | N28: 458.62 | O28: =SUM(M28:N28) -> 4809.29
A29: 2014 | B29: CELPE | C29: 10.835.932/0001-08 | D29: 4333.4300000000003 | E29: 0 | F29: 0 | G29: 0 | H29: 0 | I29: 0 | J29: 0 | K29: 4790.2299999999996 | L29: 0 | M29: =SUM(J29:L29)-456.8 -> 4333.4299999999994 | N29: 456.80000000000001 | O29: =SUM(M29:N29) -> 4790.2299999999996
A30: 2016 | B30: ENERGISA TO (CELTINS) | C30: 25.086.034/0001-71 | D30: 750.64999999999998 | E30: 0 | F30: 0 | G30: 0 | H30: 0 | I30: 0 | J30: 0 | K30: 829.77999999999997 | L30: 0 | M30: =SUM(J30:L30)-79.13 -> 750.64999999999998 | N30: 79.129999999999995 | O30: =SUM(M30:N30) -> 829.77999999999997
A31: 2017 | B31: EQUATORIAL MARANHÃO (CEMAR) | C31: 06.272.793/0001-84 | D31: 2393.0799999999999 | E31: 0 | F31: 0 | G31: 0 | H31: 0 | I31: 0 | J31: 0 | K31: 2645.3400000000001 | L31: 0 | M31: =SUM(J31:L31)-252.26 -> 2393.0799999999999 | N31: 252.25999999999999 | O31: =SUM(M31:N31) -> 2645.3400000000001
A32: 2018 | B32: ENERGISA MT (CEMAT) | C32: 03.467.321/0001-99 | D32: 2832.1799999999998 | E32: 0 | F32: 0 | G32: 0 | H32: 0 | I32: 0 | J32: 0 | K32: 3130.73 | L32: 0 | M32: =SUM(J32:L32)-298.55 -> 2832.1799999999998 | N32: 298.55000000000001 | O32: =SUM(M32:N32) -> 3130.73
A33: 2019 | B33: CEMIG-D | C33: 06.981.180/0001-16 | D33: 15112.65 | E33: 0 | F33: 0 | G33: 0 | H33: 0 | I33: 0 | J33: 0 | K33: 16705.720000000001 | L33: 0 | M33: =SUM(J33:L33)-1593.07 -> 15112.650000000001 | N33: 1593.0699999999999 | O33: =SUM(M33:N33) -> 16705.720000000001
A34: 2020 | B34: EQUATORIAL PIAUI (CEPISA) | C34: 06.840.748/0001-89 | D34: 1547.1800000000001 | E34: 0 | F34: 0 | G34: 0 | H34: 0 | I34: 0 | J34: 0 | K34: 1710.27 | L34: 0 | M34: =SUM(J34:L34)-163.09 -> 1547.1800000000001 | N34: 163.09 | O34: =SUM(M34:N34) -> 1710.27
A35: 2021 | B35: AMPLA | C35: 33.050.071/0001-58 | D35: 4624.7299999999996 | E35: 0 | F35: 0 | G35: 0 | H35: 0 | I35: 0 | J35: 0 | K35: 5112.2399999999998 | L35: 0 | M35: =SUM(J35:L35)-487.51 -> 4624.7299999999996 | N35: 487.50999999999999 | O35: =SUM(M35:N35) -> 5112.2399999999998
A36: 2024 | B36: JAGUARI | C36: 53.859.112/0001-69 | D36: 1132.6099999999999 | E36: 0 | F36: 0 | G36: 0 | H36: 0 | I36: 0 | J36: 0 | K36: 1252 | L36: 0 | M36: =SUM(J36:L36)-119.39 -> 1132.6099999999999 | N36: 119.39 | O36: =SUM(M36:N36) -> 1252
A37: 2025 | B37: COELBA-D | C37: 15.139.629/0001-94 | D37: 7901.1300000000001 | E37: 0 | F37: 0 | G37: 0 | H37: 0 | I37: 0 | J37: 0 | K37: 8734.0100000000002 | L37: 0 | M37: =SUM(J37:L37)-832.88 -> 7901.1300000000001 | N37: 832.88 | O37: =SUM(M37:N37) -> 8734.0100000000002
A38: 2026 | B38: COELCE | C38: 07.047.251/0001-70 | D38: 3175.5700000000002 | E38: 0 | F38: 0 | G38: 0 | H38: 0 | I38: 0 | J38: 0 | K38: 3510.3200000000002 | L38: 0 | M38: =SUM(J38:L38)-334.75 -> 3175.5700000000002 | N38: 334.75 | O38: =SUM(M38:N38) -> 3510.3200000000002
A39: 2027 | B39: COPEL-D | C39: 04.368.898/0001-06 | D39: 14130.66 | E39: 0 | F39: 0 | G39: 0 | H39: 0 | I39: 0 | J39: 0 | K39: 15620.219999999999 | L39: 0 | M39: =SUM(J39:L39)-1489.56 -> 14130.66 | N39: 1489.5599999999999 | O39: =SUM(M39:N39) -> 15620.219999999999
A40: 2028 | B40: COSERN | C40: 08.324.196/0001-81 | D40: 1532.29 | E40: 0 | F40: 0 | G40: 0 | H40: 0 | I40: 0 | J40: 0 | K40: 1693.8099999999999 | L40: 0 | M40: =SUM(J40:L40)-161.52 -> 1532.29 | N40: 161.52000000000001 | O40: =SUM(M40:N40) -> 1693.8099999999999
A41: 2030 | B41: CPFL-D | C41: 33.050.196/0001-88 | D41: 9921.9200000000001 | E41: 0 | F41: 0 | G41: 0 | H41: 0 | I41: 0 | J41: 0 | K41: 10967.82 | L41: 0 | M41: =SUM(J41:L41)-1045.9 -> 9921.9200000000001 | N41: 1045.9000000000001 | O41: =SUM(M41:N41) -> 10967.82
A42: 2032 | B42: DME | C42: 23.664.303/0001-04 | D42: 129.31999999999999 | E42: 0 | F42: 0 | G42: 0 | H42: 0 | I42: 0 | J42: 0 | K42: 142.94999999999999 | L42: 0 | M42: =SUM(J42:L42)-13.63 -> 129.31999999999999 | N42: 13.630000000000001 | O42: =SUM(M42:N42) -> 142.94999999999999
A43: 2033 | B43: ELEKTRO | C43: 02.328.280/0001-97 | D43: 6072.5200000000004 | E43: 0 | F43: 0 | G43: 0 | H43: 0 | I43: 0 | J43: 0 | K43: 6712.6400000000003 | L43: 0 | M43: =SUM(J43:L43)-640.12 -> 6072.5200000000004 | N43: 640.12 | O43: =SUM(M43:N43) -> 6712.6400000000003
A44: 2035 | B44: ELETROPAULO | C44: 61.695.227/0001-93 | D44: 13225.52 | E44: 0 | F44: 0 | G44: 0 | H44: 0 | I44: 0 | J44: 0 | K44: 14619.66 | L44: 0 | M44: =SUM(J44:L44)-1394.14 -> 13225.52 | N44: 1394.1400000000001 | O44: =SUM(M44:N44) -> 14619.66
A45: 2036 | B45: ENERGISA SE (ENERGIPE) | C45: 13.017.462/0001-63 | D45: 734.37 | E45: 0 | F45: 0 | G45: 0 | H45: 0 | I45: 0 | J45: 0 | K45: 811.77999999999997 | L45: 0 | M45: =SUM(J45:L45)-77.41 -> 734.37 | N45: 77.409999999999997 | O45: =SUM(M45:N45) -> 811.77999999999997
A46: 2037 | B46: ENERGISA MS (ENERSUL) | C46: 15.413.826/0001-50 | D46: 1927.3399999999999 | E46: 0 | F46: 0 | G46: 0 | H46: 0 | I46: 0 | J46: 0 | K46: 2130.5100000000002 | L46: 0 | M46: =SUM(J46:L46)-203.17 -> 1927.3400000000001 | N46: 203.16999999999999 | O46: =SUM(M46:N46) -> 2130.5100000000002
A47: 2038 | B47: EDP ES | C47: 28.152.650/0001-71 | D47: 2847.4099999999999 | E47: 0 | F47: 0 | G47: 0 | H47: 0 | I47: 0 | J47: 0 | K47: 3147.5599999999999 | L47: 0 | M47: =SUM(J47:L47)-300.15 -> 2847.4099999999999 | N47: 300.14999999999998 | O47: =SUM(M47:N47) -> 3147.5599999999999
A48: 2040 | B48: LIGHT-D | C48: 60.444.437/0001-46 | D48: 8724.5499999999993 | E48: 0 | F48: 0 | G48: 0 | H48: 0 | I48: 0 | J48: 0 | K48: 9644.2299999999996 | L48: 0 | M48: =SUM(J48:L48)-919.68 -> 8724.5499999999993 | N48: 919.67999999999995 | O48: =SUM(M48:N48) -> 9644.2299999999996
A49: 2042 | B49: PIRATININGA | C49: 04.172.213/0001-51 | D49: 4304.8000000000002 | E49: 0 | F49: 0 | G49: 0 | H49: 0 | I49: 0 | J49: 0 | K49: 4758.5799999999999 | L49: 0 | M49: =SUM(J49:L49)-453.78 -> 4304.8000000000002 | N49: 453.77999999999997 | O49: =SUM(M49:N49) -> 4758.5799999999999
A50: 2044 | B50: ENERGISA PB (SAELPA) | C50: 09.095.183/0001-40 | D50: 1507.97 | E50: 0 | F50: 0 | G50: 0 | H50: 0 | I50: 0 | J50: 0 | K50: 1666.9300000000001 | L50: 0 | M50: =SUM(J50:L50)-158.96 -> 1507.97 | N50: 158.96000000000001 | O50: =SUM(M50:N50) -> 1666.9300000000001
A51: 2048 | B51: SULGIPE | C51: 13.255.658/0001-96 | D51: 120.61 | E51: 0 | F51: 0 | G51: 0 | H51: 0 | I51: 0 | J51: 0 | K51: 133.31999999999999 | L51: 0 | M51: =SUM(J51:L51)-12.71 -> 120.60999999999999 | N51: 12.710000000000001 | O51: =SUM(M51:N51) -> 133.31999999999999
A52: 2050 | B52: ELFSM | C52: 27.485.069/0001-09 | D52: 126.88 | E52: 0 | F52: 0 | G52: 0 | H52: 0 | I52: 0 | J52: 0 | K52: 140.25 | L52: 0 | M52: =SUM(J52:L52)-13.37 -> 126.88 | N52: 13.369999999999999 | O52: =SUM(M52:N52) -> 140.25
A53: 2051 | B53: ENERGISA MG (CFLCL) | C53: 19.527.639/0001-58 | D53: 222.99000000000001 | E53: 0 | F53: 0 | G53: 0 | H53: 0 | I53: 0 | J53: 0 | K53: 246.5 | L53: 0 | M53: =SUM(J53:L53)-23.51 -> 222.99000000000001 | N53: 23.510000000000002 | O53: =SUM(M53:N53) -> 246.5
A54: 2052 | B54: DCELT (IGUAÇÚ) | C54: 83.855.973/0001-30 | D54: 5.7000000000000002 | E54: 0 | F54: 0 | G54: 0 | H54: 0 | I54: 0 | J54: 0 | K54: 6.2999999999999998 | L54: 0 | M54: =SUM(J54:L54)-0.6 -> 5.7000000000000002 | N54: 0.59999999999999998 | O54: =SUM(M54:N54) -> 6.2999999999999998
A55: 2053 | B55: ENERGISA AC (ELETROACRE) | C55: 04.065.033/0001-70 | D55: 168.41999999999999 | E55: 0 | F55: 0 | G55: 0 | H55: 0 | I55: 0 | J55: 0 | K55: 186.16999999999999 | L55: 0 | M55: =SUM(J55:L55)-17.75 -> 168.41999999999999 | N55: 17.75 | O55: =SUM(M55:N55) -> 186.16999999999999
A56: 2054 | B56: ENERGISA RONDONIA (CERON) | C56: 05.914.650/0001-66 | D56: 753.97000000000003 | E56: 0 | F56: 0 | G56: 0 | H56: 0 | I56: 0 | J56: 0 | K56: 833.45000000000005 | L56: 0 | M56: =SUM(J56:L56)-79.48 -> 753.97000000000003 | N56: 79.480000000000004 | O56: =SUM(M56:N56) -> 833.45000000000005
A57: 2055 | B57: COPREL | C57: 90.660.754/0001-60 | D57: 89.079999999999998 | E57: 0 | F57: 0 | G57: 0 | H57: 0 | I57: 0 | J57: 0 | K57: 98.469999999999999 | L57: 0 | M57: =SUM(J57:L57)-9.39 -> 89.079999999999998 | N57: 9.3900000000000006 | O57: =SUM(M57:N57) -> 98.469999999999999
A58: 2057 | B58: HIDROPAN | C58: 91.982.348/0001-87 | D58: 43.939999999999998 | E58: 0 | F58: 0 | G58: 0 | H58: 0 | I58: 0 | J58: 0 | K58: 48.57 | L58: 0 | M58: =SUM(J58:L58)-4.63 -> 43.939999999999998 | N58: 4.6299999999999999 | O58: =SUM(M58:N58) -> 48.57
A59: 2058 | B59: ELETROCAR | C59: 88.446.034/0001-55 | D59: 79.530000000000001 | E59: 0 | F59: 0 | G59: 0 | H59: 0 | I59: 0 | J59: 0 | K59: 87.909999999999997 | L59: 0 | M59: =SUM(J59:L59)-8.38 -> 79.530000000000001 | N59: 8.3800000000000008 | O59: =SUM(M59:N59) -> 87.909999999999997
A60: 2059 | B60: CERTAJA | C60: 97.839.922/0001-29 | D60: 46.649999999999999 | E60: 0 | F60: 0 | G60: 0 | H60: 0 | I60: 0 | J60: 0 | K60: 51.57 | L60: 0 | M60: =SUM(J60:L60)-4.92 -> 46.649999999999999 | N60: 4.9199999999999999 | O60: =SUM(M60:N60) -> 51.57
A61: 2060 | B61: DEMEI | C61: 95.289.500/0001-00 | D61: 112 | E61: 0 | F61: 0 | G61: 0 | H61: 0 | I61: 0 | J61: 0 | K61: 123.81 | L61: 0 | M61: =SUM(J61:L61)-11.81 -> 112 | N61: 11.81 | O61: =SUM(M61:N61) -> 123.81
A62: 2061 | B62: CERILUZ | C62: 87.656.989/0001-74 | D62: 32.399999999999999 | E62: 0 | F62: 0 | G62: 0 | H62: 0 | I62: 0 | J62: 0 | K62: 35.82 | L62: 0 | M62: =SUM(J62:L62)-3.42 -> 32.399999999999999 | N62: 3.4199999999999999 | O62: =SUM(M62:N62) -> 35.82
A63: 2063 | B63: COOPERA | C63: 83.646.653/0001-70 | D63: 91.519999999999996 | E63: 0 | F63: 0 | G63: 0 | H63: 0 | I63: 0 | J63: 0 | K63: 101.17 | L63: 0 | M63: =SUM(J63:L63)-9.65 -> 91.519999999999996 | N63: 9.6500000000000004 | O63: =SUM(M63:N63) -> 101.17
A64: 2064 | B64: CEA-D | C64: 05.965.546/0001-09 | D64: 340.27999999999997 | E64: 0 | F64: 0 | G64: 0 | H64: 0 | I64: 0 | J64: 0 | K64: 376.14999999999998 | L64: 0 | M64: =SUM(J64:L64)-35.87 -> 340.27999999999997 | N64: 35.869999999999997 | O64: =SUM(M64:N64) -> 376.14999999999998
A65: 2065 | B65: AMAZONAS-D | C65: 02.341.467/0001-20 | D65: 2206.3499999999999 | E65: 0 | F65: 0 | G65: 0 | H65: 0 | I65: 0 | J65: 0 | K65: 2438.9299999999998 | L65: 0 | M65: =SUM(J65:L65)-232.58 -> 2206.3499999999999 | N65: 232.58000000000001 | O65: =SUM(M65:N65) -> 2438.9299999999998
A66: 2066 | B66: COOPERLUZ | C66: 95.824.322/0001-61 | D66: 29.859999999999999 | E66: 0 | F66: 0 | G66: 0 | H66: 0 | I66: 0 | J66: 0 | K66: 33.009999999999998 | L66: 0 | M66: =SUM(J66:L66)-3.15 -> 29.859999999999999 | N66: 3.1499999999999999 | O66: =SUM(M66:N66) -> 33.009999999999998
A67: 2067 | B67: NOVA PALMA | C67: 89.889.604/0001-44 | D67: 2.1200000000000001 | E67: 0 | F67: 0 | G67: 0 | H67: 0 | I67: 0 | J67: 0 | K67: 2.3399999999999999 | L67: 0 | M67: =SUM(J67:L67)-0.22 -> 2.1199999999999997 | N67: 0.22 | O67: =SUM(M67:N67) -> 2.3399999999999999
A68: 2068 | B68: CHESP(SÃO PATRÍCIO) | C68: 01.377.555/0001-10 | D68: 43.850000000000001 | E68: 0 | F68: 0 | G68: 0 | H68: 0 | I68: 0 | J68: 0 | K68: 48.469999999999999 | L68: 0 | M68: =SUM(J68:L68)-4.62 -> 43.850000000000001 | N68: 4.6200000000000001 | O68: =SUM(M68:N68) -> 48.469999999999999
A69: 2069 | B69: FORCEL | C69: 79.850.574/0001-09 | D69: 1.24 | E69: 0 | F69: 0 | G69: 0 | H69: 0 | I69: 0 | J69: 0 | K69: 1.3700000000000001 | L69: 0 | M69: =SUM(J69:L69)-0.13 -> 1.2400000000000002 | N69: 0.13 | O69: =SUM(M69:N69) -> 1.3700000000000001
A70: 2070 | B70: MUXENERGIA | C70: 97.578.090/0001-34 | D70: 1.8700000000000001 | E70: 0 | F70: 0 | G70: 0 | H70: 0 | I70: 0 | J70: 0 | K70: 2.0699999999999998 | L70: 0 | M70: =SUM(J70:L70)-0.2 -> 1.8699999999999999 | N70: 0.20000000000000001 | O70: =SUM(M70:N70) -> 2.0699999999999998
A71: 2071 | B71: CERMISSÕES | C71: 97.081.434/0001-03 | D71: 34.549999999999997 | E71: 92785 | F71: 0 | G71: 0 | H71: 0 | I71: 0 | J71: 34201.32 | K71: 34201.32 | L71: 34201.309999999998 | M71: =SUM(J71:L71)-9784.4 -> 92819.550000000003 | N71: 9784.3999999999996 | O71: =SUM(M71:N71) -> 102603.95
A72: 2072 | B72: COCEL | C72: 75.805.895/0001-30 | D72: 7 | E72: 0 | F72: 0 | G72: 0 | H72: 0 | I72: 0 | J72: 0 | K72: 7.7400000000000002 | L72: 0 | M72: =SUM(J72:L72)-0.74 -> 7 | N72: 0.73999999999999999 | O72: =SUM(M72:N72) -> 7.7400000000000002
A73: 2073 | B73: CEMIRIM | C73: 52.777.034/0001-90 | D73: 34.740000000000002 | E73: 0 | F73: 0 | G73: 0 | H73: 0 | I73: 0 | J73: 0 | K73: 38.399999999999999 | L73: 0 | M73: =SUM(J73:L73)-3.66 -> 34.739999999999995 | N73: 3.6600000000000001 | O73: =SUM(M73:N73) -> 38.399999999999991
A74: 2074 | B74: CERTEL ENERGIA | C74: 09.257.558/0001-21 | D74: 169.58000000000001 | E74: 0 | F74: 0 | G74: 0 | H74: 0 | I74: 0 | J74: 0 | K74: 187.46000000000001 | L74: 0 | M74: =SUM(J74:L74)-17.88 -> 169.58000000000001 | N74: 17.879999999999999 | O74: =SUM(M74:N74) -> 187.46000000000001
A75: 2075 | B75: CERTHIL | C75: 98.042.963/0001-52 | D75: 24.219999999999999 | E75: 0 | F75: 0 | G75: 0 | H75: 0 | I75: 0 | J75: 0 | K75: 26.77 | L75: 0 | M75: =SUM(J75:L75)-2.55 -> 24.219999999999999 | N75: 2.5499999999999998 | O75: =SUM(M75:N75) -> 26.77
A76: 2076 | B76: COOPERALIANÇA | C76: 83.647.990/0001-81 | D76: 6.25 | E76: 0 | F76: 0 | G76: 0 | H76: 0 | I76: 0 | J76: 0 | K76: 6.9100000000000001 | L76: 0 | M76: =SUM(J76:L76)-0.66 -> 6.25 | N76: 0.66000000000000003 | O76: =SUM(M76:N76) -> 6.9100000000000001
A77: 2077 | B77: CERSUL | C77: 86.512.670/0001-02 | D77: 44.530000000000001 | E77: 0 | F77: 0 | G77: 0 | H77: 0 | I77: 0 | J77: 0 | K77: 49.219999999999999 | L77: 0 | M77: =SUM(J77:L77)-4.69 -> 44.530000000000001 | N77: 4.6900000000000004 | O77: =SUM(M77:N77) -> 49.219999999999999
A78: 2078 | B78: COOPERCOCAL | C78: 86.532.348/0001-45 | D78: 29.420000000000002 | E78: 0 | F78: 0 | G78: 0 | H78: 0 | I78: 0 | J78: 0 | K78: 32.520000000000003 | L78: 0 | M78: =SUM(J78:L78)-3.1 -> 29.420000000000002 | N78: 3.1000000000000001 | O78: =SUM(M78:N78) -> 32.520000000000003
A79: 3001 | B79: AES TIETÊ | C79: 00.194.724/0001-13 | D79: 1150.8599999999999 | E79: 0 | F79: 0 | G79: 0 | H79: 0 | I79: 0 | J79: 0 | K79: 1272.1800000000001 | L79: 0 | M79: =SUM(J79:L79)-121.32 -> 1150.8600000000001 | N79: 121.31999999999999 | O79: =SUM(M79:N79) -> 1272.1800000000001
A80: 3003 | B80: ALCOA (CONS. MACHADINHO) | C80: 23.637.697/0001-01 | D80: 206.00999999999999 | E80: 0 | F80: 0 | G80: 0 | H80: 0 | I80: 0 | J80: 0 | K80: 227.72999999999999 | L80: 0 | M80: =SUM(J80:L80)-21.72 -> 206.00999999999999 | N80: 21.719999999999999 | O80: =SUM(M80:N80) -> 227.72999999999999
A81: 3004 | B81: ARCELORMITTAL (CONS. GUILMAN AMORIM | C81: 17.469.701/0066-12 | D81: 34.700000000000003 | E81: 0 | F81: 0 | G81: 0 | H81: 0 | I81: 0 | J81: 0 | K81: 38.359999999999999 | L81: 0 | M81: =SUM(J81:L81)-3.66 -> 34.700000000000003 | N81: 3.6600000000000001 | O81: =SUM(M81:N81) -> 38.359999999999999
A82: 3005 | B82: MACHADINHO PART (CONS. MACHADINHO) | C82: 22.686.342/0001-40 | D82: 42.219999999999999 | E82: 0 | F82: 0 | G82: 0 | H82: 0 | I82: 0 | J82: 0 | K82: 46.670000000000002 | L82: 0 | M82: =SUM(J82:L82)-4.45 -> 42.219999999999999 | N82: 4.4500000000000002 | O82: =SUM(M82:N82) -> 46.670000000000002
A83: 3007 | B83: CBA (CONS. MACHADINHO) | C83: 24.241.083/0001-79 | D83: 220.25999999999999 | E83: 0 | F83: 0 | G83: 0 | H83: 0 | I83: 0 | J83: 0 | K83: 243.47999999999999 | L83: 0 | M83: =SUM(J83:L83)-23.22 -> 220.25999999999999 | N83: 23.219999999999999 | O83: =SUM(M83:N83) -> 243.47999999999999
A84: 3008 | B84: CBA (UHE PIRAJÚ) | C84: 61.409.892/0001-73 | D84: 51.189999999999998 | E84: 0 | F84: 0 | G84: 0 | H84: 0 | I84: 0 | J84: 0 | K84: 56.590000000000003 | L84: 0 | M84: =SUM(J84:L84)-5.4 -> 51.190000000000005 | N84: 5.4000000000000004 | O84: =SUM(M84:N84) -> 56.590000000000003
A85: 3009 | B85: CEB LAJEADO (CONS. LAJEADO) | C85: 03.677.638/0001-50 | D85: 145.77000000000001 | E85: 0 | F85: 0 | G85: 0 | H85: 0 | I85: 0 | J85: 0 | K85: 161.13999999999999 | L85: 0 | M85: =SUM(J85:L85)-15.37 -> 145.76999999999998 | N85: 15.369999999999999 | O85: =SUM(M85:N85) -> 161.13999999999999
A86: 3011 | B86: CEEE(CONS. DONA FRANCISCA) | C86: 39.881.421/0001-04 | D86: 13.02 | E86: 0 | F86: 0 | G86: 0 | H86: 0 | I86: 0 | J86: 0 | K86: 14.390000000000001 | L86: 0 | M86: =SUM(J86:L86)-1.37 -> 13.02 | N86: 1.3700000000000001 | O86: =SUM(M86:N86) -> 14.390000000000001
A87: 3012 | B87: CEEE(CONS. MACHADINHO) | C87: 39.881.421/0001-04 | D87: 44.259999999999998 | E87: 0 | F87: 0 | G87: 0 | H87: 0 | I87: 0 | J87: 0 | K87: 48.93 | L87: 0 | M87: =SUM(J87:L87)-4.67 -> 44.259999999999998 | N87: 4.6699999999999999 | O87: =SUM(M87:N87) -> 48.93
A88: 3015 | B88: CEMIG-G | C88: 06.981.176/0001-58 | D88: 1278.78 | E88: 0 | F88: 0 | G88: 0 | H88: 0 | I88: 0 | J88: 0 | K88: 1413.5799999999999 | L88: 0 | M88: =SUM(J88:L88)-134.8 -> 1278.78 | N88: 134.80000000000001 | O88: =SUM(M88:N88) -> 1413.5799999999999
A89: 3021 | B89: CGTEE | C89: 02.016.507/0001-69 | D89: 243.56 | E89: 0 | F89: 0 | G89: 0 | H89: 0 | I89: 0 | J89: 0 | K89: 269.23000000000002 | L89: 0 | M89: =SUM(J89:L89)-25.67 -> 243.56 | N89: 25.670000000000002 | O89: =SUM(M89:N89) -> 269.23000000000002
A90: 3022 | B90: CHESF-G | C90: 33.541.368/0001-16 | D90: 8691.6599999999999 | E90: 0 | F90: 0 | G90: 0 | H90: 0 | I90: 0 | J90: 0 | K90: 9607.8700000000008 | L90: 0 | M90: =SUM(J90:L90)-916.21 -> 8691.6599999999999 | N90: 916.21000000000004 | O90: =SUM(M90:N90) -> 9607.869999999999
A91: 3025 | B91: COPEL-G | C91: 04.370.282/0001-70 | D91: 1922.03 | E91: 0 | F91: 0 | G91: 0 | H91: 0 | I91: 0 | J91: 0 | K91: 2124.6399999999999 | L91: 0 | M91: =SUM(J91:L91)-202.61 -> 1922.0299999999997 | N91: 202.61000000000001 | O91: =SUM(M91:N91) -> 2124.6399999999999
A92: 3026 | B92: UEG ARAUCÁRIA | C92: 02.743.574/0001-85 | D92: 272.22000000000003 | E92: 0 | F92: 0 | G92: 0 | H92: 0 | I92: 0 | J92: 0 | K92: 300.92000000000002 | L92: 0 | M92: =SUM(J92:L92)-28.7 -> 272.22000000000003 | N92: 28.699999999999999 | O92: =SUM(M92:N92) -> 300.92000000000002
A93: 3027 | B93: COTEMINAS(CONS. PORTO ESTRELA) | C93: 07.663.140/0001-99 | D93: 18.59 | E93: 0 | F93: 0 | G93: 0 | H93: 0 | I93: 0 | J93: 0 | K93: 20.550000000000001 | L93: 0 | M93: =SUM(J93:L93)-1.96 -> 18.59 | N93: 1.96 | O93: =SUM(M93:N93) -> 20.550000000000001
A94: 3033 | B94: DFESA(CONS. DONA FRANCISCA) | C94: 02.832.860/0003-89 | D94: 73.780000000000001 | E94: 0 | F94: 0 | G94: 0 | H94: 0 | I94: 0 | J94: 0 | K94: 81.560000000000002 | L94: 0 | M94: =SUM(J94:L94)-7.78 -> 73.780000000000001 | N94: 7.7800000000000002 | O94: =SUM(M94:N94) -> 81.560000000000002
A95: 3034 | B95: DME(CONS. MACHADINHO) | C95: 23.664.303/0001-04 | D95: 21.870000000000001 | E95: 0 | F95: 0 | G95: 0 | H95: 0 | I95: 0 | J95: 0 | K95: 24.18 | L95: 0 | M95: =SUM(J95:L95)-2.31 -> 21.870000000000001 | N95: 2.3100000000000001 | O95: =SUM(M95:N95) -> 24.18
A96: 3035 | B96: RIO PARANAPANEMA(DUKE ENERGY) | C96: 02.998.301/0001-81 | D96: 1284.25 | E96: 0 | F96: 0 | G96: 0 | H96: 0 | I96: 0 | J96: 0 | K96: 1419.6300000000001 | L96: 0 | M96: =SUM(J96:L96)-135.38 -> 1284.25 | N96: 135.38 | O96: =SUM(M96:N96) -> 1419.6300000000001
A97: 3038 | B97: PETROBRAS (UTE MARIO LAGO) | C97: 33.000.167/0087-81 | D97: 557.12 | E97: 0 | F97: 0 | G97: 0 | H97: 0 | I97: 0 | J97: 0 | K97: 615.85000000000002 | L97: 0 | M97: =SUM(J97:L97)-58.73 -> 557.12 | N97: 58.729999999999997 | O97: =SUM(M97:N97) -> 615.85000000000002
A98: 3039 | B98: ELETRONORTE-G | C98: 00.357.038/0001-16 | D98: 289.02999999999997 | E98: 0 | F98: 0 | G98: 0 | H98: 0 | I98: 0 | J98: 0 | K98: 319.5 | L98: 0 | M98: =SUM(J98:L98)-30.47 -> 289.02999999999997 | N98: 30.469999999999999 | O98: =SUM(M98:N98) -> 319.5
A99: 3040 | B99: ELETRONUCLEAR | C99: 42.540.211/0001-67 | D99: 1503.26 | E99: 0 | F99: 0 | G99: 0 | H99: 0 | I99: 0 | J99: 0 | K99: 1661.72 | L99: 0 | M99: =SUM(J99:L99)-158.46 -> 1503.26 | N99: 158.46000000000001 | O99: =SUM(M99:N99) -> 1661.72
A100: 3044 | B100: FURNAS(APM MANSO) | C100: 23.274.194/0001-19 | D100: 205.97999999999999 | E100: 0 | F100: 0 | G100: 0 | H100: 0 | I100: 0 | J100: 0 | K100: 227.69 | L100: 0 | M100: =SUM(J100:L100)-21.71 -> 205.97999999999999 | N100: 21.710000000000001 | O100: =SUM(M100:N100) -> 227.69
A101: 3045 | B101: INVESTCO(CONS. LAJEADO) | C101: 00.644.907/0001-93 | D101: 7.3600000000000003 | E101: 0 | F101: 0 | G101: 0 | H101: 0 | I101: 0 | J101: 0 | K101: 8.1400000000000006 | L101: 0 | M101: =SUM(J101:L101)-0.78 -> 7.3600000000000003 | N101: 0.78000000000000003 | O101: =SUM(M101:N101) -> 8.1400000000000006
A102: 3046 | B102: ITAPEBI(UHE ITAPEBI) | C102: 02.397.080/0002-77 | D102: 192 | E102: 0 | F102: 0 | G102: 0 | H102: 0 | I102: 0 | J102: 0 | K102: 212.24000000000001 | L102: 0 | M102: =SUM(J102:L102)-20.24 -> 192 | N102: 20.239999999999998 | O102: =SUM(M102:N102) -> 212.24000000000001
A103: 3047 | B103: ITASA (CONS. ITÁ) | C103: 01.355.994/0002-02 | D103: 593.37 | E103: 0 | F103: 0 | G103: 0 | H103: 0 | I103: 0 | J103: 0 | K103: 655.91999999999996 | L103: 0 | M103: =SUM(J103:L103)-62.55 -> 593.37 | N103: 62.549999999999997 | O103: =SUM(M103:N103) -> 655.91999999999996
A104: 3048 | B104: ITIQUIRA(UHE ITIQUIRA) | C104: 02.808.298/0017-53 | D104: 147.97 | E104: 0 | F104: 0 | G104: 0 | H104: 0 | I104: 0 | J104: 0 | K104: 163.56999999999999 | L104: 0 | M104: =SUM(J104:L104)-15.6 -> 147.97 | N104: 15.6 | O104: =SUM(M104:N104) -> 163.56999999999999
A105: 3052 | B105: PETROBRAS(UTE TERMOCEARÁ) | C105: 33.000.167/0104-17 | D105: 153.30000000000001 | E105: 0 | F105: 0 | G105: 0 | H105: 0 | I105: 0 | J105: 0 | K105: 169.46000000000001 | L105: 0 | M105: =SUM(J105:L105)-16.16 -> 153.30000000000001 | N105: 16.16 | O105: =SUM(M105:N105) -> 169.46000000000001
A106: 3054 | B106: PAULISTA LAJEADO(CONS. LAJEADO) | C106: 03.491.603/0001-21 | D106: 51.020000000000003 | E106: 0 | F106: 0 | G106: 0 | H106: 0 | I106: 0 | J106: 0 | K106: 56.399999999999999 | L106: 0 | M106: =SUM(J106:L106)-5.38 -> 51.019999999999996 | N106: 5.3799999999999999 | O106: =SUM(M106:N106) -> 56.399999999999999
A107: 3055 | B107: PETROBRAS (UTE SEPÉ-TIARAJU) | C107: 33.000.167/0071-14 | D107: 147.91 | E107: 0 | F107: 0 | G107: 0 | H107: 0 | I107: 0 | J107: 0 | K107: 163.5 | L107: 0 | M107: =SUM(J107:L107)-15.59 -> 147.91 | N107: 15.59 | O107: =SUM(M107:N107) -> 163.5
A108: 3057 | B108: PETROBRAS(UTE FERNAN GASPARIAN) | C108: 33.000.167/0026-60 | D108: 108.40000000000001 | E108: 0 | F108: 0 | G108: 0 | H108: 0 | I108: 0 | J108: 0 | K108: 119.83 | L108: 0 | M108: =SUM(J108:L108)-11.43 -> 108.40000000000001 | N108: 11.43 | O108: =SUM(M108:N108) -> 119.83000000000001
A109: 3058 | B109: PETROBRAS (UTE CELSO FURTADO) | C109: 33.000.167/0024-06 | D109: 108.87 | E109: 0 | F109: 0 | G109: 0 | H109: 0 | I109: 0 | J109: 0 | K109: 120.34999999999999 | L109: 0 | M109: =SUM(J109:L109)-11.48 -> 108.86999999999999 | N109: 11.48 | O109: =SUM(M109:N109) -> 120.34999999999999
A110: 3061 | B110: LAJEADO ENERGIA(CONS. LAJEADO) | C110: 03.460.864/0002-65 | D110: 532.08000000000004 | E110: 0 | F110: 0 | G110: 0 | H110: 0 | I110: 0 | J110: 0 | K110: 588.16999999999996 | L110: 0 | M110: =SUM(J110:L110)-56.09 -> 532.07999999999993 | N110: 56.090000000000003 | O110: =SUM(M110:N110) -> 588.16999999999996
A111: 3062 | B111: VCB(CONS. MACHADINHO) | C111: 28.323.127/0001-60 | D111: 44.960000000000001 | E111: 0 | F111: 0 | G111: 0 | H111: 0 | I111: 0 | J111: 0 | K111: 49.700000000000003 | L111: 0 | M111: =SUM(J111:L111)-4.74 -> 44.960000000000001 | N111: 4.7400000000000002 | O111: =SUM(M111:N111) -> 49.700000000000003
A112: 3064 | B112: SAMARCO(CONS.GUILMAN AMORIM) | C112: 16.628.281/0003-23 | D112: 33.340000000000003 | E112: 0 | F112: 0 | G112: 0 | H112: 0 | I112: 0 | J112: 0 | K112: 36.850000000000001 | L112: 0 | M112: =SUM(J112:L112)-3.51 -> 33.340000000000003 | N112: 3.5099999999999998 | O112: =SUM(M112:N112) -> 36.850000000000001
A113: 3068 | B113: TERMOPERNAMBUCO(UTE TERMOPERN.) | C113: 03.795.050/0002-81 | D113: 364.94999999999999 | E113: 0 | F113: 0 | G113: 0 | H113: 0 | I113: 0 | J113: 0 | K113: 403.42000000000002 | L113: 0 | M113: =SUM(J113:L113)-38.47 -> 364.95000000000005 | N113: 38.469999999999999 | O113: =SUM(M113:N113) -> 403.42000000000007
A114: 3069 | B114: ENGIE | C114: 02.474.103/0001-19 | D114: 2761.1500000000001 | E114: 0 | F114: 0 | G114: 0 | H114: 0 | I114: 0 | J114: 0 | K114: 3052.21 | L114: 0 | M114: =SUM(J114:L114)-291.06 -> 2761.1500000000001 | N114: 291.06 | O114: =SUM(M114:N114) -> 3052.21
A115: 3070 | B115: ENGIE (CONS. ITÁ) | C115: 02.474.103/0001-19 | D115: 439.83999999999997 | E115: 0 | F115: 0 | G115: 0 | H115: 0 | I115: 0 | J115: 0 | K115: 486.19999999999999 | L115: 0 | M115: =SUM(J115:L115)-46.36 -> 439.83999999999997 | N115: 46.359999999999999 | O115: =SUM(M115:N115) -> 486.19999999999999
A116: 3071 | B116: ENGIE (CONS. MACHADINHO) | C116: 02.474.103/0001-19 | D116: 154.33000000000001 | E116: 0 | F116: 0 | G116: 0 | H116: 0 | I116: 0 | J116: 0 | K116: 170.59999999999999 | L116: 0 | M116: =SUM(J116:L116)-16.27 -> 154.32999999999998 | N116: 16.27 | O116: =SUM(M116:N116) -> 170.59999999999999
A117: 3072 | B117: VALE (VALESUL-CONS. MACHADINHO) | C117: 33.592.510/0005-88 | D117: 66.359999999999999 | E117: 0 | F117: 0 | G117: 0 | H117: 0 | I117: 0 | J117: 0 | K117: 73.359999999999999 | L117: 0 | M117: =SUM(J117:L117)-7 -> 66.359999999999999 | N117: 7 | O117: =SUM(M117:N117) -> 73.359999999999999
A118: 3073 | B118: EMAE | C118: 02.302.101/0001-42 | D118: 35.039999999999999 | E118: 0 | F118: 0 | G118: 0 | H118: 0 | I118: 0 | J118: 0 | K118: 38.729999999999997 | L118: 0 | M118: =SUM(J118:L118)-3.69 -> 35.039999999999999 | N118: 3.6899999999999999 | O118: =SUM(M118:N118) -> 38.729999999999997
A119: 3074 | B119: CGTF(UTE FORTALEZA) | C119: 04.423.567/0016-08 | D119: 226.33000000000001 | E119: 0 | F119: 0 | G119: 0 | H119: 0 | I119: 0 | J119: 0 | K119: 250.19 | L119: 0 | M119: =SUM(J119:L119)-23.86 -> 226.32999999999998 | N119: 23.859999999999999 | O119: =SUM(M119:N119) -> 250.19
A120: 3078 | B120: NORTE FLUMINENSE(UTE NORTE FLUM.) | C120: 03.258.983/0002-30 | D120: 523.80999999999995 | E120: 0 | F120: 0 | G120: 0 | H120: 0 | I120: 0 | J120: 0 | K120: 579.02999999999997 | L120: 0 | M120: =SUM(J120:L120)-55.22 -> 523.80999999999995 | N120: 55.219999999999999 | O120: =SUM(M120:N120) -> 579.02999999999997
A121: 3079 | B121: CDSA | C121: 01.672.223/0001-68 | D121: 498.45999999999998 | E121: 0 | F121: 0 | G121: 0 | H121: 0 | I121: 0 | J121: 0 | K121: 551 | L121: 0 | M121: =SUM(J121:L121)-52.54 -> 498.45999999999998 | N121: 52.539999999999999 | O121: =SUM(M121:N121) -> 551
A122: 3083 | B122: VOTORANTIM(UHE PEDRA DO CAVALO) | C122: 10.656.452/0066-25 | D122: 90.689999999999998 | E122: 0 | F122: 0 | G122: 0 | H122: 0 | I122: 0 | J122: 0 | K122: 100.25 | L122: 0 | M122: =SUM(J122:L122)-9.56 -> 90.689999999999998 | N122: 9.5600000000000005 | O122: =SUM(M122:N122) -> 100.25
A123: 3084 | B123: CERAN | C123: 04.237.975/0001-99 | D123: 225.44999999999999 | E123: 0 | F123: 0 | G123: 0 | H123: 0 | I123: 0 | J123: 0 | K123: 249.22 | L123: 0 | M123: =SUM(J123:L123)-23.77 -> 225.44999999999999 | N123: 23.77 | O123: =SUM(M123:N123) -> 249.22
A124: 3090 | B124: BAESA (UHE BARRA GRANDE) | C124: 04.781.143/0001-39 | D124: 505.85000000000002 | E124: 0 | F124: 0 | G124: 0 | H124: 0 | I124: 0 | J124: 0 | K124: 559.16999999999996 | L124: 0 | M124: =SUM(J124:L124)-53.32 -> 505.84999999999997 | N124: 53.32 | O124: =SUM(M124:N124) -> 559.16999999999996
A125: 3095 | B125: PETROBRAS(UTE JESUS S. PEREIRA) | C125: 33.000.167/0148-38 | D125: 265.44999999999999 | E125: 0 | F125: 0 | G125: 0 | H125: 0 | I125: 0 | J125: 0 | K125: 293.43000000000001 | L125: 0 | M125: =SUM(J125:L125)-27.98 -> 265.44999999999999 | N125: 27.98 | O125: =SUM(M125:N125) -> 293.43000000000001
A126: 3097 | B126: CEMIG(UHE IRAPÉ) | C126: 06.981.176/0001-58 | D126: 243.88999999999999 | E126: 0 | F126: 0 | G126: 0 | H126: 0 | I126: 0 | J126: 0 | K126: 269.60000000000002 | L126: 0 | M126: =SUM(J126:L126)-25.71 -> 243.89000000000001 | N126: 25.710000000000001 | O126: =SUM(M126:N126) -> 269.60000000000002
A127: 3098 | B127: VERACEL(UTE VERACEL) | C127: 40.551.996/0001-48 | D127: 5.7599999999999998 | E127: 0 | F127: 0 | G127: 0 | H127: 0 | I127: 0 | J127: 0 | K127: 6.3700000000000001 | L127: 0 | M127: =SUM(J127:L127)-0.61 -> 5.7599999999999998 | N127: 0.60999999999999999 | O127: =SUM(M127:N127) -> 6.3700000000000001
A128: 3102 | B128: ENERPEIXE(UHE PEIXE ANGICAL) | C128: 04.426.411/0003-66 | D128: 391.56 | E128: 0 | F128: 0 | G128: 0 | H128: 0 | I128: 0 | J128: 0 | K128: 432.83999999999997 | L128: 0 | M128: =SUM(J128:L128)-41.28 -> 391.55999999999995 | N128: 41.280000000000001 | O128: =SUM(M128:N128) -> 432.83999999999992
A129: 3103 | B129: ENERCAN (UHE CAMPOS NOVOS) | C129: 03.356.967/0001-07 | D129: 631.98000000000002 | E129: 0 | F129: 0 | G129: 0 | H129: 0 | I129: 0 | J129: 0 | K129: 698.60000000000002 | L129: 0 | M129: =SUM(J129:L129)-66.62 -> 631.98000000000002 | N129: 66.620000000000005 | O129: =SUM(M129:N129) -> 698.60000000000002
A130: 3108 | B130: VENTOS DO SUL | C130: 06.016.348/0002-34 | D130: 94.140000000000001 | E130: 0 | F130: 0 | G130: 0 | H130: 0 | I130: 0 | J130: 0 | K130: 104.06 | L130: 0 | M130: =SUM(J130:L130)-9.92 -> 94.140000000000001 | N130: 9.9199999999999999 | O130: =SUM(M130:N130) -> 104.06
A131: 3119 | B131: BSE-G | C131: 03.059.729/0001-21 | D131: 116.23999999999999 | E131: 0 | F131: 0 | G131: 0 | H131: 0 | I131: 0 | J131: 0 | K131: 128.49000000000001 | L131: 0 | M131: =SUM(J131:L131)-12.25 -> 116.24000000000001 | N131: 12.25 | O131: =SUM(M131:N131) -> 128.49000000000001
A132: 3120 | B132: BRENTECH(UTE GOIANIA 2) | C132: 07.921.085/0001-90 | D132: 103.03 | E132: 0 | F132: 0 | G132: 0 | H132: 0 | I132: 0 | J132: 0 | K132: 113.89 | L132: 0 | M132: =SUM(J132:L132)-10.86 -> 103.03 | N132: 10.859999999999999 | O132: =SUM(M132:N132) -> 113.89
A133: 3121 | B133: UTE GUARANI (UTE AREMBEPE) | C133: 23.865.997/0001-48 | D133: 89.459999999999994 | E133: 0 | F133: 0 | G133: 0 | H133: 0 | I133: 0 | J133: 0 | K133: 98.890000000000001 | L133: 0 | M133: =SUM(J133:L133)-9.43 -> 89.460000000000008 | N133: 9.4299999999999997 | O133: =SUM(M133:N133) -> 98.890000000000015
A134: 3122 | B134: EPESA | C134: 06.212.748/0001-34 | D134: 161.52000000000001 | E134: 0 | F134: 0 | G134: 0 | H134: 0 | I134: 0 | J134: 0 | K134: 178.55000000000001 | L134: 0 | M134: =SUM(J134:L134)-17.03 -> 161.52000000000001 | N134: 17.030000000000001 | O134: =SUM(M134:N134) -> 178.55000000000001
A135: 3123 | B135: UTE APOENA (UTE MURICY) | C135: 23.865.997/0001-48 | D135: 87.680000000000007 | E135: 0 | F135: 0 | G135: 0 | H135: 0 | I135: 0 | J135: 0 | K135: 96.920000000000002 | L135: 0 | M135: =SUM(J135:L135)-9.24 -> 87.680000000000007 | N135: 9.2400000000000002 | O135: =SUM(M135:N135) -> 96.920000000000002
A136: 3126 | B136: PETROBRAS(UTE EUZEBIO ROCHA) | C136: 33.000.167/0116-50 | D136: 98.790000000000006 | E136: 0 | F136: 0 | G136: 0 | H136: 0 | I136: 0 | J136: 0 | K136: 109.2 | L136: 0 | M136: =SUM(J136:L136)-10.41 -> 98.790000000000006 | N136: 10.41 | O136: =SUM(M136:N136) -> 109.2
A137: 3127 | B137: PRAIA FORMOSA | C137: 08.439.659/0008-27 | D137: 79.689999999999998 | E137: 0 | F137: 0 | G137: 0 | H137: 0 | I137: 0 | J137: 0 | K137: 88.090000000000003 | L137: 0 | M137: =SUM(J137:L137)-8.4 -> 79.689999999999998 | N137: 8.4000000000000004 | O137: =SUM(M137:N137) -> 88.090000000000003
A138: 3130 | B138: ICARAIZINHO | C138: 08.439.659/0009-08 | D138: 44.590000000000003 | E138: 0 | F138: 0 | G138: 0 | H138: 0 | I138: 0 | J138: 0 | K138: 49.289999999999999 | L138: 0 | M138: =SUM(J138:L138)-4.7 -> 44.589999999999996 | N138: 4.7000000000000002 | O138: =SUM(M138:N138) -> 49.289999999999999
A139: 3133 | B139: BAGUARI(CONS. BAGUARI) | C139: 07.799.995/0001-41 | D139: 38.390000000000001 | E139: 0 | F139: 0 | G139: 0 | H139: 0 | I139: 0 | J139: 0 | K139: 42.439999999999998 | L139: 0 | M139: =SUM(J139:L139)-4.05 -> 38.390000000000001 | N139: 4.0499999999999998 | O139: =SUM(M139:N139) -> 42.439999999999998
A140: 3134 | B140: GERA MARANHÃO (GERANORTE) | C140: 09.110.880/0001-23 | D140: 235.06 | E140: 0 | F140: 0 | G140: 0 | H140: 0 | I140: 0 | J140: 0 | K140: 259.83999999999997 | L140: 0 | M140: =SUM(J140:L140)-24.78 -> 235.05999999999997 | N140: 24.780000000000001 | O140: =SUM(M140:N140) -> 259.83999999999997
A141: 3135 | B141: BONS VENTOS | C141: 08.439.659/0001-50 | D141: 108.33 | E141: 0 | F141: 0 | G141: 0 | H141: 0 | I141: 0 | J141: 0 | K141: 119.75 | L141: 0 | M141: =SUM(J141:L141)-11.42 -> 108.33 | N141: 11.42 | O141: =SUM(M141:N141) -> 119.75
A142: 3136 | B142: VIANA | C142: 09.043.782/0002-00 | D142: 129.25 | E142: 0 | F142: 0 | G142: 0 | H142: 0 | I142: 0 | J142: 0 | K142: 142.87 | L142: 0 | M142: =SUM(J142:L142)-13.62 -> 129.25 | N142: 13.619999999999999 | O142: =SUM(M142:N142) -> 142.87
A143: 3137 | B143: BORBOREMA(UTE CAMP. GRANDE) | C143: 09.036.424/0001-80 | D143: 157.00999999999999 | E143: 0 | F143: 0 | G143: 0 | H143: 0 | I143: 0 | J143: 0 | K143: 173.56 | L143: 0 | M143: =SUM(J143:L143)-16.55 -> 157.00999999999999 | N143: 16.550000000000001 | O143: =SUM(M143:N143) -> 173.56
A144: 3138 | B144: ENERGIMP (VOLTA DO RIO) | C144: 07.063.713/0002-24 | D144: 34.659999999999997 | E144: 0 | F144: 0 | G144: 0 | H144: 0 | I144: 0 | J144: 0 | K144: 38.310000000000002 | L144: 0 | M144: =SUM(J144:L144)-3.65 -> 34.660000000000004 | N144: 3.6499999999999999 | O144: =SUM(M144:N144) -> 38.310000000000002
A145: 3139 | B145: ENERGIMP (PRAIA DO MORGADO) | C145: 07.063.963/0001-83 | D145: 22.649999999999999 | E145: 0 | F145: 0 | G145: 0 | H145: 0 | I145: 0 | J145: 0 | K145: 25.039999999999999 | L145: 0 | M145: =SUM(J145:L145)-2.39 -> 22.649999999999999 | N145: 2.3900000000000001 | O145: =SUM(M145:N145) -> 25.039999999999999
A146: 3140 | B146: RIO VERDE(UHE SALTO) | C146: 05.252.008/0001-69 | D146: 112.97 | E146: 0 | F146: 0 | G146: 0 | H146: 0 | I146: 0 | J146: 0 | K146: 124.88 | L146: 0 | M146: =SUM(J146:L146)-11.91 -> 112.97 | N146: 11.91 | O146: =SUM(M146:N146) -> 124.88
A147: 3141 | B147: FOZ DO RIO CLARO | C147: 07.823.262/0001-03 | D147: 64.450000000000003 | E147: 0 | F147: 0 | G147: 0 | H147: 0 | I147: 0 | J147: 0 | K147: 71.239999999999995 | L147: 0 | M147: =SUM(J147:L147)-6.79 -> 64.449999999999989 | N147: 6.79 | O147: =SUM(M147:N147) -> 71.239999999999995
A148: 3142 | B148: UTE CAÇU I | C148: 08.598.391/0001-08 | D148: 88.659999999999997 | E148: 0 | F148: 0 | G148: 0 | H148: 0 | I148: 0 | J148: 0 | K148: 98.010000000000005 | L148: 0 | M148: =SUM(J148:L148)-9.35 -> 88.660000000000011 | N148: 9.3499999999999996 | O148: =SUM(M148:N148) -> 98.010000000000005
A149: 3143 | B149: KINROSS (CAÇU B.-COQUEIROS) | C149: 20.346.524/0005-70 | D149: 151.16999999999999 | E149: 0 | F149: 0 | G149: 0 | H149: 0 | I149: 0 | J149: 0 | K149: 167.11000000000001 | L149: 0 | M149: =SUM(J149:L149)-15.94 -> 151.17000000000002 | N149: 15.94 | O149: =SUM(M149:N149) -> 167.11000000000001
A150: 3144 | B150: CANDEIAS-G | C150: 10.508.162/0001-99 | D150: 173.15000000000001 | E150: 0 | F150: 0 | G150: 0 | H150: 0 | I150: 0 | J150: 0 | K150: 191.40000000000001 | L150: 0 | M150: =SUM(J150:L150)-18.25 -> 173.15000000000001 | N150: 18.25 | O150: =SUM(M150:N150) -> 191.40000000000001
A151: 3145 | B151: CBA(RIO VERDINHO) | C151: 61.409.892/0210-90 | D151: 88.909999999999997 | E151: 0 | F151: 0 | G151: 0 | H151: 0 | I151: 0 | J151: 0 | K151: 98.280000000000001 | L151: 0 | M151: =SUM(J151:L151)-9.37 -> 88.909999999999997 | N151: 9.3699999999999992 | O151: =SUM(M151:N151) -> 98.280000000000001
A152: 3151 | B152: FOZ DO CHAPECÓ | C152: 04.591.168/0001-70 | D152: 877.37 | E152: 0 | F152: 0 | G152: 0 | H152: 0 | I152: 0 | J152: 0 | K152: 969.86000000000001 | L152: 0 | M152: =SUM(J152:L152)-92.49 -> 877.37 | N152: 92.489999999999995 | O152: =SUM(M152:N152) -> 969.86000000000001
A153: 3152 | B153: EPASA | C153: 10.366.780/0001-41 | D153: 185.25 | E153: 0 | F153: 0 | G153: 0 | H153: 0 | I153: 0 | J153: 0 | K153: 204.78 | L153: 0 | M153: =SUM(J153:L153)-19.53 -> 185.25 | N153: 19.530000000000001 | O153: =SUM(M153:N153) -> 204.78
A154: 3153 | B154: UTE SANTA LUZIA I | C154: 08.906.558/0001-42 | D154: 70.540000000000006 | E154: 0 | F154: 0 | G154: 0 | H154: 0 | I154: 0 | J154: 0 | K154: 77.980000000000004 | L154: 0 | M154: =SUM(J154:L154)-7.44 -> 70.540000000000006 | N154: 7.4400000000000004 | O154: =SUM(M154:N154) -> 77.980000000000004
A155: 3155 | B155: UTE BOA VISTA | C155: 24.222.394/0001-90 | D155: 35.009999999999998 | E155: 0 | F155: 0 | G155: 0 | H155: 0 | I155: 0 | J155: 0 | K155: 38.700000000000003 | L155: 0 | M155: =SUM(J155:L155)-3.69 -> 35.010000000000005 | N155: 3.6899999999999999 | O155: =SUM(M155:N155) -> 38.700000000000003
A156: 3156 | B156: TERNIUM(UTE ATLÂNTICO) | C156: 07.005.330/0001-19 | D156: 171.72999999999999 | E156: 0 | F156: 0 | G156: 0 | H156: 0 | I156: 0 | J156: 0 | K156: 189.83000000000001 | L156: 0 | M156: =SUM(J156:L156)-18.1 -> 171.73000000000002 | N156: 18.100000000000001 | O156: =SUM(M156:N156) -> 189.83000000000001
A157: 3158 | B157: CEE(CONS. ESTREITO) | C157: 08.976.022/0002-84 | D157: 385.25999999999999 | E157: 0 | F157: 0 | G157: 0 | H157: 0 | I157: 0 | J157: 0 | K157: 425.87 | L157: 0 | M157: =SUM(J157:L157)-40.61 -> 385.25999999999999 | N157: 40.609999999999999 | O157: =SUM(M157:N157) -> 425.87
A158: 3159 | B158: ESTREITO PART(CONS. ESTREITO) | C158: 22.686.355/0001-19 | D158: 42.689999999999998 | E158: 0 | F158: 0 | G158: 0 | H158: 0 | I158: 0 | J158: 0 | K158: 47.189999999999998 | L158: 0 | M158: =SUM(J158:L158)-4.5 -> 42.689999999999998 | N158: 4.5 | O158: =SUM(M158:N158) -> 47.189999999999998
A159: 3160 | B159: ESTREITO(CONS. ESTREITO) | C159: 07.089.298/0002-88 | D159: 245.08000000000001 | E159: 0 | F159: 0 | G159: 0 | H159: 0 | I159: 0 | J159: 0 | K159: 270.91000000000003 | L159: 0 | M159: =SUM(J159:L159)-25.83 -> 245.08000000000004 | N159: 25.829999999999998 | O159: =SUM(M159:N159) -> 270.91000000000003
A160: 3161 | B160: VALE(CONS. ESTREITO) | C160: 33.592.510/0091-00 | D160: 288.44 | E160: 0 | F160: 0 | G160: 0 | H160: 0 | I160: 0 | J160: 0 | K160: 318.85000000000002 | L160: 0 | M160: =SUM(J160:L160)-30.41 -> 288.44 | N160: 30.41 | O160: =SUM(M160:N160) -> 318.85000000000002
A161: 3166 | B161: SJC (UTE QUIRINÓPOLIS) | C161: 10.249.419/0002-16 | D161: 31.18 | E161: 0 | F161: 0 | G161: 0 | H161: 0 | I161: 0 | J161: 0 | K161: 34.469999999999999 | L161: 0 | M161: =SUM(J161:L161)-3.29 -> 31.18 | N161: 3.29 | O161: =SUM(M161:N161) -> 34.469999999999999
A162: 3167 | B162: EOL CERRO CHATO I | C162: 02.016.507/0001-69 | D162: 9.6899999999999995 | E162: 0 | F162: 0 | G162: 0 | H162: 0 | I162: 0 | J162: 0 | K162: 10.710000000000001 | L162: 0 | M162: =SUM(J162:L162)-1.02 -> 9.6900000000000013 | N162: 1.02 | O162: =SUM(M162:N162) -> 10.710000000000001
A163: 3168 | B163: EOL CERRO CHATO II | C163: 02.016.507/0001-69 | D163: 9.6899999999999995 | E163: 0 | F163: 0 | G163: 0 | H163: 0 | I163: 0 | J163: 0 | K163: 10.710000000000001 | L163: 0 | M163: =SUM(J163:L163)-1.02 -> 9.6900000000000013 | N163: 1.02 | O163: =SUM(M163:N163) -> 10.710000000000001
A164: 3169 | B164: EOL CERRO CHATO III | C164: 02.016.507/0001-69 | D164: 9.7100000000000009 | E164: 0 | F164: 0 | G164: 0 | H164: 0 | I164: 0 | J164: 0 | K164: 10.73 | L164: 0 | M164: =SUM(J164:L164)-1.02 -> 9.7100000000000009 | N164: 1.02 | O164: =SUM(M164:N164) -> 10.73
A165: 3170 | B165: UTE ELDORADO | C165: 05.620.523/0002-35 | D165: 72.200000000000003 | E165: 0 | F165: 0 | G165: 0 | H165: 0 | I165: 0 | J165: 0 | K165: 79.810000000000002 | L165: 0 | M165: =SUM(J165:L165)-7.61 -> 72.200000000000003 | N165: 7.6100000000000003 | O165: =SUM(M165:N165) -> 79.810000000000002
A166: 3172 | B166: BAGUARI ENERGIA(CONS. BAGUARI) | C166: 09.568.947/0001-78 | D166: 36.880000000000003 | E166: 0 | F166: 0 | G166: 0 | H166: 0 | I166: 0 | J166: 0 | K166: 40.770000000000003 | L166: 0 | M166: =SUM(J166:L166)-3.89 -> 36.880000000000003 | N166: 3.8900000000000001 | O166: =SUM(M166:N166) -> 40.770000000000003
A167: 3173 | B167: UTE PORTO DO PECÉM | C167: 08.976.495/0001-09 | D167: 578.22000000000003 | E167: 0 | F167: 0 | G167: 0 | H167: 0 | I167: 0 | J167: 0 | K167: 639.16999999999996 | L167: 0 | M167: =SUM(J167:L167)-60.95 -> 578.21999999999991 | N167: 60.950000000000003 | O167: =SUM(M167:N167) -> 639.16999999999996
A168: 3174 | B168: AGUAS DA PEDRA(UHE DARNANELOS) | C168: 08.768.414/0001-77 | D168: 295.89999999999998 | E168: 0 | F168: 0 | G168: 0 | H168: 0 | I168: 0 | J168: 0 | K168: 327.08999999999997 | L168: 0 | M168: =SUM(J168:L168)-31.19 -> 295.89999999999998 | N168: 31.190000000000001 | O168: =SUM(M168:N168) -> 327.08999999999997
A169: 3175 | B169: UTE BERNECK | C169: 81.905.176/0001-94 | D169: 5.2599999999999998 | E169: 0 | F169: 0 | G169: 0 | H169: 0 | I169: 0 | J169: 0 | K169: 5.8099999999999996 | L169: 0 | M169: =SUM(J169:L169)-0.55 -> 5.2599999999999998 | N169: 0.55000000000000004 | O169: =SUM(M169:N169) -> 5.8099999999999996
A170: 3176 | B170: PORTO DO ITAQUI | C170: 08.219.477/0001-74 | D170: 275.5 | E170: 0 | F170: 0 | G170: 0 | H170: 0 | I170: 0 | J170: 0 | K170: 304.54000000000002 | L170: 0 | M170: =SUM(J170:L170)-29.04 -> 275.5 | N170: 29.039999999999999 | O170: =SUM(M170:N170) -> 304.54000000000002
A171: 3177 | B171: CERRADINHO(UTE PORTO DAS AGUAS) | C171: 08.322.396/0001-03 | D171: 165.41 | E171: 0 | F171: 0 | G171: 0 | H171: 0 | I171: 0 | J171: 0 | K171: 182.84999999999999 | L171: 0 | M171: =SUM(J171:L171)-17.44 -> 165.41 | N171: 17.440000000000001 | O171: =SUM(M171:N171) -> 182.84999999999999
A172: 3178 | B172: UTE COSTA RICA | C172: 08.070.566/0016-88 | D172: 36.649999999999999 | E172: 0 | F172: 0 | G172: 0 | H172: 0 | I172: 0 | J172: 0 | K172: 40.509999999999998 | L172: 0 | M172: =SUM(J172:L172)-3.86 -> 36.649999999999999 | N172: 3.8599999999999999 | O172: =SUM(M172:N172) -> 40.509999999999998
A173: 3179 | B173: UTE NARDINI | C173: 48.708.267/0015-60 | D173: 24.140000000000001 | E173: 0 | F173: 0 | G173: 0 | H173: 0 | I173: 0 | J173: 0 | K173: 26.68 | L173: 0 | M173: =SUM(J173:L173)-2.54 -> 24.140000000000001 | N173: 2.54 | O173: =SUM(M173:N173) -> 26.68
A174: 3181 | B174: CEPASA(UTE PALMEIRAS DE GOIÁS) | C174: 13.348.048/0001-37 | D174: 142.75999999999999 | E174: 0 | F174: 0 | G174: 0 | H174: 0 | I174: 0 | J174: 0 | K174: 157.81 | L174: 0 | M174: =SUM(J174:L174)-15.05 -> 142.75999999999999 | N174: 15.050000000000001 | O174: =SUM(M174:N174) -> 157.81
A175: 3182 | B175: NEW ENERGY(EOL ALEGRIA I) | C175: 04.245.220/0002-17 | D175: 41.259999999999998 | E175: 0 | F175: 0 | G175: 0 | H175: 0 | I175: 0 | J175: 0 | K175: 45.609999999999999 | L175: 0 | M175: =SUM(J175:L175)-4.35 -> 41.259999999999998 | N175: 4.3499999999999996 | O175: =SUM(M175:N175) -> 45.609999999999999
A176: 3183 | B176: SAESA(UHE SANTO ANTÔNIO) | C176: 09.391.823/0002-40 | D176: 6032.4799999999996 | E176: 0 | F176: 0 | G176: 0 | H176: 0 | I176: 0 | J176: 0 | K176: 6668.3800000000001 | L176: 0 | M176: =SUM(J176:L176)-635.9 -> 6032.4800000000005 | N176: 635.89999999999998 | O176: =SUM(M176:N176) -> 6668.3800000000001
A177: 3184 | B177: EMPA(PCH INDAIAZINHO) | C177: 11.254.582/0002-30 | D177: 5.7199999999999998 | E177: 0 | F177: 0 | G177: 0 | H177: 0 | I177: 0 | J177: 0 | K177: 6.3200000000000003 | L177: 0 | M177: =SUM(J177:L177)-0.6 -> 5.7200000000000006 | N177: 0.59999999999999998 | O177: =SUM(M177:N177) -> 6.3200000000000003
A178: 3185 | B178: EMPA(PCH INDAIÁ GRANDE) | C178: 10.400.065/0002-69 | D178: 9.1600000000000001 | E178: 0 | F178: 0 | G178: 0 | H178: 0 | I178: 0 | J178: 0 | K178: 10.130000000000001 | L178: 0 | M178: =SUM(J178:L178)-0.97 -> 9.1600000000000001 | N178: 0.96999999999999997 | O178: =SUM(M178:N178) -> 10.130000000000001
A179: 3186 | B179: NEW ENERGY(EOL ALEGRIA II) | C179: 04.245.220/0002-17 | D179: 81.060000000000002 | E179: 0 | F179: 0 | G179: 0 | H179: 0 | I179: 0 | J179: 0 | K179: 89.599999999999994 | L179: 0 | M179: =SUM(J179:L179)-8.54 -> 81.060000000000002 | N179: 8.5399999999999991 | O179: =SUM(M179:N179) -> 89.599999999999994
A180: 3187 | B180: VENTOS DA LAGOA(EOL SANGR.2-3) | C180: 11.603.076/0002-09 | D180: 16.640000000000001 | E180: 0 | F180: 0 | G180: 0 | H180: 0 | I180: 0 | J180: 0 | K180: 18.390000000000001 | L180: 0 | M180: =SUM(J180:L180)-1.75 -> 16.640000000000001 | N180: 1.75 | O180: =SUM(M180:N180) -> 18.390000000000001
A181: 3192 | B181: EOL MACAUBAS | C181: 09.194.393/0002-77 | D181: 14.029999999999999 | E181: 0 | F181: 0 | G181: 0 | H181: 0 | I181: 0 | J181: 0 | K181: 15.51 | L181: 0 | M181: =SUM(J181:L181)-1.48 -> 14.029999999999999 | N181: 1.48 | O181: =SUM(M181:N181) -> 15.51
A182: 3193 | B182: EOL N. HORIZONTE | C182: 09.214.349/0002-81 | D182: 14.029999999999999 | E182: 0 | F182: 0 | G182: 0 | H182: 0 | I182: 0 | J182: 0 | K182: 15.51 | L182: 0 | M182: =SUM(J182:L182)-1.48 -> 14.029999999999999 | N182: 1.48 | O182: =SUM(M182:N182) -> 15.51
A183: 3194 | B183: EOL SEABRA | C183: 09.196.341/0002-30 | D183: 14.029999999999999 | E183: 0 | F183: 0 | G183: 0 | H183: 0 | I183: 0 | J183: 0 | K183: 15.51 | L183: 0 | M183: =SUM(J183:L183)-1.48 -> 14.029999999999999 | N183: 1.48 | O183: =SUM(M183:N183) -> 15.51
A184: 3195 | B184: PCH PEZZI | C184: 09.199.579/0002-19 | D184: 5.6600000000000001 | E184: 0 | F184: 0 | G184: 0 | H184: 0 | I184: 0 | J184: 0 | K184: 6.2599999999999998 | L184: 0 | M184: =SUM(J184:L184)-0.6 -> 5.6600000000000001 | N184: 0.59999999999999998 | O184: =SUM(M184:N184) -> 6.2599999999999998
A185: 3196 | B185: CPFL (EOL SANTA CLARA I) | C185: 10.797.899/0002-50 | D185: 13.24 | E185: 0 | F185: 0 | G185: 0 | H185: 0 | I185: 0 | J185: 0 | K185: 14.640000000000001 | L185: 0 | M185: =SUM(J185:L185)-1.4 -> 13.24 | N185: 1.3999999999999999 | O185: =SUM(M185:N185) -> 14.640000000000001
A186: 3197 | B186: CPFL (EOL SANTA CLARA II) | C186: 10.797.908/0002-02 | D186: 13.24 | E186: 0 | F186: 0 | G186: 0 | H186: 0 | I186: 0 | J186: 0 | K186: 14.640000000000001 | L186: 0 | M186: =SUM(J186:L186)-1.4 -> 13.24 | N186: 1.3999999999999999 | O186: =SUM(M186:N186) -> 14.640000000000001
A187: 3198 | B187: CPFL (EOL SANTA CLARA III) | C187: 10.797.910/0002-81 | D187: 13.279999999999999 | E187: 0 | F187: 0 | G187: 0 | H187: 0 | I187: 0 | J187: 0 | K187: 14.68 | L187: 0 | M187: =SUM(J187:L187)-1.4 -> 13.279999999999999 | N187: 1.3999999999999999 | O187: =SUM(M187:N187) -> 14.68
A188: 3199 | B188: CPFL (EOL SANTA CLARA IV) | C188: 10.797.907/0002-68 | D188: 13.24 | E188: 0 | F188: 0 | G188: 0 | H188: 0 | I188: 0 | J188: 0 | K188: 14.640000000000001 | L188: 0 | M188: =SUM(J188:L188)-1.4 -> 13.24 | N188: 1.3999999999999999 | O188: =SUM(M188:N188) -> 14.640000000000001
A189: 3200 | B189: CPFL (EOL SANTA CLARA V) | C189: 10.797.909/0002-57 | D189: 13.24 | E189: 0 | F189: 0 | G189: 0 | H189: 0 | I189: 0 | J189: 0 | K189: 14.640000000000001 | L189: 0 | M189: =SUM(J189:L189)-1.4 -> 13.24 | N189: 1.3999999999999999 | O189: =SUM(M189:N189) -> 14.640000000000001
A190: 3201 | B190: CPFL (EOL SANTA CLARA VI) | C190: 10.797.906/0002-13 | D190: 13.24 | E190: 0 | F190: 0 | G190: 0 | H190: 0 | I190: 0 | J190: 0 | K190: 14.640000000000001 | L190: 0 | M190: =SUM(J190:L190)-1.4 -> 13.24 | N190: 1.3999999999999999 | O190: =SUM(M190:N190) -> 14.640000000000001
A191: 3202 | B191: CPFL (EOL EURUS VI) | C191: 10.797.905/0002-79 | D191: 3.5299999999999998 | E191: 0 | F191: 0 | G191: 0 | H191: 0 | I191: 0 | J191: 0 | K191: 3.8999999999999999 | L191: 0 | M191: =SUM(J191:L191)-0.37 -> 3.5299999999999998 | N191: 0.37 | O191: =SUM(M191:N191) -> 3.8999999999999999
A192: 3203 | B192: EOL ALVORADA | C192: 11.349.807/0001-50 | D192: 3.6400000000000001 | E192: 0 | F192: 0 | G192: 0 | H192: 0 | I192: 0 | J192: 0 | K192: 4.0199999999999996 | L192: 0 | M192: =SUM(J192:L192)-0.38 -> 3.6399999999999997 | N192: 0.38 | O192: =SUM(M192:N192) -> 4.0199999999999996
A193: 3204 | B193: EOL CANDIBA | C193: 11.349.756/0001-67 | D193: 4.5800000000000001 | E193: 0 | F193: 0 | G193: 0 | H193: 0 | I193: 0 | J193: 0 | K193: 5.0599999999999996 | L193: 0 | M193: =SUM(J193:L193)-0.48 -> 4.5800000000000001 | N193: 0.47999999999999998 | O193: =SUM(M193:N193) -> 5.0600000000000005
A194: 3205 | B194: EOL GUANAMBI | C194: 11.350.499/0001-83 | D194: 9.9299999999999997 | E194: 0 | F194: 0 | G194: 0 | H194: 0 | I194: 0 | J194: 0 | K194: 10.98 | L194: 0 | M194: =SUM(J194:L194)-1.05 -> 9.9299999999999997 | N194: 1.05 | O194: =SUM(M194:N194) -> 10.98
A195: 3206 | B195: EOL GUIRAPÁ | C195: 11.345.796/0001-30 | D195: 13.640000000000001 | E195: 0 | F195: 0 | G195: 0 | H195: 0 | I195: 0 | J195: 0 | K195: 15.08 | L195: 0 | M195: =SUM(J195:L195)-1.44 -> 13.640000000000001 | N195: 1.4399999999999999 | O195: =SUM(M195:N195) -> 15.08
A196: 3207 | B196: EOL IGAPORÃ | C196: 11.366.011/0001-06 | D196: 13.640000000000001 | E196: 0 | F196: 0 | G196: 0 | H196: 0 | I196: 0 | J196: 0 | K196: 15.08 | L196: 0 | M196: =SUM(J196:L196)-1.44 -> 13.640000000000001 | N196: 1.4399999999999999 | O196: =SUM(M196:N196) -> 15.08
A197: 3208 | B197: EOL ILHEUS | C197: 11.366.468/0001-10 | D197: 5.3499999999999996 | E197: 0 | F197: 0 | G197: 0 | H197: 0 | I197: 0 | J197: 0 | K197: 5.9100000000000001 | L197: 0 | M197: =SUM(J197:L197)-0.56 -> 5.3499999999999996 | N197: 0.56000000000000005 | O197: =SUM(M197:N197) -> 5.9100000000000001
A198: 3209 | B198: EOL PAJEÚ DO VENTO | C198: 11.365.985/0001-75 | D198: 12.220000000000001 | E198: 0 | F198: 0 | G198: 0 | H198: 0 | I198: 0 | J198: 0 | K198: 13.51 | L198: 0 | M198: =SUM(J198:L198)-1.29 -> 12.219999999999999 | N198: 1.29 | O198: =SUM(M198:N198) -> 13.509999999999998
A199: 3210 | B199: EOL PINDAÍ | C199: 11.350.542/0001-00 | D199: 11.460000000000001 | E199: 0 | F199: 0 | G199: 0 | H199: 0 | I199: 0 | J199: 0 | K199: 12.67 | L199: 0 | M199: =SUM(J199:L199)-1.21 -> 11.460000000000001 | N199: 1.21 | O199: =SUM(M199:N199) -> 12.670000000000002
A200: 3211 | B200: EOL PORTO SEGURO | C200: 11.366.056/0001-80 | D200: 3.0600000000000001 | E200: 0 | F200: 0 | G200: 0 | H200: 0 | I200: 0 | J200: 0 | K200: 3.3799999999999999 | L200: 0 | M200: =SUM(J200:L200)-0.32 -> 3.0600000000000001 | N200: 0.32000000000000001 | O200: =SUM(M200:N200) -> 3.3799999999999999
A201: 3212 | B201: EOL RIO VERDE | C201: 11.350.476/0001-79 | D201: 13.640000000000001 | E201: 0 | F201: 0 | G201: 0 | H201: 0 | I201: 0 | J201: 0 | K201: 15.08 | L201: 0 | M201: =SUM(J201:L201)-1.44 -> 13.640000000000001 | N201: 1.4399999999999999 | O201: =SUM(M201:N201) -> 15.08
A202: 3213 | B202: EOL SERRA DO SALTO | C202: 11.349.836/0001-12 | D202: 9.1699999999999999 | E202: 0 | F202: 0 | G202: 0 | H202: 0 | I202: 0 | J202: 0 | K202: 10.140000000000001 | L202: 0 | M202: =SUM(J202:L202)-0.97 -> 9.1699999999999999 | N202: 0.96999999999999997 | O202: =SUM(M202:N202) -> 10.140000000000001
A203: 3215 | B203: EOL PLANALTINA | C203: 11.363.327/0001-44 | D203: 12.99 | E203: 0 | F203: 0 | G203: 0 | H203: 0 | I203: 0 | J203: 0 | K203: 14.359999999999999 | L203: 0 | M203: =SUM(J203:L203)-1.37 -> 12.989999999999998 | N203: 1.3700000000000001 | O203: =SUM(M203:N203) -> 14.359999999999999
A204: 3216 | B204: EOL LICÍNIO DE ALMEIDA | C204: 11.349.904/0001-43 | D204: 11.460000000000001 | E204: 0 | F204: 0 | G204: 0 | H204: 0 | I204: 0 | J204: 0 | K204: 12.67 | L204: 0 | M204: =SUM(J204:L204)-1.21 -> 11.460000000000001 | N204: 1.21 | O204: =SUM(M204:N204) -> 12.670000000000002
A205: 3217 | B205: EOL N.S. DA CONCEIÇÃO | C205: 11.371.340/0001-45 | D205: 13.640000000000001 | E205: 0 | F205: 0 | G205: 0 | H205: 0 | I205: 0 | J205: 0 | K205: 15.08 | L205: 0 | M205: =SUM(J205:L205)-1.44 -> 13.640000000000001 | N205: 1.4399999999999999 | O205: =SUM(M205:N205) -> 15.08
A206: 3219 | B206: DESA (EOL MORRO DOS VENTOS I) | C206: 11.686.050/0001-90 | D206: 12.630000000000001 | E206: 0 | F206: 0 | G206: 0 | H206: 0 | I206: 0 | J206: 0 | K206: 13.960000000000001 | L206: 0 | M206: =SUM(J206:L206)-1.33 -> 12.630000000000001 | N206: 1.3300000000000001 | O206: =SUM(M206:N206) -> 13.960000000000001
A207: 3220 | B207: DESA (EOL MORRO DOS VENTOS III) | C207: 11.686.100/0001-30 | D207: 12.77 | E207: 0 | F207: 0 | G207: 0 | H207: 0 | I207: 0 | J207: 0 | K207: 14.119999999999999 | L207: 0 | M207: =SUM(J207:L207)-1.35 -> 12.77 | N207: 1.3500000000000001 | O207: =SUM(M207:N207) -> 14.119999999999999
A208: 3221 | B208: DESA (EOL MORRO DOS VENTOS IV) | C208: 11.686.202/0001-55 | D208: 12.77 | E208: 0 | F208: 0 | G208: 0 | H208: 0 | I208: 0 | J208: 0 | K208: 14.119999999999999 | L208: 0 | M208: =SUM(J208:L208)-1.35 -> 12.77 | N208: 1.3500000000000001 | O208: =SUM(M208:N208) -> 14.119999999999999
A209: 3222 | B209: DESA (EOL MORRO DOS VENTOS IX) | C209: 11.686.103/0001-73 | D209: 12.99 | E209: 0 | F209: 0 | G209: 0 | H209: 0 | I209: 0 | J209: 0 | K209: 14.359999999999999 | L209: 0 | M209: =SUM(J209:L209)-1.37 -> 12.989999999999998 | N209: 1.3700000000000001 | O209: =SUM(M209:N209) -> 14.359999999999999
A210: 3223 | B210: DESA (EOL MORRO DOS VENTOS VI) | C210: 11.686.150/0001-17 | D210: 12.4 | E210: 0 | F210: 0 | G210: 0 | H210: 0 | I210: 0 | J210: 0 | K210: 13.710000000000001 | L210: 0 | M210: =SUM(J210:L210)-1.31 -> 12.4 | N210: 1.3100000000000001 | O210: =SUM(M210:N210) -> 13.710000000000001
A211: 3224 | B211: COPEL (GJC) | C211: 04.370.282/0001-70 | D211: 116.56 | E211: 0 | F211: 0 | G211: 0 | H211: 0 | I211: 0 | J211: 0 | K211: 128.84999999999999 | L211: 0 | M211: =SUM(J211:L211)-12.29 -> 116.56 | N211: 12.289999999999999 | O211: =SUM(M211:N211) -> 128.84999999999999
A212: 3225 | B212: CGT ELETROSUL (GJC) | C212: 02.016.507/0001-69 | D212: 111.98999999999999 | E212: 0 | F212: 0 | G212: 0 | H212: 0 | I212: 0 | J212: 0 | K212: 123.8 | L212: 0 | M212: =SUM(J212:L212)-11.81 -> 111.98999999999999 | N212: 11.81 | O212: =SUM(M212:N212) -> 123.8
A213: 3226 | B213: PCH SERRA DOS CAVALINHOS II | C213: 09.199.572/0002-05 | D213: 8.6400000000000006 | E213: 0 | F213: 0 | G213: 0 | H213: 0 | I213: 0 | J213: 0 | K213: 9.5500000000000007 | L213: 0 | M213: =SUM(J213:L213)-0.91 -> 8.6400000000000006 | N213: 0.91000000000000003 | O213: =SUM(M213:N213) -> 9.5500000000000007
A214: 3227 | B214: VENTOS DO LITORAL(OSORIO 2-3) | C214: 11.627.075/0002-02 | D214: 16.469999999999999 | E214: 0 | F214: 0 | G214: 0 | H214: 0 | I214: 0 | J214: 0 | K214: 18.210000000000001 | L214: 0 | M214: =SUM(J214:L214)-1.74 -> 16.470000000000002 | N214: 1.74 | O214: =SUM(M214:N214) -> 18.210000000000001
A215: 3228 | B215: PECEM II | C215: 10.471.487/0001-44 | D215: 280.16000000000003 | E215: 0 | F215: 0 | G215: 0 | H215: 0 | I215: 0 | J215: 0 | K215: 309.69 | L215: 0 | M215: =SUM(J215:L215)-29.53 -> 280.15999999999997 | N215: 29.530000000000001 | O215: =SUM(M215:N215) -> 309.68999999999994
A216: 3229 | B216: UTE SUAPE II | C216: 09.373.678/0003-56 | D216: 269.73000000000002 | E216: 0 | F216: 0 | G216: 0 | H216: 0 | I216: 0 | J216: 0 | K216: 298.16000000000003 | L216: 0 | M216: =SUM(J216:L216)-28.43 -> 269.73000000000002 | N216: 28.43 | O216: =SUM(M216:N216) -> 298.16000000000003
A217: 3230 | B217: UTE AGUA EMENDADA | C217: 08.070.566/0011-73 | D217: 33.479999999999997 | E217: 0 | F217: 0 | G217: 0 | H217: 0 | I217: 0 | J217: 0 | K217: 37.009999999999998 | L217: 0 | M217: =SUM(J217:L217)-3.53 -> 33.479999999999997 | N217: 3.5299999999999998 | O217: =SUM(M217:N217) -> 37.009999999999998
A218: 3231 | B218: UTE MORRO VERMELHO | C218: 08.070.566/0012-54 | D218: 37.130000000000003 | E218: 0 | F218: 0 | G218: 0 | H218: 0 | I218: 0 | J218: 0 | K218: 41.039999999999999 | L218: 0 | M218: =SUM(J218:L218)-3.91 -> 37.129999999999995 | N218: 3.9100000000000001 | O218: =SUM(M218:N218) -> 41.039999999999992
A219: 3232 | B219: PARNAÍBA(UTE MARANHÃO IV e V) | C219: 15.743.303/0001-71 | D219: 525.33000000000004 | E219: 0 | F219: 0 | G219: 0 | H219: 0 | I219: 0 | J219: 0 | K219: 580.71000000000004 | L219: 0 | M219: =SUM(J219:L219)-55.38 -> 525.33000000000004 | N219: 55.380000000000003 | O219: =SUM(M219:N219) -> 580.71000000000004
A220: 3234 | B220: EOL SETE GAMELEIRAS | C220: 12.710.327/0002-17 | D220: 13.6 | E220: 0 | F220: 0 | G220: 0 | H220: 0 | I220: 0 | J220: 0 | K220: 15.029999999999999 | L220: 0 | M220: =SUM(J220:L220)-1.43 -> 13.6 | N220: 1.4299999999999999 | O220: =SUM(M220:N220) -> 15.029999999999999
A221: 3235 | B221: EOL SÃO PEDRO DO LAGO | C221: 12.709.813/0002-15 | D221: 13.949999999999999 | E221: 0 | F221: 0 | G221: 0 | H221: 0 | I221: 0 | J221: 0 | K221: 15.42 | L221: 0 | M221: =SUM(J221:L221)-1.47 -> 13.949999999999999 | N221: 1.47 | O221: =SUM(M221:N221) -> 15.42
A222: 3236 | B222: EOL PEDRA BRANCA | C222: 12.709.996/0002-79 | D222: 13.6 | E222: 0 | F222: 0 | G222: 0 | H222: 0 | I222: 0 | J222: 0 | K222: 15.029999999999999 | L222: 0 | M222: =SUM(J222:L222)-1.43 -> 13.6 | N222: 1.4299999999999999 | O222: =SUM(M222:N222) -> 15.029999999999999
A223: 3237 | B223: COSAN (UTE JATAI) | C223: 18.686.104/0001-67 | D223: 145.74000000000001 | E223: 0 | F223: 0 | G223: 0 | H223: 0 | I223: 0 | J223: 0 | K223: 161.09999999999999 | L223: 0 | M223: =SUM(J223:L223)-15.36 -> 145.74000000000001 | N223: 15.359999999999999 | O223: =SUM(M223:N223) -> 161.10000000000002
A224: 3239 | B224: ENERGIMP (EOL BURITI) | C224: 11.646.785/0001-90 | D224: 11.880000000000001 | E224: 0 | F224: 0 | G224: 0 | H224: 0 | I224: 0 | J224: 0 | K224: 13.130000000000001 | L224: 0 | M224: =SUM(J224:L224)-1.25 -> 11.880000000000001 | N224: 1.25 | O224: =SUM(M224:N224) -> 13.130000000000001
A225: 3240 | B225: ENERGIMP (EOL CAJUCOCO) | C225: 11.646.760/0001-97 | D225: 11.91 | E225: 0 | F225: 0 | G225: 0 | H225: 0 | I225: 0 | J225: 0 | K225: 13.17 | L225: 0 | M225: =SUM(J225:L225)-1.26 -> 11.91 | N225: 1.26 | O225: =SUM(M225:N225) -> 13.17
A226: 3242 | B226: EOL ICARAÍ I | C226: 11.476.987/0001-31 | D226: 10.300000000000001 | E226: 0 | F226: 0 | G226: 0 | H226: 0 | I226: 0 | J226: 0 | K226: 11.390000000000001 | L226: 0 | M226: =SUM(J226:L226)-1.09 -> 10.300000000000001 | N226: 1.0900000000000001 | O226: =SUM(M226:N226) -> 11.390000000000001
A227: 3243 | B227: EOL ICARAÍ II | C227: 11.477.001/0001-48 | D227: 28.559999999999999 | E227: 0 | F227: 0 | G227: 0 | H227: 0 | I227: 0 | J227: 0 | K227: 31.57 | L227: 0 | M227: =SUM(J227:L227)-3.01 -> 28.560000000000002 | N227: 3.0099999999999998 | O227: =SUM(M227:N227) -> 31.57
A228: 3244 | B228: UTE PERNAMBUCO III | C228: 10.502.676/0001-37 | D228: 139.83000000000001 | E228: 0 | F228: 0 | G228: 0 | H228: 0 | I228: 0 | J228: 0 | K228: 154.56999999999999 | L228: 0 | M228: =SUM(J228:L228)-14.74 -> 139.82999999999998 | N228: 14.74 | O228: =SUM(M228:N228) -> 154.56999999999999
A229: 3245 | B229: ENERGIMP (EOL COQUEIRO) | C229: 11.646.832/0001-04 | D229: 10.699999999999999 | E229: 0 | F229: 0 | G229: 0 | H229: 0 | I229: 0 | J229: 0 | K229: 11.83 | L229: 0 | M229: =SUM(J229:L229)-1.13 -> 10.699999999999999 | N229: 1.1299999999999999 | O229: =SUM(M229:N229) -> 11.829999999999998
A230: 3249 | B230: ADECOAGRO(UTE AMANDINA) | C230: 07.903.169/0017-68 | D230: 27.66 | E230: 0 | F230: 0 | G230: 0 | H230: 0 | I230: 0 | J230: 0 | K230: 30.579999999999998 | L230: 0 | M230: =SUM(J230:L230)-2.92 -> 27.659999999999997 | N230: 2.9199999999999999 | O230: =SUM(M230:N230) -> 30.579999999999998
A231: 3250 | B231: UTE ALTO TAQUARI | C231: 08.070.566/0017-69 | D231: 31.82 | E231: 0 | F231: 0 | G231: 0 | H231: 0 | I231: 0 | J231: 0 | K231: 35.170000000000002 | L231: 0 | M231: =SUM(J231:L231)-3.35 -> 31.82 | N231: 3.3500000000000001 | O231: =SUM(M231:N231) -> 35.170000000000002
A232: 3251 | B232: EOL CAETITE 2 | C232: 12.106.989/0002-82 | D232: 13.4 | E232: 0 | F232: 0 | G232: 0 | H232: 0 | I232: 0 | J232: 0 | K232: 14.81 | L232: 0 | M232: =SUM(J232:L232)-1.41 -> 13.4 | N232: 1.4099999999999999 | O232: =SUM(M232:N232) -> 14.81
A233: 3252 | B233: EOL CAETITE 3 | C233: 12.106.879/0002-10 | D233: 13.300000000000001 | E233: 0 | F233: 0 | G233: 0 | H233: 0 | I233: 0 | J233: 0 | K233: 14.699999999999999 | L233: 0 | M233: =SUM(J233:L233)-1.4 -> 13.299999999999999 | N233: 1.3999999999999999 | O233: =SUM(M233:N233) -> 14.699999999999999
A234: 3258 | B234: EOL ATLANTICA I | C234: 12.773.558/0002-70 | D234: 8.5700000000000003 | E234: 0 | F234: 0 | G234: 0 | H234: 0 | I234: 0 | J234: 0 | K234: 9.4700000000000006 | L234: 0 | M234: =SUM(J234:L234)-0.9 -> 8.5700000000000003 | N234: 0.90000000000000002 | O234: =SUM(M234:N234) -> 9.4700000000000006
A235: 3259 | B235: EOL ATLANTICA II | C235: 12.963.869/0002-00 | D235: 8.5700000000000003 | E235: 0 | F235: 0 | G235: 0 | H235: 0 | I235: 0 | J235: 0 | K235: 9.4700000000000006 | L235: 0 | M235: =SUM(J235:L235)-0.9 -> 8.5700000000000003 | N235: 0.90000000000000002 | O235: =SUM(M235:N235) -> 9.4700000000000006
A236: 3260 | B236: EOL ATLANTICA IV | C236: 12.981.225/0002-36 | D236: 8.5700000000000003 | E236: 0 | F236: 0 | G236: 0 | H236: 0 | I236: 0 | J236: 0 | K236: 9.4700000000000006 | L236: 0 | M236: =SUM(J236:L236)-0.9 -> 8.5700000000000003 | N236: 0.90000000000000002 | O236: =SUM(M236:N236) -> 9.4700000000000006
A237: 3261 | B237: EOL ATLANTICA V | C237: 12.864.421/0002-20 | D237: 8.6899999999999995 | E237: 0 | F237: 0 | G237: 0 | H237: 0 | I237: 0 | J237: 0 | K237: 9.6099999999999994 | L237: 0 | M237: =SUM(J237:L237)-0.92 -> 8.6899999999999995 | N237: 0.92000000000000004 | O237: =SUM(M237:N237) -> 9.6099999999999994
A238: 3262 | B238: BRASVENTOS (EOL MIASSABA III) | C238: 11.839.616/0001-77 | D238: 61.140000000000001 | E238: 0 | F238: 0 | G238: 0 | H238: 0 | I238: 0 | J238: 0 | K238: 67.579999999999998 | L238: 0 | M238: =SUM(J238:L238)-6.44 -> 61.140000000000001 | N238: 6.4400000000000004 | O238: =SUM(M238:N238) -> 67.579999999999998
A239: 3263 | B239: ESBR (UHE JIRAU) | C239: 09.029.666/0004-90 | D239: 6504.5299999999997 | E239: 0 | F239: 0 | G239: 0 | H239: 0 | I239: 0 | J239: 0 | K239: 7190.1899999999996 | L239: 0 | M239: =SUM(J239:L239)-685.66 -> 6504.5299999999997 | N239: 685.65999999999997 | O239: =SUM(M239:N239) -> 7190.1899999999996
A240: 3264 | B240: UTE SUZANO | C240: 16.404.287/0222-05 | D240: 69.400000000000006 | E240: 0 | F240: 0 | G240: 0 | H240: 0 | I240: 0 | J240: 0 | K240: 76.719999999999999 | L240: 0 | M240: =SUM(J240:L240)-7.32 -> 69.400000000000006 | N240: 7.3200000000000003 | O240: =SUM(M240:N240) -> 76.719999999999999
A241: 3265 | B241: EOL REI DOS VENTOS 3 | C241: 11.637.104/0001-28 | D241: 53.68 | E241: 0 | F241: 0 | G241: 0 | H241: 0 | I241: 0 | J241: 0 | K241: 59.340000000000003 | L241: 0 | M241: =SUM(J241:L241)-5.66 -> 53.680000000000007 | N241: 5.6600000000000001 | O241: =SUM(M241:N241) -> 59.340000000000003
A242: 3266 | B242: RIO CANOAS (UHE GARIBALDI) | C242: 11.316.814/0001-56 | D242: 104.90000000000001 | E242: 0 | F242: 0 | G242: 0 | H242: 0 | I242: 0 | J242: 0 | K242: 115.95999999999999 | L242: 0 | M242: =SUM(J242:L242)-11.06 -> 104.89999999999999 | N242: 11.06 | O242: =SUM(M242:N242) -> 115.95999999999999
A243: 3267 | B243: EOL REI DOS VENTOS 1 | C243: 11.637.090/0001-42 | D243: 52.189999999999998 | E243: 0 | F243: 0 | G243: 0 | H243: 0 | I243: 0 | J243: 0 | K243: 57.689999999999998 | L243: 0 | M243: =SUM(J243:L243)-5.5 -> 52.189999999999998 | N243: 5.5 | O243: =SUM(M243:N243) -> 57.689999999999998
A244: 3268 | B244: EOL DREEN OLHO DAGUA | C244: 12.723.444/0001-34 | D244: 13.390000000000001 | E244: 0 | F244: 0 | G244: 0 | H244: 0 | I244: 0 | J244: 0 | K244: 14.800000000000001 | L244: 0 | M244: =SUM(J244:L244)-1.41 -> 13.390000000000001 | N244: 1.4099999999999999 | O244: =SUM(M244:N244) -> 14.800000000000001
A245: 3269 | B245: EOL DREEN BOA VISTA | C245: 12.723.413/0001-83 | D245: 6.2699999999999996 | E245: 0 | F245: 0 | G245: 0 | H245: 0 | I245: 0 | J245: 0 | K245: 6.9299999999999997 | L245: 0 | M245: =SUM(J245:L245)-0.66 -> 6.2699999999999996 | N245: 0.66000000000000003 | O245: =SUM(M245:N245) -> 6.9299999999999997
A246: 3270 | B246: EOL ASA BRANCA IV | C246: 11.681.456/0002-61 | D246: 13.49 | E246: 0 | F246: 0 | G246: 0 | H246: 0 | I246: 0 | J246: 0 | K246: 14.91 | L246: 0 | M246: =SUM(J246:L246)-1.42 -> 13.49 | N246: 1.4199999999999999 | O246: =SUM(M246:N246) -> 14.91
A247: 3271 | B247: EOL ASA BRANCA VI | C247: 11.694.617/0002-51 | D247: 13.49 | E247: 0 | F247: 0 | G247: 0 | H247: 0 | I247: 0 | J247: 0 | K247: 14.91 | L247: 0 | M247: =SUM(J247:L247)-1.42 -> 13.49 | N247: 1.4199999999999999 | O247: =SUM(M247:N247) -> 14.91
A248: 3272 | B248: EOL ASA BRANCA VIII | C248: 11.694.621/0002-10 | D248: 13.49 | E248: 0 | F248: 0 | G248: 0 | H248: 0 | I248: 0 | J248: 0 | K248: 14.91 | L248: 0 | M248: =SUM(J248:L248)-1.42 -> 13.49 | N248: 1.4199999999999999 | O248: =SUM(M248:N248) -> 14.91
A249: 3273 | B249: EOL CALANGO 1 | C249: 12.106.898/0002-47 | D249: 12.039999999999999 | E249: 0 | F249: 0 | G249: 0 | H249: 0 | I249: 0 | J249: 0 | K249: 13.31 | L249: 0 | M249: =SUM(J249:L249)-1.27 -> 12.040000000000001 | N249: 1.27 | O249: =SUM(M249:N249) -> 13.31
A250: 3274 | B250: EOL CALANGO 2 | C250: 12.107.047/0002-19 | D250: 12.050000000000001 | E250: 0 | F250: 0 | G250: 0 | H250: 0 | I250: 0 | J250: 0 | K250: 13.32 | L250: 0 | M250: =SUM(J250:L250)-1.27 -> 12.050000000000001 | N250: 1.27 | O250: =SUM(M250:N250) -> 13.32
A251: 3275 | B251: EOL CALANGO 3 | C251: 12.106.962/0002-90 | D251: 12.07 | E251: 0 | F251: 0 | G251: 0 | H251: 0 | I251: 0 | J251: 0 | K251: 13.34 | L251: 0 | M251: =SUM(J251:L251)-1.27 -> 12.07 | N251: 1.27 | O251: =SUM(M251:N251) -> 13.34
A252: 3276 | B252: EOL CALANGO 4 | C252: 12.106.862/0002-63 | D252: 11.98 | E252: 0 | F252: 0 | G252: 0 | H252: 0 | I252: 0 | J252: 0 | K252: 13.24 | L252: 0 | M252: =SUM(J252:L252)-1.26 -> 11.98 | N252: 1.26 | O252: =SUM(M252:N252) -> 13.24
A253: 3277 | B253: EOL CALANGO 5 | C253: 12.159.338/0002-50 | D253: 11.960000000000001 | E253: 0 | F253: 0 | G253: 0 | H253: 0 | I253: 0 | J253: 0 | K253: 13.220000000000001 | L253: 0 | M253: =SUM(J253:L253)-1.26 -> 11.960000000000001 | N253: 1.26 | O253: =SUM(M253:N253) -> 13.220000000000001
A254: 3278 | B254: EOL RENASCENÇA I | C254: 12.831.777/0002-68 | D254: 13.35 | E254: 0 | F254: 0 | G254: 0 | H254: 0 | I254: 0 | J254: 0 | K254: 14.76 | L254: 0 | M254: =SUM(J254:L254)-1.41 -> 13.35 | N254: 1.4099999999999999 | O254: =SUM(M254:N254) -> 14.76
A255: 3279 | B255: EOL RENASCENÇA II | C255: 12.831.668/0002-40 | D255: 13.35 | E255: 0 | F255: 0 | G255: 0 | H255: 0 | I255: 0 | J255: 0 | K255: 14.76 | L255: 0 | M255: =SUM(J255:L255)-1.41 -> 13.35 | N255: 1.4099999999999999 | O255: =SUM(M255:N255) -> 14.76
A256: 3280 | B256: EOL RENASCENÇA III | C256: 12.833.445/0002-12 | D256: 13.35 | E256: 0 | F256: 0 | G256: 0 | H256: 0 | I256: 0 | J256: 0 | K256: 14.76 | L256: 0 | M256: =SUM(J256:L256)-1.41 -> 13.35 | N256: 1.4099999999999999 | O256: =SUM(M256:N256) -> 14.76
A257: 3281 | B257: EOL RENASCENÇA IV | C257: 12.833.899/0002-93 | D257: 13.35 | E257: 0 | F257: 0 | G257: 0 | H257: 0 | I257: 0 | J257: 0 | K257: 14.76 | L257: 0 | M257: =SUM(J257:L257)-1.41 -> 13.35 | N257: 1.4099999999999999 | O257: =SUM(M257:N257) -> 14.76
A258: 3282 | B258: EOL VENTOS DE SÃO MIGUEL | C258: 12.833.419/0002-94 | D258: 13.35 | E258: 0 | F258: 0 | G258: 0 | H258: 0 | I258: 0 | J258: 0 | K258: 14.76 | L258: 0 | M258: =SUM(J258:L258)-1.41 -> 13.35 | N258: 1.4099999999999999 | O258: =SUM(M258:N258) -> 14.76
A259: 3283 | B259: EOL FLEIXEIRAS I | C259: 09.096.120/0002-90 | D259: 11.279999999999999 | E259: 0 | F259: 0 | G259: 0 | H259: 0 | I259: 0 | J259: 0 | K259: 12.470000000000001 | L259: 0 | M259: =SUM(J259:L259)-1.19 -> 11.280000000000001 | N259: 1.1899999999999999 | O259: =SUM(M259:N259) -> 12.470000000000001
A260: 3284 | B260: EOL GUAJIRÚ | C260: 08.701.973/0002-40 | D260: 11.279999999999999 | E260: 0 | F260: 0 | G260: 0 | H260: 0 | I260: 0 | J260: 0 | K260: 12.470000000000001 | L260: 0 | M260: =SUM(J260:L260)-1.19 -> 11.280000000000001 | N260: 1.1899999999999999 | O260: =SUM(M260:N260) -> 12.470000000000001
A261: 3285 | B261: EOL MUNDAÚ | C261: 08.629.553/0002-09 | D261: 8.5800000000000001 | E261: 0 | F261: 0 | G261: 0 | H261: 0 | I261: 0 | J261: 0 | K261: 9.4800000000000004 | L261: 0 | M261: =SUM(J261:L261)-0.9 -> 8.5800000000000001 | N261: 0.90000000000000002 | O261: =SUM(M261:N261) -> 9.4800000000000004
A262: 3286 | B262: EOL TRAIRÍ | C262: 09.252.423/0002-54 | D262: 9.8100000000000005 | E262: 0 | F262: 0 | G262: 0 | H262: 0 | I262: 0 | J262: 0 | K262: 10.84 | L262: 0 | M262: =SUM(J262:L262)-1.03 -> 9.8100000000000005 | N262: 1.03 | O262: =SUM(M262:N262) -> 10.84
A263: 3287 | B263: EOL FAISA I | C263: 11.619.268/0001-22 | D263: 11.83 | E263: 0 | F263: 0 | G263: 0 | H263: 0 | I263: 0 | J263: 0 | K263: 13.08 | L263: 0 | M263: =SUM(J263:L263)-1.25 -> 11.83 | N263: 1.25 | O263: =SUM(M263:N263) -> 13.08
A264: 3288 | B264: EOL FAISA II | C264: 11.619.388/0001-20 | D264: 10.960000000000001 | E264: 0 | F264: 0 | G264: 0 | H264: 0 | I264: 0 | J264: 0 | K264: 12.119999999999999 | L264: 0 | M264: =SUM(J264:L264)-1.16 -> 10.959999999999999 | N264: 1.1599999999999999 | O264: =SUM(M264:N264) -> 12.119999999999999
A265: 3289 | B265: EOL FAISA III | C265: 11.619.413/0001-75 | D265: 10.09 | E265: 0 | F265: 0 | G265: 0 | H265: 0 | I265: 0 | J265: 0 | K265: 11.15 | L265: 0 | M265: =SUM(J265:L265)-1.06 -> 10.09 | N265: 1.0600000000000001 | O265: =SUM(M265:N265) -> 11.15
A266: 3290 | B266: EOL FAISA IV | C266: 11.619.342/0001-00 | D266: 10.09 | E266: 0 | F266: 0 | G266: 0 | H266: 0 | I266: 0 | J266: 0 | K266: 11.15 | L266: 0 | M266: =SUM(J266:L266)-1.06 -> 10.09 | N266: 1.0600000000000001 | O266: =SUM(M266:N266) -> 11.15
A267: 3291 | B267: EOL FAISA V | C267: 11.652.254/0001-00 | D267: 11.83 | E267: 0 | F267: 0 | G267: 0 | H267: 0 | I267: 0 | J267: 0 | K267: 13.08 | L267: 0 | M267: =SUM(J267:L267)-1.25 -> 11.83 | N267: 1.25 | O267: =SUM(M267:N267) -> 13.08
A268: 3292 | B268: EOL TAÍBA ÁGUIA | C268: 11.477.009/0001-04 | D268: 9.3599999999999994 | E268: 0 | F268: 0 | G268: 0 | H268: 0 | I268: 0 | J268: 0 | K268: 10.35 | L268: 0 | M268: =SUM(J268:L268)-0.99 -> 9.3599999999999994 | N268: 0.98999999999999999 | O268: =SUM(M268:N268) -> 10.35
A269: 3293 | B269: EOL TAÍBA ANDORINHA | C269: 11.477.020/0001-74 | D269: 5.9400000000000004 | E269: 0 | F269: 0 | G269: 0 | H269: 0 | I269: 0 | J269: 0 | K269: 6.5700000000000003 | L269: 0 | M269: =SUM(J269:L269)-0.63 -> 5.9400000000000004 | N269: 0.63 | O269: =SUM(M269:N269) -> 6.5700000000000003
A270: 3294 | B270: EOL COLÔNIA | C270: 11.476.958/0001-70 | D270: 7.6600000000000001 | E270: 0 | F270: 0 | G270: 0 | H270: 0 | I270: 0 | J270: 0 | K270: 8.4700000000000006 | L270: 0 | M270: =SUM(J270:L270)-0.81 -> 7.6600000000000001 | N270: 0.81000000000000005 | O270: =SUM(M270:N270) -> 8.4700000000000006
A271: 3295 | B271: EOL EMBUACA | C271: 10.288.461/0001-65 | D271: 10.35 | E271: 0 | F271: 0 | G271: 0 | H271: 0 | I271: 0 | J271: 0 | K271: 11.44 | L271: 0 | M271: =SUM(J271:L271)-1.09 -> 10.35 | N271: 1.0900000000000001 | O271: =SUM(M271:N271) -> 11.44
A272: 3296 | B272: CPFL (EOL CAMPO DOS VENTOS II) | C272: 10.797.889/0002-14 | D272: 13.73 | E272: 0 | F272: 0 | G272: 0 | H272: 0 | I272: 0 | J272: 0 | K272: 15.18 | L272: 0 | M272: =SUM(J272:L272)-1.45 -> 13.73 | N272: 1.45 | O272: =SUM(M272:N272) -> 15.18
A273: 3297 | B273: EOL SÃO BENTO DO NORTE | C273: 12.723.384/0001-50 | D273: 12.51 | E273: 0 | F273: 0 | G273: 0 | H273: 0 | I273: 0 | J273: 0 | K273: 13.83 | L273: 0 | M273: =SUM(J273:L273)-1.32 -> 12.51 | N273: 1.3200000000000001 | O273: =SUM(M273:N273) -> 13.83
A274: 3298 | B274: EOL ASA BRANCA V | C274: 11.681.458/0002-50 | D274: 12.390000000000001 | E274: 0 | F274: 0 | G274: 0 | H274: 0 | I274: 0 | J274: 0 | K274: 13.699999999999999 | L274: 0 | M274: =SUM(J274:L274)-1.31 -> 12.389999999999999 | N274: 1.3100000000000001 | O274: =SUM(M274:N274) -> 13.699999999999999
A275: 3299 | B275: EOL ASA BRANCA VII | C275: 11.694.618/0002-04 | D275: 12.390000000000001 | E275: 0 | F275: 0 | G275: 0 | H275: 0 | I275: 0 | J275: 0 | K275: 13.699999999999999 | L275: 0 | M275: =SUM(J275:L275)-1.31 -> 12.389999999999999 | N275: 1.3100000000000001 | O275: =SUM(M275:N275) -> 13.699999999999999
A276: 3300 | B276: PETROBRAS (UTE B. FLUMINENSE) | C276: 33.000.167/0238-29 | D276: 385.25999999999999 | E276: 0 | F276: 0 | G276: 0 | H276: 0 | I276: 0 | J276: 0 | K276: 425.87 | L276: 0 | M276: =SUM(J276:L276)-40.61 -> 385.25999999999999 | N276: 40.609999999999999 | O276: =SUM(M276:N276) -> 425.87
A277: 3301 | B277: EOL MAR E TERRA | C277: 10.288.438/0001-70 | D277: 10.27 | E277: 0 | F277: 0 | G277: 0 | H277: 0 | I277: 0 | J277: 0 | K277: 11.35 | L277: 0 | M277: =SUM(J277:L277)-1.08 -> 10.27 | N277: 1.0800000000000001 | O277: =SUM(M277:N277) -> 11.35
A278: 3302 | B278: EOL BELA VISTA | C278: 10.288.502/0001-13 | D278: 12.23 | E278: 0 | F278: 0 | G278: 0 | H278: 0 | I278: 0 | J278: 0 | K278: 13.52 | L278: 0 | M278: =SUM(J278:L278)-1.29 -> 12.23 | N278: 1.29 | O278: =SUM(M278:N278) -> 13.52
A279: 3303 | B279: EOL PAU FERRO | C279: 14.422.424/0002-30 | D279: 13.800000000000001 | E279: 0 | F279: 0 | G279: 0 | H279: 0 | I279: 0 | J279: 0 | K279: 15.25 | L279: 0 | M279: =SUM(J279:L279)-1.45 -> 13.800000000000001 | N279: 1.45 | O279: =SUM(M279:N279) -> 15.25
A280: 3304 | B280: EOL PEDRA DO GERONIMO | C280: 14.422.483/0002-08 | D280: 13.800000000000001 | E280: 0 | F280: 0 | G280: 0 | H280: 0 | I280: 0 | J280: 0 | K280: 15.25 | L280: 0 | M280: =SUM(J280:L280)-1.45 -> 13.800000000000001 | N280: 1.45 | O280: =SUM(M280:N280) -> 15.25
A281: 3305 | B281: EOL TACAICÓ | C281: 14.411.251/0002-54 | D281: 8.4800000000000004 | E281: 0 | F281: 0 | G281: 0 | H281: 0 | I281: 0 | J281: 0 | K281: 9.3699999999999992 | L281: 0 | M281: =SUM(J281:L281)-0.89 -> 8.4799999999999986 | N281: 0.89000000000000001 | O281: =SUM(M281:N281) -> 9.3699999999999992
A282: 3306 | B282: UTE TROPICAL BIOENERGIA | C282: 08.195.806/0001-94 | D282: 36.670000000000002 | E282: 0 | F282: 0 | G282: 0 | H282: 0 | I282: 0 | J282: 0 | K282: 40.539999999999999 | L282: 0 | M282: =SUM(J282:L282)-3.87 -> 36.670000000000002 | N282: 3.8700000000000001 | O282: =SUM(M282:N282) -> 40.539999999999999
A283: 3307 | B283: EOL PALMAS | C283: 10.656.525/0001-33 | D283: 7.4800000000000004 | E283: 0 | F283: 0 | G283: 0 | H283: 0 | I283: 0 | J283: 0 | K283: 8.2699999999999996 | L283: 0 | M283: =SUM(J283:L283)-0.79 -> 7.4799999999999995 | N283: 0.79000000000000004 | O283: =SUM(M283:N283) -> 8.2699999999999996
A284: 3308 | B284: EOL ILHA GRANDE | C284: 08.624.273/0001-19 | D284: 11.859999999999999 | E284: 0 | F284: 0 | G284: 0 | H284: 0 | I284: 0 | J284: 0 | K284: 13.109999999999999 | L284: 0 | M284: =SUM(J284:L284)-1.25 -> 11.859999999999999 | N284: 1.25 | O284: =SUM(M284:N284) -> 13.109999999999999
A285: 3309 | B285: EOL RIBEIRÃO | C285: 10.656.583/0001-67 | D285: 8.6199999999999992 | E285: 0 | F285: 0 | G285: 0 | H285: 0 | I285: 0 | J285: 0 | K285: 9.5299999999999994 | L285: 0 | M285: =SUM(J285:L285)-0.91 -> 8.6199999999999992 | N285: 0.91000000000000003 | O285: =SUM(M285:N285) -> 9.5299999999999994
A286: 3310 | B286: UTE IACO | C286: 07.895.728/0006-82 | D286: 35.759999999999998 | E286: 0 | F286: 0 | G286: 0 | H286: 0 | I286: 0 | J286: 0 | K286: 39.530000000000001 | L286: 0 | M286: =SUM(J286:L286)-3.77 -> 35.759999999999998 | N286: 3.77 | O286: =SUM(M286:N286) -> 39.530000000000001
A287: 3312 | B287: EOL IBIRAPUITÃ I | C287: 14.608.116/0001-12 | D287: 8.0500000000000007 | E287: 0 | F287: 0 | G287: 0 | H287: 0 | I287: 0 | J287: 0 | K287: 8.9000000000000004 | L287: 0 | M287: =SUM(J287:L287)-0.85 -> 8.0500000000000007 | N287: 0.84999999999999998 | O287: =SUM(M287:N287) -> 8.9000000000000004
A288: 3313 | B288: PARNAÍBA II | C288: 14.578.002/0001-77 | D288: 552.07000000000005 | E288: 0 | F288: 0 | G288: 0 | H288: 0 | I288: 0 | J288: 0 | K288: 610.26999999999998 | L288: 0 | M288: =SUM(J288:L288)-58.2 -> 552.06999999999994 | N288: 58.200000000000003 | O288: =SUM(M288:N288) -> 610.26999999999998
A289: 3314 | B289: UTE ERB CANDEIAS | C289: 12.901.925/0001-92 | D289: 3.5800000000000001 | E289: 0 | F289: 0 | G289: 0 | H289: 0 | I289: 0 | J289: 0 | K289: 3.96 | L289: 0 | M289: =SUM(J289:L289)-0.38 -> 3.5800000000000001 | N289: 0.38 | O289: =SUM(M289:N289) -> 3.96
A290: 3315 | B290: EOL UNIÃO DOS VENTOS 1 | C290: 13.336.223/0001-76 | D290: 9.3699999999999992 | E290: 0 | F290: 0 | G290: 0 | H290: 0 | I290: 0 | J290: 0 | K290: 10.359999999999999 | L290: 0 | M290: =SUM(J290:L290)-0.99 -> 9.3699999999999992 | N290: 0.98999999999999999 | O290: =SUM(M290:N290) -> 10.359999999999999
A291: 3316 | B291: EOL UNIÃO DOS VENTOS 2 | C291: 13.336.463/0001-70 | D291: 9.4100000000000001 | E291: 0 | F291: 0 | G291: 0 | H291: 0 | I291: 0 | J291: 0 | K291: 10.4 | L291: 0 | M291: =SUM(J291:L291)-0.99 -> 9.4100000000000001 | N291: 0.98999999999999999 | O291: =SUM(M291:N291) -> 10.4
A292: 3317 | B292: EOL UNIÃO DOS VENTOS 3 | C292: 13.336.480/0001-08 | D292: 9.3200000000000003 | E292: 0 | F292: 0 | G292: 0 | H292: 0 | I292: 0 | J292: 0 | K292: 10.300000000000001 | L292: 0 | M292: =SUM(J292:L292)-0.98 -> 9.3200000000000003 | N292: 0.97999999999999998 | O292: =SUM(M292:N292) -> 10.300000000000001
A293: 3318 | B293: EOL UNIÃO DOS VENTOS 4 | C293: 13.336.491/0001-98 | D293: 4.6799999999999997 | E293: 0 | F293: 0 | G293: 0 | H293: 0 | I293: 0 | J293: 0 | K293: 5.1699999999999999 | L293: 0 | M293: =SUM(J293:L293)-0.49 -> 4.6799999999999997 | N293: 0.48999999999999999 | O293: =SUM(M293:N293) -> 5.1699999999999999
A294: 3319 | B294: EOL UNIÃO DOS VENTOS 5 | C294: 13.336.386/0001-59 | D294: 9.9299999999999997 | E294: 0 | F294: 0 | G294: 0 | H294: 0 | I294: 0 | J294: 0 | K294: 10.98 | L294: 0 | M294: =SUM(J294:L294)-1.05 -> 9.9299999999999997 | N294: 1.05 | O294: =SUM(M294:N294) -> 10.98
A295: 3320 | B295: EOL UNIÃO DOS VENTOS 6 | C295: 13.336.397/0001-39 | D295: 5.3399999999999999 | E295: 0 | F295: 0 | G295: 0 | H295: 0 | I295: 0 | J295: 0 | K295: 5.9000000000000004 | L295: 0 | M295: =SUM(J295:L295)-0.56 -> 5.3399999999999999 | N295: 0.56000000000000005 | O295: =SUM(M295:N295) -> 5.9000000000000004
A296: 3321 | B296: EOL UNIÃO DOS VENTOS 7 | C296: 13.341.988/0001-02 | D296: 6.04 | E296: 0 | F296: 0 | G296: 0 | H296: 0 | I296: 0 | J296: 0 | K296: 6.6799999999999997 | L296: 0 | M296: =SUM(J296:L296)-0.64 -> 6.04 | N296: 0.64000000000000001 | O296: =SUM(M296:N296) -> 6.6799999999999997
A297: 3322 | B297: EOL UNIÃO DOS VENTOS 8 | C297: 13.336.404/0001-00 | D297: 6.4199999999999999 | E297: 0 | F297: 0 | G297: 0 | H297: 0 | I297: 0 | J297: 0 | K297: 7.0999999999999996 | L297: 0 | M297: =SUM(J297:L297)-0.68 -> 6.4199999999999999 | N297: 0.68000000000000005 | O297: =SUM(M297:N297) -> 7.0999999999999996
A298: 3323 | B298: EOL UNIÃO DOS VENTOS 9 | C298: 13.336.428/0001-51 | D298: 4.7699999999999996 | E298: 0 | F298: 0 | G298: 0 | H298: 0 | I298: 0 | J298: 0 | K298: 5.2699999999999996 | L298: 0 | M298: =SUM(J298:L298)-0.5 -> 4.7699999999999996 | N298: 0.5 | O298: =SUM(M298:N298) -> 5.2699999999999996
A299: 3324 | B299: EOL UNIÃO DOS VENTOS 10 | C299: 13.336.415/0001-82 | D299: 6.1100000000000003 | E299: 0 | F299: 0 | G299: 0 | H299: 0 | I299: 0 | J299: 0 | K299: 6.75 | L299: 0 | M299: =SUM(J299:L299)-0.64 -> 6.1100000000000003 | N299: 0.64000000000000001 | O299: =SUM(M299:N299) -> 6.75
A300: 3325 | B300: UTE PARNAÍBA IV | C300: 14.578.002/0001-77 | D300: 41.039999999999999 | E300: 0 | F300: 0 | G300: 0 | H300: 0 | I300: 0 | J300: 0 | K300: 45.369999999999997 | L300: 0 | M300: =SUM(J300:L300)-4.33 -> 41.039999999999999 | N300: 4.3300000000000001 | O300: =SUM(M300:N300) -> 45.369999999999997
A301: 3326 | B301: EOL PRIMAVERA | C301: 12.851.871/0004-40 | D301: 13.32 | E301: 0 | F301: 0 | G301: 0 | H301: 0 | I301: 0 | J301: 0 | K301: 14.720000000000001 | L301: 0 | M301: =SUM(J301:L301)-1.4 -> 13.32 | N301: 1.3999999999999999 | O301: =SUM(M301:N301) -> 14.720000000000001
A302: 3327 | B302: EOL MODELO I | C302: 14.512.809/0002-98 | D302: 13.449999999999999 | E302: 0 | F302: 0 | G302: 0 | H302: 0 | I302: 0 | J302: 0 | K302: 14.869999999999999 | L302: 0 | M302: =SUM(J302:L302)-1.42 -> 13.449999999999999 | N302: 1.4199999999999999 | O302: =SUM(M302:N302) -> 14.869999999999999
A303: 3328 | B303: EOL MODELO II | C303: 14.504.489/0002-24 | D303: 11.699999999999999 | E303: 0 | F303: 0 | G303: 0 | H303: 0 | I303: 0 | J303: 0 | K303: 12.93 | L303: 0 | M303: =SUM(J303:L303)-1.23 -> 11.699999999999999 | N303: 1.23 | O303: =SUM(M303:N303) -> 12.93
A304: 3329 | B304: EOL SÃO JUDAS | C304: 12.851.951/0003-15 | D304: 13.199999999999999 | E304: 0 | F304: 0 | G304: 0 | H304: 0 | I304: 0 | J304: 0 | K304: 14.59 | L304: 0 | M304: =SUM(J304:L304)-1.39 -> 13.199999999999999 | N304: 1.3899999999999999 | O304: =SUM(M304:N304) -> 14.59
A305: 3330 | B305: EOL CRISTAL | C305: 12.851.920/0003-64 | D305: 13.25 | E305: 0 | F305: 0 | G305: 0 | H305: 0 | I305: 0 | J305: 0 | K305: 14.65 | L305: 0 | M305: =SUM(J305:L305)-1.4 -> 13.25 | N305: 1.3999999999999999 | O305: =SUM(M305:N305) -> 14.65
A306: 3331 | B306: EOL PEDRA PRETA | C306: 09.665.342/0002-86 | D306: 9.1199999999999992 | E306: 0 | F306: 0 | G306: 0 | H306: 0 | I306: 0 | J306: 0 | K306: 10.08 | L306: 0 | M306: =SUM(J306:L306)-0.96 -> 9.120000000000001 | N306: 0.95999999999999996 | O306: =SUM(M306:N306) -> 10.080000000000002
A307: 3332 | B307: EOL COSTA BRANCA | C307: 09.665.392/0002-63 | D307: 9.1199999999999992 | E307: 0 | F307: 0 | G307: 0 | H307: 0 | I307: 0 | J307: 0 | K307: 10.08 | L307: 0 | M307: =SUM(J307:L307)-0.96 -> 9.120000000000001 | N307: 0.95999999999999996 | O307: =SUM(M307:N307) -> 10.080000000000002
A308: 3333 | B308: EOL JUREMAS | C308: 09.665.446/0002-90 | D308: 7.1600000000000001 | E308: 0 | F308: 0 | G308: 0 | H308: 0 | I308: 0 | J308: 0 | K308: 7.9100000000000001 | L308: 0 | M308: =SUM(J308:L308)-0.75 -> 7.1600000000000001 | N308: 0.75 | O308: =SUM(M308:N308) -> 7.9100000000000001
A309: 3334 | B309: EOL MACACOS | C309: 07.091.059/0002-62 | D309: 9.1199999999999992 | E309: 0 | F309: 0 | G309: 0 | H309: 0 | I309: 0 | J309: 0 | K309: 10.08 | L309: 0 | M309: =SUM(J309:L309)-0.96 -> 9.120000000000001 | N309: 0.95999999999999996 | O309: =SUM(M309:N309) -> 10.080000000000002
A310: 3335 | B310: EOL EMILIANA | C310: 14.422.996/0002-19 | D310: 12.44 | E310: 0 | F310: 0 | G310: 0 | H310: 0 | I310: 0 | J310: 0 | K310: 13.75 | L310: 0 | M310: =SUM(J310:L310)-1.31 -> 12.44 | N310: 1.3100000000000001 | O310: =SUM(M310:N310) -> 13.75
A311: 3336 | B311: EOL JOANA | C311: 14.423.010/0002-25 | D311: 12.44 | E311: 0 | F311: 0 | G311: 0 | H311: 0 | I311: 0 | J311: 0 | K311: 13.75 | L311: 0 | M311: =SUM(J311:L311)-1.31 -> 12.44 | N311: 1.3100000000000001 | O311: =SUM(M311:N311) -> 13.75
A312: 3337 | B312: UHE SANTO ANTONIO JARI | C312: 03.581.989/0003-24 | D312: 236.75 | E312: 0 | F312: 0 | G312: 0 | H312: 0 | I312: 0 | J312: 0 | K312: 261.70999999999998 | L312: 0 | M312: =SUM(J312:L312)-24.96 -> 236.74999999999997 | N312: 24.960000000000001 | O312: =SUM(M312:N312) -> 261.70999999999998
A313: 3338 | B313: EOL CARCARÁ I | C313: 14.535.594/0001-40 | D313: 13.449999999999999 | E313: 0 | F313: 0 | G313: 0 | H313: 0 | I313: 0 | J313: 0 | K313: 14.869999999999999 | L313: 0 | M313: =SUM(J313:L313)-1.42 -> 13.449999999999999 | N313: 1.4199999999999999 | O313: =SUM(M313:N313) -> 14.869999999999999
A314: 3339 | B314: DESA (EOL EURUS I) | C314: 12.652.614/0001-37 | D314: 13.550000000000001 | E314: 0 | F314: 0 | G314: 0 | H314: 0 | I314: 0 | J314: 0 | K314: 14.98 | L314: 0 | M314: =SUM(J314:L314)-1.43 -> 13.550000000000001 | N314: 1.4299999999999999 | O314: =SUM(M314:N314) -> 14.98
A315: 3340 | B315: DESA (EOL EURUS III) | C315: 12.652.634/0001-08 | D315: 13.289999999999999 | E315: 0 | F315: 0 | G315: 0 | H315: 0 | I315: 0 | J315: 0 | K315: 14.69 | L315: 0 | M315: =SUM(J315:L315)-1.4 -> 13.289999999999999 | N315: 1.3999999999999999 | O315: =SUM(M315:N315) -> 14.69
A316: 3341 | B316: EOL CARCARÁ II | C316: 15.394.399/0001-00 | D316: 10.58 | E316: 0 | F316: 0 | G316: 0 | H316: 0 | I316: 0 | J316: 0 | K316: 11.699999999999999 | L316: 0 | M316: =SUM(J316:L316)-1.12 -> 10.579999999999998 | N316: 1.1200000000000001 | O316: =SUM(M316:N316) -> 11.699999999999999
A317: 3342 | B317: EOL RENASCENÇA V | C317: 10.797.904/0001-43 | D317: 13.369999999999999 | E317: 0 | F317: 0 | G317: 0 | H317: 0 | I317: 0 | J317: 0 | K317: 14.779999999999999 | L317: 0 | M317: =SUM(J317:L317)-1.41 -> 13.369999999999999 | N317: 1.4099999999999999 | O317: =SUM(M317:N317) -> 14.779999999999999
A318: 3343 | B318: ATLANTIC (EOL EURUS II) | C318: 10.797.897/0001-80 | D318: 13.369999999999999 | E318: 0 | F318: 0 | G318: 0 | H318: 0 | I318: 0 | J318: 0 | K318: 14.779999999999999 | L318: 0 | M318: =SUM(J318:L318)-1.41 -> 13.369999999999999 | N318: 1.4099999999999999 | O318: =SUM(M318:N318) -> 14.779999999999999
A319: 3344 | B319: EOL SANTO ANTÔNIO DE PÁDUA | C319: 09.601.233/0001-14 | D319: 5.8899999999999997 | E319: 0 | F319: 0 | G319: 0 | H319: 0 | I319: 0 | J319: 0 | K319: 6.5099999999999998 | L319: 0 | M319: =SUM(J319:L319)-0.62 -> 5.8899999999999997 | N319: 0.62 | O319: =SUM(M319:N319) -> 6.5099999999999998
A320: 3345 | B320: EOL SÃO CRISTOVÃO | C320: 10.272.500/0001-36 | D320: 10.630000000000001 | E320: 0 | F320: 0 | G320: 0 | H320: 0 | I320: 0 | J320: 0 | K320: 11.75 | L320: 0 | M320: =SUM(J320:L320)-1.12 -> 10.629999999999999 | N320: 1.1200000000000001 | O320: =SUM(M320:N320) -> 11.75
A321: 3346 | B321: EOL SÃO JORGE | C321: 09.571.485/0001-48 | D321: 10.039999999999999 | E321: 0 | F321: 0 | G321: 0 | H321: 0 | I321: 0 | J321: 0 | K321: 11.1 | L321: 0 | M321: =SUM(J321:L321)-1.06 -> 10.039999999999999 | N321: 1.0600000000000001 | O321: =SUM(M321:N321) -> 11.1
A322: 3347 | B322: EOL V. DO NORDESTE | C322: 11.204.086/0001-90 | D322: 10.699999999999999 | E322: 0 | F322: 0 | G322: 0 | H322: 0 | I322: 0 | J322: 0 | K322: 11.83 | L322: 0 | M322: =SUM(J322:L322)-1.13 -> 10.699999999999999 | N322: 1.1299999999999999 | O322: =SUM(M322:N322) -> 11.829999999999998
A323: 3348 | B323: EOL TANQUE | C323: 12.048.059/0001-39 | D323: 13.640000000000001 | E323: 0 | F323: 0 | G323: 0 | H323: 0 | I323: 0 | J323: 0 | K323: 15.08 | L323: 0 | M323: =SUM(J323:L323)-1.44 -> 13.640000000000001 | N323: 1.4399999999999999 | O323: =SUM(M323:N323) -> 15.08
A324: 3349 | B324: EOL SERAÍMA | C324: 12.047.526/0001-06 | D324: 13.640000000000001 | E324: 0 | F324: 0 | G324: 0 | H324: 0 | I324: 0 | J324: 0 | K324: 15.08 | L324: 0 | M324: =SUM(J324:L324)-1.44 -> 13.640000000000001 | N324: 1.4399999999999999 | O324: =SUM(M324:N324) -> 15.08
A325: 3350 | B325: EOL DOS ARAÇAS | C325: 11.201.833/0001-37 | D325: 13.640000000000001 | E325: 0 | F325: 0 | G325: 0 | H325: 0 | I325: 0 | J325: 0 | K325: 15.08 | L325: 0 | M325: =SUM(J325:L325)-1.44 -> 13.640000000000001 | N325: 1.4399999999999999 | O325: =SUM(M325:N325) -> 15.08
A326: 3351 | B326: EOL DA PRATA | C326: 11.366.231/0001-30 | D326: 9.9299999999999997 | E326: 0 | F326: 0 | G326: 0 | H326: 0 | I326: 0 | J326: 0 | K326: 10.98 | L326: 0 | M326: =SUM(J326:L326)-1.05 -> 9.9299999999999997 | N326: 1.05 | O326: =SUM(M326:N326) -> 10.98
A327: 3352 | B327: EOL CAETITÉ 1 | C327: 12.158.428/0002-27 | D327: 11.41 | E327: 0 | F327: 0 | G327: 0 | H327: 0 | I327: 0 | J327: 0 | K327: 12.609999999999999 | L327: 0 | M327: =SUM(J327:L327)-1.2 -> 11.41 | N327: 1.2 | O327: =SUM(M327:N327) -> 12.609999999999999
A328: 3353 | B328: EOL TERRAL | C328: 15.394.357/0001-79 | D328: 10.58 | E328: 0 | F328: 0 | G328: 0 | H328: 0 | I328: 0 | J328: 0 | K328: 11.699999999999999 | L328: 0 | M328: =SUM(J328:L328)-1.12 -> 10.579999999999998 | N328: 1.1200000000000001 | O328: =SUM(M328:N328) -> 11.699999999999999
A329: 3354 | B329: TIJOA (UHE TRES IRMÃOS) | C329: 14.522.198/0001-88 | D329: 776.05999999999995 | E329: 0 | F329: 0 | G329: 0 | H329: 0 | I329: 0 | J329: 0 | K329: 857.87 | L329: 0 | M329: =SUM(J329:L329)-81.81 -> 776.05999999999995 | N329: 81.810000000000002 | O329: =SUM(M329:N329) -> 857.86999999999989
A330: 3355 | B330: EOL FAROL | C330: 12.723.335/0001-17 | D330: 8.0800000000000001 | E330: 0 | F330: 0 | G330: 0 | H330: 0 | I330: 0 | J330: 0 | K330: 8.9299999999999997 | L330: 0 | M330: =SUM(J330:L330)-0.85 -> 8.0800000000000001 | N330: 0.84999999999999998 | O330: =SUM(M330:N330) -> 8.9299999999999997
A331: 3356 | B331: UTE TROPICAL BIOENERGIA II | C331: 08.195.806/0001-94 | D331: 16.32 | E331: 0 | F331: 0 | G331: 0 | H331: 0 | I331: 0 | J331: 0 | K331: 18.039999999999999 | L331: 0 | M331: =SUM(J331:L331)-1.72 -> 16.32 | N331: 1.72 | O331: =SUM(M331:N331) -> 18.039999999999999
A332: 3357 | B332: UHE FERREIRA GOMES | C332: 12.489.315/0001-23 | D332: 201.02000000000001 | E332: 0 | F332: 0 | G332: 0 | H332: 0 | I332: 0 | J332: 0 | K332: 222.21000000000001 | L332: 0 | M332: =SUM(J332:L332)-21.19 -> 201.02000000000001 | N332: 21.190000000000001 | O332: =SUM(M332:N332) -> 222.21000000000001
A333: 3358 | B333: VENTOS DOS INDIOS (INDIOS 2-3) | C333: 11.622.264/0002-84 | D333: 17.210000000000001 | E333: 0 | F333: 0 | G333: 0 | H333: 0 | I333: 0 | J333: 0 | K333: 19.02 | L333: 0 | M333: =SUM(J333:L333)-1.81 -> 17.210000000000001 | N333: 1.8100000000000001 | O333: =SUM(M333:N333) -> 19.02
A334: 3359 | B334: NORTE ENERGIA (BELO MONTE) | C334: 12.300.288/0001-07 | D334: 10749.110000000001 | E334: 0 | F334: 0 | G334: 0 | H334: 0 | I334: 0 | J334: 0 | K334: 11882.209999999999 | L334: 0 | M334: =SUM(J334:L334)-1133.1 -> 10749.109999999999 | N334: 1133.0999999999999 | O334: =SUM(M334:N334) -> 11882.209999999999
A335: 3360 | B335: EOL MORRÃO | C335: 12.049.829/0001-68 | D335: 12.24 | E335: 0 | F335: 0 | G335: 0 | H335: 0 | I335: 0 | J335: 0 | K335: 13.529999999999999 | L335: 0 | M335: =SUM(J335:L335)-1.29 -> 12.239999999999998 | N335: 1.29 | O335: =SUM(M335:N335) -> 13.529999999999998
A336: 3361 | B336: ACARI (EOL RIACHÃO I) | C336: 12.959.291/0001-29 | D336: 12.16 | E336: 0 | F336: 0 | G336: 0 | H336: 0 | I336: 0 | J336: 0 | K336: 13.44 | L336: 0 | M336: =SUM(J336:L336)-1.28 -> 12.16 | N336: 1.28 | O336: =SUM(M336:N336) -> 13.44
A337: 3362 | B337: ALBUQUERQUE (EOL RIACHÃO II) | C337: 12.960.216/0001-88 | D337: 11.19 | E337: 0 | F337: 0 | G337: 0 | H337: 0 | I337: 0 | J337: 0 | K337: 12.369999999999999 | L337: 0 | M337: =SUM(J337:L337)-1.18 -> 11.19 | N337: 1.1799999999999999 | O337: =SUM(M337:N337) -> 12.369999999999999
A338: 3363 | B338: ANEMOI (EOL RIACHÃO IV) | C338: 12.959.327/0001-74 | D338: 12.26 | E338: 0 | F338: 0 | G338: 0 | H338: 0 | I338: 0 | J338: 0 | K338: 13.550000000000001 | L338: 0 | M338: =SUM(J338:L338)-1.29 -> 12.260000000000002 | N338: 1.29 | O338: =SUM(M338:N338) -> 13.550000000000001
A339: 3364 | B339: APELIOTES (EOL RIACHÃO VI) | C339: 12.959.413/0001-87 | D339: 12.289999999999999 | E339: 0 | F339: 0 | G339: 0 | H339: 0 | I339: 0 | J339: 0 | K339: 13.59 | L339: 0 | M339: =SUM(J339:L339)-1.3 -> 12.289999999999999 | N339: 1.3 | O339: =SUM(M339:N339) -> 13.59
A340: 3365 | B340: ARENA (EOL RIACHÃO VII) | C340: 11.781.913/0001-09 | D340: 12.31 | E340: 0 | F340: 0 | G340: 0 | H340: 0 | I340: 0 | J340: 0 | K340: 13.609999999999999 | L340: 0 | M340: =SUM(J340:L340)-1.3 -> 12.309999999999999 | N340: 1.3 | O340: =SUM(M340:N340) -> 13.609999999999999
A341: 3366 | B341: EOL SANTA HELENA | C341: 12.053.929/0002-49 | D341: 14.58 | E341: 0 | F341: 0 | G341: 0 | H341: 0 | I341: 0 | J341: 0 | K341: 16.120000000000001 | L341: 0 | M341: =SUM(J341:L341)-1.54 -> 14.580000000000002 | N341: 1.54 | O341: =SUM(M341:N341) -> 16.120000000000001
A342: 3367 | B342: EOL SM | C342: 12.053.787/0002-10 | D342: 14.41 | E342: 0 | F342: 0 | G342: 0 | H342: 0 | I342: 0 | J342: 0 | K342: 15.93 | L342: 0 | M342: =SUM(J342:L342)-1.52 -> 14.41 | N342: 1.52 | O342: =SUM(M342:N342) -> 15.93
A343: 3368 | B343: EOL VERACE I | C343: 42.873.310/0003-22 | D343: 6.5199999999999996 | E343: 0 | F343: 0 | G343: 0 | H343: 0 | I343: 0 | J343: 0 | K343: 7.21 | L343: 0 | M343: =SUM(J343:L343)-0.69 -> 6.5199999999999996 | N343: 0.68999999999999995 | O343: =SUM(M343:N343) -> 7.2099999999999991
A344: 3369 | B344: EOL VERACE II | C344: 42.873.310/0003-22 | D344: 6.5099999999999998 | E344: 0 | F344: 0 | G344: 0 | H344: 0 | I344: 0 | J344: 0 | K344: 7.2000000000000002 | L344: 0 | M344: =SUM(J344:L344)-0.69 -> 6.5099999999999998 | N344: 0.68999999999999995 | O344: =SUM(M344:N344) -> 7.1999999999999993
A345: 3370 | B345: EOL VERACE III | C345: 42.873.310/0003-22 | D345: 8.5199999999999996 | E345: 0 | F345: 0 | G345: 0 | H345: 0 | I345: 0 | J345: 0 | K345: 9.4199999999999999 | L345: 0 | M345: =SUM(J345:L345)-0.9 -> 8.5199999999999996 | N345: 0.90000000000000002 | O345: =SUM(M345:N345) -> 9.4199999999999999
A346: 3371 | B346: EOL VERACE IV | C346: 42.873.310/0003-22 | D346: 9.8300000000000001 | E346: 0 | F346: 0 | G346: 0 | H346: 0 | I346: 0 | J346: 0 | K346: 10.869999999999999 | L346: 0 | M346: =SUM(J346:L346)-1.04 -> 9.8299999999999983 | N346: 1.04 | O346: =SUM(M346:N346) -> 10.869999999999997
A347: 3372 | B347: EOL VERACE V | C347: 42.873.310/0003-22 | D347: 9.7699999999999996 | E347: 0 | F347: 0 | G347: 0 | H347: 0 | I347: 0 | J347: 0 | K347: 10.800000000000001 | L347: 0 | M347: =SUM(J347:L347)-1.03 -> 9.7700000000000014 | N347: 1.03 | O347: =SUM(M347:N347) -> 10.800000000000001
A348: 3373 | B348: EOL VERACE VI | C348: 42.873.310/0003-22 | D348: 5.9299999999999997 | E348: 0 | F348: 0 | G348: 0 | H348: 0 | I348: 0 | J348: 0 | K348: 6.5599999999999996 | L348: 0 | M348: =SUM(J348:L348)-0.63 -> 5.9299999999999997 | N348: 0.63 | O348: =SUM(M348:N348) -> 6.5599999999999996
A349: 3374 | B349: EOL VERACE VII | C349: 42.873.310/0003-22 | D349: 9.8300000000000001 | E349: 0 | F349: 0 | G349: 0 | H349: 0 | I349: 0 | J349: 0 | K349: 10.869999999999999 | L349: 0 | M349: =SUM(J349:L349)-1.04 -> 9.8299999999999983 | N349: 1.04 | O349: =SUM(M349:N349) -> 10.869999999999997
A350: 3375 | B350: EOL VERACE VIII | C350: 42.873.310/0003-22 | D350: 8.5099999999999998 | E350: 0 | F350: 0 | G350: 0 | H350: 0 | I350: 0 | J350: 0 | K350: 9.4100000000000001 | L350: 0 | M350: =SUM(J350:L350)-0.9 -> 8.5099999999999998 | N350: 0.90000000000000002 | O350: =SUM(M350:N350) -> 9.4100000000000001
A351: 3376 | B351: EOL VERACE IX | C351: 42.873.310/0003-22 | D351: 9.8000000000000007 | E351: 0 | F351: 0 | G351: 0 | H351: 0 | I351: 0 | J351: 0 | K351: 10.83 | L351: 0 | M351: =SUM(J351:L351)-1.03 -> 9.8000000000000007 | N351: 1.03 | O351: =SUM(M351:N351) -> 10.83
A352: 3377 | B352: EOL VERACE X | C352: 42.873.310/0003-22 | D352: 9.1799999999999997 | E352: 0 | F352: 0 | G352: 0 | H352: 0 | I352: 0 | J352: 0 | K352: 10.15 | L352: 0 | M352: =SUM(J352:L352)-0.97 -> 9.1799999999999997 | N352: 0.96999999999999997 | O352: =SUM(M352:N352) -> 10.15
A353: 3378 | B353: EOL AMETISTA | C353: 11.201.885/0001-03 | D353: 12.76 | E353: 0 | F353: 0 | G353: 0 | H353: 0 | I353: 0 | J353: 0 | K353: 14.109999999999999 | L353: 0 | M353: =SUM(J353:L353)-1.35 -> 12.76 | N353: 1.3500000000000001 | O353: =SUM(M353:N353) -> 14.109999999999999
A354: 3379 | B354: EOL DOURADOS | C354: 12.041.319/0001-44 | D354: 12.77 | E354: 0 | F354: 0 | G354: 0 | H354: 0 | I354: 0 | J354: 0 | K354: 14.119999999999999 | L354: 0 | M354: =SUM(J354:L354)-1.35 -> 12.77 | N354: 1.3500000000000001 | O354: =SUM(M354:N354) -> 14.119999999999999
A355: 3380 | B355: EOL MARON | C355: 12.041.214/0001-95 | D355: 13.57 | E355: 0 | F355: 0 | G355: 0 | H355: 0 | I355: 0 | J355: 0 | K355: 15 | L355: 0 | M355: =SUM(J355:L355)-1.43 -> 13.57 | N355: 1.4299999999999999 | O355: =SUM(M355:N355) -> 15
A356: 3381 | B356: EOL PILÕES | C356: 11.201.797/0001-01 | D356: 13.57 | E356: 0 | F356: 0 | G356: 0 | H356: 0 | I356: 0 | J356: 0 | K356: 15 | L356: 0 | M356: =SUM(J356:L356)-1.43 -> 13.57 | N356: 1.4299999999999999 | O356: =SUM(M356:N356) -> 15
A357: 3382 | B357: EOL MALHADINHA I | C357: 14.080.223/0002-00 | D357: 8.3800000000000008 | E357: 0 | F357: 0 | G357: 0 | H357: 0 | I357: 0 | J357: 0 | K357: 9.2599999999999998 | L357: 0 | M357: =SUM(J357:L357)-0.88 -> 8.379999999999999 | N357: 0.88 | O357: =SUM(M357:N357) -> 9.2599999999999998
A358: 3383 | B358: UTE CMPC | C358: 11.234.954/0001-85 | D358: 9.9900000000000002 | E358: 0 | F358: 0 | G358: 0 | H358: 0 | I358: 0 | J358: 0 | K358: 11.039999999999999 | L358: 0 | M358: =SUM(J358:L358)-1.05 -> 9.9899999999999984 | N358: 1.05 | O358: =SUM(M358:N358) -> 11.039999999999999
A359: 3384 | B359: EOL ASA BRANCA I | C359: 12.802.855/0001-15 | D359: 12.130000000000001 | E359: 0 | F359: 0 | G359: 0 | H359: 0 | I359: 0 | J359: 0 | K359: 13.41 | L359: 0 | M359: =SUM(J359:L359)-1.28 -> 12.130000000000001 | N359: 1.28 | O359: =SUM(M359:N359) -> 13.41
A360: 3385 | B360: EOL ASA BRANCA II | C360: 12.802.844/0001-35 | D360: 13.800000000000001 | E360: 0 | F360: 0 | G360: 0 | H360: 0 | I360: 0 | J360: 0 | K360: 15.25 | L360: 0 | M360: =SUM(J360:L360)-1.45 -> 13.800000000000001 | N360: 1.45 | O360: =SUM(M360:N360) -> 15.25
A361: 3386 | B361: EOL ASA BRANCA III | C361: 12.802.835/0001-44 | D361: 11.91 | E361: 0 | F361: 0 | G361: 0 | H361: 0 | I361: 0 | J361: 0 | K361: 13.17 | L361: 0 | M361: =SUM(J361:L361)-1.26 -> 11.91 | N361: 1.26 | O361: =SUM(M361:N361) -> 13.17
A362: 3387 | B362: EOL EURUS IV | C362: 12.802.866/0001-03 | D362: 14.460000000000001 | E362: 0 | F362: 0 | G362: 0 | H362: 0 | I362: 0 | J362: 0 | K362: 15.98 | L362: 0 | M362: =SUM(J362:L362)-1.52 -> 14.460000000000001 | N362: 1.52 | O362: =SUM(M362:N362) -> 15.98
A363: 3388 | B363: ALIANÇA (CONS. PORTO ESTRELA) | C363: 12.009.135/0001-05 | D363: 37.189999999999998 | E363: 0 | F363: 0 | G363: 0 | H363: 0 | I363: 0 | J363: 0 | K363: 41.109999999999999 | L363: 0 | M363: =SUM(J363:L363)-3.92 -> 37.189999999999998 | N363: 3.9199999999999999 | O363: =SUM(M363:N363) -> 41.109999999999999
A364: 3389 | B364: ALIANÇA (UHE AIMORÉS) | C364: 12.009.135/0001-05 | D364: 176.11000000000001 | E364: 0 | F364: 0 | G364: 0 | H364: 0 | I364: 0 | J364: 0 | K364: 194.66999999999999 | L364: 0 | M364: =SUM(J364:L364)-18.56 -> 176.10999999999999 | N364: 18.559999999999999 | O364: =SUM(M364:N364) -> 194.66999999999999
A365: 3390 | B365: EOL LANCHINHA | C365: 14.603.978/0001-52 | D365: 12.66 | E365: 0 | F365: 0 | G365: 0 | H365: 0 | I365: 0 | J365: 0 | K365: 13.99 | L365: 0 | M365: =SUM(J365:L365)-1.33 -> 12.66 | N365: 1.3300000000000001 | O365: =SUM(M365:N365) -> 13.99
A366: 3391 | B366: EOL PELADO | C366: 14.604.100/0001-31 | D366: 8.9800000000000004 | E366: 0 | F366: 0 | G366: 0 | H366: 0 | I366: 0 | J366: 0 | K366: 9.9299999999999997 | L366: 0 | M366: =SUM(J366:L366)-0.95 -> 8.9800000000000004 | N366: 0.94999999999999996 | O366: =SUM(M366:N366) -> 9.9299999999999997
A367: 3392 | B367: EOL CHUÍ I | C367: 42.873.310/0002-41 | D367: 7.9400000000000004 | E367: 0 | F367: 0 | G367: 0 | H367: 0 | I367: 0 | J367: 0 | K367: 8.7799999999999994 | L367: 0 | M367: =SUM(J367:L367)-0.84 -> 7.9399999999999995 | N367: 0.83999999999999997 | O367: =SUM(M367:N367) -> 8.7799999999999994
A368: 3393 | B368: EOL CHUÍ II | C368: 42.873.310/0002-41 | D368: 7.21 | E368: 0 | F368: 0 | G368: 0 | H368: 0 | I368: 0 | J368: 0 | K368: 7.9699999999999998 | L368: 0 | M368: =SUM(J368:L368)-0.76 -> 7.21 | N368: 0.76000000000000001 | O368: =SUM(M368:N368) -> 7.9699999999999998
A369: 3394 | B369: EOL CHUÍ IV | C369: 42.873.310/0002-41 | D369: 7.21 | E369: 0 | F369: 0 | G369: 0 | H369: 0 | I369: 0 | J369: 0 | K369: 7.9699999999999998 | L369: 0 | M369: =SUM(J369:L369)-0.76 -> 7.21 | N369: 0.76000000000000001 | O369: =SUM(M369:N369) -> 7.9699999999999998
A370: 3395 | B370: EOL CHUÍ V | C370: 42.873.310/0002-41 | D370: 9.8100000000000005 | E370: 0 | F370: 0 | G370: 0 | H370: 0 | I370: 0 | J370: 0 | K370: 10.84 | L370: 0 | M370: =SUM(J370:L370)-1.03 -> 9.8100000000000005 | N370: 1.03 | O370: =SUM(M370:N370) -> 10.84
A371: 3396 | B371: EOL MINUANO I | C371: 42.873.310/0002-41 | D371: 7.1100000000000003 | E371: 0 | F371: 0 | G371: 0 | H371: 0 | I371: 0 | J371: 0 | K371: 7.8600000000000003 | L371: 0 | M371: =SUM(J371:L371)-0.75 -> 7.1100000000000003 | N371: 0.75 | O371: =SUM(M371:N371) -> 7.8600000000000003
A372: 3397 | B372: EOL MINUANO II | C372: 42.873.310/0002-41 | D372: 7.7800000000000002 | E372: 0 | F372: 0 | G372: 0 | H372: 0 | I372: 0 | J372: 0 | K372: 8.5999999999999996 | L372: 0 | M372: =SUM(J372:L372)-0.82 -> 7.7799999999999994 | N372: 0.81999999999999995 | O372: =SUM(M372:N372) -> 8.5999999999999996
A373: 3398 | B373: PETROBRAS (UTE U-50) | C373: 33.000.167/1111-08 | D373: 17.25 | E373: 0 | F373: 0 | G373: 0 | H373: 0 | I373: 0 | J373: 0 | K373: 19.07 | L373: 0 | M373: =SUM(J373:L373)-1.82 -> 17.25 | N373: 1.8200000000000001 | O373: =SUM(M373:N373) -> 19.07
A374: 3399 | B374: EOL VENTOS DE SANTO URIEL | C374: 14.583.703/0001-02 | D374: 7.2599999999999998 | E374: 0 | F374: 0 | G374: 0 | H374: 0 | I374: 0 | J374: 0 | K374: 8.0299999999999994 | L374: 0 | M374: =SUM(J374:L374)-0.77 -> 7.2599999999999998 | N374: 0.77000000000000002 | O374: =SUM(M374:N374) -> 8.0299999999999994
A375: 3401 | B375: RAESA (UTE CRISTIANO DA ROCHA) | C375: 07.386.098/0002-97 | D375: 48.68 | E375: 0 | F375: 0 | G375: 0 | H375: 0 | I375: 0 | J375: 0 | K375: 53.810000000000002 | L375: 0 | M375: =SUM(J375:L375)-5.13 -> 48.68 | N375: 5.1299999999999999 | O375: =SUM(M375:N375) -> 53.810000000000002
A376: 3402 | B376: UHE TELES PIRES | C376: 12.810.896/0005-87 | D376: 2990.3400000000001 | E376: 0 | F376: 0 | G376: 0 | H376: 0 | I376: 0 | J376: 0 | K376: 3305.5599999999999 | L376: 0 | M376: =SUM(J376:L376)-315.22 -> 2990.3400000000001 | N376: 315.22000000000003 | O376: =SUM(M376:N376) -> 3305.5600000000004
A377: 3403 | B377: DESA (EOL MORRO DOS VENTOS II) | C377: 15.207.271/0001-90 | D377: 11.08 | E377: 0 | F377: 0 | G377: 0 | H377: 0 | I377: 0 | J377: 0 | K377: 12.25 | L377: 0 | M377: =SUM(J377:L377)-1.17 -> 11.08 | N377: 1.1699999999999999 | O377: =SUM(M377:N377) -> 12.25
A378: 3404 | B378: EOL REDUTO | C378: 14.527.003/0001-92 | D378: 11.92 | E378: 0 | F378: 0 | G378: 0 | H378: 0 | I378: 0 | J378: 0 | K378: 13.18 | L378: 0 | M378: =SUM(J378:L378)-1.26 -> 11.92 | N378: 1.26 | O378: =SUM(M378:N378) -> 13.18
A379: 3405 | B379: EOL CHUÍ IX | C379: 42.873.310/0003-22 | D379: 7.1200000000000001 | E379: 0 | F379: 0 | G379: 0 | H379: 0 | I379: 0 | J379: 0 | K379: 7.8700000000000001 | L379: 0 | M379: =SUM(J379:L379)-0.75 -> 7.1200000000000001 | N379: 0.75 | O379: =SUM(M379:N379) -> 7.8700000000000001
A380: 3406 | B380: EOL VENTOS DE SANTA JOANA IX | C380: 19.082.784/0002-53 | D380: 6.8600000000000003 | E380: 0 | F380: 0 | G380: 0 | H380: 0 | I380: 0 | J380: 0 | K380: 7.5800000000000001 | L380: 0 | M380: =SUM(J380:L380)-0.72 -> 6.8600000000000003 | N380: 0.71999999999999997 | O380: =SUM(M380:N380) -> 7.5800000000000001
A381: 3407 | B381: EOL VENTOS DE SANTA JOANA X | C381: 19.082.754/0002-47 | D381: 6.8600000000000003 | E381: 0 | F381: 0 | G381: 0 | H381: 0 | I381: 0 | J381: 0 | K381: 7.5800000000000001 | L381: 0 | M381: =SUM(J381:L381)-0.72 -> 6.8600000000000003 | N381: 0.71999999999999997 | O381: =SUM(M381:N381) -> 7.5800000000000001
A382: 3408 | B382: EOL VENTOS DE SANTA JOANA XI | C382: 19.082.675/0002-36 | D382: 6.8600000000000003 | E382: 0 | F382: 0 | G382: 0 | H382: 0 | I382: 0 | J382: 0 | K382: 7.5800000000000001 | L382: 0 | M382: =SUM(J382:L382)-0.72 -> 6.8600000000000003 | N382: 0.71999999999999997 | O382: =SUM(M382:N382) -> 7.5800000000000001
A383: 3409 | B383: EOL VENTOS DE SANTA JOANA XII | C383: 19.082.701/0002-26 | D383: 6.7000000000000002 | E383: 0 | F383: 0 | G383: 0 | H383: 0 | I383: 0 | J383: 0 | K383: 7.4100000000000001 | L383: 0 | M383: =SUM(J383:L383)-0.71 -> 6.7000000000000002 | N383: 0.70999999999999996 | O383: =SUM(M383:N383) -> 7.4100000000000001
A384: 3410 | B384: EOL VENTOS DE SANTA JOANA XIII | C384: 19.082.800/0002-08 | D384: 6.8600000000000003 | E384: 0 | F384: 0 | G384: 0 | H384: 0 | I384: 0 | J384: 0 | K384: 7.5800000000000001 | L384: 0 | M384: =SUM(J384:L384)-0.72 -> 6.8600000000000003 | N384: 0.71999999999999997 | O384: =SUM(M384:N384) -> 7.5800000000000001
A385: 3411 | B385: EOL VENTOS DE SANTA JOANA XV | C385: 19.082.728/0002-19 | D385: 6.7000000000000002 | E385: 0 | F385: 0 | G385: 0 | H385: 0 | I385: 0 | J385: 0 | K385: 7.4100000000000001 | L385: 0 | M385: =SUM(J385:L385)-0.71 -> 6.7000000000000002 | N385: 0.70999999999999996 | O385: =SUM(M385:N385) -> 7.4100000000000001
A386: 3412 | B386: EOL VENTOS DE SANTA JOANA XVI | C386: 19.082.822/0002-78 | D386: 6.7000000000000002 | E386: 0 | F386: 0 | G386: 0 | H386: 0 | I386: 0 | J386: 0 | K386: 7.4100000000000001 | L386: 0 | M386: =SUM(J386:L386)-0.71 -> 6.7000000000000002 | N386: 0.70999999999999996 | O386: =SUM(M386:N386) -> 7.4100000000000001
A387: 3413 | B387: EOL VENTOS DE SANTO ONOFRE I | C387: 19.022.138/0001-10 | D387: 9.8499999999999996 | E387: 0 | F387: 0 | G387: 0 | H387: 0 | I387: 0 | J387: 0 | K387: 10.890000000000001 | L387: 0 | M387: =SUM(J387:L387)-1.04 -> 9.8500000000000014 | N387: 1.04 | O387: =SUM(M387:N387) -> 10.890000000000001
A388: 3414 | B388: EOL VENTOS DE SANTO ONOFRE II | C388: 19.022.974/0001-02 | D388: 9.7799999999999994 | E388: 0 | F388: 0 | G388: 0 | H388: 0 | I388: 0 | J388: 0 | K388: 10.81 | L388: 0 | M388: =SUM(J388:L388)-1.03 -> 9.7800000000000011 | N388: 1.03 | O388: =SUM(M388:N388) -> 10.81
A389: 3415 | B389: EOL VENTOS DE SANTO ONOFRE III | C389: 19.023.342/0001-55 | D389: 9.8499999999999996 | E389: 0 | F389: 0 | G389: 0 | H389: 0 | I389: 0 | J389: 0 | K389: 10.890000000000001 | L389: 0 | M389: =SUM(J389:L389)-1.04 -> 9.8500000000000014 | N389: 1.04 | O389: =SUM(M389:N389) -> 10.890000000000001
A390: 3416 | B390: EOL VENTOS DE SANTA JOANA II | C390: 19.023.213/0001-67 | D390: 9.8499999999999996 | E390: 0 | F390: 0 | G390: 0 | H390: 0 | I390: 0 | J390: 0 | K390: 10.890000000000001 | L390: 0 | M390: =SUM(J390:L390)-1.04 -> 9.8500000000000014 | N390: 1.04 | O390: =SUM(M390:N390) -> 10.890000000000001
A391: 3417 | B391: EOL VENTOS DE SANTA JOANA VI | C391: 19.022.818/0001-33 | D391: 9.8200000000000003 | E391: 0 | F391: 0 | G391: 0 | H391: 0 | I391: 0 | J391: 0 | K391: 10.859999999999999 | L391: 0 | M391: =SUM(J391:L391)-1.04 -> 9.8200000000000003 | N391: 1.04 | O391: =SUM(M391:N391) -> 10.859999999999999
A392: 3418 | B392: EOL VENTOS DE SANTA JOANA VIII | C392: 19.022.356/0001-54 | D392: 9.8200000000000003 | E392: 0 | F392: 0 | G392: 0 | H392: 0 | I392: 0 | J392: 0 | K392: 10.859999999999999 | L392: 0 | M392: =SUM(J392:L392)-1.04 -> 9.8200000000000003 | N392: 1.04 | O392: =SUM(M392:N392) -> 10.859999999999999
A393: 3419 | B393: EOL VENTOS DE SANTA JOANA XIV | C393: 19.023.513/0001-46 | D393: 9.8499999999999996 | E393: 0 | F393: 0 | G393: 0 | H393: 0 | I393: 0 | J393: 0 | K393: 10.890000000000001 | L393: 0 | M393: =SUM(J393:L393)-1.04 -> 9.8500000000000014 | N393: 1.04 | O393: =SUM(M393:N393) -> 10.890000000000001
A394: 3420 | B394: EOL BARAÚNAS I | C394: 19.354.626/0002-05 | D394: 24.039999999999999 | E394: 0 | F394: 0 | G394: 0 | H394: 0 | I394: 0 | J394: 0 | K394: 26.57 | L394: 0 | M394: =SUM(J394:L394)-2.53 -> 24.039999999999999 | N394: 2.5299999999999998 | O394: =SUM(M394:N394) -> 26.57
A395: 3421 | B395: EOL MORRO BRANCO I | C395: 19.353.878/0002-10 | D395: 12.01 | E395: 0 | F395: 0 | G395: 0 | H395: 0 | I395: 0 | J395: 0 | K395: 13.279999999999999 | L395: 0 | M395: =SUM(J395:L395)-1.27 -> 12.01 | N395: 1.27 | O395: =SUM(M395:N395) -> 13.279999999999999
A396: 3422 | B396: EOL MUSSAMBE | C396: 19.353.849/0002-58 | D396: 12.01 | E396: 0 | F396: 0 | G396: 0 | H396: 0 | I396: 0 | J396: 0 | K396: 13.279999999999999 | L396: 0 | M396: =SUM(J396:L396)-1.27 -> 12.01 | N396: 1.27 | O396: =SUM(M396:N396) -> 13.279999999999999
A397: 3423 | B397: UFV FONTES SOLAR I e II | C397: 18.303.676/0002-09 | D397: 1.6399999999999999 | E397: 0 | F397: 0 | G397: 0 | H397: 0 | I397: 0 | J397: 0 | K397: 1.8100000000000001 | L397: 0 | M397: =SUM(J397:L397)-0.17 -> 1.6400000000000001 | N397: 0.17000000000000001 | O397: =SUM(M397:N397) -> 1.8100000000000001
A398: 3424 | B398: EOL ASSURUÁ II | C398: 19.246.799/0002-00 | D398: 14.57 | E398: 0 | F398: 0 | G398: 0 | H398: 0 | I398: 0 | J398: 0 | K398: 16.109999999999999 | L398: 0 | M398: =SUM(J398:L398)-1.54 -> 14.57 | N398: 1.54 | O398: =SUM(M398:N398) -> 16.109999999999999
A399: 3425 | B399: EOL ASSURUÁ V | C399: 19.246.831/0002-57 | D399: 9.8300000000000001 | E399: 0 | F399: 0 | G399: 0 | H399: 0 | I399: 0 | J399: 0 | K399: 10.869999999999999 | L399: 0 | M399: =SUM(J399:L399)-1.04 -> 9.8299999999999983 | N399: 1.04 | O399: =SUM(M399:N399) -> 10.869999999999997
A400: 3426 | B400: EOL ASSURUÁ VII | C400: 19.246.849/0002-59 | D400: 8.8900000000000006 | E400: 0 | F400: 0 | G400: 0 | H400: 0 | I400: 0 | J400: 0 | K400: 9.8300000000000001 | L400: 0 | M400: =SUM(J400:L400)-0.94 -> 8.8900000000000006 | N400: 0.93999999999999995 | O400: =SUM(M400:N400) -> 9.8300000000000001
A401: 3427 | B401: EOL CARNAÚBAS | C401: 14.535.588/0001-92 | D401: 12.16 | E401: 0 | F401: 0 | G401: 0 | H401: 0 | I401: 0 | J401: 0 | K401: 13.44 | L401: 0 | M401: =SUM(J401:L401)-1.28 -> 12.16 | N401: 1.28 | O401: =SUM(M401:N401) -> 13.44
A402: 3428 | B402: EOL SÃO JOÃO | C402: 14.535.646/0001-88 | D402: 12.16 | E402: 0 | F402: 0 | G402: 0 | H402: 0 | I402: 0 | J402: 0 | K402: 13.44 | L402: 0 | M402: =SUM(J402:L402)-1.28 -> 12.16 | N402: 1.28 | O402: =SUM(M402:N402) -> 13.44
A403: 3429 | B403: EOL SANTO CRISTO | C403: 14.535.540/0001-84 | D403: 11.960000000000001 | E403: 0 | F403: 0 | G403: 0 | H403: 0 | I403: 0 | J403: 0 | K403: 13.220000000000001 | L403: 0 | M403: =SUM(J403:L403)-1.26 -> 11.960000000000001 | N403: 1.26 | O403: =SUM(M403:N403) -> 13.220000000000001
A404: 3430 | B404: EOL CAETITÉ A | C404: 19.233.858/0002-05 | D404: 7.7199999999999998 | E404: 0 | F404: 0 | G404: 0 | H404: 0 | I404: 0 | J404: 0 | K404: 8.5299999999999994 | L404: 0 | M404: =SUM(J404:L404)-0.81 -> 7.7199999999999989 | N404: 0.81000000000000005 | O404: =SUM(M404:N404) -> 8.5299999999999994
A405: 3431 | B405: EOL CAETITÉ B | C405: 19.235.607/0002-60 | D405: 7.1600000000000001 | E405: 0 | F405: 0 | G405: 0 | H405: 0 | I405: 0 | J405: 0 | K405: 7.9100000000000001 | L405: 0 | M405: =SUM(J405:L405)-0.75 -> 7.1600000000000001 | N405: 0.75 | O405: =SUM(M405:N405) -> 7.9100000000000001
A406: 3432 | B406: EOL CAETITÉ C | C406: 19.560.109/0002-92 | D406: 2.7799999999999998 | E406: 0 | F406: 0 | G406: 0 | H406: 0 | I406: 0 | J406: 0 | K406: 3.0699999999999998 | L406: 0 | M406: =SUM(J406:L406)-0.29 -> 2.7799999999999998 | N406: 0.28999999999999998 | O406: =SUM(M406:N406) -> 3.0699999999999998
A407: 3433 | B407: EOL VENTOS DA ANDORINHA | C407: 17.613.512/0002-07 | D407: 14.49 | E407: 0 | F407: 0 | G407: 0 | H407: 0 | I407: 0 | J407: 0 | K407: 16.02 | L407: 0 | M407: =SUM(J407:L407)-1.53 -> 14.49 | N407: 1.53 | O407: =SUM(M407:N407) -> 16.02
A408: 3434 | B408: EOL VENTOS DE CAMPO FORMOSO I | C408: 17.613.280/0002-97 | D408: 14.49 | E408: 0 | F408: 0 | G408: 0 | H408: 0 | I408: 0 | J408: 0 | K408: 16.02 | L408: 0 | M408: =SUM(J408:L408)-1.53 -> 14.49 | N408: 1.53 | O408: =SUM(M408:N408) -> 16.02
A409: 3435 | B409: EOL VENTOS DE CAMPO FORMOSO II | C409: 17.613.629/0002-90 | D409: 14.49 | E409: 0 | F409: 0 | G409: 0 | H409: 0 | I409: 0 | J409: 0 | K409: 16.02 | L409: 0 | M409: =SUM(J409:L409)-1.53 -> 14.49 | N409: 1.53 | O409: =SUM(M409:N409) -> 16.02
A410: 3436 | B410: EOL VENTOS DE MORRINHOS | C410: 17.613.286/0002-64 | D410: 14.49 | E410: 0 | F410: 0 | G410: 0 | H410: 0 | I410: 0 | J410: 0 | K410: 16.02 | L410: 0 | M410: =SUM(J410:L410)-1.53 -> 14.49 | N410: 1.53 | O410: =SUM(M410:N410) -> 16.02
A411: 3437 | B411: EOL VERACE 24 | C411: 42.873.310/0003-22 | D411: 7.8300000000000001 | E411: 0 | F411: 0 | G411: 0 | H411: 0 | I411: 0 | J411: 0 | K411: 8.6600000000000001 | L411: 0 | M411: =SUM(J411:L411)-0.83 -> 7.8300000000000001 | N411: 0.82999999999999996 | O411: =SUM(M411:N411) -> 8.6600000000000001
A412: 3438 | B412: EOL VERACE 25 | C412: 42.873.310/0003-22 | D412: 2.8399999999999999 | E412: 0 | F412: 0 | G412: 0 | H412: 0 | I412: 0 | J412: 0 | K412: 3.1400000000000001 | L412: 0 | M412: =SUM(J412:L412)-0.3 -> 2.8400000000000003 | N412: 0.29999999999999999 | O412: =SUM(M412:N412) -> 3.1400000000000001
A413: 3439 | B413: EOL VERACE 26 | C413: 42.873.310/0003-22 | D413: 5.6900000000000004 | E413: 0 | F413: 0 | G413: 0 | H413: 0 | I413: 0 | J413: 0 | K413: 6.29 | L413: 0 | M413: =SUM(J413:L413)-0.6 -> 5.6900000000000004 | N413: 0.59999999999999998 | O413: =SUM(M413:N413) -> 6.29
A414: 3440 | B414: EOL VERACE 27 | C414: 42.873.310/0003-22 | D414: 6.4100000000000001 | E414: 0 | F414: 0 | G414: 0 | H414: 0 | I414: 0 | J414: 0 | K414: 7.0899999999999999 | L414: 0 | M414: =SUM(J414:L414)-0.68 -> 6.4100000000000001 | N414: 0.68000000000000005 | O414: =SUM(M414:N414) -> 7.0899999999999999
A415: 3441 | B415: EOL VERACE 28 | C415: 42.873.310/0003-22 | D415: 4.9800000000000004 | E415: 0 | F415: 0 | G415: 0 | H415: 0 | I415: 0 | J415: 0 | K415: 5.5 | L415: 0 | M415: =SUM(J415:L415)-0.52 -> 4.9800000000000004 | N415: 0.52000000000000002 | O415: =SUM(M415:N415) -> 5.5
A416: 3442 | B416: EOL VERACE 29 | C416: 42.873.310/0003-22 | D416: 7.1200000000000001 | E416: 0 | F416: 0 | G416: 0 | H416: 0 | I416: 0 | J416: 0 | K416: 7.8700000000000001 | L416: 0 | M416: =SUM(J416:L416)-0.75 -> 7.1200000000000001 | N416: 0.75 | O416: =SUM(M416:N416) -> 7.8700000000000001
A417: 3443 | B417: EOL VERACE 30 | C417: 42.873.310/0003-22 | D417: 7.1200000000000001 | E417: 0 | F417: 0 | G417: 0 | H417: 0 | I417: 0 | J417: 0 | K417: 7.8700000000000001 | L417: 0 | M417: =SUM(J417:L417)-0.75 -> 7.1200000000000001 | N417: 0.75 | O417: =SUM(M417:N417) -> 7.8700000000000001
A418: 3444 | B418: EOL VERACE 31 | C418: 42.873.310/0003-22 | D418: 3.5600000000000001 | E418: 0 | F418: 0 | G418: 0 | H418: 0 | I418: 0 | J418: 0 | K418: 3.9399999999999999 | L418: 0 | M418: =SUM(J418:L418)-0.38 -> 3.5600000000000001 | N418: 0.38 | O418: =SUM(M418:N418) -> 3.9399999999999999
A419: 3445 | B419: EOL VERACE 35 | C419: 42.873.310/0003-22 | D419: 4.9800000000000004 | E419: 0 | F419: 0 | G419: 0 | H419: 0 | I419: 0 | J419: 0 | K419: 5.5 | L419: 0 | M419: =SUM(J419:L419)-0.52 -> 4.9800000000000004 | N419: 0.52000000000000002 | O419: =SUM(M419:N419) -> 5.5
A420: 3446 | B420: EOL VERACE 36 | C420: 42.873.310/0003-22 | D420: 8.5500000000000007 | E420: 0 | F420: 0 | G420: 0 | H420: 0 | I420: 0 | J420: 0 | K420: 9.4499999999999993 | L420: 0 | M420: =SUM(J420:L420)-0.9 -> 8.5499999999999989 | N420: 0.90000000000000002 | O420: =SUM(M420:N420) -> 9.4499999999999993
A421: 3447 | B421: EOL CAPÃO DO INGLÊS | C421: 02.016.507/0001-69 | D421: 3.8399999999999999 | E421: 0 | F421: 0 | G421: 0 | H421: 0 | I421: 0 | J421: 0 | K421: 4.2400000000000002 | L421: 0 | M421: =SUM(J421:L421)-0.4 -> 3.8400000000000003 | N421: 0.40000000000000002 | O421: =SUM(M421:N421) -> 4.2400000000000002
A422: 3448 | B422: EOL COXILHA SECA | C422: 02.016.507/0001-69 | D422: 11.65 | E422: 0 | F422: 0 | G422: 0 | H422: 0 | I422: 0 | J422: 0 | K422: 12.880000000000001 | L422: 0 | M422: =SUM(J422:L422)-1.23 -> 11.65 | N422: 1.23 | O422: =SUM(M422:N422) -> 12.880000000000001
A423: 3449 | B423: EOL GALPÕES | C423: 02.016.507/0001-69 | D423: 3.0800000000000001 | E423: 0 | F423: 0 | G423: 0 | H423: 0 | I423: 0 | J423: 0 | K423: 3.3999999999999999 | L423: 0 | M423: =SUM(J423:L423)-0.32 -> 3.0800000000000001 | N423: 0.32000000000000001 | O423: =SUM(M423:N423) -> 3.3999999999999999
A424: 3450 | B424: EOL VENTOS DO SERTÃO | C424: 17.613.432/0002-51 | D424: 14.49 | E424: 0 | F424: 0 | G424: 0 | H424: 0 | I424: 0 | J424: 0 | K424: 16.02 | L424: 0 | M424: =SUM(J424:L424)-1.53 -> 14.49 | N424: 1.53 | O424: =SUM(M424:N424) -> 16.02
A425: 3451 | B425: EOL VENTOS DE SANTA BRÍGIDA I | C425: 17.875.304/0001-03 | D425: 4.4900000000000002 | E425: 0 | F425: 0 | G425: 0 | H425: 0 | I425: 0 | J425: 0 | K425: 4.96 | L425: 0 | M425: =SUM(J425:L425)-0.47 -> 4.4900000000000002 | N425: 0.46999999999999997 | O425: =SUM(M425:N425) -> 4.96
A426: 3452 | B426: EOL VENTOS DE SANTA BRÍGIDA II | C426: 17.875.194/0001-71 | D426: 8.9800000000000004 | E426: 0 | F426: 0 | G426: 0 | H426: 0 | I426: 0 | J426: 0 | K426: 9.9299999999999997 | L426: 0 | M426: =SUM(J426:L426)-0.95 -> 8.9800000000000004 | N426: 0.94999999999999996 | O426: =SUM(M426:N426) -> 9.9299999999999997
A427: 3453 | B427: EOL VENTOS DE SANTA BRÍGIDA III | C427: 17.875.184/0001-36 | D427: 9.5 | E427: 0 | F427: 0 | G427: 0 | H427: 0 | I427: 0 | J427: 0 | K427: 10.5 | L427: 0 | M427: =SUM(J427:L427)-1 -> 9.5 | N427: 1 | O427: =SUM(M427:N427) -> 10.5
A428: 3454 | B428: EOL VENTOS DE SANTA BRÍGIDA IV | C428: 17.875.122/0001-24 | D428: 8.9800000000000004 | E428: 0 | F428: 0 | G428: 0 | H428: 0 | I428: 0 | J428: 0 | K428: 9.9299999999999997 | L428: 0 | M428: =SUM(J428:L428)-0.95 -> 8.9800000000000004 | N428: 0.94999999999999996 | O428: =SUM(M428:N428) -> 9.9299999999999997
A429: 3455 | B429: EOL VENTOS DE SANTA BRÍGIDA V | C429: 17.875.103/0001-06 | D429: 9.5 | E429: 0 | F429: 0 | G429: 0 | H429: 0 | I429: 0 | J429: 0 | K429: 10.5 | L429: 0 | M429: =SUM(J429:L429)-1 -> 9.5 | N429: 1 | O429: =SUM(M429:N429) -> 10.5
A430: 3456 | B430: EOL VENTOS DE SANTA BRÍGIDA VI | C430: 17.875.341/0001-03 | D430: 9.5 | E430: 0 | F430: 0 | G430: 0 | H430: 0 | I430: 0 | J430: 0 | K430: 10.5 | L430: 0 | M430: =SUM(J430:L430)-1 -> 9.5 | N430: 1 | O430: =SUM(M430:N430) -> 10.5
A431: 3457 | B431: EOL VENTOS DE SANTA BRÍGIDA VII | C431: 17.875.270/0001-49 | D431: 8.9800000000000004 | E431: 0 | F431: 0 | G431: 0 | H431: 0 | I431: 0 | J431: 0 | K431: 9.9299999999999997 | L431: 0 | M431: =SUM(J431:L431)-0.95 -> 8.9800000000000004 | N431: 0.94999999999999996 | O431: =SUM(M431:N431) -> 9.9299999999999997
A432: 3458 | B432: EOL ESPERANÇA | C432: 19.011.517/0002-95 | D432: 17.890000000000001 | E432: 0 | F432: 0 | G432: 0 | H432: 0 | I432: 0 | J432: 0 | K432: 19.780000000000001 | L432: 0 | M432: =SUM(J432:L432)-1.89 -> 17.890000000000001 | N432: 1.8899999999999999 | O432: =SUM(M432:N432) -> 19.780000000000001
A433: 3459 | B433: EOL MANIÇOBA | C433: 19.011.479/0002-70 | D433: 19.140000000000001 | E433: 0 | F433: 0 | G433: 0 | H433: 0 | I433: 0 | J433: 0 | K433: 21.16 | L433: 0 | M433: =SUM(J433:L433)-2.02 -> 19.140000000000001 | N433: 2.02 | O433: =SUM(M433:N433) -> 21.16
A434: 3460 | B434: EOL DAMASCENA | C434: 19.046.080/0002-25 | D434: 19.140000000000001 | E434: 0 | F434: 0 | G434: 0 | H434: 0 | I434: 0 | J434: 0 | K434: 21.16 | L434: 0 | M434: =SUM(J434:L434)-2.02 -> 19.140000000000001 | N434: 2.02 | O434: =SUM(M434:N434) -> 21.16
A435: 3461 | B435: EOL VENTOS DE SANTA JOANA I | C435: 19.724.929/0002-72 | D435: 9.4700000000000006 | E435: 0 | F435: 0 | G435: 0 | H435: 0 | I435: 0 | J435: 0 | K435: 10.470000000000001 | L435: 0 | M435: =SUM(J435:L435)-1 -> 9.4700000000000006 | N435: 1 | O435: =SUM(M435:N435) -> 10.470000000000001
A436: 3462 | B436: EOL VENTOS DE SANTA JOANA IV | C436: 19.725.614/0002-40 | D436: 8.9100000000000001 | E436: 0 | F436: 0 | G436: 0 | H436: 0 | I436: 0 | J436: 0 | K436: 9.8499999999999996 | L436: 0 | M436: =SUM(J436:L436)-0.94 -> 8.9100000000000001 | N436: 0.93999999999999995 | O436: =SUM(M436:N436) -> 9.8499999999999996
A437: 3463 | B437: EOL VENTOS DE SANTA JOANA V | C437: 19.725.631/0002-87 | D437: 9.4700000000000006 | E437: 0 | F437: 0 | G437: 0 | H437: 0 | I437: 0 | J437: 0 | K437: 10.470000000000001 | L437: 0 | M437: =SUM(J437:L437)-1 -> 9.4700000000000006 | N437: 1 | O437: =SUM(M437:N437) -> 10.470000000000001
A438: 3464 | B438: EOL VENTOS DE SANTA JOANA VII | C438: 19.725.315/0002-05 | D438: 9.4700000000000006 | E438: 0 | F438: 0 | G438: 0 | H438: 0 | I438: 0 | J438: 0 | K438: 10.470000000000001 | L438: 0 | M438: =SUM(J438:L438)-1 -> 9.4700000000000006 | N438: 1 | O438: =SUM(M438:N438) -> 10.470000000000001
A439: 3465 | B439: EOL VENTOS DE SANTO AUGUSTO III | C439: 17.875.483/0002-51 | D439: 9.6999999999999993 | E439: 0 | F439: 0 | G439: 0 | H439: 0 | I439: 0 | J439: 0 | K439: 10.720000000000001 | L439: 0 | M439: =SUM(J439:L439)-1.02 -> 9.7000000000000011 | N439: 1.02 | O439: =SUM(M439:N439) -> 10.720000000000001
A440: 3466 | B440: EOL VENTOS DE SANTO AUGUSTO IV | C440: 19.781.992/0002-40 | D440: 9.4700000000000006 | E440: 0 | F440: 0 | G440: 0 | H440: 0 | I440: 0 | J440: 0 | K440: 10.470000000000001 | L440: 0 | M440: =SUM(J440:L440)-1 -> 9.4700000000000006 | N440: 1 | O440: =SUM(M440:N440) -> 10.470000000000001
A441: 3467 | B441: EOL VENTOS DE SANTO AUGUSTO V | C441: 17.875.427/0002-17 | D441: 9.6999999999999993 | E441: 0 | F441: 0 | G441: 0 | H441: 0 | I441: 0 | J441: 0 | K441: 10.720000000000001 | L441: 0 | M441: =SUM(J441:L441)-1.02 -> 9.7000000000000011 | N441: 1.02 | O441: =SUM(M441:N441) -> 10.720000000000001
A442: 3468 | B442: EOL SERRA DAS VACAS I | C442: 18.127.269/0001-07 | D442: 7.3799999999999999 | E442: 0 | F442: 0 | G442: 0 | H442: 0 | I442: 0 | J442: 0 | K442: 8.1600000000000001 | L442: 0 | M442: =SUM(J442:L442)-0.78 -> 7.3799999999999999 | N442: 0.78000000000000003 | O442: =SUM(M442:N442) -> 8.1600000000000001
A443: 3469 | B443: EOL SERRA DAS VACAS II | C443: 19.224.741/0001-84 | D443: 6.9400000000000004 | E443: 0 | F443: 0 | G443: 0 | H443: 0 | I443: 0 | J443: 0 | K443: 7.6699999999999999 | L443: 0 | M443: =SUM(J443:L443)-0.73 -> 6.9399999999999995 | N443: 0.72999999999999998 | O443: =SUM(M443:N443) -> 7.6699999999999999
A444: 3470 | B444: EOL SERRA DAS VACAS IV | C444: 19.694.146/0001-02 | D444: 7.0999999999999996 | E444: 0 | F444: 0 | G444: 0 | H444: 0 | I444: 0 | J444: 0 | K444: 7.8499999999999996 | L444: 0 | M444: =SUM(J444:L444)-0.75 -> 7.0999999999999996 | N444: 0.75 | O444: =SUM(M444:N444) -> 7.8499999999999996
A445: 3471 | B445: EOL VERACE 34 | C445: 42.873.310/0003-22 | D445: 5.6900000000000004 | E445: 0 | F445: 0 | G445: 0 | H445: 0 | I445: 0 | J445: 0 | K445: 6.29 | L445: 0 | M445: =SUM(J445:L445)-0.6 -> 5.6900000000000004 | N445: 0.59999999999999998 | O445: =SUM(M445:N445) -> 6.29
A446: 3472 | B446: EOL CAIÇARA I | C446: 15.313.271/0001-74 | D446: 10.33 | E446: 0 | F446: 0 | G446: 0 | H446: 0 | I446: 0 | J446: 0 | K446: 11.42 | L446: 0 | M446: =SUM(J446:L446)-1.09 -> 10.33 | N446: 1.0900000000000001 | O446: =SUM(M446:N446) -> 11.42
A447: 3473 | B447: EOL CAIÇARA II | C447: 15.313.113/0001-14 | D447: 6.8899999999999997 | E447: 0 | F447: 0 | G447: 0 | H447: 0 | I447: 0 | J447: 0 | K447: 7.6200000000000001 | L447: 0 | M447: =SUM(J447:L447)-0.73 -> 6.8900000000000006 | N447: 0.72999999999999998 | O447: =SUM(M447:N447) -> 7.620000000000001
A448: 3474 | B448: EOL JUNCO I | C448: 15.313.226/0001-10 | D448: 9.2100000000000009 | E448: 0 | F448: 0 | G448: 0 | H448: 0 | I448: 0 | J448: 0 | K448: 10.18 | L448: 0 | M448: =SUM(J448:L448)-0.97 -> 9.2099999999999991 | N448: 0.96999999999999997 | O448: =SUM(M448:N448) -> 10.18
A449: 3475 | B449: EOL JUNCO II | C449: 15.313.187/0001-50 | D449: 9.1899999999999995 | E449: 0 | F449: 0 | G449: 0 | H449: 0 | I449: 0 | J449: 0 | K449: 10.16 | L449: 0 | M449: =SUM(J449:L449)-0.97 -> 9.1899999999999995 | N449: 0.96999999999999997 | O449: =SUM(M449:N449) -> 10.16
A450: 3476 | B450: EOL SERRA DAS VACAS III | C450: 19.694.110/0001-29 | D450: 7.5300000000000002 | E450: 0 | F450: 0 | G450: 0 | H450: 0 | I450: 0 | J450: 0 | K450: 8.3200000000000003 | L450: 0 | M450: =SUM(J450:L450)-0.79 -> 7.5300000000000002 | N450: 0.79000000000000004 | O450: =SUM(M450:N450) -> 8.3200000000000003
A451: 3477 | B451: RENOVA (EOL ABIL) | C451: 18.911.031/0001-60 | D451: 7.8600000000000003 | E451: 0 | F451: 0 | G451: 0 | H451: 0 | I451: 0 | J451: 0 | K451: 8.6899999999999995 | L451: 0 | M451: =SUM(J451:L451)-0.83 -> 7.8599999999999994 | N451: 0.82999999999999996 | O451: =SUM(M451:N451) -> 8.6899999999999995
A452: 3478 | B452: EOL BORGO | C452: 12.041.341/0001-94 | D452: 9.1500000000000004 | E452: 0 | F452: 0 | G452: 0 | H452: 0 | I452: 0 | J452: 0 | K452: 10.109999999999999 | L452: 0 | M452: =SUM(J452:L452)-0.96 -> 9.1499999999999986 | N452: 0.95999999999999996 | O452: =SUM(M452:N452) -> 10.109999999999999
A453: 3479 | B453: EOL CAETITÉ | C453: 11.201.767/0001-03 | D453: 13.619999999999999 | E453: 0 | F453: 0 | G453: 0 | H453: 0 | I453: 0 | J453: 0 | K453: 15.06 | L453: 0 | M453: =SUM(J453:L453)-1.44 -> 13.620000000000001 | N453: 1.4399999999999999 | O453: =SUM(M453:N453) -> 15.06
A454: 3480 | B454: EOL ESPIGÃO | C454: 11.197.321/0001-44 | D454: 4.5800000000000001 | E454: 0 | F454: 0 | G454: 0 | H454: 0 | I454: 0 | J454: 0 | K454: 5.0599999999999996 | L454: 0 | M454: =SUM(J454:L454)-0.48 -> 4.5800000000000001 | N454: 0.47999999999999998 | O454: =SUM(M454:N454) -> 5.0600000000000005
A455: 3481 | B455: RENOVA (EOL FOLHA DE SERRA) | C455: 18.910.740/0001-20 | D455: 7.1900000000000004 | E455: 0 | F455: 0 | G455: 0 | H455: 0 | I455: 0 | J455: 0 | K455: 7.9500000000000002 | L455: 0 | M455: =SUM(J455:L455)-0.76 -> 7.1900000000000004 | N455: 0.76000000000000001 | O455: =SUM(M455:N455) -> 7.9500000000000002
A456: 3482 | B456: RENOVA (EOL JABUTICABA) | C456: 18.870.194/0001-41 | D456: 2.98 | E456: 0 | F456: 0 | G456: 0 | H456: 0 | I456: 0 | J456: 0 | K456: 3.29 | L456: 0 | M456: =SUM(J456:L456)-0.31 -> 2.98 | N456: 0.31 | O456: =SUM(M456:N456) -> 3.29
A457: 3483 | B457: RENOVA (EOL J. DO CERRADO) | C457: 18.870.265/0001-06 | D457: 6.96 | E457: 0 | F457: 0 | G457: 0 | H457: 0 | I457: 0 | J457: 0 | K457: 7.6900000000000004 | L457: 0 | M457: =SUM(J457:L457)-0.73 -> 6.9600000000000009 | N457: 0.72999999999999998 | O457: =SUM(M457:N457) -> 7.6900000000000013
A458: 3484 | B458: EOL PELOURINHO | C458: 12.048.031/0001-00 | D458: 9.9100000000000001 | E458: 0 | F458: 0 | G458: 0 | H458: 0 | I458: 0 | J458: 0 | K458: 10.949999999999999 | L458: 0 | M458: =SUM(J458:L458)-1.04 -> 9.9100000000000001 | N458: 1.04 | O458: =SUM(M458:N458) -> 10.949999999999999
A459: 3485 | B459: EOL S. DO ESPINHAÇO | C459: 12.049.958/0001-56 | D459: 8.3900000000000006 | E459: 0 | F459: 0 | G459: 0 | H459: 0 | I459: 0 | J459: 0 | K459: 9.2699999999999996 | L459: 0 | M459: =SUM(J459:L459)-0.88 -> 8.3899999999999988 | N459: 0.88 | O459: =SUM(M459:N459) -> 9.2699999999999996
A460: 3486 | B460: RENOVA (EOL TÁBUA) | C460: 18.870.007/0001-20 | D460: 4.9800000000000004 | E460: 0 | F460: 0 | G460: 0 | H460: 0 | I460: 0 | J460: 0 | K460: 5.5 | L460: 0 | M460: =SUM(J460:L460)-0.52 -> 4.9800000000000004 | N460: 0.52000000000000002 | O460: =SUM(M460:N460) -> 5.5
A461: 3487 | B461: RENOVA (EOL VAQUETA) | C461: 18.684.356/0001-57 | D461: 7.7599999999999998 | E461: 0 | F461: 0 | G461: 0 | H461: 0 | I461: 0 | J461: 0 | K461: 8.5800000000000001 | L461: 0 | M461: =SUM(J461:L461)-0.82 -> 7.7599999999999998 | N461: 0.81999999999999995 | O461: =SUM(M461:N461) -> 8.5800000000000001
A462: 3488 | B462: EOL ANGICAL | C462: 14.570.783/0002-34 | D462: 5.8200000000000003 | E462: 0 | F462: 0 | G462: 0 | H462: 0 | I462: 0 | J462: 0 | K462: 6.4299999999999997 | L462: 0 | M462: =SUM(J462:L462)-0.61 -> 5.8199999999999994 | N462: 0.60999999999999999 | O462: =SUM(M462:N462) -> 6.4299999999999997
A463: 3489 | B463: EOL CAITITU | C463: 14.570.861/0002-09 | D463: 9.9800000000000004 | E463: 0 | F463: 0 | G463: 0 | H463: 0 | I463: 0 | J463: 0 | K463: 11.029999999999999 | L463: 0 | M463: =SUM(J463:L463)-1.05 -> 9.9799999999999986 | N463: 1.05 | O463: =SUM(M463:N463) -> 11.029999999999999
A464: 3490 | B464: EOL COQUEIRINHO | C464: 14.570.819/0002-80 | D464: 13.300000000000001 | E464: 0 | F464: 0 | G464: 0 | H464: 0 | I464: 0 | J464: 0 | K464: 14.699999999999999 | L464: 0 | M464: =SUM(J464:L464)-1.4 -> 13.299999999999999 | N464: 1.3999999999999999 | O464: =SUM(M464:N464) -> 14.699999999999999
A465: 3491 | B465: EOL CORRUPIÃO | C465: 14.570.800/0002-33 | D465: 12.470000000000001 | E465: 0 | F465: 0 | G465: 0 | H465: 0 | I465: 0 | J465: 0 | K465: 13.779999999999999 | L465: 0 | M465: =SUM(J465:L465)-1.31 -> 12.469999999999999 | N465: 1.3100000000000001 | O465: =SUM(M465:N465) -> 13.779999999999999
A466: 3492 | B466: EOL INHAMBU | C466: 14.572.367/0002-75 | D466: 13.619999999999999 | E466: 0 | F466: 0 | G466: 0 | H466: 0 | I466: 0 | J466: 0 | K466: 15.06 | L466: 0 | M466: =SUM(J466:L466)-1.44 -> 13.620000000000001 | N466: 1.4399999999999999 | O466: =SUM(M466:N466) -> 15.06
A467: 3493 | B467: EOL TAMANDUÁ MIRIM | C467: 14.571.068/0002-16 | D467: 13.300000000000001 | E467: 0 | F467: 0 | G467: 0 | H467: 0 | I467: 0 | J467: 0 | K467: 14.699999999999999 | L467: 0 | M467: =SUM(J467:L467)-1.4 -> 13.299999999999999 | N467: 1.3999999999999999 | O467: =SUM(M467:N467) -> 14.699999999999999
A468: 3494 | B468: EOL TEIU | C468: 14.570.839/0002-50 | D468: 7.4800000000000004 | E468: 0 | F468: 0 | G468: 0 | H468: 0 | I468: 0 | J468: 0 | K468: 8.2699999999999996 | L468: 0 | M468: =SUM(J468:L468)-0.79 -> 7.4799999999999995 | N468: 0.79000000000000004 | O468: =SUM(M468:N468) -> 8.2699999999999996
A469: 3495 | B469: EOL VENTOS DE SANTA JOANA III | C469: 19.725.354/0002-02 | D469: 9.6999999999999993 | E469: 0 | F469: 0 | G469: 0 | H469: 0 | I469: 0 | J469: 0 | K469: 10.720000000000001 | L469: 0 | M469: =SUM(J469:L469)-1.02 -> 9.7000000000000011 | N469: 1.02 | O469: =SUM(M469:N469) -> 10.720000000000001
A470: 3496 | B470: EDP (UHE CACHOEIRA CALDEIRÃO) | C470: 17.200.920/0001-56 | D470: 149.44 | E470: 0 | F470: 0 | G470: 0 | H470: 0 | I470: 0 | J470: 0 | K470: 165.19 | L470: 0 | M470: =SUM(J470:L470)-15.75 -> 149.44 | N470: 15.75 | O470: =SUM(M470:N470) -> 165.19
A471: 3497 | B471: EOL ITAREMA II | C471: 19.560.074/0002-91 | D471: 9.7899999999999991 | E471: 0 | F471: 0 | G471: 0 | H471: 0 | I471: 0 | J471: 0 | K471: 10.82 | L471: 0 | M471: =SUM(J471:L471)-1.03 -> 9.7900000000000009 | N471: 1.03 | O471: =SUM(M471:N471) -> 10.82
A472: 3498 | B472: EOL ITAREMA V | C472: 19.560.868/0002-55 | D472: 7.5800000000000001 | E472: 0 | F472: 0 | G472: 0 | H472: 0 | I472: 0 | J472: 0 | K472: 8.3800000000000008 | L472: 0 | M472: =SUM(J472:L472)-0.8 -> 7.580000000000001 | N472: 0.80000000000000004 | O472: =SUM(M472:N472) -> 8.3800000000000008
A473: 3499 | B473: EOL S. DE SANTANA I | C473: 12.848.401/0001-85 | D473: 8.5099999999999998 | E473: 0 | F473: 0 | G473: 0 | H473: 0 | I473: 0 | J473: 0 | K473: 9.4100000000000001 | L473: 0 | M473: =SUM(J473:L473)-0.9 -> 8.5099999999999998 | N473: 0.90000000000000002 | O473: =SUM(M473:N473) -> 9.4100000000000001
A474: 3500 | B474: EOL S. DE SANTANA II | C474: 12.851.098/0001-70 | D474: 12.449999999999999 | E474: 0 | F474: 0 | G474: 0 | H474: 0 | I474: 0 | J474: 0 | K474: 13.76 | L474: 0 | M474: =SUM(J474:L474)-1.31 -> 12.449999999999999 | N474: 1.3100000000000001 | O474: =SUM(M474:N474) -> 13.76
A475: 3501 | B475: EOL S. DE SANTANA III | C475: 12.848.783/0001-47 | D475: 12.75 | E475: 0 | F475: 0 | G475: 0 | H475: 0 | I475: 0 | J475: 0 | K475: 14.09 | L475: 0 | M475: =SUM(J475:L475)-1.34 -> 12.75 | N475: 1.3400000000000001 | O475: =SUM(M475:N475) -> 14.09
A476: 3502 | B476: EOL ITAREMA I | C476: 19.560.032/0002-50 | D476: 9.7799999999999994 | E476: 0 | F476: 0 | G476: 0 | H476: 0 | I476: 0 | J476: 0 | K476: 10.81 | L476: 0 | M476: =SUM(J476:L476)-1.03 -> 9.7800000000000011 | N476: 1.03 | O476: =SUM(M476:N476) -> 10.81
A477: 3503 | B477: EOL ITAREMA III | C477: 19.560.839/0002-93 | D477: 5.3899999999999997 | E477: 0 | F477: 0 | G477: 0 | H477: 0 | I477: 0 | J477: 0 | K477: 5.96 | L477: 0 | M477: =SUM(J477:L477)-0.57 -> 5.3899999999999997 | N477: 0.56999999999999995 | O477: =SUM(M477:N477) -> 5.96
A478: 3504 | B478: EOL BARAÚNAS II | C478: 19.905.679/0002-77 | D478: 9.5600000000000005 | E478: 0 | F478: 0 | G478: 0 | H478: 0 | I478: 0 | J478: 0 | K478: 10.57 | L478: 0 | M478: =SUM(J478:L478)-1.01 -> 9.5600000000000005 | N478: 1.01 | O478: =SUM(M478:N478) -> 10.57
A479: 3505 | B479: EOL BANDA DE COURO | C479: 19.905.727/0002-27 | D479: 11.23 | E479: 0 | F479: 0 | G479: 0 | H479: 0 | I479: 0 | J479: 0 | K479: 12.41 | L479: 0 | M479: =SUM(J479:L479)-1.18 -> 11.23 | N479: 1.1799999999999999 | O479: =SUM(M479:N479) -> 12.41
A480: 3507 | B480: EOL CACIMBAS I | C480: 13.389.543/0002-75 | D480: 5.5800000000000001 | E480: 0 | F480: 0 | G480: 0 | H480: 0 | I480: 0 | J480: 0 | K480: 6.1699999999999999 | L480: 0 | M480: =SUM(J480:L480)-0.59 -> 5.5800000000000001 | N480: 0.58999999999999997 | O480: =SUM(M480:N480) -> 6.1699999999999999
A481: 3508 | B481: UTE KLABIN CELULOSE | C481: 89.637.490/0165-72 | D481: 65.299999999999997 | E481: 0 | F481: 0 | G481: 0 | H481: 0 | I481: 0 | J481: 0 | K481: 72.180000000000007 | L481: 0 | M481: =SUM(J481:L481)-6.88 -> 65.300000000000011 | N481: 6.8799999999999999 | O481: =SUM(M481:N481) -> 72.180000000000007
A482: 3509 | B482: EOL BAIXA DO FEIJÃO I | C482: 14.496.492/0002-43 | D482: 11.65 | E482: 0 | F482: 0 | G482: 0 | H482: 0 | I482: 0 | J482: 0 | K482: 12.880000000000001 | L482: 0 | M482: =SUM(J482:L482)-1.23 -> 11.65 | N482: 1.23 | O482: =SUM(M482:N482) -> 12.880000000000001
A483: 3510 | B483: EOL BAIXA DO FEIJÃO II | C483: 14.496.545/0002-26 | D483: 11.609999999999999 | E483: 0 | F483: 0 | G483: 0 | H483: 0 | I483: 0 | J483: 0 | K483: 12.83 | L483: 0 | M483: =SUM(J483:L483)-1.22 -> 11.609999999999999 | N483: 1.22 | O483: =SUM(M483:N483) -> 12.83
A484: 3511 | B484: EOL BAIXA DO FEIJÃO III | C484: 14.496.290/0002-00 | D484: 11.67 | E484: 0 | F484: 0 | G484: 0 | H484: 0 | I484: 0 | J484: 0 | K484: 12.9 | L484: 0 | M484: =SUM(J484:L484)-1.23 -> 11.67 | N484: 1.23 | O484: =SUM(M484:N484) -> 12.9
A485: 3512 | B485: EOL BAIXA DO FEIJÃO IV | C485: 14.496.317/0002-56 | D485: 11.74 | E485: 0 | F485: 0 | G485: 0 | H485: 0 | I485: 0 | J485: 0 | K485: 12.98 | L485: 0 | M485: =SUM(J485:L485)-1.24 -> 11.74 | N485: 1.24 | O485: =SUM(M485:N485) -> 12.98
A486: 3513 | B486: EOL VENTOS DOS GUARÁS I | C486: 13.344.343/0002-04 | D486: 15.69 | E486: 0 | F486: 0 | G486: 0 | H486: 0 | I486: 0 | J486: 0 | K486: 17.34 | L486: 0 | M486: =SUM(J486:L486)-1.65 -> 15.69 | N486: 1.6499999999999999 | O486: =SUM(M486:N486) -> 17.34
A487: 3514 | B487: CPFL (EOL CAMPO DOS VENTOS I) | C487: 10.797.890/0001-68 | D487: 8.1999999999999993 | E487: 0 | F487: 0 | G487: 0 | H487: 0 | I487: 0 | J487: 0 | K487: 9.0600000000000005 | L487: 0 | M487: =SUM(J487:L487)-0.86 -> 8.2000000000000011 | N487: 0.85999999999999999 | O487: =SUM(M487:N487) -> 9.0600000000000005
A488: 3515 | B488: CPFL (EOL CAMPO DOS VENTOS III) | C488: 10.797.891/0001-02 | D488: 8.1899999999999995 | E488: 0 | F488: 0 | G488: 0 | H488: 0 | I488: 0 | J488: 0 | K488: 9.0500000000000007 | L488: 0 | M488: =SUM(J488:L488)-0.86 -> 8.1900000000000013 | N488: 0.85999999999999999 | O488: =SUM(M488:N488) -> 9.0500000000000007
A489: 3516 | B489: CPFL (EOL CAMPO DOS VENTOS V) | C489: 10.797.888/0001-99 | D489: 8.1799999999999997 | E489: 0 | F489: 0 | G489: 0 | H489: 0 | I489: 0 | J489: 0 | K489: 9.0399999999999991 | L489: 0 | M489: =SUM(J489:L489)-0.86 -> 8.1799999999999997 | N489: 0.85999999999999999 | O489: =SUM(M489:N489) -> 9.0399999999999991
A490: 3517 | B490: EOL VENTOS DE SÃO CLEMENTE 1 | C490: 21.014.004/0002-80 | D490: 12.619999999999999 | E490: 0 | F490: 0 | G490: 0 | H490: 0 | I490: 0 | J490: 0 | K490: 13.949999999999999 | L490: 0 | M490: =SUM(J490:L490)-1.33 -> 12.619999999999999 | N490: 1.3300000000000001 | O490: =SUM(M490:N490) -> 13.949999999999999
A491: 3518 | B491: EOL VENTOS DE SÃO CLEMENTE 2 | C491: 21.014.134/0002-12 | D491: 12.619999999999999 | E491: 0 | F491: 0 | G491: 0 | H491: 0 | I491: 0 | J491: 0 | K491: 13.949999999999999 | L491: 0 | M491: =SUM(J491:L491)-1.33 -> 12.619999999999999 | N491: 1.3300000000000001 | O491: =SUM(M491:N491) -> 13.949999999999999
A492: 3519 | B492: EOL VENTOS DE SÃO CLEMENTE 3 | C492: 21.014.090/0002-20 | D492: 12.619999999999999 | E492: 0 | F492: 0 | G492: 0 | H492: 0 | I492: 0 | J492: 0 | K492: 13.949999999999999 | L492: 0 | M492: =SUM(J492:L492)-1.33 -> 12.619999999999999 | N492: 1.3300000000000001 | O492: =SUM(M492:N492) -> 13.949999999999999
A493: 3520 | B493: EOL VENTOS DE SÃO CLEMENTE 4 | C493: 21.013.854/0002-63 | D493: 12.619999999999999 | E493: 0 | F493: 0 | G493: 0 | H493: 0 | I493: 0 | J493: 0 | K493: 13.949999999999999 | L493: 0 | M493: =SUM(J493:L493)-1.33 -> 12.619999999999999 | N493: 1.3300000000000001 | O493: =SUM(M493:N493) -> 13.949999999999999
A494: 3521 | B494: EOL VENTOS DE SÃO CLEMENTE 5 | C494: 21.013.993/0002-97 | D494: 12.619999999999999 | E494: 0 | F494: 0 | G494: 0 | H494: 0 | I494: 0 | J494: 0 | K494: 13.949999999999999 | L494: 0 | M494: =SUM(J494:L494)-1.33 -> 12.619999999999999 | N494: 1.3300000000000001 | O494: =SUM(M494:N494) -> 13.949999999999999
A495: 3522 | B495: EOL VENTOS DE SÃO CLEMENTE 6 | C495: 21.013.968/0002-03 | D495: 11.19 | E495: 0 | F495: 0 | G495: 0 | H495: 0 | I495: 0 | J495: 0 | K495: 12.369999999999999 | L495: 0 | M495: =SUM(J495:L495)-1.18 -> 11.19 | N495: 1.1799999999999999 | O495: =SUM(M495:N495) -> 12.369999999999999
A496: 3523 | B496: EOL VENTOS DE SÃO CLEMENTE 7 | C496: 21.013.833/0002-48 | D496: 10.56 | E496: 0 | F496: 0 | G496: 0 | H496: 0 | I496: 0 | J496: 0 | K496: 11.67 | L496: 0 | M496: =SUM(J496:L496)-1.11 -> 10.56 | N496: 1.1100000000000001 | O496: =SUM(M496:N496) -> 11.67
A497: 3524 | B497: EOL VENTOS DE SÃO CLEMENTE 8 | C497: 21.013.880/0002-91 | D497: 9 | E497: 0 | F497: 0 | G497: 0 | H497: 0 | I497: 0 | J497: 0 | K497: 9.9499999999999993 | L497: 0 | M497: =SUM(J497:L497)-0.95 -> 9 | N497: 0.94999999999999996 | O497: =SUM(M497:N497) -> 9.9499999999999993
A498: 3525 | B498: EOL VENTOS DE SANTA EDWIGES | C498: 12.960.082/0001-03 | D498: 12.24 | E498: 0 | F498: 0 | G498: 0 | H498: 0 | I498: 0 | J498: 0 | K498: 13.529999999999999 | L498: 0 | M498: =SUM(J498:L498)-1.29 -> 12.239999999999998 | N498: 1.29 | O498: =SUM(M498:N498) -> 13.529999999999998
A499: 3526 | B499: EOL VENTOS DE SANTA FATIMA | C499: 12.960.065/0001-68 | D499: 12.279999999999999 | E499: 0 | F499: 0 | G499: 0 | H499: 0 | I499: 0 | J499: 0 | K499: 13.57 | L499: 0 | M499: =SUM(J499:L499)-1.29 -> 12.280000000000001 | N499: 1.29 | O499: =SUM(M499:N499) -> 13.57
A500: 3527 | B500: EOL VENTOS DE SANTA REGINA | C500: 12.960.071/0001-15 | D500: 12.210000000000001 | E500: 0 | F500: 0 | G500: 0 | H500: 0 | I500: 0 | J500: 0 | K500: 13.5 | L500: 0 | M500: =SUM(J500:L500)-1.29 -> 12.210000000000001 | N500: 1.29 | O500: =SUM(M500:N500) -> 13.5
A501: 3528 | B501: EOL VENTOS DE SANTO ADRIANO | C501: 10.823.648/0001-11 | D501: 12.210000000000001 | E501: 0 | F501: 0 | G501: 0 | H501: 0 | I501: 0 | J501: 0 | K501: 13.5 | L501: 0 | M501: =SUM(J501:L501)-1.29 -> 12.210000000000001 | N501: 1.29 | O501: =SUM(M501:N501) -> 13.5
A502: 3529 | B502: EOL VENTOS DE SANTO ALBANO | C502: 10.656.606/0001-33 | D502: 12.210000000000001 | E502: 0 | F502: 0 | G502: 0 | H502: 0 | I502: 0 | J502: 0 | K502: 13.5 | L502: 0 | M502: =SUM(J502:L502)-1.29 -> 12.210000000000001 | N502: 1.29 | O502: =SUM(M502:N502) -> 13.5
A503: 3530 | B503: EOL ITAREMA IV | C503: 20.553.751/0002-23 | D503: 10.449999999999999 | E503: 0 | F503: 0 | G503: 0 | H503: 0 | I503: 0 | J503: 0 | K503: 11.550000000000001 | L503: 0 | M503: =SUM(J503:L503)-1.1 -> 10.450000000000001 | N503: 1.1000000000000001 | O503: =SUM(M503:N503) -> 11.550000000000001
A504: 3531 | B504: EOL ITAREMA VI | C504: 20.533.879/0002-25 | D504: 11.960000000000001 | E504: 0 | F504: 0 | G504: 0 | H504: 0 | I504: 0 | J504: 0 | K504: 13.220000000000001 | L504: 0 | M504: =SUM(J504:L504)-1.26 -> 11.960000000000001 | N504: 1.26 | O504: =SUM(M504:N504) -> 13.220000000000001
A505: 3532 | B505: EOL ITAREMA VII | C505: 20.533.473/0002-42 | D505: 10.449999999999999 | E505: 0 | F505: 0 | G505: 0 | H505: 0 | I505: 0 | J505: 0 | K505: 11.550000000000001 | L505: 0 | M505: =SUM(J505:L505)-1.1 -> 10.450000000000001 | N505: 1.1000000000000001 | O505: =SUM(M505:N505) -> 11.550000000000001
A506: 3533 | B506: EOL ESTRELA | C506: 09.265.464/0002-85 | D506: 8.4600000000000009 | E506: 0 | F506: 0 | G506: 0 | H506: 0 | I506: 0 | J506: 0 | K506: 9.3499999999999996 | L506: 0 | M506: =SUM(J506:L506)-0.89 -> 8.4599999999999991 | N506: 0.89000000000000001 | O506: =SUM(M506:N506) -> 9.3499999999999996
A507: 3534 | B507: EOL OURO VERDE | C507: 16.849.271/0002-37 | D507: 8.7699999999999996 | E507: 0 | F507: 0 | G507: 0 | H507: 0 | I507: 0 | J507: 0 | K507: 9.6899999999999995 | L507: 0 | M507: =SUM(J507:L507)-0.92 -> 8.7699999999999996 | N507: 0.92000000000000004 | O507: =SUM(M507:N507) -> 9.6899999999999995
A508: 3535 | B508: EOL SANTA MONICA I | C508: 12.445.328/0002-81 | D508: 5.5800000000000001 | E508: 0 | F508: 0 | G508: 0 | H508: 0 | I508: 0 | J508: 0 | K508: 6.1699999999999999 | L508: 0 | M508: =SUM(J508:L508)-0.59 -> 5.5800000000000001 | N508: 0.58999999999999997 | O508: =SUM(M508:N508) -> 6.1699999999999999
A509: 3536 | B509: UHE SÃO ROQUE | C509: 15.116.321/0002-04 | D509: 99.129999999999995 | E509: 0 | F509: 0 | G509: 0 | H509: 0 | I509: 0 | J509: 0 | K509: 109.58 | L509: 0 | M509: =SUM(J509:L509)-10.45 -> 99.129999999999995 | N509: 10.449999999999999 | O509: =SUM(M509:N509) -> 109.58
A510: 3537 | B510: EOL ITAREMA VIII | C510: 20.533.310/0002-60 | D510: 10.449999999999999 | E510: 0 | F510: 0 | G510: 0 | H510: 0 | I510: 0 | J510: 0 | K510: 11.550000000000001 | L510: 0 | M510: =SUM(J510:L510)-1.1 -> 10.450000000000001 | N510: 1.1000000000000001 | O510: =SUM(M510:N510) -> 11.550000000000001
A511: 3538 | B511: EOL ITAREMA IX | C511: 20.533.377/0002-02 | D511: 14.98 | E511: 0 | F511: 0 | G511: 0 | H511: 0 | I511: 0 | J511: 0 | K511: 16.559999999999999 | L511: 0 | M511: =SUM(J511:L511)-1.58 -> 14.979999999999999 | N511: 1.5800000000000001 | O511: =SUM(M511:N511) -> 16.559999999999999
A512: 3539 | B512: EOL MACAMBIRA I | C512: 15.231.588/0001-61 | D512: 6.2199999999999998 | E512: 0 | F512: 0 | G512: 0 | H512: 0 | I512: 0 | J512: 0 | K512: 6.8799999999999999 | L512: 0 | M512: =SUM(J512:L512)-0.66 -> 6.2199999999999998 | N512: 0.66000000000000003 | O512: =SUM(M512:N512) -> 6.8799999999999999
A513: 3540 | B513: EOL MACAMBIRA II | C513: 15.231.448/0001-93 | D513: 5.7599999999999998 | E513: 0 | F513: 0 | G513: 0 | H513: 0 | I513: 0 | J513: 0 | K513: 6.3700000000000001 | L513: 0 | M513: =SUM(J513:L513)-0.61 -> 5.7599999999999998 | N513: 0.60999999999999999 | O513: =SUM(M513:N513) -> 6.3700000000000001
A514: 3541 | B514: RPE (RIO PARANA ENERGIA) | C514: 23.096.269/0001-19 | D514: 4392.8100000000004 | E514: 0 | F514: 0 | G514: 0 | H514: 0 | I514: 0 | J514: 0 | K514: 4855.8699999999999 | L514: 0 | M514: =SUM(J514:L514)-463.06 -> 4392.8099999999995 | N514: 463.06 | O514: =SUM(M514:N514) -> 4855.8699999999999
A515: 3542 | B515: EOL VILA AMAZONAS V | C515: 20.339.203/0001-14 | D515: 8.4299999999999997 | E515: 0 | F515: 0 | G515: 0 | H515: 0 | I515: 0 | J515: 0 | K515: 9.3200000000000003 | L515: 0 | M515: =SUM(J515:L515)-0.89 -> 8.4299999999999997 | N515: 0.89000000000000001 | O515: =SUM(M515:N515) -> 9.3200000000000003
A516: 3543 | B516: EOL VILA PARÁ I | C516: 20.318.451/0001-89 | D516: 10.289999999999999 | E516: 0 | F516: 0 | G516: 0 | H516: 0 | I516: 0 | J516: 0 | K516: 11.369999999999999 | L516: 0 | M516: =SUM(J516:L516)-1.08 -> 10.289999999999999 | N516: 1.0800000000000001 | O516: =SUM(M516:N516) -> 11.369999999999999
A517: 3544 | B517: EOL CATAVENTOS ACARAÚ I | C517: 10.902.268/0001-72 | D517: 10.859999999999999 | E517: 0 | F517: 0 | G517: 0 | H517: 0 | I517: 0 | J517: 0 | K517: 12 | L517: 0 | M517: =SUM(J517:L517)-1.14 -> 10.859999999999999 | N517: 1.1399999999999999 | O517: =SUM(M517:N517) -> 12
A518: 3545 | B518: EOL VENTOS DE SÃO BENEDITO | C518: 12.053.657/0001-04 | D518: 13.18 | E518: 0 | F518: 0 | G518: 0 | H518: 0 | I518: 0 | J518: 0 | K518: 14.57 | L518: 0 | M518: =SUM(J518:L518)-1.39 -> 13.18 | N518: 1.3899999999999999 | O518: =SUM(M518:N518) -> 14.57
A519: 3546 | B519: EOL VENTOS DE SANTA ANGELINA | C519: 10.682.436/0001-61 | D519: 12.210000000000001 | E519: 0 | F519: 0 | G519: 0 | H519: 0 | I519: 0 | J519: 0 | K519: 13.5 | L519: 0 | M519: =SUM(J519:L519)-1.29 -> 12.210000000000001 | N519: 1.29 | O519: =SUM(M519:N519) -> 13.5
A520: 3547 | B520: EOL VENTOS DE SANTA BARBARA | C520: 12.960.046/0001-31 | D520: 12.210000000000001 | E520: 0 | F520: 0 | G520: 0 | H520: 0 | I520: 0 | J520: 0 | K520: 13.5 | L520: 0 | M520: =SUM(J520:L520)-1.29 -> 12.210000000000001 | N520: 1.29 | O520: =SUM(M520:N520) -> 13.5
A521: 3548 | B521: EOL VILA PARÁ II | C521: 20.318.810/0001-06 | D521: 9.4100000000000001 | E521: 0 | F521: 0 | G521: 0 | H521: 0 | I521: 0 | J521: 0 | K521: 10.4 | L521: 0 | M521: =SUM(J521:L521)-0.99 -> 9.4100000000000001 | N521: 0.98999999999999999 | O521: =SUM(M521:N521) -> 10.4
A522: 3549 | B522: EOL VILA PARÁ III | C522: 20.318.427/0001-40 | D522: 9.3699999999999992 | E522: 0 | F522: 0 | G522: 0 | H522: 0 | I522: 0 | J522: 0 | K522: 10.359999999999999 | L522: 0 | M522: =SUM(J522:L522)-0.99 -> 9.3699999999999992 | N522: 0.98999999999999999 | O522: =SUM(M522:N522) -> 10.359999999999999
A523: 3550 | B523: EOL SÃO DOMINGOS | C523: 12.053.825/0001-53 | D523: 8.3000000000000007 | E523: 0 | F523: 0 | G523: 0 | H523: 0 | I523: 0 | J523: 0 | K523: 9.1699999999999999 | L523: 0 | M523: =SUM(J523:L523)-0.87 -> 8.3000000000000007 | N523: 0.87 | O523: =SUM(M523:N523) -> 9.1699999999999999
A524: 3551 | B524: EOL AURA MANGUEIRA VII | C524: 20.593.647/0002-62 | D524: 10.92 | E524: 0 | F524: 0 | G524: 0 | H524: 0 | I524: 0 | J524: 0 | K524: 12.07 | L524: 0 | M524: =SUM(J524:L524)-1.15 -> 10.92 | N524: 1.1499999999999999 | O524: =SUM(M524:N524) -> 12.07
A525: 3552 | B525: EOL AURA MIRIM II | C525: 20.586.118/0002-31 | D525: 13.65 | E525: 0 | F525: 0 | G525: 0 | H525: 0 | I525: 0 | J525: 0 | K525: 15.09 | L525: 0 | M525: =SUM(J525:L525)-1.44 -> 13.65 | N525: 1.4399999999999999 | O525: =SUM(M525:N525) -> 15.09
A526: 3553 | B526: UTE CSP | C526: 09.509.535/0001-67 | D526: 46.770000000000003 | E526: 0 | F526: 0 | G526: 0 | H526: 0 | I526: 0 | J526: 0 | K526: 51.700000000000003 | L526: 0 | M526: =SUM(J526:L526)-4.93 -> 46.770000000000003 | N526: 4.9299999999999997 | O526: =SUM(M526:N526) -> 51.700000000000003
A527: 3554 | B527: UFV CALDEIRÃO GRANDE V | C527: 12.960.110/0001-84 | D527: 11.26 | E527: 0 | F527: 0 | G527: 0 | H527: 0 | I527: 0 | J527: 0 | K527: 12.449999999999999 | L527: 0 | M527: =SUM(J527:L527)-1.19 -> 11.26 | N527: 1.1899999999999999 | O527: =SUM(M527:N527) -> 12.449999999999999
A528: 3555 | B528: EOL VENTO FORMOSO | C528: 12.774.042/0001-69 | D528: 9.9499999999999993 | E528: 0 | F528: 0 | G528: 0 | H528: 0 | I528: 0 | J528: 0 | K528: 11 | L528: 0 | M528: =SUM(J528:L528)-1.05 -> 9.9499999999999993 | N528: 1.05 | O528: =SUM(M528:N528) -> 11
A529: 3556 | B529: EOL VENTOS DO MORRO DO CHAPÉU | C529: 12.774.017/0001-85 | D529: 9.9399999999999995 | E529: 0 | F529: 0 | G529: 0 | H529: 0 | I529: 0 | J529: 0 | K529: 10.99 | L529: 0 | M529: =SUM(J529:L529)-1.05 -> 9.9399999999999995 | N529: 1.05 | O529: =SUM(M529:N529) -> 10.99
A530: 3557 | B530: EOL VENTOS DO PARAZINHO | C530: 12.773.991/0001-24 | D530: 10.49 | E530: 0 | F530: 0 | G530: 0 | H530: 0 | I530: 0 | J530: 0 | K530: 11.6 | L530: 0 | M530: =SUM(J530:L530)-1.11 -> 10.49 | N530: 1.1100000000000001 | O530: =SUM(M530:N530) -> 11.6
A531: 3558 | B531: EOL VENTOS DE TIANGUÁ NORTE | C531: 12.773.953/0001-71 | D531: 10.550000000000001 | E531: 0 | F531: 0 | G531: 0 | H531: 0 | I531: 0 | J531: 0 | K531: 11.66 | L531: 0 | M531: =SUM(J531:L531)-1.11 -> 10.550000000000001 | N531: 1.1100000000000001 | O531: =SUM(M531:N531) -> 11.66
A532: 3559 | B532: EOL VENTOS DE TIANGUÁ | C532: 12.773.911/0001-30 | D532: 10.050000000000001 | E532: 0 | F532: 0 | G532: 0 | H532: 0 | I532: 0 | J532: 0 | K532: 11.109999999999999 | L532: 0 | M532: =SUM(J532:L532)-1.06 -> 10.049999999999999 | N532: 1.0600000000000001 | O532: =SUM(M532:N532) -> 11.109999999999999
A533: 3560 | B533: EOL VENTOS DE SANTO DIMAS | C533: 13.329.931/0001-80 | D533: 11.33 | E533: 0 | F533: 0 | G533: 0 | H533: 0 | I533: 0 | J533: 0 | K533: 12.52 | L533: 0 | M533: =SUM(J533:L533)-1.19 -> 11.33 | N533: 1.1899999999999999 | O533: =SUM(M533:N533) -> 12.52
A534: 3561 | B534: EOL CABEÇO PRETO III | C534: 15.231.615/0001-04 | D534: 10.199999999999999 | E534: 0 | F534: 0 | G534: 0 | H534: 0 | I534: 0 | J534: 0 | K534: 11.279999999999999 | L534: 0 | M534: =SUM(J534:L534)-1.08 -> 10.199999999999999 | N534: 1.0800000000000001 | O534: =SUM(M534:N534) -> 11.279999999999999
A535: 3562 | B535: EOL CABEÇO PRETO V | C535: 15.231.547/0001-75 | D535: 10.08 | E535: 0 | F535: 0 | G535: 0 | H535: 0 | I535: 0 | J535: 0 | K535: 11.140000000000001 | L535: 0 | M535: =SUM(J535:L535)-1.06 -> 10.08 | N535: 1.0600000000000001 | O535: =SUM(M535:N535) -> 11.140000000000001
A536: 3563 | B536: EOL CABEÇO PRETO VI | C536: 15.231.479/0001-44 | D536: 6.9500000000000002 | E536: 0 | F536: 0 | G536: 0 | H536: 0 | I536: 0 | J536: 0 | K536: 7.6799999999999997 | L536: 0 | M536: =SUM(J536:L536)-0.73 -> 6.9499999999999993 | N536: 0.72999999999999998 | O536: =SUM(M536:N536) -> 7.6799999999999997
A537: 3564 | B537: COPEL (UHE GOV PARIGOT) | C537: 04.370.282/0001-70 | D537: 184.86000000000001 | E537: 0 | F537: 0 | G537: 0 | H537: 0 | I537: 0 | J537: 0 | K537: 204.34999999999999 | L537: 0 | M537: =SUM(J537:L537)-19.49 -> 184.85999999999999 | N537: 19.489999999999998 | O537: =SUM(M537:N537) -> 204.34999999999999
A538: 3565 | B538: EOL AURA MANGUEIRA XI | C538: 19.869.512/0002-06 | D538: 3.1299999999999999 | E538: 0 | F538: 0 | G538: 0 | H538: 0 | I538: 0 | J538: 0 | K538: 3.46 | L538: 0 | M538: =SUM(J538:L538)-0.33 -> 3.1299999999999999 | N538: 0.33000000000000002 | O538: =SUM(M538:N538) -> 3.46
A539: 3566 | B539: EOL CALANGO 6 | C539: 19.560.837/0002-02 | D539: 13.49 | E539: 0 | F539: 0 | G539: 0 | H539: 0 | I539: 0 | J539: 0 | K539: 14.91 | L539: 0 | M539: =SUM(J539:L539)-1.42 -> 13.49 | N539: 1.4199999999999999 | O539: =SUM(M539:N539) -> 14.91
A540: 3567 | B540: EOL SANTANA I | C540: 19.560.874/0002-02 | D540: 13.48 | E540: 0 | F540: 0 | G540: 0 | H540: 0 | I540: 0 | J540: 0 | K540: 14.9 | L540: 0 | M540: =SUM(J540:L540)-1.42 -> 13.48 | N540: 1.4199999999999999 | O540: =SUM(M540:N540) -> 14.9
A541: 3568 | B541: EOL SANTANA II | C541: 19.588.049/0002-16 | D541: 10.779999999999999 | E541: 0 | F541: 0 | G541: 0 | H541: 0 | I541: 0 | J541: 0 | K541: 11.92 | L541: 0 | M541: =SUM(J541:L541)-1.14 -> 10.779999999999999 | N541: 1.1399999999999999 | O541: =SUM(M541:N541) -> 11.92
A542: 3569 | B542: EOL SANTA MÔNICA | C542: 12.053.687/0001-02 | D542: 9.5099999999999998 | E542: 0 | F542: 0 | G542: 0 | H542: 0 | I542: 0 | J542: 0 | K542: 10.51 | L542: 0 | M542: =SUM(J542:L542)-1 -> 9.5099999999999998 | N542: 1 | O542: =SUM(M542:N542) -> 10.51
A543: 3570 | B543: EOL VENTOS DE SÃO MARTINHO | C543: 13.330.011/0001-81 | D543: 4.7999999999999998 | E543: 0 | F543: 0 | G543: 0 | H543: 0 | I543: 0 | J543: 0 | K543: 5.3099999999999996 | L543: 0 | M543: =SUM(J543:L543)-0.51 -> 4.7999999999999998 | N543: 0.51000000000000001 | O543: =SUM(M543:N543) -> 5.3099999999999996
A544: 3571 | B544: UFV CALDEIRÃO GRANDE II | C544: 12.960.094/0001-20 | D544: 11.359999999999999 | E544: 0 | F544: 0 | G544: 0 | H544: 0 | I544: 0 | J544: 0 | K544: 12.56 | L544: 0 | M544: =SUM(J544:L544)-1.2 -> 11.360000000000001 | N544: 1.2 | O544: =SUM(M544:N544) -> 12.56
A545: 3572 | B545: UFV CALDEIRÃO GRANDE I | C545: 12.960.103/0001-82 | D545: 11.359999999999999 | E545: 0 | F545: 0 | G545: 0 | H545: 0 | I545: 0 | J545: 0 | K545: 12.56 | L545: 0 | M545: =SUM(J545:L545)-1.2 -> 11.360000000000001 | N545: 1.2 | O545: =SUM(M545:N545) -> 12.56
A546: 3573 | B546: UFV CALDEIRÃO GRANDE III | C546: 12.964.095/0001-42 | D546: 11.26 | E546: 0 | F546: 0 | G546: 0 | H546: 0 | I546: 0 | J546: 0 | K546: 12.449999999999999 | L546: 0 | M546: =SUM(J546:L546)-1.19 -> 11.26 | N546: 1.1899999999999999 | O546: =SUM(M546:N546) -> 12.449999999999999
A547: 3574 | B547: UFV CALDEIRÃO GRANDE VI | C547: 12.960.127/0001-31 | D547: 11.26 | E547: 0 | F547: 0 | G547: 0 | H547: 0 | I547: 0 | J547: 0 | K547: 12.449999999999999 | L547: 0 | M547: =SUM(J547:L547)-1.19 -> 11.26 | N547: 1.1899999999999999 | O547: =SUM(M547:N547) -> 12.449999999999999
A548: 3575 | B548: UFV CALDEIRÃO GRANDE IV | C548: 10.656.568/0001-19 | D548: 11.26 | E548: 0 | F548: 0 | G548: 0 | H548: 0 | I548: 0 | J548: 0 | K548: 12.449999999999999 | L548: 0 | M548: =SUM(J548:L548)-1.19 -> 11.26 | N548: 1.1899999999999999 | O548: =SUM(M548:N548) -> 12.449999999999999
A549: 3576 | B549: UFV CALDEIRÃO GRANDE VII | C549: 12.960.117/0001-04 | D549: 11.33 | E549: 0 | F549: 0 | G549: 0 | H549: 0 | I549: 0 | J549: 0 | K549: 12.52 | L549: 0 | M549: =SUM(J549:L549)-1.19 -> 11.33 | N549: 1.1899999999999999 | O549: =SUM(M549:N549) -> 12.52
A550: 3577 | B550: PCH SERRA DOS CAVALINHOS I | C550: 09.199.675/0002-67 | D550: 9.7300000000000004 | E550: 0 | F550: 0 | G550: 0 | H550: 0 | I550: 0 | J550: 0 | K550: 10.76 | L550: 0 | M550: =SUM(J550:L550)-1.03 -> 9.7300000000000004 | N550: 1.03 | O550: =SUM(M550:N550) -> 10.76
A551: 3578 | B551: EOL AURA MANGUEIRA XV | C551: 19.944.650/0002-02 | D551: 6.2599999999999998 | E551: 0 | F551: 0 | G551: 0 | H551: 0 | I551: 0 | J551: 0 | K551: 6.9199999999999999 | L551: 0 | M551: =SUM(J551:L551)-0.66 -> 6.2599999999999998 | N551: 0.66000000000000003 | O551: =SUM(M551:N551) -> 6.9199999999999999
A552: 3579 | B552: EOL AURA MIRIM IV | C552: 19.941.770/0002-48 | D552: 5.21 | E552: 0 | F552: 0 | G552: 0 | H552: 0 | I552: 0 | J552: 0 | K552: 5.7599999999999998 | L552: 0 | M552: =SUM(J552:L552)-0.55 -> 5.21 | N552: 0.55000000000000004 | O552: =SUM(M552:N552) -> 5.7599999999999998
A553: 3580 | B553: EOL SANTA ÚRSULA | C553: 12.053.891/0001-23 | D553: 8.8699999999999992 | E553: 0 | F553: 0 | G553: 0 | H553: 0 | I553: 0 | J553: 0 | K553: 9.8100000000000005 | L553: 0 | M553: =SUM(J553:L553)-0.94 -> 8.870000000000001 | N553: 0.93999999999999995 | O553: =SUM(M553:N553) -> 9.8100000000000005
A554: 3581 | B554: EOL VENTOS DE SANTO AUGUSTO VIII | C554: 14.676.003/0002-35 | D554: 6.3399999999999999 | E554: 0 | F554: 0 | G554: 0 | H554: 0 | I554: 0 | J554: 0 | K554: 7.0099999999999998 | L554: 0 | M554: =SUM(J554:L554)-0.67 -> 6.3399999999999999 | N554: 0.67000000000000004 | O554: =SUM(M554:N554) -> 7.0099999999999998
A555: 3582 | B555: EOL VENTOS DE SANTO AUGUSTO II | C555: 15.673.911/0002-38 | D555: 9.3599999999999994 | E555: 0 | F555: 0 | G555: 0 | H555: 0 | I555: 0 | J555: 0 | K555: 10.35 | L555: 0 | M555: =SUM(J555:L555)-0.99 -> 9.3599999999999994 | N555: 0.98999999999999999 | O555: =SUM(M555:N555) -> 10.35
A556: 3583 | B556: EOL VENTOS DE SANTO ESTEVAO V | C556: 15.674.805/0002-79 | D556: 9.3599999999999994 | E556: 0 | F556: 0 | G556: 0 | H556: 0 | I556: 0 | J556: 0 | K556: 10.35 | L556: 0 | M556: =SUM(J556:L556)-0.99 -> 9.3599999999999994 | N556: 0.98999999999999999 | O556: =SUM(M556:N556) -> 10.35
A557: 3584 | B557: EOL VENTOS DE SANTO ESTEVAO III | C557: 15.674.836/0002-20 | D557: 10.140000000000001 | E557: 0 | F557: 0 | G557: 0 | H557: 0 | I557: 0 | J557: 0 | K557: 11.210000000000001 | L557: 0 | M557: =SUM(J557:L557)-1.07 -> 10.140000000000001 | N557: 1.0700000000000001 | O557: =SUM(M557:N557) -> 11.210000000000001
A558: 3585 | B558: EOL AURA MANGUEIRA XII | C558: 19.888.199/0002-45 | D558: 5.21 | E558: 0 | F558: 0 | G558: 0 | H558: 0 | I558: 0 | J558: 0 | K558: 5.7599999999999998 | L558: 0 | M558: =SUM(J558:L558)-0.55 -> 5.21 | N558: 0.55000000000000004 | O558: =SUM(M558:N558) -> 5.7599999999999998
A559: 3586 | B559: EOL AURA MANGUEIRA XIII | C559: 19.868.433/0002-72 | D559: 5.21 | E559: 0 | F559: 0 | G559: 0 | H559: 0 | I559: 0 | J559: 0 | K559: 5.7599999999999998 | L559: 0 | M559: =SUM(J559:L559)-0.55 -> 5.21 | N559: 0.55000000000000004 | O559: =SUM(M559:N559) -> 5.7599999999999998
A560: 3587 | B560: UFV ITUVERAVA 1 E 2 | C560: 21.619.094/0003-13 | D560: 8.6600000000000001 | E560: 0 | F560: 0 | G560: 0 | H560: 0 | I560: 0 | J560: 0 | K560: 9.5700000000000003 | L560: 0 | M560: =SUM(J560:L560)-0.91 -> 8.6600000000000001 | N560: 0.91000000000000003 | O560: =SUM(M560:N560) -> 9.5700000000000003
A561: 3588 | B561: EOL PONTAL 2A | C561: 15.355.380/0001-54 | D561: 6.2300000000000004 | E561: 0 | F561: 0 | G561: 0 | H561: 0 | I561: 0 | J561: 0 | K561: 6.8899999999999997 | L561: 0 | M561: =SUM(J561:L561)-0.66 -> 6.2299999999999995 | N561: 0.66000000000000003 | O561: =SUM(M561:N561) -> 6.8899999999999997
A562: 3589 | B562: EOL PONTAL 2B | C562: 12.752.290/0001-09 | D562: 2.8500000000000001 | E562: 0 | F562: 0 | G562: 0 | H562: 0 | I562: 0 | J562: 0 | K562: 3.1499999999999999 | L562: 0 | M562: =SUM(J562:L562)-0.3 -> 2.8500000000000001 | N562: 0.29999999999999999 | O562: =SUM(M562:N562) -> 3.1499999999999999
A563: 3590 | B563: EOL PONTAL 3B | C563: 15.355.485/0001-03 | D563: 8.3800000000000008 | E563: 0 | F563: 0 | G563: 0 | H563: 0 | I563: 0 | J563: 0 | K563: 9.2599999999999998 | L563: 0 | M563: =SUM(J563:L563)-0.88 -> 8.379999999999999 | N563: 0.88 | O563: =SUM(M563:N563) -> 9.2599999999999998
A564: 3591 | B564: CEMIG (UHE TRES MARIAS) | C564: 06.981.176/0001-58 | D564: 284.89999999999998 | E564: 0 | F564: 0 | G564: 0 | H564: 0 | I564: 0 | J564: 0 | K564: 314.93000000000001 | L564: 0 | M564: =SUM(J564:L564)-30.03 -> 284.89999999999998 | N564: 30.030000000000001 | O564: =SUM(M564:N564) -> 314.92999999999995
A565: 3592 | B565: EOL AURA MANGUEIRA XVII | C565: 19.896.691/0002-62 | D565: 5.21 | E565: 0 | F565: 0 | G565: 0 | H565: 0 | I565: 0 | J565: 0 | K565: 5.7599999999999998 | L565: 0 | M565: =SUM(J565:L565)-0.55 -> 5.21 | N565: 0.55000000000000004 | O565: =SUM(M565:N565) -> 5.7599999999999998
A566: 3593 | B566: EOL AURA MIRIM VI | C566: 19.891.491/0002-17 | D566: 3.1299999999999999 | E566: 0 | F566: 0 | G566: 0 | H566: 0 | I566: 0 | J566: 0 | K566: 3.46 | L566: 0 | M566: =SUM(J566:L566)-0.33 -> 3.1299999999999999 | N566: 0.33000000000000002 | O566: =SUM(M566:N566) -> 3.46
A567: 3594 | B567: EOL AURA MIRIM VIII | C567: 19.917.214/0002-36 | D567: 3.1299999999999999 | E567: 0 | F567: 0 | G567: 0 | H567: 0 | I567: 0 | J567: 0 | K567: 3.46 | L567: 0 | M567: =SUM(J567:L567)-0.33 -> 3.1299999999999999 | N567: 0.33000000000000002 | O567: =SUM(M567:N567) -> 3.46
A568: 3595 | B568: EOL BONS VENTOS CACIMBAS 2 | C568: 19.953.139/0002-69 | D568: 7.71 | E568: 0 | F568: 0 | G568: 0 | H568: 0 | I568: 0 | J568: 0 | K568: 8.5199999999999996 | L568: 0 | M568: =SUM(J568:L568)-0.81 -> 7.7099999999999991 | N568: 0.81000000000000005 | O568: =SUM(M568:N568) -> 8.5199999999999996
A569: 3596 | B569: EOL VENTOS DE SANTO AUGUSTO I | C569: 15.674.987/0002-88 | D569: 6.2400000000000002 | E569: 0 | F569: 0 | G569: 0 | H569: 0 | I569: 0 | J569: 0 | K569: 6.9000000000000004 | L569: 0 | M569: =SUM(J569:L569)-0.66 -> 6.2400000000000002 | N569: 0.66000000000000003 | O569: =SUM(M569:N569) -> 6.9000000000000004
A570: 3597 | B570: EOL VENTOS DE SANTO AUGUSTO VII | C570: 15.673.881/0002-60 | D570: 6.2400000000000002 | E570: 0 | F570: 0 | G570: 0 | H570: 0 | I570: 0 | J570: 0 | K570: 6.9000000000000004 | L570: 0 | M570: =SUM(J570:L570)-0.66 -> 6.2400000000000002 | N570: 0.66000000000000003 | O570: =SUM(M570:N570) -> 6.9000000000000004
A571: 3598 | B571: EOL VENTOS DE SÃO VIRGÍLIO 02 | C571: 21.480.086/0002-58 | D571: 11.630000000000001 | E571: 0 | F571: 0 | G571: 0 | H571: 0 | I571: 0 | J571: 0 | K571: 12.859999999999999 | L571: 0 | M571: =SUM(J571:L571)-1.23 -> 11.629999999999999 | N571: 1.23 | O571: =SUM(M571:N571) -> 12.859999999999999
A572: 3599 | B572: UFV ITUVERAVA 3 E 4 | C572: 21.602.288/0003-06 | D572: 9.25 | E572: 0 | F572: 0 | G572: 0 | H572: 0 | I572: 0 | J572: 0 | K572: 10.23 | L572: 0 | M572: =SUM(J572:L572)-0.98 -> 9.25 | N572: 0.97999999999999998 | O572: =SUM(M572:N572) -> 10.23
A573: 3600 | B573: UFV ITUVERAVA 5 6 E 7 | C573: 21.619.125/0003-36 | D573: 13.390000000000001 | E573: 0 | F573: 0 | G573: 0 | H573: 0 | I573: 0 | J573: 0 | K573: 14.800000000000001 | L573: 0 | M573: =SUM(J573:L573)-1.41 -> 13.390000000000001 | N573: 1.4099999999999999 | O573: =SUM(M573:N573) -> 14.800000000000001
A574: 3601 | B574: UTE CARAMURU | C574: 00.080.671/0001-00 | D574: 3.5299999999999998 | E574: 0 | F574: 0 | G574: 0 | H574: 0 | I574: 0 | J574: 0 | K574: 3.8999999999999999 | L574: 0 | M574: =SUM(J574:L574)-0.37 -> 3.5299999999999998 | N574: 0.37 | O574: =SUM(M574:N574) -> 3.8999999999999999
A575: 3602 | B575: EOL VENTOS DE SANTO ONOFRE IV | C575: 21.480.328/0002-03 | D575: 10.58 | E575: 0 | F575: 0 | G575: 0 | H575: 0 | I575: 0 | J575: 0 | K575: 11.699999999999999 | L575: 0 | M575: =SUM(J575:L575)-1.12 -> 10.579999999999998 | N575: 1.1200000000000001 | O575: =SUM(M575:N575) -> 11.699999999999999
A576: 3603 | B576: EOL VENTOS DE SANTO AUGUSTO VI | C576: 15.673.793/0002-68 | D576: 10.140000000000001 | E576: 0 | F576: 0 | G576: 0 | H576: 0 | I576: 0 | J576: 0 | K576: 11.210000000000001 | L576: 0 | M576: =SUM(J576:L576)-1.07 -> 10.140000000000001 | N576: 1.0700000000000001 | O576: =SUM(M576:N576) -> 11.210000000000001
A577: 3604 | B577: EOL AURA MANGUEIRA IV | C577: 19.869.355/0002-20 | D577: 7.2999999999999998 | E577: 0 | F577: 0 | G577: 0 | H577: 0 | I577: 0 | J577: 0 | K577: 8.0700000000000003 | L577: 0 | M577: =SUM(J577:L577)-0.77 -> 7.3000000000000007 | N577: 0.77000000000000002 | O577: =SUM(M577:N577) -> 8.0700000000000003
A578: 3605 | B578: EOL VENTOS DE SÃO VIRGÍLIO 01 | C578: 21.479.982/0002-05 | D578: 11.460000000000001 | E578: 0 | F578: 0 | G578: 0 | H578: 0 | I578: 0 | J578: 0 | K578: 12.67 | L578: 0 | M578: =SUM(J578:L578)-1.21 -> 11.460000000000001 | N578: 1.21 | O578: =SUM(M578:N578) -> 12.670000000000002
A579: 3606 | B579: EOL VILA ACRE I | C579: 24.061.085/0001-86 | D579: 8.9399999999999995 | E579: 0 | F579: 0 | G579: 0 | H579: 0 | I579: 0 | J579: 0 | K579: 9.8800000000000008 | L579: 0 | M579: =SUM(J579:L579)-0.94 -> 8.9400000000000013 | N579: 0.93999999999999995 | O579: =SUM(M579:N579) -> 9.8800000000000008
A580: 3607 | B580: EOL AURA MANGUEIRA VI | C580: 19.888.311/0002-48 | D580: 9.3900000000000006 | E580: 0 | F580: 0 | G580: 0 | H580: 0 | I580: 0 | J580: 0 | K580: 10.380000000000001 | L580: 0 | M580: =SUM(J580:L580)-0.99 -> 9.3900000000000006 | N580: 0.98999999999999999 | O580: =SUM(M580:N580) -> 10.380000000000001
A581: 3608 | B581: EOL PEDRA CHEIROSA | C581: 10.883.378/0001-34 | D581: 8.0800000000000001 | E581: 0 | F581: 0 | G581: 0 | H581: 0 | I581: 0 | J581: 0 | K581: 8.9299999999999997 | L581: 0 | M581: =SUM(J581:L581)-0.85 -> 8.0800000000000001 | N581: 0.84999999999999998 | O581: =SUM(M581:N581) -> 8.9299999999999997
A582: 3609 | B582: UFV NOVA OLINDA 8 | C582: 23.566.105/0003-70 | D582: 4.0700000000000003 | E582: 0 | F582: 0 | G582: 0 | H582: 0 | I582: 0 | J582: 0 | K582: 4.5 | L582: 0 | M582: =SUM(J582:L582)-0.43 -> 4.0700000000000003 | N582: 0.42999999999999999 | O582: =SUM(M582:N582) -> 4.5
A583: 3610 | B583: UFV NOVA OLINDA 10 | C583: 23.416.727/0003-11 | D583: 4.0700000000000003 | E583: 0 | F583: 0 | G583: 0 | H583: 0 | I583: 0 | J583: 0 | K583: 4.5 | L583: 0 | M583: =SUM(J583:L583)-0.43 -> 4.0700000000000003 | N583: 0.42999999999999999 | O583: =SUM(M583:N583) -> 4.5
A584: 3611 | B584: UFV NOVA OLINDA 12 | C584: 23.414.549/0003-90 | D584: 4.0800000000000001 | E584: 0 | F584: 0 | G584: 0 | H584: 0 | I584: 0 | J584: 0 | K584: 4.5099999999999998 | L584: 0 | M584: =SUM(J584:L584)-0.43 -> 4.0800000000000001 | N584: 0.42999999999999999 | O584: =SUM(M584:N584) -> 4.5099999999999998
A585: 3612 | B585: UFV NOVA OLINDA 14 | C585: 23.399.563/0003-61 | D585: 4.0599999999999996 | E585: 0 | F585: 0 | G585: 0 | H585: 0 | I585: 0 | J585: 0 | K585: 4.4900000000000002 | L585: 0 | M585: =SUM(J585:L585)-0.43 -> 4.0600000000000005 | N585: 0.42999999999999999 | O585: =SUM(M585:N585) -> 4.4900000000000002
A586: 3613 | B586: EOL DELTA 3 I | C586: 23.598.517/0002-00 | D586: 7.6699999999999999 | E586: 0 | F586: 0 | G586: 0 | H586: 0 | I586: 0 | J586: 0 | K586: 8.4800000000000004 | L586: 0 | M586: =SUM(J586:L586)-0.81 -> 7.6699999999999999 | N586: 0.81000000000000005 | O586: =SUM(M586:N586) -> 8.4800000000000004
A587: 3614 | B587: EOL DELTA 3 II | C587: 23.598.858/0002-86 | D587: 7.6699999999999999 | E587: 0 | F587: 0 | G587: 0 | H587: 0 | I587: 0 | J587: 0 | K587: 8.4800000000000004 | L587: 0 | M587: =SUM(J587:L587)-0.81 -> 7.6699999999999999 | N587: 0.81000000000000005 | O587: =SUM(M587:N587) -> 8.4800000000000004
A588: 3615 | B588: EOL DELTA 3 III | C588: 23.598.847/0002-04 | D588: 7.6699999999999999 | E588: 0 | F588: 0 | G588: 0 | H588: 0 | I588: 0 | J588: 0 | K588: 8.4800000000000004 | L588: 0 | M588: =SUM(J588:L588)-0.81 -> 7.6699999999999999 | N588: 0.81000000000000005 | O588: =SUM(M588:N588) -> 8.4800000000000004
A589: 3616 | B589: EOL VENTOS DE SÃO VICENTE 14 | C589: 21.869.347/0001-45 | D589: 10.01 | E589: 0 | F589: 0 | G589: 0 | H589: 0 | I589: 0 | J589: 0 | K589: 11.07 | L589: 0 | M589: =SUM(J589:L589)-1.06 -> 10.01 | N589: 1.0600000000000001 | O589: =SUM(M589:N589) -> 11.07
A590: 3617 | B590: EOL DELTA 3 V | C590: 23.598.829/0002-14 | D590: 7.6699999999999999 | E590: 0 | F590: 0 | G590: 0 | H590: 0 | I590: 0 | J590: 0 | K590: 8.4800000000000004 | L590: 0 | M590: =SUM(J590:L590)-0.81 -> 7.6699999999999999 | N590: 0.81000000000000005 | O590: =SUM(M590:N590) -> 8.4800000000000004
A591: 3618 | B591: EOL DELTA 3 VI | C591: 23.598.831/0002-93 | D591: 7.6699999999999999 | E591: 0 | F591: 0 | G591: 0 | H591: 0 | I591: 0 | J591: 0 | K591: 8.4800000000000004 | L591: 0 | M591: =SUM(J591:L591)-0.81 -> 7.6699999999999999 | N591: 0.81000000000000005 | O591: =SUM(M591:N591) -> 8.4800000000000004
A592: 3619 | B592: EOL DELTA 3 VII | C592: 23.598.844/0002-62 | D592: 7.6900000000000004 | E592: 0 | F592: 0 | G592: 0 | H592: 0 | I592: 0 | J592: 0 | K592: 8.5 | L592: 0 | M592: =SUM(J592:L592)-0.81 -> 7.6899999999999995 | N592: 0.81000000000000005 | O592: =SUM(M592:N592) -> 8.5
A593: 3620 | B593: EOL DELTA 3 VIII | C593: 15.190.472/0002-02 | D593: 8.2300000000000004 | E593: 0 | F593: 0 | G593: 0 | H593: 0 | I593: 0 | J593: 0 | K593: 9.0999999999999996 | L593: 0 | M593: =SUM(J593:L593)-0.87 -> 8.2300000000000004 | N593: 0.87 | O593: =SUM(M593:N593) -> 9.0999999999999996
A594: 3621 | B594: EOL VENTOS DE SANTO ESTEVAO I | C594: 16.712.566/0002-67 | D594: 8.5800000000000001 | E594: 0 | F594: 0 | G594: 0 | H594: 0 | I594: 0 | J594: 0 | K594: 9.4800000000000004 | L594: 0 | M594: =SUM(J594:L594)-0.9 -> 8.5800000000000001 | N594: 0.90000000000000002 | O594: =SUM(M594:N594) -> 9.4800000000000004
A595: 3622 | B595: EOL VENTOS DE SANTO ESTEVAO II | C595: 16.603.387/0002-91 | D595: 8.5800000000000001 | E595: 0 | F595: 0 | G595: 0 | H595: 0 | I595: 0 | J595: 0 | K595: 9.4800000000000004 | L595: 0 | M595: =SUM(J595:L595)-0.9 -> 8.5800000000000001 | N595: 0.90000000000000002 | O595: =SUM(M595:N595) -> 9.4800000000000004
A596: 3623 | B596: EOL VENTOS DE SANTO ESTEVAO IV | C596: 21.480.026/0002-35 | D596: 11.460000000000001 | E596: 0 | F596: 0 | G596: 0 | H596: 0 | I596: 0 | J596: 0 | K596: 12.67 | L596: 0 | M596: =SUM(J596:L596)-1.21 -> 11.460000000000001 | N596: 1.21 | O596: =SUM(M596:N596) -> 12.670000000000002
A597: 3624 | B597: UFV LAPA 2 | C597: 23.509.564/0002-30 | D597: 4.2800000000000002 | E597: 0 | F597: 0 | G597: 0 | H597: 0 | I597: 0 | J597: 0 | K597: 4.7300000000000004 | L597: 0 | M597: =SUM(J597:L597)-0.45 -> 4.2800000000000002 | N597: 0.45000000000000001 | O597: =SUM(M597:N597) -> 4.7300000000000004
A598: 3625 | B598: EOL PEDRA CHEIROSA II | C598: 10.883.587/0001-88 | D598: 7.3899999999999997 | E598: 0 | F598: 0 | G598: 0 | H598: 0 | I598: 0 | J598: 0 | K598: 8.1699999999999999 | L598: 0 | M598: =SUM(J598:L598)-0.78 -> 7.3899999999999997 | N598: 0.78000000000000003 | O598: =SUM(M598:N598) -> 8.1699999999999999
A599: 3626 | B599: EOL DELTA 3 IV | C599: 23.598.842/0002-73 | D599: 7.6699999999999999 | E599: 0 | F599: 0 | G599: 0 | H599: 0 | I599: 0 | J599: 0 | K599: 8.4800000000000004 | L599: 0 | M599: =SUM(J599:L599)-0.81 -> 7.6699999999999999 | N599: 0.81000000000000005 | O599: =SUM(M599:N599) -> 8.4800000000000004
A600: 3627 | B600: EOL CRISTALÂNDIA I | C600: 22.499.471/0003-90 | D600: 9.6899999999999995 | E600: 0 | F600: 0 | G600: 0 | H600: 0 | I600: 0 | J600: 0 | K600: 10.710000000000001 | L600: 0 | M600: =SUM(J600:L600)-1.02 -> 9.6900000000000013 | N600: 1.02 | O600: =SUM(M600:N600) -> 10.710000000000001
A601: 3628 | B601: EOL CRISTALÂNDIA II | C601: 23.049.225/0003-08 | D601: 9.6899999999999995 | E601: 0 | F601: 0 | G601: 0 | H601: 0 | I601: 0 | J601: 0 | K601: 10.710000000000001 | L601: 0 | M601: =SUM(J601:L601)-1.02 -> 9.6900000000000013 | N601: 1.02 | O601: =SUM(M601:N601) -> 10.710000000000001
A602: 3629 | B602: EOL DELFINA IV | C602: 21.553.603/0003-52 | D602: 3.3100000000000001 | E602: 0 | F602: 0 | G602: 0 | H602: 0 | I602: 0 | J602: 0 | K602: 3.6600000000000001 | L602: 0 | M602: =SUM(J602:L602)-0.35 -> 3.3100000000000001 | N602: 0.34999999999999998 | O602: =SUM(M602:N602) -> 3.6600000000000001
A603: 3630 | B603: EOL DELFINA V | C603: 21.552.886/0003-18 | D603: 33.409999999999997 | E603: 0 | F603: 0 | G603: 0 | H603: 0 | I603: 0 | J603: 0 | K603: 36.93 | L603: 0 | M603: =SUM(J603:L603)-3.52 -> 33.409999999999997 | N603: 3.52 | O603: =SUM(M603:N603) -> 36.93
A604: 3631 | B604: EOL VENTOS DE SÃO VIRGÍLIO 03 | C604: 21.480.051/0002-19 | D604: 7.6299999999999999 | E604: 0 | F604: 0 | G604: 0 | H604: 0 | I604: 0 | J604: 0 | K604: 8.4299999999999997 | L604: 0 | M604: =SUM(J604:L604)-0.8 -> 7.6299999999999999 | N604: 0.80000000000000004 | O604: =SUM(M604:N604) -> 8.4299999999999997
A605: 3632 | B605: ELETRONORTE (UTE MAUA 3) | C605: 00.357.038/0001-16 | D605: 242.19999999999999 | E605: 0 | F605: 0 | G605: 0 | H605: 0 | I605: 0 | J605: 0 | K605: 267.73000000000002 | L605: 0 | M605: =SUM(J605:L605)-25.53 -> 242.20000000000002 | N605: 25.530000000000001 | O605: =SUM(M605:N605) -> 267.73000000000002
A606: 3633 | B606: EOL DREEN CUTIA | C606: 21.917.808/0001-08 | D606: 8.4299999999999997 | E606: 0 | F606: 0 | G606: 0 | H606: 0 | I606: 0 | J606: 0 | K606: 9.3200000000000003 | L606: 0 | M606: =SUM(J606:L606)-0.89 -> 8.4299999999999997 | N606: 0.89000000000000001 | O606: =SUM(M606:N606) -> 9.3200000000000003
A607: 3634 | B607: EOL DREEN GUAJIRU | C607: 21.957.870/0001-23 | D607: 7.7000000000000002 | E607: 0 | F607: 0 | G607: 0 | H607: 0 | I607: 0 | J607: 0 | K607: 8.5099999999999998 | L607: 0 | M607: =SUM(J607:L607)-0.81 -> 7.6999999999999993 | N607: 0.81000000000000005 | O607: =SUM(M607:N607) -> 8.5099999999999998
A608: 3635 | B608: EOL GE JANGADA | C608: 21.957.722/0001-09 | D608: 10.01 | E608: 0 | F608: 0 | G608: 0 | H608: 0 | I608: 0 | J608: 0 | K608: 11.07 | L608: 0 | M608: =SUM(J608:L608)-1.06 -> 10.01 | N608: 1.0600000000000001 | O608: =SUM(M608:N608) -> 11.07
A609: 3636 | B609: EOL GE MARIA HELENA | C609: 21.909.793/0001-36 | D609: 10.01 | E609: 0 | F609: 0 | G609: 0 | H609: 0 | I609: 0 | J609: 0 | K609: 11.07 | L609: 0 | M609: =SUM(J609:L609)-1.06 -> 10.01 | N609: 1.0600000000000001 | O609: =SUM(M609:N609) -> 11.07
A610: 3637 | B610: EOL POTIGUAR | C610: 21.957.968/0001-80 | D610: 10.01 | E610: 0 | F610: 0 | G610: 0 | H610: 0 | I610: 0 | J610: 0 | K610: 11.07 | L610: 0 | M610: =SUM(J610:L610)-1.06 -> 10.01 | N610: 1.0600000000000001 | O610: =SUM(M610:N610) -> 11.07
A611: 3638 | B611: EOL ESPERANÇA DO NORDESTE | C611: 21.916.951/0001-85 | D611: 10.01 | E611: 0 | F611: 0 | G611: 0 | H611: 0 | I611: 0 | J611: 0 | K611: 11.07 | L611: 0 | M611: =SUM(J611:L611)-1.06 -> 10.01 | N611: 1.0600000000000001 | O611: =SUM(M611:N611) -> 11.07
A612: 3639 | B612: EOL PARAÍSO DOS V DO NORDESTE | C612: 21.909.032/0001-84 | D612: 10.01 | E612: 0 | F612: 0 | G612: 0 | H612: 0 | I612: 0 | J612: 0 | K612: 11.07 | L612: 0 | M612: =SUM(J612:L612)-1.06 -> 10.01 | N612: 1.0600000000000001 | O612: =SUM(M612:N612) -> 11.07
A613: 3640 | B613: EOL TAMANDUA MIRIM 2 | C613: 33.541.368/0001-16 | D613: 5.7699999999999996 | E613: 0 | F613: 0 | G613: 0 | H613: 0 | I613: 0 | J613: 0 | K613: 6.3799999999999999 | L613: 0 | M613: =SUM(J613:L613)-0.61 -> 5.7699999999999996 | N613: 0.60999999999999999 | O613: =SUM(M613:N613) -> 6.3799999999999999
A614: 3641 | B614: EOL PAPAGAIO | C614: 33.541.368/0001-16 | D614: 3.29 | E614: 0 | F614: 0 | G614: 0 | H614: 0 | I614: 0 | J614: 0 | K614: 3.6400000000000001 | L614: 0 | M614: =SUM(J614:L614)-0.35 -> 3.29 | N614: 0.34999999999999998 | O614: =SUM(M614:N614) -> 3.6400000000000001
A615: 3642 | B615: EOL CORRUPIAO 3 | C615: 33.541.368/0001-16 | D615: 3.3100000000000001 | E615: 0 | F615: 0 | G615: 0 | H615: 0 | I615: 0 | J615: 0 | K615: 3.6600000000000001 | L615: 0 | M615: =SUM(J615:L615)-0.35 -> 3.3100000000000001 | N615: 0.34999999999999998 | O615: =SUM(M615:N615) -> 3.6600000000000001
A616: 3643 | B616: EOL COQUEIRINHO 2 | C616: 33.541.368/0001-16 | D616: 5.2699999999999996 | E616: 0 | F616: 0 | G616: 0 | H616: 0 | I616: 0 | J616: 0 | K616: 5.8300000000000001 | L616: 0 | M616: =SUM(J616:L616)-0.56 -> 5.2699999999999996 | N616: 0.56000000000000005 | O616: =SUM(M616:N616) -> 5.8300000000000001
A617: 3644 | B617: EOL CARCARÁ | C617: 33.541.368/0001-16 | D617: 3.3100000000000001 | E617: 0 | F617: 0 | G617: 0 | H617: 0 | I617: 0 | J617: 0 | K617: 3.6600000000000001 | L617: 0 | M617: =SUM(J617:L617)-0.35 -> 3.3100000000000001 | N617: 0.34999999999999998 | O617: =SUM(M617:N617) -> 3.6600000000000001
A618: 3645 | B618: EOL CAITITU 2 | C618: 33.541.368/0001-16 | D618: 3.3100000000000001 | E618: 0 | F618: 0 | G618: 0 | H618: 0 | I618: 0 | J618: 0 | K618: 3.6600000000000001 | L618: 0 | M618: =SUM(J618:L618)-0.35 -> 3.3100000000000001 | N618: 0.34999999999999998 | O618: =SUM(M618:N618) -> 3.6600000000000001
A619: 3646 | B619: EOL CAITITU 3 | C619: 33.541.368/0001-16 | D619: 3.3100000000000001 | E619: 0 | F619: 0 | G619: 0 | H619: 0 | I619: 0 | J619: 0 | K619: 3.6600000000000001 | L619: 0 | M619: =SUM(J619:L619)-0.35 -> 3.3100000000000001 | N619: 0.34999999999999998 | O619: =SUM(M619:N619) -> 3.6600000000000001
A620: 3647 | B620: EOL ANGICAL 2 | C620: 33.541.368/0001-16 | D620: 3.3100000000000001 | E620: 0 | F620: 0 | G620: 0 | H620: 0 | I620: 0 | J620: 0 | K620: 3.6600000000000001 | L620: 0 | M620: =SUM(J620:L620)-0.35 -> 3.3100000000000001 | N620: 0.34999999999999998 | O620: =SUM(M620:N620) -> 3.6600000000000001
A621: 3648 | B621: EOL ARAPAPÁ | C621: 33.541.368/0001-16 | D621: 1.3200000000000001 | E621: 0 | F621: 0 | G621: 0 | H621: 0 | I621: 0 | J621: 0 | K621: 1.46 | L621: 0 | M621: =SUM(J621:L621)-0.14 -> 1.3199999999999998 | N621: 0.14000000000000001 | O621: =SUM(M621:N621) -> 1.46
A622: 3649 | B622: EOL ACAUÃ | C622: 33.541.368/0001-16 | D622: 2.1099999999999999 | E622: 0 | F622: 0 | G622: 0 | H622: 0 | I622: 0 | J622: 0 | K622: 2.3300000000000001 | L622: 0 | M622: =SUM(J622:L622)-0.22 -> 2.1099999999999999 | N622: 0.22 | O622: =SUM(M622:N622) -> 2.3300000000000001
A623: 3650 | B623: EOL TEIU 2 | C623: 33.541.368/0001-16 | D623: 2.6600000000000001 | E623: 0 | F623: 0 | G623: 0 | H623: 0 | I623: 0 | J623: 0 | K623: 2.9399999999999999 | L623: 0 | M623: =SUM(J623:L623)-0.28 -> 2.6600000000000001 | N623: 0.28000000000000003 | O623: =SUM(M623:N623) -> 2.9400000000000004
A624: 3672 | B624: RENOVA (EOL ANGICO) | C624: 18.870.073/0001-08 | D624: 2.5600000000000001 | E624: 0 | F624: 0 | G624: 0 | H624: 0 | I624: 0 | J624: 0 | K624: 2.8300000000000001 | L624: 0 | M624: =SUM(J624:L624)-0.27 -> 2.5600000000000001 | N624: 0.27000000000000002 | O624: =SUM(M624:N624) -> 2.8300000000000001
A625: 3673 | B625: RENOVA (EOL SABIU) | C625: 17.305.829/0001-03 | D625: 4.3700000000000001 | E625: 0 | F625: 0 | G625: 0 | H625: 0 | I625: 0 | J625: 0 | K625: 4.8300000000000001 | L625: 0 | M625: =SUM(J625:L625)-0.46 -> 4.3700000000000001 | N625: 0.46000000000000002 | O625: =SUM(M625:N625) -> 4.8300000000000001
A626: 3674 | B626: RENOVA (EOL PAU D’ÁGUA) | C626: 17.250.513/0001-53 | D626: 5.8099999999999996 | E626: 0 | F626: 0 | G626: 0 | H626: 0 | I626: 0 | J626: 0 | K626: 6.4199999999999999 | L626: 0 | M626: =SUM(J626:L626)-0.61 -> 5.8099999999999996 | N626: 0.60999999999999999 | O626: =SUM(M626:N626) -> 6.4199999999999999
A627: 3675 | B627: RENOVA (EOL MANINEIRO) | C627: 18.560.162/0001-40 | D627: 4.4699999999999998 | E627: 0 | F627: 0 | G627: 0 | H627: 0 | I627: 0 | J627: 0 | K627: 4.9400000000000004 | L627: 0 | M627: =SUM(J627:L627)-0.47 -> 4.4700000000000006 | N627: 0.46999999999999997 | O627: =SUM(M627:N627) -> 4.9400000000000004
A628: 3676 | B628: RENOVA (EOL FACHEIO) | C628: 18.559.964/0001-30 | D628: 5.3200000000000003 | E628: 0 | F628: 0 | G628: 0 | H628: 0 | I628: 0 | J628: 0 | K628: 5.8799999999999999 | L628: 0 | M628: =SUM(J628:L628)-0.56 -> 5.3200000000000003 | N628: 0.56000000000000005 | O628: =SUM(M628:N628) -> 5.8800000000000008
A629: 3677 | B629: RENOVA (EOL UMBUZEIRO) | C629: 18.560.273/0001-56 | D629: 6.0899999999999999 | E629: 0 | F629: 0 | G629: 0 | H629: 0 | I629: 0 | J629: 0 | K629: 6.7300000000000004 | L629: 0 | M629: =SUM(J629:L629)-0.64 -> 6.0900000000000007 | N629: 0.64000000000000001 | O629: =SUM(M629:N629) -> 6.7300000000000004
A630: 3678 | B630: RENOVA (EOL CEDRO) | C630: 17.330.840/0001-15 | D630: 3.9100000000000001 | E630: 0 | F630: 0 | G630: 0 | H630: 0 | I630: 0 | J630: 0 | K630: 4.3200000000000003 | L630: 0 | M630: =SUM(J630:L630)-0.41 -> 3.9100000000000001 | N630: 0.40999999999999998 | O630: =SUM(M630:N630) -> 4.3200000000000003
A631: 3679 | B631: RENOVA (EOL JATAÍ) | C631: 18.560.347/0001-54 | D631: 5.2300000000000004 | E631: 0 | F631: 0 | G631: 0 | H631: 0 | I631: 0 | J631: 0 | K631: 5.7800000000000002 | L631: 0 | M631: =SUM(J631:L631)-0.55 -> 5.2300000000000004 | N631: 0.55000000000000004 | O631: =SUM(M631:N631) -> 5.7800000000000002
A632: 3680 | B632: RENOVA (EOL BARBATIMÃO) | C632: 19.502.908/0001-21 | D632: 5.2300000000000004 | E632: 0 | F632: 0 | G632: 0 | H632: 0 | I632: 0 | J632: 0 | K632: 5.7800000000000002 | L632: 0 | M632: =SUM(J632:L632)-0.55 -> 5.2300000000000004 | N632: 0.55000000000000004 | O632: =SUM(M632:N632) -> 5.7800000000000002
A633: 3681 | B633: RENOVA (EOL IMBURANA MACHO) | C633: 19.502.538/0001-22 | D633: 5.2300000000000004 | E633: 0 | F633: 0 | G633: 0 | H633: 0 | I633: 0 | J633: 0 | K633: 5.7800000000000002 | L633: 0 | M633: =SUM(J633:L633)-0.55 -> 5.2300000000000004 | N633: 0.55000000000000004 | O633: =SUM(M633:N633) -> 5.7800000000000002
A634: 3682 | B634: RENOVA (EOL AMESCLA) | C634: 19.502.635/0001-15 | D634: 4.3499999999999996 | E634: 0 | F634: 0 | G634: 0 | H634: 0 | I634: 0 | J634: 0 | K634: 4.8099999999999996 | L634: 0 | M634: =SUM(J634:L634)-0.46 -> 4.3499999999999996 | N634: 0.46000000000000002 | O634: =SUM(M634:N634) -> 4.8099999999999996
A635: 3683 | B635: RENOVA (EOL JUAZEIRO) | C635: 19.502.341/0001-93 | D635: 6.0999999999999996 | E635: 0 | F635: 0 | G635: 0 | H635: 0 | I635: 0 | J635: 0 | K635: 6.7400000000000002 | L635: 0 | M635: =SUM(J635:L635)-0.64 -> 6.1000000000000005 | N635: 0.64000000000000001 | O635: =SUM(M635:N635) -> 6.7400000000000002
A636: 3684 | B636: RENOVA (EOL ANGELIM) | C636: 19.502.690/0001-05 | D636: 6.9699999999999998 | E636: 0 | F636: 0 | G636: 0 | H636: 0 | I636: 0 | J636: 0 | K636: 7.7000000000000002 | L636: 0 | M636: =SUM(J636:L636)-0.73 -> 6.9700000000000006 | N636: 0.72999999999999998 | O636: =SUM(M636:N636) -> 7.7000000000000011
A637: 3685 | B637: RENOVA (EOL VELLOZIA) | C637: 18.560.475/0001-06 | D637: 5.3300000000000001 | E637: 0 | F637: 0 | G637: 0 | H637: 0 | I637: 0 | J637: 0 | K637: 5.8899999999999997 | L637: 0 | M637: =SUM(J637:L637)-0.56 -> 5.3300000000000001 | N637: 0.56000000000000005 | O637: =SUM(M637:N637) -> 5.8900000000000006
A638: 3686 | B638: RENOVA (EOL TABOQUINHA) | C638: 18.870.116/0001-47 | D638: 6.8399999999999999 | E638: 0 | F638: 0 | G638: 0 | H638: 0 | I638: 0 | J638: 0 | K638: 7.5599999999999996 | L638: 0 | M638: =SUM(J638:L638)-0.72 -> 6.8399999999999999 | N638: 0.71999999999999997 | O638: =SUM(M638:N638) -> 7.5599999999999996
A639: 3687 | B639: RENOVA (EOL ACÁCIA) | C639: 18.919.425/0001-64 | D639: 5.1299999999999999 | E639: 0 | F639: 0 | G639: 0 | H639: 0 | I639: 0 | J639: 0 | K639: 5.6699999999999999 | L639: 0 | M639: =SUM(J639:L639)-0.54 -> 5.1299999999999999 | N639: 0.54000000000000004 | O639: =SUM(M639:N639) -> 5.6699999999999999
A640: 3688 | B640: RENOVA (EOL SÃO SALVADOR) | C640: 11.197.380/0001-12 | D640: 9.0299999999999994 | E640: 0 | F640: 0 | G640: 0 | H640: 0 | I640: 0 | J640: 0 | K640: 9.9800000000000004 | L640: 0 | M640: =SUM(J640:L640)-0.95 -> 9.0300000000000011 | N640: 0.94999999999999996 | O640: =SUM(M640:N640) -> 9.9800000000000004
A641: 3689 | B641: EOL VENTOS DE SÃO VICENTE 12 | C641: 21.877.685/0001-29 | D641: 10.029999999999999 | E641: 0 | F641: 0 | G641: 0 | H641: 0 | I641: 0 | J641: 0 | K641: 11.09 | L641: 0 | M641: =SUM(J641:L641)-1.06 -> 10.029999999999999 | N641: 1.0600000000000001 | O641: =SUM(M641:N641) -> 11.09
A642: 3690 | B642: EOL DELFINA III | C642: 21.556.441/0003-06 | D642: 11.58 | E642: 0 | F642: 0 | G642: 0 | H642: 0 | I642: 0 | J642: 0 | K642: 12.800000000000001 | L642: 0 | M642: =SUM(J642:L642)-1.22 -> 11.58 | N642: 1.22 | O642: =SUM(M642:N642) -> 12.800000000000001
A643: 3691 | B643: EOL DELFINA VI | C643: 21.553.640/0003-60 | D643: 12.43 | E643: 0 | F643: 0 | G643: 0 | H643: 0 | I643: 0 | J643: 0 | K643: 13.74 | L643: 0 | M643: =SUM(J643:L643)-1.31 -> 12.43 | N643: 1.3100000000000001 | O643: =SUM(M643:N643) -> 13.74
A644: 3692 | B644: EOL DELFINA VII | C644: 21.599.114/0003-31 | D644: 12.43 | E644: 0 | F644: 0 | G644: 0 | H644: 0 | I644: 0 | J644: 0 | K644: 13.74 | L644: 0 | M644: =SUM(J644:L644)-1.31 -> 12.43 | N644: 1.3100000000000001 | O644: =SUM(M644:N644) -> 13.74
A645: 3693 | B645: EOL JAU | C645: 17.227.909/0002-60 | D645: 35.32 | E645: 0 | F645: 0 | G645: 0 | H645: 0 | I645: 0 | J645: 0 | K645: 39.039999999999999 | L645: 0 | M645: =SUM(J645:L645)-3.72 -> 35.32 | N645: 3.7200000000000002 | O645: =SUM(M645:N645) -> 39.039999999999999
A646: 3694 | B646: UFV HORIZONTE MP 1 | C646: 23.399.589/0002-29 | D646: 10.470000000000001 | E646: 0 | F646: 0 | G646: 0 | H646: 0 | I646: 0 | J646: 0 | K646: 11.57 | L646: 0 | M646: =SUM(J646:L646)-1.1 -> 10.470000000000001 | N646: 1.1000000000000001 | O646: =SUM(M646:N646) -> 11.57
A647: 3695 | B647: EOL DOIS RIACHOS | C647: 17.018.370/0002-30 | D647: 21.859999999999999 | E647: 0 | F647: 0 | G647: 0 | H647: 0 | I647: 0 | J647: 0 | K647: 24.16 | L647: 0 | M647: =SUM(J647:L647)-2.3 -> 21.859999999999999 | N647: 2.2999999999999998 | O647: =SUM(M647:N647) -> 24.16
A648: 3696 | B648: EOL ASSURUÁ IV | C648: 21.544.129/0002-11 | D648: 13.33 | E648: 0 | F648: 0 | G648: 0 | H648: 0 | I648: 0 | J648: 0 | K648: 14.74 | L648: 0 | M648: =SUM(J648:L648)-1.41 -> 13.33 | N648: 1.4099999999999999 | O648: =SUM(M648:N648) -> 14.74
A649: 3697 | B649: EOL UNIÃO DOS VENTOS 12 | C649: 18.265.320/0001-39 | D649: 10.4 | E649: 0 | F649: 0 | G649: 0 | H649: 0 | I649: 0 | J649: 0 | K649: 11.5 | L649: 0 | M649: =SUM(J649:L649)-1.1 -> 10.4 | N649: 1.1000000000000001 | O649: =SUM(M649:N649) -> 11.5
A650: 3698 | B650: EOL UNIÃO DOS VENTOS 13 | C650: 17.143.971/0001-93 | D650: 7.7999999999999998 | E650: 0 | F650: 0 | G650: 0 | H650: 0 | I650: 0 | J650: 0 | K650: 8.6199999999999992 | L650: 0 | M650: =SUM(J650:L650)-0.82 -> 7.7999999999999989 | N650: 0.81999999999999995 | O650: =SUM(M650:N650) -> 8.6199999999999992
A651: 3699 | B651: EOL UNIÃO DOS VENTOS 14 | C651: 17.143.838/0001-37 | D651: 8.6899999999999995 | E651: 0 | F651: 0 | G651: 0 | H651: 0 | I651: 0 | J651: 0 | K651: 9.6099999999999994 | L651: 0 | M651: =SUM(J651:L651)-0.92 -> 8.6899999999999995 | N651: 0.92000000000000004 | O651: =SUM(M651:N651) -> 9.6099999999999994
A652: 3700 | B652: EOL UNIÃO DOS VENTOS 15 | C652: 13.783.102/0001-72 | D652: 12.609999999999999 | E652: 0 | F652: 0 | G652: 0 | H652: 0 | I652: 0 | J652: 0 | K652: 13.94 | L652: 0 | M652: =SUM(J652:L652)-1.33 -> 12.609999999999999 | N652: 1.3300000000000001 | O652: =SUM(M652:N652) -> 13.94
A653: 3701 | B653: EOL UNIÃO DOS VENTOS 16 | C653: 17.205.697/0001-30 | D653: 12.02 | E653: 0 | F653: 0 | G653: 0 | H653: 0 | I653: 0 | J653: 0 | K653: 13.289999999999999 | L653: 0 | M653: =SUM(J653:L653)-1.27 -> 12.02 | N653: 1.27 | O653: =SUM(M653:N653) -> 13.289999999999999
A654: 3702 | B654: EOL VENTOS DE SÃO VICENTE 13 | C654: 21.877.676/0001-38 | D654: 10.029999999999999 | E654: 0 | F654: 0 | G654: 0 | H654: 0 | I654: 0 | J654: 0 | K654: 11.09 | L654: 0 | M654: =SUM(J654:L654)-1.06 -> 10.029999999999999 | N654: 1.0600000000000001 | O654: =SUM(M654:N654) -> 11.09
A655: 3703 | B655: EOL PEDRA RAJADA | C655: 21.909.246/0001-50 | D655: 7.0899999999999999 | E655: 0 | F655: 0 | G655: 0 | H655: 0 | I655: 0 | J655: 0 | K655: 7.8399999999999999 | L655: 0 | M655: =SUM(J655:L655)-0.75 -> 7.0899999999999999 | N655: 0.75 | O655: =SUM(M655:N655) -> 7.8399999999999999
A656: 3704 | B656: EOL PEDRA RAJADA II | C656: 21.909.399/0001-06 | D656: 7.0899999999999999 | E656: 0 | F656: 0 | G656: 0 | H656: 0 | I656: 0 | J656: 0 | K656: 7.8399999999999999 | L656: 0 | M656: =SUM(J656:L656)-0.75 -> 7.0899999999999999 | N656: 0.75 | O656: =SUM(M656:N656) -> 7.8399999999999999
A657: 3705 | B657: EOL SERRA DAS VACAS V | C657: 22.357.375/0001-46 | D657: 8.8499999999999996 | E657: 0 | F657: 0 | G657: 0 | H657: 0 | I657: 0 | J657: 0 | K657: 9.7799999999999994 | L657: 0 | M657: =SUM(J657:L657)-0.93 -> 8.8499999999999996 | N657: 0.93000000000000005 | O657: =SUM(M657:N657) -> 9.7799999999999994
A658: 3706 | B658: EOL SERRA DAS VACAS VII | C658: 22.193.319/0001-13 | D658: 8.8499999999999996 | E658: 0 | F658: 0 | G658: 0 | H658: 0 | I658: 0 | J658: 0 | K658: 9.7799999999999994 | L658: 0 | M658: =SUM(J658:L658)-0.93 -> 8.8499999999999996 | N658: 0.93000000000000005 | O658: =SUM(M658:N658) -> 9.7799999999999994
A659: 3711 | B659: EOL VENTOS DE SÃO VICENTE 8 | C659: 21.840.617/0001-95 | D659: 10.050000000000001 | E659: 0 | F659: 0 | G659: 0 | H659: 0 | I659: 0 | J659: 0 | K659: 11.109999999999999 | L659: 0 | M659: =SUM(J659:L659)-1.06 -> 10.049999999999999 | N659: 1.0600000000000001 | O659: =SUM(M659:N659) -> 11.109999999999999
A660: 3712 | B660: EOL VENTOS DE SÃO VICENTE 11 | C660: 23.037.357/0001-40 | D660: 10.06 | E660: 0 | F660: 0 | G660: 0 | H660: 0 | I660: 0 | J660: 0 | K660: 11.119999999999999 | L660: 0 | M660: =SUM(J660:L660)-1.06 -> 10.059999999999999 | N660: 1.0600000000000001 | O660: =SUM(M660:N660) -> 11.119999999999999
A661: 3713 | B661: EOL ASSURUÁ III | C661: 21.544.084/0002-85 | D661: 5.6699999999999999 | E661: 0 | F661: 0 | G661: 0 | H661: 0 | I661: 0 | J661: 0 | K661: 6.2699999999999996 | L661: 0 | M661: =SUM(J661:L661)-0.6 -> 5.6699999999999999 | N661: 0.59999999999999998 | O661: =SUM(M661:N661) -> 6.2699999999999996
A662: 3714 | B662: EOL CAPOEIRAS III | C662: 21.543.971/0002-39 | D662: 12.300000000000001 | E662: 0 | F662: 0 | G662: 0 | H662: 0 | I662: 0 | J662: 0 | K662: 13.6 | L662: 0 | M662: =SUM(J662:L662)-1.3 -> 12.299999999999999 | N662: 1.3 | O662: =SUM(M662:N662) -> 13.6
A663: 3715 | B663: EOL CURRAL DE PEDRAS I | C663: 21.541.973/0002-99 | D663: 9.1099999999999994 | E663: 0 | F663: 0 | G663: 0 | H663: 0 | I663: 0 | J663: 0 | K663: 10.07 | L663: 0 | M663: =SUM(J663:L663)-0.96 -> 9.1099999999999994 | N663: 0.95999999999999996 | O663: =SUM(M663:N663) -> 10.07
A664: 3716 | B664: EOL CURRAL DE PEDRAS II | C664: 21.544.255/0002-76 | D664: 12.390000000000001 | E664: 0 | F664: 0 | G664: 0 | H664: 0 | I664: 0 | J664: 0 | K664: 13.699999999999999 | L664: 0 | M664: =SUM(J664:L664)-1.31 -> 12.389999999999999 | N664: 1.3100000000000001 | O664: =SUM(M664:N664) -> 13.699999999999999
A665: 3717 | B665: EOL DIAMANTE II | C665: 21.544.216/0002-79 | D665: 7.8799999999999999 | E665: 0 | F665: 0 | G665: 0 | H665: 0 | I665: 0 | J665: 0 | K665: 8.7100000000000009 | L665: 0 | M665: =SUM(J665:L665)-0.83 -> 7.8800000000000008 | N665: 0.82999999999999996 | O665: =SUM(M665:N665) -> 8.7100000000000009
A666: 3718 | B666: EOL DIAMANTE III | C666: 21.543.994/0002-43 | D666: 7.9900000000000002 | E666: 0 | F666: 0 | G666: 0 | H666: 0 | I666: 0 | J666: 0 | K666: 8.8300000000000001 | L666: 0 | M666: =SUM(J666:L666)-0.84 -> 7.9900000000000002 | N666: 0.83999999999999997 | O666: =SUM(M666:N666) -> 8.8300000000000001
A667: 3719 | B667: EOL LARANJEIRAS I | C667: 21.544.025/0002-07 | D667: 12.69 | E667: 0 | F667: 0 | G667: 0 | H667: 0 | I667: 0 | J667: 0 | K667: 14.029999999999999 | L667: 0 | M667: =SUM(J667:L667)-1.34 -> 12.69 | N667: 1.3400000000000001 | O667: =SUM(M667:N667) -> 14.029999999999999
A668: 3720 | B668: EOL LARANJEIRAS II | C668: 21.544.159/0002-28 | D668: 13.720000000000001 | E668: 0 | F668: 0 | G668: 0 | H668: 0 | I668: 0 | J668: 0 | K668: 15.17 | L668: 0 | M668: =SUM(J668:L668)-1.45 -> 13.720000000000001 | N668: 1.45 | O668: =SUM(M668:N668) -> 15.17
A669: 3721 | B669: EOL LARANJEIRAS V | C669: 21.544.060/0002-26 | D669: 11.460000000000001 | E669: 0 | F669: 0 | G669: 0 | H669: 0 | I669: 0 | J669: 0 | K669: 12.67 | L669: 0 | M669: =SUM(J669:L669)-1.21 -> 11.460000000000001 | N669: 1.21 | O669: =SUM(M669:N669) -> 12.670000000000002
A670: 3722 | B670: UFV FLORESTA I | C670: 23.741.570/0001-38 | D670: 4.1500000000000004 | E670: 0 | F670: 0 | G670: 0 | H670: 0 | I670: 0 | J670: 0 | K670: 4.5899999999999999 | L670: 0 | M670: =SUM(J670:L670)-0.44 -> 4.1499999999999995 | N670: 0.44 | O670: =SUM(M670:N670) -> 4.5899999999999999
A671: 3723 | B671: UFV FLORESTA II | C671: 23.741.520/0001-50 | D671: 4.1500000000000004 | E671: 0 | F671: 0 | G671: 0 | H671: 0 | I671: 0 | J671: 0 | K671: 4.5899999999999999 | L671: 0 | M671: =SUM(J671:L671)-0.44 -> 4.1499999999999995 | N671: 0.44 | O671: =SUM(M671:N671) -> 4.5899999999999999
A672: 3724 | B672: UFV FLORESTA III | C672: 23.723.730/0001-16 | D672: 2.7999999999999998 | E672: 0 | F672: 0 | G672: 0 | H672: 0 | I672: 0 | J672: 0 | K672: 3.1000000000000001 | L672: 0 | M672: =SUM(J672:L672)-0.3 -> 2.8000000000000003 | N672: 0.29999999999999999 | O672: =SUM(M672:N672) -> 3.1000000000000001
A673: 3725 | B673: UHE SAO MANOEL | C673: 18.494.537/0004-63 | D673: 772.62 | E673: 0 | F673: 0 | G673: 0 | H673: 0 | I673: 0 | J673: 0 | K673: 854.05999999999995 | L673: 0 | M673: =SUM(J673:L673)-81.44 -> 772.61999999999989 | N673: 81.439999999999998 | O673: =SUM(M673:N673) -> 854.05999999999995
A674: 3726 | B674: EOL VENTOS DE SÃO VICENTE 10 | C674: 21.840.567/0001-46 | D674: 10.029999999999999 | E674: 0 | F674: 0 | G674: 0 | H674: 0 | I674: 0 | J674: 0 | K674: 11.09 | L674: 0 | M674: =SUM(J674:L674)-1.06 -> 10.029999999999999 | N674: 1.0600000000000001 | O674: =SUM(M674:N674) -> 11.09
A675: 3727 | B675: EOL VENTOS DE SÃO VICENTE 09 | C675: 21.716.502/0001-93 | D675: 10.039999999999999 | E675: 0 | F675: 0 | G675: 0 | H675: 0 | I675: 0 | J675: 0 | K675: 11.1 | L675: 0 | M675: =SUM(J675:L675)-1.06 -> 10.039999999999999 | N675: 1.0600000000000001 | O675: =SUM(M675:N675) -> 11.1
A676: 3728 | B676: EOL GARROTE | C676: 10.272.489/0001-04 | D676: 8.7200000000000006 | E676: 0 | F676: 0 | G676: 0 | H676: 0 | I676: 0 | J676: 0 | K676: 9.6400000000000006 | L676: 0 | M676: =SUM(J676:L676)-0.92 -> 8.7200000000000006 | N676: 0.92000000000000004 | O676: =SUM(M676:N676) -> 9.6400000000000006
A677: 3729 | B677: EOL SANTO INÁCIO III | C677: 12.009.141/0001-54 | D677: 11.15 | E677: 0 | F677: 0 | G677: 0 | H677: 0 | I677: 0 | J677: 0 | K677: 12.33 | L677: 0 | M677: =SUM(J677:L677)-1.18 -> 11.15 | N677: 1.1799999999999999 | O677: =SUM(M677:N677) -> 12.33
A678: 3730 | B678: EOL SANTO INÁCIO IV | C678: 11.738.349/0001-41 | D678: 8.7799999999999994 | E678: 0 | F678: 0 | G678: 0 | H678: 0 | I678: 0 | J678: 0 | K678: 9.7100000000000009 | L678: 0 | M678: =SUM(J678:L678)-0.93 -> 8.7800000000000011 | N678: 0.93000000000000005 | O678: =SUM(M678:N678) -> 9.7100000000000009
A679: 3731 | B679: EOL SÃO RAIMUNDO | C679: 10.408.112/0001-30 | D679: 8.7899999999999991 | E679: 0 | F679: 0 | G679: 0 | H679: 0 | I679: 0 | J679: 0 | K679: 9.7200000000000006 | L679: 0 | M679: =SUM(J679:L679)-0.93 -> 8.7900000000000009 | N679: 0.93000000000000005 | O679: =SUM(M679:N679) -> 9.7200000000000006
A680: 3732 | B680: UHE SINOP | C680: 19.527.586/0001-75 | D680: 412.42000000000002 | E680: 0 | F680: 0 | G680: 0 | H680: 0 | I680: 0 | J680: 0 | K680: 455.88999999999999 | L680: 0 | M680: =SUM(J680:L680)-43.47 -> 412.41999999999996 | N680: 43.469999999999999 | O680: =SUM(M680:N680) -> 455.88999999999999
A681: 3733 | B681: EOL AVENTURA I | C681: 19.980.957/0002-50 | D681: 11.460000000000001 | E681: 0 | F681: 0 | G681: 0 | H681: 0 | I681: 0 | J681: 0 | K681: 12.67 | L681: 0 | M681: =SUM(J681:L681)-1.21 -> 11.460000000000001 | N681: 1.21 | O681: =SUM(M681:N681) -> 12.670000000000002
A682: 3734 | B682: EOL MORRO DO CHAPÉU I | C682: 21.868.992/0003-05 | D682: 23.579999999999998 | E682: 0 | F682: 0 | G682: 0 | H682: 0 | I682: 0 | J682: 0 | K682: 26.07 | L682: 0 | M682: =SUM(J682:L682)-2.49 -> 23.579999999999998 | N682: 2.4900000000000002 | O682: =SUM(M682:N682) -> 26.07
A683: 3735 | B683: EOL MORRO DO CHAPÉU II | C683: 21.869.008/0003-20 | D683: 22.780000000000001 | E683: 0 | F683: 0 | G683: 0 | H683: 0 | I683: 0 | J683: 0 | K683: 25.18 | L683: 0 | M683: =SUM(J683:L683)-2.4 -> 22.780000000000001 | N683: 2.3999999999999999 | O683: =SUM(M683:N683) -> 25.18
A684: 3736 | B684: EOL BOA VISTA DA LAGOINHA | C684: 21.996.671/0003-96 | D684: 12.6 | E684: 0 | F684: 0 | G684: 0 | H684: 0 | I684: 0 | J684: 0 | K684: 13.93 | L684: 0 | M684: =SUM(J684:L684)-1.33 -> 12.6 | N684: 1.3300000000000001 | O684: =SUM(M684:N684) -> 13.93
A685: 3737 | B685: EOL VENTOS DE SANTO ABRAÃO | C685: 21.869.030/0003-70 | D685: 11.76 | E685: 0 | F685: 0 | G685: 0 | H685: 0 | I685: 0 | J685: 0 | K685: 13 | L685: 0 | M685: =SUM(J685:L685)-1.24 -> 11.76 | N685: 1.24 | O685: =SUM(M685:N685) -> 13
A686: 3738 | B686: EOL CABEÇO VERMELHO | C686: 20.024.563/0001-27 | D686: 10.970000000000001 | E686: 0 | F686: 0 | G686: 0 | H686: 0 | I686: 0 | J686: 0 | K686: 12.130000000000001 | L686: 0 | M686: =SUM(J686:L686)-1.16 -> 10.970000000000001 | N686: 1.1599999999999999 | O686: =SUM(M686:N686) -> 12.130000000000001
A687: 3739 | B687: EOL CABEÇO VERMELHO II | C687: 20.024.516/0001-83 | D687: 6.4900000000000002 | E687: 0 | F687: 0 | G687: 0 | H687: 0 | I687: 0 | J687: 0 | K687: 7.1699999999999999 | L687: 0 | M687: =SUM(J687:L687)-0.68 -> 6.4900000000000002 | N687: 0.68000000000000005 | O687: =SUM(M687:N687) -> 7.1699999999999999
A688: 3740 | B688: UFV COREMAS I | C688: 14.285.232/0001-48 | D688: 8.0800000000000001 | E688: 0 | F688: 0 | G688: 0 | H688: 0 | I688: 0 | J688: 0 | K688: 8.9299999999999997 | L688: 0 | M688: =SUM(J688:L688)-0.85 -> 8.0800000000000001 | N688: 0.84999999999999998 | O688: =SUM(M688:N688) -> 8.9299999999999997
A689: 3741 | B689: UFV COREMAS II | C689: 14.285.242/0001-83 | D689: 7.1699999999999999 | E689: 0 | F689: 0 | G689: 0 | H689: 0 | I689: 0 | J689: 0 | K689: 7.9299999999999997 | L689: 0 | M689: =SUM(J689:L689)-0.76 -> 7.1699999999999999 | N689: 0.76000000000000001 | O689: =SUM(M689:N689) -> 7.9299999999999997
A690: 3742 | B690: UHE JAGUARA | C690: 28.925.264/0002-56 | D690: 435.50999999999999 | E690: 0 | F690: 0 | G690: 0 | H690: 0 | I690: 0 | J690: 0 | K690: 481.42000000000002 | L690: 0 | M690: =SUM(J690:L690)-45.91 -> 435.50999999999999 | N690: 45.909999999999997 | O690: =SUM(M690:N690) -> 481.41999999999996
A691: 3743 | B691: UHE VOLTA GRANDE | C691: 25.176.391/0002-01 | D691: 429.66000000000003 | E691: 0 | F691: 0 | G691: 0 | H691: 0 | I691: 0 | J691: 0 | K691: 474.94999999999999 | L691: 0 | M691: =SUM(J691:L691)-45.29 -> 429.65999999999997 | N691: 45.289999999999999 | O691: =SUM(M691:N691) -> 474.94999999999999
A692: 3744 | B692: UTE PROSPERIDADE I | C692: 23.857.764/0001-01 | D692: 15.49 | E692: 0 | F692: 0 | G692: 0 | H692: 0 | I692: 0 | J692: 0 | K692: 17.120000000000001 | L692: 0 | M692: =SUM(J692:L692)-1.63 -> 15.490000000000002 | N692: 1.6299999999999999 | O692: =SUM(M692:N692) -> 17.120000000000001
A693: 3745 | B693: CÉU AZUL (CONS. BAIXO IGUAÇU) | C693: 09.136.819/0002-36 | D693: 174.53999999999999 | E693: 0 | F693: 0 | G693: 0 | H693: 0 | I693: 0 | J693: 0 | K693: 192.94 | L693: 0 | M693: =SUM(J693:L693)-18.4 -> 174.53999999999999 | N693: 18.399999999999999 | O693: =SUM(M693:N693) -> 192.94
A694: 3746 | B694: EOL SERRA DA BABILÔNIA II | C694: 24.263.234/0002-70 | D694: 11.460000000000001 | E694: 0 | F694: 0 | G694: 0 | H694: 0 | I694: 0 | J694: 0 | K694: 12.67 | L694: 0 | M694: =SUM(J694:L694)-1.21 -> 11.460000000000001 | N694: 1.21 | O694: =SUM(M694:N694) -> 12.670000000000002
A695: 3747 | B695: EOL SERRA DA BABILÔNIA VI | C695: 24.325.137/0002-65 | D695: 10.5 | E695: 0 | F695: 0 | G695: 0 | H695: 0 | I695: 0 | J695: 0 | K695: 11.609999999999999 | L695: 0 | M695: =SUM(J695:L695)-1.11 -> 10.5 | N695: 1.1100000000000001 | O695: =SUM(M695:N695) -> 11.609999999999999
A696: 3748 | B696: DIAMANTE | C696: 27.093.977/0002-38 | D696: 377.43000000000001 | E696: 0 | F696: 0 | G696: 0 | H696: 0 | I696: 0 | J696: 0 | K696: 417.22000000000003 | L696: 0 | M696: =SUM(J696:L696)-39.79 -> 377.43000000000001 | N696: 39.789999999999999 | O696: =SUM(M696:N696) -> 417.22000000000003
A697: 3749 | B697: UHE SÃO SIMÃO | C697: 27.352.303/0002-00 | D697: 1984.8699999999999 | E697: 0 | F697: 0 | G697: 0 | H697: 0 | I697: 0 | J697: 0 | K697: 2194.0999999999999 | L697: 0 | M697: =SUM(J697:L697)-209.23 -> 1984.8699999999999 | N697: 209.22999999999999 | O697: =SUM(M697:N697) -> 2194.0999999999999
A698: 3750 | B698: UFV COREMAS III | C698: 24.342.513/0001-49 | D698: 8.3200000000000003 | E698: 0 | F698: 0 | G698: 0 | H698: 0 | I698: 0 | J698: 0 | K698: 9.1999999999999993 | L698: 0 | M698: =SUM(J698:L698)-0.88 -> 8.3199999999999985 | N698: 0.88 | O698: =SUM(M698:N698) -> 9.1999999999999993
A699: 3751 | B699: EOL CAMPO LARGO I | C699: 16.756.565/0002-14 | D699: 15.619999999999999 | E699: 0 | F699: 0 | G699: 0 | H699: 0 | I699: 0 | J699: 0 | K699: 17.27 | L699: 0 | M699: =SUM(J699:L699)-1.65 -> 15.619999999999999 | N699: 1.6499999999999999 | O699: =SUM(M699:N699) -> 17.27
A700: 3752 | B700: EOL CAMPO LARGO III | C700: 16.755.810/0002-79 | D700: 12.390000000000001 | E700: 0 | F700: 0 | G700: 0 | H700: 0 | I700: 0 | J700: 0 | K700: 13.699999999999999 | L700: 0 | M700: =SUM(J700:L700)-1.31 -> 12.389999999999999 | N700: 1.3100000000000001 | O700: =SUM(M700:N700) -> 13.699999999999999
A701: 3753 | B701: EOL CAMPO LARGO IV | C701: 16.756.341/0002-02 | D701: 12.390000000000001 | E701: 0 | F701: 0 | G701: 0 | H701: 0 | I701: 0 | J701: 0 | K701: 13.699999999999999 | L701: 0 | M701: =SUM(J701:L701)-1.31 -> 12.389999999999999 | N701: 1.3100000000000001 | O701: =SUM(M701:N701) -> 13.699999999999999
A702: 3754 | B702: EOL CAMPO LARGO VII | C702: 16.757.011/0002-31 | D702: 12.390000000000001 | E702: 0 | F702: 0 | G702: 0 | H702: 0 | I702: 0 | J702: 0 | K702: 13.699999999999999 | L702: 0 | M702: =SUM(J702:L702)-1.31 -> 12.389999999999999 | N702: 1.3100000000000001 | O702: =SUM(M702:N702) -> 13.699999999999999
A703: 3755 | B703: EOL AURA LAGOA DO BARRO 07 | C703: 21.959.329/0002-35 | D703: 10.630000000000001 | E703: 0 | F703: 0 | G703: 0 | H703: 0 | I703: 0 | J703: 0 | K703: 11.75 | L703: 0 | M703: =SUM(J703:L703)-1.12 -> 10.629999999999999 | N703: 1.1200000000000001 | O703: =SUM(M703:N703) -> 11.75
A704: 3756 | B704: EOL AURA QUEIMADA NOVA 03 | C704: 21.959.361/0002-10 | D704: 3.54 | E704: 0 | F704: 0 | G704: 0 | H704: 0 | I704: 0 | J704: 0 | K704: 3.9100000000000001 | L704: 0 | M704: =SUM(J704:L704)-0.37 -> 3.54 | N704: 0.37 | O704: =SUM(M704:N704) -> 3.9100000000000001
A705: 3757 | B705: EOL VENTOS DA SANTA BEATRIZ | C705: 13.346.161/0002-64 | D705: 10.9 | E705: 0 | F705: 0 | G705: 0 | H705: 0 | I705: 0 | J705: 0 | K705: 12.050000000000001 | L705: 0 | M705: =SUM(J705:L705)-1.15 -> 10.9 | N705: 1.1499999999999999 | O705: =SUM(M705:N705) -> 12.050000000000001
A706: 3758 | B706: EOL VENTOS DE SANTA APARECIDA | C706: 13.346.095/0002-22 | D706: 11.08 | E706: 0 | F706: 0 | G706: 0 | H706: 0 | I706: 0 | J706: 0 | K706: 12.25 | L706: 0 | M706: =SUM(J706:L706)-1.17 -> 11.08 | N706: 1.1699999999999999 | O706: =SUM(M706:N706) -> 12.25
A707: 3759 | B707: EOL VENTOS DE SANTA AURORA | C707: 13.346.039/0002-98 | D707: 11.01 | E707: 0 | F707: 0 | G707: 0 | H707: 0 | I707: 0 | J707: 0 | K707: 12.17 | L707: 0 | M707: =SUM(J707:L707)-1.16 -> 11.01 | N707: 1.1599999999999999 | O707: =SUM(M707:N707) -> 12.17
A708: 3760 | B708: EOL VENTOS DE SANTA EMILIA | C708: 13.346.108/0002-63 | D708: 11.42 | E708: 0 | F708: 0 | G708: 0 | H708: 0 | I708: 0 | J708: 0 | K708: 12.619999999999999 | L708: 0 | M708: =SUM(J708:L708)-1.2 -> 11.42 | N708: 1.2 | O708: =SUM(M708:N708) -> 12.619999999999999
A709: 3761 | B709: EOL VENTOS DE SÃO GABRIEL | C709: 13.346.102/0002-96 | D709: 10.880000000000001 | E709: 0 | F709: 0 | G709: 0 | H709: 0 | I709: 0 | J709: 0 | K709: 12.029999999999999 | L709: 0 | M709: =SUM(J709:L709)-1.15 -> 10.879999999999999 | N709: 1.1499999999999999 | O709: =SUM(M709:N709) -> 12.029999999999999
A710: 3762 | B710: EOL SERRA DA BABILÔNIA X | C710: 24.263.312/0002-37 | D710: 11.449999999999999 | E710: 0 | F710: 0 | G710: 0 | H710: 0 | I710: 0 | J710: 0 | K710: 12.66 | L710: 0 | M710: =SUM(J710:L710)-1.21 -> 11.449999999999999 | N710: 1.21 | O710: =SUM(M710:N710) -> 12.66
A711: 3763 | B711: EOL SERRA DA BABILÔNIA XI | C711: 24.263.070/0002-81 | D711: 11.449999999999999 | E711: 0 | F711: 0 | G711: 0 | H711: 0 | I711: 0 | J711: 0 | K711: 12.66 | L711: 0 | M711: =SUM(J711:L711)-1.21 -> 11.449999999999999 | N711: 1.21 | O711: =SUM(M711:N711) -> 12.66
A712: 3764 | B712: EOL SERRA DA BABILÔNIA VII | C712: 24.325.076/0002-36 | D712: 11.449999999999999 | E712: 0 | F712: 0 | G712: 0 | H712: 0 | I712: 0 | J712: 0 | K712: 12.66 | L712: 0 | M712: =SUM(J712:L712)-1.21 -> 11.449999999999999 | N712: 1.21 | O712: =SUM(M712:N712) -> 12.66
A713: 3765 | B713: EOL VENTOS DA BAHIA I | C713: 23.888.783/0001-97 | D713: 11.619999999999999 | E713: 0 | F713: 0 | G713: 0 | H713: 0 | I713: 0 | J713: 0 | K713: 12.84 | L713: 0 | M713: =SUM(J713:L713)-1.22 -> 11.619999999999999 | N713: 1.22 | O713: =SUM(M713:N713) -> 12.84
A714: 3766 | B714: EOL VENTOS DA BAHIA III | C714: 23.888.824/0001-45 | D714: 12.51 | E714: 0 | F714: 0 | G714: 0 | H714: 0 | I714: 0 | J714: 0 | K714: 13.83 | L714: 0 | M714: =SUM(J714:L714)-1.32 -> 12.51 | N714: 1.3200000000000001 | O714: =SUM(M714:N714) -> 13.83
A715: 3767 | B715: EOL VENTOS DA BAHIA IX | C715: 23.890.926/0001-03 | D715: 11.619999999999999 | E715: 0 | F715: 0 | G715: 0 | H715: 0 | I715: 0 | J715: 0 | K715: 12.84 | L715: 0 | M715: =SUM(J715:L715)-1.22 -> 11.619999999999999 | N715: 1.22 | O715: =SUM(M715:N715) -> 12.84
A716: 3768 | B716: EOL VENTOS DA BAHIA XVIII | C716: 23.888.804/0001-74 | D716: 11.619999999999999 | E716: 0 | F716: 0 | G716: 0 | H716: 0 | I716: 0 | J716: 0 | K716: 12.84 | L716: 0 | M716: =SUM(J716:L716)-1.22 -> 11.619999999999999 | N716: 1.22 | O716: =SUM(M716:N716) -> 12.84
A717: 3769 | B717: EOL SÃO BENTO DO NORTE I | C717: 21.216.892/0001-32 | D717: 8.7200000000000006 | E717: 0 | F717: 0 | G717: 0 | H717: 0 | I717: 0 | J717: 0 | K717: 9.6400000000000006 | L717: 0 | M717: =SUM(J717:L717)-0.92 -> 8.7200000000000006 | N717: 0.92000000000000004 | O717: =SUM(M717:N717) -> 9.6400000000000006
A718: 3770 | B718: EOL SÃO BENTO DO NORTE II | C718: 21.216.877/0001-94 | D718: 8.6999999999999993 | E718: 0 | F718: 0 | G718: 0 | H718: 0 | I718: 0 | J718: 0 | K718: 9.6199999999999992 | L718: 0 | M718: =SUM(J718:L718)-0.92 -> 8.6999999999999993 | N718: 0.92000000000000004 | O718: =SUM(M718:N718) -> 9.6199999999999992
A719: 3771 | B719: EOL SÃO MIGUEL I | C719: 21.216.915/0001-09 | D719: 7.8499999999999996 | E719: 0 | F719: 0 | G719: 0 | H719: 0 | I719: 0 | J719: 0 | K719: 8.6799999999999997 | L719: 0 | M719: =SUM(J719:L719)-0.83 -> 7.8499999999999996 | N719: 0.82999999999999996 | O719: =SUM(M719:N719) -> 8.6799999999999997
A720: 3772 | B720: EOL SÃO MIGUEL II | C720: 21.216.925/0001-44 | D720: 7.8499999999999996 | E720: 0 | F720: 0 | G720: 0 | H720: 0 | I720: 0 | J720: 0 | K720: 8.6799999999999997 | L720: 0 | M720: =SUM(J720:L720)-0.83 -> 7.8499999999999996 | N720: 0.82999999999999996 | O720: =SUM(M720:N720) -> 8.6799999999999997
A721: 3773 | B721: EOL SÃO MIGUEL III | C721: 21.216.439/0001-26 | D721: 7.8600000000000003 | E721: 0 | F721: 0 | G721: 0 | H721: 0 | I721: 0 | J721: 0 | K721: 8.6899999999999995 | L721: 0 | M721: =SUM(J721:L721)-0.83 -> 7.8599999999999994 | N721: 0.82999999999999996 | O721: =SUM(M721:N721) -> 8.6899999999999995
A722: 3774 | B722: EOL SÃO BENTO DO NORTE III | C722: 21.216.857/0001-13 | D722: 8.6600000000000001 | E722: 0 | F722: 0 | G722: 0 | H722: 0 | I722: 0 | J722: 0 | K722: 9.5700000000000003 | L722: 0 | M722: =SUM(J722:L722)-0.91 -> 8.6600000000000001 | N722: 0.91000000000000003 | O722: =SUM(M722:N722) -> 9.5700000000000003
A723: 3775 | B723: EOL CAMPO LARGO XVI | C723: 17.828.934/0002-08 | D723: 15.68 | E723: 0 | F723: 0 | G723: 0 | H723: 0 | I723: 0 | J723: 0 | K723: 17.329999999999998 | L723: 0 | M723: =SUM(J723:L723)-1.65 -> 15.679999999999998 | N723: 1.6499999999999999 | O723: =SUM(M723:N723) -> 17.329999999999998
A724: 3776 | B724: EOL SERRA DA BABILÔNIA IX | C724: 24.263.209/0002-97 | D724: 11.449999999999999 | E724: 0 | F724: 0 | G724: 0 | H724: 0 | I724: 0 | J724: 0 | K724: 12.66 | L724: 0 | M724: =SUM(J724:L724)-1.21 -> 11.449999999999999 | N724: 1.21 | O724: =SUM(M724:N724) -> 12.66
A725: 3777 | B725: EOL SERRA DA BABILÔNIA XII | C725: 24.263.276/0002-01 | D725: 11.449999999999999 | E725: 0 | F725: 0 | G725: 0 | H725: 0 | I725: 0 | J725: 0 | K725: 12.66 | L725: 0 | M725: =SUM(J725:L725)-1.21 -> 11.449999999999999 | N725: 1.21 | O725: =SUM(M725:N725) -> 12.66
A726: 3778 | B726: EOL AURA LAGOA DO BARRO 01 | C726: 21.951.779/0002-81 | D726: 10.630000000000001 | E726: 0 | F726: 0 | G726: 0 | H726: 0 | I726: 0 | J726: 0 | K726: 11.75 | L726: 0 | M726: =SUM(J726:L726)-1.12 -> 10.629999999999999 | N726: 1.1200000000000001 | O726: =SUM(M726:N726) -> 11.75
A727: 3779 | B727: EOL GOIABEIRA | C727: 15.321.064/0001-61 | D727: 0.64000000000000001 | E727: 0 | F727: 0 | G727: 0 | H727: 0 | I727: 0 | J727: 0 | K727: 0.70999999999999996 | L727: 0 | M727: =SUM(J727:L727)-0.07 -> 0.6399999999999999 | N727: 7.0000000000000007e-002 | O727: =SUM(M727:N727) -> 0.70999999999999996
A728: 3781 | B728: EOL SANTA CATARINA | C728: 15.321.146/0001-06 | D728: 0.81999999999999995 | E728: 0 | F728: 0 | G728: 0 | H728: 0 | I728: 0 | J728: 0 | K728: 0.91000000000000003 | L728: 0 | M728: =SUM(J728:L728)-0.09 -> 0.82000000000000006 | N728: 8.9999999999999997e-002 | O728: =SUM(M728:N728) -> 0.91000000000000003
A729: 3783 | B729: EOL VENTOS DE HORIZONTE | C729: 15.253.350/0001-37 | D729: 0.63 | E729: 0 | F729: 0 | G729: 0 | H729: 0 | I729: 0 | J729: 0 | K729: 0.69999999999999996 | L729: 0 | M729: =SUM(J729:L729)-0.07 -> 0.62999999999999989 | N729: 7.0000000000000007e-002 | O729: =SUM(M729:N729) -> 0.69999999999999996
A730: 3784 | B730: EOL AURA LAGOA DO BARRO 02 | C730: 21.951.809/0002-50 | D730: 10.630000000000001 | E730: 0 | F730: 0 | G730: 0 | H730: 0 | I730: 0 | J730: 0 | K730: 11.75 | L730: 0 | M730: =SUM(J730:L730)-1.12 -> 10.629999999999999 | N730: 1.1200000000000001 | O730: =SUM(M730:N730) -> 11.75
A731: 3785 | B731: EOL AURA LAGOA DO BARRO 05 | C731: 21.949.390/0002-00 | D731: 9.4499999999999993 | E731: 0 | F731: 0 | G731: 0 | H731: 0 | I731: 0 | J731: 0 | K731: 10.449999999999999 | L731: 0 | M731: =SUM(J731:L731)-1 -> 9.4499999999999993 | N731: 1 | O731: =SUM(M731:N731) -> 10.449999999999999
A732: 3786 | B732: UFV APODI I | C732: 24.424.331/0001-17 | D732: 9.7799999999999994 | E732: 0 | F732: 0 | G732: 0 | H732: 0 | I732: 0 | J732: 0 | K732: 10.81 | L732: 0 | M732: =SUM(J732:L732)-1.03 -> 9.7800000000000011 | N732: 1.03 | O732: =SUM(M732:N732) -> 10.81
A733: 3787 | B733: UFV APODI II | C733: 24.424.175/0001-94 | D733: 9.7799999999999994 | E733: 0 | F733: 0 | G733: 0 | H733: 0 | I733: 0 | J733: 0 | K733: 10.81 | L733: 0 | M733: =SUM(J733:L733)-1.03 -> 9.7800000000000011 | N733: 1.03 | O733: =SUM(M733:N733) -> 10.81
A734: 3788 | B734: UFV APODI III | C734: 24.424.233/0001-80 | D734: 9.7799999999999994 | E734: 0 | F734: 0 | G734: 0 | H734: 0 | I734: 0 | J734: 0 | K734: 10.81 | L734: 0 | M734: =SUM(J734:L734)-1.03 -> 9.7800000000000011 | N734: 1.03 | O734: =SUM(M734:N734) -> 10.81
A735: 3789 | B735: UFV APODI IV | C735: 24.424.369/0001-90 | D735: 9.7799999999999994 | E735: 0 | F735: 0 | G735: 0 | H735: 0 | I735: 0 | J735: 0 | K735: 10.81 | L735: 0 | M735: =SUM(J735:L735)-1.03 -> 9.7800000000000011 | N735: 1.03 | O735: =SUM(M735:N735) -> 10.81
A736: 3790 | B736: EOL BOA ESPERANÇA I | C736: 21.909.323/0001-72 | D736: 11.390000000000001 | E736: 0 | F736: 0 | G736: 0 | H736: 0 | I736: 0 | J736: 0 | K736: 12.59 | L736: 0 | M736: =SUM(J736:L736)-1.2 -> 11.390000000000001 | N736: 1.2 | O736: =SUM(M736:N736) -> 12.59
A737: 3791 | B737: EOL SERRA DA BABILÔNIA VIII | C737: 24.263.248/0002-94 | D737: 11.449999999999999 | E737: 0 | F737: 0 | G737: 0 | H737: 0 | I737: 0 | J737: 0 | K737: 12.66 | L737: 0 | M737: =SUM(J737:L737)-1.21 -> 11.449999999999999 | N737: 1.21 | O737: =SUM(M737:N737) -> 12.66
A738: 3792 | B738: EOL AURA LAGOA DO BARRO 06 | C738: 21.959.389/0002-58 | D738: 10.630000000000001 | E738: 0 | F738: 0 | G738: 0 | H738: 0 | I738: 0 | J738: 0 | K738: 11.75 | L738: 0 | M738: =SUM(J738:L738)-1.12 -> 10.629999999999999 | N738: 1.1200000000000001 | O738: =SUM(M738:N738) -> 11.75
A739: 3793 | B739: EOL CAMPO LARGO V | C739: 16.757.107/0002-08 | D739: 12.390000000000001 | E739: 0 | F739: 0 | G739: 0 | H739: 0 | I739: 0 | J739: 0 | K739: 13.699999999999999 | L739: 0 | M739: =SUM(J739:L739)-1.31 -> 12.389999999999999 | N739: 1.3100000000000001 | O739: =SUM(M739:N739) -> 13.699999999999999
A740: 3794 | B740: EOL CAMPO LARGO VI | C740: 16.756.943/0002-60 | D740: 12.390000000000001 | E740: 0 | F740: 0 | G740: 0 | H740: 0 | I740: 0 | J740: 0 | K740: 13.699999999999999 | L740: 0 | M740: =SUM(J740:L740)-1.31 -> 12.389999999999999 | N740: 1.3100000000000001 | O740: =SUM(M740:N740) -> 13.699999999999999
A741: 3795 | B741: EOL CAMPO LARGO XVIII | C741: 17.889.739/0002-80 | D741: 15.619999999999999 | E741: 0 | F741: 0 | G741: 0 | H741: 0 | I741: 0 | J741: 0 | K741: 17.27 | L741: 0 | M741: =SUM(J741:L741)-1.65 -> 15.619999999999999 | N741: 1.6499999999999999 | O741: =SUM(M741:N741) -> 17.27
A742: 3796 | B742: EOL CAMPO LARGO XXI | C742: 17.878.526/0002-52 | D742: 12.390000000000001 | E742: 0 | F742: 0 | G742: 0 | H742: 0 | I742: 0 | J742: 0 | K742: 13.699999999999999 | L742: 0 | M742: =SUM(J742:L742)-1.31 -> 12.389999999999999 | N742: 1.3100000000000001 | O742: =SUM(M742:N742) -> 13.699999999999999
A743: 3797 | B743: EOL AURA LAGOA DO BARRO 03 | C743: 21.951.750/0002-08 | D743: 10.630000000000001 | E743: 0 | F743: 0 | G743: 0 | H743: 0 | I743: 0 | J743: 0 | K743: 11.75 | L743: 0 | M743: =SUM(J743:L743)-1.12 -> 10.629999999999999 | N743: 1.1200000000000001 | O743: =SUM(M743:N743) -> 11.75
A744: 3798 | B744: EOL AURA LAGOA DO BARRO 04 | C744: 21.951.831/0002-08 | D744: 10.630000000000001 | E744: 0 | F744: 0 | G744: 0 | H744: 0 | I744: 0 | J744: 0 | K744: 11.75 | L744: 0 | M744: =SUM(J744:L744)-1.12 -> 10.629999999999999 | N744: 1.1200000000000001 | O744: =SUM(M744:N744) -> 11.75
A745: 3799 | B745: UFV JUAZEIRO SOLAR I | C745: 24.302.618/0001-74 | D745: 11.699999999999999 | E745: 0 | F745: 0 | G745: 0 | H745: 0 | I745: 0 | J745: 0 | K745: 12.93 | L745: 0 | M745: =SUM(J745:L745)-1.23 -> 11.699999999999999 | N745: 1.23 | O745: =SUM(M745:N745) -> 12.93
A746: 3800 | B746: UFV JUAZEIRO SOLAR II | C746: 24.227.619/0001-00 | D746: 11.699999999999999 | E746: 0 | F746: 0 | G746: 0 | H746: 0 | I746: 0 | J746: 0 | K746: 12.93 | L746: 0 | M746: =SUM(J746:L746)-1.23 -> 11.699999999999999 | N746: 1.23 | O746: =SUM(M746:N746) -> 12.93
A747: 3801 | B747: UFV JUAZEIRO SOLAR III | C747: 24.358.177/0001-22 | D747: 11.699999999999999 | E747: 0 | F747: 0 | G747: 0 | H747: 0 | I747: 0 | J747: 0 | K747: 12.93 | L747: 0 | M747: =SUM(J747:L747)-1.23 -> 11.699999999999999 | N747: 1.23 | O747: =SUM(M747:N747) -> 12.93
A748: 3802 | B748: UFV JUAZEIRO SOLAR IV | C748: 24.168.509/0001-06 | D748: 11.699999999999999 | E748: 0 | F748: 0 | G748: 0 | H748: 0 | I748: 0 | J748: 0 | K748: 12.93 | L748: 0 | M748: =SUM(J748:L748)-1.23 -> 11.699999999999999 | N748: 1.23 | O748: =SUM(M748:N748) -> 12.93
A749: 3803 | B749: EOL LARANJEIRAS III | C749: 21.816.037/0002-43 | D749: 10.73 | E749: 0 | F749: 0 | G749: 0 | H749: 0 | I749: 0 | J749: 0 | K749: 11.859999999999999 | L749: 0 | M749: =SUM(J749:L749)-1.13 -> 10.73 | N749: 1.1299999999999999 | O749: =SUM(M749:N749) -> 11.859999999999999
A750: 3804 | B750: EOL LARANJEIRAS IX | C750: 21.815.934/0002-32 | D750: 10.73 | E750: 0 | F750: 0 | G750: 0 | H750: 0 | I750: 0 | J750: 0 | K750: 11.859999999999999 | L750: 0 | M750: =SUM(J750:L750)-1.13 -> 10.73 | N750: 1.1299999999999999 | O750: =SUM(M750:N750) -> 11.859999999999999
A751: 3805 | B751: EOL DELTA 5 I | C751: 29.296.171/0002-72 | D751: 13.94 | E751: 0 | F751: 0 | G751: 0 | H751: 0 | I751: 0 | J751: 0 | K751: 15.41 | L751: 0 | M751: =SUM(J751:L751)-1.47 -> 13.94 | N751: 1.47 | O751: =SUM(M751:N751) -> 15.41
A752: 3806 | B752: EOL DELTA 5 II | C752: 29.303.897/0002-95 | D752: 14 | E752: 0 | F752: 0 | G752: 0 | H752: 0 | I752: 0 | J752: 0 | K752: 15.48 | L752: 0 | M752: =SUM(J752:L752)-1.48 -> 14 | N752: 1.48 | O752: =SUM(M752:N752) -> 15.48
A753: 3807 | B753: COPEL (CONS. BAIXO IGUAÇU) | C753: 04.370.282/0001-70 | D753: 74.799999999999997 | E753: 0 | F753: 0 | G753: 0 | H753: 0 | I753: 0 | J753: 0 | K753: 82.680000000000007 | L753: 0 | M753: =SUM(J753:L753)-7.88 -> 74.800000000000011 | N753: 7.8799999999999999 | O753: =SUM(M753:N753) -> 82.680000000000007
A754: 3808 | B754: EOL CAMPO LARGO II | C754: 16.913.777/0002-68 | D754: 16.170000000000002 | E754: 0 | F754: 0 | G754: 0 | H754: 0 | I754: 0 | J754: 0 | K754: 17.870000000000001 | L754: 0 | M754: =SUM(J754:L754)-1.7 -> 16.170000000000002 | N754: 1.7 | O754: =SUM(M754:N754) -> 17.870000000000001
A755: 3809 | B755: EOL CAMPO LARGO XV | C755: 17.928.199/0002-04 | D755: 15.619999999999999 | E755: 0 | F755: 0 | G755: 0 | H755: 0 | I755: 0 | J755: 0 | K755: 17.27 | L755: 0 | M755: =SUM(J755:L755)-1.65 -> 15.619999999999999 | N755: 1.6499999999999999 | O755: =SUM(M755:N755) -> 17.27
A756: 3810 | B756: EOL DELTA 6 I | C756: 29.296.141/0002-66 | D756: 15.34 | E756: 0 | F756: 0 | G756: 0 | H756: 0 | I756: 0 | J756: 0 | K756: 16.960000000000001 | L756: 0 | M756: =SUM(J756:L756)-1.62 -> 15.34 | N756: 1.6200000000000001 | O756: =SUM(M756:N756) -> 16.960000000000001
A757: 3811 | B757: EOL DELTA 6 II | C757: 29.296.975/0002-71 | D757: 12.550000000000001 | E757: 0 | F757: 0 | G757: 0 | H757: 0 | I757: 0 | J757: 0 | K757: 13.869999999999999 | L757: 0 | M757: =SUM(J757:L757)-1.32 -> 12.549999999999999 | N757: 1.3200000000000001 | O757: =SUM(M757:N757) -> 13.869999999999999
A758: 3812 | B758: EOL UMBURANAS 8 | C758: 20.168.405/0002-21 | D758: 9.1699999999999999 | E758: 0 | F758: 0 | G758: 0 | H758: 0 | I758: 0 | J758: 0 | K758: 10.140000000000001 | L758: 0 | M758: =SUM(J758:L758)-0.97 -> 9.1699999999999999 | N758: 0.96999999999999997 | O758: =SUM(M758:N758) -> 10.140000000000001
A759: 3813 | B759: EOL UMBURANAS 11 | C759: 20.168.074/0002-20 | D759: 5.4900000000000002 | E759: 0 | F759: 0 | G759: 0 | H759: 0 | I759: 0 | J759: 0 | K759: 6.0700000000000003 | L759: 0 | M759: =SUM(J759:L759)-0.58 -> 5.4900000000000002 | N759: 0.57999999999999996 | O759: =SUM(M759:N759) -> 6.0700000000000003
A760: 3814 | B760: EOL UMBURANAS 13 | C760: 20.168.462/0002-00 | D760: 7.3799999999999999 | E760: 0 | F760: 0 | G760: 0 | H760: 0 | I760: 0 | J760: 0 | K760: 8.1600000000000001 | L760: 0 | M760: =SUM(J760:L760)-0.78 -> 7.3799999999999999 | N760: 0.78000000000000003 | O760: =SUM(M760:N760) -> 8.1600000000000001
A761: 3815 | B761: EOL UMBURANAS 16 | C761: 20.168.152/0002-96 | D761: 9.2200000000000006 | E761: 0 | F761: 0 | G761: 0 | H761: 0 | I761: 0 | J761: 0 | K761: 10.19 | L761: 0 | M761: =SUM(J761:L761)-0.97 -> 9.2199999999999989 | N761: 0.96999999999999997 | O761: =SUM(M761:N761) -> 10.19
A762: 3816 | B762: EOL UMBURANAS 17 | C762: 20.168.158/0002-63 | D762: 9.5500000000000007 | E762: 0 | F762: 0 | G762: 0 | H762: 0 | I762: 0 | J762: 0 | K762: 10.56 | L762: 0 | M762: =SUM(J762:L762)-1.01 -> 9.5500000000000007 | N762: 1.01 | O762: =SUM(M762:N762) -> 10.56
A763: 3817 | B763: EOL UMBURANAS 18 | C763: 20.168.194/0002-27 | D763: 2.7400000000000002 | E763: 0 | F763: 0 | G763: 0 | H763: 0 | I763: 0 | J763: 0 | K763: 3.0299999999999998 | L763: 0 | M763: =SUM(J763:L763)-0.29 -> 2.7399999999999998 | N763: 0.28999999999999998 | O763: =SUM(M763:N763) -> 3.0299999999999998
A764: 3818 | B764: EOL UMBURANAS 19 | C764: 20.168.112/0002-44 | D764: 10.550000000000001 | E764: 0 | F764: 0 | G764: 0 | H764: 0 | I764: 0 | J764: 0 | K764: 11.66 | L764: 0 | M764: =SUM(J764:L764)-1.11 -> 10.550000000000001 | N764: 1.1100000000000001 | O764: =SUM(M764:N764) -> 11.66
A765: 3819 | B765: EOL UMBURANAS 21 | C765: 20.168.743/0002-63 | D765: 9.4900000000000002 | E765: 0 | F765: 0 | G765: 0 | H765: 0 | I765: 0 | J765: 0 | K765: 10.49 | L765: 0 | M765: =SUM(J765:L765)-1 -> 9.4900000000000002 | N765: 1 | O765: =SUM(M765:N765) -> 10.49
A766: 3820 | B766: EOL UMBURANAS 23 | C766: 20.168.788/0002-38 | D766: 6.3499999999999996 | E766: 0 | F766: 0 | G766: 0 | H766: 0 | I766: 0 | J766: 0 | K766: 7.0199999999999996 | L766: 0 | M766: =SUM(J766:L766)-0.67 -> 6.3499999999999996 | N766: 0.67000000000000004 | O766: =SUM(M766:N766) -> 7.0199999999999996
A767: 3821 | B767: EOL UMBURANAS 25 | C767: 19.281.805/0002-60 | D767: 7.3700000000000001 | E767: 0 | F767: 0 | G767: 0 | H767: 0 | I767: 0 | J767: 0 | K767: 8.1500000000000004 | L767: 0 | M767: =SUM(J767:L767)-0.78 -> 7.3700000000000001 | N767: 0.78000000000000003 | O767: =SUM(M767:N767) -> 8.1500000000000004
A768: 3822 | B768: UTE AMANDINA II | C768: 21.228.540/0001-05 | D768: 26.289999999999999 | E768: 0 | F768: 0 | G768: 0 | H768: 0 | I768: 0 | J768: 0 | K768: 29.059999999999999 | L768: 0 | M768: =SUM(J768:L768)-2.77 -> 26.289999999999999 | N768: 2.77 | O768: =SUM(M768:N768) -> 29.059999999999999
A769: 3823 | B769: EOL UMBURANAS 9 | C769: 20.168.824/0002-63 | D769: 6.4100000000000001 | E769: 0 | F769: 0 | G769: 0 | H769: 0 | I769: 0 | J769: 0 | K769: 7.0899999999999999 | L769: 0 | M769: =SUM(J769:L769)-0.68 -> 6.4100000000000001 | N769: 0.68000000000000005 | O769: =SUM(M769:N769) -> 7.0899999999999999
A770: 3824 | B770: EOL UMBURANAS 10 | C770: 20.168.229/0002-28 | D770: 7.3300000000000001 | E770: 0 | F770: 0 | G770: 0 | H770: 0 | I770: 0 | J770: 0 | K770: 8.0999999999999996 | L770: 0 | M770: =SUM(J770:L770)-0.77 -> 7.3300000000000001 | N770: 0.77000000000000002 | O770: =SUM(M770:N770) -> 8.0999999999999996
A771: 3825 | B771: EOL UMBURANAS 5 | C771: 20.168.051/0002-15 | D771: 6.4100000000000001 | E771: 0 | F771: 0 | G771: 0 | H771: 0 | I771: 0 | J771: 0 | K771: 7.0899999999999999 | L771: 0 | M771: =SUM(J771:L771)-0.68 -> 6.4100000000000001 | N771: 0.68000000000000005 | O771: =SUM(M771:N771) -> 7.0899999999999999
A772: 3826 | B772: EOL UMBURANAS 6 | C772: 20.168.283/0002-73 | D772: 7.3300000000000001 | E772: 0 | F772: 0 | G772: 0 | H772: 0 | I772: 0 | J772: 0 | K772: 8.0999999999999996 | L772: 0 | M772: =SUM(J772:L772)-0.77 -> 7.3300000000000001 | N772: 0.77000000000000002 | O772: =SUM(M772:N772) -> 8.0999999999999996
A773: 3827 | B773: UTE PAMPA SUL | C773: 04.739.720/0002-05 | D773: 268.75 | E773: 0 | F773: 0 | G773: 0 | H773: 0 | I773: 0 | J773: 0 | K773: 297.07999999999998 | L773: 0 | M773: =SUM(J773:L773)-28.33 -> 268.75 | N773: 28.329999999999998 | O773: =SUM(M773:N773) -> 297.07999999999998
A774: 3828 | B774: EOL UMBURANAS 3 | C774: 20.168.215/0002-04 | D774: 7.3300000000000001 | E774: 0 | F774: 0 | G774: 0 | H774: 0 | I774: 0 | J774: 0 | K774: 8.0999999999999996 | L774: 0 | M774: =SUM(J774:L774)-0.77 -> 7.3300000000000001 | N774: 0.77000000000000002 | O774: =SUM(M774:N774) -> 8.0999999999999996
A775: 3829 | B775: EOL UMBURANAS 15 | C775: 20.168.124/0002-79 | D775: 7.3300000000000001 | E775: 0 | F775: 0 | G775: 0 | H775: 0 | I775: 0 | J775: 0 | K775: 8.0999999999999996 | L775: 0 | M775: =SUM(J775:L775)-0.77 -> 7.3300000000000001 | N775: 0.77000000000000002 | O775: =SUM(M775:N775) -> 8.0999999999999996
A776: 3830 | B776: EOL UMBURANAS 1 | C776: 20.168.187/0002-25 | D776: 9.1699999999999999 | E776: 0 | F776: 0 | G776: 0 | H776: 0 | I776: 0 | J776: 0 | K776: 10.140000000000001 | L776: 0 | M776: =SUM(J776:L776)-0.97 -> 9.1699999999999999 | N776: 0.96999999999999997 | O776: =SUM(M776:N776) -> 10.140000000000001
A777: 3831 | B777: EOL UMBURANAS 2 | C777: 20.168.242/0002-87 | D777: 9.1699999999999999 | E777: 0 | F777: 0 | G777: 0 | H777: 0 | I777: 0 | J777: 0 | K777: 10.140000000000001 | L777: 0 | M777: =SUM(J777:L777)-0.97 -> 9.1699999999999999 | N777: 0.96999999999999997 | O777: =SUM(M777:N777) -> 10.140000000000001
A778: 3832 | B778: UHE COLÍDER | C778: 04.370.282/0003-31 | D778: 535.87 | E778: 0 | F778: 0 | G778: 0 | H778: 0 | I778: 0 | J778: 0 | K778: 592.36000000000001 | L778: 0 | M778: =SUM(J778:L778)-56.49 -> 535.87 | N778: 56.490000000000002 | O778: =SUM(M778:N778) -> 592.36000000000001
A779: 3833 | B779: UTE PORTO DE SERGIPE I | C779: 23.758.522/0001-52 | D779: 1247.9100000000001 | E779: 0 | F779: 0 | G779: 0 | H779: 0 | I779: 0 | J779: 0 | K779: 1379.46 | L779: 0 | M779: =SUM(J779:L779)-131.55 -> 1247.9100000000001 | N779: 131.55000000000001 | O779: =SUM(M779:N779) -> 1379.46
A780: 3834 | B780: EOL ZEUS II | C780: 25.174.955/0001-96 | D780: 17.02 | E780: 0 | F780: 0 | G780: 0 | H780: 0 | I780: 0 | J780: 0 | K780: 18.809999999999999 | L780: 0 | M780: =SUM(J780:L780)-1.79 -> 17.02 | N780: 1.79 | O780: =SUM(M780:N780) -> 18.809999999999999
A781: 3835 | B781: PCH BANDEIRANTE | C781: 15.743.124/0002-15 | D781: 7.9500000000000002 | E781: 0 | F781: 0 | G781: 0 | H781: 0 | I781: 0 | J781: 0 | K781: 8.7899999999999991 | L781: 0 | M781: =SUM(J781:L781)-0.84 -> 7.9499999999999993 | N781: 0.83999999999999997 | O781: =SUM(M781:N781) -> 8.7899999999999991
A782: 3836 | B782: PCH AREADO | C782: 23.670.551/0002-49 | D782: 4.4299999999999997 | E782: 0 | F782: 0 | G782: 0 | H782: 0 | I782: 0 | J782: 0 | K782: 4.9000000000000004 | L782: 0 | M782: =SUM(J782:L782)-0.47 -> 4.4300000000000006 | N782: 0.46999999999999997 | O782: =SUM(M782:N782) -> 4.9000000000000004
A783: 3840 | B783: EOL DELTA 7 I | C783: 30.866.542/0002-93 | D783: 11.220000000000001 | E783: 0 | F783: 0 | G783: 0 | H783: 0 | I783: 0 | J783: 0 | K783: 12.4 | L783: 0 | M783: =SUM(J783:L783)-1.18 -> 11.220000000000001 | N783: 1.1799999999999999 | O783: =SUM(M783:N783) -> 12.4
A784: 3841 | B784: EOL DELTA 7 II | C784: 30.905.225/0002-39 | D784: 14.67 | E784: 0 | F784: 0 | G784: 0 | H784: 0 | I784: 0 | J784: 0 | K784: 16.219999999999999 | L784: 0 | M784: =SUM(J784:L784)-1.55 -> 14.669999999999998 | N784: 1.55 | O784: =SUM(M784:N784) -> 16.219999999999999
A785: 3842 | B785: EOL DELTA 8 I | C785: 30.866.547/0002-16 | D785: 14.67 | E785: 0 | F785: 0 | G785: 0 | H785: 0 | I785: 0 | J785: 0 | K785: 16.219999999999999 | L785: 0 | M785: =SUM(J785:L785)-1.55 -> 14.669999999999998 | N785: 1.55 | O785: =SUM(M785:N785) -> 16.219999999999999
A786: 3844 | B786: EOL JANDAIA I | C786: 15.253.373/0002-22 | D786: 1.52 | E786: 0 | F786: 0 | G786: 0 | H786: 0 | I786: 0 | J786: 0 | K786: 1.6799999999999999 | L786: 0 | M786: =SUM(J786:L786)-0.16 -> 1.52 | N786: 0.16 | O786: =SUM(M786:N786) -> 1.6799999999999999
A787: 3845 | B787: UFV SÃO GONÇALO 22 | C787: 29.579.676/0001-63 | D787: 27.100000000000001 | E787: 0 | F787: 0 | G787: 0 | H787: 0 | I787: 0 | J787: 0 | K787: 29.960000000000001 | L787: 0 | M787: =SUM(J787:L787)-2.86 -> 27.100000000000001 | N787: 2.8599999999999999 | O787: =SUM(M787:N787) -> 29.960000000000001
A788: 3846 | B788: EOL VENTOS DE VILA ACRE II | C788: 29.523.731/0001-01 | D788: 16.030000000000001 | E788: 0 | F788: 0 | G788: 0 | H788: 0 | I788: 0 | J788: 0 | K788: 17.719999999999999 | L788: 0 | M788: =SUM(J788:L788)-1.69 -> 16.029999999999998 | N788: 1.6899999999999999 | O788: =SUM(M788:N788) -> 17.719999999999999
A789: 3848 | B789: UHE BALBINA | C789: 00.357.038/0001-16 | D789: 134.11000000000001 | E789: 0 | F789: 0 | G789: 0 | H789: 0 | I789: 0 | J789: 0 | K789: 148.25 | L789: 0 | M789: =SUM(J789:L789)-14.14 -> 134.11000000000001 | N789: 14.140000000000001 | O789: =SUM(M789:N789) -> 148.25
A790: 3849 | B790: UFV SÃO GONÇALO 1 | C790: 25.176.404/0001-61 | D790: 24.760000000000002 | E790: 0 | F790: 0 | G790: 0 | H790: 0 | I790: 0 | J790: 0 | K790: 27.370000000000001 | L790: 0 | M790: =SUM(J790:L790)-2.61 -> 24.760000000000002 | N790: 2.6099999999999999 | O790: =SUM(M790:N790) -> 27.370000000000001
A791: 3850 | B791: UFV SÃO GONÇALO 21 | C791: 29.325.940/0001-32 | D791: 27.100000000000001 | E791: 0 | F791: 0 | G791: 0 | H791: 0 | I791: 0 | J791: 0 | K791: 29.960000000000001 | L791: 0 | M791: =SUM(J791:L791)-2.86 -> 27.100000000000001 | N791: 2.8599999999999999 | O791: =SUM(M791:N791) -> 29.960000000000001
A792: 3851 | B792: EOL VENTOS DE VILA CEARÁ II | C792: 29.498.495/0001-02 | D792: 16.93 | E792: 0 | F792: 0 | G792: 0 | H792: 0 | I792: 0 | J792: 0 | K792: 18.710000000000001 | L792: 0 | M792: =SUM(J792:L792)-1.78 -> 16.93 | N792: 1.78 | O792: =SUM(M792:N792) -> 18.710000000000001
A793: 3852 | B793: EOL VENTOS DE VILA CEARÁ I | C793: 29.498.486/0001-11 | D793: 17.41 | E793: 0 | F793: 0 | G793: 0 | H793: 0 | I793: 0 | J793: 0 | K793: 19.25 | L793: 0 | M793: =SUM(J793:L793)-1.84 -> 17.41 | N793: 1.8400000000000001 | O793: =SUM(M793:N793) -> 19.25
A794: 3853 | B794: UFV SÃO GONÇALO 2 | C794: 29.310.192/0001-14 | D794: 27.100000000000001 | E794: 0 | F794: 0 | G794: 0 | H794: 0 | I794: 0 | J794: 0 | K794: 29.960000000000001 | L794: 0 | M794: =SUM(J794:L794)-2.86 -> 27.100000000000001 | N794: 2.8599999999999999 | O794: =SUM(M794:N794) -> 29.960000000000001
A795: 3854 | B795: UFV SÃO GONÇALO 3 | C795: 29.298.774/0001-22 | D795: 24.760000000000002 | E795: 0 | F795: 0 | G795: 0 | H795: 0 | I795: 0 | J795: 0 | K795: 27.370000000000001 | L795: 0 | M795: =SUM(J795:L795)-2.61 -> 24.760000000000002 | N795: 2.6099999999999999 | O795: =SUM(M795:N795) -> 27.370000000000001
A796: 3855 | B796: EOL VILA RIO GRANDE DO NORTE I | C796: 29.401.264/0002-10 | D796: 10.94 | E796: 0 | F796: 0 | G796: 0 | H796: 0 | I796: 0 | J796: 0 | K796: 12.09 | L796: 0 | M796: =SUM(J796:L796)-1.15 -> 10.94 | N796: 1.1499999999999999 | O796: =SUM(M796:N796) -> 12.09
A797: 3856 | B797: EOL VILA RIO GRANDE DO NORTE II | C797: 29.320.977/0002-59 | D797: 16.41 | E797: 0 | F797: 0 | G797: 0 | H797: 0 | I797: 0 | J797: 0 | K797: 18.140000000000001 | L797: 0 | M797: =SUM(J797:L797)-1.73 -> 16.41 | N797: 1.73 | O797: =SUM(M797:N797) -> 18.140000000000001
A798: 3857 | B798: EOL VILA SERGIPE I | C798: 29.330.011/0002-00 | D798: 16.43 | E798: 0 | F798: 0 | G798: 0 | H798: 0 | I798: 0 | J798: 0 | K798: 18.16 | L798: 0 | M798: =SUM(J798:L798)-1.73 -> 16.43 | N798: 1.73 | O798: =SUM(M798:N798) -> 18.16
A799: 3858 | B799: EOL VENTOS DE VILA PARAÍBA II | C799: 29.498.479/0001-10 | D799: 16.59 | E799: 0 | F799: 0 | G799: 0 | H799: 0 | I799: 0 | J799: 0 | K799: 18.34 | L799: 0 | M799: =SUM(J799:L799)-1.75 -> 16.59 | N799: 1.75 | O799: =SUM(M799:N799) -> 18.34
A800: 3859 | B800: UFV ETESA 17 SÃO JOÃO DO PIAUÍ I | C800: 30.520.122/0001-70 | D800: 17.34 | E800: 0 | F800: 0 | G800: 0 | H800: 0 | I800: 0 | J800: 0 | K800: 19.170000000000002 | L800: 0 | M800: =SUM(J800:L800)-1.83 -> 17.340000000000003 | N800: 1.8300000000000001 | O800: =SUM(M800:N800) -> 19.170000000000002
A801: 3860 | B801: UFV ETESA 18 SÃO JOÃO DO PIAUÍ II | C801: 30.432.072/0001-79 | D801: 17.34 | E801: 0 | F801: 0 | G801: 0 | H801: 0 | I801: 0 | J801: 0 | K801: 19.170000000000002 | L801: 0 | M801: =SUM(J801:L801)-1.83 -> 17.340000000000003 | N801: 1.8300000000000001 | O801: =SUM(M801:N801) -> 19.170000000000002
A802: 3861 | B802: UFV ETESA 19 SÃO JOÃO DO PIAUÍ III | C802: 30.486.042/0001-45 | D802: 17.34 | E802: 0 | F802: 0 | G802: 0 | H802: 0 | I802: 0 | J802: 0 | K802: 19.170000000000002 | L802: 0 | M802: =SUM(J802:L802)-1.83 -> 17.340000000000003 | N802: 1.8300000000000001 | O802: =SUM(M802:N802) -> 19.170000000000002
A803: 3862 | B803: UFV ETESA 20 SÃO JOÃO DO PIAUÍ IV | C803: 30.425.445/0001-84 | D803: 15.550000000000001 | E803: 0 | F803: 0 | G803: 0 | H803: 0 | I803: 0 | J803: 0 | K803: 17.190000000000001 | L803: 0 | M803: =SUM(J803:L803)-1.64 -> 15.550000000000001 | N803: 1.6399999999999999 | O803: =SUM(M803:N803) -> 17.190000000000001
A804: 3863 | B804: UFV ETESA 21 SÃO JOÃO DO PIAUÍ V | C804: 30.456.405/0001-08 | D804: 15.550000000000001 | E804: 0 | F804: 0 | G804: 0 | H804: 0 | I804: 0 | J804: 0 | K804: 17.190000000000001 | L804: 0 | M804: =SUM(J804:L804)-1.64 -> 15.550000000000001 | N804: 1.6399999999999999 | O804: =SUM(M804:N804) -> 17.190000000000001
A805: 3864 | B805: UFV ETESA 22 SÃO JOÃO DO PIAUÍ VI | C805: 30.421.756/0001-75 | D805: 17.18 | E805: 0 | F805: 0 | G805: 0 | H805: 0 | I805: 0 | J805: 0 | K805: 18.989999999999998 | L805: 0 | M805: =SUM(J805:L805)-1.81 -> 17.18 | N805: 1.8100000000000001 | O805: =SUM(M805:N805) -> 18.989999999999998
A806: 3865 | B806: UFV SÃO GONÇALO 4 | C806: 29.300.841/0001-04 | D806: 27.100000000000001 | E806: 0 | F806: 0 | G806: 0 | H806: 0 | I806: 0 | J806: 0 | K806: 29.960000000000001 | L806: 0 | M806: =SUM(J806:L806)-2.86 -> 27.100000000000001 | N806: 2.8599999999999999 | O806: =SUM(M806:N806) -> 29.960000000000001
A807: 3866 | B807: UFV SÃO GONÇALO 10 | C807: 29.325.687/0001-17 | D807: 27.100000000000001 | E807: 0 | F807: 0 | G807: 0 | H807: 0 | I807: 0 | J807: 0 | K807: 29.960000000000001 | L807: 0 | M807: =SUM(J807:L807)-2.86 -> 27.100000000000001 | N807: 2.8599999999999999 | O807: =SUM(M807:N807) -> 29.960000000000001
A808: 3867 | B808: EOL VENTOS DE VILA PARAÍBA I | C808: 29.523.723/0001-57 | D808: 17.559999999999999 | E808: 0 | F808: 0 | G808: 0 | H808: 0 | I808: 0 | J808: 0 | K808: 19.41 | L808: 0 | M808: =SUM(J808:L808)-1.85 -> 17.559999999999999 | N808: 1.8500000000000001 | O808: =SUM(M808:N808) -> 19.41
A809: 3868 | B809: UFV SÃO GONÇALO 5 | C809: 29.298.803/0001-56 | D809: 27.100000000000001 | E809: 0 | F809: 0 | G809: 0 | H809: 0 | I809: 0 | J809: 0 | K809: 29.960000000000001 | L809: 0 | M809: =SUM(J809:L809)-2.86 -> 27.100000000000001 | N809: 2.8599999999999999 | O809: =SUM(M809:N809) -> 29.960000000000001
A810: 3869 | B810: UFV SÃO GONÇALO 6 | C810: 29.710.913/0001-83 | D810: 22.350000000000001 | E810: 0 | F810: 0 | G810: 0 | H810: 0 | I810: 0 | J810: 0 | K810: 24.710000000000001 | L810: 0 | M810: =SUM(J810:L810)-2.36 -> 22.350000000000001 | N810: 2.3599999999999999 | O810: =SUM(M810:N810) -> 24.710000000000001
A811: 3870 | B811: EOL VENTOS DE SÃO JANUÁRIO 20 | C811: 14.675.949/0002-87 | D811: 3.1699999999999999 | E811: 0 | F811: 0 | G811: 0 | H811: 0 | I811: 0 | J811: 0 | K811: 3.5 | L811: 0 | M811: =SUM(J811:L811)-0.33 -> 3.1699999999999999 | N811: 0.33000000000000002 | O811: =SUM(M811:N811) -> 3.5
A812: 3871 | B812: EOL VENTOS DE SÃO JANUÁRIO 21 | C812: 22.777.483/0002-59 | D812: 3.1699999999999999 | E812: 0 | F812: 0 | G812: 0 | H812: 0 | I812: 0 | J812: 0 | K812: 3.5 | L812: 0 | M812: =SUM(J812:L812)-0.33 -> 3.1699999999999999 | N812: 0.33000000000000002 | O812: =SUM(M812:N812) -> 3.5
A813: 3872 | B813: EOL VILA SERGIPE II | C813: 30.321.925/0002-86 | D813: 16.93 | E813: 0 | F813: 0 | G813: 0 | H813: 0 | I813: 0 | J813: 0 | K813: 18.710000000000001 | L813: 0 | M813: =SUM(J813:L813)-1.78 -> 16.93 | N813: 1.78 | O813: =SUM(M813:N813) -> 18.710000000000001
A814: 3873 | B814: EOL VILA MARANHÃO III | C814: 31.449.173/0001-15 | D814: 16.82 | E814: 0 | F814: 0 | G814: 0 | H814: 0 | I814: 0 | J814: 0 | K814: 18.59 | L814: 0 | M814: =SUM(J814:L814)-1.77 -> 16.82 | N814: 1.77 | O814: =SUM(M814:N814) -> 18.59
A815: 3874 | B815: UHE GOV BENTO MUNHOZ (FOZ DO AREIA) | C815: 35.742.218/0001-04 | D815: 1181.2 | E815: 0 | F815: 0 | G815: 0 | H815: 0 | I815: 0 | J815: 0 | K815: 1305.71 | L815: 0 | M815: =SUM(J815:L815)-124.51 -> 1181.2 | N815: 124.51000000000001 | O815: =SUM(M815:N815) -> 1305.71
A816: 3875 | B816: RENOVA (EOL PAU SANTO) | C816: 18.560.214/0001-88 | D816: 7.2400000000000002 | E816: 0 | F816: 0 | G816: 0 | H816: 0 | I816: 0 | J816: 0 | K816: 8 | L816: 0 | M816: =SUM(J816:L816)-0.76 -> 7.2400000000000002 | N816: 0.76000000000000001 | O816: =SUM(M816:N816) -> 8
A817: 3876 | B817: UFV SÃO GONÇALO 7 | C817: 29.618.737/0001-54 | D817: 16.899999999999999 | E817: 0 | F817: 0 | G817: 0 | H817: 0 | I817: 0 | J817: 0 | K817: 18.68 | L817: 0 | M817: =SUM(J817:L817)-1.78 -> 16.899999999999999 | N817: 1.78 | O817: =SUM(M817:N817) -> 18.68
A818: 3877 | B818: UFV SÃO GONÇALO 8 | C818: 29.618.787/0001-31 | D818: 16.899999999999999 | E818: 0 | F818: 0 | G818: 0 | H818: 0 | I818: 0 | J818: 0 | K818: 18.68 | L818: 0 | M818: =SUM(J818:L818)-1.78 -> 16.899999999999999 | N818: 1.78 | O818: =SUM(M818:N818) -> 18.68
A819: 3878 | B819: UFV SÃO GONÇALO 11 | C819: 29.617.203/0001-03 | D819: 16.899999999999999 | E819: 0 | F819: 0 | G819: 0 | H819: 0 | I819: 0 | J819: 0 | K819: 18.68 | L819: 0 | M819: =SUM(J819:L819)-1.78 -> 16.899999999999999 | N819: 1.78 | O819: =SUM(M819:N819) -> 18.68
A820: 3879 | B820: UFV SÃO GONÇALO 12 | C820: 29.711.106/0001-85 | D820: 16.899999999999999 | E820: 0 | F820: 0 | G820: 0 | H820: 0 | I820: 0 | J820: 0 | K820: 18.68 | L820: 0 | M820: =SUM(J820:L820)-1.78 -> 16.899999999999999 | N820: 1.78 | O820: =SUM(M820:N820) -> 18.68
A821: 3880 | B821: EOL VILA SERGIPE III | C821: 30.311.178/0002-03 | D821: 7.5099999999999998 | E821: 0 | F821: 0 | G821: 0 | H821: 0 | I821: 0 | J821: 0 | K821: 8.3000000000000007 | L821: 0 | M821: =SUM(J821:L821)-0.79 -> 7.5100000000000007 | N821: 0.79000000000000004 | O821: =SUM(M821:N821) -> 8.3000000000000007
A822: 3881 | B822: EOL VILA CEARÁ I | C822: 31.478.575/0001-48 | D822: 16.800000000000001 | E822: 0 | F822: 0 | G822: 0 | H822: 0 | I822: 0 | J822: 0 | K822: 18.57 | L822: 0 | M822: =SUM(J822:L822)-1.77 -> 16.800000000000001 | N822: 1.77 | O822: =SUM(M822:N822) -> 18.57
A823: 3882 | B823: EOL VENTOS DE SÃO JANUÁRIO 22 | C823: 13.346.056/0002-25 | D823: 3.1699999999999999 | E823: 0 | F823: 0 | G823: 0 | H823: 0 | I823: 0 | J823: 0 | K823: 3.5 | L823: 0 | M823: =SUM(J823:L823)-0.33 -> 3.1699999999999999 | N823: 0.33000000000000002 | O823: =SUM(M823:N823) -> 3.5
A824: 3883 | B824: EOL VILA PIAUÍ III | C824: 30.311.141/0002-77 | D824: 18.809999999999999 | E824: 0 | F824: 0 | G824: 0 | H824: 0 | I824: 0 | J824: 0 | K824: 20.789999999999999 | L824: 0 | M824: =SUM(J824:L824)-1.98 -> 18.809999999999999 | N824: 1.98 | O824: =SUM(M824:N824) -> 20.789999999999999
A825: 3884 | B825: EOL VENTOS DE SANTA ÂNGELA 1 | C825: 25.174.579/0001-30 | D825: 18.18 | E825: 0 | F825: 0 | G825: 0 | H825: 0 | I825: 0 | J825: 0 | K825: 20.100000000000001 | L825: 0 | M825: =SUM(J825:L825)-1.92 -> 18.18 | N825: 1.9199999999999999 | O825: =SUM(M825:N825) -> 20.100000000000001
A826: 3885 | B826: EOL VENTOS DE SANTA ÂNGELA 2 | C826: 25.176.787/0001-78 | D826: 18.18 | E826: 0 | F826: 0 | G826: 0 | H826: 0 | I826: 0 | J826: 0 | K826: 20.100000000000001 | L826: 0 | M826: =SUM(J826:L826)-1.92 -> 18.18 | N826: 1.9199999999999999 | O826: =SUM(M826:N826) -> 20.100000000000001
A827: 3886 | B827: EOL VENTOS DE SANTA ÂNGELA 3 | C827: 25.289.277/0001-07 | D827: 18.18 | E827: 0 | F827: 0 | G827: 0 | H827: 0 | I827: 0 | J827: 0 | K827: 20.100000000000001 | L827: 0 | M827: =SUM(J827:L827)-1.92 -> 18.18 | N827: 1.9199999999999999 | O827: =SUM(M827:N827) -> 20.100000000000001
A828: 3887 | B828: EOL VENTOS DE SANTA ÂNGELA 4 | C828: 25.289.246/0001-56 | D828: 18.18 | E828: 0 | F828: 0 | G828: 0 | H828: 0 | I828: 0 | J828: 0 | K828: 20.100000000000001 | L828: 0 | M828: =SUM(J828:L828)-1.92 -> 18.18 | N828: 1.9199999999999999 | O828: =SUM(M828:N828) -> 20.100000000000001
A829: 3888 | B829: EOL VENTOS DE SANTA ÂNGELA 9 | C829: 29.616.957/0001-49 | D829: 25.609999999999999 | E829: 0 | F829: 0 | G829: 0 | H829: 0 | I829: 0 | J829: 0 | K829: 28.309999999999999 | L829: 0 | M829: =SUM(J829:L829)-2.7 -> 25.609999999999999 | N829: 2.7000000000000002 | O829: =SUM(M829:N829) -> 28.309999999999999
A830: 3889 | B830: EOL VENTOS DE SANTA ÂNGELA 10 | C830: 29.616.881/0001-51 | D830: 23.800000000000001 | E830: 0 | F830: 0 | G830: 0 | H830: 0 | I830: 0 | J830: 0 | K830: 26.309999999999999 | L830: 0 | M830: =SUM(J830:L830)-2.51 -> 23.799999999999997 | N830: 2.5099999999999998 | O830: =SUM(M830:N830) -> 26.309999999999995
A831: 3890 | B831: EOL VENTOS DE SANTA ÂNGELA 11 | C831: 29.552.535/0001-57 | D831: 25.75 | E831: 0 | F831: 0 | G831: 0 | H831: 0 | I831: 0 | J831: 0 | K831: 28.460000000000001 | L831: 0 | M831: =SUM(J831:L831)-2.71 -> 25.75 | N831: 2.71 | O831: =SUM(M831:N831) -> 28.460000000000001
A832: 3891 | B832: EOL VENTOS DE SANTA ÂNGELA 14 | C832: 29.576.419/0001-78 | D832: 24.870000000000001 | E832: 0 | F832: 0 | G832: 0 | H832: 0 | I832: 0 | J832: 0 | K832: 27.489999999999998 | L832: 0 | M832: =SUM(J832:L832)-2.62 -> 24.869999999999997 | N832: 2.6200000000000001 | O832: =SUM(M832:N832) -> 27.489999999999998
A833: 3892 | B833: EOL VENTOS DE SANTA ÂNGELA 15 | C833: 29.559.244/0001-90 | D833: 25.260000000000002 | E833: 0 | F833: 0 | G833: 0 | H833: 0 | I833: 0 | J833: 0 | K833: 27.920000000000002 | L833: 0 | M833: =SUM(J833:L833)-2.66 -> 25.260000000000002 | N833: 2.6600000000000001 | O833: =SUM(M833:N833) -> 27.920000000000002
A834: 3893 | B834: EOL VILA MARANHÃO I | C834: 30.097.726/0001-55 | D834: 17.210000000000001 | E834: 0 | F834: 0 | G834: 0 | H834: 0 | I834: 0 | J834: 0 | K834: 19.02 | L834: 0 | M834: =SUM(J834:L834)-1.81 -> 17.210000000000001 | N834: 1.8100000000000001 | O834: =SUM(M834:N834) -> 19.02
A835: 3894 | B835: EOL INHAMBU 2 | C835: 30.519.343/0001-28 | D835: 7.3399999999999999 | E835: 0 | F835: 0 | G835: 0 | H835: 0 | I835: 0 | J835: 0 | K835: 8.1099999999999994 | L835: 0 | M835: =SUM(J835:L835)-0.77 -> 7.3399999999999999 | N835: 0.77000000000000002 | O835: =SUM(M835:N835) -> 8.1099999999999994
A836: 3895 | B836: EOL VILA PIAUÍ I | C836: 30.321.883/0002-83 | D836: 16.890000000000001 | E836: 0 | F836: 0 | G836: 0 | H836: 0 | I836: 0 | J836: 0 | K836: 18.670000000000002 | L836: 0 | M836: =SUM(J836:L836)-1.78 -> 16.890000000000001 | N836: 1.78 | O836: =SUM(M836:N836) -> 18.670000000000002
A837: 3896 | B837: EOL VILA PIAUÍ II | C837: 30.311.116/0002-93 | D837: 16.870000000000001 | E837: 0 | F837: 0 | G837: 0 | H837: 0 | I837: 0 | J837: 0 | K837: 18.649999999999999 | L837: 0 | M837: =SUM(J837:L837)-1.78 -> 16.869999999999997 | N837: 1.78 | O837: =SUM(M837:N837) -> 18.649999999999999
A838: 3897 | B838: EOL VENTOS DE SÃO JANUÁRIO 13 | C838: 30.558.294/0001-32 | D838: 2.7000000000000002 | E838: 0 | F838: 0 | G838: 0 | H838: 0 | I838: 0 | J838: 0 | K838: 2.98 | L838: 0 | M838: =SUM(J838:L838)-0.28 -> 2.7000000000000002 | N838: 0.28000000000000003 | O838: =SUM(M838:N838) -> 2.9800000000000004
A839: 3898 | B839: EOL VILA MARANHÃO II | C839: 31.004.703/0001-11 | D839: 16.829999999999998 | E839: 0 | F839: 0 | G839: 0 | H839: 0 | I839: 0 | J839: 0 | K839: 18.600000000000001 | L839: 0 | M839: =SUM(J839:L839)-1.77 -> 16.830000000000002 | N839: 1.77 | O839: =SUM(M839:N839) -> 18.600000000000001
A840: 3899 | B840: EOL VENTOS DE SANTA ÂNGELA 5 | C840: 25.289.292/0001-55 | D840: 18.079999999999998 | E840: 0 | F840: 0 | G840: 0 | H840: 0 | I840: 0 | J840: 0 | K840: 19.989999999999998 | L840: 0 | M840: =SUM(J840:L840)-1.91 -> 18.079999999999998 | N840: 1.9099999999999999 | O840: =SUM(M840:N840) -> 19.989999999999998
A841: 3900 | B841: EOL VENTOS DE SANTA ÂNGELA 6 | C841: 25.289.215/0001-03 | D841: 18.079999999999998 | E841: 0 | F841: 0 | G841: 0 | H841: 0 | I841: 0 | J841: 0 | K841: 19.989999999999998 | L841: 0 | M841: =SUM(J841:L841)-1.91 -> 18.079999999999998 | N841: 1.9099999999999999 | O841: =SUM(M841:N841) -> 19.989999999999998
A842: 3901 | B842: EOL VENTOS DE SANTA ÂNGELA 7 | C842: 25.289.312/0001-98 | D842: 14.460000000000001 | E842: 0 | F842: 0 | G842: 0 | H842: 0 | I842: 0 | J842: 0 | K842: 15.98 | L842: 0 | M842: =SUM(J842:L842)-1.52 -> 14.460000000000001 | N842: 1.52 | O842: =SUM(M842:N842) -> 15.98
A843: 3902 | B843: EOL VENTOS DE SANTA ÂNGELA 8 | C843: 29.559.160/0001-57 | D843: 18.079999999999998 | E843: 0 | F843: 0 | G843: 0 | H843: 0 | I843: 0 | J843: 0 | K843: 19.989999999999998 | L843: 0 | M843: =SUM(J843:L843)-1.91 -> 18.079999999999998 | N843: 1.9099999999999999 | O843: =SUM(M843:N843) -> 19.989999999999998
A844: 3903 | B844: EOL VENTOS DE SÃO JANUÁRIO 14 | C844: 30.558.337/0001-80 | D844: 2.7000000000000002 | E844: 0 | F844: 0 | G844: 0 | H844: 0 | I844: 0 | J844: 0 | K844: 2.98 | L844: 0 | M844: =SUM(J844:L844)-0.28 -> 2.7000000000000002 | N844: 0.28000000000000003 | O844: =SUM(M844:N844) -> 2.9800000000000004
A845: 3904 | B845: EOL SÃO FERNANDO I | C845: 23.008.029/0001-15 | D845: 35.420000000000002 | E845: 0 | F845: 0 | G845: 0 | H845: 0 | I845: 0 | J845: 0 | K845: 39.149999999999999 | L845: 0 | M845: =SUM(J845:L845)-3.73 -> 35.420000000000002 | N845: 3.73 | O845: =SUM(M845:N845) -> 39.149999999999999
A846: 3905 | B846: EOL SÃO FERNANDO II | C846: 32.132.033/0001-81 | D846: 40.219999999999999 | E846: 0 | F846: 0 | G846: 0 | H846: 0 | I846: 0 | J846: 0 | K846: 44.460000000000001 | L846: 0 | M846: =SUM(J846:L846)-4.24 -> 40.219999999999999 | N846: 4.2400000000000002 | O846: =SUM(M846:N846) -> 44.460000000000001
A847: 3906 | B847: EOL CORRUPIÃO 2 | C847: 30.519.369/0001-76 | D847: 8.4499999999999993 | E847: 0 | F847: 0 | G847: 0 | H847: 0 | I847: 0 | J847: 0 | K847: 9.3399999999999999 | L847: 0 | M847: =SUM(J847:L847)-0.89 -> 8.4499999999999993 | N847: 0.89000000000000001 | O847: =SUM(M847:N847) -> 9.3399999999999999
A848: 3907 | B848: EOL VENTOS DE SÃO JANUÁRIO 04 | C848: 30.558.320/0001-22 | D848: 15.970000000000001 | E848: 0 | F848: 0 | G848: 0 | H848: 0 | I848: 0 | J848: 0 | K848: 17.649999999999999 | L848: 0 | M848: =SUM(J848:L848)-1.68 -> 15.969999999999999 | N848: 1.6799999999999999 | O848: =SUM(M848:N848) -> 17.649999999999999
A849: 3908 | B849: EOL SERRA DO FOGO | C849: 33.295.705/0002-13 | D849: 14.65 | E849: 0 | F849: 0 | G849: 0 | H849: 0 | I849: 0 | J849: 0 | K849: 16.190000000000001 | L849: 0 | M849: =SUM(J849:L849)-1.54 -> 14.650000000000002 | N849: 1.54 | O849: =SUM(M849:N849) -> 16.190000000000001
A850: 3909 | B850: EOL SERRA DO VENTO | C850: 33.269.273/0002-76 | D850: 14.65 | E850: 0 | F850: 0 | G850: 0 | H850: 0 | I850: 0 | J850: 0 | K850: 16.190000000000001 | L850: 0 | M850: =SUM(J850:L850)-1.54 -> 14.650000000000002 | N850: 1.54 | O850: =SUM(M850:N850) -> 16.190000000000001
A851: 3910 | B851: EOL VENTOS DE SÃO JANUÁRIO 01 | C851: 30.558.359/0001-40 | D851: 18.25 | E851: 0 | F851: 0 | G851: 0 | H851: 0 | I851: 0 | J851: 0 | K851: 20.170000000000002 | L851: 0 | M851: =SUM(J851:L851)-1.92 -> 18.25 | N851: 1.9199999999999999 | O851: =SUM(M851:N851) -> 20.170000000000002
A852: 3911 | B852: EOL VENTOS DE SÃO JANUÁRIO 03 | C852: 31.818.977/0001-44 | D852: 19.710000000000001 | E852: 0 | F852: 0 | G852: 0 | H852: 0 | I852: 0 | J852: 0 | K852: 21.789999999999999 | L852: 0 | M852: =SUM(J852:L852)-2.08 -> 19.710000000000001 | N852: 2.0800000000000001 | O852: =SUM(M852:N852) -> 21.789999999999999
A853: 3912 | B853: EOL CASA NOVA A | C853: 33.541.368/0001-16 | D853: 12.43 | E853: 0 | F853: 0 | G853: 0 | H853: 0 | I853: 0 | J853: 0 | K853: 13.74 | L853: 0 | M853: =SUM(J853:L853)-1.31 -> 12.43 | N853: 1.3100000000000001 | O853: =SUM(M853:N853) -> 13.74
A854: 3913 | B854: EOL VENTOS DE SÃO JANUÁRIO 05 | C854: 31.818.981/0001-02 | D854: 2.7000000000000002 | E854: 0 | F854: 0 | G854: 0 | H854: 0 | I854: 0 | J854: 0 | K854: 2.98 | L854: 0 | M854: =SUM(J854:L854)-0.28 -> 2.7000000000000002 | N854: 0.28000000000000003 | O854: =SUM(M854:N854) -> 2.9800000000000004
A855: 3914 | B855: EOL UMBURANA DE CHEIRO | C855: 33.295.664/0002-65 | D855: 14.65 | E855: 0 | F855: 0 | G855: 0 | H855: 0 | I855: 0 | J855: 0 | K855: 16.190000000000001 | L855: 0 | M855: =SUM(J855:L855)-1.54 -> 14.650000000000002 | N855: 1.54 | O855: =SUM(M855:N855) -> 16.190000000000001
A856: 3915 | B856: EOL ARARINHA AZUL | C856: 30.519.323/0001-57 | D856: 10.050000000000001 | E856: 0 | F856: 0 | G856: 0 | H856: 0 | I856: 0 | J856: 0 | K856: 11.109999999999999 | L856: 0 | M856: =SUM(J856:L856)-1.06 -> 10.049999999999999 | N856: 1.0600000000000001 | O856: =SUM(M856:N856) -> 11.109999999999999
A857: 3916 | B857: EOL CAMPO LARGO IX | C857: 17.995.695/0002-72 | D857: 11.970000000000001 | E857: 0 | F857: 0 | G857: 0 | H857: 0 | I857: 0 | J857: 0 | K857: 13.23 | L857: 0 | M857: =SUM(J857:L857)-1.26 -> 11.970000000000001 | N857: 1.26 | O857: =SUM(M857:N857) -> 13.23
A858: 3917 | B858: EOL CAMPO LARGO X | C858: 17.815.305/0002-35 | D858: 15.9 | E858: 0 | F858: 0 | G858: 0 | H858: 0 | I858: 0 | J858: 0 | K858: 17.579999999999998 | L858: 0 | M858: =SUM(J858:L858)-1.68 -> 15.899999999999999 | N858: 1.6799999999999999 | O858: =SUM(M858:N858) -> 17.579999999999998
A859: 3918 | B859: EOL CAMPO LARGO XIV | C859: 17.829.499/0002-28 | D859: 9.9499999999999993 | E859: 0 | F859: 0 | G859: 0 | H859: 0 | I859: 0 | J859: 0 | K859: 11 | L859: 0 | M859: =SUM(J859:L859)-1.05 -> 9.9499999999999993 | N859: 1.05 | O859: =SUM(M859:N859) -> 11
A860: 3919 | B860: EOL VENTOS DE SÃO FERNANDO 3 | C860: 32.671.163/0001-92 | D860: 10.92 | E860: 0 | F860: 0 | G860: 0 | H860: 0 | I860: 0 | J860: 0 | K860: 12.07 | L860: 0 | M860: =SUM(J860:L860)-1.15 -> 10.92 | N860: 1.1499999999999999 | O860: =SUM(M860:N860) -> 12.07
A861: 3920 | B861: EOL CAMPO LARGO XVII | C861: 17.916.887/0002-46 | D861: 13.960000000000001 | E861: 0 | F861: 0 | G861: 0 | H861: 0 | I861: 0 | J861: 0 | K861: 15.43 | L861: 0 | M861: =SUM(J861:L861)-1.47 -> 13.959999999999999 | N861: 1.47 | O861: =SUM(M861:N861) -> 15.43
A862: 3921 | B862: EOL CAMPO LARGO XIX | C862: 17.928.213/0002-61 | D862: 15.890000000000001 | E862: 0 | F862: 0 | G862: 0 | H862: 0 | I862: 0 | J862: 0 | K862: 17.57 | L862: 0 | M862: =SUM(J862:L862)-1.68 -> 15.890000000000001 | N862: 1.6799999999999999 | O862: =SUM(M862:N862) -> 17.57
A863: 3922 | B863: EOL TEIÚ 3 | C863: 30.534.321/0001-37 | D863: 11.15 | E863: 0 | F863: 0 | G863: 0 | H863: 0 | I863: 0 | J863: 0 | K863: 12.33 | L863: 0 | M863: =SUM(J863:L863)-1.18 -> 11.15 | N863: 1.1799999999999999 | O863: =SUM(M863:N863) -> 12.33
A864: 3923 | B864: EOL SERROTE II | C864: 32.398.720/0001-43 | D864: 10.34 | E864: 0 | F864: 0 | G864: 0 | H864: 0 | I864: 0 | J864: 0 | K864: 11.43 | L864: 0 | M864: =SUM(J864:L864)-1.09 -> 10.34 | N864: 1.0900000000000001 | O864: =SUM(M864:N864) -> 11.43
A865: 3924 | B865: EOL SERROTE III | C865: 32.398.682/0001-29 | D865: 8.6099999999999994 | E865: 0 | F865: 0 | G865: 0 | H865: 0 | I865: 0 | J865: 0 | K865: 9.5199999999999996 | L865: 0 | M865: =SUM(J865:L865)-0.91 -> 8.6099999999999994 | N865: 0.91000000000000003 | O865: =SUM(M865:N865) -> 9.5199999999999996
A866: 3925 | B866: EOL VENTOS DE SÃO JANUÁRIO 06 | C866: 31.810.453/0001-07 | D866: 2.4300000000000002 | E866: 0 | F866: 0 | G866: 0 | H866: 0 | I866: 0 | J866: 0 | K866: 2.6899999999999999 | L866: 0 | M866: =SUM(J866:L866)-0.26 -> 2.4299999999999997 | N866: 0.26000000000000001 | O866: =SUM(M866:N866) -> 2.6899999999999995
A867: 3926 | B867: EOL VENTOS DE SÃO JANUÁRIO 11 | C867: 31.810.445/0001-60 | D867: 24.640000000000001 | E867: 0 | F867: 0 | G867: 0 | H867: 0 | I867: 0 | J867: 0 | K867: 27.239999999999998 | L867: 0 | M867: =SUM(J867:L867)-2.6 -> 24.639999999999997 | N867: 2.6000000000000001 | O867: =SUM(M867:N867) -> 27.239999999999998
A868: 3927 | B868: EOL AVENTURA II | C868: 17.875.511/0002-30 | D868: 11.800000000000001 | E868: 0 | F868: 0 | G868: 0 | H868: 0 | I868: 0 | J868: 0 | K868: 13.039999999999999 | L868: 0 | M868: =SUM(J868:L868)-1.24 -> 11.799999999999999 | N868: 1.24 | O868: =SUM(M868:N868) -> 13.039999999999999
A869: 3928 | B869: EOL AVENTURA IV | C869: 28.525.891/0002-08 | D869: 16.609999999999999 | E869: 0 | F869: 0 | G869: 0 | H869: 0 | I869: 0 | J869: 0 | K869: 18.359999999999999 | L869: 0 | M869: =SUM(J869:L869)-1.75 -> 16.609999999999999 | N869: 1.75 | O869: =SUM(M869:N869) -> 18.359999999999999
A870: 3929 | B870: EOL CAMPO LARGO XX | C870: 17.929.168/0002-60 | D870: 17.879999999999999 | E870: 0 | F870: 0 | G870: 0 | H870: 0 | I870: 0 | J870: 0 | K870: 19.760000000000002 | L870: 0 | M870: =SUM(J870:L870)-1.88 -> 17.880000000000003 | N870: 1.8799999999999999 | O870: =SUM(M870:N870) -> 19.760000000000002
A871: 3930 | B871: EOL POTIGUAR B31 | C871: 34.327.393/0001-64 | D871: 20.359999999999999 | E871: 0 | F871: 0 | G871: 0 | H871: 0 | I871: 0 | J871: 0 | K871: 22.510000000000002 | L871: 0 | M871: =SUM(J871:L871)-2.15 -> 20.360000000000003 | N871: 2.1499999999999999 | O871: =SUM(M871:N871) -> 22.510000000000002
A872: 3931 | B872: EOL POTIGUAR B32 | C872: 34.327.409/0001-39 | D872: 22.27 | E872: 0 | F872: 0 | G872: 0 | H872: 0 | I872: 0 | J872: 0 | K872: 24.620000000000001 | L872: 0 | M872: =SUM(J872:L872)-2.35 -> 22.27 | N872: 2.3500000000000001 | O872: =SUM(M872:N872) -> 24.620000000000001
A873: 3932 | B873: EOL VENTOS DE SÃO FERNANDO 4 | C873: 33.701.101/0001-49 | D873: 37.460000000000001 | E873: 0 | F873: 0 | G873: 0 | H873: 0 | I873: 0 | J873: 0 | K873: 41.409999999999997 | L873: 0 | M873: =SUM(J873:L873)-3.95 -> 37.459999999999994 | N873: 3.9500000000000002 | O873: =SUM(M873:N873) -> 41.409999999999997
A874: 3933 | B874: EOL VENTOS DE SÃO JANUÁRIO 10 | C874: 31.810.448/0001-02 | D874: 24.640000000000001 | E874: 0 | F874: 0 | G874: 0 | H874: 0 | I874: 0 | J874: 0 | K874: 27.239999999999998 | L874: 0 | M874: =SUM(J874:L874)-2.6 -> 24.639999999999997 | N874: 2.6000000000000001 | O874: =SUM(M874:N874) -> 27.239999999999998
A875: 3934 | B875: EOL SERROTE I | C875: 32.398.775/0001-53 | D875: 10.34 | E875: 0 | F875: 0 | G875: 0 | H875: 0 | I875: 0 | J875: 0 | K875: 11.43 | L875: 0 | M875: =SUM(J875:L875)-1.09 -> 10.34 | N875: 1.0900000000000001 | O875: =SUM(M875:N875) -> 11.43
A876: 3935 | B876: EOL SERROTE IV | C876: 32.398.772/0001-10 | D876: 6.8899999999999997 | E876: 0 | F876: 0 | G876: 0 | H876: 0 | I876: 0 | J876: 0 | K876: 7.6200000000000001 | L876: 0 | M876: =SUM(J876:L876)-0.73 -> 6.8900000000000006 | N876: 0.72999999999999998 | O876: =SUM(M876:N876) -> 7.620000000000001
A877: 3936 | B877: EOL SERROTE V | C877: 32.398.761/0001-30 | D877: 12.06 | E877: 0 | F877: 0 | G877: 0 | H877: 0 | I877: 0 | J877: 0 | K877: 13.33 | L877: 0 | M877: =SUM(J877:L877)-1.27 -> 12.06 | N877: 1.27 | O877: =SUM(M877:N877) -> 13.33
A878: 3937 | B878: UFV FLOR DE MANDACARU | C878: 12.009.135/0001-05 | D878: 0.90000000000000002 | E878: 0 | F878: 0 | G878: 0 | H878: 0 | I878: 0 | J878: 0 | K878: 0.98999999999999999 | L878: 0 | M878: =SUM(J878:L878)-0.09 -> 0.90000000000000002 | N878: 8.9999999999999997e-002 | O878: =SUM(M878:N878) -> 0.98999999999999999
A879: 3938 | B879: EOL VENTOS DE SANTA ÂNGELA 20 | C879: 29.552.939/0001-40 | D879: 17.469999999999999 | E879: 0 | F879: 0 | G879: 0 | H879: 0 | I879: 0 | J879: 0 | K879: 19.309999999999999 | L879: 0 | M879: =SUM(J879:L879)-1.84 -> 17.469999999999999 | N879: 1.8400000000000001 | O879: =SUM(M879:N879) -> 19.309999999999999
A880: 3939 | B880: EOL VENTOS DE SANTA ÂNGELA 21 | C880: 29.616.162/0001-30 | D880: 15.73 | E880: 0 | F880: 0 | G880: 0 | H880: 0 | I880: 0 | J880: 0 | K880: 17.390000000000001 | L880: 0 | M880: =SUM(J880:L880)-1.66 -> 15.73 | N880: 1.6599999999999999 | O880: =SUM(M880:N880) -> 17.390000000000001
A881: 3940 | B881: UFV SÃO GONÇALO 18 | C881: 31.752.294/0001-31 | D881: 20.859999999999999 | E881: 0 | F881: 0 | G881: 0 | H881: 0 | I881: 0 | J881: 0 | K881: 23.059999999999999 | L881: 0 | M881: =SUM(J881:L881)-2.2 -> 20.859999999999999 | N881: 2.2000000000000002 | O881: =SUM(M881:N881) -> 23.059999999999999
A882: 3941 | B882: UTE GNA I | C882: 23.449.511/0001-90 | D882: 987.00999999999999 | E882: 0 | F882: 0 | G882: 0 | H882: 0 | I882: 0 | J882: 0 | K882: 1091.05 | L882: 0 | M882: =SUM(J882:L882)-104.04 -> 987.00999999999999 | N882: 104.04000000000001 | O882: =SUM(M882:N882) -> 1091.05
A883: 3942 | B883: EOL CRISTALÂNDIA III | C883: 23.049.225/0003-08 | D883: 9.6899999999999995 | E883: 0 | F883: 0 | G883: 0 | H883: 0 | I883: 0 | J883: 0 | K883: 10.710000000000001 | L883: 0 | M883: =SUM(J883:L883)-1.02 -> 9.6900000000000013 | N883: 1.02 | O883: =SUM(M883:N883) -> 10.710000000000001
A884: 3943 | B884: EOL AVENTURA III | C884: 29.302.365/0002-33 | D884: 14.23 | E884: 0 | F884: 0 | G884: 0 | H884: 0 | I884: 0 | J884: 0 | K884: 15.73 | L884: 0 | M884: =SUM(J884:L884)-1.5 -> 14.23 | N884: 1.5 | O884: =SUM(M884:N884) -> 15.73
A885: 3944 | B885: EOL SERROTE VII | C885: 32.398.767/0001-07 | D885: 12.06 | E885: 0 | F885: 0 | G885: 0 | H885: 0 | I885: 0 | J885: 0 | K885: 13.33 | L885: 0 | M885: =SUM(J885:L885)-1.27 -> 12.06 | N885: 1.27 | O885: =SUM(M885:N885) -> 13.33
A886: 3945 | B886: EOL SERROTE VIII | C886: 32.398.765/0001-18 | D886: 12.06 | E886: 0 | F886: 0 | G886: 0 | H886: 0 | I886: 0 | J886: 0 | K886: 13.33 | L886: 0 | M886: =SUM(J886:L886)-1.27 -> 12.06 | N886: 1.27 | O886: =SUM(M886:N886) -> 13.33
A887: 3946 | B887: EOL POTIGUAR B33 | C887: 34.327.417/0001-85 | D887: 27.039999999999999 | E887: 0 | F887: 0 | G887: 0 | H887: 0 | I887: 0 | J887: 0 | K887: 29.890000000000001 | L887: 0 | M887: =SUM(J887:L887)-2.85 -> 27.039999999999999 | N887: 2.8500000000000001 | O887: =SUM(M887:N887) -> 29.890000000000001
A888: 3947 | B888: EOL SERRA DA BABILÔNIA A | C888: 30.063.842/0002-34 | D888: 12.26 | E888: 0 | F888: 0 | G888: 0 | H888: 0 | I888: 0 | J888: 0 | K888: 13.550000000000001 | L888: 0 | M888: =SUM(J888:L888)-1.29 -> 12.260000000000002 | N888: 1.29 | O888: =SUM(M888:N888) -> 13.550000000000001
A889: 3948 | B889: EOL SERRA DA BABILÔNIA B | C889: 29.527.877/0002-06 | D889: 14.58 | E889: 0 | F889: 0 | G889: 0 | H889: 0 | I889: 0 | J889: 0 | K889: 16.120000000000001 | L889: 0 | M889: =SUM(J889:L889)-1.54 -> 14.580000000000002 | N889: 1.54 | O889: =SUM(M889:N889) -> 16.120000000000001
A890: 3949 | B890: EOL VENTOS DE SANTA ÂNGELA 12 | C890: 29.722.095/0001-39 | D890: 14.220000000000001 | E890: 0 | F890: 0 | G890: 0 | H890: 0 | I890: 0 | J890: 0 | K890: 15.720000000000001 | L890: 0 | M890: =SUM(J890:L890)-1.5 -> 14.220000000000001 | N890: 1.5 | O890: =SUM(M890:N890) -> 15.720000000000001
A891: 3950 | B891: EOL VENTOS DE SANTA ÂNGELA 13 | C891: 29.310.217/0001-80 | D891: 13.41 | E891: 0 | F891: 0 | G891: 0 | H891: 0 | I891: 0 | J891: 0 | K891: 14.82 | L891: 0 | M891: =SUM(J891:L891)-1.41 -> 13.41 | N891: 1.4099999999999999 | O891: =SUM(M891:N891) -> 14.82
A892: 3951 | B892: EOL VENTOS DE SANTA ÂNGELA 18 | C892: 29.710.906/0001-81 | D892: 14.85 | E892: 0 | F892: 0 | G892: 0 | H892: 0 | I892: 0 | J892: 0 | K892: 16.420000000000002 | L892: 0 | M892: =SUM(J892:L892)-1.57 -> 14.850000000000001 | N892: 1.5700000000000001 | O892: =SUM(M892:N892) -> 16.420000000000002
A893: 3952 | B893: EOL GAMELEIRA | C893: 07.099.001/0001-84 | D893: 9.4900000000000002 | E893: 0 | F893: 0 | G893: 0 | H893: 0 | I893: 0 | J893: 0 | K893: 10.49 | L893: 0 | M893: =SUM(J893:L893)-1 -> 9.4900000000000002 | N893: 1 | O893: =SUM(M893:N893) -> 10.49
A894: 3953 | B894: EOL FAROL DE TOUROS | C894: 10.369.836/0001-11 | D894: 13.300000000000001 | E894: 0 | F894: 0 | G894: 0 | H894: 0 | I894: 0 | J894: 0 | K894: 14.699999999999999 | L894: 0 | M894: =SUM(J894:L894)-1.4 -> 13.299999999999999 | N894: 1.3999999999999999 | O894: =SUM(M894:N894) -> 14.699999999999999
A895: 3954 | B895: EOL COSTA DAS DUNAS | C895: 10.401.225/0001-03 | D895: 15.31 | E895: 0 | F895: 0 | G895: 0 | H895: 0 | I895: 0 | J895: 0 | K895: 16.920000000000002 | L895: 0 | M895: =SUM(J895:L895)-1.61 -> 15.310000000000002 | N895: 1.6100000000000001 | O895: =SUM(M895:N895) -> 16.920000000000002
A896: 3955 | B896: EOL FIGUEIRA BRANCA | C896: 09.665.352/0001-30 | D896: 5.6900000000000004 | E896: 0 | F896: 0 | G896: 0 | H896: 0 | I896: 0 | J896: 0 | K896: 6.29 | L896: 0 | M896: =SUM(J896:L896)-0.6 -> 5.6900000000000004 | N896: 0.59999999999999998 | O896: =SUM(M896:N896) -> 6.29
A897: 3957 | B897: EOL AVENTURA V | C897: 28.946.365/0002-03 | D897: 16.5 | E897: 0 | F897: 0 | G897: 0 | H897: 0 | I897: 0 | J897: 0 | K897: 18.239999999999998 | L897: 0 | M897: =SUM(J897:L897)-1.74 -> 16.5 | N897: 1.74 | O897: =SUM(M897:N897) -> 18.239999999999998
A898: 3958 | B898: EOL CAMPO LARGO VIII | C898: 18.001.918/0002-00 | D898: 15.890000000000001 | E898: 0 | F898: 0 | G898: 0 | H898: 0 | I898: 0 | J898: 0 | K898: 17.57 | L898: 0 | M898: =SUM(J898:L898)-1.68 -> 15.890000000000001 | N898: 1.6799999999999999 | O898: =SUM(M898:N898) -> 17.57
A899: 3959 | B899: EOL CAMPO LARGO XI | C899: 17.955.471/0002-37 | D899: 7.96 | E899: 0 | F899: 0 | G899: 0 | H899: 0 | I899: 0 | J899: 0 | K899: 8.8000000000000007 | L899: 0 | M899: =SUM(J899:L899)-0.84 -> 7.9600000000000009 | N899: 0.83999999999999997 | O899: =SUM(M899:N899) -> 8.8000000000000007
A900: 3960 | B900: EOL CAMPO LARGO XII | C900: 17.846.141/0002-03 | D900: 25.82 | E900: 0 | F900: 0 | G900: 0 | H900: 0 | I900: 0 | J900: 0 | K900: 28.539999999999999 | L900: 0 | M900: =SUM(J900:L900)-2.72 -> 25.82 | N900: 2.7200000000000002 | O900: =SUM(M900:N900) -> 28.539999999999999
A901: 3961 | B901: EOL CAMPO LARGO XIII | C901: 17.995.969/0002-23 | D901: 19.859999999999999 | E901: 0 | F901: 0 | G901: 0 | H901: 0 | I901: 0 | J901: 0 | K901: 21.949999999999999 | L901: 0 | M901: =SUM(J901:L901)-2.09 -> 19.859999999999999 | N901: 2.0899999999999999 | O901: =SUM(M901:N901) -> 21.949999999999999
A902: 3962 | B902: EOL CAMPO LARGO XXII | C902: 18.154.009/0002-01 | D902: 15.890000000000001 | E902: 0 | F902: 0 | G902: 0 | H902: 0 | I902: 0 | J902: 0 | K902: 17.57 | L902: 0 | M902: =SUM(J902:L902)-1.68 -> 15.890000000000001 | N902: 1.6799999999999999 | O902: =SUM(M902:N902) -> 17.57
A903: 3963 | B903: UFV SÃO GONÇALO 19 | C903: 31.752.301/0001-03 | D903: 21.280000000000001 | E903: 0 | F903: 0 | G903: 0 | H903: 0 | I903: 0 | J903: 0 | K903: 23.52 | L903: 0 | M903: =SUM(J903:L903)-2.24 -> 21.280000000000001 | N903: 2.2400000000000002 | O903: =SUM(M903:N903) -> 23.520000000000003
A904: 3964 | B904: EOL VENTOS DE SANTA ÂNGELA 19 | C904: 29.552.605/0001-77 | D904: 17.420000000000002 | E904: 0 | F904: 0 | G904: 0 | H904: 0 | I904: 0 | J904: 0 | K904: 19.260000000000002 | L904: 0 | M904: =SUM(J904:L904)-1.84 -> 17.420000000000002 | N904: 1.8400000000000001 | O904: =SUM(M904:N904) -> 19.260000000000002
A905: 3965 | B905: EOL SERROTE VI | C905: 32.398.764/0001-73 | D905: 12.06 | E905: 0 | F905: 0 | G905: 0 | H905: 0 | I905: 0 | J905: 0 | K905: 13.33 | L905: 0 | M905: =SUM(J905:L905)-1.27 -> 12.06 | N905: 1.27 | O905: =SUM(M905:N905) -> 13.33
A906: 3966 | B906: EOL VENTOS DE VILA MATO GROSSO I | C906: 34.109.229/0001-80 | D906: 24.140000000000001 | E906: 0 | F906: 0 | G906: 0 | H906: 0 | I906: 0 | J906: 0 | K906: 26.68 | L906: 0 | M906: =SUM(J906:L906)-2.54 -> 24.140000000000001 | N906: 2.54 | O906: =SUM(M906:N906) -> 26.68
A907: 3967 | B907: EOL TERRA SANTA I | C907: 24.895.239/0001-35 | D907: 27.43 | E907: 0 | F907: 0 | G907: 0 | H907: 0 | I907: 0 | J907: 0 | K907: 30.32 | L907: 0 | M907: =SUM(J907:L907)-2.89 -> 27.43 | N907: 2.8900000000000001 | O907: =SUM(M907:N907) -> 30.32
A908: 3968 | B908: EOL TERRA SANTA II | C908: 24.894.829/0001-43 | D908: 14.98 | E908: 0 | F908: 0 | G908: 0 | H908: 0 | I908: 0 | J908: 0 | K908: 16.559999999999999 | L908: 0 | M908: =SUM(J908:L908)-1.58 -> 14.979999999999999 | N908: 1.5800000000000001 | O908: =SUM(M908:N908) -> 16.559999999999999
A909: 3969 | B909: EOL SERRA DA BABILÔNIA C | C909: 29.591.504/0002-96 | D909: 15.33 | E909: 0 | F909: 0 | G909: 0 | H909: 0 | I909: 0 | J909: 0 | K909: 16.949999999999999 | L909: 0 | M909: =SUM(J909:L909)-1.62 -> 15.329999999999998 | N909: 1.6200000000000001 | O909: =SUM(M909:N909) -> 16.949999999999999
A910: 3970 | B910: EOL SERRA DA BABILÔNIA D | C910: 30.062.725/0002-56 | D910: 14.369999999999999 | E910: 0 | F910: 0 | G910: 0 | H910: 0 | I910: 0 | J910: 0 | K910: 15.880000000000001 | L910: 0 | M910: =SUM(J910:L910)-1.51 -> 14.370000000000001 | N910: 1.51 | O910: =SUM(M910:N910) -> 15.880000000000001
A911: 3971 | B911: UTE CGVE INNOVA | C911: 04.229.761/0011-42 | D911: 5.7599999999999998 | E911: 0 | F911: 0 | G911: 0 | H911: 0 | I911: 0 | J911: 0 | K911: 6.3700000000000001 | L911: 0 | M911: =SUM(J911:L911)-0.61 -> 5.7599999999999998 | N911: 0.60999999999999999 | O911: =SUM(M911:N911) -> 6.3700000000000001
A912: 3972 | B912: EOL SERRA DA BABILÔNIA F | C912: 30.234.798/0002-88 | D912: 12.26 | E912: 0 | F912: 0 | G912: 0 | H912: 0 | I912: 0 | J912: 0 | K912: 13.550000000000001 | L912: 0 | M912: =SUM(J912:L912)-1.29 -> 12.260000000000002 | N912: 1.29 | O912: =SUM(M912:N912) -> 13.550000000000001
A913: 3973 | B913: EOL VENTOS DE SANTA ÂNGELA 16 | C913: 29.711.059/0001-70 | D913: 14.85 | E913: 0 | F913: 0 | G913: 0 | H913: 0 | I913: 0 | J913: 0 | K913: 16.420000000000002 | L913: 0 | M913: =SUM(J913:L913)-1.57 -> 14.850000000000001 | N913: 1.5700000000000001 | O913: =SUM(M913:N913) -> 16.420000000000002
A914: 3974 | B914: EOL VENTOS DE SANTA ÂNGELA 17 | C914: 29.579.025/0001-73 | D914: 27.469999999999999 | E914: 0 | F914: 0 | G914: 0 | H914: 0 | I914: 0 | J914: 0 | K914: 30.370000000000001 | L914: 0 | M914: =SUM(J914:L914)-2.9 -> 27.470000000000002 | N914: 2.8999999999999999 | O914: =SUM(M914:N914) -> 30.370000000000001
A915: 3975 | B915: UFV SÃO GONÇALO 17 | C915: 31.762.229/0001-97 | D915: 20.649999999999999 | E915: 0 | F915: 0 | G915: 0 | H915: 0 | I915: 0 | J915: 0 | K915: 22.829999999999998 | L915: 0 | M915: =SUM(J915:L915)-2.18 -> 20.649999999999999 | N915: 2.1800000000000002 | O915: =SUM(M915:N915) -> 22.829999999999998
A916: 3976 | B916: EOL SERRA DA BABILÔNIA E | C916: 30.062.736/0002-36 | D916: 15.34 | E916: 0 | F916: 0 | G916: 0 | H916: 0 | I916: 0 | J916: 0 | K916: 16.960000000000001 | L916: 0 | M916: =SUM(J916:L916)-1.62 -> 15.34 | N916: 1.6200000000000001 | O916: =SUM(M916:N916) -> 16.960000000000001
A917: 3977 | B917: EOL VENTOS DE SANTA MARTINA 01 | C917: 29.845.768/0002-29 | D917: 4.9500000000000002 | E917: 0 | F917: 0 | G917: 0 | H917: 0 | I917: 0 | J917: 0 | K917: 5.4699999999999998 | L917: 0 | M917: =SUM(J917:L917)-0.52 -> 4.9499999999999993 | N917: 0.52000000000000002 | O917: =SUM(M917:N917) -> 5.4699999999999989
A918: 3978 | B918: EOL VENTOS DE SANTA MARTINA 09 | C918: 29.845.721/0002-65 | D918: 4.9500000000000002 | E918: 0 | F918: 0 | G918: 0 | H918: 0 | I918: 0 | J918: 0 | K918: 5.4699999999999998 | L918: 0 | M918: =SUM(J918:L918)-0.52 -> 4.9499999999999993 | N918: 0.52000000000000002 | O918: =SUM(M918:N918) -> 5.4699999999999989
A919: 3979 | B919: EOL VENTOS DE SANTA MARTINA 10 | C919: 29.845.784/0002-11 | D919: 4.9500000000000002 | E919: 0 | F919: 0 | G919: 0 | H919: 0 | I919: 0 | J919: 0 | K919: 5.4699999999999998 | L919: 0 | M919: =SUM(J919:L919)-0.52 -> 4.9499999999999993 | N919: 0.52000000000000002 | O919: =SUM(M919:N919) -> 5.4699999999999989
A920: 3980 | B920: EOL VENTOS DE SANTA MARTINA 11 | C920: 29.845.761/0002-07 | D920: 4.9500000000000002 | E920: 0 | F920: 0 | G920: 0 | H920: 0 | I920: 0 | J920: 0 | K920: 5.4699999999999998 | L920: 0 | M920: =SUM(J920:L920)-0.52 -> 4.9499999999999993 | N920: 0.52000000000000002 | O920: =SUM(M920:N920) -> 5.4699999999999989
A921: 3981 | B921: EOL VENTOS DE SANTA MARTINA 12 | C921: 29.845.751/0002-71 | D921: 4.9500000000000002 | E921: 0 | F921: 0 | G921: 0 | H921: 0 | I921: 0 | J921: 0 | K921: 5.4699999999999998 | L921: 0 | M921: =SUM(J921:L921)-0.52 -> 4.9499999999999993 | N921: 0.52000000000000002 | O921: =SUM(M921:N921) -> 5.4699999999999989
A922: 3982 | B922: EOL VENTOS DE SANTA MARTINA 13 | C922: 29.845.794/0002-57 | D922: 5.2800000000000002 | E922: 0 | F922: 0 | G922: 0 | H922: 0 | I922: 0 | J922: 0 | K922: 5.8399999999999999 | L922: 0 | M922: =SUM(J922:L922)-0.56 -> 5.2799999999999994 | N922: 0.56000000000000005 | O922: =SUM(M922:N922) -> 5.8399999999999999
A923: 3983 | B923: EOL VENTOS DE SANTA MARTINA 14 | C923: 29.845.733/0002-90 | D923: 4.9500000000000002 | E923: 0 | F923: 0 | G923: 0 | H923: 0 | I923: 0 | J923: 0 | K923: 5.4699999999999998 | L923: 0 | M923: =SUM(J923:L923)-0.52 -> 4.9499999999999993 | N923: 0.52000000000000002 | O923: =SUM(M923:N923) -> 5.4699999999999989
A924: 3984 | B924: EOL TODA ENERGIA | C924: 36.160.050/0001-83 | D924: 12.44 | E924: 0 | F924: 0 | G924: 0 | H924: 0 | I924: 0 | J924: 0 | K924: 13.75 | L924: 0 | M924: =SUM(J924:L924)-1.31 -> 12.44 | N924: 1.3100000000000001 | O924: =SUM(M924:N924) -> 13.75
A925: 3985 | B925: EOL VENTOS DE SÃO JANUÁRIO 23 | C925: 23.037.514/0002-06 | D925: 3.7000000000000002 | E925: 0 | F925: 0 | G925: 0 | H925: 0 | I925: 0 | J925: 0 | K925: 4.0899999999999999 | L925: 0 | M925: =SUM(J925:L925)-0.39 -> 3.6999999999999997 | N925: 0.39000000000000001 | O925: =SUM(M925:N925) -> 4.0899999999999999
A926: 3986 | B926: UFV SÃO GONÇALO 15 | C926: 31.752.283/0001-51 | D926: 20.649999999999999 | E926: 0 | F926: 0 | G926: 0 | H926: 0 | I926: 0 | J926: 0 | K926: 22.829999999999998 | L926: 0 | M926: =SUM(J926:L926)-2.18 -> 20.649999999999999 | N926: 2.1800000000000002 | O926: =SUM(M926:N926) -> 22.829999999999998
A927: 3987 | B927: UHE PORTO PRIMAVERA | C927: 60.933.603/0001-78 | D927: 1707.9400000000001 | E927: 0 | F927: 0 | G927: 0 | H927: 0 | I927: 0 | J927: 0 | K927: 1887.98 | L927: 0 | M927: =SUM(J927:L927)-180.04 -> 1707.9400000000001 | N927: 180.03999999999999 | O927: =SUM(M927:N927) -> 1887.98
A928: 3988 | B928: UFV SÃO GONÇALO 14 | C928: 31.791.620/0001-10 | D928: 20.649999999999999 | E928: 0 | F928: 0 | G928: 0 | H928: 0 | I928: 0 | J928: 0 | K928: 22.829999999999998 | L928: 0 | M928: =SUM(J928:L928)-2.18 -> 20.649999999999999 | N928: 2.1800000000000002 | O928: =SUM(M928:N928) -> 22.829999999999998
A929: 3989 | B929: EOL CUMARU I | C929: 31.211.298/0002-93 | D929: 19.329999999999998 | E929: 0 | F929: 0 | G929: 0 | H929: 0 | I929: 0 | J929: 0 | K929: 21.370000000000001 | L929: 0 | M929: =SUM(J929:L929)-2.04 -> 19.330000000000002 | N929: 2.04 | O929: =SUM(M929:N929) -> 21.370000000000001
A930: 3990 | B930: EOL CUMARU II | C930: 31.216.345/0002-91 | D930: 19.329999999999998 | E930: 0 | F930: 0 | G930: 0 | H930: 0 | I930: 0 | J930: 0 | K930: 21.370000000000001 | L930: 0 | M930: =SUM(J930:L930)-2.04 -> 19.330000000000002 | N930: 2.04 | O930: =SUM(M930:N930) -> 21.370000000000001
A931: 3991 | B931: EOL VILA ESPÍRITO SANTO I | C931: 34.043.696/0001-55 | D931: 15.02 | E931: 0 | F931: 0 | G931: 0 | H931: 0 | I931: 0 | J931: 0 | K931: 16.600000000000001 | L931: 0 | M931: =SUM(J931:L931)-1.58 -> 15.020000000000001 | N931: 1.5800000000000001 | O931: =SUM(M931:N931) -> 16.600000000000001
A932: 3992 | B932: UFV TERRA DO SOL XI | C932: 31.533.486/0001-57 | D932: 22.66 | E932: 0 | F932: 0 | G932: 0 | H932: 0 | I932: 0 | J932: 0 | K932: 25.050000000000001 | L932: 0 | M932: =SUM(J932:L932)-2.39 -> 22.66 | N932: 2.3900000000000001 | O932: =SUM(M932:N932) -> 25.050000000000001
A933: 3993 | B933: UFV SOL DO SERTÃO XXXVI | C933: 31.533.486/0001-57 | D933: 19.359999999999999 | E933: 0 | F933: 0 | G933: 0 | H933: 0 | I933: 0 | J933: 0 | K933: 21.399999999999999 | L933: 0 | M933: =SUM(J933:L933)-2.04 -> 19.359999999999999 | N933: 2.04 | O933: =SUM(M933:N933) -> 21.399999999999999
A934: 3994 | B934: UFV SOL DO SERTÃO VIII | C934: 31.534.389/0001-89 | D934: 45.32 | E934: 0 | F934: 0 | G934: 0 | H934: 0 | I934: 0 | J934: 0 | K934: 50.100000000000001 | L934: 0 | M934: =SUM(J934:L934)-4.78 -> 45.32 | N934: 4.7800000000000002 | O934: =SUM(M934:N934) -> 50.100000000000001
A935: 3995 | B935: UFV SOL DO SERTÃO XIII | C935: 31.512.705/0001-11 | D935: 35.609999999999999 | E935: 0 | F935: 0 | G935: 0 | H935: 0 | I935: 0 | J935: 0 | K935: 39.359999999999999 | L935: 0 | M935: =SUM(J935:L935)-3.75 -> 35.609999999999999 | N935: 3.75 | O935: =SUM(M935:N935) -> 39.359999999999999
A936: 3996 | B936: EOL ANGICOS II | C936: 33.511.191/0001-05 | D936: 13.18 | E936: 0 | F936: 0 | G936: 0 | H936: 0 | I936: 0 | J936: 0 | K936: 14.57 | L936: 0 | M936: =SUM(J936:L936)-1.39 -> 13.18 | N936: 1.3899999999999999 | O936: =SUM(M936:N936) -> 14.57
A937: 3997 | B937: EOL VILA ESPÍRITO SANTO III | C937: 34.043.685/0001-75 | D937: 16.890000000000001 | E937: 0 | F937: 0 | G937: 0 | H937: 0 | I937: 0 | J937: 0 | K937: 18.670000000000002 | L937: 0 | M937: =SUM(J937:L937)-1.78 -> 16.890000000000001 | N937: 1.78 | O937: =SUM(M937:N937) -> 18.670000000000002
A938: 3998 | B938: EOL VILA ESPÍRITO SANTO IV | C938: 34.011.712/0001-28 | D938: 17.09 | E938: 0 | F938: 0 | G938: 0 | H938: 0 | I938: 0 | J938: 0 | K938: 18.890000000000001 | L938: 0 | M938: =SUM(J938:L938)-1.8 -> 17.09 | N938: 1.8 | O938: =SUM(M938:N938) -> 18.890000000000001
A939: 3999 | B939: EOL VILA ESPÍRITO SANTO V | C939: 34.135.249/0001-26 | D939: 16.890000000000001 | E939: 0 | F939: 0 | G939: 0 | H939: 0 | I939: 0 | J939: 0 | K939: 18.670000000000002 | L939: 0 | M939: =SUM(J939:L939)-1.78 -> 16.890000000000001 | N939: 1.78 | O939: =SUM(M939:N939) -> 18.670000000000002
A940: 40005 | B940: BTG PACTUAL | C940: 30.306.294/0002-26 | D940: 5.0800000000000001 | E940: 0 | F940: 0 | G940: 0 | H940: 0 | I940: 0 | J940: 5.6200000000000001 | K940: 0 | L940: 0 | M940: =SUM(J940:L940)-0.54 -> 5.0800000000000001 | N940: 0.54000000000000004 | O940: =SUM(M940:N940) -> 5.6200000000000001
A941: 4001 | B941: UFV SOL DO SERTÃO XII | C941: 31.534.389/0001-89 | D941: 25.940000000000001 | E941: 0 | F941: 0 | G941: 0 | H941: 0 | I941: 0 | J941: 0 | K941: 28.670000000000002 | L941: 0 | M941: =SUM(J941:L941)-2.73 -> 25.940000000000001 | N941: 2.73 | O941: =SUM(M941:N941) -> 28.670000000000002
A942: 4002 | B942: UFV SOL DO SERTÃO XXXV | C942: 31.512.705/0001-11 | D942: 12.93 | E942: 0 | F942: 0 | G942: 0 | H942: 0 | I942: 0 | J942: 0 | K942: 14.289999999999999 | L942: 0 | M942: =SUM(J942:L942)-1.36 -> 12.93 | N942: 1.3600000000000001 | O942: =SUM(M942:N942) -> 14.289999999999999
A943: 4003 | B943: EOL CUMARU III | C943: 31.216.014/0002-51 | D943: 19.329999999999998 | E943: 0 | F943: 0 | G943: 0 | H943: 0 | I943: 0 | J943: 0 | K943: 21.370000000000001 | L943: 0 | M943: =SUM(J943:L943)-2.04 -> 19.330000000000002 | N943: 2.04 | O943: =SUM(M943:N943) -> 21.370000000000001
A944: 4004 | B944: EOL CUMARU IV | C944: 31.211.130/0002-88 | D944: 19.329999999999998 | E944: 0 | F944: 0 | G944: 0 | H944: 0 | I944: 0 | J944: 0 | K944: 21.370000000000001 | L944: 0 | M944: =SUM(J944:L944)-2.04 -> 19.330000000000002 | N944: 2.04 | O944: =SUM(M944:N944) -> 21.370000000000001
A945: 4005 | B945: EOL CUMARU V | C945: 31.210.772/0003-43 | D945: 17.399999999999999 | E945: 0 | F945: 0 | G945: 0 | H945: 0 | I945: 0 | J945: 0 | K945: 19.23 | L945: 0 | M945: =SUM(J945:L945)-1.83 -> 17.399999999999999 | N945: 1.8300000000000001 | O945: =SUM(M945:N945) -> 19.229999999999997
A946: 4006 | B946: EOL FILGUEIRA II | C946: 33.486.296/0001-51 | D946: 12.550000000000001 | E946: 0 | F946: 0 | G946: 0 | H946: 0 | I946: 0 | J946: 0 | K946: 13.869999999999999 | L946: 0 | M946: =SUM(J946:L946)-1.32 -> 12.549999999999999 | N946: 1.3200000000000001 | O946: =SUM(M946:N946) -> 13.869999999999999
A947: 4012 | B947: EOL VENTOS DA BAHIA XIV | C947: 31.818.978/0001-99 | D947: 20.27 | E947: 0 | F947: 0 | G947: 0 | H947: 0 | I947: 0 | J947: 0 | K947: 22.41 | L947: 0 | M947: =SUM(J947:L947)-2.14 -> 20.27 | N947: 2.1400000000000001 | O947: =SUM(M947:N947) -> 22.41
A948: 4013 | B948: UFV ALEX IX | C948: 30.567.568/0001-50 | D948: 15.42 | E948: 0 | F948: 0 | G948: 0 | H948: 0 | I948: 0 | J948: 0 | K948: 17.050000000000001 | L948: 0 | M948: =SUM(J948:L948)-1.63 -> 15.420000000000002 | N948: 1.6299999999999999 | O948: =SUM(M948:N948) -> 17.050000000000001
A949: 4014 | B949: UFV ALEX X | C949: 30.567.559/0001-69 | D949: 12.94 | E949: 0 | F949: 0 | G949: 0 | H949: 0 | I949: 0 | J949: 0 | K949: 14.300000000000001 | L949: 0 | M949: =SUM(J949:L949)-1.36 -> 12.940000000000001 | N949: 1.3600000000000001 | O949: =SUM(M949:N949) -> 14.300000000000001
A950: 4015 | B950: EOL ANGICOS I | C950: 33.511.173/0001-23 | D950: 11.300000000000001 | E950: 0 | F950: 0 | G950: 0 | H950: 0 | I950: 0 | J950: 0 | K950: 12.49 | L950: 0 | M950: =SUM(J950:L950)-1.19 -> 11.300000000000001 | N950: 1.1899999999999999 | O950: =SUM(M950:N950) -> 12.49
A951: 4018 | B951: EOL SERRA DO MATO I | C951: 32.398.781/0001-00 | D951: 9.0899999999999999 | E951: 0 | F951: 0 | G951: 0 | H951: 0 | I951: 0 | J951: 0 | K951: 10.050000000000001 | L951: 0 | M951: =SUM(J951:L951)-0.96 -> 9.0899999999999999 | N951: 0.95999999999999996 | O951: =SUM(M951:N951) -> 10.050000000000001
A952: 4019 | B952: EOL VENTOS DE SANTA ESPERANÇA 08 | C952: 29.641.225/0002-90 | D952: 11.75 | E952: 0 | F952: 0 | G952: 0 | H952: 0 | I952: 0 | J952: 0 | K952: 12.99 | L952: 0 | M952: =SUM(J952:L952)-1.24 -> 11.75 | N952: 1.24 | O952: =SUM(M952:N952) -> 12.99
A953: 4020 | B953: EOL VENTOS DE SANTA ESPERANÇA 15 | C953: 29.552.609/0002-36 | D953: 28.82 | E953: 0 | F953: 0 | G953: 0 | H953: 0 | I953: 0 | J953: 0 | K953: 31.859999999999999 | L953: 0 | M953: =SUM(J953:L953)-3.04 -> 28.82 | N953: 3.04 | O953: =SUM(M953:N953) -> 31.859999999999999
A954: 4021 | B954: EOL VENTOS DE SANTA ESPERANÇA 16 | C954: 29.552.662/0002-37 | D954: 18.260000000000002 | E954: 0 | F954: 0 | G954: 0 | H954: 0 | I954: 0 | J954: 0 | K954: 20.18 | L954: 0 | M954: =SUM(J954:L954)-1.92 -> 18.259999999999998 | N954: 1.9199999999999999 | O954: =SUM(M954:N954) -> 20.18
A955: 4022 | B955: EOL VENTOS DE SANTA ESPERANÇA 17 | C955: 29.587.306/0002-59 | D955: 26.199999999999999 | E955: 0 | F955: 0 | G955: 0 | H955: 0 | I955: 0 | J955: 0 | K955: 28.960000000000001 | L955: 0 | M955: =SUM(J955:L955)-2.76 -> 26.200000000000003 | N955: 2.7599999999999998 | O955: =SUM(M955:N955) -> 28.960000000000001
A956: 4023 | B956: EOL VENTOS DE SANTA ESPERANÇA 21 | C956: 29.579.544/0002-12 | D956: 20.09 | E956: 0 | F956: 0 | G956: 0 | H956: 0 | I956: 0 | J956: 0 | K956: 22.210000000000001 | L956: 0 | M956: =SUM(J956:L956)-2.12 -> 20.09 | N956: 2.1200000000000001 | O956: =SUM(M956:N956) -> 22.210000000000001
A957: 4024 | B957: EOL VENTOS DE SANTA ESPERANÇA 22 | C957: 29.618.696/0002-87 | D957: 20.09 | E957: 0 | F957: 0 | G957: 0 | H957: 0 | I957: 0 | J957: 0 | K957: 22.210000000000001 | L957: 0 | M957: =SUM(J957:L957)-2.12 -> 20.09 | N957: 2.1200000000000001 | O957: =SUM(M957:N957) -> 22.210000000000001
A958: 4025 | B958: EOL VILA ESPÍRITO SANTO II | C958: 34.011.705/0001-26 | D958: 16.890000000000001 | E958: 0 | F958: 0 | G958: 0 | H958: 0 | I958: 0 | J958: 0 | K958: 18.670000000000002 | L958: 0 | M958: =SUM(J958:L958)-1.78 -> 16.890000000000001 | N958: 1.78 | O958: =SUM(M958:N958) -> 18.670000000000002
A959: 4026 | B959: UTE FS SORRISO | C959: 20.003.699/0002-31 | D959: 9.1799999999999997 | E959: 0 | F959: 0 | G959: 0 | H959: 0 | I959: 0 | J959: 0 | K959: 10.15 | L959: 0 | M959: =SUM(J959:L959)-0.97 -> 9.1799999999999997 | N959: 0.96999999999999997 | O959: =SUM(M959:N959) -> 10.15
A960: 4027 | B960: EOL AFONSO BEZERRA I | C960: 33.511.218/0001-60 | D960: 13.18 | E960: 0 | F960: 0 | G960: 0 | H960: 0 | I960: 0 | J960: 0 | K960: 14.57 | L960: 0 | M960: =SUM(J960:L960)-1.39 -> 13.18 | N960: 1.3899999999999999 | O960: =SUM(M960:N960) -> 14.57
A961: 4028 | B961: EOL AFONSO BEZERRA II | C961: 33.511.255/0001-78 | D961: 13.18 | E961: 0 | F961: 0 | G961: 0 | H961: 0 | I961: 0 | J961: 0 | K961: 14.57 | L961: 0 | M961: =SUM(J961:L961)-1.39 -> 13.18 | N961: 1.3899999999999999 | O961: =SUM(M961:N961) -> 14.57
A962: 4029 | B962: UTE PUMA II | C962: 89.637.490/0165-72 | D962: 23.300000000000001 | E962: 0 | F962: 0 | G962: 0 | H962: 0 | I962: 0 | J962: 0 | K962: 25.760000000000002 | L962: 0 | M962: =SUM(J962:L962)-2.46 -> 23.300000000000001 | N962: 2.46 | O962: =SUM(M962:N962) -> 25.760000000000002
A963: 4030 | B963: UFV ALEX I | C963: 30.567.624/0001-56 | D963: 15.42 | E963: 0 | F963: 0 | G963: 0 | H963: 0 | I963: 0 | J963: 0 | K963: 17.050000000000001 | L963: 0 | M963: =SUM(J963:L963)-1.63 -> 15.420000000000002 | N963: 1.6299999999999999 | O963: =SUM(M963:N963) -> 17.050000000000001
A964: 4031 | B964: UFV ALEX III | C964: 30.567.591/0001-44 | D964: 15.42 | E964: 0 | F964: 0 | G964: 0 | H964: 0 | I964: 0 | J964: 0 | K964: 17.050000000000001 | L964: 0 | M964: =SUM(J964:L964)-1.63 -> 15.420000000000002 | N964: 1.6299999999999999 | O964: =SUM(M964:N964) -> 17.050000000000001
A965: 4032 | B965: UFV ALEX IV | C965: 30.567.615/0001-65 | D965: 15.42 | E965: 0 | F965: 0 | G965: 0 | H965: 0 | I965: 0 | J965: 0 | K965: 17.050000000000001 | L965: 0 | M965: =SUM(J965:L965)-1.63 -> 15.420000000000002 | N965: 1.6299999999999999 | O965: =SUM(M965:N965) -> 17.050000000000001
A966: 4033 | B966: UFV ALEX V | C966: 30.567.603/0001-30 | D966: 15.42 | E966: 0 | F966: 0 | G966: 0 | H966: 0 | I966: 0 | J966: 0 | K966: 17.050000000000001 | L966: 0 | M966: =SUM(J966:L966)-1.63 -> 15.420000000000002 | N966: 1.6299999999999999 | O966: =SUM(M966:N966) -> 17.050000000000001
A967: 4034 | B967: UFV ALEX VI | C967: 30.567.543/0001-56 | D967: 15.42 | E967: 0 | F967: 0 | G967: 0 | H967: 0 | I967: 0 | J967: 0 | K967: 17.050000000000001 | L967: 0 | M967: =SUM(J967:L967)-1.63 -> 15.420000000000002 | N967: 1.6299999999999999 | O967: =SUM(M967:N967) -> 17.050000000000001
A968: 4035 | B968: UFV ALEX VII | C968: 30.567.582/0001-53 | D968: 15.42 | E968: 0 | F968: 0 | G968: 0 | H968: 0 | I968: 0 | J968: 0 | K968: 17.050000000000001 | L968: 0 | M968: =SUM(J968:L968)-1.63 -> 15.420000000000002 | N968: 1.6299999999999999 | O968: =SUM(M968:N968) -> 17.050000000000001
A969: 4036 | B969: UFV ALEX VIII | C969: 30.567.573/0001-62 | D969: 15.42 | E969: 0 | F969: 0 | G969: 0 | H969: 0 | I969: 0 | J969: 0 | K969: 17.050000000000001 | L969: 0 | M969: =SUM(J969:L969)-1.63 -> 15.420000000000002 | N969: 1.6299999999999999 | O969: =SUM(M969:N969) -> 17.050000000000001
A970: 4037 | B970: UTE BRACELL | C970: 53.943.098/0001-87 | D970: 71.790000000000006 | E970: 0 | F970: 0 | G970: 0 | H970: 0 | I970: 0 | J970: 0 | K970: 79.359999999999999 | L970: 0 | M970: =SUM(J970:L970)-7.57 -> 71.789999999999992 | N970: 7.5700000000000003 | O970: =SUM(M970:N970) -> 79.359999999999985
A971: 4038 | B971: EOL FILGUEIRA I | C971: 33.486.289/0001-50 | D971: 17.260000000000002 | E971: 0 | F971: 0 | G971: 0 | H971: 0 | I971: 0 | J971: 0 | K971: 19.079999999999998 | L971: 0 | M971: =SUM(J971:L971)-1.82 -> 17.259999999999998 | N971: 1.8200000000000001 | O971: =SUM(M971:N971) -> 19.079999999999998
A972: 4039 | B972: EOL SERRA DO MATO II | C972: 32.326.077/0001-42 | D972: 9.0899999999999999 | E972: 0 | F972: 0 | G972: 0 | H972: 0 | I972: 0 | J972: 0 | K972: 10.050000000000001 | L972: 0 | M972: =SUM(J972:L972)-0.96 -> 9.0899999999999999 | N972: 0.95999999999999996 | O972: =SUM(M972:N972) -> 10.050000000000001
A973: 4040 | B973: EOL VENTOS DE SANTA ESPERANÇA 25 | C973: 29.616.244/0002-66 | D973: 11.75 | E973: 0 | F973: 0 | G973: 0 | H973: 0 | I973: 0 | J973: 0 | K973: 12.99 | L973: 0 | M973: =SUM(J973:L973)-1.24 -> 11.75 | N973: 1.24 | O973: =SUM(M973:N973) -> 12.99
A974: 4041 | B974: EOL VENTOS DE SANTA ESPERANÇA 26 | C974: 29.617.129/0002-06 | D974: 20.09 | E974: 0 | F974: 0 | G974: 0 | H974: 0 | I974: 0 | J974: 0 | K974: 22.210000000000001 | L974: 0 | M974: =SUM(J974:L974)-2.12 -> 20.09 | N974: 2.1200000000000001 | O974: =SUM(M974:N974) -> 22.210000000000001
A975: 4042 | B975: EOL VILA ALAGOAS II | C975: 34.109.311/0001-05 | D975: 9.3900000000000006 | E975: 0 | F975: 0 | G975: 0 | H975: 0 | I975: 0 | J975: 0 | K975: 10.380000000000001 | L975: 0 | M975: =SUM(J975:L975)-0.99 -> 9.3900000000000006 | N975: 0.98999999999999999 | O975: =SUM(M975:N975) -> 10.380000000000001
A976: 4043 | B976: UFV SOL DO SERTÃO XIV | C976: 31.512.705/0001-11 | D976: 9.6899999999999995 | E976: 0 | F976: 0 | G976: 0 | H976: 0 | I976: 0 | J976: 0 | K976: 10.710000000000001 | L976: 0 | M976: =SUM(J976:L976)-1.02 -> 9.6900000000000013 | N976: 1.02 | O976: =SUM(M976:N976) -> 10.710000000000001
A977: 4044 | B977: UFV TERRA DO SOL VII | C977: 31.533.486/0001-57 | D977: 25.920000000000002 | E977: 0 | F977: 0 | G977: 0 | H977: 0 | I977: 0 | J977: 0 | K977: 28.649999999999999 | L977: 0 | M977: =SUM(J977:L977)-2.73 -> 25.919999999999998 | N977: 2.73 | O977: =SUM(M977:N977) -> 28.649999999999999
A978: 4047 | B978: UFV COREMAS VII | C978: 34.920.805/0001-75 | D978: 12.119999999999999 | E978: 0 | F978: 0 | G978: 0 | H978: 0 | I978: 0 | J978: 0 | K978: 13.4 | L978: 0 | M978: =SUM(J978:L978)-1.28 -> 12.120000000000001 | N978: 1.28 | O978: =SUM(M978:N978) -> 13.4
A979: 4048 | B979: EOL TACAICÓ II | C979: 32.829.695/0002-96 | D979: 24.210000000000001 | E979: 0 | F979: 0 | G979: 0 | H979: 0 | I979: 0 | J979: 0 | K979: 26.760000000000002 | L979: 0 | M979: =SUM(J979:L979)-2.55 -> 24.210000000000001 | N979: 2.5499999999999998 | O979: =SUM(M979:N979) -> 26.760000000000002
A980: 4049 | B980: EOL VENTOS DA BAHIA XIII | C980: 31.810.463/0001-42 | D980: 30.390000000000001 | E980: 0 | F980: 0 | G980: 0 | H980: 0 | I980: 0 | J980: 0 | K980: 33.590000000000003 | L980: 0 | M980: =SUM(J980:L980)-3.2 -> 30.390000000000004 | N980: 3.2000000000000002 | O980: =SUM(M980:N980) -> 33.590000000000003
A981: 4050 | B981: UFV JUAZEIRO SOLAR VI | C981: 34.742.960/0001-49 | D981: 23.460000000000001 | E981: 0 | F981: 0 | G981: 0 | H981: 0 | I981: 0 | J981: 0 | K981: 25.93 | L981: 0 | M981: =SUM(J981:L981)-2.47 -> 23.460000000000001 | N981: 2.4700000000000002 | O981: =SUM(M981:N981) -> 25.93
A982: 4051 | B982: UFV JUAZEIRO SOLAR VIII | C982: 34.742.951/0001-58 | D982: 7.54 | E982: 0 | F982: 0 | G982: 0 | H982: 0 | I982: 0 | J982: 0 | K982: 8.3300000000000001 | L982: 0 | M982: =SUM(J982:L982)-0.79 -> 7.54 | N982: 0.79000000000000004 | O982: =SUM(M982:N982) -> 8.3300000000000001
A983: 4052 | B983: UFV JUAZEIRO SOLAR V | C983: 34.742.964/0001-27 | D983: 23.460000000000001 | E983: 0 | F983: 0 | G983: 0 | H983: 0 | I983: 0 | J983: 0 | K983: 25.93 | L983: 0 | M983: =SUM(J983:L983)-2.47 -> 23.460000000000001 | N983: 2.4700000000000002 | O983: =SUM(M983:N983) -> 25.93
A984: 4053 | B984: UFV JUAZEIRO SOLAR VII | C984: 34.751.530/0001-93 | D984: 23.460000000000001 | E984: 0 | F984: 0 | G984: 0 | H984: 0 | I984: 0 | J984: 0 | K984: 25.93 | L984: 0 | M984: =SUM(J984:L984)-2.47 -> 23.460000000000001 | N984: 2.4700000000000002 | O984: =SUM(M984:N984) -> 25.93
A985: 4054 | B985: EOL PAU FERRO II | C985: 32.829.774/0002-05 | D985: 23.460000000000001 | E985: 0 | F985: 0 | G985: 0 | H985: 0 | I985: 0 | J985: 0 | K985: 25.93 | L985: 0 | M985: =SUM(J985:L985)-2.47 -> 23.460000000000001 | N985: 2.4700000000000002 | O985: =SUM(M985:N985) -> 25.93
A986: 4055 | B986: EOL SERRA DO MATO III | C986: 32.326.123/0001-03 | D986: 9.0899999999999999 | E986: 0 | F986: 0 | G986: 0 | H986: 0 | I986: 0 | J986: 0 | K986: 10.050000000000001 | L986: 0 | M986: =SUM(J986:L986)-0.96 -> 9.0899999999999999 | N986: 0.95999999999999996 | O986: =SUM(M986:N986) -> 10.050000000000001
A987: 4058 | B987: EOL AURA QUEIMADA NOVA 01 | C987: 35.572.851/0002-74 | D987: 14.83 | E987: 0 | F987: 0 | G987: 0 | H987: 0 | I987: 0 | J987: 0 | K987: 16.390000000000001 | L987: 0 | M987: =SUM(J987:L987)-1.56 -> 14.83 | N987: 1.5600000000000001 | O987: =SUM(M987:N987) -> 16.390000000000001
A988: 4059 | B988: EOL GRAVIER | C988: 23.793.827/0001-03 | D988: 31.879999999999999 | E988: 0 | F988: 0 | G988: 0 | H988: 0 | I988: 0 | J988: 0 | K988: 35.240000000000002 | L988: 0 | M988: =SUM(J988:L988)-3.36 -> 31.880000000000003 | N988: 3.3599999999999999 | O988: =SUM(M988:N988) -> 35.240000000000002
A989: 4060 | B989: EOL VENTOS DE SANTA ESPERANÇA 13 | C989: 29.552.763/0002-08 | D989: 20.960000000000001 | E989: 0 | F989: 0 | G989: 0 | H989: 0 | I989: 0 | J989: 0 | K989: 23.170000000000002 | L989: 0 | M989: =SUM(J989:L989)-2.21 -> 20.960000000000001 | N989: 2.21 | O989: =SUM(M989:N989) -> 23.170000000000002
A990: 4061 | B990: EOL AURA QUEIMADA NOVA 02 | C990: 35.603.267/0002-39 | D990: 22.800000000000001 | E990: 0 | F990: 0 | G990: 0 | H990: 0 | I990: 0 | J990: 0 | K990: 25.199999999999999 | L990: 0 | M990: =SUM(J990:L990)-2.4 -> 22.800000000000001 | N990: 2.3999999999999999 | O990: =SUM(M990:N990) -> 25.199999999999999
A991: 4062 | B991: UFV COREMAS IV | C991: 34.921.036/0001-20 | D991: 12.119999999999999 | E991: 0 | F991: 0 | G991: 0 | H991: 0 | I991: 0 | J991: 0 | K991: 13.4 | L991: 0 | M991: =SUM(J991:L991)-1.28 -> 12.120000000000001 | N991: 1.28 | O991: =SUM(M991:N991) -> 13.4
A992: 4063 | B992: UFV COREMAS V | C992: 34.920.838/0001-15 | D992: 12.119999999999999 | E992: 0 | F992: 0 | G992: 0 | H992: 0 | I992: 0 | J992: 0 | K992: 13.4 | L992: 0 | M992: =SUM(J992:L992)-1.28 -> 12.120000000000001 | N992: 1.28 | O992: =SUM(M992:N992) -> 13.4
A993: 4064 | B993: UFV COREMAS VI | C993: 34.850.666/0001-50 | D993: 12.119999999999999 | E993: 0 | F993: 0 | G993: 0 | H993: 0 | I993: 0 | J993: 0 | K993: 13.4 | L993: 0 | M993: =SUM(J993:L993)-1.28 -> 12.120000000000001 | N993: 1.28 | O993: =SUM(M993:N993) -> 13.4
A994: 4067 | B994: EOL VENTOS DA BAHIA XXIII | C994: 31.782.653/0001-01 | D994: 30.390000000000001 | E994: 0 | F994: 0 | G994: 0 | H994: 0 | I994: 0 | J994: 0 | K994: 33.590000000000003 | L994: 0 | M994: =SUM(J994:L994)-3.2 -> 30.390000000000004 | N994: 3.2000000000000002 | O994: =SUM(M994:N994) -> 33.590000000000003
A995: 4068 | B995: EOL SERRA DO MATO IV | C995: 32.326.120/0001-70 | D995: 9.0899999999999999 | E995: 0 | F995: 0 | G995: 0 | H995: 0 | I995: 0 | J995: 0 | K995: 10.050000000000001 | L995: 0 | M995: =SUM(J995:L995)-0.96 -> 9.0899999999999999 | N995: 0.95999999999999996 | O995: =SUM(M995:N995) -> 10.050000000000001
A996: 4069 | B996: EOL SERRA DO MATO V | C996: 32.326.115/0001-67 | D996: 9.0899999999999999 | E996: 0 | F996: 0 | G996: 0 | H996: 0 | I996: 0 | J996: 0 | K996: 10.050000000000001 | L996: 0 | M996: =SUM(J996:L996)-0.96 -> 9.0899999999999999 | N996: 0.95999999999999996 | O996: =SUM(M996:N996) -> 10.050000000000001
A997: 4070 | B997: EOL SERRA DO MATO VI | C997: 32.326.113/0001-78 | D997: 7.2699999999999996 | E997: 0 | F997: 0 | G997: 0 | H997: 0 | I997: 0 | J997: 0 | K997: 8.0399999999999991 | L997: 0 | M997: =SUM(J997:L997)-0.77 -> 7.2699999999999996 | N997: 0.77000000000000002 | O997: =SUM(M997:N997) -> 8.0399999999999991
A998: 4071 | B998: EOL ACAUÃ III | C998: 35.842.711/0001-98 | D998: 9.1899999999999995 | E998: 0 | F998: 0 | G998: 0 | H998: 0 | I998: 0 | J998: 0 | K998: 10.16 | L998: 0 | M998: =SUM(J998:L998)-0.97 -> 9.1899999999999995 | N998: 0.96999999999999997 | O998: =SUM(M998:N998) -> 10.16
A999: 4072 | B999: EOL AFONSO BEZERRA III | C999: 33.511.325/0001-98 | D999: 13.18 | E999: 0 | F999: 0 | G999: 0 | H999: 0 | I999: 0 | J999: 0 | K999: 14.57 | L999: 0 | M999: =SUM(J999:L999)-1.39 -> 13.18 | N999: 1.3899999999999999 | O999: =SUM(M999:N999) -> 14.57
A1000: 4073 | B1000: EOL AFONSO BEZERRA IV | C1000: 33.511.347/0001-58 | D1000: 7.54 | E1000: 0 | F1000: 0 | G1000: 0 | H1000: 0 | I1000: 0 | J1000: 0 | K1000: 8.3300000000000001 | L1000: 0 | M1000: =SUM(J1000:L1000)-0.79 -> 7.54 | N1000: 0.79000000000000004 | O1000: =SUM(M1000:N1000) -> 8.3300000000000001
A1001: 4076 | B1001: UFV COREMAS VIII | C1001: 36.571.485/0001-10 | D1001: 12.119999999999999 | E1001: 0 | F1001: 0 | G1001: 0 | H1001: 0 | I1001: 0 | J1001: 0 | K1001: 13.4 | L1001: 0 | M1001: =SUM(J1001:L1001)-1.28 -> 12.120000000000001 | N1001: 1.28 | O1001: =SUM(M1001:N1001) -> 13.4
A1002: 4077 | B1002: EOL TUCANO VI | C1002: 36.230.315/0001-72 | D1002: 20.120000000000001 | E1002: 0 | F1002: 0 | G1002: 0 | H1002: 0 | I1002: 0 | J1002: 0 | K1002: 22.239999999999998 | L1002: 0 | M1002: =SUM(J1002:L1002)-2.12 -> 20.119999999999997 | N1002: 2.1200000000000001 | O1002: =SUM(M1002:N1002) -> 22.239999999999998
A1003: 4103 | B1003: UFV BELMONTE 1-1 | C1003: 30.418.521/0001-24 | D1003: 22.379999999999999 | E1003: 0 | F1003: 0 | G1003: 0 | H1003: 0 | I1003: 0 | J1003: 0 | K1003: 24.739999999999998 | L1003: 0 | M1003: =SUM(J1003:L1003)-2.36 -> 22.379999999999999 | N1003: 2.3599999999999999 | O1003: =SUM(M1003:N1003) -> 24.739999999999998
A1004: 4104 | B1004: UFV BELMONTE 1-2 | C1004: 30.418.521/0001-24 | D1004: 22.379999999999999 | E1004: 0 | F1004: 0 | G1004: 0 | H1004: 0 | I1004: 0 | J1004: 0 | K1004: 24.739999999999998 | L1004: 0 | M1004: =SUM(J1004:L1004)-2.36 -> 22.379999999999999 | N1004: 2.3599999999999999 | O1004: =SUM(M1004:N1004) -> 24.739999999999998
A1005: 4105 | B1005: UFV BELMONTE 1-3 | C1005: 30.418.521/0001-24 | D1005: 22.379999999999999 | E1005: 0 | F1005: 0 | G1005: 0 | H1005: 0 | I1005: 0 | J1005: 0 | K1005: 24.739999999999998 | L1005: 0 | M1005: =SUM(J1005:L1005)-2.36 -> 22.379999999999999 | N1005: 2.3599999999999999 | O1005: =SUM(M1005:N1005) -> 24.739999999999998
A1006: 4106 | B1006: UFV BELMONTE 1-4 | C1006: 30.418.521/0001-24 | D1006: 2.2400000000000002 | E1006: 0 | F1006: 0 | G1006: 0 | H1006: 0 | I1006: 0 | J1006: 0 | K1006: 2.48 | L1006: 0 | M1006: =SUM(J1006:L1006)-0.24 -> 2.2400000000000002 | N1006: 0.23999999999999999 | O1006: =SUM(M1006:N1006) -> 2.4800000000000004
A1007: 4107 | B1007: UFV BELMONTE 2-1 | C1007: 30.418.547/0001-72 | D1007: 22.989999999999998 | E1007: 0 | F1007: 0 | G1007: 0 | H1007: 0 | I1007: 0 | J1007: 0 | K1007: 25.41 | L1007: 0 | M1007: =SUM(J1007:L1007)-2.42 -> 22.990000000000002 | N1007: 2.4199999999999999 | O1007: =SUM(M1007:N1007) -> 25.410000000000004
A1008: 4108 | B1008: UFV BELMONTE 2-2 | C1008: 30.418.547/0001-72 | D1008: 22.989999999999998 | E1008: 0 | F1008: 0 | G1008: 0 | H1008: 0 | I1008: 0 | J1008: 0 | K1008: 25.41 | L1008: 0 | M1008: =SUM(J1008:L1008)-2.42 -> 22.990000000000002 | N1008: 2.4199999999999999 | O1008: =SUM(M1008:N1008) -> 25.410000000000004
A1009: 4109 | B1009: UFV BELMONTE 2-3 | C1009: 30.418.547/0001-72 | D1009: 22.989999999999998 | E1009: 0 | F1009: 0 | G1009: 0 | H1009: 0 | I1009: 0 | J1009: 0 | K1009: 25.41 | L1009: 0 | M1009: =SUM(J1009:L1009)-2.42 -> 22.990000000000002 | N1009: 2.4199999999999999 | O1009: =SUM(M1009:N1009) -> 25.410000000000004
A1010: 4110 | B1010: UFV BELMONTE 2-4 | C1010: 30.418.547/0001-72 | D1010: 22.989999999999998 | E1010: 0 | F1010: 0 | G1010: 0 | H1010: 0 | I1010: 0 | J1010: 0 | K1010: 25.41 | L1010: 0 | M1010: =SUM(J1010:L1010)-2.42 -> 22.990000000000002 | N1010: 2.4199999999999999 | O1010: =SUM(M1010:N1010) -> 25.410000000000004
A1011: 4111 | B1011: UFV BELMONTE 2-5 | C1011: 30.418.547/0001-72 | D1011: 22.989999999999998 | E1011: 0 | F1011: 0 | G1011: 0 | H1011: 0 | I1011: 0 | J1011: 0 | K1011: 25.41 | L1011: 0 | M1011: =SUM(J1011:L1011)-2.42 -> 22.990000000000002 | N1011: 2.4199999999999999 | O1011: =SUM(M1011:N1011) -> 25.410000000000004
A1012: 4112 | B1012: UFV BELMONTE 2-6 | C1012: 30.418.547/0001-72 | D1012: 22.989999999999998 | E1012: 0 | F1012: 0 | G1012: 0 | H1012: 0 | I1012: 0 | J1012: 0 | K1012: 25.41 | L1012: 0 | M1012: =SUM(J1012:L1012)-2.42 -> 22.990000000000002 | N1012: 2.4199999999999999 | O1012: =SUM(M1012:N1012) -> 25.410000000000004
A1013: 4113 | B1013: UFV LAVRAS 1 | C1013: 30.806.144/0001-09 | D1013: 10.630000000000001 | E1013: 0 | F1013: 0 | G1013: 0 | H1013: 0 | I1013: 0 | J1013: 0 | K1013: 11.75 | L1013: 0 | M1013: =SUM(J1013:L1013)-1.12 -> 10.629999999999999 | N1013: 1.1200000000000001 | O1013: =SUM(M1013:N1013) -> 11.75
A1014: 4114 | B1014: UFV LAVRAS 2 | C1014: 30.806.150/0001-58 | D1014: 10.630000000000001 | E1014: 0 | F1014: 0 | G1014: 0 | H1014: 0 | I1014: 0 | J1014: 0 | K1014: 11.75 | L1014: 0 | M1014: =SUM(J1014:L1014)-1.12 -> 10.629999999999999 | N1014: 1.1200000000000001 | O1014: =SUM(M1014:N1014) -> 11.75
A1015: 4115 | B1015: UFV LAVRAS 3 | C1015: 30.806.162/0001-82 | D1015: 10.630000000000001 | E1015: 0 | F1015: 0 | G1015: 0 | H1015: 0 | I1015: 0 | J1015: 0 | K1015: 11.75 | L1015: 0 | M1015: =SUM(J1015:L1015)-1.12 -> 10.629999999999999 | N1015: 1.1200000000000001 | O1015: =SUM(M1015:N1015) -> 11.75
A1016: 4116 | B1016: UFV LAVRAS 4 | C1016: 30.806.156/0001-25 | D1016: 10.630000000000001 | E1016: 0 | F1016: 0 | G1016: 0 | H1016: 0 | I1016: 0 | J1016: 0 | K1016: 11.75 | L1016: 0 | M1016: =SUM(J1016:L1016)-1.12 -> 10.629999999999999 | N1016: 1.1200000000000001 | O1016: =SUM(M1016:N1016) -> 11.75
A1017: 4117 | B1017: UFV LAVRAS 5 | C1017: 30.806.179/0001-30 | D1017: 10.630000000000001 | E1017: 0 | F1017: 0 | G1017: 0 | H1017: 0 | I1017: 0 | J1017: 0 | K1017: 11.75 | L1017: 0 | M1017: =SUM(J1017:L1017)-1.12 -> 10.629999999999999 | N1017: 1.1200000000000001 | O1017: =SUM(M1017:N1017) -> 11.75
A1018: 4118 | B1018: UFV XAXADO 1 | C1018: 37.427.693/0001-03 | D1018: 14.65 | E1018: 0 | F1018: 0 | G1018: 0 | H1018: 0 | I1018: 0 | J1018: 0 | K1018: 16.190000000000001 | L1018: 0 | M1018: =SUM(J1018:L1018)-1.54 -> 14.650000000000002 | N1018: 1.54 | O1018: =SUM(M1018:N1018) -> 16.190000000000001
A1019: 4119 | B1019: UFV XAXADO 2 | C1019: 37.427.699/0001-80 | D1019: 14.65 | E1019: 0 | F1019: 0 | G1019: 0 | H1019: 0 | I1019: 0 | J1019: 0 | K1019: 16.190000000000001 | L1019: 0 | M1019: =SUM(J1019:L1019)-1.54 -> 14.650000000000002 | N1019: 1.54 | O1019: =SUM(M1019:N1019) -> 16.190000000000001
A1020: 4120 | B1020: UFV XAXADO 3 | C1020: 37.427.691/0001-14 | D1020: 14.65 | E1020: 0 | F1020: 0 | G1020: 0 | H1020: 0 | I1020: 0 | J1020: 0 | K1020: 16.190000000000001 | L1020: 0 | M1020: =SUM(J1020:L1020)-1.54 -> 14.650000000000002 | N1020: 1.54 | O1020: =SUM(M1020:N1020) -> 16.190000000000001
A1021: 4121 | B1021: EOL VENTOS DA BAHIA XXVII | C1021: 32.124.546/0001-40 | D1021: 30.379999999999999 | E1021: 0 | F1021: 0 | G1021: 0 | H1021: 0 | I1021: 0 | J1021: 0 | K1021: 33.579999999999998 | L1021: 0 | M1021: =SUM(J1021:L1021)-3.2 -> 30.379999999999999 | N1021: 3.2000000000000002 | O1021: =SUM(M1021:N1021) -> 33.579999999999998
A1022: 4122 | B1022: EOL CANUDOS I | C1022: 35.474.191/0001-08 | D1022: 20.609999999999999 | E1022: 0 | F1022: 0 | G1022: 0 | H1022: 0 | I1022: 0 | J1022: 0 | K1022: 22.780000000000001 | L1022: 0 | M1022: =SUM(J1022:L1022)-2.17 -> 20.609999999999999 | N1022: 2.1699999999999999 | O1022: =SUM(M1022:N1022) -> 22.780000000000001
A1023: 4123 | B1023: EOL TUCANO VII | C1023: 36.230.329/0001-96 | D1023: 22.629999999999999 | E1023: 0 | F1023: 0 | G1023: 0 | H1023: 0 | I1023: 0 | J1023: 0 | K1023: 25.02 | L1023: 0 | M1023: =SUM(J1023:L1023)-2.39 -> 22.629999999999999 | N1023: 2.3900000000000001 | O1023: =SUM(M1023:N1023) -> 25.02
A1024: 4125 | B1024: EOL TUCANO VIII | C1024: 36.230.295/0001-30 | D1024: 20.120000000000001 | E1024: 0 | F1024: 0 | G1024: 0 | H1024: 0 | I1024: 0 | J1024: 0 | K1024: 22.239999999999998 | L1024: 0 | M1024: =SUM(J1024:L1024)-2.12 -> 20.119999999999997 | N1024: 2.1200000000000001 | O1024: =SUM(M1024:N1024) -> 22.239999999999998
A1025: 4126 | B1025: EOL CANUDOS II | C1025: 35.417.771/0001-63 | D1025: 20.609999999999999 | E1025: 0 | F1025: 0 | G1025: 0 | H1025: 0 | I1025: 0 | J1025: 0 | K1025: 22.780000000000001 | L1025: 0 | M1025: =SUM(J1025:L1025)-2.17 -> 20.609999999999999 | N1025: 2.1699999999999999 | O1025: =SUM(M1025:N1025) -> 22.780000000000001
A1026: 4127 | B1026: UTE PARNAÍBA V | C1026: 15.743.303/0001-71 | D1026: 414.69999999999999 | E1026: 0 | F1026: 0 | G1026: 0 | H1026: 0 | I1026: 0 | J1026: 0 | K1026: 458.41000000000003 | L1026: 0 | M1026: =SUM(J1026:L1026)-43.71 -> 414.70000000000005 | N1026: 43.710000000000001 | O1026: =SUM(M1026:N1026) -> 458.41000000000003
A1027: 4128 | B1027: EOL BOQUEIRAO I | C1027: 31.252.889/0002-09 | D1027: 18.649999999999999 | E1027: 0 | F1027: 0 | G1027: 0 | H1027: 0 | I1027: 0 | J1027: 0 | K1027: 20.620000000000001 | L1027: 0 | M1027: =SUM(J1027:L1027)-1.97 -> 18.650000000000002 | N1027: 1.97 | O1027: =SUM(M1027:N1027) -> 20.620000000000001
A1028: 4129 | B1028: EOL BOQUEIRAO II | C1028: 31.232.196/0002-54 | D1028: 16.710000000000001 | E1028: 0 | F1028: 0 | G1028: 0 | H1028: 0 | I1028: 0 | J1028: 0 | K1028: 18.469999999999999 | L1028: 0 | M1028: =SUM(J1028:L1028)-1.76 -> 16.709999999999997 | N1028: 1.76 | O1028: =SUM(M1028:N1028) -> 18.469999999999999
A1029: 4130 | B1029: EOL JERUSALÉM I | C1029: 30.785.922/0002-01 | D1029: 15.99 | E1029: 0 | F1029: 0 | G1029: 0 | H1029: 0 | I1029: 0 | J1029: 0 | K1029: 17.68 | L1029: 0 | M1029: =SUM(J1029:L1029)-1.69 -> 15.99 | N1029: 1.6899999999999999 | O1029: =SUM(M1029:N1029) -> 17.68
A1030: 4131 | B1030: EOL JERUSALÉM II | C1030: 30.798.864/0002-42 | D1030: 16.02 | E1030: 0 | F1030: 0 | G1030: 0 | H1030: 0 | I1030: 0 | J1030: 0 | K1030: 17.710000000000001 | L1030: 0 | M1030: =SUM(J1030:L1030)-1.69 -> 16.02 | N1030: 1.6899999999999999 | O1030: =SUM(M1030:N1030) -> 17.710000000000001
A1031: 4132 | B1031: EOL JERUSALÉM III | C1031: 31.231.701/0002-46 | D1031: 16.010000000000002 | E1031: 0 | F1031: 0 | G1031: 0 | H1031: 0 | I1031: 0 | J1031: 0 | K1031: 17.699999999999999 | L1031: 0 | M1031: =SUM(J1031:L1031)-1.69 -> 16.009999999999998 | N1031: 1.6899999999999999 | O1031: =SUM(M1031:N1031) -> 17.699999999999999
A1032: 4133 | B1032: EOL JERUSALÉM IV | C1032: 31.207.208/0002-90 | D1032: 15.98 | E1032: 0 | F1032: 0 | G1032: 0 | H1032: 0 | I1032: 0 | J1032: 0 | K1032: 17.66 | L1032: 0 | M1032: =SUM(J1032:L1032)-1.68 -> 15.98 | N1032: 1.6799999999999999 | O1032: =SUM(M1032:N1032) -> 17.66
A1033: 4134 | B1033: EOL JERUSALÉM V | C1033: 31.207.206/0002-00 | D1033: 15.99 | E1033: 0 | F1033: 0 | G1033: 0 | H1033: 0 | I1033: 0 | J1033: 0 | K1033: 17.68 | L1033: 0 | M1033: =SUM(J1033:L1033)-1.69 -> 15.99 | N1033: 1.6899999999999999 | O1033: =SUM(M1033:N1033) -> 17.68
A1034: 4135 | B1034: EOL JERUSALÉM VI | C1034: 31.190.337/0002-13 | D1034: 18.260000000000002 | E1034: 0 | F1034: 0 | G1034: 0 | H1034: 0 | I1034: 0 | J1034: 0 | K1034: 20.18 | L1034: 0 | M1034: =SUM(J1034:L1034)-1.92 -> 18.259999999999998 | N1034: 1.9199999999999999 | O1034: =SUM(M1034:N1034) -> 20.18
A1035: 4136 | B1035: EOL MONTE VERDE I | C1035: 31.199.583/0002-36 | D1035: 36.729999999999997 | E1035: 0 | F1035: 0 | G1035: 0 | H1035: 0 | I1035: 0 | J1035: 0 | K1035: 40.600000000000001 | L1035: 0 | M1035: =SUM(J1035:L1035)-3.87 -> 36.730000000000004 | N1035: 3.8700000000000001 | O1035: =SUM(M1035:N1035) -> 40.600000000000001
A1036: 4137 | B1036: EOL MONTE VERDE II | C1036: 31.199.569/0002-32 | D1036: 36.75 | E1036: 0 | F1036: 0 | G1036: 0 | H1036: 0 | I1036: 0 | J1036: 0 | K1036: 40.619999999999997 | L1036: 0 | M1036: =SUM(J1036:L1036)-3.87 -> 36.75 | N1036: 3.8700000000000001 | O1036: =SUM(M1036:N1036) -> 40.619999999999997
A1037: 4138 | B1037: EOL MONTE VERDE III | C1037: 31.199.512/0002-33 | D1037: 32.170000000000002 | E1037: 0 | F1037: 0 | G1037: 0 | H1037: 0 | I1037: 0 | J1037: 0 | K1037: 35.560000000000002 | L1037: 0 | M1037: =SUM(J1037:L1037)-3.39 -> 32.170000000000002 | N1037: 3.3900000000000001 | O1037: =SUM(M1037:N1037) -> 35.560000000000002
A1038: 4139 | B1038: EOL MONTE VERDE IV | C1038: 31.199.598/0002-02 | D1038: 25.300000000000001 | E1038: 0 | F1038: 0 | G1038: 0 | H1038: 0 | I1038: 0 | J1038: 0 | K1038: 27.969999999999999 | L1038: 0 | M1038: =SUM(J1038:L1038)-2.67 -> 25.299999999999997 | N1038: 2.6699999999999999 | O1038: =SUM(M1038:N1038) -> 27.969999999999999
A1039: 4140 | B1039: EOL MONTE VERDE V | C1039: 31.199.661/0002-00 | D1039: 18.309999999999999 | E1039: 0 | F1039: 0 | G1039: 0 | H1039: 0 | I1039: 0 | J1039: 0 | K1039: 20.239999999999998 | L1039: 0 | M1039: =SUM(J1039:L1039)-1.93 -> 18.309999999999999 | N1039: 1.9299999999999999 | O1039: =SUM(M1039:N1039) -> 20.239999999999998
A1040: 4141 | B1040: EOL MONTE VERDE VI | C1040: 31.199.538/0002-81 | D1040: 20.539999999999999 | E1040: 0 | F1040: 0 | G1040: 0 | H1040: 0 | I1040: 0 | J1040: 0 | K1040: 22.710000000000001 | L1040: 0 | M1040: =SUM(J1040:L1040)-2.17 -> 20.539999999999999 | N1040: 2.1699999999999999 | O1040: =SUM(M1040:N1040) -> 22.710000000000001
A1041: 4142 | B1041: UFV SERRA DO MEL I | C1041: 35.835.582/0001-00 | D1041: 57.299999999999997 | E1041: 0 | F1041: 0 | G1041: 0 | H1041: 0 | I1041: 0 | J1041: 0 | K1041: 63.340000000000003 | L1041: 0 | M1041: =SUM(J1041:L1041)-6.04 -> 57.300000000000004 | N1041: 6.04 | O1041: =SUM(M1041:N1041) -> 63.340000000000003
A1042: 4143 | B1042: UFV SERRA DO MEL II | C1042: 35.835.571/0001-20 | D1042: 42.960000000000001 | E1042: 0 | F1042: 0 | G1042: 0 | H1042: 0 | I1042: 0 | J1042: 0 | K1042: 47.490000000000002 | L1042: 0 | M1042: =SUM(J1042:L1042)-4.53 -> 42.960000000000001 | N1042: 4.5300000000000002 | O1042: =SUM(M1042:N1042) -> 47.490000000000002
A1043: 4144 | B1043: EOL BARAÚNAS XX | C1043: 34.986.678/0002-98 | D1043: 15.470000000000001 | E1043: 0 | F1043: 0 | G1043: 0 | H1043: 0 | I1043: 0 | J1043: 0 | K1043: 17.100000000000001 | L1043: 0 | M1043: =SUM(J1043:L1043)-1.63 -> 15.470000000000002 | N1043: 1.6299999999999999 | O1043: =SUM(M1043:N1043) -> 17.100000000000001
A1044: 4145 | B1044: EOL MORRO BRANCO II | C1044: 35.040.621/0002-64 | D1044: 14.76 | E1044: 0 | F1044: 0 | G1044: 0 | H1044: 0 | I1044: 0 | J1044: 0 | K1044: 16.32 | L1044: 0 | M1044: =SUM(J1044:L1044)-1.56 -> 14.76 | N1044: 1.5600000000000001 | O1044: =SUM(M1044:N1044) -> 16.32
A1045: 4146 | B1045: UFV FUTURA 1 | C1045: 37.349.957/0001-58 | D1045: 14.25 | E1045: 0 | F1045: 0 | G1045: 0 | H1045: 0 | I1045: 0 | J1045: 0 | K1045: 15.75 | L1045: 0 | M1045: =SUM(J1045:L1045)-1.5 -> 14.25 | N1045: 1.5 | O1045: =SUM(M1045:N1045) -> 15.75
A1046: 4147 | B1046: UFV FUTURA 2 | C1046: 37.349.957/0001-58 | D1046: 14.369999999999999 | E1046: 0 | F1046: 0 | G1046: 0 | H1046: 0 | I1046: 0 | J1046: 0 | K1046: 15.880000000000001 | L1046: 0 | M1046: =SUM(J1046:L1046)-1.51 -> 14.370000000000001 | N1046: 1.51 | O1046: =SUM(M1046:N1046) -> 15.880000000000001
A1047: 4148 | B1047: UFV FUTURA 3 | C1047: 37.349.957/0001-58 | D1047: 14.220000000000001 | E1047: 0 | F1047: 0 | G1047: 0 | H1047: 0 | I1047: 0 | J1047: 0 | K1047: 15.720000000000001 | L1047: 0 | M1047: =SUM(J1047:L1047)-1.5 -> 14.220000000000001 | N1047: 1.5 | O1047: =SUM(M1047:N1047) -> 15.720000000000001
A1048: 4149 | B1048: UFV FUTURA 4 | C1048: 37.349.957/0001-58 | D1048: 14.31 | E1048: 0 | F1048: 0 | G1048: 0 | H1048: 0 | I1048: 0 | J1048: 0 | K1048: 15.82 | L1048: 0 | M1048: =SUM(J1048:L1048)-1.51 -> 14.31 | N1048: 1.51 | O1048: =SUM(M1048:N1048) -> 15.82
A1049: 4150 | B1049: UFV FUTURA 5 | C1049: 37.349.892/0001-40 | D1049: 14.220000000000001 | E1049: 0 | F1049: 0 | G1049: 0 | H1049: 0 | I1049: 0 | J1049: 0 | K1049: 15.720000000000001 | L1049: 0 | M1049: =SUM(J1049:L1049)-1.5 -> 14.220000000000001 | N1049: 1.5 | O1049: =SUM(M1049:N1049) -> 15.720000000000001
A1050: 4151 | B1050: UFV FUTURA 6 | C1050: 37.349.892/0001-40 | D1050: 14.300000000000001 | E1050: 0 | F1050: 0 | G1050: 0 | H1050: 0 | I1050: 0 | J1050: 0 | K1050: 15.81 | L1050: 0 | M1050: =SUM(J1050:L1050)-1.51 -> 14.300000000000001 | N1050: 1.51 | O1050: =SUM(M1050:N1050) -> 15.81
A1051: 4152 | B1051: UFV FUTURA 7 | C1051: 37.349.892/0001-40 | D1051: 14.220000000000001 | E1051: 0 | F1051: 0 | G1051: 0 | H1051: 0 | I1051: 0 | J1051: 0 | K1051: 15.720000000000001 | L1051: 0 | M1051: =SUM(J1051:L1051)-1.5 -> 14.220000000000001 | N1051: 1.5 | O1051: =SUM(M1051:N1051) -> 15.720000000000001
A1052: 4153 | B1052: UFV FUTURA 8 | C1052: 37.349.892/0001-40 | D1052: 14.31 | E1052: 0 | F1052: 0 | G1052: 0 | H1052: 0 | I1052: 0 | J1052: 0 | K1052: 15.82 | L1052: 0 | M1052: =SUM(J1052:L1052)-1.51 -> 14.31 | N1052: 1.51 | O1052: =SUM(M1052:N1052) -> 15.82
A1053: 4154 | B1053: UFV FUTURA 9 | C1053: 37.350.010/0001-67 | D1053: 14.220000000000001 | E1053: 0 | F1053: 0 | G1053: 0 | H1053: 0 | I1053: 0 | J1053: 0 | K1053: 15.720000000000001 | L1053: 0 | M1053: =SUM(J1053:L1053)-1.5 -> 14.220000000000001 | N1053: 1.5 | O1053: =SUM(M1053:N1053) -> 15.720000000000001
A1054: 4155 | B1054: UFV FUTURA 10 | C1054: 37.350.010/0001-67 | D1054: 14.25 | E1054: 0 | F1054: 0 | G1054: 0 | H1054: 0 | I1054: 0 | J1054: 0 | K1054: 15.75 | L1054: 0 | M1054: =SUM(J1054:L1054)-1.5 -> 14.25 | N1054: 1.5 | O1054: =SUM(M1054:N1054) -> 15.75
A1055: 4156 | B1055: UFV FUTURA 11 | C1055: 37.350.010/0001-67 | D1055: 14.26 | E1055: 0 | F1055: 0 | G1055: 0 | H1055: 0 | I1055: 0 | J1055: 0 | K1055: 15.76 | L1055: 0 | M1055: =SUM(J1055:L1055)-1.5 -> 14.26 | N1055: 1.5 | O1055: =SUM(M1055:N1055) -> 15.76
A1056: 4157 | B1056: UFV FUTURA 12 | C1056: 37.350.010/0001-67 | D1056: 14.279999999999999 | E1056: 0 | F1056: 0 | G1056: 0 | H1056: 0 | I1056: 0 | J1056: 0 | K1056: 15.789999999999999 | L1056: 0 | M1056: =SUM(J1056:L1056)-1.51 -> 14.279999999999999 | N1056: 1.51 | O1056: =SUM(M1056:N1056) -> 15.789999999999999
A1057: 4158 | B1057: UFV FUTURA 13 | C1057: 37.349.956/0001-03 | D1057: 14.220000000000001 | E1057: 0 | F1057: 0 | G1057: 0 | H1057: 0 | I1057: 0 | J1057: 0 | K1057: 15.720000000000001 | L1057: 0 | M1057: =SUM(J1057:L1057)-1.5 -> 14.220000000000001 | N1057: 1.5 | O1057: =SUM(M1057:N1057) -> 15.720000000000001
A1058: 4159 | B1058: UFV FUTURA 14 | C1058: 37.349.956/0001-03 | D1058: 14.220000000000001 | E1058: 0 | F1058: 0 | G1058: 0 | H1058: 0 | I1058: 0 | J1058: 0 | K1058: 15.720000000000001 | L1058: 0 | M1058: =SUM(J1058:L1058)-1.5 -> 14.220000000000001 | N1058: 1.5 | O1058: =SUM(M1058:N1058) -> 15.720000000000001
A1059: 4160 | B1059: UFV FUTURA 15 | C1059: 37.349.956/0001-03 | D1059: 14.23 | E1059: 0 | F1059: 0 | G1059: 0 | H1059: 0 | I1059: 0 | J1059: 0 | K1059: 15.73 | L1059: 0 | M1059: =SUM(J1059:L1059)-1.5 -> 14.23 | N1059: 1.5 | O1059: =SUM(M1059:N1059) -> 15.73
A1060: 4161 | B1060: UFV FUTURA 16 | C1060: 37.349.956/0001-03 | D1060: 14.220000000000001 | E1060: 0 | F1060: 0 | G1060: 0 | H1060: 0 | I1060: 0 | J1060: 0 | K1060: 15.720000000000001 | L1060: 0 | M1060: =SUM(J1060:L1060)-1.5 -> 14.220000000000001 | N1060: 1.5 | O1060: =SUM(M1060:N1060) -> 15.720000000000001
A1061: 4162 | B1061: UFV FUTURA 17 | C1061: 37.349.956/0001-03 | D1061: 14.220000000000001 | E1061: 0 | F1061: 0 | G1061: 0 | H1061: 0 | I1061: 0 | J1061: 0 | K1061: 15.720000000000001 | L1061: 0 | M1061: =SUM(J1061:L1061)-1.5 -> 14.220000000000001 | N1061: 1.5 | O1061: =SUM(M1061:N1061) -> 15.720000000000001
A1062: 4163 | B1062: UFV FUTURA 18 | C1062: 37.349.910/0001-94 | D1062: 14.279999999999999 | E1062: 0 | F1062: 0 | G1062: 0 | H1062: 0 | I1062: 0 | J1062: 0 | K1062: 15.789999999999999 | L1062: 0 | M1062: =SUM(J1062:L1062)-1.51 -> 14.279999999999999 | N1062: 1.51 | O1062: =SUM(M1062:N1062) -> 15.789999999999999
A1063: 4164 | B1063: UFV FUTURA 19 | C1063: 37.349.910/0001-94 | D1063: 14.220000000000001 | E1063: 0 | F1063: 0 | G1063: 0 | H1063: 0 | I1063: 0 | J1063: 0 | K1063: 15.720000000000001 | L1063: 0 | M1063: =SUM(J1063:L1063)-1.5 -> 14.220000000000001 | N1063: 1.5 | O1063: =SUM(M1063:N1063) -> 15.720000000000001
A1064: 4165 | B1064: UFV FUTURA 20 | C1064: 37.349.910/0001-94 | D1064: 14.220000000000001 | E1064: 0 | F1064: 0 | G1064: 0 | H1064: 0 | I1064: 0 | J1064: 0 | K1064: 15.720000000000001 | L1064: 0 | M1064: =SUM(J1064:L1064)-1.5 -> 14.220000000000001 | N1064: 1.5 | O1064: =SUM(M1064:N1064) -> 15.720000000000001
A1065: 4166 | B1065: UFV FUTURA 21 | C1065: 37.576.883/0001-92 | D1065: 14.220000000000001 | E1065: 0 | F1065: 0 | G1065: 0 | H1065: 0 | I1065: 0 | J1065: 0 | K1065: 15.720000000000001 | L1065: 0 | M1065: =SUM(J1065:L1065)-1.5 -> 14.220000000000001 | N1065: 1.5 | O1065: =SUM(M1065:N1065) -> 15.720000000000001
A1066: 4167 | B1066: UFV FUTURA 22 | C1066: 37.576.883/0001-92 | D1066: 14.220000000000001 | E1066: 0 | F1066: 0 | G1066: 0 | H1066: 0 | I1066: 0 | J1066: 0 | K1066: 15.720000000000001 | L1066: 0 | M1066: =SUM(J1066:L1066)-1.5 -> 14.220000000000001 | N1066: 1.5 | O1066: =SUM(M1066:N1066) -> 15.720000000000001
A1067: 4168 | B1067: EOL JANDAIRA I | C1067: 35.823.538/0002-61 | D1067: 4.3899999999999997 | E1067: 0 | F1067: 0 | G1067: 0 | H1067: 0 | I1067: 0 | J1067: 0 | K1067: 4.8499999999999996 | L1067: 0 | M1067: =SUM(J1067:L1067)-0.46 -> 4.3899999999999997 | N1067: 0.46000000000000002 | O1067: =SUM(M1067:N1067) -> 4.8499999999999996
A1068: 4169 | B1068: EOL TUCANO X | C1068: 35.636.816/0001-90 | D1068: 17.600000000000001 | E1068: 0 | F1068: 0 | G1068: 0 | H1068: 0 | I1068: 0 | J1068: 0 | K1068: 19.460000000000001 | L1068: 0 | M1068: =SUM(J1068:L1068)-1.86 -> 17.600000000000001 | N1068: 1.8600000000000001 | O1068: =SUM(M1068:N1068) -> 19.460000000000001
A1069: 4170 | B1069: EOL ACAUÃ I | C1069: 35.842.703/0001-41 | D1069: 11.99 | E1069: 0 | F1069: 0 | G1069: 0 | H1069: 0 | I1069: 0 | J1069: 0 | K1069: 13.25 | L1069: 0 | M1069: =SUM(J1069:L1069)-1.26 -> 11.99 | N1069: 1.26 | O1069: =SUM(M1069:N1069) -> 13.25
A1070: 4171 | B1070: EOL BARAÚNAS XV | C1070: 34.986.689/0002-78 | D1070: 24.07 | E1070: 0 | F1070: 0 | G1070: 0 | H1070: 0 | I1070: 0 | J1070: 0 | K1070: 26.609999999999999 | L1070: 0 | M1070: =SUM(J1070:L1070)-2.54 -> 24.07 | N1070: 2.54 | O1070: =SUM(M1070:N1070) -> 26.609999999999999
A1071: 4172 | B1071: UTE LWARCEL | C1071: 53.943.098/0001-87 | D1071: 2.5299999999999998 | E1071: 0 | F1071: 0 | G1071: 0 | H1071: 0 | I1071: 0 | J1071: 0 | K1071: 2.7999999999999998 | L1071: 0 | M1071: =SUM(J1071:L1071)-0.27 -> 2.5299999999999998 | N1071: 0.27000000000000002 | O1071: =SUM(M1071:N1071) -> 2.7999999999999998
A1072: 4173 | B1072: UFV SERRA DO MEL V | C1072: 39.702.823/0001-02 | D1072: 21.460000000000001 | E1072: 0 | F1072: 0 | G1072: 0 | H1072: 0 | I1072: 0 | J1072: 0 | K1072: 23.719999999999999 | L1072: 0 | M1072: =SUM(J1072:L1072)-2.26 -> 21.460000000000001 | N1072: 2.2599999999999998 | O1072: =SUM(M1072:N1072) -> 23.719999999999999
A1073: 4174 | B1073: UFV SERRA DO MEL VI | C1073: 39.702.834/0001-84 | D1073: 21.460000000000001 | E1073: 0 | F1073: 0 | G1073: 0 | H1073: 0 | I1073: 0 | J1073: 0 | K1073: 23.719999999999999 | L1073: 0 | M1073: =SUM(J1073:L1073)-2.26 -> 21.460000000000001 | N1073: 2.2599999999999998 | O1073: =SUM(M1073:N1073) -> 23.719999999999999
A1074: 4175 | B1074: UFV SERRA DO MEL III | C1074: 39.702.802/0001-89 | D1074: 30.52 | E1074: 0 | F1074: 0 | G1074: 0 | H1074: 0 | I1074: 0 | J1074: 0 | K1074: 33.740000000000002 | L1074: 0 | M1074: =SUM(J1074:L1074)-3.22 -> 30.520000000000003 | N1074: 3.2200000000000002 | O1074: =SUM(M1074:N1074) -> 33.740000000000002
A1075: 4176 | B1075: UFV SERRA DO MEL IV | C1075: 39.702.815/0001-58 | D1075: 29.510000000000002 | E1075: 0 | F1075: 0 | G1075: 0 | H1075: 0 | I1075: 0 | J1075: 0 | K1075: 32.619999999999997 | L1075: 0 | M1075: =SUM(J1075:L1075)-3.11 -> 29.509999999999998 | N1075: 3.1099999999999999 | O1075: =SUM(M1075:N1075) -> 32.619999999999997
A1076: 4177 | B1076: EOL TUCANO III | C1076: 35.836.427/0001-09 | D1076: 17.600000000000001 | E1076: 0 | F1076: 0 | G1076: 0 | H1076: 0 | I1076: 0 | J1076: 0 | K1076: 19.460000000000001 | L1076: 0 | M1076: =SUM(J1076:L1076)-1.86 -> 17.600000000000001 | N1076: 1.8600000000000001 | O1076: =SUM(M1076:N1076) -> 19.460000000000001
A1077: 4178 | B1077: EOL ACAUÃ II | C1077: 35.842.703/0001-41 | D1077: 10 | E1077: 0 | F1077: 0 | G1077: 0 | H1077: 0 | I1077: 0 | J1077: 0 | K1077: 11.050000000000001 | L1077: 0 | M1077: =SUM(J1077:L1077)-1.05 -> 10 | N1077: 1.05 | O1077: =SUM(M1077:N1077) -> 11.050000000000001
A1078: 4179 | B1078: EOL VENTOS DE SÃO ROQUE 01 | C1078: 31.594.049/0001-43 | D1078: 23.079999999999998 | E1078: 0 | F1078: 0 | G1078: 0 | H1078: 0 | I1078: 0 | J1078: 0 | K1078: 25.510000000000002 | L1078: 0 | M1078: =SUM(J1078:L1078)-2.43 -> 23.080000000000002 | N1078: 2.4300000000000002 | O1078: =SUM(M1078:N1078) -> 25.510000000000002
A1079: 4180 | B1079: EOL VENTOS DE SÃO ROQUE 08 | C1079: 31.596.728/0001-51 | D1079: 23.079999999999998 | E1079: 0 | F1079: 0 | G1079: 0 | H1079: 0 | I1079: 0 | J1079: 0 | K1079: 25.510000000000002 | L1079: 0 | M1079: =SUM(J1079:L1079)-2.43 -> 23.080000000000002 | N1079: 2.4300000000000002 | O1079: =SUM(M1079:N1079) -> 25.510000000000002
A1080: 4181 | B1080: EOL VENTOS DE SÃO VITOR 01 | C1080: 35.469.795/0001-66 | D1080: 14.9 | E1080: 0 | F1080: 0 | G1080: 0 | H1080: 0 | I1080: 0 | J1080: 0 | K1080: 16.469999999999999 | L1080: 0 | M1080: =SUM(J1080:L1080)-1.57 -> 14.899999999999999 | N1080: 1.5700000000000001 | O1080: =SUM(M1080:N1080) -> 16.469999999999999
A1081: 4182 | B1081: EOL BAIXA DO SÍTIO | C1081: 35.842.708/0001-74 | D1081: 20.120000000000001 | E1081: 0 | F1081: 0 | G1081: 0 | H1081: 0 | I1081: 0 | J1081: 0 | K1081: 22.239999999999998 | L1081: 0 | M1081: =SUM(J1081:L1081)-2.12 -> 20.119999999999997 | N1081: 2.1200000000000001 | O1081: =SUM(M1081:N1081) -> 22.239999999999998
A1082: 4183 | B1082: EOL BARAÚNAS IV | C1082: 34.986.649/0002-26 | D1082: 20.629999999999999 | E1082: 0 | F1082: 0 | G1082: 0 | H1082: 0 | I1082: 0 | J1082: 0 | K1082: 22.800000000000001 | L1082: 0 | M1082: =SUM(J1082:L1082)-2.17 -> 20.630000000000003 | N1082: 2.1699999999999999 | O1082: =SUM(M1082:N1082) -> 22.800000000000004
A1083: 4184 | B1083: EOL JANDAÍRA II | C1083: 35.824.347/0002-14 | D1083: 10.18 | E1083: 0 | F1083: 0 | G1083: 0 | H1083: 0 | I1083: 0 | J1083: 0 | K1083: 11.25 | L1083: 0 | M1083: =SUM(J1083:L1083)-1.07 -> 10.18 | N1083: 1.0700000000000001 | O1083: =SUM(M1083:N1083) -> 11.25
A1084: 4185 | B1084: EOL JANDAÍRA III | C1084: 35.823.536/0002-72 | D1084: 11.59 | E1084: 0 | F1084: 0 | G1084: 0 | H1084: 0 | I1084: 0 | J1084: 0 | K1084: 12.81 | L1084: 0 | M1084: =SUM(J1084:L1084)-1.22 -> 11.59 | N1084: 1.22 | O1084: =SUM(M1084:N1084) -> 12.81
A1085: 4186 | B1085: EOL JANDAÍRA IV | C1085: 35.823.577/0002-69 | D1085: 11.550000000000001 | E1085: 0 | F1085: 0 | G1085: 0 | H1085: 0 | I1085: 0 | J1085: 0 | K1085: 12.77 | L1085: 0 | M1085: =SUM(J1085:L1085)-1.22 -> 11.549999999999999 | N1085: 1.22 | O1085: =SUM(M1085:N1085) -> 12.77
A1086: 4187 | B1086: UFV LAR DO SOL 1 | C1086: 32.222.320/0001-82 | D1086: 22.34 | E1086: 0 | F1086: 0 | G1086: 0 | H1086: 0 | I1086: 0 | J1086: 0 | K1086: 24.690000000000001 | L1086: 0 | M1086: =SUM(J1086:L1086)-2.35 -> 22.34 | N1086: 2.3500000000000001 | O1086: =SUM(M1086:N1086) -> 24.690000000000001
A1087: 4188 | B1087: UFV LAR DO SOL 2 | C1087: 32.222.320/0001-82 | D1087: 22.34 | E1087: 0 | F1087: 0 | G1087: 0 | H1087: 0 | I1087: 0 | J1087: 0 | K1087: 24.690000000000001 | L1087: 0 | M1087: =SUM(J1087:L1087)-2.35 -> 22.34 | N1087: 2.3500000000000001 | O1087: =SUM(M1087:N1087) -> 24.690000000000001
A1088: 4189 | B1088: UFV LAR DO SOL 7 | C1088: 31.345.445/0001-37 | D1088: 22.34 | E1088: 0 | F1088: 0 | G1088: 0 | H1088: 0 | I1088: 0 | J1088: 0 | K1088: 24.690000000000001 | L1088: 0 | M1088: =SUM(J1088:L1088)-2.35 -> 22.34 | N1088: 2.3500000000000001 | O1088: =SUM(M1088:N1088) -> 24.690000000000001
A1089: 4190 | B1089: UFV LAR DO SOL 8 | C1089: 31.345.445/0001-37 | D1089: 22.34 | E1089: 0 | F1089: 0 | G1089: 0 | H1089: 0 | I1089: 0 | J1089: 0 | K1089: 24.690000000000001 | L1089: 0 | M1089: =SUM(J1089:L1089)-2.35 -> 22.34 | N1089: 2.3500000000000001 | O1089: =SUM(M1089:N1089) -> 24.690000000000001
A1090: 4191 | B1090: UFV LAR DO SOL 9 | C1090: 31.345.569/0001-12 | D1090: 22.34 | E1090: 0 | F1090: 0 | G1090: 0 | H1090: 0 | I1090: 0 | J1090: 0 | K1090: 24.690000000000001 | L1090: 0 | M1090: =SUM(J1090:L1090)-2.35 -> 22.34 | N1090: 2.3500000000000001 | O1090: =SUM(M1090:N1090) -> 24.690000000000001
A1091: 4192 | B1091: UFV LAR DO SOL 10 | C1091: 31.345.569/0001-12 | D1091: 22.34 | E1091: 0 | F1091: 0 | G1091: 0 | H1091: 0 | I1091: 0 | J1091: 0 | K1091: 24.690000000000001 | L1091: 0 | M1091: =SUM(J1091:L1091)-2.35 -> 22.34 | N1091: 2.3500000000000001 | O1091: =SUM(M1091:N1091) -> 24.690000000000001
A1092: 4193 | B1092: EOL TUCANO IV | C1092: 35.836.426/0001-64 | D1092: 17.600000000000001 | E1092: 0 | F1092: 0 | G1092: 0 | H1092: 0 | I1092: 0 | J1092: 0 | K1092: 19.460000000000001 | L1092: 0 | M1092: =SUM(J1092:L1092)-1.86 -> 17.600000000000001 | N1092: 1.8600000000000001 | O1092: =SUM(M1092:N1092) -> 19.460000000000001
A1093: 4194 | B1093: EOL TUCANO XVI | C1093: 35.806.317/0002-85 | D1093: 5.0300000000000002 | E1093: 0 | F1093: 0 | G1093: 0 | H1093: 0 | I1093: 0 | J1093: 0 | K1093: 5.5599999999999996 | L1093: 0 | M1093: =SUM(J1093:L1093)-0.53 -> 5.0299999999999994 | N1093: 0.53000000000000003 | O1093: =SUM(M1093:N1093) -> 5.5599999999999996
A1094: 4195 | B1094: EOL VENTOS DE SÃO ROQUE 02 | C1094: 31.596.667/0001-22 | D1094: 23.079999999999998 | E1094: 0 | F1094: 0 | G1094: 0 | H1094: 0 | I1094: 0 | J1094: 0 | K1094: 25.510000000000002 | L1094: 0 | M1094: =SUM(J1094:L1094)-2.43 -> 23.080000000000002 | N1094: 2.4300000000000002 | O1094: =SUM(M1094:N1094) -> 25.510000000000002
A1095: 4196 | B1095: EOL VENTOS DE SÃO ROQUE 04 | C1095: 31.594.122/0001-87 | D1095: 23.079999999999998 | E1095: 0 | F1095: 0 | G1095: 0 | H1095: 0 | I1095: 0 | J1095: 0 | K1095: 25.510000000000002 | L1095: 0 | M1095: =SUM(J1095:L1095)-2.43 -> 23.080000000000002 | N1095: 2.4300000000000002 | O1095: =SUM(M1095:N1095) -> 25.510000000000002
A1096: 4197 | B1096: EOL VENTOS DE SÃO ROQUE 11 | C1096: 31.595.917/0001-00 | D1096: 23.079999999999998 | E1096: 0 | F1096: 0 | G1096: 0 | H1096: 0 | I1096: 0 | J1096: 0 | K1096: 25.510000000000002 | L1096: 0 | M1096: =SUM(J1096:L1096)-2.43 -> 23.080000000000002 | N1096: 2.4300000000000002 | O1096: =SUM(M1096:N1096) -> 25.510000000000002
A1097: 4198 | B1097: EOL VENTOS DE SÃO ROQUE 16 | C1097: 31.595.857/0001-25 | D1097: 23.079999999999998 | E1097: 0 | F1097: 0 | G1097: 0 | H1097: 0 | I1097: 0 | J1097: 0 | K1097: 25.510000000000002 | L1097: 0 | M1097: =SUM(J1097:L1097)-2.43 -> 23.080000000000002 | N1097: 2.4300000000000002 | O1097: =SUM(M1097:N1097) -> 25.510000000000002
A1098: 4199 | B1098: EOL VENTOS DE SÃO ROQUE 17 | C1098: 31.594.065/0001-36 | D1098: 23.079999999999998 | E1098: 0 | F1098: 0 | G1098: 0 | H1098: 0 | I1098: 0 | J1098: 0 | K1098: 25.510000000000002 | L1098: 0 | M1098: =SUM(J1098:L1098)-2.43 -> 23.080000000000002 | N1098: 2.4300000000000002 | O1098: =SUM(M1098:N1098) -> 25.510000000000002
A1099: 4200 | B1099: EOL VENTOS DE SÃO ROQUE 18 | C1099: 31.596.016/0001-32 | D1099: 23.079999999999998 | E1099: 0 | F1099: 0 | G1099: 0 | H1099: 0 | I1099: 0 | J1099: 0 | K1099: 25.510000000000002 | L1099: 0 | M1099: =SUM(J1099:L1099)-2.43 -> 23.080000000000002 | N1099: 2.4300000000000002 | O1099: =SUM(M1099:N1099) -> 25.510000000000002
A1100: 4201 | B1100: EOL VENTOS DE SANTA EUGÊNIA 02 | C1100: 35.637.246/0002-34 | D1100: 5.1600000000000001 | E1100: 0 | F1100: 0 | G1100: 0 | H1100: 0 | I1100: 0 | J1100: 0 | K1100: 5.7000000000000002 | L1100: 0 | M1100: =SUM(J1100:L1100)-0.54 -> 5.1600000000000001 | N1100: 0.54000000000000004 | O1100: =SUM(M1100:N1100) -> 5.7000000000000002
A1101: 4202 | B1101: EOL VENTOS DE SANTA EUGÊNIA 07 | C1101: 35.637.246/0002-34 | D1101: 7.7400000000000002 | E1101: 0 | F1101: 0 | G1101: 0 | H1101: 0 | I1101: 0 | J1101: 0 | K1101: 8.5600000000000005 | L1101: 0 | M1101: =SUM(J1101:L1101)-0.82 -> 7.7400000000000002 | N1101: 0.81999999999999995 | O1101: =SUM(M1101:N1101) -> 8.5600000000000005
A1102: 4203 | B1102: EOL VENTOS DE SÃO VITOR 02 | C1102: 35.477.401/0001-11 | D1102: 14.67 | E1102: 0 | F1102: 0 | G1102: 0 | H1102: 0 | I1102: 0 | J1102: 0 | K1102: 16.219999999999999 | L1102: 0 | M1102: =SUM(J1102:L1102)-1.55 -> 14.669999999999998 | N1102: 1.55 | O1102: =SUM(M1102:N1102) -> 16.219999999999999
A1103: 4204 | B1103: EOL VENTOS DE SÃO VITOR 03 | C1103: 35.402.454/0001-73 | D1103: 14.9 | E1103: 0 | F1103: 0 | G1103: 0 | H1103: 0 | I1103: 0 | J1103: 0 | K1103: 16.469999999999999 | L1103: 0 | M1103: =SUM(J1103:L1103)-1.57 -> 14.899999999999999 | N1103: 1.5700000000000001 | O1103: =SUM(M1103:N1103) -> 16.469999999999999
A1104: 4205 | B1104: EOL VENTOS DE SÃO VITOR 06 | C1104: 35.402.868/0001-00 | D1104: 14.9 | E1104: 0 | F1104: 0 | G1104: 0 | H1104: 0 | I1104: 0 | J1104: 0 | K1104: 16.469999999999999 | L1104: 0 | M1104: =SUM(J1104:L1104)-1.57 -> 14.899999999999999 | N1104: 1.5700000000000001 | O1104: =SUM(M1104:N1104) -> 16.469999999999999
A1105: 4206 | B1105: EOL TUCANO II | C1105: 35.806.317/0001-02 | D1105: 10.06 | E1105: 0 | F1105: 0 | G1105: 0 | H1105: 0 | I1105: 0 | J1105: 0 | K1105: 11.119999999999999 | L1105: 0 | M1105: =SUM(J1105:L1105)-1.06 -> 10.059999999999999 | N1105: 1.0600000000000001 | O1105: =SUM(M1105:N1105) -> 11.119999999999999
A1106: 4207 | B1106: EOL VENTOS DE SANTA EUGÊNIA 01 | C1106: 35.637.424/0002-27 | D1106: 22.829999999999998 | E1106: 0 | F1106: 0 | G1106: 0 | H1106: 0 | I1106: 0 | J1106: 0 | K1106: 25.239999999999998 | L1106: 0 | M1106: =SUM(J1106:L1106)-2.41 -> 22.829999999999998 | N1106: 2.4100000000000001 | O1106: =SUM(M1106:N1106) -> 25.239999999999998
A1107: 4208 | B1107: EOL VENTOS DE SÃO VITOR 04 | C1107: 35.402.592/0001-52 | D1107: 14.9 | E1107: 0 | F1107: 0 | G1107: 0 | H1107: 0 | I1107: 0 | J1107: 0 | K1107: 16.469999999999999 | L1107: 0 | M1107: =SUM(J1107:L1107)-1.57 -> 14.899999999999999 | N1107: 1.5700000000000001 | O1107: =SUM(M1107:N1107) -> 16.469999999999999
A1108: 4209 | B1108: EOL VENTOS DE SÃO VITOR 05 | C1108: 35.402.703/0001-20 | D1108: 14.9 | E1108: 0 | F1108: 0 | G1108: 0 | H1108: 0 | I1108: 0 | J1108: 0 | K1108: 16.469999999999999 | L1108: 0 | M1108: =SUM(J1108:L1108)-1.57 -> 14.899999999999999 | N1108: 1.5700000000000001 | O1108: =SUM(M1108:N1108) -> 16.469999999999999
A1109: 4210 | B1109: UTE VIANA 1 | C1109: 09.043.782/0004-63 | D1109: 27.699999999999999 | E1109: 0 | F1109: 0 | G1109: 0 | H1109: 0 | I1109: 0 | J1109: 0 | K1109: 30.620000000000001 | L1109: 0 | M1109: =SUM(J1109:L1109)-2.92 -> 27.700000000000003 | N1109: 2.9199999999999999 | O1109: =SUM(M1109:N1109) -> 30.620000000000005
A1110: 4212 | B1110: EOL VENTOS DE SANTO APOLINÁRIO | C1110: 23.037.442/0001-08 | D1110: 17.27 | E1110: 0 | F1110: 0 | G1110: 0 | H1110: 0 | I1110: 0 | J1110: 0 | K1110: 19.09 | L1110: 0 | M1110: =SUM(J1110:L1110)-1.82 -> 17.27 | N1110: 1.8200000000000001 | O1110: =SUM(M1110:N1110) -> 19.09
A1111: 4213 | B1111: EOL VENTOS DE SANTA ALEXANDRINA | C1111: 23.037.493/0001-30 | D1111: 21.629999999999999 | E1111: 0 | F1111: 0 | G1111: 0 | H1111: 0 | I1111: 0 | J1111: 0 | K1111: 23.91 | L1111: 0 | M1111: =SUM(J1111:L1111)-2.28 -> 21.629999999999999 | N1111: 2.2799999999999998 | O1111: =SUM(M1111:N1111) -> 23.91
A1112: 4214 | B1112: EOL VENTOS DE SÃO JOÃO PAULO II | C1112: 23.037.337/0001-79 | D1112: 15.109999999999999 | E1112: 0 | F1112: 0 | G1112: 0 | H1112: 0 | I1112: 0 | J1112: 0 | K1112: 16.699999999999999 | L1112: 0 | M1112: =SUM(J1112:L1112)-1.59 -> 15.109999999999999 | N1112: 1.5900000000000001 | O1112: =SUM(M1112:N1112) -> 16.699999999999999
A1113: 4215 | B1113: UFV JANAUBA 1 | C1113: 37.380.592/0001-24 | D1113: 24.289999999999999 | E1113: 0 | F1113: 0 | G1113: 0 | H1113: 0 | I1113: 0 | J1113: 0 | K1113: 26.850000000000001 | L1113: 0 | M1113: =SUM(J1113:L1113)-2.56 -> 24.290000000000003 | N1113: 2.5600000000000001 | O1113: =SUM(M1113:N1113) -> 26.850000000000001
A1114: 4216 | B1114: UFV JANAUBA 3 | C1114: 37.381.467/0001-39 | D1114: 24.289999999999999 | E1114: 0 | F1114: 0 | G1114: 0 | H1114: 0 | I1114: 0 | J1114: 0 | K1114: 26.850000000000001 | L1114: 0 | M1114: =SUM(J1114:L1114)-2.56 -> 24.290000000000003 | N1114: 2.5600000000000001 | O1114: =SUM(M1114:N1114) -> 26.850000000000001
A1115: 4217 | B1115: UFV JANAUBA 4 | C1115: 37.381.255/0001-51 | D1115: 24.289999999999999 | E1115: 0 | F1115: 0 | G1115: 0 | H1115: 0 | I1115: 0 | J1115: 0 | K1115: 26.850000000000001 | L1115: 0 | M1115: =SUM(J1115:L1115)-2.56 -> 24.290000000000003 | N1115: 2.5600000000000001 | O1115: =SUM(M1115:N1115) -> 26.850000000000001
A1116: 4218 | B1116: EOL VENTOS DE SANTO ANTERO | C1116: 22.246.333/0001-38 | D1116: 23.600000000000001 | E1116: 0 | F1116: 0 | G1116: 0 | H1116: 0 | I1116: 0 | J1116: 0 | K1116: 26.09 | L1116: 0 | M1116: =SUM(J1116:L1116)-2.49 -> 23.600000000000001 | N1116: 2.4900000000000002 | O1116: =SUM(M1116:N1116) -> 26.090000000000003
A1117: 4219 | B1117: EOL VENTOS DE SÃO BERNARDO | C1117: 21.893.166/0001-54 | D1117: 21.219999999999999 | E1117: 0 | F1117: 0 | G1117: 0 | H1117: 0 | I1117: 0 | J1117: 0 | K1117: 23.460000000000001 | L1117: 0 | M1117: =SUM(J1117:L1117)-2.24 -> 21.219999999999999 | N1117: 2.2400000000000002 | O1117: =SUM(M1117:N1117) -> 23.460000000000001
A1118: 4220 | B1118: EOL VENTOS DE SANTA EUGÊNIA 03 | C1118: 35.636.507/0002-00 | D1118: 18.059999999999999 | E1118: 0 | F1118: 0 | G1118: 0 | H1118: 0 | I1118: 0 | J1118: 0 | K1118: 19.960000000000001 | L1118: 0 | M1118: =SUM(J1118:L1118)-1.9 -> 18.060000000000002 | N1118: 1.8999999999999999 | O1118: =SUM(M1118:N1118) -> 19.960000000000001
A1119: 4222 | B1119: EOL OITIS 1 | C1119: 34.211.213/0002-65 | D1119: 23.510000000000002 | E1119: 0 | F1119: 0 | G1119: 0 | H1119: 0 | I1119: 0 | J1119: 0 | K1119: 25.989999999999998 | L1119: 0 | M1119: =SUM(J1119:L1119)-2.48 -> 23.509999999999998 | N1119: 2.48 | O1119: =SUM(M1119:N1119) -> 25.989999999999998
A1120: 4223 | B1120: EOL OITIS 5 | C1120: 34.211.252/0002-62 | D1120: 23.800000000000001 | E1120: 0 | F1120: 0 | G1120: 0 | H1120: 0 | I1120: 0 | J1120: 0 | K1120: 26.309999999999999 | L1120: 0 | M1120: =SUM(J1120:L1120)-2.51 -> 23.799999999999997 | N1120: 2.5099999999999998 | O1120: =SUM(M1120:N1120) -> 26.309999999999995
A1121: 4224 | B1121: EOL OITIS 6 | C1121: 34.211.096/0002-30 | D1121: 23.800000000000001 | E1121: 0 | F1121: 0 | G1121: 0 | H1121: 0 | I1121: 0 | J1121: 0 | K1121: 26.309999999999999 | L1121: 0 | M1121: =SUM(J1121:L1121)-2.51 -> 23.799999999999997 | N1121: 2.5099999999999998 | O1121: =SUM(M1121:N1121) -> 26.309999999999995
A1122: 4225 | B1122: EOL OITIS 7 | C1122: 34.211.395/0002-74 | D1122: 23.800000000000001 | E1122: 0 | F1122: 0 | G1122: 0 | H1122: 0 | I1122: 0 | J1122: 0 | K1122: 26.309999999999999 | L1122: 0 | M1122: =SUM(J1122:L1122)-2.51 -> 23.799999999999997 | N1122: 2.5099999999999998 | O1122: =SUM(M1122:N1122) -> 26.309999999999995
A1123: 4226 | B1123: EOL OITIS 22 | C1123: 34.211.180/0002-53 | D1123: 23.800000000000001 | E1123: 0 | F1123: 0 | G1123: 0 | H1123: 0 | I1123: 0 | J1123: 0 | K1123: 26.309999999999999 | L1123: 0 | M1123: =SUM(J1123:L1123)-2.51 -> 23.799999999999997 | N1123: 2.5099999999999998 | O1123: =SUM(M1123:N1123) -> 26.309999999999995
A1124: 4227 | B1124: EOL AW SÃO JOÃO | C1124: 33.268.331/0001-66 | D1124: 11.539999999999999 | E1124: 0 | F1124: 0 | G1124: 0 | H1124: 0 | I1124: 0 | J1124: 0 | K1124: 12.76 | L1124: 0 | M1124: =SUM(J1124:L1124)-1.22 -> 11.539999999999999 | N1124: 1.22 | O1124: =SUM(M1124:N1124) -> 12.76
A1125: 4228 | B1125: EOL AW SANTA RÉGIA | C1125: 33.268.312/0001-30 | D1125: 17.100000000000001 | E1125: 0 | F1125: 0 | G1125: 0 | H1125: 0 | I1125: 0 | J1125: 0 | K1125: 18.899999999999999 | L1125: 0 | M1125: =SUM(J1125:L1125)-1.8 -> 17.099999999999998 | N1125: 1.8 | O1125: =SUM(M1125:N1125) -> 18.899999999999999
A1126: 4229 | B1126: UFV JANAUBA 2 | C1126: 37.405.455/0001-05 | D1126: 24.289999999999999 | E1126: 0 | F1126: 0 | G1126: 0 | H1126: 0 | I1126: 0 | J1126: 0 | K1126: 26.850000000000001 | L1126: 0 | M1126: =SUM(J1126:L1126)-2.56 -> 24.290000000000003 | N1126: 2.5600000000000001 | O1126: =SUM(M1126:N1126) -> 26.850000000000001
A1127: 4230 | B1127: UFV JANAUBA 9 | C1127: 37.381.180/0001-09 | D1127: 24.289999999999999 | E1127: 0 | F1127: 0 | G1127: 0 | H1127: 0 | I1127: 0 | J1127: 0 | K1127: 26.850000000000001 | L1127: 0 | M1127: =SUM(J1127:L1127)-2.56 -> 24.290000000000003 | N1127: 2.5600000000000001 | O1127: =SUM(M1127:N1127) -> 26.850000000000001
A1128: 4231 | B1128: EOL VENTOS DE SÃO VITOR 07 | C1128: 35.402.953/0001-60 | D1128: 20.870000000000001 | E1128: 0 | F1128: 0 | G1128: 0 | H1128: 0 | I1128: 0 | J1128: 0 | K1128: 23.07 | L1128: 0 | M1128: =SUM(J1128:L1128)-2.2 -> 20.870000000000001 | N1128: 2.2000000000000002 | O1128: =SUM(M1128:N1128) -> 23.07
A1129: 4232 | B1129: EOL VENTOS DE SÃO JANUÁRIO 15 | C1129: 35.865.644/0002-08 | D1129: 4.5800000000000001 | E1129: 0 | F1129: 0 | G1129: 0 | H1129: 0 | I1129: 0 | J1129: 0 | K1129: 5.0599999999999996 | L1129: 0 | M1129: =SUM(J1129:L1129)-0.48 -> 4.5800000000000001 | N1129: 0.47999999999999998 | O1129: =SUM(M1129:N1129) -> 5.0600000000000005
A1130: 4233 | B1130: EOL VENTOS DE SÃO JANUÁRIO 16 | C1130: 35.874.355/0002-75 | D1130: 4.5800000000000001 | E1130: 0 | F1130: 0 | G1130: 0 | H1130: 0 | I1130: 0 | J1130: 0 | K1130: 5.0599999999999996 | L1130: 0 | M1130: =SUM(J1130:L1130)-0.48 -> 4.5800000000000001 | N1130: 0.47999999999999998 | O1130: =SUM(M1130:N1130) -> 5.0600000000000005
A1131: 4234 | B1131: EOL VENTOS DE SÃO JANUÁRIO 17 | C1131: 35.859.013/0002-86 | D1131: 4.5800000000000001 | E1131: 0 | F1131: 0 | G1131: 0 | H1131: 0 | I1131: 0 | J1131: 0 | K1131: 5.0599999999999996 | L1131: 0 | M1131: =SUM(J1131:L1131)-0.48 -> 4.5800000000000001 | N1131: 0.47999999999999998 | O1131: =SUM(M1131:N1131) -> 5.0600000000000005
A1132: 4235 | B1132: EOL VENTOS DE SÃO JANUÁRIO 18 | C1132: 35.865.623/0002-92 | D1132: 4.5800000000000001 | E1132: 0 | F1132: 0 | G1132: 0 | H1132: 0 | I1132: 0 | J1132: 0 | K1132: 5.0599999999999996 | L1132: 0 | M1132: =SUM(J1132:L1132)-0.48 -> 4.5800000000000001 | N1132: 0.47999999999999998 | O1132: =SUM(M1132:N1132) -> 5.0600000000000005
A1133: 4236 | B1133: EOL VENTOS DE SÃO JANUÁRIO 19 | C1133: 35.865.638/0002-50 | D1133: 4.5800000000000001 | E1133: 0 | F1133: 0 | G1133: 0 | H1133: 0 | I1133: 0 | J1133: 0 | K1133: 5.0599999999999996 | L1133: 0 | M1133: =SUM(J1133:L1133)-0.48 -> 4.5800000000000001 | N1133: 0.47999999999999998 | O1133: =SUM(M1133:N1133) -> 5.0600000000000005
A1134: 4237 | B1134: UFV JANAUBA 8 | C1134: 37.381.661/0001-14 | D1134: 24.289999999999999 | E1134: 0 | F1134: 0 | G1134: 0 | H1134: 0 | I1134: 0 | J1134: 0 | K1134: 26.850000000000001 | L1134: 0 | M1134: =SUM(J1134:L1134)-2.56 -> 24.290000000000003 | N1134: 2.5600000000000001 | O1134: =SUM(M1134:N1134) -> 26.850000000000001
A1135: 4238 | B1135: UFV JANAUBA 12 | C1135: 37.381.730/0001-90 | D1135: 24.289999999999999 | E1135: 0 | F1135: 0 | G1135: 0 | H1135: 0 | I1135: 0 | J1135: 0 | K1135: 26.850000000000001 | L1135: 0 | M1135: =SUM(J1135:L1135)-2.56 -> 24.290000000000003 | N1135: 2.5600000000000001 | O1135: =SUM(M1135:N1135) -> 26.850000000000001
A1136: 4239 | B1136: UFV JANAUBA 13 | C1136: 37.405.654/0001-05 | D1136: 24.289999999999999 | E1136: 0 | F1136: 0 | G1136: 0 | H1136: 0 | I1136: 0 | J1136: 0 | K1136: 26.850000000000001 | L1136: 0 | M1136: =SUM(J1136:L1136)-2.56 -> 24.290000000000003 | N1136: 2.5600000000000001 | O1136: =SUM(M1136:N1136) -> 26.850000000000001
A1137: 4240 | B1137: UFV JANAUBA 14 | C1137: 37.380.661/0001-08 | D1137: 24.289999999999999 | E1137: 0 | F1137: 0 | G1137: 0 | H1137: 0 | I1137: 0 | J1137: 0 | K1137: 26.850000000000001 | L1137: 0 | M1137: =SUM(J1137:L1137)-2.56 -> 24.290000000000003 | N1137: 2.5600000000000001 | O1137: =SUM(M1137:N1137) -> 26.850000000000001
A1138: 4241 | B1138: UFV LAVRAS 6 | C1138: 35.306.327/0001-70 | D1138: 10.41 | E1138: 0 | F1138: 0 | G1138: 0 | H1138: 0 | I1138: 0 | J1138: 0 | K1138: 11.51 | L1138: 0 | M1138: =SUM(J1138:L1138)-1.1 -> 10.41 | N1138: 1.1000000000000001 | O1138: =SUM(M1138:N1138) -> 11.51
A1139: 4242 | B1139: UFV LAVRAS 7 | C1139: 35.357.719/0001-69 | D1139: 8.0500000000000007 | E1139: 0 | F1139: 0 | G1139: 0 | H1139: 0 | I1139: 0 | J1139: 0 | K1139: 8.9000000000000004 | L1139: 0 | M1139: =SUM(J1139:L1139)-0.85 -> 8.0500000000000007 | N1139: 0.84999999999999998 | O1139: =SUM(M1139:N1139) -> 8.9000000000000004
A1140: 4243 | B1140: UFV LAVRAS 8 | C1140: 35.357.729/0001-02 | D1140: 8.0500000000000007 | E1140: 0 | F1140: 0 | G1140: 0 | H1140: 0 | I1140: 0 | J1140: 0 | K1140: 8.9000000000000004 | L1140: 0 | M1140: =SUM(J1140:L1140)-0.85 -> 8.0500000000000007 | N1140: 0.84999999999999998 | O1140: =SUM(M1140:N1140) -> 8.9000000000000004
A1141: 4250 | B1141: EOL OITIS 2 | C1141: 34.238.187/0002-69 | D1141: 13.220000000000001 | E1141: 0 | F1141: 0 | G1141: 0 | H1141: 0 | I1141: 0 | J1141: 0 | K1141: 14.609999999999999 | L1141: 0 | M1141: =SUM(J1141:L1141)-1.39 -> 13.219999999999999 | N1141: 1.3899999999999999 | O1141: =SUM(M1141:N1141) -> 14.609999999999999
A1142: 4251 | B1142: EOL VENTOS DE SANTO ALDERICO | C1142: 23.037.528/0001-30 | D1142: 19.460000000000001 | E1142: 0 | F1142: 0 | G1142: 0 | H1142: 0 | I1142: 0 | J1142: 0 | K1142: 21.510000000000002 | L1142: 0 | M1142: =SUM(J1142:L1142)-2.05 -> 19.460000000000001 | N1142: 2.0499999999999998 | O1142: =SUM(M1142:N1142) -> 21.510000000000002
A1143: 4252 | B1143: EOL VENTOS DE SÃO CRISPIM | C1143: 23.037.375/0001-21 | D1143: 23.780000000000001 | E1143: 0 | F1143: 0 | G1143: 0 | H1143: 0 | I1143: 0 | J1143: 0 | K1143: 26.289999999999999 | L1143: 0 | M1143: =SUM(J1143:L1143)-2.51 -> 23.780000000000001 | N1143: 2.5099999999999998 | O1143: =SUM(M1143:N1143) -> 26.289999999999999
A1144: 4253 | B1144: UHE TUCURUÍ | C1144: 00.357.038/0001-16 | D1144: 7136.8699999999999 | E1144: 0 | F1144: 0 | G1144: 0 | H1144: 0 | I1144: 0 | J1144: 0 | K1144: 7889.1899999999996 | L1144: 0 | M1144: =SUM(J1144:L1144)-752.32 -> 7136.8699999999999 | N1144: 752.32000000000005 | O1144: =SUM(M1144:N1144) -> 7889.1899999999996
A1145: 4254 | B1145: UFV RIBEIRO GONÇALVES I | C1145: 31.711.512/0001-90 | D1145: 7.5199999999999996 | E1145: 0 | F1145: 0 | G1145: 0 | H1145: 0 | I1145: 0 | J1145: 0 | K1145: 8.3100000000000005 | L1145: 0 | M1145: =SUM(J1145:L1145)-0.79 -> 7.5200000000000005 | N1145: 0.79000000000000004 | O1145: =SUM(M1145:N1145) -> 8.3100000000000005
A1146: 4255 | B1146: UFV RIBEIRO GONÇALVES II | C1146: 31.711.512/0001-90 | D1146: 17.460000000000001 | E1146: 0 | F1146: 0 | G1146: 0 | H1146: 0 | I1146: 0 | J1146: 0 | K1146: 19.300000000000001 | L1146: 0 | M1146: =SUM(J1146:L1146)-1.84 -> 17.460000000000001 | N1146: 1.8400000000000001 | O1146: =SUM(M1146:N1146) -> 19.300000000000001
A1147: 4256 | B1147: UFV RIBEIRO GONÇALVES III | C1147: 31.711.512/0001-90 | D1147: 17.460000000000001 | E1147: 0 | F1147: 0 | G1147: 0 | H1147: 0 | I1147: 0 | J1147: 0 | K1147: 19.300000000000001 | L1147: 0 | M1147: =SUM(J1147:L1147)-1.84 -> 17.460000000000001 | N1147: 1.8400000000000001 | O1147: =SUM(M1147:N1147) -> 19.300000000000001
A1148: 4257 | B1148: UFV RIBEIRO GONÇALVES IV | C1148: 31.711.512/0001-90 | D1148: 9.5299999999999994 | E1148: 0 | F1148: 0 | G1148: 0 | H1148: 0 | I1148: 0 | J1148: 0 | K1148: 10.529999999999999 | L1148: 0 | M1148: =SUM(J1148:L1148)-1 -> 9.5299999999999994 | N1148: 1 | O1148: =SUM(M1148:N1148) -> 10.529999999999999
A1149: 4258 | B1149: EOL ASSURUÁ 4 I | C1149: 38.112.927/0002-77 | D1149: 17.02 | E1149: 0 | F1149: 0 | G1149: 0 | H1149: 0 | I1149: 0 | J1149: 0 | K1149: 18.809999999999999 | L1149: 0 | M1149: =SUM(J1149:L1149)-1.79 -> 17.02 | N1149: 1.79 | O1149: =SUM(M1149:N1149) -> 18.809999999999999
A1150: 4259 | B1150: EOL ASSURUÁ 4 VI | C1150: 38.049.608/0002-64 | D1150: 17.02 | E1150: 0 | F1150: 0 | G1150: 0 | H1150: 0 | I1150: 0 | J1150: 0 | K1150: 18.809999999999999 | L1150: 0 | M1150: =SUM(J1150:L1150)-1.79 -> 17.02 | N1150: 1.79 | O1150: =SUM(M1150:N1150) -> 18.809999999999999
A1151: 4260 | B1151: UFV JANAUBA 5 | C1151: 37.380.653/0001-53 | D1151: 24.289999999999999 | E1151: 0 | F1151: 0 | G1151: 0 | H1151: 0 | I1151: 0 | J1151: 0 | K1151: 26.850000000000001 | L1151: 0 | M1151: =SUM(J1151:L1151)-2.56 -> 24.290000000000003 | N1151: 2.5600000000000001 | O1151: =SUM(M1151:N1151) -> 26.850000000000001
A1152: 4261 | B1152: UFV JANAUBA 10 | C1152: 37.405.824/0001-51 | D1152: 24.289999999999999 | E1152: 0 | F1152: 0 | G1152: 0 | H1152: 0 | I1152: 0 | J1152: 0 | K1152: 26.850000000000001 | L1152: 0 | M1152: =SUM(J1152:L1152)-2.56 -> 24.290000000000003 | N1152: 2.5600000000000001 | O1152: =SUM(M1152:N1152) -> 26.850000000000001
A1153: 4262 | B1153: EOL OITIS 3 | C1153: 34.238.239/0002-05 | D1153: 23.800000000000001 | E1153: 0 | F1153: 0 | G1153: 0 | H1153: 0 | I1153: 0 | J1153: 0 | K1153: 26.309999999999999 | L1153: 0 | M1153: =SUM(J1153:L1153)-2.51 -> 23.799999999999997 | N1153: 2.5099999999999998 | O1153: =SUM(M1153:N1153) -> 26.309999999999995
A1154: 4263 | B1154: EOL OITIS 8 | C1154: 34.211.894/0002-61 | D1154: 23.510000000000002 | E1154: 0 | F1154: 0 | G1154: 0 | H1154: 0 | I1154: 0 | J1154: 0 | K1154: 25.989999999999998 | L1154: 0 | M1154: =SUM(J1154:L1154)-2.48 -> 23.509999999999998 | N1154: 2.48 | O1154: =SUM(M1154:N1154) -> 25.989999999999998
A1155: 4264 | B1155: EOL OITIS 21 | C1155: 34.211.419/0002-95 | D1155: 21.16 | E1155: 0 | F1155: 0 | G1155: 0 | H1155: 0 | I1155: 0 | J1155: 0 | K1155: 23.390000000000001 | L1155: 0 | M1155: =SUM(J1155:L1155)-2.23 -> 21.16 | N1155: 2.23 | O1155: =SUM(M1155:N1155) -> 23.390000000000001
A1156: 4265 | B1156: EOL VENTOS DE SÃO CIRÍACO | C1156: 23.037.398/0001-36 | D1156: 23.859999999999999 | E1156: 0 | F1156: 0 | G1156: 0 | H1156: 0 | I1156: 0 | J1156: 0 | K1156: 26.379999999999999 | L1156: 0 | M1156: =SUM(J1156:L1156)-2.52 -> 23.859999999999999 | N1156: 2.52 | O1156: =SUM(M1156:N1156) -> 26.379999999999999
A1157: 4266 | B1157: EOL VENTOS DE SÃO CIRO | C1157: 23.037.463/0001-23 | D1157: 17.149999999999999 | E1157: 0 | F1157: 0 | G1157: 0 | H1157: 0 | I1157: 0 | J1157: 0 | K1157: 18.960000000000001 | L1157: 0 | M1157: =SUM(J1157:L1157)-1.81 -> 17.150000000000002 | N1157: 1.8100000000000001 | O1157: =SUM(M1157:N1157) -> 18.960000000000001
A1158: 4267 | B1158: EOL VENTOS DE SANTA EUGÊNIA 12 | C1158: 35.636.507/0002-00 | D1158: 18.050000000000001 | E1158: 0 | F1158: 0 | G1158: 0 | H1158: 0 | I1158: 0 | J1158: 0 | K1158: 19.949999999999999 | L1158: 0 | M1158: =SUM(J1158:L1158)-1.9 -> 18.050000000000001 | N1158: 1.8999999999999999 | O1158: =SUM(M1158:N1158) -> 19.949999999999999
A1159: 4268 | B1159: EOL VENTOS DE SANTA EUGÊNIA 05 | C1159: 35.636.502/0002-79 | D1159: 15.470000000000001 | E1159: 0 | F1159: 0 | G1159: 0 | H1159: 0 | I1159: 0 | J1159: 0 | K1159: 17.100000000000001 | L1159: 0 | M1159: =SUM(J1159:L1159)-1.63 -> 15.470000000000002 | N1159: 1.6299999999999999 | O1159: =SUM(M1159:N1159) -> 17.100000000000001
A1160: 4269 | B1160: RENOVA (EOL QUINA) | C1160: 18.560.032/0001-07 | D1160: 4.3700000000000001 | E1160: 0 | F1160: 0 | G1160: 0 | H1160: 0 | I1160: 0 | J1160: 0 | K1160: 4.8300000000000001 | L1160: 0 | M1160: =SUM(J1160:L1160)-0.46 -> 4.3700000000000001 | N1160: 0.46000000000000002 | O1160: =SUM(M1160:N1160) -> 4.8300000000000001
A1161: 4270 | B1161: RENOVA (EOL MULUNGU) | C1161: 18.560.032/0001-07 | D1161: 5.4900000000000002 | E1161: 0 | F1161: 0 | G1161: 0 | H1161: 0 | I1161: 0 | J1161: 0 | K1161: 6.0700000000000003 | L1161: 0 | M1161: =SUM(J1161:L1161)-0.58 -> 5.4900000000000002 | N1161: 0.57999999999999996 | O1161: =SUM(M1161:N1161) -> 6.0700000000000003
A1162: 4271 | B1162: UFV JANAUBA 6 | C1162: 37.380.936/0001-03 | D1162: 24.289999999999999 | E1162: 0 | F1162: 0 | G1162: 0 | H1162: 0 | I1162: 0 | J1162: 0 | K1162: 26.850000000000001 | L1162: 0 | M1162: =SUM(J1162:L1162)-2.56 -> 24.290000000000003 | N1162: 2.5600000000000001 | O1162: =SUM(M1162:N1162) -> 26.850000000000001
A1163: 4272 | B1163: UFV JANAUBA 7 | C1163: 37.380.859/0001-83 | D1163: 24.289999999999999 | E1163: 0 | F1163: 0 | G1163: 0 | H1163: 0 | I1163: 0 | J1163: 0 | K1163: 26.850000000000001 | L1163: 0 | M1163: =SUM(J1163:L1163)-2.56 -> 24.290000000000003 | N1163: 2.5600000000000001 | O1163: =SUM(M1163:N1163) -> 26.850000000000001
A1164: 4273 | B1164: EOL OITIS 4 | C1164: 34.211.484/0002-10 | D1164: 23.800000000000001 | E1164: 0 | F1164: 0 | G1164: 0 | H1164: 0 | I1164: 0 | J1164: 0 | K1164: 26.309999999999999 | L1164: 0 | M1164: =SUM(J1164:L1164)-2.51 -> 23.799999999999997 | N1164: 2.5099999999999998 | O1164: =SUM(M1164:N1164) -> 26.309999999999995
A1165: 4274 | B1165: EOL VENTOS DE SÃO CAIO | C1165: 23.037.422/0001-37 | D1165: 17.16 | E1165: 0 | F1165: 0 | G1165: 0 | H1165: 0 | I1165: 0 | J1165: 0 | K1165: 18.969999999999999 | L1165: 0 | M1165: =SUM(J1165:L1165)-1.81 -> 17.16 | N1165: 1.8100000000000001 | O1165: =SUM(M1165:N1165) -> 18.969999999999999
A1166: 4275 | B1166: EOL VENTOS DE SÃO VITOR 10 | C1166: 35.403.117/0001-09 | D1166: 21.379999999999999 | E1166: 0 | F1166: 0 | G1166: 0 | H1166: 0 | I1166: 0 | J1166: 0 | K1166: 23.629999999999999 | L1166: 0 | M1166: =SUM(J1166:L1166)-2.25 -> 21.379999999999999 | N1166: 2.25 | O1166: =SUM(M1166:N1166) -> 23.629999999999999
A1167: 4276 | B1167: EOL VENTOS DE SANTA EUGÊNIA 08 | C1167: 35.636.502/0002-79 | D1167: 12.9 | E1167: 0 | F1167: 0 | G1167: 0 | H1167: 0 | I1167: 0 | J1167: 0 | K1167: 14.26 | L1167: 0 | M1167: =SUM(J1167:L1167)-1.36 -> 12.9 | N1167: 1.3600000000000001 | O1167: =SUM(M1167:N1167) -> 14.26
A1168: 4277 | B1168: EOL VENTOS DE SÃO VITOR 11 | C1168: 35.403.207/0001-91 | D1168: 15.27 | E1168: 0 | F1168: 0 | G1168: 0 | H1168: 0 | I1168: 0 | J1168: 0 | K1168: 16.879999999999999 | L1168: 0 | M1168: =SUM(J1168:L1168)-1.61 -> 15.27 | N1168: 1.6100000000000001 | O1168: =SUM(M1168:N1168) -> 16.879999999999999
A1169: 4278 | B1169: EOL SANTO AGOSTINHO 13 | C1169: 20.667.603/0003-10 | D1169: 17.34 | E1169: 0 | F1169: 0 | G1169: 0 | H1169: 0 | I1169: 0 | J1169: 0 | K1169: 19.170000000000002 | L1169: 0 | M1169: =SUM(J1169:L1169)-1.83 -> 17.340000000000003 | N1169: 1.8300000000000001 | O1169: =SUM(M1169:N1169) -> 19.170000000000002
A1170: 4279 | B1170: EOL SANTO AGOSTINHO 26 | C1170: 23.079.885/0002-42 | D1170: 20.23 | E1170: 0 | F1170: 0 | G1170: 0 | H1170: 0 | I1170: 0 | J1170: 0 | K1170: 22.359999999999999 | L1170: 0 | M1170: =SUM(J1170:L1170)-2.13 -> 20.23 | N1170: 2.1299999999999999 | O1170: =SUM(M1170:N1170) -> 22.359999999999999
A1171: 4280 | B1171: EOL VENTOS DE SANTA EUGÊNIA 11 | C1171: 35.639.141/0002-14 | D1171: 12.98 | E1171: 0 | F1171: 0 | G1171: 0 | H1171: 0 | I1171: 0 | J1171: 0 | K1171: 14.35 | L1171: 0 | M1171: =SUM(J1171:L1171)-1.37 -> 12.98 | N1171: 1.3700000000000001 | O1171: =SUM(M1171:N1171) -> 14.350000000000001
A1172: 4283 | B1172: EOL VENTOS DE SANTA EUGÊNIA 13 | C1172: 35.654.188/0002-57 | D1172: 20.620000000000001 | E1172: 0 | F1172: 0 | G1172: 0 | H1172: 0 | I1172: 0 | J1172: 0 | K1172: 22.789999999999999 | L1172: 0 | M1172: =SUM(J1172:L1172)-2.17 -> 20.619999999999997 | N1172: 2.1699999999999999 | O1172: =SUM(M1172:N1172) -> 22.789999999999999
A1173: 4284 | B1173: EOL ANEMUS WIND 1 | C1173: 29.481.536/0001-58 | D1173: 17.239999999999998 | E1173: 0 | F1173: 0 | G1173: 0 | H1173: 0 | I1173: 0 | J1173: 0 | K1173: 19.059999999999999 | L1173: 0 | M1173: =SUM(J1173:L1173)-1.82 -> 17.239999999999998 | N1173: 1.8200000000000001 | O1173: =SUM(M1173:N1173) -> 19.059999999999999
A1174: 4285 | B1174: EOL VENTOS DE SÃO VITOR 09 | C1174: 35.403.066/0001-07 | D1174: 15.27 | E1174: 0 | F1174: 0 | G1174: 0 | H1174: 0 | I1174: 0 | J1174: 0 | K1174: 16.879999999999999 | L1174: 0 | M1174: =SUM(J1174:L1174)-1.61 -> 15.27 | N1174: 1.6100000000000001 | O1174: =SUM(M1174:N1174) -> 16.879999999999999
A1175: 4286 | B1175: UFV JANAUBA 11 | C1175: 37.381.300/0001-78 | D1175: 24.289999999999999 | E1175: 0 | F1175: 0 | G1175: 0 | H1175: 0 | I1175: 0 | J1175: 0 | K1175: 26.850000000000001 | L1175: 0 | M1175: =SUM(J1175:L1175)-2.56 -> 24.290000000000003 | N1175: 2.5600000000000001 | O1175: =SUM(M1175:N1175) -> 26.850000000000001
A1176: 4287 | B1176: EOL OITIS 9 | C1176: 34.211.291/0002-60 | D1176: 23.800000000000001 | E1176: 0 | F1176: 0 | G1176: 0 | H1176: 0 | I1176: 0 | J1176: 0 | K1176: 26.309999999999999 | L1176: 0 | M1176: =SUM(J1176:L1176)-2.51 -> 23.799999999999997 | N1176: 2.5099999999999998 | O1176: =SUM(M1176:N1176) -> 26.309999999999995
A1177: 4288 | B1177: EOL CASA NOVA II | C1177: 33.541.368/0001-16 | D1177: 10.75 | E1177: 0 | F1177: 0 | G1177: 0 | H1177: 0 | I1177: 0 | J1177: 0 | K1177: 11.880000000000001 | L1177: 0 | M1177: =SUM(J1177:L1177)-1.13 -> 10.75 | N1177: 1.1299999999999999 | O1177: =SUM(M1177:N1177) -> 11.879999999999999
A1178: 4289 | B1178: EOL CASA NOVA III | C1178: 33.541.368/0001-16 | D1178: 10.1 | E1178: 0 | F1178: 0 | G1178: 0 | H1178: 0 | I1178: 0 | J1178: 0 | K1178: 11.16 | L1178: 0 | M1178: =SUM(J1178:L1178)-1.06 -> 10.1 | N1178: 1.0600000000000001 | O1178: =SUM(M1178:N1178) -> 11.16
A1179: 4290 | B1179: EOL ASSURUÁ 4 II | C1179: 38.286.402/0002-58 | D1179: 14.890000000000001 | E1179: 0 | F1179: 0 | G1179: 0 | H1179: 0 | I1179: 0 | J1179: 0 | K1179: 16.460000000000001 | L1179: 0 | M1179: =SUM(J1179:L1179)-1.57 -> 14.890000000000001 | N1179: 1.5700000000000001 | O1179: =SUM(M1179:N1179) -> 16.460000000000001
A1180: 4291 | B1180: EOL ASSURUÁ 4 III | C1180: 38.112.944/0002-04 | D1180: 17.02 | E1180: 0 | F1180: 0 | G1180: 0 | H1180: 0 | I1180: 0 | J1180: 0 | K1180: 18.809999999999999 | L1180: 0 | M1180: =SUM(J1180:L1180)-1.79 -> 17.02 | N1180: 1.79 | O1180: =SUM(M1180:N1180) -> 18.809999999999999
A1181: 4292 | B1181: EOL ANEMUS WIND 2 | C1181: 29.492.546/0001-99 | D1181: 21.079999999999998 | E1181: 0 | F1181: 0 | G1181: 0 | H1181: 0 | I1181: 0 | J1181: 0 | K1181: 23.300000000000001 | L1181: 0 | M1181: =SUM(J1181:L1181)-2.22 -> 21.080000000000002 | N1181: 2.2200000000000002 | O1181: =SUM(M1181:N1181) -> 23.300000000000001
A1182: 4293 | B1182: EOL TUCANO IX | C1182: 35.805.346/0001-41 | D1182: 19.18 | E1182: 0 | F1182: 0 | G1182: 0 | H1182: 0 | I1182: 0 | J1182: 0 | K1182: 21.199999999999999 | L1182: 0 | M1182: =SUM(J1182:L1182)-2.02 -> 19.18 | N1182: 2.02 | O1182: =SUM(M1182:N1182) -> 21.199999999999999
A1183: 4294 | B1183: EOL TUCANO XI | C1183: 35.805.346/0001-41 | D1183: 14.390000000000001 | E1183: 0 | F1183: 0 | G1183: 0 | H1183: 0 | I1183: 0 | J1183: 0 | K1183: 15.91 | L1183: 0 | M1183: =SUM(J1183:L1183)-1.52 -> 14.390000000000001 | N1183: 1.52 | O1183: =SUM(M1183:N1183) -> 15.91
A1184: 4295 | B1184: UFV AC III | C1184: 33.592.510/0167-43 | D1184: 22.940000000000001 | E1184: 0 | F1184: 0 | G1184: 0 | H1184: 0 | I1184: 0 | J1184: 0 | K1184: 25.359999999999999 | L1184: 0 | M1184: =SUM(J1184:L1184)-2.42 -> 22.939999999999998 | N1184: 2.4199999999999999 | O1184: =SUM(M1184:N1184) -> 25.359999999999999
A1185: 4296 | B1185: UFV AC IV | C1185: 33.592.510/0167-43 | D1185: 23.899999999999999 | E1185: 0 | F1185: 0 | G1185: 0 | H1185: 0 | I1185: 0 | J1185: 0 | K1185: 26.420000000000002 | L1185: 0 | M1185: =SUM(J1185:L1185)-2.52 -> 23.900000000000002 | N1185: 2.52 | O1185: =SUM(M1185:N1185) -> 26.420000000000002
A1186: 4297 | B1186: UFV AC IX | C1186: 33.592.510/0167-43 | D1186: 14.01 | E1186: 0 | F1186: 0 | G1186: 0 | H1186: 0 | I1186: 0 | J1186: 0 | K1186: 15.49 | L1186: 0 | M1186: =SUM(J1186:L1186)-1.48 -> 14.01 | N1186: 1.48 | O1186: =SUM(M1186:N1186) -> 15.49
A1187: 4298 | B1187: UFV AC V | C1187: 33.592.510/0167-43 | D1187: 23.899999999999999 | E1187: 0 | F1187: 0 | G1187: 0 | H1187: 0 | I1187: 0 | J1187: 0 | K1187: 26.420000000000002 | L1187: 0 | M1187: =SUM(J1187:L1187)-2.52 -> 23.900000000000002 | N1187: 2.52 | O1187: =SUM(M1187:N1187) -> 26.420000000000002
A1188: 4299 | B1188: UFV AC VI | C1188: 33.592.510/0167-43 | D1188: 23.899999999999999 | E1188: 0 | F1188: 0 | G1188: 0 | H1188: 0 | I1188: 0 | J1188: 0 | K1188: 26.420000000000002 | L1188: 0 | M1188: =SUM(J1188:L1188)-2.52 -> 23.900000000000002 | N1188: 2.52 | O1188: =SUM(M1188:N1188) -> 26.420000000000002
A1189: 4300 | B1189: UFV AC VII | C1189: 33.592.510/0167-43 | D1189: 18.68 | E1189: 0 | F1189: 0 | G1189: 0 | H1189: 0 | I1189: 0 | J1189: 0 | K1189: 20.649999999999999 | L1189: 0 | M1189: =SUM(J1189:L1189)-1.97 -> 18.68 | N1189: 1.97 | O1189: =SUM(M1189:N1189) -> 20.649999999999999
A1190: 4301 | B1190: UFV AC VIII | C1190: 33.592.510/0167-43 | D1190: 18.68 | E1190: 0 | F1190: 0 | G1190: 0 | H1190: 0 | I1190: 0 | J1190: 0 | K1190: 20.649999999999999 | L1190: 0 | M1190: =SUM(J1190:L1190)-1.97 -> 18.68 | N1190: 1.97 | O1190: =SUM(M1190:N1190) -> 20.649999999999999
A1191: 4302 | B1191: UFV AC X | C1191: 33.592.510/0167-43 | D1191: 18.68 | E1191: 0 | F1191: 0 | G1191: 0 | H1191: 0 | I1191: 0 | J1191: 0 | K1191: 20.649999999999999 | L1191: 0 | M1191: =SUM(J1191:L1191)-1.97 -> 18.68 | N1191: 1.97 | O1191: =SUM(M1191:N1191) -> 20.649999999999999
A1192: 4303 | B1192: UFV AC XIX | C1192: 33.592.510/0167-43 | D1192: 22.940000000000001 | E1192: 0 | F1192: 0 | G1192: 0 | H1192: 0 | I1192: 0 | J1192: 0 | K1192: 25.359999999999999 | L1192: 0 | M1192: =SUM(J1192:L1192)-2.42 -> 22.939999999999998 | N1192: 2.4199999999999999 | O1192: =SUM(M1192:N1192) -> 25.359999999999999
A1193: 4304 | B1193: UFV AC XV | C1193: 33.592.510/0167-43 | D1193: 29.879999999999999 | E1193: 0 | F1193: 0 | G1193: 0 | H1193: 0 | I1193: 0 | J1193: 0 | K1193: 33.030000000000001 | L1193: 0 | M1193: =SUM(J1193:L1193)-3.15 -> 29.880000000000003 | N1193: 3.1499999999999999 | O1193: =SUM(M1193:N1193) -> 33.030000000000001
A1194: 4305 | B1194: UFV AC XVI | C1194: 33.592.510/0167-43 | D1194: 23.899999999999999 | E1194: 0 | F1194: 0 | G1194: 0 | H1194: 0 | I1194: 0 | J1194: 0 | K1194: 26.420000000000002 | L1194: 0 | M1194: =SUM(J1194:L1194)-2.52 -> 23.900000000000002 | N1194: 2.52 | O1194: =SUM(M1194:N1194) -> 26.420000000000002
A1195: 4306 | B1195: UFV AC XVII | C1195: 33.592.510/0167-43 | D1195: 29.879999999999999 | E1195: 0 | F1195: 0 | G1195: 0 | H1195: 0 | I1195: 0 | J1195: 0 | K1195: 33.030000000000001 | L1195: 0 | M1195: =SUM(J1195:L1195)-3.15 -> 29.880000000000003 | N1195: 3.1499999999999999 | O1195: =SUM(M1195:N1195) -> 33.030000000000001
A1196: 4307 | B1196: UFV AC XVIII | C1196: 33.592.510/0167-43 | D1196: 23.899999999999999 | E1196: 0 | F1196: 0 | G1196: 0 | H1196: 0 | I1196: 0 | J1196: 0 | K1196: 26.420000000000002 | L1196: 0 | M1196: =SUM(J1196:L1196)-2.52 -> 23.900000000000002 | N1196: 2.52 | O1196: =SUM(M1196:N1196) -> 26.420000000000002
A1197: 4308 | B1197: UFV AC XX | C1197: 33.592.510/0167-43 | D1197: 22.940000000000001 | E1197: 0 | F1197: 0 | G1197: 0 | H1197: 0 | I1197: 0 | J1197: 0 | K1197: 25.359999999999999 | L1197: 0 | M1197: =SUM(J1197:L1197)-2.42 -> 22.939999999999998 | N1197: 2.4199999999999999 | O1197: =SUM(M1197:N1197) -> 25.359999999999999
A1198: 4309 | B1198: UFV AC XXI | C1198: 33.592.510/0167-43 | D1198: 23.899999999999999 | E1198: 0 | F1198: 0 | G1198: 0 | H1198: 0 | I1198: 0 | J1198: 0 | K1198: 26.420000000000002 | L1198: 0 | M1198: =SUM(J1198:L1198)-2.52 -> 23.900000000000002 | N1198: 2.52 | O1198: =SUM(M1198:N1198) -> 26.420000000000002
A1199: 4310 | B1199: UFV AC XXII | C1199: 33.592.510/0167-43 | D1199: 23.899999999999999 | E1199: 0 | F1199: 0 | G1199: 0 | H1199: 0 | I1199: 0 | J1199: 0 | K1199: 26.420000000000002 | L1199: 0 | M1199: =SUM(J1199:L1199)-2.52 -> 23.900000000000002 | N1199: 2.52 | O1199: =SUM(M1199:N1199) -> 26.420000000000002
A1200: 4311 | B1200: UFV AC XXIII | C1200: 33.592.510/0167-43 | D1200: 23.899999999999999 | E1200: 0 | F1200: 0 | G1200: 0 | H1200: 0 | I1200: 0 | J1200: 0 | K1200: 26.420000000000002 | L1200: 0 | M1200: =SUM(J1200:L1200)-2.52 -> 23.900000000000002 | N1200: 2.52 | O1200: =SUM(M1200:N1200) -> 26.420000000000002
A1201: 4312 | B1201: EOL SERRA DO SERIDÓ VI | C1201: 35.882.365/0001-71 | D1201: 17.68 | E1201: 0 | F1201: 0 | G1201: 0 | H1201: 0 | I1201: 0 | J1201: 0 | K1201: 19.539999999999999 | L1201: 0 | M1201: =SUM(J1201:L1201)-1.86 -> 17.68 | N1201: 1.8600000000000001 | O1201: =SUM(M1201:N1201) -> 19.539999999999999
A1202: 4313 | B1202: EOL BREJINHOS A | C1202: 33.485.728/0001-00 | D1202: 17.460000000000001 | E1202: 0 | F1202: 0 | G1202: 0 | H1202: 0 | I1202: 0 | J1202: 0 | K1202: 19.300000000000001 | L1202: 0 | M1202: =SUM(J1202:L1202)-1.84 -> 17.460000000000001 | N1202: 1.8400000000000001 | O1202: =SUM(M1202:N1202) -> 19.300000000000001
A1203: 4314 | B1203: EOL BREJINHOS B | C1203: 33.485.874/0001-35 | D1203: 19.399999999999999 | E1203: 0 | F1203: 0 | G1203: 0 | H1203: 0 | I1203: 0 | J1203: 0 | K1203: 21.449999999999999 | L1203: 0 | M1203: =SUM(J1203:L1203)-2.05 -> 19.399999999999999 | N1203: 2.0499999999999998 | O1203: =SUM(M1203:N1203) -> 21.449999999999999
A1204: 4315 | B1204: EOL CAETITE E | C1204: 33.471.379/0001-77 | D1204: 17.460000000000001 | E1204: 0 | F1204: 0 | G1204: 0 | H1204: 0 | I1204: 0 | J1204: 0 | K1204: 19.300000000000001 | L1204: 0 | M1204: =SUM(J1204:L1204)-1.84 -> 17.460000000000001 | N1204: 1.8400000000000001 | O1204: =SUM(M1204:N1204) -> 19.300000000000001
A1205: 4316 | B1205: EOL CAETITE F | C1205: 33.468.809/0001-00 | D1205: 11.640000000000001 | E1205: 0 | F1205: 0 | G1205: 0 | H1205: 0 | I1205: 0 | J1205: 0 | K1205: 12.869999999999999 | L1205: 0 | M1205: =SUM(J1205:L1205)-1.23 -> 11.639999999999999 | N1205: 1.23 | O1205: =SUM(M1205:N1205) -> 12.869999999999999
A1206: 4317 | B1206: EOL ASSURUÁ 4 IV | C1206: 38.050.924/0002-56 | D1206: 17.02 | E1206: 0 | F1206: 0 | G1206: 0 | H1206: 0 | I1206: 0 | J1206: 0 | K1206: 18.809999999999999 | L1206: 0 | M1206: =SUM(J1206:L1206)-1.79 -> 17.02 | N1206: 1.79 | O1206: =SUM(M1206:N1206) -> 18.809999999999999
A1207: 4318 | B1207: EOL ASSURUÁ 4 V | C1207: 38.049.586/0002-32 | D1207: 17.02 | E1207: 0 | F1207: 0 | G1207: 0 | H1207: 0 | I1207: 0 | J1207: 0 | K1207: 18.809999999999999 | L1207: 0 | M1207: =SUM(J1207:L1207)-1.79 -> 17.02 | N1207: 1.79 | O1207: =SUM(M1207:N1207) -> 18.809999999999999
A1208: 4319 | B1208: EOL ANEMUS WIND 3 | C1208: 38.350.307/0001-95 | D1208: 24.91 | E1208: 0 | F1208: 0 | G1208: 0 | H1208: 0 | I1208: 0 | J1208: 0 | K1208: 27.539999999999999 | L1208: 0 | M1208: =SUM(J1208:L1208)-2.63 -> 24.91 | N1208: 2.6299999999999999 | O1208: =SUM(M1208:N1208) -> 27.539999999999999
A1209: 4324 | B1209: UTE MARLIM AZUL | C1209: 29.884.534/0002-90 | D1209: 588.22000000000003 | E1209: 0 | F1209: 0 | G1209: 0 | H1209: 0 | I1209: 0 | J1209: 0 | K1209: 650.23000000000002 | L1209: 0 | M1209: =SUM(J1209:L1209)-62.01 -> 588.22000000000003 | N1209: 62.009999999999998 | O1209: =SUM(M1209:N1209) -> 650.23000000000002
A1210: 4325 | B1210: EOL OITIS 10 | C1210: 34.211.456/0002-01 | D1210: 23.800000000000001 | E1210: 0 | F1210: 0 | G1210: 0 | H1210: 0 | I1210: 0 | J1210: 0 | K1210: 26.309999999999999 | L1210: 0 | M1210: =SUM(J1210:L1210)-2.51 -> 23.799999999999997 | N1210: 2.5099999999999998 | O1210: =SUM(M1210:N1210) -> 26.309999999999995
A1211: 4326 | B1211: EOL SERRA DO SERIDÓ IX | C1211: 35.831.535/0001-99 | D1211: 19.890000000000001 | E1211: 0 | F1211: 0 | G1211: 0 | H1211: 0 | I1211: 0 | J1211: 0 | K1211: 21.989999999999998 | L1211: 0 | M1211: =SUM(J1211:L1211)-2.1 -> 19.889999999999997 | N1211: 2.1000000000000001 | O1211: =SUM(M1211:N1211) -> 21.989999999999998
A1212: 4327 | B1212: EOL VENTOS DE SANTA EUGÊNIA 10 | C1212: 35.654.189/0002-00 | D1212: 20.75 | E1212: 0 | F1212: 0 | G1212: 0 | H1212: 0 | I1212: 0 | J1212: 0 | K1212: 22.940000000000001 | L1212: 0 | M1212: =SUM(J1212:L1212)-2.19 -> 20.75 | N1212: 2.1899999999999999 | O1212: =SUM(M1212:N1212) -> 22.940000000000001
A1213: 4328 | B1213: EOL VENTOS DE SÃO VITOR 08 | C1213: 35.403.030/0001-23 | D1213: 15.27 | E1213: 0 | F1213: 0 | G1213: 0 | H1213: 0 | I1213: 0 | J1213: 0 | K1213: 16.879999999999999 | L1213: 0 | M1213: =SUM(J1213:L1213)-1.61 -> 15.27 | N1213: 1.6100000000000001 | O1213: =SUM(M1213:N1213) -> 16.879999999999999
A1214: 4329 | B1214: EOL VENTOS DE SANTA LEIA 01 | C1214: 35.865.635/0002-17 | D1214: 6.1500000000000004 | E1214: 0 | F1214: 0 | G1214: 0 | H1214: 0 | I1214: 0 | J1214: 0 | K1214: 6.7999999999999998 | L1214: 0 | M1214: =SUM(J1214:L1214)-0.65 -> 6.1499999999999995 | N1214: 0.65000000000000002 | O1214: =SUM(M1214:N1214) -> 6.7999999999999998
A1215: 4330 | B1215: EOL VENTOS DE SANTA LEIA 02 | C1215: 35.865.640/0002-20 | D1215: 6.1500000000000004 | E1215: 0 | F1215: 0 | G1215: 0 | H1215: 0 | I1215: 0 | J1215: 0 | K1215: 6.7999999999999998 | L1215: 0 | M1215: =SUM(J1215:L1215)-0.65 -> 6.1499999999999995 | N1215: 0.65000000000000002 | O1215: =SUM(M1215:N1215) -> 6.7999999999999998
A1216: 4331 | B1216: EOL VENTOS DE SANTA LEIA 03 | C1216: 35.865.651/0002-00 | D1216: 6.1500000000000004 | E1216: 0 | F1216: 0 | G1216: 0 | H1216: 0 | I1216: 0 | J1216: 0 | K1216: 6.7999999999999998 | L1216: 0 | M1216: =SUM(J1216:L1216)-0.65 -> 6.1499999999999995 | N1216: 0.65000000000000002 | O1216: =SUM(M1216:N1216) -> 6.7999999999999998
A1217: 4332 | B1217: EOL VENTOS DE SANTA LEIA 04 | C1217: 35.874.343/0002-40 | D1217: 6.1100000000000003 | E1217: 0 | F1217: 0 | G1217: 0 | H1217: 0 | I1217: 0 | J1217: 0 | K1217: 6.75 | L1217: 0 | M1217: =SUM(J1217:L1217)-0.64 -> 6.1100000000000003 | N1217: 0.64000000000000001 | O1217: =SUM(M1217:N1217) -> 6.75
A1218: 4333 | B1218: EOL VENTOS DE SANTA LEIA 05 | C1218: 35.989.467/0002-71 | D1218: 6.1500000000000004 | E1218: 0 | F1218: 0 | G1218: 0 | H1218: 0 | I1218: 0 | J1218: 0 | K1218: 6.7999999999999998 | L1218: 0 | M1218: =SUM(J1218:L1218)-0.65 -> 6.1499999999999995 | N1218: 0.65000000000000002 | O1218: =SUM(M1218:N1218) -> 6.7999999999999998
A1219: 4334 | B1219: EOL VENTOS DE SANTA LEIA 12 | C1219: 35.859.036/0002-90 | D1219: 5.9100000000000001 | E1219: 0 | F1219: 0 | G1219: 0 | H1219: 0 | I1219: 0 | J1219: 0 | K1219: 6.5300000000000002 | L1219: 0 | M1219: =SUM(J1219:L1219)-0.62 -> 5.9100000000000001 | N1219: 0.62 | O1219: =SUM(M1219:N1219) -> 6.5300000000000002
A1220: 4335 | B1220: EOL VENTOS DE SANTA LEIA 13 | C1220: 35.896.824/0002-57 | D1220: 6.0199999999999996 | E1220: 0 | F1220: 0 | G1220: 0 | H1220: 0 | I1220: 0 | J1220: 0 | K1220: 6.6500000000000004 | L1220: 0 | M1220: =SUM(J1220:L1220)-0.63 -> 6.0200000000000005 | N1220: 0.63 | O1220: =SUM(M1220:N1220) -> 6.6500000000000004
A1221: 4336 | B1221: EOL VENTOS DE SANTA LEIA 14 | C1221: 35.865.649/0002-30 | D1221: 6.0199999999999996 | E1221: 0 | F1221: 0 | G1221: 0 | H1221: 0 | I1221: 0 | J1221: 0 | K1221: 6.6500000000000004 | L1221: 0 | M1221: =SUM(J1221:L1221)-0.63 -> 6.0200000000000005 | N1221: 0.63 | O1221: =SUM(M1221:N1221) -> 6.6500000000000004
A1222: 4337 | B1222: EOL SANTO AGOSTINHO 14 | C1222: 20.666.572/0002-00 | D1222: 2.8900000000000001 | E1222: 0 | F1222: 0 | G1222: 0 | H1222: 0 | I1222: 0 | J1222: 0 | K1222: 3.1899999999999999 | L1222: 0 | M1222: =SUM(J1222:L1222)-0.3 -> 2.8900000000000001 | N1222: 0.29999999999999999 | O1222: =SUM(M1222:N1222) -> 3.1899999999999999
A1223: 4338 | B1223: EOL SANTO AGOSTINHO 25 | C1223: 23.079.920/0002-23 | D1223: 11.56 | E1223: 0 | F1223: 0 | G1223: 0 | H1223: 0 | I1223: 0 | J1223: 0 | K1223: 12.779999999999999 | L1223: 0 | M1223: =SUM(J1223:L1223)-1.22 -> 11.559999999999999 | N1223: 1.22 | O1223: =SUM(M1223:N1223) -> 12.779999999999999
A1224: 4339 | B1224: UFV SERRA DO MATO III | C1224: 36.205.095/0001-27 | D1224: 21.370000000000001 | E1224: 0 | F1224: 0 | G1224: 0 | H1224: 0 | I1224: 0 | J1224: 0 | K1224: 23.620000000000001 | L1224: 0 | M1224: =SUM(J1224:L1224)-2.25 -> 21.370000000000001 | N1224: 2.25 | O1224: =SUM(M1224:N1224) -> 23.620000000000001
A1225: 4340 | B1225: UFV SERRA DO MATO IV | C1225: 36.159.672/0001-91 | D1225: 24.489999999999998 | E1225: 0 | F1225: 0 | G1225: 0 | H1225: 0 | I1225: 0 | J1225: 0 | K1225: 27.07 | L1225: 0 | M1225: =SUM(J1225:L1225)-2.58 -> 24.490000000000002 | N1225: 2.5800000000000001 | O1225: =SUM(M1225:N1225) -> 27.07
A1226: 4341 | B1226: UFV PITOMBEIRA | C1226: 19.382.073/0001-13 | D1226: 21.559999999999999 | E1226: 0 | F1226: 0 | G1226: 0 | H1226: 0 | I1226: 0 | J1226: 0 | K1226: 23.829999999999998 | L1226: 0 | M1226: =SUM(J1226:L1226)-2.27 -> 21.559999999999999 | N1226: 2.27 | O1226: =SUM(M1226:N1226) -> 23.829999999999998
A1227: 4342 | B1227: EOL SANTO AGOSTINHO 17 | C1227: 20.666.636/0002-65 | D1227: 20.23 | E1227: 0 | F1227: 0 | G1227: 0 | H1227: 0 | I1227: 0 | J1227: 0 | K1227: 22.359999999999999 | L1227: 0 | M1227: =SUM(J1227:L1227)-2.13 -> 20.23 | N1227: 2.1299999999999999 | O1227: =SUM(M1227:N1227) -> 22.359999999999999
A1228: 4343 | B1228: EOL VENTOS DE SANTA EUGÊNIA 06 | C1228: 35.636.424/0002-02 | D1228: 15.470000000000001 | E1228: 0 | F1228: 0 | G1228: 0 | H1228: 0 | I1228: 0 | J1228: 0 | K1228: 17.100000000000001 | L1228: 0 | M1228: =SUM(J1228:L1228)-1.63 -> 15.470000000000002 | N1228: 1.6299999999999999 | O1228: =SUM(M1228:N1228) -> 17.100000000000001
A1229: 4344 | B1229: EOL VENTOS DE SANTA EUGÊNIA 09 | C1229: 35.636.427/0002-46 | D1229: 18.050000000000001 | E1229: 0 | F1229: 0 | G1229: 0 | H1229: 0 | I1229: 0 | J1229: 0 | K1229: 19.949999999999999 | L1229: 0 | M1229: =SUM(J1229:L1229)-1.9 -> 18.050000000000001 | N1229: 1.8999999999999999 | O1229: =SUM(M1229:N1229) -> 19.949999999999999
A1230: 4345 | B1230: UFV CIRANDA 1 | C1230: 35.912.298/0001-90 | D1230: 23.079999999999998 | E1230: 0 | F1230: 0 | G1230: 0 | H1230: 0 | I1230: 0 | J1230: 0 | K1230: 25.510000000000002 | L1230: 0 | M1230: =SUM(J1230:L1230)-2.43 -> 23.080000000000002 | N1230: 2.4300000000000002 | O1230: =SUM(M1230:N1230) -> 25.510000000000002
A1231: 4346 | B1231: UFV CIRANDA 2 | C1231: 35.911.733/0001-62 | D1231: 23.079999999999998 | E1231: 0 | F1231: 0 | G1231: 0 | H1231: 0 | I1231: 0 | J1231: 0 | K1231: 25.510000000000002 | L1231: 0 | M1231: =SUM(J1231:L1231)-2.43 -> 23.080000000000002 | N1231: 2.4300000000000002 | O1231: =SUM(M1231:N1231) -> 25.510000000000002
A1232: 4347 | B1232: UFV CIRANDA 3 | C1232: 35.911.730/0001-29 | D1232: 23.079999999999998 | E1232: 0 | F1232: 0 | G1232: 0 | H1232: 0 | I1232: 0 | J1232: 0 | K1232: 25.510000000000002 | L1232: 0 | M1232: =SUM(J1232:L1232)-2.43 -> 23.080000000000002 | N1232: 2.4300000000000002 | O1232: =SUM(M1232:N1232) -> 25.510000000000002
A1233: 4348 | B1233: UFV JANAUBA 15 | C1233: 37.380.978/0001-36 | D1233: 24.289999999999999 | E1233: 0 | F1233: 0 | G1233: 0 | H1233: 0 | I1233: 0 | J1233: 0 | K1233: 26.850000000000001 | L1233: 0 | M1233: =SUM(J1233:L1233)-2.56 -> 24.290000000000003 | N1233: 2.5600000000000001 | O1233: =SUM(M1233:N1233) -> 26.850000000000001
A1234: 4349 | B1234: EOL SERRA DO SERIDO VII | C1234: 35.831.892/0001-57 | D1234: 17.68 | E1234: 0 | F1234: 0 | G1234: 0 | H1234: 0 | I1234: 0 | J1234: 0 | K1234: 19.539999999999999 | L1234: 0 | M1234: =SUM(J1234:L1234)-1.86 -> 17.68 | N1234: 1.8600000000000001 | O1234: =SUM(M1234:N1234) -> 19.539999999999999
A1235: 4350 | B1235: UFV JANAUBA 16 | C1235: 37.381.026/0001-37 | D1235: 24.289999999999999 | E1235: 0 | F1235: 0 | G1235: 0 | H1235: 0 | I1235: 0 | J1235: 0 | K1235: 26.850000000000001 | L1235: 0 | M1235: =SUM(J1235:L1235)-2.56 -> 24.290000000000003 | N1235: 2.5600000000000001 | O1235: =SUM(M1235:N1235) -> 26.850000000000001
A1236: 4351 | B1236: FURNAS-G | C1236: 23.274.194/0001-19 | D1236: 5619.8800000000001 | E1236: 0 | F1236: 0 | G1236: 0 | H1236: 0 | I1236: 0 | J1236: 0 | K1236: 6212.29 | L1236: 0 | M1236: =SUM(J1236:L1236)-592.41 -> 5619.8800000000001 | N1236: 592.40999999999997 | O1236: =SUM(M1236:N1236) -> 6212.29
A1237: 4352 | B1237: UFV JANAUBA 17 | C1237: 37.381.244/0001-71 | D1237: 24.289999999999999 | E1237: 0 | F1237: 0 | G1237: 0 | H1237: 0 | I1237: 0 | J1237: 0 | K1237: 26.850000000000001 | L1237: 0 | M1237: =SUM(J1237:L1237)-2.56 -> 24.290000000000003 | N1237: 2.5600000000000001 | O1237: =SUM(M1237:N1237) -> 26.850000000000001
A1238: 4353 | B1238: UHE SERRA DA MESA | C1238: 23.274.194/0001-19 | D1238: 1002.25 | E1238: 0 | F1238: 0 | G1238: 0 | H1238: 0 | I1238: 0 | J1238: 0 | K1238: 1107.9000000000001 | L1238: 0 | M1238: =SUM(J1238:L1238)-105.65 -> 1002.2500000000001 | N1238: 105.65000000000001 | O1238: =SUM(M1238:N1238) -> 1107.9000000000001
A1239: 4354 | B1239: UFV JANAUBA 18 | C1239: 37.404.973/0001-04 | D1239: 24.289999999999999 | E1239: 0 | F1239: 0 | G1239: 0 | H1239: 0 | I1239: 0 | J1239: 0 | K1239: 26.850000000000001 | L1239: 0 | M1239: =SUM(J1239:L1239)-2.56 -> 24.290000000000003 | N1239: 2.5600000000000001 | O1239: =SUM(M1239:N1239) -> 26.850000000000001
A1240: 4355 | B1240: UFV JANAUBA 19 | C1240: 37.405.468/0001-76 | D1240: 24.289999999999999 | E1240: 0 | F1240: 0 | G1240: 0 | H1240: 0 | I1240: 0 | J1240: 0 | K1240: 26.850000000000001 | L1240: 0 | M1240: =SUM(J1240:L1240)-2.56 -> 24.290000000000003 | N1240: 2.5600000000000001 | O1240: =SUM(M1240:N1240) -> 26.850000000000001
A1241: 4356 | B1241: UFV JANAUBA 20 | C1241: 37.381.136/0001-07 | D1241: 24.289999999999999 | E1241: 0 | F1241: 0 | G1241: 0 | H1241: 0 | I1241: 0 | J1241: 0 | K1241: 26.850000000000001 | L1241: 0 | M1241: =SUM(J1241:L1241)-2.56 -> 24.290000000000003 | N1241: 2.5600000000000001 | O1241: =SUM(M1241:N1241) -> 26.850000000000001
A1242: 4357 | B1242: EOL SERRA DO SERIDO III | C1242: 35.835.835/0001-46 | D1242: 17.68 | E1242: 0 | F1242: 0 | G1242: 0 | H1242: 0 | I1242: 0 | J1242: 0 | K1242: 19.539999999999999 | L1242: 0 | M1242: =SUM(J1242:L1242)-1.86 -> 17.68 | N1242: 1.8600000000000001 | O1242: =SUM(M1242:N1242) -> 19.539999999999999
A1243: 4358 | B1243: EOL VENTOS DE SAO ROQUE 05 | C1243: 36.051.519/0001-46 | D1243: 20.93 | E1243: 0 | F1243: 0 | G1243: 0 | H1243: 0 | I1243: 0 | J1243: 0 | K1243: 23.140000000000001 | L1243: 0 | M1243: =SUM(J1243:L1243)-2.21 -> 20.93 | N1243: 2.21 | O1243: =SUM(M1243:N1243) -> 23.140000000000001
A1244: 4359 | B1244: EOL VENTOS DE SAO ROQUE 03 | C1244: 36.051.515/0001-68 | D1244: 20.93 | E1244: 0 | F1244: 0 | G1244: 0 | H1244: 0 | I1244: 0 | J1244: 0 | K1244: 23.140000000000001 | L1244: 0 | M1244: =SUM(J1244:L1244)-2.21 -> 20.93 | N1244: 2.21 | O1244: =SUM(M1244:N1244) -> 23.140000000000001
A1245: 4360 | B1245: EOL VENTOS DE SAO VITOR 12 | C1245: 35.436.200/0001-76 | D1245: 15.27 | E1245: 0 | F1245: 0 | G1245: 0 | H1245: 0 | I1245: 0 | J1245: 0 | K1245: 16.879999999999999 | L1245: 0 | M1245: =SUM(J1245:L1245)-1.61 -> 15.27 | N1245: 1.6100000000000001 | O1245: =SUM(M1245:N1245) -> 16.879999999999999
A1246: 4361 | B1246: EOL VENTOS DE SAO VITOR 13 | C1246: 35.436.176/0001-75 | D1246: 15 | E1246: 0 | F1246: 0 | G1246: 0 | H1246: 0 | I1246: 0 | J1246: 0 | K1246: 16.579999999999998 | L1246: 0 | M1246: =SUM(J1246:L1246)-1.58 -> 14.999999999999998 | N1246: 1.5800000000000001 | O1246: =SUM(M1246:N1246) -> 16.579999999999998
A1247: 4362 | B1247: EOL VENTOS DE SAO VITOR 14 | C1247: 35.477.384/0001-12 | D1247: 18 | E1247: 0 | F1247: 0 | G1247: 0 | H1247: 0 | I1247: 0 | J1247: 0 | K1247: 19.899999999999999 | L1247: 0 | M1247: =SUM(J1247:L1247)-1.9 -> 18 | N1247: 1.8999999999999999 | O1247: =SUM(M1247:N1247) -> 19.899999999999999
A1248: 4363 | B1248: EOL ASSURUÁ 5 III | C1248: 35.497.092/0002-22 | D1248: 19.370000000000001 | E1248: 0 | F1248: 0 | G1248: 0 | H1248: 0 | I1248: 0 | J1248: 0 | K1248: 21.41 | L1248: 0 | M1248: =SUM(J1248:L1248)-2.04 -> 19.370000000000001 | N1248: 2.04 | O1248: =SUM(M1248:N1248) -> 21.41
A1249: 4364 | B1249: EOL ASSURUÁ 5 V | C1249: 42.929.707/0002-08 | D1249: 16.449999999999999 | E1249: 0 | F1249: 0 | G1249: 0 | H1249: 0 | I1249: 0 | J1249: 0 | K1249: 18.18 | L1249: 0 | M1249: =SUM(J1249:L1249)-1.73 -> 16.449999999999999 | N1249: 1.73 | O1249: =SUM(M1249:N1249) -> 18.18
A1250: 4365 | B1250: EOL AURA TANQUE NOVO 01 | C1250: 35.718.914/0002-58 | D1250: 11.82 | E1250: 0 | F1250: 0 | G1250: 0 | H1250: 0 | I1250: 0 | J1250: 0 | K1250: 13.07 | L1250: 0 | M1250: =SUM(J1250:L1250)-1.25 -> 11.82 | N1250: 1.25 | O1250: =SUM(M1250:N1250) -> 13.07
A1251: 4366 | B1251: EOL AURA TANQUE NOVO 02 | C1251: 35.655.215/0002-06 | D1251: 7.8799999999999999 | E1251: 0 | F1251: 0 | G1251: 0 | H1251: 0 | I1251: 0 | J1251: 0 | K1251: 8.7100000000000009 | L1251: 0 | M1251: =SUM(J1251:L1251)-0.83 -> 7.8800000000000008 | N1251: 0.82999999999999996 | O1251: =SUM(M1251:N1251) -> 8.7100000000000009
A1252: 4367 | B1252: UFV SANTA LUZIA 1 | C1252: 40.585.991/0001-36 | D1252: 21.34 | E1252: 0 | F1252: 0 | G1252: 0 | H1252: 0 | I1252: 0 | J1252: 0 | K1252: 23.59 | L1252: 0 | M1252: =SUM(J1252:L1252)-2.25 -> 21.34 | N1252: 2.25 | O1252: =SUM(M1252:N1252) -> 23.59
A1253: 4368 | B1253: UFV SANTA LUZIA 2 | C1253: 40.586.002/0001-29 | D1253: 21.34 | E1253: 0 | F1253: 0 | G1253: 0 | H1253: 0 | I1253: 0 | J1253: 0 | K1253: 23.59 | L1253: 0 | M1253: =SUM(J1253:L1253)-2.25 -> 21.34 | N1253: 2.25 | O1253: =SUM(M1253:N1253) -> 23.59
A1254: 4369 | B1254: UFV SANTA LUZIA 3 | C1254: 40.586.027/0001-22 | D1254: 21.34 | E1254: 0 | F1254: 0 | G1254: 0 | H1254: 0 | I1254: 0 | J1254: 0 | K1254: 23.59 | L1254: 0 | M1254: =SUM(J1254:L1254)-2.25 -> 21.34 | N1254: 2.25 | O1254: =SUM(M1254:N1254) -> 23.59
A1255: 4370 | B1255: UFV SANTA LUZIA 4 | C1255: 40.586.043/0001-15 | D1255: 21.34 | E1255: 0 | F1255: 0 | G1255: 0 | H1255: 0 | I1255: 0 | J1255: 0 | K1255: 23.59 | L1255: 0 | M1255: =SUM(J1255:L1255)-2.25 -> 21.34 | N1255: 2.25 | O1255: =SUM(M1255:N1255) -> 23.59
A1256: 4371 | B1256: UFV SANTA LUZIA 5 | C1256: 40.790.472/0001-00 | D1256: 15.9 | E1256: 0 | F1256: 0 | G1256: 0 | H1256: 0 | I1256: 0 | J1256: 0 | K1256: 17.579999999999998 | L1256: 0 | M1256: =SUM(J1256:L1256)-1.68 -> 15.899999999999999 | N1256: 1.6799999999999999 | O1256: =SUM(M1256:N1256) -> 17.579999999999998
A1257: 4372 | B1257: UFV SANTA LUZIA 6 | C1257: 40.586.566/0001-61 | D1257: 21.34 | E1257: 0 | F1257: 0 | G1257: 0 | H1257: 0 | I1257: 0 | J1257: 0 | K1257: 23.59 | L1257: 0 | M1257: =SUM(J1257:L1257)-2.25 -> 21.34 | N1257: 2.25 | O1257: =SUM(M1257:N1257) -> 23.59
A1258: 4373 | B1258: UFV SANTA LUZIA 7 | C1258: 40.586.619/0001-44 | D1258: 15.9 | E1258: 0 | F1258: 0 | G1258: 0 | H1258: 0 | I1258: 0 | J1258: 0 | K1258: 17.579999999999998 | L1258: 0 | M1258: =SUM(J1258:L1258)-1.68 -> 15.899999999999999 | N1258: 1.6799999999999999 | O1258: =SUM(M1258:N1258) -> 17.579999999999998
A1259: 4374 | B1259: UTE PROSPERIDADE II | C1259: 23.857.764/0001-01 | D1259: 22.809999999999999 | E1259: 0 | F1259: 0 | G1259: 0 | H1259: 0 | I1259: 0 | J1259: 0 | K1259: 25.210000000000001 | L1259: 0 | M1259: =SUM(J1259:L1259)-2.4 -> 22.810000000000002 | N1259: 2.3999999999999999 | O1259: =SUM(M1259:N1259) -> 25.210000000000001
A1260: 4375 | B1260: UTE PROSPERIDADE III | C1260: 23.857.764/0001-01 | D1260: 27.34 | E1260: 0 | F1260: 0 | G1260: 0 | H1260: 0 | I1260: 0 | J1260: 0 | K1260: 30.219999999999999 | L1260: 0 | M1260: =SUM(J1260:L1260)-2.88 -> 27.34 | N1260: 2.8799999999999999 | O1260: =SUM(M1260:N1260) -> 30.219999999999999
A1261: 4376 | B1261: EOL SANTO AGOSTINHO 27 | C1261: 23.193.334/0002-05 | D1261: 17.34 | E1261: 0 | F1261: 0 | G1261: 0 | H1261: 0 | I1261: 0 | J1261: 0 | K1261: 19.170000000000002 | L1261: 0 | M1261: =SUM(J1261:L1261)-1.83 -> 17.340000000000003 | N1261: 1.8300000000000001 | O1261: =SUM(M1261:N1261) -> 19.170000000000002
A1262: 4377 | B1262: EOL VENTOS DE SANTA EUGÊNIA 14 | C1262: 35.636.427/0002-46 | D1262: 10.380000000000001 | E1262: 0 | F1262: 0 | G1262: 0 | H1262: 0 | I1262: 0 | J1262: 0 | K1262: 11.470000000000001 | L1262: 0 | M1262: =SUM(J1262:L1262)-1.09 -> 10.380000000000001 | N1262: 1.0900000000000001 | O1262: =SUM(M1262:N1262) -> 11.470000000000001
A1263: 4378 | B1263: EOL VENTOS DE SANTA LUZIA 01 | C1263: 41.489.453/0001-00 | D1263: 20.82 | E1263: 0 | F1263: 0 | G1263: 0 | H1263: 0 | I1263: 0 | J1263: 0 | K1263: 23.010000000000002 | L1263: 0 | M1263: =SUM(J1263:L1263)-2.19 -> 20.82 | N1263: 2.1899999999999999 | O1263: =SUM(M1263:N1263) -> 23.010000000000002
A1264: 4379 | B1264: EOL VENTOS DE SAO ROQUE 06 | C1264: 36.677.071/0001-70 | D1264: 20.93 | E1264: 0 | F1264: 0 | G1264: 0 | H1264: 0 | I1264: 0 | J1264: 0 | K1264: 23.140000000000001 | L1264: 0 | M1264: =SUM(J1264:L1264)-2.21 -> 20.93 | N1264: 2.21 | O1264: =SUM(M1264:N1264) -> 23.140000000000001
A1265: 4380 | B1265: EOL VENTOS DE SAO ROQUE 07 | C1265: 36.051.524/0001-59 | D1265: 20.93 | E1265: 0 | F1265: 0 | G1265: 0 | H1265: 0 | I1265: 0 | J1265: 0 | K1265: 23.140000000000001 | L1265: 0 | M1265: =SUM(J1265:L1265)-2.21 -> 20.93 | N1265: 2.21 | O1265: =SUM(M1265:N1265) -> 23.140000000000001
A1266: 4381 | B1266: EOL VENTOS DE SÃO ROQUE 13 | C1266: 31.596.793/0001-87 | D1266: 20.93 | E1266: 0 | F1266: 0 | G1266: 0 | H1266: 0 | I1266: 0 | J1266: 0 | K1266: 23.140000000000001 | L1266: 0 | M1266: =SUM(J1266:L1266)-2.21 -> 20.93 | N1266: 2.21 | O1266: =SUM(M1266:N1266) -> 23.140000000000001
A1267: 4382 | B1267: EOL VENTOS DE SAO ROQUE 19 | C1267: 31.596.421/0001-50 | D1267: 20.93 | E1267: 0 | F1267: 0 | G1267: 0 | H1267: 0 | I1267: 0 | J1267: 0 | K1267: 23.140000000000001 | L1267: 0 | M1267: =SUM(J1267:L1267)-2.21 -> 20.93 | N1267: 2.21 | O1267: =SUM(M1267:N1267) -> 23.140000000000001
A1268: 4383 | B1268: EOL VENTOS DE SAO ROQUE 22 | C1268: 31.596.769/0001-48 | D1268: 20.93 | E1268: 0 | F1268: 0 | G1268: 0 | H1268: 0 | I1268: 0 | J1268: 0 | K1268: 23.140000000000001 | L1268: 0 | M1268: =SUM(J1268:L1268)-2.21 -> 20.93 | N1268: 2.21 | O1268: =SUM(M1268:N1268) -> 23.140000000000001
A1269: 4384 | B1269: EOL VENTOS DE SÃO ROQUE 26 | C1269: 31.594.093/0001-53 | D1269: 20.93 | E1269: 0 | F1269: 0 | G1269: 0 | H1269: 0 | I1269: 0 | J1269: 0 | K1269: 23.140000000000001 | L1269: 0 | M1269: =SUM(J1269:L1269)-2.21 -> 20.93 | N1269: 2.21 | O1269: =SUM(M1269:N1269) -> 23.140000000000001
A1270: 4385 | B1270: EOL VENTOS DE SAO ROQUE 29 | C1270: 31.595.987/0001-68 | D1270: 15.699999999999999 | E1270: 0 | F1270: 0 | G1270: 0 | H1270: 0 | I1270: 0 | J1270: 0 | K1270: 17.350000000000001 | L1270: 0 | M1270: =SUM(J1270:L1270)-1.65 -> 15.700000000000001 | N1270: 1.6499999999999999 | O1270: =SUM(M1270:N1270) -> 17.350000000000001
A1271: 4386 | B1271: UFV LAR DO SOL 3 | C1271: 31.321.803/0001-71 | D1271: 22.34 | E1271: 0 | F1271: 0 | G1271: 0 | H1271: 0 | I1271: 0 | J1271: 0 | K1271: 24.690000000000001 | L1271: 0 | M1271: =SUM(J1271:L1271)-2.35 -> 22.34 | N1271: 2.3500000000000001 | O1271: =SUM(M1271:N1271) -> 24.690000000000001
A1272: 4387 | B1272: UFV LAR DO SOL 4 | C1272: 31.321.803/0001-71 | D1272: 22.34 | E1272: 0 | F1272: 0 | G1272: 0 | H1272: 0 | I1272: 0 | J1272: 0 | K1272: 24.690000000000001 | L1272: 0 | M1272: =SUM(J1272:L1272)-2.35 -> 22.34 | N1272: 2.3500000000000001 | O1272: =SUM(M1272:N1272) -> 24.690000000000001
A1273: 4388 | B1273: UFV LAR DO SOL 5 | C1273: 31.321.885/0001-54 | D1273: 22.34 | E1273: 0 | F1273: 0 | G1273: 0 | H1273: 0 | I1273: 0 | J1273: 0 | K1273: 24.690000000000001 | L1273: 0 | M1273: =SUM(J1273:L1273)-2.35 -> 22.34 | N1273: 2.3500000000000001 | O1273: =SUM(M1273:N1273) -> 24.690000000000001
A1274: 4389 | B1274: UFV LAR DO SOL 6 | C1274: 31.414.665/0001-75 | D1274: 22.34 | E1274: 0 | F1274: 0 | G1274: 0 | H1274: 0 | I1274: 0 | J1274: 0 | K1274: 24.690000000000001 | L1274: 0 | M1274: =SUM(J1274:L1274)-2.35 -> 22.34 | N1274: 2.3500000000000001 | O1274: =SUM(M1274:N1274) -> 24.690000000000001
A1275: 4390 | B1275: EOL SANTO AGOSTINHO 04 | C1275: 20.675.170/0002-64 | D1275: 17.34 | E1275: 0 | F1275: 0 | G1275: 0 | H1275: 0 | I1275: 0 | J1275: 0 | K1275: 19.170000000000002 | L1275: 0 | M1275: =SUM(J1275:L1275)-1.83 -> 17.340000000000003 | N1275: 1.8300000000000001 | O1275: =SUM(M1275:N1275) -> 19.170000000000002
A1276: 4391 | B1276: UFV SANTA LUZIA 9 | C1276: 40.586.767/0001-69 | D1276: 15.619999999999999 | E1276: 0 | F1276: 0 | G1276: 0 | H1276: 0 | I1276: 0 | J1276: 0 | K1276: 17.27 | L1276: 0 | M1276: =SUM(J1276:L1276)-1.65 -> 15.619999999999999 | N1276: 1.6499999999999999 | O1276: =SUM(M1276:N1276) -> 17.27
A1277: 4392 | B1277: EOL AURA CAETITE 01 | C1277: 35.655.205/0002-70 | D1277: 11.65 | E1277: 0 | F1277: 0 | G1277: 0 | H1277: 0 | I1277: 0 | J1277: 0 | K1277: 12.880000000000001 | L1277: 0 | M1277: =SUM(J1277:L1277)-1.23 -> 11.65 | N1277: 1.23 | O1277: =SUM(M1277:N1277) -> 12.880000000000001
A1278: 4393 | B1278: EOL AURA CAETITE 02 | C1278: 35.655.200/0002-48 | D1278: 15.76 | E1278: 0 | F1278: 0 | G1278: 0 | H1278: 0 | I1278: 0 | J1278: 0 | K1278: 17.420000000000002 | L1278: 0 | M1278: =SUM(J1278:L1278)-1.66 -> 15.760000000000002 | N1278: 1.6599999999999999 | O1278: =SUM(M1278:N1278) -> 17.420000000000002
A1279: 4394 | B1279: UTE PORTO DAS ÁGUAS II | C1279: 08.322.396/0001-03 | D1279: 35.759999999999998 | E1279: 0 | F1279: 0 | G1279: 0 | H1279: 0 | I1279: 0 | J1279: 0 | K1279: 39.530000000000001 | L1279: 0 | M1279: =SUM(J1279:L1279)-3.77 -> 35.759999999999998 | N1279: 3.77 | O1279: =SUM(M1279:N1279) -> 39.530000000000001
A1280: 4395 | B1280: EOL AURA CAETITE 03 | C1280: 35.655.028/0002-22 | D1280: 15.76 | E1280: 0 | F1280: 0 | G1280: 0 | H1280: 0 | I1280: 0 | J1280: 0 | K1280: 17.420000000000002 | L1280: 0 | M1280: =SUM(J1280:L1280)-1.66 -> 15.760000000000002 | N1280: 1.6599999999999999 | O1280: =SUM(M1280:N1280) -> 17.420000000000002
A1281: 4396 | B1281: EOL AURA TANQUE NOVO 03 | C1281: 35.655.024/0002-44 | D1281: 5.8200000000000003 | E1281: 0 | F1281: 0 | G1281: 0 | H1281: 0 | I1281: 0 | J1281: 0 | K1281: 6.4299999999999997 | L1281: 0 | M1281: =SUM(J1281:L1281)-0.61 -> 5.8199999999999994 | N1281: 0.60999999999999999 | O1281: =SUM(M1281:N1281) -> 6.4299999999999997
A1282: 4397 | B1282: EOL SERRA DA MANGABEIRA | C1282: 35.924.128/0002-07 | D1282: 37.57 | E1282: 0 | F1282: 0 | G1282: 0 | H1282: 0 | I1282: 0 | J1282: 0 | K1282: 41.530000000000001 | L1282: 0 | M1282: =SUM(J1282:L1282)-3.96 -> 37.57 | N1282: 3.96 | O1282: =SUM(M1282:N1282) -> 41.530000000000001
A1283: 4398 | B1283: UFV SOLAR IRECE 01 | C1283: 25.215.822/0001-10 | D1283: 32.100000000000001 | E1283: 0 | F1283: 0 | G1283: 0 | H1283: 0 | I1283: 0 | J1283: 0 | K1283: 35.479999999999997 | L1283: 0 | M1283: =SUM(J1283:L1283)-3.38 -> 32.099999999999994 | N1283: 3.3799999999999999 | O1283: =SUM(M1283:N1283) -> 35.479999999999997
A1284: 4399 | B1284: UFV DUNAMIS I | C1284: 32.708.258/0001-33 | D1284: 13.210000000000001 | E1284: 0 | F1284: 0 | G1284: 0 | H1284: 0 | I1284: 0 | J1284: 0 | K1284: 14.6 | L1284: 0 | M1284: =SUM(J1284:L1284)-1.39 -> 13.209999999999999 | N1284: 1.3899999999999999 | O1284: =SUM(M1284:N1284) -> 14.6
A1285: 4400 | B1285: UFV DUNAMIS II | C1285: 32.708.258/0001-33 | D1285: 13.210000000000001 | E1285: 0 | F1285: 0 | G1285: 0 | H1285: 0 | I1285: 0 | J1285: 0 | K1285: 14.6 | L1285: 0 | M1285: =SUM(J1285:L1285)-1.39 -> 13.209999999999999 | N1285: 1.3899999999999999 | O1285: =SUM(M1285:N1285) -> 14.6
A1286: 4401 | B1286: UFV DUNAMIS III | C1286: 32.708.258/0001-33 | D1286: 13.210000000000001 | E1286: 0 | F1286: 0 | G1286: 0 | H1286: 0 | I1286: 0 | J1286: 0 | K1286: 14.6 | L1286: 0 | M1286: =SUM(J1286:L1286)-1.39 -> 13.209999999999999 | N1286: 1.3899999999999999 | O1286: =SUM(M1286:N1286) -> 14.6
A1287: 4402 | B1287: UFV DUNAMIS IV | C1287: 32.708.258/0001-33 | D1287: 13.210000000000001 | E1287: 0 | F1287: 0 | G1287: 0 | H1287: 0 | I1287: 0 | J1287: 0 | K1287: 14.6 | L1287: 0 | M1287: =SUM(J1287:L1287)-1.39 -> 13.209999999999999 | N1287: 1.3899999999999999 | O1287: =SUM(M1287:N1287) -> 14.6
A1288: 4403 | B1288: EOL ASSURUA 5 I | C1288: 38.297.095/0002-00 | D1288: 19.190000000000001 | E1288: 0 | F1288: 0 | G1288: 0 | H1288: 0 | I1288: 0 | J1288: 0 | K1288: 21.210000000000001 | L1288: 0 | M1288: =SUM(J1288:L1288)-2.02 -> 19.190000000000001 | N1288: 2.02 | O1288: =SUM(M1288:N1288) -> 21.210000000000001
A1289: 4404 | B1289: EOL ASSURUA 5 VI | C1289: 42.931.551/0002-08 | D1289: 16.449999999999999 | E1289: 0 | F1289: 0 | G1289: 0 | H1289: 0 | I1289: 0 | J1289: 0 | K1289: 18.18 | L1289: 0 | M1289: =SUM(J1289:L1289)-1.73 -> 16.449999999999999 | N1289: 1.73 | O1289: =SUM(M1289:N1289) -> 18.18
A1290: 4405 | B1290: EOL AURA CAETITE 04 | C1290: 35.655.010/0002-20 | D1290: 9.7100000000000009 | E1290: 0 | F1290: 0 | G1290: 0 | H1290: 0 | I1290: 0 | J1290: 0 | K1290: 10.73 | L1290: 0 | M1290: =SUM(J1290:L1290)-1.02 -> 9.7100000000000009 | N1290: 1.02 | O1290: =SUM(M1290:N1290) -> 10.73
A1291: 4406 | B1291: EOL SANTO AGOSTINHO 03 | C1291: 20.675.156/0002-60 | D1291: 5.7800000000000002 | E1291: 0 | F1291: 0 | G1291: 0 | H1291: 0 | I1291: 0 | J1291: 0 | K1291: 6.3899999999999997 | L1291: 0 | M1291: =SUM(J1291:L1291)-0.61 -> 5.7799999999999994 | N1291: 0.60999999999999999 | O1291: =SUM(M1291:N1291) -> 6.3899999999999997
A1292: 4407 | B1292: EOL SANTO AGOSTINHO 05 | C1292: 20.675.180/0002-08 | D1292: 26.010000000000002 | E1292: 0 | F1292: 0 | G1292: 0 | H1292: 0 | I1292: 0 | J1292: 0 | K1292: 28.75 | L1292: 0 | M1292: =SUM(J1292:L1292)-2.74 -> 26.009999999999998 | N1292: 2.7400000000000002 | O1292: =SUM(M1292:N1292) -> 28.75
A1293: 4408 | B1293: EOL SERRA DO SERIDÓ II | C1293: 35.831.799/0001-42 | D1293: 6.6299999999999999 | E1293: 0 | F1293: 0 | G1293: 0 | H1293: 0 | I1293: 0 | J1293: 0 | K1293: 7.3300000000000001 | L1293: 0 | M1293: =SUM(J1293:L1293)-0.7 -> 6.6299999999999999 | N1293: 0.69999999999999996 | O1293: =SUM(M1293:N1293) -> 7.3300000000000001
A1294: 4409 | B1294: EOL SERRA DO SERIDÓ IV | C1294: 35.957.107/0001-07 | D1294: 17.68 | E1294: 0 | F1294: 0 | G1294: 0 | H1294: 0 | I1294: 0 | J1294: 0 | K1294: 19.539999999999999 | L1294: 0 | M1294: =SUM(J1294:L1294)-1.86 -> 17.68 | N1294: 1.8600000000000001 | O1294: =SUM(M1294:N1294) -> 19.539999999999999
A1295: 4410 | B1295: EOL VENTOS DE SANTA LUZIA 02 | C1295: 41.413.101/0002-52 | D1295: 20.82 | E1295: 0 | F1295: 0 | G1295: 0 | H1295: 0 | I1295: 0 | J1295: 0 | K1295: 23.010000000000002 | L1295: 0 | M1295: =SUM(J1295:L1295)-2.19 -> 20.82 | N1295: 2.1899999999999999 | O1295: =SUM(M1295:N1295) -> 23.010000000000002
A1296: 4411 | B1296: EOL BONS VENTOS CACIMBAS 3 | C1296: 19.953.139/0003-40 | D1296: 4.8499999999999996 | E1296: 0 | F1296: 0 | G1296: 0 | H1296: 0 | I1296: 0 | J1296: 0 | K1296: 5.3600000000000003 | L1296: 0 | M1296: =SUM(J1296:L1296)-0.51 -> 4.8500000000000005 | N1296: 0.51000000000000001 | O1296: =SUM(M1296:N1296) -> 5.3600000000000003
A1297: 4412 | B1297: EOL BONS VENTOS CACIMBAS 4 | C1297: 19.953.139/0004-20 | D1297: 3.5 | E1297: 0 | F1297: 0 | G1297: 0 | H1297: 0 | I1297: 0 | J1297: 0 | K1297: 3.8700000000000001 | L1297: 0 | M1297: =SUM(J1297:L1297)-0.37 -> 3.5 | N1297: 0.37 | O1297: =SUM(M1297:N1297) -> 3.8700000000000001
A1298: 4413 | B1298: EOL BONS VENTOS CACIMBAS 5 | C1298: 19.953.139/0005-01 | D1298: 7.0199999999999996 | E1298: 0 | F1298: 0 | G1298: 0 | H1298: 0 | I1298: 0 | J1298: 0 | K1298: 7.7599999999999998 | L1298: 0 | M1298: =SUM(J1298:L1298)-0.74 -> 7.0199999999999996 | N1298: 0.73999999999999999 | O1298: =SUM(M1298:N1298) -> 7.7599999999999998
A1299: 4414 | B1299: EOL BONS VENTOS CACIMBAS 7 | C1299: 19.953.139/0006-92 | D1299: 5.6100000000000003 | E1299: 0 | F1299: 0 | G1299: 0 | H1299: 0 | I1299: 0 | J1299: 0 | K1299: 6.2000000000000002 | L1299: 0 | M1299: =SUM(J1299:L1299)-0.59 -> 5.6100000000000003 | N1299: 0.58999999999999997 | O1299: =SUM(M1299:N1299) -> 6.2000000000000002
A1300: 4415 | B1300: EOL CAETITE D | C1300: 33.457.932/0001-17 | D1300: 21.32 | E1300: 0 | F1300: 0 | G1300: 0 | H1300: 0 | I1300: 0 | J1300: 0 | K1300: 23.57 | L1300: 0 | M1300: =SUM(J1300:L1300)-2.25 -> 21.32 | N1300: 2.25 | O1300: =SUM(M1300:N1300) -> 23.57
A1301: 4429 | B1301: EOL CAJUÍNA A1 | C1301: 36.952.007/0001-50 | D1301: 18.260000000000002 | E1301: 0 | F1301: 0 | G1301: 0 | H1301: 0 | I1301: 0 | J1301: 0 | K1301: 20.18 | L1301: 0 | M1301: =SUM(J1301:L1301)-1.92 -> 18.259999999999998 | N1301: 1.9199999999999999 | O1301: =SUM(M1301:N1301) -> 20.18
A1302: 4430 | B1302: EOL CAJUÍNA A2 | C1302: 36.952.033/0001-89 | D1302: 18.260000000000002 | E1302: 0 | F1302: 0 | G1302: 0 | H1302: 0 | I1302: 0 | J1302: 0 | K1302: 20.18 | L1302: 0 | M1302: =SUM(J1302:L1302)-1.92 -> 18.259999999999998 | N1302: 1.9199999999999999 | O1302: =SUM(M1302:N1302) -> 20.18
A1303: 4431 | B1303: EOL CAJUÍNA A6 | C1303: 36.957.780/0001-00 | D1303: 20.649999999999999 | E1303: 0 | F1303: 0 | G1303: 0 | H1303: 0 | I1303: 0 | J1303: 0 | K1303: 22.829999999999998 | L1303: 0 | M1303: =SUM(J1303:L1303)-2.18 -> 20.649999999999999 | N1303: 2.1800000000000002 | O1303: =SUM(M1303:N1303) -> 22.829999999999998
A1304: 4432 | B1304: UFV MAURITI 1 | C1304: 31.886.399/0002-64 | D1304: 21.800000000000001 | E1304: 0 | F1304: 0 | G1304: 0 | H1304: 0 | I1304: 0 | J1304: 0 | K1304: 24.100000000000001 | L1304: 0 | M1304: =SUM(J1304:L1304)-2.3 -> 21.800000000000001 | N1304: 2.2999999999999998 | O1304: =SUM(M1304:N1304) -> 24.100000000000001
A1305: 4433 | B1305: UFV MAURITI 2 | C1305: 29.103.647/0002-01 | D1305: 10.9 | E1305: 0 | F1305: 0 | G1305: 0 | H1305: 0 | I1305: 0 | J1305: 0 | K1305: 12.050000000000001 | L1305: 0 | M1305: =SUM(J1305:L1305)-1.15 -> 10.9 | N1305: 1.1499999999999999 | O1305: =SUM(M1305:N1305) -> 12.050000000000001
A1306: 4434 | B1306: UFV MAURITI 3 | C1306: 29.168.859/0002-77 | D1306: 21.800000000000001 | E1306: 0 | F1306: 0 | G1306: 0 | H1306: 0 | I1306: 0 | J1306: 0 | K1306: 24.100000000000001 | L1306: 0 | M1306: =SUM(J1306:L1306)-2.3 -> 21.800000000000001 | N1306: 2.2999999999999998 | O1306: =SUM(M1306:N1306) -> 24.100000000000001
A1307: 4435 | B1307: UFV MAURITI 4 | C1307: 29.469.320/0002-58 | D1307: 21.800000000000001 | E1307: 0 | F1307: 0 | G1307: 0 | H1307: 0 | I1307: 0 | J1307: 0 | K1307: 24.100000000000001 | L1307: 0 | M1307: =SUM(J1307:L1307)-2.3 -> 21.800000000000001 | N1307: 2.2999999999999998 | O1307: =SUM(M1307:N1307) -> 24.100000000000001
A1308: 4436 | B1308: UFV MAURITI 5 | C1308: 29.103.664/0002-49 | D1308: 21.800000000000001 | E1308: 0 | F1308: 0 | G1308: 0 | H1308: 0 | I1308: 0 | J1308: 0 | K1308: 24.100000000000001 | L1308: 0 | M1308: =SUM(J1308:L1308)-2.3 -> 21.800000000000001 | N1308: 2.2999999999999998 | O1308: =SUM(M1308:N1308) -> 24.100000000000001
A1309: 4437 | B1309: UFV MAURITI 6 | C1309: 29.103.672/0002-95 | D1309: 21.800000000000001 | E1309: 0 | F1309: 0 | G1309: 0 | H1309: 0 | I1309: 0 | J1309: 0 | K1309: 24.100000000000001 | L1309: 0 | M1309: =SUM(J1309:L1309)-2.3 -> 21.800000000000001 | N1309: 2.2999999999999998 | O1309: =SUM(M1309:N1309) -> 24.100000000000001
A1310: 4438 | B1310: UFV MAURITI 7 | C1310: 31.153.615/0002-62 | D1310: 6.54 | E1310: 0 | F1310: 0 | G1310: 0 | H1310: 0 | I1310: 0 | J1310: 0 | K1310: 7.2300000000000004 | L1310: 0 | M1310: =SUM(J1310:L1310)-0.69 -> 6.5400000000000009 | N1310: 0.68999999999999995 | O1310: =SUM(M1310:N1310) -> 7.2300000000000004
A1311: 4439 | B1311: UFV MAURITI 8 | C1311: 31.159.183/0002-05 | D1311: 21.800000000000001 | E1311: 0 | F1311: 0 | G1311: 0 | H1311: 0 | I1311: 0 | J1311: 0 | K1311: 24.100000000000001 | L1311: 0 | M1311: =SUM(J1311:L1311)-2.3 -> 21.800000000000001 | N1311: 2.2999999999999998 | O1311: =SUM(M1311:N1311) -> 24.100000000000001
A1312: 4440 | B1312: UFV MAURITI 9 | C1312: 31.864.512/0002-00 | D1312: 4.3600000000000003 | E1312: 0 | F1312: 0 | G1312: 0 | H1312: 0 | I1312: 0 | J1312: 0 | K1312: 4.8200000000000003 | L1312: 0 | M1312: =SUM(J1312:L1312)-0.46 -> 4.3600000000000003 | N1312: 0.46000000000000002 | O1312: =SUM(M1312:N1312) -> 4.8200000000000003
A1313: 4441 | B1313: UTE PROSPERIDADE IV | C1313: 23.857.764/0001-01 | D1313: 5.8499999999999996 | E1313: 0 | F1313: 0 | G1313: 0 | H1313: 0 | I1313: 0 | J1313: 0 | K1313: 6.4699999999999998 | L1313: 0 | M1313: =SUM(J1313:L1313)-0.62 -> 5.8499999999999996 | N1313: 0.62 | O1313: =SUM(M1313:N1313) -> 6.4699999999999998
A1314: 4442 | B1314: EOL SANTO AGOSTINHO 06 | C1314: 20.675.196/0002-02 | D1314: 11.56 | E1314: 0 | F1314: 0 | G1314: 0 | H1314: 0 | I1314: 0 | J1314: 0 | K1314: 12.779999999999999 | L1314: 0 | M1314: =SUM(J1314:L1314)-1.22 -> 11.559999999999999 | N1314: 1.22 | O1314: =SUM(M1314:N1314) -> 12.779999999999999
A1315: 4444 | B1315: UTE ASOLO 2 | C1315: 41.675.130/0001-01 | D1315: 18.350000000000001 | E1315: 0 | F1315: 0 | G1315: 0 | H1315: 0 | I1315: 0 | J1315: 0 | K1315: 20.280000000000001 | L1315: 0 | M1315: =SUM(J1315:L1315)-1.93 -> 18.350000000000001 | N1315: 1.9299999999999999 | O1315: =SUM(M1315:N1315) -> 20.280000000000001
A1316: 4445 | B1316: EOL VENTOS DE SANTA LUZIA 03 | C1316: 41.489.491/0002-44 | D1316: 20.82 | E1316: 0 | F1316: 0 | G1316: 0 | H1316: 0 | I1316: 0 | J1316: 0 | K1316: 23.010000000000002 | L1316: 0 | M1316: =SUM(J1316:L1316)-2.19 -> 20.82 | N1316: 2.1899999999999999 | O1316: =SUM(M1316:N1316) -> 23.010000000000002
A1317: 4446 | B1317: UFV SAO FRANCISCO I | C1317: 48.209.587/0001-70 | D1317: 22.219999999999999 | E1317: 0 | F1317: 0 | G1317: 0 | H1317: 0 | I1317: 0 | J1317: 0 | K1317: 24.559999999999999 | L1317: 0 | M1317: =SUM(J1317:L1317)-2.34 -> 22.219999999999999 | N1317: 2.3399999999999999 | O1317: =SUM(M1317:N1317) -> 24.559999999999999
A1318: 4447 | B1318: UFV SAO FRANCISCO II | C1318: 48.346.774/0001-03 | D1318: 22.219999999999999 | E1318: 0 | F1318: 0 | G1318: 0 | H1318: 0 | I1318: 0 | J1318: 0 | K1318: 24.559999999999999 | L1318: 0 | M1318: =SUM(J1318:L1318)-2.34 -> 22.219999999999999 | N1318: 2.3399999999999999 | O1318: =SUM(M1318:N1318) -> 24.559999999999999
A1319: 4448 | B1319: UFV SAO FRANCISCO III | C1319: 48.177.875/0001-90 | D1319: 22.219999999999999 | E1319: 0 | F1319: 0 | G1319: 0 | H1319: 0 | I1319: 0 | J1319: 0 | K1319: 24.559999999999999 | L1319: 0 | M1319: =SUM(J1319:L1319)-2.34 -> 22.219999999999999 | N1319: 2.3399999999999999 | O1319: =SUM(M1319:N1319) -> 24.559999999999999
A1320: 4449 | B1320: UHE PASSO REAL | C1320: 33.042.730/0001-04 | D1320: 86.010000000000005 | E1320: 0 | F1320: 0 | G1320: 0 | H1320: 0 | I1320: 0 | J1320: 0 | K1320: 95.079999999999998 | L1320: 0 | M1320: =SUM(J1320:L1320)-9.07 -> 86.009999999999991 | N1320: 9.0700000000000003 | O1320: =SUM(M1320:N1320) -> 95.079999999999984
A1321: 4451 | B1321: UHE ITAUBA | C1321: 33.042.730/0001-04 | D1321: 350.43000000000001 | E1321: 0 | F1321: 0 | G1321: 0 | H1321: 0 | I1321: 0 | J1321: 0 | K1321: 387.37 | L1321: 0 | M1321: =SUM(J1321:L1321)-36.94 -> 350.43000000000001 | N1321: 36.939999999999998 | O1321: =SUM(M1321:N1321) -> 387.37
A1322: 4459 | B1322: EOL CAJUÍNA A3 | C1322: 36.951.946/0001-80 | D1322: 29.289999999999999 | E1322: 0 | F1322: 0 | G1322: 0 | H1322: 0 | I1322: 0 | J1322: 0 | K1322: 32.380000000000003 | L1322: 0 | M1322: =SUM(J1322:L1322)-3.09 -> 29.290000000000003 | N1322: 3.0899999999999999 | O1322: =SUM(M1322:N1322) -> 32.380000000000003
A1323: 4460 | B1323: EOL CAJUÍNA A4 | C1323: 36.951.974/0001-06 | D1323: 30.760000000000002 | E1323: 0 | F1323: 0 | G1323: 0 | H1323: 0 | I1323: 0 | J1323: 0 | K1323: 34 | L1323: 0 | M1323: =SUM(J1323:L1323)-3.24 -> 30.759999999999998 | N1323: 3.2400000000000002 | O1323: =SUM(M1323:N1323) -> 34
A1324: 4461 | B1324: EOL CAJUÍNA A5 | C1324: 36.957.768/0001-03 | D1324: 31.739999999999998 | E1324: 0 | F1324: 0 | G1324: 0 | H1324: 0 | I1324: 0 | J1324: 0 | K1324: 35.090000000000003 | L1324: 0 | M1324: =SUM(J1324:L1324)-3.35 -> 31.740000000000002 | N1324: 3.3500000000000001 | O1324: =SUM(M1324:N1324) -> 35.090000000000003
A1325: 4462 | B1325: EOL CAJUÍNA A7 | C1325: 36.957.804/0001-20 | D1325: 20.870000000000001 | E1325: 0 | F1325: 0 | G1325: 0 | H1325: 0 | I1325: 0 | J1325: 0 | K1325: 23.07 | L1325: 0 | M1325: =SUM(J1325:L1325)-2.2 -> 20.870000000000001 | N1325: 2.2000000000000002 | O1325: =SUM(M1325:N1325) -> 23.07
A1326: 4463 | B1326: EOL ASSURUÁ 5 II | C1326: 38.297.116/0002-98 | D1326: 21.93 | E1326: 0 | F1326: 0 | G1326: 0 | H1326: 0 | I1326: 0 | J1326: 0 | K1326: 24.239999999999998 | L1326: 0 | M1326: =SUM(J1326:L1326)-2.31 -> 21.93 | N1326: 2.3100000000000001 | O1326: =SUM(M1326:N1326) -> 24.239999999999998
A1327: 4464 | B1327: EOL ASSURUÁ 5 IV | C1327: 42.929.694/0002-77 | D1327: 21.93 | E1327: 0 | F1327: 0 | G1327: 0 | H1327: 0 | I1327: 0 | J1327: 0 | K1327: 24.239999999999998 | L1327: 0 | M1327: =SUM(J1327:L1327)-2.31 -> 21.93 | N1327: 2.3100000000000001 | O1327: =SUM(M1327:N1327) -> 24.239999999999998
A1328: 4465 | B1328: EOL KAIROS WIND 1 | C1328: 42.166.169/0001-66 | D1328: 16.010000000000002 | E1328: 0 | F1328: 0 | G1328: 0 | H1328: 0 | I1328: 0 | J1328: 0 | K1328: 17.699999999999999 | L1328: 0 | M1328: =SUM(J1328:L1328)-1.69 -> 16.009999999999998 | N1328: 1.6899999999999999 | O1328: =SUM(M1328:N1328) -> 17.699999999999999
A1329: 4466 | B1329: UFV NOVA OLINDA 9 | C1329: 23.566.105/0003-70 | D1329: 4.0599999999999996 | E1329: 0 | F1329: 0 | G1329: 0 | H1329: 0 | I1329: 0 | J1329: 0 | K1329: 4.4900000000000002 | L1329: 0 | M1329: =SUM(J1329:L1329)-0.43 -> 4.0600000000000005 | N1329: 0.42999999999999999 | O1329: =SUM(M1329:N1329) -> 4.4900000000000002
A1330: 4467 | B1330: UFV NOVA OLINDA 11 | C1330: 23.416.727/0003-11 | D1330: 4.0599999999999996 | E1330: 0 | F1330: 0 | G1330: 0 | H1330: 0 | I1330: 0 | J1330: 0 | K1330: 4.4900000000000002 | L1330: 0 | M1330: =SUM(J1330:L1330)-0.43 -> 4.0600000000000005 | N1330: 0.42999999999999999 | O1330: =SUM(M1330:N1330) -> 4.4900000000000002
A1331: 4468 | B1331: UFV NOVA OLINDA 13 | C1331: 23.414.549/0003-90 | D1331: 4.0599999999999996 | E1331: 0 | F1331: 0 | G1331: 0 | H1331: 0 | I1331: 0 | J1331: 0 | K1331: 4.4900000000000002 | L1331: 0 | M1331: =SUM(J1331:L1331)-0.43 -> 4.0600000000000005 | N1331: 0.42999999999999999 | O1331: =SUM(M1331:N1331) -> 4.4900000000000002
A1332: 4469 | B1332: UFV LAPA 3 | C1332: 23.509.564/0002-30 | D1332: 4.2800000000000002 | E1332: 0 | F1332: 0 | G1332: 0 | H1332: 0 | I1332: 0 | J1332: 0 | K1332: 4.7300000000000004 | L1332: 0 | M1332: =SUM(J1332:L1332)-0.45 -> 4.2800000000000002 | N1332: 0.45000000000000001 | O1332: =SUM(M1332:N1332) -> 4.7300000000000004
A1333: 4470 | B1333: UFV SANTA LUZIA 8 | C1333: 40.586.796/0001-20 | D1333: 21.34 | E1333: 0 | F1333: 0 | G1333: 0 | H1333: 0 | I1333: 0 | J1333: 0 | K1333: 23.59 | L1333: 0 | M1333: =SUM(J1333:L1333)-2.25 -> 21.34 | N1333: 2.25 | O1333: =SUM(M1333:N1333) -> 23.59
A1334: 4471 | B1334: EOL SANTO AGOSTINHO 18 | C1334: 20.666.659/0002-70 | D1334: 14.449999999999999 | E1334: 0 | F1334: 0 | G1334: 0 | H1334: 0 | I1334: 0 | J1334: 0 | K1334: 15.970000000000001 | L1334: 0 | M1334: =SUM(J1334:L1334)-1.52 -> 14.450000000000001 | N1334: 1.52 | O1334: =SUM(M1334:N1334) -> 15.970000000000001
A1335: 4472 | B1335: EOL SANTO AGOSTINHO 21 | C1335: 20.666.720/0002-89 | D1335: 14.449999999999999 | E1335: 0 | F1335: 0 | G1335: 0 | H1335: 0 | I1335: 0 | J1335: 0 | K1335: 15.970000000000001 | L1335: 0 | M1335: =SUM(J1335:L1335)-1.52 -> 14.450000000000001 | N1335: 1.52 | O1335: =SUM(M1335:N1335) -> 15.970000000000001
A1336: 4473 | B1336: EOL MUNDO NOVO V | C1336: 41.760.884/0001-60 | D1336: 8.9900000000000002 | E1336: 0 | F1336: 0 | G1336: 0 | H1336: 0 | I1336: 0 | J1336: 0 | K1336: 9.9399999999999995 | L1336: 0 | M1336: =SUM(J1336:L1336)-0.95 -> 8.9900000000000002 | N1336: 0.94999999999999996 | O1336: =SUM(M1336:N1336) -> 9.9399999999999995
A1337: 4474 | B1337: EOL MUNDO NOVO VI | C1337: 41.725.168/0001-41 | D1337: 18.109999999999999 | E1337: 0 | F1337: 0 | G1337: 0 | H1337: 0 | I1337: 0 | J1337: 0 | K1337: 20.02 | L1337: 0 | M1337: =SUM(J1337:L1337)-1.91 -> 18.109999999999999 | N1337: 1.9099999999999999 | O1337: =SUM(M1337:N1337) -> 20.02
A1338: 4475 | B1338: EOL MUNDO NOVO VII | C1338: 41.760.915/0001-82 | D1338: 18.109999999999999 | E1338: 0 | F1338: 0 | G1338: 0 | H1338: 0 | I1338: 0 | J1338: 0 | K1338: 20.02 | L1338: 0 | M1338: =SUM(J1338:L1338)-1.91 -> 18.109999999999999 | N1338: 1.9099999999999999 | O1338: =SUM(M1338:N1338) -> 20.02
A1339: 4476 | B1339: EOL CAJUÍNA B9 | C1339: 36.957.862/0001-54 | D1339: 26.16 | E1339: 0 | F1339: 0 | G1339: 0 | H1339: 0 | I1339: 0 | J1339: 0 | K1339: 28.920000000000002 | L1339: 0 | M1339: =SUM(J1339:L1339)-2.76 -> 26.160000000000004 | N1339: 2.7599999999999998 | O1339: =SUM(M1339:N1339) -> 28.920000000000002
A1340: 4477 | B1340: EOL AROEIRA 1 | C1340: 38.094.930/0001-24 | D1340: 21.640000000000001 | E1340: 0 | F1340: 0 | G1340: 0 | H1340: 0 | I1340: 0 | J1340: 0 | K1340: 23.920000000000002 | L1340: 0 | M1340: =SUM(J1340:L1340)-2.28 -> 21.640000000000001 | N1340: 2.2799999999999998 | O1340: =SUM(M1340:N1340) -> 23.920000000000002
A1341: 4478 | B1341: EOL AROEIRA 2 | C1341: 38.130.244/0002-42 | D1341: 19.690000000000001 | E1341: 0 | F1341: 0 | G1341: 0 | H1341: 0 | I1341: 0 | J1341: 0 | K1341: 21.77 | L1341: 0 | M1341: =SUM(J1341:L1341)-2.08 -> 19.689999999999998 | N1341: 2.0800000000000001 | O1341: =SUM(M1341:N1341) -> 21.769999999999996
A1342: 4479 | B1342: EOL AROEIRA 3 | C1342: 39.364.731/0001-51 | D1342: 19.690000000000001 | E1342: 0 | F1342: 0 | G1342: 0 | H1342: 0 | I1342: 0 | J1342: 0 | K1342: 21.77 | L1342: 0 | M1342: =SUM(J1342:L1342)-2.08 -> 19.689999999999998 | N1342: 2.0800000000000001 | O1342: =SUM(M1342:N1342) -> 21.769999999999996
A1343: 4480 | B1343: EOL AROEIRA 4 | C1343: 39.334.976/0001-36 | D1343: 19.690000000000001 | E1343: 0 | F1343: 0 | G1343: 0 | H1343: 0 | I1343: 0 | J1343: 0 | K1343: 21.77 | L1343: 0 | M1343: =SUM(J1343:L1343)-2.08 -> 19.689999999999998 | N1343: 2.0800000000000001 | O1343: =SUM(M1343:N1343) -> 21.769999999999996
A1344: 4481 | B1344: EOL AROEIRA 5 | C1344: 38.091.465/0001-78 | D1344: 19.690000000000001 | E1344: 0 | F1344: 0 | G1344: 0 | H1344: 0 | I1344: 0 | J1344: 0 | K1344: 21.77 | L1344: 0 | M1344: =SUM(J1344:L1344)-2.08 -> 19.689999999999998 | N1344: 2.0800000000000001 | O1344: =SUM(M1344:N1344) -> 21.769999999999996
A1345: 4497 | B1345: EOL SANTO AGOSTINHO 01 | C1345: 20.675.133/0002-56 | D1345: 8.6699999999999999 | E1345: 0 | F1345: 0 | G1345: 0 | H1345: 0 | I1345: 0 | J1345: 0 | K1345: 9.5800000000000001 | L1345: 0 | M1345: =SUM(J1345:L1345)-0.91 -> 8.6699999999999999 | N1345: 0.91000000000000003 | O1345: =SUM(M1345:N1345) -> 9.5800000000000001
A1346: 4498 | B1346: EOL SANTO AGOSTINHO 02 | C1346: 20.675.144/0002-36 | D1346: 14.449999999999999 | E1346: 0 | F1346: 0 | G1346: 0 | H1346: 0 | I1346: 0 | J1346: 0 | K1346: 15.970000000000001 | L1346: 0 | M1346: =SUM(J1346:L1346)-1.52 -> 14.450000000000001 | N1346: 1.52 | O1346: =SUM(M1346:N1346) -> 15.970000000000001
A1347: 4507 | B1347: EOL CAJUÍNA B12 | C1347: 37.002.801/0001-04 | D1347: 18.260000000000002 | E1347: 0 | F1347: 0 | G1347: 0 | H1347: 0 | I1347: 0 | J1347: 0 | K1347: 20.18 | L1347: 0 | M1347: =SUM(J1347:L1347)-1.92 -> 18.259999999999998 | N1347: 1.9199999999999999 | O1347: =SUM(M1347:N1347) -> 20.18
A1348: 4508 | B1348: EOL VENTOS DE SANTA LUZIA 04 | C1348: 41.483.602/0002-05 | D1348: 17.989999999999998 | E1348: 0 | F1348: 0 | G1348: 0 | H1348: 0 | I1348: 0 | J1348: 0 | K1348: 19.890000000000001 | L1348: 0 | M1348: =SUM(J1348:L1348)-1.9 -> 17.990000000000002 | N1348: 1.8999999999999999 | O1348: =SUM(M1348:N1348) -> 19.890000000000001
A1349: 4509 | B1349: EOL AROEIRA 6 | C1349: 38.131.056/0002-39 | D1349: 17.690000000000001 | E1349: 0 | F1349: 0 | G1349: 0 | H1349: 0 | I1349: 0 | J1349: 0 | K1349: 19.550000000000001 | L1349: 0 | M1349: =SUM(J1349:L1349)-1.86 -> 17.690000000000001 | N1349: 1.8600000000000001 | O1349: =SUM(M1349:N1349) -> 19.550000000000001
A1350: 4535 | B1350: ASS CHAFARIZ 2 | C1350: 22.548.637/0002-30 | D1350: 471.68000000000001 | E1350: 0 | F1350: 0 | G1350: 0 | H1350: 0 | I1350: 0 | J1350: 0 | K1350: 521.39999999999998 | L1350: 0 | M1350: =SUM(J1350:L1350)-49.72 -> 471.67999999999995 | N1350: 49.719999999999999 | O1350: =SUM(M1350:N1350) -> 521.39999999999998
A1351: 4536 | B1351: EOL CAJUINA B11 | C1351: 37.020.274/0001-52 | D1351: 30.969999999999999 | E1351: 0 | F1351: 0 | G1351: 0 | H1351: 0 | I1351: 0 | J1351: 0 | K1351: 34.229999999999997 | L1351: 0 | M1351: =SUM(J1351:L1351)-3.26 -> 30.969999999999999 | N1351: 3.2599999999999998 | O1351: =SUM(M1351:N1351) -> 34.229999999999997
A1352: 4537 | B1352: EOL CAJUINA B16 | C1352: 36.957.817/0001-08 | D1352: 7.8300000000000001 | E1352: 0 | F1352: 0 | G1352: 0 | H1352: 0 | I1352: 0 | J1352: 0 | K1352: 8.6600000000000001 | L1352: 0 | M1352: =SUM(J1352:L1352)-0.83 -> 7.8300000000000001 | N1352: 0.82999999999999996 | O1352: =SUM(M1352:N1352) -> 8.6600000000000001
A1353: 4538 | B1353: EOL CAJUINA B18 | C1353: 37.020.270/0001-74 | D1353: 10.44 | E1353: 0 | F1353: 0 | G1353: 0 | H1353: 0 | I1353: 0 | J1353: 0 | K1353: 11.539999999999999 | L1353: 0 | M1353: =SUM(J1353:L1353)-1.1 -> 10.44 | N1353: 1.1000000000000001 | O1353: =SUM(M1353:N1353) -> 11.539999999999999
A1354: 4539 | B1354: EOL CAJUINA C15 | C1354: 36.957.786/0001-87 | D1354: 22.420000000000002 | E1354: 0 | F1354: 0 | G1354: 0 | H1354: 0 | I1354: 0 | J1354: 0 | K1354: 24.780000000000001 | L1354: 0 | M1354: =SUM(J1354:L1354)-2.36 -> 22.420000000000002 | N1354: 2.3599999999999999 | O1354: =SUM(M1354:N1354) -> 24.780000000000001
A1355: 4540 | B1355: EOL CAJUINA C16 | C1355: 36.951.989/0001-66 | D1355: 4.1200000000000001 | E1355: 0 | F1355: 0 | G1355: 0 | H1355: 0 | I1355: 0 | J1355: 0 | K1355: 4.5499999999999998 | L1355: 0 | M1355: =SUM(J1355:L1355)-0.43 -> 4.1200000000000001 | N1355: 0.42999999999999999 | O1355: =SUM(M1355:N1355) -> 4.5499999999999998
A1356: 4541 | B1356: EOL CAJUINA E6 | C1356: 36.952.001/0001-83 | D1356: 28.530000000000001 | E1356: 0 | F1356: 0 | G1356: 0 | H1356: 0 | I1356: 0 | J1356: 0 | K1356: 31.539999999999999 | L1356: 0 | M1356: =SUM(J1356:L1356)-3.01 -> 28.530000000000001 | N1356: 3.0099999999999998 | O1356: =SUM(M1356:N1356) -> 31.539999999999999
A1357: 4558 | B1357: EOL SÃO RICARDO 01 | C1357: 37.053.489/0001-70 | D1357: 10.91 | E1357: 0 | F1357: 0 | G1357: 0 | H1357: 0 | I1357: 0 | J1357: 0 | K1357: 12.06 | L1357: 0 | M1357: =SUM(J1357:L1357)-1.15 -> 10.91 | N1357: 1.1499999999999999 | O1357: =SUM(M1357:N1357) -> 12.06
A1358: 4559 | B1358: EOL SÃO RICARDO 02 | C1358: 37.002.800/0001-51 | D1358: 13.640000000000001 | E1358: 0 | F1358: 0 | G1358: 0 | H1358: 0 | I1358: 0 | J1358: 0 | K1358: 15.08 | L1358: 0 | M1358: =SUM(J1358:L1358)-1.44 -> 13.640000000000001 | N1358: 1.4399999999999999 | O1358: =SUM(M1358:N1358) -> 15.08
A1359: 4560 | B1359: EOL CAJUÍNA B14 | C1359: 36.957.823/0001-57 | D1359: 23.710000000000001 | E1359: 0 | F1359: 0 | G1359: 0 | H1359: 0 | I1359: 0 | J1359: 0 | K1359: 26.210000000000001 | L1359: 0 | M1359: =SUM(J1359:L1359)-2.5 -> 23.710000000000001 | N1359: 2.5 | O1359: =SUM(M1359:N1359) -> 26.210000000000001
A1360: 4561 | B1360: EOL CAJUÍNA B15 | C1360: 37.002.822/0001-11 | D1360: 18.440000000000001 | E1360: 0 | F1360: 0 | G1360: 0 | H1360: 0 | I1360: 0 | J1360: 0 | K1360: 20.379999999999999 | L1360: 0 | M1360: =SUM(J1360:L1360)-1.94 -> 18.439999999999998 | N1360: 1.9399999999999999 | O1360: =SUM(M1360:N1360) -> 20.379999999999999
A1361: 4567 | B1361: EOL CAJUÍNA B13 | C1361: 36.957.856/0001-05 | D1361: 21.079999999999998 | E1361: 0 | F1361: 0 | G1361: 0 | H1361: 0 | I1361: 0 | J1361: 0 | K1361: 23.300000000000001 | L1361: 0 | M1361: =SUM(J1361:L1361)-2.22 -> 21.080000000000002 | N1361: 2.2200000000000002 | O1361: =SUM(M1361:N1361) -> 23.300000000000001
A1362: 4577 | B1362: EOL TUCANO V | C1362: 35.805.346/0001-41 | D1362: 9.5899999999999999 | E1362: 0 | F1362: 0 | G1362: 0 | H1362: 0 | I1362: 0 | J1362: 0 | K1362: 10.6 | L1362: 0 | M1362: =SUM(J1362:L1362)-1.01 -> 9.5899999999999999 | N1362: 1.01 | O1362: =SUM(M1362:N1362) -> 10.6
A1363: 4578 | B1363: EOL TUCANO XIII | C1363: 35.805.346/0001-41 | D1363: 16.780000000000001 | E1363: 0 | F1363: 0 | G1363: 0 | H1363: 0 | I1363: 0 | J1363: 0 | K1363: 18.550000000000001 | L1363: 0 | M1363: =SUM(J1363:L1363)-1.77 -> 16.780000000000001 | N1363: 1.77 | O1363: =SUM(M1363:N1363) -> 18.550000000000001
A1364: 4579 | B1364: EOL TUCANO XVII | C1364: 35.805.346/0001-41 | D1364: 7.1900000000000004 | E1364: 0 | F1364: 0 | G1364: 0 | H1364: 0 | I1364: 0 | J1364: 0 | K1364: 7.9500000000000002 | L1364: 0 | M1364: =SUM(J1364:L1364)-0.76 -> 7.1900000000000004 | N1364: 0.76000000000000001 | O1364: =SUM(M1364:N1364) -> 7.9500000000000002
A1365: 4585 | B1365: EOL KAIRÓS WIND 2 | C1365: 42.422.214/0001-04 | D1365: 16.010000000000002 | E1365: 0 | F1365: 0 | G1365: 0 | H1365: 0 | I1365: 0 | J1365: 0 | K1365: 17.699999999999999 | L1365: 0 | M1365: =SUM(J1365:L1365)-1.69 -> 16.009999999999998 | N1365: 1.6899999999999999 | O1365: =SUM(M1365:N1365) -> 17.699999999999999
A1366: 4586 | B1366: UFV HELIO VALGAS 2 | C1366: 32.431.507/0001-96 | D1366: 24.079999999999998 | E1366: 0 | F1366: 0 | G1366: 0 | H1366: 0 | I1366: 0 | J1366: 0 | K1366: 26.620000000000001 | L1366: 0 | M1366: =SUM(J1366:L1366)-2.54 -> 24.080000000000002 | N1366: 2.54 | O1366: =SUM(M1366:N1366) -> 26.620000000000001
A1367: 4587 | B1367: UFV HELIO VALGAS 3 | C1367: 32.431.516/0001-87 | D1367: 24.079999999999998 | E1367: 0 | F1367: 0 | G1367: 0 | H1367: 0 | I1367: 0 | J1367: 0 | K1367: 26.620000000000001 | L1367: 0 | M1367: =SUM(J1367:L1367)-2.54 -> 24.080000000000002 | N1367: 2.54 | O1367: =SUM(M1367:N1367) -> 26.620000000000001
A1368: 4588 | B1368: UFV HELIO VALGAS 4 | C1368: 32.431.516/0001-87 | D1368: 24.079999999999998 | E1368: 0 | F1368: 0 | G1368: 0 | H1368: 0 | I1368: 0 | J1368: 0 | K1368: 26.620000000000001 | L1368: 0 | M1368: =SUM(J1368:L1368)-2.54 -> 24.080000000000002 | N1368: 2.54 | O1368: =SUM(M1368:N1368) -> 26.620000000000001
A1369: 4589 | B1369: UFV HELIO VALGAS 5 | C1369: 32.431.510/0001-00 | D1369: 24.079999999999998 | E1369: 0 | F1369: 0 | G1369: 0 | H1369: 0 | I1369: 0 | J1369: 0 | K1369: 26.620000000000001 | L1369: 0 | M1369: =SUM(J1369:L1369)-2.54 -> 24.080000000000002 | N1369: 2.54 | O1369: =SUM(M1369:N1369) -> 26.620000000000001
A1370: 4590 | B1370: UFV HELIO VALGAS 6 | C1370: 32.431.510/0001-00 | D1370: 24.079999999999998 | E1370: 0 | F1370: 0 | G1370: 0 | H1370: 0 | I1370: 0 | J1370: 0 | K1370: 26.620000000000001 | L1370: 0 | M1370: =SUM(J1370:L1370)-2.54 -> 24.080000000000002 | N1370: 2.54 | O1370: =SUM(M1370:N1370) -> 26.620000000000001
A1371: 4591 | B1371: EOL AROEIRA 7 | C1371: 38.090.834/0002-99 | D1371: 21.640000000000001 | E1371: 0 | F1371: 0 | G1371: 0 | H1371: 0 | I1371: 0 | J1371: 0 | K1371: 23.920000000000002 | L1371: 0 | M1371: =SUM(J1371:L1371)-2.28 -> 21.640000000000001 | N1371: 2.2799999999999998 | O1371: =SUM(M1371:N1371) -> 23.920000000000002
A1372: 4592 | B1372: UFV HELIO VALGAS 7 | C1372: 40.224.338/0001-41 | D1372: 24.079999999999998 | E1372: 0 | F1372: 0 | G1372: 0 | H1372: 0 | I1372: 0 | J1372: 0 | K1372: 26.620000000000001 | L1372: 0 | M1372: =SUM(J1372:L1372)-2.54 -> 24.080000000000002 | N1372: 2.54 | O1372: =SUM(M1372:N1372) -> 26.620000000000001
A1373: 4593 | B1373: UFV HELIO VALGAS 8 | C1373: 40.224.338/0001-41 | D1373: 30.140000000000001 | E1373: 0 | F1373: 0 | G1373: 0 | H1373: 0 | I1373: 0 | J1373: 0 | K1373: 33.32 | L1373: 0 | M1373: =SUM(J1373:L1373)-3.18 -> 30.140000000000001 | N1373: 3.1800000000000002 | O1373: =SUM(M1373:N1373) -> 33.32
A1374: 4594 | B1374: UFV HELIO VALGAS 9 | C1374: 40.114.336/0001-08 | D1374: 24.100000000000001 | E1374: 0 | F1374: 0 | G1374: 0 | H1374: 0 | I1374: 0 | J1374: 0 | K1374: 26.640000000000001 | L1374: 0 | M1374: =SUM(J1374:L1374)-2.54 -> 24.100000000000001 | N1374: 2.54 | O1374: =SUM(M1374:N1374) -> 26.640000000000001
A1375: 4595 | B1375: UFV HELIO VALGAS 10 | C1375: 40.114.336/0001-08 | D1375: 24.23 | E1375: 0 | F1375: 0 | G1375: 0 | H1375: 0 | I1375: 0 | J1375: 0 | K1375: 26.780000000000001 | L1375: 0 | M1375: =SUM(J1375:L1375)-2.55 -> 24.23 | N1375: 2.5499999999999998 | O1375: =SUM(M1375:N1375) -> 26.780000000000001
A1376: 4606 | B1376: EOL KAIROS WIND 6 | C1376: 44.031.923/0001-86 | D1376: 18.010000000000002 | E1376: 0 | F1376: 0 | G1376: 0 | H1376: 0 | I1376: 0 | J1376: 0 | K1376: 19.91 | L1376: 0 | M1376: =SUM(J1376:L1376)-1.9 -> 18.010000000000002 | N1376: 1.8999999999999999 | O1376: =SUM(M1376:N1376) -> 19.91
A1377: 4607 | B1377: UFV HELIO VALGAS 1 | C1377: 32.431.507/0001-96 | D1377: 24.079999999999998 | E1377: 0 | F1377: 0 | G1377: 0 | H1377: 0 | I1377: 0 | J1377: 0 | K1377: 26.620000000000001 | L1377: 0 | M1377: =SUM(J1377:L1377)-2.54 -> 24.080000000000002 | N1377: 2.54 | O1377: =SUM(M1377:N1377) -> 26.620000000000001
A1378: 4608 | B1378: EOL PEDRA PINTADA I | C1378: 42.046.559/0002-83 | D1378: 24.23 | E1378: 0 | F1378: 0 | G1378: 0 | H1378: 0 | I1378: 0 | J1378: 0 | K1378: 26.780000000000001 | L1378: 0 | M1378: =SUM(J1378:L1378)-2.55 -> 24.23 | N1378: 2.5499999999999998 | O1378: =SUM(M1378:N1378) -> 26.780000000000001
A1379: 4609 | B1379: EOL PEDRA PINTADA II | C1379: 42.261.997/0002-64 | D1379: 24.329999999999998 | E1379: 0 | F1379: 0 | G1379: 0 | H1379: 0 | I1379: 0 | J1379: 0 | K1379: 26.890000000000001 | L1379: 0 | M1379: =SUM(J1379:L1379)-2.56 -> 24.330000000000002 | N1379: 2.5600000000000001 | O1379: =SUM(M1379:N1379) -> 26.890000000000001
A1380: 4610 | B1380: EOL PEDRA PINTADA III | C1380: 41.982.031/0002-53 | D1380: 21.489999999999998 | E1380: 0 | F1380: 0 | G1380: 0 | H1380: 0 | I1380: 0 | J1380: 0 | K1380: 23.760000000000002 | L1380: 0 | M1380: =SUM(J1380:L1380)-2.27 -> 21.490000000000002 | N1380: 2.27 | O1380: =SUM(M1380:N1380) -> 23.760000000000002
A1381: 4611 | B1381: EOL PEDRA PINTADA IV | C1381: 41.983.083/0003-25 | D1381: 24.140000000000001 | E1381: 0 | F1381: 0 | G1381: 0 | H1381: 0 | I1381: 0 | J1381: 0 | K1381: 26.68 | L1381: 0 | M1381: =SUM(J1381:L1381)-2.54 -> 24.140000000000001 | N1381: 2.54 | O1381: =SUM(M1381:N1381) -> 26.68
A1382: 4612 | B1382: UFV HORIZONTE MP 2 | C1382: 23.399.589/0001-48 | D1382: 10.300000000000001 | E1382: 0 | F1382: 0 | G1382: 0 | H1382: 0 | I1382: 0 | J1382: 0 | K1382: 11.390000000000001 | L1382: 0 | M1382: =SUM(J1382:L1382)-1.09 -> 10.300000000000001 | N1382: 1.0900000000000001 | O1382: =SUM(M1382:N1382) -> 11.390000000000001
A1383: 4613 | B1383: UFV HORIZONTE MP 11 | C1383: 23.399.589/0001-48 | D1383: 7.9400000000000004 | E1383: 0 | F1383: 0 | G1383: 0 | H1383: 0 | I1383: 0 | J1383: 0 | K1383: 8.7799999999999994 | L1383: 0 | M1383: =SUM(J1383:L1383)-0.84 -> 7.9399999999999995 | N1383: 0.83999999999999997 | O1383: =SUM(M1383:N1383) -> 8.7799999999999994
A1384: 4614 | B1384: UFV RIBEIRO GONÇALVES VI | C1384: 31.711.512/0001-90 | D1384: 15.83 | E1384: 0 | F1384: 0 | G1384: 0 | H1384: 0 | I1384: 0 | J1384: 0 | K1384: 17.5 | L1384: 0 | M1384: =SUM(J1384:L1384)-1.67 -> 15.83 | N1384: 1.6699999999999999 | O1384: =SUM(M1384:N1384) -> 17.5
A1385: 4615 | B1385: UFV RIBEIRO GONÇALVES VII | C1385: 31.711.512/0001-90 | D1385: 14.25 | E1385: 0 | F1385: 0 | G1385: 0 | H1385: 0 | I1385: 0 | J1385: 0 | K1385: 15.75 | L1385: 0 | M1385: =SUM(J1385:L1385)-1.5 -> 14.25 | N1385: 1.5 | O1385: =SUM(M1385:N1385) -> 15.75
A1386: 4616 | B1386: UFV RIBEIRO GONÇALVES VIII | C1386: 31.711.512/0001-90 | D1386: 14.25 | E1386: 0 | F1386: 0 | G1386: 0 | H1386: 0 | I1386: 0 | J1386: 0 | K1386: 15.75 | L1386: 0 | M1386: =SUM(J1386:L1386)-1.5 -> 14.25 | N1386: 1.5 | O1386: =SUM(M1386:N1386) -> 15.75
A1387: 4617 | B1387: EOL AROEIRA 8 | C1387: 39.336.768/0001-76 | D1387: 19.690000000000001 | E1387: 0 | F1387: 0 | G1387: 0 | H1387: 0 | I1387: 0 | J1387: 0 | K1387: 21.77 | L1387: 0 | M1387: =SUM(J1387:L1387)-2.08 -> 19.689999999999998 | N1387: 2.0800000000000001 | O1387: =SUM(M1387:N1387) -> 21.769999999999996
A1388: 4618 | B1388: UFV MENDUBIM I | C1388: 45.991.644/0001-27 | D1388: 17.239999999999998 | E1388: 0 | F1388: 0 | G1388: 0 | H1388: 0 | I1388: 0 | J1388: 0 | K1388: 19.059999999999999 | L1388: 0 | M1388: =SUM(J1388:L1388)-1.82 -> 17.239999999999998 | N1388: 1.8200000000000001 | O1388: =SUM(M1388:N1388) -> 19.059999999999999
A1389: 4619 | B1389: UFV MENDUBIM II | C1389: 45.991.741/0001-10 | D1389: 15.09 | E1389: 0 | F1389: 0 | G1389: 0 | H1389: 0 | I1389: 0 | J1389: 0 | K1389: 16.68 | L1389: 0 | M1389: =SUM(J1389:L1389)-1.59 -> 15.09 | N1389: 1.5900000000000001 | O1389: =SUM(M1389:N1389) -> 16.68
A1390: 4620 | B1390: UFV MENDUBIM III | C1390: 45.991.823/0001-64 | D1390: 17.239999999999998 | E1390: 0 | F1390: 0 | G1390: 0 | H1390: 0 | I1390: 0 | J1390: 0 | K1390: 19.059999999999999 | L1390: 0 | M1390: =SUM(J1390:L1390)-1.82 -> 17.239999999999998 | N1390: 1.8200000000000001 | O1390: =SUM(M1390:N1390) -> 19.059999999999999
A1391: 4621 | B1391: UFV MENDUBIM IV | C1391: 45.991.863/0001-06 | D1391: 17.239999999999998 | E1391: 0 | F1391: 0 | G1391: 0 | H1391: 0 | I1391: 0 | J1391: 0 | K1391: 19.059999999999999 | L1391: 0 | M1391: =SUM(J1391:L1391)-1.82 -> 17.239999999999998 | N1391: 1.8200000000000001 | O1391: =SUM(M1391:N1391) -> 19.059999999999999
A1392: 4622 | B1392: UFV MENDUBIM V | C1392: 45.991.921/0001-00 | D1392: 15.09 | E1392: 0 | F1392: 0 | G1392: 0 | H1392: 0 | I1392: 0 | J1392: 0 | K1392: 16.68 | L1392: 0 | M1392: =SUM(J1392:L1392)-1.59 -> 15.09 | N1392: 1.5900000000000001 | O1392: =SUM(M1392:N1392) -> 16.68
A1393: 4623 | B1393: UFV MENDUBIM VI | C1393: 45.991.972/0001-23 | D1393: 15.09 | E1393: 0 | F1393: 0 | G1393: 0 | H1393: 0 | I1393: 0 | J1393: 0 | K1393: 16.68 | L1393: 0 | M1393: =SUM(J1393:L1393)-1.59 -> 15.09 | N1393: 1.5900000000000001 | O1393: =SUM(M1393:N1393) -> 16.68
A1394: 4624 | B1394: UFV MENDUBIM VII | C1394: 45.992.035/0001-92 | D1394: 15.09 | E1394: 0 | F1394: 0 | G1394: 0 | H1394: 0 | I1394: 0 | J1394: 0 | K1394: 16.68 | L1394: 0 | M1394: =SUM(J1394:L1394)-1.59 -> 15.09 | N1394: 1.5900000000000001 | O1394: =SUM(M1394:N1394) -> 16.68
A1395: 4625 | B1395: UFV MENDUBIM VIII | C1395: 45.992.085/0001-70 | D1395: 15.09 | E1395: 0 | F1395: 0 | G1395: 0 | H1395: 0 | I1395: 0 | J1395: 0 | K1395: 16.68 | L1395: 0 | M1395: =SUM(J1395:L1395)-1.59 -> 15.09 | N1395: 1.5900000000000001 | O1395: =SUM(M1395:N1395) -> 16.68
A1396: 4626 | B1396: UFV MENDUBIM IX | C1396: 45.992.149/0001-32 | D1396: 17.239999999999998 | E1396: 0 | F1396: 0 | G1396: 0 | H1396: 0 | I1396: 0 | J1396: 0 | K1396: 19.059999999999999 | L1396: 0 | M1396: =SUM(J1396:L1396)-1.82 -> 17.239999999999998 | N1396: 1.8200000000000001 | O1396: =SUM(M1396:N1396) -> 19.059999999999999
A1397: 4627 | B1397: UFV MENDUBIM X | C1397: 45.992.184/0001-51 | D1397: 10.779999999999999 | E1397: 0 | F1397: 0 | G1397: 0 | H1397: 0 | I1397: 0 | J1397: 0 | K1397: 11.92 | L1397: 0 | M1397: =SUM(J1397:L1397)-1.14 -> 10.779999999999999 | N1397: 1.1399999999999999 | O1397: =SUM(M1397:N1397) -> 11.92
A1398: 4628 | B1398: UFV MENDUBIM XI | C1398: 45.992.228/0001-43 | D1398: 25.870000000000001 | E1398: 0 | F1398: 0 | G1398: 0 | H1398: 0 | I1398: 0 | J1398: 0 | K1398: 28.600000000000001 | L1398: 0 | M1398: =SUM(J1398:L1398)-2.73 -> 25.870000000000001 | N1398: 2.73 | O1398: =SUM(M1398:N1398) -> 28.600000000000001
A1399: 4629 | B1399: EOL VENTOS DE SANTO ANTÔNIO 01 | C1399: 42.495.343/0002-03 | D1399: 20.969999999999999 | E1399: 0 | F1399: 0 | G1399: 0 | H1399: 0 | I1399: 0 | J1399: 0 | K1399: 23.18 | L1399: 0 | M1399: =SUM(J1399:L1399)-2.21 -> 20.969999999999999 | N1399: 2.21 | O1399: =SUM(M1399:N1399) -> 23.18
A1400: 4630 | B1400: UFV MENDUBIM XII | C1400: 45.992.261/0001-73 | D1400: 12.93 | E1400: 0 | F1400: 0 | G1400: 0 | H1400: 0 | I1400: 0 | J1400: 0 | K1400: 14.289999999999999 | L1400: 0 | M1400: =SUM(J1400:L1400)-1.36 -> 12.93 | N1400: 1.3600000000000001 | O1400: =SUM(M1400:N1400) -> 14.289999999999999
A1401: 4631 | B1401: UFV MENDUBIM XIII | C1401: 45.992.304/0001-10 | D1401: 17.239999999999998 | E1401: 0 | F1401: 0 | G1401: 0 | H1401: 0 | I1401: 0 | J1401: 0 | K1401: 19.059999999999999 | L1401: 0 | M1401: =SUM(J1401:L1401)-1.82 -> 17.239999999999998 | N1401: 1.8200000000000001 | O1401: =SUM(M1401:N1401) -> 19.059999999999999
A1402: 4632 | B1402: EOL MORRO 2 | C1402: 42.625.774/0002-39 | D1402: 16.93 | E1402: 0 | F1402: 0 | G1402: 0 | H1402: 0 | I1402: 0 | J1402: 0 | K1402: 18.710000000000001 | L1402: 0 | M1402: =SUM(J1402:L1402)-1.78 -> 16.93 | N1402: 1.78 | O1402: =SUM(M1402:N1402) -> 18.710000000000001
A1403: 4633 | B1403: EOL OESTE SERIDÓ VI | C1403: 25.216.818/0001-77 | D1403: 7.71 | E1403: 0 | F1403: 0 | G1403: 0 | H1403: 0 | I1403: 0 | J1403: 0 | K1403: 8.5199999999999996 | L1403: 0 | M1403: =SUM(J1403:L1403)-0.81 -> 7.7099999999999991 | N1403: 0.81000000000000005 | O1403: =SUM(M1403:N1403) -> 8.5199999999999996
A1404: 4634 | B1404: EOL OESTE SERIDÓ X | C1404: 36.641.948/0001-73 | D1404: 11.57 | E1404: 0 | F1404: 0 | G1404: 0 | H1404: 0 | I1404: 0 | J1404: 0 | K1404: 12.789999999999999 | L1404: 0 | M1404: =SUM(J1404:L1404)-1.22 -> 11.569999999999999 | N1404: 1.22 | O1404: =SUM(M1404:N1404) -> 12.789999999999999
A1405: 4635 | B1405: EOL OESTE SERIDÓ XII | C1405: 36.641.357/0001-04 | D1405: 13.5 | E1405: 0 | F1405: 0 | G1405: 0 | H1405: 0 | I1405: 0 | J1405: 0 | K1405: 14.92 | L1405: 0 | M1405: =SUM(J1405:L1405)-1.42 -> 13.5 | N1405: 1.4199999999999999 | O1405: =SUM(M1405:N1405) -> 14.92
A1406: 4636 | B1406: EOL SERRA DAS VACAS A | C1406: 28.029.264/0001-97 | D1406: 17.32 | E1406: 0 | F1406: 0 | G1406: 0 | H1406: 0 | I1406: 0 | J1406: 0 | K1406: 19.149999999999999 | L1406: 0 | M1406: =SUM(J1406:L1406)-1.83 -> 17.32 | N1406: 1.8300000000000001 | O1406: =SUM(M1406:N1406) -> 19.149999999999999
A1407: 4637 | B1407: EOL SERRA DAS VACAS B | C1407: 28.228.040/0001-04 | D1407: 15.35 | E1407: 0 | F1407: 0 | G1407: 0 | H1407: 0 | I1407: 0 | J1407: 0 | K1407: 16.969999999999999 | L1407: 0 | M1407: =SUM(J1407:L1407)-1.62 -> 15.349999999999998 | N1407: 1.6200000000000001 | O1407: =SUM(M1407:N1407) -> 16.969999999999999
A1408: 4638 | B1408: UFV SERRA DO MEL VII | C1408: 46.545.021/0001-93 | D1408: 21.870000000000001 | E1408: 0 | F1408: 0 | G1408: 0 | H1408: 0 | I1408: 0 | J1408: 0 | K1408: 24.18 | L1408: 0 | M1408: =SUM(J1408:L1408)-2.31 -> 21.870000000000001 | N1408: 2.3100000000000001 | O1408: =SUM(M1408:N1408) -> 24.18
A1409: 4639 | B1409: UFV MARANGATU 1 | C1409: 41.977.332/0001-08 | D1409: 12.779999999999999 | E1409: 0 | F1409: 0 | G1409: 0 | H1409: 0 | I1409: 0 | J1409: 0 | K1409: 14.130000000000001 | L1409: 0 | M1409: =SUM(J1409:L1409)-1.35 -> 12.780000000000001 | N1409: 1.3500000000000001 | O1409: =SUM(M1409:N1409) -> 14.130000000000001
A1410: 4640 | B1410: UFV MARANGATU 2 | C1410: 42.066.785/0001-45 | D1410: 12.81 | E1410: 0 | F1410: 0 | G1410: 0 | H1410: 0 | I1410: 0 | J1410: 0 | K1410: 14.16 | L1410: 0 | M1410: =SUM(J1410:L1410)-1.35 -> 12.81 | N1410: 1.3500000000000001 | O1410: =SUM(M1410:N1410) -> 14.16
A1411: 4641 | B1411: UFV MARANGATU 3 | C1411: 42.066.812/0001-80 | D1411: 12.84 | E1411: 0 | F1411: 0 | G1411: 0 | H1411: 0 | I1411: 0 | J1411: 0 | K1411: 14.19 | L1411: 0 | M1411: =SUM(J1411:L1411)-1.35 -> 12.84 | N1411: 1.3500000000000001 | O1411: =SUM(M1411:N1411) -> 14.19
A1412: 4642 | B1412: UFV MARANGATU 4 | C1412: 42.066.826/0001-01 | D1412: 12.800000000000001 | E1412: 0 | F1412: 0 | G1412: 0 | H1412: 0 | I1412: 0 | J1412: 0 | K1412: 14.15 | L1412: 0 | M1412: =SUM(J1412:L1412)-1.35 -> 12.800000000000001 | N1412: 1.3500000000000001 | O1412: =SUM(M1412:N1412) -> 14.15
A1413: 4643 | B1413: UFV MARANGATU 5 | C1413: 42.066.841/0001-41 | D1413: 12.82 | E1413: 0 | F1413: 0 | G1413: 0 | H1413: 0 | I1413: 0 | J1413: 0 | K1413: 14.17 | L1413: 0 | M1413: =SUM(J1413:L1413)-1.35 -> 12.82 | N1413: 1.3500000000000001 | O1413: =SUM(M1413:N1413) -> 14.17
A1414: 4644 | B1414: UFV MARANGATU 6 | C1414: 42.066.887/0001-60 | D1414: 12.85 | E1414: 0 | F1414: 0 | G1414: 0 | H1414: 0 | I1414: 0 | J1414: 0 | K1414: 14.199999999999999 | L1414: 0 | M1414: =SUM(J1414:L1414)-1.35 -> 12.85 | N1414: 1.3500000000000001 | O1414: =SUM(M1414:N1414) -> 14.199999999999999
A1415: 4645 | B1415: UFV MARANGATU 7 | C1415: 42.066.900/0001-81 | D1415: 12.82 | E1415: 0 | F1415: 0 | G1415: 0 | H1415: 0 | I1415: 0 | J1415: 0 | K1415: 14.17 | L1415: 0 | M1415: =SUM(J1415:L1415)-1.35 -> 12.82 | N1415: 1.3500000000000001 | O1415: =SUM(M1415:N1415) -> 14.17
A1416: 4646 | B1416: UFV MARANGATU 8 | C1416: 42.066.920/0001-52 | D1416: 12.82 | E1416: 0 | F1416: 0 | G1416: 0 | H1416: 0 | I1416: 0 | J1416: 0 | K1416: 14.17 | L1416: 0 | M1416: =SUM(J1416:L1416)-1.35 -> 12.82 | N1416: 1.3500000000000001 | O1416: =SUM(M1416:N1416) -> 14.17
A1417: 4647 | B1417: UFV MARANGATU 9 | C1417: 42.066.942/0001-12 | D1417: 12.85 | E1417: 0 | F1417: 0 | G1417: 0 | H1417: 0 | I1417: 0 | J1417: 0 | K1417: 14.199999999999999 | L1417: 0 | M1417: =SUM(J1417:L1417)-1.35 -> 12.85 | N1417: 1.3500000000000001 | O1417: =SUM(M1417:N1417) -> 14.199999999999999
A1418: 4648 | B1418: UFV MARANGATU 10 | C1418: 42.066.958/0001-25 | D1418: 12.859999999999999 | E1418: 0 | F1418: 0 | G1418: 0 | H1418: 0 | I1418: 0 | J1418: 0 | K1418: 14.220000000000001 | L1418: 0 | M1418: =SUM(J1418:L1418)-1.36 -> 12.860000000000001 | N1418: 1.3600000000000001 | O1418: =SUM(M1418:N1418) -> 14.220000000000001
A1419: 4649 | B1419: UFV MARANGATU 11 | C1419: 42.066.972/0001-29 | D1419: 12.82 | E1419: 0 | F1419: 0 | G1419: 0 | H1419: 0 | I1419: 0 | J1419: 0 | K1419: 14.17 | L1419: 0 | M1419: =SUM(J1419:L1419)-1.35 -> 12.82 | N1419: 1.3500000000000001 | O1419: =SUM(M1419:N1419) -> 14.17
A1420: 4650 | B1420: UFV MARANGATU 12 | C1420: 42.066.994/0001-99 | D1420: 12.83 | E1420: 0 | F1420: 0 | G1420: 0 | H1420: 0 | I1420: 0 | J1420: 0 | K1420: 14.18 | L1420: 0 | M1420: =SUM(J1420:L1420)-1.35 -> 12.83 | N1420: 1.3500000000000001 | O1420: =SUM(M1420:N1420) -> 14.18
A1421: 4651 | B1421: UFV JAÍBA CN | C1421: 37.995.403/0001-28 | D1421: 13.65 | E1421: 0 | F1421: 0 | G1421: 0 | H1421: 0 | I1421: 0 | J1421: 0 | K1421: 15.09 | L1421: 0 | M1421: =SUM(J1421:L1421)-1.44 -> 13.65 | N1421: 1.4399999999999999 | O1421: =SUM(M1421:N1421) -> 15.09
A1422: 4652 | B1422: EOL VENTOS DE SANTA LUZIA 11 | C1422: 42.538.271/0002-26 | D1422: 23.07 | E1422: 0 | F1422: 0 | G1422: 0 | H1422: 0 | I1422: 0 | J1422: 0 | K1422: 25.5 | L1422: 0 | M1422: =SUM(J1422:L1422)-2.43 -> 23.07 | N1422: 2.4300000000000002 | O1422: =SUM(M1422:N1422) -> 25.5
A1423: 4653 | B1423: EOL VENTOS DE SANTA LUZIA 12 | C1423: 42.495.350/0003-88 | D1423: 25.170000000000002 | E1423: 0 | F1423: 0 | G1423: 0 | H1423: 0 | I1423: 0 | J1423: 0 | K1423: 27.82 | L1423: 0 | M1423: =SUM(J1423:L1423)-2.65 -> 25.170000000000002 | N1423: 2.6499999999999999 | O1423: =SUM(M1423:N1423) -> 27.82
A1424: 4654 | B1424: EOL VENTOS DE SANTA LUZIA 13 | C1424: 42.455.678/0002-90 | D1424: 25.170000000000002 | E1424: 0 | F1424: 0 | G1424: 0 | H1424: 0 | I1424: 0 | J1424: 0 | K1424: 27.82 | L1424: 0 | M1424: =SUM(J1424:L1424)-2.65 -> 25.170000000000002 | N1424: 2.6499999999999999 | O1424: =SUM(M1424:N1424) -> 27.82
A1425: 5002 | B1425: ALCOA-P | C1425: 23.637.697/0001-01 | D1425: 57.969999999999999 | E1425: 0 | F1425: 0 | G1425: 0 | H1425: 0 | I1425: 0 | J1425: 0 | K1425: 64.079999999999998 | L1425: 0 | M1425: =SUM(J1425:L1425)-6.11 -> 57.969999999999999 | N1425: 6.1100000000000003 | O1425: =SUM(M1425:N1425) -> 64.079999999999998
A1426: 5006 | B1426: CBA(CABREÚVA)-P | C1426: 61.409.892/0003-35 | D1426: 830.5 | E1426: 0 | F1426: 0 | G1426: 0 | H1426: 0 | I1426: 0 | J1426: 0 | K1426: 918.04999999999995 | L1426: 0 | M1426: =SUM(J1426:L1426)-87.55 -> 830.5 | N1426: 87.549999999999997 | O1426: =SUM(M1426:N1426) -> 918.04999999999995
A1427: 5007 | B1427: CSN ARAUCARIA | C1427: 33.042.730/0134-35 | D1427: 25.52 | E1427: 0 | F1427: 0 | G1427: 0 | H1427: 0 | I1427: 0 | J1427: 0 | K1427: 28.210000000000001 | L1427: 0 | M1427: =SUM(J1427:L1427)-2.69 -> 25.52 | N1427: 2.6899999999999999 | O1427: =SUM(M1427:N1427) -> 28.210000000000001
A1428: 5008 | B1428: VALE(ITABIRA)-P | C1428: 33.592.510/0164-09 | D1428: 142.99000000000001 | E1428: 0 | F1428: 0 | G1428: 0 | H1428: 0 | I1428: 0 | J1428: 0 | K1428: 158.06 | L1428: 0 | M1428: =SUM(J1428:L1428)-15.07 -> 142.99000000000001 | N1428: 15.07 | O1428: =SUM(M1428:N1428) -> 158.06
A1429: 5011 | B1429: FIBRAPLAC-P | C1429: 04.176.791/0002-47 | D1429: 37.219999999999999 | E1429: 0 | F1429: 0 | G1429: 0 | H1429: 0 | I1429: 0 | J1429: 0 | K1429: 41.140000000000001 | L1429: 0 | M1429: =SUM(J1429:L1429)-3.92 -> 37.219999999999999 | N1429: 3.9199999999999999 | O1429: =SUM(M1429:N1429) -> 41.140000000000001
A1430: 5017 | B1430: INNOVA-P | C1430: 04.229.761/0011-42 | D1430: 5.3200000000000003 | E1430: 0 | F1430: 0 | G1430: 0 | H1430: 0 | I1430: 0 | J1430: 0 | K1430: 5.8799999999999999 | L1430: 0 | M1430: =SUM(J1430:L1430)-0.56 -> 5.3200000000000003 | N1430: 0.56000000000000005 | O1430: =SUM(M1430:N1430) -> 5.8800000000000008
A1431: 5019 | B1431: ANGLO AMERICAN(NIQUELÂNDIA)-P | C1431: 42.184.226/0017-05 | D1431: 50.609999999999999 | E1431: 0 | F1431: 0 | G1431: 0 | H1431: 0 | I1431: 0 | J1431: 0 | K1431: 55.939999999999998 | L1431: 0 | M1431: =SUM(J1431:L1431)-5.33 -> 50.609999999999999 | N1431: 5.3300000000000001 | O1431: =SUM(M1431:N1431) -> 55.939999999999998
A1432: 5022 | B1432: ALUMAR(REFINARIA)-P | C1432: 00.655.209/0001-93 | D1432: 97.340000000000003 | E1432: 0 | F1432: 0 | G1432: 0 | H1432: 0 | I1432: 0 | J1432: 0 | K1432: 107.59999999999999 | L1432: 0 | M1432: =SUM(J1432:L1432)-10.26 -> 97.339999999999989 | N1432: 10.26 | O1432: =SUM(M1432:N1432) -> 107.59999999999999
A1433: 5023 | B1433: ALUMAR(REDUÇÃO)-P | C1433: 00.655.209/0001-93 | D1433: 694.98000000000002 | E1433: 0 | F1433: 0 | G1433: 0 | H1433: 0 | I1433: 0 | J1433: 0 | K1433: 768.24000000000001 | L1433: 0 | M1433: =SUM(J1433:L1433)-73.26 -> 694.98000000000002 | N1433: 73.260000000000005 | O1433: =SUM(M1433:N1433) -> 768.24000000000001
A1434: 5024 | B1434: OXITENO-P | C1434: 62.545.686/0018-00 | D1434: 6.9000000000000004 | E1434: 0 | F1434: 0 | G1434: 0 | H1434: 0 | I1434: 0 | J1434: 0 | K1434: 7.6299999999999999 | L1434: 0 | M1434: =SUM(J1434:L1434)-0.73 -> 6.9000000000000004 | N1434: 0.72999999999999998 | O1434: =SUM(M1434:N1434) -> 7.6300000000000008
A1435: 5025 | B1435: ARLANXEO (DSM)-P | C1435: 29.667.227/0012-20 | D1435: 12.73 | E1435: 0 | F1435: 0 | G1435: 0 | H1435: 0 | I1435: 0 | J1435: 0 | K1435: 14.07 | L1435: 0 | M1435: =SUM(J1435:L1435)-1.34 -> 12.73 | N1435: 1.3400000000000001 | O1435: =SUM(M1435:N1435) -> 14.07
A1436: 5026 | B1436: ALBRAS-P | C1436: 05.053.020/0003-06 | D1436: 1157.6199999999999 | E1436: 0 | F1436: 0 | G1436: 0 | H1436: 0 | I1436: 0 | J1436: 0 | K1436: 1279.6500000000001 | L1436: 0 | M1436: =SUM(J1436:L1436)-122.03 -> 1157.6200000000001 | N1436: 122.03 | O1436: =SUM(M1436:N1436) -> 1279.6500000000001
A1437: 5028 | B1437: NOVA ERA SILICON-P | C1437: 19.795.665/0001-67 | D1437: 49.5 | E1437: 0 | F1437: 0 | G1437: 0 | H1437: 0 | I1437: 0 | J1437: 0 | K1437: 54.719999999999999 | L1437: 0 | M1437: =SUM(J1437:L1437)-5.22 -> 49.5 | N1437: 5.2199999999999998 | O1437: =SUM(M1437:N1437) -> 54.719999999999999
A1438: 5029 | B1438: UNIPAR CARBOCLORO-P | C1438: 33.958.695/0001-78 | D1438: 160.53 | E1438: 0 | F1438: 0 | G1438: 0 | H1438: 0 | I1438: 0 | J1438: 0 | K1438: 177.44999999999999 | L1438: 0 | M1438: =SUM(J1438:L1438)-16.92 -> 160.52999999999997 | N1438: 16.920000000000002 | O1438: =SUM(M1438:N1438) -> 177.44999999999999
A1439: 5034 | B1439: CARAMURU-P | C1439: 00.080.671/0001-00 | D1439: 12.66 | E1439: 0 | F1439: 0 | G1439: 0 | H1439: 0 | I1439: 0 | J1439: 0 | K1439: 13.99 | L1439: 0 | M1439: =SUM(J1439:L1439)-1.33 -> 12.66 | N1439: 1.3300000000000001 | O1439: =SUM(M1439:N1439) -> 13.99
A1440: 5035 | B1440: NOURYON (AKZO) | C1440: 05.869.996/0001-90 | D1440: 78.950000000000003 | E1440: 0 | F1440: 0 | G1440: 0 | H1440: 0 | I1440: 0 | J1440: 0 | K1440: 87.269999999999996 | L1440: 0 | M1440: =SUM(J1440:L1440)-8.32 -> 78.949999999999989 | N1440: 8.3200000000000003 | O1440: =SUM(M1440:N1440) -> 87.269999999999982
A1441: 5036 | B1441: GERDAU(SP)-P | C1441: 07.358.761/0041-56 | D1441: 82.379999999999995 | E1441: 0 | F1441: 0 | G1441: 0 | H1441: 0 | I1441: 0 | J1441: 0 | K1441: 91.060000000000002 | L1441: 0 | M1441: =SUM(J1441:L1441)-8.68 -> 82.379999999999995 | N1441: 8.6799999999999997 | O1441: =SUM(M1441:N1441) -> 91.060000000000002
A1442: 5040 | B1442: WHITE MARTINS(IPATINGA)-P | C1442: 35.820.448/0155-91 | D1442: 44.359999999999999 | E1442: 0 | F1442: 0 | G1442: 0 | H1442: 0 | I1442: 0 | J1442: 0 | K1442: 49.039999999999999 | L1442: 0 | M1442: =SUM(J1442:L1442)-4.68 -> 44.359999999999999 | N1442: 4.6799999999999997 | O1442: =SUM(M1442:N1442) -> 49.039999999999999
A1443: 5041 | B1443: USIMINAS-P | C1443: 60.894.730/0025-82 | D1443: 325.13 | E1443: 0 | F1443: 0 | G1443: 0 | H1443: 0 | I1443: 0 | J1443: 0 | K1443: 359.39999999999998 | L1443: 0 | M1443: =SUM(J1443:L1443)-34.27 -> 325.13 | N1443: 34.270000000000003 | O1443: =SUM(M1443:N1443) -> 359.39999999999998
A1444: 5042 | B1444: WHITE MARTINS(TRIUNFO)-P | C1444: 35.820.448/0064-10 | D1444: 11.6 | E1444: 0 | F1444: 0 | G1444: 0 | H1444: 0 | I1444: 0 | J1444: 0 | K1444: 12.82 | L1444: 0 | M1444: =SUM(J1444:L1444)-1.22 -> 11.6 | N1444: 1.22 | O1444: =SUM(M1444:N1444) -> 12.82
A1445: 5046 | B1445: VALE(BRUCUTU)-P | C1445: 33.592.510/0447-98 | D1445: 87.810000000000002 | E1445: 0 | F1445: 0 | G1445: 0 | H1445: 0 | I1445: 0 | J1445: 0 | K1445: 97.069999999999993 | L1445: 0 | M1445: =SUM(J1445:L1445)-9.26 -> 87.809999999999988 | N1445: 9.2599999999999998 | O1445: =SUM(M1445:N1445) -> 97.069999999999993
A1446: 5047 | B1446: MESSER GASES (LINDE) | C1446: 60.619.202/0072-31 | D1446: 27.670000000000002 | E1446: 0 | F1446: 0 | G1446: 0 | H1446: 0 | I1446: 0 | J1446: 0 | K1446: 30.59 | L1446: 0 | M1446: =SUM(J1446:L1446)-2.92 -> 27.670000000000002 | N1446: 2.9199999999999999 | O1446: =SUM(M1446:N1446) -> 30.590000000000003
A1447: 5048 | B1447: ARLANXEO (PETROFLEX)-P | C1447: 29.667.227/0006-81 | D1447: 11.42 | E1447: 0 | F1447: 0 | G1447: 0 | H1447: 0 | I1447: 0 | J1447: 0 | K1447: 12.619999999999999 | L1447: 0 | M1447: =SUM(J1447:L1447)-1.2 -> 11.42 | N1447: 1.2 | O1447: =SUM(M1447:N1447) -> 12.619999999999999
A1448: 5049 | B1448: APERAM (ACESITA)-P | C1448: 33.390.170/0013-12 | D1448: 153.66999999999999 | E1448: 0 | F1448: 0 | G1448: 0 | H1448: 0 | I1448: 0 | J1448: 0 | K1448: 169.87 | L1448: 0 | M1448: =SUM(J1448:L1448)-16.2 -> 153.67000000000002 | N1448: 16.199999999999999 | O1448: =SUM(M1448:N1448) -> 169.87
A1449: 5060 | B1449: VALE(AGUA LIMPA)-P | C1449: 33.592.510/0413-49 | D1449: 5.3399999999999999 | E1449: 0 | F1449: 0 | G1449: 0 | H1449: 0 | I1449: 0 | J1449: 0 | K1449: 5.9000000000000004 | L1449: 0 | M1449: =SUM(J1449:L1449)-0.56 -> 5.3399999999999999 | N1449: 0.56000000000000005 | O1449: =SUM(M1449:N1449) -> 5.9000000000000004
A1450: 5061 | B1450: ARCELORMITTAL(MONLEVADE)-P | C1450: 17.469.701/0066-12 | D1450: 187.31 | E1450: 0 | F1450: 0 | G1450: 0 | H1450: 0 | I1450: 0 | J1450: 0 | K1450: 207.05000000000001 | L1450: 0 | M1450: =SUM(J1450:L1450)-19.74 -> 187.31 | N1450: 19.739999999999998 | O1450: =SUM(M1450:N1450) -> 207.05000000000001
A1451: 5062 | B1451: WHITE MARTINS(MONLEVADE)-P | C1451: 35.820.448/0135-48 | D1451: 55.200000000000003 | E1451: 0 | F1451: 0 | G1451: 0 | H1451: 0 | I1451: 0 | J1451: 0 | K1451: 61.020000000000003 | L1451: 0 | M1451: =SUM(J1451:L1451)-5.82 -> 55.200000000000003 | N1451: 5.8200000000000003 | O1451: =SUM(M1451:N1451) -> 61.020000000000003
A1452: 5065 | B1452: ANGLOGOLD ASHANTI-P | C1452: 18.565.382/0007-51 | D1452: 38.759999999999998 | E1452: 0 | F1452: 0 | G1452: 0 | H1452: 0 | I1452: 0 | J1452: 0 | K1452: 42.850000000000001 | L1452: 0 | M1452: =SUM(J1452:L1452)-4.09 -> 38.760000000000005 | N1452: 4.0899999999999999 | O1452: =SUM(M1452:N1452) -> 42.850000000000009
A1453: 5066 | B1453: MOSAIC POTÁSSIO(FERTILIZANTES) | C1453: 31.009.644/0001-74 | D1453: 33.259999999999998 | E1453: 0 | F1453: 0 | G1453: 0 | H1453: 0 | I1453: 0 | J1453: 0 | K1453: 36.770000000000003 | L1453: 0 | M1453: =SUM(J1453:L1453)-3.51 -> 33.260000000000005 | N1453: 3.5099999999999998 | O1453: =SUM(M1453:N1453) -> 36.770000000000003
A1454: 5067 | B1454: MINERAÇÃO MARACÁ-P | C1454: 86.902.053/0001-13 | D1454: 75.739999999999995 | E1454: 0 | F1454: 0 | G1454: 0 | H1454: 0 | I1454: 0 | J1454: 0 | K1454: 83.719999999999999 | L1454: 0 | M1454: =SUM(J1454:L1454)-7.98 -> 75.739999999999995 | N1454: 7.9800000000000004 | O1454: =SUM(M1454:N1454) -> 83.719999999999999
A1455: 5068 | B1455: PARAGOMINAS-P | C1455: 12.094.570/0004-10 | D1455: 70.989999999999995 | E1455: 0 | F1455: 0 | G1455: 0 | H1455: 0 | I1455: 0 | J1455: 0 | K1455: 78.469999999999999 | L1455: 0 | M1455: =SUM(J1455:L1455)-7.48 -> 70.989999999999995 | N1455: 7.4800000000000004 | O1455: =SUM(M1455:N1455) -> 78.469999999999999
A1456: 5070 | B1456: CBA (NIQUELÂNDIA) | C1456: 61.409.892/0224-95 | D1456: 0 | E1456: 0 | F1456: 0 | G1456: 0 | H1456: 0 | I1456: 0 | J1456: 0 | K1456: 0 | L1456: 0 | M1456: =SUM(J1456:L1456)-0 -> 0 | N1456: 0 | O1456: =SUM(M1456:N1456) -> 0
A1457: 5072 | B1457: BRF(SADIA) | C1457: 01.838.723/0394-14 | D1457: 29.109999999999999 | E1457: 0 | F1457: 0 | G1457: 0 | H1457: 0 | I1457: 0 | J1457: 0 | K1457: 32.18 | L1457: 0 | M1457: =SUM(J1457:L1457)-3.07 -> 29.109999999999999 | N1457: 3.0699999999999998 | O1457: =SUM(M1457:N1457) -> 32.18
A1458: 5073 | B1458: ANGLOGOLD (SÃO BENTO)-P | C1458: 18.565.382/0001-66 | D1458: 23.609999999999999 | E1458: 0 | F1458: 0 | G1458: 0 | H1458: 0 | I1458: 0 | J1458: 0 | K1458: 26.100000000000001 | L1458: 0 | M1458: =SUM(J1458:L1458)-2.49 -> 23.609999999999999 | N1458: 2.4900000000000002 | O1458: =SUM(M1458:N1458) -> 26.100000000000001
A1459: 5074 | B1459: WHITE MARTINS(BARAO COCAIS)-P | C1459: 35.820.448/0044-76 | D1459: 7.4900000000000002 | E1459: 0 | F1459: 0 | G1459: 0 | H1459: 0 | I1459: 0 | J1459: 0 | K1459: 8.2799999999999994 | L1459: 0 | M1459: =SUM(J1459:L1459)-0.79 -> 7.4899999999999993 | N1459: 0.79000000000000004 | O1459: =SUM(M1459:N1459) -> 8.2799999999999994
A1460: 5076 | B1460: VALE (MINERAÇÃO ONÇA-PUMA)-P | C1460: 48.256.824/0006-68 | D1460: 158.77000000000001 | E1460: 0 | F1460: 0 | G1460: 0 | H1460: 0 | I1460: 0 | J1460: 0 | K1460: 175.50999999999999 | L1460: 0 | M1460: =SUM(J1460:L1460)-16.74 -> 158.76999999999998 | N1460: 16.739999999999998 | O1460: =SUM(M1460:N1460) -> 175.50999999999999
A1461: 5077 | B1461: KINROSS(RPM)-P | C1461: 20.346.524/0001-46 | D1461: 174.69999999999999 | E1461: 0 | F1461: 0 | G1461: 0 | H1461: 0 | I1461: 0 | J1461: 0 | K1461: 193.12 | L1461: 0 | M1461: =SUM(J1461:L1461)-18.42 -> 174.69999999999999 | N1461: 18.420000000000002 | O1461: =SUM(M1461:N1461) -> 193.12
A1462: 5078 | B1462: ARCELORMITTAL (SBM)-P | C1462: 17.469.701/0260-52 | D1462: 103.89 | E1462: 0 | F1462: 0 | G1462: 0 | H1462: 0 | I1462: 0 | J1462: 0 | K1462: 114.84 | L1462: 0 | M1462: =SUM(J1462:L1462)-10.95 -> 103.89 | N1462: 10.949999999999999 | O1462: =SUM(M1462:N1462) -> 114.84
A1463: 5079 | B1463: REPAR-P | C1463: 33.000.167/0809-70 | D1463: 44.990000000000002 | E1463: 0 | F1463: 0 | G1463: 0 | H1463: 0 | I1463: 0 | J1463: 0 | K1463: 49.729999999999997 | L1463: 0 | M1463: =SUM(J1463:L1463)-4.74 -> 44.989999999999995 | N1463: 4.7400000000000002 | O1463: =SUM(M1463:N1463) -> 49.729999999999997
A1464: 5080 | B1464: BRASKEM (COPESUL)-P | C1464: 42.150.391/0038-62 | D1464: 269.20999999999998 | E1464: 0 | F1464: 0 | G1464: 0 | H1464: 0 | I1464: 0 | J1464: 0 | K1464: 297.58999999999997 | L1464: 0 | M1464: =SUM(J1464:L1464)-28.38 -> 269.20999999999998 | N1464: 28.379999999999999 | O1464: =SUM(M1464:N1464) -> 297.58999999999997
A1465: 5083 | B1465: ATLANTIC NICKEL (MIRABELA) | C1465: 74.127.010/0004-71 | D1465: 43.799999999999997 | E1465: 0 | F1465: 0 | G1465: 0 | H1465: 0 | I1465: 0 | J1465: 0 | K1465: 48.420000000000002 | L1465: 0 | M1465: =SUM(J1465:L1465)-4.62 -> 43.800000000000004 | N1465: 4.6200000000000001 | O1465: =SUM(M1465:N1465) -> 48.420000000000002
A1466: 5084 | B1466: CASTERTECH-P | C1466: 08.304.706/0001-59 | D1466: 25.27 | E1466: 0 | F1466: 0 | G1466: 0 | H1466: 0 | I1466: 0 | J1466: 0 | K1466: 27.93 | L1466: 0 | M1466: =SUM(J1466:L1466)-2.66 -> 25.27 | N1466: 2.6600000000000001 | O1466: =SUM(M1466:N1466) -> 27.93
A1467: 5087 | B1467: COTEMINAS(CAMP. GRANDE) | C1467: 07.663.140/0006-01 | D1467: 73.819999999999993 | E1467: 0 | F1467: 0 | G1467: 0 | H1467: 0 | I1467: 0 | J1467: 0 | K1467: 81.599999999999994 | L1467: 0 | M1467: =SUM(J1467:L1467)-7.78 -> 73.819999999999993 | N1467: 7.7800000000000002 | O1467: =SUM(M1467:N1467) -> 81.599999999999994
A1468: 5088 | B1468: VALLOUREC | C1468: 08.689.024/0002-92 | D1468: 179.93000000000001 | E1468: 0 | F1468: 0 | G1468: 0 | H1468: 0 | I1468: 0 | J1468: 0 | K1468: 198.90000000000001 | L1468: 0 | M1468: =SUM(J1468:L1468)-18.97 -> 179.93000000000001 | N1468: 18.969999999999999 | O1468: =SUM(M1468:N1468) -> 198.90000000000001
A1469: 5091 | B1469: ANGLO AMERICAN (BARRO ALTO) | C1469: 42.184.226/0011-01 | D1469: 258.64999999999998 | E1469: 0 | F1469: 0 | G1469: 0 | H1469: 0 | I1469: 0 | J1469: 0 | K1469: 285.92000000000002 | L1469: 0 | M1469: =SUM(J1469:L1469)-27.27 -> 258.65000000000003 | N1469: 27.27 | O1469: =SUM(M1469:N1469) -> 285.92000000000002
A1470: 5092 | B1470: VIPAL | C1470: 87.870.952/0001-44 | D1470: 17.510000000000002 | E1470: 0 | F1470: 0 | G1470: 0 | H1470: 0 | I1470: 0 | J1470: 0 | K1470: 19.359999999999999 | L1470: 0 | M1470: =SUM(J1470:L1470)-1.85 -> 17.509999999999998 | N1470: 1.8500000000000001 | O1470: =SUM(M1470:N1470) -> 19.359999999999999
A1471: 5094 | B1471: UTE SANTA LUZIA I-CARGA | C1471: 08.906.558/0001-42 | D1471: 2.5899999999999999 | E1471: 0 | F1471: 0 | G1471: 0 | H1471: 0 | I1471: 0 | J1471: 0 | K1471: 2.8599999999999999 | L1471: 0 | M1471: =SUM(J1471:L1471)-0.27 -> 2.5899999999999999 | N1471: 0.27000000000000002 | O1471: =SUM(M1471:N1471) -> 2.8599999999999999
A1472: 5096 | B1472: SJC (UTE QUIRINÓPOLIS)-CARGA | C1472: 10.249.419/0002-16 | D1472: 3.23 | E1472: 0 | F1472: 0 | G1472: 0 | H1472: 0 | I1472: 0 | J1472: 0 | K1472: 3.5699999999999998 | L1472: 0 | M1472: =SUM(J1472:L1472)-0.34 -> 3.23 | N1472: 0.34000000000000002 | O1472: =SUM(M1472:N1472) -> 3.5699999999999998
A1473: 5097 | B1473: UTE ELDORADO-CARGA | C1473: 05.620.523/0002-35 | D1473: 7.1500000000000004 | E1473: 0 | F1473: 0 | G1473: 0 | H1473: 0 | I1473: 0 | J1473: 0 | K1473: 7.9000000000000004 | L1473: 0 | M1473: =SUM(J1473:L1473)-0.75 -> 7.1500000000000004 | N1473: 0.75 | O1473: =SUM(M1473:N1473) -> 7.9000000000000004
A1474: 5098 | B1474: TERNIUM(UTE ATLÂNTICO)-RC | C1474: 07.005.330/0001-19 | D1474: 339.61000000000001 | E1474: 0 | F1474: 0 | G1474: 0 | H1474: 0 | I1474: 0 | J1474: 0 | K1474: 375.41000000000003 | L1474: 0 | M1474: =SUM(J1474:L1474)-35.8 -> 339.61000000000001 | N1474: 35.799999999999997 | O1474: =SUM(M1474:N1474) -> 375.41000000000003
A1475: 5100 | B1475: VALE SALOBO | C1475: 33.931.478/0002-75 | D1475: 206.93000000000001 | E1475: 0 | F1475: 0 | G1475: 0 | H1475: 0 | I1475: 0 | J1475: 0 | K1475: 228.74000000000001 | L1475: 0 | M1475: =SUM(J1475:L1475)-21.81 -> 206.93000000000001 | N1475: 21.809999999999999 | O1475: =SUM(M1475:N1475) -> 228.74000000000001
A1476: 5101 | B1476: KLABIN | C1476: 89.637.490/0133-95 | D1476: 196.38 | E1476: 0 | F1476: 0 | G1476: 0 | H1476: 0 | I1476: 0 | J1476: 0 | K1476: 217.08000000000001 | L1476: 0 | M1476: =SUM(J1476:L1476)-20.7 -> 196.38000000000002 | N1476: 20.699999999999999 | O1476: =SUM(M1476:N1476) -> 217.08000000000001
A1477: 5102 | B1477: BERNECK (CARGA)-P | C1477: 81.905.176/0001-94 | D1477: 39.090000000000003 | E1477: 0 | F1477: 0 | G1477: 0 | H1477: 0 | I1477: 0 | J1477: 0 | K1477: 43.210000000000001 | L1477: 0 | M1477: =SUM(J1477:L1477)-4.12 -> 39.090000000000003 | N1477: 4.1200000000000001 | O1477: =SUM(M1477:N1477) -> 43.210000000000001
A1478: 5103 | B1478: UNIPAR INDUPA (SOLVAY) | C1478: 61.460.325/0004-94 | D1478: 131.25999999999999 | E1478: 0 | F1478: 0 | G1478: 0 | H1478: 0 | I1478: 0 | J1478: 0 | K1478: 145.09999999999999 | L1478: 0 | M1478: =SUM(J1478:L1478)-13.84 -> 131.25999999999999 | N1478: 13.84 | O1478: =SUM(M1478:N1478) -> 145.09999999999999
A1479: 5104 | B1479: UTE COSTA RICA-CARGA | C1479: 08.070.566/0016-88 | D1479: 0 | E1479: 0 | F1479: 0 | G1479: 0 | H1479: 0 | I1479: 0 | J1479: 0 | K1479: 0 | L1479: 0 | M1479: =SUM(J1479:L1479)-0 -> 0 | N1479: 0 | O1479: =SUM(M1479:N1479) -> 0
A1480: 5105 | B1480: MATARIPE (RLAM) | C1480: 41.777.706/0001-41 | D1480: 71.620000000000005 | E1480: 0 | F1480: 0 | G1480: 0 | H1480: 0 | I1480: 0 | J1480: 0 | K1480: 79.170000000000002 | L1480: 0 | M1480: =SUM(J1480:L1480)-7.55 -> 71.620000000000005 | N1480: 7.5499999999999998 | O1480: =SUM(M1480:N1480) -> 79.170000000000002
A1481: 5106 | B1481: PROQUIGEL (PETROBRAS FAFEN) | C1481: 27.515.154/0020-35 | D1481: 20.460000000000001 | E1481: 0 | F1481: 0 | G1481: 0 | H1481: 0 | I1481: 0 | J1481: 0 | K1481: 22.620000000000001 | L1481: 0 | M1481: =SUM(J1481:L1481)-2.16 -> 20.460000000000001 | N1481: 2.1600000000000001 | O1481: =SUM(M1481:N1481) -> 22.620000000000001
A1482: 5107 | B1482: RIMA | C1482: 18.279.158/0010-07 | D1482: 116.22 | E1482: 0 | F1482: 0 | G1482: 0 | H1482: 0 | I1482: 0 | J1482: 0 | K1482: 128.47 | L1482: 0 | M1482: =SUM(J1482:L1482)-12.25 -> 116.22 | N1482: 12.25 | O1482: =SUM(M1482:N1482) -> 128.47
A1483: 5108 | B1483: TOYOTA | C1483: 59.104.760/0006-04 | D1483: 10.06 | E1483: 0 | F1483: 0 | G1483: 0 | H1483: 0 | I1483: 0 | J1483: 0 | K1483: 11.119999999999999 | L1483: 0 | M1483: =SUM(J1483:L1483)-1.06 -> 10.059999999999999 | N1483: 1.0600000000000001 | O1483: =SUM(M1483:N1483) -> 11.119999999999999
A1484: 5111 | B1484: ANGLO FERROUS | C1484: 02.359.572/0004-30 | D1484: 146.62 | E1484: 0 | F1484: 0 | G1484: 0 | H1484: 0 | I1484: 0 | J1484: 0 | K1484: 162.08000000000001 | L1484: 0 | M1484: =SUM(J1484:L1484)-15.46 -> 146.62 | N1484: 15.460000000000001 | O1484: =SUM(M1484:N1484) -> 162.08000000000001
A1485: 5114 | B1485: UTE MORRO VERMELHO-CARGA | C1485: 08.070.566/0012-54 | D1485: 0 | E1485: 0 | F1485: 0 | G1485: 0 | H1485: 0 | I1485: 0 | J1485: 0 | K1485: 0 | L1485: 0 | M1485: =SUM(J1485:L1485)-0 -> 0 | N1485: 0 | O1485: =SUM(M1485:N1485) -> 0
A1486: 5115 | B1486: VALE S11D (MINA SERRA SUL) | C1486: 33.592.510/0089-96 | D1486: 33.270000000000003 | E1486: 0 | F1486: 0 | G1486: 0 | H1486: 0 | I1486: 0 | J1486: 0 | K1486: 36.780000000000001 | L1486: 0 | M1486: =SUM(J1486:L1486)-3.51 -> 33.270000000000003 | N1486: 3.5099999999999998 | O1486: =SUM(M1486:N1486) -> 36.780000000000001
A1487: 5116 | B1487: VALE MINA CONCEIÇÃO | C1487: 33.592.510/0164-09 | D1487: 149.03999999999999 | E1487: 0 | F1487: 0 | G1487: 0 | H1487: 0 | I1487: 0 | J1487: 0 | K1487: 164.75 | L1487: 0 | M1487: =SUM(J1487:L1487)-15.71 -> 149.03999999999999 | N1487: 15.710000000000001 | O1487: =SUM(M1487:N1487) -> 164.75
A1488: 5117 | B1488: PETROBRAS(RNEST) | C1488: 33.000.167/1111-08 | D1488: 48.640000000000001 | E1488: 0 | F1488: 0 | G1488: 0 | H1488: 0 | I1488: 0 | J1488: 0 | K1488: 53.770000000000003 | L1488: 0 | M1488: =SUM(J1488:L1488)-5.13 -> 48.640000000000001 | N1488: 5.1299999999999999 | O1488: =SUM(M1488:N1488) -> 53.770000000000003
A1489: 5118 | B1489: UTE ALTO TAQUARI-CARGA | C1489: 08.070.566/0017-69 | D1489: 0 | E1489: 0 | F1489: 0 | G1489: 0 | H1489: 0 | I1489: 0 | J1489: 0 | K1489: 0 | L1489: 0 | M1489: =SUM(J1489:L1489)-0 -> 0 | N1489: 0 | O1489: =SUM(M1489:N1489) -> 0
A1490: 5119 | B1490: COSAN (UTE JATAI)-CARGA | C1490: 18.686.104/0001-67 | D1490: 0 | E1490: 0 | F1490: 0 | G1490: 0 | H1490: 0 | I1490: 0 | J1490: 0 | K1490: 0 | L1490: 0 | M1490: =SUM(J1490:L1490)-0 -> 0 | N1490: 0 | O1490: =SUM(M1490:N1490) -> 0
A1491: 5120 | B1491: AÇO VERDE (GUSA) | C1491: 07.636.657/0002-70 | D1491: 65.709999999999994 | E1491: 0 | F1491: 0 | G1491: 0 | H1491: 0 | I1491: 0 | J1491: 0 | K1491: 72.640000000000001 | L1491: 0 | M1491: =SUM(J1491:L1491)-6.93 -> 65.710000000000008 | N1491: 6.9299999999999997 | O1491: =SUM(M1491:N1491) -> 72.640000000000015
A1492: 5124 | B1492: SAMARCO GERMANO-P | C1492: 16.628.281/0003-23 | D1492: 94.180000000000007 | E1492: 0 | F1492: 0 | G1492: 0 | H1492: 0 | I1492: 0 | J1492: 0 | K1492: 104.11 | L1492: 0 | M1492: =SUM(J1492:L1492)-9.93 -> 94.180000000000007 | N1492: 9.9299999999999997 | O1492: =SUM(M1492:N1492) -> 104.11000000000001
A1493: 5125 | B1493: TROPICAL BIOENERGIA-(CARGA) | C1493: 08.195.806/0001-94 | D1493: 5.9199999999999999 | E1493: 0 | F1493: 0 | G1493: 0 | H1493: 0 | I1493: 0 | J1493: 0 | K1493: 6.54 | L1493: 0 | M1493: =SUM(J1493:L1493)-0.62 -> 5.9199999999999999 | N1493: 0.62 | O1493: =SUM(M1493:N1493) -> 6.54
A1494: 5126 | B1494: GV DO BRASIL | C1494: 12.884.632/0001-44 | D1494: 96.739999999999995 | E1494: 0 | F1494: 0 | G1494: 0 | H1494: 0 | I1494: 0 | J1494: 0 | K1494: 106.94 | L1494: 0 | M1494: =SUM(J1494:L1494)-10.2 -> 96.739999999999995 | N1494: 10.199999999999999 | O1494: =SUM(M1494:N1494) -> 106.94
A1495: 5127 | B1495: NORFIL | C1495: 02.341.494/0001-01 | D1495: 57.549999999999997 | E1495: 0 | F1495: 0 | G1495: 0 | H1495: 0 | I1495: 0 | J1495: 0 | K1495: 63.619999999999997 | L1495: 0 | M1495: =SUM(J1495:L1495)-6.07 -> 57.549999999999997 | N1495: 6.0700000000000003 | O1495: =SUM(M1495:N1495) -> 63.619999999999997
A1496: 5128 | B1496: VALE(VARGEM GRANDE) | C1496: 33.592.510/0034-12 | D1496: 183.56999999999999 | E1496: 0 | F1496: 0 | G1496: 0 | H1496: 0 | I1496: 0 | J1496: 0 | K1496: 202.91999999999999 | L1496: 0 | M1496: =SUM(J1496:L1496)-19.35 -> 183.56999999999999 | N1496: 19.350000000000001 | O1496: =SUM(M1496:N1496) -> 202.91999999999999
A1497: 5129 | B1497: WHITE MARTINS (JECEABA) | C1497: 35.820.448/0195-89 | D1497: 12.35 | E1497: 0 | F1497: 0 | G1497: 0 | H1497: 0 | I1497: 0 | J1497: 0 | K1497: 13.65 | L1497: 0 | M1497: =SUM(J1497:L1497)-1.3 -> 12.35 | N1497: 1.3 | O1497: =SUM(M1497:N1497) -> 13.65
A1498: 5130 | B1498: CMPC | C1498: 11.234.954/0001-85 | D1498: 0.20999999999999999 | E1498: 0 | F1498: 0 | G1498: 0 | H1498: 0 | I1498: 0 | J1498: 0 | K1498: 0.23000000000000001 | L1498: 0 | M1498: =SUM(J1498:L1498)-0.02 -> 0.21000000000000002 | N1498: 2.e-002 | O1498: =SUM(M1498:N1498) -> 0.23000000000000001
A1499: 5131 | B1499: CIMENTO APODI | C1499: 10.260.249/0003-51 | D1499: 20.579999999999998 | E1499: 0 | F1499: 0 | G1499: 0 | H1499: 0 | I1499: 0 | J1499: 0 | K1499: 22.75 | L1499: 0 | M1499: =SUM(J1499:L1499)-2.17 -> 20.579999999999998 | N1499: 2.1699999999999999 | O1499: =SUM(M1499:N1499) -> 22.75
A1500: 5132 | B1500: CODEVASF(PISF) | C1500: 00.399.857/0001-26 | D1500: 141.83000000000001 | E1500: 0 | F1500: 0 | G1500: 0 | H1500: 0 | I1500: 0 | J1500: 0 | K1500: 156.78 | L1500: 0 | M1500: =SUM(J1500:L1500)-14.95 -> 141.83000000000001 | N1500: 14.949999999999999 | O1500: =SUM(M1500:N1500) -> 156.78
A1501: 5133 | B1501: ELIZABETH CIMENTOS | C1501: 12.186.380/0001-80 | D1501: 22.510000000000002 | E1501: 0 | F1501: 0 | G1501: 0 | H1501: 0 | I1501: 0 | J1501: 0 | K1501: 24.879999999999999 | L1501: 0 | M1501: =SUM(J1501:L1501)-2.37 -> 22.509999999999998 | N1501: 2.3700000000000001 | O1501: =SUM(M1501:N1501) -> 24.879999999999999
A1502: 5134 | B1502: CIA DE CIMENTO DA PARAÍBA | C1502: 12.616.864/0002-00 | D1502: 26.120000000000001 | E1502: 0 | F1502: 0 | G1502: 0 | H1502: 0 | I1502: 0 | J1502: 0 | K1502: 28.870000000000001 | L1502: 0 | M1502: =SUM(J1502:L1502)-2.75 -> 26.120000000000001 | N1502: 2.75 | O1502: =SUM(M1502:N1502) -> 28.870000000000001
A1503: 5135 | B1503: CIA SIDERURGICA DO PECEM-CARGA | C1503: 09.509.535/0001-67 | D1503: 101.65000000000001 | E1503: 0 | F1503: 0 | G1503: 0 | H1503: 0 | I1503: 0 | J1503: 0 | K1503: 112.37 | L1503: 0 | M1503: =SUM(J1503:L1503)-10.72 -> 101.65000000000001 | N1503: 10.720000000000001 | O1503: =SUM(M1503:N1503) -> 112.37
A1504: 5136 | B1504: UTE KLABIN-(CARGA) | C1504: 89.637.490/0165-72 | D1504: 138.09999999999999 | E1504: 0 | F1504: 0 | G1504: 0 | H1504: 0 | I1504: 0 | J1504: 0 | K1504: 152.66 | L1504: 0 | M1504: =SUM(J1504:L1504)-14.56 -> 138.09999999999999 | N1504: 14.56 | O1504: =SUM(M1504:N1504) -> 152.66
A1505: 5137 | B1505: GERDAU (CHARQUEADAS) | C1505: 33.611.500/0182-47 | D1505: 103.65000000000001 | E1505: 0 | F1505: 0 | G1505: 0 | H1505: 0 | I1505: 0 | J1505: 0 | K1505: 114.58 | L1505: 0 | M1505: =SUM(J1505:L1505)-10.93 -> 103.65000000000001 | N1505: 10.93 | O1505: =SUM(M1505:N1505) -> 114.58000000000001
A1506: 5138 | B1506: UTE IACO-(CARGA) | C1506: 07.895.728/0006-82 | D1506: 3.1800000000000002 | E1506: 0 | F1506: 0 | G1506: 0 | H1506: 0 | I1506: 0 | J1506: 0 | K1506: 3.52 | L1506: 0 | M1506: =SUM(J1506:L1506)-0.34 -> 3.1800000000000002 | N1506: 0.34000000000000002 | O1506: =SUM(M1506:N1506) -> 3.52
A1507: 5139 | B1507: CERRADINHO (P. DAS AGUAS)-CARGA | C1507: 08.322.396/0001-03 | D1507: 0 | E1507: 0 | F1507: 0 | G1507: 0 | H1507: 0 | I1507: 0 | J1507: 0 | K1507: 0 | L1507: 0 | M1507: =SUM(J1507:L1507)-0 -> 0 | N1507: 0 | O1507: =SUM(M1507:N1507) -> 0
A1508: 5143 | B1508: VALE PELOTIZAÇÃO | C1508: 33.592.510/0434-73 | D1508: 38.770000000000003 | E1508: 0 | F1508: 0 | G1508: 0 | H1508: 0 | I1508: 0 | J1508: 0 | K1508: 42.859999999999999 | L1508: 0 | M1508: =SUM(J1508:L1508)-4.09 -> 38.769999999999996 | N1508: 4.0899999999999999 | O1508: =SUM(M1508:N1508) -> 42.859999999999999
A1509: 5144 | B1509: JBS COUROS ITUMBIARA | C1509: 02.916.265/0098-92 | D1509: 5.04 | E1509: 0 | F1509: 0 | G1509: 0 | H1509: 0 | I1509: 0 | J1509: 0 | K1509: 5.5700000000000003 | L1509: 0 | M1509: =SUM(J1509:L1509)-0.53 -> 5.04 | N1509: 0.53000000000000003 | O1509: =SUM(M1509:N1509) -> 5.5700000000000003
A1510: 5145 | B1510: WHITE MARTINS CUBATÃO | C1510: 35.820.448/0174-54 | D1510: 8.9499999999999993 | E1510: 0 | F1510: 0 | G1510: 0 | H1510: 0 | I1510: 0 | J1510: 0 | K1510: 9.8900000000000006 | L1510: 0 | M1510: =SUM(J1510:L1510)-0.94 -> 8.9500000000000011 | N1510: 0.93999999999999995 | O1510: =SUM(M1510:N1510) -> 9.8900000000000006
A1511: 5146 | B1511: USIMINAS CUBATÃO | C1511: 60.894.730/0063-08 | D1511: 117.90000000000001 | E1511: 0 | F1511: 0 | G1511: 0 | H1511: 0 | I1511: 0 | J1511: 0 | K1511: 130.33000000000001 | L1511: 0 | M1511: =SUM(J1511:L1511)-12.43 -> 117.90000000000001 | N1511: 12.43 | O1511: =SUM(M1511:N1511) -> 130.33000000000001
A1512: 5147 | B1512: PETROBRAS SIX | C1512: 40.254.927/0001-72 | D1512: 18.440000000000001 | E1512: 0 | F1512: 0 | G1512: 0 | H1512: 0 | I1512: 0 | J1512: 0 | K1512: 20.379999999999999 | L1512: 0 | M1512: =SUM(J1512:L1512)-1.94 -> 18.439999999999998 | N1512: 1.9399999999999999 | O1512: =SUM(M1512:N1512) -> 20.379999999999999
A1513: 5149 | B1513: ARLANXEO CABO | C1513: 29.667.227/0010-68 | D1513: 10.42 | E1513: 0 | F1513: 0 | G1513: 0 | H1513: 0 | I1513: 0 | J1513: 0 | K1513: 11.52 | L1513: 0 | M1513: =SUM(J1513:L1513)-1.1 -> 10.42 | N1513: 1.1000000000000001 | O1513: =SUM(M1513:N1513) -> 11.52
A1514: 5150 | B1514: VOTORANTIM JARDIM | C1514: 10.656.452/0023-95 | D1514: 53.289999999999999 | E1514: 0 | F1514: 0 | G1514: 0 | H1514: 0 | I1514: 0 | J1514: 0 | K1514: 58.909999999999997 | L1514: 0 | M1514: =SUM(J1514:L1514)-5.62 -> 53.289999999999999 | N1514: 5.6200000000000001 | O1514: =SUM(M1514:N1514) -> 58.909999999999997
A1515: 5151 | B1515: VOTORANTIM RIO BRANCO | C1515: 01.637.895/0106-00 | D1515: 92.260000000000005 | E1515: 0 | F1515: 0 | G1515: 0 | H1515: 0 | I1515: 0 | J1515: 0 | K1515: 101.98999999999999 | L1515: 0 | M1515: =SUM(J1515:L1515)-9.73 -> 92.259999999999991 | N1515: 9.7300000000000004 | O1515: =SUM(M1515:N1515) -> 101.98999999999999
A1516: 5152 | B1516: ARCELORMITTAL (JOINVILLE) | C1516: 17.469.701/0106-44 | D1516: 87.670000000000002 | E1516: 0 | F1516: 0 | G1516: 0 | H1516: 0 | I1516: 0 | J1516: 0 | K1516: 96.909999999999997 | L1516: 0 | M1516: =SUM(J1516:L1516)-9.24 -> 87.670000000000002 | N1516: 9.2400000000000002 | O1516: =SUM(M1516:N1516) -> 96.909999999999997
A1517: 5153 | B1517: UTE CUBATÃO - CARGA | C1517: 33.000.167/0116-50 | D1517: 35.219999999999999 | E1517: 0 | F1517: 0 | G1517: 0 | H1517: 0 | I1517: 0 | J1517: 0 | K1517: 38.93 | L1517: 0 | M1517: =SUM(J1517:L1517)-3.71 -> 35.219999999999999 | N1517: 3.71 | O1517: =SUM(M1517:N1517) -> 38.93
A1518: 5154 | B1518: GERDAU (INDUSTRIAL) | C1518: 07.358.761/0007-54 | D1518: 36.229999999999997 | E1518: 0 | F1518: 0 | G1518: 0 | H1518: 0 | I1518: 0 | J1518: 0 | K1518: 40.049999999999997 | L1518: 0 | M1518: =SUM(J1518:L1518)-3.82 -> 36.229999999999997 | N1518: 3.8199999999999998 | O1518: =SUM(M1518:N1518) -> 40.049999999999997
A1519: 5156 | B1519: VOTORANTIM SOBRAL | C1519: 10.656.452/0053-00 | D1519: 26.030000000000001 | E1519: 0 | F1519: 0 | G1519: 0 | H1519: 0 | I1519: 0 | J1519: 0 | K1519: 28.77 | L1519: 0 | M1519: =SUM(J1519:L1519)-2.74 -> 26.030000000000001 | N1519: 2.7400000000000002 | O1519: =SUM(M1519:N1519) -> 28.770000000000003
A1520: 5157 | B1520: ARAUCO | C1520: 00.606.549/0026-82 | D1520: 15.93 | E1520: 0 | F1520: 0 | G1520: 0 | H1520: 0 | I1520: 0 | J1520: 0 | K1520: 17.609999999999999 | L1520: 0 | M1520: =SUM(J1520:L1520)-1.68 -> 15.93 | N1520: 1.6799999999999999 | O1520: =SUM(M1520:N1520) -> 17.609999999999999
A1521: 5158 | B1521: PETROBRAS (COMPERJ) | C1521: 33.000.167/0125-41 | D1521: 39.799999999999997 | E1521: 0 | F1521: 0 | G1521: 0 | H1521: 0 | I1521: 0 | J1521: 0 | K1521: 44 | L1521: 0 | M1521: =SUM(J1521:L1521)-4.2 -> 39.799999999999997 | N1521: 4.2000000000000002 | O1521: =SUM(M1521:N1521) -> 44
A1522: 5159 | B1522: MINERAÇÃO DARDANELOS | C1522: 42.416.651/0027-46 | D1522: 20.359999999999999 | E1522: 0 | F1522: 0 | G1522: 0 | H1522: 0 | I1522: 0 | J1522: 0 | K1522: 22.510000000000002 | L1522: 0 | M1522: =SUM(J1522:L1522)-2.15 -> 20.360000000000003 | N1522: 2.1499999999999999 | O1522: =SUM(M1522:N1522) -> 22.510000000000002
A1523: 5160 | B1523: HNK (PE) | C1523: 50.221.019/0054-48 | D1523: 3.1699999999999999 | E1523: 0 | F1523: 0 | G1523: 0 | H1523: 0 | I1523: 0 | J1523: 0 | K1523: 3.5 | L1523: 0 | M1523: =SUM(J1523:L1523)-0.33 -> 3.1699999999999999 | N1523: 0.33000000000000002 | O1523: =SUM(M1523:N1523) -> 3.5
A1524: 5161 | B1524: MINERAÇÃO VALE VERDE | C1524: 08.650.571/0001-83 | D1524: 54.390000000000001 | E1524: 0 | F1524: 0 | G1524: 0 | H1524: 0 | I1524: 0 | J1524: 0 | K1524: 60.119999999999997 | L1524: 0 | M1524: =SUM(J1524:L1524)-5.73 -> 54.390000000000001 | N1524: 5.7300000000000004 | O1524: =SUM(M1524:N1524) -> 60.120000000000005
A1525: 5162 | B1525: BRACELL (CARGA) | C1525: 53.943.098/0001-87 | D1525: 4.3300000000000001 | E1525: 0 | F1525: 0 | G1525: 0 | H1525: 0 | I1525: 0 | J1525: 0 | K1525: 4.79 | L1525: 0 | M1525: =SUM(J1525:L1525)-0.46 -> 4.3300000000000001 | N1525: 0.46000000000000002 | O1525: =SUM(M1525:N1525) -> 4.79
A1526: 5164 | B1526: HEINEKEN CAXIAS | C1526: 02.864.417/0020-90 | D1526: 2.5600000000000001 | E1526: 0 | F1526: 0 | G1526: 0 | H1526: 0 | I1526: 0 | J1526: 0 | K1526: 2.8300000000000001 | L1526: 0 | M1526: =SUM(J1526:L1526)-0.27 -> 2.5600000000000001 | N1526: 0.27000000000000002 | O1526: =SUM(M1526:N1526) -> 2.8300000000000001
A1527: 5165 | B1527: FIAT(PE) | C1527: 16.701.716/0036-86 | D1527: 90.920000000000002 | E1527: 0 | F1527: 0 | G1527: 0 | H1527: 0 | I1527: 0 | J1527: 0 | K1527: 100.5 | L1527: 0 | M1527: =SUM(J1527:L1527)-9.58 -> 90.920000000000002 | N1527: 9.5800000000000001 | O1527: =SUM(M1527:N1527) -> 100.5
A1528: 5166 | B1528: A100 ROW | C1528: 12.147.176/0018-06 | D1528: 14.390000000000001 | E1528: 0 | F1528: 0 | G1528: 0 | H1528: 0 | I1528: 0 | J1528: 0 | K1528: 15.91 | L1528: 0 | M1528: =SUM(J1528:L1528)-1.52 -> 14.390000000000001 | N1528: 1.52 | O1528: =SUM(M1528:N1528) -> 15.91
A1529: 5168 | B1529: UTE FS SORRISO (CARGA) | C1529: 20.003.699/0002-31 | D1529: 7.29 | E1529: 0 | F1529: 0 | G1529: 0 | H1529: 0 | I1529: 0 | J1529: 0 | K1529: 8.0600000000000005 | L1529: 0 | M1529: =SUM(J1529:L1529)-0.77 -> 7.2900000000000009 | N1529: 0.77000000000000002 | O1529: =SUM(M1529:N1529) -> 8.0600000000000005
A1530: 5169 | B1530: PETROBRAS (REPLAN) | C1530: 33.000.167/0643-47 | D1530: 98.239999999999995 | E1530: 0 | F1530: 0 | G1530: 0 | H1530: 0 | I1530: 0 | J1530: 0 | K1530: 108.59999999999999 | L1530: 0 | M1530: =SUM(J1530:L1530)-10.36 -> 98.239999999999995 | N1530: 10.359999999999999 | O1530: =SUM(M1530:N1530) -> 108.59999999999999
A1531: 5170 | B1531: GERDAU (MOGI) | C1531: 33.611.500/0178-60 | D1531: 0 | E1531: 0 | F1531: 0 | G1531: 0 | H1531: 0 | I1531: 0 | J1531: 0 | K1531: 0 | L1531: 0 | M1531: =SUM(J1531:L1531)-0 -> 0 | N1531: 0 | O1531: =SUM(M1531:N1531) -> 0
A1532: 5171 | B1532: UTE LWARCEL (CARGA) | C1532: 53.943.098/0001-87 | D1532: 4.8499999999999996 | E1532: 0 | F1532: 0 | G1532: 0 | H1532: 0 | I1532: 0 | J1532: 0 | K1532: 5.3600000000000003 | L1532: 0 | M1532: =SUM(J1532:L1532)-0.51 -> 4.8500000000000005 | N1532: 0.51000000000000001 | O1532: =SUM(M1532:N1532) -> 5.3600000000000003
A1533: 5172 | B1533: UTE MARLIM AZUL (CARGA) | C1533: 29.884.534/0002-90 | D1533: 9.4000000000000004 | E1533: 0 | F1533: 0 | G1533: 0 | H1533: 0 | I1533: 0 | J1533: 0 | K1533: 10.390000000000001 | L1533: 0 | M1533: =SUM(J1533:L1533)-0.99 -> 9.4000000000000004 | N1533: 0.98999999999999999 | O1533: =SUM(M1533:N1533) -> 10.390000000000001
A1534: 5173 | B1534: SINOBRAS | C1534: 07.933.914/0001-54 | D1534: 120.22 | E1534: 0 | F1534: 0 | G1534: 0 | H1534: 0 | I1534: 0 | J1534: 0 | K1534: 132.88999999999999 | L1534: 0 | M1534: =SUM(J1534:L1534)-12.67 -> 120.21999999999998 | N1534: 12.67 | O1534: =SUM(M1534:N1534) -> 132.88999999999999
A1535: 5174 | B1535: AIR LIQUIDE | C1535: 00.331.788/0020-81 | D1535: 5.0099999999999998 | E1535: 0 | F1535: 0 | G1535: 0 | H1535: 0 | I1535: 0 | J1535: 0 | K1535: 5.54 | L1535: 0 | M1535: =SUM(J1535:L1535)-0.53 -> 5.0099999999999998 | N1535: 0.53000000000000003 | O1535: =SUM(M1535:N1535) -> 5.54
A1536: 5175 | B1536: UTE NARDINI (CARGA) | C1536: 48.708.267/0015-60 | D1536: 2.1200000000000001 | E1536: 0 | F1536: 0 | G1536: 0 | H1536: 0 | I1536: 0 | J1536: 0 | K1536: 2.3399999999999999 | L1536: 0 | M1536: =SUM(J1536:L1536)-0.22 -> 2.1199999999999997 | N1536: 0.22 | O1536: =SUM(M1536:N1536) -> 2.3399999999999999
A1537: 5176 | B1537: ALPEK | C1537: 08.220.101/0001-80 | D1537: 64.959999999999994 | E1537: 0 | F1537: 0 | G1537: 0 | H1537: 0 | I1537: 0 | J1537: 0 | K1537: 71.810000000000002 | L1537: 0 | M1537: =SUM(J1537:L1537)-6.85 -> 64.960000000000008 | N1537: 6.8499999999999996 | O1537: =SUM(M1537:N1537) -> 71.810000000000002
A1538: 5177 | B1538: ARAGUAIA NM | C1538: 97.515.035/0007-90 | D1538: 116.48999999999999 | E1538: 0 | F1538: 0 | G1538: 0 | H1538: 0 | I1538: 0 | J1538: 0 | K1538: 128.77000000000001 | L1538: 0 | M1538: =SUM(J1538:L1538)-12.28 -> 116.49000000000001 | N1538: 12.279999999999999 | O1538: =SUM(M1538:N1538) -> 128.77000000000001
A1539: 5178 | B1539: GERDAU ARAUCÁRIA | C1539: 07.358.761/0048-22 | D1539: 50.950000000000003 | E1539: 0 | F1539: 0 | G1539: 0 | H1539: 0 | I1539: 0 | J1539: 0 | K1539: 56.32 | L1539: 0 | M1539: =SUM(J1539:L1539)-5.37 -> 50.950000000000003 | N1539: 5.3700000000000001 | O1539: =SUM(M1539:N1539) -> 56.32
A1540: 5179 | B1540: PERÓXIDOS | C1540: 51.784.262/0001-25 | D1540: 24.030000000000001 | E1540: 0 | F1540: 0 | G1540: 0 | H1540: 0 | I1540: 0 | J1540: 0 | K1540: 26.559999999999999 | L1540: 0 | M1540: =SUM(J1540:L1540)-2.53 -> 24.029999999999998 | N1540: 2.5299999999999998 | O1540: =SUM(M1540:N1540) -> 26.559999999999999
A1541: 5180 | B1541: UTE ASOLO 2 (CARGA) | C1541: 41.675.130/0001-01 | D1541: 0.10000000000000001 | E1541: 0 | F1541: 0 | G1541: 0 | H1541: 0 | I1541: 0 | J1541: 0 | K1541: 0.11 | L1541: 0 | M1541: =SUM(J1541:L1541)-0.01 -> 0.10000000000000001 | N1541: 1.e-002 | O1541: =SUM(M1541:N1541) -> 0.11
A1542: 5181 | B1542: WHB AUTOMOTIVE | C1542: 01.261.681/0001-04 | D1542: 56.43 | E1542: 0 | F1542: 0 | G1542: 0 | H1542: 0 | I1542: 0 | J1542: 0 | K1542: 62.380000000000003 | L1542: 0 | M1542: =SUM(J1542:L1542)-5.95 -> 56.43 | N1542: 5.9500000000000002 | O1542: =SUM(M1542:N1542) -> 62.380000000000003
A1543: 5182 | B1543: UTE PORTO DAS AGUAS II (CARGA) | C1543: 08.322.396/0001-03 | D1543: 1.0600000000000001 | E1543: 0 | F1543: 0 | G1543: 0 | H1543: 0 | I1543: 0 | J1543: 0 | K1543: 1.1699999999999999 | L1543: 0 | M1543: =SUM(J1543:L1543)-0.11 -> 1.0599999999999998 | N1543: 0.11 | O1543: =SUM(M1543:N1543) -> 1.1699999999999999
A1544: 6012 | B1544: TRADENER | C1544: 02.691.745/0001-70 | D1544: 284.38999999999999 | E1544: 0 | F1544: 0 | G1544: 0 | H1544: 0 | I1544: 0 | J1544: 314.37 | K1544: 0 | L1544: 0 | M1544: =SUM(J1544:L1544)-29.98 -> 284.38999999999999 | N1544: 29.98 | O1544: =SUM(M1544:N1544) -> 314.37
A1545: 8002 | B1545: BRASKEM(COPENE)-PL | C1545: 42.150.391/0001-70 | D1545: 193.97 | E1545: 0 | F1545: 0 | G1545: 0 | H1545: 0 | I1545: 0 | J1545: 0 | K1545: 214.41999999999999 | L1545: 0 | M1545: =SUM(J1545:L1545)-20.45 -> 193.97 | N1545: 20.449999999999999 | O1545: =SUM(M1545:N1545) -> 214.41999999999999
A1546: 8003 | B1546: BRASKEM(UCS-AL)-PL | C1546: 42.150.391/0022-03 | D1546: 241.75 | E1546: 0 | F1546: 0 | G1546: 0 | H1546: 0 | I1546: 0 | J1546: 0 | K1546: 267.23000000000002 | L1546: 0 | M1546: =SUM(J1546:L1546)-25.48 -> 241.75000000000003 | N1546: 25.48 | O1546: =SUM(M1546:N1546) -> 267.23000000000002
A1547: 8005 | B1547: PARANAPANEMA(CAR. METAIS)-PL | C1547: 60.398.369/0004-79 | D1547: 62.079999999999998 | E1547: 0 | F1547: 0 | G1547: 0 | H1547: 0 | I1547: 0 | J1547: 0 | K1547: 68.620000000000005 | L1547: 0 | M1547: =SUM(J1547:L1547)-6.54 -> 62.080000000000005 | N1547: 6.54 | O1547: =SUM(M1547:N1547) -> 68.620000000000005
A1548: 8006 | B1548: DOW-PL | C1548: 60.435.351/0017-14 | D1548: 191.94999999999999 | E1548: 0 | F1548: 0 | G1548: 0 | H1548: 0 | I1548: 0 | J1548: 0 | K1548: 212.18000000000001 | L1548: 0 | M1548: =SUM(J1548:L1548)-20.23 -> 191.95000000000002 | N1548: 20.23 | O1548: =SUM(M1548:N1548) -> 212.18000000000001
A1549: 8008 | B1549: FERBASA-PL | C1549: 15.141.799/0001-03 | D1549: 358.31999999999999 | E1549: 0 | F1549: 0 | G1549: 0 | H1549: 0 | I1549: 0 | J1549: 0 | K1549: 396.08999999999997 | L1549: 0 | M1549: =SUM(J1549:L1549)-37.77 -> 358.31999999999999 | N1549: 37.770000000000003 | O1549: =SUM(M1549:N1549) -> 396.08999999999997
A1550: 8009 | B1550: GERDAU(AÇONORTE)-PL | C1550: 07.358.761/0051-28 | D1550: 33.5 | E1550: 0 | F1550: 0 | G1550: 0 | H1550: 0 | I1550: 0 | J1550: 0 | K1550: 37.030000000000001 | L1550: 0 | M1550: =SUM(J1550:L1550)-3.53 -> 33.5 | N1550: 3.5299999999999998 | O1550: =SUM(M1550:N1550) -> 37.030000000000001
A1551: 8010 | B1551: GERDAU(USIBA)-PL | C1551: 07.358.761/0005-92 | D1551: 3.1800000000000002 | E1551: 0 | F1551: 0 | G1551: 0 | H1551: 0 | I1551: 0 | J1551: 0 | K1551: 3.52 | L1551: 0 | M1551: =SUM(J1551:L1551)-0.34 -> 3.1800000000000002 | N1551: 0.34000000000000002 | O1551: =SUM(M1551:N1551) -> 3.52
A1552: 8011 | B1552: LIBRA-PL | C1552: 10.500.221/0001-82 | D1552: 8.7400000000000002 | E1552: 0 | F1552: 0 | G1552: 0 | H1552: 0 | I1552: 0 | J1552: 0 | K1552: 9.6600000000000001 | L1552: 0 | M1552: =SUM(J1552:L1552)-0.92 -> 8.7400000000000002 | N1552: 0.92000000000000004 | O1552: =SUM(M1552:N1552) -> 9.6600000000000001
A1553: 8012 | B1553: MINERAÇÃO CARAÍBA-PL | C1553: 42.509.257/0001-13 | D1553: 35.710000000000001 | E1553: 0 | F1553: 0 | G1553: 0 | H1553: 0 | I1553: 0 | J1553: 0 | K1553: 39.469999999999999 | L1553: 0 | M1553: =SUM(J1553:L1553)-3.76 -> 35.710000000000001 | N1553: 3.7599999999999998 | O1553: =SUM(M1553:N1553) -> 39.469999999999999
A1554: 8013 | B1554: VALE MANGANES (RDM)-PL | C1554: 15.144.306/0001-99 | D1554: 0 | E1554: 0 | F1554: 0 | G1554: 0 | H1554: 0 | I1554: 0 | J1554: 0 | K1554: 0 | L1554: 0 | M1554: =SUM(J1554:L1554)-0 -> 0 | N1554: 0 | O1554: =SUM(M1554:N1554) -> 0
A1555: 8014 | B1555: HNK(P. SCHINCARIOL)-PL | C1555: 50.221.019/0057-90 | D1555: 17.039999999999999 | E1555: 0 | F1555: 0 | G1555: 0 | H1555: 0 | I1555: 0 | J1555: 0 | K1555: 18.84 | L1555: 0 | M1555: =SUM(J1555:L1555)-1.8 -> 17.039999999999999 | N1555: 1.8 | O1555: =SUM(M1555:N1555) -> 18.84
A1556: 8015 | B1556: ALUNORTE-PL | C1556: 05.848.387/0003-16 | D1556: 417.99000000000001 | E1556: 0 | F1556: 0 | G1556: 0 | H1556: 0 | I1556: 0 | J1556: 0 | K1556: 462.05000000000001 | L1556: 0 | M1556: =SUM(J1556:L1556)-44.06 -> 417.99000000000001 | N1556: 44.060000000000002 | O1556: =SUM(M1556:N1556) -> 462.05000000000001
A1557: 8016 | B1557: VALE(MINA)-PL | C1557: 33.592.510/0370-74 | D1557: 48.57 | E1557: 0 | F1557: 0 | G1557: 0 | H1557: 0 | I1557: 0 | J1557: 0 | K1557: 53.689999999999998 | L1557: 0 | M1557: =SUM(J1557:L1557)-5.12 -> 48.57 | N1557: 5.1200000000000001 | O1557: =SUM(M1557:N1557) -> 53.689999999999998
A1558: 8017 | B1558: VALE(SOSSEGO)-PL | C1558: 33.931.478/0009-41 | D1558: 31.359999999999999 | E1558: 0 | F1558: 0 | G1558: 0 | H1558: 0 | I1558: 0 | J1558: 0 | K1558: 34.670000000000002 | L1558: 0 | M1558: =SUM(J1558:L1558)-3.31 -> 31.360000000000003 | N1558: 3.3100000000000001 | O1558: =SUM(M1558:N1558) -> 34.670000000000002
A1559: 8019 | B1559: VALE(PORTO)-PL | C1559: 33.592.510/0424-00 | D1559: 88.689999999999998 | E1559: 0 | F1559: 0 | G1559: 0 | H1559: 0 | I1559: 0 | J1559: 0 | K1559: 98.040000000000006 | L1559: 0 | M1559: =SUM(J1559:L1559)-9.35 -> 88.690000000000012 | N1559: 9.3499999999999996 | O1559: =SUM(M1559:N1559) -> 98.040000000000006
A1560: 8020 | B1560: PALMYRA(DOW CORNING)-PL | C1560: 04.872.297/0001-36 | D1560: 78.769999999999996 | E1560: 0 | F1560: 0 | G1560: 0 | H1560: 0 | I1560: 0 | J1560: 0 | K1560: 87.069999999999993 | L1560: 0 | M1560: =SUM(J1560:L1560)-8.3 -> 78.769999999999996 | N1560: 8.3000000000000007 | O1560: =SUM(M1560:N1560) -> 87.069999999999993
A1561: Total Geral | D1561: =SUM(D19:D1560) -> 282140.93000000017 | E1561: =SUM(E19:E1560) -> 227906.47 | F1561: =SUM(F19:F1560) -> 0 | G1561: =SUM(G19:G1560) -> 0 | H1561: =SUM(H19:H1560) -> 0 | I1561: =SUM(I19:I1560) -> 0 | J1561: =SUM(J19:J1560) -> 34521.310000000005 | K1561: =SUM(K19:K1560) -> 495090.58999999828 | L1561: =SUM(L19:L1560) -> 34201.309999999998 | M1561: =SUM(M19:M1560) -> 510047.40000000177 | N1561: =SUM(N19:N1560) -> 53765.809999999939 | O1561: =SUM(O19:O1560) -> 563813.21000000113