B1: Relatório de Aviso de Crédito
A2: 1013 | B2: Empresa: ELETROSUL | D2: Número AVC: | E2: 33818
D4: Receita Anual Permitida | E4: 837439939.08000004
D5: Recebimento Mensal (receita Anual/12) | E5: 69786661.590000004
D6: Receita Permitida | E6: 69786661.590000004
D7: PIS/PASEP e COFINS * | E7: 8788672.3199999891
D8: Antecipação | E8: -3262120.04
D9: Parcela de Ajuste do Ciclo Anterior | E9: -328427.31
D10: Quota CCC Sist. Interligado | E10: 0
D11: Quota CCC Sist. Isolado | E11: 0
D12: Quota CDE | E12: 1707135.3300000001
D13: Quota Proinfa | E13: 417581.79999999999
D14: RBNIA TLP Não Devido | E14: -8896.8799999999992
D15: Receita Melhorias RMEL | E15: 645694.58999999997
D16: Receita de novas obras RBNI | E16: 9394762.9100000001
D17: Receita de novas obras RBNIA | E17: 346327.26000000001
D18: Rede de Fronteira | E18: 10191011.82
D19: Indisponibilidade de Equipamento | E19: -541011.89000000001
D20: Total s/ PIS/PASEP e COFINS | E20: 88348719.180000007
D21: Total c/ PIS/PASEP e COFINS | E21: 97137391.5
D23: * Alíquota PIS/PASEP e COFINS = 9,25% (com RGR = 0,00%)
B25: Usuárias | C25: CNPJ | D25: Rede Básica | E25: Total de Fronteira | F25: Quota Proinfa | G25: Quota CCC Sist. Interligado | H25: Quota CCC Sist. Isolado | I25: Quota CDE | J25: 1a. Parcela dia 15/11/2023 | K25: 2a. Parcela dia 25/11/2023 | L25: 3a. Parcela dia 05/12/2023 | M25: Total s/ PIS/PASEP e COFINS | N25: PIS/PASEP e COFINS | O25: Total c/ PIS/PASEP e COFINS
A26: 2001 | B26: RGE SUL (AES-SUL) | C26: 02.016.440/0001-62 | D26: 2062972.23 | E26: 1155448.99 | F26: 0 | G26: 0 | H26: 0 | I26: 0 | J26: 0 | K26: 3546469.6600000001 | L26: 0 | M26: =SUM(J26:L26)-328048.44 -> 3218421.2200000002 | N26: 328048.44 | O26: =SUM(M26:N26) -> 3546469.6600000001
A27: 2002 | B27: EDP SAO PAULO (BANDEIRANTE) | C27: 02.302.100/0001-06 | D27: 1398123.3700000001 | E27: 0 | F27: 0 | G27: 0 | H27: 0 | I27: 0 | J27: 513543.94 | K27: 513543.94 | L27: 513543.92999999999 | M27: =SUM(J27:L27)-142508.44 -> 1398123.3700000001 | N27: 142508.44 | O27: =SUM(M27:N27) -> 1540631.8100000001
A28: 2004 | B28: ENERGISA SUL-SUDESTE | C28: 07.282.377/0001-20 | D28: 356446.04999999999 | E28: 0 | F28: 0 | G28: 0 | H28: 0 | I28: 0 | J28: 0 | K28: 392778.02000000002 | L28: 0 | M28: =SUM(J28:L28)-36331.97 -> 356446.05000000005 | N28: 36331.970000000001 | O28: =SUM(M28:N28) -> 392778.02000000002
A29: 2006 | B29: CBA | C29: 61.409.892/0003-35 | D29: 23733.349999999999 | E29: 0 | F29: 0 | G29: 0 | H29: 0 | I29: 0 | J29: 0 | K29: 26152.450000000001 | L29: 0 | M29: =SUM(J29:L29)-2419.1 -> 23733.350000000002 | N29: 2419.0999999999999 | O29: =SUM(M29:N29) -> 26152.450000000001
A30: 2007 | B30: EQUATORIAL ALAGOAS (CEAL) | C30: 12.272.084/0001-00 | D30: 489246.42999999999 | E30: 0 | F30: 0 | G30: 0 | H30: 0 | I30: 0 | J30: 0 | K30: 539114.52000000002 | L30: 0 | M30: =SUM(J30:L30)-49868.09 -> 489246.43000000005 | N30: 49868.089999999997 | O30: =SUM(M30:N30) -> 539114.52000000002
A31: 2008 | B31: CEB | C31: 07.522.669/0001-92 | D31: 618535.92000000004 | E31: 0 | F31: 0 | G31: 0 | H31: 0 | I31: 0 | J31: 0 | K31: 681582.28000000003 | L31: 0 | M31: =SUM(J31:L31)-63046.36 -> 618535.92000000004 | N31: 63046.360000000001 | O31: =SUM(M31:N31) -> 681582.28000000003
A32: 2009 | B32: CEEE-D | C32: 08.467.115/0001-00 | D32: 1336771.1000000001 | E32: 146305.26000000001 | F32: 0 | G32: 0 | H32: 0 | I32: 0 | J32: 0 | K32: 1634243.9199999999 | L32: 0 | M32: =SUM(J32:L32)-151167.56 -> 1483076.3599999999 | N32: 151167.56 | O32: =SUM(M32:N32) -> 1634243.9199999999
A33: 2011 | B33: CELESC | C33: 08.336.783/0001-90 | D33: 2901972.21 | E33: 8014308.5 | F33: 0 | G33: 0 | H33: 0 | I33: 0 | J33: 0 | K33: 12028959.460000001 | L33: 0 | M33: =SUM(J33:L33)-1112678.75 -> 10916280.710000001 | N33: 1112678.75 | O33: =SUM(M33:N33) -> 12028959.460000001
A34: 2012 | B34: CELG-D | C34: 01.543.032/0001-04 | D34: 1215189.75 | E34: 0 | F34: 0 | G34: 0 | H34: 0 | I34: 0 | J34: 0 | K34: 1339052.0700000001 | L34: 0 | M34: =SUM(J34:L34)-123862.32 -> 1215189.75 | N34: 123862.32000000001 | O34: =SUM(M34:N34) -> 1339052.0700000001
A35: 2013 | B35: EQUATORIAL PARA (CELPA) | C35: 04.895.728/0001-80 | D35: 1172306.26 | E35: 0 | F35: 0 | G35: 0 | H35: 0 | I35: 0 | J35: 0 | K35: 1291797.53 | L35: 0 | M35: =SUM(J35:L35)-119491.27 -> 1172306.26 | N35: 119491.27 | O35: =SUM(M35:N35) -> 1291797.53
A36: 2014 | B36: CELPE | C36: 10.835.932/0001-08 | D36: 1167659.71 | E36: 0 | F36: 0 | G36: 0 | H36: 0 | I36: 0 | J36: 0 | K36: 1286677.3700000001 | L36: 0 | M36: =SUM(J36:L36)-119017.66 -> 1167659.7100000002 | N36: 119017.66 | O36: =SUM(M36:N36) -> 1286677.3700000001
A37: 2016 | B37: ENERGISA TO (CELTINS) | C37: 25.086.034/0001-71 | D37: 202266.72 | E37: 0 | F37: 0 | G37: 0 | H37: 0 | I37: 0 | J37: 0 | K37: 222883.44 | L37: 0 | M37: =SUM(J37:L37)-20616.72 -> 202266.72 | N37: 20616.720000000001 | O37: =SUM(M37:N37) -> 222883.44
A38: 2017 | B38: EQUATORIAL MARANHÃO (CEMAR) | C38: 06.272.793/0001-84 | D38: 644825.5 | E38: 0 | F38: 0 | G38: 0 | H38: 0 | I38: 0 | J38: 0 | K38: 710551.52000000002 | L38: 0 | M38: =SUM(J38:L38)-65726.02 -> 644825.5 | N38: 65726.020000000004 | O38: =SUM(M38:N38) -> 710551.52000000002
A39: 2018 | B39: ENERGISA MT (CEMAT) | C39: 03.467.321/0001-99 | D39: 763141.69999999995 | E39: 0 | F39: 0 | G39: 0 | H39: 0 | I39: 0 | J39: 0 | K39: 840927.48999999999 | L39: 0 | M39: =SUM(J39:L39)-77785.79 -> 763141.69999999995 | N39: 77785.789999999994 | O39: =SUM(M39:N39) -> 840927.48999999999
A40: 2019 | B40: CEMIG-D | C40: 06.981.180/0001-16 | D40: 4072166.5099999998 | E40: 0 | F40: 0 | G40: 0 | H40: 0 | I40: 0 | J40: 0 | K40: 4487235.8200000003 | L40: 0 | M40: =SUM(J40:L40)-415069.31 -> 4072166.5100000002 | N40: 415069.31 | O40: =SUM(M40:N40) -> 4487235.8200000003
A41: 2020 | B41: EQUATORIAL PIAUI (CEPISA) | C41: 06.840.748/0001-89 | D41: 416893.53000000003 | E41: 0 | F41: 0 | G41: 0 | H41: 0 | I41: 0 | J41: 0 | K41: 459386.81 | L41: 0 | M41: =SUM(J41:L41)-42493.28 -> 416893.53000000003 | N41: 42493.279999999999 | O41: =SUM(M41:N41) -> 459386.81000000006
A42: 2021 | B42: AMPLA | C42: 33.050.071/0001-58 | D42: 1246152.3500000001 | E42: 0 | F42: 0 | G42: 0 | H42: 0 | I42: 0 | J42: 0 | K42: 1373170.6299999999 | L42: 0 | M42: =SUM(J42:L42)-127018.28 -> 1246152.3499999999 | N42: 127018.28 | O42: =SUM(M42:N42) -> 1373170.6299999999
A43: 2024 | B43: JAGUARI | C43: 53.859.112/0001-69 | D43: 305186.09999999998 | E43: 0 | F43: 0 | G43: 0 | H43: 0 | I43: 0 | J43: 0 | K43: 336293.21999999997 | L43: 0 | M43: =SUM(J43:L43)-31107.12 -> 305186.09999999998 | N43: 31107.119999999999 | O43: =SUM(M43:N43) -> 336293.21999999997
A44: 2025 | B44: COELBA-D | C44: 15.139.629/0001-94 | D44: 2128992.8199999998 | E44: 0 | F44: 0 | G44: 0 | H44: 0 | I44: 0 | J44: 0 | K44: 2345997.6000000001 | L44: 0 | M44: =SUM(J44:L44)-217004.78 -> 2128992.8200000003 | N44: 217004.78 | O44: =SUM(M44:N44) -> 2345997.6000000001
A45: 2026 | B45: COELCE | C45: 07.047.251/0001-70 | D45: 855670.08999999997 | E45: 0 | F45: 0 | G45: 0 | H45: 0 | I45: 0 | J45: 0 | K45: 942887.15000000002 | L45: 0 | M45: =SUM(J45:L45)-87217.06 -> 855670.09000000008 | N45: 87217.059999999998 | O45: =SUM(M45:N45) -> 942887.15000000014
A46: 2027 | B46: COPEL-D | C46: 04.368.898/0001-06 | D46: 3807564.1600000001 | E46: 121964.25 | F46: 0 | G46: 0 | H46: 0 | I46: 0 | J46: 0 | K46: 4330058.8499999996 | L46: 0 | M46: =SUM(J46:L46)-400530.44 -> 3929528.4099999997 | N46: 400530.44 | O46: =SUM(M46:N46) -> 4330058.8499999996
A47: 2028 | B47: COSERN | C47: 08.324.196/0001-81 | D47: 412880.89000000001 | E47: 0 | F47: 0 | G47: 0 | H47: 0 | I47: 0 | J47: 0 | K47: 454965.16999999998 | L47: 0 | M47: =SUM(J47:L47)-42084.28 -> 412880.89000000001 | N47: 42084.279999999999 | O47: =SUM(M47:N47) -> 454965.17000000004
A48: 2030 | B48: CPFL-D | C48: 33.050.196/0001-88 | D48: 2673501.3999999999 | E48: 0 | F48: 0 | G48: 0 | H48: 0 | I48: 0 | J48: 0 | K48: 2946007.0499999998 | L48: 0 | M48: =SUM(J48:L48)-272505.65 -> 2673501.3999999999 | N48: 272505.65000000002 | O48: =SUM(M48:N48) -> 2946007.0499999998
A49: 2032 | B49: DME | C49: 23.664.303/0001-04 | D49: 34845.879999999997 | E49: 0 | F49: 0 | G49: 0 | H49: 0 | I49: 0 | J49: 0 | K49: 38397.660000000003 | L49: 0 | M49: =SUM(J49:L49)-3551.78 -> 34845.880000000005 | N49: 3551.7800000000002 | O49: =SUM(M49:N49) -> 38397.660000000003
A50: 2033 | B50: ELEKTRO | C50: 02.328.280/0001-97 | D50: 1636265.9399999999 | E50: 0 | F50: 0 | G50: 0 | H50: 0 | I50: 0 | J50: 0 | K50: 1803047.8700000001 | L50: 0 | M50: =SUM(J50:L50)-166781.93 -> 1636265.9400000002 | N50: 166781.92999999999 | O50: =SUM(M50:N50) -> 1803047.8700000001
A51: 2035 | B51: ELETROPAULO | C51: 61.695.227/0001-93 | D51: 3563670.2599999998 | E51: 0 | F51: 0 | G51: 0 | H51: 0 | I51: 0 | J51: 0 | K51: 3926909.3799999999 | L51: 0 | M51: =SUM(J51:L51)-363239.12 -> 3563670.2599999998 | N51: 363239.12 | O51: =SUM(M51:N51) -> 3926909.3799999999
A52: 2036 | B52: ENERGISA SE (ENERGIPE) | C52: 13.017.462/0001-63 | D52: 197878.57000000001 | E52: 0 | F52: 0 | G52: 0 | H52: 0 | I52: 0 | J52: 0 | K52: 218048.01000000001 | L52: 0 | M52: =SUM(J52:L52)-20169.44 -> 197878.57000000001 | N52: 20169.439999999999 | O52: =SUM(M52:N52) -> 218048.01000000001
A53: 2037 | B53: ENERGISA MS (ENERSUL) | C53: 15.413.826/0001-50 | D53: 519328.94 | E53: 607836 | F53: 0 | G53: 0 | H53: 0 | I53: 0 | J53: 0 | K53: 1242055.03 | L53: 0 | M53: =SUM(J53:L53)-114890.09 -> 1127164.9399999999 | N53: 114890.09 | O53: =SUM(M53:N53) -> 1242055.03
A54: 2038 | B54: EDP ES | C54: 28.152.650/0001-71 | D54: 767247.15000000002 | E54: 0 | F54: 0 | G54: 0 | H54: 0 | I54: 0 | J54: 281817.13 | K54: 281817.13 | L54: 281817.14000000001 | M54: =SUM(J54:L54)-78204.25 -> 767247.15000000002 | N54: 78204.25 | O54: =SUM(M54:N54) -> 845451.40000000002
A55: 2040 | B55: LIGHT-D | C55: 60.444.437/0001-46 | D55: 2350866.3199999998 | E55: 0 | F55: 0 | G55: 0 | H55: 0 | I55: 0 | J55: 0 | K55: 2590486.2999999998 | L55: 0 | M55: =SUM(J55:L55)-239619.98 -> 2350866.3199999998 | N55: 239619.98000000001 | O55: =SUM(M55:N55) -> 2590486.2999999998
A56: 2042 | B56: PIRATININGA | C56: 04.172.213/0001-51 | D56: 1159945.29 | E56: 0 | F56: 0 | G56: 0 | H56: 0 | I56: 0 | J56: 0 | K56: 1278176.6299999999 | L56: 0 | M56: =SUM(J56:L56)-118231.34 -> 1159945.2899999998 | N56: 118231.34 | O56: =SUM(M56:N56) -> 1278176.6299999999
A57: 2044 | B57: ENERGISA PB (SAELPA) | C57: 09.095.183/0001-40 | D57: 406328.65000000002 | E57: 0 | F57: 0 | G57: 0 | H57: 0 | I57: 0 | J57: 0 | K57: 447745.07000000001 | L57: 0 | M57: =SUM(J57:L57)-41416.42 -> 406328.65000000002 | N57: 41416.419999999998 | O57: =SUM(M57:N57) -> 447745.07000000001
A58: 2048 | B58: SULGIPE | C58: 13.255.658/0001-96 | D58: 32500.200000000001 | E58: 0 | F58: 0 | G58: 0 | H58: 0 | I58: 0 | J58: 11937.629999999999 | K58: 11937.629999999999 | L58: 11937.629999999999 | M58: =SUM(J58:L58)-3312.69 -> 32500.200000000001 | N58: 3312.6900000000001 | O58: =SUM(M58:N58) -> 35812.889999999999
A59: 2050 | B59: ELFSM | C59: 27.485.069/0001-09 | D59: 34188.089999999997 | E59: 0 | F59: 0 | G59: 0 | H59: 0 | I59: 0 | J59: 0 | K59: 37672.830000000002 | L59: 0 | M59: =SUM(J59:L59)-3484.74 -> 34188.090000000004 | N59: 3484.7399999999998 | O59: =SUM(M59:N59) -> 37672.830000000002
A60: 2051 | B60: ENERGISA MG (CFLCL) | C60: 19.527.639/0001-58 | D60: 60084.459999999999 | E60: 0 | F60: 0 | G60: 0 | H60: 0 | I60: 0 | J60: 0 | K60: 66208.770000000004 | L60: 0 | M60: =SUM(J60:L60)-6124.31 -> 60084.460000000006 | N60: 6124.3100000000004 | O60: =SUM(M60:N60) -> 66208.770000000004
A61: 2052 | B61: DCELT (IGUAÇÚ) | C61: 83.855.973/0001-30 | D61: 1536.4300000000001 | E61: 0 | F61: 0 | G61: 0 | H61: 0 | I61: 0 | J61: 0 | K61: 1693.04 | L61: 0 | M61: =SUM(J61:L61)-156.61 -> 1536.4299999999998 | N61: 156.61000000000001 | O61: =SUM(M61:N61) -> 1693.04
A62: 2053 | B62: ENERGISA AC (ELETROACRE) | C62: 04.065.033/0001-70 | D62: 45380.699999999997 | E62: 0 | F62: 0 | G62: 0 | H62: 0 | I62: 0 | J62: 0 | K62: 50006.279999999999 | L62: 0 | M62: =SUM(J62:L62)-4625.58 -> 45380.699999999997 | N62: 4625.5799999999999 | O62: =SUM(M62:N62) -> 50006.279999999999
A63: 2054 | B63: ENERGISA RONDONIA (CERON) | C63: 05.914.650/0001-66 | D63: 203159.94 | E63: 0 | F63: 0 | G63: 0 | H63: 0 | I63: 0 | J63: 0 | K63: 223867.70000000001 | L63: 0 | M63: =SUM(J63:L63)-20707.76 -> 203159.94 | N63: 20707.759999999998 | O63: =SUM(M63:N63) -> 223867.70000000001
A64: 2055 | B64: COPREL | C64: 90.660.754/0001-60 | D64: 24003.77 | E64: 0 | F64: 0 | G64: 0 | H64: 0 | I64: 0 | J64: 0 | K64: 26450.439999999999 | L64: 0 | M64: =SUM(J64:L64)-2446.67 -> 24003.769999999997 | N64: 2446.6700000000001 | O64: =SUM(M64:N64) -> 26450.439999999995
A65: 2057 | B65: HIDROPAN | C65: 91.982.348/0001-87 | D65: 11840.43 | E65: 0 | F65: 0 | G65: 0 | H65: 0 | I65: 0 | J65: 0 | K65: 13047.309999999999 | L65: 0 | M65: =SUM(J65:L65)-1206.88 -> 11840.43 | N65: 1206.8800000000001 | O65: =SUM(M65:N65) -> 13047.310000000001
A66: 2058 | B66: ELETROCAR | C66: 88.446.034/0001-55 | D66: 21430.189999999999 | E66: 91070 | F66: 0 | G66: 0 | H66: 0 | I66: 0 | J66: 0 | K66: 123967.14999999999 | L66: 0 | M66: =SUM(J66:L66)-11466.96 -> 112500.19 | N66: 11466.959999999999 | O66: =SUM(M66:N66) -> 123967.14999999999
A67: 2059 | B67: CERTAJA | C67: 97.839.922/0001-29 | D67: 12570.360000000001 | E67: 0 | F67: 0 | G67: 0 | H67: 0 | I67: 0 | J67: 0 | K67: 13851.639999999999 | L67: 0 | M67: =SUM(J67:L67)-1281.28 -> 12570.359999999999 | N67: 1281.28 | O67: =SUM(M67:N67) -> 13851.639999999999
A68: 2060 | B68: DEMEI | C68: 95.289.500/0001-00 | D68: 30179.060000000001 | E68: 0 | F68: 0 | G68: 0 | H68: 0 | I68: 0 | J68: 0 | K68: 33255.160000000003 | L68: 0 | M68: =SUM(J68:L68)-3076.1 -> 30179.060000000005 | N68: 3076.0999999999999 | O68: =SUM(M68:N68) -> 33255.160000000003
A69: 2061 | B69: CERILUZ | C69: 87.656.989/0001-74 | D69: 8731.1700000000001 | E69: 0 | F69: 0 | G69: 0 | H69: 0 | I69: 0 | J69: 0 | K69: 9621.1200000000008 | L69: 0 | M69: =SUM(J69:L69)-889.95 -> 8731.1700000000001 | N69: 889.95000000000005 | O69: =SUM(M69:N69) -> 9621.1200000000008
A70: 2063 | B70: COOPERA | C70: 83.646.653/0001-70 | D70: 24659.23 | E70: 0 | F70: 0 | G70: 0 | H70: 0 | I70: 0 | J70: 0 | K70: 27172.709999999999 | L70: 0 | M70: =SUM(J70:L70)-2513.48 -> 24659.23 | N70: 2513.48 | O70: =SUM(M70:N70) -> 27172.709999999999
A71: 2064 | B71: CEA-D | C71: 05.965.546/0001-09 | D71: 91689.729999999996 | E71: 0 | F71: 0 | G71: 0 | H71: 0 | I71: 0 | J71: 0 | K71: 101035.52 | L71: 0 | M71: =SUM(J71:L71)-9345.79 -> 91689.73000000001 | N71: 9345.7900000000009 | O71: =SUM(M71:N71) -> 101035.52000000002
A72: 2065 | B72: AMAZONAS-D | C72: 02.341.467/0001-20 | D72: 594511.37 | E72: 0 | F72: 0 | G72: 0 | H72: 0 | I72: 0 | J72: 0 | K72: 655108.94999999995 | L72: 0 | M72: =SUM(J72:L72)-60597.58 -> 594511.37 | N72: 60597.580000000002 | O72: =SUM(M72:N72) -> 655108.94999999995
A73: 2066 | B73: COOPERLUZ | C73: 95.824.322/0001-61 | D73: 8045.8199999999997 | E73: 0 | F73: 0 | G73: 0 | H73: 0 | I73: 0 | J73: 0 | K73: 8865.9200000000001 | L73: 0 | M73: =SUM(J73:L73)-820.1 -> 8045.8199999999997 | N73: 820.10000000000002 | O73: =SUM(M73:N73) -> 8865.9200000000001
A74: 2067 | B74: NOVA PALMA | C74: 89.889.604/0001-44 | D74: 571.59000000000003 | E74: 0 | F74: 0 | G74: 0 | H74: 0 | I74: 0 | J74: 0 | K74: 629.85000000000002 | L74: 0 | M74: =SUM(J74:L74)-58.26 -> 571.59000000000003 | N74: 58.259999999999998 | O74: =SUM(M74:N74) -> 629.85000000000002
A75: 2068 | B75: CHESP(SÃO PATRÍCIO) | C75: 01.377.555/0001-10 | D75: 11815 | E75: 0 | F75: 0 | G75: 0 | H75: 0 | I75: 0 | J75: 0 | K75: 13019.280000000001 | L75: 0 | M75: =SUM(J75:L75)-1204.28 -> 11815 | N75: 1204.28 | O75: =SUM(M75:N75) -> 13019.280000000001
A76: 2069 | B76: FORCEL | C76: 79.850.574/0001-09 | D76: 334.44999999999999 | E76: 0 | F76: 0 | G76: 0 | H76: 0 | I76: 0 | J76: 0 | K76: 368.54000000000002 | L76: 0 | M76: =SUM(J76:L76)-34.09 -> 334.45000000000005 | N76: 34.090000000000003 | O76: =SUM(M76:N76) -> 368.54000000000008
A77: 2070 | B77: MUXENERGIA | C77: 97.578.090/0001-34 | D77: 504.70999999999998 | E77: 0 | F77: 0 | G77: 0 | H77: 0 | I77: 0 | J77: 0 | K77: 556.14999999999998 | L77: 0 | M77: =SUM(J77:L77)-51.44 -> 504.70999999999998 | N77: 51.439999999999998 | O77: =SUM(M77:N77) -> 556.14999999999998
A78: 2071 | B78: CERMISSÕES | C78: 97.081.434/0001-03 | D78: 9310.4500000000007 | E78: 0 | F78: 0 | G78: 0 | H78: 0 | I78: 0 | J78: 0 | K78: 10259.450000000001 | L78: 0 | M78: =SUM(J78:L78)-949 -> 9310.4500000000007 | N78: 949 | O78: =SUM(M78:N78) -> 10259.450000000001
A79: 2072 | B79: COCEL | C79: 75.805.895/0001-30 | D79: 1886.9400000000001 | E79: 0 | F79: 0 | G79: 0 | H79: 0 | I79: 0 | J79: 0 | K79: 2079.27 | L79: 0 | M79: =SUM(J79:L79)-192.33 -> 1886.9400000000001 | N79: 192.33000000000001 | O79: =SUM(M79:N79) -> 2079.27
A80: 2073 | B80: CEMIRIM | C80: 52.777.034/0001-90 | D80: 9359.5499999999993 | E80: 0 | F80: 0 | G80: 0 | H80: 0 | I80: 0 | J80: 0 | K80: 10313.549999999999 | L80: 0 | M80: =SUM(J80:L80)-954 -> 9359.5499999999993 | N80: 954 | O80: =SUM(M80:N80) -> 10313.549999999999
A81: 2074 | B81: CERTEL ENERGIA | C81: 09.257.558/0001-21 | D81: 45695.260000000002 | E81: 0 | F81: 0 | G81: 0 | H81: 0 | I81: 0 | J81: 0 | K81: 50352.900000000001 | L81: 0 | M81: =SUM(J81:L81)-4657.64 -> 45695.260000000002 | N81: 4657.6400000000003 | O81: =SUM(M81:N81) -> 50352.900000000001
A82: 2075 | B82: CERTHIL | C82: 98.042.963/0001-52 | D82: 6527.1400000000003 | E82: 0 | F82: 0 | G82: 0 | H82: 0 | I82: 0 | J82: 0 | K82: 7192.4399999999996 | L82: 0 | M82: =SUM(J82:L82)-665.3 -> 6527.1399999999994 | N82: 665.29999999999995 | O82: =SUM(M82:N82) -> 7192.4399999999996
A83: 2076 | B83: COOPERALIANÇA | C83: 83.647.990/0001-81 | D83: 1682.77 | E83: 0 | F83: 0 | G83: 0 | H83: 0 | I83: 0 | J83: 0 | K83: 1854.29 | L83: 0 | M83: =SUM(J83:L83)-171.52 -> 1682.77 | N83: 171.52000000000001 | O83: =SUM(M83:N83) -> 1854.29
A84: 2077 | B84: CERSUL | C84: 86.512.670/0001-02 | D84: 11997.58 | E84: 0 | F84: 0 | G84: 0 | H84: 0 | I84: 0 | J84: 0 | K84: 13220.469999999999 | L84: 0 | M84: =SUM(J84:L84)-1222.89 -> 11997.58 | N84: 1222.8900000000001 | O84: =SUM(M84:N84) -> 13220.469999999999
A85: 2078 | B85: COOPERCOCAL | C85: 86.532.348/0001-45 | D85: 7926.1499999999996 | E85: 63035.5 | F85: 0 | G85: 0 | H85: 0 | I85: 0 | J85: 26064.889999999999 | K85: 26064.889999999999 | L85: 26064.880000000001 | M85: =SUM(J85:L85)-7233.01 -> 70961.650000000009 | N85: 7233.0100000000002 | O85: =SUM(M85:N85) -> 78194.660000000003
A86: 3001 | B86: AES TIETÊ | C86: 00.194.724/0001-13 | D86: 310104.96999999997 | E86: 0 | F86: 0 | G86: 0 | H86: 0 | I86: 0 | J86: 0 | K86: 341713.46999999997 | L86: 0 | M86: =SUM(J86:L86)-31608.5 -> 310104.96999999997 | N86: 31608.5 | O86: =SUM(M86:N86) -> 341713.46999999997
A87: 3003 | B87: ALCOA (CONS. MACHADINHO) | C87: 23.637.697/0001-01 | D87: 55511.110000000001 | E87: 0 | F87: 0 | G87: 0 | H87: 0 | I87: 0 | J87: 0 | K87: 61169.269999999997 | L87: 0 | M87: =SUM(J87:L87)-5658.16 -> 55511.110000000001 | N87: 5658.1599999999999 | O87: =SUM(M87:N87) -> 61169.270000000004
A88: 3004 | B88: ARCELORMITTAL (CONS. GUILMAN AMORIM | C88: 17.469.701/0066-12 | D88: 9350.6700000000001 | E88: 0 | F88: 0 | G88: 0 | H88: 0 | I88: 0 | J88: 0 | K88: 10303.77 | L88: 0 | M88: =SUM(J88:L88)-953.1 -> 9350.6700000000001 | N88: 953.10000000000002 | O88: =SUM(M88:N88) -> 10303.77
A89: 3005 | B89: MACHADINHO PART (CONS. MACHADINHO) | C89: 22.686.342/0001-40 | D89: 11377.33 | E89: 0 | F89: 0 | G89: 0 | H89: 0 | I89: 0 | J89: 0 | K89: 12537 | L89: 0 | M89: =SUM(J89:L89)-1159.67 -> 11377.33 | N89: 1159.6700000000001 | O89: =SUM(M89:N89) -> 12537
A90: 3007 | B90: CBA (CONS. MACHADINHO) | C90: 24.241.083/0001-79 | D90: 59349.639999999999 | E90: 0 | F90: 0 | G90: 0 | H90: 0 | I90: 0 | J90: 0 | K90: 65399.050000000003 | L90: 0 | M90: =SUM(J90:L90)-6049.41 -> 59349.639999999999 | N90: 6049.4099999999999 | O90: =SUM(M90:N90) -> 65399.050000000003
A91: 3008 | B91: CBA (UHE PIRAJÚ) | C91: 61.409.892/0001-73 | D91: 13794.16 | E91: 0 | F91: 0 | G91: 0 | H91: 0 | I91: 0 | J91: 0 | K91: 15200.18 | L91: 0 | M91: =SUM(J91:L91)-1406.02 -> 13794.16 | N91: 1406.02 | O91: =SUM(M91:N91) -> 15200.18
A92: 3009 | B92: CEB LAJEADO (CONS. LAJEADO) | C92: 03.677.638/0001-50 | D92: 39279.540000000001 | E92: 0 | F92: 0 | G92: 0 | H92: 0 | I92: 0 | J92: 0 | K92: 43283.239999999998 | L92: 0 | M92: =SUM(J92:L92)-4003.7 -> 39279.540000000001 | N92: 4003.6999999999998 | O92: =SUM(M92:N92) -> 43283.239999999998
A93: 3011 | B93: CEEE(CONS. DONA FRANCISCA) | C93: 39.881.421/0001-04 | D93: 3508.1100000000001 | E93: 0 | F93: 0 | G93: 0 | H93: 0 | I93: 0 | J93: 0 | K93: 3865.6900000000001 | L93: 0 | M93: =SUM(J93:L93)-357.58 -> 3508.1100000000001 | N93: 357.57999999999998 | O93: =SUM(M93:N93) -> 3865.6900000000001
A94: 3012 | B94: CEEE(CONS. MACHADINHO) | C94: 39.881.421/0001-04 | D94: 11924.82 | E94: 0 | F94: 0 | G94: 0 | H94: 0 | I94: 0 | J94: 0 | K94: 13140.299999999999 | L94: 0 | M94: =SUM(J94:L94)-1215.48 -> 11924.82 | N94: 1215.48 | O94: =SUM(M94:N94) -> 13140.299999999999
A95: 3015 | B95: CEMIG-G | C95: 06.981.176/0001-58 | D95: 344573.72999999998 | E95: 0 | F95: 0 | G95: 0 | H95: 0 | I95: 0 | J95: 0 | K95: 379695.57000000001 | L95: 0 | M95: =SUM(J95:L95)-35121.84 -> 344573.72999999998 | N95: 35121.839999999997 | O95: =SUM(M95:N95) -> 379695.56999999995
A96: 3021 | B96: CGTEE | C96: 02.016.507/0001-69 | D96: 65629.309999999998 | E96: 0 | F96: 0 | G96: 0 | H96: 0 | I96: 0 | J96: 0 | K96: 72318.800000000003 | L96: 0 | M96: =SUM(J96:L96)-6689.49 -> 65629.309999999998 | N96: 6689.4899999999998 | O96: =SUM(M96:N96) -> 72318.800000000003
A97: 3022 | B97: CHESF-G | C97: 33.541.368/0001-16 | D97: 2342002.8199999998 | E97: 0 | F97: 0 | G97: 0 | H97: 0 | I97: 0 | J97: 0 | K97: 2580719.3599999999 | L97: 0 | M97: =SUM(J97:L97)-238716.54 -> 2342002.8199999998 | N97: 238716.54000000001 | O97: =SUM(M97:N97) -> 2580719.3599999999
A98: 3025 | B98: COPEL-G | C98: 04.370.282/0001-70 | D98: 517899.5 | E98: 0 | F98: 0 | G98: 0 | H98: 0 | I98: 0 | J98: 0 | K98: 570688.15000000002 | L98: 0 | M98: =SUM(J98:L98)-52788.65 -> 517899.5 | N98: 52788.650000000001 | O98: =SUM(M98:N98) -> 570688.15000000002
A99: 3026 | B99: UEG ARAUCÁRIA | C99: 02.743.574/0001-85 | D99: 73351.080000000002 | E99: 0 | F99: 0 | G99: 0 | H99: 0 | I99: 0 | J99: 0 | K99: 80827.639999999999 | L99: 0 | M99: =SUM(J99:L99)-7476.56 -> 73351.080000000002 | N99: 7476.5600000000004 | O99: =SUM(M99:N99) -> 80827.639999999999
A100: 3027 | B100: COTEMINAS(CONS. PORTO ESTRELA) | C100: 07.663.140/0001-99 | D100: 5010.2700000000004 | E100: 0 | F100: 0 | G100: 0 | H100: 0 | I100: 0 | J100: 0 | K100: 5520.96 | L100: 0 | M100: =SUM(J100:L100)-510.69 -> 5010.2700000000004 | N100: 510.69 | O100: =SUM(M100:N100) -> 5520.96
A101: 3033 | B101: DFESA(CONS. DONA FRANCISCA) | C101: 02.832.860/0003-89 | D101: 19879.279999999999 | E101: 0 | F101: 0 | G101: 0 | H101: 0 | I101: 0 | J101: 0 | K101: 21905.540000000001 | L101: 0 | M101: =SUM(J101:L101)-2026.26 -> 19879.280000000002 | N101: 2026.26 | O101: =SUM(M101:N101) -> 21905.540000000001
A102: 3034 | B102: DME(CONS. MACHADINHO) | C102: 23.664.303/0001-04 | D102: 5892.4399999999996 | E102: 0 | F102: 0 | G102: 0 | H102: 0 | I102: 0 | J102: 0 | K102: 6493.0500000000002 | L102: 0 | M102: =SUM(J102:L102)-600.61 -> 5892.4400000000005 | N102: 600.61000000000001 | O102: =SUM(M102:N102) -> 6493.0500000000002
A103: 3035 | B103: RIO PARANAPANEMA(DUKE ENERGY) | C103: 02.998.301/0001-81 | D103: 346045.34999999998 | E103: 0 | F103: 0 | G103: 0 | H103: 0 | I103: 0 | J103: 0 | K103: 381317.19 | L103: 0 | M103: =SUM(J103:L103)-35271.84 -> 346045.34999999998 | N103: 35271.839999999997 | O103: =SUM(M103:N103) -> 381317.18999999994
A104: 3038 | B104: PETROBRAS (UTE MARIO LAGO) | C104: 33.000.167/0087-81 | D104: 150117.23000000001 | E104: 0 | F104: 0 | G104: 0 | H104: 0 | I104: 0 | J104: 0 | K104: 165418.44 | L104: 0 | M104: =SUM(J104:L104)-15301.21 -> 150117.23000000001 | N104: 15301.209999999999 | O104: =SUM(M104:N104) -> 165418.44
A105: 3039 | B105: ELETRONORTE-G | C105: 00.357.038/0001-16 | D105: 77879.619999999995 | E105: 0 | F105: 0 | G105: 0 | H105: 0 | I105: 0 | J105: 0 | K105: 85817.759999999995 | L105: 0 | M105: =SUM(J105:L105)-7938.14 -> 77879.619999999995 | N105: 7938.1400000000003 | O105: =SUM(M105:N105) -> 85817.759999999995
A106: 3040 | B106: ELETRONUCLEAR | C106: 42.540.211/0001-67 | D106: 405058.27000000002 | E106: 0 | F106: 0 | G106: 0 | H106: 0 | I106: 0 | J106: 0 | K106: 446345.20000000001 | L106: 0 | M106: =SUM(J106:L106)-41286.93 -> 405058.27000000002 | N106: 41286.93 | O106: =SUM(M106:N106) -> 446345.20000000001
A107: 3044 | B107: FURNAS(APM MANSO) | C107: 23.274.194/0001-19 | D107: 55502.550000000003 | E107: 0 | F107: 0 | G107: 0 | H107: 0 | I107: 0 | J107: 0 | K107: 61159.830000000002 | L107: 0 | M107: =SUM(J107:L107)-5657.28 -> 55502.550000000003 | N107: 5657.2799999999997 | O107: =SUM(M107:N107) -> 61159.830000000002
A108: 3045 | B108: INVESTCO(CONS. LAJEADO) | C108: 00.644.907/0001-93 | D108: 1983.8199999999999 | E108: 0 | F108: 0 | G108: 0 | H108: 0 | I108: 0 | J108: 0 | K108: 2186.0300000000002 | L108: 0 | M108: =SUM(J108:L108)-202.21 -> 1983.8200000000002 | N108: 202.21000000000001 | O108: =SUM(M108:N108) -> 2186.0300000000002
A109: 3046 | B109: ITAPEBI(UHE ITAPEBI) | C109: 02.397.080/0002-77 | D109: 51735.32 | E109: 0 | F109: 0 | G109: 0 | H109: 0 | I109: 0 | J109: 0 | K109: 57008.620000000003 | L109: 0 | M109: =SUM(J109:L109)-5273.3 -> 51735.32 | N109: 5273.3000000000002 | O109: =SUM(M109:N109) -> 57008.620000000003
A110: 3047 | B110: ITASA (CONS. ITÁ) | C110: 01.355.994/0002-02 | D110: 159886.07999999999 | E110: 0 | F110: 0 | G110: 0 | H110: 0 | I110: 0 | J110: 0 | K110: 176183.01000000001 | L110: 0 | M110: =SUM(J110:L110)-16296.93 -> 159886.08000000002 | N110: 16296.93 | O110: =SUM(M110:N110) -> 176183.01000000001
A111: 3048 | B111: ITIQUIRA(UHE ITIQUIRA) | C111: 02.808.298/0017-53 | D111: 39871.160000000003 | E111: 0 | F111: 0 | G111: 0 | H111: 0 | I111: 0 | J111: 0 | K111: 43935.160000000003 | L111: 0 | M111: =SUM(J111:L111)-4064 -> 39871.160000000003 | N111: 4064 | O111: =SUM(M111:N111) -> 43935.160000000003
A112: 3052 | B112: PETROBRAS(UTE TERMOCEARÁ) | C112: 33.000.167/0104-17 | D112: 41306.379999999997 | E112: 0 | F112: 0 | G112: 0 | H112: 0 | I112: 0 | J112: 0 | K112: 45516.669999999998 | L112: 0 | M112: =SUM(J112:L112)-4210.29 -> 41306.379999999997 | N112: 4210.29 | O112: =SUM(M112:N112) -> 45516.669999999998
A113: 3054 | B113: PAULISTA LAJEADO(CONS. LAJEADO) | C113: 03.491.603/0001-21 | D113: 13747.84 | E113: 0 | F113: 0 | G113: 0 | H113: 0 | I113: 0 | J113: 0 | K113: 15149.129999999999 | L113: 0 | M113: =SUM(J113:L113)-1401.29 -> 13747.84 | N113: 1401.29 | O113: =SUM(M113:N113) -> 15149.130000000001
A114: 3055 | B114: PETROBRAS (UTE SEPÉ-TIARAJU) | C114: 33.000.167/0071-14 | D114: 39854.519999999997 | E114: 0 | F114: 0 | G114: 0 | H114: 0 | I114: 0 | J114: 0 | K114: 43916.830000000002 | L114: 0 | M114: =SUM(J114:L114)-4062.31 -> 39854.520000000004 | N114: 4062.3099999999999 | O114: =SUM(M114:N114) -> 43916.830000000002
A115: 3057 | B115: PETROBRAS(UTE FERNAN GASPARIAN) | C115: 33.000.167/0026-60 | D115: 29208.32 | E115: 0 | F115: 0 | G115: 0 | H115: 0 | I115: 0 | J115: 0 | K115: 32185.48 | L115: 0 | M115: =SUM(J115:L115)-2977.16 -> 29208.32 | N115: 2977.1599999999999 | O115: =SUM(M115:N115) -> 32185.48
A116: 3058 | B116: PETROBRAS (UTE CELSO FURTADO) | C116: 33.000.167/0024-06 | D116: 29336.73 | E116: 0 | F116: 0 | G116: 0 | H116: 0 | I116: 0 | J116: 0 | K116: 32326.98 | L116: 0 | M116: =SUM(J116:L116)-2990.25 -> 29336.73 | N116: 2990.25 | O116: =SUM(M116:N116) -> 32326.98
A117: 3061 | B117: LAJEADO ENERGIA(CONS. LAJEADO) | C117: 03.460.864/0002-65 | D117: 143370.29999999999 | E117: 0 | F117: 0 | G117: 0 | H117: 0 | I117: 0 | J117: 0 | K117: 157983.79999999999 | L117: 0 | M117: =SUM(J117:L117)-14613.5 -> 143370.29999999999 | N117: 14613.5 | O117: =SUM(M117:N117) -> 157983.79999999999
A118: 3062 | B118: VCB(CONS. MACHADINHO) | C118: 28.323.127/0001-60 | D118: 12113.51 | E118: 0 | F118: 0 | G118: 0 | H118: 0 | I118: 0 | J118: 0 | K118: 13348.219999999999 | L118: 0 | M118: =SUM(J118:L118)-1234.71 -> 12113.509999999998 | N118: 1234.71 | O118: =SUM(M118:N118) -> 13348.219999999998
A119: 3064 | B119: SAMARCO(CONS.GUILMAN AMORIM) | C119: 16.628.281/0003-23 | D119: 8983.9799999999996 | E119: 0 | F119: 0 | G119: 0 | H119: 0 | I119: 0 | J119: 0 | K119: 9899.7000000000007 | L119: 0 | M119: =SUM(J119:L119)-915.72 -> 8983.9800000000014 | N119: 915.72000000000003 | O119: =SUM(M119:N119) -> 9899.7000000000007
A120: 3068 | B120: TERMOPERNAMBUCO(UTE TERMOPERN.) | C120: 03.795.050/0002-81 | D120: 98336.190000000002 | E120: 0 | F120: 0 | G120: 0 | H120: 0 | I120: 0 | J120: 0 | K120: 108359.44 | L120: 0 | M120: =SUM(J120:L120)-10023.25 -> 98336.190000000002 | N120: 10023.25 | O120: =SUM(M120:N120) -> 108359.44
A121: 3069 | B121: ENGIE | C121: 02.474.103/0001-19 | D121: 744002.07999999996 | E121: 0 | F121: 0 | G121: 0 | H121: 0 | I121: 0 | J121: 0 | K121: 819837 | L121: 0 | M121: =SUM(J121:L121)-75834.92 -> 744002.07999999996 | N121: 75834.919999999998 | O121: =SUM(M121:N121) -> 819837
A122: 3070 | B122: ENGIE (CONS. ITÁ) | C122: 02.474.103/0001-19 | D122: 118515.64999999999 | E122: 0 | F122: 0 | G122: 0 | H122: 0 | I122: 0 | J122: 0 | K122: 130595.75999999999 | L122: 0 | M122: =SUM(J122:L122)-12080.11 -> 118515.64999999999 | N122: 12080.110000000001 | O122: =SUM(M122:N122) -> 130595.75999999999
A123: 3071 | B123: ENGIE (CONS. MACHADINHO) | C123: 02.474.103/0001-19 | D123: 41584.110000000001 | E123: 0 | F123: 0 | G123: 0 | H123: 0 | I123: 0 | J123: 0 | K123: 45822.709999999999 | L123: 0 | M123: =SUM(J123:L123)-4238.6 -> 41584.110000000001 | N123: 4238.6000000000004 | O123: =SUM(M123:N123) -> 45822.709999999999
A124: 3072 | B124: VALE (VALESUL-CONS. MACHADINHO) | C124: 33.592.510/0005-88 | D124: 17881.959999999999 | E124: 0 | F124: 0 | G124: 0 | H124: 0 | I124: 0 | J124: 0 | K124: 19704.639999999999 | L124: 0 | M124: =SUM(J124:L124)-1822.68 -> 17881.959999999999 | N124: 1822.6800000000001 | O124: =SUM(M124:N124) -> 19704.639999999999
A125: 3073 | B125: EMAE | C125: 02.302.101/0001-42 | D125: 9440.8500000000004 | E125: 0 | F125: 0 | G125: 0 | H125: 0 | I125: 0 | J125: 0 | K125: 10403.139999999999 | L125: 0 | M125: =SUM(J125:L125)-962.29 -> 9440.8499999999985 | N125: 962.28999999999996 | O125: =SUM(M125:N125) -> 10403.139999999999
A126: 3074 | B126: CGTF(UTE FORTALEZA) | C126: 04.423.567/0016-08 | D126: 60984.220000000001 | E126: 0 | F126: 0 | G126: 0 | H126: 0 | I126: 0 | J126: 0 | K126: 67200.240000000005 | L126: 0 | M126: =SUM(J126:L126)-6216.02 -> 60984.220000000001 | N126: 6216.0200000000004 | O126: =SUM(M126:N126) -> 67200.240000000005
A127: 3078 | B127: NORTE FLUMINENSE(UTE NORTE FLUM.) | C127: 03.258.983/0002-30 | D127: 141141.95000000001 | E127: 0 | F127: 0 | G127: 0 | H127: 0 | I127: 0 | J127: 0 | K127: 155528.32000000001 | L127: 0 | M127: =SUM(J127:L127)-14386.37 -> 141141.95000000001 | N127: 14386.370000000001 | O127: =SUM(M127:N127) -> 155528.32000000001
A128: 3079 | B128: CDSA | C128: 01.672.223/0001-68 | D128: 134312.20999999999 | E128: 0 | F128: 0 | G128: 0 | H128: 0 | I128: 0 | J128: 0 | K128: 148002.44 | L128: 0 | M128: =SUM(J128:L128)-13690.23 -> 134312.20999999999 | N128: 13690.23 | O128: =SUM(M128:N128) -> 148002.44
A129: 3083 | B129: VOTORANTIM(UHE PEDRA DO CAVALO) | C129: 10.656.452/0066-25 | D129: 24437.849999999999 | E129: 0 | F129: 0 | G129: 0 | H129: 0 | I129: 0 | J129: 0 | K129: 26928.759999999998 | L129: 0 | M129: =SUM(J129:L129)-2490.91 -> 24437.849999999999 | N129: 2490.9099999999999 | O129: =SUM(M129:N129) -> 26928.759999999998
A130: 3084 | B130: CERAN | C130: 04.237.975/0001-99 | D130: 60749.110000000001 | E130: 0 | F130: 0 | G130: 0 | H130: 0 | I130: 0 | J130: 0 | K130: 66941.169999999998 | L130: 0 | M130: =SUM(J130:L130)-6192.06 -> 60749.110000000001 | N130: 6192.0600000000004 | O130: =SUM(M130:N130) -> 66941.169999999998
A131: 3090 | B131: BAESA (UHE BARRA GRANDE) | C131: 04.781.143/0001-39 | D131: 136302.51999999999 | E131: 0 | F131: 0 | G131: 0 | H131: 0 | I131: 0 | J131: 0 | K131: 150195.60999999999 | L131: 0 | M131: =SUM(J131:L131)-13893.09 -> 136302.51999999999 | N131: 13893.09 | O131: =SUM(M131:N131) -> 150195.60999999999
A132: 3095 | B132: PETROBRAS(UTE JESUS S. PEREIRA) | C132: 33.000.167/0148-38 | D132: 71526.639999999999 | E132: 0 | F132: 0 | G132: 0 | H132: 0 | I132: 0 | J132: 0 | K132: 78817.229999999996 | L132: 0 | M132: =SUM(J132:L132)-7290.59 -> 71526.639999999999 | N132: 7290.5900000000001 | O132: =SUM(M132:N132) -> 78817.229999999996
A133: 3097 | B133: CEMIG(UHE IRAPÉ) | C133: 06.981.176/0001-58 | D133: 65716.639999999999 | E133: 0 | F133: 0 | G133: 0 | H133: 0 | I133: 0 | J133: 0 | K133: 72415.029999999999 | L133: 0 | M133: =SUM(J133:L133)-6698.39 -> 65716.639999999999 | N133: 6698.3900000000003 | O133: =SUM(M133:N133) -> 72415.029999999999
A134: 3098 | B134: VERACEL(UTE VERACEL) | C134: 40.551.996/0001-48 | D134: 1550.79 | E134: 0 | F134: 0 | G134: 0 | H134: 0 | I134: 0 | J134: 0 | K134: 1708.8599999999999 | L134: 0 | M134: =SUM(J134:L134)-158.07 -> 1550.79 | N134: 158.06999999999999 | O134: =SUM(M134:N134) -> 1708.8599999999999
A135: 3102 | B135: ENERPEIXE(UHE PEIXE ANGICAL) | C135: 04.426.411/0003-66 | D135: 105506.25 | E135: 0 | F135: 0 | G135: 0 | H135: 0 | I135: 0 | J135: 0 | K135: 116260.33 | L135: 0 | M135: =SUM(J135:L135)-10754.08 -> 105506.25 | N135: 10754.08 | O135: =SUM(M135:N135) -> 116260.33
A136: 3103 | B136: ENERCAN (UHE CAMPOS NOVOS) | C136: 03.356.967/0001-07 | D136: 170290.91 | E136: 0 | F136: 0 | G136: 0 | H136: 0 | I136: 0 | J136: 0 | K136: 187648.39000000001 | L136: 0 | M136: =SUM(J136:L136)-17357.48 -> 170290.91 | N136: 17357.48 | O136: =SUM(M136:N136) -> 187648.39000000001
A137: 3108 | B137: VENTOS DO SUL | C137: 06.016.348/0002-34 | D137: 25366.580000000002 | E137: 0 | F137: 0 | G137: 0 | H137: 0 | I137: 0 | J137: 0 | K137: 27952.150000000001 | L137: 0 | M137: =SUM(J137:L137)-2585.57 -> 25366.580000000002 | N137: 2585.5700000000002 | O137: =SUM(M137:N137) -> 27952.150000000001
A138: 3119 | B138: BSE-G | C138: 03.059.729/0001-21 | D138: 31321.169999999998 | E138: 0 | F138: 0 | G138: 0 | H138: 0 | I138: 0 | J138: 0 | K138: 34513.690000000002 | L138: 0 | M138: =SUM(J138:L138)-3192.52 -> 31321.170000000002 | N138: 3192.52 | O138: =SUM(M138:N138) -> 34513.690000000002
A139: 3120 | B139: BRENTECH(UTE GOIANIA 2) | C139: 07.921.085/0001-90 | D139: 27760.759999999998 | E139: 0 | F139: 0 | G139: 0 | H139: 0 | I139: 0 | J139: 10196.790000000001 | K139: 10196.790000000001 | L139: 10196.790000000001 | M139: =SUM(J139:L139)-2829.61 -> 27760.760000000002 | N139: 2829.6100000000001 | O139: =SUM(M139:N139) -> 30590.370000000003
A140: 3121 | B140: UTE GUARANI (UTE AREMBEPE) | C140: 23.865.997/0001-48 | D140: 24104.07 | E140: 0 | F140: 0 | G140: 0 | H140: 0 | I140: 0 | J140: 0 | K140: 26560.959999999999 | L140: 0 | M140: =SUM(J140:L140)-2456.89 -> 24104.07 | N140: 2456.8899999999999 | O140: =SUM(M140:N140) -> 26560.959999999999
A141: 3122 | B141: EPESA | C141: 06.212.748/0001-34 | D141: 43522.040000000001 | E141: 0 | F141: 0 | G141: 0 | H141: 0 | I141: 0 | J141: 15986.059999999999 | K141: 15986.059999999999 | L141: 15986.049999999999 | M141: =SUM(J141:L141)-4436.13 -> 43522.040000000001 | N141: 4436.1300000000001 | O141: =SUM(M141:N141) -> 47958.169999999998
A142: 3123 | B142: UTE APOENA (UTE MURICY) | C142: 23.865.997/0001-48 | D142: 23626.84 | E142: 0 | F142: 0 | G142: 0 | H142: 0 | I142: 0 | J142: 0 | K142: 26035.09 | L142: 0 | M142: =SUM(J142:L142)-2408.25 -> 23626.84 | N142: 2408.25 | O142: =SUM(M142:N142) -> 26035.09
A143: 3126 | B143: PETROBRAS(UTE EUZEBIO ROCHA) | C143: 33.000.167/0116-50 | D143: 26618.810000000001 | E143: 0 | F143: 0 | G143: 0 | H143: 0 | I143: 0 | J143: 0 | K143: 29332.02 | L143: 0 | M143: =SUM(J143:L143)-2713.21 -> 26618.810000000001 | N143: 2713.21 | O143: =SUM(M143:N143) -> 29332.02
A144: 3127 | B144: PRAIA FORMOSA | C144: 08.439.659/0008-27 | D144: 21471.619999999999 | E144: 0 | F144: 0 | G144: 0 | H144: 0 | I144: 0 | J144: 0 | K144: 23660.189999999999 | L144: 0 | M144: =SUM(J144:L144)-2188.57 -> 21471.619999999999 | N144: 2188.5700000000002 | O144: =SUM(M144:N144) -> 23660.189999999999
A145: 3130 | B145: ICARAIZINHO | C145: 08.439.659/0009-08 | D145: 12016.24 | E145: 0 | F145: 0 | G145: 0 | H145: 0 | I145: 0 | J145: 0 | K145: 13241.040000000001 | L145: 0 | M145: =SUM(J145:L145)-1224.8 -> 12016.240000000002 | N145: 1224.8 | O145: =SUM(M145:N145) -> 13241.040000000001
A146: 3133 | B146: BAGUARI(CONS. BAGUARI) | C146: 07.799.995/0001-41 | D146: 10343.700000000001 | E146: 0 | F146: 0 | G146: 0 | H146: 0 | I146: 0 | J146: 0 | K146: 11398.02 | L146: 0 | M146: =SUM(J146:L146)-1054.32 -> 10343.700000000001 | N146: 1054.3199999999999 | O146: =SUM(M146:N146) -> 11398.02
A147: 3134 | B147: GERA MARANHÃO (GERANORTE) | C147: 09.110.880/0001-23 | D147: 63338.550000000003 | E147: 0 | F147: 0 | G147: 0 | H147: 0 | I147: 0 | J147: 0 | K147: 69794.550000000003 | L147: 0 | M147: =SUM(J147:L147)-6456 -> 63338.550000000003 | N147: 6456 | O147: =SUM(M147:N147) -> 69794.550000000003
A148: 3135 | B148: BONS VENTOS | C148: 08.439.659/0001-50 | D148: 29188.810000000001 | E148: 0 | F148: 0 | G148: 0 | H148: 0 | I148: 0 | J148: 0 | K148: 32163.98 | L148: 0 | M148: =SUM(J148:L148)-2975.17 -> 29188.809999999998 | N148: 2975.1700000000001 | O148: =SUM(M148:N148) -> 32163.979999999996
A149: 3136 | B149: VIANA | C149: 09.043.782/0002-00 | D149: 34826.720000000001 | E149: 0 | F149: 0 | G149: 0 | H149: 0 | I149: 0 | J149: 12792.18 | K149: 12792.18 | L149: 12792.190000000001 | M149: =SUM(J149:L149)-3549.83 -> 34826.720000000001 | N149: 3549.8299999999999 | O149: =SUM(M149:N149) -> 38376.550000000003
A150: 3137 | B150: BORBOREMA(UTE CAMP. GRANDE) | C150: 09.036.424/0001-80 | D150: 42307.07 | E150: 0 | F150: 0 | G150: 0 | H150: 0 | I150: 0 | J150: 0 | K150: 46619.360000000001 | L150: 0 | M150: =SUM(J150:L150)-4312.29 -> 42307.07 | N150: 4312.29 | O150: =SUM(M150:N150) -> 46619.360000000001
A151: 3138 | B151: ENERGIMP (VOLTA DO RIO) | C151: 07.063.713/0002-24 | D151: 9339.7999999999993 | E151: 0 | F151: 0 | G151: 0 | H151: 0 | I151: 0 | J151: 0 | K151: 10291.790000000001 | L151: 0 | M151: =SUM(J151:L151)-951.99 -> 9339.8000000000011 | N151: 951.99000000000001 | O151: =SUM(M151:N151) -> 10291.790000000001
A152: 3139 | B152: ENERGIMP (PRAIA DO MORGADO) | C152: 07.063.963/0001-83 | D152: 6102.1899999999996 | E152: 0 | F152: 0 | G152: 0 | H152: 0 | I152: 0 | J152: 0 | K152: 6724.1800000000003 | L152: 0 | M152: =SUM(J152:L152)-621.99 -> 6102.1900000000005 | N152: 621.99000000000001 | O152: =SUM(M152:N152) -> 6724.1800000000003
A153: 3140 | B153: RIO VERDE(UHE SALTO) | C153: 05.252.008/0001-69 | D153: 30441.23 | E153: 0 | F153: 0 | G153: 0 | H153: 0 | I153: 0 | J153: 0 | K153: 33544.059999999998 | L153: 0 | M153: =SUM(J153:L153)-3102.83 -> 30441.229999999996 | N153: 3102.8299999999999 | O153: =SUM(M153:N153) -> 33544.059999999998
A154: 3141 | B154: FOZ DO RIO CLARO | C154: 07.823.262/0001-03 | D154: 17367.189999999999 | E154: 0 | F154: 0 | G154: 0 | H154: 0 | I154: 0 | J154: 0 | K154: 19137.400000000001 | L154: 0 | M154: =SUM(J154:L154)-1770.21 -> 17367.190000000002 | N154: 1770.21 | O154: =SUM(M154:N154) -> 19137.400000000001
A155: 3142 | B155: UTE CAÇU I | C155: 08.598.391/0001-08 | D155: 23890.790000000001 | E155: 0 | F155: 0 | G155: 0 | H155: 0 | I155: 0 | J155: 0 | K155: 26325.939999999999 | L155: 0 | M155: =SUM(J155:L155)-2435.15 -> 23890.789999999997 | N155: 2435.1500000000001 | O155: =SUM(M155:N155) -> 26325.939999999999
A156: 3143 | B156: KINROSS (CAÇU B.-COQUEIROS) | C156: 20.346.524/0005-70 | D156: 40733.989999999998 | E156: 0 | F156: 0 | G156: 0 | H156: 0 | I156: 0 | J156: 0 | K156: 44885.940000000002 | L156: 0 | M156: =SUM(J156:L156)-4151.95 -> 40733.990000000005 | N156: 4151.9499999999998 | O156: =SUM(M156:N156) -> 44885.940000000002
A157: 3144 | B157: CANDEIAS-G | C157: 10.508.162/0001-99 | D157: 46657.150000000001 | E157: 0 | F157: 0 | G157: 0 | H157: 0 | I157: 0 | J157: 0 | K157: 51412.839999999997 | L157: 0 | M157: =SUM(J157:L157)-4755.69 -> 46657.149999999994 | N157: 4755.6899999999996 | O157: =SUM(M157:N157) -> 51412.839999999997
A158: 3145 | B158: CBA(RIO VERDINHO) | C158: 61.409.892/0210-90 | D158: 23958.07 | E158: 0 | F158: 0 | G158: 0 | H158: 0 | I158: 0 | J158: 0 | K158: 26400.080000000002 | L158: 0 | M158: =SUM(J158:L158)-2442.01 -> 23958.07 | N158: 2442.0100000000002 | O158: =SUM(M158:N158) -> 26400.080000000002
A159: 3151 | B159: FOZ DO CHAPECÓ | C159: 04.591.168/0001-70 | D159: 236411.69 | E159: 0 | F159: 0 | G159: 0 | H159: 0 | I159: 0 | J159: 0 | K159: 260508.75 | L159: 0 | M159: =SUM(J159:L159)-24097.06 -> 236411.69 | N159: 24097.060000000001 | O159: =SUM(M159:N159) -> 260508.75
A160: 3152 | B160: EPASA | C160: 10.366.780/0001-41 | D160: 49916.489999999998 | E160: 0 | F160: 0 | G160: 0 | H160: 0 | I160: 0 | J160: 0 | K160: 55004.400000000001 | L160: 0 | M160: =SUM(J160:L160)-5087.91 -> 49916.490000000005 | N160: 5087.9099999999999 | O160: =SUM(M160:N160) -> 55004.400000000009
A161: 3153 | B161: UTE SANTA LUZIA I | C161: 08.906.558/0001-42 | D161: 19007.720000000001 | E161: 0 | F161: 0 | G161: 0 | H161: 0 | I161: 0 | J161: 0 | K161: 20945.150000000001 | L161: 0 | M161: =SUM(J161:L161)-1937.43 -> 19007.720000000001 | N161: 1937.4300000000001 | O161: =SUM(M161:N161) -> 20945.150000000001
A162: 3155 | B162: UTE BOA VISTA | C162: 24.222.394/0001-90 | D162: 9433.1399999999994 | E162: 0 | F162: 0 | G162: 0 | H162: 0 | I162: 0 | J162: 0 | K162: 10394.639999999999 | L162: 0 | M162: =SUM(J162:L162)-961.5 -> 9433.1399999999994 | N162: 961.5 | O162: =SUM(M162:N162) -> 10394.639999999999
A163: 3156 | B163: TERNIUM(UTE ATLÂNTICO) | C163: 07.005.330/0001-19 | D163: 46273.260000000002 | E163: 0 | F163: 0 | G163: 0 | H163: 0 | I163: 0 | J163: 0 | K163: 50989.82 | L163: 0 | M163: =SUM(J163:L163)-4716.56 -> 46273.260000000002 | N163: 4716.5600000000004 | O163: =SUM(M163:N163) -> 50989.82
A164: 3158 | B164: CEE(CONS. ESTREITO) | C164: 08.976.022/0002-84 | D164: 103810.83 | E164: 0 | F164: 0 | G164: 0 | H164: 0 | I164: 0 | J164: 0 | K164: 114392.10000000001 | L164: 0 | M164: =SUM(J164:L164)-10581.27 -> 103810.83 | N164: 10581.27 | O164: =SUM(M164:N164) -> 114392.10000000001
A165: 3159 | B165: ESTREITO PART(CONS. ESTREITO) | C165: 22.686.355/0001-19 | D165: 11502.879999999999 | E165: 0 | F165: 0 | G165: 0 | H165: 0 | I165: 0 | J165: 0 | K165: 12675.35 | L165: 0 | M165: =SUM(J165:L165)-1172.47 -> 11502.880000000001 | N165: 1172.47 | O165: =SUM(M165:N165) -> 12675.35
A166: 3160 | B166: ESTREITO(CONS. ESTREITO) | C166: 07.089.298/0002-88 | D166: 66037.880000000005 | E166: 0 | F166: 0 | G166: 0 | H166: 0 | I166: 0 | J166: 0 | K166: 72769.009999999995 | L166: 0 | M166: =SUM(J166:L166)-6731.13 -> 66037.87999999999 | N166: 6731.1300000000001 | O166: =SUM(M166:N166) -> 72769.009999999995
A167: 3161 | B167: VALE(CONS. ESTREITO) | C167: 33.592.510/0091-00 | D167: 77722.110000000001 | E167: 0 | F167: 0 | G167: 0 | H167: 0 | I167: 0 | J167: 0 | K167: 85644.199999999997 | L167: 0 | M167: =SUM(J167:L167)-7922.09 -> 77722.110000000001 | N167: 7922.0900000000001 | O167: =SUM(M167:N167) -> 85644.199999999997
A168: 3166 | B168: SJC (UTE QUIRINÓPOLIS) | C168: 10.249.419/0002-16 | D168: 8401.3999999999996 | E168: 0 | F168: 0 | G168: 0 | H168: 0 | I168: 0 | J168: 0 | K168: 9257.7399999999998 | L168: 0 | M168: =SUM(J168:L168)-856.34 -> 8401.3999999999996 | N168: 856.34000000000003 | O168: =SUM(M168:N168) -> 9257.7399999999998
A169: 3167 | B169: EOL CERRO CHATO I | C169: 02.016.507/0001-69 | D169: 2611.98 | E169: 0 | F169: 0 | G169: 0 | H169: 0 | I169: 0 | J169: 0 | K169: 2878.21 | L169: 0 | M169: =SUM(J169:L169)-266.23 -> 2611.98 | N169: 266.23000000000002 | O169: =SUM(M169:N169) -> 2878.21
A170: 3168 | B170: EOL CERRO CHATO II | C170: 02.016.507/0001-69 | D170: 2610.8299999999999 | E170: 0 | F170: 0 | G170: 0 | H170: 0 | I170: 0 | J170: 0 | K170: 2876.9499999999998 | L170: 0 | M170: =SUM(J170:L170)-266.12 -> 2610.8299999999999 | N170: 266.12 | O170: =SUM(M170:N170) -> 2876.9499999999998
A171: 3169 | B171: EOL CERRO CHATO III | C171: 02.016.507/0001-69 | D171: 2616.0599999999999 | E171: 0 | F171: 0 | G171: 0 | H171: 0 | I171: 0 | J171: 0 | K171: 2882.71 | L171: 0 | M171: =SUM(J171:L171)-266.65 -> 2616.0599999999999 | N171: 266.64999999999998 | O171: =SUM(M171:N171) -> 2882.71
A172: 3170 | B172: UTE ELDORADO | C172: 05.620.523/0002-35 | D172: 19453.790000000001 | E172: 0 | F172: 0 | G172: 0 | H172: 0 | I172: 0 | J172: 0 | K172: 21436.68 | L172: 0 | M172: =SUM(J172:L172)-1982.89 -> 19453.790000000001 | N172: 1982.8900000000001 | O172: =SUM(M172:N172) -> 21436.68
A173: 3172 | B173: BAGUARI ENERGIA(CONS. BAGUARI) | C173: 09.568.947/0001-78 | D173: 9938 | E173: 0 | F173: 0 | G173: 0 | H173: 0 | I173: 0 | J173: 0 | K173: 10950.959999999999 | L173: 0 | M173: =SUM(J173:L173)-1012.96 -> 9938 | N173: 1012.96 | O173: =SUM(M173:N173) -> 10950.959999999999
A174: 3173 | B174: UTE PORTO DO PECÉM | C174: 08.976.495/0001-09 | D174: 155802.48000000001 | E174: 0 | F174: 0 | G174: 0 | H174: 0 | I174: 0 | J174: 0 | K174: 171683.17000000001 | L174: 0 | M174: =SUM(J174:L174)-15880.69 -> 155802.48000000001 | N174: 15880.690000000001 | O174: =SUM(M174:N174) -> 171683.17000000001
A175: 3174 | B175: AGUAS DA PEDRA(UHE DARNANELOS) | C175: 08.768.414/0001-77 | D175: 79732.809999999998 | E175: 0 | F175: 0 | G175: 0 | H175: 0 | I175: 0 | J175: 0 | K175: 87859.850000000006 | L175: 0 | M175: =SUM(J175:L175)-8127.04 -> 79732.810000000012 | N175: 8127.04 | O175: =SUM(M175:N175) -> 87859.850000000006
A176: 3175 | B176: UTE BERNECK | C176: 81.905.176/0001-94 | D176: 1418.26 | E176: 0 | F176: 0 | G176: 0 | H176: 0 | I176: 0 | J176: 0 | K176: 1562.8199999999999 | L176: 0 | M176: =SUM(J176:L176)-144.56 -> 1418.26 | N176: 144.56 | O176: =SUM(M176:N176) -> 1562.8199999999999
A177: 3176 | B177: PORTO DO ITAQUI | C177: 08.219.477/0001-74 | D177: 74235.009999999995 | E177: 0 | F177: 0 | G177: 0 | H177: 0 | I177: 0 | J177: 0 | K177: 81801.660000000003 | L177: 0 | M177: =SUM(J177:L177)-7566.65 -> 74235.010000000009 | N177: 7566.6499999999996 | O177: =SUM(M177:N177) -> 81801.660000000003
A178: 3177 | B178: CERRADINHO(UTE PORTO DAS AGUAS) | C178: 08.322.396/0001-03 | D178: 44570.559999999998 | E178: 0 | F178: 0 | G178: 0 | H178: 0 | I178: 0 | J178: 0 | K178: 49113.559999999998 | L178: 0 | M178: =SUM(J178:L178)-4543 -> 44570.559999999998 | N178: 4543 | O178: =SUM(M178:N178) -> 49113.559999999998
A179: 3178 | B179: UTE COSTA RICA | C179: 08.070.566/0016-88 | D179: 9875.2199999999993 | E179: 0 | F179: 0 | G179: 0 | H179: 0 | I179: 0 | J179: 0 | K179: 10881.790000000001 | L179: 0 | M179: =SUM(J179:L179)-1006.57 -> 9875.2200000000012 | N179: 1006.5700000000001 | O179: =SUM(M179:N179) -> 10881.790000000001
A180: 3179 | B180: UTE NARDINI | C180: 48.708.267/0015-60 | D180: 6504.8999999999996 | E180: 0 | F180: 0 | G180: 0 | H180: 0 | I180: 0 | J180: 0 | K180: 7167.9300000000003 | L180: 0 | M180: =SUM(J180:L180)-663.03 -> 6504.9000000000005 | N180: 663.02999999999997 | O180: =SUM(M180:N180) -> 7167.9300000000003
A181: 3181 | B181: CEPASA(UTE PALMEIRAS DE GOIÁS) | C181: 13.348.048/0001-37 | D181: 38467.150000000001 | E181: 0 | F181: 0 | G181: 0 | H181: 0 | I181: 0 | J181: 0 | K181: 42388.040000000001 | L181: 0 | M181: =SUM(J181:L181)-3920.89 -> 38467.150000000001 | N181: 3920.8899999999999 | O181: =SUM(M181:N181) -> 42388.040000000001
A182: 3182 | B182: NEW ENERGY(EOL ALEGRIA I) | C182: 04.245.220/0002-17 | D182: 11118.969999999999 | E182: 0 | F182: 0 | G182: 0 | H182: 0 | I182: 0 | J182: 0 | K182: 12252.309999999999 | L182: 0 | M182: =SUM(J182:L182)-1133.34 -> 11118.969999999999 | N182: 1133.3399999999999 | O182: =SUM(M182:N182) -> 12252.309999999999
A183: 3183 | B183: SAESA(UHE SANTO ANTÔNIO) | C183: 09.391.823/0002-40 | D183: 1625475.25 | E183: 0 | F183: 0 | G183: 0 | H183: 0 | I183: 0 | J183: 0 | K183: 1791157.3 | L183: 0 | M183: =SUM(J183:L183)-165682.05 -> 1625475.25 | N183: 165682.04999999999 | O183: =SUM(M183:N183) -> 1791157.3
A184: 3184 | B184: EMPA(PCH INDAIAZINHO) | C184: 11.254.582/0002-30 | D184: 1542.54 | E184: 0 | F184: 0 | G184: 0 | H184: 0 | I184: 0 | J184: 0 | K184: 1699.77 | L184: 0 | M184: =SUM(J184:L184)-157.23 -> 1542.54 | N184: 157.22999999999999 | O184: =SUM(M184:N184) -> 1699.77
A185: 3185 | B185: EMPA(PCH INDAIÁ GRANDE) | C185: 10.400.065/0002-69 | D185: 2468.8099999999999 | E185: 0 | F185: 0 | G185: 0 | H185: 0 | I185: 0 | J185: 0 | K185: 2720.4499999999998 | L185: 0 | M185: =SUM(J185:L185)-251.64 -> 2468.8099999999999 | N185: 251.63999999999999 | O185: =SUM(M185:N185) -> 2720.4499999999998
A186: 3186 | B186: NEW ENERGY(EOL ALEGRIA II) | C186: 04.245.220/0002-17 | D186: 21842.450000000001 | E186: 0 | F186: 0 | G186: 0 | H186: 0 | I186: 0 | J186: 0 | K186: 24068.82 | L186: 0 | M186: =SUM(J186:L186)-2226.37 -> 21842.450000000001 | N186: 2226.3699999999999 | O186: =SUM(M186:N186) -> 24068.82
A187: 3187 | B187: VENTOS DA LAGOA(EOL SANGR.2-3) | C187: 11.603.076/0002-09 | D187: 4484.4399999999996 | E187: 0 | F187: 0 | G187: 0 | H187: 0 | I187: 0 | J187: 0 | K187: 4941.5299999999997 | L187: 0 | M187: =SUM(J187:L187)-457.09 -> 4484.4399999999996 | N187: 457.08999999999997 | O187: =SUM(M187:N187) -> 4941.5299999999997
A188: 3192 | B188: EOL MACAUBAS | C188: 09.194.393/0002-77 | D188: 3779.5 | E188: 0 | F188: 0 | G188: 0 | H188: 0 | I188: 0 | J188: 0 | K188: 4164.7399999999998 | L188: 0 | M188: =SUM(J188:L188)-385.24 -> 3779.5 | N188: 385.24000000000001 | O188: =SUM(M188:N188) -> 4164.7399999999998
A189: 3193 | B189: EOL N. HORIZONTE | C189: 09.214.349/0002-81 | D189: 3779.5 | E189: 0 | F189: 0 | G189: 0 | H189: 0 | I189: 0 | J189: 0 | K189: 4164.7399999999998 | L189: 0 | M189: =SUM(J189:L189)-385.24 -> 3779.5 | N189: 385.24000000000001 | O189: =SUM(M189:N189) -> 4164.7399999999998
A190: 3194 | B190: EOL SEABRA | C190: 09.196.341/0002-30 | D190: 3779.5 | E190: 0 | F190: 0 | G190: 0 | H190: 0 | I190: 0 | J190: 0 | K190: 4164.7399999999998 | L190: 0 | M190: =SUM(J190:L190)-385.24 -> 3779.5 | N190: 385.24000000000001 | O190: =SUM(M190:N190) -> 4164.7399999999998
A191: 3195 | B191: PCH PEZZI | C191: 09.199.579/0002-19 | D191: 1524.3800000000001 | E191: 0 | F191: 0 | G191: 0 | H191: 0 | I191: 0 | J191: 0 | K191: 1679.76 | L191: 0 | M191: =SUM(J191:L191)-155.38 -> 1524.3800000000001 | N191: 155.38 | O191: =SUM(M191:N191) -> 1679.7600000000002
A192: 3196 | B192: CPFL (EOL SANTA CLARA I) | C192: 10.797.899/0002-50 | D192: 3566.98 | E192: 0 | F192: 0 | G192: 0 | H192: 0 | I192: 0 | J192: 0 | K192: 3930.5599999999999 | L192: 0 | M192: =SUM(J192:L192)-363.58 -> 3566.98 | N192: 363.57999999999998 | O192: =SUM(M192:N192) -> 3930.5599999999999
A193: 3197 | B193: CPFL (EOL SANTA CLARA II) | C193: 10.797.908/0002-02 | D193: 3566.98 | E193: 0 | F193: 0 | G193: 0 | H193: 0 | I193: 0 | J193: 0 | K193: 3930.5599999999999 | L193: 0 | M193: =SUM(J193:L193)-363.58 -> 3566.98 | N193: 363.57999999999998 | O193: =SUM(M193:N193) -> 3930.5599999999999
A194: 3198 | B194: CPFL (EOL SANTA CLARA III) | C194: 10.797.910/0002-81 | D194: 3578.1900000000001 | E194: 0 | F194: 0 | G194: 0 | H194: 0 | I194: 0 | J194: 0 | K194: 3942.9099999999999 | L194: 0 | M194: =SUM(J194:L194)-364.72 -> 3578.1899999999996 | N194: 364.72000000000003 | O194: =SUM(M194:N194) -> 3942.9099999999999
A195: 3199 | B195: CPFL (EOL SANTA CLARA IV) | C195: 10.797.907/0002-68 | D195: 3566.98 | E195: 0 | F195: 0 | G195: 0 | H195: 0 | I195: 0 | J195: 0 | K195: 3930.5599999999999 | L195: 0 | M195: =SUM(J195:L195)-363.58 -> 3566.98 | N195: 363.57999999999998 | O195: =SUM(M195:N195) -> 3930.5599999999999
A196: 3200 | B196: CPFL (EOL SANTA CLARA V) | C196: 10.797.909/0002-57 | D196: 3566.98 | E196: 0 | F196: 0 | G196: 0 | H196: 0 | I196: 0 | J196: 0 | K196: 3930.5599999999999 | L196: 0 | M196: =SUM(J196:L196)-363.58 -> 3566.98 | N196: 363.57999999999998 | O196: =SUM(M196:N196) -> 3930.5599999999999
A197: 3201 | B197: CPFL (EOL SANTA CLARA VI) | C197: 10.797.906/0002-13 | D197: 3566.98 | E197: 0 | F197: 0 | G197: 0 | H197: 0 | I197: 0 | J197: 0 | K197: 3930.5599999999999 | L197: 0 | M197: =SUM(J197:L197)-363.58 -> 3566.98 | N197: 363.57999999999998 | O197: =SUM(M197:N197) -> 3930.5599999999999
A198: 3202 | B198: CPFL (EOL EURUS VI) | C198: 10.797.905/0002-79 | D198: 951.27999999999997 | E198: 0 | F198: 0 | G198: 0 | H198: 0 | I198: 0 | J198: 0 | K198: 1048.24 | L198: 0 | M198: =SUM(J198:L198)-96.96 -> 951.27999999999997 | N198: 96.959999999999994 | O198: =SUM(M198:N198) -> 1048.24
A199: 3203 | B199: EOL ALVORADA | C199: 11.349.807/0001-50 | D199: 980.37 | E199: 0 | F199: 0 | G199: 0 | H199: 0 | I199: 0 | J199: 0 | K199: 1080.3 | L199: 0 | M199: =SUM(J199:L199)-99.93 -> 980.36999999999989 | N199: 99.930000000000007 | O199: =SUM(M199:N199) -> 1080.3
A200: 3204 | B200: EOL CANDIBA | C200: 11.349.756/0001-67 | D200: 1235.26 | E200: 0 | F200: 0 | G200: 0 | H200: 0 | I200: 0 | J200: 0 | K200: 1361.1700000000001 | L200: 0 | M200: =SUM(J200:L200)-125.91 -> 1235.26 | N200: 125.91 | O200: =SUM(M200:N200) -> 1361.1700000000001
A201: 3205 | B201: EOL GUANAMBI | C201: 11.350.499/0001-83 | D201: 2676.4099999999999 | E201: 0 | F201: 0 | G201: 0 | H201: 0 | I201: 0 | J201: 0 | K201: 2949.21 | L201: 0 | M201: =SUM(J201:L201)-272.8 -> 2676.4099999999999 | N201: 272.80000000000001 | O201: =SUM(M201:N201) -> 2949.21
A202: 3206 | B202: EOL GUIRAPÁ | C202: 11.345.796/0001-30 | D202: 3676.3800000000001 | E202: 0 | F202: 0 | G202: 0 | H202: 0 | I202: 0 | J202: 0 | K202: 4051.1100000000001 | L202: 0 | M202: =SUM(J202:L202)-374.73 -> 3676.3800000000001 | N202: 374.73000000000002 | O202: =SUM(M202:N202) -> 4051.1100000000001
A203: 3207 | B203: EOL IGAPORÃ | C203: 11.366.011/0001-06 | D203: 3676.3800000000001 | E203: 0 | F203: 0 | G203: 0 | H203: 0 | I203: 0 | J203: 0 | K203: 4051.1100000000001 | L203: 0 | M203: =SUM(J203:L203)-374.73 -> 3676.3800000000001 | N203: 374.73000000000002 | O203: =SUM(M203:N203) -> 4051.1100000000001
A204: 3208 | B204: EOL ILHEUS | C204: 11.366.468/0001-10 | D204: 1441.1400000000001 | E204: 0 | F204: 0 | G204: 0 | H204: 0 | I204: 0 | J204: 0 | K204: 1588.03 | L204: 0 | M204: =SUM(J204:L204)-146.89 -> 1441.1399999999999 | N204: 146.88999999999999 | O204: =SUM(M204:N204) -> 1588.0299999999997
A205: 3209 | B205: EOL PAJEÚ DO VENTO | C205: 11.365.985/0001-75 | D205: 3294.04 | E205: 0 | F205: 0 | G205: 0 | H205: 0 | I205: 0 | J205: 0 | K205: 3629.8000000000002 | L205: 0 | M205: =SUM(J205:L205)-335.76 -> 3294.04 | N205: 335.75999999999999 | O205: =SUM(M205:N205) -> 3629.8000000000002
A206: 3210 | B206: EOL PINDAÍ | C206: 11.350.542/0001-00 | D206: 3088.1700000000001 | E206: 0 | F206: 0 | G206: 0 | H206: 0 | I206: 0 | J206: 0 | K206: 3402.9400000000001 | L206: 0 | M206: =SUM(J206:L206)-314.77 -> 3088.1700000000001 | N206: 314.76999999999998 | O206: =SUM(M206:N206) -> 3402.9400000000001
A207: 3211 | B207: EOL PORTO SEGURO | C207: 11.366.056/0001-80 | D207: 823.50999999999999 | E207: 0 | F207: 0 | G207: 0 | H207: 0 | I207: 0 | J207: 0 | K207: 907.45000000000005 | L207: 0 | M207: =SUM(J207:L207)-83.94 -> 823.50999999999999 | N207: 83.939999999999998 | O207: =SUM(M207:N207) -> 907.45000000000005
A208: 3212 | B208: EOL RIO VERDE | C208: 11.350.476/0001-79 | D208: 3676.3800000000001 | E208: 0 | F208: 0 | G208: 0 | H208: 0 | I208: 0 | J208: 0 | K208: 4051.1100000000001 | L208: 0 | M208: =SUM(J208:L208)-374.73 -> 3676.3800000000001 | N208: 374.73000000000002 | O208: =SUM(M208:N208) -> 4051.1100000000001
A209: 3213 | B209: EOL SERRA DO SALTO | C209: 11.349.836/0001-12 | D209: 2470.54 | E209: 0 | F209: 0 | G209: 0 | H209: 0 | I209: 0 | J209: 0 | K209: 2722.3600000000001 | L209: 0 | M209: =SUM(J209:L209)-251.82 -> 2470.54 | N209: 251.81999999999999 | O209: =SUM(M209:N209) -> 2722.3600000000001
A210: 3215 | B210: EOL PLANALTINA | C210: 11.363.327/0001-44 | D210: 3499.9200000000001 | E210: 0 | F210: 0 | G210: 0 | H210: 0 | I210: 0 | J210: 0 | K210: 3856.6599999999999 | L210: 0 | M210: =SUM(J210:L210)-356.74 -> 3499.9200000000001 | N210: 356.74000000000001 | O210: =SUM(M210:N210) -> 3856.6599999999999
A211: 3216 | B211: EOL LICÍNIO DE ALMEIDA | C211: 11.349.904/0001-43 | D211: 3088.1700000000001 | E211: 0 | F211: 0 | G211: 0 | H211: 0 | I211: 0 | J211: 0 | K211: 3402.9400000000001 | L211: 0 | M211: =SUM(J211:L211)-314.77 -> 3088.1700000000001 | N211: 314.76999999999998 | O211: =SUM(M211:N211) -> 3402.9400000000001
A212: 3217 | B212: EOL N.S. DA CONCEIÇÃO | C212: 11.371.340/0001-45 | D212: 3676.3800000000001 | E212: 0 | F212: 0 | G212: 0 | H212: 0 | I212: 0 | J212: 0 | K212: 4051.1100000000001 | L212: 0 | M212: =SUM(J212:L212)-374.73 -> 3676.3800000000001 | N212: 374.73000000000002 | O212: =SUM(M212:N212) -> 4051.1100000000001
A213: 3219 | B213: DESA (EOL MORRO DOS VENTOS I) | C213: 11.686.050/0001-90 | D213: 3403.5100000000002 | E213: 0 | F213: 0 | G213: 0 | H213: 0 | I213: 0 | J213: 0 | K213: 3750.4200000000001 | L213: 0 | M213: =SUM(J213:L213)-346.91 -> 3403.5100000000002 | N213: 346.91000000000003 | O213: =SUM(M213:N213) -> 3750.4200000000001
A214: 3220 | B214: DESA (EOL MORRO DOS VENTOS III) | C214: 11.686.100/0001-30 | D214: 3440.0999999999999 | E214: 0 | F214: 0 | G214: 0 | H214: 0 | I214: 0 | J214: 0 | K214: 3790.7399999999998 | L214: 0 | M214: =SUM(J214:L214)-350.64 -> 3440.0999999999999 | N214: 350.63999999999999 | O214: =SUM(M214:N214) -> 3790.7399999999998
A215: 3221 | B215: DESA (EOL MORRO DOS VENTOS IV) | C215: 11.686.202/0001-55 | D215: 3440.0999999999999 | E215: 0 | F215: 0 | G215: 0 | H215: 0 | I215: 0 | J215: 0 | K215: 3790.7399999999998 | L215: 0 | M215: =SUM(J215:L215)-350.64 -> 3440.0999999999999 | N215: 350.63999999999999 | O215: =SUM(M215:N215) -> 3790.7399999999998
A216: 3222 | B216: DESA (EOL MORRO DOS VENTOS IX) | C216: 11.686.103/0001-73 | D216: 3501.0999999999999 | E216: 0 | F216: 0 | G216: 0 | H216: 0 | I216: 0 | J216: 0 | K216: 3857.96 | L216: 0 | M216: =SUM(J216:L216)-356.86 -> 3501.0999999999999 | N216: 356.86000000000001 | O216: =SUM(M216:N216) -> 3857.96
A217: 3223 | B217: DESA (EOL MORRO DOS VENTOS VI) | C217: 11.686.150/0001-17 | D217: 3342.5100000000002 | E217: 0 | F217: 0 | G217: 0 | H217: 0 | I217: 0 | J217: 0 | K217: 3683.21 | L217: 0 | M217: =SUM(J217:L217)-340.7 -> 3342.5100000000002 | N217: 340.69999999999999 | O217: =SUM(M217:N217) -> 3683.21
A218: 3224 | B218: COPEL (GJC) | C218: 04.370.282/0001-70 | D218: 31407.650000000001 | E218: 0 | F218: 0 | G218: 0 | H218: 0 | I218: 0 | J218: 0 | K218: 34608.980000000003 | L218: 0 | M218: =SUM(J218:L218)-3201.33 -> 31407.650000000001 | N218: 3201.3299999999999 | O218: =SUM(M218:N218) -> 34608.980000000003
A219: 3225 | B219: CGT ELETROSUL (GJC) | C219: 02.016.507/0001-69 | D219: 30175.98 | E219: 0 | F219: 0 | G219: 0 | H219: 0 | I219: 0 | J219: 0 | K219: 33251.769999999997 | L219: 0 | M219: =SUM(J219:L219)-3075.79 -> 30175.979999999996 | N219: 3075.79 | O219: =SUM(M219:N219) -> 33251.769999999997
A220: 3226 | B220: PCH SERRA DOS CAVALINHOS II | C220: 09.199.572/0002-05 | D220: 2327.1300000000001 | E220: 0 | F220: 0 | G220: 0 | H220: 0 | I220: 0 | J220: 0 | K220: 2564.3299999999999 | L220: 0 | M220: =SUM(J220:L220)-237.2 -> 2327.1300000000001 | N220: 237.19999999999999 | O220: =SUM(M220:N220) -> 2564.3299999999999
A221: 3227 | B221: VENTOS DO LITORAL(OSORIO 2-3) | C221: 11.627.075/0002-02 | D221: 4438.2799999999997 | E221: 0 | F221: 0 | G221: 0 | H221: 0 | I221: 0 | J221: 0 | K221: 4890.6700000000001 | L221: 0 | M221: =SUM(J221:L221)-452.39 -> 4438.2799999999997 | N221: 452.38999999999999 | O221: =SUM(M221:N221) -> 4890.6700000000001
A222: 3228 | B222: PECEM II | C222: 10.471.487/0001-44 | D222: 75489.220000000001 | E222: 0 | F222: 0 | G222: 0 | H222: 0 | I222: 0 | J222: 0 | K222: 83183.710000000006 | L222: 0 | M222: =SUM(J222:L222)-7694.49 -> 75489.220000000001 | N222: 7694.4899999999998 | O222: =SUM(M222:N222) -> 83183.710000000006
A223: 3229 | B223: UTE SUAPE II | C223: 09.373.678/0003-56 | D223: 72678.899999999994 | E223: 0 | F223: 0 | G223: 0 | H223: 0 | I223: 0 | J223: 26695.650000000001 | K223: 26695.650000000001 | L223: 26695.639999999999 | M223: =SUM(J223:L223)-7408.04 -> 72678.900000000009 | N223: 7408.04 | O223: =SUM(M223:N223) -> 80086.940000000002
A224: 3230 | B224: UTE AGUA EMENDADA | C224: 08.070.566/0011-73 | D224: 9022.4599999999991 | E224: 0 | F224: 0 | G224: 0 | H224: 0 | I224: 0 | J224: 0 | K224: 9942.1000000000004 | L224: 0 | M224: =SUM(J224:L224)-919.64 -> 9022.4600000000009 | N224: 919.63999999999999 | O224: =SUM(M224:N224) -> 9942.1000000000004
A225: 3231 | B225: UTE MORRO VERMELHO | C225: 08.070.566/0012-54 | D225: 10003.99 | E225: 0 | F225: 0 | G225: 0 | H225: 0 | I225: 0 | J225: 0 | K225: 11023.68 | L225: 0 | M225: =SUM(J225:L225)-1019.69 -> 10003.99 | N225: 1019.6900000000001 | O225: =SUM(M225:N225) -> 11023.68
A226: 3232 | B226: PARNAÍBA(UTE MARANHÃO IV e V) | C226: 15.743.303/0001-71 | D226: 141552.64000000001 | E226: 0 | F226: 0 | G226: 0 | H226: 0 | I226: 0 | J226: 0 | K226: 155980.87 | L226: 0 | M226: =SUM(J226:L226)-14428.23 -> 141552.63999999998 | N226: 14428.23 | O226: =SUM(M226:N226) -> 155980.87
A227: 3234 | B227: EOL SETE GAMELEIRAS | C227: 12.710.327/0002-17 | D227: 3664.8400000000001 | E227: 0 | F227: 0 | G227: 0 | H227: 0 | I227: 0 | J227: 0 | K227: 4038.3899999999999 | L227: 0 | M227: =SUM(J227:L227)-373.55 -> 3664.8399999999997 | N227: 373.55000000000001 | O227: =SUM(M227:N227) -> 4038.3899999999999
A228: 3235 | B228: EOL SÃO PEDRO DO LAGO | C228: 12.709.813/0002-15 | D228: 3758.8099999999999 | E228: 0 | F228: 0 | G228: 0 | H228: 0 | I228: 0 | J228: 0 | K228: 4141.9399999999996 | L228: 0 | M228: =SUM(J228:L228)-383.13 -> 3758.8099999999995 | N228: 383.13 | O228: =SUM(M228:N228) -> 4141.9399999999996
A229: 3236 | B229: EOL PEDRA BRANCA | C229: 12.709.996/0002-79 | D229: 3664.8400000000001 | E229: 0 | F229: 0 | G229: 0 | H229: 0 | I229: 0 | J229: 0 | K229: 4038.3899999999999 | L229: 0 | M229: =SUM(J229:L229)-373.55 -> 3664.8399999999997 | N229: 373.55000000000001 | O229: =SUM(M229:N229) -> 4038.3899999999999
A230: 3237 | B230: COSAN (UTE JATAI) | C230: 18.686.104/0001-67 | D230: 39271.110000000001 | E230: 0 | F230: 0 | G230: 0 | H230: 0 | I230: 0 | J230: 0 | K230: 43273.949999999997 | L230: 0 | M230: =SUM(J230:L230)-4002.84 -> 39271.110000000001 | N230: 4002.8400000000001 | O230: =SUM(M230:N230) -> 43273.949999999997
A231: 3239 | B231: ENERGIMP (EOL BURITI) | C231: 11.646.785/0001-90 | D231: 3202.0799999999999 | E231: 0 | F231: 0 | G231: 0 | H231: 0 | I231: 0 | J231: 0 | K231: 3528.46 | L231: 0 | M231: =SUM(J231:L231)-326.38 -> 3202.0799999999999 | N231: 326.38 | O231: =SUM(M231:N231) -> 3528.46
A232: 3240 | B232: ENERGIMP (EOL CAJUCOCO) | C232: 11.646.760/0001-97 | D232: 3209.6700000000001 | E232: 0 | F232: 0 | G232: 0 | H232: 0 | I232: 0 | J232: 0 | K232: 3536.8299999999999 | L232: 0 | M232: =SUM(J232:L232)-327.16 -> 3209.6700000000001 | N232: 327.16000000000003 | O232: =SUM(M232:N232) -> 3536.8299999999999
A233: 3242 | B233: EOL ICARAÍ I | C233: 11.476.987/0001-31 | D233: 2775.3699999999999 | E233: 0 | F233: 0 | G233: 0 | H233: 0 | I233: 0 | J233: 0 | K233: 3058.2600000000002 | L233: 0 | M233: =SUM(J233:L233)-282.89 -> 2775.3700000000003 | N233: 282.88999999999999 | O233: =SUM(M233:N233) -> 3058.2600000000002
A234: 3243 | B234: EOL ICARAÍ II | C234: 11.477.001/0001-48 | D234: 7694.4300000000003 | E234: 0 | F234: 0 | G234: 0 | H234: 0 | I234: 0 | J234: 0 | K234: 8478.7099999999991 | L234: 0 | M234: =SUM(J234:L234)-784.28 -> 7694.4299999999994 | N234: 784.27999999999997 | O234: =SUM(M234:N234) -> 8478.7099999999991
A235: 3244 | B235: UTE PERNAMBUCO III | C235: 10.502.676/0001-37 | D235: 37677.870000000003 | E235: 0 | F235: 0 | G235: 0 | H235: 0 | I235: 0 | J235: 0 | K235: 41518.309999999998 | L235: 0 | M235: =SUM(J235:L235)-3840.44 -> 37677.869999999995 | N235: 3840.4400000000001 | O235: =SUM(M235:N235) -> 41518.309999999998
A236: 3245 | B236: ENERGIMP (EOL COQUEIRO) | C236: 11.646.832/0001-04 | D236: 2883.1700000000001 | E236: 0 | F236: 0 | G236: 0 | H236: 0 | I236: 0 | J236: 0 | K236: 3177.0500000000002 | L236: 0 | M236: =SUM(J236:L236)-293.88 -> 2883.1700000000001 | N236: 293.88 | O236: =SUM(M236:N236) -> 3177.0500000000002
A237: 3249 | B237: ADECOAGRO(UTE AMANDINA) | C237: 07.903.169/0017-68 | D237: 7453.2200000000003 | E237: 0 | F237: 0 | G237: 0 | H237: 0 | I237: 0 | J237: 0 | K237: 8212.9099999999999 | L237: 0 | M237: =SUM(J237:L237)-759.69 -> 7453.2199999999993 | N237: 759.69000000000005 | O237: =SUM(M237:N237) -> 8212.9099999999999
A238: 3250 | B238: UTE ALTO TAQUARI | C238: 08.070.566/0017-69 | D238: 8574.8500000000004 | E238: 0 | F238: 0 | G238: 0 | H238: 0 | I238: 0 | J238: 0 | K238: 9448.8700000000008 | L238: 0 | M238: =SUM(J238:L238)-874.02 -> 8574.8500000000004 | N238: 874.01999999999998 | O238: =SUM(M238:N238) -> 9448.8700000000008
A239: 3251 | B239: EOL CAETITE 2 | C239: 12.106.989/0002-82 | D239: 3610.21 | E239: 0 | F239: 0 | G239: 0 | H239: 0 | I239: 0 | J239: 0 | K239: 3978.1900000000001 | L239: 0 | M239: =SUM(J239:L239)-367.98 -> 3610.21 | N239: 367.98000000000002 | O239: =SUM(M239:N239) -> 3978.1900000000001
A240: 3252 | B240: EOL CAETITE 3 | C240: 12.106.879/0002-10 | D240: 3584.8499999999999 | E240: 0 | F240: 0 | G240: 0 | H240: 0 | I240: 0 | J240: 0 | K240: 3950.25 | L240: 0 | M240: =SUM(J240:L240)-365.4 -> 3584.8499999999999 | N240: 365.39999999999998 | O240: =SUM(M240:N240) -> 3950.25
A241: 3258 | B241: EOL ATLANTICA I | C241: 12.773.558/0002-70 | D241: 2309.46 | E241: 0 | F241: 0 | G241: 0 | H241: 0 | I241: 0 | J241: 0 | K241: 2544.8600000000001 | L241: 0 | M241: =SUM(J241:L241)-235.4 -> 2309.46 | N241: 235.40000000000001 | O241: =SUM(M241:N241) -> 2544.8600000000001
A242: 3259 | B242: EOL ATLANTICA II | C242: 12.963.869/0002-00 | D242: 2309.46 | E242: 0 | F242: 0 | G242: 0 | H242: 0 | I242: 0 | J242: 0 | K242: 2544.8600000000001 | L242: 0 | M242: =SUM(J242:L242)-235.4 -> 2309.46 | N242: 235.40000000000001 | O242: =SUM(M242:N242) -> 2544.8600000000001
A243: 3260 | B243: EOL ATLANTICA IV | C243: 12.981.225/0002-36 | D243: 2309.46 | E243: 0 | F243: 0 | G243: 0 | H243: 0 | I243: 0 | J243: 0 | K243: 2544.8600000000001 | L243: 0 | M243: =SUM(J243:L243)-235.4 -> 2309.46 | N243: 235.40000000000001 | O243: =SUM(M243:N243) -> 2544.8600000000001
A244: 3261 | B244: EOL ATLANTICA V | C244: 12.864.421/0002-20 | D244: 2340.9899999999998 | E244: 0 | F244: 0 | G244: 0 | H244: 0 | I244: 0 | J244: 0 | K244: 2579.5999999999999 | L244: 0 | M244: =SUM(J244:L244)-238.61 -> 2340.9899999999998 | N244: 238.61000000000001 | O244: =SUM(M244:N244) -> 2579.5999999999999
A245: 3262 | B245: BRASVENTOS (EOL MIASSABA III) | C245: 11.839.616/0001-77 | D245: 16473.580000000002 | E245: 0 | F245: 0 | G245: 0 | H245: 0 | I245: 0 | J245: 0 | K245: 18152.709999999999 | L245: 0 | M245: =SUM(J245:L245)-1679.13 -> 16473.579999999998 | N245: 1679.1300000000001 | O245: =SUM(M245:N245) -> 18152.709999999999
A246: 3263 | B246: ESBR (UHE JIRAU) | C246: 09.029.666/0004-90 | D246: 1752672.4199999999 | E246: 0 | F246: 0 | G246: 0 | H246: 0 | I246: 0 | J246: 0 | K246: 1931319.47 | L246: 0 | M246: =SUM(J246:L246)-178647.05 -> 1752672.4199999999 | N246: 178647.04999999999 | O246: =SUM(M246:N246) -> 1931319.47
A247: 3264 | B247: UTE SUZANO | C247: 16.404.287/0222-05 | D247: 18700.23 | E247: 0 | F247: 0 | G247: 0 | H247: 0 | I247: 0 | J247: 0 | K247: 20606.310000000001 | L247: 0 | M247: =SUM(J247:L247)-1906.08 -> 18700.230000000003 | N247: 1906.0799999999999 | O247: =SUM(M247:N247) -> 20606.310000000005
A248: 3265 | B248: EOL REI DOS VENTOS 3 | C248: 11.637.104/0001-28 | D248: 14464.6 | E248: 0 | F248: 0 | G248: 0 | H248: 0 | I248: 0 | J248: 0 | K248: 15938.950000000001 | L248: 0 | M248: =SUM(J248:L248)-1474.35 -> 14464.6 | N248: 1474.3499999999999 | O248: =SUM(M248:N248) -> 15938.950000000001
A249: 3266 | B249: RIO CANOAS (UHE GARIBALDI) | C249: 11.316.814/0001-56 | D249: 28266.709999999999 | E249: 0 | F249: 0 | G249: 0 | H249: 0 | I249: 0 | J249: 0 | K249: 31147.889999999999 | L249: 0 | M249: =SUM(J249:L249)-2881.18 -> 28266.709999999999 | N249: 2881.1799999999998 | O249: =SUM(M249:N249) -> 31147.889999999999
A250: 3267 | B250: EOL REI DOS VENTOS 1 | C250: 11.637.090/0001-42 | D250: 14062.809999999999 | E250: 0 | F250: 0 | G250: 0 | H250: 0 | I250: 0 | J250: 0 | K250: 15496.209999999999 | L250: 0 | M250: =SUM(J250:L250)-1433.4 -> 14062.809999999999 | N250: 1433.4000000000001 | O250: =SUM(M250:N250) -> 15496.209999999999
A251: 3268 | B251: EOL DREEN OLHO DAGUA | C251: 12.723.444/0001-34 | D251: 3606.7800000000002 | E251: 0 | F251: 0 | G251: 0 | H251: 0 | I251: 0 | J251: 0 | K251: 3974.4099999999999 | L251: 0 | M251: =SUM(J251:L251)-367.63 -> 3606.7799999999997 | N251: 367.63 | O251: =SUM(M251:N251) -> 3974.4099999999999
A252: 3269 | B252: EOL DREEN BOA VISTA | C252: 12.723.413/0001-83 | D252: 1688.5999999999999 | E252: 0 | F252: 0 | G252: 0 | H252: 0 | I252: 0 | J252: 0 | K252: 1860.72 | L252: 0 | M252: =SUM(J252:L252)-172.12 -> 1688.5999999999999 | N252: 172.12 | O252: =SUM(M252:N252) -> 1860.7199999999998
A253: 3270 | B253: EOL ASA BRANCA IV | C253: 11.681.456/0002-61 | D253: 3634.27 | E253: 0 | F253: 0 | G253: 0 | H253: 0 | I253: 0 | J253: 0 | K253: 4004.71 | L253: 0 | M253: =SUM(J253:L253)-370.44 -> 3634.27 | N253: 370.44 | O253: =SUM(M253:N253) -> 4004.71
A254: 3271 | B254: EOL ASA BRANCA VI | C254: 11.694.617/0002-51 | D254: 3634.27 | E254: 0 | F254: 0 | G254: 0 | H254: 0 | I254: 0 | J254: 0 | K254: 4004.71 | L254: 0 | M254: =SUM(J254:L254)-370.44 -> 3634.27 | N254: 370.44 | O254: =SUM(M254:N254) -> 4004.71
A255: 3272 | B255: EOL ASA BRANCA VIII | C255: 11.694.621/0002-10 | D255: 3634.27 | E255: 0 | F255: 0 | G255: 0 | H255: 0 | I255: 0 | J255: 0 | K255: 4004.71 | L255: 0 | M255: =SUM(J255:L255)-370.44 -> 3634.27 | N255: 370.44 | O255: =SUM(M255:N255) -> 4004.71
A256: 3273 | B256: EOL CALANGO 1 | C256: 12.106.898/0002-47 | D256: 3243.02 | E256: 0 | F256: 0 | G256: 0 | H256: 0 | I256: 0 | J256: 0 | K256: 3573.5799999999999 | L256: 0 | M256: =SUM(J256:L256)-330.56 -> 3243.02 | N256: 330.56 | O256: =SUM(M256:N256) -> 3573.5799999999999
A257: 3274 | B257: EOL CALANGO 2 | C257: 12.107.047/0002-19 | D257: 3246.3200000000002 | E257: 0 | F257: 0 | G257: 0 | H257: 0 | I257: 0 | J257: 0 | K257: 3577.21 | L257: 0 | M257: =SUM(J257:L257)-330.89 -> 3246.3200000000002 | N257: 330.88999999999999 | O257: =SUM(M257:N257) -> 3577.21
A258: 3275 | B258: EOL CALANGO 3 | C258: 12.106.962/0002-90 | D258: 3252.9299999999998 | E258: 0 | F258: 0 | G258: 0 | H258: 0 | I258: 0 | J258: 0 | K258: 3584.5 | L258: 0 | M258: =SUM(J258:L258)-331.57 -> 3252.9299999999998 | N258: 331.56999999999999 | O258: =SUM(M258:N258) -> 3584.5
A259: 3276 | B259: EOL CALANGO 4 | C259: 12.106.862/0002-63 | D259: 3228.71 | E259: 0 | F259: 0 | G259: 0 | H259: 0 | I259: 0 | J259: 0 | K259: 3557.8099999999999 | L259: 0 | M259: =SUM(J259:L259)-329.1 -> 3228.71 | N259: 329.10000000000002 | O259: =SUM(M259:N259) -> 3557.8099999999999
A260: 3277 | B260: EOL CALANGO 5 | C260: 12.159.338/0002-50 | D260: 3223.21 | E260: 0 | F260: 0 | G260: 0 | H260: 0 | I260: 0 | J260: 0 | K260: 3551.75 | L260: 0 | M260: =SUM(J260:L260)-328.54 -> 3223.21 | N260: 328.54000000000002 | O260: =SUM(M260:N260) -> 3551.75
A261: 3278 | B261: EOL RENASCENÇA I | C261: 12.831.777/0002-68 | D261: 3597.9299999999998 | E261: 0 | F261: 0 | G261: 0 | H261: 0 | I261: 0 | J261: 0 | K261: 3964.6599999999999 | L261: 0 | M261: =SUM(J261:L261)-366.73 -> 3597.9299999999998 | N261: 366.73000000000002 | O261: =SUM(M261:N261) -> 3964.6599999999999
A262: 3279 | B262: EOL RENASCENÇA II | C262: 12.831.668/0002-40 | D262: 3597.9299999999998 | E262: 0 | F262: 0 | G262: 0 | H262: 0 | I262: 0 | J262: 0 | K262: 3964.6599999999999 | L262: 0 | M262: =SUM(J262:L262)-366.73 -> 3597.9299999999998 | N262: 366.73000000000002 | O262: =SUM(M262:N262) -> 3964.6599999999999
A263: 3280 | B263: EOL RENASCENÇA III | C263: 12.833.445/0002-12 | D263: 3597.9299999999998 | E263: 0 | F263: 0 | G263: 0 | H263: 0 | I263: 0 | J263: 0 | K263: 3964.6599999999999 | L263: 0 | M263: =SUM(J263:L263)-366.73 -> 3597.9299999999998 | N263: 366.73000000000002 | O263: =SUM(M263:N263) -> 3964.6599999999999
A264: 3281 | B264: EOL RENASCENÇA IV | C264: 12.833.899/0002-93 | D264: 3597.9299999999998 | E264: 0 | F264: 0 | G264: 0 | H264: 0 | I264: 0 | J264: 0 | K264: 3964.6599999999999 | L264: 0 | M264: =SUM(J264:L264)-366.73 -> 3597.9299999999998 | N264: 366.73000000000002 | O264: =SUM(M264:N264) -> 3964.6599999999999
A265: 3282 | B265: EOL VENTOS DE SÃO MIGUEL | C265: 12.833.419/0002-94 | D265: 3597.9299999999998 | E265: 0 | F265: 0 | G265: 0 | H265: 0 | I265: 0 | J265: 0 | K265: 3964.6599999999999 | L265: 0 | M265: =SUM(J265:L265)-366.73 -> 3597.9299999999998 | N265: 366.73000000000002 | O265: =SUM(M265:N265) -> 3964.6599999999999
A266: 3283 | B266: EOL FLEIXEIRAS I | C266: 09.096.120/0002-90 | D266: 3039.3400000000001 | E266: 0 | F266: 0 | G266: 0 | H266: 0 | I266: 0 | J266: 0 | K266: 3349.1300000000001 | L266: 0 | M266: =SUM(J266:L266)-309.79 -> 3039.3400000000001 | N266: 309.79000000000002 | O266: =SUM(M266:N266) -> 3349.1300000000001
A267: 3284 | B267: EOL GUAJIRÚ | C267: 08.701.973/0002-40 | D267: 3039.3400000000001 | E267: 0 | F267: 0 | G267: 0 | H267: 0 | I267: 0 | J267: 0 | K267: 3349.1300000000001 | L267: 0 | M267: =SUM(J267:L267)-309.79 -> 3039.3400000000001 | N267: 309.79000000000002 | O267: =SUM(M267:N267) -> 3349.1300000000001
A268: 3285 | B268: EOL MUNDAÚ | C268: 08.629.553/0002-09 | D268: 2312.8400000000001 | E268: 0 | F268: 0 | G268: 0 | H268: 0 | I268: 0 | J268: 0 | K268: 2548.5799999999999 | L268: 0 | M268: =SUM(J268:L268)-235.74 -> 2312.8400000000001 | N268: 235.74000000000001 | O268: =SUM(M268:N268) -> 2548.5799999999999
A269: 3286 | B269: EOL TRAIRÍ | C269: 09.252.423/0002-54 | D269: 2643.3800000000001 | E269: 0 | F269: 0 | G269: 0 | H269: 0 | I269: 0 | J269: 0 | K269: 2912.8200000000002 | L269: 0 | M269: =SUM(J269:L269)-269.44 -> 2643.3800000000001 | N269: 269.44 | O269: =SUM(M269:N269) -> 2912.8200000000002
A270: 3287 | B270: EOL FAISA I | C270: 11.619.268/0001-22 | D270: 3188.4400000000001 | E270: 0 | F270: 0 | G270: 0 | H270: 0 | I270: 0 | J270: 0 | K270: 3513.4299999999998 | L270: 0 | M270: =SUM(J270:L270)-324.99 -> 3188.4399999999996 | N270: 324.99000000000001 | O270: =SUM(M270:N270) -> 3513.4299999999994
A271: 3288 | B271: EOL FAISA II | C271: 11.619.388/0001-20 | D271: 2953.5799999999999 | E271: 0 | F271: 0 | G271: 0 | H271: 0 | I271: 0 | J271: 0 | K271: 3254.6300000000001 | L271: 0 | M271: =SUM(J271:L271)-301.05 -> 2953.5799999999999 | N271: 301.05000000000001 | O271: =SUM(M271:N271) -> 3254.6300000000001
A272: 3289 | B272: EOL FAISA III | C272: 11.619.413/0001-75 | D272: 2718.73 | E272: 0 | F272: 0 | G272: 0 | H272: 0 | I272: 0 | J272: 0 | K272: 2995.8499999999999 | L272: 0 | M272: =SUM(J272:L272)-277.12 -> 2718.73 | N272: 277.12 | O272: =SUM(M272:N272) -> 2995.8499999999999
A273: 3290 | B273: EOL FAISA IV | C273: 11.619.342/0001-00 | D273: 2718.73 | E273: 0 | F273: 0 | G273: 0 | H273: 0 | I273: 0 | J273: 0 | K273: 2995.8499999999999 | L273: 0 | M273: =SUM(J273:L273)-277.12 -> 2718.73 | N273: 277.12 | O273: =SUM(M273:N273) -> 2995.8499999999999
A274: 3291 | B274: EOL FAISA V | C274: 11.652.254/0001-00 | D274: 3188.4400000000001 | E274: 0 | F274: 0 | G274: 0 | H274: 0 | I274: 0 | J274: 0 | K274: 3513.4299999999998 | L274: 0 | M274: =SUM(J274:L274)-324.99 -> 3188.4399999999996 | N274: 324.99000000000001 | O274: =SUM(M274:N274) -> 3513.4299999999994
A275: 3292 | B275: EOL TAÍBA ÁGUIA | C275: 11.477.009/0001-04 | D275: 2523.02 | E275: 0 | F275: 0 | G275: 0 | H275: 0 | I275: 0 | J275: 0 | K275: 2780.1900000000001 | L275: 0 | M275: =SUM(J275:L275)-257.17 -> 2523.02 | N275: 257.17000000000002 | O275: =SUM(M275:N275) -> 2780.1900000000001
A276: 3293 | B276: EOL TAÍBA ANDORINHA | C276: 11.477.020/0001-74 | D276: 1601.49 | E276: 0 | F276: 0 | G276: 0 | H276: 0 | I276: 0 | J276: 0 | K276: 1764.73 | L276: 0 | M276: =SUM(J276:L276)-163.24 -> 1601.49 | N276: 163.24000000000001 | O276: =SUM(M276:N276) -> 1764.73
A277: 3294 | B277: EOL COLÔNIA | C277: 11.476.958/0001-70 | D277: 2063.3699999999999 | E277: 0 | F277: 0 | G277: 0 | H277: 0 | I277: 0 | J277: 0 | K277: 2273.6900000000001 | L277: 0 | M277: =SUM(J277:L277)-210.32 -> 2063.3699999999999 | N277: 210.31999999999999 | O277: =SUM(M277:N277) -> 2273.6900000000001
A278: 3295 | B278: EOL EMBUACA | C278: 10.288.461/0001-65 | D278: 2787.8499999999999 | E278: 0 | F278: 0 | G278: 0 | H278: 0 | I278: 0 | J278: 0 | K278: 3072.0100000000002 | L278: 0 | M278: =SUM(J278:L278)-284.16 -> 2787.8500000000004 | N278: 284.16000000000003 | O278: =SUM(M278:N278) -> 3072.0100000000002
A279: 3296 | B279: CPFL (EOL CAMPO DOS VENTOS II) | C279: 10.797.889/0002-14 | D279: 3698.3600000000001 | E279: 0 | F279: 0 | G279: 0 | H279: 0 | I279: 0 | J279: 0 | K279: 4075.3299999999999 | L279: 0 | M279: =SUM(J279:L279)-376.97 -> 3698.3599999999997 | N279: 376.97000000000003 | O279: =SUM(M279:N279) -> 4075.3299999999999
A280: 3297 | B280: EOL SÃO BENTO DO NORTE | C280: 12.723.384/0001-50 | D280: 3370.8800000000001 | E280: 0 | F280: 0 | G280: 0 | H280: 0 | I280: 0 | J280: 0 | K280: 3714.4699999999998 | L280: 0 | M280: =SUM(J280:L280)-343.59 -> 3370.8799999999997 | N280: 343.58999999999997 | O280: =SUM(M280:N280) -> 3714.4699999999998
A281: 3298 | B281: EOL ASA BRANCA V | C281: 11.681.458/0002-50 | D281: 3339.8299999999999 | E281: 0 | F281: 0 | G281: 0 | H281: 0 | I281: 0 | J281: 0 | K281: 3680.25 | L281: 0 | M281: =SUM(J281:L281)-340.42 -> 3339.8299999999999 | N281: 340.42000000000002 | O281: =SUM(M281:N281) -> 3680.25
A282: 3299 | B282: EOL ASA BRANCA VII | C282: 11.694.618/0002-04 | D282: 3339.8299999999999 | E282: 0 | F282: 0 | G282: 0 | H282: 0 | I282: 0 | J282: 0 | K282: 3680.25 | L282: 0 | M282: =SUM(J282:L282)-340.42 -> 3339.8299999999999 | N282: 340.42000000000002 | O282: =SUM(M282:N282) -> 3680.25
A283: 3300 | B283: PETROBRAS (UTE B. FLUMINENSE) | C283: 33.000.167/0238-29 | D283: 103810.23 | E283: 0 | F283: 0 | G283: 0 | H283: 0 | I283: 0 | J283: 0 | K283: 114391.44 | L283: 0 | M283: =SUM(J283:L283)-10581.21 -> 103810.23000000001 | N283: 10581.209999999999 | O283: =SUM(M283:N283) -> 114391.44
A284: 3301 | B284: EOL MAR E TERRA | C284: 10.288.438/0001-70 | D284: 2767.23 | E284: 0 | F284: 0 | G284: 0 | H284: 0 | I284: 0 | J284: 0 | K284: 3049.29 | L284: 0 | M284: =SUM(J284:L284)-282.06 -> 2767.23 | N284: 282.06 | O284: =SUM(M284:N284) -> 3049.29
A285: 3302 | B285: EOL BELA VISTA | C285: 10.288.502/0001-13 | D285: 3295.3000000000002 | E285: 0 | F285: 0 | G285: 0 | H285: 0 | I285: 0 | J285: 0 | K285: 3631.1799999999998 | L285: 0 | M285: =SUM(J285:L285)-335.88 -> 3295.2999999999997 | N285: 335.88 | O285: =SUM(M285:N285) -> 3631.1799999999998
A286: 3303 | B286: EOL PAU FERRO | C286: 14.422.424/0002-30 | D286: 3718.1799999999998 | E286: 0 | F286: 0 | G286: 0 | H286: 0 | I286: 0 | J286: 0 | K286: 4097.1700000000001 | L286: 0 | M286: =SUM(J286:L286)-378.99 -> 3718.1800000000003 | N286: 378.99000000000001 | O286: =SUM(M286:N286) -> 4097.1700000000001
A287: 3304 | B287: EOL PEDRA DO GERONIMO | C287: 14.422.483/0002-08 | D287: 3718.1799999999998 | E287: 0 | F287: 0 | G287: 0 | H287: 0 | I287: 0 | J287: 0 | K287: 4097.1700000000001 | L287: 0 | M287: =SUM(J287:L287)-378.99 -> 3718.1800000000003 | N287: 378.99000000000001 | O287: =SUM(M287:N287) -> 4097.1700000000001
A288: 3305 | B288: EOL TACAICÓ | C288: 14.411.251/0002-54 | D288: 2283.8699999999999 | E288: 0 | F288: 0 | G288: 0 | H288: 0 | I288: 0 | J288: 0 | K288: 2516.6599999999999 | L288: 0 | M288: =SUM(J288:L288)-232.79 -> 2283.8699999999999 | N288: 232.78999999999999 | O288: =SUM(M288:N288) -> 2516.6599999999999
A289: 3306 | B289: UTE TROPICAL BIOENERGIA | C289: 08.195.806/0001-94 | D289: 9880.2999999999993 | E289: 0 | F289: 0 | G289: 0 | H289: 0 | I289: 0 | J289: 0 | K289: 10887.379999999999 | L289: 0 | M289: =SUM(J289:L289)-1007.08 -> 9880.2999999999993 | N289: 1007.08 | O289: =SUM(M289:N289) -> 10887.379999999999
A290: 3307 | B290: EOL PALMAS | C290: 10.656.525/0001-33 | D290: 2015.9100000000001 | E290: 0 | F290: 0 | G290: 0 | H290: 0 | I290: 0 | J290: 0 | K290: 2221.3899999999999 | L290: 0 | M290: =SUM(J290:L290)-205.48 -> 2015.9099999999999 | N290: 205.47999999999999 | O290: =SUM(M290:N290) -> 2221.3899999999999
A291: 3308 | B291: EOL ILHA GRANDE | C291: 08.624.273/0001-19 | D291: 3196.77 | E291: 0 | F291: 0 | G291: 0 | H291: 0 | I291: 0 | J291: 0 | K291: 3522.6100000000001 | L291: 0 | M291: =SUM(J291:L291)-325.84 -> 3196.77 | N291: 325.83999999999997 | O291: =SUM(M291:N291) -> 3522.6100000000001
A292: 3309 | B292: EOL RIBEIRÃO | C292: 10.656.583/0001-67 | D292: 2323.9000000000001 | E292: 0 | F292: 0 | G292: 0 | H292: 0 | I292: 0 | J292: 0 | K292: 2560.77 | L292: 0 | M292: =SUM(J292:L292)-236.87 -> 2323.9000000000001 | N292: 236.87 | O292: =SUM(M292:N292) -> 2560.77
A293: 3310 | B293: UTE IACO | C293: 07.895.728/0006-82 | D293: 9636.3299999999999 | E293: 0 | F293: 0 | G293: 0 | H293: 0 | I293: 0 | J293: 0 | K293: 10618.549999999999 | L293: 0 | M293: =SUM(J293:L293)-982.22 -> 9636.3299999999999 | N293: 982.22000000000003 | O293: =SUM(M293:N293) -> 10618.549999999999
A294: 3312 | B294: EOL IBIRAPUITÃ I | C294: 14.608.116/0001-12 | D294: 2168.3200000000002 | E294: 0 | F294: 0 | G294: 0 | H294: 0 | I294: 0 | J294: 0 | K294: 2389.3299999999999 | L294: 0 | M294: =SUM(J294:L294)-221.01 -> 2168.3199999999997 | N294: 221.00999999999999 | O294: =SUM(M294:N294) -> 2389.3299999999999
A295: 3313 | B295: PARNAÍBA II | C295: 14.578.002/0001-77 | D295: 148756.72 | E295: 0 | F295: 0 | G295: 0 | H295: 0 | I295: 0 | J295: 0 | K295: 163919.25 | L295: 0 | M295: =SUM(J295:L295)-15162.53 -> 148756.72 | N295: 15162.530000000001 | O295: =SUM(M295:N295) -> 163919.25
A296: 3314 | B296: UTE ERB CANDEIAS | C296: 12.901.925/0001-92 | D296: 964.54999999999995 | E296: 0 | F296: 0 | G296: 0 | H296: 0 | I296: 0 | J296: 0 | K296: 1062.8699999999999 | L296: 0 | M296: =SUM(J296:L296)-98.32 -> 964.54999999999995 | N296: 98.319999999999993 | O296: =SUM(M296:N296) -> 1062.8699999999999
A297: 3315 | B297: EOL UNIÃO DOS VENTOS 1 | C297: 13.336.223/0001-76 | D297: 2524.0100000000002 | E297: 0 | F297: 0 | G297: 0 | H297: 0 | I297: 0 | J297: 0 | K297: 2781.2800000000002 | L297: 0 | M297: =SUM(J297:L297)-257.27 -> 2524.0100000000002 | N297: 257.26999999999998 | O297: =SUM(M297:N297) -> 2781.2800000000002
A298: 3316 | B298: EOL UNIÃO DOS VENTOS 2 | C298: 13.336.463/0001-70 | D298: 2535.6399999999999 | E298: 0 | F298: 0 | G298: 0 | H298: 0 | I298: 0 | J298: 0 | K298: 2794.0900000000001 | L298: 0 | M298: =SUM(J298:L298)-258.45 -> 2535.6400000000003 | N298: 258.44999999999999 | O298: =SUM(M298:N298) -> 2794.0900000000001
A299: 3317 | B299: EOL UNIÃO DOS VENTOS 3 | C299: 13.336.480/0001-08 | D299: 2510.0500000000002 | E299: 0 | F299: 0 | G299: 0 | H299: 0 | I299: 0 | J299: 0 | K299: 2765.9000000000001 | L299: 0 | M299: =SUM(J299:L299)-255.85 -> 2510.0500000000002 | N299: 255.84999999999999 | O299: =SUM(M299:N299) -> 2765.9000000000001
A300: 3318 | B300: EOL UNIÃO DOS VENTOS 4 | C300: 13.336.491/0001-98 | D300: 1262.3499999999999 | E300: 0 | F300: 0 | G300: 0 | H300: 0 | I300: 0 | J300: 0 | K300: 1391.02 | L300: 0 | M300: =SUM(J300:L300)-128.67 -> 1262.3499999999999 | N300: 128.66999999999999 | O300: =SUM(M300:N300) -> 1391.02
A301: 3319 | B301: EOL UNIÃO DOS VENTOS 5 | C301: 13.336.386/0001-59 | D301: 2675.2199999999998 | E301: 0 | F301: 0 | G301: 0 | H301: 0 | I301: 0 | J301: 0 | K301: 2947.9000000000001 | L301: 0 | M301: =SUM(J301:L301)-272.68 -> 2675.2200000000003 | N301: 272.68000000000001 | O301: =SUM(M301:N301) -> 2947.9000000000001
A302: 3320 | B302: EOL UNIÃO DOS VENTOS 6 | C302: 13.336.397/0001-39 | D302: 1438.8 | E302: 0 | F302: 0 | G302: 0 | H302: 0 | I302: 0 | J302: 0 | K302: 1585.45 | L302: 0 | M302: =SUM(J302:L302)-146.65 -> 1438.8 | N302: 146.65000000000001 | O302: =SUM(M302:N302) -> 1585.45
A303: 3321 | B303: EOL UNIÃO DOS VENTOS 7 | C303: 13.341.988/0001-02 | D303: 1628.3900000000001 | E303: 0 | F303: 0 | G303: 0 | H303: 0 | I303: 0 | J303: 0 | K303: 1794.3699999999999 | L303: 0 | M303: =SUM(J303:L303)-165.98 -> 1628.3899999999999 | N303: 165.97999999999999 | O303: =SUM(M303:N303) -> 1794.3699999999999
A304: 3322 | B304: EOL UNIÃO DOS VENTOS 8 | C304: 13.336.404/0001-00 | D304: 1730.3199999999999 | E304: 0 | F304: 0 | G304: 0 | H304: 0 | I304: 0 | J304: 0 | K304: 1906.6900000000001 | L304: 0 | M304: =SUM(J304:L304)-176.37 -> 1730.3200000000002 | N304: 176.37 | O304: =SUM(M304:N304) -> 1906.6900000000001
A305: 3323 | B305: EOL UNIÃO DOS VENTOS 9 | C305: 13.336.428/0001-51 | D305: 1286.3099999999999 | E305: 0 | F305: 0 | G305: 0 | H305: 0 | I305: 0 | J305: 0 | K305: 1417.4200000000001 | L305: 0 | M305: =SUM(J305:L305)-131.11 -> 1286.3099999999999 | N305: 131.11000000000001 | O305: =SUM(M305:N305) -> 1417.4200000000001
A306: 3324 | B306: EOL UNIÃO DOS VENTOS 10 | C306: 13.336.415/0001-82 | D306: 1645.8299999999999 | E306: 0 | F306: 0 | G306: 0 | H306: 0 | I306: 0 | J306: 0 | K306: 1813.5899999999999 | L306: 0 | M306: =SUM(J306:L306)-167.76 -> 1645.8299999999999 | N306: 167.75999999999999 | O306: =SUM(M306:N306) -> 1813.5899999999999
A307: 3325 | B307: UTE PARNAÍBA IV | C307: 14.578.002/0001-77 | D307: 11057.360000000001 | E307: 0 | F307: 0 | G307: 0 | H307: 0 | I307: 0 | J307: 0 | K307: 12184.42 | L307: 0 | M307: =SUM(J307:L307)-1127.06 -> 11057.360000000001 | N307: 1127.0599999999999 | O307: =SUM(M307:N307) -> 12184.42
A308: 3326 | B308: EOL PRIMAVERA | C308: 12.851.871/0004-40 | D308: 3588.5599999999999 | E308: 0 | F308: 0 | G308: 0 | H308: 0 | I308: 0 | J308: 0 | K308: 3954.3400000000001 | L308: 0 | M308: =SUM(J308:L308)-365.78 -> 3588.5600000000004 | N308: 365.77999999999997 | O308: =SUM(M308:N308) -> 3954.3400000000001
A309: 3327 | B309: EOL MODELO I | C309: 14.512.809/0002-98 | D309: 3624.0599999999999 | E309: 0 | F309: 0 | G309: 0 | H309: 0 | I309: 0 | J309: 0 | K309: 3993.4499999999998 | L309: 0 | M309: =SUM(J309:L309)-369.39 -> 3624.0599999999999 | N309: 369.38999999999999 | O309: =SUM(M309:N309) -> 3993.4499999999998
A310: 3328 | B310: EOL MODELO II | C310: 14.504.489/0002-24 | D310: 3153.4299999999998 | E310: 0 | F310: 0 | G310: 0 | H310: 0 | I310: 0 | J310: 0 | K310: 3474.8499999999999 | L310: 0 | M310: =SUM(J310:L310)-321.42 -> 3153.4299999999998 | N310: 321.42000000000002 | O310: =SUM(M310:N310) -> 3474.8499999999999
A311: 3329 | B311: EOL SÃO JUDAS | C311: 12.851.951/0003-15 | D311: 3555.5500000000002 | E311: 0 | F311: 0 | G311: 0 | H311: 0 | I311: 0 | J311: 0 | K311: 3917.96 | L311: 0 | M311: =SUM(J311:L311)-362.41 -> 3555.5500000000002 | N311: 362.41000000000003 | O311: =SUM(M311:N311) -> 3917.96
A312: 3330 | B312: EOL CRISTAL | C312: 12.851.920/0003-64 | D312: 3571.4400000000001 | E312: 0 | F312: 0 | G312: 0 | H312: 0 | I312: 0 | J312: 0 | K312: 3935.4699999999998 | L312: 0 | M312: =SUM(J312:L312)-364.03 -> 3571.4399999999996 | N312: 364.02999999999997 | O312: =SUM(M312:N312) -> 3935.4699999999993
A313: 3331 | B313: EOL PEDRA PRETA | C313: 09.665.342/0002-86 | D313: 2456.6500000000001 | E313: 0 | F313: 0 | G313: 0 | H313: 0 | I313: 0 | J313: 0 | K313: 2707.0500000000002 | L313: 0 | M313: =SUM(J313:L313)-250.4 -> 2456.6500000000001 | N313: 250.40000000000001 | O313: =SUM(M313:N313) -> 2707.0500000000002
A314: 3332 | B314: EOL COSTA BRANCA | C314: 09.665.392/0002-63 | D314: 2458.5799999999999 | E314: 0 | F314: 0 | G314: 0 | H314: 0 | I314: 0 | J314: 0 | K314: 2709.1799999999998 | L314: 0 | M314: =SUM(J314:L314)-250.6 -> 2458.5799999999999 | N314: 250.59999999999999 | O314: =SUM(M314:N314) -> 2709.1799999999998
A315: 3333 | B315: EOL JUREMAS | C315: 09.665.446/0002-90 | D315: 1930.6199999999999 | E315: 0 | F315: 0 | G315: 0 | H315: 0 | I315: 0 | J315: 0 | K315: 2127.4000000000001 | L315: 0 | M315: =SUM(J315:L315)-196.78 -> 1930.6200000000001 | N315: 196.78 | O315: =SUM(M315:N315) -> 2127.4000000000001
A316: 3334 | B316: EOL MACACOS | C316: 07.091.059/0002-62 | D316: 2456.2800000000002 | E316: 0 | F316: 0 | G316: 0 | H316: 0 | I316: 0 | J316: 0 | K316: 2706.6399999999999 | L316: 0 | M316: =SUM(J316:L316)-250.36 -> 2456.2799999999997 | N316: 250.36000000000001 | O316: =SUM(M316:N316) -> 2706.6399999999999
A317: 3335 | B317: EOL EMILIANA | C317: 14.422.996/0002-19 | D317: 3351.6399999999999 | E317: 0 | F317: 0 | G317: 0 | H317: 0 | I317: 0 | J317: 0 | K317: 3693.27 | L317: 0 | M317: =SUM(J317:L317)-341.63 -> 3351.6399999999999 | N317: 341.63 | O317: =SUM(M317:N317) -> 3693.27
A318: 3336 | B318: EOL JOANA | C318: 14.423.010/0002-25 | D318: 3351.6399999999999 | E318: 0 | F318: 0 | G318: 0 | H318: 0 | I318: 0 | J318: 0 | K318: 3693.27 | L318: 0 | M318: =SUM(J318:L318)-341.63 -> 3351.6399999999999 | N318: 341.63 | O318: =SUM(M318:N318) -> 3693.27
A319: 3337 | B319: UHE SANTO ANTONIO JARI | C319: 03.581.989/0003-24 | D319: 63794.43 | E319: 0 | F319: 0 | G319: 0 | H319: 0 | I319: 0 | J319: 0 | K319: 70296.889999999999 | L319: 0 | M319: =SUM(J319:L319)-6502.46 -> 63794.43 | N319: 6502.46 | O319: =SUM(M319:N319) -> 70296.889999999999
A320: 3338 | B320: EOL CARCARÁ I | C320: 14.535.594/0001-40 | D320: 3625.1900000000001 | E320: 0 | F320: 0 | G320: 0 | H320: 0 | I320: 0 | J320: 0 | K320: 3994.6999999999998 | L320: 0 | M320: =SUM(J320:L320)-369.51 -> 3625.1899999999996 | N320: 369.50999999999999 | O320: =SUM(M320:N320) -> 3994.6999999999998
A321: 3339 | B321: DESA (EOL EURUS I) | C321: 12.652.614/0001-37 | D321: 3651.3299999999999 | E321: 0 | F321: 0 | G321: 0 | H321: 0 | I321: 0 | J321: 0 | K321: 4023.5 | L321: 0 | M321: =SUM(J321:L321)-372.17 -> 3651.3299999999999 | N321: 372.17000000000002 | O321: =SUM(M321:N321) -> 4023.5
A322: 3340 | B322: DESA (EOL EURUS III) | C322: 12.652.634/0001-08 | D322: 3582.1900000000001 | E322: 0 | F322: 0 | G322: 0 | H322: 0 | I322: 0 | J322: 0 | K322: 3947.3200000000002 | L322: 0 | M322: =SUM(J322:L322)-365.13 -> 3582.1900000000001 | N322: 365.13 | O322: =SUM(M322:N322) -> 3947.3200000000002
A323: 3341 | B323: EOL CARCARÁ II | C323: 15.394.399/0001-00 | D323: 2851.8699999999999 | E323: 0 | F323: 0 | G323: 0 | H323: 0 | I323: 0 | J323: 0 | K323: 3142.5599999999999 | L323: 0 | M323: =SUM(J323:L323)-290.69 -> 2851.8699999999999 | N323: 290.69 | O323: =SUM(M323:N323) -> 3142.5599999999999
A324: 3342 | B324: EOL RENASCENÇA V | C324: 10.797.904/0001-43 | D324: 3603.75 | E324: 0 | F324: 0 | G324: 0 | H324: 0 | I324: 0 | J324: 0 | K324: 3971.0700000000002 | L324: 0 | M324: =SUM(J324:L324)-367.32 -> 3603.75 | N324: 367.31999999999999 | O324: =SUM(M324:N324) -> 3971.0700000000002
A325: 3343 | B325: ATLANTIC (EOL EURUS II) | C325: 10.797.897/0001-80 | D325: 3603.75 | E325: 0 | F325: 0 | G325: 0 | H325: 0 | I325: 0 | J325: 0 | K325: 3971.0700000000002 | L325: 0 | M325: =SUM(J325:L325)-367.32 -> 3603.75 | N325: 367.31999999999999 | O325: =SUM(M325:N325) -> 3971.0700000000002
A326: 3344 | B326: EOL SANTO ANTÔNIO DE PÁDUA | C326: 09.601.233/0001-14 | D326: 1587.51 | E326: 0 | F326: 0 | G326: 0 | H326: 0 | I326: 0 | J326: 0 | K326: 1749.3199999999999 | L326: 0 | M326: =SUM(J326:L326)-161.81 -> 1587.51 | N326: 161.81 | O326: =SUM(M326:N326) -> 1749.3199999999999
A327: 3345 | B327: EOL SÃO CRISTOVÃO | C327: 10.272.500/0001-36 | D327: 2864.6799999999998 | E327: 0 | F327: 0 | G327: 0 | H327: 0 | I327: 0 | J327: 0 | K327: 3156.6700000000001 | L327: 0 | M327: =SUM(J327:L327)-291.99 -> 2864.6800000000003 | N327: 291.99000000000001 | O327: =SUM(M327:N327) -> 3156.6700000000001
A328: 3346 | B328: EOL SÃO JORGE | C328: 09.571.485/0001-48 | D328: 2705.54 | E328: 0 | F328: 0 | G328: 0 | H328: 0 | I328: 0 | J328: 0 | K328: 2981.3099999999999 | L328: 0 | M328: =SUM(J328:L328)-275.77 -> 2705.54 | N328: 275.76999999999998 | O328: =SUM(M328:N328) -> 2981.3099999999999
A329: 3347 | B329: EOL V. DO NORDESTE | C329: 11.204.086/0001-90 | D329: 2882.29 | E329: 0 | F329: 0 | G329: 0 | H329: 0 | I329: 0 | J329: 0 | K329: 3176.0799999999999 | L329: 0 | M329: =SUM(J329:L329)-293.79 -> 2882.29 | N329: 293.79000000000002 | O329: =SUM(M329:N329) -> 3176.0799999999999
A330: 3348 | B330: EOL TANQUE | C330: 12.048.059/0001-39 | D330: 3676.3800000000001 | E330: 0 | F330: 0 | G330: 0 | H330: 0 | I330: 0 | J330: 0 | K330: 4051.1100000000001 | L330: 0 | M330: =SUM(J330:L330)-374.73 -> 3676.3800000000001 | N330: 374.73000000000002 | O330: =SUM(M330:N330) -> 4051.1100000000001
A331: 3349 | B331: EOL SERAÍMA | C331: 12.047.526/0001-06 | D331: 3676.3800000000001 | E331: 0 | F331: 0 | G331: 0 | H331: 0 | I331: 0 | J331: 0 | K331: 4051.1100000000001 | L331: 0 | M331: =SUM(J331:L331)-374.73 -> 3676.3800000000001 | N331: 374.73000000000002 | O331: =SUM(M331:N331) -> 4051.1100000000001
A332: 3350 | B332: EOL DOS ARAÇAS | C332: 11.201.833/0001-37 | D332: 3676.3800000000001 | E332: 0 | F332: 0 | G332: 0 | H332: 0 | I332: 0 | J332: 0 | K332: 4051.1100000000001 | L332: 0 | M332: =SUM(J332:L332)-374.73 -> 3676.3800000000001 | N332: 374.73000000000002 | O332: =SUM(M332:N332) -> 4051.1100000000001
A333: 3351 | B333: EOL DA PRATA | C333: 11.366.231/0001-30 | D333: 2676.4099999999999 | E333: 0 | F333: 0 | G333: 0 | H333: 0 | I333: 0 | J333: 0 | K333: 2949.21 | L333: 0 | M333: =SUM(J333:L333)-272.8 -> 2676.4099999999999 | N333: 272.80000000000001 | O333: =SUM(M333:N333) -> 2949.21
A334: 3352 | B334: EOL CAETITÉ 1 | C334: 12.158.428/0002-27 | D334: 3074.4499999999998 | E334: 0 | F334: 0 | G334: 0 | H334: 0 | I334: 0 | J334: 0 | K334: 3387.8200000000002 | L334: 0 | M334: =SUM(J334:L334)-313.37 -> 3074.4500000000003 | N334: 313.37 | O334: =SUM(M334:N334) -> 3387.8200000000002
A335: 3353 | B335: EOL TERRAL | C335: 15.394.357/0001-79 | D335: 2851.8699999999999 | E335: 0 | F335: 0 | G335: 0 | H335: 0 | I335: 0 | J335: 0 | K335: 3142.5599999999999 | L335: 0 | M335: =SUM(J335:L335)-290.69 -> 2851.8699999999999 | N335: 290.69 | O335: =SUM(M335:N335) -> 3142.5599999999999
A336: 3354 | B336: TIJOA (UHE TRES IRMÃOS) | C336: 14.522.198/0001-88 | D336: 209112.69 | E336: 0 | F336: 0 | G336: 0 | H336: 0 | I336: 0 | J336: 0 | K336: 230427.20999999999 | L336: 0 | M336: =SUM(J336:L336)-21314.52 -> 209112.69 | N336: 21314.52 | O336: =SUM(M336:N336) -> 230427.20999999999
A337: 3355 | B337: EOL FAROL | C337: 12.723.335/0001-17 | D337: 2177.3499999999999 | E337: 0 | F337: 0 | G337: 0 | H337: 0 | I337: 0 | J337: 0 | K337: 2399.2800000000002 | L337: 0 | M337: =SUM(J337:L337)-221.93 -> 2177.3500000000004 | N337: 221.93000000000001 | O337: =SUM(M337:N337) -> 2399.2800000000002
A338: 3356 | B338: UTE TROPICAL BIOENERGIA II | C338: 08.195.806/0001-94 | D338: 4398.3999999999996 | E338: 0 | F338: 0 | G338: 0 | H338: 0 | I338: 0 | J338: 0 | K338: 4846.7200000000003 | L338: 0 | M338: =SUM(J338:L338)-448.32 -> 4398.4000000000005 | N338: 448.31999999999999 | O338: =SUM(M338:N338) -> 4846.7200000000003
A339: 3357 | B339: UHE FERREIRA GOMES | C339: 12.489.315/0001-23 | D339: 54165.75 | E339: 0 | F339: 0 | G339: 0 | H339: 0 | I339: 0 | J339: 0 | K339: 59686.779999999999 | L339: 0 | M339: =SUM(J339:L339)-5521.03 -> 54165.75 | N339: 5521.0299999999997 | O339: =SUM(M339:N339) -> 59686.779999999999
A340: 3358 | B340: VENTOS DOS INDIOS (INDIOS 2-3) | C340: 11.622.264/0002-84 | D340: 4636.46 | E340: 0 | F340: 0 | G340: 0 | H340: 0 | I340: 0 | J340: 0 | K340: 5109.0500000000002 | L340: 0 | M340: =SUM(J340:L340)-472.59 -> 4636.46 | N340: 472.58999999999997 | O340: =SUM(M340:N340) -> 5109.0500000000002
A341: 3359 | B341: NORTE ENERGIA (BELO MONTE) | C341: 12.300.288/0001-07 | D341: 2896326.4500000002 | E341: 0 | F341: 0 | G341: 0 | H341: 0 | I341: 0 | J341: 0 | K341: 3191544.2999999998 | L341: 0 | M341: =SUM(J341:L341)-295217.85 -> 2896326.4499999997 | N341: 295217.84999999998 | O341: =SUM(M341:N341) -> 3191544.2999999998
A342: 3360 | B342: EOL MORRÃO | C342: 12.049.829/0001-68 | D342: 3298.4400000000001 | E342: 0 | F342: 0 | G342: 0 | H342: 0 | I342: 0 | J342: 0 | K342: 3634.6399999999999 | L342: 0 | M342: =SUM(J342:L342)-336.2 -> 3298.4400000000001 | N342: 336.19999999999999 | O342: =SUM(M342:N342) -> 3634.6399999999999
A343: 3361 | B343: ACARI (EOL RIACHÃO I) | C343: 12.959.291/0001-29 | D343: 3276.5799999999999 | E343: 0 | F343: 0 | G343: 0 | H343: 0 | I343: 0 | J343: 0 | K343: 3610.5599999999999 | L343: 0 | M343: =SUM(J343:L343)-333.98 -> 3276.5799999999999 | N343: 333.98000000000002 | O343: =SUM(M343:N343) -> 3610.5599999999999
A344: 3362 | B344: ALBUQUERQUE (EOL RIACHÃO II) | C344: 12.960.216/0001-88 | D344: 3016.46 | E344: 0 | F344: 0 | G344: 0 | H344: 0 | I344: 0 | J344: 0 | K344: 3323.9200000000001 | L344: 0 | M344: =SUM(J344:L344)-307.46 -> 3016.46 | N344: 307.45999999999998 | O344: =SUM(M344:N344) -> 3323.9200000000001
A345: 3363 | B345: ANEMOI (EOL RIACHÃO IV) | C345: 12.959.327/0001-74 | D345: 3303.96 | E345: 0 | F345: 0 | G345: 0 | H345: 0 | I345: 0 | J345: 0 | K345: 3640.73 | L345: 0 | M345: =SUM(J345:L345)-336.77 -> 3303.96 | N345: 336.76999999999998 | O345: =SUM(M345:N345) -> 3640.73
A346: 3364 | B346: APELIOTES (EOL RIACHÃO VI) | C346: 12.959.413/0001-87 | D346: 3311.9400000000001 | E346: 0 | F346: 0 | G346: 0 | H346: 0 | I346: 0 | J346: 0 | K346: 3649.52 | L346: 0 | M346: =SUM(J346:L346)-337.58 -> 3311.9400000000001 | N346: 337.57999999999998 | O346: =SUM(M346:N346) -> 3649.52
A347: 3365 | B347: ARENA (EOL RIACHÃO VII) | C347: 11.781.913/0001-09 | D347: 3317.6500000000001 | E347: 0 | F347: 0 | G347: 0 | H347: 0 | I347: 0 | J347: 0 | K347: 3655.8099999999999 | L347: 0 | M347: =SUM(J347:L347)-338.16 -> 3317.6500000000001 | N347: 338.16000000000003 | O347: =SUM(M347:N347) -> 3655.8099999999999
A348: 3366 | B348: EOL SANTA HELENA | C348: 12.053.929/0002-49 | D348: 3929.7399999999998 | E348: 0 | F348: 0 | G348: 0 | H348: 0 | I348: 0 | J348: 0 | K348: 4330.29 | L348: 0 | M348: =SUM(J348:L348)-400.55 -> 3929.7399999999998 | N348: 400.55000000000001 | O348: =SUM(M348:N348) -> 4330.29
A349: 3367 | B349: EOL SM | C349: 12.053.787/0002-10 | D349: 3883.9400000000001 | E349: 0 | F349: 0 | G349: 0 | H349: 0 | I349: 0 | J349: 0 | K349: 4279.8199999999997 | L349: 0 | M349: =SUM(J349:L349)-395.88 -> 3883.9399999999996 | N349: 395.88 | O349: =SUM(M349:N349) -> 4279.8199999999997
A350: 3368 | B350: EOL VERACE I | C350: 42.873.310/0003-22 | D350: 1756.1199999999999 | E350: 0 | F350: 0 | G350: 0 | H350: 0 | I350: 0 | J350: 0 | K350: 1935.1199999999999 | L350: 0 | M350: =SUM(J350:L350)-179 -> 1756.1199999999999 | N350: 179 | O350: =SUM(M350:N350) -> 1935.1199999999999
A351: 3369 | B351: EOL VERACE II | C351: 42.873.310/0003-22 | D351: 1754.9400000000001 | E351: 0 | F351: 0 | G351: 0 | H351: 0 | I351: 0 | J351: 0 | K351: 1933.8199999999999 | L351: 0 | M351: =SUM(J351:L351)-178.88 -> 1754.9400000000001 | N351: 178.88 | O351: =SUM(M351:N351) -> 1933.8200000000002
A352: 3370 | B352: EOL VERACE III | C352: 42.873.310/0003-22 | D352: 2295.4499999999998 | E352: 0 | F352: 0 | G352: 0 | H352: 0 | I352: 0 | J352: 0 | K352: 2529.4200000000001 | L352: 0 | M352: =SUM(J352:L352)-233.97 -> 2295.4500000000003 | N352: 233.97 | O352: =SUM(M352:N352) -> 2529.4200000000001
A353: 3371 | B353: EOL VERACE IV | C353: 42.873.310/0003-22 | D353: 2649.2800000000002 | E353: 0 | F353: 0 | G353: 0 | H353: 0 | I353: 0 | J353: 0 | K353: 2919.3200000000002 | L353: 0 | M353: =SUM(J353:L353)-270.04 -> 2649.2800000000002 | N353: 270.04000000000002 | O353: =SUM(M353:N353) -> 2919.3200000000002
A354: 3372 | B354: EOL VERACE V | C354: 42.873.310/0003-22 | D354: 2633.73 | E354: 0 | F354: 0 | G354: 0 | H354: 0 | I354: 0 | J354: 0 | K354: 2902.1799999999998 | L354: 0 | M354: =SUM(J354:L354)-268.45 -> 2633.73 | N354: 268.44999999999999 | O354: =SUM(M354:N354) -> 2902.1799999999998
A355: 3373 | B355: EOL VERACE VI | C355: 42.873.310/0003-22 | D355: 1598.3099999999999 | E355: 0 | F355: 0 | G355: 0 | H355: 0 | I355: 0 | J355: 0 | K355: 1761.22 | L355: 0 | M355: =SUM(J355:L355)-162.91 -> 1598.3099999999999 | N355: 162.91 | O355: =SUM(M355:N355) -> 1761.22
A356: 3374 | B356: EOL VERACE VII | C356: 42.873.310/0003-22 | D356: 2648.1100000000001 | E356: 0 | F356: 0 | G356: 0 | H356: 0 | I356: 0 | J356: 0 | K356: 2918.0300000000002 | L356: 0 | M356: =SUM(J356:L356)-269.92 -> 2648.1100000000001 | N356: 269.92000000000002 | O356: =SUM(M356:N356) -> 2918.0300000000002
A357: 3375 | B357: EOL VERACE VIII | C357: 42.873.310/0003-22 | D357: 2292.8400000000001 | E357: 0 | F357: 0 | G357: 0 | H357: 0 | I357: 0 | J357: 0 | K357: 2526.5500000000002 | L357: 0 | M357: =SUM(J357:L357)-233.71 -> 2292.8400000000001 | N357: 233.71000000000001 | O357: =SUM(M357:N357) -> 2526.5500000000002
A358: 3376 | B358: EOL VERACE IX | C358: 42.873.310/0003-22 | D358: 2641.46 | E358: 0 | F358: 0 | G358: 0 | H358: 0 | I358: 0 | J358: 0 | K358: 2910.6999999999998 | L358: 0 | M358: =SUM(J358:L358)-269.24 -> 2641.46 | N358: 269.24000000000001 | O358: =SUM(M358:N358) -> 2910.6999999999998
A359: 3377 | B359: EOL VERACE X | C359: 42.873.310/0003-22 | D359: 2473.4899999999998 | E359: 0 | F359: 0 | G359: 0 | H359: 0 | I359: 0 | J359: 0 | K359: 2725.6100000000001 | L359: 0 | M359: =SUM(J359:L359)-252.12 -> 2473.4900000000002 | N359: 252.12 | O359: =SUM(M359:N359) -> 2725.6100000000001
A360: 3378 | B360: EOL AMETISTA | C360: 11.201.885/0001-03 | D360: 3438.6399999999999 | E360: 0 | F360: 0 | G360: 0 | H360: 0 | I360: 0 | J360: 0 | K360: 3789.1300000000001 | L360: 0 | M360: =SUM(J360:L360)-350.49 -> 3438.6400000000003 | N360: 350.49000000000001 | O360: =SUM(M360:N360) -> 3789.1300000000001
A361: 3379 | B361: EOL DOURADOS | C361: 12.041.319/0001-44 | D361: 3441.0999999999999 | E361: 0 | F361: 0 | G361: 0 | H361: 0 | I361: 0 | J361: 0 | K361: 3791.8499999999999 | L361: 0 | M361: =SUM(J361:L361)-350.75 -> 3441.0999999999999 | N361: 350.75 | O361: =SUM(M361:N361) -> 3791.8499999999999
A362: 3380 | B362: EOL MARON | C362: 12.041.214/0001-95 | D362: 3656.7800000000002 | E362: 0 | F362: 0 | G362: 0 | H362: 0 | I362: 0 | J362: 0 | K362: 4029.5100000000002 | L362: 0 | M362: =SUM(J362:L362)-372.73 -> 3656.7800000000002 | N362: 372.73000000000002 | O362: =SUM(M362:N362) -> 4029.5100000000002
A363: 3381 | B363: EOL PILÕES | C363: 11.201.797/0001-01 | D363: 3656.7800000000002 | E363: 0 | F363: 0 | G363: 0 | H363: 0 | I363: 0 | J363: 0 | K363: 4029.5100000000002 | L363: 0 | M363: =SUM(J363:L363)-372.73 -> 3656.7800000000002 | N363: 372.73000000000002 | O363: =SUM(M363:N363) -> 4029.5100000000002
A364: 3382 | B364: EOL MALHADINHA I | C364: 14.080.223/0002-00 | D364: 2257.3400000000001 | E364: 0 | F364: 0 | G364: 0 | H364: 0 | I364: 0 | J364: 0 | K364: 2487.4299999999998 | L364: 0 | M364: =SUM(J364:L364)-230.09 -> 2257.3399999999997 | N364: 230.09 | O364: =SUM(M364:N364) -> 2487.4299999999998
A365: 3383 | B365: UTE CMPC | C365: 11.234.954/0001-85 | D365: 2691.7600000000002 | E365: 0 | F365: 0 | G365: 0 | H365: 0 | I365: 0 | J365: 0 | K365: 2966.1300000000001 | L365: 0 | M365: =SUM(J365:L365)-274.37 -> 2691.7600000000002 | N365: 274.37 | O365: =SUM(M365:N365) -> 2966.1300000000001
A366: 3384 | B366: EOL ASA BRANCA I | C366: 12.802.855/0001-15 | D366: 3268.3299999999999 | E366: 0 | F366: 0 | G366: 0 | H366: 0 | I366: 0 | J366: 0 | K366: 3601.4699999999998 | L366: 0 | M366: =SUM(J366:L366)-333.14 -> 3268.3299999999999 | N366: 333.13999999999999 | O366: =SUM(M366:N366) -> 3601.4699999999998
A367: 3385 | B367: EOL ASA BRANCA II | C367: 12.802.844/0001-35 | D367: 3717.2600000000002 | E367: 0 | F367: 0 | G367: 0 | H367: 0 | I367: 0 | J367: 0 | K367: 4096.1499999999996 | L367: 0 | M367: =SUM(J367:L367)-378.89 -> 3717.2599999999998 | N367: 378.88999999999999 | O367: =SUM(M367:N367) -> 4096.1499999999996
A368: 3386 | B368: EOL ASA BRANCA III | C368: 12.802.835/0001-44 | D368: 3210.2800000000002 | E368: 0 | F368: 0 | G368: 0 | H368: 0 | I368: 0 | J368: 0 | K368: 3537.5 | L368: 0 | M368: =SUM(J368:L368)-327.22 -> 3210.2799999999997 | N368: 327.22000000000003 | O368: =SUM(M368:N368) -> 3537.5
A369: 3387 | B369: EOL EURUS IV | C369: 12.802.866/0001-03 | D369: 3897.5500000000002 | E369: 0 | F369: 0 | G369: 0 | H369: 0 | I369: 0 | J369: 0 | K369: 4294.8199999999997 | L369: 0 | M369: =SUM(J369:L369)-397.27 -> 3897.5499999999997 | N369: 397.26999999999998 | O369: =SUM(M369:N369) -> 4294.8199999999997
A370: 3388 | B370: ALIANÇA (CONS. PORTO ESTRELA) | C370: 12.009.135/0001-05 | D370: 10020.530000000001 | E370: 0 | F370: 0 | G370: 0 | H370: 0 | I370: 0 | J370: 0 | K370: 11041.91 | L370: 0 | M370: =SUM(J370:L370)-1021.38 -> 10020.530000000001 | N370: 1021.38 | O370: =SUM(M370:N370) -> 11041.91
A371: 3389 | B371: ALIANÇA (UHE AIMORÉS) | C371: 12.009.135/0001-05 | D371: 47453.139999999999 | E371: 0 | F371: 0 | G371: 0 | H371: 0 | I371: 0 | J371: 0 | K371: 52289.959999999999 | L371: 0 | M371: =SUM(J371:L371)-4836.82 -> 47453.139999999999 | N371: 4836.8199999999997 | O371: =SUM(M371:N371) -> 52289.959999999999
A372: 3390 | B372: EOL LANCHINHA | C372: 14.603.978/0001-52 | D372: 3411.96 | E372: 0 | F372: 0 | G372: 0 | H372: 0 | I372: 0 | J372: 0 | K372: 3759.7399999999998 | L372: 0 | M372: =SUM(J372:L372)-347.78 -> 3411.96 | N372: 347.77999999999997 | O372: =SUM(M372:N372) -> 3759.7399999999998
A373: 3391 | B373: EOL PELADO | C373: 14.604.100/0001-31 | D373: 2419.3899999999999 | E373: 0 | F373: 0 | G373: 0 | H373: 0 | I373: 0 | J373: 0 | K373: 2665.9899999999998 | L373: 0 | M373: =SUM(J373:L373)-246.6 -> 2419.3899999999999 | N373: 246.59999999999999 | O373: =SUM(M373:N373) -> 2665.9899999999998
A374: 3392 | B374: EOL CHUÍ I | C374: 42.873.310/0002-41 | D374: 2140.0700000000002 | E374: 0 | F374: 0 | G374: 0 | H374: 0 | I374: 0 | J374: 0 | K374: 2358.1999999999998 | L374: 0 | M374: =SUM(J374:L374)-218.13 -> 2140.0699999999997 | N374: 218.13 | O374: =SUM(M374:N374) -> 2358.1999999999998
A375: 3393 | B375: EOL CHUÍ II | C375: 42.873.310/0002-41 | D375: 1944.05 | E375: 0 | F375: 0 | G375: 0 | H375: 0 | I375: 0 | J375: 0 | K375: 2142.1999999999998 | L375: 0 | M375: =SUM(J375:L375)-198.15 -> 1944.0499999999997 | N375: 198.15000000000001 | O375: =SUM(M375:N375) -> 2142.1999999999998
A376: 3394 | B376: EOL CHUÍ IV | C376: 42.873.310/0002-41 | D376: 1942.25 | E376: 0 | F376: 0 | G376: 0 | H376: 0 | I376: 0 | J376: 0 | K376: 2140.2199999999998 | L376: 0 | M376: =SUM(J376:L376)-197.97 -> 1942.2499999999998 | N376: 197.97 | O376: =SUM(M376:N376) -> 2140.2199999999998
A377: 3395 | B377: EOL CHUÍ V | C377: 42.873.310/0002-41 | D377: 2642.71 | E377: 0 | F377: 0 | G377: 0 | H377: 0 | I377: 0 | J377: 0 | K377: 2912.0799999999999 | L377: 0 | M377: =SUM(J377:L377)-269.37 -> 2642.71 | N377: 269.37 | O377: =SUM(M377:N377) -> 2912.0799999999999
A378: 3396 | B378: EOL MINUANO I | C378: 42.873.310/0002-41 | D378: 1915.27 | E378: 0 | F378: 0 | G378: 0 | H378: 0 | I378: 0 | J378: 0 | K378: 2110.4899999999998 | L378: 0 | M378: =SUM(J378:L378)-195.22 -> 1915.2699999999998 | N378: 195.22 | O378: =SUM(M378:N378) -> 2110.4899999999998
A379: 3397 | B379: EOL MINUANO II | C379: 42.873.310/0002-41 | D379: 2095.5599999999999 | E379: 0 | F379: 0 | G379: 0 | H379: 0 | I379: 0 | J379: 0 | K379: 2309.1599999999999 | L379: 0 | M379: =SUM(J379:L379)-213.6 -> 2095.5599999999999 | N379: 213.59999999999999 | O379: =SUM(M379:N379) -> 2309.1599999999999
A380: 3398 | B380: PETROBRAS (UTE U-50) | C380: 33.000.167/1111-08 | D380: 4648.4899999999998 | E380: 0 | F380: 0 | G380: 0 | H380: 0 | I380: 0 | J380: 0 | K380: 5122.3000000000002 | L380: 0 | M380: =SUM(J380:L380)-473.81 -> 4648.4899999999998 | N380: 473.81 | O380: =SUM(M380:N380) -> 5122.3000000000002
A381: 3399 | B381: EOL VENTOS DE SANTO URIEL | C381: 14.583.703/0001-02 | D381: 1955.97 | E381: 0 | F381: 0 | G381: 0 | H381: 0 | I381: 0 | J381: 0 | K381: 2155.3400000000001 | L381: 0 | M381: =SUM(J381:L381)-199.37 -> 1955.9700000000003 | N381: 199.37 | O381: =SUM(M381:N381) -> 2155.3400000000001
A382: 3401 | B382: RAESA (UTE CRISTIANO DA ROCHA) | C382: 07.386.098/0002-97 | D382: 13116.780000000001 | E382: 0 | F382: 0 | G382: 0 | H382: 0 | I382: 0 | J382: 0 | K382: 14453.75 | L382: 0 | M382: =SUM(J382:L382)-1336.97 -> 13116.780000000001 | N382: 1336.97 | O382: =SUM(M382:N382) -> 14453.75
A383: 3402 | B383: UHE TELES PIRES | C383: 12.810.896/0005-87 | D383: 805760.37 | E383: 0 | F383: 0 | G383: 0 | H383: 0 | I383: 0 | J383: 0 | K383: 887890.20999999996 | L383: 0 | M383: =SUM(J383:L383)-82129.84 -> 805760.37 | N383: 82129.839999999997 | O383: =SUM(M383:N383) -> 887890.20999999996
A384: 3403 | B384: DESA (EOL MORRO DOS VENTOS II) | C384: 15.207.271/0001-90 | D384: 2984.4200000000001 | E384: 0 | F384: 0 | G384: 0 | H384: 0 | I384: 0 | J384: 0 | K384: 3288.6199999999999 | L384: 0 | M384: =SUM(J384:L384)-304.2 -> 2984.4200000000001 | N384: 304.19999999999999 | O384: =SUM(M384:N384) -> 3288.6199999999999
A385: 3404 | B385: EOL REDUTO | C385: 14.527.003/0001-92 | D385: 3212.6599999999999 | E385: 0 | F385: 0 | G385: 0 | H385: 0 | I385: 0 | J385: 0 | K385: 3540.1199999999999 | L385: 0 | M385: =SUM(J385:L385)-327.46 -> 3212.6599999999999 | N385: 327.45999999999998 | O385: =SUM(M385:N385) -> 3540.1199999999999
A386: 3405 | B386: EOL CHUÍ IX | C386: 42.873.310/0003-22 | D386: 1918.99 | E386: 0 | F386: 0 | G386: 0 | H386: 0 | I386: 0 | J386: 0 | K386: 2114.5900000000001 | L386: 0 | M386: =SUM(J386:L386)-195.6 -> 1918.9900000000002 | N386: 195.59999999999999 | O386: =SUM(M386:N386) -> 2114.5900000000001
A387: 3406 | B387: EOL VENTOS DE SANTA JOANA IX | C387: 19.082.784/0002-53 | D387: 1848.0699999999999 | E387: 0 | F387: 0 | G387: 0 | H387: 0 | I387: 0 | J387: 0 | K387: 2036.4400000000001 | L387: 0 | M387: =SUM(J387:L387)-188.37 -> 1848.0700000000002 | N387: 188.37 | O387: =SUM(M387:N387) -> 2036.4400000000001
A388: 3407 | B388: EOL VENTOS DE SANTA JOANA X | C388: 19.082.754/0002-47 | D388: 1848.0699999999999 | E388: 0 | F388: 0 | G388: 0 | H388: 0 | I388: 0 | J388: 0 | K388: 2036.4400000000001 | L388: 0 | M388: =SUM(J388:L388)-188.37 -> 1848.0700000000002 | N388: 188.37 | O388: =SUM(M388:N388) -> 2036.4400000000001
A389: 3408 | B389: EOL VENTOS DE SANTA JOANA XI | C389: 19.082.675/0002-36 | D389: 1848.0699999999999 | E389: 0 | F389: 0 | G389: 0 | H389: 0 | I389: 0 | J389: 0 | K389: 2036.4400000000001 | L389: 0 | M389: =SUM(J389:L389)-188.37 -> 1848.0700000000002 | N389: 188.37 | O389: =SUM(M389:N389) -> 2036.4400000000001
A390: 3409 | B390: EOL VENTOS DE SANTA JOANA XII | C390: 19.082.701/0002-26 | D390: 1804.3699999999999 | E390: 0 | F390: 0 | G390: 0 | H390: 0 | I390: 0 | J390: 0 | K390: 1988.29 | L390: 0 | M390: =SUM(J390:L390)-183.92 -> 1804.3699999999999 | N390: 183.91999999999999 | O390: =SUM(M390:N390) -> 1988.29
A391: 3410 | B391: EOL VENTOS DE SANTA JOANA XIII | C391: 19.082.800/0002-08 | D391: 1848.0699999999999 | E391: 0 | F391: 0 | G391: 0 | H391: 0 | I391: 0 | J391: 0 | K391: 2036.4400000000001 | L391: 0 | M391: =SUM(J391:L391)-188.37 -> 1848.0700000000002 | N391: 188.37 | O391: =SUM(M391:N391) -> 2036.4400000000001
A392: 3411 | B392: EOL VENTOS DE SANTA JOANA XV | C392: 19.082.728/0002-19 | D392: 1804.3699999999999 | E392: 0 | F392: 0 | G392: 0 | H392: 0 | I392: 0 | J392: 0 | K392: 1988.29 | L392: 0 | M392: =SUM(J392:L392)-183.92 -> 1804.3699999999999 | N392: 183.91999999999999 | O392: =SUM(M392:N392) -> 1988.29
A393: 3412 | B393: EOL VENTOS DE SANTA JOANA XVI | C393: 19.082.822/0002-78 | D393: 1804.3699999999999 | E393: 0 | F393: 0 | G393: 0 | H393: 0 | I393: 0 | J393: 0 | K393: 1988.29 | L393: 0 | M393: =SUM(J393:L393)-183.92 -> 1804.3699999999999 | N393: 183.91999999999999 | O393: =SUM(M393:N393) -> 1988.29
A394: 3413 | B394: EOL VENTOS DE SANTO ONOFRE I | C394: 19.022.138/0001-10 | D394: 2653.8400000000001 | E394: 0 | F394: 0 | G394: 0 | H394: 0 | I394: 0 | J394: 0 | K394: 2924.3400000000001 | L394: 0 | M394: =SUM(J394:L394)-270.5 -> 2653.8400000000001 | N394: 270.5 | O394: =SUM(M394:N394) -> 2924.3400000000001
A395: 3414 | B395: EOL VENTOS DE SANTO ONOFRE II | C395: 19.022.974/0001-02 | D395: 2636.0900000000001 | E395: 0 | F395: 0 | G395: 0 | H395: 0 | I395: 0 | J395: 0 | K395: 2904.7800000000002 | L395: 0 | M395: =SUM(J395:L395)-268.69 -> 2636.0900000000001 | N395: 268.69 | O395: =SUM(M395:N395) -> 2904.7800000000002
A396: 3415 | B396: EOL VENTOS DE SANTO ONOFRE III | C396: 19.023.342/0001-55 | D396: 2653.8400000000001 | E396: 0 | F396: 0 | G396: 0 | H396: 0 | I396: 0 | J396: 0 | K396: 2924.3400000000001 | L396: 0 | M396: =SUM(J396:L396)-270.5 -> 2653.8400000000001 | N396: 270.5 | O396: =SUM(M396:N396) -> 2924.3400000000001
A397: 3416 | B397: EOL VENTOS DE SANTA JOANA II | C397: 19.023.213/0001-67 | D397: 2653.8400000000001 | E397: 0 | F397: 0 | G397: 0 | H397: 0 | I397: 0 | J397: 0 | K397: 2924.3400000000001 | L397: 0 | M397: =SUM(J397:L397)-270.5 -> 2653.8400000000001 | N397: 270.5 | O397: =SUM(M397:N397) -> 2924.3400000000001
A398: 3417 | B398: EOL VENTOS DE SANTA JOANA VI | C398: 19.022.818/0001-33 | D398: 2644.9699999999998 | E398: 0 | F398: 0 | G398: 0 | H398: 0 | I398: 0 | J398: 0 | K398: 2914.5700000000002 | L398: 0 | M398: =SUM(J398:L398)-269.6 -> 2644.9700000000003 | N398: 269.60000000000002 | O398: =SUM(M398:N398) -> 2914.5700000000002
A399: 3418 | B399: EOL VENTOS DE SANTA JOANA VIII | C399: 19.022.356/0001-54 | D399: 2644.9699999999998 | E399: 0 | F399: 0 | G399: 0 | H399: 0 | I399: 0 | J399: 0 | K399: 2914.5700000000002 | L399: 0 | M399: =SUM(J399:L399)-269.6 -> 2644.9700000000003 | N399: 269.60000000000002 | O399: =SUM(M399:N399) -> 2914.5700000000002
A400: 3419 | B400: EOL VENTOS DE SANTA JOANA XIV | C400: 19.023.513/0001-46 | D400: 2653.8400000000001 | E400: 0 | F400: 0 | G400: 0 | H400: 0 | I400: 0 | J400: 0 | K400: 2924.3400000000001 | L400: 0 | M400: =SUM(J400:L400)-270.5 -> 2653.8400000000001 | N400: 270.5 | O400: =SUM(M400:N400) -> 2924.3400000000001
A401: 3420 | B401: EOL BARAÚNAS I | C401: 19.354.626/0002-05 | D401: 6478.8599999999997 | E401: 0 | F401: 0 | G401: 0 | H401: 0 | I401: 0 | J401: 0 | K401: 7139.2399999999998 | L401: 0 | M401: =SUM(J401:L401)-660.38 -> 6478.8599999999997 | N401: 660.38 | O401: =SUM(M401:N401) -> 7139.2399999999998
A402: 3421 | B402: EOL MORRO BRANCO I | C402: 19.353.878/0002-10 | D402: 3234.9000000000001 | E402: 0 | F402: 0 | G402: 0 | H402: 0 | I402: 0 | J402: 0 | K402: 3564.6300000000001 | L402: 0 | M402: =SUM(J402:L402)-329.73 -> 3234.9000000000001 | N402: 329.73000000000002 | O402: =SUM(M402:N402) -> 3564.6300000000001
A403: 3422 | B403: EOL MUSSAMBE | C403: 19.353.849/0002-58 | D403: 3234.9000000000001 | E403: 0 | F403: 0 | G403: 0 | H403: 0 | I403: 0 | J403: 0 | K403: 3564.6300000000001 | L403: 0 | M403: =SUM(J403:L403)-329.73 -> 3234.9000000000001 | N403: 329.73000000000002 | O403: =SUM(M403:N403) -> 3564.6300000000001
A404: 3423 | B404: UFV FONTES SOLAR I e II | C404: 18.303.676/0002-09 | D404: 442.55000000000001 | E404: 0 | F404: 0 | G404: 0 | H404: 0 | I404: 0 | J404: 0 | K404: 487.66000000000003 | L404: 0 | M404: =SUM(J404:L404)-45.11 -> 442.55000000000001 | N404: 45.109999999999999 | O404: =SUM(M404:N404) -> 487.66000000000003
A405: 3424 | B405: EOL ASSURUÁ II | C405: 19.246.799/0002-00 | D405: 3926.5300000000002 | E405: 0 | F405: 0 | G405: 0 | H405: 0 | I405: 0 | J405: 0 | K405: 4326.75 | L405: 0 | M405: =SUM(J405:L405)-400.22 -> 3926.5299999999997 | N405: 400.22000000000003 | O405: =SUM(M405:N405) -> 4326.75
A406: 3425 | B406: EOL ASSURUÁ V | C406: 19.246.831/0002-57 | D406: 2650.0799999999999 | E406: 0 | F406: 0 | G406: 0 | H406: 0 | I406: 0 | J406: 0 | K406: 2920.1999999999998 | L406: 0 | M406: =SUM(J406:L406)-270.12 -> 2650.0799999999999 | N406: 270.12 | O406: =SUM(M406:N406) -> 2920.1999999999998
A407: 3426 | B407: EOL ASSURUÁ VII | C407: 19.246.849/0002-59 | D407: 2395.0799999999999 | E407: 0 | F407: 0 | G407: 0 | H407: 0 | I407: 0 | J407: 0 | K407: 2639.21 | L407: 0 | M407: =SUM(J407:L407)-244.13 -> 2395.0799999999999 | N407: 244.13 | O407: =SUM(M407:N407) -> 2639.21
A408: 3427 | B408: EOL CARNAÚBAS | C408: 14.535.588/0001-92 | D408: 3275.7399999999998 | E408: 0 | F408: 0 | G408: 0 | H408: 0 | I408: 0 | J408: 0 | K408: 3609.6300000000001 | L408: 0 | M408: =SUM(J408:L408)-333.89 -> 3275.7400000000002 | N408: 333.88999999999999 | O408: =SUM(M408:N408) -> 3609.6300000000001
A409: 3428 | B409: EOL SÃO JOÃO | C409: 14.535.646/0001-88 | D409: 3275.7399999999998 | E409: 0 | F409: 0 | G409: 0 | H409: 0 | I409: 0 | J409: 0 | K409: 3609.6300000000001 | L409: 0 | M409: =SUM(J409:L409)-333.89 -> 3275.7400000000002 | N409: 333.88999999999999 | O409: =SUM(M409:N409) -> 3609.6300000000001
A410: 3429 | B410: EOL SANTO CRISTO | C410: 14.535.540/0001-84 | D410: 3223.5799999999999 | E410: 0 | F410: 0 | G410: 0 | H410: 0 | I410: 0 | J410: 0 | K410: 3552.1500000000001 | L410: 0 | M410: =SUM(J410:L410)-328.57 -> 3223.5799999999999 | N410: 328.56999999999999 | O410: =SUM(M410:N410) -> 3552.1500000000001
A411: 3430 | B411: EOL CAETITÉ A | C411: 19.233.858/0002-05 | D411: 2079.25 | E411: 0 | F411: 0 | G411: 0 | H411: 0 | I411: 0 | J411: 0 | K411: 2291.1799999999998 | L411: 0 | M411: =SUM(J411:L411)-211.93 -> 2079.25 | N411: 211.93000000000001 | O411: =SUM(M411:N411) -> 2291.1799999999998
A412: 3431 | B412: EOL CAETITÉ B | C412: 19.235.607/0002-60 | D412: 1928.8399999999999 | E412: 0 | F412: 0 | G412: 0 | H412: 0 | I412: 0 | J412: 0 | K412: 2125.4400000000001 | L412: 0 | M412: =SUM(J412:L412)-196.6 -> 1928.8400000000001 | N412: 196.59999999999999 | O412: =SUM(M412:N412) -> 2125.4400000000001
A413: 3432 | B413: EOL CAETITÉ C | C413: 19.560.109/0002-92 | D413: 748.30999999999995 | E413: 0 | F413: 0 | G413: 0 | H413: 0 | I413: 0 | J413: 0 | K413: 824.58000000000004 | L413: 0 | M413: =SUM(J413:L413)-76.27 -> 748.31000000000006 | N413: 76.269999999999996 | O413: =SUM(M413:N413) -> 824.58000000000004
A414: 3433 | B414: EOL VENTOS DA ANDORINHA | C414: 17.613.512/0002-07 | D414: 3903.29 | E414: 0 | F414: 0 | G414: 0 | H414: 0 | I414: 0 | J414: 0 | K414: 4301.1499999999996 | L414: 0 | M414: =SUM(J414:L414)-397.86 -> 3903.2899999999995 | N414: 397.86000000000001 | O414: =SUM(M414:N414) -> 4301.1499999999996
A415: 3434 | B415: EOL VENTOS DE CAMPO FORMOSO I | C415: 17.613.280/0002-97 | D415: 3903.29 | E415: 0 | F415: 0 | G415: 0 | H415: 0 | I415: 0 | J415: 0 | K415: 4301.1499999999996 | L415: 0 | M415: =SUM(J415:L415)-397.86 -> 3903.2899999999995 | N415: 397.86000000000001 | O415: =SUM(M415:N415) -> 4301.1499999999996
A416: 3435 | B416: EOL VENTOS DE CAMPO FORMOSO II | C416: 17.613.629/0002-90 | D416: 3903.29 | E416: 0 | F416: 0 | G416: 0 | H416: 0 | I416: 0 | J416: 0 | K416: 4301.1499999999996 | L416: 0 | M416: =SUM(J416:L416)-397.86 -> 3903.2899999999995 | N416: 397.86000000000001 | O416: =SUM(M416:N416) -> 4301.1499999999996
A417: 3436 | B417: EOL VENTOS DE MORRINHOS | C417: 17.613.286/0002-64 | D417: 3903.29 | E417: 0 | F417: 0 | G417: 0 | H417: 0 | I417: 0 | J417: 0 | K417: 4301.1499999999996 | L417: 0 | M417: =SUM(J417:L417)-397.86 -> 3903.2899999999995 | N417: 397.86000000000001 | O417: =SUM(M417:N417) -> 4301.1499999999996
A418: 3437 | B418: EOL VERACE 24 | C418: 42.873.310/0003-22 | D418: 2110.9200000000001 | E418: 0 | F418: 0 | G418: 0 | H418: 0 | I418: 0 | J418: 0 | K418: 2326.0799999999999 | L418: 0 | M418: =SUM(J418:L418)-215.16 -> 2110.9200000000001 | N418: 215.16 | O418: =SUM(M418:N418) -> 2326.0799999999999
A419: 3438 | B419: EOL VERACE 25 | C419: 42.873.310/0003-22 | D419: 765.91999999999996 | E419: 0 | F419: 0 | G419: 0 | H419: 0 | I419: 0 | J419: 0 | K419: 843.99000000000001 | L419: 0 | M419: =SUM(J419:L419)-78.07 -> 765.92000000000007 | N419: 78.069999999999993 | O419: =SUM(M419:N419) -> 843.99000000000001
A420: 3439 | B420: EOL VERACE 26 | C420: 42.873.310/0003-22 | D420: 1534.29 | E420: 0 | F420: 0 | G420: 0 | H420: 0 | I420: 0 | J420: 0 | K420: 1690.6800000000001 | L420: 0 | M420: =SUM(J420:L420)-156.39 -> 1534.29 | N420: 156.38999999999999 | O420: =SUM(M420:N420) -> 1690.6799999999998
A421: 3440 | B421: EOL VERACE 27 | C421: 42.873.310/0003-22 | D421: 1725.8599999999999 | E421: 0 | F421: 0 | G421: 0 | H421: 0 | I421: 0 | J421: 0 | K421: 1901.77 | L421: 0 | M421: =SUM(J421:L421)-175.91 -> 1725.8599999999999 | N421: 175.91 | O421: =SUM(M421:N421) -> 1901.77
A422: 3441 | B422: EOL VERACE 28 | C422: 42.873.310/0003-22 | D422: 1342.6099999999999 | E422: 0 | F422: 0 | G422: 0 | H422: 0 | I422: 0 | J422: 0 | K422: 1479.46 | L422: 0 | M422: =SUM(J422:L422)-136.85 -> 1342.6100000000001 | N422: 136.84999999999999 | O422: =SUM(M422:N422) -> 1479.46
A423: 3442 | B423: EOL VERACE 29 | C423: 42.873.310/0003-22 | D423: 1918.99 | E423: 0 | F423: 0 | G423: 0 | H423: 0 | I423: 0 | J423: 0 | K423: 2114.5900000000001 | L423: 0 | M423: =SUM(J423:L423)-195.6 -> 1918.9900000000002 | N423: 195.59999999999999 | O423: =SUM(M423:N423) -> 2114.5900000000001
A424: 3443 | B424: EOL VERACE 30 | C424: 42.873.310/0003-22 | D424: 1918.99 | E424: 0 | F424: 0 | G424: 0 | H424: 0 | I424: 0 | J424: 0 | K424: 2114.5900000000001 | L424: 0 | M424: =SUM(J424:L424)-195.6 -> 1918.9900000000002 | N424: 195.59999999999999 | O424: =SUM(M424:N424) -> 2114.5900000000001
A425: 3444 | B425: EOL VERACE 31 | C425: 42.873.310/0003-22 | D425: 958.53999999999996 | E425: 0 | F425: 0 | G425: 0 | H425: 0 | I425: 0 | J425: 0 | K425: 1056.24 | L425: 0 | M425: =SUM(J425:L425)-97.7 -> 958.53999999999996 | N425: 97.700000000000003 | O425: =SUM(M425:N425) -> 1056.24
A426: 3445 | B426: EOL VERACE 35 | C426: 42.873.310/0003-22 | D426: 1342.6099999999999 | E426: 0 | F426: 0 | G426: 0 | H426: 0 | I426: 0 | J426: 0 | K426: 1479.46 | L426: 0 | M426: =SUM(J426:L426)-136.85 -> 1342.6100000000001 | N426: 136.84999999999999 | O426: =SUM(M426:N426) -> 1479.46
A427: 3446 | B427: EOL VERACE 36 | C427: 42.873.310/0003-22 | D427: 2302.6799999999998 | E427: 0 | F427: 0 | G427: 0 | H427: 0 | I427: 0 | J427: 0 | K427: 2537.3899999999999 | L427: 0 | M427: =SUM(J427:L427)-234.71 -> 2302.6799999999998 | N427: 234.71000000000001 | O427: =SUM(M427:N427) -> 2537.3899999999999
A428: 3447 | B428: EOL CAPÃO DO INGLÊS | C428: 02.016.507/0001-69 | D428: 1034.46 | E428: 0 | F428: 0 | G428: 0 | H428: 0 | I428: 0 | J428: 0 | K428: 1139.9000000000001 | L428: 0 | M428: =SUM(J428:L428)-105.44 -> 1034.46 | N428: 105.44 | O428: =SUM(M428:N428) -> 1139.9000000000001
A429: 3448 | B429: EOL COXILHA SECA | C429: 02.016.507/0001-69 | D429: 3138.54 | E429: 0 | F429: 0 | G429: 0 | H429: 0 | I429: 0 | J429: 0 | K429: 3458.4499999999998 | L429: 0 | M429: =SUM(J429:L429)-319.91 -> 3138.54 | N429: 319.91000000000003 | O429: =SUM(M429:N429) -> 3458.4499999999998
A430: 3449 | B430: EOL GALPÕES | C430: 02.016.507/0001-69 | D430: 829.67999999999995 | E430: 0 | F430: 0 | G430: 0 | H430: 0 | I430: 0 | J430: 0 | K430: 914.25 | L430: 0 | M430: =SUM(J430:L430)-84.57 -> 829.68000000000006 | N430: 84.569999999999993 | O430: =SUM(M430:N430) -> 914.25
A431: 3450 | B431: EOL VENTOS DO SERTÃO | C431: 17.613.432/0002-51 | D431: 3903.29 | E431: 0 | F431: 0 | G431: 0 | H431: 0 | I431: 0 | J431: 0 | K431: 4301.1499999999996 | L431: 0 | M431: =SUM(J431:L431)-397.86 -> 3903.2899999999995 | N431: 397.86000000000001 | O431: =SUM(M431:N431) -> 4301.1499999999996
A432: 3451 | B432: EOL VENTOS DE SANTA BRÍGIDA I | C432: 17.875.304/0001-03 | D432: 1208.8099999999999 | E432: 0 | F432: 0 | G432: 0 | H432: 0 | I432: 0 | J432: 0 | K432: 1332.02 | L432: 0 | M432: =SUM(J432:L432)-123.21 -> 1208.8099999999999 | N432: 123.20999999999999 | O432: =SUM(M432:N432) -> 1332.02
A433: 3452 | B433: EOL VENTOS DE SANTA BRÍGIDA II | C433: 17.875.194/0001-71 | D433: 2419.8499999999999 | E433: 0 | F433: 0 | G433: 0 | H433: 0 | I433: 0 | J433: 0 | K433: 2666.5 | L433: 0 | M433: =SUM(J433:L433)-246.65 -> 2419.8499999999999 | N433: 246.65000000000001 | O433: =SUM(M433:N433) -> 2666.5
A434: 3453 | B434: EOL VENTOS DE SANTA BRÍGIDA III | C434: 17.875.184/0001-36 | D434: 2560.6999999999998 | E434: 0 | F434: 0 | G434: 0 | H434: 0 | I434: 0 | J434: 0 | K434: 2821.71 | L434: 0 | M434: =SUM(J434:L434)-261.01 -> 2560.6999999999998 | N434: 261.00999999999999 | O434: =SUM(M434:N434) -> 2821.71
A435: 3454 | B435: EOL VENTOS DE SANTA BRÍGIDA IV | C435: 17.875.122/0001-24 | D435: 2419.8499999999999 | E435: 0 | F435: 0 | G435: 0 | H435: 0 | I435: 0 | J435: 0 | K435: 2666.5 | L435: 0 | M435: =SUM(J435:L435)-246.65 -> 2419.8499999999999 | N435: 246.65000000000001 | O435: =SUM(M435:N435) -> 2666.5
A436: 3455 | B436: EOL VENTOS DE SANTA BRÍGIDA V | C436: 17.875.103/0001-06 | D436: 2560.6999999999998 | E436: 0 | F436: 0 | G436: 0 | H436: 0 | I436: 0 | J436: 0 | K436: 2821.71 | L436: 0 | M436: =SUM(J436:L436)-261.01 -> 2560.6999999999998 | N436: 261.00999999999999 | O436: =SUM(M436:N436) -> 2821.71
A437: 3456 | B437: EOL VENTOS DE SANTA BRÍGIDA VI | C437: 17.875.341/0001-03 | D437: 2560.6999999999998 | E437: 0 | F437: 0 | G437: 0 | H437: 0 | I437: 0 | J437: 0 | K437: 2821.71 | L437: 0 | M437: =SUM(J437:L437)-261.01 -> 2560.6999999999998 | N437: 261.00999999999999 | O437: =SUM(M437:N437) -> 2821.71
A438: 3457 | B438: EOL VENTOS DE SANTA BRÍGIDA VII | C438: 17.875.270/0001-49 | D438: 2419.8499999999999 | E438: 0 | F438: 0 | G438: 0 | H438: 0 | I438: 0 | J438: 0 | K438: 2666.5 | L438: 0 | M438: =SUM(J438:L438)-246.65 -> 2419.8499999999999 | N438: 246.65000000000001 | O438: =SUM(M438:N438) -> 2666.5
A439: 3458 | B439: EOL ESPERANÇA | C439: 19.011.517/0002-95 | D439: 4819.5 | E439: 0 | F439: 0 | G439: 0 | H439: 0 | I439: 0 | J439: 0 | K439: 5310.7399999999998 | L439: 0 | M439: =SUM(J439:L439)-491.24 -> 4819.5 | N439: 491.24000000000001 | O439: =SUM(M439:N439) -> 5310.7399999999998
A440: 3459 | B440: EOL MANIÇOBA | C440: 19.011.479/0002-70 | D440: 5156.1599999999999 | E440: 0 | F440: 0 | G440: 0 | H440: 0 | I440: 0 | J440: 0 | K440: 5681.7200000000003 | L440: 0 | M440: =SUM(J440:L440)-525.56 -> 5156.1599999999999 | N440: 525.55999999999995 | O440: =SUM(M440:N440) -> 5681.7199999999993
A441: 3460 | B441: EOL DAMASCENA | C441: 19.046.080/0002-25 | D441: 5156.1599999999999 | E441: 0 | F441: 0 | G441: 0 | H441: 0 | I441: 0 | J441: 0 | K441: 5681.7200000000003 | L441: 0 | M441: =SUM(J441:L441)-525.56 -> 5156.1599999999999 | N441: 525.55999999999995 | O441: =SUM(M441:N441) -> 5681.7199999999993
A442: 3461 | B442: EOL VENTOS DE SANTA JOANA I | C442: 19.724.929/0002-72 | D442: 2551.79 | E442: 0 | F442: 0 | G442: 0 | H442: 0 | I442: 0 | J442: 0 | K442: 2811.8899999999999 | L442: 0 | M442: =SUM(J442:L442)-260.1 -> 2551.79 | N442: 260.10000000000002 | O442: =SUM(M442:N442) -> 2811.8899999999999
A443: 3462 | B443: EOL VENTOS DE SANTA JOANA IV | C443: 19.725.614/0002-40 | D443: 2401.6900000000001 | E443: 0 | F443: 0 | G443: 0 | H443: 0 | I443: 0 | J443: 0 | K443: 2646.4899999999998 | L443: 0 | M443: =SUM(J443:L443)-244.8 -> 2401.6899999999996 | N443: 244.80000000000001 | O443: =SUM(M443:N443) -> 2646.4899999999998
A444: 3463 | B444: EOL VENTOS DE SANTA JOANA V | C444: 19.725.631/0002-87 | D444: 2551.79 | E444: 0 | F444: 0 | G444: 0 | H444: 0 | I444: 0 | J444: 0 | K444: 2811.8899999999999 | L444: 0 | M444: =SUM(J444:L444)-260.1 -> 2551.79 | N444: 260.10000000000002 | O444: =SUM(M444:N444) -> 2811.8899999999999
A445: 3464 | B445: EOL VENTOS DE SANTA JOANA VII | C445: 19.725.315/0002-05 | D445: 2551.79 | E445: 0 | F445: 0 | G445: 0 | H445: 0 | I445: 0 | J445: 0 | K445: 2811.8899999999999 | L445: 0 | M445: =SUM(J445:L445)-260.1 -> 2551.79 | N445: 260.10000000000002 | O445: =SUM(M445:N445) -> 2811.8899999999999
A446: 3465 | B446: EOL VENTOS DE SANTO AUGUSTO III | C446: 17.875.483/0002-51 | D446: 2613.5900000000001 | E446: 0 | F446: 0 | G446: 0 | H446: 0 | I446: 0 | J446: 0 | K446: 2879.9899999999998 | L446: 0 | M446: =SUM(J446:L446)-266.4 -> 2613.5899999999997 | N446: 266.39999999999998 | O446: =SUM(M446:N446) -> 2879.9899999999998
A447: 3466 | B447: EOL VENTOS DE SANTO AUGUSTO IV | C447: 19.781.992/0002-40 | D447: 2551.79 | E447: 0 | F447: 0 | G447: 0 | H447: 0 | I447: 0 | J447: 0 | K447: 2811.8899999999999 | L447: 0 | M447: =SUM(J447:L447)-260.1 -> 2551.79 | N447: 260.10000000000002 | O447: =SUM(M447:N447) -> 2811.8899999999999
A448: 3467 | B448: EOL VENTOS DE SANTO AUGUSTO V | C448: 17.875.427/0002-17 | D448: 2613.5900000000001 | E448: 0 | F448: 0 | G448: 0 | H448: 0 | I448: 0 | J448: 0 | K448: 2879.9899999999998 | L448: 0 | M448: =SUM(J448:L448)-266.4 -> 2613.5899999999997 | N448: 266.39999999999998 | O448: =SUM(M448:N448) -> 2879.9899999999998
A449: 3468 | B449: EOL SERRA DAS VACAS I | C449: 18.127.269/0001-07 | D449: 1989.1300000000001 | E449: 0 | F449: 0 | G449: 0 | H449: 0 | I449: 0 | J449: 0 | K449: 2191.8800000000001 | L449: 0 | M449: =SUM(J449:L449)-202.75 -> 1989.1300000000001 | N449: 202.75 | O449: =SUM(M449:N449) -> 2191.8800000000001
A450: 3469 | B450: EOL SERRA DAS VACAS II | C450: 19.224.741/0001-84 | D450: 1871.05 | E450: 0 | F450: 0 | G450: 0 | H450: 0 | I450: 0 | J450: 0 | K450: 2061.7600000000002 | L450: 0 | M450: =SUM(J450:L450)-190.71 -> 1871.0500000000002 | N450: 190.71000000000001 | O450: =SUM(M450:N450) -> 2061.7600000000002
A451: 3470 | B451: EOL SERRA DAS VACAS IV | C451: 19.694.146/0001-02 | D451: 1912.7 | E451: 0 | F451: 0 | G451: 0 | H451: 0 | I451: 0 | J451: 0 | K451: 2107.6599999999999 | L451: 0 | M451: =SUM(J451:L451)-194.96 -> 1912.6999999999998 | N451: 194.96000000000001 | O451: =SUM(M451:N451) -> 2107.6599999999999
A452: 3471 | B452: EOL VERACE 34 | C452: 42.873.310/0003-22 | D452: 1534.29 | E452: 0 | F452: 0 | G452: 0 | H452: 0 | I452: 0 | J452: 0 | K452: 1690.6800000000001 | L452: 0 | M452: =SUM(J452:L452)-156.39 -> 1534.29 | N452: 156.38999999999999 | O452: =SUM(M452:N452) -> 1690.6799999999998
A453: 3472 | B453: EOL CAIÇARA I | C453: 15.313.271/0001-74 | D453: 2784.02 | E453: 0 | F453: 0 | G453: 0 | H453: 0 | I453: 0 | J453: 0 | K453: 3067.79 | L453: 0 | M453: =SUM(J453:L453)-283.77 -> 2784.02 | N453: 283.76999999999998 | O453: =SUM(M453:N453) -> 3067.79
A454: 3473 | B454: EOL CAIÇARA II | C454: 15.313.113/0001-14 | D454: 1856.99 | E454: 0 | F454: 0 | G454: 0 | H454: 0 | I454: 0 | J454: 0 | K454: 2046.27 | L454: 0 | M454: =SUM(J454:L454)-189.28 -> 1856.99 | N454: 189.28 | O454: =SUM(M454:N454) -> 2046.27
A455: 3474 | B455: EOL JUNCO I | C455: 15.313.226/0001-10 | D455: 2480.6100000000001 | E455: 0 | F455: 0 | G455: 0 | H455: 0 | I455: 0 | J455: 0 | K455: 2733.4499999999998 | L455: 0 | M455: =SUM(J455:L455)-252.84 -> 2480.6099999999997 | N455: 252.84 | O455: =SUM(M455:N455) -> 2733.4499999999998
A456: 3475 | B456: EOL JUNCO II | C456: 15.313.187/0001-50 | D456: 2475.3800000000001 | E456: 0 | F456: 0 | G456: 0 | H456: 0 | I456: 0 | J456: 0 | K456: 2727.6900000000001 | L456: 0 | M456: =SUM(J456:L456)-252.31 -> 2475.3800000000001 | N456: 252.31 | O456: =SUM(M456:N456) -> 2727.6900000000001
A457: 3476 | B457: EOL SERRA DAS VACAS III | C457: 19.694.110/0001-29 | D457: 2029.6800000000001 | E457: 0 | F457: 0 | G457: 0 | H457: 0 | I457: 0 | J457: 0 | K457: 2236.5599999999999 | L457: 0 | M457: =SUM(J457:L457)-206.88 -> 2029.6799999999998 | N457: 206.88 | O457: =SUM(M457:N457) -> 2236.5599999999999
A458: 3477 | B458: RENOVA (EOL ABIL) | C458: 18.911.031/0001-60 | D458: 2117.46 | E458: 0 | F458: 0 | G458: 0 | H458: 0 | I458: 0 | J458: 0 | K458: 2333.29 | L458: 0 | M458: =SUM(J458:L458)-215.83 -> 2117.46 | N458: 215.83000000000001 | O458: =SUM(M458:N458) -> 2333.29
A459: 3478 | B459: EOL BORGO | C459: 12.041.341/0001-94 | D459: 2465.9000000000001 | E459: 0 | F459: 0 | G459: 0 | H459: 0 | I459: 0 | J459: 0 | K459: 2717.25 | L459: 0 | M459: =SUM(J459:L459)-251.35 -> 2465.9000000000001 | N459: 251.34999999999999 | O459: =SUM(M459:N459) -> 2717.25
A460: 3479 | B460: EOL CAETITÉ | C460: 11.201.767/0001-03 | D460: 3669.4899999999998 | E460: 0 | F460: 0 | G460: 0 | H460: 0 | I460: 0 | J460: 0 | K460: 4043.52 | L460: 0 | M460: =SUM(J460:L460)-374.03 -> 3669.4899999999998 | N460: 374.02999999999997 | O460: =SUM(M460:N460) -> 4043.5199999999995
A461: 3480 | B461: EOL ESPIGÃO | C461: 11.197.321/0001-44 | D461: 1232.95 | E461: 0 | F461: 0 | G461: 0 | H461: 0 | I461: 0 | J461: 0 | K461: 1358.6199999999999 | L461: 0 | M461: =SUM(J461:L461)-125.67 -> 1232.9499999999998 | N461: 125.67 | O461: =SUM(M461:N461) -> 1358.6199999999999
A462: 3481 | B462: RENOVA (EOL FOLHA DE SERRA) | C462: 18.910.740/0001-20 | D462: 1937.97 | E462: 0 | F462: 0 | G462: 0 | H462: 0 | I462: 0 | J462: 0 | K462: 2135.5 | L462: 0 | M462: =SUM(J462:L462)-197.53 -> 1937.97 | N462: 197.53 | O462: =SUM(M462:N462) -> 2135.5
A463: 3482 | B463: RENOVA (EOL JABUTICABA) | C463: 18.870.194/0001-41 | D463: 802.45000000000005 | E463: 0 | F463: 0 | G463: 0 | H463: 0 | I463: 0 | J463: 0 | K463: 884.24000000000001 | L463: 0 | M463: =SUM(J463:L463)-81.79 -> 802.45000000000005 | N463: 81.790000000000006 | O463: =SUM(M463:N463) -> 884.24000000000001
A464: 3483 | B464: RENOVA (EOL J. DO CERRADO) | C464: 18.870.265/0001-06 | D464: 1876.5899999999999 | E464: 0 | F464: 0 | G464: 0 | H464: 0 | I464: 0 | J464: 0 | K464: 2067.8699999999999 | L464: 0 | M464: =SUM(J464:L464)-191.28 -> 1876.5899999999999 | N464: 191.28 | O464: =SUM(M464:N464) -> 2067.8699999999999
A465: 3484 | B465: EOL PELOURINHO | C465: 12.048.031/0001-00 | D465: 2671.3800000000001 | E465: 0 | F465: 0 | G465: 0 | H465: 0 | I465: 0 | J465: 0 | K465: 2943.6700000000001 | L465: 0 | M465: =SUM(J465:L465)-272.29 -> 2671.3800000000001 | N465: 272.29000000000002 | O465: =SUM(M465:N465) -> 2943.6700000000001
A466: 3485 | B466: EOL S. DO ESPINHAÇO | C466: 12.049.958/0001-56 | D466: 2260.4099999999999 | E466: 0 | F466: 0 | G466: 0 | H466: 0 | I466: 0 | J466: 0 | K466: 2490.8099999999999 | L466: 0 | M466: =SUM(J466:L466)-230.4 -> 2260.4099999999999 | N466: 230.40000000000001 | O466: =SUM(M466:N466) -> 2490.8099999999999
A467: 3486 | B467: RENOVA (EOL TÁBUA) | C467: 18.870.007/0001-20 | D467: 1341.9200000000001 | E467: 0 | F467: 0 | G467: 0 | H467: 0 | I467: 0 | J467: 0 | K467: 1478.7 | L467: 0 | M467: =SUM(J467:L467)-136.78 -> 1341.9200000000001 | N467: 136.78 | O467: =SUM(M467:N467) -> 1478.7
A468: 3487 | B468: RENOVA (EOL VAQUETA) | C468: 18.684.356/0001-57 | D468: 2090.8899999999999 | E468: 0 | F468: 0 | G468: 0 | H468: 0 | I468: 0 | J468: 0 | K468: 2304.0100000000002 | L468: 0 | M468: =SUM(J468:L468)-213.12 -> 2090.8900000000003 | N468: 213.12 | O468: =SUM(M468:N468) -> 2304.0100000000002
A469: 3488 | B469: EOL ANGICAL | C469: 14.570.783/0002-34 | D469: 1568.0999999999999 | E469: 0 | F469: 0 | G469: 0 | H469: 0 | I469: 0 | J469: 0 | K469: 1727.9300000000001 | L469: 0 | M469: =SUM(J469:L469)-159.83 -> 1568.1000000000001 | N469: 159.83000000000001 | O469: =SUM(M469:N469) -> 1727.9300000000001
A470: 3489 | B470: EOL CAITITU | C470: 14.570.861/0002-09 | D470: 2688.5100000000002 | E470: 0 | F470: 0 | G470: 0 | H470: 0 | I470: 0 | J470: 0 | K470: 2962.5500000000002 | L470: 0 | M470: =SUM(J470:L470)-274.04 -> 2688.5100000000002 | N470: 274.04000000000002 | O470: =SUM(M470:N470) -> 2962.5500000000002
A471: 3490 | B471: EOL COQUEIRINHO | C471: 14.570.819/0002-80 | D471: 3583.8600000000001 | E471: 0 | F471: 0 | G471: 0 | H471: 0 | I471: 0 | J471: 0 | K471: 3949.1599999999999 | L471: 0 | M471: =SUM(J471:L471)-365.3 -> 3583.8599999999997 | N471: 365.30000000000001 | O471: =SUM(M471:N471) -> 3949.1599999999999
A472: 3491 | B472: EOL CORRUPIÃO | C472: 14.570.800/0002-33 | D472: 3360.0300000000002 | E472: 0 | F472: 0 | G472: 0 | H472: 0 | I472: 0 | J472: 0 | K472: 3702.5100000000002 | L472: 0 | M472: =SUM(J472:L472)-342.48 -> 3360.0300000000002 | N472: 342.48000000000002 | O472: =SUM(M472:N472) -> 3702.5100000000002
A473: 3492 | B473: EOL INHAMBU | C473: 14.572.367/0002-75 | D473: 3669.4899999999998 | E473: 0 | F473: 0 | G473: 0 | H473: 0 | I473: 0 | J473: 0 | K473: 4043.52 | L473: 0 | M473: =SUM(J473:L473)-374.03 -> 3669.4899999999998 | N473: 374.02999999999997 | O473: =SUM(M473:N473) -> 4043.5199999999995
A474: 3493 | B474: EOL TAMANDUÁ MIRIM | C474: 14.571.068/0002-16 | D474: 3583.8600000000001 | E474: 0 | F474: 0 | G474: 0 | H474: 0 | I474: 0 | J474: 0 | K474: 3949.1599999999999 | L474: 0 | M474: =SUM(J474:L474)-365.3 -> 3583.8599999999997 | N474: 365.30000000000001 | O474: =SUM(M474:N474) -> 3949.1599999999999
A475: 3494 | B475: EOL TEIU | C475: 14.570.839/0002-50 | D475: 2015.78 | E475: 0 | F475: 0 | G475: 0 | H475: 0 | I475: 0 | J475: 0 | K475: 2221.25 | L475: 0 | M475: =SUM(J475:L475)-205.47 -> 2015.78 | N475: 205.47 | O475: =SUM(M475:N475) -> 2221.25
A476: 3495 | B476: EOL VENTOS DE SANTA JOANA III | C476: 19.725.354/0002-02 | D476: 2613.5900000000001 | E476: 0 | F476: 0 | G476: 0 | H476: 0 | I476: 0 | J476: 0 | K476: 2879.9899999999998 | L476: 0 | M476: =SUM(J476:L476)-266.4 -> 2613.5899999999997 | N476: 266.39999999999998 | O476: =SUM(M476:N476) -> 2879.9899999999998
A477: 3496 | B477: EDP (UHE CACHOEIRA CALDEIRÃO) | C477: 17.200.920/0001-56 | D477: 40268.019999999997 | E477: 0 | F477: 0 | G477: 0 | H477: 0 | I477: 0 | J477: 0 | K477: 44372.470000000001 | L477: 0 | M477: =SUM(J477:L477)-4104.45 -> 40268.020000000004 | N477: 4104.4499999999998 | O477: =SUM(M477:N477) -> 44372.470000000001
A478: 3497 | B478: EOL ITAREMA II | C478: 19.560.074/0002-91 | D478: 2636.8000000000002 | E478: 0 | F478: 0 | G478: 0 | H478: 0 | I478: 0 | J478: 0 | K478: 2905.5599999999999 | L478: 0 | M478: =SUM(J478:L478)-268.76 -> 2636.8000000000002 | N478: 268.75999999999999 | O478: =SUM(M478:N478) -> 2905.5600000000004
A479: 3498 | B479: EOL ITAREMA V | C479: 19.560.868/0002-55 | D479: 2042.05 | E479: 0 | F479: 0 | G479: 0 | H479: 0 | I479: 0 | J479: 0 | K479: 2250.1900000000001 | L479: 0 | M479: =SUM(J479:L479)-208.14 -> 2042.0500000000002 | N479: 208.13999999999999 | O479: =SUM(M479:N479) -> 2250.1900000000001
A480: 3499 | B480: EOL S. DE SANTANA I | C480: 12.848.401/0001-85 | D480: 2294.1700000000001 | E480: 0 | F480: 0 | G480: 0 | H480: 0 | I480: 0 | J480: 0 | K480: 2528.0100000000002 | L480: 0 | M480: =SUM(J480:L480)-233.84 -> 2294.1700000000001 | N480: 233.84 | O480: =SUM(M480:N480) -> 2528.0100000000002
A481: 3500 | B481: EOL S. DE SANTANA II | C481: 12.851.098/0001-70 | D481: 3354.79 | E481: 0 | F481: 0 | G481: 0 | H481: 0 | I481: 0 | J481: 0 | K481: 3696.7399999999998 | L481: 0 | M481: =SUM(J481:L481)-341.95 -> 3354.79 | N481: 341.94999999999999 | O481: =SUM(M481:N481) -> 3696.7399999999998
A482: 3501 | B482: EOL S. DE SANTANA III | C482: 12.848.783/0001-47 | D482: 3435.5 | E482: 0 | F482: 0 | G482: 0 | H482: 0 | I482: 0 | J482: 0 | K482: 3785.6700000000001 | L482: 0 | M482: =SUM(J482:L482)-350.17 -> 3435.5 | N482: 350.17000000000002 | O482: =SUM(M482:N482) -> 3785.6700000000001
A483: 3502 | B483: EOL ITAREMA I | C483: 19.560.032/0002-50 | D483: 2635.21 | E483: 0 | F483: 0 | G483: 0 | H483: 0 | I483: 0 | J483: 0 | K483: 2903.8099999999999 | L483: 0 | M483: =SUM(J483:L483)-268.6 -> 2635.21 | N483: 268.60000000000002 | O483: =SUM(M483:N483) -> 2903.8099999999999
A484: 3503 | B484: EOL ITAREMA III | C484: 19.560.839/0002-93 | D484: 1451.8499999999999 | E484: 0 | F484: 0 | G484: 0 | H484: 0 | I484: 0 | J484: 0 | K484: 1599.8299999999999 | L484: 0 | M484: =SUM(J484:L484)-147.98 -> 1451.8499999999999 | N484: 147.97999999999999 | O484: =SUM(M484:N484) -> 1599.8299999999999
A485: 3504 | B485: EOL BARAÚNAS II | C485: 19.905.679/0002-77 | D485: 2576.3400000000001 | E485: 0 | F485: 0 | G485: 0 | H485: 0 | I485: 0 | J485: 0 | K485: 2838.9400000000001 | L485: 0 | M485: =SUM(J485:L485)-262.6 -> 2576.3400000000001 | N485: 262.60000000000002 | O485: =SUM(M485:N485) -> 2838.9400000000001
A486: 3505 | B486: EOL BANDA DE COURO | C486: 19.905.727/0002-27 | D486: 3025.0500000000002 | E486: 0 | F486: 0 | G486: 0 | H486: 0 | I486: 0 | J486: 0 | K486: 3333.3899999999999 | L486: 0 | M486: =SUM(J486:L486)-308.34 -> 3025.0499999999997 | N486: 308.33999999999997 | O486: =SUM(M486:N486) -> 3333.3899999999999
A487: 3507 | B487: EOL CACIMBAS I | C487: 13.389.543/0002-75 | D487: 1503.1400000000001 | E487: 0 | F487: 0 | G487: 0 | H487: 0 | I487: 0 | J487: 0 | K487: 1656.3499999999999 | L487: 0 | M487: =SUM(J487:L487)-153.21 -> 1503.1399999999999 | N487: 153.21000000000001 | O487: =SUM(M487:N487) -> 1656.3499999999999
A488: 3508 | B488: UTE KLABIN CELULOSE | C488: 89.637.490/0165-72 | D488: 17595.049999999999 | E488: 0 | F488: 0 | G488: 0 | H488: 0 | I488: 0 | J488: 0 | K488: 19388.48 | L488: 0 | M488: =SUM(J488:L488)-1793.43 -> 17595.049999999999 | N488: 1793.4300000000001 | O488: =SUM(M488:N488) -> 19388.48
A489: 3509 | B489: EOL BAIXA DO FEIJÃO I | C489: 14.496.492/0002-43 | D489: 3138.5799999999999 | E489: 0 | F489: 0 | G489: 0 | H489: 0 | I489: 0 | J489: 0 | K489: 3458.4899999999998 | L489: 0 | M489: =SUM(J489:L489)-319.91 -> 3138.5799999999999 | N489: 319.91000000000003 | O489: =SUM(M489:N489) -> 3458.4899999999998
A490: 3510 | B490: EOL BAIXA DO FEIJÃO II | C490: 14.496.545/0002-26 | D490: 3128 | E490: 0 | F490: 0 | G490: 0 | H490: 0 | I490: 0 | J490: 0 | K490: 3446.8299999999999 | L490: 0 | M490: =SUM(J490:L490)-318.83 -> 3128 | N490: 318.82999999999998 | O490: =SUM(M490:N490) -> 3446.8299999999999
A491: 3511 | B491: EOL BAIXA DO FEIJÃO III | C491: 14.496.290/0002-00 | D491: 3144.9200000000001 | E491: 0 | F491: 0 | G491: 0 | H491: 0 | I491: 0 | J491: 0 | K491: 3465.48 | L491: 0 | M491: =SUM(J491:L491)-320.56 -> 3144.9200000000001 | N491: 320.56 | O491: =SUM(M491:N491) -> 3465.48
A492: 3512 | B492: EOL BAIXA DO FEIJÃO IV | C492: 14.496.317/0002-56 | D492: 3163.7199999999998 | E492: 0 | F492: 0 | G492: 0 | H492: 0 | I492: 0 | J492: 0 | K492: 3486.1900000000001 | L492: 0 | M492: =SUM(J492:L492)-322.47 -> 3163.7200000000003 | N492: 322.47000000000003 | O492: =SUM(M492:N492) -> 3486.1900000000005
A493: 3513 | B493: EOL VENTOS DOS GUARÁS I | C493: 13.344.343/0002-04 | D493: 4226.4399999999996 | E493: 0 | F493: 0 | G493: 0 | H493: 0 | I493: 0 | J493: 0 | K493: 4657.2299999999996 | L493: 0 | M493: =SUM(J493:L493)-430.79 -> 4226.4399999999996 | N493: 430.79000000000002 | O493: =SUM(M493:N493) -> 4657.2299999999996
A494: 3514 | B494: CPFL (EOL CAMPO DOS VENTOS I) | C494: 10.797.890/0001-68 | D494: 2210.73 | E494: 0 | F494: 0 | G494: 0 | H494: 0 | I494: 0 | J494: 0 | K494: 2436.0700000000002 | L494: 0 | M494: =SUM(J494:L494)-225.34 -> 2210.73 | N494: 225.34 | O494: =SUM(M494:N494) -> 2436.0700000000002
A495: 3515 | B495: CPFL (EOL CAMPO DOS VENTOS III) | C495: 10.797.891/0001-02 | D495: 2206.98 | E495: 0 | F495: 0 | G495: 0 | H495: 0 | I495: 0 | J495: 0 | K495: 2431.9299999999998 | L495: 0 | M495: =SUM(J495:L495)-224.95 -> 2206.98 | N495: 224.94999999999999 | O495: =SUM(M495:N495) -> 2431.9299999999998
A496: 3516 | B496: CPFL (EOL CAMPO DOS VENTOS V) | C496: 10.797.888/0001-99 | D496: 2203.0599999999999 | E496: 0 | F496: 0 | G496: 0 | H496: 0 | I496: 0 | J496: 0 | K496: 2427.6100000000001 | L496: 0 | M496: =SUM(J496:L496)-224.55 -> 2203.0599999999999 | N496: 224.55000000000001 | O496: =SUM(M496:N496) -> 2427.6100000000001
A497: 3517 | B497: EOL VENTOS DE SÃO CLEMENTE 1 | C497: 21.014.004/0002-80 | D497: 3401.5500000000002 | E497: 0 | F497: 0 | G497: 0 | H497: 0 | I497: 0 | J497: 0 | K497: 3748.2600000000002 | L497: 0 | M497: =SUM(J497:L497)-346.71 -> 3401.5500000000002 | N497: 346.70999999999998 | O497: =SUM(M497:N497) -> 3748.2600000000002
A498: 3518 | B498: EOL VENTOS DE SÃO CLEMENTE 2 | C498: 21.014.134/0002-12 | D498: 3401.5500000000002 | E498: 0 | F498: 0 | G498: 0 | H498: 0 | I498: 0 | J498: 0 | K498: 3748.2600000000002 | L498: 0 | M498: =SUM(J498:L498)-346.71 -> 3401.5500000000002 | N498: 346.70999999999998 | O498: =SUM(M498:N498) -> 3748.2600000000002
A499: 3519 | B499: EOL VENTOS DE SÃO CLEMENTE 3 | C499: 21.014.090/0002-20 | D499: 3401.5500000000002 | E499: 0 | F499: 0 | G499: 0 | H499: 0 | I499: 0 | J499: 0 | K499: 3748.2600000000002 | L499: 0 | M499: =SUM(J499:L499)-346.71 -> 3401.5500000000002 | N499: 346.70999999999998 | O499: =SUM(M499:N499) -> 3748.2600000000002
A500: 3520 | B500: EOL VENTOS DE SÃO CLEMENTE 4 | C500: 21.013.854/0002-63 | D500: 3401.5500000000002 | E500: 0 | F500: 0 | G500: 0 | H500: 0 | I500: 0 | J500: 0 | K500: 3748.2600000000002 | L500: 0 | M500: =SUM(J500:L500)-346.71 -> 3401.5500000000002 | N500: 346.70999999999998 | O500: =SUM(M500:N500) -> 3748.2600000000002
A501: 3521 | B501: EOL VENTOS DE SÃO CLEMENTE 5 | C501: 21.013.993/0002-97 | D501: 3401.5500000000002 | E501: 0 | F501: 0 | G501: 0 | H501: 0 | I501: 0 | J501: 0 | K501: 3748.2600000000002 | L501: 0 | M501: =SUM(J501:L501)-346.71 -> 3401.5500000000002 | N501: 346.70999999999998 | O501: =SUM(M501:N501) -> 3748.2600000000002
A502: 3522 | B502: EOL VENTOS DE SÃO CLEMENTE 6 | C502: 21.013.968/0002-03 | D502: 3015.4000000000001 | E502: 0 | F502: 0 | G502: 0 | H502: 0 | I502: 0 | J502: 0 | K502: 3322.75 | L502: 0 | M502: =SUM(J502:L502)-307.35 -> 3015.4000000000001 | N502: 307.35000000000002 | O502: =SUM(M502:N502) -> 3322.75
A503: 3523 | B503: EOL VENTOS DE SÃO CLEMENTE 7 | C503: 21.013.833/0002-48 | D503: 2844.4400000000001 | E503: 0 | F503: 0 | G503: 0 | H503: 0 | I503: 0 | J503: 0 | K503: 3134.3699999999999 | L503: 0 | M503: =SUM(J503:L503)-289.93 -> 2844.4400000000001 | N503: 289.93000000000001 | O503: =SUM(M503:N503) -> 3134.3699999999999
A504: 3524 | B504: EOL VENTOS DE SÃO CLEMENTE 8 | C504: 21.013.880/0002-91 | D504: 2424.3600000000001 | E504: 0 | F504: 0 | G504: 0 | H504: 0 | I504: 0 | J504: 0 | K504: 2671.4699999999998 | L504: 0 | M504: =SUM(J504:L504)-247.11 -> 2424.3599999999997 | N504: 247.11000000000001 | O504: =SUM(M504:N504) -> 2671.4699999999998
A505: 3525 | B505: EOL VENTOS DE SANTA EDWIGES | C505: 12.960.082/0001-03 | D505: 3298.0799999999999 | E505: 0 | F505: 0 | G505: 0 | H505: 0 | I505: 0 | J505: 0 | K505: 3634.25 | L505: 0 | M505: =SUM(J505:L505)-336.17 -> 3298.0799999999999 | N505: 336.17000000000002 | O505: =SUM(M505:N505) -> 3634.25
A506: 3526 | B506: EOL VENTOS DE SANTA FATIMA | C506: 12.960.065/0001-68 | D506: 3309.0900000000001 | E506: 0 | F506: 0 | G506: 0 | H506: 0 | I506: 0 | J506: 0 | K506: 3646.3800000000001 | L506: 0 | M506: =SUM(J506:L506)-337.29 -> 3309.0900000000001 | N506: 337.29000000000002 | O506: =SUM(M506:N506) -> 3646.3800000000001
A507: 3527 | B507: EOL VENTOS DE SANTA REGINA | C507: 12.960.071/0001-15 | D507: 3291.3099999999999 | E507: 0 | F507: 0 | G507: 0 | H507: 0 | I507: 0 | J507: 0 | K507: 3626.79 | L507: 0 | M507: =SUM(J507:L507)-335.48 -> 3291.3099999999999 | N507: 335.48000000000002 | O507: =SUM(M507:N507) -> 3626.79
A508: 3528 | B508: EOL VENTOS DE SANTO ADRIANO | C508: 10.823.648/0001-11 | D508: 3291.3099999999999 | E508: 0 | F508: 0 | G508: 0 | H508: 0 | I508: 0 | J508: 0 | K508: 3626.79 | L508: 0 | M508: =SUM(J508:L508)-335.48 -> 3291.3099999999999 | N508: 335.48000000000002 | O508: =SUM(M508:N508) -> 3626.79
A509: 3529 | B509: EOL VENTOS DE SANTO ALBANO | C509: 10.656.606/0001-33 | D509: 3291.3099999999999 | E509: 0 | F509: 0 | G509: 0 | H509: 0 | I509: 0 | J509: 0 | K509: 3626.79 | L509: 0 | M509: =SUM(J509:L509)-335.48 -> 3291.3099999999999 | N509: 335.48000000000002 | O509: =SUM(M509:N509) -> 3626.79
A510: 3530 | B510: EOL ITAREMA IV | C510: 20.553.751/0002-23 | D510: 2816.1500000000001 | E510: 0 | F510: 0 | G510: 0 | H510: 0 | I510: 0 | J510: 0 | K510: 3103.1999999999998 | L510: 0 | M510: =SUM(J510:L510)-287.05 -> 2816.1499999999996 | N510: 287.05000000000001 | O510: =SUM(M510:N510) -> 3103.1999999999998
A511: 3531 | B511: EOL ITAREMA VI | C511: 20.533.879/0002-25 | D511: 3222.1500000000001 | E511: 0 | F511: 0 | G511: 0 | H511: 0 | I511: 0 | J511: 0 | K511: 3550.5799999999999 | L511: 0 | M511: =SUM(J511:L511)-328.43 -> 3222.1500000000001 | N511: 328.43000000000001 | O511: =SUM(M511:N511) -> 3550.5799999999999
A512: 3532 | B512: EOL ITAREMA VII | C512: 20.533.473/0002-42 | D512: 2816.1500000000001 | E512: 0 | F512: 0 | G512: 0 | H512: 0 | I512: 0 | J512: 0 | K512: 3103.1999999999998 | L512: 0 | M512: =SUM(J512:L512)-287.05 -> 2816.1499999999996 | N512: 287.05000000000001 | O512: =SUM(M512:N512) -> 3103.1999999999998
A513: 3533 | B513: EOL ESTRELA | C513: 09.265.464/0002-85 | D513: 2278.5100000000002 | E513: 0 | F513: 0 | G513: 0 | H513: 0 | I513: 0 | J513: 0 | K513: 2510.75 | L513: 0 | M513: =SUM(J513:L513)-232.24 -> 2278.5100000000002 | N513: 232.24000000000001 | O513: =SUM(M513:N513) -> 2510.75
A514: 3534 | B514: EOL OURO VERDE | C514: 16.849.271/0002-37 | D514: 2362.54 | E514: 0 | F514: 0 | G514: 0 | H514: 0 | I514: 0 | J514: 0 | K514: 2603.3499999999999 | L514: 0 | M514: =SUM(J514:L514)-240.81 -> 2362.54 | N514: 240.81 | O514: =SUM(M514:N514) -> 2603.3499999999999
A515: 3535 | B515: EOL SANTA MONICA I | C515: 12.445.328/0002-81 | D515: 1503.1400000000001 | E515: 0 | F515: 0 | G515: 0 | H515: 0 | I515: 0 | J515: 0 | K515: 1656.3499999999999 | L515: 0 | M515: =SUM(J515:L515)-153.21 -> 1503.1399999999999 | N515: 153.21000000000001 | O515: =SUM(M515:N515) -> 1656.3499999999999
A516: 3536 | B516: UHE SÃO ROQUE | C516: 15.116.321/0002-04 | D516: 26709.77 | E516: 0 | F516: 0 | G516: 0 | H516: 0 | I516: 0 | J516: 0 | K516: 29432.25 | L516: 0 | M516: =SUM(J516:L516)-2722.48 -> 26709.77 | N516: 2722.48 | O516: =SUM(M516:N516) -> 29432.25
A517: 3537 | B517: EOL ITAREMA VIII | C517: 20.533.310/0002-60 | D517: 2816.1500000000001 | E517: 0 | F517: 0 | G517: 0 | H517: 0 | I517: 0 | J517: 0 | K517: 3103.1999999999998 | L517: 0 | M517: =SUM(J517:L517)-287.05 -> 2816.1499999999996 | N517: 287.05000000000001 | O517: =SUM(M517:N517) -> 3103.1999999999998
A518: 3538 | B518: EOL ITAREMA IX | C518: 20.533.377/0002-02 | D518: 4035.8699999999999 | E518: 0 | F518: 0 | G518: 0 | H518: 0 | I518: 0 | J518: 0 | K518: 4447.2399999999998 | L518: 0 | M518: =SUM(J518:L518)-411.37 -> 4035.8699999999999 | N518: 411.37 | O518: =SUM(M518:N518) -> 4447.2399999999998
A519: 3539 | B519: EOL MACAMBIRA I | C519: 15.231.588/0001-61 | D519: 1677.0999999999999 | E519: 0 | F519: 0 | G519: 0 | H519: 0 | I519: 0 | J519: 0 | K519: 1848.04 | L519: 0 | M519: =SUM(J519:L519)-170.94 -> 1677.0999999999999 | N519: 170.94 | O519: =SUM(M519:N519) -> 1848.04
A520: 3540 | B520: EOL MACAMBIRA II | C520: 15.231.448/0001-93 | D520: 1552.8 | E520: 0 | F520: 0 | G520: 0 | H520: 0 | I520: 0 | J520: 0 | K520: 1711.0699999999999 | L520: 0 | M520: =SUM(J520:L520)-158.27 -> 1552.8 | N520: 158.27000000000001 | O520: =SUM(M520:N520) -> 1711.0699999999999
A521: 3541 | B521: RPE (RIO PARANA ENERGIA) | C521: 23.096.269/0001-19 | D521: 1183661.6399999999 | E521: 0 | F521: 0 | G521: 0 | H521: 0 | I521: 0 | J521: 0 | K521: 1304310.3500000001 | L521: 0 | M521: =SUM(J521:L521)-120648.71 -> 1183661.6400000001 | N521: 120648.71000000001 | O521: =SUM(M521:N521) -> 1304310.3500000001
A522: 3542 | B522: EOL VILA AMAZONAS V | C522: 20.339.203/0001-14 | D522: 2271.0999999999999 | E522: 0 | F522: 0 | G522: 0 | H522: 0 | I522: 0 | J522: 0 | K522: 2502.5900000000001 | L522: 0 | M522: =SUM(J522:L522)-231.49 -> 2271.1000000000004 | N522: 231.49000000000001 | O522: =SUM(M522:N522) -> 2502.5900000000001
A523: 3543 | B523: EOL VILA PARÁ I | C523: 20.318.451/0001-89 | D523: 2772.1500000000001 | E523: 0 | F523: 0 | G523: 0 | H523: 0 | I523: 0 | J523: 0 | K523: 3054.71 | L523: 0 | M523: =SUM(J523:L523)-282.56 -> 2772.1500000000001 | N523: 282.56 | O523: =SUM(M523:N523) -> 3054.71
A524: 3544 | B524: EOL CATAVENTOS ACARAÚ I | C524: 10.902.268/0001-72 | D524: 2925.4699999999998 | E524: 0 | F524: 0 | G524: 0 | H524: 0 | I524: 0 | J524: 0 | K524: 3223.6599999999999 | L524: 0 | M524: =SUM(J524:L524)-298.19 -> 2925.4699999999998 | N524: 298.19 | O524: =SUM(M524:N524) -> 3223.6599999999999
A525: 3545 | B525: EOL VENTOS DE SÃO BENEDITO | C525: 12.053.657/0001-04 | D525: 3550.1900000000001 | E525: 0 | F525: 0 | G525: 0 | H525: 0 | I525: 0 | J525: 0 | K525: 3912.0599999999999 | L525: 0 | M525: =SUM(J525:L525)-361.87 -> 3550.1900000000001 | N525: 361.87 | O525: =SUM(M525:N525) -> 3912.0599999999999
A526: 3546 | B526: EOL VENTOS DE SANTA ANGELINA | C526: 10.682.436/0001-61 | D526: 3291.3099999999999 | E526: 0 | F526: 0 | G526: 0 | H526: 0 | I526: 0 | J526: 0 | K526: 3626.79 | L526: 0 | M526: =SUM(J526:L526)-335.48 -> 3291.3099999999999 | N526: 335.48000000000002 | O526: =SUM(M526:N526) -> 3626.79
A527: 3547 | B527: EOL VENTOS DE SANTA BARBARA | C527: 12.960.046/0001-31 | D527: 3291.3099999999999 | E527: 0 | F527: 0 | G527: 0 | H527: 0 | I527: 0 | J527: 0 | K527: 3626.79 | L527: 0 | M527: =SUM(J527:L527)-335.48 -> 3291.3099999999999 | N527: 335.48000000000002 | O527: =SUM(M527:N527) -> 3626.79
A528: 3548 | B528: EOL VILA PARÁ II | C528: 20.318.810/0001-06 | D528: 2535.3200000000002 | E528: 0 | F528: 0 | G528: 0 | H528: 0 | I528: 0 | J528: 0 | K528: 2793.7399999999998 | L528: 0 | M528: =SUM(J528:L528)-258.42 -> 2535.3199999999997 | N528: 258.42000000000002 | O528: =SUM(M528:N528) -> 2793.7399999999998
A529: 3549 | B529: EOL VILA PARÁ III | C529: 20.318.427/0001-40 | D529: 2525.9000000000001 | E529: 0 | F529: 0 | G529: 0 | H529: 0 | I529: 0 | J529: 0 | K529: 2783.3600000000001 | L529: 0 | M529: =SUM(J529:L529)-257.46 -> 2525.9000000000001 | N529: 257.45999999999998 | O529: =SUM(M529:N529) -> 2783.3600000000001
A530: 3550 | B530: EOL SÃO DOMINGOS | C530: 12.053.825/0001-53 | D530: 2235.8400000000001 | E530: 0 | F530: 0 | G530: 0 | H530: 0 | I530: 0 | J530: 0 | K530: 2463.7399999999998 | L530: 0 | M530: =SUM(J530:L530)-227.9 -> 2235.8399999999997 | N530: 227.90000000000001 | O530: =SUM(M530:N530) -> 2463.7399999999998
A531: 3551 | B531: EOL AURA MANGUEIRA VII | C531: 20.593.647/0002-62 | D531: 2942.0100000000002 | E531: 0 | F531: 0 | G531: 0 | H531: 0 | I531: 0 | J531: 0 | K531: 3241.8800000000001 | L531: 0 | M531: =SUM(J531:L531)-299.87 -> 2942.0100000000002 | N531: 299.87 | O531: =SUM(M531:N531) -> 3241.8800000000001
A532: 3552 | B532: EOL AURA MIRIM II | C532: 20.586.118/0002-31 | D532: 3678.2399999999998 | E532: 0 | F532: 0 | G532: 0 | H532: 0 | I532: 0 | J532: 0 | K532: 4053.1599999999999 | L532: 0 | M532: =SUM(J532:L532)-374.92 -> 3678.2399999999998 | N532: 374.92000000000002 | O532: =SUM(M532:N532) -> 4053.1599999999999
A533: 3553 | B533: UTE CSP | C533: 09.509.535/0001-67 | D533: 12601.48 | E533: 0 | F533: 0 | G533: 0 | H533: 0 | I533: 0 | J533: 0 | K533: 13885.93 | L533: 0 | M533: =SUM(J533:L533)-1284.45 -> 12601.48 | N533: 1284.45 | O533: =SUM(M533:N533) -> 13885.93
A534: 3554 | B534: UFV CALDEIRÃO GRANDE V | C534: 12.960.110/0001-84 | D534: 3032.9000000000001 | E534: 0 | F534: 0 | G534: 0 | H534: 0 | I534: 0 | J534: 0 | K534: 3342.04 | L534: 0 | M534: =SUM(J534:L534)-309.14 -> 3032.9000000000001 | N534: 309.13999999999999 | O534: =SUM(M534:N534) -> 3342.04
A535: 3555 | B535: EOL VENTO FORMOSO | C535: 12.774.042/0001-69 | D535: 2682.25 | E535: 0 | F535: 0 | G535: 0 | H535: 0 | I535: 0 | J535: 0 | K535: 2955.6500000000001 | L535: 0 | M535: =SUM(J535:L535)-273.4 -> 2682.25 | N535: 273.39999999999998 | O535: =SUM(M535:N535) -> 2955.6500000000001
A536: 3556 | B536: EOL VENTOS DO MORRO DO CHAPÉU | C536: 12.774.017/0001-85 | D536: 2677.1399999999999 | E536: 0 | F536: 0 | G536: 0 | H536: 0 | I536: 0 | J536: 0 | K536: 2950.02 | L536: 0 | M536: =SUM(J536:L536)-272.88 -> 2677.1399999999999 | N536: 272.88 | O536: =SUM(M536:N536) -> 2950.02
A537: 3557 | B537: EOL VENTOS DO PARAZINHO | C537: 12.773.991/0001-24 | D537: 2826.27 | E537: 0 | F537: 0 | G537: 0 | H537: 0 | I537: 0 | J537: 0 | K537: 3114.3499999999999 | L537: 0 | M537: =SUM(J537:L537)-288.08 -> 2826.27 | N537: 288.07999999999998 | O537: =SUM(M537:N537) -> 3114.3499999999999
A538: 3558 | B538: EOL VENTOS DE TIANGUÁ NORTE | C538: 12.773.953/0001-71 | D538: 2842.6199999999999 | E538: 0 | F538: 0 | G538: 0 | H538: 0 | I538: 0 | J538: 0 | K538: 3132.3600000000001 | L538: 0 | M538: =SUM(J538:L538)-289.74 -> 2842.6199999999999 | N538: 289.74000000000001 | O538: =SUM(M538:N538) -> 3132.3599999999997
A539: 3559 | B539: EOL VENTOS DE TIANGUÁ | C539: 12.773.911/0001-30 | D539: 2706.77 | E539: 0 | F539: 0 | G539: 0 | H539: 0 | I539: 0 | J539: 0 | K539: 2982.6700000000001 | L539: 0 | M539: =SUM(J539:L539)-275.9 -> 2706.77 | N539: 275.89999999999998 | O539: =SUM(M539:N539) -> 2982.6700000000001
A540: 3560 | B540: EOL VENTOS DE SANTO DIMAS | C540: 13.329.931/0001-80 | D540: 3052.3800000000001 | E540: 0 | F540: 0 | G540: 0 | H540: 0 | I540: 0 | J540: 0 | K540: 3363.5 | L540: 0 | M540: =SUM(J540:L540)-311.12 -> 3052.3800000000001 | N540: 311.12 | O540: =SUM(M540:N540) -> 3363.5
A541: 3561 | B541: EOL CABEÇO PRETO III | C541: 15.231.615/0001-04 | D541: 2749.48 | E541: 0 | F541: 0 | G541: 0 | H541: 0 | I541: 0 | J541: 0 | K541: 3029.73 | L541: 0 | M541: =SUM(J541:L541)-280.25 -> 2749.48 | N541: 280.25 | O541: =SUM(M541:N541) -> 3029.73
A542: 3562 | B542: EOL CABEÇO PRETO V | C542: 15.231.547/0001-75 | D542: 2714.9400000000001 | E542: 0 | F542: 0 | G542: 0 | H542: 0 | I542: 0 | J542: 0 | K542: 2991.6700000000001 | L542: 0 | M542: =SUM(J542:L542)-276.73 -> 2714.9400000000001 | N542: 276.73000000000002 | O542: =SUM(M542:N542) -> 2991.6700000000001
A543: 3563 | B543: EOL CABEÇO PRETO VI | C543: 15.231.479/0001-44 | D543: 1872.95 | E543: 0 | F543: 0 | G543: 0 | H543: 0 | I543: 0 | J543: 0 | K543: 2063.8600000000001 | L543: 0 | M543: =SUM(J543:L543)-190.91 -> 1872.95 | N543: 190.91 | O543: =SUM(M543:N543) -> 2063.8600000000001
A544: 3564 | B544: COPEL (UHE GOV PARIGOT) | C544: 04.370.282/0001-70 | D544: 49809.989999999998 | E544: 0 | F544: 0 | G544: 0 | H544: 0 | I544: 0 | J544: 0 | K544: 54887.040000000001 | L544: 0 | M544: =SUM(J544:L544)-5077.05 -> 49809.989999999998 | N544: 5077.0500000000002 | O544: =SUM(M544:N544) -> 54887.040000000001
A545: 3565 | B545: EOL AURA MANGUEIRA XI | C545: 19.869.512/0002-06 | D545: 842.97000000000003 | E545: 0 | F545: 0 | G545: 0 | H545: 0 | I545: 0 | J545: 0 | K545: 928.88999999999999 | L545: 0 | M545: =SUM(J545:L545)-85.92 -> 842.97000000000003 | N545: 85.920000000000002 | O545: =SUM(M545:N545) -> 928.88999999999999
A546: 3566 | B546: EOL CALANGO 6 | C546: 19.560.837/0002-02 | D546: 3634.6999999999998 | E546: 0 | F546: 0 | G546: 0 | H546: 0 | I546: 0 | J546: 0 | K546: 4005.1799999999998 | L546: 0 | M546: =SUM(J546:L546)-370.48 -> 3634.6999999999998 | N546: 370.48000000000002 | O546: =SUM(M546:N546) -> 4005.1799999999998
A547: 3567 | B547: EOL SANTANA I | C547: 19.560.874/0002-02 | D547: 3632.1900000000001 | E547: 0 | F547: 0 | G547: 0 | H547: 0 | I547: 0 | J547: 0 | K547: 4002.4099999999999 | L547: 0 | M547: =SUM(J547:L547)-370.22 -> 3632.1899999999996 | N547: 370.22000000000003 | O547: =SUM(M547:N547) -> 4002.4099999999999
A548: 3568 | B548: EOL SANTANA II | C548: 19.588.049/0002-16 | D548: 2903.6599999999999 | E548: 0 | F548: 0 | G548: 0 | H548: 0 | I548: 0 | J548: 0 | K548: 3199.6300000000001 | L548: 0 | M548: =SUM(J548:L548)-295.97 -> 2903.6599999999999 | N548: 295.97000000000003 | O548: =SUM(M548:N548) -> 3199.6300000000001
A549: 3569 | B549: EOL SANTA MÔNICA | C549: 12.053.687/0001-02 | D549: 2563.1799999999998 | E549: 0 | F549: 0 | G549: 0 | H549: 0 | I549: 0 | J549: 0 | K549: 2824.4400000000001 | L549: 0 | M549: =SUM(J549:L549)-261.26 -> 2563.1800000000003 | N549: 261.25999999999999 | O549: =SUM(M549:N549) -> 2824.4400000000005
A550: 3570 | B550: EOL VENTOS DE SÃO MARTINHO | C550: 13.330.011/0001-81 | D550: 1294.4100000000001 | E550: 0 | F550: 0 | G550: 0 | H550: 0 | I550: 0 | J550: 0 | K550: 1426.3499999999999 | L550: 0 | M550: =SUM(J550:L550)-131.94 -> 1294.4099999999999 | N550: 131.94 | O550: =SUM(M550:N550) -> 1426.3499999999999
A551: 3571 | B551: UFV CALDEIRÃO GRANDE II | C551: 12.960.094/0001-20 | D551: 3061.3200000000002 | E551: 0 | F551: 0 | G551: 0 | H551: 0 | I551: 0 | J551: 0 | K551: 3373.3600000000001 | L551: 0 | M551: =SUM(J551:L551)-312.04 -> 3061.3200000000002 | N551: 312.04000000000002 | O551: =SUM(M551:N551) -> 3373.3600000000001
A552: 3572 | B552: UFV CALDEIRÃO GRANDE I | C552: 12.960.103/0001-82 | D552: 3062.2800000000002 | E552: 0 | F552: 0 | G552: 0 | H552: 0 | I552: 0 | J552: 0 | K552: 3374.4099999999999 | L552: 0 | M552: =SUM(J552:L552)-312.13 -> 3062.2799999999997 | N552: 312.13 | O552: =SUM(M552:N552) -> 3374.4099999999999
A553: 3573 | B553: UFV CALDEIRÃO GRANDE III | C553: 12.964.095/0001-42 | D553: 3032.9000000000001 | E553: 0 | F553: 0 | G553: 0 | H553: 0 | I553: 0 | J553: 0 | K553: 3342.04 | L553: 0 | M553: =SUM(J553:L553)-309.14 -> 3032.9000000000001 | N553: 309.13999999999999 | O553: =SUM(M553:N553) -> 3342.04
A554: 3574 | B554: UFV CALDEIRÃO GRANDE VI | C554: 12.960.127/0001-31 | D554: 3032.9000000000001 | E554: 0 | F554: 0 | G554: 0 | H554: 0 | I554: 0 | J554: 0 | K554: 3342.04 | L554: 0 | M554: =SUM(J554:L554)-309.14 -> 3032.9000000000001 | N554: 309.13999999999999 | O554: =SUM(M554:N554) -> 3342.04
A555: 3575 | B555: UFV CALDEIRÃO GRANDE IV | C555: 10.656.568/0001-19 | D555: 3032.9000000000001 | E555: 0 | F555: 0 | G555: 0 | H555: 0 | I555: 0 | J555: 0 | K555: 3342.04 | L555: 0 | M555: =SUM(J555:L555)-309.14 -> 3032.9000000000001 | N555: 309.13999999999999 | O555: =SUM(M555:N555) -> 3342.04
A556: 3576 | B556: UFV CALDEIRÃO GRANDE VII | C556: 12.960.117/0001-04 | D556: 3053.4000000000001 | E556: 0 | F556: 0 | G556: 0 | H556: 0 | I556: 0 | J556: 0 | K556: 3364.6300000000001 | L556: 0 | M556: =SUM(J556:L556)-311.23 -> 3053.4000000000001 | N556: 311.23000000000002 | O556: =SUM(M556:N556) -> 3364.6300000000001
A557: 3577 | B557: PCH SERRA DOS CAVALINHOS I | C557: 09.199.675/0002-67 | D557: 2621.5999999999999 | E557: 0 | F557: 0 | G557: 0 | H557: 0 | I557: 0 | J557: 0 | K557: 2888.8200000000002 | L557: 0 | M557: =SUM(J557:L557)-267.22 -> 2621.6000000000004 | N557: 267.22000000000003 | O557: =SUM(M557:N557) -> 2888.8200000000006
A558: 3578 | B558: EOL AURA MANGUEIRA XV | C558: 19.944.650/0002-02 | D558: 1685.6600000000001 | E558: 0 | F558: 0 | G558: 0 | H558: 0 | I558: 0 | J558: 0 | K558: 1857.48 | L558: 0 | M558: =SUM(J558:L558)-171.82 -> 1685.6600000000001 | N558: 171.81999999999999 | O558: =SUM(M558:N558) -> 1857.48
A559: 3579 | B559: EOL AURA MIRIM IV | C559: 19.941.770/0002-48 | D559: 1404.8299999999999 | E559: 0 | F559: 0 | G559: 0 | H559: 0 | I559: 0 | J559: 0 | K559: 1548.02 | L559: 0 | M559: =SUM(J559:L559)-143.19 -> 1404.8299999999999 | N559: 143.19 | O559: =SUM(M559:N559) -> 1548.02
A560: 3580 | B560: EOL SANTA ÚRSULA | C560: 12.053.891/0001-23 | D560: 2389.6199999999999 | E560: 0 | F560: 0 | G560: 0 | H560: 0 | I560: 0 | J560: 0 | K560: 2633.1900000000001 | L560: 0 | M560: =SUM(J560:L560)-243.57 -> 2389.6199999999999 | N560: 243.56999999999999 | O560: =SUM(M560:N560) -> 2633.1900000000001
A561: 3581 | B561: EOL VENTOS DE SANTO AUGUSTO VIII | C561: 14.676.003/0002-35 | D561: 1708.72 | E561: 0 | F561: 0 | G561: 0 | H561: 0 | I561: 0 | J561: 0 | K561: 1882.8900000000001 | L561: 0 | M561: =SUM(J561:L561)-174.17 -> 1708.72 | N561: 174.16999999999999 | O561: =SUM(M561:N561) -> 1882.8900000000001
A562: 3582 | B562: EOL VENTOS DE SANTO AUGUSTO II | C562: 15.673.911/0002-38 | D562: 2521.3499999999999 | E562: 0 | F562: 0 | G562: 0 | H562: 0 | I562: 0 | J562: 0 | K562: 2778.3499999999999 | L562: 0 | M562: =SUM(J562:L562)-257 -> 2521.3499999999999 | N562: 257 | O562: =SUM(M562:N562) -> 2778.3499999999999
A563: 3583 | B563: EOL VENTOS DE SANTO ESTEVAO V | C563: 15.674.805/0002-79 | D563: 2521.3499999999999 | E563: 0 | F563: 0 | G563: 0 | H563: 0 | I563: 0 | J563: 0 | K563: 2778.3499999999999 | L563: 0 | M563: =SUM(J563:L563)-257 -> 2521.3499999999999 | N563: 257 | O563: =SUM(M563:N563) -> 2778.3499999999999
A564: 3584 | B564: EOL VENTOS DE SANTO ESTEVAO III | C564: 15.674.836/0002-20 | D564: 2731.0700000000002 | E564: 0 | F564: 0 | G564: 0 | H564: 0 | I564: 0 | J564: 0 | K564: 3009.4400000000001 | L564: 0 | M564: =SUM(J564:L564)-278.37 -> 2731.0700000000002 | N564: 278.37 | O564: =SUM(M564:N564) -> 3009.4400000000001
A565: 3585 | B565: EOL AURA MANGUEIRA XII | C565: 19.888.199/0002-45 | D565: 1404.72 | E565: 0 | F565: 0 | G565: 0 | H565: 0 | I565: 0 | J565: 0 | K565: 1547.9000000000001 | L565: 0 | M565: =SUM(J565:L565)-143.18 -> 1404.72 | N565: 143.18000000000001 | O565: =SUM(M565:N565) -> 1547.9000000000001
A566: 3586 | B566: EOL AURA MANGUEIRA XIII | C566: 19.868.433/0002-72 | D566: 1404.3499999999999 | E566: 0 | F566: 0 | G566: 0 | H566: 0 | I566: 0 | J566: 0 | K566: 1547.49 | L566: 0 | M566: =SUM(J566:L566)-143.14 -> 1404.3499999999999 | N566: 143.13999999999999 | O566: =SUM(M566:N566) -> 1547.4899999999998
A567: 3587 | B567: UFV ITUVERAVA 1 E 2 | C567: 21.619.094/0003-13 | D567: 2334.1999999999998 | E567: 0 | F567: 0 | G567: 0 | H567: 0 | I567: 0 | J567: 0 | K567: 2572.1199999999999 | L567: 0 | M567: =SUM(J567:L567)-237.92 -> 2334.1999999999998 | N567: 237.91999999999999 | O567: =SUM(M567:N567) -> 2572.1199999999999
A568: 3588 | B568: EOL PONTAL 2A | C568: 15.355.380/0001-54 | D568: 1677.97 | E568: 0 | F568: 0 | G568: 0 | H568: 0 | I568: 0 | J568: 0 | K568: 1849 | L568: 0 | M568: =SUM(J568:L568)-171.03 -> 1677.97 | N568: 171.03 | O568: =SUM(M568:N568) -> 1849
A569: 3589 | B569: EOL PONTAL 2B | C569: 12.752.290/0001-09 | D569: 768.47000000000003 | E569: 0 | F569: 0 | G569: 0 | H569: 0 | I569: 0 | J569: 0 | K569: 846.79999999999995 | L569: 0 | M569: =SUM(J569:L569)-78.33 -> 768.46999999999991 | N569: 78.329999999999998 | O569: =SUM(M569:N569) -> 846.79999999999995
A570: 3590 | B570: EOL PONTAL 3B | C570: 15.355.485/0001-03 | D570: 2257.9000000000001 | E570: 0 | F570: 0 | G570: 0 | H570: 0 | I570: 0 | J570: 0 | K570: 2488.04 | L570: 0 | M570: =SUM(J570:L570)-230.14 -> 2257.9000000000001 | N570: 230.13999999999999 | O570: =SUM(M570:N570) -> 2488.04
A571: 3591 | B571: CEMIG (UHE TRES MARIAS) | C571: 06.981.176/0001-58 | D571: 76767.619999999995 | E571: 0 | F571: 0 | G571: 0 | H571: 0 | I571: 0 | J571: 0 | K571: 84592.419999999998 | L571: 0 | M571: =SUM(J571:L571)-7824.8 -> 76767.619999999995 | N571: 7824.8000000000002 | O571: =SUM(M571:N571) -> 84592.419999999998
A572: 3592 | B572: EOL AURA MANGUEIRA XVII | C572: 19.896.691/0002-62 | D572: 1404.3499999999999 | E572: 0 | F572: 0 | G572: 0 | H572: 0 | I572: 0 | J572: 0 | K572: 1547.49 | L572: 0 | M572: =SUM(J572:L572)-143.14 -> 1404.3499999999999 | N572: 143.13999999999999 | O572: =SUM(M572:N572) -> 1547.4899999999998
A573: 3593 | B573: EOL AURA MIRIM VI | C573: 19.891.491/0002-17 | D573: 842.28999999999996 | E573: 0 | F573: 0 | G573: 0 | H573: 0 | I573: 0 | J573: 0 | K573: 928.13999999999999 | L573: 0 | M573: =SUM(J573:L573)-85.85 -> 842.28999999999996 | N573: 85.849999999999994 | O573: =SUM(M573:N573) -> 928.13999999999999
A574: 3594 | B574: EOL AURA MIRIM VIII | C574: 19.917.214/0002-36 | D574: 842.28999999999996 | E574: 0 | F574: 0 | G574: 0 | H574: 0 | I574: 0 | J574: 0 | K574: 928.13999999999999 | L574: 0 | M574: =SUM(J574:L574)-85.85 -> 842.28999999999996 | N574: 85.849999999999994 | O574: =SUM(M574:N574) -> 928.13999999999999
A575: 3595 | B575: EOL BONS VENTOS CACIMBAS 2 | C575: 19.953.139/0002-69 | D575: 2078.3000000000002 | E575: 0 | F575: 0 | G575: 0 | H575: 0 | I575: 0 | J575: 0 | K575: 2290.1399999999999 | L575: 0 | M575: =SUM(J575:L575)-211.84 -> 2078.2999999999997 | N575: 211.84 | O575: =SUM(M575:N575) -> 2290.1399999999999
A576: 3596 | B576: EOL VENTOS DE SANTO AUGUSTO I | C576: 15.674.987/0002-88 | D576: 1680.3699999999999 | E576: 0 | F576: 0 | G576: 0 | H576: 0 | I576: 0 | J576: 0 | K576: 1851.6500000000001 | L576: 0 | M576: =SUM(J576:L576)-171.28 -> 1680.3700000000001 | N576: 171.28 | O576: =SUM(M576:N576) -> 1851.6500000000001
A577: 3597 | B577: EOL VENTOS DE SANTO AUGUSTO VII | C577: 15.673.881/0002-60 | D577: 1680.3699999999999 | E577: 0 | F577: 0 | G577: 0 | H577: 0 | I577: 0 | J577: 0 | K577: 1851.6500000000001 | L577: 0 | M577: =SUM(J577:L577)-171.28 -> 1680.3700000000001 | N577: 171.28 | O577: =SUM(M577:N577) -> 1851.6500000000001
A578: 3598 | B578: EOL VENTOS DE SÃO VIRGÍLIO 02 | C578: 21.480.086/0002-58 | D578: 3133.1799999999998 | E578: 0 | F578: 0 | G578: 0 | H578: 0 | I578: 0 | J578: 0 | K578: 3452.54 | L578: 0 | M578: =SUM(J578:L578)-319.36 -> 3133.1799999999998 | N578: 319.36000000000001 | O578: =SUM(M578:N578) -> 3452.54
A579: 3599 | B579: UFV ITUVERAVA 3 E 4 | C579: 21.602.288/0003-06 | D579: 2493.0799999999999 | E579: 0 | F579: 0 | G579: 0 | H579: 0 | I579: 0 | J579: 0 | K579: 2747.1999999999998 | L579: 0 | M579: =SUM(J579:L579)-254.12 -> 2493.0799999999999 | N579: 254.12 | O579: =SUM(M579:N579) -> 2747.1999999999998
A580: 3600 | B580: UFV ITUVERAVA 5 6 E 7 | C580: 21.619.125/0003-36 | D580: 3607.2199999999998 | E580: 0 | F580: 0 | G580: 0 | H580: 0 | I580: 0 | J580: 0 | K580: 3974.9000000000001 | L580: 0 | M580: =SUM(J580:L580)-367.68 -> 3607.2200000000003 | N580: 367.68000000000001 | O580: =SUM(M580:N580) -> 3974.9000000000001
A581: 3601 | B581: UTE CARAMURU | C581: 00.080.671/0001-00 | D581: 950.16999999999996 | E581: 0 | F581: 0 | G581: 0 | H581: 0 | I581: 0 | J581: 0 | K581: 1047.02 | L581: 0 | M581: =SUM(J581:L581)-96.85 -> 950.16999999999996 | N581: 96.849999999999994 | O581: =SUM(M581:N581) -> 1047.02
A582: 3602 | B582: EOL VENTOS DE SANTO ONOFRE IV | C582: 21.480.328/0002-03 | D582: 2851.9899999999998 | E582: 0 | F582: 0 | G582: 0 | H582: 0 | I582: 0 | J582: 0 | K582: 3142.6900000000001 | L582: 0 | M582: =SUM(J582:L582)-290.7 -> 2851.9900000000002 | N582: 290.69999999999999 | O582: =SUM(M582:N582) -> 3142.6900000000001
A583: 3603 | B583: EOL VENTOS DE SANTO AUGUSTO VI | C583: 15.673.793/0002-68 | D583: 2731.0700000000002 | E583: 0 | F583: 0 | G583: 0 | H583: 0 | I583: 0 | J583: 0 | K583: 3009.4400000000001 | L583: 0 | M583: =SUM(J583:L583)-278.37 -> 2731.0700000000002 | N583: 278.37 | O583: =SUM(M583:N583) -> 3009.4400000000001
A584: 3604 | B584: EOL AURA MANGUEIRA IV | C584: 19.869.355/0002-20 | D584: 1967.1099999999999 | E584: 0 | F584: 0 | G584: 0 | H584: 0 | I584: 0 | J584: 0 | K584: 2167.6100000000001 | L584: 0 | M584: =SUM(J584:L584)-200.5 -> 1967.1100000000001 | N584: 200.5 | O584: =SUM(M584:N584) -> 2167.6100000000001
A585: 3605 | B585: EOL VENTOS DE SÃO VIRGÍLIO 01 | C585: 21.479.982/0002-05 | D585: 3089.21 | E585: 0 | F585: 0 | G585: 0 | H585: 0 | I585: 0 | J585: 0 | K585: 3404.0900000000001 | L585: 0 | M585: =SUM(J585:L585)-314.88 -> 3089.21 | N585: 314.88 | O585: =SUM(M585:N585) -> 3404.0900000000001
A586: 3606 | B586: EOL VILA ACRE I | C586: 24.061.085/0001-86 | D586: 2409.4000000000001 | E586: 0 | F586: 0 | G586: 0 | H586: 0 | I586: 0 | J586: 0 | K586: 2654.9899999999998 | L586: 0 | M586: =SUM(J586:L586)-245.59 -> 2409.3999999999996 | N586: 245.59 | O586: =SUM(M586:N586) -> 2654.9899999999998
A587: 3607 | B587: EOL AURA MANGUEIRA VI | C587: 19.888.311/0002-48 | D587: 2530.4400000000001 | E587: 0 | F587: 0 | G587: 0 | H587: 0 | I587: 0 | J587: 0 | K587: 2788.3600000000001 | L587: 0 | M587: =SUM(J587:L587)-257.92 -> 2530.4400000000001 | N587: 257.92000000000002 | O587: =SUM(M587:N587) -> 2788.3600000000001
A588: 3608 | B588: EOL PEDRA CHEIROSA | C588: 10.883.378/0001-34 | D588: 2176.46 | E588: 0 | F588: 0 | G588: 0 | H588: 0 | I588: 0 | J588: 0 | K588: 2398.3000000000002 | L588: 0 | M588: =SUM(J588:L588)-221.84 -> 2176.46 | N588: 221.84 | O588: =SUM(M588:N588) -> 2398.3000000000002
A589: 3609 | B589: UFV NOVA OLINDA 8 | C589: 23.566.105/0003-70 | D589: 1096.73 | E589: 0 | F589: 0 | G589: 0 | H589: 0 | I589: 0 | J589: 0 | K589: 1208.52 | L589: 0 | M589: =SUM(J589:L589)-111.79 -> 1096.73 | N589: 111.79000000000001 | O589: =SUM(M589:N589) -> 1208.52
A590: 3610 | B590: UFV NOVA OLINDA 10 | C590: 23.416.727/0003-11 | D590: 1096.8 | E590: 0 | F590: 0 | G590: 0 | H590: 0 | I590: 0 | J590: 0 | K590: 1208.5999999999999 | L590: 0 | M590: =SUM(J590:L590)-111.8 -> 1096.8 | N590: 111.8 | O590: =SUM(M590:N590) -> 1208.5999999999999
A591: 3611 | B591: UFV NOVA OLINDA 12 | C591: 23.414.549/0003-90 | D591: 1100.03 | E591: 0 | F591: 0 | G591: 0 | H591: 0 | I591: 0 | J591: 0 | K591: 1212.1500000000001 | L591: 0 | M591: =SUM(J591:L591)-112.12 -> 1100.0300000000002 | N591: 112.12 | O591: =SUM(M591:N591) -> 1212.1500000000001
A592: 3612 | B592: UFV NOVA OLINDA 14 | C592: 23.399.563/0003-61 | D592: 1092.97 | E592: 0 | F592: 0 | G592: 0 | H592: 0 | I592: 0 | J592: 0 | K592: 1204.3699999999999 | L592: 0 | M592: =SUM(J592:L592)-111.4 -> 1092.9699999999998 | N592: 111.40000000000001 | O592: =SUM(M592:N592) -> 1204.3699999999999
A593: 3613 | B593: EOL DELTA 3 I | C593: 23.598.517/0002-00 | D593: 2067.2399999999998 | E593: 0 | F593: 0 | G593: 0 | H593: 0 | I593: 0 | J593: 0 | K593: 2277.9499999999998 | L593: 0 | M593: =SUM(J593:L593)-210.71 -> 2067.2399999999998 | N593: 210.71000000000001 | O593: =SUM(M593:N593) -> 2277.9499999999998
A594: 3614 | B594: EOL DELTA 3 II | C594: 23.598.858/0002-86 | D594: 2067.2399999999998 | E594: 0 | F594: 0 | G594: 0 | H594: 0 | I594: 0 | J594: 0 | K594: 2277.9499999999998 | L594: 0 | M594: =SUM(J594:L594)-210.71 -> 2067.2399999999998 | N594: 210.71000000000001 | O594: =SUM(M594:N594) -> 2277.9499999999998
A595: 3615 | B595: EOL DELTA 3 III | C595: 23.598.847/0002-04 | D595: 2067.2399999999998 | E595: 0 | F595: 0 | G595: 0 | H595: 0 | I595: 0 | J595: 0 | K595: 2277.9499999999998 | L595: 0 | M595: =SUM(J595:L595)-210.71 -> 2067.2399999999998 | N595: 210.71000000000001 | O595: =SUM(M595:N595) -> 2277.9499999999998
A596: 3616 | B596: EOL VENTOS DE SÃO VICENTE 14 | C596: 21.869.347/0001-45 | D596: 2697.3200000000002 | E596: 0 | F596: 0 | G596: 0 | H596: 0 | I596: 0 | J596: 0 | K596: 2972.25 | L596: 0 | M596: =SUM(J596:L596)-274.93 -> 2697.3200000000002 | N596: 274.93000000000001 | O596: =SUM(M596:N596) -> 2972.25
A597: 3617 | B597: EOL DELTA 3 V | C597: 23.598.829/0002-14 | D597: 2067.2399999999998 | E597: 0 | F597: 0 | G597: 0 | H597: 0 | I597: 0 | J597: 0 | K597: 2277.9499999999998 | L597: 0 | M597: =SUM(J597:L597)-210.71 -> 2067.2399999999998 | N597: 210.71000000000001 | O597: =SUM(M597:N597) -> 2277.9499999999998
A598: 3618 | B598: EOL DELTA 3 VI | C598: 23.598.831/0002-93 | D598: 2067.2399999999998 | E598: 0 | F598: 0 | G598: 0 | H598: 0 | I598: 0 | J598: 0 | K598: 2277.9499999999998 | L598: 0 | M598: =SUM(J598:L598)-210.71 -> 2067.2399999999998 | N598: 210.71000000000001 | O598: =SUM(M598:N598) -> 2277.9499999999998
A599: 3619 | B599: EOL DELTA 3 VII | C599: 23.598.844/0002-62 | D599: 2071.6399999999999 | E599: 0 | F599: 0 | G599: 0 | H599: 0 | I599: 0 | J599: 0 | K599: 2282.8000000000002 | L599: 0 | M599: =SUM(J599:L599)-211.16 -> 2071.6400000000003 | N599: 211.16 | O599: =SUM(M599:N599) -> 2282.8000000000002
A600: 3620 | B600: EOL DELTA 3 VIII | C600: 15.190.472/0002-02 | D600: 2216.6799999999998 | E600: 0 | F600: 0 | G600: 0 | H600: 0 | I600: 0 | J600: 0 | K600: 2442.6199999999999 | L600: 0 | M600: =SUM(J600:L600)-225.94 -> 2216.6799999999998 | N600: 225.94 | O600: =SUM(M600:N600) -> 2442.6199999999999
A601: 3621 | B601: EOL VENTOS DE SANTO ESTEVAO I | C601: 16.712.566/0002-67 | D601: 2310.6900000000001 | E601: 0 | F601: 0 | G601: 0 | H601: 0 | I601: 0 | J601: 0 | K601: 2546.21 | L601: 0 | M601: =SUM(J601:L601)-235.52 -> 2310.6900000000001 | N601: 235.52000000000001 | O601: =SUM(M601:N601) -> 2546.21
A602: 3622 | B602: EOL VENTOS DE SANTO ESTEVAO II | C602: 16.603.387/0002-91 | D602: 2310.6900000000001 | E602: 0 | F602: 0 | G602: 0 | H602: 0 | I602: 0 | J602: 0 | K602: 2546.21 | L602: 0 | M602: =SUM(J602:L602)-235.52 -> 2310.6900000000001 | N602: 235.52000000000001 | O602: =SUM(M602:N602) -> 2546.21
A603: 3623 | B603: EOL VENTOS DE SANTO ESTEVAO IV | C603: 21.480.026/0002-35 | D603: 3089.21 | E603: 0 | F603: 0 | G603: 0 | H603: 0 | I603: 0 | J603: 0 | K603: 3404.0900000000001 | L603: 0 | M603: =SUM(J603:L603)-314.88 -> 3089.21 | N603: 314.88 | O603: =SUM(M603:N603) -> 3404.0900000000001
A604: 3624 | B604: UFV LAPA 2 | C604: 23.509.564/0002-30 | D604: 1151.9300000000001 | E604: 0 | F604: 0 | G604: 0 | H604: 0 | I604: 0 | J604: 0 | K604: 1269.3399999999999 | L604: 0 | M604: =SUM(J604:L604)-117.41 -> 1151.9299999999998 | N604: 117.41 | O604: =SUM(M604:N604) -> 1269.3399999999999
A605: 3625 | B605: EOL PEDRA CHEIROSA II | C605: 10.883.587/0001-88 | D605: 1990.8699999999999 | E605: 0 | F605: 0 | G605: 0 | H605: 0 | I605: 0 | J605: 0 | K605: 2193.8000000000002 | L605: 0 | M605: =SUM(J605:L605)-202.93 -> 1990.8700000000001 | N605: 202.93000000000001 | O605: =SUM(M605:N605) -> 2193.8000000000002
A606: 3626 | B606: EOL DELTA 3 IV | C606: 23.598.842/0002-73 | D606: 2067.2399999999998 | E606: 0 | F606: 0 | G606: 0 | H606: 0 | I606: 0 | J606: 0 | K606: 2277.9499999999998 | L606: 0 | M606: =SUM(J606:L606)-210.71 -> 2067.2399999999998 | N606: 210.71000000000001 | O606: =SUM(M606:N606) -> 2277.9499999999998
A607: 3627 | B607: EOL CRISTALÂNDIA I | C607: 22.499.471/0003-90 | D607: 2611.8299999999999 | E607: 0 | F607: 0 | G607: 0 | H607: 0 | I607: 0 | J607: 0 | K607: 2878.0500000000002 | L607: 0 | M607: =SUM(J607:L607)-266.22 -> 2611.8299999999999 | N607: 266.22000000000003 | O607: =SUM(M607:N607) -> 2878.0500000000002
A608: 3628 | B608: EOL CRISTALÂNDIA II | C608: 23.049.225/0003-08 | D608: 2611.8299999999999 | E608: 0 | F608: 0 | G608: 0 | H608: 0 | I608: 0 | J608: 0 | K608: 2878.0500000000002 | L608: 0 | M608: =SUM(J608:L608)-266.22 -> 2611.8299999999999 | N608: 266.22000000000003 | O608: =SUM(M608:N608) -> 2878.0500000000002
A609: 3629 | B609: EOL DELFINA IV | C609: 21.553.603/0003-52 | D609: 891.73000000000002 | E609: 0 | F609: 0 | G609: 0 | H609: 0 | I609: 0 | J609: 0 | K609: 982.62 | L609: 0 | M609: =SUM(J609:L609)-90.89 -> 891.73000000000002 | N609: 90.890000000000001 | O609: =SUM(M609:N609) -> 982.62
A610: 3630 | B610: EOL DELFINA V | C610: 21.552.886/0003-18 | D610: 9002.75 | E610: 0 | F610: 0 | G610: 0 | H610: 0 | I610: 0 | J610: 0 | K610: 9920.3899999999994 | L610: 0 | M610: =SUM(J610:L610)-917.64 -> 9002.75 | N610: 917.63999999999999 | O610: =SUM(M610:N610) -> 9920.3899999999994
A611: 3631 | B611: EOL VENTOS DE SÃO VIRGÍLIO 03 | C611: 21.480.051/0002-19 | D611: 2054.7800000000002 | E611: 0 | F611: 0 | G611: 0 | H611: 0 | I611: 0 | J611: 0 | K611: 2264.2199999999998 | L611: 0 | M611: =SUM(J611:L611)-209.44 -> 2054.7799999999997 | N611: 209.44 | O611: =SUM(M611:N611) -> 2264.2199999999998
A612: 3632 | B612: ELETRONORTE (UTE MAUA 3) | C612: 00.357.038/0001-16 | D612: 65261.540000000001 | E612: 0 | F612: 0 | G612: 0 | H612: 0 | I612: 0 | J612: 0 | K612: 71913.539999999994 | L612: 0 | M612: =SUM(J612:L612)-6652 -> 65261.539999999994 | N612: 6652 | O612: =SUM(M612:N612) -> 71913.539999999994
A613: 3633 | B613: EOL DREEN CUTIA | C613: 21.917.808/0001-08 | D613: 2272.0300000000002 | E613: 0 | F613: 0 | G613: 0 | H613: 0 | I613: 0 | J613: 0 | K613: 2503.6100000000001 | L613: 0 | M613: =SUM(J613:L613)-231.58 -> 2272.0300000000002 | N613: 231.58000000000001 | O613: =SUM(M613:N613) -> 2503.6100000000001
A614: 3634 | B614: EOL DREEN GUAJIRU | C614: 21.957.870/0001-23 | D614: 2074.9000000000001 | E614: 0 | F614: 0 | G614: 0 | H614: 0 | I614: 0 | J614: 0 | K614: 2286.3899999999999 | L614: 0 | M614: =SUM(J614:L614)-211.49 -> 2074.8999999999996 | N614: 211.49000000000001 | O614: =SUM(M614:N614) -> 2286.3899999999994
A615: 3635 | B615: EOL GE JANGADA | C615: 21.957.722/0001-09 | D615: 2696.8600000000001 | E615: 0 | F615: 0 | G615: 0 | H615: 0 | I615: 0 | J615: 0 | K615: 2971.75 | L615: 0 | M615: =SUM(J615:L615)-274.89 -> 2696.8600000000001 | N615: 274.88999999999999 | O615: =SUM(M615:N615) -> 2971.75
A616: 3636 | B616: EOL GE MARIA HELENA | C616: 21.909.793/0001-36 | D616: 2696.8600000000001 | E616: 0 | F616: 0 | G616: 0 | H616: 0 | I616: 0 | J616: 0 | K616: 2971.75 | L616: 0 | M616: =SUM(J616:L616)-274.89 -> 2696.8600000000001 | N616: 274.88999999999999 | O616: =SUM(M616:N616) -> 2971.75
A617: 3637 | B617: EOL POTIGUAR | C617: 21.957.968/0001-80 | D617: 2696.8600000000001 | E617: 0 | F617: 0 | G617: 0 | H617: 0 | I617: 0 | J617: 0 | K617: 2971.75 | L617: 0 | M617: =SUM(J617:L617)-274.89 -> 2696.8600000000001 | N617: 274.88999999999999 | O617: =SUM(M617:N617) -> 2971.75
A618: 3638 | B618: EOL ESPERANÇA DO NORDESTE | C618: 21.916.951/0001-85 | D618: 2696.8600000000001 | E618: 0 | F618: 0 | G618: 0 | H618: 0 | I618: 0 | J618: 0 | K618: 2971.75 | L618: 0 | M618: =SUM(J618:L618)-274.89 -> 2696.8600000000001 | N618: 274.88999999999999 | O618: =SUM(M618:N618) -> 2971.75
A619: 3639 | B619: EOL PARAÍSO DOS V DO NORDESTE | C619: 21.909.032/0001-84 | D619: 2696.8600000000001 | E619: 0 | F619: 0 | G619: 0 | H619: 0 | I619: 0 | J619: 0 | K619: 2971.75 | L619: 0 | M619: =SUM(J619:L619)-274.89 -> 2696.8600000000001 | N619: 274.88999999999999 | O619: =SUM(M619:N619) -> 2971.75
A620: 3640 | B620: EOL TAMANDUA MIRIM 2 | C620: 33.541.368/0001-16 | D620: 1555.8 | E620: 0 | F620: 0 | G620: 0 | H620: 0 | I620: 0 | J620: 0 | K620: 1714.3800000000001 | L620: 0 | M620: =SUM(J620:L620)-158.58 -> 1555.8000000000002 | N620: 158.58000000000001 | O620: =SUM(M620:N620) -> 1714.3800000000001
A621: 3641 | B621: EOL PAPAGAIO | C621: 33.541.368/0001-16 | D621: 886.27999999999997 | E621: 0 | F621: 0 | G621: 0 | H621: 0 | I621: 0 | J621: 0 | K621: 976.62 | L621: 0 | M621: =SUM(J621:L621)-90.34 -> 886.27999999999997 | N621: 90.340000000000003 | O621: =SUM(M621:N621) -> 976.62
A622: 3642 | B622: EOL CORRUPIAO 3 | C622: 33.541.368/0001-16 | D622: 890.77999999999997 | E622: 0 | F622: 0 | G622: 0 | H622: 0 | I622: 0 | J622: 0 | K622: 981.58000000000004 | L622: 0 | M622: =SUM(J622:L622)-90.8 -> 890.78000000000009 | N622: 90.799999999999997 | O622: =SUM(M622:N622) -> 981.58000000000004
A623: 3643 | B623: EOL COQUEIRINHO 2 | C623: 33.541.368/0001-16 | D623: 1420.5999999999999 | E623: 0 | F623: 0 | G623: 0 | H623: 0 | I623: 0 | J623: 0 | K623: 1565.4000000000001 | L623: 0 | M623: =SUM(J623:L623)-144.8 -> 1420.6000000000001 | N623: 144.80000000000001 | O623: =SUM(M623:N623) -> 1565.4000000000001
A624: 3644 | B624: EOL CARCARÁ | C624: 33.541.368/0001-16 | D624: 892.25999999999999 | E624: 0 | F624: 0 | G624: 0 | H624: 0 | I624: 0 | J624: 0 | K624: 983.21000000000004 | L624: 0 | M624: =SUM(J624:L624)-90.95 -> 892.25999999999999 | N624: 90.950000000000003 | O624: =SUM(M624:N624) -> 983.21000000000004
A625: 3645 | B625: EOL CAITITU 2 | C625: 33.541.368/0001-16 | D625: 892.61000000000001 | E625: 0 | F625: 0 | G625: 0 | H625: 0 | I625: 0 | J625: 0 | K625: 983.59000000000003 | L625: 0 | M625: =SUM(J625:L625)-90.98 -> 892.61000000000001 | N625: 90.980000000000004 | O625: =SUM(M625:N625) -> 983.59000000000003
A626: 3646 | B626: EOL CAITITU 3 | C626: 33.541.368/0001-16 | D626: 892.61000000000001 | E626: 0 | F626: 0 | G626: 0 | H626: 0 | I626: 0 | J626: 0 | K626: 983.59000000000003 | L626: 0 | M626: =SUM(J626:L626)-90.98 -> 892.61000000000001 | N626: 90.980000000000004 | O626: =SUM(M626:N626) -> 983.59000000000003
A627: 3647 | B627: EOL ANGICAL 2 | C627: 33.541.368/0001-16 | D627: 892.61000000000001 | E627: 0 | F627: 0 | G627: 0 | H627: 0 | I627: 0 | J627: 0 | K627: 983.59000000000003 | L627: 0 | M627: =SUM(J627:L627)-90.98 -> 892.61000000000001 | N627: 90.980000000000004 | O627: =SUM(M627:N627) -> 983.59000000000003
A628: 3648 | B628: EOL ARAPAPÁ | C628: 33.541.368/0001-16 | D628: 356.54000000000002 | E628: 0 | F628: 0 | G628: 0 | H628: 0 | I628: 0 | J628: 0 | K628: 392.88 | L628: 0 | M628: =SUM(J628:L628)-36.34 -> 356.53999999999996 | N628: 36.340000000000003 | O628: =SUM(M628:N628) -> 392.88
A629: 3649 | B629: EOL ACAUÃ | C629: 33.541.368/0001-16 | D629: 568.58000000000004 | E629: 0 | F629: 0 | G629: 0 | H629: 0 | I629: 0 | J629: 0 | K629: 626.52999999999997 | L629: 0 | M629: =SUM(J629:L629)-57.95 -> 568.57999999999993 | N629: 57.950000000000003 | O629: =SUM(M629:N629) -> 626.52999999999997
A630: 3650 | B630: EOL TEIU 2 | C630: 33.541.368/0001-16 | D630: 717.65999999999997 | E630: 0 | F630: 0 | G630: 0 | H630: 0 | I630: 0 | J630: 0 | K630: 790.80999999999995 | L630: 0 | M630: =SUM(J630:L630)-73.15 -> 717.65999999999997 | N630: 73.150000000000006 | O630: =SUM(M630:N630) -> 790.80999999999995
A631: 3672 | B631: RENOVA (EOL ANGICO) | C631: 18.870.073/0001-08 | D631: 691.04999999999995 | E631: 0 | F631: 0 | G631: 0 | H631: 0 | I631: 0 | J631: 0 | K631: 761.49000000000001 | L631: 0 | M631: =SUM(J631:L631)-70.44 -> 691.04999999999995 | N631: 70.439999999999998 | O631: =SUM(M631:N631) -> 761.49000000000001
A632: 3673 | B632: RENOVA (EOL SABIU) | C632: 17.305.829/0001-03 | D632: 1177.8299999999999 | E632: 0 | F632: 0 | G632: 0 | H632: 0 | I632: 0 | J632: 0 | K632: 1297.8800000000001 | L632: 0 | M632: =SUM(J632:L632)-120.05 -> 1177.8300000000002 | N632: 120.05 | O632: =SUM(M632:N632) -> 1297.8800000000001
A633: 3674 | B633: RENOVA (EOL PAU D’ÁGUA) | C633: 17.250.513/0001-53 | D633: 1564.9100000000001 | E633: 0 | F633: 0 | G633: 0 | H633: 0 | I633: 0 | J633: 0 | K633: 1724.4200000000001 | L633: 0 | M633: =SUM(J633:L633)-159.51 -> 1564.9100000000001 | N633: 159.50999999999999 | O633: =SUM(M633:N633) -> 1724.4200000000001
A634: 3675 | B634: RENOVA (EOL MANINEIRO) | C634: 18.560.162/0001-40 | D634: 1203.77 | E634: 0 | F634: 0 | G634: 0 | H634: 0 | I634: 0 | J634: 0 | K634: 1326.47 | L634: 0 | M634: =SUM(J634:L634)-122.7 -> 1203.77 | N634: 122.7 | O634: =SUM(M634:N634) -> 1326.47
A635: 3676 | B635: RENOVA (EOL FACHEIO) | C635: 18.559.964/0001-30 | D635: 1434.72 | E635: 0 | F635: 0 | G635: 0 | H635: 0 | I635: 0 | J635: 0 | K635: 1580.96 | L635: 0 | M635: =SUM(J635:L635)-146.24 -> 1434.72 | N635: 146.24000000000001 | O635: =SUM(M635:N635) -> 1580.96
A636: 3677 | B636: RENOVA (EOL UMBUZEIRO) | C636: 18.560.273/0001-56 | D636: 1640.7 | E636: 0 | F636: 0 | G636: 0 | H636: 0 | I636: 0 | J636: 0 | K636: 1807.9300000000001 | L636: 0 | M636: =SUM(J636:L636)-167.23 -> 1640.7 | N636: 167.22999999999999 | O636: =SUM(M636:N636) -> 1807.9300000000001
A637: 3678 | B637: RENOVA (EOL CEDRO) | C637: 17.330.840/0001-15 | D637: 1053.47 | E637: 0 | F637: 0 | G637: 0 | H637: 0 | I637: 0 | J637: 0 | K637: 1160.8499999999999 | L637: 0 | M637: =SUM(J637:L637)-107.38 -> 1053.4699999999998 | N637: 107.38 | O637: =SUM(M637:N637) -> 1160.8499999999999
A638: 3679 | B638: RENOVA (EOL JATAÍ) | C638: 18.560.347/0001-54 | D638: 1408.8699999999999 | E638: 0 | F638: 0 | G638: 0 | H638: 0 | I638: 0 | J638: 0 | K638: 1552.47 | L638: 0 | M638: =SUM(J638:L638)-143.6 -> 1408.8700000000001 | N638: 143.59999999999999 | O638: =SUM(M638:N638) -> 1552.47
A639: 3680 | B639: RENOVA (EOL BARBATIMÃO) | C639: 19.502.908/0001-21 | D639: 1408.8699999999999 | E639: 0 | F639: 0 | G639: 0 | H639: 0 | I639: 0 | J639: 0 | K639: 1552.47 | L639: 0 | M639: =SUM(J639:L639)-143.6 -> 1408.8700000000001 | N639: 143.59999999999999 | O639: =SUM(M639:N639) -> 1552.47
A640: 3681 | B640: RENOVA (EOL IMBURANA MACHO) | C640: 19.502.538/0001-22 | D640: 1408.8699999999999 | E640: 0 | F640: 0 | G640: 0 | H640: 0 | I640: 0 | J640: 0 | K640: 1552.47 | L640: 0 | M640: =SUM(J640:L640)-143.6 -> 1408.8700000000001 | N640: 143.59999999999999 | O640: =SUM(M640:N640) -> 1552.47
A641: 3682 | B641: RENOVA (EOL AMESCLA) | C641: 19.502.635/0001-15 | D641: 1173.46 | E641: 0 | F641: 0 | G641: 0 | H641: 0 | I641: 0 | J641: 0 | K641: 1293.0699999999999 | L641: 0 | M641: =SUM(J641:L641)-119.61 -> 1173.46 | N641: 119.61 | O641: =SUM(M641:N641) -> 1293.0699999999999
A642: 3683 | B642: RENOVA (EOL JUAZEIRO) | C642: 19.502.341/0001-93 | D642: 1643.3800000000001 | E642: 0 | F642: 0 | G642: 0 | H642: 0 | I642: 0 | J642: 0 | K642: 1810.8900000000001 | L642: 0 | M642: =SUM(J642:L642)-167.51 -> 1643.3800000000001 | N642: 167.50999999999999 | O642: =SUM(M642:N642) -> 1810.8900000000001
A643: 3684 | B643: RENOVA (EOL ANGELIM) | C643: 19.502.690/0001-05 | D643: 1877.9000000000001 | E643: 0 | F643: 0 | G643: 0 | H643: 0 | I643: 0 | J643: 0 | K643: 2069.3099999999999 | L643: 0 | M643: =SUM(J643:L643)-191.41 -> 1877.8999999999999 | N643: 191.41 | O643: =SUM(M643:N643) -> 2069.3099999999999
A644: 3685 | B644: RENOVA (EOL VELLOZIA) | C644: 18.560.475/0001-06 | D644: 1435.6099999999999 | E644: 0 | F644: 0 | G644: 0 | H644: 0 | I644: 0 | J644: 0 | K644: 1581.9400000000001 | L644: 0 | M644: =SUM(J644:L644)-146.33 -> 1435.6100000000001 | N644: 146.33000000000001 | O644: =SUM(M644:N644) -> 1581.9400000000001
A645: 3686 | B645: RENOVA (EOL TABOQUINHA) | C645: 18.870.116/0001-47 | D645: 1843.99 | E645: 0 | F645: 0 | G645: 0 | H645: 0 | I645: 0 | J645: 0 | K645: 2031.9400000000001 | L645: 0 | M645: =SUM(J645:L645)-187.95 -> 1843.99 | N645: 187.94999999999999 | O645: =SUM(M645:N645) -> 2031.9400000000001
A646: 3687 | B646: RENOVA (EOL ACÁCIA) | C646: 18.919.425/0001-64 | D646: 1382.6700000000001 | E646: 0 | F646: 0 | G646: 0 | H646: 0 | I646: 0 | J646: 0 | K646: 1523.5999999999999 | L646: 0 | M646: =SUM(J646:L646)-140.93 -> 1382.6699999999998 | N646: 140.93000000000001 | O646: =SUM(M646:N646) -> 1523.5999999999999
A647: 3688 | B647: RENOVA (EOL SÃO SALVADOR) | C647: 11.197.380/0001-12 | D647: 2432.7199999999998 | E647: 0 | F647: 0 | G647: 0 | H647: 0 | I647: 0 | J647: 0 | K647: 2680.6799999999998 | L647: 0 | M647: =SUM(J647:L647)-247.96 -> 2432.7199999999998 | N647: 247.96000000000001 | O647: =SUM(M647:N647) -> 2680.6799999999998
A648: 3689 | B648: EOL VENTOS DE SÃO VICENTE 12 | C648: 21.877.685/0001-29 | D648: 2702.6100000000001 | E648: 0 | F648: 0 | G648: 0 | H648: 0 | I648: 0 | J648: 0 | K648: 2978.0799999999999 | L648: 0 | M648: =SUM(J648:L648)-275.47 -> 2702.6099999999997 | N648: 275.47000000000003 | O648: =SUM(M648:N648) -> 2978.0799999999999
A649: 3690 | B649: EOL DELFINA III | C649: 21.556.441/0003-06 | D649: 3119.8600000000001 | E649: 0 | F649: 0 | G649: 0 | H649: 0 | I649: 0 | J649: 0 | K649: 3437.8600000000001 | L649: 0 | M649: =SUM(J649:L649)-318 -> 3119.8600000000001 | N649: 318 | O649: =SUM(M649:N649) -> 3437.8600000000001
A650: 3691 | B650: EOL DELFINA VI | C650: 21.553.640/0003-60 | D650: 3348.4200000000001 | E650: 0 | F650: 0 | G650: 0 | H650: 0 | I650: 0 | J650: 0 | K650: 3689.7199999999998 | L650: 0 | M650: =SUM(J650:L650)-341.3 -> 3348.4199999999996 | N650: 341.30000000000001 | O650: =SUM(M650:N650) -> 3689.7199999999998
A651: 3692 | B651: EOL DELFINA VII | C651: 21.599.114/0003-31 | D651: 3348.4200000000001 | E651: 0 | F651: 0 | G651: 0 | H651: 0 | I651: 0 | J651: 0 | K651: 3689.7199999999998 | L651: 0 | M651: =SUM(J651:L651)-341.3 -> 3348.4199999999996 | N651: 341.30000000000001 | O651: =SUM(M651:N651) -> 3689.7199999999998
A652: 3693 | B652: EOL JAU | C652: 17.227.909/0002-60 | D652: 9516.2800000000007 | E652: 0 | F652: 0 | G652: 0 | H652: 0 | I652: 0 | J652: 0 | K652: 10486.26 | L652: 0 | M652: =SUM(J652:L652)-969.98 -> 9516.2800000000007 | N652: 969.98000000000002 | O652: =SUM(M652:N652) -> 10486.26
A653: 3694 | B653: UFV HORIZONTE MP 1 | C653: 23.399.589/0002-29 | D653: 2821.27 | E653: 0 | F653: 0 | G653: 0 | H653: 0 | I653: 0 | J653: 0 | K653: 3108.8400000000001 | L653: 0 | M653: =SUM(J653:L653)-287.57 -> 2821.27 | N653: 287.56999999999999 | O653: =SUM(M653:N653) -> 3108.8400000000001
A654: 3695 | B654: EOL DOIS RIACHOS | C654: 17.018.370/0002-30 | D654: 5889.3800000000001 | E654: 0 | F654: 0 | G654: 0 | H654: 0 | I654: 0 | J654: 0 | K654: 6489.6700000000001 | L654: 0 | M654: =SUM(J654:L654)-600.29 -> 5889.3800000000001 | N654: 600.28999999999996 | O654: =SUM(M654:N654) -> 6489.6700000000001
A655: 3696 | B655: EOL ASSURUÁ IV | C655: 21.544.129/0002-11 | D655: 3593.04 | E655: 0 | F655: 0 | G655: 0 | H655: 0 | I655: 0 | J655: 0 | K655: 3959.27 | L655: 0 | M655: =SUM(J655:L655)-366.23 -> 3593.04 | N655: 366.23000000000002 | O655: =SUM(M655:N655) -> 3959.27
A656: 3697 | B656: EOL UNIÃO DOS VENTOS 12 | C656: 18.265.320/0001-39 | D656: 2802.8299999999999 | E656: 0 | F656: 0 | G656: 0 | H656: 0 | I656: 0 | J656: 0 | K656: 3088.52 | L656: 0 | M656: =SUM(J656:L656)-285.69 -> 2802.8299999999999 | N656: 285.69 | O656: =SUM(M656:N656) -> 3088.52
A657: 3698 | B657: EOL UNIÃO DOS VENTOS 13 | C657: 17.143.971/0001-93 | D657: 2100.6199999999999 | E657: 0 | F657: 0 | G657: 0 | H657: 0 | I657: 0 | J657: 0 | K657: 2314.73 | L657: 0 | M657: =SUM(J657:L657)-214.11 -> 2100.6199999999999 | N657: 214.11000000000001 | O657: =SUM(M657:N657) -> 2314.73
A658: 3699 | B658: EOL UNIÃO DOS VENTOS 14 | C658: 17.143.838/0001-37 | D658: 2341.5300000000002 | E658: 0 | F658: 0 | G658: 0 | H658: 0 | I658: 0 | J658: 0 | K658: 2580.1999999999998 | L658: 0 | M658: =SUM(J658:L658)-238.67 -> 2341.5299999999997 | N658: 238.66999999999999 | O658: =SUM(M658:N658) -> 2580.1999999999998
A659: 3700 | B659: EOL UNIÃO DOS VENTOS 15 | C659: 13.783.102/0001-72 | D659: 3398.6399999999999 | E659: 0 | F659: 0 | G659: 0 | H659: 0 | I659: 0 | J659: 0 | K659: 3745.0599999999999 | L659: 0 | M659: =SUM(J659:L659)-346.42 -> 3398.6399999999999 | N659: 346.42000000000002 | O659: =SUM(M659:N659) -> 3745.0599999999999
A660: 3701 | B660: EOL UNIÃO DOS VENTOS 16 | C660: 17.205.697/0001-30 | D660: 3238.4499999999998 | E660: 0 | F660: 0 | G660: 0 | H660: 0 | I660: 0 | J660: 0 | K660: 3568.54 | L660: 0 | M660: =SUM(J660:L660)-330.09 -> 3238.4499999999998 | N660: 330.08999999999997 | O660: =SUM(M660:N660) -> 3568.54
A661: 3702 | B661: EOL VENTOS DE SÃO VICENTE 13 | C661: 21.877.676/0001-38 | D661: 2702.0500000000002 | E661: 0 | F661: 0 | G661: 0 | H661: 0 | I661: 0 | J661: 0 | K661: 2977.4699999999998 | L661: 0 | M661: =SUM(J661:L661)-275.42 -> 2702.0499999999997 | N661: 275.42000000000002 | O661: =SUM(M661:N661) -> 2977.4699999999998
A662: 3703 | B662: EOL PEDRA RAJADA | C662: 21.909.246/0001-50 | D662: 1911.49 | E662: 0 | F662: 0 | G662: 0 | H662: 0 | I662: 0 | J662: 0 | K662: 2106.3299999999999 | L662: 0 | M662: =SUM(J662:L662)-194.84 -> 1911.49 | N662: 194.84 | O662: =SUM(M662:N662) -> 2106.3299999999999
A663: 3704 | B663: EOL PEDRA RAJADA II | C663: 21.909.399/0001-06 | D663: 1911.49 | E663: 0 | F663: 0 | G663: 0 | H663: 0 | I663: 0 | J663: 0 | K663: 2106.3299999999999 | L663: 0 | M663: =SUM(J663:L663)-194.84 -> 1911.49 | N663: 194.84 | O663: =SUM(M663:N663) -> 2106.3299999999999
A664: 3705 | B664: EOL SERRA DAS VACAS V | C664: 22.357.375/0001-46 | D664: 2383.6500000000001 | E664: 0 | F664: 0 | G664: 0 | H664: 0 | I664: 0 | J664: 0 | K664: 2626.6100000000001 | L664: 0 | M664: =SUM(J664:L664)-242.96 -> 2383.6500000000001 | N664: 242.96000000000001 | O664: =SUM(M664:N664) -> 2626.6100000000001
A665: 3706 | B665: EOL SERRA DAS VACAS VII | C665: 22.193.319/0001-13 | D665: 2383.6500000000001 | E665: 0 | F665: 0 | G665: 0 | H665: 0 | I665: 0 | J665: 0 | K665: 2626.6100000000001 | L665: 0 | M665: =SUM(J665:L665)-242.96 -> 2383.6500000000001 | N665: 242.96000000000001 | O665: =SUM(M665:N665) -> 2626.6100000000001
A666: 3711 | B666: EOL VENTOS DE SÃO VICENTE 8 | C666: 21.840.617/0001-95 | D666: 2708.6500000000001 | E666: 0 | F666: 0 | G666: 0 | H666: 0 | I666: 0 | J666: 0 | K666: 2984.7399999999998 | L666: 0 | M666: =SUM(J666:L666)-276.09 -> 2708.6499999999996 | N666: 276.08999999999997 | O666: =SUM(M666:N666) -> 2984.7399999999998
A667: 3712 | B667: EOL VENTOS DE SÃO VICENTE 11 | C667: 23.037.357/0001-40 | D667: 2710.6799999999998 | E667: 0 | F667: 0 | G667: 0 | H667: 0 | I667: 0 | J667: 0 | K667: 2986.98 | L667: 0 | M667: =SUM(J667:L667)-276.3 -> 2710.6799999999998 | N667: 276.30000000000001 | O667: =SUM(M667:N667) -> 2986.98
A668: 3713 | B668: EOL ASSURUÁ III | C668: 21.544.084/0002-85 | D668: 1527.3599999999999 | E668: 0 | F668: 0 | G668: 0 | H668: 0 | I668: 0 | J668: 0 | K668: 1683.04 | L668: 0 | M668: =SUM(J668:L668)-155.68 -> 1527.3599999999999 | N668: 155.68000000000001 | O668: =SUM(M668:N668) -> 1683.04
A669: 3714 | B669: EOL CAPOEIRAS III | C669: 21.543.971/0002-39 | D669: 3315.6300000000001 | E669: 0 | F669: 0 | G669: 0 | H669: 0 | I669: 0 | J669: 0 | K669: 3653.5900000000001 | L669: 0 | M669: =SUM(J669:L669)-337.96 -> 3315.6300000000001 | N669: 337.95999999999998 | O669: =SUM(M669:N669) -> 3653.5900000000001
A670: 3715 | B670: EOL CURRAL DE PEDRAS I | C670: 21.541.973/0002-99 | D670: 2454 | E670: 0 | F670: 0 | G670: 0 | H670: 0 | I670: 0 | J670: 0 | K670: 2704.1300000000001 | L670: 0 | M670: =SUM(J670:L670)-250.13 -> 2454 | N670: 250.13 | O670: =SUM(M670:N670) -> 2704.1300000000001
A671: 3716 | B671: EOL CURRAL DE PEDRAS II | C671: 21.544.255/0002-76 | D671: 3339.1199999999999 | E671: 0 | F671: 0 | G671: 0 | H671: 0 | I671: 0 | J671: 0 | K671: 3679.4699999999998 | L671: 0 | M671: =SUM(J671:L671)-340.35 -> 3339.1199999999999 | N671: 340.35000000000002 | O671: =SUM(M671:N671) -> 3679.4699999999998
A672: 3717 | B672: EOL DIAMANTE II | C672: 21.544.216/0002-79 | D672: 2122.23 | E672: 0 | F672: 0 | G672: 0 | H672: 0 | I672: 0 | J672: 0 | K672: 2338.5500000000002 | L672: 0 | M672: =SUM(J672:L672)-216.32 -> 2122.23 | N672: 216.31999999999999 | O672: =SUM(M672:N672) -> 2338.5500000000002
A673: 3718 | B673: EOL DIAMANTE III | C673: 21.543.994/0002-43 | D673: 2154.1799999999998 | E673: 0 | F673: 0 | G673: 0 | H673: 0 | I673: 0 | J673: 0 | K673: 2373.75 | L673: 0 | M673: =SUM(J673:L673)-219.57 -> 2154.1799999999998 | N673: 219.56999999999999 | O673: =SUM(M673:N673) -> 2373.75
A674: 3719 | B674: EOL LARANJEIRAS I | C674: 21.544.025/0002-07 | D674: 3420.3699999999999 | E674: 0 | F674: 0 | G674: 0 | H674: 0 | I674: 0 | J674: 0 | K674: 3769 | L674: 0 | M674: =SUM(J674:L674)-348.63 -> 3420.3699999999999 | N674: 348.63 | O674: =SUM(M674:N674) -> 3769
A675: 3720 | B675: EOL LARANJEIRAS II | C675: 21.544.159/0002-28 | D675: 3697.8099999999999 | E675: 0 | F675: 0 | G675: 0 | H675: 0 | I675: 0 | J675: 0 | K675: 4074.7199999999998 | L675: 0 | M675: =SUM(J675:L675)-376.91 -> 3697.8099999999999 | N675: 376.91000000000003 | O675: =SUM(M675:N675) -> 4074.7199999999998
A676: 3721 | B676: EOL LARANJEIRAS V | C676: 21.544.060/0002-26 | D676: 3086.8000000000002 | E676: 0 | F676: 0 | G676: 0 | H676: 0 | I676: 0 | J676: 0 | K676: 3401.4299999999998 | L676: 0 | M676: =SUM(J676:L676)-314.63 -> 3086.7999999999997 | N676: 314.63 | O676: =SUM(M676:N676) -> 3401.4299999999998
A677: 3722 | B677: UFV FLORESTA I | C677: 23.741.570/0001-38 | D677: 1117.0999999999999 | E677: 0 | F677: 0 | G677: 0 | H677: 0 | I677: 0 | J677: 0 | K677: 1230.96 | L677: 0 | M677: =SUM(J677:L677)-113.86 -> 1117.1000000000001 | N677: 113.86 | O677: =SUM(M677:N677) -> 1230.96
A678: 3723 | B678: UFV FLORESTA II | C678: 23.741.520/0001-50 | D678: 1117.0999999999999 | E678: 0 | F678: 0 | G678: 0 | H678: 0 | I678: 0 | J678: 0 | K678: 1230.96 | L678: 0 | M678: =SUM(J678:L678)-113.86 -> 1117.1000000000001 | N678: 113.86 | O678: =SUM(M678:N678) -> 1230.96
A679: 3724 | B679: UFV FLORESTA III | C679: 23.723.730/0001-16 | D679: 755.32000000000005 | E679: 0 | F679: 0 | G679: 0 | H679: 0 | I679: 0 | J679: 0 | K679: 832.30999999999995 | L679: 0 | M679: =SUM(J679:L679)-76.99 -> 755.31999999999994 | N679: 76.989999999999995 | O679: =SUM(M679:N679) -> 832.30999999999995
A680: 3725 | B680: UHE SAO MANOEL | C680: 18.494.537/0004-63 | D680: 208186.04999999999 | E680: 0 | F680: 0 | G680: 0 | H680: 0 | I680: 0 | J680: 0 | K680: 229406.12 | L680: 0 | M680: =SUM(J680:L680)-21220.07 -> 208186.04999999999 | N680: 21220.07 | O680: =SUM(M680:N680) -> 229406.12
A681: 3726 | B681: EOL VENTOS DE SÃO VICENTE 10 | C681: 21.840.567/0001-46 | D681: 2702.4200000000001 | E681: 0 | F681: 0 | G681: 0 | H681: 0 | I681: 0 | J681: 0 | K681: 2977.8699999999999 | L681: 0 | M681: =SUM(J681:L681)-275.45 -> 2702.4200000000001 | N681: 275.44999999999999 | O681: =SUM(M681:N681) -> 2977.8699999999999
A682: 3727 | B682: EOL VENTOS DE SÃO VICENTE 09 | C682: 21.716.502/0001-93 | D682: 2705.4899999999998 | E682: 0 | F682: 0 | G682: 0 | H682: 0 | I682: 0 | J682: 0 | K682: 2981.2600000000002 | L682: 0 | M682: =SUM(J682:L682)-275.77 -> 2705.4900000000002 | N682: 275.76999999999998 | O682: =SUM(M682:N682) -> 2981.2600000000002
A683: 3728 | B683: EOL GARROTE | C683: 10.272.489/0001-04 | D683: 2349.3299999999999 | E683: 0 | F683: 0 | G683: 0 | H683: 0 | I683: 0 | J683: 0 | K683: 2588.79 | L683: 0 | M683: =SUM(J683:L683)-239.46 -> 2349.3299999999999 | N683: 239.46000000000001 | O683: =SUM(M683:N683) -> 2588.79
A684: 3729 | B684: EOL SANTO INÁCIO III | C684: 12.009.141/0001-54 | D684: 3005.27 | E684: 0 | F684: 0 | G684: 0 | H684: 0 | I684: 0 | J684: 0 | K684: 3311.5900000000001 | L684: 0 | M684: =SUM(J684:L684)-306.32 -> 3005.27 | N684: 306.31999999999999 | O684: =SUM(M684:N684) -> 3311.5900000000001
A685: 3730 | B685: EOL SANTO INÁCIO IV | C685: 11.738.349/0001-41 | D685: 2366.0900000000001 | E685: 0 | F685: 0 | G685: 0 | H685: 0 | I685: 0 | J685: 0 | K685: 2607.2600000000002 | L685: 0 | M685: =SUM(J685:L685)-241.17 -> 2366.0900000000001 | N685: 241.16999999999999 | O685: =SUM(M685:N685) -> 2607.2600000000002
A686: 3731 | B686: EOL SÃO RAIMUNDO | C686: 10.408.112/0001-30 | D686: 2369.1999999999998 | E686: 0 | F686: 0 | G686: 0 | H686: 0 | I686: 0 | J686: 0 | K686: 2610.6900000000001 | L686: 0 | M686: =SUM(J686:L686)-241.49 -> 2369.1999999999998 | N686: 241.49000000000001 | O686: =SUM(M686:N686) -> 2610.6899999999996
A687: 3732 | B687: UHE SINOP | C687: 19.527.586/0001-75 | D687: 111129.3 | E687: 0 | F687: 0 | G687: 0 | H687: 0 | I687: 0 | J687: 0 | K687: 122456.53 | L687: 0 | M687: =SUM(J687:L687)-11327.23 -> 111129.3 | N687: 11327.23 | O687: =SUM(M687:N687) -> 122456.53
A688: 3733 | B688: EOL AVENTURA I | C688: 19.980.957/0002-50 | D688: 3086.73 | E688: 0 | F688: 0 | G688: 0 | H688: 0 | I688: 0 | J688: 0 | K688: 3401.3600000000001 | L688: 0 | M688: =SUM(J688:L688)-314.63 -> 3086.73 | N688: 314.63 | O688: =SUM(M688:N688) -> 3401.3600000000001
A689: 3734 | B689: EOL MORRO DO CHAPÉU I | C689: 21.868.992/0003-05 | D689: 6353.2799999999997 | E689: 0 | F689: 0 | G689: 0 | H689: 0 | I689: 0 | J689: 0 | K689: 7000.8599999999997 | L689: 0 | M689: =SUM(J689:L689)-647.58 -> 6353.2799999999997 | N689: 647.58000000000004 | O689: =SUM(M689:N689) -> 7000.8599999999997
A690: 3735 | B690: EOL MORRO DO CHAPÉU II | C690: 21.869.008/0003-20 | D690: 6137.9899999999998 | E690: 0 | F690: 0 | G690: 0 | H690: 0 | I690: 0 | J690: 0 | K690: 6763.6300000000001 | L690: 0 | M690: =SUM(J690:L690)-625.64 -> 6137.9899999999998 | N690: 625.63999999999999 | O690: =SUM(M690:N690) -> 6763.6300000000001
A691: 3736 | B691: EOL BOA VISTA DA LAGOINHA | C691: 21.996.671/0003-96 | D691: 3396.1700000000001 | E691: 0 | F691: 0 | G691: 0 | H691: 0 | I691: 0 | J691: 0 | K691: 3742.3400000000001 | L691: 0 | M691: =SUM(J691:L691)-346.17 -> 3396.1700000000001 | N691: 346.17000000000002 | O691: =SUM(M691:N691) -> 3742.3400000000001
A692: 3737 | B692: EOL VENTOS DE SANTO ABRAÃO | C692: 21.869.030/0003-70 | D692: 3169.2199999999998 | E692: 0 | F692: 0 | G692: 0 | H692: 0 | I692: 0 | J692: 0 | K692: 3492.25 | L692: 0 | M692: =SUM(J692:L692)-323.03 -> 3169.2200000000003 | N692: 323.02999999999997 | O692: =SUM(M692:N692) -> 3492.25
A693: 3738 | B693: EOL CABEÇO VERMELHO | C693: 20.024.563/0001-27 | D693: 2955.3299999999999 | E693: 0 | F693: 0 | G693: 0 | H693: 0 | I693: 0 | J693: 0 | K693: 3256.5599999999999 | L693: 0 | M693: =SUM(J693:L693)-301.23 -> 2955.3299999999999 | N693: 301.23000000000002 | O693: =SUM(M693:N693) -> 3256.5599999999999
A694: 3739 | B694: EOL CABEÇO VERMELHO II | C694: 20.024.516/0001-83 | D694: 1748.3299999999999 | E694: 0 | F694: 0 | G694: 0 | H694: 0 | I694: 0 | J694: 0 | K694: 1926.53 | L694: 0 | M694: =SUM(J694:L694)-178.2 -> 1748.3299999999999 | N694: 178.19999999999999 | O694: =SUM(M694:N694) -> 1926.53
A695: 3740 | B695: UFV COREMAS I | C695: 14.285.232/0001-48 | D695: 2176.2600000000002 | E695: 0 | F695: 0 | G695: 0 | H695: 0 | I695: 0 | J695: 0 | K695: 2398.0799999999999 | L695: 0 | M695: =SUM(J695:L695)-221.82 -> 2176.2599999999998 | N695: 221.81999999999999 | O695: =SUM(M695:N695) -> 2398.0799999999999
A696: 3741 | B696: UFV COREMAS II | C696: 14.285.242/0001-83 | D696: 1932.3 | E696: 0 | F696: 0 | G696: 0 | H696: 0 | I696: 0 | J696: 0 | K696: 2129.2600000000002 | L696: 0 | M696: =SUM(J696:L696)-196.96 -> 1932.3000000000002 | N696: 196.96000000000001 | O696: =SUM(M696:N696) -> 2129.2600000000002
A697: 3742 | B697: UHE JAGUARA | C697: 28.925.264/0002-56 | D697: 117349.75 | E697: 0 | F697: 0 | G697: 0 | H697: 0 | I697: 0 | J697: 0 | K697: 129311.02 | L697: 0 | M697: =SUM(J697:L697)-11961.27 -> 117349.75 | N697: 11961.27 | O697: =SUM(M697:N697) -> 129311.02
A698: 3743 | B698: UHE VOLTA GRANDE | C698: 25.176.391/0002-01 | D698: 115772.61 | E698: 0 | F698: 0 | G698: 0 | H698: 0 | I698: 0 | J698: 0 | K698: 127573.12 | L698: 0 | M698: =SUM(J698:L698)-11800.51 -> 115772.61 | N698: 11800.51 | O698: =SUM(M698:N698) -> 127573.12
A699: 3744 | B699: UTE PROSPERIDADE I | C699: 23.857.764/0001-01 | D699: 4175.04 | E699: 0 | F699: 0 | G699: 0 | H699: 0 | I699: 0 | J699: 0 | K699: 4600.6000000000004 | L699: 0 | M699: =SUM(J699:L699)-425.56 -> 4175.04 | N699: 425.56 | O699: =SUM(M699:N699) -> 4600.6000000000004
A700: 3745 | B700: CÉU AZUL (CONS. BAIXO IGUAÇU) | C700: 09.136.819/0002-36 | D700: 47030.779999999999 | E700: 0 | F700: 0 | G700: 0 | H700: 0 | I700: 0 | J700: 0 | K700: 51824.550000000003 | L700: 0 | M700: =SUM(J700:L700)-4793.77 -> 47030.779999999999 | N700: 4793.7700000000004 | O700: =SUM(M700:N700) -> 51824.550000000003
A701: 3746 | B701: EOL SERRA DA BABILÔNIA II | C701: 24.263.234/0002-70 | D701: 3087.23 | E701: 0 | F701: 0 | G701: 0 | H701: 0 | I701: 0 | J701: 0 | K701: 3401.9099999999999 | L701: 0 | M701: =SUM(J701:L701)-314.68 -> 3087.23 | N701: 314.68000000000001 | O701: =SUM(M701:N701) -> 3401.9099999999999
A702: 3747 | B702: EOL SERRA DA BABILÔNIA VI | C702: 24.325.137/0002-65 | D702: 2829.0100000000002 | E702: 0 | F702: 0 | G702: 0 | H702: 0 | I702: 0 | J702: 0 | K702: 3117.3699999999999 | L702: 0 | M702: =SUM(J702:L702)-288.36 -> 2829.0099999999998 | N702: 288.36000000000001 | O702: =SUM(M702:N702) -> 3117.3699999999999
A703: 3748 | B703: DIAMANTE | C703: 27.093.977/0002-38 | D703: 101700.25 | E703: 0 | F703: 0 | G703: 0 | H703: 0 | I703: 0 | J703: 0 | K703: 112066.39 | L703: 0 | M703: =SUM(J703:L703)-10366.14 -> 101700.25 | N703: 10366.139999999999 | O703: =SUM(M703:N703) -> 112066.39
A704: 3749 | B704: UHE SÃO SIMÃO | C704: 27.352.303/0002-00 | D704: 534830.44999999995 | E704: 0 | F704: 0 | G704: 0 | H704: 0 | I704: 0 | J704: 0 | K704: 589344.84999999998 | L704: 0 | M704: =SUM(J704:L704)-54514.4 -> 534830.44999999995 | N704: 54514.400000000001 | O704: =SUM(M704:N704) -> 589344.84999999998
A705: 3750 | B705: UFV COREMAS III | C705: 24.342.513/0001-49 | D705: 2240.5599999999999 | E705: 0 | F705: 0 | G705: 0 | H705: 0 | I705: 0 | J705: 0 | K705: 2468.9400000000001 | L705: 0 | M705: =SUM(J705:L705)-228.38 -> 2240.5599999999999 | N705: 228.38 | O705: =SUM(M705:N705) -> 2468.9400000000001
A706: 3751 | B706: EOL CAMPO LARGO I | C706: 16.756.565/0002-14 | D706: 4207.5900000000001 | E706: 0 | F706: 0 | G706: 0 | H706: 0 | I706: 0 | J706: 0 | K706: 4636.46 | L706: 0 | M706: =SUM(J706:L706)-428.87 -> 4207.5900000000001 | N706: 428.87 | O706: =SUM(M706:N706) -> 4636.46
A707: 3752 | B707: EOL CAMPO LARGO III | C707: 16.755.810/0002-79 | D707: 3338.3299999999999 | E707: 0 | F707: 0 | G707: 0 | H707: 0 | I707: 0 | J707: 0 | K707: 3678.5999999999999 | L707: 0 | M707: =SUM(J707:L707)-340.27 -> 3338.3299999999999 | N707: 340.26999999999998 | O707: =SUM(M707:N707) -> 3678.5999999999999
A708: 3753 | B708: EOL CAMPO LARGO IV | C708: 16.756.341/0002-02 | D708: 3338.3299999999999 | E708: 0 | F708: 0 | G708: 0 | H708: 0 | I708: 0 | J708: 0 | K708: 3678.5999999999999 | L708: 0 | M708: =SUM(J708:L708)-340.27 -> 3338.3299999999999 | N708: 340.26999999999998 | O708: =SUM(M708:N708) -> 3678.5999999999999
A709: 3754 | B709: EOL CAMPO LARGO VII | C709: 16.757.011/0002-31 | D709: 3338.3299999999999 | E709: 0 | F709: 0 | G709: 0 | H709: 0 | I709: 0 | J709: 0 | K709: 3678.5999999999999 | L709: 0 | M709: =SUM(J709:L709)-340.27 -> 3338.3299999999999 | N709: 340.26999999999998 | O709: =SUM(M709:N709) -> 3678.5999999999999
A710: 3755 | B710: EOL AURA LAGOA DO BARRO 07 | C710: 21.959.329/0002-35 | D710: 2865.6399999999999 | E710: 0 | F710: 0 | G710: 0 | H710: 0 | I710: 0 | J710: 0 | K710: 3157.73 | L710: 0 | M710: =SUM(J710:L710)-292.09 -> 2865.6399999999999 | N710: 292.08999999999997 | O710: =SUM(M710:N710) -> 3157.73
A711: 3756 | B711: EOL AURA QUEIMADA NOVA 03 | C711: 21.959.361/0002-10 | D711: 953.34000000000003 | E711: 0 | F711: 0 | G711: 0 | H711: 0 | I711: 0 | J711: 0 | K711: 1050.51 | L711: 0 | M711: =SUM(J711:L711)-97.17 -> 953.34000000000003 | N711: 97.170000000000002 | O711: =SUM(M711:N711) -> 1050.51
A712: 3757 | B712: EOL VENTOS DA SANTA BEATRIZ | C712: 13.346.161/0002-64 | D712: 2937.6900000000001 | E712: 0 | F712: 0 | G712: 0 | H712: 0 | I712: 0 | J712: 0 | K712: 3237.1199999999999 | L712: 0 | M712: =SUM(J712:L712)-299.43 -> 2937.6900000000001 | N712: 299.43000000000001 | O712: =SUM(M712:N712) -> 3237.1199999999999
A713: 3758 | B713: EOL VENTOS DE SANTA APARECIDA | C713: 13.346.095/0002-22 | D713: 2985.4299999999998 | E713: 0 | F713: 0 | G713: 0 | H713: 0 | I713: 0 | J713: 0 | K713: 3289.73 | L713: 0 | M713: =SUM(J713:L713)-304.3 -> 2985.4299999999998 | N713: 304.30000000000001 | O713: =SUM(M713:N713) -> 3289.73
A714: 3759 | B714: EOL VENTOS DE SANTA AURORA | C714: 13.346.039/0002-98 | D714: 2965.5300000000002 | E714: 0 | F714: 0 | G714: 0 | H714: 0 | I714: 0 | J714: 0 | K714: 3267.8000000000002 | L714: 0 | M714: =SUM(J714:L714)-302.27 -> 2965.5300000000002 | N714: 302.26999999999998 | O714: =SUM(M714:N714) -> 3267.8000000000002
A715: 3760 | B715: EOL VENTOS DE SANTA EMILIA | C715: 13.346.108/0002-63 | D715: 3077.3499999999999 | E715: 0 | F715: 0 | G715: 0 | H715: 0 | I715: 0 | J715: 0 | K715: 3391.02 | L715: 0 | M715: =SUM(J715:L715)-313.67 -> 3077.3499999999999 | N715: 313.67000000000002 | O715: =SUM(M715:N715) -> 3391.02
A716: 3761 | B716: EOL VENTOS DE SÃO GABRIEL | C716: 13.346.102/0002-96 | D716: 2931.6599999999999 | E716: 0 | F716: 0 | G716: 0 | H716: 0 | I716: 0 | J716: 0 | K716: 3230.48 | L716: 0 | M716: =SUM(J716:L716)-298.82 -> 2931.6599999999999 | N716: 298.81999999999999 | O716: =SUM(M716:N716) -> 3230.48
A717: 3762 | B717: EOL SERRA DA BABILÔNIA X | C717: 24.263.312/0002-37 | D717: 3086.1900000000001 | E717: 0 | F717: 0 | G717: 0 | H717: 0 | I717: 0 | J717: 0 | K717: 3400.7600000000002 | L717: 0 | M717: =SUM(J717:L717)-314.57 -> 3086.1900000000001 | N717: 314.56999999999999 | O717: =SUM(M717:N717) -> 3400.7600000000002
A718: 3763 | B718: EOL SERRA DA BABILÔNIA XI | C718: 24.263.070/0002-81 | D718: 3086.54 | E718: 0 | F718: 0 | G718: 0 | H718: 0 | I718: 0 | J718: 0 | K718: 3401.1500000000001 | L718: 0 | M718: =SUM(J718:L718)-314.61 -> 3086.54 | N718: 314.61000000000001 | O718: =SUM(M718:N718) -> 3401.1500000000001
A719: 3764 | B719: EOL SERRA DA BABILÔNIA VII | C719: 24.325.076/0002-36 | D719: 3086.1900000000001 | E719: 0 | F719: 0 | G719: 0 | H719: 0 | I719: 0 | J719: 0 | K719: 3400.7600000000002 | L719: 0 | M719: =SUM(J719:L719)-314.57 -> 3086.1900000000001 | N719: 314.56999999999999 | O719: =SUM(M719:N719) -> 3400.7600000000002
A720: 3765 | B720: EOL VENTOS DA BAHIA I | C720: 23.888.783/0001-97 | D720: 3131.0100000000002 | E720: 0 | F720: 0 | G720: 0 | H720: 0 | I720: 0 | J720: 0 | K720: 3450.1500000000001 | L720: 0 | M720: =SUM(J720:L720)-319.14 -> 3131.0100000000002 | N720: 319.13999999999999 | O720: =SUM(M720:N720) -> 3450.1500000000001
A721: 3766 | B721: EOL VENTOS DA BAHIA III | C721: 23.888.824/0001-45 | D721: 3371.8600000000001 | E721: 0 | F721: 0 | G721: 0 | H721: 0 | I721: 0 | J721: 0 | K721: 3715.5500000000002 | L721: 0 | M721: =SUM(J721:L721)-343.69 -> 3371.8600000000001 | N721: 343.69 | O721: =SUM(M721:N721) -> 3715.5500000000002
A722: 3767 | B722: EOL VENTOS DA BAHIA IX | C722: 23.890.926/0001-03 | D722: 3131.0100000000002 | E722: 0 | F722: 0 | G722: 0 | H722: 0 | I722: 0 | J722: 0 | K722: 3450.1500000000001 | L722: 0 | M722: =SUM(J722:L722)-319.14 -> 3131.0100000000002 | N722: 319.13999999999999 | O722: =SUM(M722:N722) -> 3450.1500000000001
A723: 3768 | B723: EOL VENTOS DA BAHIA XVIII | C723: 23.888.804/0001-74 | D723: 3129.98 | E723: 0 | F723: 0 | G723: 0 | H723: 0 | I723: 0 | J723: 0 | K723: 3449.0100000000002 | L723: 0 | M723: =SUM(J723:L723)-319.03 -> 3129.9800000000005 | N723: 319.02999999999997 | O723: =SUM(M723:N723) -> 3449.0100000000002
A724: 3769 | B724: EOL SÃO BENTO DO NORTE I | C724: 21.216.892/0001-32 | D724: 2350.6500000000001 | E724: 0 | F724: 0 | G724: 0 | H724: 0 | I724: 0 | J724: 0 | K724: 2590.25 | L724: 0 | M724: =SUM(J724:L724)-239.6 -> 2350.6500000000001 | N724: 239.59999999999999 | O724: =SUM(M724:N724) -> 2590.25
A725: 3770 | B725: EOL SÃO BENTO DO NORTE II | C725: 21.216.877/0001-94 | D725: 2345.5900000000001 | E725: 0 | F725: 0 | G725: 0 | H725: 0 | I725: 0 | J725: 0 | K725: 2584.6700000000001 | L725: 0 | M725: =SUM(J725:L725)-239.08 -> 2345.5900000000001 | N725: 239.08000000000001 | O725: =SUM(M725:N725) -> 2584.6700000000001
A726: 3771 | B726: EOL SÃO MIGUEL I | C726: 21.216.915/0001-09 | D726: 2115.7399999999998 | E726: 0 | F726: 0 | G726: 0 | H726: 0 | I726: 0 | J726: 0 | K726: 2331.3899999999999 | L726: 0 | M726: =SUM(J726:L726)-215.65 -> 2115.7399999999998 | N726: 215.65000000000001 | O726: =SUM(M726:N726) -> 2331.3899999999999
A727: 3772 | B727: EOL SÃO MIGUEL II | C727: 21.216.925/0001-44 | D727: 2115.7399999999998 | E727: 0 | F727: 0 | G727: 0 | H727: 0 | I727: 0 | J727: 0 | K727: 2331.3899999999999 | L727: 0 | M727: =SUM(J727:L727)-215.65 -> 2115.7399999999998 | N727: 215.65000000000001 | O727: =SUM(M727:N727) -> 2331.3899999999999
A728: 3773 | B728: EOL SÃO MIGUEL III | C728: 21.216.439/0001-26 | D728: 2118.02 | E728: 0 | F728: 0 | G728: 0 | H728: 0 | I728: 0 | J728: 0 | K728: 2333.9099999999999 | L728: 0 | M728: =SUM(J728:L728)-215.89 -> 2118.02 | N728: 215.88999999999999 | O728: =SUM(M728:N728) -> 2333.9099999999999
A729: 3774 | B729: EOL SÃO BENTO DO NORTE III | C729: 21.216.857/0001-13 | D729: 2332.48 | E729: 0 | F729: 0 | G729: 0 | H729: 0 | I729: 0 | J729: 0 | K729: 2570.23 | L729: 0 | M729: =SUM(J729:L729)-237.75 -> 2332.48 | N729: 237.75 | O729: =SUM(M729:N729) -> 2570.23
A730: 3775 | B730: EOL CAMPO LARGO XVI | C730: 17.828.934/0002-08 | D730: 4223.9499999999998 | E730: 0 | F730: 0 | G730: 0 | H730: 0 | I730: 0 | J730: 0 | K730: 4654.4899999999998 | L730: 0 | M730: =SUM(J730:L730)-430.54 -> 4223.9499999999998 | N730: 430.54000000000002 | O730: =SUM(M730:N730) -> 4654.4899999999998
A731: 3776 | B731: EOL SERRA DA BABILÔNIA IX | C731: 24.263.209/0002-97 | D731: 3086.1900000000001 | E731: 0 | F731: 0 | G731: 0 | H731: 0 | I731: 0 | J731: 0 | K731: 3400.7600000000002 | L731: 0 | M731: =SUM(J731:L731)-314.57 -> 3086.1900000000001 | N731: 314.56999999999999 | O731: =SUM(M731:N731) -> 3400.7600000000002
A732: 3777 | B732: EOL SERRA DA BABILÔNIA XII | C732: 24.263.276/0002-01 | D732: 3086.54 | E732: 0 | F732: 0 | G732: 0 | H732: 0 | I732: 0 | J732: 0 | K732: 3401.1500000000001 | L732: 0 | M732: =SUM(J732:L732)-314.61 -> 3086.54 | N732: 314.61000000000001 | O732: =SUM(M732:N732) -> 3401.1500000000001
A733: 3778 | B733: EOL AURA LAGOA DO BARRO 01 | C733: 21.951.779/0002-81 | D733: 2865.6399999999999 | E733: 0 | F733: 0 | G733: 0 | H733: 0 | I733: 0 | J733: 0 | K733: 3157.73 | L733: 0 | M733: =SUM(J733:L733)-292.09 -> 2865.6399999999999 | N733: 292.08999999999997 | O733: =SUM(M733:N733) -> 3157.73
A734: 3779 | B734: EOL GOIABEIRA | C734: 15.321.064/0001-61 | D734: 173.09999999999999 | E734: 0 | F734: 0 | G734: 0 | H734: 0 | I734: 0 | J734: 0 | K734: 190.74000000000001 | L734: 0 | M734: =SUM(J734:L734)-17.64 -> 173.10000000000002 | N734: 17.640000000000001 | O734: =SUM(M734:N734) -> 190.74000000000001
A735: 3781 | B735: EOL SANTA CATARINA | C735: 15.321.146/0001-06 | D735: 222.03999999999999 | E735: 0 | F735: 0 | G735: 0 | H735: 0 | I735: 0 | J735: 0 | K735: 244.66999999999999 | L735: 0 | M735: =SUM(J735:L735)-22.63 -> 222.03999999999999 | N735: 22.629999999999999 | O735: =SUM(M735:N735) -> 244.66999999999999
A736: 3783 | B736: EOL VENTOS DE HORIZONTE | C736: 15.253.350/0001-37 | D736: 169 | E736: 0 | F736: 0 | G736: 0 | H736: 0 | I736: 0 | J736: 0 | K736: 186.22999999999999 | L736: 0 | M736: =SUM(J736:L736)-17.23 -> 169 | N736: 17.23 | O736: =SUM(M736:N736) -> 186.22999999999999
A737: 3784 | B737: EOL AURA LAGOA DO BARRO 02 | C737: 21.951.809/0002-50 | D737: 2865.6399999999999 | E737: 0 | F737: 0 | G737: 0 | H737: 0 | I737: 0 | J737: 0 | K737: 3157.73 | L737: 0 | M737: =SUM(J737:L737)-292.09 -> 2865.6399999999999 | N737: 292.08999999999997 | O737: =SUM(M737:N737) -> 3157.73
A738: 3785 | B738: EOL AURA LAGOA DO BARRO 05 | C738: 21.949.390/0002-00 | D738: 2545.5100000000002 | E738: 0 | F738: 0 | G738: 0 | H738: 0 | I738: 0 | J738: 0 | K738: 2804.9699999999998 | L738: 0 | M738: =SUM(J738:L738)-259.46 -> 2545.5099999999998 | N738: 259.45999999999998 | O738: =SUM(M738:N738) -> 2804.9699999999998
A739: 3786 | B739: UFV APODI I | C739: 24.424.331/0001-17 | D739: 2635.8400000000001 | E739: 0 | F739: 0 | G739: 0 | H739: 0 | I739: 0 | J739: 0 | K739: 2904.5100000000002 | L739: 0 | M739: =SUM(J739:L739)-268.67 -> 2635.8400000000001 | N739: 268.67000000000002 | O739: =SUM(M739:N739) -> 2904.5100000000002
A740: 3787 | B740: UFV APODI II | C740: 24.424.175/0001-94 | D740: 2635.8400000000001 | E740: 0 | F740: 0 | G740: 0 | H740: 0 | I740: 0 | J740: 0 | K740: 2904.5100000000002 | L740: 0 | M740: =SUM(J740:L740)-268.67 -> 2635.8400000000001 | N740: 268.67000000000002 | O740: =SUM(M740:N740) -> 2904.5100000000002
A741: 3788 | B741: UFV APODI III | C741: 24.424.233/0001-80 | D741: 2635.8400000000001 | E741: 0 | F741: 0 | G741: 0 | H741: 0 | I741: 0 | J741: 0 | K741: 2904.5100000000002 | L741: 0 | M741: =SUM(J741:L741)-268.67 -> 2635.8400000000001 | N741: 268.67000000000002 | O741: =SUM(M741:N741) -> 2904.5100000000002
A742: 3789 | B742: UFV APODI IV | C742: 24.424.369/0001-90 | D742: 2635.8400000000001 | E742: 0 | F742: 0 | G742: 0 | H742: 0 | I742: 0 | J742: 0 | K742: 2904.5100000000002 | L742: 0 | M742: =SUM(J742:L742)-268.67 -> 2635.8400000000001 | N742: 268.67000000000002 | O742: =SUM(M742:N742) -> 2904.5100000000002
A743: 3790 | B743: EOL BOA ESPERANÇA I | C743: 21.909.323/0001-72 | D743: 3067.9000000000001 | E743: 0 | F743: 0 | G743: 0 | H743: 0 | I743: 0 | J743: 0 | K743: 3380.6100000000001 | L743: 0 | M743: =SUM(J743:L743)-312.71 -> 3067.9000000000001 | N743: 312.70999999999998 | O743: =SUM(M743:N743) -> 3380.6100000000001
A744: 3791 | B744: EOL SERRA DA BABILÔNIA VIII | C744: 24.263.248/0002-94 | D744: 3086.1900000000001 | E744: 0 | F744: 0 | G744: 0 | H744: 0 | I744: 0 | J744: 0 | K744: 3400.7600000000002 | L744: 0 | M744: =SUM(J744:L744)-314.57 -> 3086.1900000000001 | N744: 314.56999999999999 | O744: =SUM(M744:N744) -> 3400.7600000000002
A745: 3792 | B745: EOL AURA LAGOA DO BARRO 06 | C745: 21.959.389/0002-58 | D745: 2865.6399999999999 | E745: 0 | F745: 0 | G745: 0 | H745: 0 | I745: 0 | J745: 0 | K745: 3157.73 | L745: 0 | M745: =SUM(J745:L745)-292.09 -> 2865.6399999999999 | N745: 292.08999999999997 | O745: =SUM(M745:N745) -> 3157.73
A746: 3793 | B746: EOL CAMPO LARGO V | C746: 16.757.107/0002-08 | D746: 3338.3299999999999 | E746: 0 | F746: 0 | G746: 0 | H746: 0 | I746: 0 | J746: 0 | K746: 3678.5999999999999 | L746: 0 | M746: =SUM(J746:L746)-340.27 -> 3338.3299999999999 | N746: 340.26999999999998 | O746: =SUM(M746:N746) -> 3678.5999999999999
A747: 3794 | B747: EOL CAMPO LARGO VI | C747: 16.756.943/0002-60 | D747: 3338.3299999999999 | E747: 0 | F747: 0 | G747: 0 | H747: 0 | I747: 0 | J747: 0 | K747: 3678.5999999999999 | L747: 0 | M747: =SUM(J747:L747)-340.27 -> 3338.3299999999999 | N747: 340.26999999999998 | O747: =SUM(M747:N747) -> 3678.5999999999999
A748: 3795 | B748: EOL CAMPO LARGO XVIII | C748: 17.889.739/0002-80 | D748: 4207.5900000000001 | E748: 0 | F748: 0 | G748: 0 | H748: 0 | I748: 0 | J748: 0 | K748: 4636.46 | L748: 0 | M748: =SUM(J748:L748)-428.87 -> 4207.5900000000001 | N748: 428.87 | O748: =SUM(M748:N748) -> 4636.46
A749: 3796 | B749: EOL CAMPO LARGO XXI | C749: 17.878.526/0002-52 | D749: 3339.02 | E749: 0 | F749: 0 | G749: 0 | H749: 0 | I749: 0 | J749: 0 | K749: 3679.3600000000001 | L749: 0 | M749: =SUM(J749:L749)-340.34 -> 3339.02 | N749: 340.33999999999997 | O749: =SUM(M749:N749) -> 3679.3600000000001
A750: 3797 | B750: EOL AURA LAGOA DO BARRO 03 | C750: 21.951.750/0002-08 | D750: 2865.6399999999999 | E750: 0 | F750: 0 | G750: 0 | H750: 0 | I750: 0 | J750: 0 | K750: 3157.73 | L750: 0 | M750: =SUM(J750:L750)-292.09 -> 2865.6399999999999 | N750: 292.08999999999997 | O750: =SUM(M750:N750) -> 3157.73
A751: 3798 | B751: EOL AURA LAGOA DO BARRO 04 | C751: 21.951.831/0002-08 | D751: 2865.6399999999999 | E751: 0 | F751: 0 | G751: 0 | H751: 0 | I751: 0 | J751: 0 | K751: 3157.73 | L751: 0 | M751: =SUM(J751:L751)-292.09 -> 2865.6399999999999 | N751: 292.08999999999997 | O751: =SUM(M751:N751) -> 3157.73
A752: 3799 | B752: UFV JUAZEIRO SOLAR I | C752: 24.302.618/0001-74 | D752: 3152.1700000000001 | E752: 0 | F752: 0 | G752: 0 | H752: 0 | I752: 0 | J752: 0 | K752: 3473.4699999999998 | L752: 0 | M752: =SUM(J752:L752)-321.3 -> 3152.1699999999996 | N752: 321.30000000000001 | O752: =SUM(M752:N752) -> 3473.4699999999998
A753: 3800 | B753: UFV JUAZEIRO SOLAR II | C753: 24.227.619/0001-00 | D753: 3152.1700000000001 | E753: 0 | F753: 0 | G753: 0 | H753: 0 | I753: 0 | J753: 0 | K753: 3473.4699999999998 | L753: 0 | M753: =SUM(J753:L753)-321.3 -> 3152.1699999999996 | N753: 321.30000000000001 | O753: =SUM(M753:N753) -> 3473.4699999999998
A754: 3801 | B754: UFV JUAZEIRO SOLAR III | C754: 24.358.177/0001-22 | D754: 3152.1700000000001 | E754: 0 | F754: 0 | G754: 0 | H754: 0 | I754: 0 | J754: 0 | K754: 3473.4699999999998 | L754: 0 | M754: =SUM(J754:L754)-321.3 -> 3152.1699999999996 | N754: 321.30000000000001 | O754: =SUM(M754:N754) -> 3473.4699999999998
A755: 3802 | B755: UFV JUAZEIRO SOLAR IV | C755: 24.168.509/0001-06 | D755: 3152.1700000000001 | E755: 0 | F755: 0 | G755: 0 | H755: 0 | I755: 0 | J755: 0 | K755: 3473.4699999999998 | L755: 0 | M755: =SUM(J755:L755)-321.3 -> 3152.1699999999996 | N755: 321.30000000000001 | O755: =SUM(M755:N755) -> 3473.4699999999998
A756: 3803 | B756: EOL LARANJEIRAS III | C756: 21.816.037/0002-43 | D756: 2891.8099999999999 | E756: 0 | F756: 0 | G756: 0 | H756: 0 | I756: 0 | J756: 0 | K756: 3186.5700000000002 | L756: 0 | M756: =SUM(J756:L756)-294.76 -> 2891.8100000000004 | N756: 294.75999999999999 | O756: =SUM(M756:N756) -> 3186.5700000000006
A757: 3804 | B757: EOL LARANJEIRAS IX | C757: 21.815.934/0002-32 | D757: 2891.1999999999998 | E757: 0 | F757: 0 | G757: 0 | H757: 0 | I757: 0 | J757: 0 | K757: 3185.9000000000001 | L757: 0 | M757: =SUM(J757:L757)-294.7 -> 2891.2000000000003 | N757: 294.69999999999999 | O757: =SUM(M757:N757) -> 3185.9000000000001
A758: 3805 | B758: EOL DELTA 5 I | C758: 29.296.171/0002-72 | D758: 3756.4499999999998 | E758: 0 | F758: 0 | G758: 0 | H758: 0 | I758: 0 | J758: 0 | K758: 4139.3400000000001 | L758: 0 | M758: =SUM(J758:L758)-382.89 -> 3756.4500000000003 | N758: 382.88999999999999 | O758: =SUM(M758:N758) -> 4139.3400000000001
A759: 3806 | B759: EOL DELTA 5 II | C759: 29.303.897/0002-95 | D759: 3773.3899999999999 | E759: 0 | F759: 0 | G759: 0 | H759: 0 | I759: 0 | J759: 0 | K759: 4158.0100000000002 | L759: 0 | M759: =SUM(J759:L759)-384.62 -> 3773.3900000000003 | N759: 384.62 | O759: =SUM(M759:N759) -> 4158.0100000000002
A760: 3807 | B760: COPEL (CONS. BAIXO IGUAÇU) | C760: 04.370.282/0001-70 | D760: 20156.049999999999 | E760: 0 | F760: 0 | G760: 0 | H760: 0 | I760: 0 | J760: 0 | K760: 22210.52 | L760: 0 | M760: =SUM(J760:L760)-2054.47 -> 20156.049999999999 | N760: 2054.4699999999998 | O760: =SUM(M760:N760) -> 22210.52
A761: 3808 | B761: EOL CAMPO LARGO II | C761: 16.913.777/0002-68 | D761: 4356.7700000000004 | E761: 0 | F761: 0 | G761: 0 | H761: 0 | I761: 0 | J761: 0 | K761: 4800.8500000000004 | L761: 0 | M761: =SUM(J761:L761)-444.08 -> 4356.7700000000004 | N761: 444.07999999999998 | O761: =SUM(M761:N761) -> 4800.8500000000004
A762: 3809 | B762: EOL CAMPO LARGO XV | C762: 17.928.199/0002-04 | D762: 4207.5900000000001 | E762: 0 | F762: 0 | G762: 0 | H762: 0 | I762: 0 | J762: 0 | K762: 4636.46 | L762: 0 | M762: =SUM(J762:L762)-428.87 -> 4207.5900000000001 | N762: 428.87 | O762: =SUM(M762:N762) -> 4636.46
A763: 3810 | B763: EOL DELTA 6 I | C763: 29.296.141/0002-66 | D763: 4132.5799999999999 | E763: 0 | F763: 0 | G763: 0 | H763: 0 | I763: 0 | J763: 0 | K763: 4553.8100000000004 | L763: 0 | M763: =SUM(J763:L763)-421.23 -> 4132.5799999999999 | N763: 421.23000000000002 | O763: =SUM(M763:N763) -> 4553.8099999999995
A764: 3811 | B764: EOL DELTA 6 II | C764: 29.296.975/0002-71 | D764: 3380.8000000000002 | E764: 0 | F764: 0 | G764: 0 | H764: 0 | I764: 0 | J764: 0 | K764: 3725.4000000000001 | L764: 0 | M764: =SUM(J764:L764)-344.6 -> 3380.8000000000002 | N764: 344.60000000000002 | O764: =SUM(M764:N764) -> 3725.4000000000001
A765: 3812 | B765: EOL UMBURANAS 8 | C765: 20.168.405/0002-21 | D765: 2469.8000000000002 | E765: 0 | F765: 0 | G765: 0 | H765: 0 | I765: 0 | J765: 0 | K765: 2721.54 | L765: 0 | M765: =SUM(J765:L765)-251.74 -> 2469.8000000000002 | N765: 251.74000000000001 | O765: =SUM(M765:N765) -> 2721.54
A766: 3813 | B766: EOL UMBURANAS 11 | C766: 20.168.074/0002-20 | D766: 1478.8299999999999 | E766: 0 | F766: 0 | G766: 0 | H766: 0 | I766: 0 | J766: 0 | K766: 1629.5599999999999 | L766: 0 | M766: =SUM(J766:L766)-150.73 -> 1478.8299999999999 | N766: 150.72999999999999 | O766: =SUM(M766:N766) -> 1629.5599999999999
A767: 3814 | B767: EOL UMBURANAS 13 | C767: 20.168.462/0002-00 | D767: 1987.97 | E767: 0 | F767: 0 | G767: 0 | H767: 0 | I767: 0 | J767: 0 | K767: 2190.5999999999999 | L767: 0 | M767: =SUM(J767:L767)-202.63 -> 1987.9699999999998 | N767: 202.63 | O767: =SUM(M767:N767) -> 2190.5999999999999
A768: 3815 | B768: EOL UMBURANAS 16 | C768: 20.168.152/0002-96 | D768: 2483.3800000000001 | E768: 0 | F768: 0 | G768: 0 | H768: 0 | I768: 0 | J768: 0 | K768: 2736.5100000000002 | L768: 0 | M768: =SUM(J768:L768)-253.13 -> 2483.3800000000001 | N768: 253.13 | O768: =SUM(M768:N768) -> 2736.5100000000002
A769: 3816 | B769: EOL UMBURANAS 17 | C769: 20.168.158/0002-63 | D769: 2573.77 | E769: 0 | F769: 0 | G769: 0 | H769: 0 | I769: 0 | J769: 0 | K769: 2836.1100000000001 | L769: 0 | M769: =SUM(J769:L769)-262.34 -> 2573.77 | N769: 262.33999999999997 | O769: =SUM(M769:N769) -> 2836.1100000000001
A770: 3817 | B770: EOL UMBURANAS 18 | C770: 20.168.194/0002-27 | D770: 739.01999999999998 | E770: 0 | F770: 0 | G770: 0 | H770: 0 | I770: 0 | J770: 0 | K770: 814.35000000000002 | L770: 0 | M770: =SUM(J770:L770)-75.33 -> 739.01999999999998 | N770: 75.329999999999998 | O770: =SUM(M770:N770) -> 814.35000000000002
A771: 3818 | B771: EOL UMBURANAS 19 | C771: 20.168.112/0002-44 | D771: 2841.9200000000001 | E771: 0 | F771: 0 | G771: 0 | H771: 0 | I771: 0 | J771: 0 | K771: 3131.5900000000001 | L771: 0 | M771: =SUM(J771:L771)-289.67 -> 2841.9200000000001 | N771: 289.67000000000002 | O771: =SUM(M771:N771) -> 3131.5900000000001
A772: 3819 | B772: EOL UMBURANAS 21 | C772: 20.168.743/0002-63 | D772: 2557.4299999999998 | E772: 0 | F772: 0 | G772: 0 | H772: 0 | I772: 0 | J772: 0 | K772: 2818.0999999999999 | L772: 0 | M772: =SUM(J772:L772)-260.67 -> 2557.4299999999998 | N772: 260.67000000000002 | O772: =SUM(M772:N772) -> 2818.0999999999999
A773: 3820 | B773: EOL UMBURANAS 23 | C773: 20.168.788/0002-38 | D773: 1711.0799999999999 | E773: 0 | F773: 0 | G773: 0 | H773: 0 | I773: 0 | J773: 0 | K773: 1885.49 | L773: 0 | M773: =SUM(J773:L773)-174.41 -> 1711.0799999999999 | N773: 174.41 | O773: =SUM(M773:N773) -> 1885.49
A774: 3821 | B774: EOL UMBURANAS 25 | C774: 19.281.805/0002-60 | D774: 1987.02 | E774: 0 | F774: 0 | G774: 0 | H774: 0 | I774: 0 | J774: 0 | K774: 2189.5500000000002 | L774: 0 | M774: =SUM(J774:L774)-202.53 -> 1987.0200000000002 | N774: 202.53 | O774: =SUM(M774:N774) -> 2189.5500000000002
A775: 3822 | B775: UTE AMANDINA II | C775: 21.228.540/0001-05 | D775: 7083.5299999999997 | E775: 0 | F775: 0 | G775: 0 | H775: 0 | I775: 0 | J775: 0 | K775: 7805.54 | L775: 0 | M775: =SUM(J775:L775)-722.01 -> 7083.5299999999997 | N775: 722.00999999999999 | O775: =SUM(M775:N775) -> 7805.54
A776: 3823 | B776: EOL UMBURANAS 9 | C776: 20.168.824/0002-63 | D776: 1726.3800000000001 | E776: 0 | F776: 0 | G776: 0 | H776: 0 | I776: 0 | J776: 0 | K776: 1902.3499999999999 | L776: 0 | M776: =SUM(J776:L776)-175.97 -> 1726.3799999999999 | N776: 175.97 | O776: =SUM(M776:N776) -> 1902.3499999999999
A777: 3824 | B777: EOL UMBURANAS 10 | C777: 20.168.229/0002-28 | D777: 1975.0599999999999 | E777: 0 | F777: 0 | G777: 0 | H777: 0 | I777: 0 | J777: 0 | K777: 2176.3699999999999 | L777: 0 | M777: =SUM(J777:L777)-201.31 -> 1975.0599999999999 | N777: 201.31 | O777: =SUM(M777:N777) -> 2176.3699999999999
A778: 3825 | B778: EOL UMBURANAS 5 | C778: 20.168.051/0002-15 | D778: 1727.01 | E778: 0 | F778: 0 | G778: 0 | H778: 0 | I778: 0 | J778: 0 | K778: 1903.04 | L778: 0 | M778: =SUM(J778:L778)-176.03 -> 1727.01 | N778: 176.03 | O778: =SUM(M778:N778) -> 1903.04
A779: 3826 | B779: EOL UMBURANAS 6 | C779: 20.168.283/0002-73 | D779: 1975.3 | E779: 0 | F779: 0 | G779: 0 | H779: 0 | I779: 0 | J779: 0 | K779: 2176.6399999999999 | L779: 0 | M779: =SUM(J779:L779)-201.34 -> 1975.3 | N779: 201.34 | O779: =SUM(M779:N779) -> 2176.6399999999999
A780: 3827 | B780: UTE PAMPA SUL | C780: 04.739.720/0002-05 | D780: 72416.350000000006 | E780: 0 | F780: 0 | G780: 0 | H780: 0 | I780: 0 | J780: 0 | K780: 79797.630000000005 | L780: 0 | M780: =SUM(J780:L780)-7381.28 -> 72416.350000000006 | N780: 7381.2799999999997 | O780: =SUM(M780:N780) -> 79797.630000000005
A781: 3828 | B781: EOL UMBURANAS 3 | C781: 20.168.215/0002-04 | D781: 1974.5899999999999 | E781: 0 | F781: 0 | G781: 0 | H781: 0 | I781: 0 | J781: 0 | K781: 2175.8600000000001 | L781: 0 | M781: =SUM(J781:L781)-201.27 -> 1974.5900000000001 | N781: 201.27000000000001 | O781: =SUM(M781:N781) -> 2175.8600000000001
A782: 3829 | B782: EOL UMBURANAS 15 | C782: 20.168.124/0002-79 | D782: 1974.5899999999999 | E782: 0 | F782: 0 | G782: 0 | H782: 0 | I782: 0 | J782: 0 | K782: 2175.8600000000001 | L782: 0 | M782: =SUM(J782:L782)-201.27 -> 1974.5900000000001 | N782: 201.27000000000001 | O782: =SUM(M782:N782) -> 2175.8600000000001
A783: 3830 | B783: EOL UMBURANAS 1 | C783: 20.168.187/0002-25 | D783: 2470.9899999999998 | E783: 0 | F783: 0 | G783: 0 | H783: 0 | I783: 0 | J783: 0 | K783: 2722.8499999999999 | L783: 0 | M783: =SUM(J783:L783)-251.86 -> 2470.9899999999998 | N783: 251.86000000000001 | O783: =SUM(M783:N783) -> 2722.8499999999999
A784: 3831 | B784: EOL UMBURANAS 2 | C784: 20.168.242/0002-87 | D784: 2470.9899999999998 | E784: 0 | F784: 0 | G784: 0 | H784: 0 | I784: 0 | J784: 0 | K784: 2722.8499999999999 | L784: 0 | M784: =SUM(J784:L784)-251.86 -> 2470.9899999999998 | N784: 251.86000000000001 | O784: =SUM(M784:N784) -> 2722.8499999999999
A785: 3832 | B785: UHE COLÍDER | C785: 04.370.282/0003-31 | D785: 144391.66 | E785: 0 | F785: 0 | G785: 0 | H785: 0 | I785: 0 | J785: 0 | K785: 159109.26999999999 | L785: 0 | M785: =SUM(J785:L785)-14717.61 -> 144391.65999999997 | N785: 14717.610000000001 | O785: =SUM(M785:N785) -> 159109.26999999996
A786: 3833 | B786: UTE PORTO DE SERGIPE I | C786: 23.758.522/0001-52 | D786: 336254.84999999998 | E786: 0 | F786: 0 | G786: 0 | H786: 0 | I786: 0 | J786: 0 | K786: 370528.76000000001 | L786: 0 | M786: =SUM(J786:L786)-34273.91 -> 336254.84999999998 | N786: 34273.910000000003 | O786: =SUM(M786:N786) -> 370528.76000000001
A787: 3834 | B787: EOL ZEUS II | C787: 25.174.955/0001-96 | D787: 4585.9300000000003 | E787: 0 | F787: 0 | G787: 0 | H787: 0 | I787: 0 | J787: 0 | K787: 5053.3699999999999 | L787: 0 | M787: =SUM(J787:L787)-467.44 -> 4585.9300000000003 | N787: 467.44 | O787: =SUM(M787:N787) -> 5053.3699999999999
A788: 3835 | B788: PCH BANDEIRANTE | C788: 15.743.124/0002-15 | D788: 2141.6199999999999 | E788: 0 | F788: 0 | G788: 0 | H788: 0 | I788: 0 | J788: 0 | K788: 2359.9099999999999 | L788: 0 | M788: =SUM(J788:L788)-218.29 -> 2141.6199999999999 | N788: 218.28999999999999 | O788: =SUM(M788:N788) -> 2359.9099999999999
A789: 3836 | B789: PCH AREADO | C789: 23.670.551/0002-49 | D789: 1194.3299999999999 | E789: 0 | F789: 0 | G789: 0 | H789: 0 | I789: 0 | J789: 0 | K789: 1316.0699999999999 | L789: 0 | M789: =SUM(J789:L789)-121.74 -> 1194.3299999999999 | N789: 121.73999999999999 | O789: =SUM(M789:N789) -> 1316.0699999999999
A790: 3840 | B790: EOL DELTA 7 I | C790: 30.866.542/0002-93 | D790: 3022.4099999999999 | E790: 0 | F790: 0 | G790: 0 | H790: 0 | I790: 0 | J790: 0 | K790: 3330.48 | L790: 0 | M790: =SUM(J790:L790)-308.07 -> 3022.4099999999999 | N790: 308.06999999999999 | O790: =SUM(M790:N790) -> 3330.48
A791: 3841 | B791: EOL DELTA 7 II | C791: 30.905.225/0002-39 | D791: 3953.3800000000001 | E791: 0 | F791: 0 | G791: 0 | H791: 0 | I791: 0 | J791: 0 | K791: 4356.3400000000001 | L791: 0 | M791: =SUM(J791:L791)-402.96 -> 3953.3800000000001 | N791: 402.95999999999998 | O791: =SUM(M791:N791) -> 4356.3400000000001
A792: 3842 | B792: EOL DELTA 8 I | C792: 30.866.547/0002-16 | D792: 3953.3800000000001 | E792: 0 | F792: 0 | G792: 0 | H792: 0 | I792: 0 | J792: 0 | K792: 4356.3400000000001 | L792: 0 | M792: =SUM(J792:L792)-402.96 -> 3953.3800000000001 | N792: 402.95999999999998 | O792: =SUM(M792:N792) -> 4356.3400000000001
A793: 3844 | B793: EOL JANDAIA I | C793: 15.253.373/0002-22 | D793: 410.31 | E793: 0 | F793: 0 | G793: 0 | H793: 0 | I793: 0 | J793: 0 | K793: 452.13 | L793: 0 | M793: =SUM(J793:L793)-41.82 -> 410.31 | N793: 41.82 | O793: =SUM(M793:N793) -> 452.13
A794: 3845 | B794: UFV SÃO GONÇALO 22 | C794: 29.579.676/0001-63 | D794: 7303.04 | E794: 0 | F794: 0 | G794: 0 | H794: 0 | I794: 0 | J794: 0 | K794: 8047.4300000000003 | L794: 0 | M794: =SUM(J794:L794)-744.39 -> 7303.04 | N794: 744.38999999999999 | O794: =SUM(M794:N794) -> 8047.4300000000003
A795: 3846 | B795: EOL VENTOS DE VILA ACRE II | C795: 29.523.731/0001-01 | D795: 4318.3999999999996 | E795: 0 | F795: 0 | G795: 0 | H795: 0 | I795: 0 | J795: 0 | K795: 4758.5699999999997 | L795: 0 | M795: =SUM(J795:L795)-440.17 -> 4318.3999999999996 | N795: 440.17000000000002 | O795: =SUM(M795:N795) -> 4758.5699999999997
A796: 3848 | B796: UHE BALBINA | C796: 00.357.038/0001-16 | D796: 36137.709999999999 | E796: 0 | F796: 0 | G796: 0 | H796: 0 | I796: 0 | J796: 0 | K796: 39821.169999999998 | L796: 0 | M796: =SUM(J796:L796)-3683.46 -> 36137.709999999999 | N796: 3683.46 | O796: =SUM(M796:N796) -> 39821.169999999998
A797: 3849 | B797: UFV SÃO GONÇALO 1 | C797: 25.176.404/0001-61 | D797: 6672.0500000000002 | E797: 0 | F797: 0 | G797: 0 | H797: 0 | I797: 0 | J797: 0 | K797: 7352.1199999999999 | L797: 0 | M797: =SUM(J797:L797)-680.07 -> 6672.0500000000002 | N797: 680.07000000000005 | O797: =SUM(M797:N797) -> 7352.1199999999999
A798: 3850 | B798: UFV SÃO GONÇALO 21 | C798: 29.325.940/0001-32 | D798: 7303.04 | E798: 0 | F798: 0 | G798: 0 | H798: 0 | I798: 0 | J798: 0 | K798: 8047.4300000000003 | L798: 0 | M798: =SUM(J798:L798)-744.39 -> 7303.04 | N798: 744.38999999999999 | O798: =SUM(M798:N798) -> 8047.4300000000003
A799: 3851 | B799: EOL VENTOS DE VILA CEARÁ II | C799: 29.498.495/0001-02 | D799: 4561.3000000000002 | E799: 0 | F799: 0 | G799: 0 | H799: 0 | I799: 0 | J799: 0 | K799: 5026.2299999999996 | L799: 0 | M799: =SUM(J799:L799)-464.93 -> 4561.2999999999993 | N799: 464.93000000000001 | O799: =SUM(M799:N799) -> 5026.2299999999996
A800: 3852 | B800: EOL VENTOS DE VILA CEARÁ I | C800: 29.498.486/0001-11 | D800: 4691.4300000000003 | E800: 0 | F800: 0 | G800: 0 | H800: 0 | I800: 0 | J800: 0 | K800: 5169.6199999999999 | L800: 0 | M800: =SUM(J800:L800)-478.19 -> 4691.4300000000003 | N800: 478.19 | O800: =SUM(M800:N800) -> 5169.6199999999999
A801: 3853 | B801: UFV SÃO GONÇALO 2 | C801: 29.310.192/0001-14 | D801: 7303.04 | E801: 0 | F801: 0 | G801: 0 | H801: 0 | I801: 0 | J801: 0 | K801: 8047.4300000000003 | L801: 0 | M801: =SUM(J801:L801)-744.39 -> 7303.04 | N801: 744.38999999999999 | O801: =SUM(M801:N801) -> 8047.4300000000003
A802: 3854 | B802: UFV SÃO GONÇALO 3 | C802: 29.298.774/0001-22 | D802: 6672.0500000000002 | E802: 0 | F802: 0 | G802: 0 | H802: 0 | I802: 0 | J802: 0 | K802: 7352.1199999999999 | L802: 0 | M802: =SUM(J802:L802)-680.07 -> 6672.0500000000002 | N802: 680.07000000000005 | O802: =SUM(M802:N802) -> 7352.1199999999999
A803: 3855 | B803: EOL VILA RIO GRANDE DO NORTE I | C803: 29.401.264/0002-10 | D803: 2948.52 | E803: 0 | F803: 0 | G803: 0 | H803: 0 | I803: 0 | J803: 0 | K803: 3249.0599999999999 | L803: 0 | M803: =SUM(J803:L803)-300.54 -> 2948.52 | N803: 300.54000000000002 | O803: =SUM(M803:N803) -> 3249.0599999999999
A804: 3856 | B804: EOL VILA RIO GRANDE DO NORTE II | C804: 29.320.977/0002-59 | D804: 4422.1800000000003 | E804: 0 | F804: 0 | G804: 0 | H804: 0 | I804: 0 | J804: 0 | K804: 4872.9300000000003 | L804: 0 | M804: =SUM(J804:L804)-450.75 -> 4422.1800000000003 | N804: 450.75 | O804: =SUM(M804:N804) -> 4872.9300000000003
A805: 3857 | B805: EOL VILA SERGIPE I | C805: 29.330.011/0002-00 | D805: 4428.1800000000003 | E805: 0 | F805: 0 | G805: 0 | H805: 0 | I805: 0 | J805: 0 | K805: 4879.54 | L805: 0 | M805: =SUM(J805:L805)-451.36 -> 4428.1800000000003 | N805: 451.36000000000001 | O805: =SUM(M805:N805) -> 4879.54
A806: 3858 | B806: EOL VENTOS DE VILA PARAÍBA II | C806: 29.498.479/0001-10 | D806: 4469.6300000000001 | E806: 0 | F806: 0 | G806: 0 | H806: 0 | I806: 0 | J806: 0 | K806: 4925.21 | L806: 0 | M806: =SUM(J806:L806)-455.58 -> 4469.6300000000001 | N806: 455.57999999999998 | O806: =SUM(M806:N806) -> 4925.21
A807: 3859 | B807: UFV ETESA 17 SÃO JOÃO DO PIAUÍ I | C807: 30.520.122/0001-70 | D807: 4671.7299999999996 | E807: 0 | F807: 0 | G807: 0 | H807: 0 | I807: 0 | J807: 0 | K807: 5147.9099999999999 | L807: 0 | M807: =SUM(J807:L807)-476.18 -> 4671.7299999999996 | N807: 476.18000000000001 | O807: =SUM(M807:N807) -> 5147.9099999999999
A808: 3860 | B808: UFV ETESA 18 SÃO JOÃO DO PIAUÍ II | C808: 30.432.072/0001-79 | D808: 4671.7299999999996 | E808: 0 | F808: 0 | G808: 0 | H808: 0 | I808: 0 | J808: 0 | K808: 5147.9099999999999 | L808: 0 | M808: =SUM(J808:L808)-476.18 -> 4671.7299999999996 | N808: 476.18000000000001 | O808: =SUM(M808:N808) -> 5147.9099999999999
A809: 3861 | B809: UFV ETESA 19 SÃO JOÃO DO PIAUÍ III | C809: 30.486.042/0001-45 | D809: 4671.7299999999996 | E809: 0 | F809: 0 | G809: 0 | H809: 0 | I809: 0 | J809: 0 | K809: 5147.9099999999999 | L809: 0 | M809: =SUM(J809:L809)-476.18 -> 4671.7299999999996 | N809: 476.18000000000001 | O809: =SUM(M809:N809) -> 5147.9099999999999
A810: 3862 | B810: UFV ETESA 20 SÃO JOÃO DO PIAUÍ IV | C810: 30.425.445/0001-84 | D810: 4189.3699999999999 | E810: 0 | F810: 0 | G810: 0 | H810: 0 | I810: 0 | J810: 0 | K810: 4616.3900000000003 | L810: 0 | M810: =SUM(J810:L810)-427.02 -> 4189.3700000000008 | N810: 427.01999999999998 | O810: =SUM(M810:N810) -> 4616.3900000000012
A811: 3863 | B811: UFV ETESA 21 SÃO JOÃO DO PIAUÍ V | C811: 30.456.405/0001-08 | D811: 4189.3699999999999 | E811: 0 | F811: 0 | G811: 0 | H811: 0 | I811: 0 | J811: 0 | K811: 4616.3900000000003 | L811: 0 | M811: =SUM(J811:L811)-427.02 -> 4189.3700000000008 | N811: 427.01999999999998 | O811: =SUM(M811:N811) -> 4616.3900000000012
A812: 3864 | B812: UFV ETESA 22 SÃO JOÃO DO PIAUÍ VI | C812: 30.421.756/0001-75 | D812: 4628.9499999999998 | E812: 0 | F812: 0 | G812: 0 | H812: 0 | I812: 0 | J812: 0 | K812: 5100.7700000000004 | L812: 0 | M812: =SUM(J812:L812)-471.82 -> 4628.9500000000007 | N812: 471.81999999999999 | O812: =SUM(M812:N812) -> 5100.7700000000004
A813: 3865 | B813: UFV SÃO GONÇALO 4 | C813: 29.300.841/0001-04 | D813: 7303.04 | E813: 0 | F813: 0 | G813: 0 | H813: 0 | I813: 0 | J813: 0 | K813: 8047.4300000000003 | L813: 0 | M813: =SUM(J813:L813)-744.39 -> 7303.04 | N813: 744.38999999999999 | O813: =SUM(M813:N813) -> 8047.4300000000003
A814: 3866 | B814: UFV SÃO GONÇALO 10 | C814: 29.325.687/0001-17 | D814: 7303.04 | E814: 0 | F814: 0 | G814: 0 | H814: 0 | I814: 0 | J814: 0 | K814: 8047.4300000000003 | L814: 0 | M814: =SUM(J814:L814)-744.39 -> 7303.04 | N814: 744.38999999999999 | O814: =SUM(M814:N814) -> 8047.4300000000003
A815: 3867 | B815: EOL VENTOS DE VILA PARAÍBA I | C815: 29.523.723/0001-57 | D815: 4732.8599999999997 | E815: 0 | F815: 0 | G815: 0 | H815: 0 | I815: 0 | J815: 0 | K815: 5215.2700000000004 | L815: 0 | M815: =SUM(J815:L815)-482.41 -> 4732.8600000000006 | N815: 482.41000000000003 | O815: =SUM(M815:N815) -> 5215.2700000000004
A816: 3868 | B816: UFV SÃO GONÇALO 5 | C816: 29.298.803/0001-56 | D816: 7303.04 | E816: 0 | F816: 0 | G816: 0 | H816: 0 | I816: 0 | J816: 0 | K816: 8047.4300000000003 | L816: 0 | M816: =SUM(J816:L816)-744.39 -> 7303.04 | N816: 744.38999999999999 | O816: =SUM(M816:N816) -> 8047.4300000000003
A817: 3869 | B817: UFV SÃO GONÇALO 6 | C817: 29.710.913/0001-83 | D817: 6022.4799999999996 | E817: 0 | F817: 0 | G817: 0 | H817: 0 | I817: 0 | J817: 0 | K817: 6636.3400000000001 | L817: 0 | M817: =SUM(J817:L817)-613.86 -> 6022.4800000000005 | N817: 613.86000000000001 | O817: =SUM(M817:N817) -> 6636.3400000000001
A818: 3870 | B818: EOL VENTOS DE SÃO JANUÁRIO 20 | C818: 14.675.949/0002-87 | D818: 854.77999999999997 | E818: 0 | F818: 0 | G818: 0 | H818: 0 | I818: 0 | J818: 0 | K818: 941.90999999999997 | L818: 0 | M818: =SUM(J818:L818)-87.13 -> 854.77999999999997 | N818: 87.129999999999995 | O818: =SUM(M818:N818) -> 941.90999999999997
A819: 3871 | B819: EOL VENTOS DE SÃO JANUÁRIO 21 | C819: 22.777.483/0002-59 | D819: 854.77999999999997 | E819: 0 | F819: 0 | G819: 0 | H819: 0 | I819: 0 | J819: 0 | K819: 941.90999999999997 | L819: 0 | M819: =SUM(J819:L819)-87.13 -> 854.77999999999997 | N819: 87.129999999999995 | O819: =SUM(M819:N819) -> 941.90999999999997
A820: 3872 | B820: EOL VILA SERGIPE II | C820: 30.321.925/0002-86 | D820: 4561.7299999999996 | E820: 0 | F820: 0 | G820: 0 | H820: 0 | I820: 0 | J820: 0 | K820: 5026.6999999999998 | L820: 0 | M820: =SUM(J820:L820)-464.97 -> 4561.7299999999996 | N820: 464.97000000000003 | O820: =SUM(M820:N820) -> 5026.6999999999998
A821: 3873 | B821: EOL VILA MARANHÃO III | C821: 31.449.173/0001-15 | D821: 4533.3699999999999 | E821: 0 | F821: 0 | G821: 0 | H821: 0 | I821: 0 | J821: 0 | K821: 4995.4499999999998 | L821: 0 | M821: =SUM(J821:L821)-462.08 -> 4533.3699999999999 | N821: 462.07999999999998 | O821: =SUM(M821:N821) -> 4995.4499999999998
A822: 3874 | B822: UHE GOV BENTO MUNHOZ (FOZ DO AREIA) | C822: 35.742.218/0001-04 | D822: 318280.10999999999 | E822: 0 | F822: 0 | G822: 0 | H822: 0 | I822: 0 | J822: 0 | K822: 350721.88 | L822: 0 | M822: =SUM(J822:L822)-32441.77 -> 318280.10999999999 | N822: 32441.77 | O822: =SUM(M822:N822) -> 350721.88
A823: 3875 | B823: RENOVA (EOL PAU SANTO) | C823: 18.560.214/0001-88 | D823: 1951.26 | E823: 0 | F823: 0 | G823: 0 | H823: 0 | I823: 0 | J823: 0 | K823: 2150.1500000000001 | L823: 0 | M823: =SUM(J823:L823)-198.89 -> 1951.2600000000002 | N823: 198.88999999999999 | O823: =SUM(M823:N823) -> 2150.1500000000001
A824: 3876 | B824: UFV SÃO GONÇALO 7 | C824: 29.618.737/0001-54 | D824: 4554.0500000000002 | E824: 0 | F824: 0 | G824: 0 | H824: 0 | I824: 0 | J824: 0 | K824: 5018.2399999999998 | L824: 0 | M824: =SUM(J824:L824)-464.19 -> 4554.0500000000002 | N824: 464.19 | O824: =SUM(M824:N824) -> 5018.2399999999998
A825: 3877 | B825: UFV SÃO GONÇALO 8 | C825: 29.618.787/0001-31 | D825: 4554.0500000000002 | E825: 0 | F825: 0 | G825: 0 | H825: 0 | I825: 0 | J825: 0 | K825: 5018.2399999999998 | L825: 0 | M825: =SUM(J825:L825)-464.19 -> 4554.0500000000002 | N825: 464.19 | O825: =SUM(M825:N825) -> 5018.2399999999998
A826: 3878 | B826: UFV SÃO GONÇALO 11 | C826: 29.617.203/0001-03 | D826: 4554.0500000000002 | E826: 0 | F826: 0 | G826: 0 | H826: 0 | I826: 0 | J826: 0 | K826: 5018.2399999999998 | L826: 0 | M826: =SUM(J826:L826)-464.19 -> 4554.0500000000002 | N826: 464.19 | O826: =SUM(M826:N826) -> 5018.2399999999998
A827: 3879 | B827: UFV SÃO GONÇALO 12 | C827: 29.711.106/0001-85 | D827: 4554.0500000000002 | E827: 0 | F827: 0 | G827: 0 | H827: 0 | I827: 0 | J827: 0 | K827: 5018.2399999999998 | L827: 0 | M827: =SUM(J827:L827)-464.19 -> 4554.0500000000002 | N827: 464.19 | O827: =SUM(M827:N827) -> 5018.2399999999998
A828: 3880 | B828: EOL VILA SERGIPE III | C828: 30.311.178/0002-03 | D828: 2022.77 | E828: 0 | F828: 0 | G828: 0 | H828: 0 | I828: 0 | J828: 0 | K828: 2228.9499999999998 | L828: 0 | M828: =SUM(J828:L828)-206.18 -> 2022.7699999999998 | N828: 206.18000000000001 | O828: =SUM(M828:N828) -> 2228.9499999999998
A829: 3881 | B829: EOL VILA CEARÁ I | C829: 31.478.575/0001-48 | D829: 4526.1400000000003 | E829: 0 | F829: 0 | G829: 0 | H829: 0 | I829: 0 | J829: 0 | K829: 4987.4799999999996 | L829: 0 | M829: =SUM(J829:L829)-461.34 -> 4526.1399999999994 | N829: 461.33999999999997 | O829: =SUM(M829:N829) -> 4987.4799999999996
A830: 3882 | B830: EOL VENTOS DE SÃO JANUÁRIO 22 | C830: 13.346.056/0002-25 | D830: 854.77999999999997 | E830: 0 | F830: 0 | G830: 0 | H830: 0 | I830: 0 | J830: 0 | K830: 941.90999999999997 | L830: 0 | M830: =SUM(J830:L830)-87.13 -> 854.77999999999997 | N830: 87.129999999999995 | O830: =SUM(M830:N830) -> 941.90999999999997
A831: 3883 | B831: EOL VILA PIAUÍ III | C831: 30.311.141/0002-77 | D831: 5069.2799999999997 | E831: 0 | F831: 0 | G831: 0 | H831: 0 | I831: 0 | J831: 0 | K831: 5585.9799999999996 | L831: 0 | M831: =SUM(J831:L831)-516.7 -> 5069.2799999999997 | N831: 516.70000000000005 | O831: =SUM(M831:N831) -> 5585.9799999999996
A832: 3884 | B832: EOL VENTOS DE SANTA ÂNGELA 1 | C832: 25.174.579/0001-30 | D832: 4899.6099999999997 | E832: 0 | F832: 0 | G832: 0 | H832: 0 | I832: 0 | J832: 0 | K832: 5399.0200000000004 | L832: 0 | M832: =SUM(J832:L832)-499.41 -> 4899.6100000000006 | N832: 499.41000000000003 | O832: =SUM(M832:N832) -> 5399.0200000000004
A833: 3885 | B833: EOL VENTOS DE SANTA ÂNGELA 2 | C833: 25.176.787/0001-78 | D833: 4899.6099999999997 | E833: 0 | F833: 0 | G833: 0 | H833: 0 | I833: 0 | J833: 0 | K833: 5399.0200000000004 | L833: 0 | M833: =SUM(J833:L833)-499.41 -> 4899.6100000000006 | N833: 499.41000000000003 | O833: =SUM(M833:N833) -> 5399.0200000000004
A834: 3886 | B834: EOL VENTOS DE SANTA ÂNGELA 3 | C834: 25.289.277/0001-07 | D834: 4899.6099999999997 | E834: 0 | F834: 0 | G834: 0 | H834: 0 | I834: 0 | J834: 0 | K834: 5399.0200000000004 | L834: 0 | M834: =SUM(J834:L834)-499.41 -> 4899.6100000000006 | N834: 499.41000000000003 | O834: =SUM(M834:N834) -> 5399.0200000000004
A835: 3887 | B835: EOL VENTOS DE SANTA ÂNGELA 4 | C835: 25.289.246/0001-56 | D835: 4899.6099999999997 | E835: 0 | F835: 0 | G835: 0 | H835: 0 | I835: 0 | J835: 0 | K835: 5399.0200000000004 | L835: 0 | M835: =SUM(J835:L835)-499.41 -> 4899.6100000000006 | N835: 499.41000000000003 | O835: =SUM(M835:N835) -> 5399.0200000000004
A836: 3888 | B836: EOL VENTOS DE SANTA ÂNGELA 9 | C836: 29.616.957/0001-49 | D836: 6900.7200000000003 | E836: 0 | F836: 0 | G836: 0 | H836: 0 | I836: 0 | J836: 0 | K836: 7604.1000000000004 | L836: 0 | M836: =SUM(J836:L836)-703.38 -> 6900.7200000000003 | N836: 703.38 | O836: =SUM(M836:N836) -> 7604.1000000000004
A837: 3889 | B837: EOL VENTOS DE SANTA ÂNGELA 10 | C837: 29.616.881/0001-51 | D837: 6413.3100000000004 | E837: 0 | F837: 0 | G837: 0 | H837: 0 | I837: 0 | J837: 0 | K837: 7067.0100000000002 | L837: 0 | M837: =SUM(J837:L837)-653.7 -> 6413.3100000000004 | N837: 653.70000000000005 | O837: =SUM(M837:N837) -> 7067.0100000000002
A838: 3890 | B838: EOL VENTOS DE SANTA ÂNGELA 11 | C838: 29.552.535/0001-57 | D838: 6937.5200000000004 | E838: 0 | F838: 0 | G838: 0 | H838: 0 | I838: 0 | J838: 0 | K838: 7644.6499999999996 | L838: 0 | M838: =SUM(J838:L838)-707.13 -> 6937.5199999999995 | N838: 707.13 | O838: =SUM(M838:N838) -> 7644.6499999999996
A839: 3891 | B839: EOL VENTOS DE SANTA ÂNGELA 14 | C839: 29.576.419/0001-78 | D839: 6701.71 | E839: 0 | F839: 0 | G839: 0 | H839: 0 | I839: 0 | J839: 0 | K839: 7384.8000000000002 | L839: 0 | M839: =SUM(J839:L839)-683.09 -> 6701.71 | N839: 683.09000000000003 | O839: =SUM(M839:N839) -> 7384.8000000000002
A840: 3892 | B840: EOL VENTOS DE SANTA ÂNGELA 15 | C840: 29.559.244/0001-90 | D840: 6805.2700000000004 | E840: 0 | F840: 0 | G840: 0 | H840: 0 | I840: 0 | J840: 0 | K840: 7498.9200000000001 | L840: 0 | M840: =SUM(J840:L840)-693.65 -> 6805.2700000000004 | N840: 693.64999999999998 | O840: =SUM(M840:N840) -> 7498.9200000000001
A841: 3893 | B841: EOL VILA MARANHÃO I | C841: 30.097.726/0001-55 | D841: 4637.9799999999996 | E841: 0 | F841: 0 | G841: 0 | H841: 0 | I841: 0 | J841: 0 | K841: 5110.7200000000003 | L841: 0 | M841: =SUM(J841:L841)-472.74 -> 4637.9800000000005 | N841: 472.74000000000001 | O841: =SUM(M841:N841) -> 5110.7200000000003
A842: 3894 | B842: EOL INHAMBU 2 | C842: 30.519.343/0001-28 | D842: 1978.3800000000001 | E842: 0 | F842: 0 | G842: 0 | H842: 0 | I842: 0 | J842: 0 | K842: 2180.0300000000002 | L842: 0 | M842: =SUM(J842:L842)-201.65 -> 1978.3800000000001 | N842: 201.65000000000001 | O842: =SUM(M842:N842) -> 2180.0300000000002
A843: 3895 | B843: EOL VILA PIAUÍ I | C843: 30.321.883/0002-83 | D843: 4551.8500000000004 | E843: 0 | F843: 0 | G843: 0 | H843: 0 | I843: 0 | J843: 0 | K843: 5015.8100000000004 | L843: 0 | M843: =SUM(J843:L843)-463.96 -> 4551.8500000000004 | N843: 463.95999999999998 | O843: =SUM(M843:N843) -> 5015.8100000000004
A844: 3896 | B844: EOL VILA PIAUÍ II | C844: 30.311.116/0002-93 | D844: 4546.9099999999999 | E844: 0 | F844: 0 | G844: 0 | H844: 0 | I844: 0 | J844: 0 | K844: 5010.3699999999999 | L844: 0 | M844: =SUM(J844:L844)-463.46 -> 4546.9099999999999 | N844: 463.45999999999998 | O844: =SUM(M844:N844) -> 5010.3699999999999
A845: 3897 | B845: EOL VENTOS DE SÃO JANUÁRIO 13 | C845: 30.558.294/0001-32 | D845: 726.35000000000002 | E845: 0 | F845: 0 | G845: 0 | H845: 0 | I845: 0 | J845: 0 | K845: 800.38999999999999 | L845: 0 | M845: =SUM(J845:L845)-74.04 -> 726.35000000000002 | N845: 74.040000000000006 | O845: =SUM(M845:N845) -> 800.38999999999999
A846: 3898 | B846: EOL VILA MARANHÃO II | C846: 31.004.703/0001-11 | D846: 4534.96 | E846: 0 | F846: 0 | G846: 0 | H846: 0 | I846: 0 | J846: 0 | K846: 4997.1999999999998 | L846: 0 | M846: =SUM(J846:L846)-462.24 -> 4534.96 | N846: 462.24000000000001 | O846: =SUM(M846:N846) -> 4997.1999999999998
A847: 3899 | B847: EOL VENTOS DE SANTA ÂNGELA 5 | C847: 25.289.292/0001-55 | D847: 4872.5200000000004 | E847: 0 | F847: 0 | G847: 0 | H847: 0 | I847: 0 | J847: 0 | K847: 5369.1700000000001 | L847: 0 | M847: =SUM(J847:L847)-496.65 -> 4872.5200000000004 | N847: 496.64999999999998 | O847: =SUM(M847:N847) -> 5369.1700000000001
A848: 3900 | B848: EOL VENTOS DE SANTA ÂNGELA 6 | C848: 25.289.215/0001-03 | D848: 4872.5200000000004 | E848: 0 | F848: 0 | G848: 0 | H848: 0 | I848: 0 | J848: 0 | K848: 5369.1700000000001 | L848: 0 | M848: =SUM(J848:L848)-496.65 -> 4872.5200000000004 | N848: 496.64999999999998 | O848: =SUM(M848:N848) -> 5369.1700000000001
A849: 3901 | B849: EOL VENTOS DE SANTA ÂNGELA 7 | C849: 25.289.312/0001-98 | D849: 3897.3800000000001 | E849: 0 | F849: 0 | G849: 0 | H849: 0 | I849: 0 | J849: 0 | K849: 4294.6300000000001 | L849: 0 | M849: =SUM(J849:L849)-397.25 -> 3897.3800000000001 | N849: 397.25 | O849: =SUM(M849:N849) -> 4294.6300000000001
A850: 3902 | B850: EOL VENTOS DE SANTA ÂNGELA 8 | C850: 29.559.160/0001-57 | D850: 4872.5200000000004 | E850: 0 | F850: 0 | G850: 0 | H850: 0 | I850: 0 | J850: 0 | K850: 5369.1700000000001 | L850: 0 | M850: =SUM(J850:L850)-496.65 -> 4872.5200000000004 | N850: 496.64999999999998 | O850: =SUM(M850:N850) -> 5369.1700000000001
A851: 3903 | B851: EOL VENTOS DE SÃO JANUÁRIO 14 | C851: 30.558.337/0001-80 | D851: 726.35000000000002 | E851: 0 | F851: 0 | G851: 0 | H851: 0 | I851: 0 | J851: 0 | K851: 800.38999999999999 | L851: 0 | M851: =SUM(J851:L851)-74.04 -> 726.35000000000002 | N851: 74.040000000000006 | O851: =SUM(M851:N851) -> 800.38999999999999
A852: 3904 | B852: EOL SÃO FERNANDO I | C852: 23.008.029/0001-15 | D852: 9544.5900000000001 | E852: 0 | F852: 0 | G852: 0 | H852: 0 | I852: 0 | J852: 0 | K852: 10517.450000000001 | L852: 0 | M852: =SUM(J852:L852)-972.86 -> 9544.5900000000001 | N852: 972.86000000000001 | O852: =SUM(M852:N852) -> 10517.450000000001
A853: 3905 | B853: EOL SÃO FERNANDO II | C853: 32.132.033/0001-81 | D853: 10838.58 | E853: 0 | F853: 0 | G853: 0 | H853: 0 | I853: 0 | J853: 0 | K853: 11943.34 | L853: 0 | M853: =SUM(J853:L853)-1104.76 -> 10838.58 | N853: 1104.76 | O853: =SUM(M853:N853) -> 11943.34
A854: 3906 | B854: EOL CORRUPIÃO 2 | C854: 30.519.369/0001-76 | D854: 2276.1599999999999 | E854: 0 | F854: 0 | G854: 0 | H854: 0 | I854: 0 | J854: 0 | K854: 2508.1700000000001 | L854: 0 | M854: =SUM(J854:L854)-232.01 -> 2276.1599999999999 | N854: 232.00999999999999 | O854: =SUM(M854:N854) -> 2508.1700000000001
A855: 3907 | B855: EOL VENTOS DE SÃO JANUÁRIO 04 | C855: 30.558.320/0001-22 | D855: 4303.4399999999996 | E855: 0 | F855: 0 | G855: 0 | H855: 0 | I855: 0 | J855: 0 | K855: 4742.0799999999999 | L855: 0 | M855: =SUM(J855:L855)-438.64 -> 4303.4399999999996 | N855: 438.63999999999999 | O855: =SUM(M855:N855) -> 4742.0799999999999
A856: 3908 | B856: EOL SERRA DO FOGO | C856: 33.295.705/0002-13 | D856: 3947.3899999999999 | E856: 0 | F856: 0 | G856: 0 | H856: 0 | I856: 0 | J856: 0 | K856: 4349.7399999999998 | L856: 0 | M856: =SUM(J856:L856)-402.35 -> 3947.3899999999999 | N856: 402.35000000000002 | O856: =SUM(M856:N856) -> 4349.7399999999998
A857: 3909 | B857: EOL SERRA DO VENTO | C857: 33.269.273/0002-76 | D857: 3947.3899999999999 | E857: 0 | F857: 0 | G857: 0 | H857: 0 | I857: 0 | J857: 0 | K857: 4349.7399999999998 | L857: 0 | M857: =SUM(J857:L857)-402.35 -> 3947.3899999999999 | N857: 402.35000000000002 | O857: =SUM(M857:N857) -> 4349.7399999999998
A858: 3910 | B858: EOL VENTOS DE SÃO JANUÁRIO 01 | C858: 30.558.359/0001-40 | D858: 4918.21 | E858: 0 | F858: 0 | G858: 0 | H858: 0 | I858: 0 | J858: 0 | K858: 5419.5200000000004 | L858: 0 | M858: =SUM(J858:L858)-501.31 -> 4918.21 | N858: 501.31 | O858: =SUM(M858:N858) -> 5419.5200000000004
A859: 3911 | B859: EOL VENTOS DE SÃO JANUÁRIO 03 | C859: 31.818.977/0001-44 | D859: 5310.6099999999997 | E859: 0 | F859: 0 | G859: 0 | H859: 0 | I859: 0 | J859: 0 | K859: 5851.9099999999999 | L859: 0 | M859: =SUM(J859:L859)-541.3 -> 5310.6099999999997 | N859: 541.29999999999995 | O859: =SUM(M859:N859) -> 5851.9099999999999
A860: 3912 | B860: EOL CASA NOVA A | C860: 33.541.368/0001-16 | D860: 3349.75 | E860: 0 | F860: 0 | G860: 0 | H860: 0 | I860: 0 | J860: 0 | K860: 3691.1799999999998 | L860: 0 | M860: =SUM(J860:L860)-341.43 -> 3349.75 | N860: 341.43000000000001 | O860: =SUM(M860:N860) -> 3691.1799999999998
A861: 3913 | B861: EOL VENTOS DE SÃO JANUÁRIO 05 | C861: 31.818.981/0001-02 | D861: 726.35000000000002 | E861: 0 | F861: 0 | G861: 0 | H861: 0 | I861: 0 | J861: 0 | K861: 800.38999999999999 | L861: 0 | M861: =SUM(J861:L861)-74.04 -> 726.35000000000002 | N861: 74.040000000000006 | O861: =SUM(M861:N861) -> 800.38999999999999
A862: 3914 | B862: EOL UMBURANA DE CHEIRO | C862: 33.295.664/0002-65 | D862: 3947.3899999999999 | E862: 0 | F862: 0 | G862: 0 | H862: 0 | I862: 0 | J862: 0 | K862: 4349.7399999999998 | L862: 0 | M862: =SUM(J862:L862)-402.35 -> 3947.3899999999999 | N862: 402.35000000000002 | O862: =SUM(M862:N862) -> 4349.7399999999998
A863: 3915 | B863: EOL ARARINHA AZUL | C863: 30.519.323/0001-57 | D863: 2709.1700000000001 | E863: 0 | F863: 0 | G863: 0 | H863: 0 | I863: 0 | J863: 0 | K863: 2985.3099999999999 | L863: 0 | M863: =SUM(J863:L863)-276.14 -> 2709.1700000000001 | N863: 276.13999999999999 | O863: =SUM(M863:N863) -> 2985.3099999999999
A864: 3916 | B864: EOL CAMPO LARGO IX | C864: 17.995.695/0002-72 | D864: 3226.1500000000001 | E864: 0 | F864: 0 | G864: 0 | H864: 0 | I864: 0 | J864: 0 | K864: 3554.9899999999998 | L864: 0 | M864: =SUM(J864:L864)-328.84 -> 3226.1499999999996 | N864: 328.83999999999997 | O864: =SUM(M864:N864) -> 3554.9899999999998
A865: 3917 | B865: EOL CAMPO LARGO X | C865: 17.815.305/0002-35 | D865: 4284.7200000000003 | E865: 0 | F865: 0 | G865: 0 | H865: 0 | I865: 0 | J865: 0 | K865: 4721.4499999999998 | L865: 0 | M865: =SUM(J865:L865)-436.73 -> 4284.7199999999993 | N865: 436.73000000000002 | O865: =SUM(M865:N865) -> 4721.4499999999989
A866: 3918 | B866: EOL CAMPO LARGO XIV | C866: 17.829.499/0002-28 | D866: 2680.0500000000002 | E866: 0 | F866: 0 | G866: 0 | H866: 0 | I866: 0 | J866: 0 | K866: 2953.2199999999998 | L866: 0 | M866: =SUM(J866:L866)-273.17 -> 2680.0499999999997 | N866: 273.17000000000002 | O866: =SUM(M866:N866) -> 2953.2199999999998
A867: 3919 | B867: EOL VENTOS DE SÃO FERNANDO 3 | C867: 32.671.163/0001-92 | D867: 2942.5599999999999 | E867: 0 | F867: 0 | G867: 0 | H867: 0 | I867: 0 | J867: 0 | K867: 3242.4899999999998 | L867: 0 | M867: =SUM(J867:L867)-299.93 -> 2942.5599999999999 | N867: 299.93000000000001 | O867: =SUM(M867:N867) -> 3242.4899999999998
A868: 3920 | B868: EOL CAMPO LARGO XVII | C868: 17.916.887/0002-46 | D868: 3762.9299999999998 | E868: 0 | F868: 0 | G868: 0 | H868: 0 | I868: 0 | J868: 0 | K868: 4146.4799999999996 | L868: 0 | M868: =SUM(J868:L868)-383.55 -> 3762.9299999999994 | N868: 383.55000000000001 | O868: =SUM(M868:N868) -> 4146.4799999999996
A869: 3921 | B869: EOL CAMPO LARGO XIX | C869: 17.928.213/0002-61 | D869: 4281.3100000000004 | E869: 0 | F869: 0 | G869: 0 | H869: 0 | I869: 0 | J869: 0 | K869: 4717.6999999999998 | L869: 0 | M869: =SUM(J869:L869)-436.39 -> 4281.3099999999995 | N869: 436.38999999999999 | O869: =SUM(M869:N869) -> 4717.6999999999998
A870: 3922 | B870: EOL TEIÚ 3 | C870: 30.534.321/0001-37 | D870: 3003.96 | E870: 0 | F870: 0 | G870: 0 | H870: 0 | I870: 0 | J870: 0 | K870: 3310.1500000000001 | L870: 0 | M870: =SUM(J870:L870)-306.19 -> 3003.96 | N870: 306.19 | O870: =SUM(M870:N870) -> 3310.1500000000001
A871: 3923 | B871: EOL SERROTE II | C871: 32.398.720/0001-43 | D871: 2784.9200000000001 | E871: 0 | F871: 0 | G871: 0 | H871: 0 | I871: 0 | J871: 0 | K871: 3068.7800000000002 | L871: 0 | M871: =SUM(J871:L871)-283.86 -> 2784.9200000000001 | N871: 283.86000000000001 | O871: =SUM(M871:N871) -> 3068.7800000000002
A872: 3924 | B872: EOL SERROTE III | C872: 32.398.682/0001-29 | D872: 2319.8200000000002 | E872: 0 | F872: 0 | G872: 0 | H872: 0 | I872: 0 | J872: 0 | K872: 2556.2800000000002 | L872: 0 | M872: =SUM(J872:L872)-236.46 -> 2319.8200000000002 | N872: 236.46000000000001 | O872: =SUM(M872:N872) -> 2556.2800000000002
A873: 3925 | B873: EOL VENTOS DE SÃO JANUÁRIO 06 | C873: 31.810.453/0001-07 | D873: 653.71000000000004 | E873: 0 | F873: 0 | G873: 0 | H873: 0 | I873: 0 | J873: 0 | K873: 720.34000000000003 | L873: 0 | M873: =SUM(J873:L873)-66.63 -> 653.71000000000004 | N873: 66.629999999999995 | O873: =SUM(M873:N873) -> 720.34000000000003
A874: 3926 | B874: EOL VENTOS DE SÃO JANUÁRIO 11 | C874: 31.810.445/0001-60 | D874: 6638.2700000000004 | E874: 0 | F874: 0 | G874: 0 | H874: 0 | I874: 0 | J874: 0 | K874: 7314.8999999999996 | L874: 0 | M874: =SUM(J874:L874)-676.63 -> 6638.2699999999995 | N874: 676.63 | O874: =SUM(M874:N874) -> 7314.8999999999996
A875: 3927 | B875: EOL AVENTURA II | C875: 17.875.511/0002-30 | D875: 3179.7199999999998 | E875: 0 | F875: 0 | G875: 0 | H875: 0 | I875: 0 | J875: 0 | K875: 3503.8200000000002 | L875: 0 | M875: =SUM(J875:L875)-324.1 -> 3179.7200000000003 | N875: 324.10000000000002 | O875: =SUM(M875:N875) -> 3503.8200000000002
A876: 3928 | B876: EOL AVENTURA IV | C876: 28.525.891/0002-08 | D876: 4475.3900000000003 | E876: 0 | F876: 0 | G876: 0 | H876: 0 | I876: 0 | J876: 0 | K876: 4931.5600000000004 | L876: 0 | M876: =SUM(J876:L876)-456.17 -> 4475.3900000000003 | N876: 456.17000000000002 | O876: =SUM(M876:N876) -> 4931.5600000000004
A877: 3929 | B877: EOL CAMPO LARGO XX | C877: 17.929.168/0002-60 | D877: 4817.29 | E877: 0 | F877: 0 | G877: 0 | H877: 0 | I877: 0 | J877: 0 | K877: 5308.3100000000004 | L877: 0 | M877: =SUM(J877:L877)-491.02 -> 4817.2900000000009 | N877: 491.01999999999998 | O877: =SUM(M877:N877) -> 5308.3100000000013
A878: 3930 | B878: EOL POTIGUAR B31 | C878: 34.327.393/0001-64 | D878: 5486.3000000000002 | E878: 0 | F878: 0 | G878: 0 | H878: 0 | I878: 0 | J878: 0 | K878: 6045.5100000000002 | L878: 0 | M878: =SUM(J878:L878)-559.21 -> 5486.3000000000002 | N878: 559.21000000000004 | O878: =SUM(M878:N878) -> 6045.5100000000002
A879: 3931 | B879: EOL POTIGUAR B32 | C879: 34.327.409/0001-39 | D879: 6000.4899999999998 | E879: 0 | F879: 0 | G879: 0 | H879: 0 | I879: 0 | J879: 0 | K879: 6612.1099999999997 | L879: 0 | M879: =SUM(J879:L879)-611.62 -> 6000.4899999999998 | N879: 611.62 | O879: =SUM(M879:N879) -> 6612.1099999999997
A880: 3932 | B880: EOL VENTOS DE SÃO FERNANDO 4 | C880: 33.701.101/0001-49 | D880: 10093 | E880: 0 | F880: 0 | G880: 0 | H880: 0 | I880: 0 | J880: 0 | K880: 11121.76 | L880: 0 | M880: =SUM(J880:L880)-1028.76 -> 10093 | N880: 1028.76 | O880: =SUM(M880:N880) -> 11121.76
A881: 3933 | B881: EOL VENTOS DE SÃO JANUÁRIO 10 | C881: 31.810.448/0001-02 | D881: 6638.2700000000004 | E881: 0 | F881: 0 | G881: 0 | H881: 0 | I881: 0 | J881: 0 | K881: 7314.8999999999996 | L881: 0 | M881: =SUM(J881:L881)-676.63 -> 6638.2699999999995 | N881: 676.63 | O881: =SUM(M881:N881) -> 7314.8999999999996
A882: 3934 | B882: EOL SERROTE I | C882: 32.398.775/0001-53 | D882: 2784.9200000000001 | E882: 0 | F882: 0 | G882: 0 | H882: 0 | I882: 0 | J882: 0 | K882: 3068.7800000000002 | L882: 0 | M882: =SUM(J882:L882)-283.86 -> 2784.9200000000001 | N882: 283.86000000000001 | O882: =SUM(M882:N882) -> 3068.7800000000002
A883: 3935 | B883: EOL SERROTE IV | C883: 32.398.772/0001-10 | D883: 1855.8499999999999 | E883: 0 | F883: 0 | G883: 0 | H883: 0 | I883: 0 | J883: 0 | K883: 2045.01 | L883: 0 | M883: =SUM(J883:L883)-189.16 -> 1855.8499999999999 | N883: 189.16 | O883: =SUM(M883:N883) -> 2045.01
A884: 3936 | B884: EOL SERROTE V | C884: 32.398.761/0001-30 | D884: 3248.8899999999999 | E884: 0 | F884: 0 | G884: 0 | H884: 0 | I884: 0 | J884: 0 | K884: 3580.04 | L884: 0 | M884: =SUM(J884:L884)-331.15 -> 3248.8899999999999 | N884: 331.14999999999998 | O884: =SUM(M884:N884) -> 3580.04
A885: 3937 | B885: UFV FLOR DE MANDACARU | C885: 12.009.135/0001-05 | D885: 243.03999999999999 | E885: 0 | F885: 0 | G885: 0 | H885: 0 | I885: 0 | J885: 0 | K885: 267.81 | L885: 0 | M885: =SUM(J885:L885)-24.77 -> 243.03999999999999 | N885: 24.77 | O885: =SUM(M885:N885) -> 267.81
A886: 3938 | B886: EOL VENTOS DE SANTA ÂNGELA 20 | C886: 29.552.939/0001-40 | D886: 4708.3999999999996 | E886: 0 | F886: 0 | G886: 0 | H886: 0 | I886: 0 | J886: 0 | K886: 5188.3199999999997 | L886: 0 | M886: =SUM(J886:L886)-479.92 -> 4708.3999999999996 | N886: 479.92000000000002 | O886: =SUM(M886:N886) -> 5188.3199999999997
A887: 3939 | B887: EOL VENTOS DE SANTA ÂNGELA 21 | C887: 29.616.162/0001-30 | D887: 4239.3100000000004 | E887: 0 | F887: 0 | G887: 0 | H887: 0 | I887: 0 | J887: 0 | K887: 4671.4200000000001 | L887: 0 | M887: =SUM(J887:L887)-432.11 -> 4239.3100000000004 | N887: 432.11000000000001 | O887: =SUM(M887:N887) -> 4671.4200000000001
A888: 3940 | B888: UFV SÃO GONÇALO 18 | C888: 31.752.294/0001-31 | D888: 5620.1899999999996 | E888: 0 | F888: 0 | G888: 0 | H888: 0 | I888: 0 | J888: 0 | K888: 6193.0500000000002 | L888: 0 | M888: =SUM(J888:L888)-572.86 -> 5620.1900000000005 | N888: 572.86000000000001 | O888: =SUM(M888:N888) -> 6193.0500000000002
A889: 3941 | B889: UTE GNA I | C889: 23.449.511/0001-90 | D889: 265953.64000000001 | E889: 0 | F889: 0 | G889: 0 | H889: 0 | I889: 0 | J889: 0 | K889: 293061.85999999999 | L889: 0 | M889: =SUM(J889:L889)-27108.22 -> 265953.64000000001 | N889: 27108.220000000001 | O889: =SUM(M889:N889) -> 293061.85999999999
A890: 3942 | B890: EOL CRISTALÂNDIA III | C890: 23.049.225/0003-08 | D890: 2611.8299999999999 | E890: 0 | F890: 0 | G890: 0 | H890: 0 | I890: 0 | J890: 0 | K890: 2878.0500000000002 | L890: 0 | M890: =SUM(J890:L890)-266.22 -> 2611.8299999999999 | N890: 266.22000000000003 | O890: =SUM(M890:N890) -> 2878.0500000000002
A891: 3943 | B891: EOL AVENTURA III | C891: 29.302.365/0002-33 | D891: 3835.3899999999999 | E891: 0 | F891: 0 | G891: 0 | H891: 0 | I891: 0 | J891: 0 | K891: 4226.3299999999999 | L891: 0 | M891: =SUM(J891:L891)-390.94 -> 3835.3899999999999 | N891: 390.94 | O891: =SUM(M891:N891) -> 4226.3299999999999
A892: 3944 | B892: EOL SERROTE VII | C892: 32.398.767/0001-07 | D892: 3248.8899999999999 | E892: 0 | F892: 0 | G892: 0 | H892: 0 | I892: 0 | J892: 0 | K892: 3580.04 | L892: 0 | M892: =SUM(J892:L892)-331.15 -> 3248.8899999999999 | N892: 331.14999999999998 | O892: =SUM(M892:N892) -> 3580.04
A893: 3945 | B893: EOL SERROTE VIII | C893: 32.398.765/0001-18 | D893: 3248.8899999999999 | E893: 0 | F893: 0 | G893: 0 | H893: 0 | I893: 0 | J893: 0 | K893: 3580.04 | L893: 0 | M893: =SUM(J893:L893)-331.15 -> 3248.8899999999999 | N893: 331.14999999999998 | O893: =SUM(M893:N893) -> 3580.04
A894: 3946 | B894: EOL POTIGUAR B33 | C894: 34.327.417/0001-85 | D894: 7286.3100000000004 | E894: 0 | F894: 0 | G894: 0 | H894: 0 | I894: 0 | J894: 0 | K894: 8028.9899999999998 | L894: 0 | M894: =SUM(J894:L894)-742.68 -> 7286.3099999999995 | N894: 742.67999999999995 | O894: =SUM(M894:N894) -> 8028.9899999999998
A895: 3947 | B895: EOL SERRA DA BABILÔNIA A | C895: 30.063.842/0002-34 | D895: 3304.6500000000001 | E895: 0 | F895: 0 | G895: 0 | H895: 0 | I895: 0 | J895: 0 | K895: 3641.4899999999998 | L895: 0 | M895: =SUM(J895:L895)-336.84 -> 3304.6499999999996 | N895: 336.83999999999997 | O895: =SUM(M895:N895) -> 3641.4899999999998
A896: 3948 | B896: EOL SERRA DA BABILÔNIA B | C896: 29.527.877/0002-06 | D896: 3929.5799999999999 | E896: 0 | F896: 0 | G896: 0 | H896: 0 | I896: 0 | J896: 0 | K896: 4330.1199999999999 | L896: 0 | M896: =SUM(J896:L896)-400.54 -> 3929.5799999999999 | N896: 400.54000000000002 | O896: =SUM(M896:N896) -> 4330.1199999999999
A897: 3949 | B897: EOL VENTOS DE SANTA ÂNGELA 12 | C897: 29.722.095/0001-39 | D897: 3830.77 | E897: 0 | F897: 0 | G897: 0 | H897: 0 | I897: 0 | J897: 0 | K897: 4221.2299999999996 | L897: 0 | M897: =SUM(J897:L897)-390.46 -> 3830.7699999999995 | N897: 390.45999999999998 | O897: =SUM(M897:N897) -> 4221.2299999999996
A898: 3950 | B898: EOL VENTOS DE SANTA ÂNGELA 13 | C898: 29.310.217/0001-80 | D898: 3613.1300000000001 | E898: 0 | F898: 0 | G898: 0 | H898: 0 | I898: 0 | J898: 0 | K898: 3981.4099999999999 | L898: 0 | M898: =SUM(J898:L898)-368.28 -> 3613.1300000000001 | N898: 368.27999999999997 | O898: =SUM(M898:N898) -> 3981.4099999999999
A899: 3951 | B899: EOL VENTOS DE SANTA ÂNGELA 18 | C899: 29.710.906/0001-81 | D899: 4001.8299999999999 | E899: 0 | F899: 0 | G899: 0 | H899: 0 | I899: 0 | J899: 0 | K899: 4409.7299999999996 | L899: 0 | M899: =SUM(J899:L899)-407.9 -> 4001.8299999999995 | N899: 407.89999999999998 | O899: =SUM(M899:N899) -> 4409.7299999999996
A900: 3952 | B900: EOL GAMELEIRA | C900: 07.099.001/0001-84 | D900: 2558.1999999999998 | E900: 0 | F900: 0 | G900: 0 | H900: 0 | I900: 0 | J900: 0 | K900: 2818.9499999999998 | L900: 0 | M900: =SUM(J900:L900)-260.75 -> 2558.1999999999998 | N900: 260.75 | O900: =SUM(M900:N900) -> 2818.9499999999998
A901: 3953 | B901: EOL FAROL DE TOUROS | C901: 10.369.836/0001-11 | D901: 3582.9499999999998 | E901: 0 | F901: 0 | G901: 0 | H901: 0 | I901: 0 | J901: 0 | K901: 3948.1500000000001 | L901: 0 | M901: =SUM(J901:L901)-365.2 -> 3582.9500000000003 | N901: 365.19999999999999 | O901: =SUM(M901:N901) -> 3948.1500000000001
A902: 3954 | B902: EOL COSTA DAS DUNAS | C902: 10.401.225/0001-03 | D902: 4126.4799999999996 | E902: 0 | F902: 0 | G902: 0 | H902: 0 | I902: 0 | J902: 0 | K902: 4547.0900000000001 | L902: 0 | M902: =SUM(J902:L902)-420.61 -> 4126.4800000000005 | N902: 420.61000000000001 | O902: =SUM(M902:N902) -> 4547.0900000000001
A903: 3955 | B903: EOL FIGUEIRA BRANCA | C903: 09.665.352/0001-30 | D903: 1534.03 | E903: 0 | F903: 0 | G903: 0 | H903: 0 | I903: 0 | J903: 0 | K903: 1690.3900000000001 | L903: 0 | M903: =SUM(J903:L903)-156.36 -> 1534.0300000000002 | N903: 156.36000000000001 | O903: =SUM(M903:N903) -> 1690.3900000000003
A904: 3957 | B904: EOL AVENTURA V | C904: 28.946.365/0002-03 | D904: 4446.79 | E904: 0 | F904: 0 | G904: 0 | H904: 0 | I904: 0 | J904: 0 | K904: 4900.04 | L904: 0 | M904: =SUM(J904:L904)-453.25 -> 4446.79 | N904: 453.25 | O904: =SUM(M904:N904) -> 4900.04
A905: 3958 | B905: EOL CAMPO LARGO VIII | C905: 18.001.918/0002-00 | D905: 4281.3100000000004 | E905: 0 | F905: 0 | G905: 0 | H905: 0 | I905: 0 | J905: 0 | K905: 4717.6999999999998 | L905: 0 | M905: =SUM(J905:L905)-436.39 -> 4281.3099999999995 | N905: 436.38999999999999 | O905: =SUM(M905:N905) -> 4717.6999999999998
A906: 3959 | B906: EOL CAMPO LARGO XI | C906: 17.955.471/0002-37 | D906: 2145.52 | E906: 0 | F906: 0 | G906: 0 | H906: 0 | I906: 0 | J906: 0 | K906: 2364.21 | L906: 0 | M906: =SUM(J906:L906)-218.69 -> 2145.52 | N906: 218.69 | O906: =SUM(M906:N906) -> 2364.21
A907: 3960 | B907: EOL CAMPO LARGO XII | C907: 17.846.141/0002-03 | D907: 6957.29 | E907: 0 | F907: 0 | G907: 0 | H907: 0 | I907: 0 | J907: 0 | K907: 7666.4399999999996 | L907: 0 | M907: =SUM(J907:L907)-709.15 -> 6957.29 | N907: 709.14999999999998 | O907: =SUM(M907:N907) -> 7666.4399999999996
A908: 3961 | B908: EOL CAMPO LARGO XIII | C908: 17.995.969/0002-23 | D908: 5351.96 | E908: 0 | F908: 0 | G908: 0 | H908: 0 | I908: 0 | J908: 0 | K908: 5897.4799999999996 | L908: 0 | M908: =SUM(J908:L908)-545.52 -> 5351.9599999999991 | N908: 545.51999999999998 | O908: =SUM(M908:N908) -> 5897.4799999999996
A909: 3962 | B909: EOL CAMPO LARGO XXII | C909: 18.154.009/0002-01 | D909: 4281.3100000000004 | E909: 0 | F909: 0 | G909: 0 | H909: 0 | I909: 0 | J909: 0 | K909: 4717.6999999999998 | L909: 0 | M909: =SUM(J909:L909)-436.39 -> 4281.3099999999995 | N909: 436.38999999999999 | O909: =SUM(M909:N909) -> 4717.6999999999998
A910: 3963 | B910: UFV SÃO GONÇALO 19 | C910: 31.752.301/0001-03 | D910: 5734.8100000000004 | E910: 0 | F910: 0 | G910: 0 | H910: 0 | I910: 0 | J910: 0 | K910: 6319.3500000000004 | L910: 0 | M910: =SUM(J910:L910)-584.54 -> 5734.8100000000004 | N910: 584.53999999999996 | O910: =SUM(M910:N910) -> 6319.3500000000004
A911: 3964 | B911: EOL VENTOS DE SANTA ÂNGELA 19 | C911: 29.552.605/0001-77 | D911: 4694.0600000000004 | E911: 0 | F911: 0 | G911: 0 | H911: 0 | I911: 0 | J911: 0 | K911: 5172.5200000000004 | L911: 0 | M911: =SUM(J911:L911)-478.46 -> 4694.0600000000004 | N911: 478.45999999999998 | O911: =SUM(M911:N911) -> 5172.5200000000004
A912: 3965 | B912: EOL SERROTE VI | C912: 32.398.764/0001-73 | D912: 3248.8899999999999 | E912: 0 | F912: 0 | G912: 0 | H912: 0 | I912: 0 | J912: 0 | K912: 3580.04 | L912: 0 | M912: =SUM(J912:L912)-331.15 -> 3248.8899999999999 | N912: 331.14999999999998 | O912: =SUM(M912:N912) -> 3580.04
A913: 3966 | B913: EOL VENTOS DE VILA MATO GROSSO I | C913: 34.109.229/0001-80 | D913: 6503.5699999999997 | E913: 0 | F913: 0 | G913: 0 | H913: 0 | I913: 0 | J913: 0 | K913: 7166.4700000000003 | L913: 0 | M913: =SUM(J913:L913)-662.9 -> 6503.5700000000006 | N913: 662.89999999999998 | O913: =SUM(M913:N913) -> 7166.4700000000003
A914: 3967 | B914: EOL TERRA SANTA I | C914: 24.895.239/0001-35 | D914: 7390.5500000000002 | E914: 0 | F914: 0 | G914: 0 | H914: 0 | I914: 0 | J914: 0 | K914: 8143.8599999999997 | L914: 0 | M914: =SUM(J914:L914)-753.31 -> 7390.5499999999993 | N914: 753.30999999999995 | O914: =SUM(M914:N914) -> 8143.8599999999988
A915: 3968 | B915: EOL TERRA SANTA II | C915: 24.894.829/0001-43 | D915: 4037.0999999999999 | E915: 0 | F915: 0 | G915: 0 | H915: 0 | I915: 0 | J915: 0 | K915: 4448.6000000000004 | L915: 0 | M915: =SUM(J915:L915)-411.5 -> 4037.1000000000004 | N915: 411.5 | O915: =SUM(M915:N915) -> 4448.6000000000004
A916: 3969 | B916: EOL SERRA DA BABILÔNIA C | C916: 29.591.504/0002-96 | D916: 4131.8299999999999 | E916: 0 | F916: 0 | G916: 0 | H916: 0 | I916: 0 | J916: 0 | K916: 4552.9799999999996 | L916: 0 | M916: =SUM(J916:L916)-421.15 -> 4131.8299999999999 | N916: 421.14999999999998 | O916: =SUM(M916:N916) -> 4552.9799999999996
A917: 3970 | B917: EOL SERRA DA BABILÔNIA D | C917: 30.062.725/0002-56 | D917: 3871.8800000000001 | E917: 0 | F917: 0 | G917: 0 | H917: 0 | I917: 0 | J917: 0 | K917: 4266.5299999999997 | L917: 0 | M917: =SUM(J917:L917)-394.65 -> 3871.8799999999997 | N917: 394.64999999999998 | O917: =SUM(M917:N917) -> 4266.5299999999997
A918: 3971 | B918: UTE CGVE INNOVA | C918: 04.229.761/0011-42 | D918: 1552.0899999999999 | E918: 0 | F918: 0 | G918: 0 | H918: 0 | I918: 0 | J918: 0 | K918: 1710.29 | L918: 0 | M918: =SUM(J918:L918)-158.2 -> 1552.0899999999999 | N918: 158.19999999999999 | O918: =SUM(M918:N918) -> 1710.29
A919: 3972 | B919: EOL SERRA DA BABILÔNIA F | C919: 30.234.798/0002-88 | D919: 3303.9299999999998 | E919: 0 | F919: 0 | G919: 0 | H919: 0 | I919: 0 | J919: 0 | K919: 3640.6900000000001 | L919: 0 | M919: =SUM(J919:L919)-336.76 -> 3303.9300000000003 | N919: 336.75999999999999 | O919: =SUM(M919:N919) -> 3640.6900000000005
A920: 3973 | B920: EOL VENTOS DE SANTA ÂNGELA 16 | C920: 29.711.059/0001-70 | D920: 4000.5300000000002 | E920: 0 | F920: 0 | G920: 0 | H920: 0 | I920: 0 | J920: 0 | K920: 4408.3000000000002 | L920: 0 | M920: =SUM(J920:L920)-407.77 -> 4000.5300000000002 | N920: 407.76999999999998 | O920: =SUM(M920:N920) -> 4408.3000000000002
A921: 3974 | B921: EOL VENTOS DE SANTA ÂNGELA 17 | C921: 29.579.025/0001-73 | D921: 7401.1999999999998 | E921: 0 | F921: 0 | G921: 0 | H921: 0 | I921: 0 | J921: 0 | K921: 8155.5900000000001 | L921: 0 | M921: =SUM(J921:L921)-754.39 -> 7401.1999999999998 | N921: 754.38999999999999 | O921: =SUM(M921:N921) -> 8155.5900000000001
A922: 3975 | B922: UFV SÃO GONÇALO 17 | C922: 31.762.229/0001-97 | D922: 5564.5799999999999 | E922: 0 | F922: 0 | G922: 0 | H922: 0 | I922: 0 | J922: 0 | K922: 6131.7700000000004 | L922: 0 | M922: =SUM(J922:L922)-567.19 -> 5564.5799999999999 | N922: 567.19000000000005 | O922: =SUM(M922:N922) -> 6131.7700000000004
A923: 3976 | B923: EOL SERRA DA BABILÔNIA E | C923: 30.062.736/0002-36 | D923: 4132.1400000000003 | E923: 0 | F923: 0 | G923: 0 | H923: 0 | I923: 0 | J923: 0 | K923: 4553.3199999999997 | L923: 0 | M923: =SUM(J923:L923)-421.18 -> 4132.1399999999994 | N923: 421.18000000000001 | O923: =SUM(M923:N923) -> 4553.3199999999997
A924: 3977 | B924: EOL VENTOS DE SANTA MARTINA 01 | C924: 29.845.768/0002-29 | D924: 1332.98 | E924: 0 | F924: 0 | G924: 0 | H924: 0 | I924: 0 | J924: 0 | K924: 1468.8499999999999 | L924: 0 | M924: =SUM(J924:L924)-135.87 -> 1332.98 | N924: 135.87 | O924: =SUM(M924:N924) -> 1468.8499999999999
A925: 3978 | B925: EOL VENTOS DE SANTA MARTINA 09 | C925: 29.845.721/0002-65 | D925: 1332.98 | E925: 0 | F925: 0 | G925: 0 | H925: 0 | I925: 0 | J925: 0 | K925: 1468.8499999999999 | L925: 0 | M925: =SUM(J925:L925)-135.87 -> 1332.98 | N925: 135.87 | O925: =SUM(M925:N925) -> 1468.8499999999999
A926: 3979 | B926: EOL VENTOS DE SANTA MARTINA 10 | C926: 29.845.784/0002-11 | D926: 1332.98 | E926: 0 | F926: 0 | G926: 0 | H926: 0 | I926: 0 | J926: 0 | K926: 1468.8499999999999 | L926: 0 | M926: =SUM(J926:L926)-135.87 -> 1332.98 | N926: 135.87 | O926: =SUM(M926:N926) -> 1468.8499999999999
A927: 3980 | B927: EOL VENTOS DE SANTA MARTINA 11 | C927: 29.845.761/0002-07 | D927: 1332.98 | E927: 0 | F927: 0 | G927: 0 | H927: 0 | I927: 0 | J927: 0 | K927: 1468.8499999999999 | L927: 0 | M927: =SUM(J927:L927)-135.87 -> 1332.98 | N927: 135.87 | O927: =SUM(M927:N927) -> 1468.8499999999999
A928: 3981 | B928: EOL VENTOS DE SANTA MARTINA 12 | C928: 29.845.751/0002-71 | D928: 1332.98 | E928: 0 | F928: 0 | G928: 0 | H928: 0 | I928: 0 | J928: 0 | K928: 1468.8499999999999 | L928: 0 | M928: =SUM(J928:L928)-135.87 -> 1332.98 | N928: 135.87 | O928: =SUM(M928:N928) -> 1468.8499999999999
A929: 3982 | B929: EOL VENTOS DE SANTA MARTINA 13 | C929: 29.845.794/0002-57 | D929: 1421.72 | E929: 0 | F929: 0 | G929: 0 | H929: 0 | I929: 0 | J929: 0 | K929: 1566.6300000000001 | L929: 0 | M929: =SUM(J929:L929)-144.91 -> 1421.72 | N929: 144.91 | O929: =SUM(M929:N929) -> 1566.6300000000001
A930: 3983 | B930: EOL VENTOS DE SANTA MARTINA 14 | C930: 29.845.733/0002-90 | D930: 1332.98 | E930: 0 | F930: 0 | G930: 0 | H930: 0 | I930: 0 | J930: 0 | K930: 1468.8499999999999 | L930: 0 | M930: =SUM(J930:L930)-135.87 -> 1332.98 | N930: 135.87 | O930: =SUM(M930:N930) -> 1468.8499999999999
A931: 3984 | B931: EOL TODA ENERGIA | C931: 36.160.050/0001-83 | D931: 3351.6900000000001 | E931: 0 | F931: 0 | G931: 0 | H931: 0 | I931: 0 | J931: 0 | K931: 3693.3200000000002 | L931: 0 | M931: =SUM(J931:L931)-341.63 -> 3351.6900000000001 | N931: 341.63 | O931: =SUM(M931:N931) -> 3693.3200000000002
A932: 3985 | B932: EOL VENTOS DE SÃO JANUÁRIO 23 | C932: 23.037.514/0002-06 | D932: 997.17999999999995 | E932: 0 | F932: 0 | G932: 0 | H932: 0 | I932: 0 | J932: 0 | K932: 1098.8199999999999 | L932: 0 | M932: =SUM(J932:L932)-101.64 -> 997.17999999999995 | N932: 101.64 | O932: =SUM(M932:N932) -> 1098.8199999999999
A933: 3986 | B933: UFV SÃO GONÇALO 15 | C933: 31.752.283/0001-51 | D933: 5564.5799999999999 | E933: 0 | F933: 0 | G933: 0 | H933: 0 | I933: 0 | J933: 0 | K933: 6131.7700000000004 | L933: 0 | M933: =SUM(J933:L933)-567.19 -> 5564.5799999999999 | N933: 567.19000000000005 | O933: =SUM(M933:N933) -> 6131.7700000000004
A934: 3987 | B934: UHE PORTO PRIMAVERA | C934: 60.933.603/0001-78 | D934: 460210.46999999997 | E934: 0 | F934: 0 | G934: 0 | H934: 0 | I934: 0 | J934: 0 | K934: 507118.97999999998 | L934: 0 | M934: =SUM(J934:L934)-46908.51 -> 460210.46999999997 | N934: 46908.510000000002 | O934: =SUM(M934:N934) -> 507118.97999999998
A935: 3988 | B935: UFV SÃO GONÇALO 14 | C935: 31.791.620/0001-10 | D935: 5564.5799999999999 | E935: 0 | F935: 0 | G935: 0 | H935: 0 | I935: 0 | J935: 0 | K935: 6131.7700000000004 | L935: 0 | M935: =SUM(J935:L935)-567.19 -> 5564.5799999999999 | N935: 567.19000000000005 | O935: =SUM(M935:N935) -> 6131.7700000000004
A936: 3989 | B936: EOL CUMARU I | C936: 31.211.298/0002-93 | D936: 5209.0299999999997 | E936: 0 | F936: 0 | G936: 0 | H936: 0 | I936: 0 | J936: 0 | K936: 5739.9799999999996 | L936: 0 | M936: =SUM(J936:L936)-530.95 -> 5209.0299999999997 | N936: 530.95000000000005 | O936: =SUM(M936:N936) -> 5739.9799999999996
A937: 3990 | B937: EOL CUMARU II | C937: 31.216.345/0002-91 | D937: 5209.0299999999997 | E937: 0 | F937: 0 | G937: 0 | H937: 0 | I937: 0 | J937: 0 | K937: 5739.9799999999996 | L937: 0 | M937: =SUM(J937:L937)-530.95 -> 5209.0299999999997 | N937: 530.95000000000005 | O937: =SUM(M937:N937) -> 5739.9799999999996
A938: 3991 | B938: EOL VILA ESPÍRITO SANTO I | C938: 34.043.696/0001-55 | D938: 4046.1799999999998 | E938: 0 | F938: 0 | G938: 0 | H938: 0 | I938: 0 | J938: 0 | K938: 4458.6000000000004 | L938: 0 | M938: =SUM(J938:L938)-412.42 -> 4046.1800000000003 | N938: 412.42000000000002 | O938: =SUM(M938:N938) -> 4458.6000000000004
A939: 3992 | B939: UFV TERRA DO SOL XI | C939: 31.533.486/0001-57 | D939: 6106.3199999999997 | E939: 0 | F939: 0 | G939: 0 | H939: 0 | I939: 0 | J939: 0 | K939: 6728.7299999999996 | L939: 0 | M939: =SUM(J939:L939)-622.41 -> 6106.3199999999997 | N939: 622.40999999999997 | O939: =SUM(M939:N939) -> 6728.7299999999996
A940: 3993 | B940: UFV SOL DO SERTÃO XXXVI | C940: 31.533.486/0001-57 | D940: 5215.6400000000003 | E940: 0 | F940: 0 | G940: 0 | H940: 0 | I940: 0 | J940: 0 | K940: 5747.2600000000002 | L940: 0 | M940: =SUM(J940:L940)-531.62 -> 5215.6400000000003 | N940: 531.62 | O940: =SUM(M940:N940) -> 5747.2600000000002
A941: 3994 | B941: UFV SOL DO SERTÃO VIII | C941: 31.534.389/0001-89 | D941: 12212.120000000001 | E941: 0 | F941: 0 | G941: 0 | H941: 0 | I941: 0 | J941: 0 | K941: 13456.879999999999 | L941: 0 | M941: =SUM(J941:L941)-1244.76 -> 12212.119999999999 | N941: 1244.76 | O941: =SUM(M941:N941) -> 13456.879999999999
A942: 3995 | B942: UFV SOL DO SERTÃO XIII | C942: 31.512.705/0001-11 | D942: 9595.0300000000007 | E942: 0 | F942: 0 | G942: 0 | H942: 0 | I942: 0 | J942: 0 | K942: 10573.040000000001 | L942: 0 | M942: =SUM(J942:L942)-978.01 -> 9595.0300000000007 | N942: 978.00999999999999 | O942: =SUM(M942:N942) -> 10573.040000000001
A943: 3996 | B943: EOL ANGICOS II | C943: 33.511.191/0001-05 | D943: 3552.1999999999998 | E943: 0 | F943: 0 | G943: 0 | H943: 0 | I943: 0 | J943: 0 | K943: 3914.27 | L943: 0 | M943: =SUM(J943:L943)-362.07 -> 3552.1999999999998 | N943: 362.06999999999999 | O943: =SUM(M943:N943) -> 3914.27
A944: 3997 | B944: EOL VILA ESPÍRITO SANTO III | C944: 34.043.685/0001-75 | D944: 4551.5799999999999 | E944: 0 | F944: 0 | G944: 0 | H944: 0 | I944: 0 | J944: 0 | K944: 5015.5200000000004 | L944: 0 | M944: =SUM(J944:L944)-463.94 -> 4551.5800000000008 | N944: 463.94 | O944: =SUM(M944:N944) -> 5015.5200000000004
A945: 3998 | B945: EOL VILA ESPÍRITO SANTO IV | C945: 34.011.712/0001-28 | D945: 4605.21 | E945: 0 | F945: 0 | G945: 0 | H945: 0 | I945: 0 | J945: 0 | K945: 5074.6099999999997 | L945: 0 | M945: =SUM(J945:L945)-469.4 -> 4605.21 | N945: 469.39999999999998 | O945: =SUM(M945:N945) -> 5074.6099999999997
A946: 3999 | B946: EOL VILA ESPÍRITO SANTO V | C946: 34.135.249/0001-26 | D946: 4551.5799999999999 | E946: 0 | F946: 0 | G946: 0 | H946: 0 | I946: 0 | J946: 0 | K946: 5015.5200000000004 | L946: 0 | M946: =SUM(J946:L946)-463.94 -> 4551.5800000000008 | N946: 463.94 | O946: =SUM(M946:N946) -> 5015.5200000000004
A947: 40005 | B947: BTG PACTUAL | C947: 30.306.294/0002-26 | D947: 1369.5999999999999 | E947: 0 | F947: 0 | G947: 0 | H947: 0 | I947: 0 | J947: 1509.2 | K947: 0 | L947: 0 | M947: =SUM(J947:L947)-139.6 -> 1369.6000000000001 | N947: 139.59999999999999 | O947: =SUM(M947:N947) -> 1509.2
A948: 4001 | B948: UFV SOL DO SERTÃO XII | C948: 31.534.389/0001-89 | D948: 6989.8900000000003 | E948: 0 | F948: 0 | G948: 0 | H948: 0 | I948: 0 | J948: 0 | K948: 7702.3599999999997 | L948: 0 | M948: =SUM(J948:L948)-712.47 -> 6989.8899999999994 | N948: 712.47000000000003 | O948: =SUM(M948:N948) -> 7702.3599999999997
A949: 4002 | B949: UFV SOL DO SERTÃO XXXV | C949: 31.512.705/0001-11 | D949: 3483.9699999999998 | E949: 0 | F949: 0 | G949: 0 | H949: 0 | I949: 0 | J949: 0 | K949: 3839.0900000000001 | L949: 0 | M949: =SUM(J949:L949)-355.12 -> 3483.9700000000003 | N949: 355.12 | O949: =SUM(M949:N949) -> 3839.0900000000001
A950: 4003 | B950: EOL CUMARU III | C950: 31.216.014/0002-51 | D950: 5209.0299999999997 | E950: 0 | F950: 0 | G950: 0 | H950: 0 | I950: 0 | J950: 0 | K950: 5739.9799999999996 | L950: 0 | M950: =SUM(J950:L950)-530.95 -> 5209.0299999999997 | N950: 530.95000000000005 | O950: =SUM(M950:N950) -> 5739.9799999999996
A951: 4004 | B951: EOL CUMARU IV | C951: 31.211.130/0002-88 | D951: 5209.0299999999997 | E951: 0 | F951: 0 | G951: 0 | H951: 0 | I951: 0 | J951: 0 | K951: 5739.9799999999996 | L951: 0 | M951: =SUM(J951:L951)-530.95 -> 5209.0299999999997 | N951: 530.95000000000005 | O951: =SUM(M951:N951) -> 5739.9799999999996
A952: 4005 | B952: EOL CUMARU V | C952: 31.210.772/0003-43 | D952: 4688.2399999999998 | E952: 0 | F952: 0 | G952: 0 | H952: 0 | I952: 0 | J952: 0 | K952: 5166.1000000000004 | L952: 0 | M952: =SUM(J952:L952)-477.86 -> 4688.2400000000007 | N952: 477.86000000000001 | O952: =SUM(M952:N952) -> 5166.1000000000004
A953: 4006 | B953: EOL FILGUEIRA II | C953: 33.486.296/0001-51 | D953: 3381.54 | E953: 0 | F953: 0 | G953: 0 | H953: 0 | I953: 0 | J953: 0 | K953: 3726.21 | L953: 0 | M953: =SUM(J953:L953)-344.67 -> 3381.54 | N953: 344.67000000000002 | O953: =SUM(M953:N953) -> 3726.21
A954: 4012 | B954: EOL VENTOS DA BAHIA XIV | C954: 31.818.978/0001-99 | D954: 5460.6000000000004 | E954: 0 | F954: 0 | G954: 0 | H954: 0 | I954: 0 | J954: 0 | K954: 6017.1899999999996 | L954: 0 | M954: =SUM(J954:L954)-556.59 -> 5460.5999999999995 | N954: 556.59000000000003 | O954: =SUM(M954:N954) -> 6017.1899999999996
A955: 4013 | B955: UFV ALEX IX | C955: 30.567.568/0001-50 | D955: 4155.21 | E955: 0 | F955: 0 | G955: 0 | H955: 0 | I955: 0 | J955: 0 | K955: 4578.7399999999998 | L955: 0 | M955: =SUM(J955:L955)-423.53 -> 4155.21 | N955: 423.52999999999997 | O955: =SUM(M955:N955) -> 4578.7399999999998
A956: 4014 | B956: UFV ALEX X | C956: 30.567.559/0001-69 | D956: 3487.7800000000002 | E956: 0 | F956: 0 | G956: 0 | H956: 0 | I956: 0 | J956: 0 | K956: 3843.2800000000002 | L956: 0 | M956: =SUM(J956:L956)-355.5 -> 3487.7800000000002 | N956: 355.5 | O956: =SUM(M956:N956) -> 3843.2800000000002
A957: 4015 | B957: EOL ANGICOS I | C957: 33.511.173/0001-23 | D957: 3044.5700000000002 | E957: 0 | F957: 0 | G957: 0 | H957: 0 | I957: 0 | J957: 0 | K957: 3354.9000000000001 | L957: 0 | M957: =SUM(J957:L957)-310.33 -> 3044.5700000000002 | N957: 310.32999999999998 | O957: =SUM(M957:N957) -> 3354.9000000000001
A958: 4018 | B958: EOL SERRA DO MATO I | C958: 32.398.781/0001-00 | D958: 2449.21 | E958: 0 | F958: 0 | G958: 0 | H958: 0 | I958: 0 | J958: 0 | K958: 2698.8499999999999 | L958: 0 | M958: =SUM(J958:L958)-249.64 -> 2449.21 | N958: 249.63999999999999 | O958: =SUM(M958:N958) -> 2698.8499999999999
A959: 4019 | B959: EOL VENTOS DE SANTA ESPERANÇA 08 | C959: 29.641.225/0002-90 | D959: 3165.6700000000001 | E959: 0 | F959: 0 | G959: 0 | H959: 0 | I959: 0 | J959: 0 | K959: 3488.3400000000001 | L959: 0 | M959: =SUM(J959:L959)-322.67 -> 3165.6700000000001 | N959: 322.67000000000002 | O959: =SUM(M959:N959) -> 3488.3400000000001
A960: 4020 | B960: EOL VENTOS DE SANTA ESPERANÇA 15 | C960: 29.552.609/0002-36 | D960: 7764.4799999999996 | E960: 0 | F960: 0 | G960: 0 | H960: 0 | I960: 0 | J960: 0 | K960: 8555.8999999999996 | L960: 0 | M960: =SUM(J960:L960)-791.42 -> 7764.4799999999996 | N960: 791.41999999999996 | O960: =SUM(M960:N960) -> 8555.8999999999996
A961: 4021 | B961: EOL VENTOS DE SANTA ESPERANÇA 16 | C961: 29.552.662/0002-37 | D961: 4920.7600000000002 | E961: 0 | F961: 0 | G961: 0 | H961: 0 | I961: 0 | J961: 0 | K961: 5422.3299999999999 | L961: 0 | M961: =SUM(J961:L961)-501.57 -> 4920.7600000000002 | N961: 501.56999999999999 | O961: =SUM(M961:N961) -> 5422.3299999999999
A962: 4022 | B962: EOL VENTOS DE SANTA ESPERANÇA 17 | C962: 29.587.306/0002-59 | D962: 7058.9899999999998 | E962: 0 | F962: 0 | G962: 0 | H962: 0 | I962: 0 | J962: 0 | K962: 7778.5 | L962: 0 | M962: =SUM(J962:L962)-719.51 -> 7058.9899999999998 | N962: 719.50999999999999 | O962: =SUM(M962:N962) -> 7778.5
A963: 4023 | B963: EOL VENTOS DE SANTA ESPERANÇA 21 | C963: 29.579.544/0002-12 | D963: 5412.9499999999998 | E963: 0 | F963: 0 | G963: 0 | H963: 0 | I963: 0 | J963: 0 | K963: 5964.6800000000003 | L963: 0 | M963: =SUM(J963:L963)-551.73 -> 5412.9500000000007 | N963: 551.73000000000002 | O963: =SUM(M963:N963) -> 5964.6800000000003
A964: 4024 | B964: EOL VENTOS DE SANTA ESPERANÇA 22 | C964: 29.618.696/0002-87 | D964: 5412.9499999999998 | E964: 0 | F964: 0 | G964: 0 | H964: 0 | I964: 0 | J964: 0 | K964: 5964.6800000000003 | L964: 0 | M964: =SUM(J964:L964)-551.73 -> 5412.9500000000007 | N964: 551.73000000000002 | O964: =SUM(M964:N964) -> 5964.6800000000003
A965: 4025 | B965: EOL VILA ESPÍRITO SANTO II | C965: 34.011.705/0001-26 | D965: 4551.5799999999999 | E965: 0 | F965: 0 | G965: 0 | H965: 0 | I965: 0 | J965: 0 | K965: 5015.5200000000004 | L965: 0 | M965: =SUM(J965:L965)-463.94 -> 4551.5800000000008 | N965: 463.94 | O965: =SUM(M965:N965) -> 5015.5200000000004
A966: 4026 | B966: UTE FS SORRISO | C966: 20.003.699/0002-31 | D966: 2473.6799999999998 | E966: 0 | F966: 0 | G966: 0 | H966: 0 | I966: 0 | J966: 0 | K966: 2725.8200000000002 | L966: 0 | M966: =SUM(J966:L966)-252.14 -> 2473.6800000000003 | N966: 252.13999999999999 | O966: =SUM(M966:N966) -> 2725.8200000000002
A967: 4027 | B967: EOL AFONSO BEZERRA I | C967: 33.511.218/0001-60 | D967: 3552.1999999999998 | E967: 0 | F967: 0 | G967: 0 | H967: 0 | I967: 0 | J967: 0 | K967: 3914.27 | L967: 0 | M967: =SUM(J967:L967)-362.07 -> 3552.1999999999998 | N967: 362.06999999999999 | O967: =SUM(M967:N967) -> 3914.27
A968: 4028 | B968: EOL AFONSO BEZERRA II | C968: 33.511.255/0001-78 | D968: 3552.1999999999998 | E968: 0 | F968: 0 | G968: 0 | H968: 0 | I968: 0 | J968: 0 | K968: 3914.27 | L968: 0 | M968: =SUM(J968:L968)-362.07 -> 3552.1999999999998 | N968: 362.06999999999999 | O968: =SUM(M968:N968) -> 3914.27
A969: 4029 | B969: UTE PUMA II | C969: 89.637.490/0165-72 | D969: 6277.3800000000001 | E969: 0 | F969: 0 | G969: 0 | H969: 0 | I969: 0 | J969: 0 | K969: 6917.2200000000003 | L969: 0 | M969: =SUM(J969:L969)-639.84 -> 6277.3800000000001 | N969: 639.84000000000003 | O969: =SUM(M969:N969) -> 6917.2200000000003
A970: 4030 | B970: UFV ALEX I | C970: 30.567.624/0001-56 | D970: 4155.21 | E970: 0 | F970: 0 | G970: 0 | H970: 0 | I970: 0 | J970: 0 | K970: 4578.7399999999998 | L970: 0 | M970: =SUM(J970:L970)-423.53 -> 4155.21 | N970: 423.52999999999997 | O970: =SUM(M970:N970) -> 4578.7399999999998
A971: 4031 | B971: UFV ALEX III | C971: 30.567.591/0001-44 | D971: 4155.21 | E971: 0 | F971: 0 | G971: 0 | H971: 0 | I971: 0 | J971: 0 | K971: 4578.7399999999998 | L971: 0 | M971: =SUM(J971:L971)-423.53 -> 4155.21 | N971: 423.52999999999997 | O971: =SUM(M971:N971) -> 4578.7399999999998
A972: 4032 | B972: UFV ALEX IV | C972: 30.567.615/0001-65 | D972: 4155.21 | E972: 0 | F972: 0 | G972: 0 | H972: 0 | I972: 0 | J972: 0 | K972: 4578.7399999999998 | L972: 0 | M972: =SUM(J972:L972)-423.53 -> 4155.21 | N972: 423.52999999999997 | O972: =SUM(M972:N972) -> 4578.7399999999998
A973: 4033 | B973: UFV ALEX V | C973: 30.567.603/0001-30 | D973: 4155.21 | E973: 0 | F973: 0 | G973: 0 | H973: 0 | I973: 0 | J973: 0 | K973: 4578.7399999999998 | L973: 0 | M973: =SUM(J973:L973)-423.53 -> 4155.21 | N973: 423.52999999999997 | O973: =SUM(M973:N973) -> 4578.7399999999998
A974: 4034 | B974: UFV ALEX VI | C974: 30.567.543/0001-56 | D974: 4155.21 | E974: 0 | F974: 0 | G974: 0 | H974: 0 | I974: 0 | J974: 0 | K974: 4578.7399999999998 | L974: 0 | M974: =SUM(J974:L974)-423.53 -> 4155.21 | N974: 423.52999999999997 | O974: =SUM(M974:N974) -> 4578.7399999999998
A975: 4035 | B975: UFV ALEX VII | C975: 30.567.582/0001-53 | D975: 4155.21 | E975: 0 | F975: 0 | G975: 0 | H975: 0 | I975: 0 | J975: 0 | K975: 4578.7399999999998 | L975: 0 | M975: =SUM(J975:L975)-423.53 -> 4155.21 | N975: 423.52999999999997 | O975: =SUM(M975:N975) -> 4578.7399999999998
A976: 4036 | B976: UFV ALEX VIII | C976: 30.567.573/0001-62 | D976: 4155.21 | E976: 0 | F976: 0 | G976: 0 | H976: 0 | I976: 0 | J976: 0 | K976: 4578.7399999999998 | L976: 0 | M976: =SUM(J976:L976)-423.53 -> 4155.21 | N976: 423.52999999999997 | O976: =SUM(M976:N976) -> 4578.7399999999998
A977: 4037 | B977: UTE BRACELL | C977: 53.943.098/0001-87 | D977: 19343.34 | E977: 0 | F977: 0 | G977: 0 | H977: 0 | I977: 0 | J977: 0 | K977: 21314.98 | L977: 0 | M977: =SUM(J977:L977)-1971.64 -> 19343.34 | N977: 1971.6400000000001 | O977: =SUM(M977:N977) -> 21314.98
A978: 4038 | B978: EOL FILGUEIRA I | C978: 33.486.289/0001-50 | D978: 4649.6800000000003 | E978: 0 | F978: 0 | G978: 0 | H978: 0 | I978: 0 | J978: 0 | K978: 5123.6099999999997 | L978: 0 | M978: =SUM(J978:L978)-473.93 -> 4649.6799999999994 | N978: 473.93000000000001 | O978: =SUM(M978:N978) -> 5123.6099999999997
A979: 4039 | B979: EOL SERRA DO MATO II | C979: 32.326.077/0001-42 | D979: 2449.21 | E979: 0 | F979: 0 | G979: 0 | H979: 0 | I979: 0 | J979: 0 | K979: 2698.8499999999999 | L979: 0 | M979: =SUM(J979:L979)-249.64 -> 2449.21 | N979: 249.63999999999999 | O979: =SUM(M979:N979) -> 2698.8499999999999
A980: 4040 | B980: EOL VENTOS DE SANTA ESPERANÇA 25 | C980: 29.616.244/0002-66 | D980: 3165.6700000000001 | E980: 0 | F980: 0 | G980: 0 | H980: 0 | I980: 0 | J980: 0 | K980: 3488.3400000000001 | L980: 0 | M980: =SUM(J980:L980)-322.67 -> 3165.6700000000001 | N980: 322.67000000000002 | O980: =SUM(M980:N980) -> 3488.3400000000001
A981: 4041 | B981: EOL VENTOS DE SANTA ESPERANÇA 26 | C981: 29.617.129/0002-06 | D981: 5412.9499999999998 | E981: 0 | F981: 0 | G981: 0 | H981: 0 | I981: 0 | J981: 0 | K981: 5964.6800000000003 | L981: 0 | M981: =SUM(J981:L981)-551.73 -> 5412.9500000000007 | N981: 551.73000000000002 | O981: =SUM(M981:N981) -> 5964.6800000000003
A982: 4042 | B982: EOL VILA ALAGOAS II | C982: 34.109.311/0001-05 | D982: 2529.4699999999998 | E982: 0 | F982: 0 | G982: 0 | H982: 0 | I982: 0 | J982: 0 | K982: 2787.29 | L982: 0 | M982: =SUM(J982:L982)-257.82 -> 2529.4699999999998 | N982: 257.81999999999999 | O982: =SUM(M982:N982) -> 2787.29
A983: 4043 | B983: UFV SOL DO SERTÃO XIV | C983: 31.512.705/0001-11 | D983: 2612.29 | E983: 0 | F983: 0 | G983: 0 | H983: 0 | I983: 0 | J983: 0 | K983: 2878.5599999999999 | L983: 0 | M983: =SUM(J983:L983)-266.27 -> 2612.29 | N983: 266.26999999999998 | O983: =SUM(M983:N983) -> 2878.5599999999999
A984: 4044 | B984: UFV TERRA DO SOL VII | C984: 31.533.486/0001-57 | D984: 6983.3999999999996 | E984: 0 | F984: 0 | G984: 0 | H984: 0 | I984: 0 | J984: 0 | K984: 7695.21 | L984: 0 | M984: =SUM(J984:L984)-711.81 -> 6983.3999999999996 | N984: 711.80999999999995 | O984: =SUM(M984:N984) -> 7695.2099999999991
A985: 4047 | B985: UFV COREMAS VII | C985: 34.920.805/0001-75 | D985: 3265.8400000000001 | E985: 0 | F985: 0 | G985: 0 | H985: 0 | I985: 0 | J985: 0 | K985: 3598.7199999999998 | L985: 0 | M985: =SUM(J985:L985)-332.88 -> 3265.8399999999997 | N985: 332.88 | O985: =SUM(M985:N985) -> 3598.7199999999998
A986: 4048 | B986: EOL TACAICÓ II | C986: 32.829.695/0002-96 | D986: 6522.1899999999996 | E986: 0 | F986: 0 | G986: 0 | H986: 0 | I986: 0 | J986: 0 | K986: 7186.9899999999998 | L986: 0 | M986: =SUM(J986:L986)-664.8 -> 6522.1899999999996 | N986: 664.79999999999995 | O986: =SUM(M986:N986) -> 7186.9899999999998
A987: 4049 | B987: EOL VENTOS DA BAHIA XIII | C987: 31.810.463/0001-42 | D987: 8189.6899999999996 | E987: 0 | F987: 0 | G987: 0 | H987: 0 | I987: 0 | J987: 0 | K987: 9024.4500000000007 | L987: 0 | M987: =SUM(J987:L987)-834.76 -> 8189.6900000000005 | N987: 834.75999999999999 | O987: =SUM(M987:N987) -> 9024.4500000000007
A988: 4050 | B988: UFV JUAZEIRO SOLAR VI | C988: 34.742.960/0001-49 | D988: 6320.3699999999999 | E988: 0 | F988: 0 | G988: 0 | H988: 0 | I988: 0 | J988: 0 | K988: 6964.6000000000004 | L988: 0 | M988: =SUM(J988:L988)-644.23 -> 6320.3700000000008 | N988: 644.23000000000002 | O988: =SUM(M988:N988) -> 6964.6000000000004
A989: 4051 | B989: UFV JUAZEIRO SOLAR VIII | C989: 34.742.951/0001-58 | D989: 2030.98 | E989: 0 | F989: 0 | G989: 0 | H989: 0 | I989: 0 | J989: 0 | K989: 2237.9899999999998 | L989: 0 | M989: =SUM(J989:L989)-207.01 -> 2030.9799999999998 | N989: 207.00999999999999 | O989: =SUM(M989:N989) -> 2237.9899999999998
A990: 4052 | B990: UFV JUAZEIRO SOLAR V | C990: 34.742.964/0001-27 | D990: 6320.3699999999999 | E990: 0 | F990: 0 | G990: 0 | H990: 0 | I990: 0 | J990: 0 | K990: 6964.6000000000004 | L990: 0 | M990: =SUM(J990:L990)-644.23 -> 6320.3700000000008 | N990: 644.23000000000002 | O990: =SUM(M990:N990) -> 6964.6000000000004
A991: 4053 | B991: UFV JUAZEIRO SOLAR VII | C991: 34.751.530/0001-93 | D991: 6320.3699999999999 | E991: 0 | F991: 0 | G991: 0 | H991: 0 | I991: 0 | J991: 0 | K991: 6964.6000000000004 | L991: 0 | M991: =SUM(J991:L991)-644.23 -> 6320.3700000000008 | N991: 644.23000000000002 | O991: =SUM(M991:N991) -> 6964.6000000000004
A992: 4054 | B992: EOL PAU FERRO II | C992: 32.829.774/0002-05 | D992: 6321.7399999999998 | E992: 0 | F992: 0 | G992: 0 | H992: 0 | I992: 0 | J992: 0 | K992: 6966.1000000000004 | L992: 0 | M992: =SUM(J992:L992)-644.36 -> 6321.7400000000007 | N992: 644.36000000000001 | O992: =SUM(M992:N992) -> 6966.1000000000004
A993: 4055 | B993: EOL SERRA DO MATO III | C993: 32.326.123/0001-03 | D993: 2449.21 | E993: 0 | F993: 0 | G993: 0 | H993: 0 | I993: 0 | J993: 0 | K993: 2698.8499999999999 | L993: 0 | M993: =SUM(J993:L993)-249.64 -> 2449.21 | N993: 249.63999999999999 | O993: =SUM(M993:N993) -> 2698.8499999999999
A994: 4058 | B994: EOL AURA QUEIMADA NOVA 01 | C994: 35.572.851/0002-74 | D994: 3996.5599999999999 | E994: 0 | F994: 0 | G994: 0 | H994: 0 | I994: 0 | J994: 0 | K994: 4403.9200000000001 | L994: 0 | M994: =SUM(J994:L994)-407.36 -> 3996.5599999999999 | N994: 407.36000000000001 | O994: =SUM(M994:N994) -> 4403.9200000000001
A995: 4059 | B995: EOL GRAVIER | C995: 23.793.827/0001-03 | D995: 8589.7399999999998 | E995: 0 | F995: 0 | G995: 0 | H995: 0 | I995: 0 | J995: 0 | K995: 9465.2800000000007 | L995: 0 | M995: =SUM(J995:L995)-875.54 -> 8589.7400000000016 | N995: 875.53999999999996 | O995: =SUM(M995:N995) -> 9465.2800000000025
A996: 4060 | B996: EOL VENTOS DE SANTA ESPERANÇA 13 | C996: 29.552.763/0002-08 | D996: 5647.6599999999999 | E996: 0 | F996: 0 | G996: 0 | H996: 0 | I996: 0 | J996: 0 | K996: 6223.3199999999997 | L996: 0 | M996: =SUM(J996:L996)-575.66 -> 5647.6599999999999 | N996: 575.65999999999997 | O996: =SUM(M996:N996) -> 6223.3199999999997
A997: 4061 | B997: EOL AURA QUEIMADA NOVA 02 | C997: 35.603.267/0002-39 | D997: 6143.9099999999999 | E997: 0 | F997: 0 | G997: 0 | H997: 0 | I997: 0 | J997: 0 | K997: 6770.1499999999996 | L997: 0 | M997: =SUM(J997:L997)-626.24 -> 6143.9099999999999 | N997: 626.24000000000001 | O997: =SUM(M997:N997) -> 6770.1499999999996
A998: 4062 | B998: UFV COREMAS IV | C998: 34.921.036/0001-20 | D998: 3265.8400000000001 | E998: 0 | F998: 0 | G998: 0 | H998: 0 | I998: 0 | J998: 0 | K998: 3598.7199999999998 | L998: 0 | M998: =SUM(J998:L998)-332.88 -> 3265.8399999999997 | N998: 332.88 | O998: =SUM(M998:N998) -> 3598.7199999999998
A999: 4063 | B999: UFV COREMAS V | C999: 34.920.838/0001-15 | D999: 3265.8400000000001 | E999: 0 | F999: 0 | G999: 0 | H999: 0 | I999: 0 | J999: 0 | K999: 3598.7199999999998 | L999: 0 | M999: =SUM(J999:L999)-332.88 -> 3265.8399999999997 | N999: 332.88 | O999: =SUM(M999:N999) -> 3598.7199999999998
A1000: 4064 | B1000: UFV COREMAS VI | C1000: 34.850.666/0001-50 | D1000: 3265.8400000000001 | E1000: 0 | F1000: 0 | G1000: 0 | H1000: 0 | I1000: 0 | J1000: 0 | K1000: 3598.7199999999998 | L1000: 0 | M1000: =SUM(J1000:L1000)-332.88 -> 3265.8399999999997 | N1000: 332.88 | O1000: =SUM(M1000:N1000) -> 3598.7199999999998
A1001: 4067 | B1001: EOL VENTOS DA BAHIA XXIII | C1001: 31.782.653/0001-01 | D1001: 8189.1000000000004 | E1001: 0 | F1001: 0 | G1001: 0 | H1001: 0 | I1001: 0 | J1001: 0 | K1001: 9023.7999999999993 | L1001: 0 | M1001: =SUM(J1001:L1001)-834.7 -> 8189.0999999999995 | N1001: 834.70000000000005 | O1001: =SUM(M1001:N1001) -> 9023.7999999999993
A1002: 4068 | B1002: EOL SERRA DO MATO IV | C1002: 32.326.120/0001-70 | D1002: 2449.21 | E1002: 0 | F1002: 0 | G1002: 0 | H1002: 0 | I1002: 0 | J1002: 0 | K1002: 2698.8499999999999 | L1002: 0 | M1002: =SUM(J1002:L1002)-249.64 -> 2449.21 | N1002: 249.63999999999999 | O1002: =SUM(M1002:N1002) -> 2698.8499999999999
A1003: 4069 | B1003: EOL SERRA DO MATO V | C1003: 32.326.115/0001-67 | D1003: 2449.21 | E1003: 0 | F1003: 0 | G1003: 0 | H1003: 0 | I1003: 0 | J1003: 0 | K1003: 2698.8499999999999 | L1003: 0 | M1003: =SUM(J1003:L1003)-249.64 -> 2449.21 | N1003: 249.63999999999999 | O1003: =SUM(M1003:N1003) -> 2698.8499999999999
A1004: 4070 | B1004: EOL SERRA DO MATO VI | C1004: 32.326.113/0001-78 | D1004: 1959.3699999999999 | E1004: 0 | F1004: 0 | G1004: 0 | H1004: 0 | I1004: 0 | J1004: 0 | K1004: 2159.0900000000001 | L1004: 0 | M1004: =SUM(J1004:L1004)-199.72 -> 1959.3700000000001 | N1004: 199.72 | O1004: =SUM(M1004:N1004) -> 2159.0900000000001
A1005: 4071 | B1005: EOL ACAUÃ III | C1005: 35.842.711/0001-98 | D1005: 2475.0100000000002 | E1005: 0 | F1005: 0 | G1005: 0 | H1005: 0 | I1005: 0 | J1005: 0 | K1005: 2727.2800000000002 | L1005: 0 | M1005: =SUM(J1005:L1005)-252.27 -> 2475.0100000000002 | N1005: 252.27000000000001 | O1005: =SUM(M1005:N1005) -> 2727.2800000000002
A1006: 4072 | B1006: EOL AFONSO BEZERRA III | C1006: 33.511.325/0001-98 | D1006: 3552.1999999999998 | E1006: 0 | F1006: 0 | G1006: 0 | H1006: 0 | I1006: 0 | J1006: 0 | K1006: 3914.27 | L1006: 0 | M1006: =SUM(J1006:L1006)-362.07 -> 3552.1999999999998 | N1006: 362.06999999999999 | O1006: =SUM(M1006:N1006) -> 3914.27
A1007: 4073 | B1007: EOL AFONSO BEZERRA IV | C1007: 33.511.347/0001-58 | D1007: 2030.53 | E1007: 0 | F1007: 0 | G1007: 0 | H1007: 0 | I1007: 0 | J1007: 0 | K1007: 2237.5 | L1007: 0 | M1007: =SUM(J1007:L1007)-206.97 -> 2030.53 | N1007: 206.97 | O1007: =SUM(M1007:N1007) -> 2237.5
A1008: 4076 | B1008: UFV COREMAS VIII | C1008: 36.571.485/0001-10 | D1008: 3265.8400000000001 | E1008: 0 | F1008: 0 | G1008: 0 | H1008: 0 | I1008: 0 | J1008: 0 | K1008: 3598.7199999999998 | L1008: 0 | M1008: =SUM(J1008:L1008)-332.88 -> 3265.8399999999997 | N1008: 332.88 | O1008: =SUM(M1008:N1008) -> 3598.7199999999998
A1009: 4077 | B1009: EOL TUCANO VI | C1009: 36.230.315/0001-72 | D1009: 5420.6800000000003 | E1009: 0 | F1009: 0 | G1009: 0 | H1009: 0 | I1009: 0 | J1009: 0 | K1009: 5973.1999999999998 | L1009: 0 | M1009: =SUM(J1009:L1009)-552.52 -> 5420.6800000000003 | N1009: 552.51999999999998 | O1009: =SUM(M1009:N1009) -> 5973.2000000000007
A1010: 4103 | B1010: UFV BELMONTE 1-1 | C1010: 30.418.521/0001-24 | D1010: 6031.71 | E1010: 0 | F1010: 0 | G1010: 0 | H1010: 0 | I1010: 0 | J1010: 0 | K1010: 6646.5100000000002 | L1010: 0 | M1010: =SUM(J1010:L1010)-614.8 -> 6031.71 | N1010: 614.79999999999995 | O1010: =SUM(M1010:N1010) -> 6646.5100000000002
A1011: 4104 | B1011: UFV BELMONTE 1-2 | C1011: 30.418.521/0001-24 | D1011: 6031.71 | E1011: 0 | F1011: 0 | G1011: 0 | H1011: 0 | I1011: 0 | J1011: 0 | K1011: 6646.5100000000002 | L1011: 0 | M1011: =SUM(J1011:L1011)-614.8 -> 6031.71 | N1011: 614.79999999999995 | O1011: =SUM(M1011:N1011) -> 6646.5100000000002
A1012: 4105 | B1012: UFV BELMONTE 1-3 | C1012: 30.418.521/0001-24 | D1012: 6031.71 | E1012: 0 | F1012: 0 | G1012: 0 | H1012: 0 | I1012: 0 | J1012: 0 | K1012: 6646.5100000000002 | L1012: 0 | M1012: =SUM(J1012:L1012)-614.8 -> 6031.71 | N1012: 614.79999999999995 | O1012: =SUM(M1012:N1012) -> 6646.5100000000002
A1013: 4106 | B1013: UFV BELMONTE 1-4 | C1013: 30.418.521/0001-24 | D1013: 603.16999999999996 | E1013: 0 | F1013: 0 | G1013: 0 | H1013: 0 | I1013: 0 | J1013: 0 | K1013: 664.64999999999998 | L1013: 0 | M1013: =SUM(J1013:L1013)-61.48 -> 603.16999999999996 | N1013: 61.479999999999997 | O1013: =SUM(M1013:N1013) -> 664.64999999999998
A1014: 4107 | B1014: UFV BELMONTE 2-1 | C1014: 30.418.547/0001-72 | D1014: 6195.0799999999999 | E1014: 0 | F1014: 0 | G1014: 0 | H1014: 0 | I1014: 0 | J1014: 0 | K1014: 6826.5299999999997 | L1014: 0 | M1014: =SUM(J1014:L1014)-631.45 -> 6195.0799999999999 | N1014: 631.45000000000005 | O1014: =SUM(M1014:N1014) -> 6826.5299999999997
A1015: 4108 | B1015: UFV BELMONTE 2-2 | C1015: 30.418.547/0001-72 | D1015: 6195.0799999999999 | E1015: 0 | F1015: 0 | G1015: 0 | H1015: 0 | I1015: 0 | J1015: 0 | K1015: 6826.5299999999997 | L1015: 0 | M1015: =SUM(J1015:L1015)-631.45 -> 6195.0799999999999 | N1015: 631.45000000000005 | O1015: =SUM(M1015:N1015) -> 6826.5299999999997
A1016: 4109 | B1016: UFV BELMONTE 2-3 | C1016: 30.418.547/0001-72 | D1016: 6195.0799999999999 | E1016: 0 | F1016: 0 | G1016: 0 | H1016: 0 | I1016: 0 | J1016: 0 | K1016: 6826.5299999999997 | L1016: 0 | M1016: =SUM(J1016:L1016)-631.45 -> 6195.0799999999999 | N1016: 631.45000000000005 | O1016: =SUM(M1016:N1016) -> 6826.5299999999997
A1017: 4110 | B1017: UFV BELMONTE 2-4 | C1017: 30.418.547/0001-72 | D1017: 6195.0799999999999 | E1017: 0 | F1017: 0 | G1017: 0 | H1017: 0 | I1017: 0 | J1017: 0 | K1017: 6826.5299999999997 | L1017: 0 | M1017: =SUM(J1017:L1017)-631.45 -> 6195.0799999999999 | N1017: 631.45000000000005 | O1017: =SUM(M1017:N1017) -> 6826.5299999999997
A1018: 4111 | B1018: UFV BELMONTE 2-5 | C1018: 30.418.547/0001-72 | D1018: 6195.0799999999999 | E1018: 0 | F1018: 0 | G1018: 0 | H1018: 0 | I1018: 0 | J1018: 0 | K1018: 6826.5299999999997 | L1018: 0 | M1018: =SUM(J1018:L1018)-631.45 -> 6195.0799999999999 | N1018: 631.45000000000005 | O1018: =SUM(M1018:N1018) -> 6826.5299999999997
A1019: 4112 | B1019: UFV BELMONTE 2-6 | C1019: 30.418.547/0001-72 | D1019: 6195.0799999999999 | E1019: 0 | F1019: 0 | G1019: 0 | H1019: 0 | I1019: 0 | J1019: 0 | K1019: 6826.5299999999997 | L1019: 0 | M1019: =SUM(J1019:L1019)-631.45 -> 6195.0799999999999 | N1019: 631.45000000000005 | O1019: =SUM(M1019:N1019) -> 6826.5299999999997
A1020: 4113 | B1020: UFV LAVRAS 1 | C1020: 30.806.144/0001-09 | D1020: 2863.0500000000002 | E1020: 0 | F1020: 0 | G1020: 0 | H1020: 0 | I1020: 0 | J1020: 0 | K1020: 3154.8800000000001 | L1020: 0 | M1020: =SUM(J1020:L1020)-291.83 -> 2863.0500000000002 | N1020: 291.82999999999998 | O1020: =SUM(M1020:N1020) -> 3154.8800000000001
A1021: 4114 | B1021: UFV LAVRAS 2 | C1021: 30.806.150/0001-58 | D1021: 2863.0500000000002 | E1021: 0 | F1021: 0 | G1021: 0 | H1021: 0 | I1021: 0 | J1021: 0 | K1021: 3154.8800000000001 | L1021: 0 | M1021: =SUM(J1021:L1021)-291.83 -> 2863.0500000000002 | N1021: 291.82999999999998 | O1021: =SUM(M1021:N1021) -> 3154.8800000000001
A1022: 4115 | B1022: UFV LAVRAS 3 | C1022: 30.806.162/0001-82 | D1022: 2863.0500000000002 | E1022: 0 | F1022: 0 | G1022: 0 | H1022: 0 | I1022: 0 | J1022: 0 | K1022: 3154.8800000000001 | L1022: 0 | M1022: =SUM(J1022:L1022)-291.83 -> 2863.0500000000002 | N1022: 291.82999999999998 | O1022: =SUM(M1022:N1022) -> 3154.8800000000001
A1023: 4116 | B1023: UFV LAVRAS 4 | C1023: 30.806.156/0001-25 | D1023: 2863.0500000000002 | E1023: 0 | F1023: 0 | G1023: 0 | H1023: 0 | I1023: 0 | J1023: 0 | K1023: 3154.8800000000001 | L1023: 0 | M1023: =SUM(J1023:L1023)-291.83 -> 2863.0500000000002 | N1023: 291.82999999999998 | O1023: =SUM(M1023:N1023) -> 3154.8800000000001
A1024: 4117 | B1024: UFV LAVRAS 5 | C1024: 30.806.179/0001-30 | D1024: 2863.0500000000002 | E1024: 0 | F1024: 0 | G1024: 0 | H1024: 0 | I1024: 0 | J1024: 0 | K1024: 3154.8800000000001 | L1024: 0 | M1024: =SUM(J1024:L1024)-291.83 -> 2863.0500000000002 | N1024: 291.82999999999998 | O1024: =SUM(M1024:N1024) -> 3154.8800000000001
A1025: 4118 | B1025: UFV XAXADO 1 | C1025: 37.427.693/0001-03 | D1025: 3946.27 | E1025: 0 | F1025: 0 | G1025: 0 | H1025: 0 | I1025: 0 | J1025: 0 | K1025: 4348.5100000000002 | L1025: 0 | M1025: =SUM(J1025:L1025)-402.24 -> 3946.2700000000004 | N1025: 402.24000000000001 | O1025: =SUM(M1025:N1025) -> 4348.5100000000002
A1026: 4119 | B1026: UFV XAXADO 2 | C1026: 37.427.699/0001-80 | D1026: 3946.27 | E1026: 0 | F1026: 0 | G1026: 0 | H1026: 0 | I1026: 0 | J1026: 0 | K1026: 4348.5100000000002 | L1026: 0 | M1026: =SUM(J1026:L1026)-402.24 -> 3946.2700000000004 | N1026: 402.24000000000001 | O1026: =SUM(M1026:N1026) -> 4348.5100000000002
A1027: 4120 | B1027: UFV XAXADO 3 | C1027: 37.427.691/0001-14 | D1027: 3946.27 | E1027: 0 | F1027: 0 | G1027: 0 | H1027: 0 | I1027: 0 | J1027: 0 | K1027: 4348.5100000000002 | L1027: 0 | M1027: =SUM(J1027:L1027)-402.24 -> 3946.2700000000004 | N1027: 402.24000000000001 | O1027: =SUM(M1027:N1027) -> 4348.5100000000002
A1028: 4121 | B1028: EOL VENTOS DA BAHIA XXVII | C1028: 32.124.546/0001-40 | D1028: 8184.8999999999996 | E1028: 0 | F1028: 0 | G1028: 0 | H1028: 0 | I1028: 0 | J1028: 0 | K1028: 9019.1700000000001 | L1028: 0 | M1028: =SUM(J1028:L1028)-834.27 -> 8184.8999999999996 | N1028: 834.26999999999998 | O1028: =SUM(M1028:N1028) -> 9019.1700000000001
A1029: 4122 | B1029: EOL CANUDOS I | C1029: 35.474.191/0001-08 | D1029: 5554.6400000000003 | E1029: 0 | F1029: 0 | G1029: 0 | H1029: 0 | I1029: 0 | J1029: 0 | K1029: 6120.8199999999997 | L1029: 0 | M1029: =SUM(J1029:L1029)-566.18 -> 5554.6399999999994 | N1029: 566.17999999999995 | O1029: =SUM(M1029:N1029) -> 6120.8199999999997
A1030: 4123 | B1030: EOL TUCANO VII | C1030: 36.230.329/0001-96 | D1030: 6098.25 | E1030: 0 | F1030: 0 | G1030: 0 | H1030: 0 | I1030: 0 | J1030: 0 | K1030: 6719.8299999999999 | L1030: 0 | M1030: =SUM(J1030:L1030)-621.58 -> 6098.25 | N1030: 621.58000000000004 | O1030: =SUM(M1030:N1030) -> 6719.8299999999999
A1031: 4125 | B1031: EOL TUCANO VIII | C1031: 36.230.295/0001-30 | D1031: 5420.6800000000003 | E1031: 0 | F1031: 0 | G1031: 0 | H1031: 0 | I1031: 0 | J1031: 0 | K1031: 5973.1999999999998 | L1031: 0 | M1031: =SUM(J1031:L1031)-552.52 -> 5420.6800000000003 | N1031: 552.51999999999998 | O1031: =SUM(M1031:N1031) -> 5973.2000000000007
A1032: 4126 | B1032: EOL CANUDOS II | C1032: 35.417.771/0001-63 | D1032: 5554.6400000000003 | E1032: 0 | F1032: 0 | G1032: 0 | H1032: 0 | I1032: 0 | J1032: 0 | K1032: 6120.8199999999997 | L1032: 0 | M1032: =SUM(J1032:L1032)-566.18 -> 5554.6399999999994 | N1032: 566.17999999999995 | O1032: =SUM(M1032:N1032) -> 6120.8199999999997
A1033: 4127 | B1033: UTE PARNAÍBA V | C1033: 15.743.303/0001-71 | D1033: 111743.47 | E1033: 0 | F1033: 0 | G1033: 0 | H1033: 0 | I1033: 0 | J1033: 0 | K1033: 123133.3 | L1033: 0 | M1033: =SUM(J1033:L1033)-11389.83 -> 111743.47 | N1033: 11389.83 | O1033: =SUM(M1033:N1033) -> 123133.3
A1034: 4128 | B1034: EOL BOQUEIRAO I | C1034: 31.252.889/0002-09 | D1034: 5026.6700000000001 | E1034: 0 | F1034: 0 | G1034: 0 | H1034: 0 | I1034: 0 | J1034: 0 | K1034: 5539.0299999999997 | L1034: 0 | M1034: =SUM(J1034:L1034)-512.36 -> 5026.6700000000001 | N1034: 512.36000000000001 | O1034: =SUM(M1034:N1034) -> 5539.0299999999997
A1035: 4129 | B1035: EOL BOQUEIRAO II | C1035: 31.232.196/0002-54 | D1035: 4501.5100000000002 | E1035: 0 | F1035: 0 | G1035: 0 | H1035: 0 | I1035: 0 | J1035: 0 | K1035: 4960.3400000000001 | L1035: 0 | M1035: =SUM(J1035:L1035)-458.83 -> 4501.5100000000002 | N1035: 458.82999999999998 | O1035: =SUM(M1035:N1035) -> 4960.3400000000001
A1036: 4130 | B1036: EOL JERUSALÉM I | C1036: 30.785.922/0002-01 | D1036: 4308.4700000000003 | E1036: 0 | F1036: 0 | G1036: 0 | H1036: 0 | I1036: 0 | J1036: 0 | K1036: 4747.6300000000001 | L1036: 0 | M1036: =SUM(J1036:L1036)-439.16 -> 4308.4700000000003 | N1036: 439.16000000000003 | O1036: =SUM(M1036:N1036) -> 4747.6300000000001
A1037: 4131 | B1037: EOL JERUSALÉM II | C1037: 30.798.864/0002-42 | D1037: 4315.9399999999996 | E1037: 0 | F1037: 0 | G1037: 0 | H1037: 0 | I1037: 0 | J1037: 0 | K1037: 4755.8599999999997 | L1037: 0 | M1037: =SUM(J1037:L1037)-439.92 -> 4315.9399999999996 | N1037: 439.92000000000002 | O1037: =SUM(M1037:N1037) -> 4755.8599999999997
A1038: 4132 | B1038: EOL JERUSALÉM III | C1038: 31.231.701/0002-46 | D1038: 4314.4499999999998 | E1038: 0 | F1038: 0 | G1038: 0 | H1038: 0 | I1038: 0 | J1038: 0 | K1038: 4754.21 | L1038: 0 | M1038: =SUM(J1038:L1038)-439.76 -> 4314.4499999999998 | N1038: 439.75999999999999 | O1038: =SUM(M1038:N1038) -> 4754.21
A1039: 4133 | B1039: EOL JERUSALÉM IV | C1039: 31.207.208/0002-90 | D1039: 4305.4799999999996 | E1039: 0 | F1039: 0 | G1039: 0 | H1039: 0 | I1039: 0 | J1039: 0 | K1039: 4744.3299999999999 | L1039: 0 | M1039: =SUM(J1039:L1039)-438.85 -> 4305.4799999999996 | N1039: 438.85000000000002 | O1039: =SUM(M1039:N1039) -> 4744.3299999999999
A1040: 4134 | B1040: EOL JERUSALÉM V | C1040: 31.207.206/0002-00 | D1040: 4308.0299999999997 | E1040: 0 | F1040: 0 | G1040: 0 | H1040: 0 | I1040: 0 | J1040: 0 | K1040: 4747.1400000000003 | L1040: 0 | M1040: =SUM(J1040:L1040)-439.11 -> 4308.0300000000007 | N1040: 439.11000000000001 | O1040: =SUM(M1040:N1040) -> 4747.1400000000003
A1041: 4135 | B1041: EOL JERUSALÉM VI | C1041: 31.190.337/0002-13 | D1041: 4920.6099999999997 | E1041: 0 | F1041: 0 | G1041: 0 | H1041: 0 | I1041: 0 | J1041: 0 | K1041: 5422.1599999999999 | L1041: 0 | M1041: =SUM(J1041:L1041)-501.55 -> 4920.6099999999997 | N1041: 501.55000000000001 | O1041: =SUM(M1041:N1041) -> 5422.1599999999999
A1042: 4136 | B1042: EOL MONTE VERDE I | C1042: 31.199.583/0002-36 | D1042: 9895.7000000000007 | E1042: 0 | F1042: 0 | G1042: 0 | H1042: 0 | I1042: 0 | J1042: 0 | K1042: 10904.35 | L1042: 0 | M1042: =SUM(J1042:L1042)-1008.65 -> 9895.7000000000007 | N1042: 1008.65 | O1042: =SUM(M1042:N1042) -> 10904.35
A1043: 4137 | B1043: EOL MONTE VERDE II | C1043: 31.199.569/0002-32 | D1043: 9901.1800000000003 | E1043: 0 | F1043: 0 | G1043: 0 | H1043: 0 | I1043: 0 | J1043: 0 | K1043: 10910.389999999999 | L1043: 0 | M1043: =SUM(J1043:L1043)-1009.21 -> 9901.1800000000003 | N1043: 1009.21 | O1043: =SUM(M1043:N1043) -> 10910.389999999999
A1044: 4138 | B1044: EOL MONTE VERDE III | C1044: 31.199.512/0002-33 | D1044: 8668.9200000000001 | E1044: 0 | F1044: 0 | G1044: 0 | H1044: 0 | I1044: 0 | J1044: 0 | K1044: 9552.5300000000007 | L1044: 0 | M1044: =SUM(J1044:L1044)-883.61 -> 8668.9200000000001 | N1044: 883.61000000000001 | O1044: =SUM(M1044:N1044) -> 9552.5300000000007
A1045: 4139 | B1045: EOL MONTE VERDE IV | C1045: 31.199.598/0002-02 | D1045: 6816.1499999999996 | E1045: 0 | F1045: 0 | G1045: 0 | H1045: 0 | I1045: 0 | J1045: 0 | K1045: 7510.9099999999999 | L1045: 0 | M1045: =SUM(J1045:L1045)-694.76 -> 6816.1499999999996 | N1045: 694.75999999999999 | O1045: =SUM(M1045:N1045) -> 7510.9099999999999
A1046: 4140 | B1046: EOL MONTE VERDE V | C1046: 31.199.661/0002-00 | D1046: 4934.6499999999996 | E1046: 0 | F1046: 0 | G1046: 0 | H1046: 0 | I1046: 0 | J1046: 0 | K1046: 5437.6300000000001 | L1046: 0 | M1046: =SUM(J1046:L1046)-502.98 -> 4934.6499999999996 | N1046: 502.98000000000002 | O1046: =SUM(M1046:N1046) -> 5437.6299999999992
A1047: 4141 | B1047: EOL MONTE VERDE VI | C1047: 31.199.538/0002-81 | D1047: 5533.6099999999997 | E1047: 0 | F1047: 0 | G1047: 0 | H1047: 0 | I1047: 0 | J1047: 0 | K1047: 6097.6400000000003 | L1047: 0 | M1047: =SUM(J1047:L1047)-564.03 -> 5533.6100000000006 | N1047: 564.02999999999997 | O1047: =SUM(M1047:N1047) -> 6097.6400000000003
A1048: 4142 | B1048: UFV SERRA DO MEL I | C1048: 35.835.582/0001-00 | D1048: 15440.08 | E1048: 0 | F1048: 0 | G1048: 0 | H1048: 0 | I1048: 0 | J1048: 0 | K1048: 17013.860000000001 | L1048: 0 | M1048: =SUM(J1048:L1048)-1573.78 -> 15440.08 | N1048: 1573.78 | O1048: =SUM(M1048:N1048) -> 17013.860000000001
A1049: 4143 | B1049: UFV SERRA DO MEL II | C1049: 35.835.571/0001-20 | D1049: 11576.33 | E1049: 0 | F1049: 0 | G1049: 0 | H1049: 0 | I1049: 0 | J1049: 0 | K1049: 12756.290000000001 | L1049: 0 | M1049: =SUM(J1049:L1049)-1179.96 -> 11576.330000000002 | N1049: 1179.96 | O1049: =SUM(M1049:N1049) -> 12756.290000000001
A1050: 4144 | B1050: EOL BARAÚNAS XX | C1050: 34.986.678/0002-98 | D1050: 4169.1300000000001 | E1050: 0 | F1050: 0 | G1050: 0 | H1050: 0 | I1050: 0 | J1050: 0 | K1050: 4594.0799999999999 | L1050: 0 | M1050: =SUM(J1050:L1050)-424.95 -> 4169.1300000000001 | N1050: 424.94999999999999 | O1050: =SUM(M1050:N1050) -> 4594.0799999999999
A1051: 4145 | B1051: EOL MORRO BRANCO II | C1051: 35.040.621/0002-64 | D1051: 3977.8499999999999 | E1051: 0 | F1051: 0 | G1051: 0 | H1051: 0 | I1051: 0 | J1051: 0 | K1051: 4383.3100000000004 | L1051: 0 | M1051: =SUM(J1051:L1051)-405.46 -> 3977.8500000000004 | N1051: 405.45999999999998 | O1051: =SUM(M1051:N1051) -> 4383.3100000000004
A1052: 4146 | B1052: UFV FUTURA 1 | C1052: 37.349.957/0001-58 | D1052: 3839.6799999999998 | E1052: 0 | F1052: 0 | G1052: 0 | H1052: 0 | I1052: 0 | J1052: 0 | K1052: 4231.0500000000002 | L1052: 0 | M1052: =SUM(J1052:L1052)-391.37 -> 3839.6800000000003 | N1052: 391.37 | O1052: =SUM(M1052:N1052) -> 4231.0500000000002
A1053: 4147 | B1053: UFV FUTURA 2 | C1053: 37.349.957/0001-58 | D1053: 3872.6100000000001 | E1053: 0 | F1053: 0 | G1053: 0 | H1053: 0 | I1053: 0 | J1053: 0 | K1053: 4267.3400000000001 | L1053: 0 | M1053: =SUM(J1053:L1053)-394.73 -> 3872.6100000000001 | N1053: 394.73000000000002 | O1053: =SUM(M1053:N1053) -> 4267.3400000000001
A1054: 4148 | B1054: UFV FUTURA 3 | C1054: 37.349.957/0001-58 | D1054: 3832.52 | E1054: 0 | F1054: 0 | G1054: 0 | H1054: 0 | I1054: 0 | J1054: 0 | K1054: 4223.1599999999999 | L1054: 0 | M1054: =SUM(J1054:L1054)-390.64 -> 3832.52 | N1054: 390.63999999999999 | O1054: =SUM(M1054:N1054) -> 4223.1599999999999
A1055: 4149 | B1055: UFV FUTURA 4 | C1055: 37.349.957/0001-58 | D1055: 3856.4000000000001 | E1055: 0 | F1055: 0 | G1055: 0 | H1055: 0 | I1055: 0 | J1055: 0 | K1055: 4249.4799999999996 | L1055: 0 | M1055: =SUM(J1055:L1055)-393.08 -> 3856.3999999999996 | N1055: 393.07999999999998 | O1055: =SUM(M1055:N1055) -> 4249.4799999999996
A1056: 4150 | B1056: UFV FUTURA 5 | C1056: 37.349.892/0001-40 | D1056: 3832.52 | E1056: 0 | F1056: 0 | G1056: 0 | H1056: 0 | I1056: 0 | J1056: 0 | K1056: 4223.1599999999999 | L1056: 0 | M1056: =SUM(J1056:L1056)-390.64 -> 3832.52 | N1056: 390.63999999999999 | O1056: =SUM(M1056:N1056) -> 4223.1599999999999
A1057: 4151 | B1057: UFV FUTURA 6 | C1057: 37.349.892/0001-40 | D1057: 3852.5 | E1057: 0 | F1057: 0 | G1057: 0 | H1057: 0 | I1057: 0 | J1057: 0 | K1057: 4245.1800000000003 | L1057: 0 | M1057: =SUM(J1057:L1057)-392.68 -> 3852.5000000000005 | N1057: 392.68000000000001 | O1057: =SUM(M1057:N1057) -> 4245.1800000000003
A1058: 4152 | B1058: UFV FUTURA 7 | C1058: 37.349.892/0001-40 | D1058: 3832.52 | E1058: 0 | F1058: 0 | G1058: 0 | H1058: 0 | I1058: 0 | J1058: 0 | K1058: 4223.1599999999999 | L1058: 0 | M1058: =SUM(J1058:L1058)-390.64 -> 3832.52 | N1058: 390.63999999999999 | O1058: =SUM(M1058:N1058) -> 4223.1599999999999
A1059: 4153 | B1059: UFV FUTURA 8 | C1059: 37.349.892/0001-40 | D1059: 3855.3899999999999 | E1059: 0 | F1059: 0 | G1059: 0 | H1059: 0 | I1059: 0 | J1059: 0 | K1059: 4248.3599999999997 | L1059: 0 | M1059: =SUM(J1059:L1059)-392.97 -> 3855.3899999999994 | N1059: 392.97000000000003 | O1059: =SUM(M1059:N1059) -> 4248.3599999999997
A1060: 4154 | B1060: UFV FUTURA 9 | C1060: 37.350.010/0001-67 | D1060: 3832.52 | E1060: 0 | F1060: 0 | G1060: 0 | H1060: 0 | I1060: 0 | J1060: 0 | K1060: 4223.1599999999999 | L1060: 0 | M1060: =SUM(J1060:L1060)-390.64 -> 3832.52 | N1060: 390.63999999999999 | O1060: =SUM(M1060:N1060) -> 4223.1599999999999
A1061: 4155 | B1061: UFV FUTURA 10 | C1061: 37.350.010/0001-67 | D1061: 3838.9299999999998 | E1061: 0 | F1061: 0 | G1061: 0 | H1061: 0 | I1061: 0 | J1061: 0 | K1061: 4230.2299999999996 | L1061: 0 | M1061: =SUM(J1061:L1061)-391.3 -> 3838.9299999999994 | N1061: 391.30000000000001 | O1061: =SUM(M1061:N1061) -> 4230.2299999999996
A1062: 4156 | B1062: UFV FUTURA 11 | C1062: 37.350.010/0001-67 | D1062: 3842.0799999999999 | E1062: 0 | F1062: 0 | G1062: 0 | H1062: 0 | I1062: 0 | J1062: 0 | K1062: 4233.6999999999998 | L1062: 0 | M1062: =SUM(J1062:L1062)-391.62 -> 3842.0799999999999 | N1062: 391.62 | O1062: =SUM(M1062:N1062) -> 4233.6999999999998
A1063: 4157 | B1063: UFV FUTURA 12 | C1063: 37.350.010/0001-67 | D1063: 3847.98 | E1063: 0 | F1063: 0 | G1063: 0 | H1063: 0 | I1063: 0 | J1063: 0 | K1063: 4240.1999999999998 | L1063: 0 | M1063: =SUM(J1063:L1063)-392.22 -> 3847.9799999999996 | N1063: 392.22000000000003 | O1063: =SUM(M1063:N1063) -> 4240.1999999999998
A1064: 4158 | B1064: UFV FUTURA 13 | C1064: 37.349.956/0001-03 | D1064: 3832.52 | E1064: 0 | F1064: 0 | G1064: 0 | H1064: 0 | I1064: 0 | J1064: 0 | K1064: 4223.1599999999999 | L1064: 0 | M1064: =SUM(J1064:L1064)-390.64 -> 3832.52 | N1064: 390.63999999999999 | O1064: =SUM(M1064:N1064) -> 4223.1599999999999
A1065: 4159 | B1065: UFV FUTURA 14 | C1065: 37.349.956/0001-03 | D1065: 3832.52 | E1065: 0 | F1065: 0 | G1065: 0 | H1065: 0 | I1065: 0 | J1065: 0 | K1065: 4223.1599999999999 | L1065: 0 | M1065: =SUM(J1065:L1065)-390.64 -> 3832.52 | N1065: 390.63999999999999 | O1065: =SUM(M1065:N1065) -> 4223.1599999999999
A1066: 4160 | B1066: UFV FUTURA 15 | C1066: 37.349.956/0001-03 | D1066: 3835.54 | E1066: 0 | F1066: 0 | G1066: 0 | H1066: 0 | I1066: 0 | J1066: 0 | K1066: 4226.4899999999998 | L1066: 0 | M1066: =SUM(J1066:L1066)-390.95 -> 3835.54 | N1066: 390.94999999999999 | O1066: =SUM(M1066:N1066) -> 4226.4899999999998
A1067: 4161 | B1067: UFV FUTURA 16 | C1067: 37.349.956/0001-03 | D1067: 3832.52 | E1067: 0 | F1067: 0 | G1067: 0 | H1067: 0 | I1067: 0 | J1067: 0 | K1067: 4223.1599999999999 | L1067: 0 | M1067: =SUM(J1067:L1067)-390.64 -> 3832.52 | N1067: 390.63999999999999 | O1067: =SUM(M1067:N1067) -> 4223.1599999999999
A1068: 4162 | B1068: UFV FUTURA 17 | C1068: 37.349.956/0001-03 | D1068: 3832.52 | E1068: 0 | F1068: 0 | G1068: 0 | H1068: 0 | I1068: 0 | J1068: 0 | K1068: 4223.1599999999999 | L1068: 0 | M1068: =SUM(J1068:L1068)-390.64 -> 3832.52 | N1068: 390.63999999999999 | O1068: =SUM(M1068:N1068) -> 4223.1599999999999
A1069: 4163 | B1069: UFV FUTURA 18 | C1069: 37.349.910/0001-94 | D1069: 3847.6100000000001 | E1069: 0 | F1069: 0 | G1069: 0 | H1069: 0 | I1069: 0 | J1069: 0 | K1069: 4239.79 | L1069: 0 | M1069: =SUM(J1069:L1069)-392.18 -> 3847.6100000000001 | N1069: 392.18000000000001 | O1069: =SUM(M1069:N1069) -> 4239.79
A1070: 4164 | B1070: UFV FUTURA 19 | C1070: 37.349.910/0001-94 | D1070: 3832.52 | E1070: 0 | F1070: 0 | G1070: 0 | H1070: 0 | I1070: 0 | J1070: 0 | K1070: 4223.1599999999999 | L1070: 0 | M1070: =SUM(J1070:L1070)-390.64 -> 3832.52 | N1070: 390.63999999999999 | O1070: =SUM(M1070:N1070) -> 4223.1599999999999
A1071: 4165 | B1071: UFV FUTURA 20 | C1071: 37.349.910/0001-94 | D1071: 3832.52 | E1071: 0 | F1071: 0 | G1071: 0 | H1071: 0 | I1071: 0 | J1071: 0 | K1071: 4223.1599999999999 | L1071: 0 | M1071: =SUM(J1071:L1071)-390.64 -> 3832.52 | N1071: 390.63999999999999 | O1071: =SUM(M1071:N1071) -> 4223.1599999999999
A1072: 4166 | B1072: UFV FUTURA 21 | C1072: 37.576.883/0001-92 | D1072: 3832.52 | E1072: 0 | F1072: 0 | G1072: 0 | H1072: 0 | I1072: 0 | J1072: 0 | K1072: 4223.1599999999999 | L1072: 0 | M1072: =SUM(J1072:L1072)-390.64 -> 3832.52 | N1072: 390.63999999999999 | O1072: =SUM(M1072:N1072) -> 4223.1599999999999
A1073: 4167 | B1073: UFV FUTURA 22 | C1073: 37.576.883/0001-92 | D1073: 3832.52 | E1073: 0 | F1073: 0 | G1073: 0 | H1073: 0 | I1073: 0 | J1073: 0 | K1073: 4223.1599999999999 | L1073: 0 | M1073: =SUM(J1073:L1073)-390.64 -> 3832.52 | N1073: 390.63999999999999 | O1073: =SUM(M1073:N1073) -> 4223.1599999999999
A1074: 4168 | B1074: EOL JANDAIRA I | C1074: 35.823.538/0002-61 | D1074: 1181.5599999999999 | E1074: 0 | F1074: 0 | G1074: 0 | H1074: 0 | I1074: 0 | J1074: 0 | K1074: 1301.99 | L1074: 0 | M1074: =SUM(J1074:L1074)-120.43 -> 1181.5599999999999 | N1074: 120.43000000000001 | O1074: =SUM(M1074:N1074) -> 1301.99
A1075: 4169 | B1075: EOL TUCANO X | C1075: 35.636.816/0001-90 | D1075: 4743.0900000000001 | E1075: 0 | F1075: 0 | G1075: 0 | H1075: 0 | I1075: 0 | J1075: 0 | K1075: 5226.5500000000002 | L1075: 0 | M1075: =SUM(J1075:L1075)-483.46 -> 4743.0900000000001 | N1075: 483.45999999999998 | O1075: =SUM(M1075:N1075) -> 5226.5500000000002
A1076: 4170 | B1076: EOL ACAUÃ I | C1076: 35.842.703/0001-41 | D1076: 3231.8899999999999 | E1076: 0 | F1076: 0 | G1076: 0 | H1076: 0 | I1076: 0 | J1076: 0 | K1076: 3561.3099999999999 | L1076: 0 | M1076: =SUM(J1076:L1076)-329.42 -> 3231.8899999999999 | N1076: 329.42000000000002 | O1076: =SUM(M1076:N1076) -> 3561.3099999999999
A1077: 4171 | B1077: EOL BARAÚNAS XV | C1077: 34.986.689/0002-78 | D1077: 6485.3100000000004 | E1077: 0 | F1077: 0 | G1077: 0 | H1077: 0 | I1077: 0 | J1077: 0 | K1077: 7146.3500000000004 | L1077: 0 | M1077: =SUM(J1077:L1077)-661.04 -> 6485.3100000000004 | N1077: 661.03999999999996 | O1077: =SUM(M1077:N1077) -> 7146.3500000000004
A1078: 4172 | B1078: UTE LWARCEL | C1078: 53.943.098/0001-87 | D1078: 682.05999999999995 | E1078: 0 | F1078: 0 | G1078: 0 | H1078: 0 | I1078: 0 | J1078: 0 | K1078: 751.58000000000004 | L1078: 0 | M1078: =SUM(J1078:L1078)-69.52 -> 682.06000000000006 | N1078: 69.519999999999996 | O1078: =SUM(M1078:N1078) -> 751.58000000000004
A1079: 4173 | B1079: UFV SERRA DO MEL V | C1079: 39.702.823/0001-02 | D1079: 5782.1800000000003 | E1079: 0 | F1079: 0 | G1079: 0 | H1079: 0 | I1079: 0 | J1079: 0 | K1079: 6371.5500000000002 | L1079: 0 | M1079: =SUM(J1079:L1079)-589.37 -> 5782.1800000000003 | N1079: 589.37 | O1079: =SUM(M1079:N1079) -> 6371.5500000000002
A1080: 4174 | B1080: UFV SERRA DO MEL VI | C1080: 39.702.834/0001-84 | D1080: 5782.1800000000003 | E1080: 0 | F1080: 0 | G1080: 0 | H1080: 0 | I1080: 0 | J1080: 0 | K1080: 6371.5500000000002 | L1080: 0 | M1080: =SUM(J1080:L1080)-589.37 -> 5782.1800000000003 | N1080: 589.37 | O1080: =SUM(M1080:N1080) -> 6371.5500000000002
A1081: 4175 | B1081: UFV SERRA DO MEL III | C1081: 39.702.802/0001-89 | D1081: 8224.3899999999994 | E1081: 0 | F1081: 0 | G1081: 0 | H1081: 0 | I1081: 0 | J1081: 0 | K1081: 9062.6900000000005 | L1081: 0 | M1081: =SUM(J1081:L1081)-838.3 -> 8224.3900000000012 | N1081: 838.29999999999995 | O1081: =SUM(M1081:N1081) -> 9062.6900000000005
A1082: 4176 | B1082: UFV SERRA DO MEL IV | C1082: 39.702.815/0001-58 | D1082: 7951.6800000000003 | E1082: 0 | F1082: 0 | G1082: 0 | H1082: 0 | I1082: 0 | J1082: 0 | K1082: 8762.1800000000003 | L1082: 0 | M1082: =SUM(J1082:L1082)-810.5 -> 7951.6800000000003 | N1082: 810.5 | O1082: =SUM(M1082:N1082) -> 8762.1800000000003
A1083: 4177 | B1083: EOL TUCANO III | C1083: 35.836.427/0001-09 | D1083: 4743.0900000000001 | E1083: 0 | F1083: 0 | G1083: 0 | H1083: 0 | I1083: 0 | J1083: 0 | K1083: 5226.5500000000002 | L1083: 0 | M1083: =SUM(J1083:L1083)-483.46 -> 4743.0900000000001 | N1083: 483.45999999999998 | O1083: =SUM(M1083:N1083) -> 5226.5500000000002
A1084: 4178 | B1084: EOL ACAUÃ II | C1084: 35.842.703/0001-41 | D1084: 2693.2399999999998 | E1084: 0 | F1084: 0 | G1084: 0 | H1084: 0 | I1084: 0 | J1084: 0 | K1084: 2967.7600000000002 | L1084: 0 | M1084: =SUM(J1084:L1084)-274.52 -> 2693.2400000000002 | N1084: 274.51999999999998 | O1084: =SUM(M1084:N1084) -> 2967.7600000000002
A1085: 4179 | B1085: EOL VENTOS DE SÃO ROQUE 01 | C1085: 31.594.049/0001-43 | D1085: 6220.0299999999997 | E1085: 0 | F1085: 0 | G1085: 0 | H1085: 0 | I1085: 0 | J1085: 0 | K1085: 6854.0299999999997 | L1085: 0 | M1085: =SUM(J1085:L1085)-634 -> 6220.0299999999997 | N1085: 634 | O1085: =SUM(M1085:N1085) -> 6854.0299999999997
A1086: 4180 | B1086: EOL VENTOS DE SÃO ROQUE 08 | C1086: 31.596.728/0001-51 | D1086: 6220.0299999999997 | E1086: 0 | F1086: 0 | G1086: 0 | H1086: 0 | I1086: 0 | J1086: 0 | K1086: 6854.0299999999997 | L1086: 0 | M1086: =SUM(J1086:L1086)-634 -> 6220.0299999999997 | N1086: 634 | O1086: =SUM(M1086:N1086) -> 6854.0299999999997
A1087: 4181 | B1087: EOL VENTOS DE SÃO VITOR 01 | C1087: 35.469.795/0001-66 | D1087: 4016.1599999999999 | E1087: 0 | F1087: 0 | G1087: 0 | H1087: 0 | I1087: 0 | J1087: 0 | K1087: 4425.5200000000004 | L1087: 0 | M1087: =SUM(J1087:L1087)-409.36 -> 4016.1600000000003 | N1087: 409.36000000000001 | O1087: =SUM(M1087:N1087) -> 4425.5200000000004
A1088: 4182 | B1088: EOL BAIXA DO SÍTIO | C1088: 35.842.708/0001-74 | D1088: 5420.1999999999998 | E1088: 0 | F1088: 0 | G1088: 0 | H1088: 0 | I1088: 0 | J1088: 0 | K1088: 5972.6700000000001 | L1088: 0 | M1088: =SUM(J1088:L1088)-552.47 -> 5420.1999999999998 | N1088: 552.47000000000003 | O1088: =SUM(M1088:N1088) -> 5972.6700000000001
A1089: 4183 | B1089: EOL BARAÚNAS IV | C1089: 34.986.649/0002-26 | D1089: 5558.8400000000001 | E1089: 0 | F1089: 0 | G1089: 0 | H1089: 0 | I1089: 0 | J1089: 0 | K1089: 6125.4399999999996 | L1089: 0 | M1089: =SUM(J1089:L1089)-566.6 -> 5558.8399999999992 | N1089: 566.60000000000002 | O1089: =SUM(M1089:N1089) -> 6125.4399999999996
A1090: 4184 | B1090: EOL JANDAÍRA II | C1090: 35.824.347/0002-14 | D1090: 2742.9400000000001 | E1090: 0 | F1090: 0 | G1090: 0 | H1090: 0 | I1090: 0 | J1090: 0 | K1090: 3022.52 | L1090: 0 | M1090: =SUM(J1090:L1090)-279.58 -> 2742.9400000000001 | N1090: 279.57999999999998 | O1090: =SUM(M1090:N1090) -> 3022.52
A1091: 4185 | B1091: EOL JANDAÍRA III | C1091: 35.823.536/0002-72 | D1091: 3124.0300000000002 | E1091: 0 | F1091: 0 | G1091: 0 | H1091: 0 | I1091: 0 | J1091: 0 | K1091: 3442.46 | L1091: 0 | M1091: =SUM(J1091:L1091)-318.43 -> 3124.0300000000002 | N1091: 318.43000000000001 | O1091: =SUM(M1091:N1091) -> 3442.46
A1092: 4186 | B1092: EOL JANDAÍRA IV | C1092: 35.823.577/0002-69 | D1092: 3111.48 | E1092: 0 | F1092: 0 | G1092: 0 | H1092: 0 | I1092: 0 | J1092: 0 | K1092: 3428.6300000000001 | L1092: 0 | M1092: =SUM(J1092:L1092)-317.15 -> 3111.48 | N1092: 317.14999999999998 | O1092: =SUM(M1092:N1092) -> 3428.6300000000001
A1093: 4187 | B1093: UFV LAR DO SOL 1 | C1093: 32.222.320/0001-82 | D1093: 6018.5500000000002 | E1093: 0 | F1093: 0 | G1093: 0 | H1093: 0 | I1093: 0 | J1093: 0 | K1093: 6632.0100000000002 | L1093: 0 | M1093: =SUM(J1093:L1093)-613.46 -> 6018.5500000000002 | N1093: 613.46000000000004 | O1093: =SUM(M1093:N1093) -> 6632.0100000000002
A1094: 4188 | B1094: UFV LAR DO SOL 2 | C1094: 32.222.320/0001-82 | D1094: 6018.5500000000002 | E1094: 0 | F1094: 0 | G1094: 0 | H1094: 0 | I1094: 0 | J1094: 0 | K1094: 6632.0100000000002 | L1094: 0 | M1094: =SUM(J1094:L1094)-613.46 -> 6018.5500000000002 | N1094: 613.46000000000004 | O1094: =SUM(M1094:N1094) -> 6632.0100000000002
A1095: 4189 | B1095: UFV LAR DO SOL 7 | C1095: 31.345.445/0001-37 | D1095: 6018.5500000000002 | E1095: 0 | F1095: 0 | G1095: 0 | H1095: 0 | I1095: 0 | J1095: 0 | K1095: 6632.0100000000002 | L1095: 0 | M1095: =SUM(J1095:L1095)-613.46 -> 6018.5500000000002 | N1095: 613.46000000000004 | O1095: =SUM(M1095:N1095) -> 6632.0100000000002
A1096: 4190 | B1096: UFV LAR DO SOL 8 | C1096: 31.345.445/0001-37 | D1096: 6018.5500000000002 | E1096: 0 | F1096: 0 | G1096: 0 | H1096: 0 | I1096: 0 | J1096: 0 | K1096: 6632.0100000000002 | L1096: 0 | M1096: =SUM(J1096:L1096)-613.46 -> 6018.5500000000002 | N1096: 613.46000000000004 | O1096: =SUM(M1096:N1096) -> 6632.0100000000002
A1097: 4191 | B1097: UFV LAR DO SOL 9 | C1097: 31.345.569/0001-12 | D1097: 6018.5500000000002 | E1097: 0 | F1097: 0 | G1097: 0 | H1097: 0 | I1097: 0 | J1097: 0 | K1097: 6632.0100000000002 | L1097: 0 | M1097: =SUM(J1097:L1097)-613.46 -> 6018.5500000000002 | N1097: 613.46000000000004 | O1097: =SUM(M1097:N1097) -> 6632.0100000000002
A1098: 4192 | B1098: UFV LAR DO SOL 10 | C1098: 31.345.569/0001-12 | D1098: 6018.5500000000002 | E1098: 0 | F1098: 0 | G1098: 0 | H1098: 0 | I1098: 0 | J1098: 0 | K1098: 6632.0100000000002 | L1098: 0 | M1098: =SUM(J1098:L1098)-613.46 -> 6018.5500000000002 | N1098: 613.46000000000004 | O1098: =SUM(M1098:N1098) -> 6632.0100000000002
A1099: 4193 | B1099: EOL TUCANO IV | C1099: 35.836.426/0001-64 | D1099: 4743.0900000000001 | E1099: 0 | F1099: 0 | G1099: 0 | H1099: 0 | I1099: 0 | J1099: 0 | K1099: 5226.5500000000002 | L1099: 0 | M1099: =SUM(J1099:L1099)-483.46 -> 4743.0900000000001 | N1099: 483.45999999999998 | O1099: =SUM(M1099:N1099) -> 5226.5500000000002
A1100: 4194 | B1100: EOL TUCANO XVI | C1100: 35.806.317/0002-85 | D1100: 1355.1700000000001 | E1100: 0 | F1100: 0 | G1100: 0 | H1100: 0 | I1100: 0 | J1100: 0 | K1100: 1493.3 | L1100: 0 | M1100: =SUM(J1100:L1100)-138.13 -> 1355.1700000000001 | N1100: 138.13 | O1100: =SUM(M1100:N1100) -> 1493.3000000000002
A1101: 4195 | B1101: EOL VENTOS DE SÃO ROQUE 02 | C1101: 31.596.667/0001-22 | D1101: 6220.0299999999997 | E1101: 0 | F1101: 0 | G1101: 0 | H1101: 0 | I1101: 0 | J1101: 0 | K1101: 6854.0299999999997 | L1101: 0 | M1101: =SUM(J1101:L1101)-634 -> 6220.0299999999997 | N1101: 634 | O1101: =SUM(M1101:N1101) -> 6854.0299999999997
A1102: 4196 | B1102: EOL VENTOS DE SÃO ROQUE 04 | C1102: 31.594.122/0001-87 | D1102: 6220.0299999999997 | E1102: 0 | F1102: 0 | G1102: 0 | H1102: 0 | I1102: 0 | J1102: 0 | K1102: 6854.0299999999997 | L1102: 0 | M1102: =SUM(J1102:L1102)-634 -> 6220.0299999999997 | N1102: 634 | O1102: =SUM(M1102:N1102) -> 6854.0299999999997
A1103: 4197 | B1103: EOL VENTOS DE SÃO ROQUE 11 | C1103: 31.595.917/0001-00 | D1103: 6220.0299999999997 | E1103: 0 | F1103: 0 | G1103: 0 | H1103: 0 | I1103: 0 | J1103: 0 | K1103: 6854.0299999999997 | L1103: 0 | M1103: =SUM(J1103:L1103)-634 -> 6220.0299999999997 | N1103: 634 | O1103: =SUM(M1103:N1103) -> 6854.0299999999997
A1104: 4198 | B1104: EOL VENTOS DE SÃO ROQUE 16 | C1104: 31.595.857/0001-25 | D1104: 6220.0299999999997 | E1104: 0 | F1104: 0 | G1104: 0 | H1104: 0 | I1104: 0 | J1104: 0 | K1104: 6854.0299999999997 | L1104: 0 | M1104: =SUM(J1104:L1104)-634 -> 6220.0299999999997 | N1104: 634 | O1104: =SUM(M1104:N1104) -> 6854.0299999999997
A1105: 4199 | B1105: EOL VENTOS DE SÃO ROQUE 17 | C1105: 31.594.065/0001-36 | D1105: 6220.0299999999997 | E1105: 0 | F1105: 0 | G1105: 0 | H1105: 0 | I1105: 0 | J1105: 0 | K1105: 6854.0299999999997 | L1105: 0 | M1105: =SUM(J1105:L1105)-634 -> 6220.0299999999997 | N1105: 634 | O1105: =SUM(M1105:N1105) -> 6854.0299999999997
A1106: 4200 | B1106: EOL VENTOS DE SÃO ROQUE 18 | C1106: 31.596.016/0001-32 | D1106: 6220.0299999999997 | E1106: 0 | F1106: 0 | G1106: 0 | H1106: 0 | I1106: 0 | J1106: 0 | K1106: 6854.0299999999997 | L1106: 0 | M1106: =SUM(J1106:L1106)-634 -> 6220.0299999999997 | N1106: 634 | O1106: =SUM(M1106:N1106) -> 6854.0299999999997
A1107: 4201 | B1107: EOL VENTOS DE SANTA EUGÊNIA 02 | C1107: 35.637.246/0002-34 | D1107: 1390.3800000000001 | E1107: 0 | F1107: 0 | G1107: 0 | H1107: 0 | I1107: 0 | J1107: 0 | K1107: 1532.0999999999999 | L1107: 0 | M1107: =SUM(J1107:L1107)-141.72 -> 1390.3799999999999 | N1107: 141.72 | O1107: =SUM(M1107:N1107) -> 1532.0999999999999
A1108: 4202 | B1108: EOL VENTOS DE SANTA EUGÊNIA 07 | C1108: 35.637.246/0002-34 | D1108: 2085.5700000000002 | E1108: 0 | F1108: 0 | G1108: 0 | H1108: 0 | I1108: 0 | J1108: 0 | K1108: 2298.1500000000001 | L1108: 0 | M1108: =SUM(J1108:L1108)-212.58 -> 2085.5700000000002 | N1108: 212.58000000000001 | O1108: =SUM(M1108:N1108) -> 2298.1500000000001
A1109: 4203 | B1109: EOL VENTOS DE SÃO VITOR 02 | C1109: 35.477.401/0001-11 | D1109: 3952.7600000000002 | E1109: 0 | F1109: 0 | G1109: 0 | H1109: 0 | I1109: 0 | J1109: 0 | K1109: 4355.6599999999999 | L1109: 0 | M1109: =SUM(J1109:L1109)-402.9 -> 3952.7599999999998 | N1109: 402.89999999999998 | O1109: =SUM(M1109:N1109) -> 4355.6599999999999
A1110: 4204 | B1110: EOL VENTOS DE SÃO VITOR 03 | C1110: 35.402.454/0001-73 | D1110: 4016.1599999999999 | E1110: 0 | F1110: 0 | G1110: 0 | H1110: 0 | I1110: 0 | J1110: 0 | K1110: 4425.5200000000004 | L1110: 0 | M1110: =SUM(J1110:L1110)-409.36 -> 4016.1600000000003 | N1110: 409.36000000000001 | O1110: =SUM(M1110:N1110) -> 4425.5200000000004
A1111: 4205 | B1111: EOL VENTOS DE SÃO VITOR 06 | C1111: 35.402.868/0001-00 | D1111: 4016.1599999999999 | E1111: 0 | F1111: 0 | G1111: 0 | H1111: 0 | I1111: 0 | J1111: 0 | K1111: 4425.5200000000004 | L1111: 0 | M1111: =SUM(J1111:L1111)-409.36 -> 4016.1600000000003 | N1111: 409.36000000000001 | O1111: =SUM(M1111:N1111) -> 4425.5200000000004
A1112: 4206 | B1112: EOL TUCANO II | C1112: 35.806.317/0001-02 | D1112: 2710.3299999999999 | E1112: 0 | F1112: 0 | G1112: 0 | H1112: 0 | I1112: 0 | J1112: 0 | K1112: 2986.5900000000001 | L1112: 0 | M1112: =SUM(J1112:L1112)-276.26 -> 2710.3299999999999 | N1112: 276.25999999999999 | O1112: =SUM(M1112:N1112) -> 2986.5900000000001
A1113: 4207 | B1113: EOL VENTOS DE SANTA EUGÊNIA 01 | C1113: 35.637.424/0002-27 | D1113: 6152.1199999999999 | E1113: 0 | F1113: 0 | G1113: 0 | H1113: 0 | I1113: 0 | J1113: 0 | K1113: 6779.1999999999998 | L1113: 0 | M1113: =SUM(J1113:L1113)-627.08 -> 6152.1199999999999 | N1113: 627.08000000000004 | O1113: =SUM(M1113:N1113) -> 6779.1999999999998
A1114: 4208 | B1114: EOL VENTOS DE SÃO VITOR 04 | C1114: 35.402.592/0001-52 | D1114: 4016.1599999999999 | E1114: 0 | F1114: 0 | G1114: 0 | H1114: 0 | I1114: 0 | J1114: 0 | K1114: 4425.5200000000004 | L1114: 0 | M1114: =SUM(J1114:L1114)-409.36 -> 4016.1600000000003 | N1114: 409.36000000000001 | O1114: =SUM(M1114:N1114) -> 4425.5200000000004
A1115: 4209 | B1115: EOL VENTOS DE SÃO VITOR 05 | C1115: 35.402.703/0001-20 | D1115: 4016.1599999999999 | E1115: 0 | F1115: 0 | G1115: 0 | H1115: 0 | I1115: 0 | J1115: 0 | K1115: 4425.5200000000004 | L1115: 0 | M1115: =SUM(J1115:L1115)-409.36 -> 4016.1600000000003 | N1115: 409.36000000000001 | O1115: =SUM(M1115:N1115) -> 4425.5200000000004
A1116: 4210 | B1116: UTE VIANA 1 | C1116: 09.043.782/0004-63 | D1116: 7464.9300000000003 | E1116: 0 | F1116: 0 | G1116: 0 | H1116: 0 | I1116: 0 | J1116: 0 | K1116: 8225.8199999999997 | L1116: 0 | M1116: =SUM(J1116:L1116)-760.89 -> 7464.9299999999994 | N1116: 760.88999999999999 | O1116: =SUM(M1116:N1116) -> 8225.8199999999997
A1117: 4212 | B1117: EOL VENTOS DE SANTO APOLINÁRIO | C1117: 23.037.442/0001-08 | D1117: 4652.5 | E1117: 0 | F1117: 0 | G1117: 0 | H1117: 0 | I1117: 0 | J1117: 0 | K1117: 5126.7200000000003 | L1117: 0 | M1117: =SUM(J1117:L1117)-474.22 -> 4652.5 | N1117: 474.22000000000003 | O1117: =SUM(M1117:N1117) -> 5126.7200000000003
A1118: 4213 | B1118: EOL VENTOS DE SANTA ALEXANDRINA | C1118: 23.037.493/0001-30 | D1118: 5829.4099999999999 | E1118: 0 | F1118: 0 | G1118: 0 | H1118: 0 | I1118: 0 | J1118: 0 | K1118: 6423.5900000000001 | L1118: 0 | M1118: =SUM(J1118:L1118)-594.18 -> 5829.4099999999999 | N1118: 594.17999999999995 | O1118: =SUM(M1118:N1118) -> 6423.5900000000001
A1119: 4214 | B1119: EOL VENTOS DE SÃO JOÃO PAULO II | C1119: 23.037.337/0001-79 | D1119: 4070.1999999999998 | E1119: 0 | F1119: 0 | G1119: 0 | H1119: 0 | I1119: 0 | J1119: 0 | K1119: 4485.0699999999997 | L1119: 0 | M1119: =SUM(J1119:L1119)-414.87 -> 4070.1999999999998 | N1119: 414.87 | O1119: =SUM(M1119:N1119) -> 4485.0699999999997
A1120: 4215 | B1120: UFV JANAUBA 1 | C1120: 37.380.592/0001-24 | D1120: 6544.8299999999999 | E1120: 0 | F1120: 0 | G1120: 0 | H1120: 0 | I1120: 0 | J1120: 0 | K1120: 7211.9300000000003 | L1120: 0 | M1120: =SUM(J1120:L1120)-667.1 -> 6544.8299999999999 | N1120: 667.10000000000002 | O1120: =SUM(M1120:N1120) -> 7211.9300000000003
A1121: 4216 | B1121: UFV JANAUBA 3 | C1121: 37.381.467/0001-39 | D1121: 6544.8299999999999 | E1121: 0 | F1121: 0 | G1121: 0 | H1121: 0 | I1121: 0 | J1121: 0 | K1121: 7211.9300000000003 | L1121: 0 | M1121: =SUM(J1121:L1121)-667.1 -> 6544.8299999999999 | N1121: 667.10000000000002 | O1121: =SUM(M1121:N1121) -> 7211.9300000000003
A1122: 4217 | B1122: UFV JANAUBA 4 | C1122: 37.381.255/0001-51 | D1122: 6544.8299999999999 | E1122: 0 | F1122: 0 | G1122: 0 | H1122: 0 | I1122: 0 | J1122: 0 | K1122: 7211.9300000000003 | L1122: 0 | M1122: =SUM(J1122:L1122)-667.1 -> 6544.8299999999999 | N1122: 667.10000000000002 | O1122: =SUM(M1122:N1122) -> 7211.9300000000003
A1123: 4218 | B1123: EOL VENTOS DE SANTO ANTERO | C1123: 22.246.333/0001-38 | D1123: 6358.6899999999996 | E1123: 0 | F1123: 0 | G1123: 0 | H1123: 0 | I1123: 0 | J1123: 0 | K1123: 7006.8199999999997 | L1123: 0 | M1123: =SUM(J1123:L1123)-648.13 -> 6358.6899999999996 | N1123: 648.13 | O1123: =SUM(M1123:N1123) -> 7006.8199999999997
A1124: 4219 | B1124: EOL VENTOS DE SÃO BERNARDO | C1124: 21.893.166/0001-54 | D1124: 5716.8599999999997 | E1124: 0 | F1124: 0 | G1124: 0 | H1124: 0 | I1124: 0 | J1124: 0 | K1124: 6299.5699999999997 | L1124: 0 | M1124: =SUM(J1124:L1124)-582.71 -> 5716.8599999999997 | N1124: 582.71000000000004 | O1124: =SUM(M1124:N1124) -> 6299.5699999999997
A1125: 4220 | B1125: EOL VENTOS DE SANTA EUGÊNIA 03 | C1125: 35.636.507/0002-00 | D1125: 4865.1000000000004 | E1125: 0 | F1125: 0 | G1125: 0 | H1125: 0 | I1125: 0 | J1125: 0 | K1125: 5360.9899999999998 | L1125: 0 | M1125: =SUM(J1125:L1125)-495.89 -> 4865.0999999999995 | N1125: 495.88999999999999 | O1125: =SUM(M1125:N1125) -> 5360.9899999999998
A1126: 4222 | B1126: EOL OITIS 1 | C1126: 34.211.213/0002-65 | D1126: 6335.0200000000004 | E1126: 0 | F1126: 0 | G1126: 0 | H1126: 0 | I1126: 0 | J1126: 0 | K1126: 6980.7399999999998 | L1126: 0 | M1126: =SUM(J1126:L1126)-645.72 -> 6335.0199999999995 | N1126: 645.72000000000003 | O1126: =SUM(M1126:N1126) -> 6980.7399999999998
A1127: 4223 | B1127: EOL OITIS 5 | C1127: 34.211.252/0002-62 | D1127: 6413.4899999999998 | E1127: 0 | F1127: 0 | G1127: 0 | H1127: 0 | I1127: 0 | J1127: 0 | K1127: 7067.21 | L1127: 0 | M1127: =SUM(J1127:L1127)-653.72 -> 6413.4899999999998 | N1127: 653.72000000000003 | O1127: =SUM(M1127:N1127) -> 7067.21
A1128: 4224 | B1128: EOL OITIS 6 | C1128: 34.211.096/0002-30 | D1128: 6413.4899999999998 | E1128: 0 | F1128: 0 | G1128: 0 | H1128: 0 | I1128: 0 | J1128: 0 | K1128: 7067.21 | L1128: 0 | M1128: =SUM(J1128:L1128)-653.72 -> 6413.4899999999998 | N1128: 653.72000000000003 | O1128: =SUM(M1128:N1128) -> 7067.21
A1129: 4225 | B1129: EOL OITIS 7 | C1129: 34.211.395/0002-74 | D1129: 6413.4899999999998 | E1129: 0 | F1129: 0 | G1129: 0 | H1129: 0 | I1129: 0 | J1129: 0 | K1129: 7067.21 | L1129: 0 | M1129: =SUM(J1129:L1129)-653.72 -> 6413.4899999999998 | N1129: 653.72000000000003 | O1129: =SUM(M1129:N1129) -> 7067.21
A1130: 4226 | B1130: EOL OITIS 22 | C1130: 34.211.180/0002-53 | D1130: 6413.4899999999998 | E1130: 0 | F1130: 0 | G1130: 0 | H1130: 0 | I1130: 0 | J1130: 0 | K1130: 7067.21 | L1130: 0 | M1130: =SUM(J1130:L1130)-653.72 -> 6413.4899999999998 | N1130: 653.72000000000003 | O1130: =SUM(M1130:N1130) -> 7067.21
A1131: 4227 | B1131: EOL AW SÃO JOÃO | C1131: 33.268.331/0001-66 | D1131: 3109.6300000000001 | E1131: 0 | F1131: 0 | G1131: 0 | H1131: 0 | I1131: 0 | J1131: 0 | K1131: 3426.5900000000001 | L1131: 0 | M1131: =SUM(J1131:L1131)-316.96 -> 3109.6300000000001 | N1131: 316.95999999999998 | O1131: =SUM(M1131:N1131) -> 3426.5900000000001
A1132: 4228 | B1132: EOL AW SANTA RÉGIA | C1132: 33.268.312/0001-30 | D1132: 4608.1899999999996 | E1132: 0 | F1132: 0 | G1132: 0 | H1132: 0 | I1132: 0 | J1132: 0 | K1132: 5077.8999999999996 | L1132: 0 | M1132: =SUM(J1132:L1132)-469.71 -> 4608.1899999999996 | N1132: 469.70999999999998 | O1132: =SUM(M1132:N1132) -> 5077.8999999999996
A1133: 4229 | B1133: UFV JANAUBA 2 | C1133: 37.405.455/0001-05 | D1133: 6544.8299999999999 | E1133: 0 | F1133: 0 | G1133: 0 | H1133: 0 | I1133: 0 | J1133: 0 | K1133: 7211.9300000000003 | L1133: 0 | M1133: =SUM(J1133:L1133)-667.1 -> 6544.8299999999999 | N1133: 667.10000000000002 | O1133: =SUM(M1133:N1133) -> 7211.9300000000003
A1134: 4230 | B1134: UFV JANAUBA 9 | C1134: 37.381.180/0001-09 | D1134: 6544.8299999999999 | E1134: 0 | F1134: 0 | G1134: 0 | H1134: 0 | I1134: 0 | J1134: 0 | K1134: 7211.9300000000003 | L1134: 0 | M1134: =SUM(J1134:L1134)-667.1 -> 6544.8299999999999 | N1134: 667.10000000000002 | O1134: =SUM(M1134:N1134) -> 7211.9300000000003
A1135: 4231 | B1135: EOL VENTOS DE SÃO VITOR 07 | C1135: 35.402.953/0001-60 | D1135: 5622.6199999999999 | E1135: 0 | F1135: 0 | G1135: 0 | H1135: 0 | I1135: 0 | J1135: 0 | K1135: 6195.7200000000003 | L1135: 0 | M1135: =SUM(J1135:L1135)-573.1 -> 5622.6199999999999 | N1135: 573.10000000000002 | O1135: =SUM(M1135:N1135) -> 6195.7200000000003
A1136: 4232 | B1136: EOL VENTOS DE SÃO JANUÁRIO 15 | C1136: 35.865.644/0002-08 | D1136: 1233.0699999999999 | E1136: 0 | F1136: 0 | G1136: 0 | H1136: 0 | I1136: 0 | J1136: 0 | K1136: 1358.75 | L1136: 0 | M1136: =SUM(J1136:L1136)-125.68 -> 1233.0699999999999 | N1136: 125.68000000000001 | O1136: =SUM(M1136:N1136) -> 1358.75
A1137: 4233 | B1137: EOL VENTOS DE SÃO JANUÁRIO 16 | C1137: 35.874.355/0002-75 | D1137: 1233.0699999999999 | E1137: 0 | F1137: 0 | G1137: 0 | H1137: 0 | I1137: 0 | J1137: 0 | K1137: 1358.75 | L1137: 0 | M1137: =SUM(J1137:L1137)-125.68 -> 1233.0699999999999 | N1137: 125.68000000000001 | O1137: =SUM(M1137:N1137) -> 1358.75
A1138: 4234 | B1138: EOL VENTOS DE SÃO JANUÁRIO 17 | C1138: 35.859.013/0002-86 | D1138: 1233.0699999999999 | E1138: 0 | F1138: 0 | G1138: 0 | H1138: 0 | I1138: 0 | J1138: 0 | K1138: 1358.75 | L1138: 0 | M1138: =SUM(J1138:L1138)-125.68 -> 1233.0699999999999 | N1138: 125.68000000000001 | O1138: =SUM(M1138:N1138) -> 1358.75
A1139: 4235 | B1139: EOL VENTOS DE SÃO JANUÁRIO 18 | C1139: 35.865.623/0002-92 | D1139: 1233.0699999999999 | E1139: 0 | F1139: 0 | G1139: 0 | H1139: 0 | I1139: 0 | J1139: 0 | K1139: 1358.75 | L1139: 0 | M1139: =SUM(J1139:L1139)-125.68 -> 1233.0699999999999 | N1139: 125.68000000000001 | O1139: =SUM(M1139:N1139) -> 1358.75
A1140: 4236 | B1140: EOL VENTOS DE SÃO JANUÁRIO 19 | C1140: 35.865.638/0002-50 | D1140: 1233.0699999999999 | E1140: 0 | F1140: 0 | G1140: 0 | H1140: 0 | I1140: 0 | J1140: 0 | K1140: 1358.75 | L1140: 0 | M1140: =SUM(J1140:L1140)-125.68 -> 1233.0699999999999 | N1140: 125.68000000000001 | O1140: =SUM(M1140:N1140) -> 1358.75
A1141: 4237 | B1141: UFV JANAUBA 8 | C1141: 37.381.661/0001-14 | D1141: 6544.8299999999999 | E1141: 0 | F1141: 0 | G1141: 0 | H1141: 0 | I1141: 0 | J1141: 0 | K1141: 7211.9300000000003 | L1141: 0 | M1141: =SUM(J1141:L1141)-667.1 -> 6544.8299999999999 | N1141: 667.10000000000002 | O1141: =SUM(M1141:N1141) -> 7211.9300000000003
A1142: 4238 | B1142: UFV JANAUBA 12 | C1142: 37.381.730/0001-90 | D1142: 6544.8299999999999 | E1142: 0 | F1142: 0 | G1142: 0 | H1142: 0 | I1142: 0 | J1142: 0 | K1142: 7211.9300000000003 | L1142: 0 | M1142: =SUM(J1142:L1142)-667.1 -> 6544.8299999999999 | N1142: 667.10000000000002 | O1142: =SUM(M1142:N1142) -> 7211.9300000000003
A1143: 4239 | B1143: UFV JANAUBA 13 | C1143: 37.405.654/0001-05 | D1143: 6544.8299999999999 | E1143: 0 | F1143: 0 | G1143: 0 | H1143: 0 | I1143: 0 | J1143: 0 | K1143: 7211.9300000000003 | L1143: 0 | M1143: =SUM(J1143:L1143)-667.1 -> 6544.8299999999999 | N1143: 667.10000000000002 | O1143: =SUM(M1143:N1143) -> 7211.9300000000003
A1144: 4240 | B1144: UFV JANAUBA 14 | C1144: 37.380.661/0001-08 | D1144: 6544.8299999999999 | E1144: 0 | F1144: 0 | G1144: 0 | H1144: 0 | I1144: 0 | J1144: 0 | K1144: 7211.9300000000003 | L1144: 0 | M1144: =SUM(J1144:L1144)-667.1 -> 6544.8299999999999 | N1144: 667.10000000000002 | O1144: =SUM(M1144:N1144) -> 7211.9300000000003
A1145: 4241 | B1145: UFV LAVRAS 6 | C1145: 35.306.327/0001-70 | D1145: 2804.1300000000001 | E1145: 0 | F1145: 0 | G1145: 0 | H1145: 0 | I1145: 0 | J1145: 0 | K1145: 3089.9499999999998 | L1145: 0 | M1145: =SUM(J1145:L1145)-285.82 -> 2804.1299999999997 | N1145: 285.81999999999999 | O1145: =SUM(M1145:N1145) -> 3089.9499999999998
A1146: 4242 | B1146: UFV LAVRAS 7 | C1146: 35.357.719/0001-69 | D1146: 2168.8200000000002 | E1146: 0 | F1146: 0 | G1146: 0 | H1146: 0 | I1146: 0 | J1146: 0 | K1146: 2389.8800000000001 | L1146: 0 | M1146: =SUM(J1146:L1146)-221.06 -> 2168.8200000000002 | N1146: 221.06 | O1146: =SUM(M1146:N1146) -> 2389.8800000000001
A1147: 4243 | B1147: UFV LAVRAS 8 | C1147: 35.357.729/0001-02 | D1147: 2168.8200000000002 | E1147: 0 | F1147: 0 | G1147: 0 | H1147: 0 | I1147: 0 | J1147: 0 | K1147: 2389.8800000000001 | L1147: 0 | M1147: =SUM(J1147:L1147)-221.06 -> 2168.8200000000002 | N1147: 221.06 | O1147: =SUM(M1147:N1147) -> 2389.8800000000001
A1148: 4250 | B1148: EOL OITIS 2 | C1148: 34.238.187/0002-69 | D1148: 3563.0500000000002 | E1148: 0 | F1148: 0 | G1148: 0 | H1148: 0 | I1148: 0 | J1148: 0 | K1148: 3926.23 | L1148: 0 | M1148: =SUM(J1148:L1148)-363.18 -> 3563.0500000000002 | N1148: 363.18000000000001 | O1148: =SUM(M1148:N1148) -> 3926.23
A1149: 4251 | B1149: EOL VENTOS DE SANTO ALDERICO | C1149: 23.037.528/0001-30 | D1149: 5244.3299999999999 | E1149: 0 | F1149: 0 | G1149: 0 | H1149: 0 | I1149: 0 | J1149: 0 | K1149: 5778.8800000000001 | L1149: 0 | M1149: =SUM(J1149:L1149)-534.55 -> 5244.3299999999999 | N1149: 534.54999999999995 | O1149: =SUM(M1149:N1149) -> 5778.8800000000001
A1150: 4252 | B1150: EOL VENTOS DE SÃO CRISPIM | C1150: 23.037.375/0001-21 | D1150: 6408.1499999999996 | E1150: 0 | F1150: 0 | G1150: 0 | H1150: 0 | I1150: 0 | J1150: 0 | K1150: 7061.3199999999997 | L1150: 0 | M1150: =SUM(J1150:L1150)-653.17 -> 6408.1499999999996 | N1150: 653.16999999999996 | O1150: =SUM(M1150:N1150) -> 7061.3199999999997
A1151: 4253 | B1151: UHE TUCURUÍ | C1151: 00.357.038/0001-16 | D1151: 1923057.99 | E1151: 0 | F1151: 0 | G1151: 0 | H1151: 0 | I1151: 0 | J1151: 0 | K1151: 2119072.1699999999 | L1151: 0 | M1151: =SUM(J1151:L1151)-196014.18 -> 1923057.99 | N1151: 196014.17999999999 | O1151: =SUM(M1151:N1151) -> 2119072.1699999999
A1152: 4254 | B1152: UFV RIBEIRO GONÇALVES I | C1152: 31.711.512/0001-90 | D1152: 2026.3 | E1152: 0 | F1152: 0 | G1152: 0 | H1152: 0 | I1152: 0 | J1152: 0 | K1152: 2232.8400000000001 | L1152: 0 | M1152: =SUM(J1152:L1152)-206.54 -> 2026.3000000000002 | N1152: 206.53999999999999 | O1152: =SUM(M1152:N1152) -> 2232.8400000000001
A1153: 4255 | B1153: UFV RIBEIRO GONÇALVES II | C1153: 31.711.512/0001-90 | D1153: 4705.8100000000004 | E1153: 0 | F1153: 0 | G1153: 0 | H1153: 0 | I1153: 0 | J1153: 0 | K1153: 5185.4700000000003 | L1153: 0 | M1153: =SUM(J1153:L1153)-479.66 -> 4705.8100000000004 | N1153: 479.66000000000003 | O1153: =SUM(M1153:N1153) -> 5185.4700000000003
A1154: 4256 | B1154: UFV RIBEIRO GONÇALVES III | C1154: 31.711.512/0001-90 | D1154: 4705.8100000000004 | E1154: 0 | F1154: 0 | G1154: 0 | H1154: 0 | I1154: 0 | J1154: 0 | K1154: 5185.4700000000003 | L1154: 0 | M1154: =SUM(J1154:L1154)-479.66 -> 4705.8100000000004 | N1154: 479.66000000000003 | O1154: =SUM(M1154:N1154) -> 5185.4700000000003
A1155: 4257 | B1155: UFV RIBEIRO GONÇALVES IV | C1155: 31.711.512/0001-90 | D1155: 2566.8000000000002 | E1155: 0 | F1155: 0 | G1155: 0 | H1155: 0 | I1155: 0 | J1155: 0 | K1155: 2828.4299999999998 | L1155: 0 | M1155: =SUM(J1155:L1155)-261.63 -> 2566.7999999999997 | N1155: 261.63 | O1155: =SUM(M1155:N1155) -> 2828.4299999999998
A1156: 4258 | B1156: EOL ASSURUÁ 4 I | C1156: 38.112.927/0002-77 | D1156: 4585.0600000000004 | E1156: 0 | F1156: 0 | G1156: 0 | H1156: 0 | I1156: 0 | J1156: 0 | K1156: 5052.4099999999999 | L1156: 0 | M1156: =SUM(J1156:L1156)-467.35 -> 4585.0599999999995 | N1156: 467.35000000000002 | O1156: =SUM(M1156:N1156) -> 5052.4099999999999
A1157: 4259 | B1157: EOL ASSURUÁ 4 VI | C1157: 38.049.608/0002-64 | D1157: 4585.0600000000004 | E1157: 0 | F1157: 0 | G1157: 0 | H1157: 0 | I1157: 0 | J1157: 0 | K1157: 5052.4099999999999 | L1157: 0 | M1157: =SUM(J1157:L1157)-467.35 -> 4585.0599999999995 | N1157: 467.35000000000002 | O1157: =SUM(M1157:N1157) -> 5052.4099999999999
A1158: 4260 | B1158: UFV JANAUBA 5 | C1158: 37.380.653/0001-53 | D1158: 6544.8299999999999 | E1158: 0 | F1158: 0 | G1158: 0 | H1158: 0 | I1158: 0 | J1158: 0 | K1158: 7211.9300000000003 | L1158: 0 | M1158: =SUM(J1158:L1158)-667.1 -> 6544.8299999999999 | N1158: 667.10000000000002 | O1158: =SUM(M1158:N1158) -> 7211.9300000000003
A1159: 4261 | B1159: UFV JANAUBA 10 | C1159: 37.405.824/0001-51 | D1159: 6544.8299999999999 | E1159: 0 | F1159: 0 | G1159: 0 | H1159: 0 | I1159: 0 | J1159: 0 | K1159: 7211.9300000000003 | L1159: 0 | M1159: =SUM(J1159:L1159)-667.1 -> 6544.8299999999999 | N1159: 667.10000000000002 | O1159: =SUM(M1159:N1159) -> 7211.9300000000003
A1160: 4262 | B1160: EOL OITIS 3 | C1160: 34.238.239/0002-05 | D1160: 6413.4899999999998 | E1160: 0 | F1160: 0 | G1160: 0 | H1160: 0 | I1160: 0 | J1160: 0 | K1160: 7067.21 | L1160: 0 | M1160: =SUM(J1160:L1160)-653.72 -> 6413.4899999999998 | N1160: 653.72000000000003 | O1160: =SUM(M1160:N1160) -> 7067.21
A1161: 4263 | B1161: EOL OITIS 8 | C1161: 34.211.894/0002-61 | D1161: 6335.0200000000004 | E1161: 0 | F1161: 0 | G1161: 0 | H1161: 0 | I1161: 0 | J1161: 0 | K1161: 6980.7399999999998 | L1161: 0 | M1161: =SUM(J1161:L1161)-645.72 -> 6335.0199999999995 | N1161: 645.72000000000003 | O1161: =SUM(M1161:N1161) -> 6980.7399999999998
A1162: 4264 | B1162: EOL OITIS 21 | C1162: 34.211.419/0002-95 | D1162: 5700.8800000000001 | E1162: 0 | F1162: 0 | G1162: 0 | H1162: 0 | I1162: 0 | J1162: 0 | K1162: 6281.96 | L1162: 0 | M1162: =SUM(J1162:L1162)-581.08 -> 5700.8800000000001 | N1162: 581.08000000000004 | O1162: =SUM(M1162:N1162) -> 6281.96
A1163: 4265 | B1163: EOL VENTOS DE SÃO CIRÍACO | C1163: 23.037.398/0001-36 | D1163: 6428.6400000000003 | E1163: 0 | F1163: 0 | G1163: 0 | H1163: 0 | I1163: 0 | J1163: 0 | K1163: 7083.8999999999996 | L1163: 0 | M1163: =SUM(J1163:L1163)-655.26 -> 6428.6399999999994 | N1163: 655.25999999999999 | O1163: =SUM(M1163:N1163) -> 7083.8999999999996
A1164: 4266 | B1164: EOL VENTOS DE SÃO CIRO | C1164: 23.037.463/0001-23 | D1164: 4620.7600000000002 | E1164: 0 | F1164: 0 | G1164: 0 | H1164: 0 | I1164: 0 | J1164: 0 | K1164: 5091.75 | L1164: 0 | M1164: =SUM(J1164:L1164)-470.99 -> 4620.7600000000002 | N1164: 470.99000000000001 | O1164: =SUM(M1164:N1164) -> 5091.75
A1165: 4267 | B1165: EOL VENTOS DE SANTA EUGÊNIA 12 | C1165: 35.636.507/0002-00 | D1165: 4863.8599999999997 | E1165: 0 | F1165: 0 | G1165: 0 | H1165: 0 | I1165: 0 | J1165: 0 | K1165: 5359.6300000000001 | L1165: 0 | M1165: =SUM(J1165:L1165)-495.77 -> 4863.8600000000006 | N1165: 495.76999999999998 | O1165: =SUM(M1165:N1165) -> 5359.630000000001
A1166: 4268 | B1166: EOL VENTOS DE SANTA EUGÊNIA 05 | C1166: 35.636.502/0002-79 | D1166: 4168.6800000000003 | E1166: 0 | F1166: 0 | G1166: 0 | H1166: 0 | I1166: 0 | J1166: 0 | K1166: 4593.5900000000001 | L1166: 0 | M1166: =SUM(J1166:L1166)-424.91 -> 4168.6800000000003 | N1166: 424.91000000000003 | O1166: =SUM(M1166:N1166) -> 4593.5900000000001
A1167: 4269 | B1167: RENOVA (EOL QUINA) | C1167: 18.560.032/0001-07 | D1167: 1176.3299999999999 | E1167: 0 | F1167: 0 | G1167: 0 | H1167: 0 | I1167: 0 | J1167: 0 | K1167: 1296.23 | L1167: 0 | M1167: =SUM(J1167:L1167)-119.9 -> 1176.3299999999999 | N1167: 119.90000000000001 | O1167: =SUM(M1167:N1167) -> 1296.23
A1168: 4270 | B1168: RENOVA (EOL MULUNGU) | C1168: 18.560.032/0001-07 | D1168: 1480.05 | E1168: 0 | F1168: 0 | G1168: 0 | H1168: 0 | I1168: 0 | J1168: 0 | K1168: 1630.9100000000001 | L1168: 0 | M1168: =SUM(J1168:L1168)-150.86 -> 1480.0500000000002 | N1168: 150.86000000000001 | O1168: =SUM(M1168:N1168) -> 1630.9100000000003
A1169: 4271 | B1169: UFV JANAUBA 6 | C1169: 37.380.936/0001-03 | D1169: 6544.8299999999999 | E1169: 0 | F1169: 0 | G1169: 0 | H1169: 0 | I1169: 0 | J1169: 0 | K1169: 7211.9300000000003 | L1169: 0 | M1169: =SUM(J1169:L1169)-667.1 -> 6544.8299999999999 | N1169: 667.10000000000002 | O1169: =SUM(M1169:N1169) -> 7211.9300000000003
A1170: 4272 | B1170: UFV JANAUBA 7 | C1170: 37.380.859/0001-83 | D1170: 6544.8299999999999 | E1170: 0 | F1170: 0 | G1170: 0 | H1170: 0 | I1170: 0 | J1170: 0 | K1170: 7211.9300000000003 | L1170: 0 | M1170: =SUM(J1170:L1170)-667.1 -> 6544.8299999999999 | N1170: 667.10000000000002 | O1170: =SUM(M1170:N1170) -> 7211.9300000000003
A1171: 4273 | B1171: EOL OITIS 4 | C1171: 34.211.484/0002-10 | D1171: 6413.4899999999998 | E1171: 0 | F1171: 0 | G1171: 0 | H1171: 0 | I1171: 0 | J1171: 0 | K1171: 7067.21 | L1171: 0 | M1171: =SUM(J1171:L1171)-653.72 -> 6413.4899999999998 | N1171: 653.72000000000003 | O1171: =SUM(M1171:N1171) -> 7067.21
A1172: 4274 | B1172: EOL VENTOS DE SÃO CAIO | C1172: 23.037.422/0001-37 | D1172: 4623.8000000000002 | E1172: 0 | F1172: 0 | G1172: 0 | H1172: 0 | I1172: 0 | J1172: 0 | K1172: 5095.1000000000004 | L1172: 0 | M1172: =SUM(J1172:L1172)-471.3 -> 4623.8000000000002 | N1172: 471.30000000000001 | O1172: =SUM(M1172:N1172) -> 5095.1000000000004
A1173: 4275 | B1173: EOL VENTOS DE SÃO VITOR 10 | C1173: 35.403.117/0001-09 | D1173: 5759.6999999999998 | E1173: 0 | F1173: 0 | G1173: 0 | H1173: 0 | I1173: 0 | J1173: 0 | K1173: 6346.7799999999997 | L1173: 0 | M1173: =SUM(J1173:L1173)-587.08 -> 5759.6999999999998 | N1173: 587.08000000000004 | O1173: =SUM(M1173:N1173) -> 6346.7799999999997
A1174: 4276 | B1174: EOL VENTOS DE SANTA EUGÊNIA 08 | C1174: 35.636.502/0002-79 | D1174: 3474.7199999999998 | E1174: 0 | F1174: 0 | G1174: 0 | H1174: 0 | I1174: 0 | J1174: 0 | K1174: 3828.8899999999999 | L1174: 0 | M1174: =SUM(J1174:L1174)-354.17 -> 3474.7199999999998 | N1174: 354.17000000000002 | O1174: =SUM(M1174:N1174) -> 3828.8899999999999
A1175: 4277 | B1175: EOL VENTOS DE SÃO VITOR 11 | C1175: 35.403.207/0001-91 | D1175: 4114.0799999999999 | E1175: 0 | F1175: 0 | G1175: 0 | H1175: 0 | I1175: 0 | J1175: 0 | K1175: 4533.4200000000001 | L1175: 0 | M1175: =SUM(J1175:L1175)-419.34 -> 4114.0799999999999 | N1175: 419.33999999999997 | O1175: =SUM(M1175:N1175) -> 4533.4200000000001
A1176: 4278 | B1176: EOL SANTO AGOSTINHO 13 | C1176: 20.667.603/0003-10 | D1176: 4671.7399999999998 | E1176: 0 | F1176: 0 | G1176: 0 | H1176: 0 | I1176: 0 | J1176: 0 | K1176: 5147.9200000000001 | L1176: 0 | M1176: =SUM(J1176:L1176)-476.18 -> 4671.7399999999998 | N1176: 476.18000000000001 | O1176: =SUM(M1176:N1176) -> 5147.9200000000001
A1177: 4279 | B1177: EOL SANTO AGOSTINHO 26 | C1177: 23.079.885/0002-42 | D1177: 5450.3699999999999 | E1177: 0 | F1177: 0 | G1177: 0 | H1177: 0 | I1177: 0 | J1177: 0 | K1177: 6005.9200000000001 | L1177: 0 | M1177: =SUM(J1177:L1177)-555.55 -> 5450.3699999999999 | N1177: 555.54999999999995 | O1177: =SUM(M1177:N1177) -> 6005.9200000000001
A1178: 4280 | B1178: EOL VENTOS DE SANTA EUGÊNIA 11 | C1178: 35.639.141/0002-14 | D1178: 3496.5999999999999 | E1178: 0 | F1178: 0 | G1178: 0 | H1178: 0 | I1178: 0 | J1178: 0 | K1178: 3853 | L1178: 0 | M1178: =SUM(J1178:L1178)-356.4 -> 3496.5999999999999 | N1178: 356.39999999999998 | O1178: =SUM(M1178:N1178) -> 3853
A1179: 4283 | B1179: EOL VENTOS DE SANTA EUGÊNIA 13 | C1179: 35.654.188/0002-57 | D1179: 5556.6000000000004 | E1179: 0 | F1179: 0 | G1179: 0 | H1179: 0 | I1179: 0 | J1179: 0 | K1179: 6122.9799999999996 | L1179: 0 | M1179: =SUM(J1179:L1179)-566.38 -> 5556.5999999999995 | N1179: 566.38 | O1179: =SUM(M1179:N1179) -> 6122.9799999999996
A1180: 4284 | B1180: EOL ANEMUS WIND 1 | C1180: 29.481.536/0001-58 | D1180: 4646.4300000000003 | E1180: 0 | F1180: 0 | G1180: 0 | H1180: 0 | I1180: 0 | J1180: 0 | K1180: 5120.0299999999997 | L1180: 0 | M1180: =SUM(J1180:L1180)-473.6 -> 4646.4299999999994 | N1180: 473.60000000000002 | O1180: =SUM(M1180:N1180) -> 5120.0299999999997
A1181: 4285 | B1181: EOL VENTOS DE SÃO VITOR 09 | C1181: 35.403.066/0001-07 | D1181: 4114.0799999999999 | E1181: 0 | F1181: 0 | G1181: 0 | H1181: 0 | I1181: 0 | J1181: 0 | K1181: 4533.4200000000001 | L1181: 0 | M1181: =SUM(J1181:L1181)-419.34 -> 4114.0799999999999 | N1181: 419.33999999999997 | O1181: =SUM(M1181:N1181) -> 4533.4200000000001
A1182: 4286 | B1182: UFV JANAUBA 11 | C1182: 37.381.300/0001-78 | D1182: 6544.8299999999999 | E1182: 0 | F1182: 0 | G1182: 0 | H1182: 0 | I1182: 0 | J1182: 0 | K1182: 7211.9300000000003 | L1182: 0 | M1182: =SUM(J1182:L1182)-667.1 -> 6544.8299999999999 | N1182: 667.10000000000002 | O1182: =SUM(M1182:N1182) -> 7211.9300000000003
A1183: 4287 | B1183: EOL OITIS 9 | C1183: 34.211.291/0002-60 | D1183: 6413.4899999999998 | E1183: 0 | F1183: 0 | G1183: 0 | H1183: 0 | I1183: 0 | J1183: 0 | K1183: 7067.21 | L1183: 0 | M1183: =SUM(J1183:L1183)-653.72 -> 6413.4899999999998 | N1183: 653.72000000000003 | O1183: =SUM(M1183:N1183) -> 7067.21
A1184: 4288 | B1184: EOL CASA NOVA II | C1184: 33.541.368/0001-16 | D1184: 2897.98 | E1184: 0 | F1184: 0 | G1184: 0 | H1184: 0 | I1184: 0 | J1184: 0 | K1184: 3193.3699999999999 | L1184: 0 | M1184: =SUM(J1184:L1184)-295.39 -> 2897.98 | N1184: 295.38999999999999 | O1184: =SUM(M1184:N1184) -> 3193.3699999999999
A1185: 4289 | B1185: EOL CASA NOVA III | C1185: 33.541.368/0001-16 | D1185: 2722.0500000000002 | E1185: 0 | F1185: 0 | G1185: 0 | H1185: 0 | I1185: 0 | J1185: 0 | K1185: 2999.5 | L1185: 0 | M1185: =SUM(J1185:L1185)-277.45 -> 2722.0500000000002 | N1185: 277.44999999999999 | O1185: =SUM(M1185:N1185) -> 2999.5
A1186: 4290 | B1186: EOL ASSURUÁ 4 II | C1186: 38.286.402/0002-58 | D1186: 4011.9400000000001 | E1186: 0 | F1186: 0 | G1186: 0 | H1186: 0 | I1186: 0 | J1186: 0 | K1186: 4420.8699999999999 | L1186: 0 | M1186: =SUM(J1186:L1186)-408.93 -> 4011.9400000000001 | N1186: 408.93000000000001 | O1186: =SUM(M1186:N1186) -> 4420.8699999999999
A1187: 4291 | B1187: EOL ASSURUÁ 4 III | C1187: 38.112.944/0002-04 | D1187: 4585.0600000000004 | E1187: 0 | F1187: 0 | G1187: 0 | H1187: 0 | I1187: 0 | J1187: 0 | K1187: 5052.4099999999999 | L1187: 0 | M1187: =SUM(J1187:L1187)-467.35 -> 4585.0599999999995 | N1187: 467.35000000000002 | O1187: =SUM(M1187:N1187) -> 5052.4099999999999
A1188: 4292 | B1188: EOL ANEMUS WIND 2 | C1188: 29.492.546/0001-99 | D1188: 5678.9700000000003 | E1188: 0 | F1188: 0 | G1188: 0 | H1188: 0 | I1188: 0 | J1188: 0 | K1188: 6257.8199999999997 | L1188: 0 | M1188: =SUM(J1188:L1188)-578.85 -> 5678.9699999999993 | N1188: 578.85000000000002 | O1188: =SUM(M1188:N1188) -> 6257.8199999999997
A1189: 4293 | B1189: EOL TUCANO IX | C1189: 35.805.346/0001-41 | D1189: 5168.6999999999998 | E1189: 0 | F1189: 0 | G1189: 0 | H1189: 0 | I1189: 0 | J1189: 0 | K1189: 5695.54 | L1189: 0 | M1189: =SUM(J1189:L1189)-526.84 -> 5168.6999999999998 | N1189: 526.84000000000003 | O1189: =SUM(M1189:N1189) -> 5695.54
A1190: 4294 | B1190: EOL TUCANO XI | C1190: 35.805.346/0001-41 | D1190: 3876.5300000000002 | E1190: 0 | F1190: 0 | G1190: 0 | H1190: 0 | I1190: 0 | J1190: 0 | K1190: 4271.6599999999999 | L1190: 0 | M1190: =SUM(J1190:L1190)-395.13 -> 3876.5299999999997 | N1190: 395.13 | O1190: =SUM(M1190:N1190) -> 4271.6599999999999
A1191: 4295 | B1191: UFV AC III | C1191: 33.592.510/0167-43 | D1191: 6182.5799999999999 | E1191: 0 | F1191: 0 | G1191: 0 | H1191: 0 | I1191: 0 | J1191: 0 | K1191: 6812.7600000000002 | L1191: 0 | M1191: =SUM(J1191:L1191)-630.18 -> 6182.5799999999999 | N1191: 630.17999999999995 | O1191: =SUM(M1191:N1191) -> 6812.7600000000002
A1192: 4296 | B1192: UFV AC IV | C1192: 33.592.510/0167-43 | D1192: 6440.8100000000004 | E1192: 0 | F1192: 0 | G1192: 0 | H1192: 0 | I1192: 0 | J1192: 0 | K1192: 7097.3100000000004 | L1192: 0 | M1192: =SUM(J1192:L1192)-656.5 -> 6440.8100000000004 | N1192: 656.5 | O1192: =SUM(M1192:N1192) -> 7097.3100000000004
A1193: 4297 | B1193: UFV AC IX | C1193: 33.592.510/0167-43 | D1193: 3775.52 | E1193: 0 | F1193: 0 | G1193: 0 | H1193: 0 | I1193: 0 | J1193: 0 | K1193: 4160.3500000000004 | L1193: 0 | M1193: =SUM(J1193:L1193)-384.83 -> 3775.5200000000004 | N1193: 384.82999999999998 | O1193: =SUM(M1193:N1193) -> 4160.3500000000004
A1194: 4298 | B1194: UFV AC V | C1194: 33.592.510/0167-43 | D1194: 6440.8100000000004 | E1194: 0 | F1194: 0 | G1194: 0 | H1194: 0 | I1194: 0 | J1194: 0 | K1194: 7097.3100000000004 | L1194: 0 | M1194: =SUM(J1194:L1194)-656.5 -> 6440.8100000000004 | N1194: 656.5 | O1194: =SUM(M1194:N1194) -> 7097.3100000000004
A1195: 4299 | B1195: UFV AC VI | C1195: 33.592.510/0167-43 | D1195: 6440.8100000000004 | E1195: 0 | F1195: 0 | G1195: 0 | H1195: 0 | I1195: 0 | J1195: 0 | K1195: 7097.3100000000004 | L1195: 0 | M1195: =SUM(J1195:L1195)-656.5 -> 6440.8100000000004 | N1195: 656.5 | O1195: =SUM(M1195:N1195) -> 7097.3100000000004
A1196: 4300 | B1196: UFV AC VII | C1196: 33.592.510/0167-43 | D1196: 5034.0200000000004 | E1196: 0 | F1196: 0 | G1196: 0 | H1196: 0 | I1196: 0 | J1196: 0 | K1196: 5547.1300000000001 | L1196: 0 | M1196: =SUM(J1196:L1196)-513.11 -> 5034.0200000000004 | N1196: 513.11000000000001 | O1196: =SUM(M1196:N1196) -> 5547.1300000000001
A1197: 4301 | B1197: UFV AC VIII | C1197: 33.592.510/0167-43 | D1197: 5034.0200000000004 | E1197: 0 | F1197: 0 | G1197: 0 | H1197: 0 | I1197: 0 | J1197: 0 | K1197: 5547.1300000000001 | L1197: 0 | M1197: =SUM(J1197:L1197)-513.11 -> 5034.0200000000004 | N1197: 513.11000000000001 | O1197: =SUM(M1197:N1197) -> 5547.1300000000001
A1198: 4302 | B1198: UFV AC X | C1198: 33.592.510/0167-43 | D1198: 5034.0200000000004 | E1198: 0 | F1198: 0 | G1198: 0 | H1198: 0 | I1198: 0 | J1198: 0 | K1198: 5547.1300000000001 | L1198: 0 | M1198: =SUM(J1198:L1198)-513.11 -> 5034.0200000000004 | N1198: 513.11000000000001 | O1198: =SUM(M1198:N1198) -> 5547.1300000000001
A1199: 4303 | B1199: UFV AC XIX | C1199: 33.592.510/0167-43 | D1199: 6182.5799999999999 | E1199: 0 | F1199: 0 | G1199: 0 | H1199: 0 | I1199: 0 | J1199: 0 | K1199: 6812.7600000000002 | L1199: 0 | M1199: =SUM(J1199:L1199)-630.18 -> 6182.5799999999999 | N1199: 630.17999999999995 | O1199: =SUM(M1199:N1199) -> 6812.7600000000002
A1200: 4304 | B1200: UFV AC XV | C1200: 33.592.510/0167-43 | D1200: 8051.0100000000002 | E1200: 0 | F1200: 0 | G1200: 0 | H1200: 0 | I1200: 0 | J1200: 0 | K1200: 8871.6399999999994 | L1200: 0 | M1200: =SUM(J1200:L1200)-820.63 -> 8051.0099999999993 | N1200: 820.63 | O1200: =SUM(M1200:N1200) -> 8871.6399999999994
A1201: 4305 | B1201: UFV AC XVI | C1201: 33.592.510/0167-43 | D1201: 6440.8100000000004 | E1201: 0 | F1201: 0 | G1201: 0 | H1201: 0 | I1201: 0 | J1201: 0 | K1201: 7097.3100000000004 | L1201: 0 | M1201: =SUM(J1201:L1201)-656.5 -> 6440.8100000000004 | N1201: 656.5 | O1201: =SUM(M1201:N1201) -> 7097.3100000000004
A1202: 4306 | B1202: UFV AC XVII | C1202: 33.592.510/0167-43 | D1202: 8051.0100000000002 | E1202: 0 | F1202: 0 | G1202: 0 | H1202: 0 | I1202: 0 | J1202: 0 | K1202: 8871.6399999999994 | L1202: 0 | M1202: =SUM(J1202:L1202)-820.63 -> 8051.0099999999993 | N1202: 820.63 | O1202: =SUM(M1202:N1202) -> 8871.6399999999994
A1203: 4307 | B1203: UFV AC XVIII | C1203: 33.592.510/0167-43 | D1203: 6440.8100000000004 | E1203: 0 | F1203: 0 | G1203: 0 | H1203: 0 | I1203: 0 | J1203: 0 | K1203: 7097.3100000000004 | L1203: 0 | M1203: =SUM(J1203:L1203)-656.5 -> 6440.8100000000004 | N1203: 656.5 | O1203: =SUM(M1203:N1203) -> 7097.3100000000004
A1204: 4308 | B1204: UFV AC XX | C1204: 33.592.510/0167-43 | D1204: 6182.5799999999999 | E1204: 0 | F1204: 0 | G1204: 0 | H1204: 0 | I1204: 0 | J1204: 0 | K1204: 6812.7600000000002 | L1204: 0 | M1204: =SUM(J1204:L1204)-630.18 -> 6182.5799999999999 | N1204: 630.17999999999995 | O1204: =SUM(M1204:N1204) -> 6812.7600000000002
A1205: 4309 | B1205: UFV AC XXI | C1205: 33.592.510/0167-43 | D1205: 6440.8100000000004 | E1205: 0 | F1205: 0 | G1205: 0 | H1205: 0 | I1205: 0 | J1205: 0 | K1205: 7097.3100000000004 | L1205: 0 | M1205: =SUM(J1205:L1205)-656.5 -> 6440.8100000000004 | N1205: 656.5 | O1205: =SUM(M1205:N1205) -> 7097.3100000000004
A1206: 4310 | B1206: UFV AC XXII | C1206: 33.592.510/0167-43 | D1206: 6440.8100000000004 | E1206: 0 | F1206: 0 | G1206: 0 | H1206: 0 | I1206: 0 | J1206: 0 | K1206: 7097.3100000000004 | L1206: 0 | M1206: =SUM(J1206:L1206)-656.5 -> 6440.8100000000004 | N1206: 656.5 | O1206: =SUM(M1206:N1206) -> 7097.3100000000004
A1207: 4311 | B1207: UFV AC XXIII | C1207: 33.592.510/0167-43 | D1207: 6440.8100000000004 | E1207: 0 | F1207: 0 | G1207: 0 | H1207: 0 | I1207: 0 | J1207: 0 | K1207: 7097.3100000000004 | L1207: 0 | M1207: =SUM(J1207:L1207)-656.5 -> 6440.8100000000004 | N1207: 656.5 | O1207: =SUM(M1207:N1207) -> 7097.3100000000004
A1208: 4312 | B1208: EOL SERRA DO SERIDÓ VI | C1208: 35.882.365/0001-71 | D1208: 4763.1599999999999 | E1208: 0 | F1208: 0 | G1208: 0 | H1208: 0 | I1208: 0 | J1208: 0 | K1208: 5248.6599999999999 | L1208: 0 | M1208: =SUM(J1208:L1208)-485.5 -> 4763.1599999999999 | N1208: 485.5 | O1208: =SUM(M1208:N1208) -> 5248.6599999999999
A1209: 4313 | B1209: EOL BREJINHOS A | C1209: 33.485.728/0001-00 | D1209: 4704.9700000000003 | E1209: 0 | F1209: 0 | G1209: 0 | H1209: 0 | I1209: 0 | J1209: 0 | K1209: 5184.54 | L1209: 0 | M1209: =SUM(J1209:L1209)-479.57 -> 4704.9700000000003 | N1209: 479.56999999999999 | O1209: =SUM(M1209:N1209) -> 5184.54
A1210: 4314 | B1210: EOL BREJINHOS B | C1210: 33.485.874/0001-35 | D1210: 5228.3100000000004 | E1210: 0 | F1210: 0 | G1210: 0 | H1210: 0 | I1210: 0 | J1210: 0 | K1210: 5761.2200000000003 | L1210: 0 | M1210: =SUM(J1210:L1210)-532.91 -> 5228.3100000000004 | N1210: 532.90999999999997 | O1210: =SUM(M1210:N1210) -> 5761.2200000000003
A1211: 4315 | B1211: EOL CAETITE E | C1211: 33.471.379/0001-77 | D1211: 4704.9700000000003 | E1211: 0 | F1211: 0 | G1211: 0 | H1211: 0 | I1211: 0 | J1211: 0 | K1211: 5184.54 | L1211: 0 | M1211: =SUM(J1211:L1211)-479.57 -> 4704.9700000000003 | N1211: 479.56999999999999 | O1211: =SUM(M1211:N1211) -> 5184.54
A1212: 4316 | B1212: EOL CAETITE F | C1212: 33.468.809/0001-00 | D1212: 3137.4899999999998 | E1212: 0 | F1212: 0 | G1212: 0 | H1212: 0 | I1212: 0 | J1212: 0 | K1212: 3457.29 | L1212: 0 | M1212: =SUM(J1212:L1212)-319.8 -> 3137.4899999999998 | N1212: 319.80000000000001 | O1212: =SUM(M1212:N1212) -> 3457.29
A1213: 4317 | B1213: EOL ASSURUÁ 4 IV | C1213: 38.050.924/0002-56 | D1213: 4585.0600000000004 | E1213: 0 | F1213: 0 | G1213: 0 | H1213: 0 | I1213: 0 | J1213: 0 | K1213: 5052.4099999999999 | L1213: 0 | M1213: =SUM(J1213:L1213)-467.35 -> 4585.0599999999995 | N1213: 467.35000000000002 | O1213: =SUM(M1213:N1213) -> 5052.4099999999999
A1214: 4318 | B1214: EOL ASSURUÁ 4 V | C1214: 38.049.586/0002-32 | D1214: 4585.0600000000004 | E1214: 0 | F1214: 0 | G1214: 0 | H1214: 0 | I1214: 0 | J1214: 0 | K1214: 5052.4099999999999 | L1214: 0 | M1214: =SUM(J1214:L1214)-467.35 -> 4585.0599999999995 | N1214: 467.35000000000002 | O1214: =SUM(M1214:N1214) -> 5052.4099999999999
A1215: 4319 | B1215: EOL ANEMUS WIND 3 | C1215: 38.350.307/0001-95 | D1215: 6711.5100000000002 | E1215: 0 | F1215: 0 | G1215: 0 | H1215: 0 | I1215: 0 | J1215: 0 | K1215: 7395.6000000000004 | L1215: 0 | M1215: =SUM(J1215:L1215)-684.09 -> 6711.5100000000002 | N1215: 684.09000000000003 | O1215: =SUM(M1215:N1215) -> 7395.6000000000004
A1216: 4324 | B1216: UTE MARLIM AZUL | C1216: 29.884.534/0002-90 | D1216: 158499.04999999999 | E1216: 0 | F1216: 0 | G1216: 0 | H1216: 0 | I1216: 0 | J1216: 0 | K1216: 174654.60000000001 | L1216: 0 | M1216: =SUM(J1216:L1216)-16155.55 -> 158499.05000000002 | N1216: 16155.549999999999 | O1216: =SUM(M1216:N1216) -> 174654.60000000001
A1217: 4325 | B1217: EOL OITIS 10 | C1217: 34.211.456/0002-01 | D1217: 6413.4899999999998 | E1217: 0 | F1217: 0 | G1217: 0 | H1217: 0 | I1217: 0 | J1217: 0 | K1217: 7067.21 | L1217: 0 | M1217: =SUM(J1217:L1217)-653.72 -> 6413.4899999999998 | N1217: 653.72000000000003 | O1217: =SUM(M1217:N1217) -> 7067.21
A1218: 4326 | B1218: EOL SERRA DO SERIDÓ IX | C1218: 35.831.535/0001-99 | D1218: 5359.7600000000002 | E1218: 0 | F1218: 0 | G1218: 0 | H1218: 0 | I1218: 0 | J1218: 0 | K1218: 5906.0699999999997 | L1218: 0 | M1218: =SUM(J1218:L1218)-546.31 -> 5359.7600000000002 | N1218: 546.30999999999995 | O1218: =SUM(M1218:N1218) -> 5906.0699999999997
A1219: 4327 | B1219: EOL VENTOS DE SANTA EUGÊNIA 10 | C1219: 35.654.189/0002-00 | D1219: 5591.5799999999999 | E1219: 0 | F1219: 0 | G1219: 0 | H1219: 0 | I1219: 0 | J1219: 0 | K1219: 6161.5200000000004 | L1219: 0 | M1219: =SUM(J1219:L1219)-569.94 -> 5591.5799999999999 | N1219: 569.94000000000005 | O1219: =SUM(M1219:N1219) -> 6161.5200000000004
A1220: 4328 | B1220: EOL VENTOS DE SÃO VITOR 08 | C1220: 35.403.030/0001-23 | D1220: 4114.0799999999999 | E1220: 0 | F1220: 0 | G1220: 0 | H1220: 0 | I1220: 0 | J1220: 0 | K1220: 4533.4200000000001 | L1220: 0 | M1220: =SUM(J1220:L1220)-419.34 -> 4114.0799999999999 | N1220: 419.33999999999997 | O1220: =SUM(M1220:N1220) -> 4533.4200000000001
A1221: 4329 | B1221: EOL VENTOS DE SANTA LEIA 01 | C1221: 35.865.635/0002-17 | D1221: 1657.1500000000001 | E1221: 0 | F1221: 0 | G1221: 0 | H1221: 0 | I1221: 0 | J1221: 0 | K1221: 1826.0599999999999 | L1221: 0 | M1221: =SUM(J1221:L1221)-168.91 -> 1657.1499999999999 | N1221: 168.91 | O1221: =SUM(M1221:N1221) -> 1826.0599999999999
A1222: 4330 | B1222: EOL VENTOS DE SANTA LEIA 02 | C1222: 35.865.640/0002-20 | D1222: 1657.1500000000001 | E1222: 0 | F1222: 0 | G1222: 0 | H1222: 0 | I1222: 0 | J1222: 0 | K1222: 1826.0599999999999 | L1222: 0 | M1222: =SUM(J1222:L1222)-168.91 -> 1657.1499999999999 | N1222: 168.91 | O1222: =SUM(M1222:N1222) -> 1826.0599999999999
A1223: 4331 | B1223: EOL VENTOS DE SANTA LEIA 03 | C1223: 35.865.651/0002-00 | D1223: 1657.1500000000001 | E1223: 0 | F1223: 0 | G1223: 0 | H1223: 0 | I1223: 0 | J1223: 0 | K1223: 1826.0599999999999 | L1223: 0 | M1223: =SUM(J1223:L1223)-168.91 -> 1657.1499999999999 | N1223: 168.91 | O1223: =SUM(M1223:N1223) -> 1826.0599999999999
A1224: 4332 | B1224: EOL VENTOS DE SANTA LEIA 04 | C1224: 35.874.343/0002-40 | D1224: 1647.3800000000001 | E1224: 0 | F1224: 0 | G1224: 0 | H1224: 0 | I1224: 0 | J1224: 0 | K1224: 1815.29 | L1224: 0 | M1224: =SUM(J1224:L1224)-167.91 -> 1647.3799999999999 | N1224: 167.91 | O1224: =SUM(M1224:N1224) -> 1815.29
A1225: 4333 | B1225: EOL VENTOS DE SANTA LEIA 05 | C1225: 35.989.467/0002-71 | D1225: 1657.1500000000001 | E1225: 0 | F1225: 0 | G1225: 0 | H1225: 0 | I1225: 0 | J1225: 0 | K1225: 1826.0599999999999 | L1225: 0 | M1225: =SUM(J1225:L1225)-168.91 -> 1657.1499999999999 | N1225: 168.91 | O1225: =SUM(M1225:N1225) -> 1826.0599999999999
A1226: 4334 | B1226: EOL VENTOS DE SANTA LEIA 12 | C1226: 35.859.036/0002-90 | D1226: 1593.27 | E1226: 0 | F1226: 0 | G1226: 0 | H1226: 0 | I1226: 0 | J1226: 0 | K1226: 1755.6700000000001 | L1226: 0 | M1226: =SUM(J1226:L1226)-162.4 -> 1593.27 | N1226: 162.40000000000001 | O1226: =SUM(M1226:N1226) -> 1755.6700000000001
A1227: 4335 | B1227: EOL VENTOS DE SANTA LEIA 13 | C1227: 35.896.824/0002-57 | D1227: 1622.8299999999999 | E1227: 0 | F1227: 0 | G1227: 0 | H1227: 0 | I1227: 0 | J1227: 0 | K1227: 1788.24 | L1227: 0 | M1227: =SUM(J1227:L1227)-165.41 -> 1622.8299999999999 | N1227: 165.41 | O1227: =SUM(M1227:N1227) -> 1788.24
A1228: 4336 | B1228: EOL VENTOS DE SANTA LEIA 14 | C1228: 35.865.649/0002-30 | D1228: 1622.8299999999999 | E1228: 0 | F1228: 0 | G1228: 0 | H1228: 0 | I1228: 0 | J1228: 0 | K1228: 1788.24 | L1228: 0 | M1228: =SUM(J1228:L1228)-165.41 -> 1622.8299999999999 | N1228: 165.41 | O1228: =SUM(M1228:N1228) -> 1788.24
A1229: 4337 | B1229: EOL SANTO AGOSTINHO 14 | C1229: 20.666.572/0002-00 | D1229: 778.63 | E1229: 0 | F1229: 0 | G1229: 0 | H1229: 0 | I1229: 0 | J1229: 0 | K1229: 857.99000000000001 | L1229: 0 | M1229: =SUM(J1229:L1229)-79.36 -> 778.63 | N1229: 79.359999999999999 | O1229: =SUM(M1229:N1229) -> 857.99000000000001
A1230: 4338 | B1230: EOL SANTO AGOSTINHO 25 | C1230: 23.079.920/0002-23 | D1230: 3114.5 | E1230: 0 | F1230: 0 | G1230: 0 | H1230: 0 | I1230: 0 | J1230: 0 | K1230: 3431.96 | L1230: 0 | M1230: =SUM(J1230:L1230)-317.46 -> 3114.5 | N1230: 317.45999999999998 | O1230: =SUM(M1230:N1230) -> 3431.96
A1231: 4339 | B1231: UFV SERRA DO MATO III | C1231: 36.205.095/0001-27 | D1231: 5759.1800000000003 | E1231: 0 | F1231: 0 | G1231: 0 | H1231: 0 | I1231: 0 | J1231: 0 | K1231: 6346.1999999999998 | L1231: 0 | M1231: =SUM(J1231:L1231)-587.02 -> 5759.1800000000003 | N1231: 587.01999999999998 | O1231: =SUM(M1231:N1231) -> 6346.2000000000007
A1232: 4340 | B1232: UFV SERRA DO MATO IV | C1232: 36.159.672/0001-91 | D1232: 6598.8999999999996 | E1232: 0 | F1232: 0 | G1232: 0 | H1232: 0 | I1232: 0 | J1232: 0 | K1232: 7271.5200000000004 | L1232: 0 | M1232: =SUM(J1232:L1232)-672.62 -> 6598.9000000000005 | N1232: 672.62 | O1232: =SUM(M1232:N1232) -> 7271.5200000000004
A1233: 4341 | B1233: UFV PITOMBEIRA | C1233: 19.382.073/0001-13 | D1233: 5808.7399999999998 | E1233: 0 | F1233: 0 | G1233: 0 | H1233: 0 | I1233: 0 | J1233: 0 | K1233: 6400.8199999999997 | L1233: 0 | M1233: =SUM(J1233:L1233)-592.08 -> 5808.7399999999998 | N1233: 592.08000000000004 | O1233: =SUM(M1233:N1233) -> 6400.8199999999997
A1234: 4342 | B1234: EOL SANTO AGOSTINHO 17 | C1234: 20.666.636/0002-65 | D1234: 5450.3699999999999 | E1234: 0 | F1234: 0 | G1234: 0 | H1234: 0 | I1234: 0 | J1234: 0 | K1234: 6005.9200000000001 | L1234: 0 | M1234: =SUM(J1234:L1234)-555.55 -> 5450.3699999999999 | N1234: 555.54999999999995 | O1234: =SUM(M1234:N1234) -> 6005.9200000000001
A1235: 4343 | B1235: EOL VENTOS DE SANTA EUGÊNIA 06 | C1235: 35.636.424/0002-02 | D1235: 4168.6800000000003 | E1235: 0 | F1235: 0 | G1235: 0 | H1235: 0 | I1235: 0 | J1235: 0 | K1235: 4593.5900000000001 | L1235: 0 | M1235: =SUM(J1235:L1235)-424.91 -> 4168.6800000000003 | N1235: 424.91000000000003 | O1235: =SUM(M1235:N1235) -> 4593.5900000000001
A1236: 4344 | B1236: EOL VENTOS DE SANTA EUGÊNIA 09 | C1236: 35.636.427/0002-46 | D1236: 4862.6400000000003 | E1236: 0 | F1236: 0 | G1236: 0 | H1236: 0 | I1236: 0 | J1236: 0 | K1236: 5358.2799999999997 | L1236: 0 | M1236: =SUM(J1236:L1236)-495.64 -> 4862.6399999999994 | N1236: 495.63999999999999 | O1236: =SUM(M1236:N1236) -> 5358.2799999999997
A1237: 4345 | B1237: UFV CIRANDA 1 | C1237: 35.912.298/0001-90 | D1237: 6218.9799999999996 | E1237: 0 | F1237: 0 | G1237: 0 | H1237: 0 | I1237: 0 | J1237: 0 | K1237: 6852.8699999999999 | L1237: 0 | M1237: =SUM(J1237:L1237)-633.89 -> 6218.9799999999996 | N1237: 633.88999999999999 | O1237: =SUM(M1237:N1237) -> 6852.8699999999999
A1238: 4346 | B1238: UFV CIRANDA 2 | C1238: 35.911.733/0001-62 | D1238: 6218.9799999999996 | E1238: 0 | F1238: 0 | G1238: 0 | H1238: 0 | I1238: 0 | J1238: 0 | K1238: 6852.8699999999999 | L1238: 0 | M1238: =SUM(J1238:L1238)-633.89 -> 6218.9799999999996 | N1238: 633.88999999999999 | O1238: =SUM(M1238:N1238) -> 6852.8699999999999
A1239: 4347 | B1239: UFV CIRANDA 3 | C1239: 35.911.730/0001-29 | D1239: 6218.9799999999996 | E1239: 0 | F1239: 0 | G1239: 0 | H1239: 0 | I1239: 0 | J1239: 0 | K1239: 6852.8699999999999 | L1239: 0 | M1239: =SUM(J1239:L1239)-633.89 -> 6218.9799999999996 | N1239: 633.88999999999999 | O1239: =SUM(M1239:N1239) -> 6852.8699999999999
A1240: 4348 | B1240: UFV JANAUBA 15 | C1240: 37.380.978/0001-36 | D1240: 6544.8299999999999 | E1240: 0 | F1240: 0 | G1240: 0 | H1240: 0 | I1240: 0 | J1240: 0 | K1240: 7211.9300000000003 | L1240: 0 | M1240: =SUM(J1240:L1240)-667.1 -> 6544.8299999999999 | N1240: 667.10000000000002 | O1240: =SUM(M1240:N1240) -> 7211.9300000000003
A1241: 4349 | B1241: EOL SERRA DO SERIDO VII | C1241: 35.831.892/0001-57 | D1241: 4764.2200000000003 | E1241: 0 | F1241: 0 | G1241: 0 | H1241: 0 | I1241: 0 | J1241: 0 | K1241: 5249.8299999999999 | L1241: 0 | M1241: =SUM(J1241:L1241)-485.61 -> 4764.2200000000003 | N1241: 485.61000000000001 | O1241: =SUM(M1241:N1241) -> 5249.8299999999999
A1242: 4350 | B1242: UFV JANAUBA 16 | C1242: 37.381.026/0001-37 | D1242: 6544.8299999999999 | E1242: 0 | F1242: 0 | G1242: 0 | H1242: 0 | I1242: 0 | J1242: 0 | K1242: 7211.9300000000003 | L1242: 0 | M1242: =SUM(J1242:L1242)-667.1 -> 6544.8299999999999 | N1242: 667.10000000000002 | O1242: =SUM(M1242:N1242) -> 7211.9300000000003
A1243: 4351 | B1243: FURNAS-G | C1243: 23.274.194/0001-19 | D1243: 1514300.6599999999 | E1243: 0 | F1243: 0 | G1243: 0 | H1243: 0 | I1243: 0 | J1243: 0 | K1243: 1668650.8700000001 | L1243: 0 | M1243: =SUM(J1243:L1243)-154350.21 -> 1514300.6600000001 | N1243: 154350.20999999999 | O1243: =SUM(M1243:N1243) -> 1668650.8700000001
A1244: 4352 | B1244: UFV JANAUBA 17 | C1244: 37.381.244/0001-71 | D1244: 6544.8299999999999 | E1244: 0 | F1244: 0 | G1244: 0 | H1244: 0 | I1244: 0 | J1244: 0 | K1244: 7211.9300000000003 | L1244: 0 | M1244: =SUM(J1244:L1244)-667.1 -> 6544.8299999999999 | N1244: 667.10000000000002 | O1244: =SUM(M1244:N1244) -> 7211.9300000000003
A1245: 4353 | B1245: UHE SERRA DA MESA | C1245: 23.274.194/0001-19 | D1245: 270059.88 | E1245: 0 | F1245: 0 | G1245: 0 | H1245: 0 | I1245: 0 | J1245: 0 | K1245: 297586.64000000001 | L1245: 0 | M1245: =SUM(J1245:L1245)-27526.76 -> 270059.88 | N1245: 27526.759999999998 | O1245: =SUM(M1245:N1245) -> 297586.64000000001
A1246: 4354 | B1246: UFV JANAUBA 18 | C1246: 37.404.973/0001-04 | D1246: 6544.8299999999999 | E1246: 0 | F1246: 0 | G1246: 0 | H1246: 0 | I1246: 0 | J1246: 0 | K1246: 7211.9300000000003 | L1246: 0 | M1246: =SUM(J1246:L1246)-667.1 -> 6544.8299999999999 | N1246: 667.10000000000002 | O1246: =SUM(M1246:N1246) -> 7211.9300000000003
A1247: 4355 | B1247: UFV JANAUBA 19 | C1247: 37.405.468/0001-76 | D1247: 6544.8299999999999 | E1247: 0 | F1247: 0 | G1247: 0 | H1247: 0 | I1247: 0 | J1247: 0 | K1247: 7211.9300000000003 | L1247: 0 | M1247: =SUM(J1247:L1247)-667.1 -> 6544.8299999999999 | N1247: 667.10000000000002 | O1247: =SUM(M1247:N1247) -> 7211.9300000000003
A1248: 4356 | B1248: UFV JANAUBA 20 | C1248: 37.381.136/0001-07 | D1248: 6544.8299999999999 | E1248: 0 | F1248: 0 | G1248: 0 | H1248: 0 | I1248: 0 | J1248: 0 | K1248: 7211.9300000000003 | L1248: 0 | M1248: =SUM(J1248:L1248)-667.1 -> 6544.8299999999999 | N1248: 667.10000000000002 | O1248: =SUM(M1248:N1248) -> 7211.9300000000003
A1249: 4357 | B1249: EOL SERRA DO SERIDO III | C1249: 35.835.835/0001-46 | D1249: 4764.2200000000003 | E1249: 0 | F1249: 0 | G1249: 0 | H1249: 0 | I1249: 0 | J1249: 0 | K1249: 5249.8299999999999 | L1249: 0 | M1249: =SUM(J1249:L1249)-485.61 -> 4764.2200000000003 | N1249: 485.61000000000001 | O1249: =SUM(M1249:N1249) -> 5249.8299999999999
A1250: 4358 | B1250: EOL VENTOS DE SAO ROQUE 05 | C1250: 36.051.519/0001-46 | D1250: 5640.3699999999999 | E1250: 0 | F1250: 0 | G1250: 0 | H1250: 0 | I1250: 0 | J1250: 0 | K1250: 6215.2799999999997 | L1250: 0 | M1250: =SUM(J1250:L1250)-574.91 -> 5640.3699999999999 | N1250: 574.90999999999997 | O1250: =SUM(M1250:N1250) -> 6215.2799999999997
A1251: 4359 | B1251: EOL VENTOS DE SAO ROQUE 03 | C1251: 36.051.515/0001-68 | D1251: 5640.3699999999999 | E1251: 0 | F1251: 0 | G1251: 0 | H1251: 0 | I1251: 0 | J1251: 0 | K1251: 6215.2799999999997 | L1251: 0 | M1251: =SUM(J1251:L1251)-574.91 -> 5640.3699999999999 | N1251: 574.90999999999997 | O1251: =SUM(M1251:N1251) -> 6215.2799999999997
A1252: 4360 | B1252: EOL VENTOS DE SAO VITOR 12 | C1252: 35.436.200/0001-76 | D1252: 4114.0799999999999 | E1252: 0 | F1252: 0 | G1252: 0 | H1252: 0 | I1252: 0 | J1252: 0 | K1252: 4533.4200000000001 | L1252: 0 | M1252: =SUM(J1252:L1252)-419.34 -> 4114.0799999999999 | N1252: 419.33999999999997 | O1252: =SUM(M1252:N1252) -> 4533.4200000000001
A1253: 4361 | B1253: EOL VENTOS DE SAO VITOR 13 | C1253: 35.436.176/0001-75 | D1253: 4042.79 | E1253: 0 | F1253: 0 | G1253: 0 | H1253: 0 | I1253: 0 | J1253: 0 | K1253: 4454.8699999999999 | L1253: 0 | M1253: =SUM(J1253:L1253)-412.08 -> 4042.79 | N1253: 412.07999999999998 | O1253: =SUM(M1253:N1253) -> 4454.8699999999999
A1254: 4362 | B1254: EOL VENTOS DE SAO VITOR 14 | C1254: 35.477.384/0001-12 | D1254: 4851.3500000000004 | E1254: 0 | F1254: 0 | G1254: 0 | H1254: 0 | I1254: 0 | J1254: 0 | K1254: 5345.8400000000001 | L1254: 0 | M1254: =SUM(J1254:L1254)-494.49 -> 4851.3500000000004 | N1254: 494.49000000000001 | O1254: =SUM(M1254:N1254) -> 5345.8400000000001
A1255: 4363 | B1255: EOL ASSURUÁ 5 III | C1255: 35.497.092/0002-22 | D1255: 5219.9700000000003 | E1255: 0 | F1255: 0 | G1255: 0 | H1255: 0 | I1255: 0 | J1255: 0 | K1255: 5752.0299999999997 | L1255: 0 | M1255: =SUM(J1255:L1255)-532.06 -> 5219.9699999999993 | N1255: 532.05999999999995 | O1255: =SUM(M1255:N1255) -> 5752.0299999999988
A1256: 4364 | B1256: EOL ASSURUÁ 5 V | C1256: 42.929.707/0002-08 | D1256: 4431.8500000000004 | E1256: 0 | F1256: 0 | G1256: 0 | H1256: 0 | I1256: 0 | J1256: 0 | K1256: 4883.5799999999999 | L1256: 0 | M1256: =SUM(J1256:L1256)-451.73 -> 4431.8500000000004 | N1256: 451.73000000000002 | O1256: =SUM(M1256:N1256) -> 4883.5799999999999
A1257: 4365 | B1257: EOL AURA TANQUE NOVO 01 | C1257: 35.718.914/0002-58 | D1257: 3185.1799999999998 | E1257: 0 | F1257: 0 | G1257: 0 | H1257: 0 | I1257: 0 | J1257: 0 | K1257: 3509.8400000000001 | L1257: 0 | M1257: =SUM(J1257:L1257)-324.66 -> 3185.1800000000003 | N1257: 324.66000000000003 | O1257: =SUM(M1257:N1257) -> 3509.8400000000001
A1258: 4366 | B1258: EOL AURA TANQUE NOVO 02 | C1258: 35.655.215/0002-06 | D1258: 2123.46 | E1258: 0 | F1258: 0 | G1258: 0 | H1258: 0 | I1258: 0 | J1258: 0 | K1258: 2339.9000000000001 | L1258: 0 | M1258: =SUM(J1258:L1258)-216.44 -> 2123.46 | N1258: 216.44 | O1258: =SUM(M1258:N1258) -> 2339.9000000000001
A1259: 4367 | B1259: UFV SANTA LUZIA 1 | C1259: 40.585.991/0001-36 | D1259: 5750.9700000000003 | E1259: 0 | F1259: 0 | G1259: 0 | H1259: 0 | I1259: 0 | J1259: 0 | K1259: 6337.1599999999999 | L1259: 0 | M1259: =SUM(J1259:L1259)-586.19 -> 5750.9699999999993 | N1259: 586.19000000000005 | O1259: =SUM(M1259:N1259) -> 6337.1599999999999
A1260: 4368 | B1260: UFV SANTA LUZIA 2 | C1260: 40.586.002/0001-29 | D1260: 5750.9700000000003 | E1260: 0 | F1260: 0 | G1260: 0 | H1260: 0 | I1260: 0 | J1260: 0 | K1260: 6337.1599999999999 | L1260: 0 | M1260: =SUM(J1260:L1260)-586.19 -> 5750.9699999999993 | N1260: 586.19000000000005 | O1260: =SUM(M1260:N1260) -> 6337.1599999999999
A1261: 4369 | B1261: UFV SANTA LUZIA 3 | C1261: 40.586.027/0001-22 | D1261: 5750.9700000000003 | E1261: 0 | F1261: 0 | G1261: 0 | H1261: 0 | I1261: 0 | J1261: 0 | K1261: 6337.1599999999999 | L1261: 0 | M1261: =SUM(J1261:L1261)-586.19 -> 5750.9699999999993 | N1261: 586.19000000000005 | O1261: =SUM(M1261:N1261) -> 6337.1599999999999
A1262: 4370 | B1262: UFV SANTA LUZIA 4 | C1262: 40.586.043/0001-15 | D1262: 5750.9700000000003 | E1262: 0 | F1262: 0 | G1262: 0 | H1262: 0 | I1262: 0 | J1262: 0 | K1262: 6337.1599999999999 | L1262: 0 | M1262: =SUM(J1262:L1262)-586.19 -> 5750.9699999999993 | N1262: 586.19000000000005 | O1262: =SUM(M1262:N1262) -> 6337.1599999999999
A1263: 4371 | B1263: UFV SANTA LUZIA 5 | C1263: 40.790.472/0001-00 | D1263: 4283.2399999999998 | E1263: 0 | F1263: 0 | G1263: 0 | H1263: 0 | I1263: 0 | J1263: 0 | K1263: 4719.8199999999997 | L1263: 0 | M1263: =SUM(J1263:L1263)-436.58 -> 4283.2399999999998 | N1263: 436.57999999999998 | O1263: =SUM(M1263:N1263) -> 4719.8199999999997
A1264: 4372 | B1264: UFV SANTA LUZIA 6 | C1264: 40.586.566/0001-61 | D1264: 5750.9700000000003 | E1264: 0 | F1264: 0 | G1264: 0 | H1264: 0 | I1264: 0 | J1264: 0 | K1264: 6337.1599999999999 | L1264: 0 | M1264: =SUM(J1264:L1264)-586.19 -> 5750.9699999999993 | N1264: 586.19000000000005 | O1264: =SUM(M1264:N1264) -> 6337.1599999999999
A1265: 4373 | B1265: UFV SANTA LUZIA 7 | C1265: 40.586.619/0001-44 | D1265: 4283.2399999999998 | E1265: 0 | F1265: 0 | G1265: 0 | H1265: 0 | I1265: 0 | J1265: 0 | K1265: 4719.8199999999997 | L1265: 0 | M1265: =SUM(J1265:L1265)-436.58 -> 4283.2399999999998 | N1265: 436.57999999999998 | O1265: =SUM(M1265:N1265) -> 4719.8199999999997
A1266: 4374 | B1266: UTE PROSPERIDADE II | C1266: 23.857.764/0001-01 | D1266: 6145.7299999999996 | E1266: 0 | F1266: 0 | G1266: 0 | H1266: 0 | I1266: 0 | J1266: 0 | K1266: 6772.1499999999996 | L1266: 0 | M1266: =SUM(J1266:L1266)-626.42 -> 6145.7299999999996 | N1266: 626.41999999999996 | O1266: =SUM(M1266:N1266) -> 6772.1499999999996
A1267: 4375 | B1267: UTE PROSPERIDADE III | C1267: 23.857.764/0001-01 | D1267: 7366.5900000000001 | E1267: 0 | F1267: 0 | G1267: 0 | H1267: 0 | I1267: 0 | J1267: 0 | K1267: 8117.4499999999998 | L1267: 0 | M1267: =SUM(J1267:L1267)-750.86 -> 7366.5900000000001 | N1267: 750.86000000000001 | O1267: =SUM(M1267:N1267) -> 8117.4499999999998
A1268: 4376 | B1268: EOL SANTO AGOSTINHO 27 | C1268: 23.193.334/0002-05 | D1268: 4671.7399999999998 | E1268: 0 | F1268: 0 | G1268: 0 | H1268: 0 | I1268: 0 | J1268: 0 | K1268: 5147.9200000000001 | L1268: 0 | M1268: =SUM(J1268:L1268)-476.18 -> 4671.7399999999998 | N1268: 476.18000000000001 | O1268: =SUM(M1268:N1268) -> 5147.9200000000001
A1269: 4377 | B1269: EOL VENTOS DE SANTA EUGÊNIA 14 | C1269: 35.636.427/0002-46 | D1269: 2797.0300000000002 | E1269: 0 | F1269: 0 | G1269: 0 | H1269: 0 | I1269: 0 | J1269: 0 | K1269: 3082.1300000000001 | L1269: 0 | M1269: =SUM(J1269:L1269)-285.1 -> 2797.0300000000002 | N1269: 285.10000000000002 | O1269: =SUM(M1269:N1269) -> 3082.1300000000001
A1270: 4378 | B1270: EOL VENTOS DE SANTA LUZIA 01 | C1270: 41.489.453/0001-00 | D1270: 5609.0799999999999 | E1270: 0 | F1270: 0 | G1270: 0 | H1270: 0 | I1270: 0 | J1270: 0 | K1270: 6180.8000000000002 | L1270: 0 | M1270: =SUM(J1270:L1270)-571.72 -> 5609.0799999999999 | N1270: 571.72000000000003 | O1270: =SUM(M1270:N1270) -> 6180.8000000000002
A1271: 4379 | B1271: EOL VENTOS DE SAO ROQUE 06 | C1271: 36.677.071/0001-70 | D1271: 5640.3699999999999 | E1271: 0 | F1271: 0 | G1271: 0 | H1271: 0 | I1271: 0 | J1271: 0 | K1271: 6215.2799999999997 | L1271: 0 | M1271: =SUM(J1271:L1271)-574.91 -> 5640.3699999999999 | N1271: 574.90999999999997 | O1271: =SUM(M1271:N1271) -> 6215.2799999999997
A1272: 4380 | B1272: EOL VENTOS DE SAO ROQUE 07 | C1272: 36.051.524/0001-59 | D1272: 5640.3699999999999 | E1272: 0 | F1272: 0 | G1272: 0 | H1272: 0 | I1272: 0 | J1272: 0 | K1272: 6215.2799999999997 | L1272: 0 | M1272: =SUM(J1272:L1272)-574.91 -> 5640.3699999999999 | N1272: 574.90999999999997 | O1272: =SUM(M1272:N1272) -> 6215.2799999999997
A1273: 4381 | B1273: EOL VENTOS DE SÃO ROQUE 13 | C1273: 31.596.793/0001-87 | D1273: 5640.3699999999999 | E1273: 0 | F1273: 0 | G1273: 0 | H1273: 0 | I1273: 0 | J1273: 0 | K1273: 6215.2799999999997 | L1273: 0 | M1273: =SUM(J1273:L1273)-574.91 -> 5640.3699999999999 | N1273: 574.90999999999997 | O1273: =SUM(M1273:N1273) -> 6215.2799999999997
A1274: 4382 | B1274: EOL VENTOS DE SAO ROQUE 19 | C1274: 31.596.421/0001-50 | D1274: 5640.3699999999999 | E1274: 0 | F1274: 0 | G1274: 0 | H1274: 0 | I1274: 0 | J1274: 0 | K1274: 6215.2799999999997 | L1274: 0 | M1274: =SUM(J1274:L1274)-574.91 -> 5640.3699999999999 | N1274: 574.90999999999997 | O1274: =SUM(M1274:N1274) -> 6215.2799999999997
A1275: 4383 | B1275: EOL VENTOS DE SAO ROQUE 22 | C1275: 31.596.769/0001-48 | D1275: 5640.3699999999999 | E1275: 0 | F1275: 0 | G1275: 0 | H1275: 0 | I1275: 0 | J1275: 0 | K1275: 6215.2799999999997 | L1275: 0 | M1275: =SUM(J1275:L1275)-574.91 -> 5640.3699999999999 | N1275: 574.90999999999997 | O1275: =SUM(M1275:N1275) -> 6215.2799999999997
A1276: 4384 | B1276: EOL VENTOS DE SÃO ROQUE 26 | C1276: 31.594.093/0001-53 | D1276: 5640.3699999999999 | E1276: 0 | F1276: 0 | G1276: 0 | H1276: 0 | I1276: 0 | J1276: 0 | K1276: 6215.2799999999997 | L1276: 0 | M1276: =SUM(J1276:L1276)-574.91 -> 5640.3699999999999 | N1276: 574.90999999999997 | O1276: =SUM(M1276:N1276) -> 6215.2799999999997
A1277: 4385 | B1277: EOL VENTOS DE SAO ROQUE 29 | C1277: 31.595.987/0001-68 | D1277: 4230.2799999999997 | E1277: 0 | F1277: 0 | G1277: 0 | H1277: 0 | I1277: 0 | J1277: 0 | K1277: 4661.4700000000003 | L1277: 0 | M1277: =SUM(J1277:L1277)-431.19 -> 4230.2800000000007 | N1277: 431.19 | O1277: =SUM(M1277:N1277) -> 4661.4700000000003
A1278: 4386 | B1278: UFV LAR DO SOL 3 | C1278: 31.321.803/0001-71 | D1278: 6018.5500000000002 | E1278: 0 | F1278: 0 | G1278: 0 | H1278: 0 | I1278: 0 | J1278: 0 | K1278: 6632.0100000000002 | L1278: 0 | M1278: =SUM(J1278:L1278)-613.46 -> 6018.5500000000002 | N1278: 613.46000000000004 | O1278: =SUM(M1278:N1278) -> 6632.0100000000002
A1279: 4387 | B1279: UFV LAR DO SOL 4 | C1279: 31.321.803/0001-71 | D1279: 6018.5500000000002 | E1279: 0 | F1279: 0 | G1279: 0 | H1279: 0 | I1279: 0 | J1279: 0 | K1279: 6632.0100000000002 | L1279: 0 | M1279: =SUM(J1279:L1279)-613.46 -> 6018.5500000000002 | N1279: 613.46000000000004 | O1279: =SUM(M1279:N1279) -> 6632.0100000000002
A1280: 4388 | B1280: UFV LAR DO SOL 5 | C1280: 31.321.885/0001-54 | D1280: 6018.5500000000002 | E1280: 0 | F1280: 0 | G1280: 0 | H1280: 0 | I1280: 0 | J1280: 0 | K1280: 6632.0100000000002 | L1280: 0 | M1280: =SUM(J1280:L1280)-613.46 -> 6018.5500000000002 | N1280: 613.46000000000004 | O1280: =SUM(M1280:N1280) -> 6632.0100000000002
A1281: 4389 | B1281: UFV LAR DO SOL 6 | C1281: 31.414.665/0001-75 | D1281: 6018.5500000000002 | E1281: 0 | F1281: 0 | G1281: 0 | H1281: 0 | I1281: 0 | J1281: 0 | K1281: 6632.0100000000002 | L1281: 0 | M1281: =SUM(J1281:L1281)-613.46 -> 6018.5500000000002 | N1281: 613.46000000000004 | O1281: =SUM(M1281:N1281) -> 6632.0100000000002
A1282: 4390 | B1282: EOL SANTO AGOSTINHO 04 | C1282: 20.675.170/0002-64 | D1282: 4671.7399999999998 | E1282: 0 | F1282: 0 | G1282: 0 | H1282: 0 | I1282: 0 | J1282: 0 | K1282: 5147.9200000000001 | L1282: 0 | M1282: =SUM(J1282:L1282)-476.18 -> 4671.7399999999998 | N1282: 476.18000000000001 | O1282: =SUM(M1282:N1282) -> 5147.9200000000001
A1283: 4391 | B1283: UFV SANTA LUZIA 9 | C1283: 40.586.767/0001-69 | D1283: 4208.0699999999997 | E1283: 0 | F1283: 0 | G1283: 0 | H1283: 0 | I1283: 0 | J1283: 0 | K1283: 4636.9899999999998 | L1283: 0 | M1283: =SUM(J1283:L1283)-428.92 -> 4208.0699999999997 | N1283: 428.92000000000002 | O1283: =SUM(M1283:N1283) -> 4636.9899999999998
A1284: 4392 | B1284: EOL AURA CAETITE 01 | C1284: 35.655.205/0002-70 | D1284: 3139.7800000000002 | E1284: 0 | F1284: 0 | G1284: 0 | H1284: 0 | I1284: 0 | J1284: 0 | K1284: 3459.8099999999999 | L1284: 0 | M1284: =SUM(J1284:L1284)-320.03 -> 3139.7799999999997 | N1284: 320.02999999999997 | O1284: =SUM(M1284:N1284) -> 3459.8099999999995
A1285: 4393 | B1285: EOL AURA CAETITE 02 | C1285: 35.655.200/0002-48 | D1285: 4247.3400000000001 | E1285: 0 | F1285: 0 | G1285: 0 | H1285: 0 | I1285: 0 | J1285: 0 | K1285: 4680.2600000000002 | L1285: 0 | M1285: =SUM(J1285:L1285)-432.92 -> 4247.3400000000001 | N1285: 432.92000000000002 | O1285: =SUM(M1285:N1285) -> 4680.2600000000002
A1286: 4394 | B1286: UTE PORTO DAS ÁGUAS II | C1286: 08.322.396/0001-03 | D1286: 9636.3299999999999 | E1286: 0 | F1286: 0 | G1286: 0 | H1286: 0 | I1286: 0 | J1286: 0 | K1286: 10618.549999999999 | L1286: 0 | M1286: =SUM(J1286:L1286)-982.22 -> 9636.3299999999999 | N1286: 982.22000000000003 | O1286: =SUM(M1286:N1286) -> 10618.549999999999
A1287: 4395 | B1287: EOL AURA CAETITE 03 | C1287: 35.655.028/0002-22 | D1287: 4247.3400000000001 | E1287: 0 | F1287: 0 | G1287: 0 | H1287: 0 | I1287: 0 | J1287: 0 | K1287: 4680.2600000000002 | L1287: 0 | M1287: =SUM(J1287:L1287)-432.92 -> 4247.3400000000001 | N1287: 432.92000000000002 | O1287: =SUM(M1287:N1287) -> 4680.2600000000002
A1288: 4396 | B1288: EOL AURA TANQUE NOVO 03 | C1288: 35.655.024/0002-44 | D1288: 1569.5599999999999 | E1288: 0 | F1288: 0 | G1288: 0 | H1288: 0 | I1288: 0 | J1288: 0 | K1288: 1729.54 | L1288: 0 | M1288: =SUM(J1288:L1288)-159.98 -> 1569.5599999999999 | N1288: 159.97999999999999 | O1288: =SUM(M1288:N1288) -> 1729.54
A1289: 4397 | B1289: EOL SERRA DA MANGABEIRA | C1289: 35.924.128/0002-07 | D1289: 10124.469999999999 | E1289: 0 | F1289: 0 | G1289: 0 | H1289: 0 | I1289: 0 | J1289: 0 | K1289: 11156.440000000001 | L1289: 0 | M1289: =SUM(J1289:L1289)-1031.97 -> 10124.470000000001 | N1289: 1031.97 | O1289: =SUM(M1289:N1289) -> 11156.440000000001
A1290: 4398 | B1290: UFV SOLAR IRECE 01 | C1290: 25.215.822/0001-10 | D1290: 8650.25 | E1290: 0 | F1290: 0 | G1290: 0 | H1290: 0 | I1290: 0 | J1290: 0 | K1290: 9531.9599999999991 | L1290: 0 | M1290: =SUM(J1290:L1290)-881.71 -> 8650.25 | N1290: 881.71000000000004 | O1290: =SUM(M1290:N1290) -> 9531.9599999999991
A1291: 4399 | B1291: UFV DUNAMIS I | C1291: 32.708.258/0001-33 | D1291: 3559.0999999999999 | E1291: 0 | F1291: 0 | G1291: 0 | H1291: 0 | I1291: 0 | J1291: 0 | K1291: 3921.8699999999999 | L1291: 0 | M1291: =SUM(J1291:L1291)-362.77 -> 3559.0999999999999 | N1291: 362.76999999999998 | O1291: =SUM(M1291:N1291) -> 3921.8699999999999
A1292: 4400 | B1292: UFV DUNAMIS II | C1292: 32.708.258/0001-33 | D1292: 3559.0999999999999 | E1292: 0 | F1292: 0 | G1292: 0 | H1292: 0 | I1292: 0 | J1292: 0 | K1292: 3921.8699999999999 | L1292: 0 | M1292: =SUM(J1292:L1292)-362.77 -> 3559.0999999999999 | N1292: 362.76999999999998 | O1292: =SUM(M1292:N1292) -> 3921.8699999999999
A1293: 4401 | B1293: UFV DUNAMIS III | C1293: 32.708.258/0001-33 | D1293: 3559.0999999999999 | E1293: 0 | F1293: 0 | G1293: 0 | H1293: 0 | I1293: 0 | J1293: 0 | K1293: 3921.8699999999999 | L1293: 0 | M1293: =SUM(J1293:L1293)-362.77 -> 3559.0999999999999 | N1293: 362.76999999999998 | O1293: =SUM(M1293:N1293) -> 3921.8699999999999
A1294: 4402 | B1294: UFV DUNAMIS IV | C1294: 32.708.258/0001-33 | D1294: 3559.0999999999999 | E1294: 0 | F1294: 0 | G1294: 0 | H1294: 0 | I1294: 0 | J1294: 0 | K1294: 3921.8699999999999 | L1294: 0 | M1294: =SUM(J1294:L1294)-362.77 -> 3559.0999999999999 | N1294: 362.76999999999998 | O1294: =SUM(M1294:N1294) -> 3921.8699999999999
A1295: 4403 | B1295: EOL ASSURUA 5 I | C1295: 38.297.095/0002-00 | D1295: 5170.5600000000004 | E1295: 0 | F1295: 0 | G1295: 0 | H1295: 0 | I1295: 0 | J1295: 0 | K1295: 5697.5900000000001 | L1295: 0 | M1295: =SUM(J1295:L1295)-527.03 -> 5170.5600000000004 | N1295: 527.02999999999997 | O1295: =SUM(M1295:N1295) -> 5697.5900000000001
A1296: 4404 | B1296: EOL ASSURUA 5 VI | C1296: 42.931.551/0002-08 | D1296: 4431.8500000000004 | E1296: 0 | F1296: 0 | G1296: 0 | H1296: 0 | I1296: 0 | J1296: 0 | K1296: 4883.5799999999999 | L1296: 0 | M1296: =SUM(J1296:L1296)-451.73 -> 4431.8500000000004 | N1296: 451.73000000000002 | O1296: =SUM(M1296:N1296) -> 4883.5799999999999
A1297: 4405 | B1297: EOL AURA CAETITE 04 | C1297: 35.655.010/0002-20 | D1297: 2616.1999999999998 | E1297: 0 | F1297: 0 | G1297: 0 | H1297: 0 | I1297: 0 | J1297: 0 | K1297: 2882.8699999999999 | L1297: 0 | M1297: =SUM(J1297:L1297)-266.67 -> 2616.1999999999998 | N1297: 266.67000000000002 | O1297: =SUM(M1297:N1297) -> 2882.8699999999999
A1298: 4406 | B1298: EOL SANTO AGOSTINHO 03 | C1298: 20.675.156/0002-60 | D1298: 1557.24 | E1298: 0 | F1298: 0 | G1298: 0 | H1298: 0 | I1298: 0 | J1298: 0 | K1298: 1715.97 | L1298: 0 | M1298: =SUM(J1298:L1298)-158.73 -> 1557.24 | N1298: 158.72999999999999 | O1298: =SUM(M1298:N1298) -> 1715.97
A1299: 4407 | B1299: EOL SANTO AGOSTINHO 05 | C1299: 20.675.180/0002-08 | D1299: 7007.6300000000001 | E1299: 0 | F1299: 0 | G1299: 0 | H1299: 0 | I1299: 0 | J1299: 0 | K1299: 7721.9099999999999 | L1299: 0 | M1299: =SUM(J1299:L1299)-714.28 -> 7007.6300000000001 | N1299: 714.27999999999997 | O1299: =SUM(M1299:N1299) -> 7721.9099999999999
A1300: 4408 | B1300: EOL SERRA DO SERIDÓ II | C1300: 35.831.799/0001-42 | D1300: 1786.1900000000001 | E1300: 0 | F1300: 0 | G1300: 0 | H1300: 0 | I1300: 0 | J1300: 0 | K1300: 1968.25 | L1300: 0 | M1300: =SUM(J1300:L1300)-182.06 -> 1786.1900000000001 | N1300: 182.06 | O1300: =SUM(M1300:N1300) -> 1968.25
A1301: 4409 | B1301: EOL SERRA DO SERIDÓ IV | C1301: 35.957.107/0001-07 | D1301: 4763.6899999999996 | E1301: 0 | F1301: 0 | G1301: 0 | H1301: 0 | I1301: 0 | J1301: 0 | K1301: 5249.25 | L1301: 0 | M1301: =SUM(J1301:L1301)-485.56 -> 4763.6899999999996 | N1301: 485.56 | O1301: =SUM(M1301:N1301) -> 5249.25
A1302: 4410 | B1302: EOL VENTOS DE SANTA LUZIA 02 | C1302: 41.413.101/0002-52 | D1302: 5609.0799999999999 | E1302: 0 | F1302: 0 | G1302: 0 | H1302: 0 | I1302: 0 | J1302: 0 | K1302: 6180.8000000000002 | L1302: 0 | M1302: =SUM(J1302:L1302)-571.72 -> 5609.0799999999999 | N1302: 571.72000000000003 | O1302: =SUM(M1302:N1302) -> 6180.8000000000002
A1303: 4411 | B1303: EOL BONS VENTOS CACIMBAS 3 | C1303: 19.953.139/0003-40 | D1303: 1307.3199999999999 | E1303: 0 | F1303: 0 | G1303: 0 | H1303: 0 | I1303: 0 | J1303: 0 | K1303: 1440.5699999999999 | L1303: 0 | M1303: =SUM(J1303:L1303)-133.25 -> 1307.3199999999999 | N1303: 133.25 | O1303: =SUM(M1303:N1303) -> 1440.5699999999999
A1304: 4412 | B1304: EOL BONS VENTOS CACIMBAS 4 | C1304: 19.953.139/0004-20 | D1304: 943.25999999999999 | E1304: 0 | F1304: 0 | G1304: 0 | H1304: 0 | I1304: 0 | J1304: 0 | K1304: 1039.4000000000001 | L1304: 0 | M1304: =SUM(J1304:L1304)-96.14 -> 943.2600000000001 | N1304: 96.140000000000001 | O1304: =SUM(M1304:N1304) -> 1039.4000000000001
A1305: 4413 | B1305: EOL BONS VENTOS CACIMBAS 5 | C1305: 19.953.139/0005-01 | D1305: 1892.3599999999999 | E1305: 0 | F1305: 0 | G1305: 0 | H1305: 0 | I1305: 0 | J1305: 0 | K1305: 2085.25 | L1305: 0 | M1305: =SUM(J1305:L1305)-192.89 -> 1892.3600000000001 | N1305: 192.88999999999999 | O1305: =SUM(M1305:N1305) -> 2085.25
A1306: 4414 | B1306: EOL BONS VENTOS CACIMBAS 7 | C1306: 19.953.139/0006-92 | D1306: 1511.6500000000001 | E1306: 0 | F1306: 0 | G1306: 0 | H1306: 0 | I1306: 0 | J1306: 0 | K1306: 1665.73 | L1306: 0 | M1306: =SUM(J1306:L1306)-154.08 -> 1511.6500000000001 | N1306: 154.08000000000001 | O1306: =SUM(M1306:N1306) -> 1665.73
A1307: 4415 | B1307: EOL CAETITE D | C1307: 33.457.932/0001-17 | D1307: 5744.7299999999996 | E1307: 0 | F1307: 0 | G1307: 0 | H1307: 0 | I1307: 0 | J1307: 0 | K1307: 6330.2799999999997 | L1307: 0 | M1307: =SUM(J1307:L1307)-585.55 -> 5744.7299999999996 | N1307: 585.54999999999995 | O1307: =SUM(M1307:N1307) -> 6330.2799999999997
A1308: 4429 | B1308: EOL CAJUÍNA A1 | C1308: 36.952.007/0001-50 | D1308: 4920.8999999999996 | E1308: 0 | F1308: 0 | G1308: 0 | H1308: 0 | I1308: 0 | J1308: 0 | K1308: 5422.4799999999996 | L1308: 0 | M1308: =SUM(J1308:L1308)-501.58 -> 4920.8999999999996 | N1308: 501.57999999999998 | O1308: =SUM(M1308:N1308) -> 5422.4799999999996
A1309: 4430 | B1309: EOL CAJUÍNA A2 | C1309: 36.952.033/0001-89 | D1309: 4920.8999999999996 | E1309: 0 | F1309: 0 | G1309: 0 | H1309: 0 | I1309: 0 | J1309: 0 | K1309: 5422.4799999999996 | L1309: 0 | M1309: =SUM(J1309:L1309)-501.58 -> 4920.8999999999996 | N1309: 501.57999999999998 | O1309: =SUM(M1309:N1309) -> 5422.4799999999996
A1310: 4431 | B1310: EOL CAJUÍNA A6 | C1310: 36.957.780/0001-00 | D1310: 5564.0900000000001 | E1310: 0 | F1310: 0 | G1310: 0 | H1310: 0 | I1310: 0 | J1310: 0 | K1310: 6131.2299999999996 | L1310: 0 | M1310: =SUM(J1310:L1310)-567.14 -> 5564.0899999999992 | N1310: 567.13999999999999 | O1310: =SUM(M1310:N1310) -> 6131.2299999999996
A1311: 4432 | B1311: UFV MAURITI 1 | C1311: 31.886.399/0002-64 | D1311: 5875.0100000000002 | E1311: 0 | F1311: 0 | G1311: 0 | H1311: 0 | I1311: 0 | J1311: 0 | K1311: 6473.8400000000001 | L1311: 0 | M1311: =SUM(J1311:L1311)-598.83 -> 5875.0100000000002 | N1311: 598.83000000000004 | O1311: =SUM(M1311:N1311) -> 6473.8400000000001
A1312: 4433 | B1312: UFV MAURITI 2 | C1312: 29.103.647/0002-01 | D1312: 2937.5100000000002 | E1312: 0 | F1312: 0 | G1312: 0 | H1312: 0 | I1312: 0 | J1312: 0 | K1312: 3236.9299999999998 | L1312: 0 | M1312: =SUM(J1312:L1312)-299.42 -> 2937.5099999999998 | N1312: 299.42000000000002 | O1312: =SUM(M1312:N1312) -> 3236.9299999999998
A1313: 4434 | B1313: UFV MAURITI 3 | C1313: 29.168.859/0002-77 | D1313: 5875.0100000000002 | E1313: 0 | F1313: 0 | G1313: 0 | H1313: 0 | I1313: 0 | J1313: 0 | K1313: 6473.8400000000001 | L1313: 0 | M1313: =SUM(J1313:L1313)-598.83 -> 5875.0100000000002 | N1313: 598.83000000000004 | O1313: =SUM(M1313:N1313) -> 6473.8400000000001
A1314: 4435 | B1314: UFV MAURITI 4 | C1314: 29.469.320/0002-58 | D1314: 5875.0100000000002 | E1314: 0 | F1314: 0 | G1314: 0 | H1314: 0 | I1314: 0 | J1314: 0 | K1314: 6473.8400000000001 | L1314: 0 | M1314: =SUM(J1314:L1314)-598.83 -> 5875.0100000000002 | N1314: 598.83000000000004 | O1314: =SUM(M1314:N1314) -> 6473.8400000000001
A1315: 4436 | B1315: UFV MAURITI 5 | C1315: 29.103.664/0002-49 | D1315: 5875.0100000000002 | E1315: 0 | F1315: 0 | G1315: 0 | H1315: 0 | I1315: 0 | J1315: 0 | K1315: 6473.8400000000001 | L1315: 0 | M1315: =SUM(J1315:L1315)-598.83 -> 5875.0100000000002 | N1315: 598.83000000000004 | O1315: =SUM(M1315:N1315) -> 6473.8400000000001
A1316: 4437 | B1316: UFV MAURITI 6 | C1316: 29.103.672/0002-95 | D1316: 5875.0100000000002 | E1316: 0 | F1316: 0 | G1316: 0 | H1316: 0 | I1316: 0 | J1316: 0 | K1316: 6473.8400000000001 | L1316: 0 | M1316: =SUM(J1316:L1316)-598.83 -> 5875.0100000000002 | N1316: 598.83000000000004 | O1316: =SUM(M1316:N1316) -> 6473.8400000000001
A1317: 4438 | B1317: UFV MAURITI 7 | C1317: 31.153.615/0002-62 | D1317: 1762.5 | E1317: 0 | F1317: 0 | G1317: 0 | H1317: 0 | I1317: 0 | J1317: 0 | K1317: 1942.1500000000001 | L1317: 0 | M1317: =SUM(J1317:L1317)-179.65 -> 1762.5 | N1317: 179.65000000000001 | O1317: =SUM(M1317:N1317) -> 1942.1500000000001
A1318: 4439 | B1318: UFV MAURITI 8 | C1318: 31.159.183/0002-05 | D1318: 5875.0100000000002 | E1318: 0 | F1318: 0 | G1318: 0 | H1318: 0 | I1318: 0 | J1318: 0 | K1318: 6473.8400000000001 | L1318: 0 | M1318: =SUM(J1318:L1318)-598.83 -> 5875.0100000000002 | N1318: 598.83000000000004 | O1318: =SUM(M1318:N1318) -> 6473.8400000000001
A1319: 4440 | B1319: UFV MAURITI 9 | C1319: 31.864.512/0002-00 | D1319: 1175 | E1319: 0 | F1319: 0 | G1319: 0 | H1319: 0 | I1319: 0 | J1319: 0 | K1319: 1294.77 | L1319: 0 | M1319: =SUM(J1319:L1319)-119.77 -> 1175 | N1319: 119.77 | O1319: =SUM(M1319:N1319) -> 1294.77
A1320: 4441 | B1320: UTE PROSPERIDADE IV | C1320: 23.857.764/0001-01 | D1320: 1575.4000000000001 | E1320: 0 | F1320: 0 | G1320: 0 | H1320: 0 | I1320: 0 | J1320: 0 | K1320: 1735.98 | L1320: 0 | M1320: =SUM(J1320:L1320)-160.58 -> 1575.4000000000001 | N1320: 160.58000000000001 | O1320: =SUM(M1320:N1320) -> 1735.98
A1321: 4442 | B1321: EOL SANTO AGOSTINHO 06 | C1321: 20.675.196/0002-02 | D1321: 3114.5 | E1321: 0 | F1321: 0 | G1321: 0 | H1321: 0 | I1321: 0 | J1321: 0 | K1321: 3431.96 | L1321: 0 | M1321: =SUM(J1321:L1321)-317.46 -> 3114.5 | N1321: 317.45999999999998 | O1321: =SUM(M1321:N1321) -> 3431.96
A1322: 4444 | B1322: UTE ASOLO 2 | C1322: 41.675.130/0001-01 | D1322: 4944.3900000000003 | E1322: 0 | F1322: 0 | G1322: 0 | H1322: 0 | I1322: 0 | J1322: 0 | K1322: 5448.3599999999997 | L1322: 0 | M1322: =SUM(J1322:L1322)-503.97 -> 4944.3899999999994 | N1322: 503.97000000000003 | O1322: =SUM(M1322:N1322) -> 5448.3599999999997
A1323: 4445 | B1323: EOL VENTOS DE SANTA LUZIA 03 | C1323: 41.489.491/0002-44 | D1323: 5609.0799999999999 | E1323: 0 | F1323: 0 | G1323: 0 | H1323: 0 | I1323: 0 | J1323: 0 | K1323: 6180.8000000000002 | L1323: 0 | M1323: =SUM(J1323:L1323)-571.72 -> 5609.0799999999999 | N1323: 571.72000000000003 | O1323: =SUM(M1323:N1323) -> 6180.8000000000002
A1324: 4446 | B1324: UFV SAO FRANCISCO I | C1324: 48.209.587/0001-70 | D1324: 5987.0299999999997 | E1324: 0 | F1324: 0 | G1324: 0 | H1324: 0 | I1324: 0 | J1324: 0 | K1324: 6597.2799999999997 | L1324: 0 | M1324: =SUM(J1324:L1324)-610.25 -> 5987.0299999999997 | N1324: 610.25 | O1324: =SUM(M1324:N1324) -> 6597.2799999999997
A1325: 4447 | B1325: UFV SAO FRANCISCO II | C1325: 48.346.774/0001-03 | D1325: 5987.0299999999997 | E1325: 0 | F1325: 0 | G1325: 0 | H1325: 0 | I1325: 0 | J1325: 0 | K1325: 6597.2799999999997 | L1325: 0 | M1325: =SUM(J1325:L1325)-610.25 -> 5987.0299999999997 | N1325: 610.25 | O1325: =SUM(M1325:N1325) -> 6597.2799999999997
A1326: 4448 | B1326: UFV SAO FRANCISCO III | C1326: 48.177.875/0001-90 | D1326: 5987.0299999999997 | E1326: 0 | F1326: 0 | G1326: 0 | H1326: 0 | I1326: 0 | J1326: 0 | K1326: 6597.2799999999997 | L1326: 0 | M1326: =SUM(J1326:L1326)-610.25 -> 5987.0299999999997 | N1326: 610.25 | O1326: =SUM(M1326:N1326) -> 6597.2799999999997
A1327: 4449 | B1327: UHE PASSO REAL | C1327: 33.042.730/0001-04 | D1327: 23175.119999999999 | E1327: 0 | F1327: 0 | G1327: 0 | H1327: 0 | I1327: 0 | J1327: 0 | K1327: 25537.32 | L1327: 0 | M1327: =SUM(J1327:L1327)-2362.2 -> 23175.119999999999 | N1327: 2362.1999999999998 | O1327: =SUM(M1327:N1327) -> 25537.32
A1328: 4451 | B1328: UHE ITAUBA | C1328: 33.042.730/0001-04 | D1328: 94425.929999999993 | E1328: 0 | F1328: 0 | G1328: 0 | H1328: 0 | I1328: 0 | J1328: 0 | K1328: 104050.61 | L1328: 0 | M1328: =SUM(J1328:L1328)-9624.68 -> 94425.929999999993 | N1328: 9624.6800000000003 | O1328: =SUM(M1328:N1328) -> 104050.60999999999
A1329: 4459 | B1329: EOL CAJUÍNA A3 | C1329: 36.951.946/0001-80 | D1329: 7893.6000000000004 | E1329: 0 | F1329: 0 | G1329: 0 | H1329: 0 | I1329: 0 | J1329: 0 | K1329: 8698.1800000000003 | L1329: 0 | M1329: =SUM(J1329:L1329)-804.58 -> 7893.6000000000004 | N1329: 804.58000000000004 | O1329: =SUM(M1329:N1329) -> 8698.1800000000003
A1330: 4460 | B1330: EOL CAJUÍNA A4 | C1330: 36.951.974/0001-06 | D1330: 8288.8099999999995 | E1330: 0 | F1330: 0 | G1330: 0 | H1330: 0 | I1330: 0 | J1330: 0 | K1330: 9133.6700000000001 | L1330: 0 | M1330: =SUM(J1330:L1330)-844.86 -> 8288.8099999999995 | N1330: 844.86000000000001 | O1330: =SUM(M1330:N1330) -> 9133.6700000000001
A1331: 4461 | B1331: EOL CAJUÍNA A5 | C1331: 36.957.768/0001-03 | D1331: 8553.3500000000004 | E1331: 0 | F1331: 0 | G1331: 0 | H1331: 0 | I1331: 0 | J1331: 0 | K1331: 9425.1800000000003 | L1331: 0 | M1331: =SUM(J1331:L1331)-871.83 -> 8553.3500000000004 | N1331: 871.83000000000004 | O1331: =SUM(M1331:N1331) -> 9425.1800000000003
A1332: 4462 | B1332: EOL CAJUÍNA A7 | C1332: 36.957.804/0001-20 | D1332: 5623.8199999999997 | E1332: 0 | F1332: 0 | G1332: 0 | H1332: 0 | I1332: 0 | J1332: 0 | K1332: 6197.0500000000002 | L1332: 0 | M1332: =SUM(J1332:L1332)-573.23 -> 5623.8199999999997 | N1332: 573.23000000000002 | O1332: =SUM(M1332:N1332) -> 6197.0499999999993
A1333: 4463 | B1333: EOL ASSURUÁ 5 II | C1333: 38.297.116/0002-98 | D1333: 5909 | E1333: 0 | F1333: 0 | G1333: 0 | H1333: 0 | I1333: 0 | J1333: 0 | K1333: 6511.29 | L1333: 0 | M1333: =SUM(J1333:L1333)-602.29 -> 5909 | N1333: 602.28999999999996 | O1333: =SUM(M1333:N1333) -> 6511.29
A1334: 4464 | B1334: EOL ASSURUÁ 5 IV | C1334: 42.929.694/0002-77 | D1334: 5909 | E1334: 0 | F1334: 0 | G1334: 0 | H1334: 0 | I1334: 0 | J1334: 0 | K1334: 6511.29 | L1334: 0 | M1334: =SUM(J1334:L1334)-602.29 -> 5909 | N1334: 602.28999999999996 | O1334: =SUM(M1334:N1334) -> 6511.29
A1335: 4465 | B1335: EOL KAIROS WIND 1 | C1335: 42.166.169/0001-66 | D1335: 4314.04 | E1335: 0 | F1335: 0 | G1335: 0 | H1335: 0 | I1335: 0 | J1335: 0 | K1335: 4753.7600000000002 | L1335: 0 | M1335: =SUM(J1335:L1335)-439.72 -> 4314.04 | N1335: 439.72000000000003 | O1335: =SUM(M1335:N1335) -> 4753.7600000000002
A1336: 4466 | B1336: UFV NOVA OLINDA 9 | C1336: 23.566.105/0003-70 | D1336: 1093.9200000000001 | E1336: 0 | F1336: 0 | G1336: 0 | H1336: 0 | I1336: 0 | J1336: 0 | K1336: 1205.4200000000001 | L1336: 0 | M1336: =SUM(J1336:L1336)-111.5 -> 1093.9200000000001 | N1336: 111.5 | O1336: =SUM(M1336:N1336) -> 1205.4200000000001
A1337: 4467 | B1337: UFV NOVA OLINDA 11 | C1337: 23.416.727/0003-11 | D1337: 1094.53 | E1337: 0 | F1337: 0 | G1337: 0 | H1337: 0 | I1337: 0 | J1337: 0 | K1337: 1206.0899999999999 | L1337: 0 | M1337: =SUM(J1337:L1337)-111.56 -> 1094.53 | N1337: 111.56 | O1337: =SUM(M1337:N1337) -> 1206.0899999999999
A1338: 4468 | B1338: UFV NOVA OLINDA 13 | C1338: 23.414.549/0003-90 | D1338: 1093.3 | E1338: 0 | F1338: 0 | G1338: 0 | H1338: 0 | I1338: 0 | J1338: 0 | K1338: 1204.74 | L1338: 0 | M1338: =SUM(J1338:L1338)-111.44 -> 1093.3 | N1338: 111.44 | O1338: =SUM(M1338:N1338) -> 1204.74
A1339: 4469 | B1339: UFV LAPA 3 | C1339: 23.509.564/0002-30 | D1339: 1151.9300000000001 | E1339: 0 | F1339: 0 | G1339: 0 | H1339: 0 | I1339: 0 | J1339: 0 | K1339: 1269.3399999999999 | L1339: 0 | M1339: =SUM(J1339:L1339)-117.41 -> 1151.9299999999998 | N1339: 117.41 | O1339: =SUM(M1339:N1339) -> 1269.3399999999999
A1340: 4470 | B1340: UFV SANTA LUZIA 8 | C1340: 40.586.796/0001-20 | D1340: 5750.9700000000003 | E1340: 0 | F1340: 0 | G1340: 0 | H1340: 0 | I1340: 0 | J1340: 0 | K1340: 6337.1599999999999 | L1340: 0 | M1340: =SUM(J1340:L1340)-586.19 -> 5750.9699999999993 | N1340: 586.19000000000005 | O1340: =SUM(M1340:N1340) -> 6337.1599999999999
A1341: 4471 | B1341: EOL SANTO AGOSTINHO 18 | C1341: 20.666.659/0002-70 | D1341: 3893.1300000000001 | E1341: 0 | F1341: 0 | G1341: 0 | H1341: 0 | I1341: 0 | J1341: 0 | K1341: 4289.9499999999998 | L1341: 0 | M1341: =SUM(J1341:L1341)-396.82 -> 3893.1299999999997 | N1341: 396.81999999999999 | O1341: =SUM(M1341:N1341) -> 4289.9499999999998
A1342: 4472 | B1342: EOL SANTO AGOSTINHO 21 | C1342: 20.666.720/0002-89 | D1342: 3893.1300000000001 | E1342: 0 | F1342: 0 | G1342: 0 | H1342: 0 | I1342: 0 | J1342: 0 | K1342: 4289.9499999999998 | L1342: 0 | M1342: =SUM(J1342:L1342)-396.82 -> 3893.1299999999997 | N1342: 396.81999999999999 | O1342: =SUM(M1342:N1342) -> 4289.9499999999998
A1343: 4473 | B1343: EOL MUNDO NOVO V | C1343: 41.760.884/0001-60 | D1343: 2423.54 | E1343: 0 | F1343: 0 | G1343: 0 | H1343: 0 | I1343: 0 | J1343: 0 | K1343: 2670.5700000000002 | L1343: 0 | M1343: =SUM(J1343:L1343)-247.03 -> 2423.54 | N1343: 247.03 | O1343: =SUM(M1343:N1343) -> 2670.5700000000002
A1344: 4474 | B1344: EOL MUNDO NOVO VI | C1344: 41.725.168/0001-41 | D1344: 4881.0299999999997 | E1344: 0 | F1344: 0 | G1344: 0 | H1344: 0 | I1344: 0 | J1344: 0 | K1344: 5378.5500000000002 | L1344: 0 | M1344: =SUM(J1344:L1344)-497.52 -> 4881.0300000000007 | N1344: 497.51999999999998 | O1344: =SUM(M1344:N1344) -> 5378.5500000000011
A1345: 4475 | B1345: EOL MUNDO NOVO VII | C1345: 41.760.915/0001-82 | D1345: 4881.0299999999997 | E1345: 0 | F1345: 0 | G1345: 0 | H1345: 0 | I1345: 0 | J1345: 0 | K1345: 5378.5500000000002 | L1345: 0 | M1345: =SUM(J1345:L1345)-497.52 -> 4881.0300000000007 | N1345: 497.51999999999998 | O1345: =SUM(M1345:N1345) -> 5378.5500000000011
A1346: 4476 | B1346: EOL CAJUÍNA B9 | C1346: 36.957.862/0001-54 | D1346: 7048.6300000000001 | E1346: 0 | F1346: 0 | G1346: 0 | H1346: 0 | I1346: 0 | J1346: 0 | K1346: 7767.0900000000001 | L1346: 0 | M1346: =SUM(J1346:L1346)-718.46 -> 7048.6300000000001 | N1346: 718.46000000000004 | O1346: =SUM(M1346:N1346) -> 7767.0900000000001
A1347: 4477 | B1347: EOL AROEIRA 1 | C1347: 38.094.930/0001-24 | D1347: 5831.7700000000004 | E1347: 0 | F1347: 0 | G1347: 0 | H1347: 0 | I1347: 0 | J1347: 0 | K1347: 6426.1899999999996 | L1347: 0 | M1347: =SUM(J1347:L1347)-594.42 -> 5831.7699999999995 | N1347: 594.41999999999996 | O1347: =SUM(M1347:N1347) -> 6426.1899999999996
A1348: 4478 | B1348: EOL AROEIRA 2 | C1348: 38.130.244/0002-42 | D1348: 5305.0299999999997 | E1348: 0 | F1348: 0 | G1348: 0 | H1348: 0 | I1348: 0 | J1348: 0 | K1348: 5845.7600000000002 | L1348: 0 | M1348: =SUM(J1348:L1348)-540.73 -> 5305.0300000000007 | N1348: 540.73000000000002 | O1348: =SUM(M1348:N1348) -> 5845.7600000000002
A1349: 4479 | B1349: EOL AROEIRA 3 | C1349: 39.364.731/0001-51 | D1349: 5305.0299999999997 | E1349: 0 | F1349: 0 | G1349: 0 | H1349: 0 | I1349: 0 | J1349: 0 | K1349: 5845.7600000000002 | L1349: 0 | M1349: =SUM(J1349:L1349)-540.73 -> 5305.0300000000007 | N1349: 540.73000000000002 | O1349: =SUM(M1349:N1349) -> 5845.7600000000002
A1350: 4480 | B1350: EOL AROEIRA 4 | C1350: 39.334.976/0001-36 | D1350: 5305.0299999999997 | E1350: 0 | F1350: 0 | G1350: 0 | H1350: 0 | I1350: 0 | J1350: 0 | K1350: 5845.7600000000002 | L1350: 0 | M1350: =SUM(J1350:L1350)-540.73 -> 5305.0300000000007 | N1350: 540.73000000000002 | O1350: =SUM(M1350:N1350) -> 5845.7600000000002
A1351: 4481 | B1351: EOL AROEIRA 5 | C1351: 38.091.465/0001-78 | D1351: 5305.0299999999997 | E1351: 0 | F1351: 0 | G1351: 0 | H1351: 0 | I1351: 0 | J1351: 0 | K1351: 5845.7600000000002 | L1351: 0 | M1351: =SUM(J1351:L1351)-540.73 -> 5305.0300000000007 | N1351: 540.73000000000002 | O1351: =SUM(M1351:N1351) -> 5845.7600000000002
A1352: 4497 | B1352: EOL SANTO AGOSTINHO 01 | C1352: 20.675.133/0002-56 | D1352: 2335.8699999999999 | E1352: 0 | F1352: 0 | G1352: 0 | H1352: 0 | I1352: 0 | J1352: 0 | K1352: 2573.96 | L1352: 0 | M1352: =SUM(J1352:L1352)-238.09 -> 2335.8699999999999 | N1352: 238.09 | O1352: =SUM(M1352:N1352) -> 2573.96
A1353: 4498 | B1353: EOL SANTO AGOSTINHO 02 | C1353: 20.675.144/0002-36 | D1353: 3893.1300000000001 | E1353: 0 | F1353: 0 | G1353: 0 | H1353: 0 | I1353: 0 | J1353: 0 | K1353: 4289.9499999999998 | L1353: 0 | M1353: =SUM(J1353:L1353)-396.82 -> 3893.1299999999997 | N1353: 396.81999999999999 | O1353: =SUM(M1353:N1353) -> 4289.9499999999998
A1354: 4507 | B1354: EOL CAJUÍNA B12 | C1354: 37.002.801/0001-04 | D1354: 4920.8999999999996 | E1354: 0 | F1354: 0 | G1354: 0 | H1354: 0 | I1354: 0 | J1354: 0 | K1354: 5422.4799999999996 | L1354: 0 | M1354: =SUM(J1354:L1354)-501.58 -> 4920.8999999999996 | N1354: 501.57999999999998 | O1354: =SUM(M1354:N1354) -> 5422.4799999999996
A1355: 4508 | B1355: EOL VENTOS DE SANTA LUZIA 04 | C1355: 41.483.602/0002-05 | D1355: 4846.4399999999996 | E1355: 0 | F1355: 0 | G1355: 0 | H1355: 0 | I1355: 0 | J1355: 0 | K1355: 5340.4300000000003 | L1355: 0 | M1355: =SUM(J1355:L1355)-493.99 -> 4846.4400000000005 | N1355: 493.99000000000001 | O1355: =SUM(M1355:N1355) -> 5340.4300000000003
A1356: 4509 | B1356: EOL AROEIRA 6 | C1356: 38.131.056/0002-39 | D1356: 4765.75 | E1356: 0 | F1356: 0 | G1356: 0 | H1356: 0 | I1356: 0 | J1356: 0 | K1356: 5251.5200000000004 | L1356: 0 | M1356: =SUM(J1356:L1356)-485.77 -> 4765.75 | N1356: 485.76999999999998 | O1356: =SUM(M1356:N1356) -> 5251.5200000000004
A1357: 4535 | B1357: ASS CHAFARIZ 2 | C1357: 22.548.637/0002-30 | D1357: 127095.98 | E1357: 0 | F1357: 0 | G1357: 0 | H1357: 0 | I1357: 0 | J1357: 0 | K1357: 140050.67000000001 | L1357: 0 | M1357: =SUM(J1357:L1357)-12954.69 -> 127095.98000000001 | N1357: 12954.690000000001 | O1357: =SUM(M1357:N1357) -> 140050.67000000001
A1358: 4536 | B1358: EOL CAJUINA B11 | C1358: 37.020.274/0001-52 | D1358: 8346.1299999999992 | E1358: 0 | F1358: 0 | G1358: 0 | H1358: 0 | I1358: 0 | J1358: 0 | K1358: 9196.8400000000001 | L1358: 0 | M1358: =SUM(J1358:L1358)-850.71 -> 8346.130000000001 | N1358: 850.71000000000004 | O1358: =SUM(M1358:N1358) -> 9196.8400000000001
A1359: 4537 | B1359: EOL CAJUINA B16 | C1359: 36.957.817/0001-08 | D1359: 2108.9899999999998 | E1359: 0 | F1359: 0 | G1359: 0 | H1359: 0 | I1359: 0 | J1359: 0 | K1359: 2323.96 | L1359: 0 | M1359: =SUM(J1359:L1359)-214.97 -> 2108.9900000000002 | N1359: 214.97 | O1359: =SUM(M1359:N1359) -> 2323.96
A1360: 4538 | B1360: EOL CAJUINA B18 | C1360: 37.020.270/0001-74 | D1360: 2811.9099999999999 | E1360: 0 | F1360: 0 | G1360: 0 | H1360: 0 | I1360: 0 | J1360: 0 | K1360: 3098.52 | L1360: 0 | M1360: =SUM(J1360:L1360)-286.61 -> 2811.9099999999999 | N1360: 286.61000000000001 | O1360: =SUM(M1360:N1360) -> 3098.52
A1361: 4539 | B1361: EOL CAJUINA C15 | C1361: 36.957.786/0001-87 | D1361: 6040.0299999999997 | E1361: 0 | F1361: 0 | G1361: 0 | H1361: 0 | I1361: 0 | J1361: 0 | K1361: 6655.6800000000003 | L1361: 0 | M1361: =SUM(J1361:L1361)-615.65 -> 6040.0300000000007 | N1361: 615.64999999999998 | O1361: =SUM(M1361:N1361) -> 6655.6800000000003
A1362: 4540 | B1362: EOL CAJUINA C16 | C1362: 36.951.989/0001-66 | D1362: 1109.96 | E1362: 0 | F1362: 0 | G1362: 0 | H1362: 0 | I1362: 0 | J1362: 0 | K1362: 1223.0999999999999 | L1362: 0 | M1362: =SUM(J1362:L1362)-113.14 -> 1109.9599999999998 | N1362: 113.14 | O1362: =SUM(M1362:N1362) -> 1223.0999999999999
A1363: 4541 | B1363: EOL CAJUINA E6 | C1363: 36.952.001/0001-83 | D1363: 7687.2299999999996 | E1363: 0 | F1363: 0 | G1363: 0 | H1363: 0 | I1363: 0 | J1363: 0 | K1363: 8470.7800000000007 | L1363: 0 | M1363: =SUM(J1363:L1363)-783.55 -> 7687.2300000000005 | N1363: 783.54999999999995 | O1363: =SUM(M1363:N1363) -> 8470.7800000000007
A1364: 4558 | B1364: EOL SÃO RICARDO 01 | C1364: 37.053.489/0001-70 | D1364: 2939.54 | E1364: 0 | F1364: 0 | G1364: 0 | H1364: 0 | I1364: 0 | J1364: 0 | K1364: 3239.1599999999999 | L1364: 0 | M1364: =SUM(J1364:L1364)-299.62 -> 2939.54 | N1364: 299.62 | O1364: =SUM(M1364:N1364) -> 3239.1599999999999
A1365: 4559 | B1365: EOL SÃO RICARDO 02 | C1365: 37.002.800/0001-51 | D1365: 3674.3499999999999 | E1365: 0 | F1365: 0 | G1365: 0 | H1365: 0 | I1365: 0 | J1365: 0 | K1365: 4048.8699999999999 | L1365: 0 | M1365: =SUM(J1365:L1365)-374.52 -> 3674.3499999999999 | N1365: 374.51999999999998 | O1365: =SUM(M1365:N1365) -> 4048.8699999999999
A1366: 4560 | B1366: EOL CAJUÍNA B14 | C1366: 36.957.823/0001-57 | D1366: 6389.8100000000004 | E1366: 0 | F1366: 0 | G1366: 0 | H1366: 0 | I1366: 0 | J1366: 0 | K1366: 7041.1099999999997 | L1366: 0 | M1366: =SUM(J1366:L1366)-651.3 -> 6389.8099999999995 | N1366: 651.29999999999995 | O1366: =SUM(M1366:N1366) -> 7041.1099999999997
A1367: 4561 | B1367: EOL CAJUÍNA B15 | C1367: 37.002.822/0001-11 | D1367: 4969.8699999999999 | E1367: 0 | F1367: 0 | G1367: 0 | H1367: 0 | I1367: 0 | J1367: 0 | K1367: 5476.4399999999996 | L1367: 0 | M1367: =SUM(J1367:L1367)-506.57 -> 4969.8699999999999 | N1367: 506.56999999999999 | O1367: =SUM(M1367:N1367) -> 5476.4399999999996
A1368: 4567 | B1368: EOL CAJUÍNA B13 | C1368: 36.957.856/0001-05 | D1368: 5679.7700000000004 | E1368: 0 | F1368: 0 | G1368: 0 | H1368: 0 | I1368: 0 | J1368: 0 | K1368: 6258.6999999999998 | L1368: 0 | M1368: =SUM(J1368:L1368)-578.93 -> 5679.7699999999995 | N1368: 578.92999999999995 | O1368: =SUM(M1368:N1368) -> 6258.6999999999998
A1369: 4577 | B1369: EOL TUCANO V | C1369: 35.805.346/0001-41 | D1369: 2584.3400000000001 | E1369: 0 | F1369: 0 | G1369: 0 | H1369: 0 | I1369: 0 | J1369: 0 | K1369: 2847.7600000000002 | L1369: 0 | M1369: =SUM(J1369:L1369)-263.42 -> 2584.3400000000001 | N1369: 263.42000000000002 | O1369: =SUM(M1369:N1369) -> 2847.7600000000002
A1370: 4578 | B1370: EOL TUCANO XIII | C1370: 35.805.346/0001-41 | D1370: 4522.6099999999997 | E1370: 0 | F1370: 0 | G1370: 0 | H1370: 0 | I1370: 0 | J1370: 0 | K1370: 4983.5900000000001 | L1370: 0 | M1370: =SUM(J1370:L1370)-460.98 -> 4522.6100000000006 | N1370: 460.98000000000002 | O1370: =SUM(M1370:N1370) -> 4983.5900000000001
A1371: 4579 | B1371: EOL TUCANO XVII | C1371: 35.805.346/0001-41 | D1371: 1938.26 | E1371: 0 | F1371: 0 | G1371: 0 | H1371: 0 | I1371: 0 | J1371: 0 | K1371: 2135.8200000000002 | L1371: 0 | M1371: =SUM(J1371:L1371)-197.56 -> 1938.2600000000002 | N1371: 197.56 | O1371: =SUM(M1371:N1371) -> 2135.8200000000002
A1372: 4585 | B1372: EOL KAIRÓS WIND 2 | C1372: 42.422.214/0001-04 | D1372: 4314.04 | E1372: 0 | F1372: 0 | G1372: 0 | H1372: 0 | I1372: 0 | J1372: 0 | K1372: 4753.7600000000002 | L1372: 0 | M1372: =SUM(J1372:L1372)-439.72 -> 4314.04 | N1372: 439.72000000000003 | O1372: =SUM(M1372:N1372) -> 4753.7600000000002
A1373: 4586 | B1373: UFV HELIO VALGAS 2 | C1373: 32.431.507/0001-96 | D1373: 6489.7700000000004 | E1373: 0 | F1373: 0 | G1373: 0 | H1373: 0 | I1373: 0 | J1373: 0 | K1373: 7151.2600000000002 | L1373: 0 | M1373: =SUM(J1373:L1373)-661.49 -> 6489.7700000000004 | N1373: 661.49000000000001 | O1373: =SUM(M1373:N1373) -> 7151.2600000000002
A1374: 4587 | B1374: UFV HELIO VALGAS 3 | C1374: 32.431.516/0001-87 | D1374: 6489.7700000000004 | E1374: 0 | F1374: 0 | G1374: 0 | H1374: 0 | I1374: 0 | J1374: 0 | K1374: 7151.2600000000002 | L1374: 0 | M1374: =SUM(J1374:L1374)-661.49 -> 6489.7700000000004 | N1374: 661.49000000000001 | O1374: =SUM(M1374:N1374) -> 7151.2600000000002
A1375: 4588 | B1375: UFV HELIO VALGAS 4 | C1375: 32.431.516/0001-87 | D1375: 6489.7700000000004 | E1375: 0 | F1375: 0 | G1375: 0 | H1375: 0 | I1375: 0 | J1375: 0 | K1375: 7151.2600000000002 | L1375: 0 | M1375: =SUM(J1375:L1375)-661.49 -> 6489.7700000000004 | N1375: 661.49000000000001 | O1375: =SUM(M1375:N1375) -> 7151.2600000000002
A1376: 4589 | B1376: UFV HELIO VALGAS 5 | C1376: 32.431.510/0001-00 | D1376: 6489.7700000000004 | E1376: 0 | F1376: 0 | G1376: 0 | H1376: 0 | I1376: 0 | J1376: 0 | K1376: 7151.2600000000002 | L1376: 0 | M1376: =SUM(J1376:L1376)-661.49 -> 6489.7700000000004 | N1376: 661.49000000000001 | O1376: =SUM(M1376:N1376) -> 7151.2600000000002
A1377: 4590 | B1377: UFV HELIO VALGAS 6 | C1377: 32.431.510/0001-00 | D1377: 6489.7700000000004 | E1377: 0 | F1377: 0 | G1377: 0 | H1377: 0 | I1377: 0 | J1377: 0 | K1377: 7151.2600000000002 | L1377: 0 | M1377: =SUM(J1377:L1377)-661.49 -> 6489.7700000000004 | N1377: 661.49000000000001 | O1377: =SUM(M1377:N1377) -> 7151.2600000000002
A1378: 4591 | B1378: EOL AROEIRA 7 | C1378: 38.090.834/0002-99 | D1378: 5831.7700000000004 | E1378: 0 | F1378: 0 | G1378: 0 | H1378: 0 | I1378: 0 | J1378: 0 | K1378: 6426.1899999999996 | L1378: 0 | M1378: =SUM(J1378:L1378)-594.42 -> 5831.7699999999995 | N1378: 594.41999999999996 | O1378: =SUM(M1378:N1378) -> 6426.1899999999996
A1379: 4592 | B1379: UFV HELIO VALGAS 7 | C1379: 40.224.338/0001-41 | D1379: 6489.7700000000004 | E1379: 0 | F1379: 0 | G1379: 0 | H1379: 0 | I1379: 0 | J1379: 0 | K1379: 7151.2600000000002 | L1379: 0 | M1379: =SUM(J1379:L1379)-661.49 -> 6489.7700000000004 | N1379: 661.49000000000001 | O1379: =SUM(M1379:N1379) -> 7151.2600000000002
A1380: 4593 | B1380: UFV HELIO VALGAS 8 | C1380: 40.224.338/0001-41 | D1380: 8120.1400000000003 | E1380: 0 | F1380: 0 | G1380: 0 | H1380: 0 | I1380: 0 | J1380: 0 | K1380: 8947.8099999999995 | L1380: 0 | M1380: =SUM(J1380:L1380)-827.67 -> 8120.1399999999994 | N1380: 827.66999999999996 | O1380: =SUM(M1380:N1380) -> 8947.8099999999995
A1381: 4594 | B1381: UFV HELIO VALGAS 9 | C1381: 40.114.336/0001-08 | D1381: 6494.96 | E1381: 0 | F1381: 0 | G1381: 0 | H1381: 0 | I1381: 0 | J1381: 0 | K1381: 7156.9799999999996 | L1381: 0 | M1381: =SUM(J1381:L1381)-662.02 -> 6494.9599999999991 | N1381: 662.01999999999998 | O1381: =SUM(M1381:N1381) -> 7156.9799999999996
A1382: 4595 | B1382: UFV HELIO VALGAS 10 | C1382: 40.114.336/0001-08 | D1382: 6528.71 | E1382: 0 | F1382: 0 | G1382: 0 | H1382: 0 | I1382: 0 | J1382: 0 | K1382: 7194.1700000000001 | L1382: 0 | M1382: =SUM(J1382:L1382)-665.46 -> 6528.71 | N1382: 665.46000000000004 | O1382: =SUM(M1382:N1382) -> 7194.1700000000001
A1383: 4606 | B1383: EOL KAIROS WIND 6 | C1383: 44.031.923/0001-86 | D1383: 4853.29 | E1383: 0 | F1383: 0 | G1383: 0 | H1383: 0 | I1383: 0 | J1383: 0 | K1383: 5347.9799999999996 | L1383: 0 | M1383: =SUM(J1383:L1383)-494.69 -> 4853.29 | N1383: 494.69 | O1383: =SUM(M1383:N1383) -> 5347.9799999999996
A1384: 4607 | B1384: UFV HELIO VALGAS 1 | C1384: 32.431.507/0001-96 | D1384: 6489.7700000000004 | E1384: 0 | F1384: 0 | G1384: 0 | H1384: 0 | I1384: 0 | J1384: 0 | K1384: 7151.2600000000002 | L1384: 0 | M1384: =SUM(J1384:L1384)-661.49 -> 6489.7700000000004 | N1384: 661.49000000000001 | O1384: =SUM(M1384:N1384) -> 7151.2600000000002
A1385: 4608 | B1385: EOL PEDRA PINTADA I | C1385: 42.046.559/0002-83 | D1385: 6529.4899999999998 | E1385: 0 | F1385: 0 | G1385: 0 | H1385: 0 | I1385: 0 | J1385: 0 | K1385: 7195.0299999999997 | L1385: 0 | M1385: =SUM(J1385:L1385)-665.54 -> 6529.4899999999998 | N1385: 665.53999999999996 | O1385: =SUM(M1385:N1385) -> 7195.0299999999997
A1386: 4609 | B1386: EOL PEDRA PINTADA II | C1386: 42.261.997/0002-64 | D1386: 6555.3999999999996 | E1386: 0 | F1386: 0 | G1386: 0 | H1386: 0 | I1386: 0 | J1386: 0 | K1386: 7223.5799999999999 | L1386: 0 | M1386: =SUM(J1386:L1386)-668.18 -> 6555.3999999999996 | N1386: 668.17999999999995 | O1386: =SUM(M1386:N1386) -> 7223.5799999999999
A1387: 4610 | B1387: EOL PEDRA PINTADA III | C1387: 41.982.031/0002-53 | D1387: 5791.04 | E1387: 0 | F1387: 0 | G1387: 0 | H1387: 0 | I1387: 0 | J1387: 0 | K1387: 6381.3100000000004 | L1387: 0 | M1387: =SUM(J1387:L1387)-590.27 -> 5791.0400000000009 | N1387: 590.26999999999998 | O1387: =SUM(M1387:N1387) -> 6381.3100000000013
A1388: 4611 | B1388: EOL PEDRA PINTADA IV | C1388: 41.983.083/0003-25 | D1388: 6503.5799999999999 | E1388: 0 | F1388: 0 | G1388: 0 | H1388: 0 | I1388: 0 | J1388: 0 | K1388: 7166.4799999999996 | L1388: 0 | M1388: =SUM(J1388:L1388)-662.9 -> 6503.5799999999999 | N1388: 662.89999999999998 | O1388: =SUM(M1388:N1388) -> 7166.4799999999996
A1389: 4612 | B1389: UFV HORIZONTE MP 2 | C1389: 23.399.589/0001-48 | D1389: 2776.1500000000001 | E1389: 0 | F1389: 0 | G1389: 0 | H1389: 0 | I1389: 0 | J1389: 0 | K1389: 3059.1199999999999 | L1389: 0 | M1389: =SUM(J1389:L1389)-282.97 -> 2776.1499999999996 | N1389: 282.97000000000003 | O1389: =SUM(M1389:N1389) -> 3059.1199999999999
A1390: 4613 | B1390: UFV HORIZONTE MP 11 | C1390: 23.399.589/0001-48 | D1390: 2140.54 | E1390: 0 | F1390: 0 | G1390: 0 | H1390: 0 | I1390: 0 | J1390: 0 | K1390: 2358.7199999999998 | L1390: 0 | M1390: =SUM(J1390:L1390)-218.18 -> 2140.54 | N1390: 218.18000000000001 | O1390: =SUM(M1390:N1390) -> 2358.7199999999998
A1391: 4614 | B1391: UFV RIBEIRO GONÇALVES VI | C1391: 31.711.512/0001-90 | D1391: 4265.6999999999998 | E1391: 0 | F1391: 0 | G1391: 0 | H1391: 0 | I1391: 0 | J1391: 0 | K1391: 4700.5 | L1391: 0 | M1391: =SUM(J1391:L1391)-434.8 -> 4265.6999999999998 | N1391: 434.80000000000001 | O1391: =SUM(M1391:N1391) -> 4700.5
A1392: 4615 | B1392: UFV RIBEIRO GONÇALVES VII | C1392: 31.711.512/0001-90 | D1392: 3839 | E1392: 0 | F1392: 0 | G1392: 0 | H1392: 0 | I1392: 0 | J1392: 0 | K1392: 4230.3000000000002 | L1392: 0 | M1392: =SUM(J1392:L1392)-391.3 -> 3839 | N1392: 391.30000000000001 | O1392: =SUM(M1392:N1392) -> 4230.3000000000002
A1393: 4616 | B1393: UFV RIBEIRO GONÇALVES VIII | C1393: 31.711.512/0001-90 | D1393: 3839 | E1393: 0 | F1393: 0 | G1393: 0 | H1393: 0 | I1393: 0 | J1393: 0 | K1393: 4230.3000000000002 | L1393: 0 | M1393: =SUM(J1393:L1393)-391.3 -> 3839 | N1393: 391.30000000000001 | O1393: =SUM(M1393:N1393) -> 4230.3000000000002
A1394: 4617 | B1394: EOL AROEIRA 8 | C1394: 39.336.768/0001-76 | D1394: 5305.0299999999997 | E1394: 0 | F1394: 0 | G1394: 0 | H1394: 0 | I1394: 0 | J1394: 0 | K1394: 5845.7600000000002 | L1394: 0 | M1394: =SUM(J1394:L1394)-540.73 -> 5305.0300000000007 | N1394: 540.73000000000002 | O1394: =SUM(M1394:N1394) -> 5845.7600000000002
A1395: 4618 | B1395: UFV MENDUBIM I | C1395: 45.991.644/0001-27 | D1395: 4646.5699999999997 | E1395: 0 | F1395: 0 | G1395: 0 | H1395: 0 | I1395: 0 | J1395: 0 | K1395: 5120.1899999999996 | L1395: 0 | M1395: =SUM(J1395:L1395)-473.62 -> 4646.5699999999997 | N1395: 473.62 | O1395: =SUM(M1395:N1395) -> 5120.1899999999996
A1396: 4619 | B1396: UFV MENDUBIM II | C1396: 45.991.741/0001-10 | D1396: 4065.7199999999998 | E1396: 0 | F1396: 0 | G1396: 0 | H1396: 0 | I1396: 0 | J1396: 0 | K1396: 4480.1300000000001 | L1396: 0 | M1396: =SUM(J1396:L1396)-414.41 -> 4065.7200000000003 | N1396: 414.41000000000003 | O1396: =SUM(M1396:N1396) -> 4480.1300000000001
A1397: 4620 | B1397: UFV MENDUBIM III | C1397: 45.991.823/0001-64 | D1397: 4646.5699999999997 | E1397: 0 | F1397: 0 | G1397: 0 | H1397: 0 | I1397: 0 | J1397: 0 | K1397: 5120.1899999999996 | L1397: 0 | M1397: =SUM(J1397:L1397)-473.62 -> 4646.5699999999997 | N1397: 473.62 | O1397: =SUM(M1397:N1397) -> 5120.1899999999996
A1398: 4621 | B1398: UFV MENDUBIM IV | C1398: 45.991.863/0001-06 | D1398: 4646.5699999999997 | E1398: 0 | F1398: 0 | G1398: 0 | H1398: 0 | I1398: 0 | J1398: 0 | K1398: 5120.1899999999996 | L1398: 0 | M1398: =SUM(J1398:L1398)-473.62 -> 4646.5699999999997 | N1398: 473.62 | O1398: =SUM(M1398:N1398) -> 5120.1899999999996
A1399: 4622 | B1399: UFV MENDUBIM V | C1399: 45.991.921/0001-00 | D1399: 4065.7199999999998 | E1399: 0 | F1399: 0 | G1399: 0 | H1399: 0 | I1399: 0 | J1399: 0 | K1399: 4480.1300000000001 | L1399: 0 | M1399: =SUM(J1399:L1399)-414.41 -> 4065.7200000000003 | N1399: 414.41000000000003 | O1399: =SUM(M1399:N1399) -> 4480.1300000000001
A1400: 4623 | B1400: UFV MENDUBIM VI | C1400: 45.991.972/0001-23 | D1400: 4065.7199999999998 | E1400: 0 | F1400: 0 | G1400: 0 | H1400: 0 | I1400: 0 | J1400: 0 | K1400: 4480.1300000000001 | L1400: 0 | M1400: =SUM(J1400:L1400)-414.41 -> 4065.7200000000003 | N1400: 414.41000000000003 | O1400: =SUM(M1400:N1400) -> 4480.1300000000001
A1401: 4624 | B1401: UFV MENDUBIM VII | C1401: 45.992.035/0001-92 | D1401: 4065.7199999999998 | E1401: 0 | F1401: 0 | G1401: 0 | H1401: 0 | I1401: 0 | J1401: 0 | K1401: 4480.1300000000001 | L1401: 0 | M1401: =SUM(J1401:L1401)-414.41 -> 4065.7200000000003 | N1401: 414.41000000000003 | O1401: =SUM(M1401:N1401) -> 4480.1300000000001
A1402: 4625 | B1402: UFV MENDUBIM VIII | C1402: 45.992.085/0001-70 | D1402: 4065.7199999999998 | E1402: 0 | F1402: 0 | G1402: 0 | H1402: 0 | I1402: 0 | J1402: 0 | K1402: 4480.1300000000001 | L1402: 0 | M1402: =SUM(J1402:L1402)-414.41 -> 4065.7200000000003 | N1402: 414.41000000000003 | O1402: =SUM(M1402:N1402) -> 4480.1300000000001
A1403: 4626 | B1403: UFV MENDUBIM IX | C1403: 45.992.149/0001-32 | D1403: 4646.5699999999997 | E1403: 0 | F1403: 0 | G1403: 0 | H1403: 0 | I1403: 0 | J1403: 0 | K1403: 5120.1899999999996 | L1403: 0 | M1403: =SUM(J1403:L1403)-473.62 -> 4646.5699999999997 | N1403: 473.62 | O1403: =SUM(M1403:N1403) -> 5120.1899999999996
A1404: 4627 | B1404: UFV MENDUBIM X | C1404: 45.992.184/0001-51 | D1404: 2904.0100000000002 | E1404: 0 | F1404: 0 | G1404: 0 | H1404: 0 | I1404: 0 | J1404: 0 | K1404: 3200.0100000000002 | L1404: 0 | M1404: =SUM(J1404:L1404)-296 -> 2904.0100000000002 | N1404: 296 | O1404: =SUM(M1404:N1404) -> 3200.0100000000002
A1405: 4628 | B1405: UFV MENDUBIM XI | C1405: 45.992.228/0001-43 | D1405: 6969.7200000000003 | E1405: 0 | F1405: 0 | G1405: 0 | H1405: 0 | I1405: 0 | J1405: 0 | K1405: 7680.1300000000001 | L1405: 0 | M1405: =SUM(J1405:L1405)-710.41 -> 6969.7200000000003 | N1405: 710.40999999999997 | O1405: =SUM(M1405:N1405) -> 7680.1300000000001
A1406: 4629 | B1406: EOL VENTOS DE SANTO ANTÔNIO 01 | C1406: 42.495.343/0002-03 | D1406: 5651.1300000000001 | E1406: 0 | F1406: 0 | G1406: 0 | H1406: 0 | I1406: 0 | J1406: 0 | K1406: 6227.1400000000003 | L1406: 0 | M1406: =SUM(J1406:L1406)-576.01 -> 5651.1300000000001 | N1406: 576.00999999999999 | O1406: =SUM(M1406:N1406) -> 6227.1400000000003
A1407: 4630 | B1407: UFV MENDUBIM XII | C1407: 45.992.261/0001-73 | D1407: 3484.8600000000001 | E1407: 0 | F1407: 0 | G1407: 0 | H1407: 0 | I1407: 0 | J1407: 0 | K1407: 3840.0700000000002 | L1407: 0 | M1407: =SUM(J1407:L1407)-355.21 -> 3484.8600000000001 | N1407: 355.20999999999998 | O1407: =SUM(M1407:N1407) -> 3840.0700000000002
A1408: 4631 | B1408: UFV MENDUBIM XIII | C1408: 45.992.304/0001-10 | D1408: 4646.5699999999997 | E1408: 0 | F1408: 0 | G1408: 0 | H1408: 0 | I1408: 0 | J1408: 0 | K1408: 5120.1899999999996 | L1408: 0 | M1408: =SUM(J1408:L1408)-473.62 -> 4646.5699999999997 | N1408: 473.62 | O1408: =SUM(M1408:N1408) -> 5120.1899999999996
A1409: 4632 | B1409: EOL MORRO 2 | C1409: 42.625.774/0002-39 | D1409: 4560.7200000000003 | E1409: 0 | F1409: 0 | G1409: 0 | H1409: 0 | I1409: 0 | J1409: 0 | K1409: 5025.5900000000001 | L1409: 0 | M1409: =SUM(J1409:L1409)-464.87 -> 4560.7200000000003 | N1409: 464.87 | O1409: =SUM(M1409:N1409) -> 5025.5900000000001
A1410: 4633 | B1410: EOL OESTE SERIDÓ VI | C1410: 25.216.818/0001-77 | D1410: 2078.75 | E1410: 0 | F1410: 0 | G1410: 0 | H1410: 0 | I1410: 0 | J1410: 0 | K1410: 2290.6300000000001 | L1410: 0 | M1410: =SUM(J1410:L1410)-211.88 -> 2078.75 | N1410: 211.88 | O1410: =SUM(M1410:N1410) -> 2290.6300000000001
A1411: 4634 | B1411: EOL OESTE SERIDÓ X | C1411: 36.641.948/0001-73 | D1411: 3118.1199999999999 | E1411: 0 | F1411: 0 | G1411: 0 | H1411: 0 | I1411: 0 | J1411: 0 | K1411: 3435.9400000000001 | L1411: 0 | M1411: =SUM(J1411:L1411)-317.82 -> 3118.1199999999999 | N1411: 317.81999999999999 | O1411: =SUM(M1411:N1411) -> 3435.9400000000001
A1412: 4635 | B1412: EOL OESTE SERIDÓ XII | C1412: 36.641.357/0001-04 | D1412: 3637.8099999999999 | E1412: 0 | F1412: 0 | G1412: 0 | H1412: 0 | I1412: 0 | J1412: 0 | K1412: 4008.6100000000001 | L1412: 0 | M1412: =SUM(J1412:L1412)-370.8 -> 3637.8099999999999 | N1412: 370.80000000000001 | O1412: =SUM(M1412:N1412) -> 4008.6100000000001
A1413: 4636 | B1413: EOL SERRA DAS VACAS A | C1413: 28.029.264/0001-97 | D1413: 4666.6499999999996 | E1413: 0 | F1413: 0 | G1413: 0 | H1413: 0 | I1413: 0 | J1413: 0 | K1413: 5142.3100000000004 | L1413: 0 | M1413: =SUM(J1413:L1413)-475.66 -> 4666.6500000000005 | N1413: 475.66000000000003 | O1413: =SUM(M1413:N1413) -> 5142.3100000000004
A1414: 4637 | B1414: EOL SERRA DAS VACAS B | C1414: 28.228.040/0001-04 | D1414: 4137.2399999999998 | E1414: 0 | F1414: 0 | G1414: 0 | H1414: 0 | I1414: 0 | J1414: 0 | K1414: 4558.9399999999996 | L1414: 0 | M1414: =SUM(J1414:L1414)-421.7 -> 4137.2399999999998 | N1414: 421.69999999999999 | O1414: =SUM(M1414:N1414) -> 4558.9399999999996
A1415: 4638 | B1415: UFV SERRA DO MEL VII | C1415: 46.545.021/0001-93 | D1415: 5892.0299999999997 | E1415: 0 | F1415: 0 | G1415: 0 | H1415: 0 | I1415: 0 | J1415: 0 | K1415: 6492.6000000000004 | L1415: 0 | M1415: =SUM(J1415:L1415)-600.57 -> 5892.0300000000007 | N1415: 600.57000000000005 | O1415: =SUM(M1415:N1415) -> 6492.6000000000004
A1416: 4639 | B1416: UFV MARANGATU 1 | C1416: 41.977.332/0001-08 | D1416: 3443 | E1416: 0 | F1416: 0 | G1416: 0 | H1416: 0 | I1416: 0 | J1416: 0 | K1416: 3793.9400000000001 | L1416: 0 | M1416: =SUM(J1416:L1416)-350.94 -> 3443 | N1416: 350.94 | O1416: =SUM(M1416:N1416) -> 3793.9400000000001
A1417: 4640 | B1417: UFV MARANGATU 2 | C1417: 42.066.785/0001-45 | D1417: 3450.5799999999999 | E1417: 0 | F1417: 0 | G1417: 0 | H1417: 0 | I1417: 0 | J1417: 0 | K1417: 3802.29 | L1417: 0 | M1417: =SUM(J1417:L1417)-351.71 -> 3450.5799999999999 | N1417: 351.70999999999998 | O1417: =SUM(M1417:N1417) -> 3802.29
A1418: 4641 | B1418: UFV MARANGATU 3 | C1418: 42.066.812/0001-80 | D1418: 3459.8000000000002 | E1418: 0 | F1418: 0 | G1418: 0 | H1418: 0 | I1418: 0 | J1418: 0 | K1418: 3812.4499999999998 | L1418: 0 | M1418: =SUM(J1418:L1418)-352.65 -> 3459.7999999999997 | N1418: 352.64999999999998 | O1418: =SUM(M1418:N1418) -> 3812.4499999999998
A1419: 4642 | B1419: UFV MARANGATU 4 | C1419: 42.066.826/0001-01 | D1419: 3448.3600000000001 | E1419: 0 | F1419: 0 | G1419: 0 | H1419: 0 | I1419: 0 | J1419: 0 | K1419: 3799.8499999999999 | L1419: 0 | M1419: =SUM(J1419:L1419)-351.49 -> 3448.3599999999997 | N1419: 351.49000000000001 | O1419: =SUM(M1419:N1419) -> 3799.8499999999995
A1420: 4643 | B1420: UFV MARANGATU 5 | C1420: 42.066.841/0001-41 | D1420: 3454.9000000000001 | E1420: 0 | F1420: 0 | G1420: 0 | H1420: 0 | I1420: 0 | J1420: 0 | K1420: 3807.0500000000002 | L1420: 0 | M1420: =SUM(J1420:L1420)-352.15 -> 3454.9000000000001 | N1420: 352.14999999999998 | O1420: =SUM(M1420:N1420) -> 3807.0500000000002
A1421: 4644 | B1421: UFV MARANGATU 6 | C1421: 42.066.887/0001-60 | D1421: 3462.3600000000001 | E1421: 0 | F1421: 0 | G1421: 0 | H1421: 0 | I1421: 0 | J1421: 0 | K1421: 3815.27 | L1421: 0 | M1421: =SUM(J1421:L1421)-352.91 -> 3462.3600000000001 | N1421: 352.91000000000003 | O1421: =SUM(M1421:N1421) -> 3815.27
A1422: 4645 | B1422: UFV MARANGATU 7 | C1422: 42.066.900/0001-81 | D1422: 3453.27 | E1422: 0 | F1422: 0 | G1422: 0 | H1422: 0 | I1422: 0 | J1422: 0 | K1422: 3805.2600000000002 | L1422: 0 | M1422: =SUM(J1422:L1422)-351.99 -> 3453.2700000000004 | N1422: 351.99000000000001 | O1422: =SUM(M1422:N1422) -> 3805.2600000000002
A1423: 4646 | B1423: UFV MARANGATU 8 | C1423: 42.066.920/0001-52 | D1423: 3455.48 | E1423: 0 | F1423: 0 | G1423: 0 | H1423: 0 | I1423: 0 | J1423: 0 | K1423: 3807.6900000000001 | L1423: 0 | M1423: =SUM(J1423:L1423)-352.21 -> 3455.48 | N1423: 352.20999999999998 | O1423: =SUM(M1423:N1423) -> 3807.6900000000001
A1424: 4647 | B1424: UFV MARANGATU 9 | C1424: 42.066.942/0001-12 | D1424: 3463.6399999999999 | E1424: 0 | F1424: 0 | G1424: 0 | H1424: 0 | I1424: 0 | J1424: 0 | K1424: 3816.6799999999998 | L1424: 0 | M1424: =SUM(J1424:L1424)-353.04 -> 3463.6399999999999 | N1424: 353.04000000000002 | O1424: =SUM(M1424:N1424) -> 3816.6799999999998
A1425: 4648 | B1425: UFV MARANGATU 10 | C1425: 42.066.958/0001-25 | D1425: 3466.21 | E1425: 0 | F1425: 0 | G1425: 0 | H1425: 0 | I1425: 0 | J1425: 0 | K1425: 3819.52 | L1425: 0 | M1425: =SUM(J1425:L1425)-353.31 -> 3466.21 | N1425: 353.31 | O1425: =SUM(M1425:N1425) -> 3819.52
A1426: 4649 | B1426: UFV MARANGATU 11 | C1426: 42.066.972/0001-29 | D1426: 3455.5999999999999 | E1426: 0 | F1426: 0 | G1426: 0 | H1426: 0 | I1426: 0 | J1426: 0 | K1426: 3807.8200000000002 | L1426: 0 | M1426: =SUM(J1426:L1426)-352.22 -> 3455.6000000000004 | N1426: 352.22000000000003 | O1426: =SUM(M1426:N1426) -> 3807.8200000000006
A1427: 4650 | B1427: UFV MARANGATU 12 | C1427: 42.066.994/0001-99 | D1427: 3456.6399999999999 | E1427: 0 | F1427: 0 | G1427: 0 | H1427: 0 | I1427: 0 | J1427: 0 | K1427: 3808.9699999999998 | L1427: 0 | M1427: =SUM(J1427:L1427)-352.33 -> 3456.6399999999999 | N1427: 352.32999999999998 | O1427: =SUM(M1427:N1427) -> 3808.9699999999998
A1428: 4651 | B1428: UFV JAÍBA CN | C1428: 37.995.403/0001-28 | D1428: 3676.73 | E1428: 0 | F1428: 0 | G1428: 0 | H1428: 0 | I1428: 0 | J1428: 0 | K1428: 4051.4899999999998 | L1428: 0 | M1428: =SUM(J1428:L1428)-374.76 -> 3676.7299999999996 | N1428: 374.75999999999999 | O1428: =SUM(M1428:N1428) -> 4051.4899999999998
A1429: 4652 | B1429: EOL VENTOS DE SANTA LUZIA 11 | C1429: 42.538.271/0002-26 | D1429: 6216.2399999999998 | E1429: 0 | F1429: 0 | G1429: 0 | H1429: 0 | I1429: 0 | J1429: 0 | K1429: 6849.8500000000004 | L1429: 0 | M1429: =SUM(J1429:L1429)-633.61 -> 6216.2400000000007 | N1429: 633.61000000000001 | O1429: =SUM(M1429:N1429) -> 6849.8500000000004
A1430: 4653 | B1430: EOL VENTOS DE SANTA LUZIA 12 | C1430: 42.495.350/0003-88 | D1430: 6781.3500000000004 | E1430: 0 | F1430: 0 | G1430: 0 | H1430: 0 | I1430: 0 | J1430: 0 | K1430: 7472.5600000000004 | L1430: 0 | M1430: =SUM(J1430:L1430)-691.21 -> 6781.3500000000004 | N1430: 691.21000000000004 | O1430: =SUM(M1430:N1430) -> 7472.5600000000004
A1431: 4654 | B1431: EOL VENTOS DE SANTA LUZIA 13 | C1431: 42.455.678/0002-90 | D1431: 6781.3500000000004 | E1431: 0 | F1431: 0 | G1431: 0 | H1431: 0 | I1431: 0 | J1431: 0 | K1431: 7472.5600000000004 | L1431: 0 | M1431: =SUM(J1431:L1431)-691.21 -> 6781.3500000000004 | N1431: 691.21000000000004 | O1431: =SUM(M1431:N1431) -> 7472.5600000000004
A1432: 5002 | B1432: ALCOA-P | C1432: 23.637.697/0001-01 | D1432: 15619.09 | E1432: 0 | F1432: 0 | G1432: 0 | H1432: 0 | I1432: 0 | J1432: 0 | K1432: 17211.119999999999 | L1432: 0 | M1432: =SUM(J1432:L1432)-1592.03 -> 15619.089999999998 | N1432: 1592.03 | O1432: =SUM(M1432:N1432) -> 17211.119999999999
A1433: 5006 | B1433: CBA(CABREÚVA)-P | C1433: 61.409.892/0003-35 | D1433: 223782.01999999999 | E1433: 0 | F1433: 0 | G1433: 0 | H1433: 0 | I1433: 0 | J1433: 0 | K1433: 246591.76000000001 | L1433: 0 | M1433: =SUM(J1433:L1433)-22809.74 -> 223782.02000000002 | N1433: 22809.740000000002 | O1433: =SUM(M1433:N1433) -> 246591.76000000001
A1434: 5007 | B1434: CSN ARAUCARIA | C1434: 33.042.730/0134-35 | D1434: 6876.8100000000004 | E1434: 0 | F1434: 0 | G1434: 0 | H1434: 0 | I1434: 0 | J1434: 0 | K1434: 7577.75 | L1434: 0 | M1434: =SUM(J1434:L1434)-700.94 -> 6876.8099999999995 | N1434: 700.94000000000005 | O1434: =SUM(M1434:N1434) -> 7577.75
A1435: 5008 | B1435: VALE(ITABIRA)-P | C1435: 33.592.510/0164-09 | D1435: 38529.32 | E1435: 0 | F1435: 0 | G1435: 0 | H1435: 0 | I1435: 0 | J1435: 0 | K1435: 42456.550000000003 | L1435: 0 | M1435: =SUM(J1435:L1435)-3927.23 -> 38529.32 | N1435: 3927.23 | O1435: =SUM(M1435:N1435) -> 42456.550000000003
A1436: 5011 | B1436: FIBRAPLAC-P | C1436: 04.176.791/0002-47 | D1436: 10028.27 | E1436: 0 | F1436: 0 | G1436: 0 | H1436: 0 | I1436: 0 | J1436: 0 | K1436: 11050.440000000001 | L1436: 0 | M1436: =SUM(J1436:L1436)-1022.17 -> 10028.27 | N1436: 1022.17 | O1436: =SUM(M1436:N1436) -> 11050.440000000001
A1437: 5017 | B1437: INNOVA-P | C1437: 04.229.761/0011-42 | D1437: 1433.23 | E1437: 0 | F1437: 0 | G1437: 0 | H1437: 0 | I1437: 0 | J1437: 0 | K1437: 1579.3199999999999 | L1437: 0 | M1437: =SUM(J1437:L1437)-146.09 -> 1433.23 | N1437: 146.09 | O1437: =SUM(M1437:N1437) -> 1579.3199999999999
A1438: 5019 | B1438: ANGLO AMERICAN(NIQUELÂNDIA)-P | C1438: 42.184.226/0017-05 | D1438: 13637.32 | E1438: 0 | F1438: 0 | G1438: 0 | H1438: 0 | I1438: 0 | J1438: 0 | K1438: 15027.35 | L1438: 0 | M1438: =SUM(J1438:L1438)-1390.03 -> 13637.32 | N1438: 1390.03 | O1438: =SUM(M1438:N1438) -> 15027.35
A1439: 5022 | B1439: ALUMAR(REFINARIA)-P | C1439: 00.655.209/0001-93 | D1439: 26229.25 | E1439: 0 | F1439: 0 | G1439: 0 | H1439: 0 | I1439: 0 | J1439: 0 | K1439: 28902.75 | L1439: 0 | M1439: =SUM(J1439:L1439)-2673.5 -> 26229.25 | N1439: 2673.5 | O1439: =SUM(M1439:N1439) -> 28902.75
A1440: 5023 | B1440: ALUMAR(REDUÇÃO)-P | C1440: 00.655.209/0001-93 | D1440: 187264.70999999999 | E1440: 0 | F1440: 0 | G1440: 0 | H1440: 0 | I1440: 0 | J1440: 0 | K1440: 206352.29999999999 | L1440: 0 | M1440: =SUM(J1440:L1440)-19087.59 -> 187264.70999999999 | N1440: 19087.59 | O1440: =SUM(M1440:N1440) -> 206352.29999999999
A1441: 5024 | B1441: OXITENO-P | C1441: 62.545.686/0018-00 | D1441: 1859.5 | E1441: 0 | F1441: 0 | G1441: 0 | H1441: 0 | I1441: 0 | J1441: 0 | K1441: 2049.04 | L1441: 0 | M1441: =SUM(J1441:L1441)-189.54 -> 1859.5 | N1441: 189.53999999999999 | O1441: =SUM(M1441:N1441) -> 2049.04
A1442: 5025 | B1442: ARLANXEO (DSM)-P | C1442: 29.667.227/0012-20 | D1442: 3428.8699999999999 | E1442: 0 | F1442: 0 | G1442: 0 | H1442: 0 | I1442: 0 | J1442: 0 | K1442: 3778.3699999999999 | L1442: 0 | M1442: =SUM(J1442:L1442)-349.5 -> 3428.8699999999999 | N1442: 349.5 | O1442: =SUM(M1442:N1442) -> 3778.3699999999999
A1443: 5026 | B1443: ALBRAS-P | C1443: 05.053.020/0003-06 | D1443: 311924.59000000003 | E1443: 0 | F1443: 0 | G1443: 0 | H1443: 0 | I1443: 0 | J1443: 0 | K1443: 343718.56 | L1443: 0 | M1443: =SUM(J1443:L1443)-31793.97 -> 311924.58999999997 | N1443: 31793.970000000001 | O1443: =SUM(M1443:N1443) -> 343718.55999999994
A1444: 5028 | B1444: NOVA ERA SILICON-P | C1444: 19.795.665/0001-67 | D1444: 13338.200000000001 | E1444: 0 | F1444: 0 | G1444: 0 | H1444: 0 | I1444: 0 | J1444: 0 | K1444: 14697.74 | L1444: 0 | M1444: =SUM(J1444:L1444)-1359.54 -> 13338.200000000001 | N1444: 1359.54 | O1444: =SUM(M1444:N1444) -> 14697.740000000002
A1445: 5029 | B1445: UNIPAR CARBOCLORO-P | C1445: 33.958.695/0001-78 | D1445: 43255.529999999999 | E1445: 0 | F1445: 0 | G1445: 0 | H1445: 0 | I1445: 0 | J1445: 0 | K1445: 47664.5 | L1445: 0 | M1445: =SUM(J1445:L1445)-4408.97 -> 43255.529999999999 | N1445: 4408.9700000000003 | O1445: =SUM(M1445:N1445) -> 47664.5
A1446: 5034 | B1446: CARAMURU-P | C1446: 00.080.671/0001-00 | D1446: 3412.5900000000001 | E1446: 0 | F1446: 0 | G1446: 0 | H1446: 0 | I1446: 0 | J1446: 0 | K1446: 3760.4299999999998 | L1446: 0 | M1446: =SUM(J1446:L1446)-347.84 -> 3412.5899999999997 | N1446: 347.83999999999997 | O1446: =SUM(M1446:N1446) -> 3760.4299999999998
A1447: 5035 | B1447: NOURYON (AKZO) | C1447: 05.869.996/0001-90 | D1447: 21274.650000000001 | E1447: 0 | F1447: 0 | G1447: 0 | H1447: 0 | I1447: 0 | J1447: 0 | K1447: 23443.139999999999 | L1447: 0 | M1447: =SUM(J1447:L1447)-2168.49 -> 21274.650000000001 | N1447: 2168.4899999999998 | O1447: =SUM(M1447:N1447) -> 23443.139999999999
A1448: 5036 | B1448: GERDAU(SP)-P | C1448: 07.358.761/0041-56 | D1448: 22196.380000000001 | E1448: 0 | F1448: 0 | G1448: 0 | H1448: 0 | I1448: 0 | J1448: 0 | K1448: 24458.82 | L1448: 0 | M1448: =SUM(J1448:L1448)-2262.44 -> 22196.380000000001 | N1448: 2262.4400000000001 | O1448: =SUM(M1448:N1448) -> 24458.82
A1449: 5040 | B1449: WHITE MARTINS(IPATINGA)-P | C1449: 35.820.448/0155-91 | D1449: 11952.91 | E1449: 0 | F1449: 0 | G1449: 0 | H1449: 0 | I1449: 0 | J1449: 0 | K1449: 13171.25 | L1449: 0 | M1449: =SUM(J1449:L1449)-1218.34 -> 11952.91 | N1449: 1218.3399999999999 | O1449: =SUM(M1449:N1449) -> 13171.25
A1450: 5041 | B1450: USIMINAS-P | C1450: 60.894.730/0025-82 | D1450: 87607.639999999999 | E1450: 0 | F1450: 0 | G1450: 0 | H1450: 0 | I1450: 0 | J1450: 0 | K1450: 96537.339999999997 | L1450: 0 | M1450: =SUM(J1450:L1450)-8929.7 -> 87607.639999999999 | N1450: 8929.7000000000007 | O1450: =SUM(M1450:N1450) -> 96537.339999999997
A1451: 5042 | B1451: WHITE MARTINS(TRIUNFO)-P | C1451: 35.820.448/0064-10 | D1451: 3126.0599999999999 | E1451: 0 | F1451: 0 | G1451: 0 | H1451: 0 | I1451: 0 | J1451: 0 | K1451: 3444.6900000000001 | L1451: 0 | M1451: =SUM(J1451:L1451)-318.63 -> 3126.0599999999999 | N1451: 318.63 | O1451: =SUM(M1451:N1451) -> 3444.6900000000001
A1452: 5046 | B1452: VALE(BRUCUTU)-P | C1452: 33.592.510/0447-98 | D1452: 23660.299999999999 | E1452: 0 | F1452: 0 | G1452: 0 | H1452: 0 | I1452: 0 | J1452: 0 | K1452: 26071.959999999999 | L1452: 0 | M1452: =SUM(J1452:L1452)-2411.66 -> 23660.299999999999 | N1452: 2411.6599999999999 | O1452: =SUM(M1452:N1452) -> 26071.959999999999
A1453: 5047 | B1453: MESSER GASES (LINDE) | C1453: 60.619.202/0072-31 | D1453: 7455.7299999999996 | E1453: 0 | F1453: 0 | G1453: 0 | H1453: 0 | I1453: 0 | J1453: 0 | K1453: 8215.6800000000003 | L1453: 0 | M1453: =SUM(J1453:L1453)-759.95 -> 7455.7300000000005 | N1453: 759.95000000000005 | O1453: =SUM(M1453:N1453) -> 8215.6800000000003
A1454: 5048 | B1454: ARLANXEO (PETROFLEX)-P | C1454: 29.667.227/0006-81 | D1454: 3077.1900000000001 | E1454: 0 | F1454: 0 | G1454: 0 | H1454: 0 | I1454: 0 | J1454: 0 | K1454: 3390.8400000000001 | L1454: 0 | M1454: =SUM(J1454:L1454)-313.65 -> 3077.1900000000001 | N1454: 313.64999999999998 | O1454: =SUM(M1454:N1454) -> 3390.8400000000001
A1455: 5049 | B1455: APERAM (ACESITA)-P | C1455: 33.390.170/0013-12 | D1455: 41407.470000000001 | E1455: 0 | F1455: 0 | G1455: 0 | H1455: 0 | I1455: 0 | J1455: 0 | K1455: 45628.07 | L1455: 0 | M1455: =SUM(J1455:L1455)-4220.6 -> 41407.470000000001 | N1455: 4220.6000000000004 | O1455: =SUM(M1455:N1455) -> 45628.07
A1456: 5060 | B1456: VALE(AGUA LIMPA)-P | C1456: 33.592.510/0413-49 | D1456: 1438.6400000000001 | E1456: 0 | F1456: 0 | G1456: 0 | H1456: 0 | I1456: 0 | J1456: 0 | K1456: 1585.28 | L1456: 0 | M1456: =SUM(J1456:L1456)-146.64 -> 1438.6399999999999 | N1456: 146.63999999999999 | O1456: =SUM(M1456:N1456) -> 1585.2799999999997
A1457: 5061 | B1457: ARCELORMITTAL(MONLEVADE)-P | C1457: 17.469.701/0066-12 | D1457: 50470.190000000002 | E1457: 0 | F1457: 0 | G1457: 0 | H1457: 0 | I1457: 0 | J1457: 0 | K1457: 55614.529999999999 | L1457: 0 | M1457: =SUM(J1457:L1457)-5144.34 -> 50470.190000000002 | N1457: 5144.3400000000001 | O1457: =SUM(M1457:N1457) -> 55614.529999999999
A1458: 5062 | B1458: WHITE MARTINS(MONLEVADE)-P | C1458: 35.820.448/0135-48 | D1458: 14872.66 | E1458: 0 | F1458: 0 | G1458: 0 | H1458: 0 | I1458: 0 | J1458: 0 | K1458: 16388.610000000001 | L1458: 0 | M1458: =SUM(J1458:L1458)-1515.95 -> 14872.66 | N1458: 1515.95 | O1458: =SUM(M1458:N1458) -> 16388.610000000001
A1459: 5065 | B1459: ANGLOGOLD ASHANTI-P | C1459: 18.565.382/0007-51 | D1459: 10442.98 | E1459: 0 | F1459: 0 | G1459: 0 | H1459: 0 | I1459: 0 | J1459: 0 | K1459: 11507.42 | L1459: 0 | M1459: =SUM(J1459:L1459)-1064.44 -> 10442.98 | N1459: 1064.4400000000001 | O1459: =SUM(M1459:N1459) -> 11507.42
A1460: 5066 | B1460: MOSAIC POTÁSSIO(FERTILIZANTES) | C1460: 31.009.644/0001-74 | D1460: 8962.0900000000001 | E1460: 0 | F1460: 0 | G1460: 0 | H1460: 0 | I1460: 0 | J1460: 0 | K1460: 9875.5799999999999 | L1460: 0 | M1460: =SUM(J1460:L1460)-913.49 -> 8962.0900000000001 | N1460: 913.49000000000001 | O1460: =SUM(M1460:N1460) -> 9875.5799999999999
A1461: 5067 | B1461: MINERAÇÃO MARACÁ-P | C1461: 86.902.053/0001-13 | D1461: 20407.779999999999 | E1461: 0 | F1461: 0 | G1461: 0 | H1461: 0 | I1461: 0 | J1461: 0 | K1461: 22487.91 | L1461: 0 | M1461: =SUM(J1461:L1461)-2080.13 -> 20407.779999999999 | N1461: 2080.1300000000001 | O1461: =SUM(M1461:N1461) -> 22487.91
A1462: 5068 | B1462: PARAGOMINAS-P | C1462: 12.094.570/0004-10 | D1462: 19129.709999999999 | E1462: 0 | F1462: 0 | G1462: 0 | H1462: 0 | I1462: 0 | J1462: 0 | K1462: 21079.57 | L1462: 0 | M1462: =SUM(J1462:L1462)-1949.86 -> 19129.709999999999 | N1462: 1949.8599999999999 | O1462: =SUM(M1462:N1462) -> 21079.57
A1463: 5070 | B1463: CBA (NIQUELÂNDIA) | C1463: 61.409.892/0224-95 | D1463: 0 | E1463: 0 | F1463: 0 | G1463: 0 | H1463: 0 | I1463: 0 | J1463: 0 | K1463: 0 | L1463: 0 | M1463: =SUM(J1463:L1463)-0 -> 0 | N1463: 0 | O1463: =SUM(M1463:N1463) -> 0
A1464: 5072 | B1464: BRF(SADIA) | C1464: 01.838.723/0394-14 | D1464: 7843.71 | E1464: 0 | F1464: 0 | G1464: 0 | H1464: 0 | I1464: 0 | J1464: 0 | K1464: 8643.2099999999991 | L1464: 0 | M1464: =SUM(J1464:L1464)-799.5 -> 7843.7099999999991 | N1464: 799.5 | O1464: =SUM(M1464:N1464) -> 8643.2099999999991
A1465: 5073 | B1465: ANGLOGOLD (SÃO BENTO)-P | C1465: 18.565.382/0001-66 | D1465: 6362.4300000000003 | E1465: 0 | F1465: 0 | G1465: 0 | H1465: 0 | I1465: 0 | J1465: 0 | K1465: 7010.9399999999996 | L1465: 0 | M1465: =SUM(J1465:L1465)-648.51 -> 6362.4299999999994 | N1465: 648.50999999999999 | O1465: =SUM(M1465:N1465) -> 7010.9399999999996
A1466: 5074 | B1466: WHITE MARTINS(BARAO COCAIS)-P | C1466: 35.820.448/0044-76 | D1466: 2017.2 | E1466: 0 | F1466: 0 | G1466: 0 | H1466: 0 | I1466: 0 | J1466: 0 | K1466: 2222.8099999999999 | L1466: 0 | M1466: =SUM(J1466:L1466)-205.61 -> 2017.1999999999998 | N1466: 205.61000000000001 | O1466: =SUM(M1466:N1466) -> 2222.8099999999999
A1467: 5076 | B1467: VALE (MINERAÇÃO ONÇA-PUMA)-P | C1467: 48.256.824/0006-68 | D1467: 42780.68 | E1467: 0 | F1467: 0 | G1467: 0 | H1467: 0 | I1467: 0 | J1467: 0 | K1467: 47141.25 | L1467: 0 | M1467: =SUM(J1467:L1467)-4360.57 -> 42780.68 | N1467: 4360.5699999999997 | O1467: =SUM(M1467:N1467) -> 47141.25
A1468: 5077 | B1468: KINROSS(RPM)-P | C1468: 20.346.524/0001-46 | D1468: 47073.699999999997 | E1468: 0 | F1468: 0 | G1468: 0 | H1468: 0 | I1468: 0 | J1468: 0 | K1468: 51871.849999999999 | L1468: 0 | M1468: =SUM(J1468:L1468)-4798.15 -> 47073.699999999997 | N1468: 4798.1499999999996 | O1468: =SUM(M1468:N1468) -> 51871.849999999999
A1469: 5078 | B1469: ARCELORMITTAL (SBM)-P | C1469: 17.469.701/0260-52 | D1469: 27992.98 | E1469: 0 | F1469: 0 | G1469: 0 | H1469: 0 | I1469: 0 | J1469: 0 | K1469: 30846.259999999998 | L1469: 0 | M1469: =SUM(J1469:L1469)-2853.28 -> 27992.98 | N1469: 2853.2800000000002 | O1469: =SUM(M1469:N1469) -> 30846.259999999998
A1470: 5079 | B1470: REPAR-P | C1470: 33.000.167/0809-70 | D1470: 12123.68 | E1470: 0 | F1470: 0 | G1470: 0 | H1470: 0 | I1470: 0 | J1470: 0 | K1470: 13359.43 | L1470: 0 | M1470: =SUM(J1470:L1470)-1235.75 -> 12123.68 | N1470: 1235.75 | O1470: =SUM(M1470:N1470) -> 13359.43
A1471: 5080 | B1471: BRASKEM (COPESUL)-P | C1471: 42.150.391/0038-62 | D1471: 72539.949999999997 | E1471: 0 | F1471: 0 | G1471: 0 | H1471: 0 | I1471: 0 | J1471: 0 | K1471: 79933.830000000002 | L1471: 0 | M1471: =SUM(J1471:L1471)-7393.88 -> 72539.949999999997 | N1471: 7393.8800000000001 | O1471: =SUM(M1471:N1471) -> 79933.830000000002
A1472: 5083 | B1472: ATLANTIC NICKEL (MIRABELA) | C1472: 74.127.010/0004-71 | D1472: 11802.4 | E1472: 0 | F1472: 0 | G1472: 0 | H1472: 0 | I1472: 0 | J1472: 0 | K1472: 13005.4 | L1472: 0 | M1472: =SUM(J1472:L1472)-1203 -> 11802.4 | N1472: 1203 | O1472: =SUM(M1472:N1472) -> 13005.4
A1473: 5084 | B1473: CASTERTECH-P | C1473: 08.304.706/0001-59 | D1473: 6809.3400000000001 | E1473: 0 | F1473: 0 | G1473: 0 | H1473: 0 | I1473: 0 | J1473: 0 | K1473: 7503.3999999999996 | L1473: 0 | M1473: =SUM(J1473:L1473)-694.06 -> 6809.3400000000001 | N1473: 694.05999999999995 | O1473: =SUM(M1473:N1473) -> 7503.3999999999996
A1474: 5087 | B1474: COTEMINAS(CAMP. GRANDE) | C1474: 07.663.140/0006-01 | D1474: 19889.880000000001 | E1474: 0 | F1474: 0 | G1474: 0 | H1474: 0 | I1474: 0 | J1474: 0 | K1474: 21917.220000000001 | L1474: 0 | M1474: =SUM(J1474:L1474)-2027.34 -> 19889.880000000001 | N1474: 2027.3399999999999 | O1474: =SUM(M1474:N1474) -> 21917.220000000001
A1475: 5088 | B1475: VALLOUREC | C1475: 08.689.024/0002-92 | D1475: 48483.889999999999 | E1475: 0 | F1475: 0 | G1475: 0 | H1475: 0 | I1475: 0 | J1475: 0 | K1475: 53425.769999999997 | L1475: 0 | M1475: =SUM(J1475:L1475)-4941.88 -> 48483.889999999999 | N1475: 4941.8800000000001 | O1475: =SUM(M1475:N1475) -> 53425.769999999997
A1476: 5091 | B1476: ANGLO AMERICAN (BARRO ALTO) | C1476: 42.184.226/0011-01 | D1476: 69694 | E1476: 0 | F1476: 0 | G1476: 0 | H1476: 0 | I1476: 0 | J1476: 0 | K1476: 76797.800000000003 | L1476: 0 | M1476: =SUM(J1476:L1476)-7103.8 -> 69694 | N1476: 7103.8000000000002 | O1476: =SUM(M1476:N1476) -> 76797.800000000003
A1477: 5092 | B1477: VIPAL | C1477: 87.870.952/0001-44 | D1477: 4717.8599999999997 | E1477: 0 | F1477: 0 | G1477: 0 | H1477: 0 | I1477: 0 | J1477: 0 | K1477: 5198.7399999999998 | L1477: 0 | M1477: =SUM(J1477:L1477)-480.88 -> 4717.8599999999997 | N1477: 480.88 | O1477: =SUM(M1477:N1477) -> 5198.7399999999998
A1478: 5094 | B1478: UTE SANTA LUZIA I-CARGA | C1478: 08.906.558/0001-42 | D1478: 698.50999999999999 | E1478: 0 | F1478: 0 | G1478: 0 | H1478: 0 | I1478: 0 | J1478: 0 | K1478: 769.71000000000004 | L1478: 0 | M1478: =SUM(J1478:L1478)-71.2 -> 698.50999999999999 | N1478: 71.200000000000003 | O1478: =SUM(M1478:N1478) -> 769.71000000000004
A1479: 5096 | B1479: SJC (UTE QUIRINÓPOLIS)-CARGA | C1479: 10.249.419/0002-16 | D1479: 870.78999999999996 | E1479: 0 | F1479: 0 | G1479: 0 | H1479: 0 | I1479: 0 | J1479: 0 | K1479: 959.54999999999995 | L1479: 0 | M1479: =SUM(J1479:L1479)-88.76 -> 870.78999999999996 | N1479: 88.760000000000005 | O1479: =SUM(M1479:N1479) -> 959.54999999999995
A1480: 5097 | B1480: UTE ELDORADO-CARGA | C1480: 05.620.523/0002-35 | D1480: 1925.9000000000001 | E1480: 0 | F1480: 0 | G1480: 0 | H1480: 0 | I1480: 0 | J1480: 0 | K1480: 2122.1999999999998 | L1480: 0 | M1480: =SUM(J1480:L1480)-196.3 -> 1925.8999999999999 | N1480: 196.30000000000001 | O1480: =SUM(M1480:N1480) -> 2122.1999999999998
A1481: 5098 | B1481: TERNIUM(UTE ATLÂNTICO)-RC | C1481: 07.005.330/0001-19 | D1481: 91509.350000000006 | E1481: 0 | F1481: 0 | G1481: 0 | H1481: 0 | I1481: 0 | J1481: 0 | K1481: 100836.75 | L1481: 0 | M1481: =SUM(J1481:L1481)-9327.4 -> 91509.350000000006 | N1481: 9327.3999999999996 | O1481: =SUM(M1481:N1481) -> 100836.75
A1482: 5100 | B1482: VALE SALOBO | C1482: 33.931.478/0002-75 | D1482: 55758.139999999999 | E1482: 0 | F1482: 0 | G1482: 0 | H1482: 0 | I1482: 0 | J1482: 0 | K1482: 61441.480000000003 | L1482: 0 | M1482: =SUM(J1482:L1482)-5683.34 -> 55758.139999999999 | N1482: 5683.3400000000001 | O1482: =SUM(M1482:N1482) -> 61441.479999999996
A1483: 5101 | B1483: KLABIN | C1483: 89.637.490/0133-95 | D1483: 52916.370000000003 | E1483: 0 | F1483: 0 | G1483: 0 | H1483: 0 | I1483: 0 | J1483: 0 | K1483: 58310.050000000003 | L1483: 0 | M1483: =SUM(J1483:L1483)-5393.68 -> 52916.370000000003 | N1483: 5393.6800000000003 | O1483: =SUM(M1483:N1483) -> 58310.050000000003
A1484: 5102 | B1484: BERNECK (CARGA)-P | C1484: 81.905.176/0001-94 | D1484: 10532.35 | E1484: 0 | F1484: 0 | G1484: 0 | H1484: 0 | I1484: 0 | J1484: 0 | K1484: 11605.9 | L1484: 0 | M1484: =SUM(J1484:L1484)-1073.55 -> 10532.35 | N1484: 1073.55 | O1484: =SUM(M1484:N1484) -> 11605.9
A1485: 5103 | B1485: UNIPAR INDUPA (SOLVAY) | C1485: 61.460.325/0004-94 | D1485: 35369.18 | E1485: 0 | F1485: 0 | G1485: 0 | H1485: 0 | I1485: 0 | J1485: 0 | K1485: 38974.300000000003 | L1485: 0 | M1485: =SUM(J1485:L1485)-3605.12 -> 35369.18 | N1485: 3605.1199999999999 | O1485: =SUM(M1485:N1485) -> 38974.300000000003
A1486: 5104 | B1486: UTE COSTA RICA-CARGA | C1486: 08.070.566/0016-88 | D1486: 0 | E1486: 0 | F1486: 0 | G1486: 0 | H1486: 0 | I1486: 0 | J1486: 0 | K1486: 0 | L1486: 0 | M1486: =SUM(J1486:L1486)-0 -> 0 | N1486: 0 | O1486: =SUM(M1486:N1486) -> 0
A1487: 5105 | B1487: MATARIPE (RLAM) | C1487: 41.777.706/0001-41 | D1487: 19299.290000000001 | E1487: 0 | F1487: 0 | G1487: 0 | H1487: 0 | I1487: 0 | J1487: 0 | K1487: 21266.439999999999 | L1487: 0 | M1487: =SUM(J1487:L1487)-1967.15 -> 19299.289999999997 | N1487: 1967.1500000000001 | O1487: =SUM(M1487:N1487) -> 21266.439999999999
A1488: 5106 | B1488: PROQUIGEL (PETROBRAS FAFEN) | C1488: 27.515.154/0020-35 | D1488: 5513.4399999999996 | E1488: 0 | F1488: 0 | G1488: 0 | H1488: 0 | I1488: 0 | J1488: 0 | K1488: 6075.4200000000001 | L1488: 0 | M1488: =SUM(J1488:L1488)-561.98 -> 5513.4400000000005 | N1488: 561.98000000000002 | O1488: =SUM(M1488:N1488) -> 6075.4200000000001
A1489: 5107 | B1489: RIMA | C1489: 18.279.158/0010-07 | D1489: 31316.799999999999 | E1489: 0 | F1489: 0 | G1489: 0 | H1489: 0 | I1489: 0 | J1489: 0 | K1489: 34508.870000000003 | L1489: 0 | M1489: =SUM(J1489:L1489)-3192.07 -> 31316.800000000003 | N1489: 3192.0700000000002 | O1489: =SUM(M1489:N1489) -> 34508.870000000003
A1490: 5108 | B1490: TOYOTA | C1490: 59.104.760/0006-04 | D1490: 2709.79 | E1490: 0 | F1490: 0 | G1490: 0 | H1490: 0 | I1490: 0 | J1490: 0 | K1490: 2985.9899999999998 | L1490: 0 | M1490: =SUM(J1490:L1490)-276.2 -> 2709.79 | N1490: 276.19999999999999 | O1490: =SUM(M1490:N1490) -> 2985.9899999999998
A1491: 5111 | B1491: ANGLO FERROUS | C1491: 02.359.572/0004-30 | D1491: 39506.209999999999 | E1491: 0 | F1491: 0 | G1491: 0 | H1491: 0 | I1491: 0 | J1491: 0 | K1491: 43533.010000000002 | L1491: 0 | M1491: =SUM(J1491:L1491)-4026.8 -> 39506.209999999999 | N1491: 4026.8000000000002 | O1491: =SUM(M1491:N1491) -> 43533.010000000002
A1492: 5114 | B1492: UTE MORRO VERMELHO-CARGA | C1492: 08.070.566/0012-54 | D1492: 0 | E1492: 0 | F1492: 0 | G1492: 0 | H1492: 0 | I1492: 0 | J1492: 0 | K1492: 0 | L1492: 0 | M1492: =SUM(J1492:L1492)-0 -> 0 | N1492: 0 | O1492: =SUM(M1492:N1492) -> 0
A1493: 5115 | B1493: VALE S11D (MINA SERRA SUL) | C1493: 33.592.510/0089-96 | D1493: 8964.9400000000005 | E1493: 0 | F1493: 0 | G1493: 0 | H1493: 0 | I1493: 0 | J1493: 0 | K1493: 9878.7199999999993 | L1493: 0 | M1493: =SUM(J1493:L1493)-913.78 -> 8964.9399999999987 | N1493: 913.77999999999997 | O1493: =SUM(M1493:N1493) -> 9878.7199999999993
A1494: 5116 | B1494: VALE MINA CONCEIÇÃO | C1494: 33.592.510/0164-09 | D1494: 40160.18 | E1494: 0 | F1494: 0 | G1494: 0 | H1494: 0 | I1494: 0 | J1494: 0 | K1494: 44253.639999999999 | L1494: 0 | M1494: =SUM(J1494:L1494)-4093.46 -> 40160.18 | N1494: 4093.46 | O1494: =SUM(M1494:N1494) -> 44253.639999999999
A1495: 5117 | B1495: PETROBRAS(RNEST) | C1495: 33.000.167/1111-08 | D1495: 13105.43 | E1495: 0 | F1495: 0 | G1495: 0 | H1495: 0 | I1495: 0 | J1495: 0 | K1495: 14441.25 | L1495: 0 | M1495: =SUM(J1495:L1495)-1335.82 -> 13105.43 | N1495: 1335.8199999999999 | O1495: =SUM(M1495:N1495) -> 14441.25
A1496: 5118 | B1496: UTE ALTO TAQUARI-CARGA | C1496: 08.070.566/0017-69 | D1496: 0 | E1496: 0 | F1496: 0 | G1496: 0 | H1496: 0 | I1496: 0 | J1496: 0 | K1496: 0 | L1496: 0 | M1496: =SUM(J1496:L1496)-0 -> 0 | N1496: 0 | O1496: =SUM(M1496:N1496) -> 0
A1497: 5119 | B1497: COSAN (UTE JATAI)-CARGA | C1497: 18.686.104/0001-67 | D1497: 0 | E1497: 0 | F1497: 0 | G1497: 0 | H1497: 0 | I1497: 0 | J1497: 0 | K1497: 0 | L1497: 0 | M1497: =SUM(J1497:L1497)-0 -> 0 | N1497: 0 | O1497: =SUM(M1497:N1497) -> 0
A1498: 5120 | B1498: AÇO VERDE (GUSA) | C1498: 07.636.657/0002-70 | D1498: 17705.049999999999 | E1498: 0 | F1498: 0 | G1498: 0 | H1498: 0 | I1498: 0 | J1498: 0 | K1498: 19509.700000000001 | L1498: 0 | M1498: =SUM(J1498:L1498)-1804.65 -> 17705.049999999999 | N1498: 1804.6500000000001 | O1498: =SUM(M1498:N1498) -> 19509.700000000001
A1499: 5124 | B1499: SAMARCO GERMANO-P | C1499: 16.628.281/0003-23 | D1499: 25376.860000000001 | E1499: 0 | F1499: 0 | G1499: 0 | H1499: 0 | I1499: 0 | J1499: 0 | K1499: 27963.48 | L1499: 0 | M1499: =SUM(J1499:L1499)-2586.62 -> 25376.860000000001 | N1499: 2586.6199999999999 | O1499: =SUM(M1499:N1499) -> 27963.48
A1500: 5125 | B1500: TROPICAL BIOENERGIA-(CARGA) | C1500: 08.195.806/0001-94 | D1500: 1595.3099999999999 | E1500: 0 | F1500: 0 | G1500: 0 | H1500: 0 | I1500: 0 | J1500: 0 | K1500: 1757.9200000000001 | L1500: 0 | M1500: =SUM(J1500:L1500)-162.61 -> 1595.3099999999999 | N1500: 162.61000000000001 | O1500: =SUM(M1500:N1500) -> 1757.9200000000001
A1501: 5126 | B1501: GV DO BRASIL | C1501: 12.884.632/0001-44 | D1501: 26067.619999999999 | E1501: 0 | F1501: 0 | G1501: 0 | H1501: 0 | I1501: 0 | J1501: 0 | K1501: 28724.650000000001 | L1501: 0 | M1501: =SUM(J1501:L1501)-2657.03 -> 26067.620000000003 | N1501: 2657.0300000000002 | O1501: =SUM(M1501:N1501) -> 28724.650000000001
A1502: 5127 | B1502: NORFIL | C1502: 02.341.494/0001-01 | D1502: 15506.620000000001 | E1502: 0 | F1502: 0 | G1502: 0 | H1502: 0 | I1502: 0 | J1502: 0 | K1502: 17087.18 | L1502: 0 | M1502: =SUM(J1502:L1502)-1580.56 -> 15506.620000000001 | N1502: 1580.5599999999999 | O1502: =SUM(M1502:N1502) -> 17087.18
A1503: 5128 | B1503: VALE(VARGEM GRANDE) | C1503: 33.592.510/0034-12 | D1503: 49462.540000000001 | E1503: 0 | F1503: 0 | G1503: 0 | H1503: 0 | I1503: 0 | J1503: 0 | K1503: 54504.18 | L1503: 0 | M1503: =SUM(J1503:L1503)-5041.64 -> 49462.540000000001 | N1503: 5041.6400000000003 | O1503: =SUM(M1503:N1503) -> 54504.18
A1504: 5129 | B1504: WHITE MARTINS (JECEABA) | C1504: 35.820.448/0195-89 | D1504: 3326.73 | E1504: 0 | F1504: 0 | G1504: 0 | H1504: 0 | I1504: 0 | J1504: 0 | K1504: 3665.8200000000002 | L1504: 0 | M1504: =SUM(J1504:L1504)-339.09 -> 3326.73 | N1504: 339.08999999999997 | O1504: =SUM(M1504:N1504) -> 3665.8200000000002
A1505: 5130 | B1505: CMPC | C1505: 11.234.954/0001-85 | D1505: 56.890000000000001 | E1505: 0 | F1505: 0 | G1505: 0 | H1505: 0 | I1505: 0 | J1505: 0 | K1505: 62.689999999999998 | L1505: 0 | M1505: =SUM(J1505:L1505)-5.8 -> 56.890000000000001 | N1505: 5.7999999999999998 | O1505: =SUM(M1505:N1505) -> 62.689999999999998
A1506: 5131 | B1506: CIMENTO APODI | C1506: 10.260.249/0003-51 | D1506: 5546.54 | E1506: 0 | F1506: 0 | G1506: 0 | H1506: 0 | I1506: 0 | J1506: 0 | K1506: 6111.8900000000003 | L1506: 0 | M1506: =SUM(J1506:L1506)-565.35 -> 5546.54 | N1506: 565.35000000000002 | O1506: =SUM(M1506:N1506) -> 6111.8900000000003
A1507: 5132 | B1507: CODEVASF(PISF) | C1507: 00.399.857/0001-26 | D1507: 38216.519999999997 | E1507: 0 | F1507: 0 | G1507: 0 | H1507: 0 | I1507: 0 | J1507: 0 | K1507: 42111.870000000003 | L1507: 0 | M1507: =SUM(J1507:L1507)-3895.35 -> 38216.520000000004 | N1507: 3895.3499999999999 | O1507: =SUM(M1507:N1507) -> 42111.870000000003
A1508: 5133 | B1508: ELIZABETH CIMENTOS | C1508: 12.186.380/0001-80 | D1508: 6065.79 | E1508: 0 | F1508: 0 | G1508: 0 | H1508: 0 | I1508: 0 | J1508: 0 | K1508: 6684.0699999999997 | L1508: 0 | M1508: =SUM(J1508:L1508)-618.28 -> 6065.79 | N1508: 618.27999999999997 | O1508: =SUM(M1508:N1508) -> 6684.0699999999997
A1509: 5134 | B1509: CIA DE CIMENTO DA PARAÍBA | C1509: 12.616.864/0002-00 | D1509: 7037.8900000000003 | E1509: 0 | F1509: 0 | G1509: 0 | H1509: 0 | I1509: 0 | J1509: 0 | K1509: 7755.25 | L1509: 0 | M1509: =SUM(J1509:L1509)-717.36 -> 7037.8900000000003 | N1509: 717.36000000000001 | O1509: =SUM(M1509:N1509) -> 7755.25
A1510: 5135 | B1510: CIA SIDERURGICA DO PECEM-CARGA | C1510: 09.509.535/0001-67 | D1510: 27391.360000000001 | E1510: 0 | F1510: 0 | G1510: 0 | H1510: 0 | I1510: 0 | J1510: 0 | K1510: 30183.32 | L1510: 0 | M1510: =SUM(J1510:L1510)-2791.96 -> 27391.360000000001 | N1510: 2791.96 | O1510: =SUM(M1510:N1510) -> 30183.32
A1511: 5136 | B1511: UTE KLABIN-(CARGA) | C1511: 89.637.490/0165-72 | D1511: 37211.43 | E1511: 0 | F1511: 0 | G1511: 0 | H1511: 0 | I1511: 0 | J1511: 0 | K1511: 41004.330000000002 | L1511: 0 | M1511: =SUM(J1511:L1511)-3792.9 -> 37211.43 | N1511: 3792.9000000000001 | O1511: =SUM(M1511:N1511) -> 41004.330000000002
A1512: 5137 | B1512: GERDAU (CHARQUEADAS) | C1512: 33.611.500/0182-47 | D1512: 27929.560000000001 | E1512: 0 | F1512: 125476.99000000001 | G1512: 0 | H1512: 0 | I1512: 512968.26000000001 | J1512: 0 | K1512: 669221.62 | L1512: 0 | M1512: =SUM(J1512:L1512)-2846.81 -> 666374.80999999994 | N1512: 2846.8099999999999 | O1512: =SUM(M1512:N1512) -> 669221.62
A1513: 5138 | B1513: UTE IACO-(CARGA) | C1513: 07.895.728/0006-82 | D1513: 857.49000000000001 | E1513: 0 | F1513: 0 | G1513: 0 | H1513: 0 | I1513: 0 | J1513: 0 | K1513: 944.88999999999999 | L1513: 0 | M1513: =SUM(J1513:L1513)-87.4 -> 857.49000000000001 | N1513: 87.400000000000006 | O1513: =SUM(M1513:N1513) -> 944.88999999999999
A1514: 5139 | B1514: CERRADINHO (P. DAS AGUAS)-CARGA | C1514: 08.322.396/0001-03 | D1514: 0 | E1514: 0 | F1514: 0 | G1514: 0 | H1514: 0 | I1514: 0 | J1514: 0 | K1514: 0 | L1514: 0 | M1514: =SUM(J1514:L1514)-0 -> 0 | N1514: 0 | O1514: =SUM(M1514:N1514) -> 0
A1515: 5143 | B1515: VALE PELOTIZAÇÃO | C1515: 33.592.510/0434-73 | D1515: 10447.93 | E1515: 0 | F1515: 0 | G1515: 0 | H1515: 0 | I1515: 0 | J1515: 0 | K1515: 11512.870000000001 | L1515: 0 | M1515: =SUM(J1515:L1515)-1064.94 -> 10447.93 | N1515: 1064.9400000000001 | O1515: =SUM(M1515:N1515) -> 11512.870000000001
A1516: 5144 | B1516: JBS COUROS ITUMBIARA | C1516: 02.916.265/0098-92 | D1516: 1358.95 | E1516: 0 | F1516: 0 | G1516: 0 | H1516: 0 | I1516: 0 | J1516: 0 | K1516: 1497.47 | L1516: 0 | M1516: =SUM(J1516:L1516)-138.52 -> 1358.95 | N1516: 138.52000000000001 | O1516: =SUM(M1516:N1516) -> 1497.47
A1517: 5145 | B1517: WHITE MARTINS CUBATÃO | C1517: 35.820.448/0174-54 | D1517: 2412.8699999999999 | E1517: 0 | F1517: 0 | G1517: 0 | H1517: 0 | I1517: 0 | J1517: 0 | K1517: 2658.8099999999999 | L1517: 0 | M1517: =SUM(J1517:L1517)-245.94 -> 2412.8699999999999 | N1517: 245.94 | O1517: =SUM(M1517:N1517) -> 2658.8099999999999
A1518: 5146 | B1518: USIMINAS CUBATÃO | C1518: 60.894.730/0063-08 | D1518: 31769.57 | E1518: 0 | F1518: 0 | G1518: 0 | H1518: 0 | I1518: 0 | J1518: 0 | K1518: 35007.790000000001 | L1518: 0 | M1518: =SUM(J1518:L1518)-3238.22 -> 31769.57 | N1518: 3238.2199999999998 | O1518: =SUM(M1518:N1518) -> 35007.790000000001
A1519: 5147 | B1519: PETROBRAS SIX | C1519: 40.254.927/0001-72 | D1519: 4968.1000000000004 | E1519: 0 | F1519: 0 | G1519: 0 | H1519: 0 | I1519: 0 | J1519: 0 | K1519: 5474.4899999999998 | L1519: 0 | M1519: =SUM(J1519:L1519)-506.39 -> 4968.0999999999995 | N1519: 506.38999999999999 | O1519: =SUM(M1519:N1519) -> 5474.4899999999998
A1520: 5149 | B1520: ARLANXEO CABO | C1520: 29.667.227/0010-68 | D1520: 2806.6100000000001 | E1520: 0 | F1520: 0 | G1520: 0 | H1520: 0 | I1520: 0 | J1520: 0 | K1520: 3092.6799999999998 | L1520: 0 | M1520: =SUM(J1520:L1520)-286.07 -> 2806.6099999999997 | N1520: 286.06999999999999 | O1520: =SUM(M1520:N1520) -> 3092.6799999999998
A1521: 5150 | B1521: VOTORANTIM JARDIM | C1521: 10.656.452/0023-95 | D1521: 14359.549999999999 | E1521: 0 | F1521: 0 | G1521: 0 | H1521: 0 | I1521: 0 | J1521: 0 | K1521: 15823.200000000001 | L1521: 0 | M1521: =SUM(J1521:L1521)-1463.65 -> 14359.550000000001 | N1521: 1463.6500000000001 | O1521: =SUM(M1521:N1521) -> 15823.200000000001
A1522: 5151 | B1522: VOTORANTIM RIO BRANCO | C1522: 01.637.895/0106-00 | D1522: 24858.919999999998 | E1522: 0 | F1522: 0 | G1522: 0 | H1522: 0 | I1522: 0 | J1522: 0 | K1522: 27392.75 | L1522: 0 | M1522: =SUM(J1522:L1522)-2533.83 -> 24858.919999999998 | N1522: 2533.8299999999999 | O1522: =SUM(M1522:N1522) -> 27392.75
A1523: 5152 | B1523: ARCELORMITTAL (JOINVILLE) | C1523: 17.469.701/0106-44 | D1523: 23621.830000000002 | E1523: 0 | F1523: 292104.81 | G1523: 0 | H1523: 0 | I1523: 1194167.0700000001 | J1523: 0 | K1523: 1512301.4399999999 | L1523: 0 | M1523: =SUM(J1523:L1523)-2407.73 -> 1509893.71 | N1523: 2407.73 | O1523: =SUM(M1523:N1523) -> 1512301.4399999999
A1524: 5153 | B1524: UTE CUBATÃO - CARGA | C1524: 33.000.167/0116-50 | D1524: 9491.0699999999997 | E1524: 0 | F1524: 0 | G1524: 0 | H1524: 0 | I1524: 0 | J1524: 0 | K1524: 10458.48 | L1524: 0 | M1524: =SUM(J1524:L1524)-967.41 -> 9491.0699999999997 | N1524: 967.40999999999997 | O1524: =SUM(M1524:N1524) -> 10458.48
A1525: 5154 | B1525: GERDAU (INDUSTRIAL) | C1525: 07.358.761/0007-54 | D1525: 9761.9099999999999 | E1525: 0 | F1525: 0 | G1525: 0 | H1525: 0 | I1525: 0 | J1525: 0 | K1525: 10756.93 | L1525: 0 | M1525: =SUM(J1525:L1525)-995.02 -> 9761.9099999999999 | N1525: 995.01999999999998 | O1525: =SUM(M1525:N1525) -> 10756.93
A1526: 5156 | B1526: VOTORANTIM SOBRAL | C1526: 10.656.452/0053-00 | D1526: 7014.7200000000003 | E1526: 0 | F1526: 0 | G1526: 0 | H1526: 0 | I1526: 0 | J1526: 0 | K1526: 7729.7200000000003 | L1526: 0 | M1526: =SUM(J1526:L1526)-715 -> 7014.7200000000003 | N1526: 715 | O1526: =SUM(M1526:N1526) -> 7729.7200000000003
A1527: 5157 | B1527: ARAUCO | C1527: 00.606.549/0026-82 | D1527: 4293.3000000000002 | E1527: 0 | F1527: 0 | G1527: 0 | H1527: 0 | I1527: 0 | J1527: 0 | K1527: 4730.9099999999999 | L1527: 0 | M1527: =SUM(J1527:L1527)-437.61 -> 4293.3000000000002 | N1527: 437.61000000000001 | O1527: =SUM(M1527:N1527) -> 4730.9099999999999
A1528: 5158 | B1528: PETROBRAS (COMPERJ) | C1528: 33.000.167/0125-41 | D1528: 10723.459999999999 | E1528: 0 | F1528: 0 | G1528: 0 | H1528: 0 | I1528: 0 | J1528: 0 | K1528: 11816.48 | L1528: 0 | M1528: =SUM(J1528:L1528)-1093.02 -> 10723.459999999999 | N1528: 1093.02 | O1528: =SUM(M1528:N1528) -> 11816.48
A1529: 5159 | B1529: MINERAÇÃO DARDANELOS | C1529: 42.416.651/0027-46 | D1529: 5487.3699999999999 | E1529: 0 | F1529: 0 | G1529: 0 | H1529: 0 | I1529: 0 | J1529: 0 | K1529: 6046.6899999999996 | L1529: 0 | M1529: =SUM(J1529:L1529)-559.32 -> 5487.3699999999999 | N1529: 559.32000000000005 | O1529: =SUM(M1529:N1529) -> 6046.6899999999996
A1530: 5160 | B1530: HNK (PE) | C1530: 50.221.019/0054-48 | D1530: 853.53999999999996 | E1530: 0 | F1530: 0 | G1530: 0 | H1530: 0 | I1530: 0 | J1530: 0 | K1530: 940.53999999999996 | L1530: 0 | M1530: =SUM(J1530:L1530)-87 -> 853.53999999999996 | N1530: 87 | O1530: =SUM(M1530:N1530) -> 940.53999999999996
A1531: 5161 | B1531: MINERAÇÃO VALE VERDE | C1531: 08.650.571/0001-83 | D1531: 14656.559999999999 | E1531: 0 | F1531: 0 | G1531: 0 | H1531: 0 | I1531: 0 | J1531: 0 | K1531: 16150.48 | L1531: 0 | M1531: =SUM(J1531:L1531)-1493.92 -> 14656.559999999999 | N1531: 1493.9200000000001 | O1531: =SUM(M1531:N1531) -> 16150.48
A1532: 5162 | B1532: BRACELL (CARGA) | C1532: 53.943.098/0001-87 | D1532: 1166.51 | E1532: 0 | F1532: 0 | G1532: 0 | H1532: 0 | I1532: 0 | J1532: 0 | K1532: 1285.4100000000001 | L1532: 0 | M1532: =SUM(J1532:L1532)-118.9 -> 1166.51 | N1532: 118.90000000000001 | O1532: =SUM(M1532:N1532) -> 1285.4100000000001
A1533: 5164 | B1533: HEINEKEN CAXIAS | C1533: 02.864.417/0020-90 | D1533: 690.61000000000001 | E1533: 0 | F1533: 0 | G1533: 0 | H1533: 0 | I1533: 0 | J1533: 0 | K1533: 761 | L1533: 0 | M1533: =SUM(J1533:L1533)-70.39 -> 690.61000000000001 | N1533: 70.390000000000001 | O1533: =SUM(M1533:N1533) -> 761
A1534: 5165 | B1534: FIAT(PE) | C1534: 16.701.716/0036-86 | D1534: 24498.599999999999 | E1534: 0 | F1534: 0 | G1534: 0 | H1534: 0 | I1534: 0 | J1534: 0 | K1534: 26995.700000000001 | L1534: 0 | M1534: =SUM(J1534:L1534)-2497.1 -> 24498.600000000002 | N1534: 2497.0999999999999 | O1534: =SUM(M1534:N1534) -> 26995.700000000001
A1535: 5166 | B1535: A100 ROW | C1535: 12.147.176/0018-06 | D1535: 3877.7600000000002 | E1535: 0 | F1535: 0 | G1535: 0 | H1535: 0 | I1535: 0 | J1535: 0 | K1535: 4273.0100000000002 | L1535: 0 | M1535: =SUM(J1535:L1535)-395.25 -> 3877.7600000000002 | N1535: 395.25 | O1535: =SUM(M1535:N1535) -> 4273.0100000000002
A1536: 5168 | B1536: UTE FS SORRISO (CARGA) | C1536: 20.003.699/0002-31 | D1536: 1964.22 | E1536: 0 | F1536: 0 | G1536: 0 | H1536: 0 | I1536: 0 | J1536: 0 | K1536: 2164.4299999999998 | L1536: 0 | M1536: =SUM(J1536:L1536)-200.21 -> 1964.2199999999998 | N1536: 200.21000000000001 | O1536: =SUM(M1536:N1536) -> 2164.4299999999998
A1537: 5169 | B1537: PETROBRAS (REPLAN) | C1537: 33.000.167/0643-47 | D1537: 26472.23 | E1537: 0 | F1537: 0 | G1537: 0 | H1537: 0 | I1537: 0 | J1537: 0 | K1537: 29170.5 | L1537: 0 | M1537: =SUM(J1537:L1537)-2698.27 -> 26472.23 | N1537: 2698.27 | O1537: =SUM(M1537:N1537) -> 29170.5
A1538: 5170 | B1538: GERDAU (MOGI) | C1538: 33.611.500/0178-60 | D1538: 0 | E1538: 0 | F1538: 0 | G1538: 0 | H1538: 0 | I1538: 0 | J1538: 0 | K1538: 0 | L1538: 0 | M1538: =SUM(J1538:L1538)-0 -> 0 | N1538: 0 | O1538: =SUM(M1538:N1538) -> 0
A1539: 5171 | B1539: UTE LWARCEL (CARGA) | C1539: 53.943.098/0001-87 | D1539: 1307.47 | E1539: 0 | F1539: 0 | G1539: 0 | H1539: 0 | I1539: 0 | J1539: 0 | K1539: 1440.74 | L1539: 0 | M1539: =SUM(J1539:L1539)-133.27 -> 1307.47 | N1539: 133.27000000000001 | O1539: =SUM(M1539:N1539) -> 1440.74
A1540: 5172 | B1540: UTE MARLIM AZUL (CARGA) | C1540: 29.884.534/0002-90 | D1540: 2534.1700000000001 | E1540: 0 | F1540: 0 | G1540: 0 | H1540: 0 | I1540: 0 | J1540: 0 | K1540: 2792.4699999999998 | L1540: 0 | M1540: =SUM(J1540:L1540)-258.3 -> 2534.1699999999996 | N1540: 258.30000000000001 | O1540: =SUM(M1540:N1540) -> 2792.4699999999998
A1541: 5173 | B1541: SINOBRAS | C1541: 07.933.914/0001-54 | D1541: 32392.59 | E1541: 0 | F1541: 0 | G1541: 0 | H1541: 0 | I1541: 0 | J1541: 0 | K1541: 35694.309999999998 | L1541: 0 | M1541: =SUM(J1541:L1541)-3301.72 -> 32392.589999999997 | N1541: 3301.7199999999998 | O1541: =SUM(M1541:N1541) -> 35694.309999999998
A1542: 5174 | B1542: AIR LIQUIDE | C1542: 00.331.788/0020-81 | D1542: 1350.95 | E1542: 0 | F1542: 0 | G1542: 0 | H1542: 0 | I1542: 0 | J1542: 0 | K1542: 1488.6500000000001 | L1542: 0 | M1542: =SUM(J1542:L1542)-137.7 -> 1350.95 | N1542: 137.69999999999999 | O1542: =SUM(M1542:N1542) -> 1488.6500000000001
A1543: 5175 | B1543: UTE NARDINI (CARGA) | C1543: 48.708.267/0015-60 | D1543: 571.64999999999998 | E1543: 0 | F1543: 0 | G1543: 0 | H1543: 0 | I1543: 0 | J1543: 0 | K1543: 629.91999999999996 | L1543: 0 | M1543: =SUM(J1543:L1543)-58.27 -> 571.64999999999998 | N1543: 58.270000000000003 | O1543: =SUM(M1543:N1543) -> 629.91999999999996
A1544: 5176 | B1544: ALPEK | C1544: 08.220.101/0001-80 | D1544: 17504.990000000002 | E1544: 0 | F1544: 0 | G1544: 0 | H1544: 0 | I1544: 0 | J1544: 0 | K1544: 19289.25 | L1544: 0 | M1544: =SUM(J1544:L1544)-1784.26 -> 17504.990000000002 | N1544: 1784.26 | O1544: =SUM(M1544:N1544) -> 19289.25
A1545: 5177 | B1545: ARAGUAIA NM | C1545: 97.515.035/0007-90 | D1545: 31388.110000000001 | E1545: 0 | F1545: 0 | G1545: 0 | H1545: 0 | I1545: 0 | J1545: 0 | K1545: 34587.449999999997 | L1545: 0 | M1545: =SUM(J1545:L1545)-3199.34 -> 31388.109999999997 | N1545: 3199.3400000000001 | O1545: =SUM(M1545:N1545) -> 34587.449999999997
A1546: 5178 | B1546: GERDAU ARAUCÁRIA | C1546: 07.358.761/0048-22 | D1546: 13728.09 | E1546: 0 | F1546: 0 | G1546: 0 | H1546: 0 | I1546: 0 | J1546: 0 | K1546: 15127.370000000001 | L1546: 0 | M1546: =SUM(J1546:L1546)-1399.28 -> 13728.09 | N1546: 1399.28 | O1546: =SUM(M1546:N1546) -> 15127.370000000001
A1547: 5179 | B1547: PERÓXIDOS | C1547: 51.784.262/0001-25 | D1547: 6475.9700000000003 | E1547: 0 | F1547: 0 | G1547: 0 | H1547: 0 | I1547: 0 | J1547: 0 | K1547: 7136.0600000000004 | L1547: 0 | M1547: =SUM(J1547:L1547)-660.09 -> 6475.9700000000003 | N1547: 660.09000000000003 | O1547: =SUM(M1547:N1547) -> 7136.0600000000004
A1548: 5180 | B1548: UTE ASOLO 2 (CARGA) | C1548: 41.675.130/0001-01 | D1548: 27.399999999999999 | E1548: 0 | F1548: 0 | G1548: 0 | H1548: 0 | I1548: 0 | J1548: 0 | K1548: 30.190000000000001 | L1548: 0 | M1548: =SUM(J1548:L1548)-2.79 -> 27.400000000000002 | N1548: 2.79 | O1548: =SUM(M1548:N1548) -> 30.190000000000001
A1549: 5181 | B1549: WHB AUTOMOTIVE | C1549: 01.261.681/0001-04 | D1549: 15206.52 | E1549: 0 | F1549: 0 | G1549: 0 | H1549: 0 | I1549: 0 | J1549: 0 | K1549: 16756.5 | L1549: 0 | M1549: =SUM(J1549:L1549)-1549.98 -> 15206.52 | N1549: 1549.98 | O1549: =SUM(M1549:N1549) -> 16756.5
A1550: 5182 | B1550: UTE PORTO DAS AGUAS II (CARGA) | C1550: 08.322.396/0001-03 | D1550: 285.82999999999998 | E1550: 0 | F1550: 0 | G1550: 0 | H1550: 0 | I1550: 0 | J1550: 0 | K1550: 314.95999999999998 | L1550: 0 | M1550: =SUM(J1550:L1550)-29.13 -> 285.82999999999998 | N1550: 29.129999999999999 | O1550: =SUM(M1550:N1550) -> 314.95999999999998
A1551: 6012 | B1551: TRADENER | C1551: 02.691.745/0001-70 | D1551: 76630.740000000005 | E1551: 0 | F1551: 0 | G1551: 0 | H1551: 0 | I1551: 0 | J1551: 84441.589999999997 | K1551: 0 | L1551: 0 | M1551: =SUM(J1551:L1551)-7810.85 -> 76630.739999999991 | N1551: 7810.8500000000004 | O1551: =SUM(M1551:N1551) -> 84441.589999999997
A1552: 8002 | B1552: BRASKEM(COPENE)-PL | C1552: 42.150.391/0001-70 | D1552: 52264.910000000003 | E1552: 0 | F1552: 0 | G1552: 0 | H1552: 0 | I1552: 0 | J1552: 0 | K1552: 57592.190000000002 | L1552: 0 | M1552: =SUM(J1552:L1552)-5327.28 -> 52264.910000000003 | N1552: 5327.2799999999997 | O1552: =SUM(M1552:N1552) -> 57592.190000000002
A1553: 8003 | B1553: BRASKEM(UCS-AL)-PL | C1553: 42.150.391/0022-03 | D1553: 65140.120000000003 | E1553: 0 | F1553: 0 | G1553: 0 | H1553: 0 | I1553: 0 | J1553: 0 | K1553: 71779.75 | L1553: 0 | M1553: =SUM(J1553:L1553)-6639.63 -> 65140.120000000003 | N1553: 6639.6300000000001 | O1553: =SUM(M1553:N1553) -> 71779.75
A1554: 8005 | B1554: PARANAPANEMA(CAR. METAIS)-PL | C1554: 60.398.369/0004-79 | D1554: 16727.330000000002 | E1554: 0 | F1554: 0 | G1554: 0 | H1554: 0 | I1554: 0 | J1554: 0 | K1554: 18432.32 | L1554: 0 | M1554: =SUM(J1554:L1554)-1704.99 -> 16727.329999999998 | N1554: 1704.99 | O1554: =SUM(M1554:N1554) -> 18432.32
A1555: 8006 | B1555: DOW-PL | C1555: 60.435.351/0017-14 | D1555: 51722.089999999997 | E1555: 0 | F1555: 0 | G1555: 0 | H1555: 0 | I1555: 0 | J1555: 0 | K1555: 56994.040000000001 | L1555: 0 | M1555: =SUM(J1555:L1555)-5271.95 -> 51722.090000000004 | N1555: 5271.9499999999998 | O1555: =SUM(M1555:N1555) -> 56994.040000000001
A1556: 8008 | B1556: FERBASA-PL | C1556: 15.141.799/0001-03 | D1556: 96551.850000000006 | E1556: 0 | F1556: 0 | G1556: 0 | H1556: 0 | I1556: 0 | J1556: 0 | K1556: 106393.22 | L1556: 0 | M1556: =SUM(J1556:L1556)-9841.37 -> 96551.850000000006 | N1556: 9841.3700000000008 | O1556: =SUM(M1556:N1556) -> 106393.22
A1557: 8009 | B1557: GERDAU(AÇONORTE)-PL | C1557: 07.358.761/0051-28 | D1557: 9026.4599999999991 | E1557: 0 | F1557: 0 | G1557: 0 | H1557: 0 | I1557: 0 | J1557: 0 | K1557: 9946.5100000000002 | L1557: 0 | M1557: =SUM(J1557:L1557)-920.05 -> 9026.4600000000009 | N1557: 920.04999999999995 | O1557: =SUM(M1557:N1557) -> 9946.5100000000002
A1558: 8010 | B1558: GERDAU(USIBA)-PL | C1558: 07.358.761/0005-92 | D1558: 858.12 | E1558: 0 | F1558: 0 | G1558: 0 | H1558: 0 | I1558: 0 | J1558: 0 | K1558: 945.59000000000003 | L1558: 0 | M1558: =SUM(J1558:L1558)-87.47 -> 858.12 | N1558: 87.469999999999999 | O1558: =SUM(M1558:N1558) -> 945.59000000000003
A1559: 8011 | B1559: LIBRA-PL | C1559: 10.500.221/0001-82 | D1559: 2355.3699999999999 | E1559: 0 | F1559: 0 | G1559: 0 | H1559: 0 | I1559: 0 | J1559: 0 | K1559: 2595.4499999999998 | L1559: 0 | M1559: =SUM(J1559:L1559)-240.08 -> 2355.3699999999999 | N1559: 240.08000000000001 | O1559: =SUM(M1559:N1559) -> 2595.4499999999998
A1560: 8012 | B1560: MINERAÇÃO CARAÍBA-PL | C1560: 42.509.257/0001-13 | D1560: 9622.7999999999993 | E1560: 0 | F1560: 0 | G1560: 0 | H1560: 0 | I1560: 0 | J1560: 0 | K1560: 10603.639999999999 | L1560: 0 | M1560: =SUM(J1560:L1560)-980.84 -> 9622.7999999999993 | N1560: 980.84000000000003 | O1560: =SUM(M1560:N1560) -> 10603.639999999999
A1561: 8013 | B1561: VALE MANGANES (RDM)-PL | C1561: 15.144.306/0001-99 | D1561: 0 | E1561: 0 | F1561: 0 | G1561: 0 | H1561: 0 | I1561: 0 | J1561: 0 | K1561: 0 | L1561: 0 | M1561: =SUM(J1561:L1561)-0 -> 0 | N1561: 0 | O1561: =SUM(M1561:N1561) -> 0
A1562: 8014 | B1562: HNK(P. SCHINCARIOL)-PL | C1562: 50.221.019/0057-90 | D1562: 4591.4099999999999 | E1562: 0 | F1562: 0 | G1562: 0 | H1562: 0 | I1562: 0 | J1562: 0 | K1562: 5059.3999999999996 | L1562: 0 | M1562: =SUM(J1562:L1562)-467.99 -> 4591.4099999999999 | N1562: 467.99000000000001 | O1562: =SUM(M1562:N1562) -> 5059.3999999999996
A1563: 8015 | B1563: ALUNORTE-PL | C1563: 05.848.387/0003-16 | D1563: 112629.62 | E1563: 0 | F1563: 0 | G1563: 0 | H1563: 0 | I1563: 0 | J1563: 0 | K1563: 124109.77 | L1563: 0 | M1563: =SUM(J1563:L1563)-11480.15 -> 112629.62000000001 | N1563: 11480.15 | O1563: =SUM(M1563:N1563) -> 124109.77
A1564: 8016 | B1564: VALE(MINA)-PL | C1564: 33.592.510/0370-74 | D1564: 13086.33 | E1564: 0 | F1564: 0 | G1564: 0 | H1564: 0 | I1564: 0 | J1564: 0 | K1564: 14420.200000000001 | L1564: 0 | M1564: =SUM(J1564:L1564)-1333.87 -> 13086.330000000002 | N1564: 1333.8699999999999 | O1564: =SUM(M1564:N1564) -> 14420.200000000001
A1565: 8017 | B1565: VALE(SOSSEGO)-PL | C1565: 33.931.478/0009-41 | D1565: 8449.0300000000007 | E1565: 0 | F1565: 0 | G1565: 0 | H1565: 0 | I1565: 0 | J1565: 0 | K1565: 9310.2299999999996 | L1565: 0 | M1565: =SUM(J1565:L1565)-861.2 -> 8449.0299999999988 | N1565: 861.20000000000005 | O1565: =SUM(M1565:N1565) -> 9310.2299999999996
A1566: 8019 | B1566: VALE(PORTO)-PL | C1566: 33.592.510/0424-00 | D1566: 23897.419999999998 | E1566: 0 | F1566: 0 | G1566: 0 | H1566: 0 | I1566: 0 | J1566: 0 | K1566: 26333.25 | L1566: 0 | M1566: =SUM(J1566:L1566)-2435.83 -> 23897.419999999998 | N1566: 2435.8299999999999 | O1566: =SUM(M1566:N1566) -> 26333.25
A1567: 8020 | B1567: PALMYRA(DOW CORNING)-PL | C1567: 04.872.297/0001-36 | D1567: 21225.959999999999 | E1567: 0 | F1567: 0 | G1567: 0 | H1567: 0 | I1567: 0 | J1567: 0 | K1567: 23389.490000000002 | L1567: 0 | M1567: =SUM(J1567:L1567)-2163.53 -> 21225.960000000003 | N1567: 2163.5300000000002 | O1567: =SUM(M1567:N1567) -> 23389.490000000002
A1568: Total Geral | D1568: =SUM(D26:D1567) -> 76024033.549999923 | E1568: =SUM(E26:E1567) -> 10199968.5 | F1568: =SUM(F26:F1567) -> 417581.79999999999 | G1568: =SUM(G26:G1567) -> 0 | H1568: =SUM(H26:H1567) -> 0 | I1568: =SUM(I26:I1567) -> 1707135.3300000001 | J1568: =SUM(J26:J1567) -> 984985.06000000017 | K1568: =SUM(K26:K1567) -> 95253372.190000027 | L1568: =SUM(L26:L1567) -> 899034.25000000012 | M1568: =SUM(M26:M1567) -> 88348719.179999903 | N1568: =SUM(N26:N1567) -> 8788672.3199999947 | O1568: =SUM(O26:O1567) -> 97137391.499999985